ticker,nameOfIssuer,cusip,value,shares,allocation_percent,filingDate,reportDate,accessionNumber
ADUS,ADDUS HOMECARE,006739106,90708000.0,3896371,61.28504830754679,2016-02-11,2015-12-31,0001041062-16-000982
SPY,SPDR S&P 500 ETF TRUST,78462F103,18338000.0,89950,12.389703398419027,2016-02-11,2015-12-31,0001041062-16-000982
JPM,JPMORGAN CHASE & CO CMN,46625H100,5613000.0,85007,3.792311330315519,2016-02-11,2015-12-31,0001041062-16-000982
BRK/B,BERKSHIRE HATHAWAY INC. CLASS B,084670702,4390000.0,33250,2.966015809742585,2016-02-11,2015-12-31,0001041062-16-000982
AAPL,"APPLE, INC. CMN",037833100,2988000.0,28385,2.018782514694953,2016-02-11,2015-12-31,0001041062-16-000982
GE,GENERAL ELECTRIC CO CMN,369604103,2570000.0,82493,1.7363691642456591,2016-02-11,2015-12-31,0001041062-16-000982
AIG,"AMERICAN INTL GROUP, INC. CMN",026874784,2479000.0,40000,1.6748868319708128,2016-02-11,2015-12-31,0001041062-16-000982
JPM,JPMORGAN CHASE & CO CMN,46625H100,1717000.0,26000,1.1600567529220998,2016-02-11,2015-12-31,0001041062-16-000982
MSFT,MICROSOFT CORPORATION CMN,594918104,1199000.0,21620,0.8100803999729749,2016-02-11,2015-12-31,0001041062-16-000982
XOM,EXXON MOBIL CORPORATION CMN,30231G102,1190000.0,15260,0.80399972974799,2016-02-11,2015-12-31,0001041062-16-000982
CPB,CAMPBELL SOUP CO CMN,134429109,981000.0,18668,0.662793054523343,2016-02-11,2015-12-31,0001041062-16-000982
JNJ,JOHNSON & JOHNSON CMN,478160104,949000.0,9236,0.641172893723397,2016-02-11,2015-12-31,0001041062-16-000982
HD,"THE HOME DEPOT, INC. CMN",437076102,921000.0,6964,0.6222552530234443,2016-02-11,2015-12-31,0001041062-16-000982
N/A,TIME WARNER CABLE INC. CMN,88732J207,860000.0,4634,0.5810418214985474,2016-02-11,2015-12-31,0001041062-16-000982
N/A,E.I. DU PONT DE NEMOURS AND CO CMN,263534109,855000.0,12834,0.5776636713735559,2016-02-11,2015-12-31,0001041062-16-000982
GPC,GENUINE PARTS CO. CMN,372460105,838000.0,9760,0.5661779609485846,2016-02-11,2015-12-31,0001041062-16-000982
UTXZ,UNITED TECHNOLOGIES CORP CMN,913017109,784000.0,8158,0.5296939395986757,2016-02-11,2015-12-31,0001041062-16-000982
WBA,"WALGREENS BOOTS ALLIANCE, INC. CMN",931427108,779000.0,9143,0.5263157894736842,2016-02-11,2015-12-31,0001041062-16-000982
SEE,SEALED AIR CORPORATION CMN,81211K100,757000.0,16970,0.5114519289237214,2016-02-11,2015-12-31,0001041062-16-000982
FNV,FRANCO-NEVADA CORPORATION CMN,351858105,618000.0,13500,0.41753935544895615,2016-02-11,2015-12-31,0001041062-16-000982
XJQCX,NUVEEN CREDIT STRATEGIES INCOME FUND MUTUAL FUND,67073D102,598000.0,76271,0.40402675494898993,2016-02-11,2015-12-31,0001041062-16-000982
GM,GENERAL MOTORS COMPANY CMN,37045V100,536000.0,15750,0.3621376933990947,2016-02-11,2015-12-31,0001041062-16-000982
TTE,TOTAL SA SPONSORED ADR CMN,89151E109,526000.0,11700,0.35538139314911155,2016-02-11,2015-12-31,0001041062-16-000982
N/A,FIRST TRUST ADVISORS LP-FIRST *TR HIGH INCOME LONG/SHORT FD MUTUAL FUND,33738E109,487000.0,34575,0.3290318221741774,2016-02-11,2015-12-31,0001041062-16-000982
EFT,EATON VANCE FLTG-RT INCOME TR MUTUAL FUND,278279104,483000.0,38202,0.3263293020741842,2016-02-11,2015-12-31,0001041062-16-000982
FPF,FIRST TR INTER DUR PFD & IN FD MUTUAL FUND,33718W103,436000.0,20500,0.2945746908992635,2016-02-11,2015-12-31,0001041062-16-000982
LDP,"COHEN & STEERS LTD DUR PFD INC AND INCOME FD, INC",19248C105,434000.0,19270,0.29322343084926694,2016-02-11,2015-12-31,0001041062-16-000982
JPC,NUVEEN PREFERRED INCOME OPPORTUNITIES FUND MUTUAL FUND,67073B106,412000.0,44990,0.27835957029930414,2016-02-11,2015-12-31,0001041062-16-000982
COP,CONOCOPHILLIPS CMN,20825C104,388000.0,8318,0.26214444969934464,2016-02-11,2015-12-31,0001041062-16-000982
XXHYBXX,"NEW AMERICA HIGH INCOME FUND, *INC. (THE) MUTUAL FUND",641876800,384000.0,50143,0.2594419295993514,2016-02-11,2015-12-31,0001041062-16-000982
HIO,WESTERN ASSET HIGH INCOME OPPORTUNITY FUND,95766K109,370000.0,78941,0.24998310924937506,2016-02-11,2015-12-31,0001041062-16-000982
MRK,"MERCK & CO., INC. CMN",58933Y105,369000.0,6979,0.2493074792243767,2016-02-11,2015-12-31,0001041062-16-000982
VTA,INVESCO DYNAMIC CREDIT OPPORTUNITIES FUND MUTUAL FUND,46132R104,362000.0,34354,0.24457806904938853,2016-02-11,2015-12-31,0001041062-16-000982
VVR,INVESCO SENIOR INCOME TRUST MUTUAL FUND,46131H107,331000.0,82000,0.2236335382744409,2016-02-11,2015-12-31,0001041062-16-000982
EVF,EATON VANCE SENIOR INCOME TRUST,27826S103,303000.0,52465,0.2047158975744882,2016-02-11,2015-12-31,0001041062-16-000982
BAC,VERIZON COMMUNICATIONS INC. CMN,92343V104,265000.0,5739,0.17904195662455238,2016-02-11,2015-12-31,0001041062-16-000982
N/A,DEUTSCHE HIGH INCOME OPPORTUNITIES FD INC,25158Y102,262000.0,20086,0.17701506654955748,2016-02-11,2015-12-31,0001041062-16-000982
N/A,BLACKROCK DEBT STRATEGIES FUND,09255R103,242000.0,71822,0.16350246604959123,2016-02-11,2015-12-31,0001041062-16-000982
N/A,NUVEEN FLTG RT INC OPPORTUNITY MUTUAL FUND,6706EN100,209000.0,21372,0.14120667522464697,2016-02-11,2015-12-31,0001041062-16-000982
N/A,MANAGED HIGH INCOME PORTFOLIO FUND INC MUTUAL FUND,95766L107,200000.0,44341,0.13512600499966218,2016-02-11,2015-12-31,0001041062-16-000982
N/A,VOYA PRIME RATE TRUST,92913A100,184000.0,36449,0.12431592459968921,2016-02-11,2015-12-31,0001041062-16-000982
BGB,BLACKSTONE GSO STRATEGIC CREDIT FUND CMN,09257R101,179000.0,13382,0.12093777447469765,2016-02-11,2015-12-31,0001041062-16-000982
GNW,GENWORTH FINANCIAL INC CMN CLASS A,37247D106,155000.0,41500,0.10472265387473818,2016-02-11,2015-12-31,0001041062-16-000982
XEADX,WELLS FARGO INCOME OPPORTUNITIES FUND,94987B105,148000.0,19825,0.09999324369975,2016-02-11,2015-12-31,0001041062-16-000982
XFRAX,"BLACKROCK FLOATING RATE INCOME STRATEGIES FUND, INC. MUTUAL FUND",09255X100,139000.0,10794,0.09391257347476523,2016-02-11,2015-12-31,0001041062-16-000982
HYG,CALL/HYG                @  80 EXP 01/15/2016/iShares iBoxx $ High Yield Corporate Bond ETF,464288513,24000.0,204,0.016215120599959464,2016-02-11,2015-12-31,0001041062-16-000982
N/A,CALL/JNK                @  34 EXP 01/15/2016/SPDR BARCLAYS HIGH YIELD BOND EXCHANGE TRADED FUND,78464A417,18000.0,615,0.012161340449969596,2016-02-11,2015-12-31,0001041062-16-000982
XEVVX,EATON VANCE LTD DUR INCOME FD MUTUAL FUND,27828H105,18000.0,1440,0.012161340449969596,2016-02-11,2015-12-31,0001041062-16-000982
CC,CHEMOURS COMPANY (THE) CMN,163851108,14000.0,2566,0.009458820349976353,2016-02-11,2015-12-31,0001041062-16-000982
