ticker,nameOfIssuer,cusip,value,shares,allocation_percent
GO,GROCERY OUTLET HLDG CORP COM,39874R101,2236000.0,180,0.00014011855190043364
POCT,INNOVATOR U.S. EQUITY POWER BUFFER ETF - OCTOBER,45782C797,2230000.0,54,0.0001397425629418457
LZB,LA Z BOY INC COM,505336107,2230000.0,60,0.0001397425629418457
EXPI,EXP WORLD HLDGS INC COM,30212W100,2230000.0,245,0.0001397425629418457
TOWN,TOWNEBANK PORTSMOUTH VA COM,89214P109,2222000.0,65,0.00013924124433039513
NRIX,NURIX THERAPEUTICS INC COM,67080M103,2221000.0,195,0.0001391785795039638
CIM,CHIMERA INVT CORP COM SHS,16934Q802,2219000.0,160,0.00013905324985110116
AHCO,ADAPTHEALTH CORP COMMON STOCK,00653Q102,2216000.0,235,0.0001388652553718072
CIO,CITY OFFICE REIT INC COM,178587101,2216000.0,415,0.0001388652553718072
DBD,DIEBOLD NIXDORF INC COM SHS,253651202,2216000.0,40,0.0001388652553718072
UNFI,UNITED NAT FOODS INC COM,911163103,2214000.0,95,0.00013873992571894456
PLOW,DOUGLAS DYNAMICS INC COM,25960R105,2210000.0,75,0.00013848926641321928
IAG,IAMGOLD CORP COM,450913108,2205000.0,300,0.00013817594228106268
PX,PRAXAIR INC,69376K106,2197000.0,215,0.0001376746236696121
FARO,FARO TECHNOLOGIES INC COM,311642102,2196000.0,50,0.0001376119588431808
JANX,JANUX THERAPEUTICS INC COM,47103J105,2195000.0,95,0.00013754929401674947
SPNS,SAPIENS INTL CORP N V SHS,G7T16G103,2194000.0,75,0.00013748662919031815
ACRE,ARES COML REAL ESTATE CORP COM,04013V108,2194000.0,460,0.00013748662919031815
ENTA,ENANTA PHARMACEUTICALS INC COM,29251M106,2192000.0,290,0.0001373612995374555
DXPE,DXP ENTERPRISES INC COM NEW,233377407,2191000.0,25,0.00013729863471102416
INSW,INTERNATIONAL SEAWAYS INC COM,Y41053102,2189000.0,60,0.00013717330505816155
AMSF,AMERISAFE INC COM,03071H100,2187000.0,50,0.0001370479754052989
UUUU,ENERGY FUELS INC COM NEW,292671708,2185000.0,380,0.00013692264575243627
VVX,V2X INC COM,92242T101,2185000.0,45,0.00013692264575243627
SCL,STEPAN CO COM,858586100,2183000.0,40,0.0001367973160995736
AMPH,AMPHASTAR PHARMACEUTICALS INC COM,03209R103,2181000.0,95,0.00013667198644671096
ZIMV,ZIMVIE INC COM,98888T107,2169000.0,232,0.0001359200085295351
RUN,SUNRUN INC COM,86771W105,2168000.0,265,0.0001358573437031038
LNN,LINDSAY CORP COM,535555106,2164000.0,15,0.00013560668439737853
FIZZ,NATIONAL BEVERAGE CORP COM,635017106,2162000.0,50,0.00013548135474451587
AUPH,AURINIA PHARMACEUTICALS INC COM,05156V102,2160000.0,255,0.00013535602509165323
UFCS,UNITED FIRE GROUP INC COM,910340108,2153000.0,75,0.00013491737130663398
AKBA,AKEBIA THERAPEUTICS INC COM,00972D105,2148000.0,590,0.00013460404717447738
FNCL,FIDELITY MSCI FINANCIALS INDEX ETF,316092501,2147000.0,29,0.00013454138234804606
PEBO,PEOPLES BANCORP INC COM,709789101,2138000.0,70,0.00013397739891016417
STOT,SPDR DOUBLELINE SHORT DURATION TOTAL RETURN TACTICAL ETF,78470P200,2131000.0,45,0.00013353874512514493
FUN,SIX FLAGS ENTERTAINMENT CORP COM,83001C108,2130000.0,70,0.0001334760802987136
N/A,DIVERSIFIED ENERGY COMPANY PLC SHS NEW,G2891G204,2127000.0,145,0.00013328808581941965
SFL,SFL CORPORATION LTD SHS,G7738W106,2124000.0,255,0.00013310009134012569
TRTX,TPG RE FIN TR INC COM,87266M107,2123000.0,275,0.00013303742651369436
SHBI,SHORE BANCSHARES INC COM,825107105,2122000.0,135,0.00013297476168726304
PAX,PATRIA INVESTMENTS LIMITED COM CL A,G69451105,2109000.0,150,0.00013216011894365585
NSZ,NETSCOUT SYS INC COM,64115T104,2109000.0,85,0.00013216011894365585
PRAX,PRAXIS PRECISION MEDICINES INC COM NEW,74006W207,2103000.0,50,0.00013178412998506793
CPF,CENTRAL PAC FINL CORP COM NEW,154760409,2102000.0,75,0.0001317214651586366
MCB,METROPOLITAN BK HLDG CORP COM,591774104,2100000.0,30,0.00013159613550577397
EWTX,EDGEWISE THERAPEUTICS INC COM,28036F105,2098000.0,160,0.00013147080585291135
HAFC,HANMI FINL CORP COM NEW,410495204,2098000.0,85,0.00013147080585291135
S9Q,SPIRIT AEROSYSTEMS HLDGS INC COM CL A,848574109,2098000.0,55,0.00013147080585291135
SYRE,SPYRE THERAPEUTICS INC COM NEW,00773J202,2096000.0,140,0.00013134547620004868
CRMD,CORMEDIX INC COM,21900C308,2094000.0,170,0.00013122014654718604
PINC,PREMIER INC CL A,74051N102,2083000.0,95,0.00013053083345644152
BV,BRIGHTVIEW HLDGS INC COM,10948C107,2081000.0,125,0.00013040550380357887
RWT,REDWOOD TRUST INC COM,758075402,2080000.0,352,0.00013034283897714755
NX,QUANEX BLDG PRODS CORP COM,747619104,2079000.0,110,0.00013028017415071623
NVAX,NOVAVAX INC COM NEW,670002401,2079000.0,330,0.00013028017415071623
KLIC,KULICKE & SOFFA INDS INC COM,501242101,2076000.0,60,0.00013009217967142227
AKAM,AKAMAI TECHNOLOGIES INC COM,00971T101,2074000.0,26,0.00012996685001855963
EHAB,ENHABIT INC COM,29332G102,2073000.0,215,0.0001299041851921283
SHLS,SHOALS TECHNOLOGIES GROUP INC CL A,82489W107,2061000.0,485,0.00012915220727495244
MRC,MRC GLOBAL INC COM,55345K103,2057000.0,150,0.00012890154796922718
IVT,INVENTRUST PPTYS CORP COM NEW,46124J201,2055000.0,75,0.00012877621831636454
SLVM,SYLVAMO CORP COMMON STOCK,871332102,2054000.0,41,0.0001287135534899332
SONO,SONOS INC COM,83570H108,2054000.0,190,0.0001287135534899332
HG,HAMILTON INSURANCE GROUP LTD. CL B,G42706104,2054000.0,95,0.0001287135534899332
PUBM,PUBMATIC INC COM CL A,74467Q103,2053000.0,165,0.00012865088866350187
OMF,ONEMAIN HLDGS INC COM,68268W103,2052000.0,36,0.00012858822383707058
SUPN,SUPERNUS PHARMACEUTICALS INC COM,868459108,2049000.0,65,0.00012840022935777662
RYI,RYERSON HLDG CORP COM,783754104,2049000.0,95,0.00012840022935777662
VICR,VICOR CORP COM,925815102,2041000.0,45,0.00012789891074632605
BEAM,BEAM THERAPEUTICS INC COM,07373V105,2041000.0,120,0.00012789891074632605
AVDL,AVADEL PHARMACEUTICALS PLC COM SHS,G29687103,2036000.0,230,0.00012758558661416942
PPT,PUTNAM PREMIER INCOME TR SH BEN INT,746853100,2030000.0,553,0.0001272095976555815
AHH,ARMADA HOFFLER PPTYS INC COM,04208T108,2027000.0,295,0.00012702160317628757
KN,KNOWLES CORP COM,49926D109,2026000.0,115,0.00012695893834985624
ARVN,ARVINAS INC COM,04335A105,2024000.0,275,0.00012683360869699358
ANDE,ANDERSONS INC COM,034164103,2021000.0,55,0.00012664561421769961
ARDX,ARDELYX INC COM,039697107,2019000.0,515,0.00012652028456483697
PRSU,PURSUIT ATTRACTIONS AND HOSPIT COM,92552R406,2018000.0,70,0.00012645761973840565
FCPT,FOUR CORNERS PPTY TR INC COM,35086T109,2018000.0,75,0.00012645761973840565
HPP,HUDSON PAC PPTYS INC COM,444097109,2014000.0,735,0.00012620696043268037
TFX,TELEFLEX INCORPORATED COM,879369106,2012000.0,17,0.00012608163077981773
MTSI,MACOM TECH SOLUTIONS HLDGS INC COM,55405Y100,2006000.0,14,0.0001257056418212298
TRST,TRUSTCO BK CORP N Y COM NEW,898349204,2005000.0,60,0.00012564297699479849
SBGI,SINCLAIR INC CL A,829242106,2004000.0,145,0.00012558031216836717
PRLB,PROTO LABS INC COM,743713109,2002000.0,50,0.00012545498251550452
KALU,KAISER ALUMINUM CORP COM PAR $0.01,483007704,1998000.0,25,0.00012520432320977924
USLM,UNITED STS LIME & MINERALS INC COM,911922102,1996000.0,20,0.00012507899355691657
INDI,INDIE SEMICONDUCTOR INC CLASS A COM,45569U101,1994000.0,560,0.00012495366390405396
IBRX,IMMUNITYBIO INC COM,45256X103,1993000.0,755,0.00012489099907762264
PARR,PAR PAC HOLDINGS INC COM NEW,69888T207,1990000.0,75,0.00012470300459832868
THRM,GENTHERM INC COM,37253A103,1980000.0,70,0.00012407635633401545
DKS,DICKS SPORTING GOODS INC COM,253393102,1978000.0,10,0.00012395102668115283
CYRX,CRYOPORT INC COM PAR $0.001,229050307,1977000.0,265,0.0001238883618547215
COGT,COGENT BIOSCIENCES INC COM,19240Q201,1975000.0,275,0.00012376303220185887
XPEL,XPEL INC COM,98379L100,1975000.0,55,0.00012376303220185887
COUR,COURSERA INC COM,22266M104,1971000.0,225,0.00012351237289613356
MEG,MONTROSE ENVIRONMENTAL GROUP I COM,615111101,1970000.0,90,0.00012344970806970227
CLMT,CALUMET INC COM,131428104,1969000.0,125,0.00012338704324327095
FWRD,FORWARD AIR CORP COM,34986A104,1963000.0,80,0.000123011054284683
XERS,XERIS BIOPHARMA HOLDINGS INC COM,98422E103,1961000.0,420,0.00012288572463182038
CRMT,AMERICAS CAR-MART INC COM,03062T105,1961000.0,35,0.00012288572463182038
SIRI,SIRIUSXM HOLDINGS INC COMMON STOCK,829933100,1952000.0,85,0.00012232174119393847
WVE,WAVE LIFE SCIENCES LTD SHS,Y95308105,1950000.0,300,0.00012219641154107583
GEF,GREIF INC CL A,397624107,1950000.0,30,0.00012219641154107583
FOXF,FOX FACTORY HLDG CORP COM,35138V102,1946000.0,75,0.00012194575223535053
MFA,MFA FINL INC COM,55272X607,1939000.0,205,0.00012150709845033132
BLFS,BIOLIFE SOLUTIONS INC COM NEW,09062W204,1939000.0,90,0.00012150709845033132
SNCY,SUN CTRY AIRLS HLDGS INC COM,866683105,1939000.0,165,0.00012150709845033132
UDMY,UDEMY INC COM,902685106,1933000.0,275,0.00012113110949174338
GTN,GRAY MEDIA INC COM,389375106,1925000.0,425,0.00012062979088029281
COLL,COLLEGIUM PHARMACEUTICAL INC COM,19459J104,1922000.0,65,0.00012044179640099884
ROOT,ROOT INC CL A NEW,77664L207,1920000.0,15,0.00012031646674813621
DGII,DIGI INTL INC COM,253798102,1917000.0,55,0.00012012847226884224
ACCO,ACCO BRANDS CORP COM,00081T108,1915000.0,535,0.0001200031426159796
BCI,ABRDN BLOOMBERG ALL COMMODITY STRATEGY K-1 FREE ETF,003261104,1911000.0,92,0.00011975248331025433
OMCL,OMNICELL COM COM,68213N109,1911000.0,65,0.00011975248331025433
OMI,OWENS & MINOR INC NEW COM,690732102,1911000.0,210,0.00011975248331025433
IAS,INTEGRAL AD SCIENCE HLDNG CORP COM,45828L108,1911000.0,230,0.00011975248331025433
FFIC,FLUSHING FINL CORP COM,343873105,1901000.0,160,0.0001191258350459411
GCI,GANNETT CO INC COM,36472T109,1897000.0,530,0.00011887517574021583
MSEX,MIDDLESEX WTR CO COM,596680108,1896000.0,35,0.0001188125109137845
SEE,SEALED AIR CORP NEW COM,81211K100,1893000.0,61,0.00011862451643449053
SKAA,SKECHERS U S A INC CL A,830566105,1893000.0,30,0.00011862451643449053
EVR,EVERCORE INC CLASS A,29977A105,1890000.0,7,0.00011843652195519658
CNS,COHEN & STEERS INC COM,19247A100,1884000.0,25,0.00011806053299660866
EYPT,EYEPOINT PHARMACEUTICALS INC COM NEW,30233G209,1882000.0,200,0.00011793520334374602
SCSC,SCANSOURCE INC COM,806037107,1881000.0,45,0.00011787253851731468
GCT,GIGACLOUD TECHNOLOGY INC CLASS A ORD,G38644103,1879000.0,95,0.00011774720886445204
SXI,STANDEX INTL CORP COM,854231107,1878000.0,12,0.00011768454403802072
BHLB,BERKSHIRE HILLS BANCORP INC COM,084680107,1878000.0,75,0.00011768454403802072
SKY,CHAMPION HOMES INC COM,830830105,1878000.0,30,0.00011768454403802072
SAGE,SAGE THERAPEUTICS INC COM,78667J108,1870000.0,205,0.00011718322542657016
MOFG,MIDWESTONE FINL GROUP INC NEW COM,598511103,1870000.0,65,0.00011718322542657016
CTLP,CANTALOUPE INC COM,138103106,1868000.0,170,0.00011705789577370752
MTW,MANITOWOC CO INC COM NEW,563571405,1863000.0,155,0.00011674457164155091
DOCN,DIGITALOCEAN HLDGS INC COM,25402D102,1856000.0,65,0.00011630591785653167
MRVI,MARAVAI LIFESCIENCES HLDGS INC COM CL A,56600D107,1856000.0,770,0.00011630591785653167
MTCH,MATCH GROUP INC NEW COM,57667L107,1853000.0,60,0.00011611792337723771
RLAY,RELAY THERAPEUTICS INC COM,75943R102,1851000.0,535,0.00011599259372437505
CRVL,CORVEL CORP COM,221006109,1850000.0,18,0.00011592992889794373
CFLT 0 01/15/27,CONFLUENT INC 0 01/15/2027,20717MAB9,1845000.0,2000,0.00011561660476578714
CLB,CORE LABORATORIES INC COM,21867A105,1843000.0,160,0.00011549127511292449
WKC,WORLD KINECT CORPORATION COM,981475106,1843000.0,65,0.00011549127511292449
KREF,KKR REAL ESTATE FIN TR INC COM,48251K100,1842000.0,210,0.00011542861028649317
ANGO,ANGIODYNAMICS INC COM,03475V101,1835000.0,185,0.00011498995650147392
HTGC,HERCULES CAPITAL INC COM,427096508,1828000.0,100,0.00011455130271645468
MVST,MICROVAST HOLDINGS INC COM,59516C106,1815000.0,500,0.0001137366599728475
STAG,STAG INDL INC COM,85254J102,1814000.0,50,0.00011367399514641618
VTOL,BRISTOW GROUP INC COM,11040G103,1813000.0,55,0.00011361133031998486
LIND,LINDBLAD EXPEDITIONS HLDGS INC COM,535219109,1809000.0,155,0.00011336067101425959
LQDA,LIQUIDIA CORPORATION COM NEW,53635D202,1807000.0,145,0.00011323534136139694
RBA,RB GLOBAL INC COM,74935Q107,1805000.0,17,0.0001131100117085343
MATW,MATTHEWS INTL CORP CL A,577128101,1793000.0,75,0.00011235803379135843
PUMP,PROPETRO HLDG CORP COM,74347M108,1791000.0,300,0.00011223270413849581
MLR,MILLER INDS INC TENN COM NEW,600551204,1778000.0,40,0.00011141806139488863
MNMD,MIND MEDICINE MINDMED INC COM NEW,60255C885,1772000.0,273,0.0001110420724363007
ARRY,ARRAY TECHNOLOGIES INC COM SHS,04271T100,1770000.0,300,0.00011091674278343806
DFH,DREAM FINDERS HOMES INC COM CL A,26154D100,1759000.0,70,0.00011022742969269354
FLO,FLOWERS FOODS INC COM,343498101,1758000.0,110,0.0001101647648662622
SITC,SITE CTRS CORP COM,82981J851,1753000.0,155,0.00010985144073410561
OSPN,ONESPAN INC COM,68287N100,1752000.0,105,0.00010978877590767429
Z,ZILLOW GROUP INC CL C CAP STK,98954M200,1751000.0,25,0.00010972611108124296
UVV,UNIVERSAL CORP VA COM,913456109,1747000.0,30,0.00010947545177551769
NTGR,NETGEAR INC COM,64111Q104,1744000.0,60,0.00010928745729622373
SMPL,SIMPLY GOOD FOODS CO COM,82900L102,1737000.0,55,0.00010884880351120448
CSTL,CASTLE BIOSCIENCES INC COM,14843C105,1736000.0,85,0.00010878613868477315
AMBP,ARDAGH METAL PACKAGING S A SHS,L02235106,1733000.0,405,0.00010859814420547919
AFRM,AFFIRM HLDGS INC COM CL A,00827B106,1729000.0,25,0.00010834748489975389
MBUU,MALIBU BOATS INC COM CL A,56117J100,1724000.0,55,0.0001080341607675973
YELP,YELP INC CL A,985817105,1714000.0,50,0.00010740751250328408
BMRC,BANK MARIN BANCORP COM,063425102,1713000.0,75,0.00010734484767685276
IDT,IDT CORP CL B NEW,448947507,1708000.0,25,0.00010703152354469617
ACEL,ACCEL ENTERTAINMENT INC COM CL A1,00436Q106,1707000.0,145,0.00010696885871826484
WABC,WESTAMERICA BANCORPORATION COM,957090103,1695000.0,35,0.000106216880801089
EVER,EVERQUOTE INC COM CL A,30041R108,1693000.0,70,0.00010609155114822634
XNCR,XENCOR INC COM,98401F105,1690000.0,215,0.00010590355666893239
VTLE,VITAL ENERGY INC COM,516806205,1689000.0,105,0.00010584089184250107
DVAX,DYNAVAX TECHNOLOGIES CORP COM NEW,268158201,1686000.0,170,0.0001056528973632071
AGS,PLAYAGS INC COM,72814N104,1686000.0,135,0.0001056528973632071
RBBN,RIBBON COMMUNICATIONS INC COM,762544104,1684000.0,420,0.00010552756771034445
MNKD,MANNKIND CORP COM NEW,56400P706,1683000.0,450,0.00010546490288391313
KWR,QUAKER HOUGHTON COM,747316107,1679000.0,15,0.00010521424357818787
AXL,AMERICAN AXLE & MFG HLDGS INC COM,024061103,1673000.0,410,0.00010483825461959994
GRPN,GROUPON INC COM NEW,399473206,1673000.0,50,0.00010483825461959994
HUBS,HUBSPOT INC COM,443573100,1670000.0,3,0.00010465026014030597
HR,HEALTHCARE RLTY TR CL A COM,42226K105,1665000.0,105,0.00010433693600814938
JAMF,JAMF HLDG CORP COM,47074L105,1664000.0,175,0.00010427427118171803
SIGA,SIGA TECHNOLOGIES INC COM,826917106,1663000.0,255,0.00010421160635528672
DAKT,DAKTRONICS INC COM,234264109,1663000.0,110,0.00010421160635528672
LECO,LINCOLN ELEC HLDGS INC COM,533900106,1659000.0,8,0.00010396094704956144
NAGE,NIAGEN BIOSCIENCE INC COM NEW,171077407,1657000.0,115,0.00010383561739669879
EFSC,ENTERPRISE FINL SVCS CORP COM,293712105,1653000.0,30,0.00010358495809097352
MTX,MINERALS TECHNOLOGIES INC COM,603158106,1652000.0,30,0.0001035222932645422
CNXN,PC CONNECTION INC COM,69318J100,1645000.0,25,0.00010308363947952295
TKO,TKO GROUP HOLDINGS INC CL A,87256C101,1638000.0,9,0.00010264498569450371
WBS,WEBSTER FINL CORP COM,947890109,1638000.0,30,0.00010264498569450371
MAPS,WM TECHNOLOGY INC COM,92971A109,1635000.0,1825,0.00010245699121520973
ARMK,ARAMARK COM,03852U106,1633000.0,39,0.00010233166156234709
UPBD,UPBOUND GROUP INC COM,76009N100,1632000.0,65,0.00010226899673591577
LIF,LIFE360 INC COM,532206109,1631000.0,25,0.00010220633190948445
CMTG,CLAROS MTG TR INC COMMON STOCK,18270D106,1625000.0,570,0.00010183034295089653
GIC,GLOBAL INDUSTRIAL COMPANY COM,37892E102,1621000.0,60,0.00010157968364517123
BRSP,BRIGHTSPIRE CAPITAL INC COM CL A,10949T109,1616000.0,320,0.00010126635951301464
LINC,LINCOLN EDL SVCS CORP COM,533535100,1614000.0,70,0.000101141029860152
SDGR,SCHRODINGER INC COM,80810D103,1610000.0,80,0.00010089037055442672
CSV,CARRIAGE SVCS INC COM,143905107,1601000.0,35,0.00010032638711654484
CDRE,CADRE HLDGS INC COM,12763L105,1593000.0,50,9.982506850509427e-05
CTBI,COMMUNITY TR BANCORP INC COM,204149108,1588000.0,30,9.951174437293765e-05
CFFN,CAPITOL FED FINL INC COM,14057J101,1586000.0,260,9.938641472007501e-05
LPG,DORIAN LPG LTD SHS USD,Y2106R110,1585000.0,65,9.93237498936437e-05
KALV,KALVISTA PHARMACEUTICALS INC COM,483497103,1583000.0,140,9.919842024078104e-05
KOS,KOSMOS ENERGY LTD COM,500688106,1582000.0,920,9.913575541434973e-05
OIS,OIL STS INTL INC COM,678026105,1581000.0,295,9.907309058791841e-05
NABL,N-ABLE INC COMMON STOCK,62878D100,1580000.0,195,9.901042576148709e-05
DRH,DIAMONDROCK HOSPITALITY CO COM,252784301,1570000.0,205,9.838377749717387e-05
ZS,ZSCALER INC COM,98980G102,1570000.0,5,9.838377749717387e-05
BKV,BKV CORP COM,05603J108,1568000.0,65,9.825844784431123e-05
TMP,TOMPKINS FINL CORP COM,890110109,1568000.0,25,9.825844784431123e-05
GCMG,GCM GROSVENOR INC COM CL A,36831E108,1561000.0,135,9.781979405929199e-05
HLX,HELIX ENERGY SOLUTIONS GRP INC COM,42330P107,1560000.0,250,9.775712923286067e-05
CECO,CECO ENVIRONMENTAL CORP COM,125141101,1557000.0,55,9.756913475356672e-05
LTC,LTC PPTYS INC COM,502175102,1557000.0,45,9.756913475356672e-05
WTTR,SELECT WATER SOLUTIONS INC CL A COM,81617J301,1555000.0,180,9.744380510070405e-05
SLDP,SOLID POWER INC CLASS A COM,83422N105,1555000.0,710,9.744380510070405e-05
SVC,SERVICE PPTYS TR COM SH BEN INT,81761L102,1554000.0,650,9.738114027427274e-05
FTI,TECHNIPFMC PLC COM,G87110105,1550000.0,45,9.713048096854746e-05
PRAA,PRA GROUP INC COM,69354N106,1549000.0,105,9.706781614211615e-05
PSTL,POSTAL REALTY TRUST INC CL A,73757R102,1547000.0,105,9.694248648925348e-05
UIS,UNISYS CORP COM NEW,909214306,1540000.0,340,9.650383270423424e-05
SOC,SABLE OFFSHORE CORP COM SHS,78574H104,1539000.0,70,9.644116787780292e-05
LKFN,LAKELAND FINL CORP COM,511656100,1536000.0,25,9.625317339850897e-05
ILPT,INDUSTRIAL LOGISTICS PPTYS TR COM SHS BEN INT,456237106,1536000.0,338,9.625317339850897e-05
CRNC,CERENCE INC COM,156727109,1532000.0,150,9.600251409278368e-05
VECO,VEECO INSTRS INC DEL COM,922417100,1524000.0,75,9.550119548133311e-05
CBL,CBL & ASSOC PPTYS INC COMMON STOCK,124830878,1523000.0,60,9.543853065490179e-05
LXFR,LUXFER HLDGS PLC SHS,G5698W116,1523000.0,125,9.543853065490179e-05
HCI,HCI GROUP INC COM,40416E103,1522000.0,10,9.537586582847047e-05
AVTR,AVANTOR INC COM,05352A100,1521000.0,113,9.531320100203915e-05
TFLO,ISHARES TREASURY FLOATING RATE BOND ETF,46434V860,1520000.0,30,9.525053617560783e-05
THRY,THRYV HLDGS INC COM NEW,886029206,1520000.0,125,9.525053617560783e-05
AGL,AGILON HEALTH INC COM,00857U107,1518000.0,660,9.512520652274519e-05
HTH,HILLTOP HOLDINGS INC COM,432748101,1518000.0,50,9.512520652274519e-05
SSTK,SHUTTERSTOCK INC COM,825690100,1517000.0,80,9.506254169631387e-05
GERN,GERON CORP COM,374163103,1516000.0,1075,9.499987686988255e-05
COTY,COTY INC COM CL A,222070203,1511000.0,325,9.468655273772595e-05
QXO,QXO INC COM NEW,82846H405,1508000.0,70,9.449855825843198e-05
ISBA,ISABELLA BK CORP COM,464214105,1508000.0,50,9.449855825843198e-05
HZO,MARINEMAX INC COM,567908108,1508000.0,60,9.449855825843198e-05
NEOG,NEOGEN CORP COM,640491106,1506000.0,315,9.437322860556933e-05
LPLA,LPL FINL HLDGS INC COM,50212V100,1500000.0,4,9.39972396469814e-05
PVBC,PROVIDENT BANCORP INC COM NEW,74383L105,1499000.0,120,9.393457482055009e-05
GTES,GATES INDL CORP PLC ORD SHS,G39108108,1497000.0,65,9.380924516768746e-05
EFC,ELLINGTON FINANCIAL INC COM,28852N109,1494000.0,115,9.362125068839348e-05
N/A,THERAVANCE BIOPHARMA INC COM,G8807B106,1489000.0,135,9.330792655623688e-05
GBTG,GLOBAL BUSINESS TRAVEL GROUP COM CL A,37890B100,1481000.0,235,9.280660794478632e-05
LBRDK,LIBERTY BROADBAND CORP COM SER C,530307305,1476000.0,15,9.249328381262971e-05
ESI,ELEMENT SOLUTIONS INC COM,28618M106,1472000.0,65,9.224262450690443e-05
SCS,STEELCASE INC CL A,858155203,1471000.0,141,9.21799596804731e-05
WWD,WOODWARD INC COM,980745103,1471000.0,6,9.21799596804731e-05
GLDD,GREAT LAKES DREDGE & DOCK CORP COM,390607109,1463000.0,120,9.167864106902253e-05
EVGO,EVGO INC CL A COM,30052F100,1460000.0,400,9.149064658972857e-05
IBCP,INDEPENDENT BK CORP MICH COM NEW,453838609,1458000.0,45,9.136531693686593e-05
N/A,MAC COPPER LIMITED ORD SHS,G60409110,1451000.0,120,9.092666315184669e-05
WMK,WEIS MKTS INC COM,948849104,1450000.0,20,9.086399832541536e-05
RRX,REGAL REXNORD CORPORATION COM,758750103,1450000.0,10,9.086399832541536e-05
KOP,KOPPERS HOLDINGS INC COM,50060P106,1447000.0,45,9.06760038461214e-05
BRKR,BRUKER CORP COM,116794108,1442000.0,35,9.036267971396479e-05
MGTX,MEIRAGTX HLDGS PLC COM,G59665102,1434000.0,220,8.986136110251422e-05
HTLD,HEARTLAND EXPRESS INC COM,422347104,1426000.0,165,8.936004249106366e-05
YORW,YORK WTR CO COM,987184108,1422000.0,45,8.910938318533838e-05
HRMY,HARMONY BIOSCIENCES HLDGS INC COM,413197104,1422000.0,45,8.910938318533838e-05
VOT,VANGUARD MID-CAP GROWTH ETF,922908538,1422000.0,5,8.910938318533838e-05
ARIS,ARIS WATER SOLUTIONS INC CLASS A COM,04041L106,1419000.0,60,8.892138870604441e-05
BMBL,BUMBLE INC COM CL A,12047B105,1417000.0,215,8.879605905318177e-05
WOOF,PETCO HEALTH & WELLNESS CO INC COM,71601V105,1415000.0,500,8.867072940031913e-05
EIG,EMPLOYERS HLDGS INC COM,292218104,1415000.0,30,8.867072940031913e-05
VERX,VERTEX INC CL A,92538J106,1413000.0,40,8.854539974745649e-05
FISI,FINANCIAL INSTNS INC COM,317585404,1412000.0,55,8.848273492102517e-05
FNF,FIDELITY NATIONAL FINANCIAL IN COM SHS,31620R303,1402000.0,25,8.785608665671195e-05
SAFE,SAFEHOLD INC COM,78646V107,1400000.0,90,8.773075700384932e-05
SUI,SUN CMNTYS INC COM,866674104,1391000.0,11,8.716677356596743e-05
CARE,CARTER BANKSHARES INC COM NEW,146103106,1387000.0,80,8.691611426024214e-05
DCI,DONALDSON INC COM,257651109,1387000.0,20,8.691611426024214e-05
GDYN,GRID DYNAMICS HLDGS INC CL A,39813G109,1386000.0,120,8.685344943381082e-05
THRD,THIRD HARMONIC BIO INC COM,88427A107,1385000.0,255,8.67907846073795e-05
LASR,NLIGHT INC COM,65487K100,1378000.0,70,8.635213082236026e-05
FSLY,FASTLY INC CL A,31188V100,1377000.0,195,8.628946599592892e-05
MYE,MYERS INDS INC COM,628464109,1377000.0,95,8.628946599592892e-05
PD,PAGERDUTY INC COM,69553P100,1375000.0,90,8.61641363430663e-05
CMCO,COLUMBUS MCKINNON CORP N Y COM,199333105,1374000.0,90,8.610147151663498e-05
IVR,INVESCO MORTGAGE CAPITAL INC COM,46131B704,1372000.0,175,8.597614186377233e-05
GRNT,GRANITE RIDGE RESOURCES INC COM,387432107,1370000.0,215,8.585081221090968e-05
DOX,AMDOCS LTD SHS,G02602103,1369000.0,15,8.578814738447836e-05
ALGM,ALLEGRO MICROSYSTEMS INC COM,01749D105,1368000.0,40,8.572548255804705e-05
ARDT,ARDENT HEALTH INC COM,03980N107,1366000.0,100,8.56001529051844e-05
LXU,LSB INDS INC COM,502160104,1365000.0,175,8.553748807875308e-05
PLYM,PLYMOUTH INDL REIT INC COM,729640102,1365000.0,85,8.553748807875308e-05
EGBN,EAGLE BANCORP INC MD COM,268948106,1364000.0,70,8.547482325232177e-05
HP,HELMERICH & PAYNE INC COM,423452101,1364000.0,90,8.547482325232177e-05
GLOB,GLOBANT S A COM,L44385109,1363000.0,15,8.541215842589045e-05
UNIT,UNITI GROUP INC COM,91325V108,1361000.0,315,8.52868287730278e-05
ODP,THE ODP CORP COM,88337F105,1360000.0,75,8.522416394659649e-05
QCRH,QCR HOLDINGS INC COM,74727A104,1358000.0,20,8.509883429373383e-05
NEWT,NEWTEKONE INC COM NEW,652526203,1354000.0,120,8.484817498800855e-05
GTLB,GITLAB INC CLASS A COM,37637K108,1353000.0,30,8.478551016157723e-05
CWCO,CONSOLIDATED WATER CO INC ORD,G23773107,1351000.0,45,8.466018050871459e-05
N/A,CNH INDL N V SHS,N20944109,1348000.0,104,8.447218602942063e-05
JBI,JANUS INTERNATIONAL GROUP INC COMMON STOCK,47103N106,1343000.0,165,8.415886189726403e-05
VRE,VERIS RESIDENTIAL INC COM,554489104,1340000.0,90,8.397086741797006e-05
MITK,MITEK SYS INC COM NEW,606710200,1337000.0,135,8.378287293867609e-05
TWI,TITAN INTL INC ILL COM,88830M102,1335000.0,130,8.365754328581346e-05
AMH,AMERICAN HOMES 4 RENT CL A,02665T306,1335000.0,37,8.365754328581346e-05
WNC,WABASH NATL CORP COM,929566107,1329000.0,125,8.328155432722552e-05
HLIT,HARMONIC INC COM,413160102,1326000.0,140,8.309355984793156e-05
EWCZ,EUROPEAN WAX CTR INC CLASS A COM,29882P106,1323000.0,235,8.29055653686376e-05
AROW,ARROW FINL CORP COM,042744102,1321000.0,50,8.278023571577496e-05
SCHC,SCHWAB INTERNATIONAL SMALL-CAP EQUITY ETF,808524888,1320000.0,31,8.271757088934364e-05
VMEO,VIMEO INC COMMON STOCK,92719V100,1313000.0,325,8.22789171043244e-05
SLM,SLM CORP COM,78442P106,1312000.0,40,8.221625227789307e-05
DENN,DENNYS CORP COM,24869P104,1312000.0,320,8.221625227789307e-05
CTOS,CUSTOM TRUCK ONE SOURCE INC COM CL A,23204X103,1309000.0,265,8.202825779859911e-05
SWIM,LATHAM GROUP INC COM,51819L107,1308000.0,205,8.196559297216779e-05
ANIP,ANI PHARMACEUTICALS INC COM,00182C103,1305000.0,20,8.177759849287382e-05
CLFD,CLEARFIELD INC COM,18482P103,1302000.0,30,8.158960401357987e-05
FDP,FRESH DEL MONTE PRODUCE INC ORD,G36738105,1297000.0,40,8.127627988142325e-05
GDOT,GREEN DOT CORP CL A,39304D102,1294000.0,120,8.108828540212929e-05
LFMD,LIFEMD INC COM,53216B104,1294000.0,95,8.108828540212929e-05
AEHR,AEHR TEST SYS COM,00760J108,1293000.0,100,8.102562057569797e-05
TRNS,TRANSCAT INC COM,893529107,1289000.0,15,8.077496126997269e-05
PBPB,POTBELLY CORP COM,73754Y100,1286000.0,105,8.058696679067873e-05
PDFS,PDF SOLUTIONS INC COM,693282105,1283000.0,60,8.039897231138477e-05
VTS,VITESSE ENERGY INC COMMON STOCK,92852X103,1281000.0,58,8.027364265852212e-05
NEO,NEOGENOMICS INC COM NEW,64049M209,1279000.0,175,8.014831300565948e-05
PAHC,PHIBRO ANIMAL HEALTH CORP CL A COM,71742Q106,1277000.0,50,8.002298335279684e-05
AMTB,AMERANT BANCORP INC CL A,023576101,1276000.0,70,7.996031852636552e-05
SOY,SUNOPTA INC COM,8676EP108,1276000.0,220,7.996031852636552e-05
NAT,NORDIC AMERICAN TANKERS LIMITE COM,G65773106,1276000.0,485,7.996031852636552e-05
MJ,AMPLIFY ETF TR ALTRNTV HARV ETF,032108474,1275000.0,71,7.98976536999342e-05
TRC,TEJON RANCH CO COM,879080109,1272000.0,75,7.970965922064023e-05
IMKTA,INGLES MKTS INC CL A,457030104,1268000.0,20,7.945899991491494e-05
RMR,RMR GROUP INC CL A,74967R106,1259000.0,77,7.889501647703307e-05
WLDN,WILLDAN GROUP INC COM,96924N100,1250000.0,20,7.833103303915117e-05
