ticker,nameOfIssuer,cusip,value,shares,allocation_percent
SBI,WESTERN ASSET INTER MUNI FD IN COM,958435109,94000000.0,12500,0.005890493684544168
CGNG,CAPITAL GROUP NEW GEOGRAPHY EQUITY ETF,14021N105,92192000.0,3200,0.0057771956783563404
DORM,DORMAN PRODS INC COM,258278100,92125000.0,751,0.005772997134985441
IQLT,ISHARES MSCI INTL QUALITY FACTOR ETF,46434V456,91756000.0,2123,0.005749873814032284
CSQ,CALAMOS STRATEGIC TOTAL RETURN COM SH BEN INT,128125101,91200000.0,5000,0.00571503217053647
PAYX,PAYCHEX INC COM,704326107,90913000.0,625,0.0056970473653506805
HQH,ABRDN HEALTHCARE INVESTORS SH BEN INT,87911J103,90911000.0,5869,0.005696922035697818
AFL,AFLAC INC COM,001055102,90168000.0,855,0.005650362069659347
CTSH,COGNIZANT TECHNOLOGY SOLUTIONS CL A,192446102,89266000.0,1144,0.005593838396218295
BTT,BLACKROCK MUN TARGET TERM TR COM SHS BEN IN,09257P105,87560000.0,4000,0.005486932202326461
ATMU,ATMUS FILTRATION TECHNOLOGIES COM,04956D107,86971000.0,2388,0.005450022619558414
FTNT,FORTINET INC COM,34959E109,86902000.0,822,0.005445698746534652
IFF,INTERNATIONAL FLAVORS&FRAGRANC COM,459506101,86568000.0,1177,0.005424768694506591
SCHZ,SCHWAB US AGGREGATE BOND ETF,808524839,86383000.0,3717,0.005413175701616797
SCZ,ISHARES MSCI EAFE SMALL-CAP ETF,464288273,85544000.0,1177,0.005360599912240918
O,REALTY INCOME CORP COM,756109104,85263000.0,1480,0.005342991096013717
N/A,NXP SEMICONDUCTORS N V COM,N6596X109,85211000.0,390,0.005339732525039289
PKG,PACKAGING CORP AMER COM,695156109,85179000.0,452,0.0053377272505934865
GTY,GETTY RLTY CORP NEW COM,374297109,84855000.0,3070,0.005317423846829738
UAL,UNITED AIRLS HLDGS INC COM,910047109,84726000.0,1064,0.005309340084220098
MUFG,MITSUBISHI UFJ FINL GROUP INC SPONSORED ADS,606822104,84378000.0,6150,0.005287532724621998
GSBD,GOLDMAN SACHS BDC INC SHS,38147U107,84375000.0,7500,0.005287344730142704
CVI,CVR ENERGY INC COM,12662P108,84041000.0,3130,0.005266414678114643
HDV,ISHARES CORE HIGH DIVIDEND ETF,46429B663,83191000.0,710,0.005213149575648021
GVI,ISHARES INTERMEDIATE GOVERNMENT/CREDIT BOND ETF,464288612,82762000.0,775,0.005186266365108984
ITA*,ISHARES U.S. AEROSPACE & DEFENSE ETF,464288760,82058000.0,435,0.005142150327301334
SF,STIFEL FINL CORP COM,860630102,81467000.0,785,0.005105115414880423
NDAQ,NASDAQ INC COM,631103108,81462000.0,911,0.005104802090748267
GRMN,GARMIN LTD SHS,H2906T109,80775000.0,387,0.0050617513549899495
VOOV,VANGUARD S&P 500 VALUE ETF,921932703,79636000.0,422,0.004990376117684675
RJF,RAYMOND JAMES FINL INC COM,754730109,78986000.0,515,0.004949643980504316
XLP,CONSUMER STAPLES SELECT SECTOR SPDR FUND,81369Y308,78950000.0,975,0.004947388046752789
BCO,BRINKS CO COM,109696104,78575000.0,880,0.004923888736841043
SNPS,SYNOPSYS INC COM,871607107,78440000.0,153,0.004915428985272815
IT,GARTNER INC COM,366651107,78014000.0,193,0.004888733769213072
PHIN,PHINIA INC COMMON STOCK,71880K101,77858000.0,1750,0.004878958056289785
EL,LAUDER ESTEE COS INC CL A,518439104,77810000.0,963,0.004875950144621083
CGIE,CAPITAL GROUP INTERNATIONAL EQUITY ETF,14021M107,77362000.0,2350,0.00484787630237985
PAYC,PAYCOM SOFTWARE INC COM,70432V102,77288000.0,334,0.004843239105223933
NSY,NICE LTD SPONSORED ADR,653656108,76516000.0,453,0.004794861859218953
KBE,SPDR S&P BANK ETF,78464A797,76112000.0,1365,0.004769545269340699
CCK,CROWN HLDGS INC COM,228368106,75690000.0,735,0.004743100712586682
DTM,DT MIDSTREAM INC COMMON STOCK,23345M107,75069000.0,683,0.004704185855372831
TSCO,TRACTOR SUPPLY CO COM,892356106,74337000.0,1409,0.004658315202425105
APA,APA CORPORATION COM,03743Q108,74111000.0,4052,0.004644152951651627
KEY,KEYCORP COM,493267108,73077000.0,4195,0.004579357521121641
WHR,WHIRLPOOL CORP COM,963320106,72718000.0,717,0.0045568608484327965
PODD,INSULET CORP COM,45784P101,72576000.0,231,0.004547962443079549
COIN,COINBASE GLOBAL INC COM CL A,19260Q107,71850000.0,205,0.00450246777909041
TTC,TORO CO COM,891092108,71740000.0,1015,0.004495574648182964
EES,WISDOMTREE U.S. SMALLCAP FUND,97717W562,71344000.0,1400,0.004470759376916161
WAB,WABTEC COM,929740108,70970000.0,339,0.004447322731830847
SPDW,SPDR PORTFOLIO DEVELOPED WORLD EX-US ETF,78463X889,70898000.0,1751,0.004442810864327793
VITL,VITAL FARMS INC COM,92847W103,70877000.0,1840,0.004441494902972734
CGUI,CAPITAL GROUP ULTRA SHORT INCOME ETF,14020Y888,70644000.0,2800,0.004426893998414236
HIG,HARTFORD INSURANCE GROUP INC COM,416515104,69779000.0,550,0.004372688923551144
HEI,HEICO CORP NEW COM,422806109,69540000.0,212,0.004357712030034058
DAL,DELTA AIR LINES INC DEL COM NEW,247361702,69344000.0,1410,0.004345429724053519
PAMC,PACER LUNT MIDCAP MULTI-FACTOR ALTERNATOR ETF,69374H725,69011000.0,1575,0.00432456233685189
PRU,PRUDENTIAL FINL INC COM,744320102,68869000.0,641,0.004315663931498642
ABNB,AIRBNB INC COM CL A,009066101,68420000.0,517,0.004287527424430979
MDY,SPDR S&P MIDCAP 400 ETF TRUST,78467Y107,68333000.0,121,0.004282075584531454
GVA,GRANITE CONSTR INC COM,387328107,67893000.0,726,0.004254503060901672
IRM,IRON MTN INC DEL COM,46284V101,67491000.0,658,0.004229311800676282
ING,ING GROEP N.V. SPONSORED ADR,456837103,67491000.0,3086,0.004229311800676282
PVAL,PUTNAM FOCUSED LARGE CAP VALUE ETF,746729300,67385000.0,1675,0.004222669329074562
AXON,AXON ENTERPRISE INC COM,05464C101,67063000.0,81,0.004202491254963676
AZN,ASTRAZENECA PLC SPONSORED ADR,046353108,66526000.0,952,0.004168840243170057
VICI,VICI PPTYS INC COM,925652109,65819000.0,2019,0.004124536210883113
CG,CARLYLE GROUP INC COM,14316J108,64507000.0,1255,0.0040423199586052195
PKST,PEAKSTONE REALTY TRUST COMMON SHARES,39818P799,64333000.0,4870,0.0040314162788061695
IJS,ISHARES S&P SMALL-CAP 600 VALUE ETF,464287879,64072000.0,644,0.004015060759107595
MRCC,MONROE CAP CORP COM,610335101,63600000.0,10000,0.003985482961032012
NAD,NUVEEN QUALITY MUNCP INCOME FD COM,67066V101,63585000.0,5632,0.003984542988635542
ABG,CENCORA INC COM,03073E105,62669000.0,209,0.003927142007624452
PHM,PULTE GROUP INC COM,745867101,61905000.0,587,0.003879266080230923
DAY,DAYFORCE INC COM,15677J108,61704000.0,1114,0.003866670450118227
FIX,COMFORT SYS USA INC COM,199908104,61701000.0,115,0.0038664824556389333
HRL,HORMEL FOODS CORP COM,440452100,61498000.0,2033,0.003853761495873375
IXUS,ISHARES CORE MSCI TOTAL INTERNATIONAL STOCK ETF,46432F834,61461000.0,795,0.003851442897295416
CMA,COMERICA INC COM,200340107,61320000.0,1028,0.0038426071567686003
DELL,DELL TECHNOLOGIES INC CL C,24703L202,61177000.0,499,0.0038336460865889214
VOD,VODAFONE GROUP PLC NEW SPONSORED ADR,92857W308,60954000.0,5718,0.003819671830294737
USPX,FRANKLIN U.S. EQUITY INDEX ETF,35473P405,60888000.0,1120,0.0038155359517502694
CLS,CELESTICA INC COM,15101Q207,60834000.0,390,0.0038121520511229783
WSO,WATSCO INC COM,942622200,59619000.0,135,0.003736014287008923
ETH,GRAYSCALE ETHEREUM MINI TRUST ETF,38964R203,59347000.0,2502,0.003718969454219604
PAVE,GLOBAL X U.S. INFRASTRUCTURE DEVELOPMENT ETF,37954Y673,59321000.0,1361,0.0037173401687323896
EXAS,EXACT SCIENCES CORP COM,30063P105,59145000.0,1113,0.0037063111592804767
SPLG,SPDR PORTFOLIO S&P 500 ETF,78464A854,59103000.0,813,0.003703679236570362
ISTB,ISHARES CORE 1-5 YEAR USD BOND ETF,46432F859,58137000.0,1195,0.003643145014237706
MTZ,MASTEC INC COM,576323109,57605000.0,338,0.0036098073265762426
BTI,BRITISH AMERN TOB PLC SPONSORED ADR,110448107,57553000.0,1216,0.0036065487556018144
AEG,AEGON LTD AMER REG 1 CERT,0076CA104,57239000.0,7906,0.003586872000102379
VCIT,VANGUARD INTERMEDIATE-TERM CORPORATE BOND ETF,92206C870,57215000.0,690,0.0035853680442680274
SNRE,SUNRISE COMMUNICATIONS AG ADS CL A,867975104,57116000.0,1010,0.003579164226451327
VOE,VANGUARD MID-CAP VALUE ETF,922908512,57070000.0,347,0.003576281644435486
PDI,PIMCO DYNAMIC INCOME FD SHS,72201Y101,56910000.0,3000,0.0035662552722064743
VRSN,VERISIGN INC COM,92343E102,56894000.0,197,0.0035652526349835736
NTR,NUTRIEN LTD COM,67077M108,56475000.0,971,0.00353899607270885
RGEN,REPLIGEN CORP COM,759916109,55971000.0,450,0.0035074130001874647
AVY,AVERY DENNISON CORP COM,053611109,55799000.0,318,0.003496634650041277
PSP,INVESCO GLOBAL LISTED PRIVATE EQUITY ETF,46137V118,55080000.0,800,0.0034515786398371575
BMO,BANK MONTREAL QUE COM,063671101,55080000.0,498,0.0034515786398371575
HAS,HASBRO INC COM,418056107,54627000.0,740,0.003423191473463769
PCTY,PAYLOCITY HLDG CORP COM,70438V106,54357000.0,300,0.0034062719703273126
GLDM,SPDR GOLD MINISHARES TRUST OF BENEFICIAL INTEREST,98149E303,54054000.0,825,0.003387284527918622
GPN,GLOBAL PMTS INC COM,37940X102,54027000.0,675,0.0033855925776049766
GWRE,GUIDEWIRE SOFTWARE INC COM,40171V100,53447000.0,227,0.00334924697827481
TWN,TAIWAN FD INC COM,874036106,53414000.0,1192,0.003347179039002577
HPE,HEWLETT PACKARD ENTERPRISE CO COM,42824C109,53395000.0,2611,0.0033459884073003816
DKNG,DRAFTKINGS INC NEW COM CL A,26142V105,52926000.0,1234,0.0033165986037040924
NXT,NEXTRACKER INC CLASS A COM,65290E101,52793000.0,971,0.003308264181788726
FTV,FORTIVE CORP COM,34959J108,52234000.0,1002,0.003273234543813618
XLG,INVESCO S&P 500 TOP 50 ETF,46137V233,52100000.0,1000,0.003264837457071821
GDX,VANECK GOLD MINERS ETF,92189F106,52060000.0,1000,0.003262330864014568
SYF,SYNCHRONY FINANCIAL COM,87165B103,51990000.0,779,0.0032579443261643755
LIT,GLOBAL X LITHIUM & BATTERY TECH ETF,37954Y855,51533000.0,1342,0.003229306500485262
EVRG,EVERGY INC COM,30034W106,51491000.0,747,0.0032266745777751464
OAKM,OAKMARK U.S. LARGE CAP ETF,41456U106,51360000.0,2000,0.0032184654855126433
PCOR,PROCORE TECHNOLOGIES INC COM,74275K108,50836000.0,743,0.0031856291164626314
CTRE,CARETRUST REIT INC COM,14174T107,50827000.0,1661,0.0031850651330247496
MLM,MARTIN MARIETTA MATLS INC COM,573284106,50504000.0,92,0.003164824394087433
INDA,ISHARES MSCI INDIA ETF,46429B598,50502000.0,907,0.0031646990644345696
VTES,VANGUARD SHORT-TERM TAX EXEMPT BOND ETF,921935870,50465000.0,500,0.0031623804658566113
NGG,NATIONAL GRID PLC SPONSORED ADR NE,636274409,50227000.0,675,0.003147466237165957
VGSH,VANGUARD SHORT-TERM TREASURY ETF,92206C102,49963000.0,850,0.003130922722988088
XLI,INDUSTRIAL SELECT SECTOR SPDR FUND,81369Y704,49488000.0,335,0.003101156930433211
HSBC,HSBC HLDGS PLC SPON ADR NEW,404280406,49483000.0,814,0.0031008436063010543
IFRA,ISHARES U.S. INFRASTRUCTURE ETF,46435U713,49190000.0,1000,0.003082482812156677
IR,INGERSOLL RAND INC COM,45687V106,49159000.0,591,0.003080540202537306
LGND,LIGAND PHARMACEUTICALS INC COM NEW,53220K504,48996000.0,431,0.003070325835829001
TIP,ISHARES TIPS BOND ETF,464287176,48858000.0,444,0.0030616780897814787
BBVA,BANCO BILBAO VIZCAYA ARGENTARI SPONSORED ADR,05946K101,48754000.0,3172,0.0030551609478326213
SAN,BANCO SANTANDER S.A. ADR,05964H105,48389000.0,5830,0.003032288286185189
WPP,WPP PLC NEW ADR,92937A102,48314000.0,1380,0.00302758842420284
TTE,TOTALENERGIES SE SPONSORED ADS,89151E109,47884000.0,780,0.003000642548837372
BKR,BAKER HUGHES COMPANY CL A,05722G100,47592000.0,1241,0.002982344419519426
DB,DEUTSCHE BANK A G NAMEN AKT,D18190898,47346000.0,1617,0.002966928872217321
STRL,STERLING INFRASTRUCTURE INC COM,859241101,47069000.0,204,0.002949570715295845
NSA,NATIONAL STORAGE AFFILIATES TR COM SHS BEN IN,637870106,46993000.0,1469,0.002944808188487065
XYL,XYLEM INC COM,98419M100,46182000.0,357,0.002893987014251264
NLY,ANNALY CAPITAL MANAGEMENT INC COM NEW,035710839,46109000.0,2450,0.0028894124819217773
ADX,ADAMS DIVERSIFIED EQUITY FD COM,006212104,46047000.0,2121,0.002885527262683035
XMHIX,PIONEER MUNICIPAL HIGH INCOME COM SHS,723763108,45800000.0,5000,0.002870049050554499
MNST,MONSTER BEVERAGE CORP NEW COM,61174X109,45727000.0,730,0.0028654745182250126
AMX,AMERICA MOVIL SAB DE CV SPON ADS RP CL B,02390A101,45675000.0,2546,0.002862215947250584
WY,WEYERHAEUSER CO MTN BE COM NEW,962166104,45523000.0,1772,0.0028526908936330232
EXR,EXTRA SPACE STORAGE INC COM,30225T102,44822000.0,304,0.002808762850304667
SMR,NUSCALE PWR CORP CL A COM,67079K100,44505000.0,1125,0.0027888981003259383
MOO,VANECK AGRIBUSINESS ETF,92189F700,44172000.0,600,0.0027680307131243086
DEUS,XTRACKERS RUSSELL US MULTIFACTOR ETF,233051481,44160000.0,786,0.0027672787352071328
IHG,INTERCONTINENTAL HOTELS GROUP SPONSORED ADS,45857P806,43945000.0,381,0.0027538057975243987
LUV,SOUTHWEST AIRLS CO COM,844741108,43924000.0,1354,0.0027524898361693407
HES,HESS CORP COM,42809H107,43917000.0,317,0.0027520511823843218
AIRR,FIRST TRUST RBA AMERICAN INDUSTRIAL RENAISSANCE ETF,33738R704,43820000.0,538,0.002745972694220484
BR,BROADRIDGE FINL SOLUTIONS INC COM,11133T103,43502000.0,179,0.0027260452794153236
MT,ARCELORMITTAL SA LUXEMBOURG NY REGISTRY SH,03938L203,43075000.0,1364,0.0026992873985291497
KLG,WK KELLOGG CO COM SHS,92942W107,42926000.0,2693,0.0026899503393908826
BXP,BXP INC COM,101121101,42843000.0,635,0.002684749158797083
IQV,IQVIA HLDGS INC COM,46266C105,42392000.0,269,0.002656487322076557
IEF,ISHARES 7-10 YEAR TREASURY BOND ETF,464287440,42290000.0,442,0.0026500955097805627
IEI,ISHARES 3-7 YEAR TREASURY BOND ETF,464288661,42248000.0,355,0.002647463587070447
N/A,CRH PLC ORD,G25508105,42228000.0,460,0.0026462102905418206
RACE,FERRARI N V COM,N3167Y103,42204000.0,86,0.002644706334707469
FEZ,SPDR EURO STOXX 50 ETF,78463X202,41811000.0,700,0.00262007905791996
CMF,ISHARES CALIFORNIA MUNI BOND ETF,464288356,41805000.0,750,0.002619703068961372
TEAM,ATLASSIAN CORPORATION CL A,049468101,41633000.0,205,0.0026089247188151848
ILMN,ILLUMINA INC COM,452327109,41503000.0,435,0.002600778291379113
FSK,FS KKR CAP CORP COM,302635206,41459000.0,1998,0.0025980210390161348
RMD,RESMED INC COM,761152107,41280000.0,160,0.0025868040350849283
FGD,FIRST TRUST DOW JONES GLOBAL SELECT DIVIDEND INDEX FUND,33734X200,41062000.0,1491,0.0025731431029229
LBTYK,LIBERTY GLOBAL LTD COM CL C,G61188127,40931000.0,3970,0.0025649340106603975
FRT,FEDERAL RLTY INVT TR NEW SH BEN INT NEW,313745101,40751000.0,429,0.0025536543419027594
ULST,SPDR SSGA ULTRA SHORT TERM BOND ETF,78467V707,40741000.0,1002,0.0025530276936384464
VRSK,VERISK ANALYTICS INC COM,92345Y106,40495000.0,130,0.0025376121463363413
EXPE,EXPEDIA GROUP INC COM NEW,30212P303,40483000.0,240,0.0025368601684191655
SHV,ISHARES SHORT TREASURY BOND ETF,464288679,40414000.0,366,0.0025325362953954045
UDR,UDR INC COM,902653104,40218000.0,985,0.0025202539894148657
BYM,BLACKROCK MUN INCOME QUALITY T COM,092479104,40128000.0,3800,0.0025146141550360466
TRGP,TARGA RES CORP COM,87612G101,40038000.0,230,0.0025089743206572275
DHS,WISDOMTREE U.S. HIGH DIVIDEND FUND,97717W208,39954000.0,416,0.0025037104752369966
RYLD,GLOBAL X RUSSELL 2000 COVERED CALL ETF,37954Y459,39884000.0,2675,0.0024993239373868044
STM,STMICROELECTRONICS N V NY REGISTRY,861012102,39624000.0,1303,0.0024830310825146606
CINF,CINCINNATI FINL CORP COM,172062101,39613000.0,266,0.0024823417694239164
SPMD,SPDR PORTFOLIO S&P 400 MID CAP ETF,78464A847,39512000.0,727,0.0024760126219543527
FDM,FIRST TRUST DOW JONES SELECT MICROCAP INDEX FUND,33718M105,39398000.0,550,0.0024688688317411824
AIQ,GLOBAL X ARTIFICIAL INTELLIGENCE & TECHNOLOGY ETF,37954Y632,39321000.0,900,0.002464043640105971
FBIN,FORTUNE BRANDS INNOVATIONS INC COM,34964C106,39176000.0,761,0.0024549572402734294
OGS,ONE GAS INC COM,68235P108,39164000.0,545,0.0024542052623562536
RDVY,FIRST TRUST RISING DIVIDEND ACHIEVERS ETF,33738R506,38397000.0,612,0.00240614134048343
FICO,FAIR ISAAC CORP COM,303250104,38387000.0,21,0.0024055146922191168
HMC,HONDA MOTOR LTD ADR ECH CNV IN 3,438128308,38113000.0,1322,0.0023883445297769347
EPI,WISDOMTREE INDIA EARNINGS FUND,97717W422,37976000.0,800,0.002379759448555844
PTY,PIMCO CORPORATE & INCOME OPPOR COM,72201B101,37474000.0,2694,0.0023483017056873208
CSR,CENTERSPACE COM,15202L107,37438000.0,622,0.0023460457719357932
HLN,HALEON PLC SPON ADS,405552100,37425000.0,3609,0.002345231129192186
CPRT,COPART INC COM,217204106,37195000.0,758,0.0023308182191129822
OMC,OMNICOM GROUP INC COM,681919106,36689000.0,510,0.002299109816938734
USCI,UNITED STATES COMMODITY INDEX FUND,911717106,36644000.0,500,0.0022962898997493245
MGK,VANGUARD MEGA CAP GROWTH ETF,921910816,36617000.0,100,0.002294597949435679
MELI,MERCADOLIBRE INC COM,58733R102,36591000.0,14,0.002292968663948464
VFH,VANGUARD FINANCIALS ETF,92204A405,36408000.0,286,0.002281501000711533
ESGU,ISHARES ESG AWARE MSCI USA ETF,46435G425,36396000.0,269,0.002280749022794357
LDOS,LEIDOS HOLDINGS INC COM,525327102,36161000.0,229,0.0022660227885829966
DGX,QUEST DIAGNOSTICS INC COM,74834L100,35926000.0,200,0.002251296554371636
OKLO,OKLO INC COM CL A,02156V109,35834000.0,640,0.0022455313903399546
MSCI,MSCI INC COM,55354G100,35758000.0,62,0.0022407688635311743
KEYS,KEYSIGHT TECHNOLOGIES INC COM,49338L103,35721000.0,218,0.002238450264953215
DXCM,DEXCOM INC COM,252131107,35702000.0,409,0.0022372596332510203
XLY,CONSUMER DISCRETIONARY SELECT SECTOR SPDR FUND,81369Y407,35701000.0,164,0.002237196968424589
ABCB,AMERIS BANCORP COM,03076K108,35585000.0,550,0.0022299278485585555
PCAR,PACCAR INC COM,693718108,35552000.0,374,0.002227859909286322
WTS,WATTS WATER TECHNOLOGIES INC CL A,942749102,35408000.0,144,0.002218836174280212
LVS,LAS VEGAS SANDS CORP COM,517834107,35374000.0,813,0.002216705570181547
MBB,ISHARES MBS ETF,464288588,35366000.0,377,0.002216204251570096
GAB,GABELLI EQUITY TR INC COM,362397101,34920000.0,6000,0.0021882557389817274
TNET,TRINET GROUP INC COM,896288107,34888000.0,477,0.0021862504645359247
DOC,HEALTHPEAK PROPERTIES INC COM,42250P103,34775000.0,1986,0.0021791693391491856
GRID,FIRST TRUST NASDAQ CLEAN EDGE SMART GRID INFRASTRUCTURE INDEX,33737A108,34755000.0,250,0.0021779160426205592
AMRX,AMNEAL PHARMACEUTICALS INC COM STK CL A,03168L105,34747000.0,4295,0.0021774147240091087
RBLX,ROBLOX CORP CL A,771049103,34506000.0,328,0.0021623125008391605
MFG,MIZUHO FINANCIAL GROUP INC SPONSORED ADR,60687Y109,34311000.0,6171,0.002150092859685053
WDC,WESTERN DIGITAL CORP COM,958102105,34235000.0,535,0.0021453303328762725
HUM,HUMANA INC COM,444859102,34227000.0,140,0.002144829014264822
VTWO,VANGUARD RUSSELL 2000 ETF,92206C664,34190000.0,392,0.002142510415686863
BCS,BARCLAYS PLC ADR,06738E204,34075000.0,1833,0.002135303960647261
KTOS,KRATOS DEFENSE & SEC SOLUTIONS COM NEW,50077B207,33444000.0,720,0.0020957624551690974
SCHA,SCHWAB U.S. SMALL-CAP ETF,808524607,33362000.0,1319,0.002090623939401729
DCOM,DIME CMNTY BANCSHARES INC COM,25432X102,33082000.0,1228,0.002073077788000959
PHG,KONINKLIJKE PHILIPS N V NY REGIS SHS NEW,500472303,33068000.0,1379,0.002072200480430921
FW2N,BANNER CORP COM NEW,06652V208,33037000.0,515,0.00207025787081155
BHP,BHP GROUP LTD SPONSORED ADS,088606108,32749000.0,681,0.0020522104007993295
STRA,STRATEGIC ED INC COM,86272C103,32520000.0,382,0.002037860155546557
FIW,FIRST TRUST WATER ETF,33733B100,32496000.0,301,0.002036356199712205
PPG,PPG INDS INC COM,693506107,32305000.0,284,0.002024387217863823
SNAP,SNAP INC CL A,83304A106,32153000.0,3700,0.002014862164246262
WOP,WOODSIDE ENERGY GROUP LTD SPONSORED ADR,980228308,31986000.0,2073,0.0020043971382322314
NET,CLOUDFLARE INC CL A COM,18915M107,31920000.0,163,0.0020002612596877645
CNP,CENTERPOINT ENERGY INC COM,15189T107,31854000.0,867,0.001996125381143297
XOP,SPDR S&P OIL & GAS EXPLORATION & PRODUCTION ETF,78468R556,31827000.0,253,0.0019944334308296514
VCSH,VANGUARD SHORT-TERM CORPORATE BOND ETF,92206C409,31800000.0,400,0.001992741480516006
BIPC,BROOKFIELD INFRASTRUCTURE CORP COM SUB VTG A,11276H106,31741000.0,763,0.001989044255756558
BBEU,JPMORGAN BETABUILDERS EUROPE ETF,46641Q191,31566000.0,468,0.001978077911131077
KDP,KEURIG DR PEPPER INC COM,49271V100,31374000.0,949,0.0019660462644562633
XEL,XCEL ENERGY INC COM,98389B100,30986000.0,455,0.0019417323118009104
JBL,JABIL INC COM,466313103,30752000.0,141,0.0019270687424159814
N/A,ALCON AG ORD SHS,H01301128,30721000.0,348,0.0019251261327966106
HII,HUNTINGTON INGALLS INDS INC COM,446413106,30665000.0,127,0.0019216169025164567
MLPA,GLOBAL X MLP ETF,37954Y343,30622000.0,610,0.0019189223149799098
BTA,BLACKROCK LONG-TERM MUN ADVANT COM,09250B103,30261000.0,3300,0.0018963003126382027
ZG,ZILLOW GROUP INC CL A,98954M101,30204000.0,441,0.0018927284175316176
NWG,NATWEST GROUP PLC SPONS ADR,639057207,30168000.0,2132,0.0018904724837800902
N/A,FERROVIAL SE ORD SHS,N3168P101,30160000.0,563,0.0018899711651686395
XEMDX,WESTERN ASSET EMERGING MKTS DE COM,95766A101,30150000.0,3000,0.0018893445169043265
TRI,THOMSON REUTERS CORP COM,884903808,30109000.0,150,0.0018867752590206422
CEF/U,SPROTT ASSET MANAGEMENT LP PHYSICAL GOLD AN,85208R101,30100000.0,1000,0.0018862112755827604
JEF,JEFFERIES FINL GROUP INC COM,47233W109,30080000.0,550,0.0018849579790541338
BBY,BEST BUY INC COM,086516101,30074000.0,448,0.0018845819900955459
RSPC,INVESCO S&P 500 EQUAL WEIGHT COMMUNICATION SERVICES ETF,46137Y609,30034000.0,785,0.0018820753970382933
NMR,NOMURA HLDGS INC SPONSORED ADR,65535H208,29932000.0,4549,0.0018756835847422984
IWS,ISHARES RUSSELL MID-CAP VALUE ETF,464287473,29732000.0,225,0.0018631506194560343
CRDO,CREDO TECHNOLOGY GROUP HOLDING ORDINARY SHARES,G25457105,29629000.0,320,0.0018566961423336084
FLS,FLOWSERVE CORP COM,34354P105,29588000.0,565,0.0018541268844499239
ALEX,ALEXANDER & BALDWIN INC NEW COM,014491104,29473000.0,1653,0.001846920429410322
IXN,ISHARES GLOBAL TECH ETF,464287291,29364000.0,318,0.0018400899633293079
VNO,VORNADO RLTY TR SH BEN INT,929042109,29254000.0,765,0.0018331968324218628
INOD,INNODATA INC COM NEW,457642205,29195000.0,570,0.0018294996076624148
FMHI,FIRST TRUST MUNICIPAL HIGH INCOME ETF,33739P301,29188000.0,625,0.0018290609538773957
UMBF,UMB FINL CORP COM,902788108,29129000.0,277,0.0018253637291179476
TQQQ,PROSHARES ULTRAPRO QQQ,74347X831,29050000.0,350,0.0018204132078298734
HUBB,HUBBELL INC COM,443510607,29000000.0,71,0.0018172799665083074
ERIC,TELEFONAKTIEBOLAGET LM ERICSS ADR B SEK 10,294821608,28807000.0,3397,0.0018051856550070624
SPSM,SPDR PORTFOLIO S&P 600 SMALL CAP ETF,78468R853,28670000.0,673,0.0017966005737859716
SBAC,SBA COMMUNICATIONS CORP NEW CL A,78410G104,28650000.0,122,0.001795347277257345
CNC,CENTENE CORP DEL COM,15135B101,28334000.0,522,0.0017755451921050477
VLUE,ISHARES MSCI USA VALUE FACTOR ETF,46432F388,28287000.0,250,0.0017725999452627755
AFW,ALIGN TECHNOLOGY INC COM,016255101,28210000.0,149,0.0017677747536275637
AG8,AGILENT TECHNOLOGIES INC COM,00846U101,28204000.0,239,0.0017673987646689758
BIIB,BIOGEN INC COM,09062X103,28132000.0,224,0.0017628868971659207
NOK,NOKIA CORP SPONSORED ADR,654902204,28107000.0,5426,0.0017613202765051378
VONG,VANGUARD RUSSELL 1000 GROWTH ETF,92206C680,28064000.0,257,0.001758625688968591
CRVS,CORVUS PHARMACEUTICALS INC COM,221015100,28000000.0,7000,0.0017546151400769862
GL,GLOBE LIFE INC COM,37959E102,27965000.0,225,0.00175242187115189
SJM,SMUCKER J M CO COM NEW,832696405,27791000.0,283,0.00174151819135284
USFD,US FOODS HLDG CORP COM,912008109,27724000.0,360,0.0017373196479819417
CHD,CHURCH & DWIGHT CO INC COM,171340102,27680000.0,288,0.0017345623956189638
AMKR,AMKOR TECHNOLOGY INC COM,031652100,27602000.0,1315,0.0017296745391573208
DGRE,WISDOMTREE EMERGING MARKETS QUALITY DIVIDEND GROWTH FUND,97717W323,27570000.0,1000,0.0017276692647115181
ESLT,ELBIT SYS LTD ORD,M3760D101,27420000.0,61,0.00171826954074682
SHAK,SHAKE SHACK INC CL A,819047101,27417000.0,195,0.0017180815462675262
MOS,MOSAIC CO NEW COM,61945C103,27360000.0,750,0.001714509651160941
FE,FIRSTENERGY CORP COM,337932107,27256000.0,677,0.0017079925092120835
SYM,SYMBOTIC INC CLASS A COM,87151X101,27195000.0,700,0.001704169954799773
SPXV,PROSHARES S&P 500 EX-HEALTH CARE ETF,74347B565,27106000.0,400,0.0016985927852473854
PTON,PELOTON INTERACTIVE INC CL A COM,70614W100,27066000.0,3900,0.0016960861921901324
MTD,METTLER TOLEDO INTERNATIONAL COM,592688105,27019000.0,23,0.0016931409453478604
MCX,MCCORMICK & CO INC COM NON VTG,579780206,26992000.0,356,0.0016914489950342149
WPM,WHEATON PRECIOUS METALS CORP COM,962879102,26940000.0,300,0.0016881904240597862
SHOP,SHOPIFY INC CL A SUB VTG SHS,82509L107,26877000.0,233,0.0016842425399946131
LYG,LLOYDS BANKING GROUP PLC SPONSORED ADR,539439109,26465000.0,6227,0.0016584246315049086
STE,STERIS PLC SHS USD,G8473T100,26424000.0,110,0.0016558553736212244
EMN,EASTMAN CHEM CO COM,277432100,26086000.0,349,0.0016346746622874382
AKX,ANSYS INC COM,03662Q105,25990000.0,74,0.0016286588389500312
SPGM,SPDR PORTFOLIO MSCI GLOBAL STOCK MARKET ETF,78463X475,25977000.0,376,0.0016278441962064242
DGS,WISDOMTREE EMERGING MARKETS SMALLCAP DIVIDEND FUND,97717W281,25856000.0,468,0.0016202617522082343
DDWM,WISDOMTREE DYNAMIC INTERNATIONAL EQUITY FUND,97717X263,25779000.0,650,0.0016154365605730225
IVLU,ISHARES MSCI INTL VALUE FACTOR ETF,46435G409,25654000.0,780,0.0016076034572691073
IHE,ISHARES U.S. PHARMACEUTICALS ETF,464288836,25561000.0,390,0.0016017756284109946
MRNA,MODERNA INC COM,60770K107,25383000.0,920,0.0015906212893062196
PUK,PRUDENTIAL PLC ADR,74435K204,25345000.0,1013,0.0015882400259018294
SPEM,SPDR PORTFOLIO EMERGING MARKETS ETF,78463X509,25217000.0,590,0.0015802189281186204
SCHB,SCHWAB U.S. BROAD MARKET ETF,808524102,24922000.0,1046,0.0015617328043213805
IJK,ISHARES S&P MID-CAP 400 GROWTH ETF,464287606,24747000.0,272,0.0015507664596958995
CHWY,CHEWY INC CL A,16679L109,24720000.0,580,0.0015490745093822537
FRO,FRONTLINE PLC COM,M46528101,24615000.0,1500,0.001542494702606965
AMLP,ALERIAN MLP ETF,00162Q452,24430000.0,500,0.0015309017097171705
TOL,TOLL BROTHERS INC COM,889478103,24310000.0,213,0.001523381930545412
IGIB,ISHARES 5-10 YEAR INVESTMENT GRADE CORPORATE BOND ETF,464288638,24247000.0,455,0.0015194340464802388
FIS,FIDELITY NATL INFORMATION SVCS COM,31620M106,23853000.0,293,0.0014947441048662985
AMBA,AMBARELLA INC SHS,G037AX101,23783000.0,360,0.0014903575670161058
CFG,CITIZENS FINL GROUP INC COM,174610105,23673000.0,529,0.0014834644361086606
NWSA,NEWS CORP NEW CL A,65249B109,23627000.0,795,0.0014805818540928198
PMO,PUTNAM MUN OPPORTUNITIES TR SH BEN INT,746922103,23627000.0,2389,0.0014805818540928198
UHAL,U HAUL HOLDING COMPANY COM,023586100,23618000.0,390,0.001480017870654938
AVB,AVALONBAY CMNTYS INC COM,053484101,23606000.0,116,0.001479265892737762
TEF,TELEFONICA S A SPONSORED ADR,879382208,23457000.0,4485,0.0014699288335994953
