ticker,nameOfIssuer,cusip,value,shares,allocation_percent
HST,HOST HOTELS & RESORTS INC COM,44107P104,7603000.0,495,0.0004764406753573331
EFT,EATON VANCE FLTING RATE INC TR COM,278279104,7600000.0,609,0.00047625268087803915
PMAY,INNOVATOR U.S. EQUITY POWER BUFFER ETF - MAY,45782C318,7558000.0,200,0.00047362075816792363
TFI,SPDR NUVEEN ICE MUNICIPAL BOND ETF,78468R721,7549000.0,169,0.0004730567747300418
FPF,FIRST TR INTER DURATN PFD & IN COM,33718W103,7528000.0,400,0.00047174081337498407
SHM,SPDR NUVEEN ICE SHORT TERM MUNICIPAL BOND ETF,78468R739,7509000.0,157,0.0004705501816727889
LUMN,LUMEN TECHNOLOGIES INC COM,550241103,7507000.0,1714,0.00047042485201992634
CWK,CUSHMAN WAKEFIELD PLC SHS,G2717B108,7472000.0,675,0.00046823158309483007
UCB,UNITED CMNTY BKS BLAIRSVLE GA COM,90984P303,7448000.0,250,0.0004667276272604784
MOH,MOLINA HEALTHCARE INC COM,60855R100,7448000.0,25,0.0004667276272604784
TENB,TENABLE HLDGS INC COM,88025T102,7432000.0,220,0.0004657249900375772
GLNG,GOLAR LNG LTD SHS,G9456A100,7414000.0,180,0.0004645970231618134
RDNT,RADNET INC COM,750491102,7398000.0,130,0.00046359438593891235
AWG,ASBURY AUTOMOTIVE GROUP INC COM,043436104,7395000.0,31,0.0004634063914596184
KMX,CARMAX INC COM,143130102,7393000.0,110,0.0004632810618067557
SOUN,SOUNDHOUND AI INC CLASS A COM,836100107,7382000.0,688,0.00046259174871601116
AUB,ATLANTIC UN BANKSHARES CORP COM,04911A107,7382000.0,236,0.00046259174871601116
VAL,VALARIS LTD CL A,G9460G101,7369000.0,175,0.000461777105972404
BL,BLACKLINE INC COM,09239B109,7361000.0,130,0.00046127578736095343
BOX,BOX INC CL A,10316T104,7347000.0,215,0.00046039847979091494
AROC,ARCHROCK INC COM,03957W106,7325000.0,295,0.0004590198536094259
GBDC,GOLUB CAP BDC INC COM,38173M102,7325000.0,500,0.0004590198536094259
PCVX,VAXCYTE INC COM,92243G108,7315000.0,225,0.0004583932053451127
CATY,CATHAY GEN BANCORP COM,149150104,7285000.0,160,0.000456513260552173
ADMA,ADMA BIOLOGICS INC COM,000899104,7284000.0,400,0.0004564505957257417
CYTK,CYTOKINETICS INC COM NEW,23282W605,7269000.0,220,0.00045551062332927194
WSBC,WESBANCO INC COM,950810101,7243000.0,229,0.0004538813378420576
CWAN,CLEARWATER ANALYTICS HLDGS INC CL A,185123106,7237000.0,330,0.0004535053488834697
INDB,INDEPENDENT BK CORP MASS COM,453836108,7232000.0,115,0.000453192024751313
FUL,FULLER H B CO COM,359694106,7218000.0,120,0.00045231471718127454
FIVE,FIVE BELOW INC COM,33829M101,7215000.0,55,0.00045212672270198063
PGX,INVESCO PREFERRED ETF,46138E511,7201000.0,647,0.00045124941513194214
TDY,TELEDYNE TECHNOLOGIES INC COM,879360105,7172000.0,14,0.00044943213516543374
WSFS,WSFS FINL CORP COM,929328102,7150000.0,130,0.00044805350898394474
ZWS,ZURN ELKAY WATER SOLNS CORP COM,98983L108,7131000.0,195,0.00044686287728174965
LTH,LIFE TIME GROUP HOLDINGS INC COMMON STOCK,53190C102,7128000.0,235,0.0004466748828024557
MWA,MUELLER WTR PRODS INC COM SER A,624758108,7116000.0,296,0.0004459229048852798
EXPO,EXPONENT INC COM,30214U102,7097000.0,95,0.0004447322731830847
ESGR,ENSTAR GROUP LIMITED SHS,G3075P101,7064000.0,21,0.0004426643339108512
ATKR,ATKORE INC COM,047649108,7055000.0,100,0.00044210035047296923
REZI,RESIDEO TECHNOLOGIES INC COM,76118Y104,6993000.0,317,0.0004382151312342273
FERG,FERGUSON ENTERPRISES INC COMMON STOCK NEW,31488V107,6968000.0,32,0.0004366485105734443
DMLP,DORCHESTER MINERALS LP COM UNIT,25820R105,6965000.0,250,0.00043646051609415033
CHI,CALAMOS CONV OPPORTUNITIES & I SH BEN INT,128117108,6964000.0,662,0.000436397851267719
NMIH,NMI HLDGS INC COM,629209305,6961000.0,165,0.00043620985678842505
UFPI,UFP INDUSTRIES INC COM,90278Q108,6955000.0,70,0.0004358338678298372
GT,GOODYEAR TIRE & RUBR CO COM,382550101,6948000.0,670,0.00043539521404481794
DIOD,DIODES INC COM,254543101,6929000.0,131,0.0004342045823426228
AAT,AMERICAN ASSETS TR INC COM,024013104,6913000.0,350,0.0004332019451197217
MYRG,MYR GROUP INC DEL COM,55405W104,6895000.0,38,0.00043207397824395784
GNW,GENWORTH FINL INC COM SHS,37247D106,6846000.0,880,0.0004290034017488232
ERJ,EMBRAER S.A. SPONSORED ADS,29082A107,6829000.0,120,0.00042793809969949074
FINX,GLOBAL X FINTECH ETF,37954Y814,6776000.0,198,0.00042461686389863075
CVBF,CVB FINL CORP COM,126600105,6729000.0,340,0.0004216716170563586
PCH,POTLATCHDELTIC CORPORATION COM,737630103,6715000.0,175,0.0004207943094863201
GPOR,GULFPORT ENERGY CORP COMMON SHARES,402635502,6639000.0,33,0.0004160317826775398
RYTM,RHYTHM PHARMACEUTICALS INC COM,76243J105,6635000.0,105,0.0004157811233718144
HL,HECLA MNG CO COM,422704106,6619000.0,1105,0.0004147784861489133
OHI,OMEGA HEALTHCARE INVS INC COM,681936100,6597000.0,180,0.00041339985996742426
TRMK,TRUSTMARK CORP COM,898402102,6563000.0,180,0.0004112692558687593
GOLF,ACUSHNET HLDGS CORP COM,005098108,6554000.0,90,0.0004107052724308774
VSEC,VSE CORP COM,918284100,6549000.0,50,0.0004103919482987208
LAUR,LAUREATE EDUCATION INC COMMON STOCK,518613203,6546000.0,280,0.00041020395381942686
MGNI,MAGNITE INC COM,55955D100,6512000.0,270,0.0004080733497207619
DXC,DXC TECHNOLOGY CO COM,23355L106,6422000.0,420,0.0004024335153419431
APLE,APPLE HOSPITALITY REIT INC COM NEW,03784Y200,6419000.0,550,0.0004022455208626491
TRN,TRINITY INDS INC COM,896522109,6401000.0,237,0.0004011175539868853
FXG,FIRST TRUST CONSUMER STAPLES ALPHADEX FUND,33734X119,6391000.0,101,0.0004004909057225721
PRGS,PROGRESS SOFTWARE CORP COM,743312100,6384000.0,100,0.0004000522519375529
CBT,CABOT CORP COM,127055101,6375000.0,85,0.00039948826849967094
TEM,TEMPUS AI INC CL A,88023B103,6354000.0,100,0.0003981723071446132
ANRO,ALTO NEUROSCIENCE INC COM SHS,02157Q109,6347000.0,2885,0.00039773365335959396
WHD,CACTUS INC CL A,127203107,6339000.0,145,0.0003972323347481434
FRME,FIRST MERCHANTS CORP COM,320817109,6320000.0,165,0.00039604170304594836
RCL 6 08/15/25,ROYAL CARIBBEAN GROUP 6 08/15/2025,780153BQ4,6310000.0,1000,0.00039541505478163516
AGYS,AGILYSYS INC COM,00847J105,6305000.0,55,0.00039510173064947855
EXPD,EXPEDITORS INTL WASH INC COM,302130109,6284000.0,55,0.0003937857692944208
SLNO,SOLENO THERAPEUTICS INC COM,834203309,6284000.0,75,0.0003937857692944208
CNR,CORE NATURAL RESOURCES INC COM SHS,218937100,6277000.0,90,0.0003933471155094016
SEZL,SEZZLE INC COM,78435P105,6274000.0,35,0.0003931591210301076
TBBK,BANCORP INC DEL COM,05969A105,6267000.0,110,0.00039272046724508837
CAKE,CHEESECAKE FACTORY INC COM,163072101,6266000.0,100,0.000392657802418657
AVA,AVISTA CORP COM,05379B107,6262000.0,165,0.0003924071431129317
CRK,COMSTOCK RES INC COM,205768302,6253000.0,226,0.0003918431596750499
TDS,TELEPHONE & DATA SYS INC COM NEW,879433829,6227000.0,175,0.00039021387418783544
GBX,GREENBRIER COS INC COM,393657101,6217000.0,135,0.00038958722592352224
AGX,ARGAN INC COM,04010E109,6173000.0,28,0.0003868299735605442
MHO,M/I HOMES INC COM,55305B101,6167000.0,55,0.0003864539846019562
FCA,FIRST TRUST CHINA ALPHADEX FUND,33737J141,6151000.0,255,0.00038545134737905513
KNF,KNIFE RIVER CORP COMMON STOCK,498894104,6123000.0,75,0.00038369673223897816
ZETA,ZETA GLOBAL HOLDINGS CORP CL A,98956A105,6119000.0,395,0.0003834460729332529
SWTX,SPRINGWORKS THERAPEUTICS INC COM,85205L107,6109000.0,130,0.0003828194246689396
NUVL,NUVALENT INC COM,670703107,6104000.0,80,0.000382506100536783
FBRT,FRANKLIN BSP RLTY TR INC COMMON STOCK,35243J101,6104000.0,571,0.000382506100536783
NOG,NORTHERN OIL & GAS INC COM,665531307,6095000.0,215,0.00038194211709890113
PTGX,PROTAGONIST THERAPEUTICS INC COM,74366E102,6080000.0,110,0.0003810021447024313
CNK,CINEMARK HLDGS INC COM,17243V102,6066000.0,201,0.00038012483713239283
SIGI,SELECTIVE INS GROUP INC COM,816300107,6066000.0,70,0.00038012483713239283
HRI,HERC HLDGS INC COM,42704L104,6058000.0,46,0.0003796235185209422
GNTX,GENTEX CORP COM,371901109,6047000.0,275,0.00037893420543019774
WOR,WORTHINGTON ENTERPRISES INC COM,981811102,6046000.0,95,0.0003788715406037664
UNF,UNIFIRST CORP MASS COM,904708104,6023000.0,32,0.00037743024959584605
SRRK,SCHOLAR ROCK HLDG CORP COM,80706P103,6021000.0,170,0.00037730491994298335
BWIN,THE BALDWIN INSURANCE GRP INC COM CL A,05589G102,5993000.0,140,0.0003755503048029064
IBOC,INTERNATIONAL BANCSHARES CORP COM,459044103,5990000.0,90,0.0003753623103236124
TOST,TOAST INC CL A,888787108,5979000.0,135,0.00037467299723286795
UHS,UNIVERSAL HLTH SVCS INC CL B,913903100,5978000.0,33,0.00037461033240643657
PFSI,PENNYMAC FINL SVCS INC NEW COM,70932M107,5978000.0,60,0.00037461033240643657
CBU,COMMUNITY FINANCIAL SYSTEM INC COM,203607106,5971000.0,105,0.0003741716786214173
GEN,GEN DIGITAL INC COM,668771108,5968000.0,203,0.00037398368414212336
AEIS,ADVANCED ENERGY INDS COM,007973100,5963000.0,45,0.00037367036000996676
MGY,MAGNOLIA OIL & GAS CORP CL A,559663109,5957000.0,265,0.00037329437105137884
REVG,REV GROUP INC COM,749527107,5949000.0,125,0.0003727930524399283
WDFC,WD 40 CO COM,929236107,5930000.0,26,0.0003716024207377332
CDP,COPT DEFENSE PROPERTIES SHS BEN INT,22002T108,5930000.0,215,0.0003716024207377332
MQ,MARQETA INC CLASS A COM,57142B104,5917000.0,1015,0.000370787777994126
SLAB,SILICON LABORATORIES INC COM,826919102,5894000.0,40,0.0003693464869862056
LINE,LINEAGE INC COM,53566V106,5875000.0,135,0.0003681558552840105
CALX,CALIX INC COM,13100M509,5851000.0,110,0.00036665189944965886
HUBG,HUB GROUP INC CL A,443320106,5850000.0,175,0.0003665892346232275
GRFS,GRIFOLS S A SP ADR REP B NVT,398438408,5849000.0,647,0.0003665265697967962
NTST,NETSTREIT CORP COM,64119V303,5841000.0,345,0.0003660252511853456
RNA,AVIDITY BIOSCIENCES INC COM,05370A108,5822000.0,205,0.0003648346194831505
GFF,GRIFFON CORP COM,398433102,5790000.0,80,0.00036282934503734825
BLKB,BLACKBAUD INC COM,09227Q100,5779000.0,90,0.0003621400319466037
RNST,RENASANT CORP COM,75970E107,5749000.0,160,0.0003602600871536641
EUFN,ISHARES MSCI EUROPE FINANCIALS ETF,464289180,5725000.0,181,0.00035875613131931236
QS,QUANTUMSCAPE CORP COM CL A,74767V109,5712000.0,850,0.00035794148857570525
WAFD,WAFD INC COM,938824109,5710000.0,195,0.00035781615892284256
ADNT,ADIENT PLC ORD SHS,G0084W101,5682000.0,292,0.0003560615437827656
UEC,URANIUM ENERGY CORP COM,916896103,5678000.0,835,0.0003558108844770403
AZZ,AZZ INC COM,002474104,5669000.0,60,0.0003552469010391584
RUSHA,RUSH ENTERPRISES INC CL A,781846209,5666000.0,110,0.00035505890655986445
LKQ1,LKQ CORP COM,501889208,5663000.0,153,0.0003548709120805705
MRCY,MERCURY SYS INC COM,589378108,5655000.0,105,0.0003543695934691199
AVNT,AVIENT CORPORATION COM,05368V106,5654000.0,175,0.00035430692864268855
BCC,BOISE CASCADE CO DEL COM,09739D100,5643000.0,65,0.0003536176155519441
SS1A,RADIUS RECYCLING INC CL A,806882106,5641000.0,190,0.00035349228589908144
IMAR,INNOVATOR INTERNATIONAL DEVELOPED POWER BUFFER ETF MARCH,45783Y343,5640000.0,200,0.0003534296210726501
PATK,PATRICK INDS INC COM,703343103,5628000.0,61,0.00035267764315547427
BATRK,ATLANTA BRAVES HLDGS INC COM SER C,047726302,5612000.0,120,0.00035167500593257314
AIN,ALBANY INTL CORP CL A,012348108,5610000.0,80,0.00035154967627971045
GRAL,GRAIL INC COM,384747101,5605000.0,109,0.0003512363521475539
TWLO,TWILIO INC CL A,90138F102,5596000.0,45,0.00035067236870967196
OII,OCEANEERING INTL INC COM,675232102,5594000.0,270,0.0003505470390568093
QUBT,QUANTUM COMPUTING INC COM,74766W108,5559000.0,290,0.0003483537701317131
PAR,PAR TECHNOLOGY CORP COM,698884103,5550000.0,80,0.0003477897866938312
LEVI,LEVI STRAUSS & CO NEW CL A COM STK,52736R102,5547000.0,300,0.00034760179221453725
ITM,VANECK INTERMEDIATE MUNI ETF,92189H201,5547000.0,122,0.00034760179221453725
ARWR,ARROWHEAD PHARMACEUTICALS INC COM,04280A100,5530000.0,350,0.0003465364901652048
IDV,ISHARES INTERNATIONAL SELECT DIVIDEND ETF,464288448,5522000.0,160,0.00034603517155375424
CLSK,CLEANSPARK INC COM NEW,18452B209,5515000.0,500,0.000345596517768735
FLOT,ISHARES FLOATING RATE BOND ETF,46429B655,5510000.0,108,0.0003452831936365784
GEO,GEO GROUP INC NEW COM,36162J106,5509000.0,230,0.00034522052881014707
SCHI,SCHWAB 5-10 YEAR CORPORATE BOND ETF,808524698,5508000.0,242,0.0003451578639837157
EPAC,ENERPAC TOOL GROUP CORP CL A COM,292765104,5476000.0,135,0.00034315258953791344
PRCT,PROCEPT BIOROBOTICS CORP COM,74276L105,5472000.0,95,0.0003429019302321882
VFC,V F CORP COM,918204108,5464000.0,465,0.0003424006116207376
RE,EVEREST GROUP LTD COM,G3223R108,5438000.0,16,0.0003407713261335233
SFBS,SERVISFIRST BANCSHARES INC COM,81768T108,5426000.0,70,0.0003400193482163474
BCPC,BALCHEM CORP COM,057665200,5413000.0,34,0.00033920470547274024
HNI,HNI CORP COM,404251100,5410000.0,110,0.0003390167109934463
KAI,KADANT INC COM,48282T104,5397000.0,17,0.0003382020682498391
IEI,INSIGHT ENTERPRISES INC COM,45765U103,5385000.0,39,0.00033745009033266327
LXP,LXP INDUSTRIAL TRUST COM,529043101,5369000.0,650,0.00033644745310976214
AWR,AMER STATES WTR CO COM,029899101,5366000.0,70,0.0003362594586304682
KRYS,KRYSTAL BIOTECH INC COM,501147102,5361000.0,39,0.0003359461344983116
VDE,VANGUARD ENERGY ETF,92204A306,5360000.0,45,0.00033588346967188025
REG,REGENCY CTRS CORP COM,758849103,5342000.0,75,0.0003347555027961165
TSA,ACI WORLDWIDE INC COM,004498101,5280000.0,115,0.00033087028355737456
COMP,COMPASS INC CL A,20464U100,5275000.0,840,0.00033055695942521795
PSMT,PRICESMART INC COM,741511109,5252000.0,50,0.0003291156684172976
PDM,PIEDMONT REALTY TRUST INC COM CL A,720190206,5249000.0,720,0.0003289276739380036
POOL,POOL CORP COM,73278L105,5247000.0,18,0.000328802344285141
CCSI,CONSENSUS CLOUD SOLUTIONS INC COM,20848V105,5235000.0,227,0.00032805036636796513
OI,O-I GLASS INC COM,67098H104,5233000.0,355,0.0003279250367151025
ACLS,AXCELIS TECHNOLOGIES INC COM NEW,054540208,5227000.0,75,0.0003275490477565145
SYNA,SYNAPTICS INC COM,87157D109,5186000.0,80,0.00032497978987283037
NOVT,NOVANTA INC COM,67000B104,5157000.0,40,0.00032316250990632213
HMN,HORACE MANN EDUCATORS CORP NEW COM,440327104,5156000.0,120,0.00032309984507989075
FRSH,FRESHWORKS INC CLASS A COM,358054104,5144000.0,345,0.0003223478671627149
BFH,BREAD FINANCIAL HOLDINGS INC COM,018581108,5141000.0,90,0.00032215987268342095
ALE,ALLETE INC COM NEW,018522300,5126000.0,80,0.00032121990028695114
CMU,MFS HIGH YIELD MUN TR SH BEN INT,59318E102,5118000.0,1537,0.0003207185816755006
EBC,EASTERN BANKSHARES INC COM,27627N105,5115000.0,335,0.0003205305871962066
AWN,ADVANCE AUTO PARTS INC COM,00751Y106,5114000.0,110,0.0003204679223697753
CHEF,CHEFS WHSE INC COM,163086101,5105000.0,80,0.0003199039389318934
DNOW,DNOW INC COM,67011P100,5072000.0,342,0.0003178359996596598
WSM,WILLIAMS SONOMA INC COM,969904101,5064000.0,31,0.00031733468104820926
WNS,WNS HLDGS LTD COM SHS,G98196101,5059000.0,80,0.00031702135691605266
FCF,FIRST COMWLTH FINL CORP PA COM,319829107,5031000.0,310,0.00031526674177597563
ACVA,ACV AUCTIONS INC COM CL A,00091G104,5028000.0,310,0.00031507874729668167
ALG,ALAMO GROUP INC COM,011311107,5023000.0,23,0.00031476542316452507
RS,RELIANCE INC COM,759509102,5022000.0,16,0.00031470275833809375
CARG,CARGURUS INC COM CL A,141788109,5021000.0,150,0.0003146400935116624
KYMR,KYMERA THERAPEUTICS INC COM,501575104,5019000.0,115,0.0003145147638587998
PRM,PERIMETER SOLUTIONS INC COMMON STOCK,71385M107,5011000.0,360,0.0003140134452473492
ELME,ELME COMMUNITIES SH BEN INT,939653101,5009000.0,315,0.0003138881155944866
N/A,SEADRILL LTD COM,G7997W102,4988000.0,190,0.00031257215423942885
CON,CONCENTRA GROUP HOLDINGS PAREN COMMON STOCK,20603L102,4978000.0,242,0.00031194550597511564
CNMD,CONMED CORP COM,207410101,4948000.0,95,0.000310065561182176
IIM,INVESCO VALUE MUN INCOME TR COM,46132P108,4947000.0,425,0.0003100028963557447
FELE,FRANKLIN ELEC INC COM,353514102,4936000.0,55,0.0003093135832650002
AI,C3 AI INC CL A,12468P104,4914000.0,200,0.0003079349570835111
SKWD,SKYWARD SPECIALTY INS GROUP IN COM,830940102,4912000.0,85,0.00030780962743064843
PFS,PROVIDENT FINL SVCS INC COM,74386T105,4908000.0,280,0.0003075589681249232
WAY,WAYSTAR HLDG CORP COM,946784105,4904000.0,120,0.0003073083088191979
PII,POLARIS INC COM,731068102,4878000.0,120,0.00030567902333198353
HBI,HANESBRANDS INC COM,410345102,4878000.0,1065,0.00030567902333198353
MGEE,MGE ENERGY INC COM,55277P104,4864000.0,55,0.00030480171576194505
YOU,CLEAR SECURE INC COM CL A,18467V109,4858000.0,175,0.0003044257268033571
DAVE,FAMOUS DAVES AMER INC COM,23834J201,4831000.0,18,0.00030273377648971147
VBTX,VERITEX HLDGS INC COM,923451108,4829000.0,185,0.0003026084468368488
LMND,LEMONADE INC COM,52567D107,4819000.0,110,0.0003019817985725356
HURN,HURON CONSULTING GROUP INC COM,447462102,4814000.0,35,0.00030166847444037896
PBH,PRESTIGE CONSMR HEALTHCARE INC COM,74112D101,4791000.0,60,0.0003002271834324586
SWBI,SMITH & WESSON BRANDS INC COM,831754106,4786000.0,551,0.000299913859300302
NBTB,NBT BANCORP INC COM,628778102,4778000.0,115,0.0002994125406888515
DES,WISDOMTREE U.S. SMALLCAP DIVIDEND FUND,97717W604,4774000.0,150,0.0002991618813831262
ATRC,ATRICURE INC COM,04963C209,4752000.0,145,0.0002977832552016371
POWI,POWER INTEGRATIONS INC COM,739276103,4752000.0,85,0.0002977832552016371
GSHD,GOOSEHEAD INS INC COM CL A,38267D109,4748000.0,45,0.0002975325958959118
BITO,PROSHARES BITCOIN ETF,74347G440,4732000.0,220,0.0002965299586730107
GHC,GRAHAM HLDGS CO COM CL B,384637104,4731000.0,5,0.00029646729384657936
GNL,GLOBAL NET LEASE INC COM NEW,379378201,4719000.0,625,0.0002957153159294035
DAN,DANA INC COM,235825205,4716000.0,275,0.00029552732145010955
BF/B,BROWN FORMAN CORP CL B,115637209,4709000.0,175,0.0002950886676650903
KMT,KENNAMETAL INC COM,489170100,4707000.0,205,0.00029496333801222767
SBCF,SEACOAST BKG CORP FLA COM NEW,811707801,4695000.0,170,0.0002942113600950518
OSW,ONESPAWORLD HOLDINGS LIMITED COM,P73684113,4690000.0,230,0.0002938980359628952
ICFI,ICF INTL INC COM,44925C103,4659000.0,55,0.0002919554263435243
MGRC,MCGRATH RENTCORP COM,580589109,4638000.0,40,0.0002906394649884665
OTTR,OTTER TAIL CORP COM,689648103,4625000.0,60,0.0002898248222448594
TDW,TIDEWATER INC NEW COM,88642R109,4613000.0,100,0.0002890728443276835
FIBK,FIRST INTST BANCSYSTEM INC COM,32055Y201,4611000.0,160,0.00028894751467482084
DEI,DOUGLAS EMMETT INC COM,25960P109,4602000.0,306,0.000288383531236939
AVDX,AVIDXCHANGE HOLDINGS INC COM,05368X102,4601000.0,470,0.00028832086641050763
CHX,CHAMPIONX CORPORATION COM,15872M104,4595000.0,185,0.0002879448774519197
SUB,ISHARES SHORT-TERM NATIONAL MUNI BOND ETF,464288158,4573000.0,43,0.00028656625127043066
CSGS,CSG SYS INTL INC COM,126349109,4572000.0,70,0.00028650358644399934
HGV,HILTON GRAND VACATIONS INC COM,43283X105,4568000.0,110,0.00028625292713827405
SHOO,MADDEN STEVEN LTD COM,556269108,4556000.0,190,0.0002855009492210982
DNLI,DENALI THERAPEUTICS INC COM,24823R105,4547000.0,325,0.0002849369657832163
HWKN,HAWKINS INC COM,420261109,4547000.0,32,0.0002849369657832163
SPOT 0 03/15/26,SPOTIFY USA INC 0 03/15/2026,84921RAB6,4545000.0,3000,0.0002848116361303537
VFL,ABRDN NATL MUN INCOME FD SH BEN INT,24610T108,4540000.0,470,0.000284498311998197
ESS,ESSEX PPTY TR INC COM,297178105,4534000.0,16,0.00028412232303960916
ACAD,ACADIA PHARMACEUTICALS INC COM,004225108,4530000.0,210,0.0002838716637338839
NGVT,INGEVITY CORP COM,45688C107,4524000.0,105,0.0002834956747752959
GBCI,GLACIER BANCORP INC NEW COM,37637Q105,4523000.0,105,0.00028343300994886463
EVTC,EVERTEC INC COM,30040P103,4506000.0,125,0.0002823677078995322
MUB,ISHARES NATIONAL MUNI BOND ETF,464288414,4493000.0,43,0.000281553065155925
INGR,INGREDION INC COM,457187102,4475000.0,33,0.0002804250982801612
DKNG 0 03/15/28,DRAFTKINGS INC NEW 0 03/15/2028,26142RAB0,4473000.0,5000,0.00028029976862729855
PCT,PURECYCLE TECHNOLOGIES INC COM,74623V103,4453000.0,325,0.00027904647209867214
SM,SM ENERGY CO COM,78454L100,4448000.0,180,0.00027873314796651553
TPC,TUTOR PERINI CORP COM,901109108,4444000.0,95,0.00027848248866079025
ALIT,ALIGHT INC COM CL A,01626W101,4443000.0,785,0.00027841982383435893
PI,IMPINJ INC COM,453204109,4443000.0,40,0.00027841982383435893
PBI,PITNEY BOWES INC COM,724479100,4419000.0,405,0.00027691586800000724
APO 6.75 07/31/26,APOLLO GLOBAL MGMT INC SER A MAND CNV,03769M304,4416000.0,59,0.0002767278735207133
NWE,NORTHWESTERN ENERGY GROUP INC COM NEW,668074305,4412000.0,86,0.00027647721421498794
RXO,RXO INC COMMON STOCK,74982T103,4402000.0,280,0.0002758505659506748
SEM,SELECT MED HLDGS CORP COM,81619Q105,4402000.0,290,0.0002758505659506748
INTA,INTAPP INC COM,45827U109,4388000.0,85,0.0002749732583806363
NMRK,NEWMARK GROUP INC CL A,65158N102,4374000.0,360,0.0002740959508105978
OUST,OUSTER INC COM NEW,68989M202,4365000.0,180,0.00027353196737271593
AORT,ARTIVION INC COM,228903100,4354000.0,140,0.00027284265428197135
SYBT,STOCK YDS BANCORP INC COM,861025104,4344000.0,55,0.0002722160060176582
EXE,CSUSCHK,165167735,4327000.0,37,0.0002711507039683257
BANF,BANCFIRST CORP COM,05945F103,4327000.0,35,0.0002711507039683257
BWXT,BWX TECHNOLOGIES INC COM,05605H100,4322000.0,30,0.0002708373798361691
CRNX,CRINETICS PHARMACEUTICALS INC COM,22663K107,4314000.0,150,0.0002703360612247185
KAR,OPENLANE INC COM,48238T109,4303000.0,176,0.000269646748133974
CBZ,CBIZ INC COM,124805102,4303000.0,60,0.000269646748133974
CSW,CSW INDUSTRIALS INC COM,126402106,4302000.0,15,0.0002695840833075427
VONV,VANGUARD RUSSELL 1000 VALUE ETF,92206C714,4281000.0,50,0.00026826812195248495
NATL,NCR ATLEOS CORPORATION COM SHS,63001N106,4280000.0,150,0.00026820545712605363
RELY,REAL IND INC COM,75960P104,4223000.0,225,0.00026463356201946836
ALKT,ALKAMI TECHNOLOGY INC COM,01644J108,4220000.0,140,0.00026444556754017434
IDYA,IDEAYA BIOSCIENCES INC COM,45166A102,4204000.0,200,0.0002634429303172732
SPNT,SIRIUSPOINT LTD COM,G8192H106,4180000.0,205,0.0002619389744829215
ALKS,ALKERMES PLC SHS,G01767105,4148000.0,145,0.00025993370003711926
HEI/A,HEICO CORP NEW CL A,422806208,4140000.0,16,0.0002594323814256687
CXW,CORECIVIC INC COM,21871N101,4109000.0,195,0.00025748977180629776
ANAB,ANAPTYSBIO INC COM,032724106,4107000.0,185,0.0002573644421534351
WK,WORKIVA INC COM CL A,98139A105,4107000.0,60,0.0002573644421534351
RGNX,REGENXBIO INC COM,75901B107,4105000.0,500,0.0002572391125005725
W,WAYFAIR INC CL A,94419L101,4091000.0,80,0.000256361804930534
ACT,ALLERGAN PLC SHS,29249E109,4087000.0,110,0.00025611114562480865
ZS 0.125 07/01/25,ZSCALER INC 0.125 07/01/2025,98980GAB8,4084000.0,2000,0.00025592315114551475
VLT,INVESCO HIGH INCOME TR II COM,46131F101,4079000.0,373,0.00025560982701335814
XENE,XENON PHARMACEUTICALS INC COM,98420N105,4069000.0,130,0.0002549831787490449
CXT,CRANE NXT CO COM,224441105,4066000.0,75,0.000254795184269751
LIVN,LIVANOVA PLC SHS,G5509L101,4052000.0,90,0.0002539178766997125
THC,TENET HEALTHCARE CORP COM NEW,88033G407,4048000.0,23,0.00025366721739398715
VCEL,VERICEL CORP COM,92346J108,4042000.0,95,0.00025329122843539923
JBHT,HUNT J B TRANS SVCS INC COM,445658107,4021000.0,28,0.0002519752670803415
BTSG,BRIGHTSPRING HEALTH SVCS INC COM,10950A106,4010000.0,170,0.00025128595398959697
PPBI,PACIFIC PREMIER BANCORP COM,69478X105,4007000.0,190,0.000251097959510303
DFIN,DONNELLEY FINL SOLUTIONS INC COM,25787G100,4007000.0,65,0.000251097959510303
TRS,TRIMAS CORP COM NEW,896215209,4005000.0,140,0.00025097262985744037
CDL,VICTORYSHARES US LARGE CAP HIGH DIVIDEND VOLATILITY WTD ETF,92647N865,3996000.0,60,0.0002504086464195585
TG7,TRIUMPH GROUP INC NEW COM,896818101,3991000.0,155,0.0002500953222874019
MZTI,MARZETTI COMPANY COM,513847103,3974000.0,23,0.00024903002023806943
KBH,KB HOME COM,48666K109,3973000.0,75,0.0002489673554116381
ACLX,ARCELLX INC COMMON STOCK,03940C100,3951000.0,60,0.000247588729230149
AIZ,ASSURANT INC COM,04621X108,3950000.0,20,0.00024752606440371774
CELH,CELSIUS HLDGS INC COM NEW,15118V207,3943000.0,85,0.0002470874106186985
NRG 2.75 06/01/48,NRG ENERGY INC 2.75 06/01/2048,629377CG5,3937000.0,1000,0.0002467114216601105
ENR,ENERGIZER HLDGS INC NEW COM,29272W109,3931000.0,195,0.00024633543270152265
FCNCA,FIRST CTZNS BANCSHARES INC DEL CL A,31946M103,3913000.0,2,0.0002452074658257588
EYE,NATIONAL VISION HLDGS INC COM,63845R107,3912000.0,170,0.0002451448009993275
CW,CURTISS WRIGHT CORP COM,231561101,3908000.0,8,0.0002448941416936023
RRR,RED ROCK RESORTS INC CL A,75700L108,3902000.0,75,0.0002445181527350143
AKR,ACADIA RLTY TR COM SH BEN INT,004239109,3900000.0,210,0.00024439282308215166
HTO,H2O AMERICA COM,784305104,3898000.0,75,0.000244267493429289
MATV,MATIV HOLDINGS INC COM,808541106,3887000.0,570,0.00024357818033854452
BHVN,BIOHAVEN LTD COM,G1110E107,3880000.0,275,0.00024313952655352527
WD,WALKER & DUNLOP INC COM,93148P102,3876000.0,55,0.00024288886724779994
TRUP,TRUPANION INC COM,898202106,3875000.0,70,0.00024282620242136864
FRPT,FRESHPET INC COM,358039105,3874000.0,57,0.00024276353759493732
TWST,TWIST BIOSCIENCE CORP COM,90184D100,3863000.0,105,0.0002420742245041928
HOPE,HOPE BANCORP INC COM,43940T109,3863000.0,360,0.0002420742245041928
RUM,RUMBLE INC COM CL A,78137L105,3861000.0,430,0.00024194889485133016
ARCB,ARCBEST CORP COM,03937C105,3851000.0,50,0.00024132224658701692
CUBI,CUSTOMERS BANCORP INC COM,23204G100,3818000.0,65,0.00023925430731478335
MIRM,MIRUM PHARMACEUTICALS INC COM,604749101,3817000.0,75,0.00023919164248835202
FL,FOOT LOCKER INC COM,344849104,3798000.0,155,0.00023800101078615693
BRKL,BROOKLINE BANCORP INC DEL COM,11373M107,3798000.0,360,0.00023800101078615693
LC,LENDINGCLUB CORP COM NEW,52603A208,3789000.0,315,0.00023743702734827505
VCYT,VERACYTE INC COM,92337F107,3784000.0,140,0.00023712370321611845
MNDY,MONDAY COM LTD SHS,M7S64H106,3774000.0,12,0.00023649705495180521
ITT,ITT INC COM,45073V108,3764000.0,24,0.00023587040668749204
SPB,SPECTRUM BRANDS HLDGS INC NEW COM,84790A105,3763000.0,71,0.0002358077418610607
SCHR,SCHWAB INTERMEDIATE-TERM US TREASURY ETF,808524854,3755000.0,150,0.00023530642324961015
VMBS,VANGUARD MORTGAGE-BACKED SECURITIES ETF,92206C771,3754000.0,81,0.0002352437584231788
STOK,STOKE THERAPEUTICS INC COM,86150R107,3746000.0,330,0.00023474243981172824
NHC,NATIONAL HEALTHCARE CORP COM,635906100,3745000.0,35,0.00023467977498529692
GENI,GENIUS SPORTS LIMITED SHARES CL A,G3934V109,3744000.0,360,0.0002346171101588656
FIVN,FIVE9 INC COM,338307101,3707000.0,140,0.0002322985115809067
TROX,TRONOX HOLDINGS PLC SHS,G9087Q102,3701000.0,730,0.00023192252262231881
VYX,NCR VOYIX CORPORATION COM,62886E108,3695000.0,315,0.00023154653366373086
