ticker,nameOfIssuer,cusip,value,shares,allocation_percent
NVDA,NVIDIA CORPORATION COM,67066G104,68498893000.0,433565,4.292471240582625
AAPL,APPLE INC COM,037833100,56697926000.0,276346,3.5529656918058787
JPM,JPMORGAN CHASE & CO. COM,46625H100,42626552000.0,147034,2.671185482445676
MSFT,MICROSOFT CORP COM,594918104,35069258000.0,70504,2.1976089656452134
BRK/B,BERKSHIRE HATHAWAY INC DEL CL B NEW,084670702,31067420000.0,63955,1.946834481968949
GOOGL,ALPHABET INC CAP STK CL A,02079K305,31066329000.0,176283,1.9467661146433124
BX,BLACKSTONE INC COM,09260D107,29721025000.0,198697,1.8624628729859503
PRF,INVESCO RAFI US 1000 ETF,46137V613,26181550000.0,619388,1.6406622864529505
AMZN,AMAZON COM INC COM,023135106,24352745000.0,111002,1.526060538551219
META,META PLATFORMS INC CL A,30303M102,22681180000.0,30730,1.4213122079575478
COST,COSTCO WHSL CORP NEW COM,22160K105,21999351000.0,22223,1.3785855120167068
CVX,CHEVRON CORP NEW COM,166764100,18972967000.0,132502,1.18893768394218
ABBV,ABBVIE INC COM,00287Y109,18950620000.0,102094,1.1875373130659193
JEPI,JPMORGAN EQUITY PREMIUM INCOME ETF,46641Q332,18792609000.0,330565,1.1776355811766799
ORCL,ORACLE CORP COM,68389X105,18744927000.0,85738,1.1746475969227816
GOOG,ALPHABET INC CAP STK CL C,02079K107,18225854000.0,102745,1.1421199774725965
CGDG,CAPITAL GROUP DIVIDEND GROWERS ETF,14021L109,18053388000.0,536824,1.1313124255172924
AMGN,AMGEN INC COM,031162100,16697678000.0,59803,1.0463570936760862
SPY,SPDR S&P 500 ETF TRUST,78462F103,16638831000.0,26930,1.0426694566350823
VIG,VANGUARD DIVIDEND APPRECIATION ETF,921908844,16608789000.0,81149,1.0407868799194324
AVUV,AVANTIS U.S. SMALL CAP VALUE ETF,025072877,16527045000.0,181417,1.0356644063476306
PANW,PALO ALTO NETWORKS INC COM,697435105,15847731000.0,77442,0.9930953124452642
XOM,EXXON MOBIL CORP COM,30231G102,15628742000.0,144979,0.9793724047698956
FYLD,CAMBRIA FOREIGN SHAREHOLDER YIELD ETF,132061300,15488464000.0,529701,0.9705819082477628
JNJ,JOHNSON & JOHNSON COM,478160104,14956644000.0,97916,0.9372555002550578
NFLX,NETFLIX INC COM,64110L106,14747839000.0,11013,0.9241707711720658
HON,HONEYWELL INTL INC COM,438516106,14095540000.0,60527,0.8832945675557415
DLR,DIGITAL RLTY TR INC COM,253868103,14008272000.0,80355,0.8778259334827331
SYLD,CAMBRIA SHAREHOLDER YIELD ETF,132061201,13886289000.0,213537,0.8701818899601612
GD,GENERAL DYNAMICS CORP COM,369550108,13850658000.0,47489,0.8679490795295869
ITW,ILLINOIS TOOL WKS INC COM,452308109,12566740000.0,50826,0.7874925809075382
GE,GE AEROSPACE COM NEW,369604301,12175944000.0,47305,0.7630034173974837
BBIN,JPMORGAN BETABUILDERS INTERNATIONAL EQUITY ETF,46641Q373,12098126000.0,179232,0.7581269659342511
AVGO,BROADCOM INC COM,11135F101,11649593000.0,42262,0.7300197233405313
SYK,STRYKER CORPORATION COM,863667101,11514416000.0,29104,0.7215488800980248
AIG,AMERICAN INTL GROUP INC COM NEW,026874784,11317969000.0,132235,0.709238562940071
JEPQ,JPMORGAN NASDAQ EQUITY PREMIUM INCOME ETF,46654Q203,10947117000.0,201234,0.6859991867283628
V,VISA INC COM CL A,92826C839,10936391000.0,30802,0.6853270438000605
CAT,CATERPILLAR INC COM,149123101,10827648000.0,27891,0.6785126825794393
TMO,THERMO FISHER SCIENTIFIC INC COM,883556102,10675793000.0,26330,0.6689967153617111
CSCO,CISCO SYS INC COM,17275R102,10562082000.0,152235,0.6618710352833792
QCOM,QUALCOMM INC COM,747525103,9963836000.0,62563,0.6243820535301471
HD,HOME DEPOT INC COM,437076102,9956460000.0,27156,0.6239198377703897
VOO,VANGUARD S&P 500 ETF,922908363,9613289000.0,16924,0.6024150866191269
IGSB,ISHARES 1-5 YEAR INVESTMENT GRADE CORPORATE BOND ETF,464288646,9434776000.0,178824,0.5912286004583924
SO,SOUTHERN CO COM,842587107,9076363000.0,98839,0.5687687120226634
CBOE,CBOE GLOBAL MKTS INC COM,12503M108,8664918000.0,37155,0.5429855825116287
UNP,UNION PAC CORP COM,907818108,8613748000.0,37438,0.5397790233431379
HLT,HILTON WORLDWIDE HLDGS INC COM,43300A203,8508764000.0,31947,0.5332002192050721
BAC,VERIZON COMMUNICATIONS INC COM,92343V104,8369406000.0,193423,0.5244673743232561
WMT,WALMART INC COM,931142103,8351085000.0,85407,0.5233192920382078
LLY,ELI LILLY & CO COM,532457108,8268708000.0,10607,0.5181571516312748
IWF,ISHARES RUSSELL 1000 GROWTH ETF,464287614,8058070000.0,18979,0.5049575579214343
RSP,INVESCO S&P 500 EQUAL WEIGHT ETF,46137V357,7624395000.0,41952,0.4777813893188312
PSA,PUBLIC STORAGE OPER CO COM,74460D109,7100471000.0,24199,0.44494978279562786
MCD,MCDONALDS CORP COM,580135101,6913342000.0,23662,0.43322337649036113
EPD,ENTERPRISE PRODS PARTNERS L P COM,293792107,6774197000.0,218452,0.424503879216575
MRK,MERCK & CO INC COM,58933Y105,6716741000.0,84850,0.420903408949137
APO,APOLLO GLOBAL MGMT INC COM,03769M106,6576568000.0,46356,0.41211949223377947
IBM,INTERNATIONAL BUSINESS MACHS COM,459200101,6440648000.0,21849,0.40360208902523437
RPV,INVESCO S&P 500 PURE VALUE ETF,46137V258,6418320000.0,68455,0.4022029087806758
BAC,BANK AMERICA CORP COM,060505104,6339971000.0,133981,0.39729318229460825
JAJL,INNOVATOR EQUITY DEFINED PROTECTION ETF - 6MO JAN/JUL,45783Y244,6231204000.0,221200,0.39047731711815276
ETN,EATON CORP PLC SHS,G29183103,6176641000.0,17302,0.3870581361935806
VXF,VANGUARD EXTENDED MARKET ETF,922908652,6111691000.0,31714,0.38298805571686634
CEG,CONSTELLATION ENERGY CORP COM,21037T109,6108694000.0,18926,0.38280024923205164
CGDV,CAPITAL GROUP DIVIDEND VALUE ETF,14020W106,5949941000.0,150670,0.3728520200416001
TLT,ISHARES 20 YEAR TREASURY BOND ETF,464287432,5866026000.0,66471,0.3675935011316159
MRVL,MARVELL TECHNOLOGY INC COM,573874104,5779601000.0,74672,0.36217769350728896
AMD,ADVANCED MICRO DEVICES INC COM,007903107,5774762000.0,40696,0.3618744584121878
MET,METLIFE INC COM,59156R108,5704290000.0,70931,0.3574583427639197
IWD,ISHARES RUSSELL 1000 VALUE ETF,464287598,5494561000.0,28289,0.3443157113813052
NKE,NIKE INC CL B,654106103,5470706000.0,77009,0.342820841946786
LMT,LOCKHEED MARTIN CORP COM,539830109,5435983000.0,11737,0.34064493117861133
NUE,NUCOR CORP COM,670346105,5404189000.0,41718,0.3386525656870539
PYPL,PAYPAL HLDGS INC COM,70450Y103,5271741000.0,70933,0.3303527347558783
ALL,ALLSTATE CORP COM,020002101,5042467000.0,25048,0.3159853193406636
EMR,EMERSON ELEC CO COM,291011104,4998808000.0,37492,0.31324943568349856
AMT,AMERICAN TOWER CORP NEW COM,03027X100,4911340000.0,22221,0.3077682686452038
CGGO,CAPITAL GROUP GLOBAL GROWTH EQUITY ETF,14020X104,4844990000.0,151548,0.3036104574114856
KKR,KKR & CO INC COM,48251W104,4815300000.0,36197,0.30174993871473976
BJRI,BJS RESTAURANTS INC COM,09180C106,4694596000.0,105260,0.2941860435051736
PSX,PHILLIPS 66 COM,718546104,4645954000.0,38943,0.29113790101790127
EYLD,CAMBRIA EMERGING SHAREHOLDER YIELD ETF,132061706,4555761000.0,126128,0.2854859723275811
RTX,RTX CORPORATION COM,75513E101,4530856000.0,31029,0.2839253048253091
ABT,ABBOTT LABS COM,002824100,4499075000.0,33079,0.2819337539764953
BJUL,INNOVATOR U.S. EQUITY BUFFER ETF - JULY,45782C789,4458498000.0,94600,0.27939100331439154
VTI,VANGUARD TOTAL STOCK MARKET ETF,922908769,4449839000.0,14641,0.27884838858232275
CGSD,CAPITAL GROUP SHORT DURATION INCOME ETF,14020Y409,4214490000.0,162502,0.26410028434653776
BLD,TOPBUILD CORP COM,89055F103,4212181000.0,13011,0.2639555912623079
MMM,3M CO COM,88579Y101,4163770000.0,27350,0.2609219243499412
BA,BOEING CO COM,097023105,4123341000.0,19679,0.25838844808214934
PXH,INVESCO RAFI EMERGING MARKETS ETF,46138E727,4096969000.0,175159,0.25673585127950255
LIN,LINDE PLC SHS,G54950103,4096897000.0,8732,0.2567313394119995
PG,PROCTER AND GAMBLE CO COM,742718109,4093427000.0,25693,0.2565138924642828
DUK,DUKE ENERGY CORP NEW COM NEW,26441C204,4042322000.0,34257,0.2533114065095101
KMI,KINDER MORGAN INC DEL COM,49456B101,3916051000.0,133199,0.2453986562112008
NTNX,NUTANIX INC CL A,67059N108,3886439000.0,50843,0.24354302537091654
CVS,CVS HEALTH CORP COM,126650100,3880778000.0,56259,0.2431882797884888
CMI,CUMMINS INC COM,231021106,3809315000.0,11631,0.23871006329722733
EMXC,ISHARES MSCI EMERGING MARKETS EX CHINA ETF,46434G764,3783615000.0,59924,0.2370995772579424
PFF,ISHARES PREFERRED & INCOME SECURITIES ETF,464288687,3771452000.0,122929,0.23633738497405823
DE,DEERE & CO COM,244199105,3698670000.0,7274,0.23177651357673382
EFA,ISHARES MSCI EAFE ETF,464287465,3550842000.0,39723,0.2225128976150445
MPC,MARATHON PETE CORP COM,56585A102,3452466000.0,20784,0.21634818265003686
VUG,VANGUARD GROWTH ETF,922908736,3430478000.0,7825,0.21497030844646497
UNH,UNITEDHEALTH GROUP INC COM,91324P102,3393659000.0,10878,0.21266305220209017
QQQ,INVESCO QQQ TRUST SERIES I,46090E103,3366120000.0,6102,0.21093732554699807
TSLA,TESLA INC COM,88160R101,3324947000.0,10467,0.20835722664834128
ITB,ISHARES U.S. HOME CONSTRUCTION ETF,464288752,3217626000.0,34535,0.20163197481090547
DIS,DISNEY WALT CO COM,254687106,3188674000.0,25713,0.19981770275606583
PM,PHILIP MORRIS INTL INC COM,718172109,3185818000.0,17492,0.199638732011778
FDX,FEDEX CORP COM,31428X106,3136607000.0,13799,0.19655493323826626
WT,WISDOMTREE INC COM,97717P104,3096055000.0,268988,0.19401374919682335
RVT,ROYCE SMALL CAP TRUST INC COM,780910105,3057733000.0,203172,0.19161230771832227
T,AT&T INC COM,00206R102,3039443000.0,105026,0.1904661680428934
PFE,PFIZER INC COM,717081103,2981913000.0,123016,0.18686106057829951
TSM,TAIWAN SEMICONDUCTOR MFG LTD SPONSORED ADS,874039100,2974848000.0,13135,0.18641833357956222
ED,CONSOLIDATED EDISON INC COM,209115104,2886568000.0,28765,0.18088628270220522
PLTR,PALANTIR TECHNOLOGIES INC CL A,69608A108,2841045000.0,20841,0.1780335918085722
WEC,WEC ENERGY GROUP INC COM,92939U106,2806002000.0,26929,0.17583762829593944
SBUX,STARBUCKS CORP COM,855244109,2803749000.0,30599,0.17569644444198965
CGCP,CAPITAL GROUP CORE PLUS INCOME ETF,14020Y102,2769525000.0,123090,0.17355180342220414
NSC,NORFOLK SOUTHN CORP COM,655844108,2769083000.0,10818,0.17352410556892148
EQT,EQT CORP COM,26884L109,2708176000.0,46436,0.16970737898546903
CGMS,CAPITAL GROUP U.S. MULTI-SECTOR INCOME ETF,14020Y300,2661187000.0,96350,0.16676282145628768
D,DOMINION ENERGY INC COM,25746U109,2660560000.0,47073,0.16672353061011524
IBIT,ISHARES BITCOIN TRUST ETF,46438F101,2613177000.0,42692,0.16375428313931994
CGCB,CAPITAL GROUP CORE BOND ETF,14020Y508,2608636000.0,99188,0.16346972216249533
SHY,ISHARES 1-3 YEAR TREASURY BOND ETF,464287457,2522739000.0,30446,0.15808700156652417
DVN,DEVON ENERGY CORP NEW COM,25179M103,2509211000.0,78881,0.15723927179456124
AXP,AMERICAN EXPRESS CO COM,025816109,2501569000.0,7842,0.1567603871909731
UBER,UBER TECHNOLOGIES INC COM,90353T100,2452764000.0,26289,0.15370203033699248
CIEN,CIENA CORP COM NEW,171779309,2396226000.0,29463,0.15015908638021844
VTR,VENTAS INC COM,92276F100,2387828000.0,37812,0.1496328271678482
BP,BP PLC SPONSORED ADR,055622104,2333762000.0,77974,0.14624479066201243
ORI,OLD REP INTL CORP COM,680223104,2328968000.0,60587,0.14594437548410066
WFC,WELLS FARGO CO NEW COM,949746101,2296720000.0,28666,0.14392356016134342
WM,WASTE MGMT INC DEL COM,94106L109,2251818000.0,9841,0.14110978412492425
VGIT,VANGUARD INTERMEDIATE-TERM TREASURY ETF,92206C706,2247979000.0,37585,0.1408692138562544
PNW,PINNACLE WEST CAP CORP COM,723484101,2215725000.0,24765,0.1388480225445386
PRDO,PERDOCEO ED CORP COM,71363P106,2151329000.0,65810,0.13481265838166723
PEP,PEPSICO INC COM,713448108,2142217000.0,16224,0.13424165648322506
GDDY,GODADDY INC CL A,380237107,2054305000.0,11409,0.12873266626199478
OXY,OCCIDENTAL PETE CORP COM,674599105,2049099000.0,48776,0.1284064331755933
CNI,CANADIAN NATL RY CO COM,136375102,2041994000.0,19627,0.12796119958379878
COP,CONOCOPHILLIPS COM,20825C104,2008776000.0,22384,0.12587959937940316
NVS,NOVARTIS AG SPONSORED ADR,66987V109,2006467000.0,16581,0.12573490629517325
SSNC,SS&C TECHNOLOGIES HLDGS INC COM,78467J100,2004091000.0,24204,0.1255860146675724
STWD,STARWOOD PPTY TR INC COM,85571B105,1912691000.0,95301,0.11985844953174968
KLAC,KLA CORP COM NEW,482480100,1861348000.0,2078,0.11664104934828637
VYM,VANGUARD HIGH DIVIDEND YIELD INDEX ETF,921946406,1843277000.0,13827,0.11550863326984598
GS,GOLDMAN SACHS GROUP INC COM,38141G104,1789903000.0,2529,0.11216396082390065
GLW,CORNING INC COM,219350105,1787008000.0,33980,0.11198254615138196
FANG,DIAMONDBACK ENERGY INC COM,25278X109,1785925000.0,12998,0.11191468014435685
NI,NISOURCE INC COM,65473P105,1766287000.0,43785,0.11068406828289856
PEO,EXELON CORP COM,30161N101,1714916000.0,39496,0.1074649134842952
BK,BANK NEW YORK MELLON CORP COM,064058100,1684549000.0,18489,0.10556197070005525
BMY,BRISTOL-MYERS SQUIBB CO COM,110122108,1683844000.0,36376,0.10551779199742119
TRL,DAVITA INC COM,23918K108,1655981000.0,11625,0.10377176193856529
TEL,TE CONNECTIVITY PLC ORD SHS,G87052109,1623955000.0,9628,0.1017648582072758
ARE,ALEXANDRIA REAL ESTATE EQ INC COM,015271109,1607302000.0,22130,0.10072130085271502
CTRA,COTERRA ENERGY INC COM,127097103,1606884000.0,63313,0.1006951069552667
MA,MASTERCARD INCORPORATED CL A,57636Q104,1600457000.0,2848,0.10029236011579261
KRE,SPDR S&P REGIONAL BANKING ETF,78464A698,1597413000.0,26897,0.10010160838413568
ALLY,ALLY FINL INC COM,02005N100,1578812000.0,40534,0.09893597994768669
BALT,BALTIC TRADING LIMITED COM,45783Y855,1565504000.0,48800,0.09810203643753866
OBDC,BLUE OWL CAPITAL CORPORATION COM,69121K104,1545838000.0,107799,0.09686966996094029
PPL,PPL CORP COM,69351T106,1539521000.0,45427,0.09647381625237365
URI,UNITED RENTALS INC COM,911363109,1530909000.0,2032,0.09593414676714711
IWM,ISHARES RUSSELL 2000 ETF,464287655,1528441000.0,7083,0.09577948997551461
AEE,AMEREN CORP COM,023608102,1508692000.0,15709,0.09454192231832245
MO,ALTRIA GROUP INC COM,02209S103,1508111000.0,25723,0.09450551405416587
J,JACOBS SOLUTIONS INC COM,46982L108,1505365000.0,11452,0.09433343644078544
ACI,ALBERTSONS COS INC COMMON STOCK,013091103,1501850000.0,69821,0.09411316957587935
IGE,ISHARES NORTH AMERICAN NATURAL RESOURCES ETF,464287374,1477509000.0,33390,0.09258784503571457
BRK/A,BERKSHIRE HATHAWAY INC DEL CL A,084670108,1457600000.0,2,0.09134025100629341
SCHW,SCHWAB CHARLES CORP COM,808513105,1441678000.0,15801,0.09034250163985391
MDT,MEDTRONIC PLC SHS,G5960L103,1428875000.0,16392,0.0895402038670537
SPGI,S&P GLOBAL INC COM,78409V104,1387300000.0,2631,0.08693491370817154
WRB,BERKLEY W R CORP COM,084423102,1379987000.0,18783,0.0864766458324793
DPZ,DOMINOS PIZZA INC COM,25754A201,1378385000.0,3059,0.08637625678053631
VNQ,VANGUARD REAL ESTATE ETF,922908553,1368327000.0,15364,0.08574597395629009
CMCSA,COMCAST CORP NEW CL A,20030N101,1365392000.0,38257,0.08556205269071415
KO,COCA COLA CO COM,191216100,1359108000.0,19210,0.08516826692141974
REXR,REXFORD INDL RLTY INC COM,76169C100,1354292000.0,38074,0.08486647311732651
IVW,ISHARES S&P 500 GROWTH ETF,464287309,1348080000.0,12244,0.08447719921553513
BIV,VANGUARD INTERMEDIATE-TERM BOND ETF,921937819,1347650000.0,17425,0.08445025334016966
STX,SEAGATE TECHNOLOGY HLDNGS PLC ORD SHS,G7997R103,1317156000.0,9126,0.08253935212297296
ARCC,ARES CAPITAL CORP COM,04010L103,1310090000.0,59658,0.08209656245940924
UTI,UNIVERSAL TECHNICAL INST INC COM,913915104,1304087000.0,38480,0.08172038550634203
AON,AON PLC SHS CL A,G0403H108,1297536000.0,3637,0.08130986822839044
BSV,VANGUARD SHORT-TERM BOND ETF,921937827,1296456000.0,16473,0.08124219021584461
COWZ,PACER US CASH COWS 100 ETF,69374H881,1294959000.0,23502,0.08114838097067693
8CW,CROWN CASTLE INC COM,22822V101,1285666000.0,12515,0.08056603673865066
KBR,KBR INC COM,48242W106,1280190000.0,26704,0.08022288414911276
OWL,BLUE OWL CAPITAL INC COM CL A,09581B103,1270604000.0,66143,0.07962217912294212
FCX,FREEPORT-MCMORAN INC CL B,35671D857,1269548000.0,29286,0.07955600506623063
IVE,ISHARES S&P 500 VALUE ETF,464287408,1269076000.0,6494,0.07952642726815506
KVUE,KENVUE INC COM,49177J102,1252281000.0,59832,0.07847397150824102
MYD,BLACKROCK MUNIYIELD FD INC COM,09253W104,1247972000.0,124300,0.07820394877114846
MAR,MARRIOTT INTL INC NEW CL A,571903202,1235456000.0,4522,0.07741963580353405
CGGR,CAPITAL GROUP GROWTH ETF,14020G101,1232645000.0,30323,0.0772434849764356
PXF,INVESCO RAFI DEVELOPED MARKETS EX-U.S. ETF,46138E743,1231951000.0,21455,0.07719999558689226
GBTC,GRAYSCALE BITCOIN TRUST ETF,389637109,1229187000.0,14490,0.07702679000663609
MCHP,MICROCHIP TECHNOLOGY INC. COM,595017104,1209308000.0,17185,0.07578107592200786
OKE,ONEOK INC NEW COM,682680103,1198357000.0,14680,0.07509483340775847
JHS,HANCOCK JOHN INCOME SECS TR COM,410123103,1126026000.0,99825,0.07056222384715459
GEV,GE VERNOVA INC COM,36828A101,1110715000.0,2099,0.06960276268966463
IVV,ISHARES CORE S&P 500 ETF,464287200,1086701000.0,1750,0.0680979295477429
VT,VANGUARD TOTAL WORLD STOCK ETF,922042742,1069198000.0,8319,0.0670011070907155
VXUS,VANGUARD TOTAL INTERNATIONAL STOCK ETF,921909768,1068822000.0,15470,0.06697754511597731
NVO,NOVO-NORDISK A S ADR,670100205,1068241000.0,15477,0.06694113685182071
CRM,SALESFORCE INC COM,79466L302,1062276000.0,3896,0.06656734116215789
DHR,DANAHER CORPORATION COM,235851102,1056447000.0,5348,0.06620206788888972
DON,SPDR DOW JONES INDUSTRIAL AVERAGE ETF TRUST,78467X109,1046544000.0,2375,0.06558149811274033
GWW,GRAINGER W W INC COM,384802104,1041280000.0,1001,0.06525163046640586
EW,EDWARDS LIFESCIENCES CORP COM,28176E108,1030104000.0,13171,0.06455128836620942
NEE,NEXTERA ENERGY INC COM,65339F101,1029260000.0,14827,0.0644983992527014
BG,BUNGE GLOBAL SA COM SHS,H11356104,1019797000.0,12703,0.0639054020001818
MSTR,MICROSTRATEGY INC CL A NEW,594972408,1015830000.0,2513,0.06365681063372874
KHC,KRAFT HEINZ CO COM,500754106,1000811000.0,38761,0.06271564760555674
CLF,CLEVELAND-CLIFFS INC NEW COM,185899101,999278000.0,131484,0.06261958242663752
DWD,MORGAN STANLEY COM NEW,617446448,993204000.0,7051,0.06223895627089368
DRI,DARDEN RESTAURANTS INC COM,237194105,988058000.0,4533,0.0619164830740781
TRV,TRAVELERS COMPANIES INC COM,89417E109,985885000.0,3685,0.06178031240624284
SNOW,SNOWFLAKE INC COM SHS,833445109,984588000.0,4400,0.06169903612636142
TECH,BIO-TECHNE CORP COM,09073M104,976315000.0,18976,0.0611806100172951
MDB,MONGODB INC CL A,60937P106,967844000.0,4609,0.06064977627259538
IQI,INVESCO QUALITY MUN INCOME TR COM,46133G107,967434000.0,103138,0.06062408369375854
XLE,ENERGY SELECT SECTOR SPDR FUND,81369Y506,963740000.0,11364,0.06039259982492124
NOC,NORTHROP GRUMMAN CORP COM,666807102,959482000.0,1919,0.06012577299397667
VLO,VALERO ENERGY CORP COM,91913Y100,935429000.0,6959,0.058618495923824114
STT,STATE STR CORP COM,857477103,935154000.0,8794,0.0586012630965555
FITB,FIFTH THIRD BANCORP COM,316773100,933737000.0,22702,0.05851246703750232
CLIP,GLOBAL X 1-3 MONTH T-BILL ETF,37960A438,928885000.0,9250,0.05820841729965755
GNRC,GENERAC HLDGS INC COM,368736104,917260000.0,6405,0.05747993869239345
FLR,FLUOR CORP NEW COM,343412102,910914000.0,17767,0.05708226770386028
K,KELLANOVA COM,487836108,901154000.0,11331,0.05647065899789059
NPKI,NPK INTERNATIONAL INC COM SHS,651718504,897175000.0,105426,0.056221315653520364
N/A,TECNOGLASS INC ORD SHS,G87264100,895984000.0,11582,0.05614668184524066
CNQ,CANADIAN NAT RES LTD COM,136385101,888589000.0,28299,0.055683275453781045
SGOV,ISHARES 0-3 MONTH TREASURY BOND ETF,46436E718,877094000.0,8711,0.05496294327395301
MSI,MOTOROLA SOLUTIONS INC COM NEW,620076307,871614000.0,2073,0.054619540025109374
LYB,LYONDELLBASELL INDUSTRIES N V SHS - A -,N53745100,867293000.0,14990,0.05434876531009963
PRGO,PERRIGO CO PLC SHS,G97822103,857097000.0,32077,0.05370983473980588
COF,CAPITAL ONE FINL CORP COM,14040H105,847849000.0,3985,0.053130310424969025
FTLS,FIRST TRUST LONG/SHORT EQUITY ETF,33739P103,843612000.0,12728,0.052864799555379524
ULTA,ULTA BEAUTY INC COM,90384S303,843479000.0,1803,0.052856465133464155
STBF,PERFORMANCE TRUST SHORT TERM BOND ETF,89834G570,811230000.0,32001,0.05083558714588049
VGM,INVESCO TR INVT GRADE MUNS COM,46131M106,790517000.0,83300,0.04953761059600854
DNP,DNP SELECT INCOME FD INC COM,23325P104,785001000.0,80184,0.049191951413413364
VPU,VANGUARD UTILITIES ETF,92204A876,774879000.0,4390,0.04855765804027554
PNFP,PINNACLE FINL PARTNERS INC COM,72346Q104,771545000.0,6988,0.048348733508953516
EWJ,ISHARES MSCI JAPAN ETF,46434G822,763924000.0,10190,0.04787116486672042
MMU,WESTERN ASSET MANAGED MUNS FD COM,95766M105,763330000.0,77104,0.047833941959820214
ENB,ENBRIDGE INC COM,29250N105,759711000.0,16771,0.04760715795296526
FBTC,FIDELITY WISE ORIGIN BITCOIN FUND,315948109,751920000.0,8000,0.04711893629023884
KMB,KIMBERLY-CLARK CORP COM,494368103,750959000.0,5825,0.04705871539203834
CGMM,CAPITAL GROUP U.S. SMALL AND MID CAP ETF,14022A102,744307000.0,27690,0.04664186896661719
CPT,CAMDEN PPTY TR SH BEN INT,133131102,725724000.0,6440,0.04547736849704396
WTRG,ESSENTIAL UTILS INC COM,29670G102,725121000.0,19524,0.04543958160670587
BLE,BLACKROCK MUNI INCOME TR II COM,09249N101,724326000.0,72144,0.04538976306969297
XBI,SPDR S&P BIOTECH ETF,78464A870,721404000.0,8699,0.04520665644686065
TTD,THE TRADE DESK INC COM CL A,88339J105,713493000.0,9911,0.04471091500496247
ALB,ALBEMARLE CORP COM,012653101,713165000.0,11380,0.044690360941893
ADBE,ADOBE INC COM,00724F101,712774000.0,1842,0.044665858994758355
TGT,TARGET CORP COM,87612E106,707329000.0,7170,0.04432464901483981
TROW,PRICE T ROWE GROUP INC COM,74144T108,706600000.0,7322,0.04427896635637137
AFB,ALLIANCEBERNSTEIN NATL MUN INM COM,01864U106,705967000.0,68474,0.044239299521240345
NTRS,NORTHERN TR CORP COM,665859104,704065000.0,5553,0.04412011102136798
EOG,EOG RES INC COM,26875P101,697685000.0,5833,0.04372030942873615
XNIEX,VIRTUS EQUITY & CONV INCM FD COM,92841M101,692885000.0,28991,0.04341951826186581
PH,PARKER-HANNIFIN CORP COM,701094104,686596000.0,983,0.04302541916843923
XLU,UTILITIES SELECT SECTOR SPDR FUND,81369Y886,686056000.0,8401,0.042991580162166323
INTC,INTEL CORP COM,458140100,685194000.0,30589,0.042937563081782516
SCHD,SCHWAB US DIVIDEND EQUITY ETF,808524797,684002000.0,25811,0.04286286660867639
VKQ,INVESCO MUNICIPAL TRUST COM,46131J103,683505000.0,74700,0.04283172218994002
UPS,UNITED PARCEL SERVICE INC CL B,911312106,682564000.0,6762,0.042772754588268146
ACM,AECOM COM,00766T100,678853000.0,6015,0.042540205417381516
IVZ,INVESCO LTD SHS,G491BT108,678741000.0,43040,0.042533186956821206
CGUS,CAPITAL GROUP CORE EQUITY ETF,14020V108,669857000.0,18139,0.04197647263880536
DEM,WISDOMTREE EMERGING MARKETS HIGH DIVIDEND FUND,97717W315,662238000.0,14622,0.041499029326225116
GLD,SPDR GOLD SHARES,78463V107,660871000.0,2168,0.0414133665084935
ENVX,ENOVIX CORPORATION COM,293594107,660623000.0,63890,0.04139782563153853
EIX,EDISON INTL COM,281020107,649438000.0,12586,0.04069691954790421
XTWO,BONDBLOXX BLOOMBERG TWO YEAR TARGET DURATION US TREASURY ETF,09789C853,637391000.0,12865,0.03994199638388608
BLK,BLACKROCK INC COM,09290D101,635862000.0,606,0.03984618186427259
VKI,INVESCO ADVANTAGE MUN INCOME T SH BEN INT,46132E103,630813000.0,75366,0.03952978715562086
DOW,DOW INC COM,260557103,629959000.0,23790,0.03947627139384851
CAL,CALERES INC COM,129500104,627094000.0,51317,0.039296736666122774
EVN,EATON VANCE MUNI INCOME TRUST SH BEN INT,27826U108,624030000.0,61000,0.03910473163793721
CMG,CHIPOTLE MEXICAN GRILL INC COM,169656105,621581000.0,11070,0.038951265478006904
DIVO,AMPLIFY CWP ENHANCED DIVIDEND INCOME ETF,032108409,613146000.0,14410,0.03842268766705871
AMAT,APPLIED MATLS INC COM,038222105,612058000.0,3343,0.03835450833590143
HODL,VANECK BITCOIN ETF,92189K105,609400000.0,20000,0.03818794522724698
VB,VANGUARD SMALL-CAP ETF,922908751,606386000.0,2559,0.03799907344038298
CRWD,CROWDSTRIKE HLDGS INC CL A,22788C105,597930000.0,1174,0.03746917966807973
CIT,CINTAS CORP COM,172908105,594840000.0,2669,0.03727554535440695
AEP,AMERICAN ELEC PWR CO INC COM,025537101,591233000.0,5698,0.03704951332546917
RSPG,INVESCO S&P 500 EQUAL WEIGHT ENERGY ETF,46137V365,588220000.0,7898,0.036860704203431606
GM,GENERAL MTRS CO COM,37045V100,588060000.0,11950,0.03685067783120259
CME,CME GROUP INC COM,12572Q105,587346000.0,2131,0.03680593514513063
NOW,SERVICENOW INC COM,81762P102,584978000.0,569,0.03665754483614126
ESPO,VANECK VIDEO GAMING AND ESPORTS ETF,92189F114,584944000.0,5340,0.0366554142320426
MAA,MID-AMER APT CMNTYS INC COM,59522J103,582271000.0,3934,0.036487911150991675
RF,REGIONS FINANCIAL CORP NEW COM,7591EP100,578686000.0,24604,0.03626325774823539
SPG,SIMON PPTY GROUP INC NEW COM,828806109,577001000.0,3589,0.03615766751569861
KR,KROGER CO COM,501044101,575346000.0,8021,0.03605395722795478
GMED,GLOBUS MED INC CL A,379577208,575327000.0,9748,0.03605276659625258
DD,DUPONT DE NEMOURS INC COM,26614N102,575009000.0,8383,0.036032839181447424
MPLX,MPLX LP COM UNIT REP LTD,55336V100,574337000.0,11150,0.03599072841808557
MDLZ,MONDELEZ INTL INC CL A,609207105,574117000.0,8513,0.03597694215627069
WMB,WILLIAMS COS INC COM,969457100,568619000.0,9053,0.03563241094055128
VGT,VANGUARD INFORMATION TECHNOLOGY ETF,92204A702,566058000.0,853,0.035471926320060666
EAT,BRINKER INTL INC COM,109641100,564433000.0,3130,0.03537009597710977
NTAP,NETAPP INC COM,64110D104,557257000.0,5230,0.03492041318263861
DLTR,DOLLAR TREE INC COM,256746108,557001000.0,5624,0.03490437098707219
IBB,ISHARES BIOTECHNOLOGY ETF,464287556,556644000.0,4400,0.03488199964403621
JPC,NUVEEN PFD & INCOME OPPORTUNIT COM,67073B106,556588000.0,69400,0.03487849041375606
DGRW,WISDOMTREE US QUALITY DIVIDEND GROWTH FUND,97717X669,555612000.0,6635,0.03481732954315909
CB,CHUBB LIMITED COM,H1467J104,546752000.0,1887,0.03426211918097759
AJG,GALLAGHER ARTHUR J & CO COM,363576109,546125000.0,1706,0.034222828334805146
SHW,SHERWIN WILLIAMS CO COM,824348106,543539000.0,1583,0.03406077709365375
CHTR,CHARTER COMMUNICATIONS INC NEW CL A,16119P108,540856000.0,1323,0.033892647364338516
ADP,AUTOMATIC DATA PROCESSING INC COM,053015103,537850000.0,1744,0.03370427689608597
IEUR,ISHARES CORE MSCI EUROPE ETF,46434V738,529196000.0,7994,0.033161975488149316
NBH,NEUBERGER BERMAN MUN FD INC COM,64124P101,527871000.0,53700,0.03307894459312782
ETHE,GRAYSCALE ETHEREUM TRUST ETF,389638107,527424000.0,25284,0.03305093341571302
PECO,PHILLIPS EDISON & CO INC COMMON STOCK,71844V201,525800000.0,15010,0.03294916573758855
SPLV,INVESCO S&P 500 LOW VOLATILITY ETF,46138E354,524814000.0,7207,0.03288737821872727
