ticker,nameOfIssuer,cusip,value,shares,allocation_percent
NTR,NUTRIEN LTD NPV Common Stock,67077M108,2319741000.0,39831,0.010004807789087893
VCIT,VANGUARD INVESTMENTS Inter-Term Corp Bd Index ETF,92206C870,2290250000.0,27620,0.009877616095485896
KWEB,KRANESHARES TRUST CSI China Internet ETF (USD),500767306,2288094000.0,66650,0.009868317486031964
IEMG,ISHARES INC Core MSCI Emerging Mkts ETF,46434G103,2254606000.0,37558,0.00972388713659167
IXJ,ISHARES TRUST S&P Gbl Healthcare Sector,464287325,2240406000.0,26024,0.009662643975995273
YUMC,YUM CHINA HOLDINGS INC USD0.01 Common Stock,98850P109,2228212000.0,49837,0.009610052490057775
BN,BROOKFIELD CORP Cls A Limited Voting Shs (USD),11271J107,2162825000.0,35013,0.0093280449871059
AME,AMETEK INC NPV Common Stock,031100100,2153604000.0,11901,0.009288275748805941
APG,API GROUP CORP USD0.0001 Common Stock,00187Y100,2093917000.0,41017,0.009030851768065295
NU,NU HOLDINGS LTD USD0.000006666666 Cls A Com,G6683N103,2024934000.0,147590,0.008733335081627176
ABNB,AIRBNB INC USD0.0001 Class A Common Stock,009066101,1999789000.0,15111,0.008624887245486582
COIN,COINBASE GLOBAL INC 0.00001 Class A Common Stock,19260Q107,1947672000.0,5557,0.008400111907401902
KDP,KEURIG DR PEPPER USD0.01 Common Stock,49271V100,1944820000.0,58827,0.00838781152049902
SE,SEA LTD ADS Ea Rep 1 Cls A Shares,81141R100,1941351000.0,12138,0.008372850075139238
XYZ,BLOCK INC USD0.0000001 Cls A Com Stock,852234103,1912772000.0,28158,0.008249591745091036
BALL,BALL CORP NPV Common Stock,058498106,1872676000.0,33387,0.008076661761480251
GIS,GENERAL MILLS INC USD0.10 Common Stock,370334104,1857492000.0,35852,0.008011174708628442
IVE,ISHARES TRUST S&P 500 Value ETF,464287408,1844178000.0,9437,0.007953752776221368
IVW,ISHARES TRUST S&P 500 Growth ETF,464287309,1816650000.0,16500,0.007835027302637028
BA,BOEING CO USD5 Common Stock,097023105,1775557000.0,8474,0.007657797359088594
FMC,FMC CORP USD0.10 Common Stock,302491303,1726988000.0,41365,0.007448324185355746
DXJ,WISDOMTREE TRUST Japan Hedged Equity Fund,97717W851,1710393000.0,14968,0.007376751632531998
ARM,ARM HOLDINGS PLC Spon ADR Each Rep 1 Ord Shs,042068205,1695358000.0,10482,0.007311907201576587
N/A,GOLAR LNG USD1 Common Stock,G9456A100,1692497000.0,41090,0.007299567998586004
ZBH,ZIMMER BIOMET HOLDINGS INC USD0.01 Common Stock,98956P102,1686746000.0,18493,0.007274764518544462
AAXJ,ISHARES INC MSCI All Country Asia Ex Japan,464288182,1679829000.0,20332,0.007244932198696202
LOW,LOWES COS INC USD0.50 Common Stock,548661107,1661806000.0,7490,0.007167200826623747
BLFS,BIOLIFE SOLUTIONS USD0.001 Common Stock,09062W204,1660432000.0,77086,0.00716127490390125
COP,CONOCOPHILLIPS INC USD0.01 Common Stock,20825C104,1652651000.0,18416,0.007127716239633605
TTD,THE TRADE DESK INC USD0.000001 Cls A Common Stock,88339J105,1643819000.0,22834,0.0070896247189020985
STIP,ISHARES TRUST 0-5 Year TIPS Bond ETF,46429B747,1608380000.0,15629,0.0069367799042277505
TPL,TEXAS PACIFIC LAND CORP USD0.01 Common Stock,88262P102,1584585000.0,1500,0.006834154481242449
XPO,XPO LOGISTICS INC USD0.001 Common Stock,983793100,1543895000.0,12225,0.006658662635843335
ASPI,ASP ISOTOPES INC USD0.01 Common Stock,00218A105,1531976000.0,208149,0.006607257197030063
VTI,VANGUARD INDEX FUNDS Total Stock Market ETF,922908769,1528463000.0,5029,0.006592105984130406
CAE,CAE INC NPV Common Stock,124765108,1521000000.0,52000,0.006559918821628228
IJR,ISHARES TRUST Core S&P Sml Cap ETF,464287804,1483502000.0,13574,0.006398193748667402
BF/B,BROWN-FORMAN CORP USD0.15 B Common Stock,115637209,1476524000.0,54869,0.006368098342002497
FEZ,SPDR INDEX SHARES Eurostoxx 50 ETF,78463X202,1449945000.0,24275,0.006253465809221394
CCL,CARNIVAL CORP USD0.001 Common (Paired Stock),143658300,1449417000.0,51544,0.00625118859874288
KHC,KRAFT HEINZ CO NPV Common Stock,500754106,1414161000.0,54770,0.006099133044518472
SBUX,STARBUCKS CORP USD0.001 Common Stock,855244109,1404687000.0,15330,0.006058272642864227
BMY,BRISTOL-MYERS SQUIBB CO NPV Common Stock,110122108,1399531000.0,30234,0.006036035337509648
L,LOEWS CORP USD1 Common Stock,540424108,1374900000.0,15000,0.0059298043312667
TQQQ,PROSHARES TRUST UltraPro QQQ ETF,74347X831,1344019000.0,16193,0.005796617708564069
MMM,3M COMPANY USD0.01 Common Stock,88579Y101,1319768000.0,8669,0.0056920256038018695
WPM,WHEATON PRECIOUS METALS CORP NPV Common Stock,962879102,1253092000.0,13962,0.0054044587745113466
UTHR,UTD THERAPEUTIC COM USD0.01,91307C102,1224111000.0,4260,0.005279466659212459
BXSL,BLACKSTONE SECURED LENDING USD0.001 Common Stock,09261X102,1183044000.0,38473,0.005102348851028497
SDY,SPDR SERIES TRUST S&P Dividend ETF,78464A763,1177457000.0,8675,0.005078252686362859
ADM,ARCHER-DANIELS-MIDLAND CO NPV Common Stock,039483102,1173457000.0,22233,0.005061001091828662
VTV,VANGUARD INDEX FUNDS Value ETF,922908744,1157647000.0,6550,0.004992814164432251
LMNR,LIMONEIRA CORP NPV Common Stock,532746104,1148084000.0,73360,0.00495156991479962
PTCT,PTC THERAPEUTICS INC USD0.001 Common Stock,69366J200,1147740000.0,23500,0.004950086277669679
FPA,FIRST TRUST Asia Pac Ex Jpn AlphaDEX ETF,33737J109,1139929000.0,31904,0.004916398226443026
AMD,ADVANCED MICRO DEVICES INC USD0.01 Common Stock,007903107,1119591000.0,7890,0.004828682494033905
RIO,RIO TINTO PLC ADR Each Rep 1 Ordinary Shares,767204100,1099228000.0,18845,0.004740858939158944
BBVA,BANCO BILBAO VIZCAYA ADS Ea Rep 1 Ord EUR0.49,05946K101,1078589000.0,70175,0.004651845024261123
MDAI,SPECTRAL AI INC USD0.0001 Cls A Common Stock,84757T105,1074291000.0,433182,0.004633308185934129
N/A,AON PLC USD0.01 Cls A Common Stock,G0403H108,1071707000.0,3004,0.004622163655865038
PAAS,PAN AMERICAN SILVER CORP NPV Common Stock,697900108,1069242000.0,37671,0.00461153236073334
LQD,ISHARES TRUST IBOXX USD Inv Grd Corp Bd ETF,464287242,1050392000.0,9583,0.004530234221490939
N/A,NEBIUS GROUP NV USD0.01 Cls A Ordinary Shares,N97284108,1047230000.0,18927,0.004516596836011656
SWK,STANLEY BLACK & DECKER INC USD2.50 Common Stock,854502101,1026683000.0,15154,0.004427979707788122
CMCSA,COMCAST CORP USD1 A Common Stock,20030N101,1019948000.0,28578,0.004398932335491168
VEU,VANGUARD INTL EQUITY FTSE All World Ex US ETF,922042775,1007090000.0,14982,0.004343477084860993
FEM,FIRST TRUST Emerging Markets AlphaDEX ETF,33737J182,995220000.0,40522,0.004292282978080765
CDE,COEUR MINING INC USD1 Common Stock,192108504,966976000.0,109138,0.004170469469074804
BCE,BCE INC NPV Common Stock,05534B760,958627000.0,43318,0.004134461078383302
SLV,ISHARES INC Silver Trust ETF,46428Q109,955755000.0,29130,0.004122074433507749
VHT,VANGUARD WORLD FUNDS Healthcare ETF,92204A504,954370000.0,3843,0.0041161010689002835
TTEK,TETRA TECH INC USD0.01 Common Stock,88162G103,943590000.0,26240,0.004069608021630624
DEM,WISDOMTREE TRUST Emg Mkts High Dividend Fund,97717W315,939993000.0,20755,0.004054094525245748
ACI,ALBERTSONS COMPANIES INC USD0.01 Cls A Com Stk,013091103,935685000.0,43500,0.004035514557932418
FAST,FASTENAL COMPANY USD0.01 Common Stock,311900104,914004000.0,21762,0.003942006602658439
AU,ANGLOGOLD ASHANTI PLC USD1 Ordinary Shares,G0378L100,911313000.0,20058,0.003930400592435559
AAUC,ALLIED GOLD CORP NPV Common Stock (Rev Split),01921D204,894396000.0,66746,0.0038574392862518085
INDA,ISHARES TRUST MSCI India ETF,46429B598,849008000.0,15248,0.00366168544307228
NAKA,KINDLY MD INC NPV Common Stock,49457M106,845583000.0,61075,0.0036469137652523744
N/A,BROOKFIELD INFRASTRUCTURE PRTS Partners L P Shares,G16252101,843932000.0,25192,0.0036397931696083847
PXF,INVESCO EXCHANGE TRADED FD TR RAFI Dev Mkts Ex US ETF,46138E743,838332000.0,14600,0.0036156409372605095
RACE,FERRARI NV EUR0.01 Common Stock,N3167Y103,836711000.0,1705,0.0036086497285755265
COPX,GLOBAL X FUNDS Copper Miners ETF,37954Y830,832230000.0,18494,0.003589323629798593
N/A,INDIVIOR PLC USD0.50 Shares,G4766E116,831677000.0,56015,0.0035869385968542405
AZN,ASTRAZENECA PLC Spon ADR Rep 1 USD0.5 Ord Shs,046353108,820181000.0,11737,0.0035373575141629597
SLF,SUN LIFE FINANCIAL INC NPV Common Stock,866796105,819233000.0,12336,0.0035332688862583545
OXY,OCCIDENTAL PETROLEUM CORP USD0.20 Common Stock,674599105,818144000.0,19475,0.0035285721396464196
FSLR,FIRST SOLAR INC USD0.001 Common Stock,336433107,807669000.0,4879,0.0034833945264599927
ITA*,ISHARES TRUST US Aerospace & Defense ETF,464288760,785496000.0,4164,0.0033877646250583078
URNJ,SPROTT ETFS Junior Uranium Miners ETF,85208P808,778555000.0,36846,0.0033578287956428435
ALL,ALLSTATE CORP NPV Common Stock,020002101,777861000.0,3864,0.0033548356439911603
IEV,ISHARES INC Europe ETF,464287861,777469000.0,12292,0.003353144987726809
TREX,TREX COMPANY INC USD0.01 Common Stock,89531P105,776655000.0,14282,0.0033496342882391
WDFC,WD-40 CO USD0.001 Common Stock,929236107,772084000.0,3385,0.003329920028585147
N/A,WILLIS TOWERS WATSON PLC USD0.000304635 Common Stock,G96629103,772073000.0,2519,0.003329872586700178
SKYY,FIRST TRUST Cloud Computing ETF,33734X192,765358000.0,6292,0.003300911472375896
ADP,AUTO DATA PROCESS USD0.10 Common Stock,053015103,757122000.0,2455,0.003265390439229985
ICLN,ISHARES TRUST S&P Global Clean Energy Index,464288224,754834000.0,57577,0.0032555225271564243
PXH,INVESCO EXCHANGE TRADING II FTSE RAFI Emerging Markets ETF,46138E727,752690000.0,32180,0.003246275672486095
CNI,CANADIAN NATIONAL RAILWAYS CO NPV Common Stock,136375102,744048000.0,7155,0.003209003602494964
LHX,L3 HARRIS TECHNOLOGIES INC USD1.00 Common Stock,502431109,742235000.0,2959,0.0032011843172723388
IR,INGERSOLL RAND INC USD1 Common Stock,45687V106,742215000.0,8923,0.003201098059299668
XENE,XENON PHARMACEUTICALS INC NPV Common Stock,98420N105,740745000.0,23666,0.0031947580983083504
ANET,ARISTA NETWORKS INC USD0.0001 Common Stock (P/R),040413205,738166000.0,7215,0.0031836351327324272
PPG,PPG INDUSTRIES INC USD1.666 Common Stock,693506107,730502000.0,6422,0.0031505810776049073
GDX,VANECK VECTORS ETF Gold Miners ETF,92189F106,725039000.0,13927,0.003127019712369828
TRP,TC ENERGY CORP NPV Common Stock,87807B107,724856000.0,14878,0.0031262304519198885
EXAS,EXACT SCIENCES CORP USD0.01 Common Stock,30063P105,707505000.0,13314,0.0030513973477291774
GBTC,GRAYSCALE BITCOIN TRUST ETF NPV Common Stock,389637109,706633000.0,8330,0.003047636500120723
PEN,PENUMBRA INC USD0.001 Common Stock,70975L107,705732000.0,2750,0.003043750578451895
IXC,ISHARES TRUST Global Energy ETF,464287341,704430000.0,17929,0.003038135184431014
TKR,TIMKEN CO NPV Common Stock,887389104,696480000.0,9600,0.0030038476402942985
IGV,ISHARES TRUST Expanded Tech-Software ETF,464287515,696420000.0,6360,0.003003588866376285
AG,FIRST MAJESTIC SILVER NPV Common Stock,32076V103,696012000.0,84182,0.0030018292037337973
EPS,WISDOMTREE TRUST US LargeCap Fund,97717W588,690667000.0,10790,0.002978776760537477
PSX,PHILLIPS 66 USD0.01 Common Stock,718546104,690150000.0,5785,0.0029765469919439324
N/A,FERROVIAL SE EUR0.01 Shares,N3168P101,688033000.0,12950,0.002967416585536709
DG,DOLLAR GENERAL CORP USD0.875 Common Stock,256677105,683191000.0,5973,0.0029465335303530643
PLD,PROLOGIS INC USD0.01 Common Stock,74340W103,677603000.0,6446,0.0029224330527887915
BH,BIGLARI HOLDINGS INC NPV Cls B Common Stock,08986R309,672083000.0,2300,0.0028986258523316
XSD,SPDR SERIES TRUST S&P Semiconductor ETF,78464A862,658717000.0,2568,0.0028409796491955827
CNQ,CDN NATURAL RESOURCES NPV Common Stock,136385101,657452000.0,20958,0.002835523832424143
GD,GENERAL DYNAMICS CORP USD1 Common Stock,369550108,652151000.0,2236,0.0028126611567676992
ENB,ENBRIDGE INC NPV Common Stock,29250N105,651953000.0,14402,0.0028118072028382565
N/A,ASML HOLDING NV EUR0.09 NY Registry Shs 2012,N07059210,650728000.0,812,0.0028065239020121585
VRNA,VERONA PHARMA Spon ADR Each Rep 8 Ord Shs,925050106,649859000.0,6871,0.0028027759930996043
MDY,SPDR SERIES TRUST S&P MidCap 400 ETF,78467Y107,645787000.0,1140,0.0027852138698637925
LYV,LIVE NATION ENTERTAINMENT INC USD0.01 Common Stock,538034109,635678000.0,4202,0.002741614777577244
EQX,EQUINOX GOLD CORP NPV Com Stk (Post Rev Split),29446Y502,633485000.0,109993,0.002732156590873871
PHK,PIMCO HIGH INCOME FUND USD0.00001 Common Stock,722014107,630720000.0,131400,0.0027202314261521076
FIS,FIDELITY NATIONAL INFORMATION USD0.01 Common Stock,31620M106,628078000.0,7715,0.0027088367479622707
A4S,AMERIPRISE FINANCIAL INC USD0.01 Common Stock,03076C106,627132000.0,1175,0.0027047567458549334
JHG,JANUS HENDERSON GROUP PLC USD1.50 Ordinary Shares,G4474Y214,624158000.0,16070,0.002691930185318758
NIO,NIO INC Spon ADS Each Rep 1 Ord Shares,62914V106,621862000.0,181301,0.0026820277700561296
UL,UNILEVER PLC ADS Ea Rep 1 Ord Share,904767704,619652000.0,10130,0.002672496264075986
FNX,FIRST TRUST Mid Cap Core AlphaDEX ETF,33735B108,618352000.0,5384,0.0026668894958523717
TAC,TRANSALTA CORP MTN NPV Common Shares,89346D107,614019000.0,57012,0.0026482017060732036
SRFM,SURF AIR MOBILITY INC USD0.0001 Com Stk (P-R Split),868927203,596890000.0,161759,0.0025743260653791405
APPS,DIGITAL TURBINE INC USD0.0001 Common Stock,25400W102,595988000.0,101015,0.0025704358308116793
MAG,MAG SILVER CORP NPV Common Stock,55903Q104,591988000.0,27987,0.002553184236277483
7HP,HP INC USD0.01 Common Stock,40434L105,570211000.0,23312,0.0024592622427346833
K,KELLANOVA USD0.25 Common Stock,487836108,565299000.0,7108,0.0024380772846466898
VRTX,VERTEX PHARMACEUTICAL INC USD0.01 Common Stock,92532F100,556945000.0,1251,0.0024020473294620206
ICLR,ICON PLC EUR0.06 Ordinary Shares,G4705A100,549801000.0,3780,0.0023712359816239455
UEC,URANIUM ENERGY CORP USD0.001 Common Stock,916896103,548535000.0,80667,0.0023657758519538725
YUM,YUM BRANDS INC NPV Common Stock,988498101,547525000.0,3695,0.002361419824333988
NAT,NORDIC AMERICAN TANKERS LTD USD0.01 Common Stock,G65773106,541648000.0,205950,0.0023360729190646193
REET,ISHARES TRUST Global REIT ETF,46434V647,530704000.0,21486,0.002288872556419058
ORMP,ORAMED PHARMACEUTICALS INC USD0.001 Common Stock,68403P203,524290000.0,233018,0.0022612096245834736
FTLS,FIRST TRUST Long/Short Equity ETF,33739P103,523678000.0,7901,0.0022585701306197417
SNOW,SNOWFLAKE INC USD0.0001 Class A Common Stock,833445109,515342000.0,2303,0.002222617807610476
QUAL,ISHARES TRUST MSCI USA Quality Factor ETF,46432F339,514821000.0,2816,0.002220370787422397
IMO,IMPERIAL OIL NPV Common Stock,453038408,513972000.0,6483,0.0022167091364825135
IEFA,ISHARES TRUST Core MSCI EAFE ETF,46432F842,509228000.0,6100,0.0021962487453649564
WY,WEYERHAUSER CO USD1.25 Common Stock,962166104,508148000.0,19780,0.0021915908148407237
ASTS,AST SPACEMOBILE INC USD0.0001 Class A Common Stock,00217D100,506085000.0,10830,0.0021826933049597114
DOCU,DOCUSIGN INC USD0.0001 Common Stock,256163106,504104000.0,6472,0.0021741494527666508
SOPH,SOPHIA GENETICS SA CHF0.05 Common Stock,H82027105,503697000.0,162483,0.0021723941030227963
H,HYATT HOTELS CORP USD0.01 Cls A Com Stk,448579102,500226000.0,3582,0.0021574240318657473
SOXX,ISHARES TRUST Semiconductor ETF,464287523,496496000.0,2080,0.0021413369199626093
CTVA,CORTEVA INC USD0.01 Common Stock (WI),22052L104,493612000.0,6623,0.0021288985203034533
MXCT,MAXCYTE INC USD0.01 Ordinary Sh (Delisted),57777K106,493469000.0,237245,0.002128281775798856
FTSM,FIRST TRUST Enhanced Short Maturity ETF,33739Q408,493209000.0,8238,0.002127160422154133
AGI,ALAMOS GOLD INC NPV Class A Common Stock,011532108,481790000.0,18140,0.0020779114326576354
APPF,APPFOLIO INC USD0.0001 Cls A Common Stock,03783C100,460560000.0,2000,0.0019863485946673876
LMND,LEMONADE INC USD0.00001 Common Stock,52567D107,450279000.0,10278,0.0019420076838158689
VXF,VANGUARD INDEX FUNDS Extended Market ETF,922908652,443233000.0,2300,0.0019116190000438818
XPEV,XPENG INC Spon ADS Ea Rep 2 Cl A Shares,98422D105,438918000.0,24548,0.0018930088424401173
ARES,ARES MANAGEMENT CORP USD0.01 Cls A Common Stock,03990B101,435944000.0,2517,0.001880182281903942
IBIT,ISHARES BITCOIN TRUST ETF NPV Common Stock,46438F101,435325000.0,7112,0.0018775125976497754
GLW,CORNING INC USD0.50 Common Stock,219350105,434656000.0,8265,0.001874627268463931
VONG,VANGUARD SCOTTSDAL Russell 1000 Growth Index ETF,92206C680,431340000.0,3950,0.0018603256965950819
IYR,ISHARES TRUST US Real Estate ETF,464287739,430066000.0,4538,0.0018548310637359405
KMI,KINDER MORGAN INC USD0.01 Common Stock,49456B101,423771000.0,14414,0.0018276813668377486
UUUU,ENERGY FUELS INC NPV Common Stock,292671708,419721000.0,72995,0.0018102141273718746
SII,SPROTT INC NPV Common Stock (P/R Split),852066208,418087000.0,6060,0.0018031668510046551
QAI,NEW YORK LIFE INVESTMENTS ETF Hedge Multi-Strat Tracker ETF,45409B107,417542000.0,12919,0.0018008163212493709
APA,APA CORP USD0.625 Common Stock,03743Q108,413354000.0,22600,0.0017827539017720674
STWD,STARWOOD PROPERTY TRUST INC USD0.01 Common Stock,85571B105,411234000.0,20490,0.001773610556668943
LVHI,LEGG MASON ETF Franklin Low Vol Hi Div ETF,52468L505,407460000.0,12518,0.0017573336772259286
MRNA,MODERNA INC USD0.0001 Common Stock,60770K107,403200000.0,14614,0.0017389607290470095
HYLS,FIRST TRUST High Yield Long/Short ETF,33738D408,401166000.0,9595,0.0017301882932263704
LRCX,LAM RESEARCH CORP USD0.001 Com Stock (P/S),512807306,400067000.0,4110,0.0017254484176281
IEF,ISHARES TRUST 7-10 Yr Treasury Bond ETF,464287440,399456000.0,4171,0.0017228132365630015
BTG,B2GOLD CORP NPV Common Stock,11777Q209,396872000.0,109937,0.0017116687064939104
ING,ING GROEP NV Spon ADR Each Rep 1 EUR0.24,456837103,395847000.0,18100,0.0017072479853945226
MXL,MAXLINEAR INC USD0.01 Common Stock,57776J100,395322000.0,27820,0.0017049837136119093
HPE,HEWLETT PACKARD ENTERPRISE CO USD0.01 Common Stock,42824C109,395155000.0,19323,0.0017042634595401066
BOW,BOWHEAD SPECIALTY HLDGS INC USD0.01 Common Stock,10240L102,394065000.0,10500,0.001699562400029538
SU,SUNCOR ENERGY INC New NPV Common Stock (CAD),867224107,390621000.0,10450,0.0016847087771355948
VBR,VANGUARD INDEX FUNDS Small Cap Value ETF,922908611,390020000.0,2000,0.0016821167250568318
PGR,PROGRESSIVE CORP USD1 Common Stock,743315103,389882000.0,1461,0.001681521545045402
DLN,WISDOMTREE TRUST US LargeCap Dividend Fund,97717W307,386058000.0,4700,0.0016650290206707103
CARR,CARRIER GLOBAL CORP USD0.01 Common Stock (WI),14448C104,384759000.0,5257,0.0016594265653457297
VST,VISTRA CORP USD0.01 Common Stock,92840M102,373084000.0,1925,0.0016090734737990438
CPRT,COPART INC USD0.001 Common Stock,217204106,372932000.0,7600,0.0016084179132067442
SCL,STEPAN CO USD1 Common Stock,858586100,362957000.0,6650,0.0015653967493370917
RBLX,ROBLOX CORPORATION USD0.0001 Cls A Common Stock,771049103,358206000.0,3405,0.0015449061679290998
HMY,HARMONY GOLD MINING CO Spon ADR Rep 1 ZAR0.50 Ord Shs,413216300,358120000.0,25635,0.0015445352586466146
N/A,ARCH CAPITAL GROUP LTD USD0.01 Common Stock,G0450A105,356642000.0,3917,0.0015381607944662291
SNRE,SUNRISE COMMUNICATIONS AG ADS Each Rep Class A 1 Ord Shs,867975104,356604000.0,6306,0.001537996904318154
N/A,VERTICAL AEROSPACE LTD USD0.0001 Ord Shs (Pst Rev Sp),G9471C206,356420000.0,52647,0.001537203330969581
ILMN,ILLUMINA INC USD0.01 Common Stock,452327109,352826000.0,3698,0.0015217027732806056
IWD,ISHARES TRUST Russell 1000 Value ETF,464287598,349419000.0,1799,0.0015070087276361035
FTNT,FORTINET INC USD0.001 Common Stock,34959E109,346419000.0,3278,0.0014940700317354562
HOOD,ROBINHOOD MARKETS USD0.0001 Cls A Common Stock,770700102,344090000.0,3675,0.0014840252908179202
IQV,IQVIA HOLDINGS INC USD0.01 Common Stock,46266C105,343703000.0,2181,0.0014823561990467368
CVS,CVS CORP USD0.01 Common Stock,126650100,338898000.0,4913,0.0014616327211125332
PTY,PIMCO CORPORATE & INCOME OPPS USD0.00001 Common Stock,72201B101,333840000.0,24000,0.0014398180798240417
ACWV,ISHARES INC Edge MSCI Min Vol Gbl Mkts ETF,464286525,325593000.0,2746,0.001404249604793162
SIL,GLOBAL X FUNDS Global X Silver Miners ETF,37954Y848,320371000.0,6655,0.0013817276481287684
SOXL,DIREXION SH ETF TRUST Daily Semiconductor Bull 3X,25459W458,318897000.0,12700,0.0013753704355429172
GILD,GILEAD SCIENCES INC USD0.001 Common Stock,375558103,318196000.0,2870,0.001372347093600799
TDG,TRANSDIGM GROUP INC USD0.01 Common Stock,893641100,314772000.0,207,0.001357579728679527
N/A,GARMIN LTD CHF10 Common Stock,H2906T109,314749000.0,1508,0.0013574805320109554
DRD,DRDGOLD LTD Spon ADR Ea Rep 10 NPV Ord Shs,26152H301,314254000.0,23575,0.0013553456471873484
GSK,GSK PLC Spon ADS Each Rep 2 Ord Shares,37733W204,313958000.0,8176,0.0013540690291918179
TRV,THE TRAVELERS CO INC NPV Common Stock,89417E109,311951000.0,1166,0.0013454130416342847
SDVY,FIRST TRUST SMID Cap Rising Div Achvrs ETF,33741X102,311557000.0,8831,0.0013437137595726663
IBRX,IMMUNITYBIO INC USD0.0001 Common Stock,45256X103,309988000.0,117420,0.001336946821616628
ADI,ANALOG DEVICES USD16.666 Common Stock,032654105,308235000.0,1295,0.0013293863103120162
IAG,IAMGOLD CORP NPV Common Stock,450913108,307891000.0,41890,0.0013279026731820753
ONON,ON HOLDING AG CHF0.10 Cls A Shares,H5919C104,305221000.0,5864,0.001316387233830499
TGT,TARGET CORP USD0.0833 Common Stock,87612E106,299600000.0,3037,0.0012921444306113195
DD,DUPONT DE NEMOURS INC USD0.01 Common Stock,26614N102,296720000.0,4326,0.001279723282546698
SHCO,SOHO HOUSE & CO INC USD0.01 Cls A Common Stock,586001109,292897000.0,39850,0.0012632350710706397
BKR,BAKER HUGHES COMPANY USD0.0001 Cls A Common Stock,05722G100,292495000.0,7629,0.001261501285819953
MKC/V,MCCORMICK & CO INC NPV Vtg Common Stock,579780107,283160000.0,3750,0.0012212403770757718
XAR,SPDR SERIES TRUST S&P Aerospace & Defense ETF,78464A631,283081000.0,1342,0.0012208996580837215
EXEL,EXELIXIS INC USD0.001 Common Stock,30161Q104,279744000.0,6347,0.0012065075153435678
SAP,SAP AG Spon ADR Ea Rep 1 Ord Shs,803054204,279467000.0,919,0.0012053128424220749
INDY,ISHARES TRUST India 50 ETF,464289529,278425000.0,5120,0.0012008188020459166
HL,HECLA MINING CO USD0.25 Common Stock,422704106,276162000.0,46104,0.001191058712438195
MPC,MARATHON PETROLEUM CORP USD0.01 Common Stock,56585A102,275576000.0,1659,0.0011885313538389352
FEX,FIRST TRUST Large Cap Core Alphadex ETF,33734K109,272260000.0,2476,0.0011742297819700863
ITOT,ISHARES TRUST Core S&P Total US Stock Market,464287150,270080000.0,2000,0.0011648276629489492
ERO,ERO COPPER CORP NPV Common Stock,296006109,268124000.0,15903,0.0011563916332217271
N/A,BROOKFIELD BUSINESS PARTNERS Unit Ltd Partnership,G16234109,265444000.0,10237,0.0011448330648838154
AIG,AMERICAN INTL GROUP INC NPV Common Stock,026874784,262846000.0,3071,0.0011336281542338547
XLU,SPDR SERIES TRUST Utilities Select Sector ETF,81369Y886,262373000.0,3213,0.001131588153180186
COF,CAPITAL ONE FINANCIAL CORP USD0.01 Common Stock,14040H105,258928000.0,1217,0.0011167302173876092
N/A,AMRIZE AG CHF1000 Shares,H2927K103,257350000.0,5176,0.0011099244633438687
BIDUN,BAIDU INC ADS Each Rep 1 Ord Cls A Share,056752108,254278000.0,2965,0.0010966752387416058
IONQ,IONQ INC USD0.0001 Common Stock,46222L108,253909000.0,5909,0.0010950837791458261
DELL,DELL TECHNOLOGIES INC USD0.01 Class C Common Stock,24703L202,252188000.0,2057,0.0010876612805974881
EBA,EBAY INC USD0.001 Common Stock,278642103,251525000.0,3378,0.0010848018288034452
LTBR,LIGHTBRIDGE CORP USD0.001 Com Stk (P-R Split),53224K302,248494000.0,18586,0.0010717294330451577
HACK,AMPLIFY ETF TRUST Cybersecurity ETF,032108664,246154000.0,2850,0.0010616372502426526
KMX,CARMAX INC USD0.50 Common Stock,143130102,241956000.0,3600,0.0010435317017790135
VIOO,VANGUARD ADMIRAL FUNDS INC S&P Small Cap 600 Index ETF,921932828,240927000.0,2380,0.0010390937290850914
AWC,AMERICAN WATER WORKS USD0.01 Common Stock,030420103,240660000.0,1730,0.0010379421851499336
BP,BP PLC ADR Cnv Into 6 USD0.25 Ord Shs,055622104,240507000.0,8037,0.0010372823116590007
PSIX,POWER SOLUTIONS INTL INC USD0.001 Common Stock,73933G202,238992000.0,3695,0.0010307482702291738
HYG,ISHARES TRUST IBOXX USD High Yld Corp Bd ETF,464288513,237756000.0,2948,0.0010254175275181071
PPTA,PERPETUA RESOURCES CORP NPV Common Stock,714266103,234400000.0,19340,0.0010109434397039161
CCK,CROWN HOLDINGS INC USD5 Common Stock,228368106,231190000.0,2245,0.0009970990350902235
GDXJ,VANECK VECTORS ETF JR Gold Miners ETF,92189F791,231157000.0,3420,0.0009969567094353163
EFA,ISHARES TRUST MSCI EAFE Index Fund,464287465,230626000.0,2580,0.0009946665602609016
NXE,NEXGEN ENERGY LTD NPV Common Stock,65340P106,229643000.0,33131,0.000990426980904123
TLT,ISHARES TRUST 20 Yr Treasury Bond ETF,464287432,226802000.0,2570,0.0009781740358862099
PCAR,PACCAR INC USD1 Common Stock,693718108,225197000.0,2369,0.0009712518335793635
OMC,OMNICOM GROUP INC USD0.15 Common Stock,681919106,224021000.0,3114,0.0009661798647863098
APP,APPLOVIN CORP USD0.00003 Cls A Common Stock,03831W108,223000000.0,637,0.000961776395281456
BHP,BHP GROUP LTD Spon ADR Ea Rep 2 Ord Shs,088606108,221983000.0,4616,0.0009573901773711366
IWB,ISHARES TRUST Russell 1000 ETF,464287622,221739000.0,653,0.0009563378301045507
DPZ,DOMINOS PIZZA INC USD0.01 Common Stock,25754A201,218541000.0,485,0.0009425451802744605
N/A,GREENLIGHT CAPITAL RE LTD USD0.10 Class A Common Stock,G4095J109,217489000.0,15135,0.0009380080109119669
CNTA,CENTESSA PHARMACEUTICALS PLC Spon ADS Eh Rep 1 Ord Shs,152309100,216810000.0,16500,0.000935079552739787
KALV,KALVISTA PHARMACEUTICALS INC USD0.001 Common Stock,483497103,215043000.0,19022,0.0009274586608543057
VUG,VANGUARD INDEX FUNDS Growth ETF,922908736,214816000.0,490,0.00092647963286449
SEDG,SOLAREDGE TECHNOLOGIES INC USD0.0001 Common Stock,83417M104,214506000.0,10515,0.0009251426342880897
RGLD,ROYAL GOLD INC USD0.01 Common Stock,780287108,213408000.0,1200,0.0009204070715884529
VTRS,VIATRIS INC USD0.01 Common Stock,92556V106,213337000.0,23890,0.0009201008557854709
APO,APOLLO GLOBAL MANAGEMENT INC USD0.00001 Common Stock,03769M106,212805000.0,1500,0.0009178063937124227
ORLA,ORLA MINING LTD NPV Common Stock,68634K106,210128000.0,20950,0.0009062607640704116
LMBS,FIRST TRUST Low Dur Mortgage Opps ETF,33739Q200,209552000.0,4254,0.0009037765344574874
WAT,WATERS CORP USD0.01 Common Stock,941848103,209074000.0,599,0.000901714968910651
