ticker,nameOfIssuer,cusip,value,shares,allocation_percent
OUT,OUTFRONT MEDIA INC          COM NEW,69007J304,948000.0,58081,0.0039380997189991385
VRNT,VERINT SYS INC              COM,92343X100,947000.0,48125,0.0039339456053715015
REAL 1 03/01/28,THE REALREAL INC            NOTE  1.000 3/0,88339PAD3,945000.0,11860,0.003925637378116229
CHRD,CHORD ENERGY CORPORATION    COM NEW,674215207,944000.0,9746,0.003921483264488593
OLLI,OLLIES BARGAIN OUTLET HLDGS COM,681116109,944000.0,7167,0.003921483264488593
FLS,FLOWSERVE CORP              COM,34354P105,941000.0,17968,0.003909020923605684
MCHI,ISHARES TR                  MSCI CHINA ETF,46429B671,941000.0,17080,0.003909020923605684
N/A,DISNEY WALT CO,254687906,941000.0,191500,0.003909020923605684
UGP,ULTRAPAR PARTICIPACOES SA   SP ADR REP COM,90400P101,938000.0,285874,0.0038965585827227755
ROK,ROCKWELL AUTOMATION INC     COM,773903109,937000.0,2822,0.0038924044690951394
ICFI,ICF INTL INC                COM,44925C103,937000.0,11062,0.0038924044690951394
MLI,MUELLER INDS INC            COM,624756102,937000.0,11786,0.0038924044690951394
N/A,AFLAC INC,001055902,933000.0,150000,0.003875788014584594
GATX,GATX CORP                   COM,361448103,930000.0,6056,0.003863325673701686
TXG,10X GENOMICS INC            CL A COM,88025U109,927000.0,80040,0.003850863332818777
EFSC,ENTERPRISE FINL SVCS CORP   COM,293712105,923000.0,16743,0.0038342468783082325
BG,BUNGE GLOBAL SA             COM SHS,H11356104,923000.0,11502,0.0038342468783082325
AME,AMETEK INC                  COM,031100100,921000.0,5092,0.00382593865105296
LIT,GLOBAL X FDS                LITHIUM BTRY ETF,37954Y855,917000.0,23873,0.003809322196542415
AMBA,AMBARELLA INC               SHS,G037AX101,916000.0,13871,0.0038051680829147786
ROOT,ROOT INC                    CL A NEW,77664L207,915000.0,7147,0.0038010139692871425
CVLT,COMMVAULT SYS INC           COM,204166102,910000.0,5220,0.0037802434011489612
RIO,RIO TINTO PLC               SPONSORED ADR,767204100,910000.0,15597,0.0037802434011489612
CVBF,CVB FINL CORP               COM,126600105,908000.0,45878,0.003771935173893689
BEPC,BROOKFIELD RENEWABLE CORP   CL A  EX SUB VTG,11285B108,908000.0,27691,0.003771935173893689
TPH,TRI POINTE HOMES INC        COM,87265H109,907000.0,28400,0.003767781060266053
FROG,JFROG LTD                   ORD SHS,M6191J100,905000.0,20629,0.0037594728330107804
BANC,BANC OF CALIFORNIA INC      COM,05990K106,901000.0,64137,0.0037428563785002356
WMK,WEIS MKTS INC               COM,948849104,900000.0,12409,0.0037387022648725995
HWC,HANCOCK WHITNEY CORPORATION COM,410120109,899000.0,15658,0.003734548151244963
DLB,DOLBY LABORATORIES INC      COM CL A,25659T107,897000.0,12079,0.0037262399239896904
ARMK,ARAMARK                     COM,03852U106,897000.0,21427,0.0037262399239896904
G,GENPACT LIMITED             SHS,G3922B107,896000.0,20368,0.0037220858103620543
ARRY,ARRAY TECHNOLOGIES INC      COM SHS,04271T100,896000.0,151833,0.0037220858103620543
CHE,CHEMED CORP NEW             COM,16359R103,894000.0,1835,0.003713777583106782
VGSH,VANGUARD SCOTTSDALE FDS     SHORT TERM TREAS,92206C102,893000.0,15193,0.003709623469479146
OVV,OVINTIV INC                 COM,69047Q102,891000.0,23410,0.003701315242223873
WBTN,WEBTOON ENTMT INC           COM,94845U105,889000.0,97890,0.003693007014968601
GPK,GRAPHIC PACKAGING HLDG CO   COM,388689101,887000.0,42080,0.0036846987877133287
BHP,BHP GROUP LTD               SPONSORED ADS,088606108,887000.0,18450,0.0036846987877133287
ENOV 3.875 10/15/28,ENOVIS CORPORATION          NOTE  3.87510/1,194014AB2,886000.0,9000,0.0036805446740856918
APOG,APOGEE ENTERPRISES INC      COM,037598109,883000.0,21759,0.0036680823332027835
MRX,MAREX GROUP PLC             ORD,G5S37H101,883000.0,22365,0.0036680823332027835
SMH,VANECK ETF TRUST            SEMICONDUCTR ETF,92189F676,883000.0,3166,0.0036680823332027835
OMC,OMNICOM GROUP INC           COM,681919106,882000.0,12254,0.0036639282195751475
FHN,FIRST HORIZON CORPORATION   COM,320517105,882000.0,41625,0.0036639282195751475
FNB,F N B CORP                  COM,302520101,882000.0,60478,0.0036639282195751475
KNF,KNIFE RIVER CORP            COMMON STOCK,498894104,881000.0,10789,0.0036597741059475114
HAE,HAEMONETICS CORP MASS       COM,405024100,880000.0,11794,0.0036556199923198744
NJR,NEW JERSEY RES CORP         COM,646025106,880000.0,19637,0.0036556199923198744
HSY,HERSHEY CO                  COM,427866108,878000.0,5290,0.0036473117650646023
PMT 8.5 06/01/29,PENNYMAC CORP               NOTE  8.500 6/0,70932AAH6,877000.0,8770,0.003643157651436966
SNDR,SCHNEIDER NATIONAL INC      CL B,80689H102,875000.0,36230,0.003634849424181694
BFAM,BRIGHT HORIZONS FAM SOL IN D COM,109194100,875000.0,7076,0.003634849424181694
ASB,ASSOCIATED BANC CORP        COM,045487105,875000.0,35869,0.003634849424181694
JKS,JINKOSOLAR HLDG CO LTD      SPONSORED ADR,47759T100,872000.0,41094,0.003622387083298785
FIBK,FIRST INTST BANCSYSTEM INC  COM,32055Y201,871000.0,30226,0.003618232969671149
RXST,RXSIGHT INC                 COM,78349D107,866000.0,66600,0.0035974624015329675
UPWK,UPWORK INC                  COM,91688F104,865000.0,64335,0.0035933082879053314
NFG,NATIONAL FUEL GAS CO        COM,636180101,863000.0,10191,0.0035850000606500593
LDOS,LEIDOS HOLDINGS INC         COM,525327102,862000.0,5467,0.0035808459470224223
EXAS,EXACT SCIENCES CORP         COM,30063P105,859000.0,16163,0.003568383606139514
CUZ,COUSINS PPTYS INC           COM NEW,222795502,859000.0,28614,0.003568383606139514
BHB,BAR HBR BANKSHARES          COM,066849100,859000.0,28669,0.003568383606139514
CLVT,CLARIVATE PLC               ORD SHS,G21810109,858000.0,199571,0.003564229492511878
0J7Q,IAC INC                     COM NEW,44891N208,858000.0,22966,0.003564229492511878
STLD,STEEL DYNAMICS INC          COM,858119100,858000.0,6699,0.003564229492511878
ELS,EQUITY LIFESTYLE PPTYS INC  COM,29472R108,857000.0,13902,0.003560075378884242
N/A,LAM RESEARCH CORP,512807906,854000.0,47800,0.003547613038001333
SEALTD 0.25 09/15/26,SEA LTD                     NOTE  0.250 9/1,81141RAG5,852000.0,9000,0.0035393048107460606
AWN,ADVANCE AUTO PARTS INC      COM,00751Y106,851000.0,18304,0.0035351506971184245
STRL,STERLING INFRASTRUCTURE INC COM,859241101,848000.0,3674,0.0035226883562355154
URBN,URBAN OUTFITTERS INC        COM,917047102,848000.0,11693,0.0035226883562355154
ES,EVERSOURCE ENERGY           COM,30040W108,848000.0,13323,0.0035226883562355154
OWL,BLUE OWL CAPITAL INC        COM CL A,09581B103,847000.0,44072,0.0035185342426078793
GL,GLOBE LIFE INC              COM,37959E102,845000.0,6800,0.003510226015352607
AVB,AVALONBAY CMNTYS INC        COM,053484101,845000.0,4150,0.003510226015352607
TRV,TRAVELERS COMPANIES INC     COM,89417E109,844000.0,3153,0.003506071901724971
COUR,COURSERA INC                COM,22266M104,844000.0,96307,0.003506071901724971
XRT,SPDR SERIES TRUST           S&P RETAIL ETF,78464A714,844000.0,10954,0.003506071901724971
PRLB,PROTO LABS INC              COM,743713109,844000.0,21070,0.003506071901724971
PARR,PAR PAC HOLDINGS INC        COM NEW,69888T207,843000.0,31775,0.003501917788097334
IDA,IDACORP INC                 COM,451107106,843000.0,7303,0.003501917788097334
GLPI,GAMING & LEISURE PPTYS INC  COM,36467J108,842000.0,18028,0.003497763674469698
CSV,CARRIAGE SVCS INC           COM,143905107,841000.0,18382,0.003493609560842062
N/A,ABBVIE INC,00287Y909,840000.0,96200,0.003489455447214426
NDSN,NORDSON CORP                COM,655663102,839000.0,3913,0.00348530133358679
LH,LABCORP HOLDINGS INC        COM SHS,504922105,838000.0,3194,0.0034811472199591537
GLDD,GREAT LAKES DREDGE & DOCK CO COM,390607109,837000.0,68660,0.0034769931063315168
PAVE,GLOBAL X FDS                US INFR DEV ETF,37954Y673,834000.0,19134,0.0034645307654486085
PLAB,PHOTRONICS INC              COM,719405102,832000.0,44204,0.0034562225381933364
HRL,HORMEL FOODS CORP           COM,440452100,827000.0,27332,0.003435451970055155
N/A,ALPHABET INC,02079K955,824000.0,880000,0.003422989629172246
DKNG,DRAFTKINGS INC NEW          COM CL A,26142V105,824000.0,19215,0.003422989629172246
REKR,REKOR SYSTEMS INC           COM,759419104,822000.0,708987,0.003414681401916974
DBX 0 03/01/26,DROPBOX INC                 NOTE         3/0,26210CAC8,821000.0,8300,0.0034105272882893377
ITT,ITT INC                     COM,45073V108,816000.0,5203,0.0033897567201511564
WST,WEST PHARMACEUTICAL SVSC INC COM,955306105,813000.0,3718,0.0033772943792682478
NIC,NICOLET BANKSHARES INC      COM,65406E102,813000.0,6586,0.0033772943792682478
SAND,SANDSTORM GOLD LTD          COM NEW,80013R206,811000.0,86246,0.003368986152012975
AL,AIR LEASE CORP              CL A,00912X302,809000.0,13838,0.003360677924757703
CIEN,CIENA CORP                  COM NEW,171779309,809000.0,9946,0.003360677924757703
BOW,BOWHEAD SPECIALTY HLDGS INC COM SHS,10240L102,808000.0,21528,0.003356523811130067
TPR,TAPESTRY INC                COM,876030107,808000.0,9199,0.003356523811130067
MRCY,MERCURY SYS INC             COM,589378108,804000.0,14919,0.0033399073566195217
NEU,NEWMARKET CORP              COM,651587107,803000.0,1163,0.0033357532429918856
AMRX,AMNEAL PHARMACEUTICALS INC  COM STK CL A,03168L105,802000.0,99129,0.0033315991293642495
EWM,ISHARES INC                 MSCI MLY ETF NEW,46434G814,800000.0,32870,0.003323290902108977
GES,GUESS INC                   COM,401617105,795000.0,65789,0.003302520333970796
WBS,WEBSTER FINL CORP           COM,947890109,794000.0,14541,0.0032983662203431596
ASPN,ASPEN AEROGELS INC          COM,04523Y105,792000.0,133821,0.0032900579930878874
N/A,BAIDU INC,056752908,792000.0,94900,0.0032900579930878874
NNI,NELNET INC                  CL A,64031N108,791000.0,6528,0.0032859038794602513
BATRK,ATLANTA BRAVES HLDGS INC    COM SER C,047726302,791000.0,16905,0.0032859038794602513
SAIC,SCIENCE APPLICATIONS INTL CO COM,808625107,787000.0,6991,0.003269287424949706
EWS,ISHARES INC                 MSCI SINGPOR ETF,46434G780,787000.0,30289,0.003269287424949706
RXRX,RECURSION PHARMACEUTICALS IN CL A,75629V104,785000.0,155231,0.003260979197694434
TDOC 1.25 06/01/27,TELADOC HEALTH INC          NOTE  1.250 6/0,87918AAF2,784000.0,8500,0.003256825084066798
N/A,BOOKING HOLDINGS INC,09857L958,783000.0,7500,0.0032526709704391614
APLS,APELLIS PHARMACEUTICALS INC COM,03753U106,781000.0,45103,0.0032443627431838888
ARW,ARROW ELECTRS INC           COM,042735100,778000.0,6108,0.0032319004023009805
N/A,AMPHENOL CORP NEW,032095901,776000.0,170000,0.0032235921750457075
PHG,KONINKLIJKE PHILIPS N V     NY REGIS SHS NEW,500472303,775000.0,32301,0.0032194380614180714
PRM,PERIMETER SOLUTIONS INC     COMMON STOCK,71385M107,774000.0,55619,0.0032152839477904353
FSLY,FASTLY INC                  CL A,31188V100,774000.0,109566,0.0032152839477904353
QD,QUDIAN INC                  ADR,747798106,772000.0,245740,0.003206975720535163
GDYN,GRID DYNAMICS HLDGS INC     CL A,39813G109,772000.0,66873,0.003206975720535163
HMN,HORACE MANN EDUCATORS CORP N COM,440327104,772000.0,17976,0.003206975720535163
EQH,EQUITABLE HLDGS INC         COM,29452E101,771000.0,13739,0.003202821606907527
FHB,FIRST HAWAIIAN INC          COM,32051X108,770000.0,30835,0.00319866749327989
MZTI,LANCASTER COLONY CORP       COM,513847103,769000.0,4452,0.003194513379652254
N/A,BROOKFIELD INFRAST PARTNERS LP INT UNIT,G16252101,768000.0,22940,0.003190359266024618
ARKG,ARK ETF TR                  GENOMIC REV ETF,00214Q302,766000.0,31472,0.003182051038769346
NCLH,NORWEGIAN CRUISE LINE HLDG L SHS,G66721104,764000.0,37680,0.0031737428115140728
FIVN,FIVE9 INC                   COM,338307101,762000.0,28770,0.0031654345842588006
EPRT,ESSENTIAL PPTYS RLTY TR INC COM,29670E107,762000.0,23872,0.0031654345842588006
HNI,HNI CORP                    COM,404251100,754000.0,15330,0.003132201675237711
N/A,MCDONALDS CORP,580135901,754000.0,57700,0.003132201675237711
SKWD,SKYWARD SPECIALTY INS GROUP COM,830940102,754000.0,13048,0.003132201675237711
NTRA,NATERA INC                  COM,632307104,752000.0,4452,0.003123893447982438
OPCH,OPTION CARE HEALTH INC      COM NEW,68404L201,751000.0,23117,0.003119739334354802
DT,DYNATRACE INC               COM NEW,268150109,750000.0,13593,0.003115585220727166
ALE,ALLETE INC                  COM NEW,018522300,748000.0,11669,0.0031072769934718937
AZZ,AZZ INC                     COM,002474104,748000.0,7917,0.0031072769934718937
OI,O-I GLASS INC               COM,67098H104,748000.0,50725,0.0031072769934718937
OTIS,OTIS WORLDWIDE CORP         COM,68902V107,746000.0,7537,0.0030989687662166207
TROX,TRONOX HOLDINGS PLC         SHS,G9087Q102,746000.0,147058,0.0030989687662166207
DOCS,DOXIMITY INC                CL A,26622P107,746000.0,12156,0.0030989687662166207
LNW,LIGHT & WONDER INC          COM,80874P109,746000.0,7752,0.0030989687662166207
BTG,B2GOLD CORP                 COM,11777Q209,745000.0,206316,0.0030948146525889846
CVCO,CAVCO INDS INC DEL          COM,149568107,745000.0,1714,0.0030948146525889846
ALGT,ALLEGIANT TRAVEL CO         COM,01748X102,744000.0,13538,0.0030906605389613485
QNST,QUINSTREET INC              COM,74874Q100,744000.0,46215,0.0030906605389613485
MAGS,LISTED FDS TR               ROUNDHILL MAGNIF,53656G498,743000.0,13390,0.0030865064253337124
NXST,NEXSTAR MEDIA GROUP INC     COMMON STOCK,65336K103,743000.0,4297,0.0030865064253337124
RRC,RANGE RES CORP              COM,75281A109,741000.0,18208,0.0030781981980784402
GPI,GROUP 1 AUTOMOTIVE INC      COM,398905109,741000.0,1696,0.0030781981980784402
TYL 0.25 03/15/26,TYLER TEX INDPT SCH DIST    NOTE  0.250 3/1,902252AB1,740000.0,6070,0.0030740440844508033
WY,WEYERHAEUSER CO MTN BE      COM NEW,962166104,739000.0,28769,0.003069889970823167
AEO,AMERICAN EAGLE OUTFITTERS IN COM,02553E106,738000.0,76763,0.003065735857195531
TMP,TOMPKINS FINL CORP          COM,890110109,738000.0,11772,0.003065735857195531
AGM,FEDERAL AGRIC MTG CORP      CL C,313148306,735000.0,3784,0.003053273516312623
N/A,MCKESSON CORP,58155Q903,735000.0,26000,0.003053273516312623
AWG,ASBURY AUTOMOTIVE GROUP INC COM,043436104,734000.0,3077,0.0030491194026849864
CNA,CNA FINL CORP               COM,126117100,733000.0,15749,0.0030449652890573503
ENPH 0 03/01/28,ENPHASE ENERGY INC          NOTE         3/0,29355AAK3,733000.0,8990,0.0030449652890573503
SNY,SANOFI                      SPONSORED ADR,80105N105,733000.0,15174,0.0030449652890573503
N/A,ARISTA NETWORKS INC,040413955,732000.0,102100,0.0030408111754297138
GEN,GEN DIGITAL INC             COM,668771108,731000.0,24880,0.0030366570618020777
ELVN,ENLIVEN THERAPEUTICS INC    COM,29337E102,730000.0,36373,0.0030325029481744416
WCC,WESCO INTL INC              COM,95082P105,730000.0,3942,0.0030325029481744416
KMT,KENNAMETAL INC              COM,489170100,729000.0,31757,0.003028348834546805
CHDN,CHURCHILL DOWNS INC         COM,171484108,729000.0,7215,0.003028348834546805
PHM,PULTE GROUP INC             COM,745867101,729000.0,6912,0.003028348834546805
SBAC,SBA COMMUNICATIONS CORP NEW CL A,78410G104,729000.0,3104,0.003028348834546805
LMND,LEMONADE INC                COM,52567D107,728000.0,16619,0.003024194720919169
ALLY,ALLY FINL INC               COM,02005N100,728000.0,18682,0.003024194720919169
EEFT,EURONET WORLDWIDE INC       COM,298736109,728000.0,7182,0.003024194720919169
OSW,ONESPAWORLD HOLDINGS LIMITED COM,P73684113,726000.0,35603,0.0030158864936638964
WEN,WENDYS CO                   COM,95058W100,725000.0,63507,0.0030117323800362603
CRTO,CRITEO S A                  SPONS ADS,226718104,725000.0,30265,0.0030117323800362603
TGS,TRANSPORTADORA DE GAS SUR   SPONSORED ADS B,893870204,724000.0,27953,0.0030075782664086242
AZN,ASTRAZENECA PLC             SPONSORED ADR,046353108,721000.0,10321,0.0029951159255257155
ENSG,ENSIGN GROUP INC            COM,29358P101,720000.0,4669,0.002990961811898079
THFF,FIRST FINANCIAL CORPORATION COM,320218100,719000.0,13267,0.002986807698270443
EMN,EASTMAN CHEM CO             COM,277432100,716000.0,9586,0.0029743453573875343
EXP,EAGLE MATLS INC             COM,26969P108,716000.0,3543,0.0029743453573875343
TTEK,TETRA TECH INC NEW          COM,88162G103,715000.0,19873,0.002970191243759898
ZION,ZIONS BANCORPORATION N A    COM,989701107,714000.0,13746,0.0029660371301322617
SMTC,SEMTECH CORP                COM,816850101,714000.0,15816,0.0029660371301322617
LITE,LUMENTUM HLDGS INC          COM,55024U109,714000.0,7508,0.0029660371301322617
TNET,TRINET GROUP INC            COM,896288107,713000.0,9753,0.0029618830165046256
SMP,STANDARD MTR PRODS INC      COM,853666105,712000.0,23188,0.0029577289028769895
EVRG,EVERGY INC                  COM,30034W106,712000.0,10328,0.0029577289028769895
AUPH,AURINIA PHARMACEUTICALS INC COM,05156V102,712000.0,84092,0.0029577289028769895
ST,SENSATA TECHNOLOGIES HLDG PL SHS,G8060N102,711000.0,23619,0.002953574789249353
PRK,PARK NATL CORP              COM,700658107,710000.0,4247,0.002949420675621717
OC,OWENS CORNING NEW           COM,690742101,708000.0,5146,0.0029411124483664447
BOKF,BOK FINL CORP               COM NEW,05561Q201,708000.0,7255,0.0029411124483664447
MTDR,MATADOR RES CO              COM,576485205,708000.0,14844,0.0029411124483664447
CMS,CMS ENERGY CORP             COM,125896100,707000.0,10199,0.002936958334738808
BYND,BEYOND MEAT INC             COM,08862E109,704000.0,201838,0.0029244959938558995
SKM,SK TELECOM CO LTD           SPONSORED ADR,78440P306,704000.0,30163,0.0029244959938558995
BRX,BRIXMOR PPTY GROUP INC      COM,11120U105,704000.0,27046,0.0029244959938558995
HTHT,H WORLD GROUP LTD           SPONSORED ADS,44332N106,704000.0,20745,0.0029244959938558995
N/A,NUTRIEN LTD,67077M908,704000.0,94400,0.0029244959938558995
LNTH,LANTHEUS HLDGS INC          COM,516544103,702000.0,8581,0.0029161877666006274
LQDA,LIQUIDIA CORPORATION        COM NEW,53635D202,702000.0,56363,0.0029161877666006274
AXSM,AXSOME THERAPEUTICS INC     COM,05464T104,702000.0,6729,0.0029161877666006274
VECO,VEECO INSTRS INC DEL        COM,922417100,702000.0,34525,0.0029161877666006274
N/A,SCHWAB CHARLES CORP,808513955,701000.0,170000,0.0029120336529729913
USFD,US FOODS HLDG CORP          COM,912008109,700000.0,9095,0.0029078795393453548
VOYA,VOYA FINANCIAL INC          COM,929089100,696000.0,9798,0.00289126308483481
OLO,OLO INC                     CL A,68134L109,692000.0,77800,0.0028746466303242652
FULT,FULTON FINL CORP PA         COM,360271100,690000.0,38229,0.0028663384030689926
MET,METLIFE INC                 COM,59156R108,689000.0,8567,0.0028621842894413566
EVR,EVERCORE INC                CLASS A,29977A105,689000.0,2551,0.0028621842894413566
ITRN,ITURAN LOCATION AND CONTROL SHS,M6158M104,688000.0,17767,0.0028580301758137205
PRA,PROASSURANCE CORP           COM,74267C106,686000.0,30059,0.002849721948558448
CXM,SPRINKLR INC                CL A,85208T107,682000.0,80588,0.002833105494047903
PPBI,PACIFIC PREMIER BANCORP     COM,69478X105,681000.0,32279,0.002828951380420267
GREK,GLOBAL X FDS                MSCI GREECE ETF,37954Y319,680000.0,11716,0.0028247972667926305
FSM,FORTUNA MNG CORP            COM NEW,349942102,679000.0,103809,0.0028206431531649944
ZBRA,ZEBRA TECHNOLOGIES CORPORATI CL A,989207105,678000.0,2198,0.0028164890395373583
ADUS,ADDUS HOMECARE CORP         COM,006739106,677000.0,5878,0.002812334925909722
N/A,NOBLE CORP PLC              W EXP 02/04/202,G65431135,677000.0,34812,0.002812334925909722
SUPN,SUPERNUS PHARMACEUTICALS INC COM,868459108,675000.0,21423,0.0028040266986544497
PJT,PJT PARTNERS INC            COM CL A,69343T107,675000.0,4091,0.0028040266986544497
ORRF,ORRSTOWN FINL SVCS INC      COM,687380105,675000.0,21222,0.0028040266986544497
N/A,AES CORP,00130H905,670000.0,1760000,0.0027832561305162684
SEI,SOLARIS ENERGY INFRAS INC   COM CL A,83418M103,667000.0,23562,0.0027707937896333597
EPR,EPR PPTYS                   COM SH BEN INT,26884U109,667000.0,11450,0.0027707937896333597
SDGR,SCHRODINGER INC             COM,80810D103,667000.0,33173,0.0027707937896333597
SIRI,SIRIUSXM HOLDINGS INC       COMMON STOCK,829933100,666000.0,28977,0.0027666396760057236
UI,UBIQUITI INC                COM,90353W103,666000.0,1617,0.0027666396760057236
CRDO,CREDO TECHNOLOGY GROUP HOLDI ORDINARY SHARES,G25457105,664000.0,7170,0.002758331448750451
TINY,PROSHARES TR                NANOTECH ETF,74347G465,663000.0,15169,0.002754177335122815
MUSA,MURPHY USA INC              COM,626755102,663000.0,1629,0.002754177335122815
IEI,INSIGHT ENTERPRISES INC     COM,45765U103,663000.0,4805,0.002754177335122815
BAH,BOOZ ALLEN HAMILTON HLDG COR CL A,099502106,662000.0,6360,0.0027500232214951784
N/A,SHELL PLC,780259905,661000.0,163300,0.0027458691078675423
ILMN,ILLUMINA INC                COM,452327109,661000.0,6933,0.0027458691078675423
NVT,NVENT ELECTRIC PLC          SHS,G6700G107,661000.0,9019,0.0027458691078675423
TXT,TEXTRON INC                 COM,883203101,658000.0,8194,0.0027334067669846336
PKN,REVVITY INC                 COM,714046109,658000.0,6798,0.0027334067669846336
CW,CURTISS WRIGHT CORP         COM,231561101,657000.0,1345,0.0027292526533569976
RDN,RADIAN GROUP INC            COM,750236101,656000.0,18205,0.002725098539729361
DVN,DEVON ENERGY CORP NEW       COM,25179M103,656000.0,20625,0.002725098539729361
SLQT,SELECTQUOTE INC             COM,816307300,655000.0,275024,0.002720944426101725
COPX,GLOBAL X FDS                GLOBAL X COPPER,37954Y830,655000.0,14562,0.002720944426101725
UHS,UNIVERSAL HLTH SVCS INC     CL B,913903100,654000.0,3608,0.002716790312474089
WTS,WATTS WATER TECHNOLOGIES INC CL A,942749102,654000.0,2661,0.002716790312474089
N/A,WELLS FARGO CO NEW,949746901,654000.0,36000,0.002716790312474089
UBS,UBS GROUP AG                SHS,H42097107,654000.0,19331,0.002716790312474089
VVV,VALVOLINE INC               COM,92047W101,653000.0,17237,0.0027126361988464524
TREX,TREX CO INC                 COM,89531P105,650000.0,11954,0.0027001738579635437
N/A,JOHNSON & JOHNSON,478160954,649000.0,228500,0.0026960197443359076
TPL,TEXAS PACIFIC LAND CORPORATI COM,88262P102,645000.0,611,0.002679403289825363
MLCO,MELCO RESORTS AND ENTMNT LTD ADR,585464100,645000.0,89227,0.002679403289825363
N/A,CNH INDL N V                SHS,N20944109,645000.0,49775,0.002679403289825363
N/A,THERMO FISHER SCIENTIFIC INC,883556902,644000.0,4900,0.0026752491761977263
ALRM,ALARM COM HLDGS INC         COM,011642105,644000.0,11384,0.0026752491761977263
SRPT,SAREPTA THERAPEUTICS INC    COM,803607100,643000.0,37593,0.0026710950625700902
OS,ONESTREAM INC               CL A,68278B107,641000.0,22667,0.0026627868353148176
SHAK,SHAKE SHACK INC             CL A,819047101,641000.0,4561,0.0026627868353148176
ECG,EVERUS CONSTR GROUP         COM,300426103,641000.0,10097,0.0026627868353148176
MAIN,MAIN STR CAP CORP           COM,56035L104,639000.0,10806,0.0026544786080595455
ALGM,ALLEGRO MICROSYSTEMS INC    COM,01749D105,638000.0,18654,0.002650324494431909
IBCP,INDEPENDENT BK CORP MICH    COM NEW,453838609,638000.0,19689,0.002650324494431909
WB,WEIBO CORP                  SPONSORED ADR,948596101,637000.0,66808,0.002646170380804273
ENVA,ENOVA INTL INC              COM,29357K103,635000.0,5691,0.0026378621535490003
XPO,XPO INC                     COM,983793100,635000.0,5027,0.0026378621535490003
BTDR,BITDEER TECHNOLOGIES GROUP  CL A ORD SHS,G11448100,634000.0,55256,0.002633708039921364
GDXJ,VANECK ETF TRUST            JUNIOR GOLD MINE,92189F791,634000.0,9384,0.002633708039921364
N/A,VANECK ETF TRUST,92189F906,634000.0,30000,0.002633708039921364
SMR,NUSCALE PWR CORP            CL A COM,67079K100,632000.0,15988,0.0026253998126660916
NG,NOVAGOLD RES INC            COM NEW,66987E206,631000.0,154274,0.0026212456990384555
HIW,HIGHWOODS PPTYS INC         COM,431284108,631000.0,20310,0.0026212456990384555
SYF,SYNCHRONY FINANCIAL         COM,87165B103,630000.0,9436,0.0026170915854108194
SSD,SIMPSON MFG INC             COM,829073105,629000.0,4053,0.0026129374717831833
VNET,VNET GROUP INC              SPONSORED ADS A,90138A103,629000.0,91200,0.0026129374717831833
GEHC,GE HEALTHCARE TECHNOLOGIES I COMMON STOCK,36266G107,629000.0,8494,0.0026129374717831833
THG,HANOVER INS GROUP INC       COM,410867105,626000.0,3688,0.0026004751309002747
CCK,CROWN HLDGS INC             COM,228368106,625000.0,6071,0.002596321017272638
POWL,POWELL INDS INC             COM,739128106,625000.0,2970,0.002596321017272638
IRDM,IRIDIUM COMMUNICATIONS INC  COM,46269C102,624000.0,20675,0.002592166903645002
APG,API GROUP CORP              COM STK,00187Y100,624000.0,12223,0.002592166903645002
ED,CONSOLIDATED EDISON INC     COM,209115104,624000.0,6216,0.002592166903645002
RNA,AVIDITY BIOSCIENCES INC     COM,05370A108,623000.0,21930,0.002588012790017366
HRMY,HARMONY BIOSCIENCES HLDGS IN COM,413197104,623000.0,19707,0.002588012790017366
VFC,V F CORP                    COM,918204108,622000.0,52953,0.0025838586763897295
MD,PEDIATRIX MEDICAL GROUP INC COM,58502B106,621000.0,43259,0.0025797045627620934
HWKN,HAWKINS INC                 COM,420261109,620000.0,4363,0.0025755504491344573
APA,APA CORPORATION             COM,03743Q108,619000.0,33839,0.0025713963355068208
TENB,TENABLE HLDGS INC           COM,88025T102,619000.0,18316,0.0025713963355068208
N/A,DELL TECHNOLOGIES INC,24703L952,615000.0,36400,0.002554779880996276
AGCO,AGCO CORP                   COM,001084102,615000.0,5958,0.002554779880996276
STNE,STONECO LTD                 COM CL A,G85158106,614000.0,38272,0.00255062576736864
KFRC,KFORCE INC                  COM,493732101,613000.0,14907,0.0025464716537410034
TEX,TEREX CORP NEW              COM,880779103,613000.0,13134,0.0025464716537410034
FRPT,FRESHPET INC                COM,358039105,613000.0,9025,0.0025464716537410034
MTRN,MATERION CORP               COM,576690101,613000.0,7725,0.0025464716537410034
CNXC,CONCENTRIX CORP             COM,20602D101,612000.0,11584,0.0025423175401133673
IIIN,INSTEEL INDS INC            COM,45774W108,612000.0,16439,0.0025423175401133673
CTLP,CANTALOUPE INC              COM,138103106,610000.0,55543,0.0025340093128580947
PAC,GRUPO AEROPUERTO DEL PACIFIC SPON ADS B,400506101,609000.0,2651,0.0025298551992304586
DXPE,DXP ENTERPRISES INC         COM NEW,233377407,608000.0,6937,0.0025257010856028226
