ticker,nameOfIssuer,cusip,value,shares,allocation_percent
MOFG,MIDWESTONE FINL GROUP INC NE COM,598511103,244000.0,8488,0.001013603725143238
RYN,RAYONIER INC                COM,754907103,243000.0,10934,0.0010094496115156018
N/A,CONOCOPHILLIPS,20825C904,242000.0,165500,0.0010052954978879655
CGON,CG ONCOLOGY INC             COM,156944100,241000.0,9271,0.0010011413842603294
ATRO,ASTRONICS CORP              COM,046433108,241000.0,7192,0.0010011413842603294
ABR,ARBOR REALTY TRUST INC      COM,038923108,240000.0,22432,0.000996987270632693
HIFS,HINGHAM INSTN SVGS MASS     COM,433323102,239000.0,962,0.000992833157005057
SPNT,SIRIUSPOINT LTD             COM,G8192H106,239000.0,11715,0.000992833157005057
GXO,GXO LOGISTICS INCORPORATED  COMMON STOCK,36262G101,239000.0,4910,0.000992833157005057
AWR,AMER STATES WTR CO          COM,029899101,239000.0,3114,0.000992833157005057
KNTK,KINETIK HOLDINGS INC        COM NEW CL A,02215L209,239000.0,5431,0.000992833157005057
INDI,INDIE SEMICONDUCTOR INC     CLASS A COM,45569U101,238000.0,66903,0.0009886790433774207
AZTA,AZENTA INC                  COM,114340102,238000.0,7740,0.0009886790433774207
HBNC,HORIZON BANCORP INC         COM,440407104,238000.0,15449,0.0009886790433774207
WHR,WHIRLPOOL CORP              COM,963320106,238000.0,2343,0.0009886790433774207
N/A,TEXAS ROADHOUSE INC,882681909,238000.0,14000,0.0009886790433774207
BLOK,AMPLIFY ETF TR              BLOCKCHAIN LDR,032108607,237000.0,4145,0.0009845249297497846
DAC,DANAOS CORPORATION          SHS,Y1968P121,235000.0,2727,0.0009762167024945119
SGMA,SIGMATRON INTL INC          COM,82661L101,235000.0,78946,0.0009762167024945119
SGRY,SURGERY PARTNERS INC        COM,86881A100,234000.0,10507,0.0009720625888668758
BKSY,BLACKSKY TECHNOLOGY INC     CL A NEW,09263B207,234000.0,11380,0.0009720625888668758
MSM,MSC INDL DIRECT INC         CL A,553530106,233000.0,2744,0.0009679084752392395
N/A,MARVELL TECHNOLOGY INC,573874904,232000.0,133700,0.0009637543616116033
CACC,CREDIT ACCEP CORP MICH      COM,225310101,232000.0,456,0.0009637543616116033
ANGI,ANGI INC                    CL A NEW,00183L201,232000.0,15210,0.0009637543616116033
N/A,SUNCOR ENERGY INC NEW,867224957,232000.0,203100,0.0009637543616116033
BXP,BXP INC                     COM,101121101,232000.0,3438,0.0009637543616116033
N/A,QUALCOMM INC,747525953,231000.0,10000,0.0009596002479839671
PAA,PLAINS ALL AMERN PIPELINE L UNIT LTD PARTN,726503105,231000.0,12632,0.0009596002479839671
SMPL,SIMPLY GOOD FOODS CO        COM,82900L102,231000.0,7317,0.0009596002479839671
N/A,OMEGA HEALTHCARE INVS INC,681936950,231000.0,209100,0.0009596002479839671
PIPR,PIPER SANDLER COMPANIES     COM,724078100,230000.0,826,0.0009554461343563308
STAA,STAAR SURGICAL CO           COM PAR $0.01,852312305,230000.0,13723,0.0009554461343563308
CRNC 1.5 07/01/28,CERENCE INC                 NOTE  1.500 7/0,156727AD1,229000.0,2950,0.0009512920207286947
EPAM,EPAM SYS INC                COM,29414B104,229000.0,1293,0.0009512920207286947
TSDD,GRANITESHARES ETF TR        2X SHORT TSLA DA,38747R595,229000.0,10000,0.0009512920207286947
PTCT,PTC THERAPEUTICS INC        COM,69366J200,229000.0,4680,0.0009512920207286947
HI,HILLENBRAND INC             COM,431571108,228000.0,11367,0.0009471379071010585
IEP,ICAHN ENTERPRISES LP        DEPOSITARY UNIT,451100101,228000.0,28334,0.0009471379071010585
INGR,INGREDION INC               COM,457187102,228000.0,1682,0.0009471379071010585
ASH,ASHLAND INC                 COM,044186104,227000.0,4521,0.0009429837934734223
RDW,REDWIRE CORPORATION         COM,75776W103,227000.0,13932,0.0009429837934734223
HCC,WARRIOR MET COAL INC        COM,93627C101,227000.0,4945,0.0009429837934734223
ZETA,ZETA GLOBAL HOLDINGS CORP   CL A,98956A105,227000.0,14641,0.0009429837934734223
N/A,INTUIT,461202953,226000.0,7200,0.000938829679845786
SANA,SANA BIOTECHNOLOGY INC      COM,799566104,226000.0,82677,0.000938829679845786
MUFG,MITSUBISHI UFJ FINL GROUP IN SPONSORED ADS,606822104,226000.0,16500,0.000938829679845786
N/A,ASPEN INSURANCE HOLDINGS LTD ORD SHS CL A,G05384501,225000.0,7145,0.0009346755662181499
CMPO,COMPOSECURE INC             COM CL A,20459V105,225000.0,15935,0.0009346755662181499
QC10,FLAGSTAR FINANCIAL INC      COM NEW,649445400,225000.0,21229,0.0009346755662181499
TM,TOYOTA MOTOR CORP           ADS,892331307,225000.0,1305,0.0009346755662181499
UVV,UNIVERSAL CORP VA           COM,913456109,224000.0,3848,0.0009305214525905136
REAX,THE REAL BROKERAGE INC      COM NEW,75585H206,224000.0,49588,0.0009305214525905136
TRU,TRANSUNION                  COM,89400J107,223000.0,2533,0.0009263673389628773
HSBC,HSBC HLDGS PLC              SPON ADR NEW,404280406,223000.0,3675,0.0009263673389628773
RCUS,ARCUS BIOSCIENCES INC       COM,03969F109,223000.0,27362,0.0009263673389628773
EOLS,EVOLUS INC                  COM,30052C107,223000.0,24212,0.0009263673389628773
N/A,ALPHABET INC,02079K957,223000.0,20000,0.0009263673389628773
FTRE,FORTREA HLDGS INC           COMMON STOCK,34965K107,222000.0,44906,0.0009222132253352412
HLIT,HARMONIC INC                COM,413160102,222000.0,23491,0.0009222132253352412
HRI,HERC HLDGS INC              COM,42704L104,222000.0,1683,0.0009222132253352412
SAFE,SAFEHOLD INC                COM,78646V107,222000.0,14287,0.0009222132253352412
CRL,CHARLES RIV LABS INTL INC   COM,159864107,222000.0,1462,0.0009222132253352412
YETI,YETI HLDGS INC              COM,98585X104,221000.0,7000,0.0009180591117076049
N/A,ON HLDG AG,H5919C954,221000.0,29900,0.0009180591117076049
OII,OCEANEERING INTL INC        COM,675232102,220000.0,10599,0.0009139049980799686
MCRI,MONARCH CASINO & RESORT INC COM,609027107,220000.0,2545,0.0009139049980799686
WWD,WOODWARD INC                COM,980745103,220000.0,897,0.0009139049980799686
N/A,BARRICK MNG CORP,06849F958,220000.0,413200,0.0009139049980799686
VLY,VALLEY NATL BANCORP         COM,919794107,219000.0,24505,0.0009097508844523325
SPB,SPECTRUM BRANDS HLDGS INC NE COM,84790A105,218000.0,4116,0.0009055967708246962
GOLF,ACUSHNET HLDGS CORP         COM,005098108,217000.0,2983,0.0009014426571970599
N/A,CSX CORP,126408953,217000.0,304700,0.0009014426571970599
IPAR,INTERPARFUMS INC            COM,458334109,217000.0,1656,0.0009014426571970599
TCOM,TRIP COM GROUP LTD          ADS,89677Q107,217000.0,3709,0.0009014426571970599
VG,VENTURE GLOBAL INC          COM CL A,92333F101,216000.0,13851,0.0008972885435694238
DCGO,DOCGO INC                   COM,256086109,215000.0,136965,0.0008931344299417875
ON1,OLD NATL BANCORP IND        COM,680033107,215000.0,10072,0.0008931344299417875
N/A,VALERO ENERGY CORP,91913Y900,215000.0,33200,0.0008931344299417875
N/A,XPENG INC,98422D955,214000.0,870800,0.0008889803163141515
RGR,STURM RUGER & CO INC        COM,864159108,214000.0,5970,0.0008889803163141515
N/A,COUPANG INC,22266T959,214000.0,716500,0.0008889803163141515
DCOM,DIME CMNTY BANCSHARES INC   COM,25432X102,212000.0,7878,0.0008806720890588789
FISI,FINANCIAL INSTNS INC        COM,317585404,212000.0,8262,0.0008806720890588789
CBL,CBL & ASSOC PPTYS INC       COMMON STOCK,124830878,212000.0,8339,0.0008806720890588789
NSY,NICE LTD                    SPONSORED ADR,653656108,212000.0,1257,0.0008806720890588789
WPP,WPP PLC NEW                 ADR,92937A102,212000.0,6061,0.0008806720890588789
N/A,TECNOGLASS INC              ORD SHS,G87264100,211000.0,2733,0.0008765179754312428
VUZI,VUZIX CORP                  COM NEW,92921W300,211000.0,72113,0.0008765179754312428
AGX,ARGAN INC                   COM,04010E109,211000.0,959,0.0008765179754312428
HIMX,HIMAX TECHNOLOGIES INC      SPONSORED ADR,43289P106,210000.0,23500,0.0008723638618036065
N/A,STEVANATO GROUP S P A       ORD SHS,T9224W109,210000.0,8616,0.0008723638618036065
PBR/A,PETROLEO BRASILEIRO SA PETRO SP ADR NON VTG,71654V101,210000.0,18200,0.0008723638618036065
GTM,ZOOMINFO TECHNOLOGIES INC   COMMON STOCK,98980F104,209000.0,20633,0.0008682097481759702
CALM,CAL MAINE FOODS INC         COM NEW,128030202,209000.0,2100,0.0008682097481759702
N/A,SCHWAB CHARLES CORP,808513905,209000.0,80000,0.0008682097481759702
BILI,BILIBILI INC                SPONS ADS REP Z,090040106,209000.0,9727,0.0008682097481759702
GTX,GARRETT MOTION INC          COM,366505105,208000.0,19802,0.0008640556345483341
WGS,GENEDX HOLDINGS CORP        COM CL A,81663L200,207000.0,2245,0.0008599015209206978
MLR,MILLER INDS INC TENN        COM NEW,600551204,207000.0,4650,0.0008599015209206978
PNFP,PINNACLE FINL PARTNERS INC  COM,72346Q104,207000.0,1876,0.0008599015209206978
TWST,TWIST BIOSCIENCE CORP       COM,90184D100,206000.0,5601,0.0008557474072930615
CORT,CORCEPT THERAPEUTICS INC    COM,218352102,205000.0,2790,0.0008515932936654254
BLKB,BLACKBAUD INC               COM,09227Q100,205000.0,3190,0.0008515932936654254
ELAN,ELANCO ANIMAL HEALTH INC    COM,28414H103,204000.0,14309,0.0008474391800377891
N/A,VANECK ETF TRUST,92189F901,204000.0,11000,0.0008474391800377891
PATK,PATRICK INDS INC            COM,703343103,204000.0,2210,0.0008474391800377891
WEA,WESTERN ALLIANCE BANCORP    COM,957638109,203000.0,2598,0.0008432850664101529
TDUP,THREDUP INC                 CL A,88556E102,203000.0,27167,0.0008432850664101529
LABU,DIREXION SHS ETF TR         DAILY S&P BIOTCH,25460G120,203000.0,3561,0.0008432850664101529
UE,URBAN EDGE PPTYS            COM,91704F104,202000.0,10825,0.0008391309527825167
HURN,HURON CONSULTING GROUP INC  COM,447462102,202000.0,1466,0.0008391309527825167
WEAV,WEAVE COMMUNICATIONS INC    COM,94724R108,202000.0,24235,0.0008391309527825167
FLNG,FLEX LNG LTD                SHS,G35947202,200000.0,9106,0.0008308227255272442
LTC,LTC PPTYS INC               COM,502175102,200000.0,5777,0.0008308227255272442
N/A,EXXON MOBIL CORP,30231G902,200000.0,141500,0.0008308227255272442
HOV,HOVNANIAN ENTERPRISES INC   CL A NEW,442487401,200000.0,1915,0.0008308227255272442
BIPC,BROOKFIELD INFRASTRUCTURE CO COM SUB VTG A,11276H106,200000.0,4816,0.0008308227255272442
XP,XP INC                      CL A,G98239109,200000.0,9907,0.0008308227255272442
TK,TEEKAY CORPORATION LTD      SHS,G8726T105,200000.0,24258,0.0008308227255272442
PTEN,PATTERSON-UTI ENERGY INC    COM,703481101,199000.0,33633,0.000826668611899608
PERI,PERION NETWORK LTD          SHS NEW,M78673114,199000.0,19607,0.000826668611899608
LEA,LEAR CORP                   COM NEW,521865204,199000.0,2090,0.000826668611899608
N/A,AGNICO EAGLE MINES LTD,008474958,199000.0,202400,0.000826668611899608
CPF,CENTRAL PAC FINL CORP       COM NEW,154760409,197000.0,7031,0.0008183603846443356
DGII,DIGI INTL INC               COM,253798102,196000.0,5624,0.0008142062710166995
NTGR,NETGEAR INC                 COM,64111Q104,196000.0,6756,0.0008142062710166995
SITM,SITIME CORP                 COM,82982T106,196000.0,919,0.0008142062710166995
BUWA,BIO RAD LABS INC            CL A,090572207,196000.0,814,0.0008142062710166995
LBTYA,LIBERTY GLOBAL LTD          COM CL A,G61188101,196000.0,19591,0.0008142062710166995
TFIN,TRIUMPH FINANCIAL INC       COM,89679E300,195000.0,3532,0.0008100521573890632
N/A,ERMENEGILDO ZEGNA N V       ORD SHS,N30577105,195000.0,22819,0.0008100521573890632
JANX,JANUX THERAPEUTICS INC      COM,47103J105,193000.0,8342,0.0008017439301337908
N/A,CISCO SYS INC,17275R902,193000.0,8800,0.0008017439301337908
TRC,TEJON RANCH CO              COM,879080109,192000.0,11343,0.0007975898165061545
CBSH,COMMERCE BANCSHARES INC     COM,200525103,192000.0,3086,0.0007975898165061545
VERI 1.75 11/15/26,VERITONE INC                NOTE  1.75011/1,92347MAB6,192000.0,4430,0.0007975898165061545
NFE,NEW FORTRESS ENERGY INC     COM CL A,644393100,191000.0,57591,0.0007934357028785182
UMBF,UMB FINL CORP               COM,902788108,191000.0,1812,0.0007934357028785182
MRTN,MARTEN TRANS LTD            COM,573075108,191000.0,14728,0.0007934357028785182
MDXG,MIMEDX GROUP INC            COM,602496101,191000.0,31191,0.0007934357028785182
N/A,CORE SCIENTIFIC INC NEW,21874A906,190000.0,25000,0.0007892815892508821
N/A,BEST BUY INC,086516951,189000.0,14700,0.0007851274756232458
SWX,SOUTHWEST GAS HLDGS INC     COM,844895102,189000.0,2534,0.0007851274756232458
CWK,CUSHMAN WAKEFIELD PLC       SHS,G2717B108,189000.0,17068,0.0007851274756232458
VIR,VIR BIOTECHNOLOGY INC       COM,92764N102,189000.0,37475,0.0007851274756232458
G2C,EVERI HLDGS INC             COM,30034T103,189000.0,13283,0.0007851274756232458
QCRH,QCR HOLDINGS INC            COM,74727A104,188000.0,2771,0.0007809733619956095
TCBK,TRICO BANCSHARES            COM,896095106,188000.0,4637,0.0007809733619956095
OPFI,OPPFI INC                   COM CL A,68386H103,187000.0,13402,0.0007768192483679734
SSNC,SS&C TECHNOLOGIES HLDGS INC COM,78467J100,187000.0,2260,0.0007768192483679734
NMIH,NMI HLDGS INC               COM,629209305,187000.0,4444,0.0007768192483679734
N/A,TECK RESOURCES LTD,878742954,187000.0,93300,0.0007768192483679734
SHG,SHINHAN FINANCIAL GROUP CO L SPN ADR RESTRD,824596100,187000.0,4146,0.0007768192483679734
N/A,SEADRILL LTD                COM,G7997W102,187000.0,7109,0.0007768192483679734
HRTG,HERITAGE INSURANCE HLDGS INC COM,42727J102,187000.0,7485,0.0007768192483679734
AMTM,AMENTUM HOLDINGS INC        COM,023939101,186000.0,7882,0.0007726651347403371
KGS,KODIAK GAS SVCS INC         COM,50012A108,185000.0,5403,0.0007685110211127008
CARG,CARGURUS INC                COM CL A,141788109,185000.0,5534,0.0007685110211127008
THO,THOR INDS INC               COM,885160101,185000.0,2079,0.0007685110211127008
N/A,CANADIAN PACIFIC KANSAS CITY,13646K908,184000.0,24100,0.0007643569074850647
BHVN,BIOHAVEN LTD                COM,G1110E107,184000.0,13064,0.0007643569074850647
HNST,HONEST CO INC               COM,438333106,184000.0,36130,0.0007643569074850647
USPH,U S PHYSICAL THERAPY        COM,90337L108,184000.0,2353,0.0007643569074850647
WF2,WINTRUST FINL CORP          COM,97650W108,184000.0,1483,0.0007643569074850647
ALEX,ALEXANDER & BALDWIN INC NEW COM,014491104,183000.0,10279,0.0007602027938574284
SBLK,STAR BULK CARRIERS CORP.    SHS PAR,Y8162K204,183000.0,10601,0.0007602027938574284
UNG,UNITED STS NAT GAS FD LP    UNIT PAR,912318409,183000.0,12000,0.0007602027938574284
BTU,PEABODY ENERGY CORP         COM,704551100,183000.0,13629,0.0007602027938574284
FSK,FS KKR CAP CORP             COM,302635206,183000.0,8807,0.0007602027938574284
WOR,WORTHINGTON ENTERPRISES INC COM,981811102,182000.0,2853,0.0007560486802297922
N/A,AMERICAN EXPRESS CO,025816909,182000.0,2600,0.0007560486802297922
INVX,INNOVEX INTERNATIONAL INC   COM,457651107,182000.0,11630,0.0007560486802297922
SCVL,SHOE CARNIVAL INC           COM,824889109,182000.0,9707,0.0007560486802297922
IE,IVANHOE ELECTRIC INC        COM,46578C108,182000.0,20073,0.0007560486802297922
N/A,BP PLC,055622954,181000.0,134500,0.0007518945666021561
N/A,ROBLOX CORP,771049953,181000.0,162300,0.0007518945666021561
ALG,ALAMO GROUP INC             COM,011311107,181000.0,827,0.0007518945666021561
N/A,ORACLE CORP,68389X955,181000.0,13800,0.0007518945666021561
N/A,ARES MANAGEMENT CORPORATION,03990B901,180000.0,10000,0.0007477404529745198
CTBI,COMMUNITY TR BANCORP INC    COM,204149108,180000.0,3407,0.0007477404529745198
EVGO,EVGO INC                    CL A COM,30052F100,179000.0,49104,0.0007435863393468836
MHK,MOHAWK INDS INC             COM,608190104,179000.0,1708,0.0007435863393468836
NNE,NANO NUCLEAR ENERGY INC     COM,63010H108,178000.0,5148,0.0007394322257192474
SBH,SALLY BEAUTY HLDGS INC      COM,79546E104,178000.0,19231,0.0007394322257192474
HIPO,HIPPO HLDGS INC             COM NEW,433539202,178000.0,6361,0.0007394322257192474
N/A,TJX COS INC NEW,872540959,178000.0,87100,0.0007394322257192474
OMCL,OMNICELL COM                COM,68213N109,177000.0,6032,0.0007352781120916112
HFWA,HERITAGE FINL CORP WASH     COM,42722X106,177000.0,7419,0.0007352781120916112
PI,IMPINJ INC                  COM,453204109,177000.0,1597,0.0007352781120916112
PANL,PANGAEA LOGISTICS SOLUTION L SHS,G6891L105,177000.0,37688,0.0007352781120916112
GSBD,GOLDMAN SACHS BDC INC       SHS,38147U107,177000.0,15737,0.0007352781120916112
N/A,UNITED PARCEL SERVICE INC,911312956,177000.0,20800,0.0007352781120916112
RES,RPC INC                     COM,749660106,177000.0,37443,0.0007352781120916112
CURB,CURBLINE PPTYS CORP         COM,23128Q101,176000.0,7714,0.0007311239984639749
PEGA,PEGASYSTEMS INC             COM,705573103,176000.0,3258,0.0007311239984639749
NRIM,NORTHRIM BANCORP INC        COM,666762109,176000.0,1890,0.0007311239984639749
BY,BYLINE BANCORP INC          COM,124411109,176000.0,6592,0.0007311239984639749
N/A,AMERICAN TOWER CORP NEW,03027X900,175000.0,10100,0.0007269698848363387
N/A,CADENCE DESIGN SYSTEM INC,127387908,175000.0,50000,0.0007269698848363387
WSC,WILLSCOT HLDGS CORP         COM CL A,971378104,175000.0,6372,0.0007269698848363387
HPK,HIGHPEAK ENERGY INC         COM,43114Q105,175000.0,17839,0.0007269698848363387
AVPT,AVEPOINT INC                COM CL A,053604104,175000.0,9087,0.0007269698848363387
N/A,CATERPILLAR INC,149123951,175000.0,31700,0.0007269698848363387
NXRT,NEXPOINT RESIDENTIAL TR INC COM,65341D102,174000.0,5226,0.0007228157712087025
ARLO,ARLO TECHNOLOGIES INC       COM,04206A101,174000.0,10249,0.0007228157712087025
CENX,CENTURY ALUM CO             COM,156431108,174000.0,9640,0.0007228157712087025
BHRB,BURKE HERBERT FINL SVCS CORP COM,12135Y108,174000.0,2918,0.0007228157712087025
CHA,CHAGEE HLDGS LTD            SPONSORED ADS,15743P104,174000.0,6672,0.0007228157712087025
WES,WESTERN MIDSTREAM PARTNERS L COM UNIT LP INT,958669103,174000.0,4490,0.0007228157712087025
INTA,INTAPP INC                  COM,45827U109,174000.0,3363,0.0007228157712087025
TTMI,TTM TECHNOLOGIES INC        COM,87305R109,174000.0,4254,0.0007228157712087025
HEI/A,HEICO CORP NEW              CL A,422806208,173000.0,670,0.0007186616575810663
MODG,TOPGOLF AWAY BRANDS CORP COM,131193104,173000.0,21540,0.0007186616575810663
NPO,ENPRO INC                   COM,29355X107,173000.0,904,0.0007186616575810663
CAKE,CHEESECAKE FACTORY INC      COM,163072101,172000.0,2751,0.0007145075439534301
CPRX,CATALYST PHARMACEUTICALS INC COM,14888U101,172000.0,7914,0.0007145075439534301
TPC,TUTOR PERINI CORP           COM,901109108,172000.0,3676,0.0007145075439534301
PHR,PHREESIA INC                COM,71944F106,172000.0,6040,0.0007145075439534301
KRNY,KEARNY FINL CORP MD         COM,48716P108,171000.0,26455,0.0007103534303257939
SAH,SONIC AUTOMOTIVE INC        CL A,83545G102,171000.0,2139,0.0007103534303257939
CNOB,CONNECTONE BANCORP INC      COM,20786W107,170000.0,7345,0.0007061993166981576
MASS,908 DEVICES INC             COM,65443P102,170000.0,23864,0.0007061993166981576
CALX,CALIX INC                   COM,13100M509,170000.0,3193,0.0007061993166981576
MQ,MARQETA INC                 CLASS A COM,57142B104,170000.0,29101,0.0007061993166981576
RUSHA,RUSH ENTERPRISES INC        CL A,781846209,170000.0,3302,0.0007061993166981576
N/A,CANADIAN PACIFIC KANSAS CITY,13646K958,170000.0,76400,0.0007061993166981576
VRDN,VIRIDIAN THERAPEUTICS INC   COM,92790C104,170000.0,12137,0.0007061993166981576
N/A,DUPONT DE NEMOURS INC,26614N902,169000.0,41600,0.0007020452030705214
UTI,UNIVERSAL TECHNICAL INST INC COM,913915104,168000.0,4951,0.0006978910894428852
AHCO,ADAPTHEALTH CORP            COMMON STOCK,00653Q102,168000.0,17779,0.0006978910894428852
ANIP,ANI PHARMACEUTICALS INC     COM,00182C103,167000.0,2564,0.0006937369758152489
SB9,SITIO ROYALTIES CORP        CLASS A COM,82983N108,166000.0,9026,0.0006895828621876128
N/A,QUANTUMSCAPE CORP,74767V959,166000.0,1011200,0.0006895828621876128
KOPN,KOPIN CORP                  COM,500600101,166000.0,108413,0.0006895828621876128
IX,ORIX CORP                   SPONSORED ADR,686330101,165000.0,7316,0.0006854287485599766
VSTS,VESTIS CORPORATION          COM SHS,29430C102,165000.0,28861,0.0006854287485599766
ARDT,ARDENT HEALTH INC           COM,03980N107,165000.0,12077,0.0006854287485599766
HBM,HUDBAY MINERALS INC         COM,443628102,164000.0,15471,0.0006812746349323403
MMI,MARCUS & MILLICHAP INC      COM,566324109,164000.0,5332,0.0006812746349323403
AMKR,AMKOR TECHNOLOGY INC        COM,031652100,164000.0,7829,0.0006812746349323403
ADMA,ADMA BIOLOGICS INC          COM,000899104,164000.0,9031,0.0006812746349323403
STRA,STRATEGIC ED INC            COM,86272C103,164000.0,1928,0.0006812746349323403
NAVI,NAVIENT CORPORATION         COM,63938C108,163000.0,11586,0.0006771205213047041
GDRX,GOODRX HLDGS INC            COM CL A,38246G108,163000.0,32641,0.0006771205213047041
DORM,DORMAN PRODS INC            COM,258278100,163000.0,1330,0.0006771205213047041
EGBN,EAGLE BANCORP INC MD        COM,268948106,163000.0,8376,0.0006771205213047041
N/A,DUPONT DE NEMOURS INC,26614N952,162000.0,53800,0.0006729664076770679
LOPE,GRAND CANYON ED INC         COM,38526M106,162000.0,858,0.0006729664076770679
SOC,SABLE OFFSHORE CORP         COM SHS,78574H104,161000.0,7330,0.0006688122940494316
FC,FRANKLIN COVEY CO           COM,353469109,161000.0,7043,0.0006688122940494316
SUZ,SUZANO S A                  SPON ADS,86959K105,161000.0,17123,0.0006688122940494316
N/A,REALTY INCOME CORP,756109954,161000.0,176200,0.0006688122940494316
N/A,REALTY INCOME CORP,756109904,161000.0,107200,0.0006688122940494316
BKE,BUCKLE INC                  COM,118440106,160000.0,3530,0.0006646581804217954
GH,GUARDANT HEALTH INC         COM,40131M109,160000.0,3074,0.0006646581804217954
RUM,RUMBLE INC                  COM CL A,78137L105,160000.0,17784,0.0006646581804217954
LXP,LXP INDUSTRIAL TRUST        COM,529043101,160000.0,19328,0.0006646581804217954
AG,FIRST MAJESTIC SILVER CORP  COM,32076V103,160000.0,19386,0.0006646581804217954
ULS,UL SOLUTIONS INC            CLASS A COM SHS,903731107,160000.0,2202,0.0006646581804217954
STN,STANTEC INC                 COM,85472N109,159000.0,1463,0.0006605040667941592
LIND,LINDBLAD EXPEDITIONS HLDGS I COM,535219109,159000.0,13609,0.0006605040667941592
BRKL,BROOKLINE BANCORP INC DEL   COM,11373M107,158000.0,14988,0.0006563499531665229
HP,HELMERICH & PAYNE INC       COM,423452101,158000.0,10449,0.0006563499531665229
MC,MOELIS & CO                 CL A,60786M105,158000.0,2537,0.0006563499531665229
SLM,SLM CORP                    COM,78442P106,158000.0,4816,0.0006563499531665229
DRVN,DRIVEN BRANDS HLDGS INC     COM,26210V102,158000.0,8994,0.0006563499531665229
CPK,CHESAPEAKE UTILS CORP       COM,165303108,158000.0,1312,0.0006563499531665229
RVMD,REVOLUTION MEDICINES INC    COM,76155X100,157000.0,4278,0.0006521958395388867
HUYA,HUYA INC                    ADS REP SHS A,44852D108,157000.0,44658,0.0006521958395388867
CSGS,CSG SYS INTL INC            COM,126349109,157000.0,2404,0.0006521958395388867
PB,PROSPERITY BANCSHARES INC   COM,743606105,157000.0,2230,0.0006521958395388867
RCKT,ROCKET PHARMACEUTICALS INC  COM,77313F106,156000.0,63553,0.0006480417259112505
GMS,GMS INC                     COM,36251C103,156000.0,1438,0.0006480417259112505
SMBK,SMARTFINANCIAL INC          COM NEW,83190L208,156000.0,4623,0.0006480417259112505
RRR,RED ROCK RESORTS INC        CL A,75700L108,156000.0,2992,0.0006480417259112505
AMBC,AMBAC FINL GROUP INC        COM NEW,023139884,154000.0,21642,0.000639733498655978
NAK,NORTHERN DYNASTY MINERALS LT COM NEW,66510M204,154000.0,115000,0.000639733498655978
BZH,BEAZER HOMES USA INC        COM NEW,07556Q881,154000.0,6883,0.000639733498655978
PCRX,PACIRA BIOSCIENCES INC      COM,695127100,154000.0,6451,0.000639733498655978
ELME,ELME COMMUNITIES            SH BEN INT,939653101,153000.0,9620,0.0006355793850283418
AMWD,AMERICAN WOODMARK CORPORATIO COM,030506109,153000.0,2876,0.0006355793850283418
DAVA,ENDAVA PLC                  ADS,29260V105,153000.0,9975,0.0006355793850283418
NHI,NATIONAL HEALTH INVS INC    COM,63633D104,153000.0,2181,0.0006355793850283418
N/A,DECKERS OUTDOOR CORP,243537907,152000.0,205000,0.0006314252714007056
MSBI,MIDLAND STATES BANCORP INC  COM,597742105,152000.0,8758,0.0006314252714007056
VSEC,VSE CORP                    COM,918284100,151000.0,1151,0.0006272711577730693
SLG,SL GREEN RLTY CORP          COM,78440X887,151000.0,2436,0.0006272711577730693
HONE,HARBORONE BANCORP INC NEW   COM NEW,41165Y100,150000.0,12874,0.0006231170441454331
N/A,INTERCORP FINL SVCS INC     SHS,P5626F128,150000.0,3933,0.0006231170441454331
OTX,OPEN TEXT CORP              COM,683715106,150000.0,5140,0.0006231170441454331
GHC,GRAHAM HLDGS CO             COM CL B,384637104,149000.0,158,0.000618962930517797
TPG,TPG INC                     COM CL A,872657101,149000.0,2837,0.000618962930517797
WIX 0 08/15/25,WIX COM LTD                 NOTE         8/1,92940WAD1,149000.0,1500,0.000618962930517797
N/A,GRAINGER W W INC,384802904,147000.0,42900,0.0006106547032625246
BL,BLACKLINE INC               COM,09239B109,147000.0,2596,0.0006106547032625246
N/A,ARK ETF TR,00214Q902,146000.0,34000,0.0006065005896348883
OMAB,GRUPO AEROPORTUARIO DEL CENT SPON ADR,400501102,146000.0,1386,0.0006065005896348883
MEC,MAYVILLE ENGR CO INC        COM,578605107,146000.0,9128,0.0006065005896348883
AVDX,AVIDXCHANGE HOLDINGS INC    COM,05368X102,146000.0,14917,0.0006065005896348883
LZ,LEGALZOOM COM INC           COM,52466B103,146000.0,16435,0.0006065005896348883
RNR,RENAISSANCERE HLDGS LTD     COM,G7496G103,146000.0,602,0.0006065005896348883
NLR,VANECK ETF TRUST            URANIUM AND NUCL,92189F601,146000.0,1315,0.0006065005896348883
FFC0,OAKTREE SPECIALTY LENDING CO COM,67401P405,146000.0,10675,0.0006065005896348883
VCTR,VICTORY CAP HLDGS INC       COM CL A,92645B103,146000.0,2293,0.0006065005896348883
PENN,PENN ENTERTAINMENT INC      COM,707569109,146000.0,8192,0.0006065005896348883
VIRT,VIRTU FINL INC              CL A,928254101,145000.0,3240,0.0006023464760072521
STEL,STELLAR BANCORP INC         COM,858927106,145000.0,5166,0.0006023464760072521
ALX,ALEXANDERS INC              COM,014752109,145000.0,643,0.0006023464760072521
ROG,ROGERS CORP                 COM,775133101,145000.0,2114,0.0006023464760072521
SATS,ECHOSTAR CORP               CL A,278768106,145000.0,5231,0.0006023464760072521
COMP,COMPASS INC                 CL A,20464U100,145000.0,23043,0.0006023464760072521
