ticker,nameOfIssuer,cusip,value,shares,allocation_percent
YINN,DIREXION FUNDS Daily China Bull 3X Shs (Rev S,25460G195,208629000.0,5091,0.0008997957290187216
DON,SPDR ETFS Dow Jones Industrial Avg ETF,78467X109,208427000.0,473,0.0008989245234947446
OII,OCEANEERING INTL INC USD0.25 Common Stock,675232102,207200000.0,10000,0.0008936325968713799
POOL,POOL CORPORATION USD0.001 Common Stock,73278L105,205784000.0,706,0.0008875255324062742
MNTK,MONTAUK RENEWABLES INC USD0.01 Common Stock,61218C103,204240000.0,92000,0.0008808664169160744
SBSW,SIBANYE STILLWATER Spon ADR Ea Rep 4 Ord Shs,82575P107,201697000.0,27936,0.0008698987156909589
SGOV,ISHARES TRUST 0-3 Month Treasury Bond ETF,46436E718,201380000.0,2000,0.0008685315268241239
HEI/A,HEICO CORP USD0.01 Common Stock,422806208,200531000.0,775,0.0008648698758842407
RIVN,RIVIAN AUTOMOTIVE INC USD0.001 Cls A Common Stock,76954A103,190889000.0,13893,0.00082328490725956
PTM,PLATINUM GROUP METALS LTD NPV Com Stk (Post Rev Split),72765Q882,183600000.0,120000,0.0007918481891196203
MNMD,MIND MEDICINE INC NPV Com Stk (Post Rev Split),60255C885,183018000.0,28200,0.0007893380821148949
WBA,WALGREENS BOOTS ALLIANCE USD0.01 Common Stock,931427108,178950000.0,15588,0.0007717932104736169
MODG,CALLAWAY GOLF CO USD0.01 Common Stock,131193104,174242000.0,21645,0.0007514880837068676
MVST,MICROVAST HOLDINGS INC USD0.0001 Common Stock,59516C106,163350000.0,45000,0.0007045119917902505
VALE,VALE SA Spons ADR Rep 1 Com NPV,91912E105,160360000.0,16515,0.0006916164248759386
EC,ECOPETROL SA Spon ADR Ea Rep 20 Ord Shs,279158109,155538000.0,17575,0.0006708196276649646
MESO,MESOBLAST LTD Spon ADR Ea Rep 10 Ord Shs,590717401,152645000.0,14017,0.0006583424119181071
TDF,TEMPLETON DRAGON FUND PLC USD0.01 Common Stock,88018T101,151848000.0,15200,0.0006549050317071684
AUTL,AUTOLUS THERAPEUTICS INC Spon ADS Each Rep 1 Ord Shares,05280R100,148200000.0,65000,0.0006391715774919812
VIR,VIR BIOTECHNOLOGY USD0.0001 Common Stock,92764N102,144199000.0,28611,0.0006219156700591511
RGTI,RIGETTI COMPUTING INC USD0.0001 Common Stock,76655K103,143043000.0,12061,0.0006169299592387683
PBR,PETROLEO BRASILEIRO SA Spon ADS Each Rep 2 Ord Shares,71654V408,138986000.0,11110,0.0005994325294824594
TEI,TEMPLETON EMERGING MARKETS INC NPV Common Stock,880192109,138000000.0,23000,0.00059518001142978
DNN,DENISON MINES INC NPV Common Stock,248356107,137046000.0,75300,0.0005910655061333741
PGX,INVESCO EXCH TRDII Preferred ETF,46138E511,122430000.0,11000,0.0005280281797054201
EXK,ENDEAVOUR SILVER CORP NPV Common Stock,29258Y103,122016000.0,24800,0.0005262426396711307
GENI,GENIUS SPORTS LTD NPV Common Stock,G3934V109,121940000.0,11725,0.000525914859374981
SAND,SANDSTORM GOLD LTD NPV Common Stock,80013R206,117020000.0,12457,0.0005046953980979193
FSM,FORTUNA MINING CORP NPV Common Stock,349942102,114701000.0,17550,0.0004946937861667188
SLN,SILENCE THERAPEUTICS PLC Spon ADS Ea Rep 3 Ord Shares,82686Q101,106841000.0,18421,0.0004607944029070227
ITUB,ITAU UNIBANCO HOLDING SA ADR Each Rep 1 NPV Pref,465562106,104566000.0,15400,0.00045098255851569837
NGD,NEW GOLD INC NPV Common Stock,644535106,104322000.0,21068,0.00044993021124911236
CDZI,CADIZ INC USD0.01 Common Stock,127537207,104225000.0,34858,0.0004495118600816581
ADAP,ADAPTIMMUNE THERAPEUTICS PLC Spon ADS Each Rep 6 Ord Shs,00653A107,103746000.0,432818,0.0004474459816361881
XAODX,ABRDN TOTAL DYNAMIC DIV FUND Ben Int NPV Common Shares,00326L100,100649000.0,11360,0.00043408893456808645
GLDG,GOLDMINING INC NPV Common Stock,38149E101,93960000.0,130500,0.00040523995560827627
PTON,PELOTON INTERACTIVE INC USD0.000025 Cls A Common Stock,70614W100,93107000.0,13416,0.0004015610530738589
ELBM,ELECTRA BATTERY MATERIALS CORP NPV Common Stock (P-R Split),28474P706,81184000.0,75171,0.0003501383626660526
MSD,MORGAN STANLEY EMERG MKTS DEBT USD0.01 Common Stock,61744H105,77300000.0,10000,0.0003333870643733478
ASM,AVINO SILVER & GOLD NPV Common Stock,053906103,75749000.0,21100,0.0003266977585927131
BB,BLACKBERRY LTD NPV Shares,09228F103,74338000.0,16231,0.00032061225862077525
ITRG,INTEGRA RESOURCES CORP NPV Com Stk (Post Rev Split),45826T509,73084000.0,48400,0.00031520388373430466
KODK,EASTMAN KODAK CO USD0.01 Common Stock,277461406,72320000.0,12800,0.00031190882917827314
AUID,AUTHID INC USD0.0001 Com Stk (P-R Split),46264C305,68960000.0,13036,0.000297417489769548
IAUX,I 80 GOLD CORP (US Quote) NPV Common Stock,44955L106,67729000.0,110740,0.0002921083115516491
CLOV,CLOVER HEALTH INVESTMENTS CORP USD0.0001 Cls A Com Stk,18914F103,64170000.0,23000,0.0002767587053148477
SABR,SABRE CORP USD0.01 Common Stock,78573M104,63042000.0,19950,0.0002718937556562043
UROY,URANIUM ROYALTY CORP NPV Common Stock,91702V101,62500000.0,25000,0.00026955616459682066
SVM,SILVERCORP METALS INC NPV Common Stock,82835P103,51711000.0,12225,0.00022302430123945908
RXRX,RECURSION PHARMACEUTICALS INC USD0.00001 Cls A Common Stock,75629V104,50827000.0,10045,0.00021921169884740166
RCKT,ROCKET PHARMACEUTICALS INC USD0.01 Common Stock,77313F106,49000000.0,20000,0.0002113320330439074
VZLA,VIZSLA SILVER CORP NPV Common Stock,92859G608,48306000.0,16375,0.00020833888139222428
PLUN,PLUG POWER INC USD0.01 Common Stock,72919P202,43621000.0,29276,0.0001881329512940466
BYND,BEYOND MEAT INC USD0.0001 Common Stock,08862E109,40044000.0,11474,0.0001727057128818414
EAF,GRAFTECH INTERNATIONAL LTD USD0.01 Common Stock,384313508,39152000.0,40256,0.00016885860730071555
HAIN,HAIN CELESIAL GROUP INC USD0.01 Common Stock,405217100,38972000.0,25640,0.0001680822855466767
ODV,OSISKO DEVELOPMENT CORP NPV Com Stk (Post Rev Split),68828E809,38520000.0,18000,0.0001661328553643125
PEPG,PEPGEN INC USD0.0001 Common Stock,713317105,35523000.0,32003,0.00015320709815956577
DV,DOLLY VARDEN SILVER CORP Com Stk NPV (Post Rev-Split),256827783,34633000.0,10259,0.00014936861837570704
USAS,AMERICAS GOLD & SILVER CORP NPV Common Stock,03062D100,33890000.0,41959,0.00014616413469098003
WRN,WESTERN COPPER & GOLD CORP NPV Common Stock,95805V108,33489000.0,27450,0.00014443466233892682
RIG,TRANSOCEAN LTD CHF15 Common Stock,H8817H100,32716000.0,12632,0.00014110079169519336
LCTX,LINEAGE CELL THERAPEUTICS INC NPV Common Stock,53566P109,31759000.0,35000,0.00013697334770288683
EU,ENCORE ENERGY CORP NPV Com Stk (Post Rev Split),29259W700,28500000.0,10000,0.0001229176110561502
PSNY,POLESTAR AUTOMOTIVE HOLDING UK ADS Cl A Ea Rep 1 Cl A Ord,731105201,27054000.0,25285,0.00011668115963203818
EMX,EMX ROYALTY CORP NPV Common Stock,26873J107,25100000.0,10000,0.00010825375570208317
IOVA,IOVANCE BIOTHERAPEUTICS INC USD0.000041666 Com Stk,462260100,22624000.0,13154,9.757501868541552e-05
URE,UR ENERGY INC NPV Common Stock,91688R108,21000000.0,20000,9.057087130453175e-05
NFGC,NEW FOUND GOLD CORP NPV Common Stock,64440N103,16216000.0,11340,6.993796424163271e-05
IPA,IMMUNOPRECISE ANTIBODIES LTD NPV Com Stock (Post Rev Split),45257F200,14840000.0,14000,6.40034157218691e-05
ILLR,TRILLER GROUP INC USD0.001 Common Stock,895970101,12561000.0,13500,5.4174319736010624e-05
TE,FREYR BATTERY INC NPV Common Stock,35834F104,12300000.0,10000,5.304865319265431e-05
CODX,CO DIAGNOSTICS INC USD0.001 Common Stock,189763105,7005000.0,25000,3.0211854928011657e-05
TRX,TRX GOLD CORP NPV Common Stock,87283P109,4690000.0,14000,2.0227494591345423e-05
