ticker,nameOfIssuer,cusip,value,shares,allocation_percent
AAPL,APPLE INC                   COM,037833100,2691145000.0,13116660,11.179322118445079
AVGO,BROADCOM INC                COM,11135F101,2245645000.0,8146727,9.328664497333142
GOOGL,ALPHABET INC                CAP STK CL A,02079K305,1236967000.0,7019049,5.138501471636293
META,META PLATFORMS INC          CL A,30303M102,984480000.0,1333821,4.089641784135307
GOOG,ALPHABET INC                CAP STK CL C,02079K107,696850000.0,3928351,2.8947940814183006
IVV,ISHARES TR                  CORE S&P500 ETF,464287200,512801000.0,825900,2.130233622365482
NVDA,NVIDIA CORPORATION          COM,67066G104,461140000.0,2918793,1.9156279582481672
PANW,PALO ALTO NETWORKS INC      COM,697435105,357318000.0,1746083,1.4843395731997193
CSCO,CISCO SYS INC               COM,17275R102,314161000.0,4528114,1.305060491371823
DIS,DISNEY WALT CO              COM,254687106,304864000.0,2458384,1.2664396969756888
AMZN,AMAZON COM INC              COM,023135106,259489000.0,1182776,1.0779467911216953
GLD,SPDR GOLD TR                GOLD SHS,78463V107,224571000.0,736710,0.9328934514718938
TSLA,TESLA INC                   COM,88160R101,202687000.0,638064,0.8419848288447027
UNH,UNITEDHEALTH GROUP INC      COM,91324P102,198013000.0,634718,0.8225685017491311
CAT,CATERPILLAR INC             COM,149123101,190593000.0,490953,0.7917449786320703
AIG,AMERICAN INTL GROUP INC     COM NEW,026874784,186965000.0,2184430,0.7766738543910061
IWM,ISHARES TR                  RUSSELL 2000 ETF,464287655,184584000.0,855385,0.7667829098436042
ROP,ROPER TECHNOLOGIES INC      COM,776696106,155829000.0,274909,0.6473313724809246
ORCL,ORACLE CORP                 COM,68389X105,139965000.0,640190,0.5814305138921038
PGR,PROGRESSIVE CORP            COM,743315103,139524000.0,522836,0.5795985497823162
MNDY,MONDAY COM LTD              SHS,M7S64H106,137166000.0,436168,0.5698031498483499
MA,MASTERCARD INCORPORATED     CL A,57636Q104,134866000.0,240000,0.5602486885047866
WMT,WALMART INC                 COM,931142103,128897000.0,1318237,0.535452784261426
ASML,ASML HOLDING N V            N Y REGISTRY SHS,N07059210,121509000.0,151623,0.5047621927804496
MSTR,MICROSTRATEGY INC           CL A NEW,594972408,117343000.0,290288,0.4874561554077171
NFLX,NETFLIX INC                 COM,64110L106,115753000.0,86439,0.4808511147397755
XLC,SELECT SECTOR SPDR TR       COMMUNICATION,81369Y852,115126000.0,1060776,0.4782464854952476
N/A,NVIDIA CORPORATION,67066G904,109252000.0,3119700,0.45384522204651245
QQQ,INVESCO QQQ TR              UNIT SER 1,46090E103,107178000.0,194290,0.4452295903827949
JNJ,JOHNSON & JOHNSON           COM,478160104,104724000.0,685588,0.4350353955405757
TT,TRANE TECHNOLOGIES PLC      SHS,G8994E103,99151000.0,226677,0.411884520293759
ADBE,ADOBE INC                   COM,00724F101,98578000.0,254802,0.4095042131851234
SLV,ISHARES SILVER TR           ISHARES,46428Q109,94656000.0,2884965,0.39321177953753417
LQD,ISHARES TR                  IBOXX INV CP ETF,464287242,94178000.0,859213,0.391226113223524
EFA,ISHARES TR                  MSCI EAFE ETF,464287465,92597000.0,1035882,0.38465845957823114
RCL,ROYAL CARIBBEAN GROUP       COM,V7780T103,89820000.0,286838,0.3731224860342854
N/A,CLOUDFLARE INC,18915M957,88742000.0,1000000,0.36864435154369357
INTU,INTUIT                      COM,461202103,82372000.0,104582,0.3421826477356508
ABBV,ABBVIE INC                  COM,00287Y109,79496000.0,428271,0.330235416942569
DASH,DOORDASH INC                CL A,25809K105,78971000.0,320358,0.32805450728806
UPS,UNITED PARCEL SERVICE INC   CL B,911312106,75372000.0,746698,0.3131038523421973
AMAT,APPLIED MATLS INC           COM,038222105,72569000.0,396402,0.30145987184393297
N/A,INVESCO QQQ TR,46090E903,71924000.0,1012200,0.2987804685541076
COF,CAPITAL ONE FINL CORP       COM,14040H105,70733000.0,332456,0.29383291922359284
N/A,CLOUDFLARE INC,18915M907,70505000.0,1000000,0.2928857813164918
DLR,DIGITAL RLTY TR INC         COM,253868103,70039000.0,401762,0.2909499643660133
WIX,WIX COM LTD                 SHS,M98068105,67260000.0,424460,0.27940568259481224
N/A,NETFLIX INC,64110L906,66760000.0,222400,0.2773286257809941
AMGN,AMGEN INC                   COM,031162100,66119000.0,236806,0.2746658389456793
TSM,TAIWAN SEMICONDUCTOR MFG LTD SPONSORED ADS,874039100,65416000.0,288826,0.27174549706545104
ETN,EATON CORP PLC              SHS,G29183103,65402000.0,183204,0.27168733947466417
INCY,INCYTE CORP                 COM,45337C102,64639000.0,949174,0.2685177507767777
BKNG,BOOKING HOLDINGS INC        COM,09857L108,64446000.0,11132,0.26771600684664393
HON,HONEYWELL INTL INC          COM,438516106,64079000.0,275160,0.2661914471453014
N/A,NXP SEMICONDUCTORS N V      COM,N6596X109,63197000.0,289246,0.2625275189257263
MDT,MEDTRONIC PLC               SHS,G5960L103,62653000.0,718744,0.2602676811122922
EMB,ISHARES TR                  JPMORGAN USD EMG,464288281,61892000.0,668231,0.257106400641661
CMG,CHIPOTLE MEXICAN GRILL INC  COM,169656105,61808000.0,1100769,0.25675745509693954
MDY,SPDR S&P MIDCAP 400 ETF TR  UTSER1 S&PDCRP,78467Y107,59390000.0,104840,0.24671280834531517
N/A,ISHARES TR,464287955,58715000.0,8278500,0.24390878164666074
N/A,SEA LTD,81141R900,55122000.0,619900,0.2289830513825638
HLT,HILTON WORLDWIDE HLDGS INC  COM,43300A203,53834000.0,202124,0.22363255303016832
PLTR,PALANTIR TECHNOLOGIES INC   CL A,69608A108,51822000.0,380150,0.21527447641136424
WDC,WESTERN DIGITAL CORP        COM,958102105,51485000.0,804582,0.21387454011885088
VRTX,VERTEX PHARMACEUTICALS INC  COM,92532F100,51483000.0,115640,0.21386623189159557
CME,CME GROUP INC               COM,12572Q105,51360000.0,186342,0.21335527591539633
CTVA,CORTEVA INC                 COM,22052L104,51026000.0,684643,0.2119678019637658
N/A,TESLA INC,88160R901,49760000.0,1282000,0.20670869411117837
SYK,STRYKER CORPORATION         COM,863667101,49572000.0,125300,0.20592772074918275
DON,SPDR DOW JONES INDL AVERAGE UT SER 1,78467X109,49483000.0,112296,0.20555800463632315
HWM,HOWMET AEROSPACE INC        COM,443201108,48937000.0,262918,0.20328985859563378
DWD,MORGAN STANLEY              COM NEW,617446448,48903000.0,347173,0.20314861873229415
SEALTD 2.375 12/01/25,SEA LTD                     NOTE  2.37512/0,81141RAF7,48825000.0,276240,0.2028245978693385
FXI,ISHARES TR                  CHINA LG-CAP ETF,464287184,48535000.0,1320330,0.20161990491732398
N/A,CRH PLC                     ORD,G25508105,47484000.0,517252,0.19725393149467832
CB,CHUBB LIMITED               COM,H1467J104,47105000.0,162588,0.1956795224298042
EXR,EXTRA SPACE STORAGE INC     COM,30225T102,46742000.0,317023,0.19417157918297226
CYBR,CYBERARK SOFTWARE LTD       SHS,M2682V108,45326000.0,111399,0.18828935428623936
ATAT,ATOUR LIFESTYLE HLDGS LTD   SPONSORED ADS,04965M106,45211000.0,1390686,0.18781163121906122
IP,INTERNATIONAL PAPER CO      COM,460146103,45111000.0,963300,0.1873962198562976
MSFT,MICROSOFT CORP              COM,594918104,44869000.0,90205,0.18639092435840962
BRK/A,BERKSHIRE HATHAWAY INC DEL  CL A,084670108,43728000.0,60,0.18165108070927669
BAC,VERIZON COMMUNICATIONS INC  COM,92343V104,43028000.0,994409,0.1787432011699313
EQT,EQT CORP                    COM,26884L109,42920000.0,735936,0.1782945568981466
ELV,ELEVANCE HEALTH INC         COM,036752103,42441000.0,109115,0.17630473647050887
NEE,NEXTERA ENERGY INC          COM,65339F101,42265000.0,608831,0.1755736124720449
GS,GOLDMAN SACHS GROUP INC     COM,38141G104,41934000.0,59250,0.1741986008612973
N/A,SPDR GOLD TR,78463V907,41225000.0,1028900,0.17125333429930323
AXP,AMERICAN EXPRESS CO         COM,025816109,41169000.0,129065,0.1710207039361556
BHC,BAUSCH HEALTH COS INC       COM,071734107,40979000.0,6152986,0.17023142234690472
LITE 1.5 12/15/29,LUMENTUM HLDGS INC          NOTE  1.50012/1,55024UAH2,40738000.0,265680,0.1692302809626444
UBER,UBER TECHNOLOGIES INC       COM,90353T100,40626000.0,435435,0.16876502023634912
N/A,ISHARES TR,464287905,40583000.0,4799000,0.16858639335036077
CRWD,CROWDSTRIKE HLDGS INC       CL A,22788C105,39828000.0,78199,0.16545003756149543
SPOT,SPOTIFY TECHNOLOGY S A      SHS,L8681T102,38696000.0,50429,0.16074758093501124
ROST,ROSS STORES INC             COM,778296103,38640000.0,302872,0.1605149505718636
AMD,ADVANCED MICRO DEVICES INC  COM,007903107,37033000.0,260979,0.15383928997225219
BABA,ALIBABA GROUP HLDG LTD      SPONSORED ADS,01609W102,36562000.0,322390,0.15188270245363553
LRN 1.125 09/01/27,STRIDE INC                  NOTE  1.125 9/0,86333MAA6,36266000.0,130000,0.1506530848198552
CDW,CDW CORP                    COM,12514G108,36118000.0,202238,0.15003827600296504
PAYC,PAYCOM SOFTWARE INC         COM,70432V102,35980000.0,155489,0.14946500832235124
CHTR,CHARTER COMMUNICATIONS INC N CL A,16119P108,35370000.0,86519,0.14693099900949314
TDG,TRANSDIGM GROUP INC         COM,893641100,34905000.0,22954,0.1449993361726423
HYG,ISHARES TR                  IBOXX HI YD ETF,464288513,34750000.0,430874,0.1443554485603587
T,AT&T INC                    COM,00206R102,34272000.0,1184255,0.14236978224634858
CP,CANADIAN PACIFIC KANSAS CITY COM,13646K108,34087000.0,348940,0.1416012712252359
MRVL,MARVELL TECHNOLOGY INC      COM,573874104,33429000.0,431904,0.13886786445825122
COIN 0.25 04/01/30,COINBASE GLOBAL INC         NOTE  0.250 4/0,19260QAF4,32795000.0,250000,0.1362341564183299
N/A,COCA-COLA EUROPACIFIC PARTNE SHS,G25839104,32573000.0,351309,0.13531194319299464
NOC,NORTHROP GRUMMAN CORP       COM,666807102,32500000.0,65003,0.13500869289817718
WAT,WATERS CORP                 COM,941848103,32082000.0,91915,0.13327227340182526
IEF,ISHARES TR                  7-10 YR TRSY BD,464287440,31780000.0,331839,0.13201773108627912
N/A,ELASTIC N V                 ORD SHS,N14506104,31229000.0,370321,0.12972881447745155
NTAP,NETAPP INC                  COM,64110D104,31193000.0,292756,0.12957926638685666
EWZ,ISHARES INC                 MSCI BRAZIL ETF,464286400,31162000.0,1080140,0.12945048886439992
N/A,MICROSTRATEGY INC,594972908,30955000.0,133300,0.12859058734347922
EWJ,ISHARES INC                 MSCI JPN ETF NEW,46434G822,30838000.0,411343,0.12810455604904578
EEM,ISHARES TR                  MSCI EMG MKT ETF,464287234,30478000.0,631805,0.12660907514309674
CDNS,CADENCE DESIGN SYSTEM INC   COM,127387108,30320000.0,98393,0.12595272518993023
GDX,VANECK ETF TRUST            GOLD MINERS ETF,92189F106,30281000.0,581655,0.1257907147584524
FSLR,FIRST SOLAR INC             COM,336433107,29654000.0,179136,0.1231860855139245
BIDUN,BAIDU INC                   SPON ADR REP A,056752108,29187000.0,340328,0.12124611444981839
DUK,DUKE ENERGY CORP NEW        COM NEW,26441C204,29074000.0,246389,0.1207766996098955
VIPS,VIPSHOP HLDGS LTD           SPONSORED ADS A,92763W103,29001000.0,1926991,0.12047344931507804
NOW,SERVICENOW INC              COM,81762P102,28994000.0,28202,0.1204443705196846
YMM,FULL TRUCK ALLIANCE CO LTD  SPONSORED ADS,35969L108,28446000.0,2408596,0.11816791625173995
IDXX,IDEXX LABS INC              COM,45168D104,28040000.0,52280,0.11648134611891964
BDX,BECTON DICKINSON & CO       COM,075887109,28002000.0,162566,0.11632348980106946
TSCO,TRACTOR SUPPLY CO           COM,892356106,27658000.0,524126,0.11489447471316261
N/A,INVESCO QQQ TR,46090E953,27439000.0,2612000,0.11398472382871028
ABT,ABBOTT LABS                 COM,002824100,27185000.0,199877,0.11292957896729067
AFRM,AFFIRM HLDGS INC            COM CL A,00827B106,27067000.0,391479,0.11243939355922959
CFG,CITIZENS FINL GROUP INC     COM,174610105,27066000.0,604834,0.11243523944560196
DHR,DANAHER CORPORATION         COM,235851102,26703000.0,135177,0.11092729619877001
POOL,POOL CORP                   COM,73278L105,26295000.0,90211,0.10923241783869443
ADI,ANALOG DEVICES INC          COM,032654105,26159000.0,109903,0.1086674583853359
SNAP,SNAP INC                    CL A,83304A106,26128000.0,3006711,0.1085386808628792
PM,PHILIP MORRIS INTL INC      COM,718172109,26024000.0,142888,0.10810665304560503
HOOD,ROBINHOOD MKTS INC          COM CL A,770700102,25939000.0,277035,0.10775355338725594
MDLZ,MONDELEZ INTL INC           CL A,609207105,25786000.0,382351,0.10711797400222761
PCG,PG&E CORP                   COM,69331C108,25660000.0,1840757,0.10659455568514545
ITRI 1.375 07/15/30,ITRON INC                   NOTE  1.375 7/1,465741AQ9,25500000.0,255000,0.10592989750472365
PAYX,PAYCHEX INC                 COM,704326107,25244000.0,173546,0.10486644441604877
ANET,ARISTA NETWORKS INC         COM SHS,040413205,25210000.0,246404,0.10472520455270914
BPOP,POPULAR INC                 COM NEW,733174700,25131000.0,228028,0.10439702957612587
RGA,REINSURANCE GRP OF AMERICA I COM NEW,759351604,24752000.0,124781,0.10282262051125174
MCD,MCDONALDS CORP              COM,580135101,24393000.0,83488,0.10133129371893035
SOXX,ISHARES TR                  ISHARES SEMICDTR,464287523,24359000.0,102048,0.10119005385559071
URI,UNITED RENTALS INC          COM,911363109,24040000.0,31909,0.09986489160837476
HSIC,HENRY SCHEIN INC            COM,806407102,23954000.0,327911,0.09950763783639804
ADP,AUTOMATIC DATA PROCESSING IN COM,053015103,23755000.0,77028,0.09868096922449844
EWH,ISHARES INC                 MSCI HONG KG ETF,464286871,23738000.0,1195271,0.09861034929282862
GE,GE AEROSPACE                COM NEW,369604301,23594000.0,91668,0.09801215693044901
HTHT 3 05/01/26,H WORLD GROUP LTD           NOTE  3.000 5/0,44332NAB2,23348000.0,220000,0.09699024497805049
CSX,CSX CORP                    COM,126408103,23159000.0,709731,0.09620511750242726
LSCC,LATTICE SEMICONDUCTOR CORP  COM,518415104,23063000.0,470760,0.09580632259417418
TDY,TELEDYNE TECHNOLOGIES INC   COM,879360105,23042000.0,44977,0.09571908620799381
BMY,BRISTOL-MYERS SQUIBB CO     COM,110122108,23002000.0,496918,0.09555292166288837
GLBE,GLOBAL E ONLINE LTD         SHS,M5216V106,22446000.0,669234,0.09324323448592262
ASND 2.25 04/01/28,ASCENDIS PHARMA A/S         NOTE  2.250 4/0,04351PAD3,22342000.0,180000,0.09281120666864846
GPN,GLOBAL PMTS INC             COM,37940X102,22124000.0,276412,0.09190560989782376
ECL,ECOLAB INC                  COM,278865100,21943000.0,81439,0.0911537153312216
QCOM,QUALCOMM INC                COM,747525103,21761000.0,136636,0.09039766665099182
NKE,NIKE INC                    CL B,654106103,21567000.0,303587,0.0895917686072304
KRE,SPDR SERIES TRUST           S&P REGL BKG,78464A698,21273000.0,358188,0.08837045920070533
XOM,EXXON MOBIL CORP            COM,30231G102,21269000.0,197301,0.08835384274619479
BROS,DUTCH BROS INC              CL A,26701L100,21244000.0,310720,0.0882499899055039
BRK/B,BERKSHIRE HATHAWAY INC DEL  CL B NEW,084670702,21055000.0,43343,0.08746486242988064
XLE,SELECT SECTOR SPDR TR       ENERGY,81369Y506,20813000.0,245413,0.08645956693199268
IWD,ISHARES TR                  RUS 1000 VAL ETF,464287598,20645000.0,106294,0.08576167584254979
ON,ON SEMICONDUCTOR CORP       COM,682189105,20473000.0,390625,0.08504716829859636
SHOP,SHOPIFY INC                 CL A SUB VTG SHS,82509L107,20443000.0,177226,0.08492254488976728
SKAA,SKECHERS U S A INC          CL A,830566105,20407000.0,323414,0.08477299679917237
SHY,ISHARES TR                  1 3 YR TREAS BD,464287457,20228000.0,244125,0.08402941045982548
WCN,WASTE CONNECTIONS INC       COM,94106B101,20205000.0,108210,0.08393386584638986
HUN,HUNTSMAN CORP               COM,447011107,20019000.0,1921233,0.08316120071164951
AR,ANTERO RESOURCES CORP       COM,03674X106,19435000.0,482506,0.08073519835310997
MTB,M & T BK CORP               COM,55261F104,19432000.0,100169,0.08072273601222706
SHV,ISHARES TR                  SHORT TREAS BD,464288679,19399000.0,175683,0.08058565026251506
WSM,WILLIAMS SONOMA INC         COM,969904101,19338000.0,118371,0.08033224933122925
SBUX,STARBUCKS CORP              COM,855244109,19177000.0,209289,0.07966343703717982
LPLA,LPL FINL HLDGS INC          COM,50212V100,18780000.0,50083,0.07801425392700823
SHW,SHERWIN WILLIAMS CO         COM,824348106,18687000.0,54424,0.07762792135963807
F,FORD MTR CO                 COM,345370860,18568000.0,1711357,0.07713358183794936
FOUR 0 12/15/25,SHIFT4 PMTS INC             NOTE        12/1,82452JAB5,18460000.0,145620,0.07668493756616464
PFE,PFIZER INC                  COM,717081103,18429000.0,760287,0.07655616004370792
SYY,SYSCO CORP                  COM,871829107,18416000.0,243148,0.07650215656654866
INTC,INTEL CORP                  COM,458140100,18329000.0,818244,0.0761407486809443
KDP,KEURIG DR PEPPER INC        COM,49271V100,18294000.0,553363,0.07599535470397703
LII,LENNOX INTL INC             COM,526107107,18219000.0,31783,0.07568379618190431
IQV,IQVIA HLDGS INC             COM,46266C105,17975000.0,114060,0.07467019245676107
TMO,THERMO FISHER SCIENTIFIC INC COM,883556102,17880000.0,44097,0.07427555166213563
CRCL,CIRCLE INTERNET GROUP INC   COM CL A,172573107,17806000.0,98217,0.07396814725369057
ENPH,ENPHASE ENERGY INC          COM,29355A107,17775000.0,448306,0.07383936973123384
SCHW,SCHWAB CHARLES CORP         COM,808513105,17763000.0,194681,0.0737895203677022
PSX,PHILLIPS 66                 COM,718546104,17751000.0,148796,0.07373967100417056
XLF,SELECT SECTOR SPDR TR       FINANCIAL,81369Y605,17498000.0,334131,0.0726886802563786
SLB,SCHLUMBERGER LTD            COM STK,806857108,17405000.0,514953,0.07230234768900844
APD,AIR PRODS & CHEMS INC       COM,009158106,17380000.0,61618,0.07219849484831753
EWW,ISHARES INC                 MSCI MEXICO ETF,464286822,17366000.0,286750,0.07214033725753062
V,VISA INC                    COM CL A,92826C839,17312000.0,48758,0.07191601512163827
KO,COCA COLA CO                COM,191216100,17281000.0,244259,0.07178723759918154
GD,GENERAL DYNAMICS CORP       COM,369550108,17160000.0,58835,0.07128458985023756
PSTG,PURE STORAGE INC            CL A,74624M102,16890000.0,293329,0.07016297917077578
CLX,CLOROX CO DEL               COM,189054109,16680000.0,138920,0.06929061530897218
MAA,MID-AMER APT CMNTYS INC     COM,59522J103,16636000.0,112398,0.06910783430935617
GDDY,GODADDY INC                 CL A,380237107,16600000.0,92189,0.06895828621876128
HIMS,HIMS & HERS HEALTH INC      COM CL A,433000106,16593000.0,332868,0.06892920742336782
CVNA,CARVANA CO                  CL A,146869102,16572000.0,49182,0.06884197103718746
MRK,MERCK & CO INC              COM,58933Y105,16566000.0,209275,0.06881704635542164
SPY,SPDR S&P 500 ETF TR         TR UNIT,78462F103,16434000.0,26598,0.06826870335657366
XLV,SELECT SECTOR SPDR TR       SBI HEALTHCARE,81369Y209,16409000.0,121740,0.06816485051588275
RBLX,ROBLOX CORP                 CL A,771049103,16365000.0,155565,0.06798206951626676
N/A,COSTCO WHSL CORP NEW,22160K905,16336000.0,155800,0.06786160022106531
LYV,LIVE NATION ENTERTAINMENT IN COM,538034109,16333000.0,107967,0.0678491378801824
HPE,HEWLETT PACKARD ENTERPRISE C COM,42824C109,16180000.0,791220,0.06721355849515406
N/A,PALANTIR TECHNOLOGIES INC,69608A908,16176000.0,550800,0.06719694204064351
D,DOMINION ENERGY INC         COM,25746U109,16150000.0,285740,0.06708893508632498
SMCI,SUPER MICRO COMER INC    COM NEW,86800U302,15953000.0,325509,0.06627057470168063
VECO 2.875 06/01/29,VEECO INSTRS INC DEL        NOTE  2.875 6/0,922417AJ9,15886000.0,150000,0.06599224908862901
MPWR,MONOLITHIC PWR SYS INC      COM,609839105,15884000.0,21718,0.06598394086137374
N/A,ADVANCED MICRO DEVICES INC,007903907,15840000.0,1347100,0.06580115986175775
URGN,UROGEN PHARMA LTD           COM,M96088105,15742000.0,1149081,0.06539405672624939
N/A,SPDR S&P 500 ETF TR,78462F903,15725000.0,247500,0.06532343679457958
MMM,3M CO                       COM,88579Y101,15697000.0,103105,0.06520712161300576
N/A,TAIWAN SEMICONDUCTOR MFG LTD,874039900,15685000.0,327200,0.06515727224947414
MRNA,MODERNA INC                 COM,60770K107,15426000.0,559129,0.06408135681991635
DDOG,DATADOG INC                 CL A COM,23804L103,15331000.0,114130,0.06368671602529091
N/A,SPDR S&P 500 ETF TR,78462F953,15261000.0,2697500,0.06339592807135637
IBM,INTERNATIONAL BUSINESS MACHS COM,459200101,15221000.0,51635,0.06322976352625093
XYL,XYLEM INC                   COM,98419M100,15218000.0,117637,0.06321730118536802
HES,HESS CORP                   COM,42809H107,15081000.0,108860,0.06264818761838185
FLUT,FLUTTER ENTMT PLC           SHS,G3643J108,15000000.0,52490,0.06231170441454331
CI,THE CIGNA GROUP             COM,125523100,14827000.0,44852,0.06159304275696225
BKH,BLACK HILLS CORP            COM,092113109,14699000.0,262011,0.06106131621262482
N/A,META PLATFORMS INC,30303M902,14663000.0,126800,0.060911768122029905
N/A,ORACLE CORP,68389X905,14654000.0,267900,0.06087438109938118
N/A,AMAZON COM INC,023135906,14551000.0,922700,0.06044650739573465
C,CITIGROUP INC               COM NEW,172967424,14403000.0,169211,0.05983169857884449
FRO,FRONTLINE PLC               COM,M46528101,14400000.0,877529,0.05981923623796159
QBTS,D-WAVE QUANTUM INC          COM,26740W109,14349000.0,980138,0.059607376442952144
SNPS,SYNOPSYS INC                COM,871607107,14233000.0,27762,0.05912549926214634
SE,SEA LTD                     SPONSORD ADS,81141R100,14218000.0,88894,0.05906318755773179
XLI,SELECT SECTOR SPDR TR       INDL,81369Y704,14041000.0,95182,0.05832790944564018
NEM,NEWMONT CORP                COM,651639106,14017000.0,240599,0.05822821071857691
VLO,VALERO ENERGY CORP          COM,91913Y100,13964000.0,103887,0.05800804269631219
XLU,SELECT SECTOR SPDR TR       SBI INT-UTILS,81369Y886,13899000.0,170205,0.05773802531051584
TJX,TJX COS INC NEW             COM,872540109,13705000.0,110982,0.056932127266754416
HAL,HALLIBURTON CO              COM,406216101,13669000.0,670700,0.05678257917615951
VGK,VANGUARD INTL EQUITY INDEX F FTSE EUROPE ETF,922042874,13610000.0,175615,0.056537486472128966
VOO,VANGUARD INDEX FDS          S&P 500 ETF SHS,922908363,13437000.0,23655,0.055818824814547904
BMRN,BIOMARIN PHARMACEUTICAL INC COM,09061G101,13382000.0,243447,0.05559034856502792
LULU,LULULEMON ATHLETICA INC     COM,550021109,13295000.0,55961,0.05522894067942356
AM,ANTERO MIDSTREAM CORP       COM,03676B102,13180000.0,695526,0.0547512176122454
CCL,CARNIVAL CORP               UNIT 99/99/9999,143658300,13138000.0,467209,0.05457674483988468
GLW,CORNING INC                 COM,219350105,13003000.0,247243,0.05401593950015379
STT,STATE STR CORP              COM,857477103,12999000.0,122238,0.053999323045643234
COIN,COINBASE GLOBAL INC         COM CL A,19260Q107,12992000.0,37068,0.05397024425024979
FCX,FREEPORT-MCMORAN INC        CL B,35671D857,12933000.0,298340,0.05372515154621924
CHKP,CHECK POINT SOFTWARE TECH LT ORD,M22465104,12867000.0,58157,0.053450980046795264
IRM,IRON MTN INC DEL            COM,46284V101,12854000.0,125316,0.05339697656963598
AEM,AGNICO EAGLE MINES LTD      COM,008474108,12739000.0,107115,0.05291925350245782
CAH,CARDINAL HEALTH INC         COM,14149Y108,12610000.0,75061,0.052383372844492744
IT,GARTNER INC                 COM,366651107,12581000.0,31123,0.0522629035492913
FLNC,FLUENCE ENERGY INC          COM CL A,34379V103,12539000.0,1868711,0.05208843077693058
BSX,BOSTON SCIENTIFIC CORP      COM,101137107,12383000.0,115288,0.051440389051019324
HUBB,HUBBELL INC                 COM,443510607,12296000.0,30106,0.05107898116541498
WBD,WARNER BROS DISCOVERY INC   COM SER A,934423104,12161000.0,1061194,0.05051817582568408
SPXN,PROSHARES TR                SP500 EX FINLS,74347B573,11922000.0,180000,0.04952534266867903
JPM,JPMORGAN CHASE & CO.        COM,46625H100,11918000.0,41110,0.049508726214168484
LEN,LENNAR CORP                 CL A,526057104,11915000.0,107717,0.049496263873285574
CBOE,CBOE GLOBAL MKTS INC        COM,12503M108,11909000.0,51064,0.04947133919151976
JNP,JUNIPER NETWORKS INC        COM,48203R104,11826000.0,296176,0.04912654776042595
N/A,BOOKING HOLDINGS INC,09857L908,11771000.0,6400,0.04889807151090596
N/A,BROADCOM INC,11135F901,11701000.0,135900,0.04860728355697143
PAAS,PAN AMERN SILVER CORP       COM,697900108,11543000.0,406453,0.0479509336038049
SNRE,SUNRISE COMMUNICATIONS AG   ADS CL A,867975104,11513000.0,203585,0.04782631019497581
N/A,GOLDMAN SACHS GROUP INC,38141G904,11266000.0,112500,0.04680024412894967
UVXY,PROSHARES TR II             ULTRA VIX SHORT,74347Y755,11260000.0,600539,0.046775319447183855
ACWI,ISHARES TR                  MSCI ACWI ETF,464288257,11221000.0,87253,0.04661330901570604
IYR,ISHARES TR                  U.S. REAL ES ETF,464287739,11122000.0,117355,0.04620205176657005
TEL,TE CONNECTIVITY PLC         ORD SHS,G87052109,11111000.0,65875,0.04615635651666605
IWF,ISHARES TR                  RUS 1000 GRW ETF,464287614,11074000.0,26083,0.04600265431244351
ABG,CENCORA INC                 COM,03073E105,11055000.0,36867,0.045923726153518425
CF,CF INDS HLDGS INC           COM,125269100,11009000.0,119660,0.04573263692664716
TIP,ISHARES TR                  TIPS BD ETF,464287176,10926000.0,99294,0.04538784549555335
OXY,OCCIDENTAL PETE CORP        COM,674599105,10809000.0,257304,0.04490181420111992
COP,CONOCOPHILLIPS              COM,20825C104,10781000.0,120135,0.0447854990195461
CVX,CHEVRON CORP NEW            COM,166764100,10743000.0,75023,0.044627642701695926
N/A,MIRION TECHNOLOGIES INC,60471A901,10726000.0,984000,0.04455702277002611
XBI,SPDR SERIES TRUST           S&P BIOTECH,78464A870,10678000.0,128763,0.04435762531589957
N/A,ETSY INC,29786A956,10616000.0,455000,0.04410007027098613
JHG,JANUS HENDERSON GROUP PLC   ORD SHS,G4474Y214,10572000.0,272199,0.043917289271370126
N/A,MICROSOFT CORP,594918904,10536000.0,316800,0.04376774118077523
SO,SOUTHERN CO                 COM,842587107,10481000.0,114138,0.043539264931255234
LLY,ELI LILLY & CO              COM,532457108,10469000.0,13430,0.0434894155677236
BILL,BILL HOLDINGS INC           COM,090043100,10460000.0,226117,0.04345202854507487
N/A,NVIDIA CORPORATION,67066G954,10411000.0,4488700,0.0432484769773207
PDD,PDD HOLDINGS INC            SPONSORED ADS,722304102,10409000.0,99452,0.04324016875006543
ASO,ACADEMY SPORTS & OUTDOORS IN COM,00402L107,10403000.0,232168,0.04321524406829961
BLD,TOPBUILD CORP               COM,89055F103,10387000.0,32085,0.04314877825025743
FLEX,FLEX LTD                    ORD,Y2573F102,10198000.0,204279,0.042363650774634186
