ticker,nameOfIssuer,cusip,value,shares,allocation_percent
FWRD,FORWARD AIR CORP            COM,34986A104,3168000.0,129087,0.01316023197235155
MDB,MONGODB INC                 CL A,60937P106,3150000.0,15000,0.013085457927054098
CPB,THE CAMPBELLS COMPANY       COM,134429109,3146000.0,102628,0.013068841472543554
AFW,ALIGN TECHNOLOGY INC        COM,016255101,3131000.0,16537,0.013006529768129008
NVR,NVR INC                     COM,62944T105,3124000.0,423,0.012977450972735555
N/A,SERVICENOW INC,81762P902,3109000.0,63800,0.012915139268321012
FDS,FACTSET RESH SYS INC        COM,303075105,3104000.0,6940,0.01289436870018283
BZ,KANZHUN LIMITED             SPONSORED ADS,48553T106,3101000.0,173822,0.012881906359299923
GMED,GLOBUS MED INC              CL A,379577208,3101000.0,52539,0.012881906359299923
AAL,AMERICAN AIRLS GROUP INC    COM,02376R102,3077000.0,274241,0.012782207632236654
L,LOEWS CORP                  COM,540424108,3071000.0,33506,0.012757282950470836
EXEL,EXELIXIS INC                COM,30161Q104,3068000.0,69617,0.012744820609587927
N/A,CATERPILLAR INC,149123901,3066000.0,89100,0.012736512382332654
MMC,MARSH & MCLENNAN COS INC    COM,571748102,3054000.0,13967,0.01268666301880102
WELL,WELLTOWER INC               COM,95040Q104,3026000.0,19681,0.012570347837227207
JCI,JOHNSON CTLS INTL PLC       SHS,G51502105,3006000.0,28465,0.012487265564674482
N/A,ELI LILLY & CO,532457908,2999000.0,24700,0.012458186769281027
QUAL,ISHARES TR                  MSCI USA QLT FCT,46432F339,2972000.0,16256,0.01234602570133485
SBSW,SIBANYE STILLWATER LTD      SPONSORED ADR,82575P107,2965000.0,410626,0.012316946905941397
FE 4 05/01/26,FIRSTENERGY CORP            NOTE  4.000 5/0,337932AR8,2961000.0,29500,0.012300330451430853
N/A,COUPANG INC,22266T909,2955000.0,411300,0.012275405769665034
K,KELLANOVA                   COM,487836108,2941000.0,36977,0.012217248178878128
TKO,TKO GROUP HOLDINGS INC      CL A,87256C101,2940000.0,16161,0.012213094065250492
NTRS,NORTHERN TR CORP            COM,665859104,2931000.0,23118,0.012175707042601765
ASND,ASCENDIS PHARMA A/S         SPONSORED ADR,04351P101,2920000.0,16915,0.012130011792697766
VSH,VISHAY INTERTECHNOLOGY INC  COM,928298108,2915000.0,183593,0.012109241224559586
TRP,TC ENERGY CORP              COM,87807B107,2901000.0,59468,0.012051083633772679
WSFS,WSFS FINL CORP              COM,929328102,2900000.0,52722,0.012046929520145041
PGNY,PROGYNY INC                 COM,74340E103,2894000.0,131550,0.012022004838379225
KRC,KILROY RLTY CORP            COM,49427F108,2869000.0,83628,0.01191815199768832
GNK,GENCO SHIPPING & TRADING LTD SHS,Y2685T131,2858000.0,218684,0.01187245674778432
N/A,AFFIRM HLDGS INC,00827B906,2850000.0,158000,0.01183922383876323
BASE,COUCHBASE INC               COM,22207T101,2838000.0,116406,0.011789374475231595
N/A,PALO ALTO NETWORKS INC,697435905,2837000.0,93500,0.01178522036160396
N/A,JPMORGAN CHASE & CO.,46625H950,2834000.0,467400,0.011772758020721051
IHG,INTERCONTINENTAL HOTELS GROU SPONSORED ADS,45857P806,2828000.0,24522,0.011747833338955233
BIIB,BIOGEN INC                  COM,09062X103,2822000.0,22470,0.011722908657189416
A4S,AMERIPRISE FINL INC         COM,03076C106,2819000.0,5281,0.011710446316306508
LCID,LUCID GROUP INC             COM,549498103,2804000.0,1328819,0.011648134611891965
AGO,ASSURED GUARANTY LTD        COM,G0585R106,2803000.0,32181,0.011643980498264329
IQ,IQIYI INC                   SPONSORED ADS,46267X108,2781000.0,1571432,0.011552589998456332
KMI,KINDER MORGAN INC DEL       COM,49456B101,2763000.0,93980,0.011477815953158879
N/A,NIKE INC,654106903,2748000.0,684800,0.011415504248744338
MGV,VANGUARD WORLD FD           MEGA CAP VAL ETF,921910840,2747000.0,20941,0.0114113501351167
IEX,IDEX CORP                   COM,45167R104,2745000.0,15636,0.011403041907861428
N/A,PALO ALTO NETWORKS INC,697435955,2744000.0,754400,0.011398887794233791
FTNT,FORTINET INC                COM,34959E109,2743000.0,25948,0.011394733680606155
RDWR,RADWARE LTD                 ORD,M81873107,2741000.0,93101,0.011386425453350882
W 3.5 11/15/28,WAYFAIR INC                 NOTE  3.50011/1,94419LAR2,2722000.0,20000,0.011307497294425794
WYNN,WYNN RESORTS LTD            COM,983134107,2718000.0,29021,0.01129088083991525
STZ,CONSTELLATION BRANDS INC    CL A,21036P108,2680000.0,16476,0.011133024522065074
N/A,ALPHABET INC,02079K905,2679000.0,449300,0.011128870408437436
PLNT,PLANET FITNESS INC          CL A,72703H101,2678000.0,24557,0.011124716294809801
BWXT,BWX TECHNOLOGIES INC        COM,05605H100,2673000.0,18552,0.01110394572667162
SOUN,SOUNDHOUND AI INC           CLASS A COM,836100107,2673000.0,249143,0.01110394572667162
PTON 5.5 12/01/29,PELOTON INTERACTIVE INC     NOTE  5.50012/0,70614WAD2,2661000.0,14750,0.011054096363139984
TRL,DAVITA INC                  COM,23918K108,2656000.0,18644,0.011033325795001804
NCLH 2.5 02/15/27,NCL CORP LTD                NOTE  2.500 2/1,62886HBK6,2644000.0,26410,0.01098347643147017
ITW,ILLINOIS TOOL WKS INC       COM,452308109,2637000.0,10666,0.010954397636076715
OGE,OGE ENERGY CORP             COM,670837103,2583000.0,58202,0.01073007550018436
SPGI,S&P GLOBAL INC              COM,78409V104,2577000.0,4887,0.010705150818418541
R,RYDER SYS INC               COM,783549108,2576000.0,16203,0.010700996704790905
N/A,PAYPAL HLDGS INC,70450Y903,2573000.0,582800,0.010688534363907997
CPRT,COPART INC                  COM,217204106,2571000.0,52390,0.010680226136652725
ZWS,ZURN ELKAY WATER SOLNS CORP COM,98983L108,2564000.0,70113,0.01065114734125927
GWW,GRAINGER W W INC            COM,384802104,2551000.0,2452,0.010597143864100001
RE,EVEREST GROUP LTD           COM,G3223R108,2527000.0,7437,0.010497445137036732
HESM,HESS MIDSTREAM LP           CL A SHS,428103105,2525000.0,65555,0.01048913690978146
IBKR,INTERACTIVE BROKERS GROUP IN COM CL A,45841N107,2517000.0,45434,0.01045590400076037
CC,CHEMOURS CO                 COM,163851108,2514000.0,219576,0.01044344165987746
N/A,GE AEROSPACE,369604901,2504000.0,41500,0.010401900523601099
N/A,KROGER CO,501044901,2498000.0,824500,0.01037697584183528
DUK 4.125 04/15/26,DUKE ENERGY CORP NEW        NOTE  4.125 4/1,26441CBY0,2494000.0,23600,0.010360359387324736
COKE,COCA COLA CONS INC          COM,191098102,2493000.0,22333,0.0103562052736971
ITGR,INTEGER HLDGS CORP          COM,45826H109,2486000.0,20219,0.010327126478303646
VALE,VALE S A                    SPONSORED ADS,91912E105,2484000.0,255854,0.010318818251048373
MASI,MASIMO CORP                 COM,574795100,2484000.0,14766,0.010318818251048373
N/A,SEA LTD,81141R950,2482000.0,1559800,0.010310510023793101
RL,RALPH LAUREN CORP           CL A,751212101,2479000.0,9038,0.010298047682910193
RPRX,ROYALTY PHARMA PLC          SHS CLASS A,G7709Q104,2475000.0,68705,0.010281431228399649
EME,EMCOR GROUP INC             COM,29084Q100,2474000.0,4626,0.010277277114772011
EXPE 0 02/15/26,EXPEDIA GROUP INC           NOTE         2/1,30212PBE4,2471000.0,25400,0.010264814773889103
CEG,CONSTELLATION ENERGY CORP   COM,21037T109,2457000.0,7614,0.010206657183102196
GCO,GENESCO INC                 COM,371532102,2453000.0,124566,0.010190040728591651
EOG,EOG RES INC                 COM,26875P101,2442000.0,20415,0.010144345478687651
KSPI,KASPI KZ JSC                SPONSORED ADS,48581R205,2431000.0,28637,0.010098650228783654
VLTO,VERALTO CORP                COM SHS,92338C103,2424000.0,24011,0.0100695714333902
TMUS,T-MOBILE US INC             COM,872590104,2418000.0,10149,0.010044646751624382
N/A,BOEING CO,097023905,2408000.0,144200,0.01000310561534802
PK,PARK HOTELS & RESORTS INC   COM,700517105,2405000.0,235070,0.009990643274465113
BHF,BRIGHTHOUSE FINL INC        COM,10922N103,2402000.0,44674,0.009978180933582203
ESS,ESSEX PPTY TR INC           COM,297178105,2398000.0,8462,0.009961564479071658
SLAB,SILICON LABORATORIES INC    COM,826919102,2397000.0,16264,0.009957410365444022
RS,RELIANCE INC                COM,759509102,2397000.0,7636,0.009957410365444022
RNG,RINGCENTRAL INC             CL A,76680R206,2393000.0,84400,0.009940793910933478
NCLH 5.375 08/01/25,NCL CORP LTD                NOTE  5.375 8/0,62886HAX9,2373000.0,21520,0.009857711638380753
NE,NOBLE CORP PLC              ORD SHS A,G65431127,2371000.0,89291,0.00984940341112548
FIS,FIDELITY NATL INFORMATION SV COM,31620M106,2357000.0,28949,0.009791245820338574
NRG,NRG ENERGY INC              COM NEW,629377508,2351000.0,14641,0.009766321138572755
SFD,SMITHFIELD FOODS INC        COM,832248207,2345000.0,99662,0.009741396456806939
CCS,CENTURY CMNTYS INC          COM,156504300,2343000.0,41602,0.009733088229551667
EQIX,EQUINIX INC                 COM,29444U700,2332000.0,2932,0.009687392979647668
KGC,KINROSS GOLD CORP           COM,496902404,2330000.0,149060,0.009679084752392396
ICLR,ICON PLC                    SHS,G4705A100,2322000.0,15962,0.009645851843371307
CBRE,CBRE GROUP INC              CL A,12504L109,2310000.0,16488,0.009596002479839673
CCJ,CAMECO CORP                 COM,13321L108,2302000.0,31015,0.009562769570818582
SHOPCN 0.125 11/01/25,SHOPIFY INC                 NOTE  0.12511/0,82509LAA5,2288000.0,22520,0.009504611980031675
OKLO,OKLO INC                    COM CL A,02156V109,2286000.0,40832,0.009496303752776403
DXCM,DEXCOM INC                  COM,252131107,2285000.0,26176,0.009492149639148765
DNUT,KRISPY KREME INC            COM,50101L106,2282000.0,784136,0.009479687298265857
AKX,ANSYS INC                   COM,03662Q105,2278000.0,6486,0.009463070843755313
LVS,LAS VEGAS SANDS CORP        COM,517834107,2277000.0,52338,0.009458916730127675
PLD,PROLOGIS INC.               COM,74340W103,2275000.0,21644,0.009450608502872403
NUE,NUCOR CORP                  COM,670346105,2270000.0,17521,0.009429837934734222
N/A,ADOBE INC,00724F951,2260000.0,31800,0.00938829679845786
ITRI 0 03/15/26,ITRON INC                   NOTE         3/1,465741AN6,2251000.0,19920,0.009350909775809133
ARES,ARES MANAGEMENT CORPORATION CL A COM STK,03990B101,2244000.0,12957,0.00932183098041568
SPOT 0 03/15/26,SPOTIFY USA INC             NOTE         3/1,84921RAB6,2232000.0,14750,0.009271981616884046
MNST,MONSTER BEVERAGE CORP NEW   COM,61174X109,2216000.0,35373,0.009205515798841867
WK 1.25 08/15/28,WORKIVA INC                 NOTE  1.250 8/1,98139AAD7,2216000.0,24000,0.009205515798841867
CUCA,AVIS BUDGET GROUP           COM,053774105,2206000.0,13049,0.009163974662565504
ET,ENERGY TRANSFER L P         COM UT LTD PTN,29273V100,2204000.0,121592,0.009155666435310232
EWG,ISHARES INC                 MSCI GERMANY ETF,464286806,2193000.0,51841,0.009109971185406233
MIDD 1 09/01/25,MIDDLEBY CORP               NOTE  1.000 9/0,596278AB7,2192000.0,19400,0.009105817071778597
PLUN,PLUG POWER INC              COM NEW,72919P202,2190000.0,1469909,0.009097508844523325
IRMD,IRADIMED CORP               COM,46266A109,2183000.0,36516,0.009068430049129871
RIOT,RIOT PLATFORMS INC          COM,767292105,2179000.0,192811,0.009051813594619325
KKR,KKR & CO INC                COM,48251W104,2178000.0,16372,0.00904765948099169
AAL 6.5 07/01/25,AMERICAN AIRLINES GROUP INC NOTE  6.500 7/0,02376RAF9,2177000.0,21750,0.009043505367364053
RMD,RESMED INC                  COM,761152107,2152000.0,8343,0.008939652526673149
FOX,FOX CORP                    CL B COM,35137L204,2152000.0,41675,0.008939652526673149
UAL,UNITED AIRLS HLDGS INC      COM,910047109,2136000.0,26822,0.008873186708630968
BKR,BAKER HUGHES COMPANY        CL A,05722G100,2128000.0,55491,0.00883995379960988
ADTN,ADTRAN HOLDINGS INC         COM,00486H105,2128000.0,237207,0.00883995379960988
JKHY,HENRY JACK & ASSOC INC      COM,426281101,2126000.0,11801,0.008831645572354605
TAL,TAL EDUCATION GROUP         SPONSORED ADS,874080104,2126000.0,207977,0.008831645572354605
IMAB,I MAB                       SPONSORED ADS,44975P103,2121000.0,876353,0.008810875004216425
ERIE,ERIE INDTY CO               CL A,29530P102,2121000.0,6116,0.008810875004216425
N/A,CINTAS CORP,172908905,2120000.0,152400,0.008806720890588789
FBK,FB FINL CORP                COM,30257X104,2116000.0,46712,0.008790104436078245
BALL,BALL CORP                   COM,058498106,2112000.0,37658,0.008773487981567699
BCRX,BIOCRYST PHARMACEUTICALS INC COM,09058V103,2110000.0,235532,0.008765179754312426
MGA,MAGNA INTL INC              COM,559222401,2109000.0,54631,0.008761025640684792
MOH,MOLINA HEALTHCARE INC       COM,60855R100,2101000.0,7052,0.008727792731663702
CFLT 0 01/15/27,CONFLUENT INC               NOTE         1/1,20717MAB9,2093000.0,22400,0.008694559822642611
AMCR,AMCOR PLC                   ORD,G0250X107,2091000.0,227567,0.008686251595387339
VICI,VICI PPTYS INC              COM,925652109,2079000.0,63758,0.008636402231855704
MBLY,MOBILEYE GLOBAL INC         COMMON CLASS A,60741F104,2073000.0,115321,0.008611477550089888
N/A,INTUITIVE SURGICAL INC,46120E902,2064000.0,29300,0.00857409052744116
QTWO 0.125 11/15/25,Q2 HLDGS INC                NOTE  0.12511/1,74736LAF6,2060000.0,20880,0.008557474072930615
BJ,BJS WHSL CLUB HLDGS INC     COM,05550J101,2053000.0,19042,0.008528395277537163
SEZL,SEZZLE INC                  COM,78435P105,2048000.0,11426,0.00850762470939898
N/A,CAMECO CORP,13321L908,2047000.0,85400,0.008503470595771346
ATI,ATI INC                     COM,01741R102,2041000.0,23636,0.008478545914005528
KAI,KADANT INC                  COM,48282T104,2033000.0,6405,0.008445313004984438
PGX,INVESCO EXCH TRADED FD TR II PFD ETF,46138E511,2029000.0,182300,0.008428696550473893
VRSK,VERISK ANALYTICS INC        COM,92345Y106,2011000.0,6457,0.008353922505176442
EZU,ISHARES INC                 MSCI EURZONE ETF,464286608,2008000.0,33775,0.008341460164293532
IFF,INTERNATIONAL FLAVORS&FRAGRA COM,459506101,2005000.0,27260,0.008328997823410624
PCAR,PACCAR INC                  COM,693718108,2003000.0,21068,0.008320689596155352
UPWK 0.25 08/15/26,UPWORK INC                  NOTE  0.250 8/1,91688FAB0,1998000.0,21170,0.00829991902801717
EXPD,EXPEDITORS INTL WASH INC    COM,302130109,1997000.0,17478,0.008295764914389533
MSI,MOTOROLA SOLUTIONS INC      COM NEW,620076307,1995000.0,4744,0.008287456687134261
HUBG,HUB GROUP INC               CL A,443320106,1988000.0,59467,0.008258377891740807
KTOS,KRATOS DEFENSE & SEC SOLUTIO COM NEW,50077B207,1986000.0,42747,0.008250069664485535
TOST,TOAST INC                   CL A,888787108,1985000.0,44826,0.008245915550857899
FUTU,FUTU HLDGS LTD              SPON ADS CL A,36118L106,1983000.0,16042,0.008237607323602627
CBT,CABOT CORP                  COM,127055101,1970000.0,26273,0.008183603846443356
7HP,HP INC                      COM,40434L105,1967000.0,80436,0.008171141505560447
UTHR,UNITED THERAPEUTICS CORP DEL COM,91307C102,1958000.0,6814,0.008133754482911721
N/A,ISHARES SILVER TR,46428Q909,1954000.0,569000,0.008117138028401177
DKNG 0 03/15/28,DRAFTKINGS INC NEW          NOTE         3/1,26142RAB0,1953000.0,21800,0.00811298391477354
N/A,MARVELL TECHNOLOGY INC,573874954,1946000.0,400000,0.008083905119380086
SHAK 0 03/01/28,SHAKE SHACK INC             NOTE         3/0,819047AB7,1942000.0,18150,0.008067288664869542
SIL,GLOBAL X FDS                GLOBAL X SILVER,37954Y848,1936000.0,40214,0.008042363983103724
EL,LAUDER ESTEE COS INC        CL A,518439104,1936000.0,23955,0.008042363983103724
N/A,SNOWFLAKE INC,833445909,1934000.0,32000,0.008034055755848452
N/A,DATADOG INC,23804L903,1934000.0,97900,0.008034055755848452
JEF,JEFFERIES FINL GROUP INC    COM,47233W109,1931000.0,35300,0.008021593414965543
CGNT,COGNYTE SOFTWARE LTD        ORD SHS,M25133105,1930000.0,208843,0.008017439301337907
MOS,MOSAIC CO NEW               COM,61945C103,1925000.0,52760,0.007996668733199725
CGNX,COGNEX CORP                 COM,192422103,1924000.0,60656,0.00799251461957209
WM,WASTE MGMT INC DEL          COM,94106L109,1924000.0,8410,0.00799251461957209
RUN,SUNRUN INC                  COM,86771W105,1919000.0,234612,0.007971744051433909
CNM,CORE & MAIN INC             CL A,21874C102,1918000.0,31780,0.007967589937806272
BBAI,BIGBEAR AI HLDGS INC        COM,08975B109,1913000.0,281697,0.007946819369668092
EDU,NEW ORIENTAL ED & TECHNOLOGY SPON ADR,647581206,1912000.0,35433,0.007942665256040456
SNOW,SNOWFLAKE INC               CL A,833445109,1910000.0,8534,0.007934357028785182
BABA 0.5 06/01/31,ALIBABA GROUP HLDG LTD      NOTE  0.500 6/0,01609WBG6,1908000.0,15000,0.00792604880152991
N/A,REDDIT INC,75734B900,1907000.0,60000,0.007921894687902274
AKAM 1.125 02/15/29,AKAMAI TECHNOLOGIES INC     NOTE  1.125 2/1,00971TAN1,1900000.0,20000,0.007892815892508821
N/A,AGNICO EAGLE MINES LTD,008474908,1897000.0,76500,0.007880353551625911
MSCI,MSCI INC                    COM,55354G100,1895000.0,3285,0.007872045324370639
GBX 2.875 04/15/28,GREENBRIER COS INC          NOTE  2.875 4/1,393657AM3,1894000.0,17790,0.007867891210743003
CVS,CVS HEALTH CORP             COM,126650100,1884000.0,27319,0.007826350074466642
TTD,THE TRADE DESK INC          COM CL A,88339J105,1876000.0,26064,0.007793117165445551
VTR,VENTAS INC                  COM,92276F100,1874000.0,29669,0.007784808938190279
ICVT,ISHARES TR                  CONV BD ETF,46435G102,1874000.0,20794,0.007784808938190279
CRSP,CRISPR THERAPEUTICS AG      NAMEN AKT,H17182108,1872000.0,38482,0.007776500710935007
DOCN 0 12/01/26,DIGITALOCEAN HLDGS INC      NOTE        12/0,25402DAB8,1869000.0,19960,0.0077640383700520975
ULTA,ULTA BEAUTY INC             COM,90384S303,1868000.0,3992,0.0077598842564244605
PRCH 9 05/15/30,PORCH GROUP INC             DEBT  9.000 5/1,733245AD6,1868000.0,15000,0.0077598842564244605
MELI,MERCADOLIBRE INC            COM,58733R102,1866000.0,714,0.007751576029169188
ABNB,AIRBNB INC                  COM CL A,009066101,1865000.0,14092,0.007747421915541553
ACM,AECOM                       COM,00766T100,1860000.0,16481,0.007726651347403372
ACGL,ARCH CAP GROUP LTD          ORD,G0450A105,1860000.0,20428,0.007726651347403372
BOX 0 01/15/26,BOX INC                     NOTE         1/1,10316TAB0,1860000.0,14000,0.007726651347403372
LPX,LOUISIANA PAC CORP          COM,546347105,1858000.0,21603,0.007718343120148099
MBWM,MERCANTILE BK CORP          COM,587376104,1858000.0,40042,0.007718343120148099
BCS,BARCLAYS PLC                ADR,06738E204,1857000.0,99878,0.007714189006520463
HTO,H2O AMERICA                 COM,784305104,1852000.0,35645,0.0076934184383822815
PAWZ,PROSHARES TR                PET CARE ETF,74348A145,1849000.0,31927,0.007680956097499372
KEYS,KEYSIGHT TECHNOLOGIES INC   COM,49338L103,1843000.0,11250,0.007656031415733556
WMS,ADVANCED DRAIN SYS INC DEL  COM,00790R104,1842000.0,16038,0.00765187730210592
IBB,ISHARES TR                  ISHARES BIOTECH,464287556,1841000.0,14553,0.007647723188478284
AWM,SKYWORKS SOLUTIONS INC      COM,83088M102,1840000.0,24688,0.007643569074850647
DB,DEUTSCHE BANK A G           NAMEN AKT,D18190898,1839000.0,62803,0.007639414961223011
ACN,ACCENTURE PLC IRELAND       SHS CLASS A,G1151C101,1832000.0,6131,0.007610336165829557
N/A,DELL TECHNOLOGIES INC,24703L902,1816000.0,160700,0.007543870347787378
LEU,CENTRUS ENERGY CORP         CL A,15643U104,1807000.0,9865,0.007506483325138652
TRIP,TRIPADVISOR INC             COM,896945201,1806000.0,138384,0.007502329211511016
ZTS,ZOETIS INC                  CL A,98978V103,1801000.0,11548,0.007481558643372834
LUV,SOUTHWEST AIRLS CO          COM,844741108,1792000.0,55251,0.007444171620724109
SLN,SILENCE THERAPEUTICS PLC    ADS,82686Q101,1788000.0,308331,0.007427555166213564
ITRI,ITRON INC                   COM,465741106,1772000.0,13464,0.0073610893481713836
NBR 1.75 06/15/29,NABORS INDS INC             NOTE  1.750 6/1,62957HAL9,1766000.0,30720,0.007336164666405567
TDOC,TELADOC HEALTH INC          COM,87918A105,1766000.0,202786,0.007336164666405567
KEY,KEYCORP                     COM,493267108,1760000.0,101036,0.007311239984639749
N/A,CENCORA INC,03073E905,1758000.0,41400,0.007302931757384477
FITB,FIFTH THIRD BANCORP         COM,316773100,1756000.0,42692,0.0072946235301292045
LIF,LIFE360 INC                 COM,532206109,1752000.0,26851,0.00727800707561866
MRVI,MARAVAI LIFESCIENCES HLDGS I COM CL A,56600D107,1751000.0,726742,0.007273852961991023
HMY,HARMONY GOLD MINING CO LTD  SPONSORED ADR,413216300,1750000.0,125282,0.007269698848363388
PEO,EXELON CORP                 COM,30161N101,1743000.0,40148,0.0072406200529699346
ALKS,ALKERMES PLC                SHS,G01767105,1741000.0,60842,0.007232311825714661
GCMG,GCM GROSVENOR INC           COM CL A,36831E108,1735000.0,150098,0.007207387143948844
N/A,META PLATFORMS INC,30303M952,1734000.0,227500,0.007203233030321207
KRYS,KRYSTAL BIOTECH INC         COM,501147102,1733000.0,12607,0.007199078916693572
NSC,NORFOLK SOUTHN CORP         COM,655844108,1730000.0,6758,0.007186616575810663
DKS,DICKS SPORTING GOODS INC    COM,253393102,1723000.0,8708,0.007157537780417209
AON,AON PLC                     SHS CL A,G0403H108,1712000.0,4800,0.007111842530513212
WPC,WP CAREY INC                COM,92936U109,1707000.0,27368,0.00709107196237503
CNP,CENTERPOINT ENERGY INC      COM,15189T107,1707000.0,46466,0.00709107196237503
HALO,HALOZYME THERAPEUTICS INC   COM,40637H109,1702000.0,32712,0.007070301394236849
PBH,PRESTIGE CONSMR HEALTHCARE I COM,74112D101,1696000.0,21235,0.007045376712471031
MPW,MEDICAL PPTYS TRUST INC     COM,58463J304,1695000.0,393286,0.007041222598843396
SNA,SNAP ON INC                 COM,833034101,1694000.0,5445,0.007037068485215759
JBHT,HUNT J B TRANS SVCS INC     COM,445658107,1688000.0,11756,0.007012143803449942
DEA,EASTERLY GOVT PPTYS INC     COM SHS,27616P301,1684000.0,75852,0.006995527348939396
SOFI,SOFI TECHNOLOGIES INC       COM,83406F102,1683000.0,92416,0.006991373235311761
N/A,BOEING CO,097023955,1680000.0,310000,0.006978910894428852
N/A,BANK OF NT BUTTERFIELD&SON L SHS NEW,G0772R208,1679000.0,37914,0.006974756780801215
MLYS,MINERALYS THERAPEUTICS INC  COM,603170101,1678000.0,123987,0.00697060266717358
KIM,KIMCO RLTY CORP             COM,49446R109,1668000.0,79367,0.006929061530897217
TWLO,TWILIO INC                  CL A,90138F102,1653000.0,13294,0.006866749826482673
EPI,WISDOMTREE TR               INDIA ERNGS FD,97717W422,1649000.0,34741,0.006850133371972129
ATRC,ATRICURE INC                COM,04963C209,1647000.0,50249,0.006841825144716857
LNT,ALLIANT ENERGY CORP         COM,018802108,1646000.0,27220,0.00683767103108922
GRBK,GREEN BRICK PARTNERS INC    COM,392709101,1641000.0,26099,0.0068169004629510385
BWA,BORGWARNER INC              COM,099724106,1641000.0,49007,0.0068169004629510385
RGTI,RIGETTI COMING INC       COMMON STOCK,76655K103,1638000.0,138105,0.00680443812206813
LAZ,LAZARD INC                  COM,52110M109,1636000.0,34100,0.006796129894812857
DOC,HEALTHPEAK PROPERTIES INC   COM,42250P103,1633000.0,93255,0.00678366755392995
FERG,FERGUSON ENTERPRISES INC    COMMON STOCK NEW,31488V107,1631000.0,7489,0.006775359326674677
STX,SEAGATE TECHNOLOGY HLDNGS PL ORD SHS,G7997R103,1624000.0,11251,0.006746280531281223
N/A,GLOBAL PMTS INC,37940X902,1624000.0,290000,0.006746280531281223
MIR,MIRION TECHNOLOGIES INC     COM CL A,60471A101,1623000.0,75406,0.006742126417653587
IBP,INSTALLED BLDG PRODS INC    COM,45780R101,1622000.0,8995,0.00673797230402595
SNEX,STONEX GROUP INC            COM,861896108,1622000.0,17798,0.00673797230402595
PSA,PUBLIC STORAGE OPER CO      COM,74460D109,1620000.0,5522,0.006729664076770678
BTSG,BRIGHTSPRING HEALTH SVCS INC COM,10950A106,1616000.0,68487,0.006713047622260134
BBVA,BANCO BILBAO VIZCAYA ARGENTA SPONSORED ADR,05946K101,1604000.0,104354,0.006663198258728499
N/A,SELECT SECTOR SPDR TR,81369Y905,1602000.0,500000,0.006654890031473226
NWS,NEWS CORP NEW               CL B,65249B208,1601000.0,46652,0.006650735917845591
FBP,FIRST BANCORP P R           COM NEW,318672706,1599000.0,76758,0.006642427690590318
CDE,COEUR MNG INC               COM NEW,192108504,1596000.0,180086,0.0066299653497074095
KT,KT CORP                     SPONSORED ADR,48268K101,1592000.0,76592,0.006613348895196864
PLTK,PLAYTIKA HLDG CORP          COM,72815L107,1591000.0,336275,0.006609194781569228
N/A,T-MOBILE US INC,872590904,1588000.0,33900,0.006596732440686319
FUL,FULLER H B CO               COM,359694106,1588000.0,26404,0.006596732440686319
XMTR 1 02/01/27,XOMETRY INC                 NOTE  1.000 2/0,98423FAB5,1585000.0,15600,0.006584270099803411
EWY,ISHARES INC                 MSCI STH KOR ETF,464286772,1585000.0,22078,0.006584270099803411
BRO,BROWN & BROWN INC           COM,115236101,1585000.0,14298,0.006584270099803411
EW,EDWARDS LIFESCIENCES CORP   COM,28176E108,1583000.0,20234,0.006575961872548138
RH,RH                          COM,74967X103,1583000.0,8375,0.006575961872548138
KMB,KIMBERLY-CLARK CORP         COM,494368103,1582000.0,12273,0.006571807758920503
KBR,KBR INC                     COM,48242W106,1580000.0,32955,0.00656349953166523
FIVN 1 03/15/29,FIVE9 INC                   NOTE  1.000 3/1,338307AF8,1576000.0,18070,0.006546883077154684
SPG,SIMON PPTY GROUP INC NEW    COM,828806109,1569000.0,9759,0.006517804281761231
AIZ,ASSURANT INC                COM,04621X108,1564000.0,7920,0.00649703371362305
OHI,OMEGA HEALTHCARE INVS INC   COM,681936100,1564000.0,42669,0.00649703371362305
WMG,WARNER MUSIC GROUP CORP     COM CL A,934550203,1562000.0,57354,0.0064887254863677775
N/A,MONGODB INC,60937P956,1557000.0,60000,0.006467954918229596
VRA,VERA BRADLEY INC            COM,92335C106,1552000.0,702175,0.006447184350091415
HL,HECLA MNG CO                COM,422704106,1549000.0,258574,0.006434722009208508
LYB,LYONDELLBASELL INDUSTRIES N SHS - A -,N53745100,1547000.0,26741,0.006426413781953234
FOUR 0.5 08/01/27,SHIFT4 PMTS INC             NOTE  0.500 8/0,82452JAD1,1546000.0,14400,0.0064222596683255985
BLDR,BUILDERS FIRSTSOURCE INC    COM,12008R107,1544000.0,13231,0.006413951441070326
CINF,CINCINNATI FINL CORP        COM,172062101,1537000.0,10324,0.006384872645676873
MARA,MARA HOLDINGS INC           COM,565788106,1532000.0,97690,0.006364102077538692
BILL 0 12/01/25,BILL HOLDINGS INC           NOTE        12/0,090043AB6,1524000.0,15740,0.006330869168517601
ZS,ZSCALER INC                 COM,98980G102,1524000.0,4853,0.006330869168517601
FIX,COMFORT SYS USA INC         COM,199908104,1523000.0,2841,0.006326715054889966
