ticker,nameOfIssuer,cusip,value,shares,allocation_percent
MSFT,MICROSOFT CORP USD 0.00000625 Common Stock,594918104,1744033366000.0,3506229,7.521839121085491
V,VISA INC USD0.0001 Common Stock,92826C839,1216768066000.0,3427033,5.247797329197619
AMZN,AMAZON COM INC USD0.01 Common Stock,023135106,1196837828000.0,5455298,5.16184023296111
GOOGL,ALPHABET INC USD0.001 Cls A Common Stock,02079K305,836498076000.0,4746627,3.6077314089468766
JPM,JP MORGAN CHASE & CO USD1 Common Stock,46625H100,803942172000.0,2773075,3.46732109507132
NVDA,NVIDIA CORP USD0.001 Common Stock,67066G104,800030552000.0,5063805,3.4504506745183563
AAPL,APPLE INC NPV Common Stock,037833100,596525004000.0,2907467,2.5727518746294895
BRK/B,BERKSHIRE HATHAWAY INC USD0.0033 Cls B Common Stock,084670702,511496673000.0,1052963,2.2060333020466265
META,META PLATFORMS INC USD0.000006 Cls A Common Stock,30303M102,406855874000.0,551228,1.7547281430260373
KO,COCA-COLA CO USD0.25 Common Stock,191216100,403573635000.0,5704221,1.7405721789279553
ACN,ACCENTURE PLC New A Class Shares,G1151C101,394616695000.0,1320274,1.701941804641174
ABT,ABBOTT LABORATORIES NPV Common Stock,002824100,391230316000.0,2876482,1.6873366952793944
TMO,THERMO FISHER SCIENTIFIC INC USD1 Common Stock,883556102,367084832000.0,905354,1.5831996703294122
GOOG,ALPHABET INC USD0.001 Cls C Common Stock,02079K107,354031769000.0,1995782,1.5269031327530813
APH,AMPHENOL CORP USD0.001 Cls A Common Stock,032095101,324182030000.0,3282856,1.3981642342081833
SPGI,S&P GLOBAL INC USD1 Common Stock,78409V104,323186059000.0,612919,1.3938687122432287
MA,MASTERCARD INC USD0.0001 Class A Common Stock,57636Q104,316437405000.0,563116,1.3647624516283328
BKNG,BOOKING HOLDINGS INC USD0.008 Common Stock,09857L108,312532121000.0,53985,1.3479193576011117
N/A,LINDE PLC EUR0.001 Common Shares,G54950103,274134367000.0,584284,1.1823137368431558
COST,COSTCO CORP NPV Common Stock,22160K105,273258260000.0,276130,1.178535176160013
CME,CME GROUP INC USD0.01 Cls A Common Stock,12572Q105,258354611000.0,937358,1.1142572487530171
ISRG,INTUITIVE SURGICAL INC USD0.001 Common Stock,46120E602,250166400000.0,460364,1.0789423247199053
INTU,INTUIT INC USD0.01 Common Stock,461202103,247081893000.0,313703,1.0656391586944325
BSX,BOSTON SCIENTIFIC USD0.01 Common Stock,101137107,241720619000.0,2250448,1.04251652738575
ADBE,ADOBE INC USD0.0001 Common Stock,00724F101,237909921000.0,614945,1.0260813731886815
PG,PROCTER & GAMBLE CO NPV Common Stock,742718109,225701474000.0,1416655,0.9734275788046247
MMC,MARSH & MCLENNAN CO INC USD1 Common Stock,571748102,216659996000.0,990944,0.9344326006931601
LLY,LILLY (ELI) & CO NPV Common Stock,532457108,214369970000.0,274999,0.924555950686968
HD,HOME DEPOT INC USD0.05 Common Stock,437076102,211784830000.0,577637,0.9134065039134349
TSM,TAIWAN SEMICONDUCTORS MAN LTD ADS Rep 5 TWD10 Ord Share,874039100,201237044000.0,888503,0.8679149720870662
CRM,SALESFORCE.COM INC USD0.001 Common Stock,79466L302,189568634000.0,695180,0.8175903025423752
FERG,FERGUSON ENTERPRISES INC USD0.0001 Shares,31488V107,187486330000.0,860920,0.8086095364661414
SHOP,SHOPIFY INC NPV Class A Common Stock,82509L107,182002474000.0,1577832,0.7849582214171612
N/A,CRH PLC EUR0.32 Ordinary Shares (DI),G25508105,180704349000.0,1967239,0.7793595398784852
PANW,PALO ALTO NETWORKS INC USD0.0001 Common Stock,697435105,175819934000.0,859167,0.7582935530992982
GS,GOLDMAN SACHS GROUP USD0.01 Common Stock,38141G104,173780227000.0,245539,0.7494965035661577
CDNS,CADENCE DESIGN SYSTEMS INC USD0.01 Common Stock,127387108,173060121000.0,561610,0.7463907593827472
EQIX,EQUINIX INC USD0.001 New Common Stock,29444U700,167668371000.0,210779,0.7231366881753086
NOW,SERVICENOW INC USD0.001 Common Stock,81762P102,156966226000.0,152679,0.676979421628764
RTX,RTX CORP USD1.00 Common Stock,75513E101,154212451000.0,1056105,0.6651026691941622
DE,DEERE & CO USD1 Common Stock,244199105,151149161000.0,297251,0.6518910099389975
WMT,WAL-MART STORES INC USD0.1 Common Stock,931142103,144652896000.0,1479371,0.6238732774973245
CIT,CINTAS CORP NPV Common Stock,172908105,139115676000.0,624201,0.5999918089256636
ORLY,OREILLY AUTOMOTIVE NEW INC USD0.01 Common Stock,67103H107,135656826000.0,1505124,0.5850741394870121
CP,CANADIAN PAC KANSAS CITY LTD NPV Common Stock,13646K108,130927651000.0,1651653,0.5646776870916975
JNJ,JOHNSON & JOHNSON USD1 Common Stock,478160104,129938009000.0,850658,0.5604094614621946
TJX,TJX COMPANIES INC NPV Common Stock,872540109,123626826000.0,1001108,0.533189968925416
WCN,WASTE CONNECTIONS INC NPV Common Stock,94106B101,120588817000.0,645827,0.5200873440606062
MDLZ,MONDELEZ INTL INC USD0.01 Common Stock,609207105,119245249000.0,1768168,0.5142926714693259
DIS,WALT DISNEY (HLDGS) CO USD0.1 Common Stock,254687106,114640920000.0,924449,0.49443466721681517
RCL,ROYAL CARIBBEAN CRUISES LTD USD0.01 Common Stock,V7780T103,111506335000.0,356091,0.48091551985357156
MLM,MARTIN MARIETTA MATERIALS USD0.01 Common Stock,573284106,110937130000.0,202086,0.4784605963868623
ROL,ROLLINS INC USD1 Common Stock,775711104,110476961000.0,1958117,0.47647593413556055
HON,HONEYWELL INTL INC USD1 Common Stock,438516106,109885592000.0,471855,0.47392541958353723
FWONK,LIBERTY MEDIA CORP USD0.01 F1 Ser C Com Stk,531229755,109309194000.0,1046021,0.4714394734369568
DWD,MORGAN STANLEY USD0.01 Common Stock,617446448,107454346000.0,762845,0.4634397020323155
CVX,CHEVRON CORP USD0.75 Common Stock,166764100,106951761000.0,746922,0.4612721038725732
BR,BROADRIDGE FINANCIAL SOLUTIONS USD0.01 Common Stock,11133T103,104886887000.0,431580,0.45236651161952207
ICE,INTERCONTINENTAL EXCHANGE GRP USD0.01 Common Stock,45866F104,103527534000.0,564275,0.44650375992331115
UBER,UBER TECHNOLOGIES USD0.00001 Common Stock,90353T100,100165760000.0,1073588,0.4320047694324101
KKR,KKR & CO INC NPV Class A Common Stock,48251W104,97829729000.0,735396,0.4219297045245818
CB,CHUBB LTD CHF24.15 Ordinary Shares,H1467J104,96488928000.0,333042,0.41614696572382043
N/A,APTIV PLC USD0.01 Common Shares,G3265R107,94345394000.0,1382958,0.4069021208642543
LMT,LOCKHEED MARTIN CO USD1 Common Stock,539830109,93345403000.0,201549,0.40258926104679293
SHW,SHERWIN-WILLIAMS USD1 Common Stock,824348106,91738238000.0,267178,0.39565772131440496
WM,WASTE MANAGEMENT INC NPV Common Stock,94106L109,89250096000.0,390045,0.38492661708252873
MCD,MCDONALD'S CORP USD0.01 Common Stock,580135101,88858830000.0,304134,0.38323912648577446
CAT,CATERPILLAR INC USD1 Common Stock,149123101,88473447000.0,227901,0.38157700867168143
NFLX,NETFLIX COM INC USD0.001 Common Stock,64110L106,88456232000.0,66055,0.38150276212170486
USB,US BANCORP DEL USD0.01 Common Stock,902973304,85856852000.0,1897389,0.3702918996716299
AKX,ANSYS INC USD0.01 Common Stock,03662Q105,84585015000.0,240832,0.3648065956122327
AMT,AMER TOWER CORP USD0.01 New Common Stock,03027X100,84242436000.0,381153,0.36332908711125006
ROP,ROPER TECHNOLOGIES INC USD0.01 Common Stock,776696106,81972433000.0,144613,0.35353879427439766
GWRE,GUIDEWIRE SOFTWARE INC USD0.0001 Common Stock,40171V100,81151138000.0,344664,0.3499966321911569
ZTS,ZOETIS INC USD0.01 Cls A Common Stock,98978V103,78672720000.0,504474,0.33930746658559335
WEC,WEC ENERGY GROUP INC USD0.01 Common Stock,92939U106,76288467000.0,732135,0.3290244250798579
XOM,EXXON MOBIL CORP NPV Common Stock,30231G102,75948873000.0,704535,0.3275597905812965
ECL,ECOLAB INC USD1 Common Stock,278865100,75114483000.0,278780,0.3239611510904494
IDXX,IDEXX LABORATORIES INC USD0.10 Common Stock,45168D104,73596038000.0,137219,0.3174122517248299
DHR,DANAHER CORP USD0.01 Common Stock,235851102,68618679000.0,347366,0.2959454068950464
BAH,BOOZ ALLEN HAMILTON HLDG CORP USD0.01 Class A Common Stock,099502106,68340206000.0,656297,0.2947443810738661
ULTA,ULTA BEAUTY INC USD0.01 Common Stock,90384S303,66505291000.0,142160,0.2868305786776873
BRO,BROWN & BROWN INC USD0.10 Common Stock,115236101,65353430000.0,589460,0.28186271894474874
MRVL,MARVELL TECHNOLOGY INC USD0.002 Common Stock,573874104,65003151000.0,839834,0.2803520011242878
MSI,MOTOROLA SOLUTIONS INC USD0.01 Common Stock,620076307,64820636000.0,154166,0.2795648324301856
SLB,SCHLUMBERGER LTD USD0.01 Common Stock,806857108,63665781000.0,1883603,0.2745840598787382
GLD,SPDR GOLD TRUST NPV Shares ETF,78463V107,63328458000.0,207750,0.2731292199729735
FCX,FREEPORT-MCMORAN INC USD0.10 Common Stock,35671D857,60924523000.0,1405410,0.2627612919963326
BLK,BLACKROCK INC USD0.01 Common Stock,09290D101,60872239000.0,58015,0.26253579640417607
DXCM,DEXCOM INC USD0.001 Common Stock,252131107,60260738000.0,690351,0.25989845457686217
PH,PARKER-HANNIFIN CORP USD0.50 Common Stock,701094104,59551552000.0,85260,0.25683980724653
VOO,VANGUARD INDEX FUNDS S&P 500 ETF (USD),922908363,58611039000.0,103183,0.25278347001399476
TXN,TEXAS INSTRUMENTS INC Common Stock,882508104,54183214000.0,260973,0.23368670962190013
XYL,XYLEM INC USD0.01 Common Stock,98419M100,53165537000.0,410989,0.22929757187920577
OTIS,OTIS WORLDWIDE CORP USD0.01 Common Stock (WI),68902V107,50301169000.0,507990,0.21694384304602388
BAC,BANK OF AMERICA CORP NPV Common Stock,060505104,47563082000.0,1005137,0.20513475136518527
SPY,SPDR SERIES TRUST S&P 500 ETF Trust,78462F103,47486715000.0,76858,0.20480538823523703
CBRE,CBRE GROUP INC USD0.01 Class A Common Stock,12504L109,46560194000.0,332288,0.20080939708038242
COO,COOPER COS INC USD0.10 Com Stk (Post Split),216648501,45959468000.0,645861,0.198218526735845
PEP,PEPSICO INC USD0.016666 Cap,713448108,43356389000.0,328358,0.18699171087372457
VRSK,VERISK ANALYTICS INC USD0.001 Common Stock,92345Y106,42780787000.0,137338,0.1845091977944564
MCK,MCKESSON CORP USD0.01 Common Stock,58155Q103,40417946000.0,55157,0.17431850407426253
GE,GE AEROSPACE USD0.01 Common Stock,369604301,38352654000.0,149006,0.1654111090295826
MRK,MERCK & CO INC USD0.50 Common Stock,58933Y105,37801433000.0,477532,0.163033748731899
NEE,NEXTERA ENERGY INC USD0.01 Common Stock,65339F101,37396415000.0,538698,0.16128694715313618
EA,ELECTRONIC ARTS INC USD0.01 Common Stock,285512109,36887026000.0,230977,0.15909000403109125
TTWO,TAKE TWO INTERACTIVE INC USD0.01 Common Stock,874054109,35996684000.0,148226,0.15525004923589986
CCJ,CAMECO CORP NPV Common Stock,13321L108,35469657000.0,478540,0.15297703520775635
WMS,ADVANCED DRAINAGE SYSTEM INC USD0.01 Common Stock,00790R104,34114224000.0,297007,0.14713119007418896
RY,ROYAL BANK OF CANADA NPV Common Stock,780087102,32603656000.0,247880,0.14061626341110592
AZO,AUTOZONE INC USD0.01 Common Stock,053332102,32166472000.0,8665,0.13873073313489637
GEV,GE VERNOVA INC USD0.01 Common Stock,36828A101,31102378000.0,58778,0.13414140357632853
JCI,JOHNSON CONTROLS INTL USD1 Common Stock,G51502105,30650501000.0,290196,0.13219250388049625
TT,TRANE TECHNOLOGIES PLC USD1 Common Stock,G8994E103,30066251000.0,68737,0.1296726928538452
TSLA,TESLA INC USD0.001 Common Stock,88160R101,29620842000.0,93247,0.1277516889863747
AXON,AXON ENTERPRISE INC USD0.00001 Common Stock,05464C101,28176454000.0,34032,0.12152218995485993
AVGO,BROADCOM CORP USD1 Common Stock,11135F101,26986135000.0,97900,0.11638846476627236
STE,STERIS PLC USD0.001 Ordinary Shares,G8473T100,26876053000.0,111881,0.115913692258894
MELI,MERCADOLIBRE INC USD0.001 Common Stock,58733R102,24421758000.0,9344,0.10532856670706756
AMAT,APPLIED MATERIALS INC NPV Common Stock,038222105,24420397000.0,133391,0.10532269685202729
NKE,NIKE INC NPV Cls B Common Stock,654106103,24178108000.0,340345,0.1042777289550033
MSCI,MSCI INC USD0.01 Common Stock,55354G100,24172326000.0,41912,0.10425279177510413
BAC,VERIZON COMMS INC NPV Common Stock,92343V104,23723859000.0,548275,0.10231859906361224
PAYX,PAYCHEX INC USD0.01 Common Stock,704326107,23314183000.0,160279,0.10055170800301436
GEHC,GE HEALTHCARE TECH INC USD0.01 Common Stock,36266G107,22697270000.0,306430,0.09789102476829567
HDB,HDFC BANK LTD Spon ADR Each Rep 3 INR10 Shs,40415F101,22249787000.0,290202,0.09596107594905921
RSG,REPUBLIC SERVICES INC USD0.01 Common Stock,760759100,20609444000.0,83571,0.08888644286580732
CSCO,CISCO SYSTEMS INC USD0.001 Common Stock,17275R102,20437474000.0,294573,0.08814475368779588
ADSK,AUTODESK INC NPV Common Stock,052769106,19321501000.0,62414,0.08333167526101816
C,CITIGROUP INC USD0.01 Common Stock,172967424,19181792000.0,225350,0.08272912450582365
HCA,HCA HOLDINGS INC USD0.01 Common Stock,40412C101,18829365000.0,49150,0.08120914257909782
CL,COLGATE-PALMOLIVE CO NPV Common Stock,194162103,18136004000.0,199516,0.07821874686964156
TRI,THOMSON REUTERS CORP NPV Com Stk (Post Rev Split),884903808,18076348000.0,90071,0.07796145658875855
SPYX,SPDR SERIES TRUST S&P Fossil Fuel Res Free ETF,78468R796,17143649000.0,336612,0.07393882034614592
ACM,AECOM TECHNOLOGY CORP USD0.01 Common Stock,00766T100,16893674000.0,149687,0.07286070351022447
PSA,PUBLIC STORAGE INC USD0.10 Common Stock,74460D109,16459101000.0,56094,0.07098643421234713
EWJ,ISHARES INC MSCI Japan New ETF (P/R Split),46434G822,15783659000.0,210533,0.06807332133350544
UNH,UNITED HEALTHCARE CORP USD0.01 Common Stock,91324P102,15450314000.0,49525,0.066635638138505
LSAK,NET 1 UEPS TECHNOLOGIES INC USD0.001 Common Stock,64107N206,15353195000.0,3419420,0.06621677373611334
QQQ,INVESCO QQQ TRUST Unit Series 1 ETF,46090E103,15060875000.0,27302,0.06495602720755426
EL,ESTEE LAUDER COS USD0.01 Class A Common Stock,518439104,14481218000.0,179223,0.06245602532432708
HASI,HA SUST INFTRA CAPITAL INC USD0.01 Common Stock,41068X100,14427822000.0,537149,0.062225733788890084
VPL,VANGUARD INTL EQUITY FTSE Pacific ETF,922042866,14400976000.0,175237,0.062109949712173824
GXO,GXO LOGISTICS INC (WI) USD0.01 Common Stock,36262G101,14354617000.0,294756,0.06191000804442112
EWU,ISHARES TRUST MSCI UK New ETF (Post Cons),46435G334,14235250000.0,358390,0.06139519027323026
PYPL,PAYPAL HOLDINGS INC USD0.0001 Common Stock,70450Y103,13754774000.0,185075,0.05932294598937711
ABBV,ABBVIE INC USD0.01 Common Stock,00287Y109,13311367000.0,71713,0.05741057654497099
HYBL,SSGA ACTIVE TR Spdr Blackstone High Inc ETF,78470P846,12465240000.0,436000,0.05376131656286196
APD,AIR PRODUCTS & CHEMICALS INC USD1 Common Stock,009158106,12410640000.0,44000,0.05352583229747018
PFE,PFIZER INC USD0.05 Common Stock,717081103,11817678000.0,487528,0.05096844729792362
SYK,STRYKER CORP USD0.10 Common Stock,863667101,11722121000.0,29629,0.050556319643197574
VT,VANGUARD INTL EQUITY Total World Stock Market ETF,922042742,11389185000.0,88618,0.049120400423738254
VNQ,VANGUARD INDEX FUNDS Real Estate ETF,922908553,10950550000.0,122957,0.04722861213161143
BRK/A,BERKSHIRE HATHAWAY INC USD5 Class A Common Stock,084670108,10932000000.0,15,0.047148607861959096
SCHW,SCHWAB (CHARLES) CORP USD0.01 Common Stock,808513105,10772524000.0,118068,0.046460804039475216
AJG,GALLAGHER AJ & CO USD1 Common Stock,363576109,10757312000.0,33604,0.04639519622546166
IBM,IBM CORP USD0.20 Common Stock,459200101,10736477000.0,36422,0.046305336982431666
GH,GUARDANT HEALTH INC USD0.00001 Common Stock,40131M109,10718418000.0,205965,0.046227450346008406
BDX,BECTON DICKINSON & CO NPV Common Stock,075887109,10660035000.0,61887,0.04597565038508591
VNT,VONTIER CORP USD0.0001 Common Stock,928881101,10500522000.0,284567,0.04528768698535258
MU,MICRON TECHNOLOGY INC USD0.10 Common Stock,595112103,10241335000.0,83094,0.044169839727218885
EW,EDWARDS LIFESCIENCES CORP USD1 Common Stock,28176E108,10059057000.0,128616,0.04338369319009282
N/A,EATON CORPORATION PLC USD0.50 Common Stock,G29183103,9636588000.0,26994,0.04156162721727595
WFC,WELLS FARGO & CO USD1.6666 Common Stock,949746101,9002042000.0,112357,0.03882489464095189
CERT,CERTARA INC USD0.01 Common Stock,15687V109,8856783000.0,756990,0.03819840729834117
DEFI,DEFI TECHNOLOGIES INC NPV Common Stock,244916102,8789443000.0,2799330,0.03790797670435797
GDDY,GODADDY INC USD0.001 Cls A Common Stock,380237107,8591742000.0,47716,0.03705531233160667
UNP,UNION PACIFIC CORP USD2.50 Common Stock,907818108,8491102000.0,36905,0.03662126221312629
IXN,ISHARES TRUST Global Technology ETF,464287291,8436551000.0,91364,0.03638598927976755
QCOM,QUALCOMM INC USD0.001 Common Stock,747525103,8032437000.0,50436,0.034643086561369475
TIP,ISHARES TRUST Tips Bond ETF,464287176,7923430000.0,72005,0.034172950420022184
ARCC,ARES CAPITAL CORP USD0.001 Common Stock,04010L103,7576353000.0,345007,0.03267604250098586
CM,CANADIAN IMPERIAL BANK NPV Common Stock,136069101,7376280000.0,104126,0.03181314793267578
BNS,BANK OF NOVA SCOTIA NPV Common Stock,064149107,7315654000.0,132578,0.03155167414011823
OC,OWENS CORNING INC USD0.01 Common Stock,690742101,7060964000.0,51345,0.030453221987139605
BMI,BADGER METER INC USD1 Common Stock,056525108,6990628000.0,28539,0.03014986994885029
ITW,ILLINOIS TOOL WORKS INC NPV Common Stock,452308109,6988521000.0,28265,0.030140782671429403
INOD,INNODATA INC USD0.01 Common Stock,457642205,6986459000.0,136401,0.030131889474447025
BABA,ALIBABA GROUP HOLDINGS LTD Spon ADS Each Rep 1 Ord,01609W102,6982993000.0,61573,0.030116940967783144
IWM,ISHARES TRUST Russell 2000 ETF,464287655,6867085000.0,31823,0.029617041512965733
BSV,VANGUARD BOND INDEX FUND Short Term Bond ETF,921937827,6643775000.0,84419,0.028653928119107875
VWO,VANGUARD INTL EQUITY FTSE Emerging Markets Idx ETF,922042858,6598211000.0,133405,0.028457415205768843
PM,PHILIP MORRIS INTL INC NPV Common Stock,718172109,6535552000.0,35884,0.02818717329028929
IPAR,INTER PARFUMS INC USD0.001 Common Stock,458334109,6368535000.0,48500,0.02746684589920981
WDAY,WORKDAY INC USD0.001 Cls A Common Stock,98138H101,6353280000.0,26472,0.027401052630555017
AEM,AGNICO EAGLE MINES LTD NPV Common Stock,008474108,6305304000.0,53028,0.02719413700571187
ON,ON SEMICONDUCTOR USD0.01 Common Stock,682189105,6266139000.0,119560,0.02702522233072891
MSTR,MICROSTRATEGY INC USD0.001 Cls A Common Stock,594972408,6246161000.0,15452,0.02693905924182787
IP,INTERNATIONAL PAPER CORP USD1 Common Stock,460146103,6121242000.0,130712,0.026400296257423548
DVY,ISHARES TRUST Select Dividend ETF,464287168,6109127000.0,45999,0.026348045490478096
IJH,ISHARES TRUST Core S&P Mid-Cap ETF,464287507,6044159000.0,97455,0.026067845092053676
NTRS,NORTHERN TRUST CORP USD1.666 Common Stock,665859104,5983854000.0,47195,0.0258077557399575
BK,BANK OF NEW YORK MELLON CORP USD0.01 Common Stock,064058100,5905112000.0,64813,0.025468149475754574
NVS,NOVARTIS AG ADR Rep 1 CHF0.5 (Regd) Shares,66987V109,5880964000.0,48599,0.025364001599551628
EEM,ISHARES TRUST MSCI Emerging Markets ETF,464287234,5864778000.0,121575,0.025294193022269002
STT,STATE STREET CORP USD1 Common Stock,857477103,5708650000.0,53683,0.024620828784410242
CSX,CSX CORP USD1 Common Stock,126408103,5614024000.0,172051,0.024212716438312024
VTWO,VANGUARD INVESTMENTS Russell 2000 ETF,92206C664,5586354000.0,64049,0.02409337853312172
LKQ1,LKQ CORP USD0.01 Common Stock,501889208,5551944000.0,150012,0.023944971691141296
DAVA,ENDAVA PLC Spon ADS Each Rep 1 Ord Shares,29260V105,5527808000.0,360823,0.02384087556972195
MO,ALTRIA GROUP INC USD0.333333 Common Stock,02209S103,5505708000.0,93906,0.023745560509920518
EPP,ISHARES INC MSCI Pacific Ex Japan ETF,464286665,5429564000.0,109977,0.02341715915636755
FDX,FEDEX CORP USD0.10 Common Stock,31428X106,5332237000.0,23458,0.022997397671060113
S,SENTINELONE INC USD0.0001 Cls A Common Stock,81730H109,5271440000.0,288372,0.022735186372836228
BCC,BOISE CASCADE COMPANY USD0.01 Common Stock,09739D100,5265025000.0,60643,0.02270751912810201
NEM,NEWMONT CORP USD1.60 Common Stock,651639106,5136418000.0,88166,0.02215285017353716
MDT,MEDTRONIC PLC USD0.0001 Common Stock,G5960L103,5104152000.0,58554,0.02201369018622706
ORCL,ORACLE CORP USD0.01 Common Stock,68389X105,5084677000.0,23257,0.02192969648533869
FJP,FIRST TRUST Japan AlphaDEX ETF,33737J158,4987993000.0,83523,0.02151270819385263
PLTR,PALANTIR TECHNOLOGIES INC USD0.001 Cls A Common Stock,69608A108,4905611000.0,35986,0.021157402978623584
PSLV/U,SPROTT ASSET MGMT Physical Silver,85207K107,4885657000.0,399155,0.021071343399289743
SYY,SYSCO CORP NPV Common Stock,871829107,4850844000.0,64046,0.020921198459159997
EZU,ISHARES INC MSCI EMU ETF,464286608,4844045000.0,81481,0.0208918750613505
N/A,DIVERSIFIED ENERGY CO PLC 20p Ordinary Shares,G2891G204,4776502000.0,321650,0.02060056894894469
IYW,ISHARES TRUST US Technology ETF,464287721,4677077000.0,26993,0.020171759002304068
BMO,BANK OF MONTREAL NPV Common Stock,063671101,4657808000.0,42114,0.020088653758534206
BND,VANGUARD BOND INDEX FUND Total Bond Market ETF,921937835,4626393000.0,62833,0.019953164047961262
SPOT,SPOTIFY TECHNOLOGY EUR0.000625 Common Stock,L8681T102,4620154000.0,6021,0.01992625587338655
EMR,EMERSON ELECTRIC CO USD0.50 Common Stock,291011104,4575218000.0,34315,0.019732451460389388
IBND,SPDR SERIES TRUST Barclays Cap Intl Corp Bd ETF,78464A151,4560579000.0,139938,0.01966931493729286
CRWD,CROWDSTRIKE HOLDINGS INC USD0.0005 Class A Common Stock,22788C105,4440164000.0,8718,0.019149977248334043
TRMB,TRIMBLE INC NPV Common Stock,896239100,4433357000.0,58349,0.01912061934733547
DOV,DOVER CORP USD1 Common Stock,260003108,4340901000.0,23691,0.018721865991272055
BX,BLACKSTONE GROUP INC USD0.00001 Common Stock,09260D107,4340512000.0,29018,0.018720188273703604
TTE,TOTAL SE Spon ADR Each Rep 1 Ord Shares,89151E109,4327565000.0,70493,0.018664349175095043
IVV,ISHARES TRUST Core S&P 500 ETF,464287200,4256269000.0,6855,0.018356856754117523
MPWR,MONOLITHIC POWER SYSTEM INC USD0.001 Common Stock,609839105,4168866000.0,5700,0.01797989647484943
VGK,VANGUARD INTL EQUITY European ETF,922042874,4133617000.0,53337,0.017827871110915456
LFUS,LITTELFUSE INC USD0.01 Common Stock,537008104,4025591000.0,17755,0.01736196592312768
ACWX,ISHARES TRUST MSCI ACWI Ex-US ETF,464288240,4017774000.0,65930,0.017328251994509224
BAM,BROOKFIELD ASSET MGMT Cls A Limited Voting Shs (USD),113004105,3985243000.0,72144,0.017187949089061235
RDNT,RADNET INC USD0.01 Common Stock,750491102,3955586000.0,69506,0.017060041454286072
MCO,MOODYS CORP USD0.01 Common Stock,615369105,3904878000.0,7785,0.01684134299037606
SONY,SONY GROUP CORP Spon Adr Ea Rep 1 Ord Shares,835699307,3808735000.0,146321,0.016426687977050748
BJ,BJS WHOLESALE CLUB HLDGS INC USD0.01 Common Stock,05550J101,3806399000.0,35300,0.016416613045842778
N/A,SMURFIT WESTROCK LTD USD0.001 Common Stock (DI),G8267P108,3805642000.0,88380,0.01641334818157718
GNRC,GENERAC HOLDINGS INC USD0.01 Common Stock,368736104,3773153000.0,26347,0.0162732264178718
IAU,ISHARES TRUST Gold New (Post Rev Split),464285204,3718339000.0,59627,0.01603681919217244
AMGN,AMGEN INC USD0.0001 Common Stock,031162100,3611860000.0,12936,0.015577586058570762
MFC,MANULIFE FINANCIAL CORP NPV Common Stock,56501R106,3463830000.0,108550,0.014939147673846485
VGT,VANGUARD WORLD FUNDS Information Technology ETF,92204A702,3402626000.0,5130,0.014675181025878743
CIBR,FIRST TRUST NASDAQ Cybersecurity ETF,33734X846,3387797000.0,44824,0.014611225052041843
VB,VANGUARD INDEX FUNDS Small Cap ETF,922908751,3386207000.0,14289,0.0146043675432145
BALY,BALLYS CORP USD0.01 Com Stock (Rolling Shs,05875B304,3354820000.0,350190,0.014468998593803293
KMB,KIMBERLY CLARK CORP NPV Common Stock,494368103,3318400000.0,25740,0.014311922825569435
GII,SPDR INDEX SHARES S&P Gbl Infrastructure ETF,78463X855,3261494000.0,48439,0.014066493015928687
MKL,MARKEL GROUP INC NPV Common Stock,570535104,3243712000.0,1624,0.013989801052426918
EOG,EOG RESOURCES INC USD0.01 Common Stock,26875P101,3185931000.0,26636,0.013740597456481814
UTF,COHEN & STEERS INFRASTRUCTURE USD0.001 Common Stock,19248A109,3161315000.0,117303,0.013634431143718371
IGSB,ISHARES TRUST Barcs 1-5 Yr Inv Grd Corp Bd,464288646,3159901000.0,59892,0.013628332705050532
MCHP,MICROCHIP TECHNOLOGY INC USD0.001 Common Stock,595017104,3154616000.0,44829,0.013605539035772225
VLTO,VERALTO CORP USD0.01 Common Stock,92338C103,3046166000.0,30175,0.01313780517896382
AXP,AMERICAN EXPRESS CORP USD0.20 Common Stock,025816109,3040198000.0,9531,0.013112065799918799
CSL,CARLISLE COS INC USD1 Common Stock,142339100,2987200000.0,8000,0.012883490798137963
LULU,LULULEMON ATHLETICA INC USD0.01 Common Stock,550021109,2977590000.0,12533,0.012842043842269555
FKU,FIRST TRUST UK AlphaDEX ETF,33737J224,2939205000.0,62683,0.012676493228220773
IWP,ISHARES TRUST Russell Midcap Growth ETF,464287481,2924761000.0,21090,0.012614197720357788
NVO,NOVO-NORDISK AS ADR Rep 1 DKK1 Cls B Shares,670100205,2902152000.0,42048,0.012516687395151875
T,AT&T INC USD1 Common Stock,00206R102,2823502000.0,97564,0.012177477917623237
B,BARRICK MINING CORP NPV Common Stock (USD),06849F108,2744859000.0,131960,0.011838298630385033
VCSH,VANGUARD SCOTTSDAL Short Term Corp Bond Index ETF,92206C409,2706816000.0,34048,0.011674223027668924
IVZ,INVESCO LTD USD0.20 Common Stock,G491BT108,2688469000.0,170480,0.011595094276439196
EMA,EMERA INC NPV Common Stock,290876101,2683764000.0,58700,0.011574802088368348
IOO,ISHARES TRUST Global 100 ETF,464287572,2611697000.0,24225,0.011263984422544364
FEUZ,FIRST TRUST Eurozone AlphaDEX ETF,33737J505,2571855000.0,46541,0.011092149915186499
INTC,INTEL CORP USD0.001 Common Stock,458140100,2565472000.0,114530,0.011064620683208555
AOS,SMITH (AO) CORP USD1 Common Stock,831865209,2552246000.0,38924,0.011007578285881234
JXN,JACKSON FINANCIAL INC USD0.01 Cls A Common Stock WI,46817M107,2475198000.0,27877,0.010675278071963541
PICB,INVESCO EXCHANGE TRADING Intl Corp Bond ETF,46138E636,2474339000.0,102330,0.010671573292037322
TD,TORONTO-DOMINION BANK NPV Common Stock,891160509,2454129000.0,33435,0.010584409610653295
PWR,QUANTA SERVICES INC USD0.00001 Common Stock,74762E102,2453739000.0,6490,0.01058272758018621
PPLT,ABRDN Physical Platinum Shares ETF,003260106,2403337000.0,19560,0.010365348863258066
GRID,FIRST TRUST NASDAQ Clean Edge Smart Grid,33737A108,2399763000.0,17262,0.010349934563541762
JLL,JONES LANG LASALLE USD0.01 Common Stock,48020Q107,2341410000.0,9154,0.01009826398957827
SHEL,SHELL PLC Spon ADS Ea Rep 2 Ord Shs,780259305,2335147000.0,33165,0.01007125230543635
ACWI,ISHARES TRUST MSCI ACWI ETF,464288257,2334475000.0,18153,0.010068354037554607
