ticker,nameOfIssuer,cusip,value,shares,allocation_percent,filingDate,reportDate,accessionNumber
N/A,NCI BLDG SYS INC COM,628852105,9598000.0,165000,2.7887462264178353,2006-11-14,2006-09-30,0000950159-06-001569
FI,FISERV INC  COM STK,337738108,9418000.0,200000,2.7364463388625935,2006-11-14,2006-09-30,0000950159-06-001569
CENT,CENTRAL GARDEN & PET  CO COM S,153527106,9169000.0,190000,2.6640981610778427,2006-11-14,2006-09-30,0000950159-06-001569
GEF,GREIF INC CL A COM STK,397624107,8452000.0,105500,2.4557702756494626,2006-11-14,2006-09-30,0000950159-06-001569
GATX,General American Tra nsportati,361448103,8274000.0,200000,2.404051497955946,2006-11-14,2006-09-30,0000950159-06-001569
HRSEUR,HARRIS CORP DEL  COM STK,413875105,8008000.0,180000,2.3267638863465336,2006-11-14,2006-09-30,0000950159-06-001569
MIDD,"METTLER TOLEDO INTER NATIONAL    COMMON STOCK  592688105    14,553  220,000 SH         SOLE       01          220,000     0      0 MIDDLEBY CORP  COM STK",596278101,7706000.0,100000,2.239016297226072,2006-11-14,2006-09-30,0000950159-06-001569
N/A,UNITED SURGICAL PART NERS INTE,913016309,7672000.0,309000,2.2291374295767485,2006-11-14,2006-09-30,0000950159-06-001569
GCO,GENESCO INC  COM STK,371532102,7525000.0,218300,2.186425854739968,2006-11-14,2006-09-30,0000950159-06-001569
DRCEUR,DRESSER-RAND GROUP INC COM,261608103,7244000.0,355100,2.104779919167618,2006-11-14,2006-09-30,0000950159-06-001569
HLF,HERBALIFE LTD  COM STK,G4412G101,7197000.0,190000,2.091123837417083,2006-11-14,2006-09-30,0000950159-06-001569
BECNUSD,BEACON ROOFING SUPPLY INC COM,073685109,7013000.0,346500,2.0376617301383915,2006-11-14,2006-09-30,0000950159-06-001569
N/A,HILTON HOTELS CORP  COM STK,432848109,6963000.0,250000,2.023133983595269,2006-11-14,2006-09-30,0000950159-06-001569
N/A,RESPIRONICS INC  COM STK,761230101,6757000.0,175000,1.963279667837603,2006-11-14,2006-09-30,0000950159-06-001569
RRX,REGAL-BELOIT CORP  COM STK,758750103,6525000.0,150000,1.8958709238775135,2006-11-14,2006-09-30,0000950159-06-001569
AIR,AAR CORP  COM STK,000361105,6437000.0,270000,1.8703020899616178,2006-11-14,2006-09-30,0000950159-06-001569
N/A,CENVEO INC,15670S105,6308000.0,335200,1.8328205038803609,2006-11-14,2006-09-30,0000950159-06-001569
AMG,AFFILIATED MANAGERS GROUP INC,008252108,6297000.0,62900,1.829624399640874,2006-11-14,2006-09-30,0000950159-06-001569
N/A,W-H ENERGY SVCS INC  COM STK,92925E108,6221000.0,150000,1.8075422248953275,2006-11-14,2006-09-30,0000950159-06-001569
CHS1USD,CHICOS FAS INC  COM STK,168615102,6179000.0,287000,1.7953389177991046,2006-11-14,2006-09-30,0000950159-06-001569
N/A,I2 TECHNOLOGIES INC  COM STK,465754208,6040000.0,322500,1.7549517824092233,2006-11-14,2006-09-30,0000950159-06-001569
N/A,ICON PLC  ADR,45103T107,5858000.0,83000,1.7020707849922565,2006-11-14,2006-09-30,0000950159-06-001569
N/A,COMSYS IT PARTNERS INC,20581E104,5834000.0,339400,1.695097466651558,2006-11-14,2006-09-30,0000950159-06-001569
N/A,GUITAR CTR INC  COM STK,402040109,5808000.0,130000,1.687543038449134,2006-11-14,2006-09-30,0000950159-06-001569
N/A,<PAGE> ELKCORP  COM STK,287456107,5468000.0,201400,1.5887543619558995,2006-11-14,2006-09-30,0000950159-06-001569
CYH,COMMUNITY HEALTH SYS TEMS INC,203668108,5229000.0,140000,1.519311733479773,2006-11-14,2006-09-30,0000950159-06-001569
ARW,"AMPHENOL CORPORATION  (NEW) CL   COMMON STOCK  032095101    16,288  263,000 SH         SOLE       01          263,000     0      0 ANIXTER INTL INC  COM STK        COMMON STOCK  035290105    12,141  215,000 SH         SOLE       01          215,000     0      0 ARROW ELECTRS INC  COM STK",042735100,5192000.0,189300,1.5085612010378622,2006-11-14,2006-09-30,0000950159-06-001569
CVS,CVS CORPORATION  COM STK,126650100,5139000.0,160000,1.493161789702152,2006-11-14,2006-09-30,0000950159-06-001569
AMG,AFFILIATED MANAGERS GROUP INC,008252108,5006000.0,50000,1.4545179838974458,2006-11-14,2006-09-30,0000950159-06-001569
N/A,GETTY IMAGES INC  COM STK,374276103,4968000.0,100000,1.4434768965246725,2006-11-14,2006-09-30,0000950159-06-001569
CSX,CSX CORP COM,126408103,4925000.0,150000,1.430983034497587,2006-11-14,2006-09-30,0000950159-06-001569
UNF,UNIFIRST CORP  COM STK,904708104,4686000.0,150000,1.3615404060214604,2006-11-14,2006-09-30,0000950159-06-001569
AVT,AVNET INC  COM STK,053807103,4560000.0,232400,1.3249304847327912,2006-11-14,2006-09-30,0000950159-06-001569
N/A,PACER INTERNATIONAL INC TENNES,69373H106,4553000.0,164000,1.3228966002167541,2006-11-14,2006-09-30,0000950159-06-001569
TRL,DAVITA INC  COM STK,23918K108,4485000.0,77500,1.303138864918107,2006-11-14,2006-09-30,0000950159-06-001569
N/A,EFUNDS CORP  COM STK,28224R101,4403000.0,182100,1.2793133605873859,2006-11-14,2006-09-30,0000950159-06-001569
N/A,MSC SOFTWARE CORP  COM STK,553531104,3958000.0,257000,1.1500164163535938,2006-11-14,2006-09-30,0000950159-06-001569
N/A,PETSMART INC  COM STK,716768106,3906000.0,140700,1.1349075599487461,2006-11-14,2006-09-30,0000950159-06-001569
N/A,MORTON'S RESTAURANT GROUP INC,619430101,3783000.0,245500,1.0991693034526642,2006-11-14,2006-09-30,0000950159-06-001569
N/A,CKE RESTAURANTS INC  COM STK,12561E105,3652000.0,218400,1.0611066075096827,2006-11-14,2006-09-30,0000950159-06-001569
ASTE,ASTEC INDS INC  COM STK,046224101,3535000.0,140000,1.0271116805987757,2006-11-14,2006-09-30,0000950159-06-001569
N/A,VERIFONE HLDGS INC  COM STK,92342Y109,3512000.0,123000,1.0204289171889391,2006-11-14,2006-09-30,0000950159-06-001569
N/A,<PAGE> PER-SE TECHNOLOGIES INC COM ST,713569309,3422000.0,150000,0.9942789734113182,2006-11-14,2006-09-30,0000950159-06-001569
N/A,"KNOLL INC  COM STK               COMMON STOCK  498904200    11,312  560,000 SH         SOLE       01          560,000     0      0 LAWSON SOFTWARE INC NEW COM ST",52078P102,3326000.0,458800,0.9663857000485226,2006-11-14,2006-09-30,0000950159-06-001569
N/A,FIRST CONSULTING GROUP INC COM,31986R103,3218000.0,330000,0.9350057675153777,2006-11-14,2006-09-30,0000950159-06-001569
N/A,CLAIRE'S STORES INC  COM STK,179584107,3208000.0,110000,0.9321002182067532,2006-11-14,2006-09-30,0000950159-06-001569
JAHEUR,JARDEN CORP  COM STK,471109108,2967000.0,90000,0.8620764798689016,2006-11-14,2006-09-30,0000950159-06-001569
UPBD,RENT A CTR INC NEW  COM STK,76009N100,2929000.0,100000,0.8510353924961283,2006-11-14,2006-09-30,0000950159-06-001569
N/A,CYTYC CORP  COM STK,232946103,2916000.0,119100,0.8472581783949165,2006-11-14,2006-09-30,0000950159-06-001569
N/A,STEIN MART INC  COM STK,858375108,2914000.0,191600,0.8466770685331915,2006-11-14,2006-09-30,0000950159-06-001569
TSCO,TRACTOR SUPPLY CO  COM STK,892356106,2896000.0,60000,0.8414470797776673,2006-11-14,2006-09-30,0000950159-06-001569
AWN,ADVANCE AUTO PTS INC  COM STK,00751Y106,2869000.0,87100,0.8336020966443811,2006-11-14,2006-09-30,0000950159-06-001569
N/A,CAREMARK RX INC  COM STK,141705103,2834000.0,50000,0.8234326740641953,2006-11-14,2006-09-30,0000950159-06-001569
N/A,COMPUWARE CORP  COM STK,205638109,2727000.0,350000,0.7923432964619125,2006-11-14,2006-09-30,0000950159-06-001569
RHI,ROBERT HALF INTERNAT IONAL INC,770323103,2718000.0,80000,0.7897283020841506,2006-11-14,2006-09-30,0000950159-06-001569
ALB,ALBEMARLE CORP  COM STK,012653101,2717000.0,50000,0.7894377471532882,2006-11-14,2006-09-30,0000950159-06-001569
N/A,SUNRISE SENIOR LIVIN G INC COM,86768K106,2688000.0,90000,0.7810116541582769,2006-11-14,2006-09-30,0000950159-06-001569
ITPCAD,INTERTAPE POLYMER GROUP INC CA,460919103,2560000.0,332500,0.7438206230078828,2006-11-14,2006-09-30,0000950159-06-001569
N/A,MATTSON TECHNOLOGY I NC COM ST,577223100,2501000.0,301300,0.7266778820869979,2006-11-14,2006-09-30,0000950159-06-001569
N/A,INTEGRATED DEVICE TE CHNOLOGY,458118106,2491000.0,155000,0.7237723327783734,2006-11-14,2006-09-30,0000950159-06-001569
NSY,NICE SYS LTD  ADR,653656108,2490000.0,90000,0.7234817778475109,2006-11-14,2006-09-30,0000950159-06-001569
WCC,WESCO INTL INC  COM STK,95082P105,2321000.0,40000,0.6743779945317562,2006-11-14,2006-09-30,0000950159-06-001569
N/A,SUN HEALTHCARE GROUP  INC COM,866933401,2148000.0,200000,0.6241119914925516,2006-11-14,2006-09-30,0000950159-06-001569
RBC,BRC BEARINGS INC COM,75524B104,2145000.0,88800,0.6232403266999643,2006-11-14,2006-09-30,0000950159-06-001569
N/A,GARDNER DENVER INC  COM STK,365558105,1876000.0,56700,0.545081050297964,2006-11-14,2006-09-30,0000950159-06-001569
N/A,EMERGENCY MEDICAL SV CS CORP C,29100P102,1874000.0,114600,0.5444999404362392,2006-11-14,2006-09-30,0000950159-06-001569
N/A,RUBY TUESDAY INC  COM STK,781182100,1832000.0,65000,0.5322966333400161,2006-11-14,2006-09-30,0000950159-06-001569
HUBG,HUB GROUP INC CL A COM STK,443320106,1752000.0,76900,0.5090522388710198,2006-11-14,2006-09-30,0000950159-06-001569
MRLNUSD,MARLIN BUS SVC,571157106,1695000.0,81100,0.4924906078118599,2006-11-14,2006-09-30,0000950159-06-001569
N/A,WILLIS GROUP HOLDING S LTD  BE,G96655108,1520000.0,40000,0.44164349491093036,2006-11-14,2006-09-30,0000950159-06-001569
N/A,"CROWN HOLDINGS INC  COM STK      COMMON STOCK  228368106    15,652  841,500 SH         SOLE       01          841,500     0      0 CSK AUTO CORP  COM STK",125965103,1516000.0,107500,0.44048127518748054,2006-11-14,2006-09-30,0000950159-06-001569
N/A,NEXTEST SYSTEMS CORP COM,653339101,1402000.0,106500,0.4073580130691608,2006-11-14,2006-09-30,0000950159-06-001569
N/A,"THERMO ELECTRON CORP  COM STK    COMMON STOCK  883556102    14,159  360,000 SH         SOLE       01          360,000     0      0 TODCO COM STK",88889T107,1367000.0,39500,0.39718859048897487,2006-11-14,2006-09-30,0000950159-06-001569
N/A,IMS HEALTH INC  COM STK,449934108,1332000.0,50000,0.387019167908789,2006-11-14,2006-09-30,0000950159-06-001569
N/A,AARON RENTS INC CL B COM STK,002535201,1204000.0,52400,0.34982813675839486,2006-11-14,2006-09-30,0000950159-06-001569
N/A,RARE HOSPITALITY INT L INC COM,753820109,1189000.0,38900,0.3454698127954581,2006-11-14,2006-09-30,0000950159-06-001569
N/A,SITEL CORP  COM STK,82980K107,1069000.0,355100,0.31060322109196353,2006-11-14,2006-09-30,0000950159-06-001569
N/A,LIFEPOINT HOSPITALS INC COM ST,53219L109,1060000.0,30000,0.30798822671420145,2006-11-14,2006-09-30,0000950159-06-001569
MNRO,MONRO MUFFLER BRAKE INC COM ST,610236101,1048000.0,30800,0.304501567543852,2006-11-14,2006-09-30,0000950159-06-001569
N/A,CORE LABORATORIES NL G0.03 ORD,N22717107,957000.0,15000,0.2780610688353687,2006-11-14,2006-09-30,0000950159-06-001569
IU1,IMMUCOR INC  COM STK,452526106,932000.0,41600,0.2707971955638073,2006-11-14,2006-09-30,0000950159-06-001569
N/A,WILLIAMS SCOTSMAN IN TERNATION,96950G102,865000.0,40500,0.2513300151960229,2006-11-14,2006-09-30,0000950159-06-001569
N/A,ELKCORP  COM STK,287456107,850000.0,31300,0.2469716912330861,2006-11-14,2006-09-30,0000950159-06-001569
N/A,PERFORMANCE FOOD GRO UP CO COM,713755106,843000.0,30000,0.2449378067170489,2006-11-14,2006-09-30,0000950159-06-001569
CRVL,CORVEL CORP  COM STK,221006109,786000.0,22400,0.22837617565788898,2006-11-14,2006-09-30,0000950159-06-001569
BG3,BIG 5 SPORTING GOODS  CORP COM,08915P101,695000.0,30500,0.20193567694940565,2006-11-14,2006-09-30,0000950159-06-001569
KFRC,KFORCE INC  COM STK,493732101,650000.0,54500,0.1888607050605952,2006-11-14,2006-09-30,0000950159-06-001569
N/A,RADIANT SYS INC  COM STK,75025N102,597000.0,49400,0.17346129372488517,2006-11-14,2006-09-30,0000950159-06-001569
N/A,STELLENT INC  COM STK,85856W105,434000.0,40000,0.12610083999430513,2006-11-14,2006-09-30,0000950159-06-001569
N/A,UNIVERSAL STAINLESS & ALLOY PR,913837100,356000.0,15800,0.10343755538703368,2006-11-14,2006-09-30,0000950159-06-001569
