ticker,nameOfIssuer,cusip,value,shares,allocation_percent,filingDate,reportDate,accessionNumber
RCI,ROGERS COMMUNICATIONS INCORPORATED COMMON STOCK CLASS 'B' NPV,775109200,23001000.0,528155,0.045204217881146376,2015-08-10,2015-06-30,0001140361-15-030521
N/A,LYONDELLBASELL INDUSTRIES NV CLASS A COMMON STOCK USD0.01,N53745100,22992000.0,226250,0.04518653004318584,2015-08-10,2015-06-30,0001140361-15-030521
N/A,ALLERGAN PLC COMMON STOCK USD0.0001,G0177J108,22911000.0,75499,0.045027339501541,2015-08-10,2015-06-30,0001140361-15-030521
CVE,CENOVUS ENERGY INCORPORATED COMMON NPV,15135U109,22865000.0,1154821,0.04493693499640937,2015-08-10,2015-06-30,0001140361-15-030521
SWN1EUR,SOUTHWESTERN ENERGY COMPANY COMMON STOCK USD0.10,845467109,22843000.0,1015695,0.044893698059172496,2015-08-10,2015-06-30,0001140361-15-030521
AAL,AMERICAN AIRLINES GROUP INCORPORATED COMMON STOCK USD1,02376R102,22735000.0,571955,0.04468144400364605,2015-08-10,2015-06-30,0001140361-15-030521
TSM,TAIWAN SEMICONDUCTOR MANUFACTURING COMPANY LIMITED ADS REPRESENTING 5 COMMON SHARES,874039100,22676000.0,1013244,0.044565490399238086,2015-08-10,2015-06-30,0001140361-15-030521
WDAY,WORKDAY INCORPORATED COMMON STOCK USD0.001,98138H101,22609000.0,296282,0.04443381427219854,2015-08-10,2015-06-30,0001140361-15-030521
AMG,AFFILIATED MANAGERS GROUP INCORPORATED COMMON STOCK NPV,008252108,22442000.0,102350,0.04410560661226411,2015-08-10,2015-06-30,0001140361-15-030521
IBM,INTL BUSINESS MACHINES CORPORATION COMMON STOCK USD0.20,459200101,22357000.0,137184,0.04393855480930348,2015-08-10,2015-06-30,0001140361-15-030521
FLB,FLUIDIGM CORPORATION COMMON STOCK USD0.001,34385P108,22352000.0,936000,0.04392872823265875,2015-08-10,2015-06-30,0001140361-15-030521
SBUX,STARBUCKS CORPORATION COMMON STOCK USD0.001,855244109,22259000.0,415669,0.04374595390706653,2015-08-10,2015-06-30,0001140361-15-030521
KEYS,KEYSIGHT TECHNOLOGIES INCORPORATED COMMON STOCK USD0.01,49338L103,22225000.0,707800,0.04367913318588228,2015-08-10,2015-06-30,0001140361-15-030521
COST,COSTCO WHOLESALE CORPORATION COMMON STOCK USD0.01,22160K105,22202000.0,163623,0.04363393093331646,2015-08-10,2015-06-30,0001140361-15-030521
IEMG,ISHARES CORE MSCI EMERGING ETF,46434G103,22079000.0,465895,0.043392197147855784,2015-08-10,2015-06-30,0001140361-15-030521
N/A,REYNOLDS AMERICAN INCORPORATED COMMON STOCK USD0.0001,761713106,21813000.0,290606,0.04286942327035546,2015-08-10,2015-06-30,0001140361-15-030521
WFC,WELLS FARGO AND COMPANY COMMON STOCK USD1.6667,949746101,21799000.0,388849,0.04284190885575018,2015-08-10,2015-06-30,0001140361-15-030521
BMA,BANCO MACRO SA ADR (REPRESENTS 10 CLASS 'B' SHARES ARS1),05961W105,21798000.0,477200,0.04283994354042123,2015-08-10,2015-06-30,0001140361-15-030521
CFR,CULLEN FROST BANKERS COMMON STOCK USD5,229899109,21722000.0,276355,0.04269057957542114,2015-08-10,2015-06-30,0001140361-15-030521
ON,ON SEMICONDUCTOR CORPORATION COMMON STOCK USD0.01,682189105,21500000.0,1834500,0.042254279572394554,2015-08-10,2015-06-30,0001140361-15-030521
SERVUSD,SERVICEMASTER GLOBAL HOLDINGS INCORPORATED COMMON STOCK USD0.01,81761R109,21364000.0,605554,0.04198699668765755,2015-08-10,2015-06-30,0001140361-15-030521
BAC,VERIZON COMMUNICATIONS INCORPORATED COMMON STOCK USD0.10,92343V104,21221000.0,453729,0.0417059565956179,2015-08-10,2015-06-30,0001140361-15-030521
N/A,GENERAL GROWTH PROPERTIES INCORPORATED REIT USD0.01,370023103,21202000.0,824666,0.041668615604367874,2015-08-10,2015-06-30,0001140361-15-030521
TSM,TAIWAN SEMICONDUCTOR MANUFACTURING COMPANY LIMITED ADS REPRESENTING 5 COMMON SHARES,874039100,21164000.0,945651,0.04159393362186783,2015-08-10,2015-06-30,0001140361-15-030521
N/A,UBS GROUP AG CHF0.10 (REGISTERED),H42097107,21161000.0,1067100,0.041588037675880984,2015-08-10,2015-06-30,0001140361-15-030521
N/A,ISHARES TRUST MORTGAGE REAL ESTATE CAPPED ETF,464288539,21158000.0,1996082,0.041582141729894134,2015-08-10,2015-06-30,0001140361-15-030521
CBSH,COMMERCE BANCSHARES INCORPORATED COMMON STOCK USD5,200525103,21104000.0,452539,0.04147601470213091,2015-08-10,2015-06-30,0001140361-15-030521
NAVI,NAVIENT CORPORATION COMMON STOCK USD0.01,63938C108,20890000.0,1153513,0.041055437221735915,2015-08-10,2015-06-30,0001140361-15-030521
XLY,CONSUMER DISCRETIONARY SELECT SECTOR SPDR FUND,81369Y407,20848000.0,273812,0.040972893977920075,2015-08-10,2015-06-30,0001140361-15-030521
N/A,ACE LIMITED CHF25.94 (US LISTING),H0023R105,20725000.0,203986,0.0407311601924594,2015-08-10,2015-06-30,0001140361-15-030521
SYNHEUR,INC RESEARCH HOLDINGS INCORPORATED CLASS A COMMON STOCK USD0.01,45329R109,20671000.0,543700,0.04062503316469618,2015-08-10,2015-06-30,0001140361-15-030521
N/A,CANADIAN PACIFIC RAILWAY LTD,13645T100,20653000.0,104280,0.0405896574887751,2015-08-10,2015-06-30,0001140361-15-030521
PEB,PEBBLEBROOK HOTEL TRUST REIT USD0.01,70509V100,20640000.0,487011,0.04056410838949877,2015-08-10,2015-06-30,0001140361-15-030521
N/A,ADVANCED SEMICONDUCTOR ENGINEERING INCORPORATED ADS (EACH REPRESENTING 5 TWD10 SHARES),00756M404,20619000.0,3177100,0.040522836767590845,2015-08-10,2015-06-30,0001140361-15-030521
NKE,NIKE INCORPORATED CLASS B COMMON STOCK NPV,654106103,20570000.0,191051,0.04042653631647237,2015-08-10,2015-06-30,0001140361-15-030521
CSCO,CISCO SYSTEMS INCORPORATED USD0.001 (US LISTING),17275R102,20561000.0,746580,0.04040884847851183,2015-08-10,2015-06-30,0001140361-15-030521
N/A,XEROX CORPORATION COMMON STOCK USD1,984121103,20505000.0,1902133,0.04029879082009071,2015-08-10,2015-06-30,0001140361-15-030521
CUBE,CUBESMART REIT USD0.01,229663109,20367000.0,888998,0.040027577304695805,2015-08-10,2015-06-30,0001140361-15-030521
AERIEUR,AERIE PHARMACEUTICALS INC COMMON USD0.0010,00771V108,20363000.0,1185300,0.04001971604338001,2015-08-10,2015-06-30,0001140361-15-030521
JNJ,JOHNSON AND JOHNSON COMMON STOCK USD1,478160104,20361000.0,208448,0.04001578541272212,2015-08-10,2015-06-30,0001140361-15-030521
TRNO,TERRENO REALTY CORPORATION REIT USD0.01,88146M101,20355000.0,1049235,0.040003993520748425,2015-08-10,2015-06-30,0001140361-15-030521
EQR,EQUITY RESIDENTIAL SBI USD0.01,29476L107,20337000.0,290035,0.039968617844827345,2015-08-10,2015-06-30,0001140361-15-030521
GBDC,GOLUB CAPITAL BDC INCORPORATED COMMON STOCK USD0.001,38173M102,20337000.0,1220724,0.039968617844827345,2015-08-10,2015-06-30,0001140361-15-030521
N/A,MEMORIAL RESOURCE DEVELOPMENT CORPORATION COMMON STOCK USD0.01,58605Q109,20320000.0,1078575,0.03993520748423522,2015-08-10,2015-06-30,0001140361-15-030521
ORCL,ORACLE CORPORATION COMMON STOCK USD0.01,68389X105,20294000.0,502081,0.03988410928568256,2015-08-10,2015-06-30,0001140361-15-030521
N/A,DUN & BRADSTREET CORPORATION COMMON STOCK USD0.01(SEPTEMBER 2000 NEW),26483E100,19969000.0,163022,0.03924538180377427,2015-08-10,2015-06-30,0001140361-15-030521
N/A,COMPUTER SCIENCES CORP,205363104,19955000.0,303496,0.03921786738916899,2015-08-10,2015-06-30,0001140361-15-030521
IYE,ISHARES U.S. ENERGY ETF,464287796,19924000.0,473246,0.03915694261397158,2015-08-10,2015-06-30,0001140361-15-030521
N/A,ADVANCED SEMICONDUCTOR ENGINEERING INCORPORATED ADS (EACH REPRESENTING 5 TWD10 SHARES),00756M404,19872000.0,3061900,0.03905474621686626,2015-08-10,2015-06-30,0001140361-15-030521
N/A,SYNTEL INCORPORATED COMMON STOCK NPV,87162H103,19749000.0,420368,0.038813012431405586,2015-08-10,2015-06-30,0001140361-15-030521
MTD,METTLER-TOLEDO INTERNATIONAL COMMON STOCK USD0.01,592688105,19697000.0,58102,0.03871081603430025,2015-08-10,2015-06-30,0001140361-15-030521
MSFT,MICROSOFT CORPORATION COMMON STOCK USD0.0000125,594918104,19679000.0,443522,0.03867544035837918,2015-08-10,2015-06-30,0001140361-15-030521
COP,CONOCOPHILLIPS INCORPORATED COMMON STOCK USD0.01,20825C104,19649000.0,322058,0.038616480898510726,2015-08-10,2015-06-30,0001140361-15-030521
RS,RELIANCE STEEL & ALUMINUM COMPANY COMMON STOCK NPV,759509102,19642000.0,317520,0.03860272369120808,2015-08-10,2015-06-30,0001140361-15-030521
N/A,HILTON WORLDWIDE HOLDINGS INCORPORATED COMMON USD0.01,43300A104,19579000.0,716380,0.038478908825484326,2015-08-10,2015-06-30,0001140361-15-030521
BABA,ALIBABA GROUP HOLDING LIMITED SPONSORED ADR (EACH REPRESENTS 1 ORDINARY SHARES USD0.000025),01609W102,19522000.0,240800,0.038366885851734256,2015-08-10,2015-06-30,0001140361-15-030521
VRSK,VERISK ANALYTICS INC COMMON STOCK USD0.001,92345Y106,19352000.0,266257,0.038032782245812996,2015-08-10,2015-06-30,0001140361-15-030521
N/A,FIRSTMERIT CORPORATION COMMON STOCK NPV,337915102,19200000.0,922200,0.03773405431581281,2015-08-10,2015-06-30,0001140361-15-030521
CVX,CHEVRON CORPORATION COMMON STOCK USD0.75,166764100,19160000.0,198154,0.03765544170265487,2015-08-10,2015-06-30,0001140361-15-030521
DY,DYCOM INDUSTRIES INCORPORATED COMMON STOCK USD0.333,267475101,19086000.0,325700,0.03751000836831267,2015-08-10,2015-06-30,0001140361-15-030521
PSA,PUBLIC STORAGE COMMON STOCK USD0.10,74460D109,19027000.0,103984,0.0373940547639047,2015-08-10,2015-06-30,0001140361-15-030521
VALE,VALE DO RIO DOCE (CIA) SPONSORED ADR (REPRESENTING 1 ORDINARY NPV),91912E105,19023000.0,3108388,0.037386193502588906,2015-08-10,2015-06-30,0001140361-15-030521
TTMCHF,TATA MOTORS LIMITED SPONSORED ADR (EACH REPRESENTS 5 ORDINARY INR2),876568502,18986000.0,558241,0.037313476835417816,2015-08-10,2015-06-30,0001140361-15-030521
N/A,ROCK-TENN COMPANY CLASS 'A' COMMON STOCK USD0.01,772739207,18974000.0,311400,0.03728989305147043,2015-08-10,2015-06-30,0001140361-15-030521
SPY,SPDR S&P 500 ETF TRUST,78462F103,18781000.0,91425,0.03691058719298335,2015-08-10,2015-06-30,0001140361-15-030521
FRCB,FIRST REPUBLIC BANK/SAN FRANCISCO CA COMMON STOCK USD0.01,33616C100,18719000.0,296335,0.03678873764258854,2015-08-10,2015-06-30,0001140361-15-030521
IWM,ISHARES TRUST RUSSELL 2000 ETF,464287655,18717000.0,150600,0.03678480701193065,2015-08-10,2015-06-30,0001140361-15-030521
FRTEUR,FEDERAL REALTY INVESTMENT TRUST REIT USD0.01,313747206,18649000.0,145878,0.03665116556956214,2015-08-10,2015-06-30,0001140361-15-030521
GS,GOLDMAN SACHS GROUP INCORPORATED COMMON STOCK USD0.01,38141G104,18643000.0,89779,0.03663937367758845,2015-08-10,2015-06-30,0001140361-15-030521
MRK,MERCK AND COMPANY INCORPORATED NEW COMMON STOCK USD0.01,58933Y105,18639000.0,325345,0.03663151241627265,2015-08-10,2015-06-30,0001140361-15-030521
N/A,HEALTHSOUTH CORPORATION COMMON STOCK USD0.01,421924309,18588000.0,404182,0.03653128133449628,2015-08-10,2015-06-30,0001140361-15-030521
MLKN,MILLER (HERMAN) INCORPORATED COMMON STOCK USD0.20,600544100,18574000.0,622252,0.036503766919891,2015-08-10,2015-06-30,0001140361-15-030521
VNO,VORNADO REALTY TRUST COMMON STOCK USD0.04,929042109,18573000.0,195732,0.03650180160456205,2015-08-10,2015-06-30,0001140361-15-030521
VIV1USD,TELEF BRASIL SA SPONSORED ADR (EACH REPRESENTS 1 PREFERENCE SHARE),87936R106,18550000.0,1355000,0.03645659935199623,2015-08-10,2015-06-30,0001140361-15-030521
ELS,EQUITY LIFESTYLE PROPERTIES INCORPORATED REIT USD0.01,29472R108,18491000.0,352218,0.03634064574758826,2015-08-10,2015-06-30,0001140361-15-030521
RES,RPC INCORPORATED COMMON STOCK USD0.10,749660106,18473000.0,1365300,0.036305270071667194,2015-08-10,2015-06-30,0001140361-15-030521
FI,FISERV INCORPORATED COMMON STOCK USD0.01,337738108,18380000.0,221900,0.03612249574607497,2015-08-10,2015-06-30,0001140361-15-030521
N/A,AETNA INCORPORATED COMMON STOCK NPV,00817Y108,18375000.0,144364,0.03611266916943023,2015-08-10,2015-06-30,0001140361-15-030521
N/A,INTERVAL LEISURE GROUP INCORPORATED COMMON STOCK USD0.01,46113M108,18339000.0,802600,0.03604191781758808,2015-08-10,2015-06-30,0001140361-15-030521
MCD,MCDONALD'S CORPORATION COMMON STOCK USD0.01,580135101,18283000.0,191563,0.03593186015916695,2015-08-10,2015-06-30,0001140361-15-030521
N/A,DU PONT (E.I.) DE NEMOURS,263534109,18247000.0,286720,0.03586110880732481,2015-08-10,2015-06-30,0001140361-15-030521
GD,GENERAL DYNAMICS CORPORATION COMMON STOCK USD1,369550108,18148000.0,127946,0.0356665425897589,2015-08-10,2015-06-30,0001140361-15-030521
LBEUR,L BRANDS INCORPORATED COMMON STOCK USD0.50,501797104,18003000.0,211600,0.035381571867061354,2015-08-10,2015-06-30,0001140361-15-030521
WRLD,WORLD ACCEPTANCE CORPORATION COMMON STOCK NPV,981419104,17966000.0,290198,0.03530885519989026,2015-08-10,2015-06-30,0001140361-15-030521
N/A,GLOBAL EAGLE ENTERTAINMENT INCORPORATED COMMON STOCK USD0.0001,37951D102,17898000.0,1386400,0.03517521375752175,2015-08-10,2015-06-30,0001140361-15-030521
N/A,CLUBCORP HOLDINGS INCORPORATED COMMON STOCK USD0.01,18948M108,17820000.0,755400,0.035021919161863764,2015-08-10,2015-06-30,0001140361-15-030521
N/A,ACE LIMITED CHF25.94 (US LISTING),H0023R105,17808000.0,175275,0.03499833537791638,2015-08-10,2015-06-30,0001140361-15-030521
RIG,TRANSOCEAN LIMITED CHF15 (US LISTING) (REGISTERED),H8817H100,17697000.0,1109500,0.03478018537640309,2015-08-10,2015-06-30,0001140361-15-030521
PWR,QUANTA SERVICES INCORPORATED COMMON STOCK USD0.00001,74762E102,17684000.0,613400,0.03475463627712676,2015-08-10,2015-06-30,0001140361-15-030521
IT,GARTNER INCORPORATED COMMON STOCK USD0.0005,366651107,17645000.0,206353,0.03467798897929776,2015-08-10,2015-06-30,0001140361-15-030521
BAX,BAXTER INTERNATIONAL INCORPORATED COMMON STOCK USD1,071813109,17635000.0,249609,0.034658335826008274,2015-08-10,2015-06-30,0001140361-15-030521
TECH,BIO-TECHNE CORPORATION COMMON STOCK USD0.01,09073M104,17606000.0,179433,0.03460134168146877,2015-08-10,2015-06-30,0001140361-15-030521
N/A,HFF INCORPORATED CLASS A COMMON STOCK USD0.01,40418F108,17594000.0,425700,0.034577757897521384,2015-08-10,2015-06-30,0001140361-15-030521
CTRA,CABOT OIL & GAS CORPORATION COMMON STOCK USD0.10,127097103,17592000.0,559016,0.034573827266863484,2015-08-10,2015-06-30,0001140361-15-030521
SYY,SYSCO CORPORATION COMMON STOCK USD1,871829107,17578000.0,468246,0.034546312852258204,2015-08-10,2015-06-30,0001140361-15-030521
NTES,NETEASE INCORPORATED ADR (EACH REPRESENTS 25 SHARES USD0.0001),64110W102,17543000.0,124761,0.034477526815745,2015-08-10,2015-06-30,0001140361-15-030521
ROP,ROPER TECHNOLOGIES INCORPORATED COMMON STOCK USD0.01,776696106,17516000.0,101500,0.03442446330186339,2015-08-10,2015-06-30,0001140361-15-030521
AMSF,AMERISAFE INCORPORATED COMMON STOCK USD0.01,03071H100,17426000.0,372200,0.034247584922258024,2015-08-10,2015-06-30,0001140361-15-030521
SO,SOUTHERN COMPANY (THE) COMMON STOCK USD5,842587107,17370000.0,413959,0.0341375272638369,2015-08-10,2015-06-30,0001140361-15-030521
TSN,TYSON FOODS INCORPORATED CLASS A COMMON STOCK USD0.10,902494103,17349000.0,403931,0.03409625564192898,2015-08-10,2015-06-30,0001140361-15-030521
FFIV,F5 NETWORKS INCORPORATED COMMON STOCK NPV,315616102,17348000.0,144507,0.03409429032660003,2015-08-10,2015-06-30,0001140361-15-030521
BDX,BECTON DICKINSON & COMPANY COMMON STOCK USD1,075887109,17342000.0,122314,0.03408249843462634,2015-08-10,2015-06-30,0001140361-15-030521
ESRT,EMPIRE STATE REALTY TRUST INCORPORATED CLASS A REIT USD0.01,292104106,17314000.0,1016677,0.03402746960541578,2015-08-10,2015-06-30,0001140361-15-030521
IDA,IDACORP INCORPORATED COMMON STOCK NPV,451107106,17267000.0,306100,0.0339350997849552,2015-08-10,2015-06-30,0001140361-15-030521
PETS,PETMED EXPRESS INC COMMON STOCK USD0.001,716382106,17246000.0,1006198,0.03389382816304727,2015-08-10,2015-06-30,0001140361-15-030521
CVE,CENOVUS ENERGY INCORPORATED COMMON NPV,15135U109,17235000.0,870463,0.03387220969442884,2015-08-10,2015-06-30,0001140361-15-030521
MDPUSD,MEREDITH CORP COM STK US$1,589433101,17206000.0,330700,0.03381521554988933,2015-08-10,2015-06-30,0001140361-15-030521
FCNCA,FIRST CITIZENS BANCSHARES INCORPORATED CLASS A COMMON STOCK USD1,31946M103,17075000.0,65259,0.03355775924179707,2015-08-10,2015-06-30,0001140361-15-030521
N/A,LASALLE HOTEL PROPERTIES REIT USD0.01,517942108,17057000.0,486080,0.033522383565875995,2015-08-10,2015-06-30,0001140361-15-030521
N/A,DYNEGY INC COMMON STOCK USD0.01,26817R108,17046000.0,577635,0.03350076509725756,2015-08-10,2015-06-30,0001140361-15-030521
PACWUSD,PACWEST BANCORP COMMON STOCK NPV,695263103,17010000.0,364400,0.03343001374541541,2015-08-10,2015-06-30,0001140361-15-030521
GGAL,GRUPO FINANCIERO GALICIA-ADR,399909100,16983000.0,902400,0.0333769502315338,2015-08-10,2015-06-30,0001140361-15-030521
WRUSD,WESTAR ENERGY INCORPORATED COMMON STOCK USD5,95709T100,16899000.0,493400,0.033211863743902115,2015-08-10,2015-06-30,0001140361-15-030521
PG,PROCTER AND GAMBLE COMPANY (THE) COMMON STOCK NPV,742718109,16854000.0,215189,0.03312342455409943,2015-08-10,2015-06-30,0001140361-15-030521
KEY,KEYCORP COMMON STOCK USD1,493267108,16838000.0,1124800,0.03309197950883625,2015-08-10,2015-06-30,0001140361-15-030521
SIVBEUR,SVB FINANCIAL GROUP COMMON STOCK USD0.001,78486Q101,16837000.0,117549,0.0330900141935073,2015-08-10,2015-06-30,0001140361-15-030521
N/A,ENSCO PLC CLASS A COMMON STOCK USD0.10,G3157S106,16821000.0,757006,0.03305856914824413,2015-08-10,2015-06-30,0001140361-15-030521
N/A,HOLLYSYS AUTOMATION TECHNOLOGIES LIMITED USD0.0001,G45667105,16791000.0,713600,0.03299960968837567,2015-08-10,2015-06-30,0001140361-15-030521
MFAUSD,MFA FINANCIAL INCORPORATED REIT USD0.01,55272X102,16775000.0,2260740,0.032968164643112495,2015-08-10,2015-06-30,0001140361-15-030521
TTC,TORO COMPANY COMMON STOCK USD1,891092108,16740000.0,247847,0.03289937860659929,2015-08-10,2015-06-30,0001140361-15-030521
ARE,ALEXANDRIA REAL ESTATE EQUITIES INCORPORATED REIT USD0.01,015271109,16739000.0,191656,0.03289741329127035,2015-08-10,2015-06-30,0001140361-15-030521
BWA,BORGWARNER INCORPORATED COMMON STOCK USD0.01,099724106,16706000.0,290741,0.03283255788541504,2015-08-10,2015-06-30,0001140361-15-030521
PBR/A,PETROL BRASILEIRO-PETROBRAS SA SPONSORED ADR (EACH REPRESENTS 2 PREFERENCE SHARE NPV),71654V101,16697000.0,2041167,0.0328148700474545,2015-08-10,2015-06-30,0001140361-15-030521
RL,RALPH LAUREN CORPORATION CLASS A COMMON STOCK USD0.01,751212101,16644000.0,124363,0.032710708335020225,2015-08-10,2015-06-30,0001140361-15-030521
ABG,AMERISOURCE BERGEN CORPORATION CLASS 'A' COMMON STOCK USD0.01,03073E105,16459000.0,155124,0.03234712499916474,2015-08-10,2015-06-30,0001140361-15-030521
IPG,INTERPUBLIC GROUP OF COMPANIES INCORPORATED (THE) COMMON STOCK USD0.10,460690100,16404000.0,858858,0.03223903265607257,2015-08-10,2015-06-30,0001140361-15-030521
BAC,BANK OF AMERICA CORPORATION COMMON STOCK USD0.01,060505104,16402000.0,971126,0.03223510202541467,2015-08-10,2015-06-30,0001140361-15-030521
WPXUSD,WPX ENERGY INCORPORATED COMMON STOCK USD1,98212B103,16364000.0,1316511,0.032160420042914625,2015-08-10,2015-06-30,0001140361-15-030521
OII,OCEANEERING INTERNATIONAL INCORPORATED COMMON STOCK USD0.25,675232102,16258000.0,352366,0.03195209661804608,2015-08-10,2015-06-30,0001140361-15-030521
CMA,COMERICA INC COMMON STOCK USD5,200340107,16163000.0,315800,0.031765391661795955,2015-08-10,2015-06-30,0001140361-15-030521
STT,STATE STREET CORPORATION COMMON STOCK USD1,857477103,16080000.0,210775,0.031602270489493225,2015-08-10,2015-06-30,0001140361-15-030521
N/A,DONNELLEY (R.R.) & SONS COMPANY COMMON STOCK USD1.25,257867101,16058000.0,905700,0.03155903355225636,2015-08-10,2015-06-30,0001140361-15-030521
CMI,CUMMINS INCORPORATED COMMON STOCK USD2.50,231021106,16052000.0,122400,0.031547241660282666,2015-08-10,2015-06-30,0001140361-15-030521
HOG,HARLEY DAVIDSON INCORPORATED COMMON STOCK USD0.01,412822108,16021000.0,286450,0.03148631688508526,2015-08-10,2015-06-30,0001140361-15-030521
USNA,USANA HEALTH SCIENCES INCORPORATED COMMON STOCK USD0.001,90328M107,16016000.0,115165,0.03147649030844052,2015-08-10,2015-06-30,0001140361-15-030521
N/A,SOLARCITY CORPORATION COMMON STOCK USD0.0001,83416T100,15996000.0,300286,0.031437184001861546,2015-08-10,2015-06-30,0001140361-15-030521
N/A,DR PEPPER SNAPPLE GROUP INCORPORATED COMMON STOCK USD0.01,26138E109,15974000.0,217843,0.03139394706462467,2015-08-10,2015-06-30,0001140361-15-030521
CAH,CARDINAL HEALTH CORPORATION INCORPORATED COMMON STOCK NPV,14149Y108,15969000.0,190700,0.031384120487979936,2015-08-10,2015-06-30,0001140361-15-030521
UHS,UNIVERSAL HEALTH SERVICES INCORPORATED CLASS 'B' COMMON STOCK USD0.01,913903100,15955000.0,112900,0.03135660607337465,2015-08-10,2015-06-30,0001140361-15-030521
N/A,HEALTH CARE REIT INCORPORATED COMMON STOCK USD1,42217K106,15945000.0,242472,0.03133695292008517,2015-08-10,2015-06-30,0001140361-15-030521
PEP,PEPSICO INCORPORATED CAPITAL STOCK USD0.016666,713448108,15933000.0,170059,0.03131336913613779,2015-08-10,2015-06-30,0001140361-15-030521
N/A,FAIRCHILD SEMICONDUCTOR CORPORATION CLASS A COMMON STOCK USD0.01,303726103,15853000.0,909500,0.031156143909821903,2015-08-10,2015-06-30,0001140361-15-030521
MTSI,MA-COM TECHNOLOGY SOLUTIONS COMMON STOCK USD0.01,55405Y100,15819000.0,416500,0.03108932318863765,2015-08-10,2015-06-30,0001140361-15-030521
UVE,UNIVERSAL INSURANCE HOLDINGS INCORPORATED COMMON STOCK USD0.01,91359V107,15801000.0,665600,0.031053947512716572,2015-08-10,2015-06-30,0001140361-15-030521
OC,OWENS CORNING INCORPORATED COMMON STOCK USD0.01,690742101,15775000.0,378558,0.03100284931416391,2015-08-10,2015-06-30,0001140361-15-030521
DAR,DARLING INGREDIENTS INCORPORATED COMMON STOCK USD0.01,237266101,15760000.0,1083900,0.03097336958422968,2015-08-10,2015-06-30,0001140361-15-030521
NOG1EUR,NORTHERN OIL AND GAS INCORPORATED COMMON STOCK USD0.001,665531109,15736000.0,2366286,0.030926202016334916,2015-08-10,2015-06-30,0001140361-15-030521
N/A,ULTIMATE SOFTWARE GROUP INC COMMON STOCK USD0.01,90385D107,15727000.0,96006,0.030908514178374376,2015-08-10,2015-06-30,0001140361-15-030521
PDCEUSD,PDC ENERGY INCORPORATED COMMON STOCK USD0.01,69327R101,15726000.0,298300,0.030906548863045426,2015-08-10,2015-06-30,0001140361-15-030521
IVZ,INVESCO LIMITED ORDINARY USD0.10,G491BT108,15712000.0,420100,0.03087903444844015,2015-08-10,2015-06-30,0001140361-15-030521
AKRXEUR,AKORN INC NPV USD COMMON STOCK,009728106,15710000.0,369300,0.030875103817782253,2015-08-10,2015-06-30,0001140361-15-030521
BECNUSD,BEACON ROOFING SUPPLY INCORPORATED COMMON STOCK USD0.01,073685109,15683000.0,473656,0.030822040303900643,2015-08-10,2015-06-30,0001140361-15-030521
WMT,WAL-MART STORES INCORPORATED COMMON STOCK USD0.10,931142103,15668000.0,219376,0.030792560573966413,2015-08-10,2015-06-30,0001140361-15-030521
SFM,SPROUTS FARMERS MARKETS INCORPORATED COMMON STOCK USD0.001,85208M102,15646000.0,575865,0.030749323636729543,2015-08-10,2015-06-30,0001140361-15-030521
WDAY,WORKDAY INCORPORATED COMMON STOCK USD0.001,98138H101,15585000.0,204229,0.03062943940166368,2015-08-10,2015-06-30,0001140361-15-030521
IWD,ISHARES TRUST RUSSELL 1000 VALUE ETF,464287598,15584000.0,151290,0.030627474086334726,2015-08-10,2015-06-30,0001140361-15-030521
N/A,OUTERWALL INCORPORATED COMMON STOCK USD0.001,690070107,15579000.0,205941,0.03061764750968999,2015-08-10,2015-06-30,0001140361-15-030521
N/A,SIGNET JEWELERS LIMITED ORDINARY USD0.18,G81276100,15564000.0,191290,0.03058816777975576,2015-08-10,2015-06-30,0001140361-15-030521
N/A,ARM HOLDINGS PLC ADR (EACH REPRESENTS 3 ORDINARY 0.05P),042068106,15563000.0,317350,0.03058620246442681,2015-08-10,2015-06-30,0001140361-15-030521
PNC,PNC FINANCIAL SERVICES GROUP COMMON STOCK USD5,693475105,15554000.0,162600,0.030568514626466276,2015-08-10,2015-06-30,0001140361-15-030521
KRE,SPDR SERIES TRUST S&P REGIONAL BANKING ETF,78464A698,15540000.0,351913,0.030541000211860993,2015-08-10,2015-06-30,0001140361-15-030521
ON1,OLD NATL BANCORP COMMON STOCK NPV,680033107,15526000.0,1074455,0.030513485797255713,2015-08-10,2015-06-30,0001140361-15-030521
AFL,AFLAC INCORPORATED COMMON STOCK USD0.10,001055102,15481000.0,251975,0.030425046607453026,2015-08-10,2015-06-30,0001140361-15-030521
VEA,VANGUARD FTSE DEVELOPED MARKETS ETF,921943858,15470000.0,389584,0.03040342813883459,2015-08-10,2015-06-30,0001140361-15-030521
QCOM,QUALCOMM INCORPORATED COMMON STOCK USD0.0001,747525103,15447000.0,246678,0.030358225886268773,2015-08-10,2015-06-30,0001140361-15-030521
PLOW,DOUGLAS DYNAMICS INCORPORATED COMMON STOCK USD0.01,25960R105,15411000.0,737711,0.030287474534426626,2015-08-10,2015-06-30,0001140361-15-030521
CNA,CNA FINANCIAL CORPORATION COMMON STOCK USD2.50,126117100,15409000.0,405172,0.03028354390376873,2015-08-10,2015-06-30,0001140361-15-030521
N/A,JDS UNIPHASE CORPORATION COMMON STOCK USD0.001,46612J507,15285000.0,1306400,0.030039844802979106,2015-08-10,2015-06-30,0001140361-15-030521
EBA,EBAY INCORPORATED COMMON STOCK USD0.001,278642103,15210000.0,256187,0.02989244615330796,2015-08-10,2015-06-30,0001140361-15-030521
N/A,E-HOUSE CHINA HOLDINGS LIMITED ADS (EACH REPRESENTS 1 ORDINARY USD0.001),26852W103,15188000.0,2260100,0.02984920921607109,2015-08-10,2015-06-30,0001140361-15-030521
N/A,ISHARES INCORPORATED MSCI TAIWAN ETF,464286731,15183000.0,971383,0.02983938263942635,2015-08-10,2015-06-30,0001140361-15-030521
N/A,NEW YORK COMMUNITY BANCORP INCORPORATED COMMON STOCK USD0.01,649445103,15170000.0,831253,0.029813833540150016,2015-08-10,2015-06-30,0001140361-15-030521
N/A,WUXI PHARMATECH CAYMAN INCORPORATED ADR (EACH REPRESENTS 8 COMMON USD0.02),929352102,15164000.0,365843,0.029802041648176326,2015-08-10,2015-06-30,0001140361-15-030521
SU,SUNCOR ENERGY INCORPORATED NEW COMMON NPV (CANADA LISTING),867224107,15138000.0,448003,0.029750943449623663,2015-08-10,2015-06-30,0001140361-15-030521
IBM,INTL BUSINESS MACHINES CORPORATION COMMON STOCK USD0.20,459200101,15054000.0,92371,0.02958585696199198,2015-08-10,2015-06-30,0001140361-15-030521
SLG2EUR,SL GREEN REALTY CORPORATION REIT USD0.01,78440X101,15014000.0,136451,0.029507244348834036,2015-08-10,2015-06-30,0001140361-15-030521
N/A,SOUFUN HOLDINGS LIMITED ADR (EACH REPRESENTS 0.20 ORDINARY SHARES),836034108,14932000.0,1836600,0.029346088491860253,2015-08-10,2015-06-30,0001140361-15-030521
N/A,K2M GROUP HOLDINGS INCORPORATED COMMON STOCK USD0.001,48273J107,14913000.0,629766,0.02930874750061023,2015-08-10,2015-06-30,0001140361-15-030521
SNEUR,SANCHEZ ENERGY CORPORATION COMMON STOCK USD0.01,79970Y105,14912000.0,1546846,0.02930678218528128,2015-08-10,2015-06-30,0001140361-15-030521
