ticker,nameOfIssuer,cusip,value,shares,allocation_percent,filingDate,reportDate,accessionNumber
KRE,SPDR SERIES TRUST S&P REGIONAL BANKING ETF,78464A698,640000.0,14495,0.0012578018105270936,2015-08-10,2015-06-30,0001140361-15-030521
SHW,SHERWIN-WILLIAMS COMPANY (THE) COMMON STOCK USD1,824348106,635000.0,2300,0.0012479752338823507,2015-08-10,2015-06-30,0001140361-15-030521
ALNY,ALNYLAM PHARMACEUTICALS INCORPORATED COMMON STOCK USD0.01,02043Q107,634000.0,5550,0.0012460099185534021,2015-08-10,2015-06-30,0001140361-15-030521
XECEUR,CIMAREX ENERGY COMPANY COMMON STOCK USD0.01,171798101,634000.0,5805,0.0012460099185534021,2015-08-10,2015-06-30,0001140361-15-030521
BALL,BALL CORPORATION COMMON STOCK NPV,058498106,633000.0,8901,0.0012440446032244536,2015-08-10,2015-06-30,0001140361-15-030521
GLD,SPDR GOLD TRUST GOLD SHARES NPV,78463V107,631000.0,5579,0.0012401139725665565,2015-08-10,2015-06-30,0001140361-15-030521
N/A,SPECTRA ENERGY CORPORATION COMMON STOCK USD0.001,847560109,629000.0,19532,0.0012361833419086592,2015-08-10,2015-06-30,0001140361-15-030521
N/A,CIA PARANAENSE ENER-SP ADR P,20441B407,628000.0,57900,0.0012342180265797107,2015-08-10,2015-06-30,0001140361-15-030521
SO,SOUTHERN COMPANY (THE) COMMON STOCK USD5,842587107,623000.0,14837,0.0012243914499349676,2015-08-10,2015-06-30,0001140361-15-030521
PFE,PFIZER INCORPORATED COMMON STOCK USD0.05,717081103,620000.0,18453,0.001218495503948122,2015-08-10,2015-06-30,0001140361-15-030521
AEM,AGNICO EAGLE MINES LIMITED COMMON NPV,008474108,617000.0,17132,0.0012125995579612761,2015-08-10,2015-06-30,0001140361-15-030521
LOGI,LOGITECH INTERNATIONAL SA CHF0.25 (REGISTERED),H50430232,616000.0,44929,0.0012106342426323276,2015-08-10,2015-06-30,0001140361-15-030521
AAPL,APPLE INCORPORATED COMMON STOCK NPV,037833100,614000.0,4929,0.0012067036119744305,2015-08-10,2015-06-30,0001140361-15-030521
FDX,FEDEX CORPORATION COMMON STOCK USD0.10,31428X106,614000.0,3589,0.0012067036119744305,2015-08-10,2015-06-30,0001140361-15-030521
COST,COSTCO WHOLESALE CORPORATION COMMON STOCK USD0.01,22160K105,613000.0,4514,0.0012047382966454817,2015-08-10,2015-06-30,0001140361-15-030521
EW,EDWARDS LIFESCIENCES CORPORATION COMMON STOCK USD1,28176E108,612000.0,4300,0.0012027729813165334,2015-08-10,2015-06-30,0001140361-15-030521
RLJ,RLJ LODGING TRUST REIT USD0.01,74965L101,607000.0,20500,0.0011929464046717903,2015-08-10,2015-06-30,0001140361-15-030521
HSY,HERSHEY COMPANY (THE) COMMON STOCK USD1,427866108,606000.0,6894,0.0011909810893428417,2015-08-10,2015-06-30,0001140361-15-030521
AIT,APPLIED INDUSTRIAL TECHNOLOGIES INCORPORATED COMMON STOCK NPV,03820C105,605000.0,15100,0.0011890157740138932,2015-08-10,2015-06-30,0001140361-15-030521
KR,KROGER COMPANY (THE) COMMON STOCK USD1,501044101,603000.0,8300,0.001185085143355996,2015-08-10,2015-06-30,0001140361-15-030521
JNJ,JOHNSON AND JOHNSON COMMON STOCK USD1,478160104,602000.0,6161,0.0011831198280270474,2015-08-10,2015-06-30,0001140361-15-030521
CTRA,CABOT OIL & GAS CORPORATION COMMON STOCK USD0.10,127097103,602000.0,19139,0.0011831198280270474,2015-08-10,2015-06-30,0001140361-15-030521
N/A,PEPCO HOLDINGS INCORPORATED COMMON STOCK USD0.01,713291102,600000.0,22479,0.0011791891973691503,2015-08-10,2015-06-30,0001140361-15-030521
BK,BANK OF NEW YORK MELLON CORPORATION (THE) COMMON STOCK USD0.01,064058100,597000.0,14297,0.0011732932513823045,2015-08-10,2015-06-30,0001140361-15-030521
AAT,AMERICAN ASSETS TRUST INCORPORATED REIT USD0.01,024013104,596000.0,15298,0.001171327936053356,2015-08-10,2015-06-30,0001140361-15-030521
XECEUR,CIMAREX ENERGY COMPANY COMMON STOCK USD0.01,171798101,592000.0,5419,0.0011634666747375615,2015-08-10,2015-06-30,0001140361-15-030521
XLI,INDUSTRIAL SELECT SECTOR SPDR FUND,81369Y704,589000.0,10900,0.001157570728750716,2015-08-10,2015-06-30,0001140361-15-030521
WEP,MAGELLAN MIDSTREAM PARTNERS COMMON STOCK NPV,559080106,587000.0,7900,0.0011536400980928186,2015-08-10,2015-06-30,0001140361-15-030521
RF,REGIONS FINANCIAL CORPORATION COMMON STOCK USD0.01,7591EP100,586000.0,56900,0.00115167478276387,2015-08-10,2015-06-30,0001140361-15-030521
PEO,EXELON CORPORATION COMMON STOCK NPV,30161N101,585000.0,18391,0.0011497094674349216,2015-08-10,2015-06-30,0001140361-15-030521
DFSEUR,DISCOVER FINANCIAL SERVICES COMMON STOCK USD0.01,254709108,584000.0,10192,0.0011477441521059728,2015-08-10,2015-06-30,0001140361-15-030521
META,FACEBOOK INCORPORATED CLASS A COMMON STOCK USD0.000006,30303M102,583000.0,6800,0.0011457788367770243,2015-08-10,2015-06-30,0001140361-15-030521
HB6,HIBBETT SPORTS INCORPORATED COMMON STOCK USD0.01,428567101,577000.0,12441,0.0011339869448033328,2015-08-10,2015-06-30,0001140361-15-030521
N/A,OMNICARE INC. COMMON STOCK USD1,681904108,574000.0,6097,0.001128090998816487,2015-08-10,2015-06-30,0001140361-15-030521
TJX,TJX COS INCORPORATED COMMON STOCK USD1,872540109,571000.0,8646,0.0011221950528296414,2015-08-10,2015-06-30,0001140361-15-030521
APH,AMPHENOL CORPORATION CLASS A COMMON STOCK USD0.001,032095101,568000.0,10000,0.0011162991068427957,2015-08-10,2015-06-30,0001140361-15-030521
N/A,TRANSATLANTIC PETROLEUM LIMITED COMMON NPV (US LISTING),G89982113,564000.0,112492,0.0011084378455270012,2015-08-10,2015-06-30,0001140361-15-030521
MET,METLIFE INCORPORATED COMMON STOCK USD0.01,59156R108,555000.0,10013,0.001090750007566464,2015-08-10,2015-06-30,0001140361-15-030521
NKSH,NATIONAL BANKSHARES INCORPORATED COMMON STOCK USD1.25,634865109,552000.0,19000,0.0010848540615796183,2015-08-10,2015-06-30,0001140361-15-030521
GNW,GENWORTH FINANCIAL INC CLASS 'A' COMMON STOCK USD0.001,37247D106,551000.0,72300,0.0010828887462506697,2015-08-10,2015-06-30,0001140361-15-030521
AWR,AMERICAN STATES WATER COMPANY COMMON STOCK NPV,029899101,546000.0,14600,0.0010730621696059268,2015-08-10,2015-06-30,0001140361-15-030521
N/A,CIA BRASILEIRA DE DISTRIBUICAO GRUPO PAO DE ACUCAR ADR (EACH REPRESENTS 1 PREFERENCE),20440T201,545000.0,22499,0.0010710968542769783,2015-08-10,2015-06-30,0001140361-15-030521
EXPE,EXPEDIA INCORPORATED COMMON STOCK USD0.001,30212P303,545000.0,5100,0.0010710968542769783,2015-08-10,2015-06-30,0001140361-15-030521
FBP,FIRST BANCORP PUERTO RICO COMMON STOCK USD1,318672706,542000.0,96900,0.0010652009082901324,2015-08-10,2015-06-30,0001140361-15-030521
CVX,CHEVRON CORPORATION COMMON STOCK USD0.75,166764100,542000.0,5607,0.0010652009082901324,2015-08-10,2015-06-30,0001140361-15-030521
PLOW,DOUGLAS DYNAMICS INCORPORATED COMMON STOCK USD0.01,25960R105,541000.0,25875,0.0010632355929611839,2015-08-10,2015-06-30,0001140361-15-030521
ARLP,ALLIANCE RESOURCE PARTNERS LP NPV,01877R108,537000.0,21786,0.0010553743316453895,2015-08-10,2015-06-30,0001140361-15-030521
N/A,PAREXEL INTERNATIONAL CORPORATION COMMON STOCK USD0.01,699462107,531000.0,8300,0.0010435824396716979,2015-08-10,2015-06-30,0001140361-15-030521
N/A,DONNELLEY (R.R.) & SONS COMPANY COMMON STOCK USD1.25,257867101,528000.0,29800,0.0010376864936848522,2015-08-10,2015-06-30,0001140361-15-030521
SO,SOUTHERN COMPANY (THE) COMMON STOCK USD5,842587107,525000.0,12500,0.0010317905476980066,2015-08-10,2015-06-30,0001140361-15-030521
USPH,US PHYSICAL THERAPY INCORPORATED COMMON STOCK USD0.01,90337L108,522000.0,9700,0.0010258946017111608,2015-08-10,2015-06-30,0001140361-15-030521
N/A,STILLWATER MINING COMPANY COMMON STOCK USD0.01,86074Q102,521000.0,44378,0.001023929286382212,2015-08-10,2015-06-30,0001140361-15-030521
MAIN,MAIN STREET CAPITAL CORPORATION COMMON STOCK USD0.01,56035L104,521000.0,16400,0.001023929286382212,2015-08-10,2015-06-30,0001140361-15-030521
TRL,DAVITA HEALTHCARE PARTNERS INCORPORATED COMMON STOCK USD0.001,23918K108,521000.0,6545,0.001023929286382212,2015-08-10,2015-06-30,0001140361-15-030521
N/A,DST SYSTEMS INCORPORATED COMMON STOCK USD0.01,233326107,520000.0,4200,0.0010219639710532635,2015-08-10,2015-06-30,0001140361-15-030521
AWM,SKYWORKS SOLUTIONS INCORPORATED COMMON STOCK USD0.25,83088M102,520000.0,5100,0.0010219639710532635,2015-08-10,2015-06-30,0001140361-15-030521
SHYG,ISHARES 0-5 YR HY CORP BOND,46434V407,520000.0,10710,0.0010219639710532635,2015-08-10,2015-06-30,0001140361-15-030521
TD,TORONTO-DOMINION BANK (THE) COMMON NPV,891160509,520000.0,9792,0.0010219639710532635,2015-08-10,2015-06-30,0001140361-15-030521
A4S,AMERIPRISE FINANCIAL INCORPORATED COMMON STOCK USD0.01,03076C106,520000.0,4200,0.0010219639710532635,2015-08-10,2015-06-30,0001140361-15-030521
N/A,CELESTICA INCORPORATED SUBORDINATED ORDINARY VOTING SHARES NPV,15101Q108,519000.0,36100,0.001019998655724315,2015-08-10,2015-06-30,0001140361-15-030521
N/A,APOLLO RESIDENTIAL MORTGAGE INCORPORATED REIT USD0.01,03763V102,518000.0,35100,0.0010180333403953664,2015-08-10,2015-06-30,0001140361-15-030521
N/A,ULTIMATE SOFTWARE GROUP INC COMMON STOCK USD0.01,90385D107,512000.0,3123,0.001006241448421675,2015-08-10,2015-06-30,0001140361-15-030521
CMTL,COMTECH TELECOMMUNICATIONS CORPORATION COMMON STOCK USD0.10,205826209,508000.0,17300,0.0009983801871058806,2015-08-10,2015-06-30,0001140361-15-030521
VAC,MARRIOTT VACATIONS WORLDWIDE CORPORATION COMMON STOCK USD0.01,57164Y107,507000.0,5600,0.000996414871776932,2015-08-10,2015-06-30,0001140361-15-030521
BSBR,BANCO SANTANDER BRASIL SA ADR (EACH REPRESENTS 1 UNIT SHARE),05967A107,506000.0,95500,0.0009944495564479835,2015-08-10,2015-06-30,0001140361-15-030521
EGP,EASTGROUP PROPERTIES INCORPORATED REIT USD0.0001,277276101,501000.0,8795,0.0009846229798032404,2015-08-10,2015-06-30,0001140361-15-030521
APH,AMPHENOL CORPORATION CLASS A COMMON STOCK USD0.001,032095101,500000.0,8800,0.0009826576644742918,2015-08-10,2015-06-30,0001140361-15-030521
N/A,UBS GROUP AG CHF0.10 (REGISTERED),H42097107,500000.0,25200,0.0009826576644742918,2015-08-10,2015-06-30,0001140361-15-030521
ILCB,ISHARES MORNINGSTAR LARGE-CA,464287127,499000.0,4145,0.0009806923491453433,2015-08-10,2015-06-30,0001140361-15-030521
N/A,WESTERN REFINING INCORPORATED COMMON STOCK USD0.01,959319104,496000.0,11600,0.0009747964031584977,2015-08-10,2015-06-30,0001140361-15-030521
SHYG,ISHARES 0-5 YR HY CORP BOND,46434V407,494000.0,10185,0.0009708657725006004,2015-08-10,2015-06-30,0001140361-15-030521
SYY,SYSCO CORPORATION COMMON STOCK USD1,871829107,492000.0,13109,0.0009669351418427032,2015-08-10,2015-06-30,0001140361-15-030521
ELV,ANTHEM INCORPORATED COMMON STOCK USD0.01,036752103,489000.0,3000,0.0009610391958558575,2015-08-10,2015-06-30,0001140361-15-030521
CX,CEMEX SAB DE CV SPONSORED ADR (EACH REPRESENTS 10 CPO),151290889,488000.0,54072,0.0009590738805269088,2015-08-10,2015-06-30,0001140361-15-030521
IGF,ISHARES GLOBAL INFRASTRUCTUR,464288372,486000.0,12000,0.0009551432498690119,2015-08-10,2015-06-30,0001140361-15-030521
XIFR,NEXTERA ENERGY PARTNERS LP NPV,65341B106,486000.0,11886,0.0009551432498690119,2015-08-10,2015-06-30,0001140361-15-030521
HAS,HASBRO INC COMMON STOCK USD0.50,418056107,484000.0,6400,0.0009512126192111146,2015-08-10,2015-06-30,0001140361-15-030521
PEP,PEPSICO INCORPORATED CAPITAL STOCK USD0.016666,713448108,483000.0,5157,0.000949247303882166,2015-08-10,2015-06-30,0001140361-15-030521
NEE,NEXTERA ENERGY INCORPORATED COMMON STOCK  USD0.01,65339F101,481000.0,4900,0.0009453166732242688,2015-08-10,2015-06-30,0001140361-15-030521
N/A,RPX CORPORATION COMMON STOCK USD0.0001,74972G103,477000.0,28500,0.0009374554119084744,2015-08-10,2015-06-30,0001140361-15-030521
GE,GENERAL ELECTRIC COMPANY COMMON STOCK USD0.06,369604103,473000.0,17765,0.0009295941505926802,2015-08-10,2015-06-30,0001140361-15-030521
FDX,FEDEX CORPORATION COMMON STOCK USD0.10,31428X106,473000.0,2766,0.0009295941505926802,2015-08-10,2015-06-30,0001140361-15-030521
N/A,MICHAEL KORS HOLDINGS LIMITED COMMON STOCK NPV,G60754101,472000.0,10893,0.0009276288352637316,2015-08-10,2015-06-30,0001140361-15-030521
CME,CME GROUP INCORPORATED COMMON STOCK USD0.01,12572Q105,471000.0,5101,0.000925663519934783,2015-08-10,2015-06-30,0001140361-15-030521
N/A,VANTIV INCORPORATED CLASS A COMMON STOCK USD0.00001,92210H105,468000.0,12399,0.0009197675739479372,2015-08-10,2015-06-30,0001140361-15-030521
MRK,MERCK AND COMPANY INCORPORATED NEW COMMON STOCK USD0.01,58933Y105,468000.0,8167,0.0009197675739479372,2015-08-10,2015-06-30,0001140361-15-030521
KBIA,KB FINANCIAL GROUP INCORPORATED ADR (EACH REPRESENTS 1 ORDINARY KRW5000),48241A105,467000.0,14300,0.0009178022586189885,2015-08-10,2015-06-30,0001140361-15-030521
NDAQ,NASDAQ OMX GROUP INCORPORATED (THE) COMMON STOCK USD0.01,631103108,467000.0,9613,0.0009178022586189885,2015-08-10,2015-06-30,0001140361-15-030521
MHK,MOHAWK INDUSTRIES INCORPORATED COMMON STOCK USD0.01,608190104,465000.0,2464,0.0009138716279610916,2015-08-10,2015-06-30,0001140361-15-030521
AGX,ARGAN INCORPORATED COMMON STOCK USD0.15,04010E109,463000.0,11800,0.0009099409973031944,2015-08-10,2015-06-30,0001140361-15-030521
HDB,HDFC BANK LIMITED ADR (EACH REPRESENTING 3 ORDINARY),40415F101,462000.0,7664,0.0009079756819742457,2015-08-10,2015-06-30,0001140361-15-030521
EPR,EPR PROPERTIES REIT USD0.01,26884U109,462000.0,8400,0.0009079756819742457,2015-08-10,2015-06-30,0001140361-15-030521
PRI,PRIMERICA INCORPORATED COMMON STOCK USD0.01,74164M108,460000.0,10079,0.0009040450513163485,2015-08-10,2015-06-30,0001140361-15-030521
HOG,HARLEY DAVIDSON INCORPORATED COMMON STOCK USD0.01,412822108,459000.0,8199,0.0009020797359873999,2015-08-10,2015-06-30,0001140361-15-030521
MAIN,MAIN STREET CAPITAL CORPORATION COMMON STOCK USD0.01,56035L104,451000.0,14200,0.0008863572133558113,2015-08-10,2015-06-30,0001140361-15-030521
N/A,PALL CORPORATION COMMON STOCK USD0.10,696429307,449000.0,3604,0.0008824265826979141,2015-08-10,2015-06-30,0001140361-15-030521
NGD,NEW GOLD INCORPORATED COMMON NPV (US LISTING),644535106,449000.0,162684,0.0008824265826979141,2015-08-10,2015-06-30,0001140361-15-030521
N/A,AVAGO TECHNOLOGIES LIMITED NPV (US LISTING),Y0486S104,449000.0,3400,0.0008824265826979141,2015-08-10,2015-06-30,0001140361-15-030521
MNST,MONSTER BEVERAGE CORPORATION COMMON STOCK USD0.005,61174X109,448000.0,3344,0.0008804612673689655,2015-08-10,2015-06-30,0001140361-15-030521
DWD,MORGAN STANLEY COMMON STOCK USD0.01,617446448,448000.0,11691,0.0008804612673689655,2015-08-10,2015-06-30,0001140361-15-030521
COF,CAPITAL ONE FINANCIAL CORPORATION COMMON STOCK USD0.01,14040H105,446000.0,5080,0.0008765306367110683,2015-08-10,2015-06-30,0001140361-15-030521
VFC,VF CORPORATION COMMON STOCK USD1,918204108,441000.0,6400,0.0008667040600663254,2015-08-10,2015-06-30,0001140361-15-030521
LSAK,NET 1 UEPS TECHNOLOGIES INCORPORATED COMMON STOCK USD0.001,64107N206,439000.0,24300,0.0008627734294084283,2015-08-10,2015-06-30,0001140361-15-030521
STT,STATE STREET CORPORATION COMMON STOCK USD1,857477103,437000.0,5730,0.0008588427987505311,2015-08-10,2015-06-30,0001140361-15-030521
CFFI,C AND F FINANCIAL CORPORATION COMMON STOCK USD1,12466Q104,437000.0,11979,0.0008588427987505311,2015-08-10,2015-06-30,0001140361-15-030521
BAC,VERIZON COMMUNICATIONS INCORPORATED COMMON STOCK USD0.10,92343V104,435000.0,9300,0.0008549121680926339,2015-08-10,2015-06-30,0001140361-15-030521
SBUX,STARBUCKS CORPORATION COMMON STOCK USD0.001,855244109,430000.0,8021,0.0008450855914478911,2015-08-10,2015-06-30,0001140361-15-030521
FETUSD,FORUM ENERGY TECHNOLOGIES INCORPORATED COMMON STOCK USD0.01,34984V100,428000.0,21400,0.0008411549607899939,2015-08-10,2015-06-30,0001140361-15-030521
GS,GOLDMAN SACHS GROUP INCORPORATED COMMON STOCK USD0.01,38141G104,425000.0,2049,0.000835259014803148,2015-08-10,2015-06-30,0001140361-15-030521
CERNCHF,CERNER CORPORATION COMMON STOCK USD0.01,156782104,425000.0,6224,0.000835259014803148,2015-08-10,2015-06-30,0001140361-15-030521
EA,ELECTRONIC ARTS INCORPORATED COMMON STOCK USD0.01,285512109,421000.0,6365,0.0008273977534873538,2015-08-10,2015-06-30,0001140361-15-030521
JECUSD,JACOBS ENGINEERING GROUP INCORPORATED COMMON STOCK USD1,469814107,419000.0,10300,0.0008234671228294566,2015-08-10,2015-06-30,0001140361-15-030521
N/A,JOHNSON CONTROLS INCORPORATED COMMON STOCK USD0.01388,478366107,419000.0,8400,0.0008234671228294566,2015-08-10,2015-06-30,0001140361-15-030521
CL,COLGATE-PALMOLIVE COMPANY COMMON STOCK USD1,194162103,418000.0,6398,0.0008215018075005081,2015-08-10,2015-06-30,0001140361-15-030521
GCI1EUR,GANNETT COMPANY INCORPORATED COMMON STOCK NPV,36473H104,418000.0,30800,0.0008215018075005081,2015-08-10,2015-06-30,0001140361-15-030521
BPOP,POPULAR INCORPORATED COMMON STOCK USD0.01,733174700,417000.0,14100,0.0008195364921715594,2015-08-10,2015-06-30,0001140361-15-030521
ORLY,O'REILLY AUTOMOTIVE INCORPORATED COMMON STOCK USD0.01,67103H107,408000.0,1802,0.0008018486542110222,2015-08-10,2015-06-30,0001140361-15-030521
N/A,IMS HEALTH HOLDINGS INCORPORATED COMMON STOCK USD0.01,44970B109,407000.0,13351,0.0007998833388820736,2015-08-10,2015-06-30,0001140361-15-030521
SF9,SANDERSON FARMS INCORPORATED COMMON STOCK USD1,800013104,405000.0,5400,0.0007959527082241764,2015-08-10,2015-06-30,0001140361-15-030521
AKX,ANSYS INCORPORATED COMMON STOCK USD0.01,03662Q105,400000.0,4400,0.0007861261315794336,2015-08-10,2015-06-30,0001140361-15-030521
CTSH,COGNIZANT TECHNOLOGY SOLUTIONS CORPORATION CLASS A COMMON STOCK USD0.01,192446102,399000.0,6530,0.000784160816250485,2015-08-10,2015-06-30,0001140361-15-030521
DVY,ISHARES TRUST SELECT DIVIDEND ETF,464287168,399000.0,5310,0.000784160816250485,2015-08-10,2015-06-30,0001140361-15-030521
N/A,CBS CORPORATION CLASS B COMMON STOCK USD0.001,124857202,398000.0,7200,0.0007821955009215363,2015-08-10,2015-06-30,0001140361-15-030521
DG,DOLLAR GENERAL CORPORATION COMMON STOCK USD0.875,256677105,397000.0,5100,0.0007802301855925878,2015-08-10,2015-06-30,0001140361-15-030521
TRIP,TRIPADVISOR INCORPORATED COMMON STOCK USD0.001,896945201,397000.0,4632,0.0007802301855925878,2015-08-10,2015-06-30,0001140361-15-030521
N/A,AIRGAS INCORPORATED COMMON STOCK USD0.01,009363102,397000.0,3760,0.0007802301855925878,2015-08-10,2015-06-30,0001140361-15-030521
GILD,GILEAD SCIENCES INCORPORATED COMMON STOCK USD0.001,375558103,395000.0,3422,0.0007762995549346906,2015-08-10,2015-06-30,0001140361-15-030521
N/A,EATON CORPORATION PLC COMMON STOCK USD0.50,G29183103,387000.0,5788,0.0007605770323031019,2015-08-10,2015-06-30,0001140361-15-030521
DLB,DOLBY LABORATORIES INCORPORATED CLASS 'A' COMMON STOCK USD0.001,25659T107,386000.0,9700,0.0007586117169741533,2015-08-10,2015-06-30,0001140361-15-030521
N/A,ROCKWELL COLLINS INCORPORATED COMMON STOCK USD0.01,774341101,386000.0,4164,0.0007586117169741533,2015-08-10,2015-06-30,0001140361-15-030521
GPRE,GREEN PLAINS INCORPORATED COMMON STOCK USD0.001,393222104,385000.0,14400,0.0007566464016452048,2015-08-10,2015-06-30,0001140361-15-030521
N/A,PALL CORPORATION COMMON STOCK USD0.10,696429307,384000.0,3084,0.0007546810863162562,2015-08-10,2015-06-30,0001140361-15-030521
NUE,NUCOR CORPORATION COMMON STOCK USD0.40,670346105,383000.0,8517,0.0007527157709873076,2015-08-10,2015-06-30,0001140361-15-030521
DE,DEERE & COMPANY COMMON STOCK USD1,244199105,382000.0,4019,0.000750750455658359,2015-08-10,2015-06-30,0001140361-15-030521
APC,ANADARKO PETROLEUM CORPORATION COMMON STOCK USD0.10,032511107,382000.0,4857,0.000750750455658359,2015-08-10,2015-06-30,0001140361-15-030521
BABA,ALIBABA GROUP HOLDING LIMITED SPONSORED ADR (EACH REPRESENTS 1 ORDINARY SHARES USD0.000025),01609W102,381000.0,4703,0.0007487851403294104,2015-08-10,2015-06-30,0001140361-15-030521
N/A,REGULUS THERAPEUTICS INCORPORATED COMMON STOCK USD0.001,75915K101,379000.0,37498,0.0007448545096715133,2015-08-10,2015-06-30,0001140361-15-030521
N/A,MONSANTO COMPANY COMMON STOCK USD0.01,61166W101,377000.0,3650,0.0007409238790136161,2015-08-10,2015-06-30,0001140361-15-030521
HUM,HUMANA INC COMMON STOCK USD0.166,444859102,377000.0,1956,0.0007409238790136161,2015-08-10,2015-06-30,0001140361-15-030521
ARE,ALEXANDRIA REAL ESTATE EQUITIES INCORPORATED REIT USD0.01,015271109,376000.0,4300,0.0007389585636846675,2015-08-10,2015-06-30,0001140361-15-030521
MFAUSD,MFA FINANCIAL INCORPORATED REIT USD0.01,55272X102,376000.0,50730,0.0007389585636846675,2015-08-10,2015-06-30,0001140361-15-030521
MBI,MBIA INC COM STK US$1,55262C100,376000.0,59000,0.0007389585636846675,2015-08-10,2015-06-30,0001140361-15-030521
ADBE,ADOBE SYSTEMS INCORPORATED NPV,00724F101,374000.0,4600,0.0007350279330267704,2015-08-10,2015-06-30,0001140361-15-030521
FF,FUTUREFUEL CORPORATION COMMON STOCK USD0.0001,36116M106,372000.0,29200,0.0007310973023688732,2015-08-10,2015-06-30,0001140361-15-030521
LEG,LEGGETT & PLATT INCORPORATED COMMON STOCK USD0.01,524660107,371000.0,7600,0.0007291319870399246,2015-08-10,2015-06-30,0001140361-15-030521
HAL,HALLIBURTON COMPANY COMMON STOCK USD2.50,406216101,370000.0,8656,0.000727166671710976,2015-08-10,2015-06-30,0001140361-15-030521
N/A,CALIFORNIA RESOURCES CORPORATION COMMON STOCK USD0.01,13057Q107,368000.0,57113,0.0007232360410530788,2015-08-10,2015-06-30,0001140361-15-030521
FEZ,FRESCO DJ EURO STOXX 50,78463X202,367000.0,9750,0.0007212707257241303,2015-08-10,2015-06-30,0001140361-15-030521
N/A,LYONDELLBASELL INDUSTRIES NV CLASS A COMMON STOCK USD0.01,N53745100,365000.0,3594,0.0007173400950662331,2015-08-10,2015-06-30,0001140361-15-030521
PANW,PALO ALTO NETWORKS INCORPORATED COMMON STOCK USD0.0001,697435105,364000.0,2118,0.0007153747797372845,2015-08-10,2015-06-30,0001140361-15-030521
JLL,JONES LANG LASALLE INCORPORATED COMMON STOCK USD0.01,48020Q107,363000.0,2148,0.0007134094644083359,2015-08-10,2015-06-30,0001140361-15-030521
N/A,YAHOO! INCORPORATED COMMON STOCK USD0.01,984332106,359000.0,9220,0.0007055482030925416,2015-08-10,2015-06-30,0001140361-15-030521
N/A,FIDELITY AND GUARANTY LIFE COMMON STOCK USD0.01,315785105,359000.0,15200,0.0007055482030925416,2015-08-10,2015-06-30,0001140361-15-030521
SHW,SHERWIN-WILLIAMS COMPANY (THE) COMMON STOCK USD1,824348106,359000.0,1300,0.0007055482030925416,2015-08-10,2015-06-30,0001140361-15-030521
DB,DEUTSCHE BANK AG NPV (REGISTERED),D18190898,358000.0,13297,0.000703582887763593,2015-08-10,2015-06-30,0001140361-15-030521
APD,AIR PRODUCTS & CHEMICALS INC COM STK US$1,009158106,357000.0,2600,0.0007016175724346445,2015-08-10,2015-06-30,0001140361-15-030521
HAL,HALLIBURTON COMPANY COMMON STOCK USD2.50,406216101,356000.0,8337,0.0006996522571056958,2015-08-10,2015-06-30,0001140361-15-030521
DHI,D.R. HORTON INCORPORATED COMMON STOCK USD0.01,23331A109,356000.0,13000,0.0006996522571056958,2015-08-10,2015-06-30,0001140361-15-030521
MDLZ,MONDELEZ INTERNATIONAL INCORPORATED COMMON STOCK  USD0.01,609207105,355000.0,8703,0.0006976869417767473,2015-08-10,2015-06-30,0001140361-15-030521
GGB,GERDAU SA ADR (EACH REPRESENTS 1 PREFERENCE NPV),373737105,352000.0,139100,0.0006917909957899016,2015-08-10,2015-06-30,0001140361-15-030521
N/A,ULTIMATE SOFTWARE GROUP INC COMMON STOCK USD0.01,90385D107,351000.0,2142,0.0006898256804609529,2015-08-10,2015-06-30,0001140361-15-030521
SAIC,SCIENCE APPLICATIONS INTERNATIONAL CORPORATION COMMON STOCK USD0.0001,808625107,349000.0,6592,0.0006858950498030557,2015-08-10,2015-06-30,0001140361-15-030521
QCOM,QUALCOMM INCORPORATED COMMON STOCK USD0.0001,747525103,348000.0,5550,0.0006839297344741072,2015-08-10,2015-06-30,0001140361-15-030521
N/A,DR PEPPER SNAPPLE GROUP INCORPORATED COMMON STOCK USD0.01,26138E109,347000.0,4733,0.0006819644191451586,2015-08-10,2015-06-30,0001140361-15-030521
N/A,IMS HEALTH HOLDINGS INCORPORATED COMMON STOCK USD0.01,44970B109,347000.0,11377,0.0006819644191451586,2015-08-10,2015-06-30,0001140361-15-030521
N/A,CONVERGYS CORPORATION COMMON STOCK NPV,212485106,344000.0,13400,0.0006760684731583128,2015-08-10,2015-06-30,0001140361-15-030521
N/A,SIGNET JEWELERS LIMITED ORDINARY USD0.18 (US LISTING),G81276100,344000.0,2691,0.0006760684731583128,2015-08-10,2015-06-30,0001140361-15-030521
MMC,MARSH & MCLENNAN COS INC COMMON STOCK USD1,571748102,344000.0,6055,0.0006760684731583128,2015-08-10,2015-06-30,0001140361-15-030521
N/A,AMTRUST FINANCIAL SERVICES INCORPORATED COMMON STOCK USD0.01,032359309,342000.0,5400,0.0006721378425004157,2015-08-10,2015-06-30,0001140361-15-030521
N/A,SUNTRUST BANKS INCORPORATED COMMON STOCK USD1,867914103,342000.0,8017,0.0006721378425004157,2015-08-10,2015-06-30,0001140361-15-030521
TJX,TJX COS INCORPORATED COMMON STOCK USD1,872540109,339000.0,5131,0.0006662418965135699,2015-08-10,2015-06-30,0001140361-15-030521
SMFG,SUMITOMO MITSUI FINANCIAL GROUP INCORPORATED ADR (EACH REPRESENTS 0.2 ORD NPV),86562M209,338000.0,38579,0.0006642765811846213,2015-08-10,2015-06-30,0001140361-15-030521
VMWEUR,VMWARE INCORPORATED CLASS 'A' COMMON STOCK USD0.01,928563402,337000.0,3927,0.0006623112658556728,2015-08-10,2015-06-30,0001140361-15-030521
IWM,ISHARES TRUST RUSSELL 2000 ETF,464287655,337000.0,2710,0.0006623112658556728,2015-08-10,2015-06-30,0001140361-15-030521
LEJUEUR,LEJU HOLDINGS LIMITED ADR (EACH REPRESENTS 1 ORDINARY SHARES),50187J108,336000.0,42529,0.0006603459505267242,2015-08-10,2015-06-30,0001140361-15-030521
N/A,MARVELL TECHNOLOGY GROUP LIMITED COMMON STOCK USD0.002,G5876H105,333000.0,25100,0.0006544500045398783,2015-08-10,2015-06-30,0001140361-15-030521
MHK,MOHAWK INDUSTRIES INCORPORATED COMMON STOCK USD0.01,608190104,333000.0,1763,0.0006544500045398783,2015-08-10,2015-06-30,0001140361-15-030521
N/A,YAHOO! INCORPORATED COMMON STOCK USD0.01,984332106,332000.0,8525,0.0006524846892109299,2015-08-10,2015-06-30,0001140361-15-030521
META,FACEBOOK INCORPORATED CLASS A COMMON STOCK USD0.000006,30303M102,331000.0,3853,0.0006505193738819813,2015-08-10,2015-06-30,0001140361-15-030521
N/A,CANADIAN PACIFIC RAILWAY LTD,13645T100,329000.0,1660,0.0006465887432240841,2015-08-10,2015-06-30,0001140361-15-030521
M,MACY'S INCORPORATED COMMON STOCK USD0.01,55616P104,329000.0,4900,0.0006465887432240841,2015-08-10,2015-06-30,0001140361-15-030521
EOG,EOG RESOURCES INCORPORATED COMMON STOCK USD0.01,26875P101,328000.0,3800,0.0006446234278951354,2015-08-10,2015-06-30,0001140361-15-030521
CCL,CARNIVAL CORPORATION COMMON STOCK USD0.01 (PAIRED STOCK),143658300,328000.0,6700,0.0006446234278951354,2015-08-10,2015-06-30,0001140361-15-030521
NFLX,NETFLIX INCORPORATED COMMON STOCK USD0.001,64110L106,323000.0,500,0.0006347968512503925,2015-08-10,2015-06-30,0001140361-15-030521
