ticker,nameOfIssuer,cusip,value,shares,allocation_percent,filingDate,reportDate,accessionNumber
N/A,LINEAR TECHNOLOGY CORPORATION COMMON STOCK USD0.001,535678106,5522000.0,124500,0.01085247124645408,2015-08-10,2015-06-30,0001140361-15-030521
WLK,WESTLAKE CHEMICAL CORPORATION COMMON STOCK USD0.01,960413102,5520000.0,81200,0.010848540615796182,2015-08-10,2015-06-30,0001140361-15-030521
HRC,HILL-ROM HOLDINGS INCORPORATED COMMON STOCK NPV,431475102,5487000.0,99612,0.010783685209940878,2015-08-10,2015-06-30,0001140361-15-030521
WDR,WADDELL & REED FINANCIAL-A,930059100,5475000.0,116200,0.010760101425993497,2015-08-10,2015-06-30,0001140361-15-030521
N/A,STRAYER EDUCATION INCORPORATED COMMON STOCK USD0.01,863236105,5464000.0,124668,0.010738482957375062,2015-08-10,2015-06-30,0001140361-15-030521
SHW,SHERWIN-WILLIAMS COMPANY (THE) COMMON STOCK USD1,824348106,5454000.0,19740,0.010718829804085577,2015-08-10,2015-06-30,0001140361-15-030521
UPLEUR,ULTRA PETROLEUM CORPORATION COMMON NPV (US LISTING),903914109,5447000.0,434722,0.010705072596782937,2015-08-10,2015-06-30,0001140361-15-030521
DIS,WALT DISNEY COMPANY (THE) COMMON STOCK USD0.01,254687106,5441000.0,48130,0.010693280704809245,2015-08-10,2015-06-30,0001140361-15-030521
META,FACEBOOK INCORPORATED CLASS A COMMON STOCK USD0.000006,30303M102,5399000.0,62930,0.010610737460993403,2015-08-10,2015-06-30,0001140361-15-030521
N/A,NATIONAL INSTRUMENTS CORPORATION COMMON STOCK USD0.01,636518102,5398000.0,182176,0.010608772145664455,2015-08-10,2015-06-30,0001140361-15-030521
MWA,MUELLER WATER PRODUCTS INCORPORATED CLASS 'A' COMMON STOCK USD0.01,624758108,5388000.0,594065,0.01058911899237497,2015-08-10,2015-06-30,0001140361-15-030521
F,FORD MOTOR COMPANY COMMON STOCK USD0.01,345370860,5388000.0,358716,0.01058911899237497,2015-08-10,2015-06-30,0001140361-15-030521
NTAP,NETAPP INCORPORATED COMMON STOCK USD0.001,64110D104,5385000.0,170016,0.010583223046388123,2015-08-10,2015-06-30,0001140361-15-030521
N/A,COMPUTER SCIENCES CORP,205363104,5379000.0,81803,0.010571431154414432,2015-08-10,2015-06-30,0001140361-15-030521
CLGX,CORELOGIC INCORPORATED COMMON STOCK USD1,21871D103,5339000.0,135966,0.01049281854125649,2015-08-10,2015-06-30,0001140361-15-030521
BIIB,BIOGEN INCORPORATED COMMON STOCK USD0.0005,09062X103,5334000.0,13462,0.010482991964611745,2015-08-10,2015-06-30,0001140361-15-030521
FOXF,FOX FACTORY HOLDING CORPORATION COMMON STOCK USD0.001,35138V102,5327000.0,333147,0.010469234757309105,2015-08-10,2015-06-30,0001140361-15-030521
OMC,OMNICOM GROUP INC COMMON STOCK USD0.15,681919106,5326000.0,76961,0.010467269441980157,2015-08-10,2015-06-30,0001140361-15-030521
ESRT,EMPIRE STATE REALTY TRUST INCORPORATED CLASS A REIT USD0.01,292104106,5305000.0,311482,0.010425997820072237,2015-08-10,2015-06-30,0001140361-15-030521
FRTEUR,FEDERAL REALTY INVESTMENT TRUST REIT USD0.01,313747206,5295000.0,41416,0.010406344666782752,2015-08-10,2015-06-30,0001140361-15-030521
N/A,COACH INCORPORATED COMMON STOCK USD0.01,189754104,5253000.0,150127,0.01032380142296691,2015-08-10,2015-06-30,0001140361-15-030521
CHRW,C.H. ROBINSON WORLDWIDE INCORPORATED COMMON STOCK USD0.10,12541W209,5251000.0,85113,0.010319870792309014,2015-08-10,2015-06-30,0001140361-15-030521
DLX,DELUXE CORPORATION COMMON STOCK USD1,248019101,5247000.0,86335,0.010312009530993219,2015-08-10,2015-06-30,0001140361-15-030521
CME,CME GROUP INCORPORATED COMMON STOCK USD0.01,12572Q105,5237000.0,56733,0.010292356377703734,2015-08-10,2015-06-30,0001140361-15-030521
CBOE,CBOE HOLDINGS INCORPORATED COMMON STOCK USD0.01,12503M108,5232000.0,91700,0.010282529801058992,2015-08-10,2015-06-30,0001140361-15-030521
N/A,GOLDCORP INCORPORATED COMMON NPV (US LISTING),380956409,5220000.0,319071,0.010258946017111607,2015-08-10,2015-06-30,0001140361-15-030521
HTO,SJW CORPORATION COMMON STOCK USD1.042,784305104,5180000.0,168900,0.010180333403953665,2015-08-10,2015-06-30,0001140361-15-030521
HRSEUR,HARRIS CORP COMMON STOCK USD1,413875105,5148000.0,66764,0.010117443313427309,2015-08-10,2015-06-30,0001140361-15-030521
GIS,GENERAL MILLS INC COMMON STOCK USD0.10,370334104,5133000.0,91557,0.01008796358349308,2015-08-10,2015-06-30,0001140361-15-030521
N/A,E-HOUSE CHINA HOLDINGS LIMITED ADS (EACH REPRESENTS 1 ORDINARY USD0.001),26852W103,5125000.0,762600,0.010072241060861492,2015-08-10,2015-06-30,0001140361-15-030521
VAREUR,VARIAN MEDICAL SYSTEMS INCORPORATED COMMON STOCK USD1,92220P105,5118000.0,61216,0.010058483853558852,2015-08-10,2015-06-30,0001140361-15-030521
CE,CELANESE CORPORATION CLASS A COMMON STOCK USD0.0001 (US LISTING),150870103,5118000.0,71388,0.010058483853558852,2015-08-10,2015-06-30,0001140361-15-030521
SNI,SCRIPPS NETWORKS INTERACTIVE INCORPORATED CLASS 'A' COMMON STOCK USD0.01,811065101,5116000.0,79000,0.010054553222900954,2015-08-10,2015-06-30,0001140361-15-030521
TSS,TOTAL SYSTEM SERVICES INCORPORATED COMMON STOCK USD0.10,891906109,5115000.0,122521,0.010052587907572005,2015-08-10,2015-06-30,0001140361-15-030521
N/A,ENERGIZER HOLDINGS INCORPORATED COMMON STOCK USD0.01,29266R108,5114000.0,38800,0.010050622592243057,2015-08-10,2015-06-30,0001140361-15-030521
PVG1EUR,PRETIUM RESOURCES INC COMMON STOCK USD0.01,74139C102,5096000.0,943739,0.010015246916321982,2015-08-10,2015-06-30,0001140361-15-030521
LTC,LTC PROPERTIES INCORPORATED REIT USD0.01,502175102,5084000.0,122600,0.0099916631323746,2015-08-10,2015-06-30,0001140361-15-030521
N/A,CASH AMERICA INTERNATIONAL INCORPORATED COMMON STOCK USD0.10,14754D100,5070000.0,193668,0.00996414871776932,2015-08-10,2015-06-30,0001140361-15-030521
N/A,LABORATORY CORPORATION OF AMERICA HOLDINGS COMMON STOCK USD0.01,50540R409,5039000.0,42204,0.009903223942571914,2015-08-10,2015-06-30,0001140361-15-030521
N/A,HCP INCORPORATED REIT USD1,40414L109,5019000.0,136604,0.009863917635992942,2015-08-10,2015-06-30,0001140361-15-030521
VMI,VALMONT INDUSTRIES INCORPORATED COMMON STOCK USD1,920253101,4996000.0,42100,0.009818715383427126,2015-08-10,2015-06-30,0001140361-15-030521
SAIC,SCIENCE APPLICATIONS INTERNATIONAL CORPORATION COMMON STOCK USD0.0001,808625107,4991000.0,94170,0.009808888806782382,2015-08-10,2015-06-30,0001140361-15-030521
EWBC,EAST WEST BANCORP INCORPORATED COMMON STOCK USD0.001,27579R104,4990000.0,111793,0.009806923491453432,2015-08-10,2015-06-30,0001140361-15-030521
CTCMEUR,CTC MEDIA INCORPORATED COMMON STOCK NPV,12642X106,4971000.0,2071109,0.00976958250020341,2015-08-10,2015-06-30,0001140361-15-030521
ALXN,ALEXION PHARMACEUTICALS INCORPORATED COMMON STOCK USD0.0001,015351109,4969000.0,27953,0.009765651869545514,2015-08-10,2015-06-30,0001140361-15-030521
UNH,UNITEDHEALTH GROUP INCORPORATED COMMON STOCK USD0.01,91324P102,4964000.0,40960,0.00975582529290077,2015-08-10,2015-06-30,0001140361-15-030521
N/A,DOW CHEMICAL COMPANY (THE) COMMON STOCK USD2.50,260543103,4957000.0,97589,0.009742068085598129,2015-08-10,2015-06-30,0001140361-15-030521
K,KELLOGG COMPANY COMMON STOCK USD0.25,487836108,4947000.0,79021,0.009722414932308644,2015-08-10,2015-06-30,0001140361-15-030521
VIAB,VIACOM INCORPORATED NEW CLASS 'B' NON VOTING COMMON STOCK  USD0.001,92553P201,4945000.0,76800,0.009718484301650747,2015-08-10,2015-06-30,0001140361-15-030521
ELV,ANTHEM INCORPORATED COMMON STOCK USD0.01,036752103,4941000.0,30300,0.009710623040334954,2015-08-10,2015-06-30,0001140361-15-030521
CIG,COMPANHIA ENERGETICA DE MINAS GERAIS SPONS ADR (EACH REP 1 NON-VTG PREF SHS) (LEVEL 2),204409601,4935000.0,1298603,0.00969883114836126,2015-08-10,2015-06-30,0001140361-15-030521
SNA,SNAP-ON INCORPORATED COMMON STOCK USD1,833034101,4930000.0,31100,0.009689004571716517,2015-08-10,2015-06-30,0001140361-15-030521
UPLEUR,ULTRA PETROLEUM CORPORATION COMMON NPV (US LISTING),903914109,4899000.0,390974,0.009628079796519112,2015-08-10,2015-06-30,0001140361-15-030521
N/A,SYMETRA FINANCIAL CORPORATION COMMON STOCK USD0.01,87151Q106,4889000.0,203221,0.009608426643229627,2015-08-10,2015-06-30,0001140361-15-030521
N/A,HALYARD HEALTH INCORPORATED COMMON STOCK USD0.01,40650V100,4876000.0,120573,0.009582877543953294,2015-08-10,2015-06-30,0001140361-15-030521
AMGN,AMGEN INCORPORATED COMMON STOCK USD0.0001,031162100,4875000.0,32160,0.009580912228624346,2015-08-10,2015-06-30,0001140361-15-030521
PRIM,PRIMORIS SERVICES CORPORATION COMMON STOCK USD0.0001,74164F103,4867000.0,246076,0.009565189705992757,2015-08-10,2015-06-30,0001140361-15-030521
BSX,BOSTON SCIENTIFIC CORPORATION COMMON STOCK USD0.01,101137107,4849000.0,272290,0.009529814030071682,2015-08-10,2015-06-30,0001140361-15-030521
PFE,PFIZER INCORPORATED COMMON STOCK USD0.05,717081103,4837000.0,144010,0.0095062302461243,2015-08-10,2015-06-30,0001140361-15-030521
SMG,SCOTTS MIRACLE-GRO COMPANY (THE) CLASS'A'COMMON STOCK NPV,810186106,4826000.0,80000,0.009484611777505866,2015-08-10,2015-06-30,0001140361-15-030521
AAPL,APPLE INCORPORATED COMMON STOCK NPV,037833100,4820000.0,38702,0.009472819885532174,2015-08-10,2015-06-30,0001140361-15-030521
LMT,LOCKHEED MARTIN CORP COMMON STOCK USD0.01,539830109,4818000.0,25971,0.009468889254874277,2015-08-10,2015-06-30,0001140361-15-030521
N/A,PLUM CREEK TIMBER COMPANY INCORPORATED COMMON STOCK USD0.01,729251108,4795000.0,117755,0.009423687002308459,2015-08-10,2015-06-30,0001140361-15-030521
HAS,HASBRO INC COMMON STOCK USD0.50,418056107,4793000.0,63400,0.009419756371650562,2015-08-10,2015-06-30,0001140361-15-030521
VAC,MARRIOTT VACATIONS WORLDWIDE CORPORATION COMMON STOCK USD0.01,57164Y107,4787000.0,52900,0.00940796447967687,2015-08-10,2015-06-30,0001140361-15-030521
ITW,ILLINOIS TOOL WORKS INC COMMON STOCK NPV,452308109,4775000.0,52211,0.009384380695729487,2015-08-10,2015-06-30,0001140361-15-030521
MCHP,MICROCHIP TECHNOLOGY INCORPORATED COMMON STOCK USD0.001,595017104,4758000.0,100800,0.009350970335137362,2015-08-10,2015-06-30,0001140361-15-030521
AGO,ASSURED GUARANTY LIMITED COMMON STOCK USD0.01,G0585R106,4728000.0,199000,0.009292010875268904,2015-08-10,2015-06-30,0001140361-15-030521
BKD,BROOKDALE SENIOR LIVING INCORPORATED COMMON STOCK USD0.01,112463104,4712000.0,134324,0.009260565830005727,2015-08-10,2015-06-30,0001140361-15-030521
NOG1EUR,NORTHERN OIL AND GAS INCORPORATED COMMON STOCK USD0.001,665531109,4708000.0,708000,0.009252704568689932,2015-08-10,2015-06-30,0001140361-15-030521
DWD,MORGAN STANLEY COMMON STOCK USD0.01,617446448,4689000.0,122391,0.009215363577439909,2015-08-10,2015-06-30,0001140361-15-030521
EGP,EASTGROUP PROPERTIES INCORPORATED REIT USD0.0001,277276101,4680000.0,82151,0.009197675739479372,2015-08-10,2015-06-30,0001140361-15-030521
N/A,GARMIN LIMITED COMMON STOCK USD0.005,H2906T109,4649000.0,105707,0.009136750964281966,2015-08-10,2015-06-30,0001140361-15-030521
N/A,POLYCOM INCORPORATED COMMON STOCK NPV,73172K104,4640000.0,405603,0.00911906312632143,2015-08-10,2015-06-30,0001140361-15-030521
N/A,CIGNA CORPORATION COMMON STOCK USD0.25,125509109,4631000.0,28122,0.009101375288360893,2015-08-10,2015-06-30,0001140361-15-030521
MTH,MERITAGE HOMES CORPORATION COMMON STOCK USD0.01,59001A102,4630000.0,98477,0.009099409973031942,2015-08-10,2015-06-30,0001140361-15-030521
CMG,CHIPOTLE MEXICAN GRILL INCORPORATED COMMON STOCK USD0.01,169656105,4613000.0,7688,0.009065999612439818,2015-08-10,2015-06-30,0001140361-15-030521
N/A,MARVELL TECHNOLOGY GROUP LIMITED COMMON STOCK USD0.002,G5876H105,4580000.0,344881,0.009001144206584514,2015-08-10,2015-06-30,0001140361-15-030521
EMR,EMERSON ELECTRIC COMPANY COMMON STOCK USD1,291011104,4565000.0,82171,0.008971664476650284,2015-08-10,2015-06-30,0001140361-15-030521
N/A,INTELIQUENT INCORPORATED COMMON STOCK USD0.001,45825N107,4552000.0,246720,0.008946115377373954,2015-08-10,2015-06-30,0001140361-15-030521
N/A,FLEXTRONICS INTERNATIONAL LIMITED COMMON STOCK USD0.01,Y2573F102,4547000.0,393304,0.008936288800729211,2015-08-10,2015-06-30,0001140361-15-030521
BPLUSD,BUCKEYE PARTNERS LP UNITS NPV,118230101,4541000.0,60400,0.00892449690875552,2015-08-10,2015-06-30,0001140361-15-030521
SBRA,SABRA HEALTHCARE INCORPORATED REIT USD0.01,78573L106,4539000.0,175512,0.008920566278097621,2015-08-10,2015-06-30,0001140361-15-030521
MTG,MGIC INVESTMENT CORPORATION COMMON STOCK USD1,552848103,4536000.0,402452,0.008914670332110776,2015-08-10,2015-06-30,0001140361-15-030521
ABBV,ABBVIE INCORPORATED COMMON STOCK USD0.01,00287Y109,4531000.0,67439,0.008904843755466033,2015-08-10,2015-06-30,0001140361-15-030521
N/A,AIRGAS INCORPORATED COMMON STOCK USD0.01,009363102,4521000.0,42860,0.008885190602176548,2015-08-10,2015-06-30,0001140361-15-030521
PAC,GRUPO AEROPORTUARIO DEL PACIFICO SAB DE CV ADR (EACH REPRESENTS 10 SERIES 'B' SHARES),400506101,4507000.0,65447,0.008857676187571268,2015-08-10,2015-06-30,0001140361-15-030521
N/A,NEW ORIENTAL EDUCATION & TECHNOLOGY GROUP INCORPORATED SPONSORED ADR (EACH REPRESENTS 1 ORDINARY SHARES),647581107,4497000.0,189277,0.008838023034281781,2015-08-10,2015-06-30,0001140361-15-030521
EBA,EBAY INCORPORATED COMMON STOCK USD0.001,278642103,4471000.0,75300,0.008786924835729118,2015-08-10,2015-06-30,0001140361-15-030521
EC,ECOPETROL SA SPONSORED ADR (EACH REPRESENTS 20 ORDINARY COP250),279158109,4453000.0,340697,0.008751549159808043,2015-08-10,2015-06-30,0001140361-15-030521
CVS,CVS HEALTH CORPORATION COMMON STOCK USD0.01,126650100,4446000.0,42417,0.008737791952505404,2015-08-10,2015-06-30,0001140361-15-030521
HDB,HDFC BANK LIMITED ADR (EACH REPRESENTING 3 ORDINARY),40415F101,4434000.0,73500,0.008714208168558021,2015-08-10,2015-06-30,0001140361-15-030521
VOO,VANGUARD INDEX FUNDS S&P 500 ETF,922908363,4415000.0,23440,0.008676867177307998,2015-08-10,2015-06-30,0001140361-15-030521
HMN,HORACE MANN EDUCATORS CORPORATION COMMON STOCK USD0.001,440327104,4412000.0,122178,0.008670971231321153,2015-08-10,2015-06-30,0001140361-15-030521
AAT,AMERICAN ASSETS TRUST INCORPORATED REIT USD0.01,024013104,4361000.0,111895,0.008570740149544774,2015-08-10,2015-06-30,0001140361-15-030521
WY,WEYERHAEUSER COMPANY REIT USD1.25,962166104,4348000.0,137900,0.008545191050268443,2015-08-10,2015-06-30,0001140361-15-030521
N2EUR,NETSUITE INCORPORATED COMMON STOCK USD0.01,64118Q107,4344000.0,47887,0.008537329788952648,2015-08-10,2015-06-30,0001140361-15-030521
PG,PROCTER AND GAMBLE COMPANY (THE) COMMON STOCK NPV,742718109,4336000.0,55364,0.00852160726632106,2015-08-10,2015-06-30,0001140361-15-030521
MOH,MOLINA HEALTHCARE INCORPORATED COMMON STOCK USD0.001,60855R100,4332000.0,61800,0.008513746005005266,2015-08-10,2015-06-30,0001140361-15-030521
SC2,NUANCE COMMUNICATIONS INCORPORATED COMMON STOCK USD0.001,67020Y100,4329000.0,249649,0.00850785005901842,2015-08-10,2015-06-30,0001140361-15-030521
N/A,NEW YORK COMMUNITY BANCORP INCORPORATED COMMON STOCK USD0.01,649445103,4329000.0,237189,0.00850785005901842,2015-08-10,2015-06-30,0001140361-15-030521
BA,BOEING COMPANY (THE) COMMON STOCK USD5,097023105,4325000.0,31178,0.008499988797702624,2015-08-10,2015-06-30,0001140361-15-030521
KMI,KINDER MORGAN INCORPORATED COMMON STOCK USD0.01,49456B101,4310000.0,112347,0.008470509067768396,2015-08-10,2015-06-30,0001140361-15-030521
N/A,CALPINE CORPORATION COMMON STOCK USD0.001,131347304,4294000.0,238704,0.008439064022505218,2015-08-10,2015-06-30,0001140361-15-030521
AMZN,AMAZON COMMUNICATIONS INCORPORATED USD0.01,023135106,4281000.0,9958,0.008413514923228888,2015-08-10,2015-06-30,0001140361-15-030521
PKG,PACKAGING CORPORATION OF AMERICA COMMON STOCK USD0.01,695156109,4236000.0,67700,0.008325075733426201,2015-08-10,2015-06-30,0001140361-15-030521
GAP,GAP INCORPORATED (THE) COMMON STOCK USD0.05,364760108,4216000.0,110800,0.00828576942684723,2015-08-10,2015-06-30,0001140361-15-030521
ABG,AMERISOURCE BERGEN CORPORATION CLASS 'A' COMMON STOCK USD0.01,03073E105,4190000.0,39489,0.008234671228294566,2015-08-10,2015-06-30,0001140361-15-030521
SO,SOUTHERN COMPANY (THE) COMMON STOCK USD5,842587107,4180000.0,99625,0.008215018075005081,2015-08-10,2015-06-30,0001140361-15-030521
VOYA,VOYA FINANCIAL INCORPORATED COMMON STOCK USD0.01,929089100,4168000.0,90228,0.008191434291057696,2015-08-10,2015-06-30,0001140361-15-030521
MZTI,LANCASTER COLONY CORPORATION COMMON STOCK NPV,513847103,4155000.0,46000,0.008165885191781366,2015-08-10,2015-06-30,0001140361-15-030521
MTRX,MATRIX SERVICE COMPANY COMMON STOCK USD0.01,576853105,4149000.0,225100,0.008154093299807675,2015-08-10,2015-06-30,0001140361-15-030521
N/A,SOLARWINDS INCORPORATED COMMON STOCK USD0.001,83416B109,4144000.0,91279,0.008144266723162931,2015-08-10,2015-06-30,0001140361-15-030521
N/A,PHILIPPINE LONG DISTANCE TELEPHONE COMPANY SPONSORED ADR (EACH REPRESENTS 1 PHP5),718252604,4121000.0,66916,0.008099064470597115,2015-08-10,2015-06-30,0001140361-15-030521
MTD,METTLER-TOLEDO INTERNATIONAL COMMON STOCK USD0.01,592688105,4106000.0,12111,0.008069584740662885,2015-08-10,2015-06-30,0001140361-15-030521
VRA,VERA BRADLEY INCORPORATED COMMON STOCK NPV,92335C106,4102000.0,365600,0.008061723479347091,2015-08-10,2015-06-30,0001140361-15-030521
BAC,VERIZON COMMUNICATIONS INCORPORATED COMMON STOCK USD0.10,92343V104,4087000.0,87390,0.008032243749412861,2015-08-10,2015-06-30,0001140361-15-030521
JAHEUR,JARDEN CORPORATION COMMON STOCK USD0.01,471109108,4087000.0,78339,0.008032243749412861,2015-08-10,2015-06-30,0001140361-15-030521
VC,VISTEON CORP COMMON STOCK USD0.01,92839U206,4081000.0,39237,0.00802045185743917,2015-08-10,2015-06-30,0001140361-15-030521
TMO,THERMO FISHER SCIENTIFIC INCORPORATED COMMON STOCK USD1,883556102,4080000.0,31520,0.008018486542110221,2015-08-10,2015-06-30,0001140361-15-030521
EMB,ISHARES TRUST JP MORGAN USD EMERGING MARKETS BOND ETF,464288281,4077000.0,37184,0.008012590596123376,2015-08-10,2015-06-30,0001140361-15-030521
LMT,LOCKHEED MARTIN CORP COMMON STOCK USD0.01,539830109,4076000.0,21969,0.008010625280794428,2015-08-10,2015-06-30,0001140361-15-030521
CBRL,CRACKER BARREL OLD COUNTRY STORE INCORPORATED COMMON STOCK USD0.01,22410J106,4076000.0,27700,0.008010625280794428,2015-08-10,2015-06-30,0001140361-15-030521
FLS,FLOWSERVE CORPORATION COMMON STOCK USD1.25,34354P105,4070000.0,79500,0.007998833388820736,2015-08-10,2015-06-30,0001140361-15-030521
IJH,ISHARES TRUST CORE S&P MID-CAP ETF,464287507,4057000.0,27110,0.007973284289544405,2015-08-10,2015-06-30,0001140361-15-030521
DE,DEERE & COMPANY COMMON STOCK USD1,244199105,4047000.0,42615,0.00795363113625492,2015-08-10,2015-06-30,0001140361-15-030521
DLB,DOLBY LABORATORIES INCORPORATED CLASS 'A' COMMON STOCK USD0.001,25659T107,4043000.0,101649,0.007945769874939125,2015-08-10,2015-06-30,0001140361-15-030521
SNEUR,SANCHEZ ENERGY CORPORATION COMMON STOCK USD0.01,79970Y105,4039000.0,419000,0.00793790861362333,2015-08-10,2015-06-30,0001140361-15-030521
N/A,COMPUTER SCIENCES CORP,205363104,4038000.0,61421,0.007935943298294381,2015-08-10,2015-06-30,0001140361-15-030521
N/A,MCGRAW HILL FINANCIAL INCORPORATED COMMON STOCK USD1,580645109,4034000.0,40095,0.007928082036978586,2015-08-10,2015-06-30,0001140361-15-030521
DEI,DOUGLAS EMMETT INCORPORATED REIT USD0.01,25960P109,4028000.0,150014,0.007916290145004895,2015-08-10,2015-06-30,0001140361-15-030521
TUP,TUPPERWARE BRANDS CORPORATION COMMON STOCK USD0.01,899896104,4018000.0,62200,0.00789663699171541,2015-08-10,2015-06-30,0001140361-15-030521
HD,HOME DEPOT INCORPORATED (THE) COMMON STOCK USD0.05,437076102,4009000.0,36270,0.007878949153754871,2015-08-10,2015-06-30,0001140361-15-030521
N/A,PARTNERRE HOLDINGS COMMON STOCK USD1,G6852T105,3976000.0,30932,0.00781409374789957,2015-08-10,2015-06-30,0001140361-15-030521
PEG,PUBLIC SERVICE ENTERPRISE GROUP INCORPORATED COMMON STOCK NPV,744573106,3955000.0,100838,0.007772822125991649,2015-08-10,2015-06-30,0001140361-15-030521
BRSEUR,BRISTOW GROUP INCORPORATED COMMON STOCK USD0.01,110394103,3946000.0,73900,0.0077551342880311114,2015-08-10,2015-06-30,0001140361-15-030521
REX,REX AMERICAN RESOURCES CORPORATION COMMON STOCK USD0.01,761624105,3935000.0,62600,0.007733515819412677,2015-08-10,2015-06-30,0001140361-15-030521
N/A,DENTSPLY INTERNATIONAL INC COM STK US$1,249030107,3931000.0,76589,0.007725654558096882,2015-08-10,2015-06-30,0001140361-15-030521
PXGBX,PRAXAIR INCORPORATED COMMON STOCK USD0.01,74005P104,3925000.0,32900,0.0077138626661231915,2015-08-10,2015-06-30,0001140361-15-030521
MAT,MATTEL INC COMMON STOCK USD1,577081102,3913000.0,151100,0.007690278882175808,2015-08-10,2015-06-30,0001140361-15-030521
RY,ROYAL BANK OF CANADA COMMON NPV,780087102,3903000.0,51042,0.007670625728886322,2015-08-10,2015-06-30,0001140361-15-030521
N/A,LIBERTY MEDIA CORPORATION CLASS A COMMON STOCK USD0.01,531229102,3901000.0,107948,0.007666695098228426,2015-08-10,2015-06-30,0001140361-15-030521
EVH,EVOLENT HEALTH INC NPV COMMON STOCK USD 0.01,30050B101,3900000.0,200000,0.007664729782899477,2015-08-10,2015-06-30,0001140361-15-030521
MRK,MERCK AND COMPANY INCORPORATED NEW COMMON STOCK USD0.01,58933Y105,3883000.0,67780,0.007631319422307351,2015-08-10,2015-06-30,0001140361-15-030521
N/A,NEUSTAR INCORPORATED CLASS 'A' COMMON STOCK USD0.001,64126X201,3877000.0,133700,0.007619527530333659,2015-08-10,2015-06-30,0001140361-15-030521
CNC,CENTENE CORPORATION COMMON STOCK USD0.001,15135B101,3864000.0,48000,0.007593978431057328,2015-08-10,2015-06-30,0001140361-15-030521
LXKEUR,LEXMARK INTERNATIONAL GROUP COMMON STOCK USD0.01,529771107,3854000.0,87091,0.007574325277767842,2015-08-10,2015-06-30,0001140361-15-030521
N/A,BUNGE LIMITED COMMON STOCK USD0.01,G16962105,3851000.0,43828,0.007568429331780996,2015-08-10,2015-06-30,0001140361-15-030521
PM,PHILIP MORRIS INTERNATIONAL INCORPORATED COMMON STOCK NPV,718172109,3849000.0,48042,0.007564498701123099,2015-08-10,2015-06-30,0001140361-15-030521
N/A,BRIDGEPOINT EDUCATION INCORPORATED COMMON STOCK USD0.01,10807M105,3846000.0,398918,0.007558602755136253,2015-08-10,2015-06-30,0001140361-15-030521
MRO*,MARATHON OIL CORPORATION COMMON STOCK USD1,565849106,3838000.0,143800,0.007542880232504665,2015-08-10,2015-06-30,0001140361-15-030521
N/A,SOUFUN HOLDINGS LIMITED ADR (EACH REPRESENTS 0.20 ORDINARY SHARES),836034108,3831000.0,471256,0.007529123025202024,2015-08-10,2015-06-30,0001140361-15-030521
N/A,ALLIED WORLD ASSURANCE HOLDINGS LIMITED AG COMMON STOCK USD0.03,H01531104,3830000.0,88600,0.007527157709873076,2015-08-10,2015-06-30,0001140361-15-030521
SPLKCHF,SPLUNK INC COMMON STOCK USD0.01,848637104,3816000.0,56071,0.007499643295267795,2015-08-10,2015-06-30,0001140361-15-030521
EMB,ISHARES TRUST JP MORGAN USD EMERGING MARKETS BOND ETF,464288281,3811000.0,34759,0.007489816718623053,2015-08-10,2015-06-30,0001140361-15-030521
LDOS,LEIDOS HOLDINGS INCORPORATED COMMON STOCK USD0.0001,525327102,3809000.0,94200,0.007485886087965157,2015-08-10,2015-06-30,0001140361-15-030521
AMSGEUR,AMSURG CORPORATION COMMON STOCK NPV,03232P405,3799000.0,54500,0.007466232934675671,2015-08-10,2015-06-30,0001140361-15-030521
N/A,PLUM CREEK TIMBER COMPANY INCORPORATED COMMON STOCK USD0.01,729251108,3790000.0,93082,0.0074485450967151316,2015-08-10,2015-06-30,0001140361-15-030521
SLB,SCHLUMBERGER LIMITED COMMON STOCK USD0.01,806857108,3774000.0,44060,0.007417100051451956,2015-08-10,2015-06-30,0001140361-15-030521
SQM,SOCIEDAD QUIMICA Y MINERA DE CHILE SA SPONSORED ADR (EACH REPRESENTS 1 PREFERENCE SERIES B),833635105,3774000.0,242700,0.007417100051451956,2015-08-10,2015-06-30,0001140361-15-030521
N/A,GOOGLE INCORPORATED CLASS A COMMON STOCK USD0.001,38259P508,3773000.0,6970,0.0074151347361230075,2015-08-10,2015-06-30,0001140361-15-030521
ADM,ARCHER-DANIELS-MIDLAND CO COM STK NPV,039483102,3769000.0,77798,0.0074072734748072125,2015-08-10,2015-06-30,0001140361-15-030521
CM,CANADIAN IMPERIAL BANK OF COMMERCE COMMON NPV,136069101,3752000.0,40637,0.007373863114215087,2015-08-10,2015-06-30,0001140361-15-030521
CVCEUR,CABLEVISION SYSTEMS CORPORATION CLASS 'A' COMMON STOCK USD0.01,12686C109,3743000.0,155900,0.007356175276254549,2015-08-10,2015-06-30,0001140361-15-030521
N/A,RANDGOLD RESOURCES LIMITED ADR (EACH REPR 1 ORD USD0.05),752344309,3741000.0,54465,0.0073522446455966525,2015-08-10,2015-06-30,0001140361-15-030521
FNV,FRANCO-NEVADA CORPORATION COMMON NPV,351858105,3726000.0,62502,0.007322764915662423,2015-08-10,2015-06-30,0001140361-15-030521
SLB,SCHLUMBERGER LIMITED COMMON STOCK USD0.01,806857108,3708000.0,43291,0.007287389239741348,2015-08-10,2015-06-30,0001140361-15-030521
N/A,SENSATA TECHNOLOGIES HOLDING NV USD0.01,N7902X106,3706000.0,70507,0.007283458609083452,2015-08-10,2015-06-30,0001140361-15-030521
CENX,CENTURY ALUMINUM COMPANY COMMON STOCK USD0.01,156431108,3705000.0,350200,0.007281493293754503,2015-08-10,2015-06-30,0001140361-15-030521
HI,HILLENBRAND INCORPORATED COMMON STOCK NPV,431571108,3704000.0,121449,0.007279527978425555,2015-08-10,2015-06-30,0001140361-15-030521
TROW,PRICE T.ROWE GROUP INCORPORATED COMMON STOCK USD0.20,74144T108,3698000.0,47735,0.0072677360864518625,2015-08-10,2015-06-30,0001140361-15-030521
BNS,BANK OF NOVA SCOTIA CAPITAL STOCK,064149107,3690000.0,57069,0.007252013563820274,2015-08-10,2015-06-30,0001140361-15-030521
N/A,XEROX CORPORATION COMMON STOCK USD1,984121103,3681000.0,341442,0.007234325725859737,2015-08-10,2015-06-30,0001140361-15-030521
WMT,WAL-MART STORES INCORPORATED COMMON STOCK USD0.10,931142103,3675000.0,51460,0.007222533833886045,2015-08-10,2015-06-30,0001140361-15-030521
JPM,JPMORGAN CHASE AND COMPANY COMMON STOCK USD1,46625H100,3671000.0,54630,0.007214672572570251,2015-08-10,2015-06-30,0001140361-15-030521
LOW,LOWE'S COMPANIES INCORPORATED COMMON STOCK USD0.50,548661107,3647000.0,54000,0.007167505004675485,2015-08-10,2015-06-30,0001140361-15-030521
N/A,CHUBB CORPORATION (THE) COMMON STOCK USD1,171232101,3647000.0,38525,0.007167505004675485,2015-08-10,2015-06-30,0001140361-15-030521
BEN,FRANKLIN RESOURCES INCORPORATED COMMON STOCK USD0.10,354613101,3642000.0,74500,0.007157678428030743,2015-08-10,2015-06-30,0001140361-15-030521
BMY,BRISTOL-MYERS SQUIBB COMPANY COMMON STOCK USD0.10,110122108,3626000.0,54971,0.007126233382767565,2015-08-10,2015-06-30,0001140361-15-030521
GIS,GENERAL MILLS INC COMMON STOCK USD0.10,370334104,3622000.0,64609,0.00711837212145177,2015-08-10,2015-06-30,0001140361-15-030521
