ticker,nameOfIssuer,cusip,value,shares,allocation_percent,filingDate,reportDate,accessionNumber
AAPL,APPLE INCORPORATED COMMON STOCK NPV,037833100,747740000.0,6004493,1.469544884068014,2015-08-10,2015-06-30,0001140361-15-030521
PFE,PFIZER INCORPORATED COMMON STOCK USD0.05,717081103,725799000.0,21607605,1.4264239004355532,2015-08-10,2015-06-30,0001140361-15-030521
JPM,JPMORGAN CHASE AND COMPANY COMMON STOCK USD1,46625H100,623258000.0,9274678,1.2248985012898366,2015-08-10,2015-06-30,0001140361-15-030521
INTC,INTEL CORPORATION COMMON STOCK USD0.001,458140100,549937000.0,18095980,1.0807996160559974,2015-08-10,2015-06-30,0001140361-15-030521
MSFT,MICROSOFT CORPORATION COMMON STOCK USD0.0000125,594918104,508381000.0,11457762,0.9991289722462099,2015-08-10,2015-06-30,0001140361-15-030521
CSCO,CISCO SYSTEMS INCORPORATED USD0.001 (US LISTING),17275R102,495350000.0,17986566,0.9735189481946811,2015-08-10,2015-06-30,0001140361-15-030521
AMGN,AMGEN INCORPORATED COMMON STOCK USD0.0001,031162100,435734000.0,2874234,0.8563547095440821,2015-08-10,2015-06-30,0001140361-15-030521
UNH,UNITEDHEALTH GROUP INCORPORATED COMMON STOCK USD0.01,91324P102,401004000.0,3308888,0.7880993081696979,2015-08-10,2015-06-30,0001140361-15-030521
MRK,MERCK AND COMPANY INCORPORATED NEW COMMON STOCK USD0.01,58933Y105,370746000.0,6471393,0.7286327969463716,2015-08-10,2015-06-30,0001140361-15-030521
TD,TORONTO-DOMINION BANK (THE) COMMON NPV,891160509,364570000.0,6869603,0.7164950094747852,2015-08-10,2015-06-30,0001140361-15-030521
JNJ,JOHNSON AND JOHNSON COMMON STOCK USD1,478160104,364422000.0,3730773,0.7162041428061008,2015-08-10,2015-06-30,0001140361-15-030521
INFY,INFOSYS LIMITED SPONSORED ADR (EACH REPRESENTS 1 ORDINARY INR5),456788108,356646000.0,22487110,0.7009218508081967,2015-08-10,2015-06-30,0001140361-15-030521
XOM,EXXON MOBIL CORPORATION COMMON STOCK NPV,30231G102,332912000.0,4019702,0.654277056790931,2015-08-10,2015-06-30,0001140361-15-030521
N/A,STAPLES INCORPORATED COMMON STOCK USD0.0006,855030102,332350000.0,21693844,0.6531725495760619,2015-08-10,2015-06-30,0001140361-15-030521
C,CITIGROUP INCORPORATED COMMON STOCK USD0.01,172967424,326877000.0,5956216,0.6424163787807262,2015-08-10,2015-06-30,0001140361-15-030521
WFC,WELLS FARGO AND COMPANY COMMON STOCK USD1.6667,949746101,301930000.0,5385830,0.5933876572694459,2015-08-10,2015-06-30,0001140361-15-030521
ITUB,ITAU UNIBANCO HOLDING SA ADR (EACH REPRESENTS 1 PREFERENCE SHARE),465562106,298150000.0,27428671,0.5859587653260202,2015-08-10,2015-06-30,0001140361-15-030521
IVV,ISHARES TRUST CORE S&P 500 ETF,464287200,295734000.0,1430531,0.5812105634912805,2015-08-10,2015-06-30,0001140361-15-030521
N/A,GOOGLE INCORPORATED CLASS A COMMON STOCK USD0.001,38259P508,275767000.0,509501,0.5419691123181641,2015-08-10,2015-06-30,0001140361-15-030521
N/A,HEWLETT-PACKARD COMPANY COMMON STOCK USD0.01,428236103,271280000.0,9051703,0.5331507424371719,2015-08-10,2015-06-30,0001140361-15-030521
GILD,GILEAD SCIENCES INCORPORATED COMMON STOCK USD0.001,375558103,257449000.0,2229866,0.5059684661224839,2015-08-10,2015-06-30,0001140361-15-030521
CHKP,CHECK POINT SOFTWARE TECHNOLOGIES LIMITED ILS1,M22465104,250526000.0,3202832,0.4923625881001729,2015-08-10,2015-06-30,0001140361-15-030521
ORCL,ORACLE CORPORATION COMMON STOCK USD0.01,68389X105,237711000.0,5881019,0.46717707215969684,2015-08-10,2015-06-30,0001140361-15-030521
HDB,HDFC BANK LIMITED ADR (EACH REPRESENTING 3 ORDINARY),40415F101,237586000.0,3938103,0.4669314077435783,2015-08-10,2015-06-30,0001140361-15-030521
IBM,INTL BUSINESS MACHINES CORPORATION COMMON STOCK USD0.20,459200101,233093000.0,1430282,0.4581012459706123,2015-08-10,2015-06-30,0001140361-15-030521
AIG,AMERICAN INTERNATIONAL GROUP INCORPORATED COMMON STOCK USD2.50,026874784,228322000.0,3707126,0.44872472653619855,2015-08-10,2015-06-30,0001140361-15-030521
CMCSA,COMCAST CORPORATION CLASS A COMMON STOCK USD1,20030N101,224208000.0,3738039,0.4406394192729041,2015-08-10,2015-06-30,0001140361-15-030521
QCOM,QUALCOMM INCORPORATED COMMON STOCK USD0.0001,747525103,222773000.0,3557542,0.43781919177586287,2015-08-10,2015-06-30,0001140361-15-030521
N/A,WUXI PHARMATECH CAYMAN INCORPORATED ADR (EACH REPRESENTS 8 COMMON USD0.02),929352102,217521000.0,5247791,0.42749735566822494,2015-08-10,2015-06-30,0001140361-15-030521
N/A,AETNA INCORPORATED COMMON STOCK NPV,00817Y108,214294000.0,1683646,0.42115528310170786,2015-08-10,2015-06-30,0001140361-15-030521
BAC,VERIZON COMMUNICATIONS INCORPORATED COMMON STOCK USD0.10,92343V104,213876000.0,4572929,0.4203337812942073,2015-08-10,2015-06-30,0001140361-15-030521
SLB,SCHLUMBERGER LIMITED COMMON STOCK USD0.01,806857108,211525000.0,2469360,0.41571332495584923,2015-08-10,2015-06-30,0001140361-15-030521
ZBH,ZIMMER BIOMET HOLDINGS INCORPORATED COMMON STOCK USD0.01,98956P102,206232000.0,1887018,0.4053109109197243,2015-08-10,2015-06-30,0001140361-15-030521
CVX,CHEVRON CORPORATION COMMON STOCK USD0.75,166764100,204379000.0,2113756,0.4016691816151826,2015-08-10,2015-06-30,0001140361-15-030521
CMI,CUMMINS INCORPORATED COMMON STOCK USD2.50,231021106,203871000.0,1554604,0.4006708014280767,2015-08-10,2015-06-30,0001140361-15-030521
GS,GOLDMAN SACHS GROUP INCORPORATED COMMON STOCK USD0.01,38141G104,202727000.0,976293,0.39842248069175956,2015-08-10,2015-06-30,0001140361-15-030521
YUM,YUM BRANDS INCORPORATED COMMON STOCK NPV,988498101,191156000.0,2133201,0.3756818170204955,2015-08-10,2015-06-30,0001140361-15-030521
CAH,CARDINAL HEALTH CORPORATION INCORPORATED COMMON STOCK NPV,14149Y108,191061000.0,2281598,0.37549511206424535,2015-08-10,2015-06-30,0001140361-15-030521
RCI,ROGERS COMMUNICATIONS INCORPORATED COMMON STOCK CLASS 'B' NPV,775109200,190154000.0,4366342,0.373712571060889,2015-08-10,2015-06-30,0001140361-15-030521
BAX,BAXTER INTERNATIONAL INCORPORATED COMMON STOCK USD1,071813109,190100000.0,2690728,0.37360644403312576,2015-08-10,2015-06-30,0001140361-15-030521
OXY,OCCIDENTAL PETROLEUM CORP COMMON STOCK USD0.20,674599105,188767000.0,2439795,0.3709866786996373,2015-08-10,2015-06-30,0001140361-15-030521
AFL,AFLAC INCORPORATED COMMON STOCK USD0.10,001055102,187682000.0,3054714,0.3688543115677281,2015-08-10,2015-06-30,0001140361-15-030521
BIDUN,BAIDU INCORPORATED SPONSORED ADR (EACH REPRESENTS 0.10 CLASS A SHARES),056752108,187397000.0,934647,0.3682941966989778,2015-08-10,2015-06-30,0001140361-15-030521
GHC,GRAHAM HOLDINGS COMPANY COMMON STOCK USD1,384637104,184299000.0,172234,0.36220564980989506,2015-08-10,2015-06-30,0001140361-15-030521
AAPL,APPLE INCORPORATED COMMON STOCK NPV,037833100,181870000.0,1460450,0.3574318988758789,2015-08-10,2015-06-30,0001140361-15-030521
DIS,WALT DISNEY COMPANY (THE) COMMON STOCK USD0.01,254687106,174524000.0,1543777,0.3429946924694226,2015-08-10,2015-06-30,0001140361-15-030521
N/A,EMC CORPORATION MASSACHUSETTS COMMON STOCK USD0.01,268648102,172926000.0,6653573,0.3398541185737628,2015-08-10,2015-06-30,0001140361-15-030521
IVV,ISHARES TRUST CORE S&P 500 ETF,464287200,172869000.0,836205,0.33974209560001273,2015-08-10,2015-06-30,0001140361-15-030521
N/A,ACE LIMITED CHF25.94 (US LISTING),H0023R105,172489000.0,1697726,0.33899527577501226,2015-08-10,2015-06-30,0001140361-15-030521
PNC,PNC FINANCIAL SERVICES GROUP COMMON STOCK USD5,693475105,171898000.0,1796968,0.33783377441560364,2015-08-10,2015-06-30,0001140361-15-030521
PM,PHILIP MORRIS INTERNATIONAL INCORPORATED COMMON STOCK NPV,718172109,169744000.0,2118618,0.33360048519704844,2015-08-10,2015-06-30,0001140361-15-030521
TSM,TAIWAN SEMICONDUCTOR MANUFACTURING COMPANY LIMITED ADS REPRESENTING 5 COMMON SHARES,874039100,169695000.0,7582439,0.3335041847459299,2015-08-10,2015-06-30,0001140361-15-030521
EMR,EMERSON ELECTRIC COMPANY COMMON STOCK USD1,291011104,169239000.0,3046052,0.3326080009559294,2015-08-10,2015-06-30,0001140361-15-030521
PEP,PEPSICO INCORPORATED CAPITAL STOCK USD0.016666,713448108,167467000.0,1787463,0.3291254621930325,2015-08-10,2015-06-30,0001140361-15-030521
HON,HONEYWELL INTERNATIONAL INCORPORATED COMMON STOCK USD1,438516106,167376000.0,1643358,0.32894661849809814,2015-08-10,2015-06-30,0001140361-15-030521
N/A,APOLLO EDUCATION GROUP INCORPORATED CLASS A COMMON STOCK NPV,037604105,163823000.0,10542016,0.32196385313434384,2015-08-10,2015-06-30,0001140361-15-030521
BAC,BANK OF AMERICA CORPORATION COMMON STOCK USD0.01,060505104,159783000.0,9460190,0.31402397920539155,2015-08-10,2015-06-30,0001140361-15-030521
WMT,WAL-MART STORES INCORPORATED COMMON STOCK USD0.10,931142103,159708000.0,2236186,0.31387658055572043,2015-08-10,2015-06-30,0001140361-15-030521
VLO,VALERO ENERGY CORPORATION COMMON STOCK USD0.01,91913Y100,158850000.0,2623018,0.3121903400034825,2015-08-10,2015-06-30,0001140361-15-030521
AMZN,AMAZON COMMUNICATIONS INCORPORATED USD0.01,023135106,158403000.0,368500,0.3113118440514425,2015-08-10,2015-06-30,0001140361-15-030521
DFSEUR,DISCOVER FINANCIAL SERVICES COMMON STOCK USD0.01,254709108,155753000.0,2716775,0.30610375842972876,2015-08-10,2015-06-30,0001140361-15-030521
NOC,NORTHROP GRUMMAN CORPORATION COMMON STOCK USD1,666807102,155429000.0,979514,0.30546699626314944,2015-08-10,2015-06-30,0001140361-15-030521
N/A,DR PEPPER SNAPPLE GROUP INCORPORATED COMMON STOCK USD0.01,26138E109,154239000.0,2103350,0.3031282710217006,2015-08-10,2015-06-30,0001140361-15-030521
DGX,QUEST DIAGNOSTICS INCORPORATED COMMON STOCK USD0.01,74834L100,149654000.0,2102171,0.2941173002384714,2015-08-10,2015-06-30,0001140361-15-030521
PG,PROCTER AND GAMBLE COMPANY (THE) COMMON STOCK NPV,742718109,148926000.0,1901513,0.2926865506789968,2015-08-10,2015-06-30,0001140361-15-030521
N/A,COACH INCORPORATED COMMON STOCK USD0.01,189754104,145364000.0,4154431,0.28568609747728196,2015-08-10,2015-06-30,0001140361-15-030521
TXN,TEXAS INSTRUMENTS INCORPORATED COMMON STOCK USD1,882508104,144048000.0,2795965,0.28309974250438563,2015-08-10,2015-06-30,0001140361-15-030521
SYK,STRYKER CORP COM STK USD0.10,863667101,139645000.0,1464395,0.274446459111025,2015-08-10,2015-06-30,0001140361-15-030521
SPY,SPDR S&P 500 ETF TRUST,78462F103,139222000.0,677745,0.2736151307268797,2015-08-10,2015-06-30,0001140361-15-030521
ACN,ACCENTURE PLC CLASS A NEW COMMON STOCK USD0.0000225,G1151C101,138118000.0,1428615,0.2714454226037205,2015-08-10,2015-06-30,0001140361-15-030521
BABA,ALIBABA GROUP HOLDING LIMITED SPONSORED ADR (EACH REPRESENTS 1 ORDINARY SHARES USD0.000025),01609W102,137022000.0,1690169,0.26929143700319286,2015-08-10,2015-06-30,0001140361-15-030521
MDT,MEDTRONIC PLC USD0.10,G5960L103,134958000.0,1841177,0.265235026164243,2015-08-10,2015-06-30,0001140361-15-030521
TMO,THERMO FISHER SCIENTIFIC INCORPORATED COMMON STOCK USD1,883556102,130799000.0,1010421,0.25706127971114584,2015-08-10,2015-06-30,0001140361-15-030521
DOV,DOVER CORPORATION COMMON STOCK USD1,260003108,130292000.0,1858927,0.2560648648393689,2015-08-10,2015-06-30,0001140361-15-030521
ABEV,AMBEV SA SPONSORED ADR (EACH REPRESENTS 1 COMMON NPV),02319V103,129551000.0,21307650,0.254608566180618,2015-08-10,2015-06-30,0001140361-15-030521
N/A,MINDRAY MEDICAL INTERNATIONAL LIMITED SPONSORED ADR (EACH REPRSENTS 1 CLASS A SHARE),602675100,128169000.0,4533731,0.251892500396011,2015-08-10,2015-06-30,0001140361-15-030521
EL,ESTEE LAUDER COMPANIES INC CLASS'A'COM STK USD0.01,518439104,127039000.0,1476335,0.24967169407429912,2015-08-10,2015-06-30,0001140361-15-030521
BIDUN,BAIDU INCORPORATED SPONSORED ADR (EACH REPRESENTS 0.10 CLASS A SHARES),056752108,126275000.0,629802,0.24817019316298242,2015-08-10,2015-06-30,0001140361-15-030521
PH,PARKER-HANNIFIN CORPORATION COMMON STOCK USD0.5,701094104,124805000.0,1078883,0.24528117962942803,2015-08-10,2015-06-30,0001140361-15-030521
COP,CONOCOPHILLIPS INCORPORATED COMMON STOCK USD0.01,20825C104,123875000.0,2030404,0.2434534363735058,2015-08-10,2015-06-30,0001140361-15-030521
PFG,PRINCIPAL FINANCIAL GROUP COMMON STOCK USD0.01,74251V102,123645000.0,2436826,0.24300141384784762,2015-08-10,2015-06-30,0001140361-15-030521
GD,GENERAL DYNAMICS CORPORATION COMMON STOCK USD1,369550108,123329000.0,869495,0.24238037420389988,2015-08-10,2015-06-30,0001140361-15-030521
N/A,LYONDELLBASELL INDUSTRIES NV CLASS A COMMON STOCK USD0.01,N53745100,122050000.0,1201045,0.23986673589817464,2015-08-10,2015-06-30,0001140361-15-030521
N/A,GOOGLE INCORPORATED CLASS A COMMON STOCK USD0.001,38259P508,121484000.0,224451,0.23875436742198974,2015-08-10,2015-06-30,0001140361-15-030521
MCD,MCDONALD'S CORPORATION COMMON STOCK USD0.01,580135101,120506000.0,1262636,0.23683228903027803,2015-08-10,2015-06-30,0001140361-15-030521
ERJ,EMBRAER SA SPONSORED ADR (EACH REPRESENTS 4 SHARES),29082A107,119678000.0,4001267,0.23520500793790863,2015-08-10,2015-06-30,0001140361-15-030521
BBTUSD,BB&T CORPORATION COMMON STOCK USD5,054937107,118553000.0,2945408,0.23299402819284146,2015-08-10,2015-06-30,0001140361-15-030521
N/A,ENERSIS SA SPONSORED ADR (EACH REPRESENTS 50 COMMON SHARES NPV),29274F104,117501000.0,7624978,0.23092651646678752,2015-08-10,2015-06-30,0001140361-15-030521
CTLTEUR,CATALENT INCORPORATED COMMON STOCK USD0.01,148806102,116354000.0,3952258,0.2286722997844835,2015-08-10,2015-06-30,0001140361-15-030521
DHR,DANAHER CORPORATION COMMON STOCK USD0.01,235851102,116275000.0,1371972,0.22851703987349656,2015-08-10,2015-06-30,0001140361-15-030521
MMM,3M COMPANY COMMON STOCK USD0.01,88579Y101,115401000.0,749599,0.22679935427599554,2015-08-10,2015-06-30,0001140361-15-030521
UTXZ,UNITED TECHNOLOGIES CORPORATION COMMON STOCK USD1,913017109,110868000.0,994062,0.2178905798898716,2015-08-10,2015-06-30,0001140361-15-030521
META,FACEBOOK INCORPORATED CLASS A COMMON STOCK USD0.000006,30303M102,110845000.0,1291897,0.21784537763730577,2015-08-10,2015-06-30,0001140361-15-030521
N/A,CHINA LODGING GROUP LIMITED SPONSORED ADS (EACH REPRESENTS 4 SHARES),16949N109,110780000.0,4506900,0.2177176321409241,2015-08-10,2015-06-30,0001140361-15-030521
N/A,HILTON WORLDWIDE HOLDINGS INCORPORATED COMMON USD0.01,43300A104,110739000.0,4051926,0.21763705421243723,2015-08-10,2015-06-30,0001140361-15-030521
N/A,ADT CORPORATION (THE) COMMON STOCK USD0.01,00101J106,110426000.0,3268000,0.21702191051447633,2015-08-10,2015-06-30,0001140361-15-030521
CPB,CAMPBELL SOUP COMPANY CAPITAL STOCK USD0.0375,134429109,109534000.0,2330014,0.2152688492410542,2015-08-10,2015-06-30,0001140361-15-030521
WU,WESTERN UNION COMPANY (THE) COMMON STOCK USD0.01,959802109,107809000.0,5295145,0.21187868029861784,2015-08-10,2015-06-30,0001140361-15-030521
RTN1USD,RAYTHEON COMPANY COMMON STOCK USD0.01,755111507,107609000.0,1121865,0.21148561723282813,2015-08-10,2015-06-30,0001140361-15-030521
HD,HOME DEPOT INCORPORATED (THE) COMMON STOCK USD0.05,437076102,106831000.0,966444,0.20995660190690615,2015-08-10,2015-06-30,0001140361-15-030521
IBN,ICICI BANK LIMITED SPONSORED ADR (EACH REPRESENTS 2 ORDINARY INR10),45104G104,106802000.0,10481108,0.20989960776236663,2015-08-10,2015-06-30,0001140361-15-030521
WDC,WESTERN DIGITAL CORPORATION COMMON STOCK USD0.01,958102105,106673000.0,1301527,0.20964608208493227,2015-08-10,2015-06-30,0001140361-15-030521
IP,INTERNATIONAL PAPER COMPANY COMMON STOCK USD1,460146103,105785000.0,2217723,0.20790088207282595,2015-08-10,2015-06-30,0001140361-15-030521
GLW,CORNING INCORPORATED COMMON STOCK USD0.50,219350105,104713000.0,5315373,0.20579406404019307,2015-08-10,2015-06-30,0001140361-15-030521
FITB,FIFTH THIRD BANCORP COM STK NPV,316773100,104042000.0,5014055,0.20447533745446855,2015-08-10,2015-06-30,0001140361-15-030521
ROK,ROCKWELL AUTOMATION INCORPORATED COMMON STOCK USD1,773903109,103337000.0,840753,0.2030897901475598,2015-08-10,2015-06-30,0001140361-15-030521
MET,METLIFE INCORPORATED COMMON STOCK USD0.01,59156R108,102232000.0,1843015,0.20091811670907164,2015-08-10,2015-06-30,0001140361-15-030521
PAYX,PAYCHEX INCORPORATED COMMON STOCK USD0.01,704326107,100861000.0,2155390,0.1982236693930831,2015-08-10,2015-06-30,0001140361-15-030521
SU,SUNCOR ENERGY INCORPORATED NEW COMMON NPV (CANADA LISTING),867224107,100693000.0,2979968,0.19789349641781978,2015-08-10,2015-06-30,0001140361-15-030521
TSM,TAIWAN SEMICONDUCTOR MANUFACTURING COMPANY LIMITED ADS REPRESENTING 5 COMMON SHARES,874039100,99768000.0,4457916,0.1960755797385423,2015-08-10,2015-06-30,0001140361-15-030521
INFY,INFOSYS LIMITED SPONSORED ADR (EACH REPRESENTS 1 ORDINARY INR5),456788108,98368000.0,6202282,0.19332413827801428,2015-08-10,2015-06-30,0001140361-15-030521
ITUB,ITAU UNIBANCO HOLDING SA ADR (EACH REPRESENTS 1 PREFERENCE SHARE),465562106,98232000.0,9036984,0.19305685539327727,2015-08-10,2015-06-30,0001140361-15-030521
CTSH,COGNIZANT TECHNOLOGY SOLUTIONS CORPORATION CLASS A COMMON STOCK USD0.01,192446102,97928000.0,1600789,0.19245939953327693,2015-08-10,2015-06-30,0001140361-15-030521
LLY,ELI LILLY AND COMPANY COMMON STOCK NPV,532457108,97772000.0,1167009,0.19215281034196094,2015-08-10,2015-06-30,0001140361-15-030521
NTAP,NETAPP INCORPORATED COMMON STOCK USD0.001,64110D104,95227000.0,3006387,0.1871510828297868,2015-08-10,2015-06-30,0001140361-15-030521
UNP,UNION PACIFIC CORPORATION COMMON STOCK USD2.50,907818108,95111000.0,995616,0.18692310625162875,2015-08-10,2015-06-30,0001140361-15-030521
CLX,CLOROX COMPANY COMMON STOCK USD1,189054109,93863000.0,897868,0.1844703927211009,2015-08-10,2015-06-30,0001140361-15-030521
N/A,MINDRAY MEDICAL INTERNATIONAL LIMITED SPONSORED ADR (EACH REPRSENTS 1 CLASS A SHARE),602675100,93670000.0,3313391,0.18409108686261386,2015-08-10,2015-06-30,0001140361-15-030521
GIS,GENERAL MILLS INC COMMON STOCK USD0.10,370334104,93314000.0,1664545,0.18339143460550816,2015-08-10,2015-06-30,0001140361-15-030521
LNC,LINCOLN NATIONAL CORPORATION COMMON STOCK NPV,534187109,92804000.0,1582341,0.18238912378774436,2015-08-10,2015-06-30,0001140361-15-030521
AFG,AMERICAN FINANCIAL GROUP INCORPORATED COMMON STOCK NPV,025932104,92536000.0,1426491,0.18186241927958616,2015-08-10,2015-06-30,0001140361-15-030521
JPM,JPMORGAN CHASE AND COMPANY COMMON STOCK USD1,46625H100,90804000.0,1351247,0.1784584931298472,2015-08-10,2015-06-30,0001140361-15-030521
HRSEUR,HARRIS CORP COMMON STOCK USD1,413875105,88512000.0,1147861,0.17395399039589704,2015-08-10,2015-06-30,0001140361-15-030521
BBD,BANCO BRADESCO SA SPONSORED ADR (EACH REPRESENTING 1 PREFERENCE SHARE NPV),059460303,88470000.0,9754103,0.17387144715208122,2015-08-10,2015-06-30,0001140361-15-030521
MXIM,MAXIM INTEGRATED PRODUCTS INCORPORATED COMMON STOCK USD0.001,57772K101,88291000.0,2568452,0.1735196557081994,2015-08-10,2015-06-30,0001140361-15-030521
FAF,FIRST AMERICAN FINANCIAL CORPORATION COMMON STOCK USD0.00001,31847R102,87972000.0,2395753,0.17289272011826481,2015-08-10,2015-06-30,0001140361-15-030521
BALL,BALL CORPORATION COMMON STOCK NPV,058498106,87742000.0,1233721,0.17244069759260663,2015-08-10,2015-06-30,0001140361-15-030521
AMXN,AMERICA MOVIL SAB DE CV ADR (EACH REPRESENTS 20 SERIES 'L' SHARES),02364W105,87354000.0,4155744,0.1716781552449746,2015-08-10,2015-06-30,0001140361-15-030521
WFC,WELLS FARGO AND COMPANY COMMON STOCK USD1.6667,949746101,87138000.0,1554375,0.1712536471339217,2015-08-10,2015-06-30,0001140361-15-030521
N/A,MINDRAY MEDICAL INTERNATIONAL LIMITED SPONSORED ADR (EACH REPRSENTS 1 CLASS A SHARE),602675100,86979000.0,3076726,0.17094116199661888,2015-08-10,2015-06-30,0001140361-15-030521
N/A,CA INCORPORATED COMMON STOCK USD0.10,12673P105,86901000.0,2989367,0.17078786740096089,2015-08-10,2015-06-30,0001140361-15-030521
DB,DEUTSCHE BANK AG NPV (REGISTERED),D18190898,86670000.0,3215973,0.17033387955997376,2015-08-10,2015-06-30,0001140361-15-030521
KLIC,KULICKE AND SOFFA INDUSTRIES INCORPORATED COMMON STOCK NPV,501242101,85978000.0,7225054,0.16897388135234134,2015-08-10,2015-06-30,0001140361-15-030521
KO,COCA-COLA COMPANY (THE) COMMON STOCK USD0.25,191216100,85784000.0,2177270,0.1685926101785253,2015-08-10,2015-06-30,0001140361-15-030521
CLGX,CORELOGIC INCORPORATED COMMON STOCK USD1,21871D103,84965000.0,2163600,0.16698301692411643,2015-08-10,2015-06-30,0001140361-15-030521
META,FACEBOOK INCORPORATED CLASS A COMMON STOCK USD0.000006,30303M102,84435000.0,984086,0.16594139979977368,2015-08-10,2015-06-30,0001140361-15-030521
ARMK,ARAMARK COMMON STOCK USD0.01,03852U106,84408000.0,2693300,0.16588833628589206,2015-08-10,2015-06-30,0001140361-15-030521
N/A,VANTIV INCORPORATED CLASS A COMMON STOCK USD0.00001,92210H105,84371000.0,2234389,0.165815619618721,2015-08-10,2015-06-30,0001140361-15-030521
MA,MASTERCARD INCORPORATED CLASS A COMMON STOCK USD0.0001,57636Q104,83663000.0,904272,0.16442417636582538,2015-08-10,2015-06-30,0001140361-15-030521
AAPL,APPLE INCORPORATED COMMON STOCK NPV,037833100,82882000.0,665561,0.16288926509391652,2015-08-10,2015-06-30,0001140361-15-030521
N/A,ASM INTERNATIONAL NV EUR0.04,N07045102,82592000.0,1992331,0.16231932364852145,2015-08-10,2015-06-30,0001140361-15-030521
DIS,WALT DISNEY COMPANY (THE) COMMON STOCK USD0.01,254687106,82441000.0,729245,0.1620225610338502,2015-08-10,2015-06-30,0001140361-15-030521
RE,EVEREST RE GROUP LIMITED COMMON STOCK USD0.01,G3223R108,81808000.0,451054,0.16077851643062574,2015-08-10,2015-06-30,0001140361-15-030521
CELG,CELGENE CORPORATION COMMON STOCK USD0.01,151020104,80933000.0,704315,0.15905886551779574,2015-08-10,2015-06-30,0001140361-15-030521
NSC,NORFOLK SOUTHERN CORP COMMON STOCK USD1,655844108,80517000.0,925695,0.15824129434095313,2015-08-10,2015-06-30,0001140361-15-030521
COF,CAPITAL ONE FINANCIAL CORPORATION COMMON STOCK USD0.01,14040H105,80317000.0,915289,0.1578482312751634,2015-08-10,2015-06-30,0001140361-15-030521
C,CITIGROUP INCORPORATED COMMON STOCK USD0.01,172967424,80094000.0,1459437,0.15740996595680787,2015-08-10,2015-06-30,0001140361-15-030521
CHKP,CHECK POINT SOFTWARE TECHNOLOGIES LIMITED ILS1,M22465104,79743000.0,1019477,0.1567201402763469,2015-08-10,2015-06-30,0001140361-15-030521
SJR/BEUR,SHAW COMMUNICATIONS INCORPORATED CLASS 'B' NPV,82028K200,79144000.0,2920441,0.1555429163943067,2015-08-10,2015-06-30,0001140361-15-030521
LMT,LOCKHEED MARTIN CORP COMMON STOCK USD0.01,539830109,78951000.0,425566,0.15516361053581965,2015-08-10,2015-06-30,0001140361-15-030521
HXL,HEXCEL CORPORATION COMMON STOCK USD0.01,428291108,78834000.0,1587471,0.15493366864233266,2015-08-10,2015-06-30,0001140361-15-030521
CTSH,COGNIZANT TECHNOLOGY SOLUTIONS CORPORATION CLASS A COMMON STOCK USD0.01,192446102,78171000.0,1277834,0.15363066457923974,2015-08-10,2015-06-30,0001140361-15-030521
V,VISA INCORPORATED CLASS A COMMON STOCK USD0.0001,92826C839,77193000.0,1156968,0.15170858618752803,2015-08-10,2015-06-30,0001140361-15-030521
HDB,HDFC BANK LIMITED ADR (EACH REPRESENTING 3 ORDINARY),40415F101,76820000.0,1273331,0.1509755235698302,2015-08-10,2015-06-30,0001140361-15-030521
BCE,BCE INCORPORATED COMMON NPV,05534B760,76791000.0,1449425,0.1509185294252907,2015-08-10,2015-06-30,0001140361-15-030521
HII,HUNTINGTON INGALLS INDUSTRIES INCORPORATED COMMON STOCK USD0.01,446413106,76644000.0,681582,0.15062962807193525,2015-08-10,2015-06-30,0001140361-15-030521
N/A,VWR CORPORATION COMMON STOCK USD0.01,91843L103,76060000.0,2876700,0.14948188391982928,2015-08-10,2015-06-30,0001140361-15-030521
NOVEUR,NATIONAL-OILWELL VARCO INCORPORATED COMMON STOCK USD0.01,637071101,75925000.0,1563204,0.14921656635042121,2015-08-10,2015-06-30,0001140361-15-030521
BIDUN,BAIDU INCORPORATED SPONSORED ADR (EACH REPRESENTS 0.10 CLASS A SHARES),056752108,75496000.0,376541,0.14837344607430228,2015-08-10,2015-06-30,0001140361-15-030521
KMB,KIMBERLY-CLARK CORPORATION COMMON STOCK USD1.25,494368103,75225000.0,708865,0.14784084562015723,2015-08-10,2015-06-30,0001140361-15-030521
N/A,HUBBELL INCORPORATED CLASS B COMMON STOCK USD0.01,443510201,75091000.0,690172,0.14757749336607812,2015-08-10,2015-06-30,0001140361-15-030521
PFE,PFIZER INCORPORATED COMMON STOCK USD0.05,717081103,75012000.0,2233155,0.14742223345509117,2015-08-10,2015-06-30,0001140361-15-030521
LECO,LINCOLN ELECTRIC HOLDINGS INCORPORATED COMMON STOCK NPV,533900106,74461000.0,1222068,0.1463393447088405,2015-08-10,2015-06-30,0001140361-15-030521
YUM,YUM BRANDS INCORPORATED COMMON STOCK NPV,988498101,74395000.0,830207,0.1462096338971299,2015-08-10,2015-06-30,0001140361-15-030521
N/A,DELPHI AUTOMOTIVE PLC USD0.01 (US LISTING),G27823106,74309000.0,879082,0.1460406167788403,2015-08-10,2015-06-30,0001140361-15-030521
XLNXEUR,XILINX INCORPORATED COMMON STOCK USD0.01,983919101,73236000.0,1665593,0.14393183343087848,2015-08-10,2015-06-30,0001140361-15-030521
TEVA,TEVA PHARMACEUTICAL INDUSTRIES LIMITED SPONSORED ADR (EACH CONVERT INTO 1 ORDINARY ILS0.10),881624209,72670000.0,1224016,0.14281946495469358,2015-08-10,2015-06-30,0001140361-15-030521
XECEUR,CIMAREX ENERGY COMPANY COMMON STOCK USD0.01,171798101,72409000.0,662961,0.142306517653838,2015-08-10,2015-06-30,0001140361-15-030521
WDR,WADDELL & REED FINANCIAL-A,930059100,71661000.0,1520818,0.14083646178778447,2015-08-10,2015-06-30,0001140361-15-030521
N/A,WASTE CONNECTIONS INCORPORATED COMMON STOCK USD0.01,941053100,71409000.0,1516121,0.14034120232488942,2015-08-10,2015-06-30,0001140361-15-030521
PTC,PTC INCORPORATED COMMON STOCK USD0.01,69370C100,70625000.0,1722153,0.13880039510699374,2015-08-10,2015-06-30,0001140361-15-030521
RNR,RENAISSANCE HOLDINGS COMMON STOCK NPV,G7496G103,70577000.0,696096,0.1387060599712042,2015-08-10,2015-06-30,0001140361-15-030521
BCRUSD,BARD(C.R.) INC COMMON STOCK USD0.25,067383109,70289000.0,411193,0.13814004915646702,2015-08-10,2015-06-30,0001140361-15-030521
UNH,UNITEDHEALTH GROUP INCORPORATED COMMON STOCK USD0.01,91324P102,69619000.0,574463,0.13682328788607145,2015-08-10,2015-06-30,0001140361-15-030521
ITW,ILLINOIS TOOL WORKS INC COMMON STOCK NPV,452308109,69242000.0,757155,0.13608236400705784,2015-08-10,2015-06-30,0001140361-15-030521
AMGN,AMGEN INCORPORATED COMMON STOCK USD0.0001,031162100,69077000.0,455656,0.13575808697778133,2015-08-10,2015-06-30,0001140361-15-030521
MO,ALTRIA GROUP INCORPORATED COMMON STOCK USD0.3333,02209S103,68956000.0,1416816,0.13552028382297854,2015-08-10,2015-06-30,0001140361-15-030521
DLX,DELUXE CORPORATION COMMON STOCK USD1,248019101,68174000.0,1121835,0.13398340723574073,2015-08-10,2015-06-30,0001140361-15-030521
