ticker,nameOfIssuer,cusip,value,shares,allocation_percent,filingDate,reportDate,accessionNumber
CSCO,CISCO SYSTEMS INCORPORATED USD0.001 (US LISTING),17275R102,611861000.0,21498981,1.2648818629641476,2016-05-10,2016-03-31,0001140361-16-064175
INTC,INTEL CORPORATION COMMON STOCK USD0.001,458140100,584276000.0,17862302,1.2078562212091313,2016-05-10,2016-03-31,0001140361-16-064175
MSFT,MICROSOFT CORPORATION COMMON STOCK USD0.0000125,594918104,527767000.0,9587053,1.0910368632271044,2016-05-10,2016-03-31,0001140361-16-064175
AAPL,APPLE INCORPORATED COMMON STOCK NPV,037833100,510368000.0,4658347,1.05506843325083,2016-05-10,2016-03-31,0001140361-16-064175
PFE,PFIZER INCORPORATED COMMON STOCK USD0.05,717081103,504547000.0,16779079,1.043034854832996,2016-05-10,2016-03-31,0001140361-16-064175
JPM,JPMORGAN CHASE AND COMPANY COMMON STOCK USD1,46625H100,447460000.0,7493885,0.9250206148160081,2016-05-10,2016-03-31,0001140361-16-064175
TD,TORONTO-DOMINION BANK (THE) COMMON NPV,891160509,391364000.0,6955107,0.8090550393260898,2016-05-10,2016-03-31,0001140361-16-064175
BABA,ALIBABA GROUP HOLDING LIMITED SPONSORED ADR (EACH REPRESENTS 1 ORDINARY SHARES USD0.000025),01609W102,382112000.0,4845451,0.789928657686887,2016-05-10,2016-03-31,0001140361-16-064175
AMGN,AMGEN INCORPORATED COMMON STOCK USD0.0001,031162100,340910000.0,2280640,0.70475300093176,2016-05-10,2016-03-31,0001140361-16-064175
BABA,ALIBABA GROUP HOLDING LIMITED SPONSORED ADR (EACH REPRESENTS 1 ORDINARY SHARES USD0.000025),01609W102,335123000.0,4249589,0.692789709692453,2016-05-10,2016-03-31,0001140361-16-064175
JNJ,JOHNSON AND JOHNSON COMMON STOCK USD1,478160104,332589000.0,3051835,0.6875512476222261,2016-05-10,2016-03-31,0001140361-16-064175
CHKP,CHECK POINT SOFTWARE TECHNOLOGIES LIMITED ILS1,M22465104,305867000.0,3542592,0.6323096598398246,2016-05-10,2016-03-31,0001140361-16-064175
TSM,TAIWAN SEMICONDUCTOR MANUFACTURING COMPANY LIMITED ADS REPRESENTING 5 COMMON SHARES,874039100,300131000.0,11342820,0.6204517993683084,2016-05-10,2016-03-31,0001140361-16-064175
MRK,MERCK AND COMPANY INCORPORATED NEW COMMON STOCK USD0.01,58933Y105,297349000.0,5587170,0.6147006543488248,2016-05-10,2016-03-31,0001140361-16-064175
UNH,UNITEDHEALTH GROUP INCORPORATED COMMON STOCK USD0.01,91324P102,296863000.0,2289194,0.6136959611498783,2016-05-10,2016-03-31,0001140361-16-064175
BABA,ALIBABA GROUP HOLDING LIMITED SPONSORED ADR (EACH REPRESENTS 1 ORDINARY SHARES USD0.000025),01609W102,296369000.0,3758172,0.6126747297912785,2016-05-10,2016-03-31,0001140361-16-064175
IVV,ISHARES TRUST CORE S&P 500 ETF,464287200,296306000.0,1430531,0.6125444917840076,2016-05-10,2016-03-31,0001140361-16-064175
C,CITIGROUP INCORPORATED COMMON STOCK USD0.01,172967424,292097000.0,6974616,0.6038433525363418,2016-05-10,2016-03-31,0001140361-16-064175
N/A,SPDR BARCLAYS HIGH YIELD BOND ETF,78464A417,288292000.0,8429592,0.5959773903511746,2016-05-10,2016-03-31,0001140361-16-064175
XOM,EXXON MOBIL CORPORATION COMMON STOCK NPV,30231G102,286080000.0,3384761,0.5914045892069986,2016-05-10,2016-03-31,0001140361-16-064175
WFC,WELLS FARGO AND COMPANY COMMON STOCK USD1.6667,949746101,285639000.0,5871310,0.5904929231561027,2016-05-10,2016-03-31,0001140361-16-064175
GOOGL,ALPHABET INCORPORATED CL A NPV,02079K305,283129000.0,368495,0.585304075564836,2016-05-10,2016-03-31,0001140361-16-064175
N/A,STAPLES INCORPORATED COMMON STOCK USD0.0006,855030102,280869000.0,25510359,0.5806320454627393,2016-05-10,2016-03-31,0001140361-16-064175
IBM,INTL BUSINESS MACHINES CORPORATION COMMON STOCK USD0.20,459200101,274929000.0,1852496,0.5683524619200605,2016-05-10,2016-03-31,0001140361-16-064175
ITUB,ITAU UNIBANCO HOLDING SA ADR (EACH REPRESENTS 1 PREFERENCE SHARE),465562106,255913000.0,29081021,0.5290412564238347,2016-05-10,2016-03-31,0001140361-16-064175
HDB,HDFC BANK LIMITED ADR (EACH REPRESENTING 3 ORDINARY),40415F101,239400000.0,3933612,0.49490442762917874,2016-05-10,2016-03-31,0001140361-16-064175
AAPL,APPLE INCORPORATED COMMON STOCK NPV,037833100,220036000.0,2008365,0.4548738121880283,2016-05-10,2016-03-31,0001140361-16-064175
JD,JD.COM INCORPORATED ADR (EACH REPRESENTING 2 SHARES),47215P106,219918000.0,8073355,0.45462987433314006,2016-05-10,2016-03-31,0001140361-16-064175
INFY,INFOSYS LIMITED SPONSORED ADR (EACH REPRESENTS 1 ORDINARY INR5),456788108,217080000.0,11329835,0.4487629621960824,2016-05-10,2016-03-31,0001140361-16-064175
PG,PROCTER AND GAMBLE COMPANY (THE) COMMON STOCK NPV,742718109,215715000.0,2609040,0.4459411387052143,2016-05-10,2016-03-31,0001140361-16-064175
BABA,ALIBABA GROUP HOLDING LIMITED SPONSORED ADR (EACH REPRESENTS 1 ORDINARY SHARES USD0.000025),01609W102,214286000.0,2717294,0.44298700993711865,2016-05-10,2016-03-31,0001140361-16-064175
GOOGL,ALPHABET INCORPORATED CL A NPV,02079K305,213579000.0,277975,0.4415254500777459,2016-05-10,2016-03-31,0001140361-16-064175
CVX,CHEVRON CORPORATION COMMON STOCK USD0.75,166764100,204171000.0,2143529,0.422076574325301,2016-05-10,2016-03-31,0001140361-16-064175
GIS,GENERAL MILLS INC COMMON STOCK USD0.10,370334104,191152000.0,3019294,0.39516278675928473,2016-05-10,2016-03-31,0001140361-16-064175
PEP,PEPSICO INCORPORATED CAPITAL STOCK USD0.016666,713448108,184475000.0,1796425,0.3813596252585328,2016-05-10,2016-03-31,0001140361-16-064175
BAC,BANK OF AMERICA CORPORATION COMMON STOCK USD0.01,060505104,183479000.0,13611179,0.37930062438167955,2016-05-10,2016-03-31,0001140361-16-064175
ORCL,ORACLE CORPORATION COMMON STOCK USD0.01,68389X105,181946000.0,4440955,0.37613149953808916,2016-05-10,2016-03-31,0001140361-16-064175
CMCSA,COMCAST CORPORATION CLASS A COMMON STOCK USD1,20030N101,179813000.0,2957450,0.3717220127204909,2016-05-10,2016-03-31,0001140361-16-064175
GILD,GILEAD SCIENCES INCORPORATED COMMON STOCK USD0.001,375558103,178882000.0,1945002,0.3697973843908219,2016-05-10,2016-03-31,0001140361-16-064175
KO,COCA-COLA COMPANY (THE) COMMON STOCK USD0.25,191216100,178457000.0,3831192,0.3689187946592329,2016-05-10,2016-03-31,0001140361-16-064175
QCOM,QUALCOMM INCORPORATED COMMON STOCK USD0.0001,747525103,170383000.0,3341508,0.352227657028999,2016-05-10,2016-03-31,0001140361-16-064175
N/A,DOW CHEMICAL COMPANY (THE) COMMON STOCK USD2.50,260543103,169565000.0,3293810,0.3505366302044348,2016-05-10,2016-03-31,0001140361-16-064175
IWB,ISHARES TRUST RUSSELL 1000 ETF,464287622,166542000.0,1458084,0.3442872731253913,2016-05-10,2016-03-31,0001140361-16-064175
META,FACEBOOK INCORPORATED CLASS A COMMON STOCK USD0.000006,30303M102,166299000.0,1449861,0.34378492652591813,2016-05-10,2016-03-31,0001140361-16-064175
HPE,HEWLETT PACKARD ENTERPRISE COMMON STOCK USD0.01,42824C109,166058000.0,9282186,0.3432867144663582,2016-05-10,2016-03-31,0001140361-16-064175
JD,JD.COM INCORPORATED ADR (EACH REPRESENTING 2 SHARES),47215P106,164000000.0,6020541,0.3390322728955109,2016-05-10,2016-03-31,0001140361-16-064175
N/A,NEW ORIENTAL EDUCATION & TECHNOLOGY GROUP INCORPORATED SPONSORED ADR (EACH REPRESENTS 1 ORDINARY SHARES),647581107,163822000.0,4564565,0.3386642988432219,2016-05-10,2016-03-31,0001140361-16-064175
UNP,UNION PACIFIC CORPORATION COMMON STOCK USD2.50,907818108,163276000.0,2026763,0.33753556944687463,2016-05-10,2016-03-31,0001140361-16-064175
N/A,CHINA LODGING GROUP LIMITED SPONSORED ADS (EACH REPRESENTS 4 SHARES),16949N109,161209000.0,4274956,0.3332625224464172,2016-05-10,2016-03-31,0001140361-16-064175
UTXZ,UNITED TECHNOLOGIES CORPORATION COMMON STOCK USD1,913017109,158074000.0,1576796,0.3267816311322255,2016-05-10,2016-03-31,0001140361-16-064175
AIG,AMERICAN INTERNATIONAL GROUP INCORPORATED COMMON STOCK USD2.50,026874784,157126000.0,2881991,0.324821859213293,2016-05-10,2016-03-31,0001140361-16-064175
BIDUN,BAIDU INCORPORATED SPONSORED ADR (EACH REPRESENTS 0.10 CLASS A SHARES),056752108,155272000.0,817694,0.32098914071360835,2016-05-10,2016-03-31,0001140361-16-064175
T,AT AND T INCORPORATED COMMON STOCK USD1,00206R102,153328000.0,3894536,0.31697036791782257,2016-05-10,2016-03-31,0001140361-16-064175
AMZN,AMAZON COMMUNICATIONS INCORPORATED USD0.01,023135106,150288000.0,251028,0.3106858672495155,2016-05-10,2016-03-31,0001140361-16-064175
XOM,EXXON MOBIL CORPORATION COMMON STOCK NPV,30231G102,146952000.0,1738671,0.3037894546740312,2016-05-10,2016-03-31,0001140361-16-064175
WMT,WAL-MART STORES INCORPORATED COMMON STOCK USD0.10,931142103,146033000.0,2122566,0.30188963358384235,2016-05-10,2016-03-31,0001140361-16-064175
EMR,EMERSON ELECTRIC COMPANY COMMON STOCK USD1,291011104,145685000.0,2670182,0.3011702236389177,2016-05-10,2016-03-31,0001140361-16-064175
TEVA,TEVA PHARMACEUTICAL INDUSTRIES LIMITED SPONSORED ADR (EACH CONVERT INTO 1 ORDINARY ILS0.10),881624209,145306000.0,2671057,0.300386728325336,2016-05-10,2016-03-31,0001140361-16-064175
N/A,LYONDELLBASELL INDUSTRIES NV CLASS A COMMON STOCK USD0.01,N53745100,145150000.0,1689761,0.30006423421209394,2016-05-10,2016-03-31,0001140361-16-064175
N/A,UBS GROUP AG CHF0.10 (REGISTERED),H42097107,144374000.0,9131790,0.2984600327257103,2016-05-10,2016-03-31,0001140361-16-064175
DIS,WALT DISNEY COMPANY (THE) COMMON STOCK USD0.01,254687106,142181000.0,1437481,0.2939265097107112,2016-05-10,2016-03-31,0001140361-16-064175
TEVA,TEVA PHARMACEUTICAL INDUSTRIES LIMITED SPONSORED ADR (EACH CONVERT INTO 1 ORDINARY ILS0.10),881624209,141506000.0,2601210,0.29253110248995223,2016-05-10,2016-03-31,0001140361-16-064175
PM,PHILIP MORRIS INTERNATIONAL INCORPORATED COMMON STOCK NPV,718172109,141338000.0,1432144,0.29218380113723,2016-05-10,2016-03-31,0001140361-16-064175
BA,BOEING COMPANY (THE) COMMON STOCK USD5,097023105,139570000.0,1085469,0.28852886785381987,2016-05-10,2016-03-31,0001140361-16-064175
GS,GOLDMAN SACHS GROUP INCORPORATED COMMON STOCK USD0.01,38141G104,139457000.0,891098,0.28829526634871505,2016-05-10,2016-03-31,0001140361-16-064175
TSM,TAIWAN SEMICONDUCTOR MANUFACTURING COMPANY LIMITED ADS REPRESENTING 5 COMMON SHARES,874039100,135883000.0,5135403,0.2809068435235409,2016-05-10,2016-03-31,0001140361-16-064175
VIV1USD,TELEF BRASIL SA SPONSORED ADR (EACH REPRESENTS 1 PREFERENCE SHARE),87936R106,129954000.0,10105302,0.2686499999503855,2016-05-10,2016-03-31,0001140361-16-064175
AMZN,AMAZON COMMUNICATIONS INCORPORATED USD0.01,023135106,126392000.0,211114,0.2612863843646916,2016-05-10,2016-03-31,0001140361-16-064175
CMCSA,COMCAST CORPORATION CLASS A COMMON STOCK USD1,20030N101,125971000.0,2071890,0.2604160637129293,2016-05-10,2016-03-31,0001140361-16-064175
WFC,WELLS FARGO AND COMPANY COMMON STOCK USD1.6667,949746101,125078000.0,2570981,0.2585699916416141,2016-05-10,2016-03-31,0001140361-16-064175
PNC,PNC FINANCIAL SERVICES GROUP COMMON STOCK USD5,693475105,123714000.0,1449494,0.2557502354207027,2016-05-10,2016-03-31,0001140361-16-064175
N/A,VANTIV INCORPORATED CLASS A COMMON STOCK USD0.00001,92210H105,122997000.0,2283225,0.25426800286176315,2016-05-10,2016-03-31,0001140361-16-064175
VLO,VALERO ENERGY CORPORATION COMMON STOCK USD0.01,91913Y100,121906000.0,1905380,0.2520126113390253,2016-05-10,2016-03-31,0001140361-16-064175
N/A,APOLLO EDUCATION GROUP INCORPORATED CLASS A COMMON STOCK NPV,037604105,121296000.0,14937937,0.25075157666545056,2016-05-10,2016-03-31,0001140361-16-064175
MMM,3M COMPANY COMMON STOCK USD0.01,88579Y101,118694000.0,711809,0.24537254023816935,2016-05-10,2016-03-31,0001140361-16-064175
HD,HOME DEPOT INCORPORATED (THE) COMMON STOCK USD0.05,437076102,118208000.0,885987,0.2443678470392229,2016-05-10,2016-03-31,0001140361-16-064175
N/A,EXPRESS SCRIPTS HOLDING COMPANY COMMON STOCK USD0.01,30219G108,117582000.0,1702853,0.24307373604634128,2016-05-10,2016-03-31,0001140361-16-064175
YUM,YUM BRANDS INCORPORATED COMMON STOCK NPV,988498101,116521000.0,1416672,0.24088036262230383,2016-05-10,2016-03-31,0001140361-16-064175
SLB,SCHLUMBERGER LIMITED COMMON STOCK USD0.01,806857108,115665000.0,1554422,0.23911077953938578,2016-05-10,2016-03-31,0001140361-16-064175
JPM,JPMORGAN CHASE AND COMPANY COMMON STOCK USD1,46625H100,114651000.0,1920125,0.23701456780331231,2016-05-10,2016-03-31,0001140361-16-064175
N/A,CANADIAN PACIFIC RAILWAY LTD,13645T100,114308000.0,657885,0.2363054942081711,2016-05-10,2016-03-31,0001140361-16-064175
GE,GENERAL ELECTRIC COMPANY COMMON STOCK USD0.06,369604103,113091000.0,3552980,0.23378962667089162,2016-05-10,2016-03-31,0001140361-16-064175
CHKP,CHECK POINT SOFTWARE TECHNOLOGIES LIMITED ILS1,M22465104,113070000.0,1309593,0.23374621400180134,2016-05-10,2016-03-31,0001140361-16-064175
N/A,ENERSIS SA SPONSORED ADR (EACH REPRESENTS 50 COMMON SHARES NPV),29274F104,113032000.0,8178867,0.2336676577434475,2016-05-10,2016-03-31,0001140361-16-064175
MPC,MARATHON PETROLEUM CORPORATION COMMON STOCK NPV,56585A102,111981000.0,3061271,0.23149495701897688,2016-05-10,2016-03-31,0001140361-16-064175
N/A,AETNA INCORPORATED COMMON STOCK NPV,00817Y108,111659000.0,977833,0.23082929609292593,2016-05-10,2016-03-31,0001140361-16-064175
N/A,COACH INCORPORATED COMMON STOCK USD0.01,189754104,111087000.0,2755129,0.22964681767770498,2016-05-10,2016-03-31,0001140361-16-064175
ERJ,EMBRAER SA SPONSORED ADR (EACH REPRESENTS 4 SHARES),29082A107,110504000.0,4179431,0.2284415992929606,2016-05-10,2016-03-31,0001140361-16-064175
PEP,PEPSICO INCORPORATED CAPITAL STOCK USD0.016666,713448108,110472000.0,1075782,0.22837544665434686,2016-05-10,2016-03-31,0001140361-16-064175
CTSH,COGNIZANT TECHNOLOGY SOLUTIONS CORPORATION CLASS A COMMON STOCK USD0.01,192446102,109084000.0,1746743,0.22550607595447505,2016-05-10,2016-03-31,0001140361-16-064175
C,CITIGROUP INCORPORATED COMMON STOCK USD0.01,172967424,108738000.0,2596418,0.2247908005494638,2016-05-10,2016-03-31,0001140361-16-064175
DHR,DANAHER CORPORATION COMMON STOCK USD0.01,235851102,108431000.0,1141020,0.2241561486727631,2016-05-10,2016-03-31,0001140361-16-064175
ACN,ACCENTURE PLC CLASS A NEW COMMON STOCK USD0.0000225,G1151C101,106848000.0,926133,0.22088366033133872,2016-05-10,2016-03-31,0001140361-16-064175
META,FACEBOOK INCORPORATED CLASS A COMMON STOCK USD0.000006,30303M102,106216000.0,926032,0.219577145718717,2016-05-10,2016-03-31,0001140361-16-064175
N/A,MICHAEL KORS HOLDINGS LIMITED COMMON STOCK NPV,G60754101,105635000.0,1857487,0.21837606187388595,2016-05-10,2016-03-31,0001140361-16-064175
BBTUSD,BB&T CORPORATION COMMON STOCK USD5,054937107,105292000.0,3140240,0.21766698827874473,2016-05-10,2016-03-31,0001140361-16-064175
N/A,ST. JUDE MEDICAL INCORPORATED COMMON STOCK USD0.10,790849103,104405000.0,1896556,0.2158333198271696,2016-05-10,2016-03-31,0001140361-16-064175
IVV,ISHARES TRUST CORE S&P 500 ETF,464287200,103165000.0,498071,0.2132699050808865,2016-05-10,2016-03-31,0001140361-16-064175
DGX,QUEST DIAGNOSTICS INCORPORATED COMMON STOCK USD0.01,74834L100,103092000.0,1426679,0.21311899437404885,2016-05-10,2016-03-31,0001140361-16-064175
CMI,CUMMINS INCORPORATED COMMON STOCK USD2.50,231021106,102498000.0,937686,0.21189103601978093,2016-05-10,2016-03-31,0001140361-16-064175
TMO,THERMO FISHER SCIENTIFIC INCORPORATED COMMON STOCK USD1,883556102,101413000.0,720311,0.2096480481167832,2016-05-10,2016-03-31,0001140361-16-064175
PFE,PFIZER INCORPORATED COMMON STOCK USD0.05,717081103,101020000.0,3359505,0.208835611023808,2016-05-10,2016-03-31,0001140361-16-064175
SU,SUNCOR ENERGY INCORPORATED NEW COMMON NPV (CANADA LISTING),867224107,101008000.0,2833336,0.20881080378432784,2016-05-10,2016-03-31,0001140361-16-064175
AMGN,AMGEN INCORPORATED COMMON STOCK USD0.0001,031162100,100441000.0,671938,0.2076386617188903,2016-05-10,2016-03-31,0001140361-16-064175
OC,OWENS CORNING INCORPORATED COMMON STOCK USD0.01,690742101,100197000.0,2114759,0.2071342478494604,2016-05-10,2016-03-31,0001140361-16-064175
N/A,VWR CORPORATION COMMON STOCK USD0.01,91843L103,100018000.0,3732000,0.20676420652721467,2016-05-10,2016-03-31,0001140361-16-064175
GOOG,ALPHABET INCORPORATED-CL C NPV,02079K107,99318000.0,132330,0.20531711755753876,2016-05-10,2016-03-31,0001140361-16-064175
ITUB,ITAU UNIBANCO HOLDING SA ADR (EACH REPRESENTS 1 PREFERENCE SHARE),465562106,99070000.0,11258003,0.2048044346082821,2016-05-10,2016-03-31,0001140361-16-064175
7HP,HP INCORPORATED COMMON STOCK USD0.01,40434L105,97802000.0,7951352,0.20218313630321194,2016-05-10,2016-03-31,0001140361-16-064175
NEE,NEXTERA ENERGY INCORPORATED COMMON STOCK USD0.01,65339F101,97571000.0,823385,0.20170559694321888,2016-05-10,2016-03-31,0001140361-16-064175
POT1EUR,POTASH CORPORATION OF SASKATCHEWAN INCORPORATED COMMON NPV,73755L107,96457000.0,4271797,0.19940265821147743,2016-05-10,2016-03-31,0001140361-16-064175
BMY,BRISTOL-MYERS SQUIBB COMPANY COMMON STOCK USD0.10,110122108,95055000.0,1498338,0.19650434573221212,2016-05-10,2016-03-31,0001140361-16-064175
CTSH,COGNIZANT TECHNOLOGY SOLUTIONS CORPORATION CLASS A COMMON STOCK USD0.01,192446102,94793000.0,1517905,0.195962721003562,2016-05-10,2016-03-31,0001140361-16-064175
DIS,WALT DISNEY COMPANY (THE) COMMON STOCK USD0.01,254687106,94582000.0,956238,0.1955265270427025,2016-05-10,2016-03-31,0001140361-16-064175
ARMK,ARAMARK COMMON STOCK USD0.01,03852U106,94303000.0,2859400,0.1949497587247888,2016-05-10,2016-03-31,0001140361-16-064175
EBA,EBAY INCORPORATED COMMON STOCK USD0.001,278642103,94073000.0,3913175,0.1944742866347524,2016-05-10,2016-03-31,0001140361-16-064175
OMC,OMNICOM GROUP INC COMMON STOCK USD0.15,681919106,93726000.0,1124886,0.1937569439597845,2016-05-10,2016-03-31,0001140361-16-064175
CTLTEUR,CATALENT INCORPORATED COMMON STOCK USD0.01,148806102,93379000.0,3481681,0.19303960128481654,2016-05-10,2016-03-31,0001140361-16-064175
N/A,CHINA LODGING GROUP LIMITED SPONSORED ADS (EACH REPRESENTS 4 SHARES),16949N109,93186000.0,2471112,0.19264061818317732,2016-05-10,2016-03-31,0001140361-16-064175
TJX,TJX COS INCORPORATED COMMON STOCK USD1,872540109,92573000.0,1176574,0.19137338169973253,2016-05-10,2016-03-31,0001140361-16-064175
HDB,HDFC BANK LIMITED ADR (EACH REPRESENTING 3 ORDINARY),40415F101,91879000.0,1509685,0.18993869634979663,2016-05-10,2016-03-31,0001140361-16-064175
LMT,LOCKHEED MARTIN CORP COMMON STOCK USD0.01,539830109,91812000.0,411787,0.1898001892626991,2016-05-10,2016-03-31,0001140361-16-064175
MCD,MCDONALD'S CORPORATION COMMON STOCK USD0.01,580135101,91091000.0,723925,0.18830968762393285,2016-05-10,2016-03-31,0001140361-16-064175
ORCL,ORACLE CORPORATION COMMON STOCK USD0.01,68389X105,89698000.0,2189356,0.18542998057427768,2016-05-10,2016-03-31,0001140361-16-064175
TJX,TJX COS INCORPORATED COMMON STOCK USD1,872540109,89678000.0,1139784,0.1853886351751441,2016-05-10,2016-03-31,0001140361-16-064175
FMX,FOMENTO ECONOMICO MEXICANO ADR REPR. 10 UNITS (1'B'&2'D-B'&2'D-L')(CIT),344419106,89444000.0,925922,0.18490489400528098,2016-05-10,2016-03-31,0001140361-16-064175
AFL,AFLAC INCORPORATED COMMON STOCK USD0.10,001055102,89048000.0,1397270,0.1840862551024357,2016-05-10,2016-03-31,0001140361-16-064175
PVH,PVH CORPORATION COMMON STOCK USD1,693656100,88618000.0,895856,0.18319732902106334,2016-05-10,2016-03-31,0001140361-16-064175
SBUX,STARBUCKS CORPORATION COMMON STOCK USD0.001,855244109,88572000.0,1475950,0.18310223460305605,2016-05-10,2016-03-31,0001140361-16-064175
MDT,MEDTRONIC PLC USD0.10,G5960L103,88414000.0,1172295,0.1827756059499006,2016-05-10,2016-03-31,0001140361-16-064175
QCOM,QUALCOMM INCORPORATED COMMON STOCK USD0.0001,747525103,87716000.0,1720265,0.181332651520138,2016-05-10,2016-03-31,0001140361-16-064175
N/A,TARO PHARMACEUTICAL INDUSTRIES LIMITED ILS0.0001,M8737E108,87706000.0,617908,0.18131197882057123,2016-05-10,2016-03-31,0001140361-16-064175
XECEUR,CIMAREX ENERGY COMPANY COMMON STOCK USD0.01,171798101,87697000.0,908213,0.1812933733909611,2016-05-10,2016-03-31,0001140361-16-064175
BIDUN,BAIDU INCORPORATED SPONSORED ADR (EACH REPRESENTS 0.10 CLASS A SHARES),056752108,87566000.0,461139,0.18102256102663605,2016-05-10,2016-03-31,0001140361-16-064175
MDT,MEDTRONIC PLC USD0.10,G5960L103,87540000.0,1160699,0.18096881200776235,2016-05-10,2016-03-31,0001140361-16-064175
HON,HONEYWELL INTERNATIONAL INCORPORATED COMMON STOCK USD1,438516106,87496000.0,780030,0.18087785212966842,2016-05-10,2016-03-31,0001140361-16-064175
SON,SONOCO PRODUCTS COMPANY COMMON STOCK NPV,835495102,87097000.0,1788441,0.18005301141695312,2016-05-10,2016-03-31,0001140361-16-064175
CHRW,C.H. ROBINSON WORLDWIDE INCORPORATED COMMON STOCK USD0.10,12541W209,87023000.0,1167315,0.1799000334401588,2016-05-10,2016-03-31,0001140361-16-064175
AAPL,APPLE INCORPORATED COMMON STOCK NPV,037833100,86153000.0,786352,0.17810150857784726,2016-05-10,2016-03-31,0001140361-16-064175
WBA,WALGREENS BOOTS ALLIANCE INCORPORATED COMMON STOCK USD0.01,931427108,85201000.0,1018790,0.17613346757908796,2016-05-10,2016-03-31,0001140361-16-064175
RTN1USD,RAYTHEON COMPANY COMMON STOCK USD0.01,755111507,85069000.0,687373,0.1758605879448062,2016-05-10,2016-03-31,0001140361-16-064175
KHC,KRAFT HEINZ COMPANY (THE) COMMON STOCK USD0.01,500754106,85059000.0,1078056,0.17583991524523943,2016-05-10,2016-03-31,0001140361-16-064175
DFSEUR,DISCOVER FINANCIAL SERVICES COMMON STOCK USD0.01,254709108,84967000.0,1690543,0.17564972640922485,2016-05-10,2016-03-31,0001140361-16-064175
UNH,UNITEDHEALTH GROUP INCORPORATED COMMON STOCK USD0.01,91324P102,84939000.0,654989,0.17559184285043783,2016-05-10,2016-03-31,0001140361-16-064175
V,VISA INCORPORATED CLASS A COMMON STOCK USD0.0001,92826C839,84498000.0,1100523,0.17468017679954195,2016-05-10,2016-03-31,0001140361-16-064175
N/A,LINEAR TECHNOLOGY CORPORATION COMMON STOCK USD0.001,535678106,84447000.0,1885827,0.17457474603175127,2016-05-10,2016-03-31,0001140361-16-064175
TMO,THERMO FISHER SCIENTIFIC INCORPORATED COMMON STOCK USD1,883556102,83258000.0,591366,0.17211676205325882,2016-05-10,2016-03-31,0001140361-16-064175
KMB,KIMBERLY-CLARK CORPORATION COMMON STOCK USD1.25,494368103,82921000.0,611016,0.1714200920778577,2016-05-10,2016-03-31,0001140361-16-064175
JD,JD.COM INCORPORATED ADR (EACH REPRESENTING 2 SHARES),47215P106,82513000.0,3029111,0.17057664593553226,2016-05-10,2016-03-31,0001140361-16-064175
AWN,ADVANCE AUTO PARTS INCORPORATED COMMON STOCK USD0.0001,00751Y106,81371000.0,496800,0.16821582364500376,2016-05-10,2016-03-31,0001140361-16-064175
WU,WESTERN UNION COMPANY (THE) COMMON STOCK USD0.01,959802109,81323000.0,4207113,0.16811659468708315,2016-05-10,2016-03-31,0001140361-16-064175
EL,ESTEE LAUDER COMPANIES INC CLASS'A'COM STK USD0.01,518439104,80874000.0,856531,0.16718839047653386,2016-05-10,2016-03-31,0001140361-16-064175
PAYX,PAYCHEX INCORPORATED COMMON STOCK USD0.01,704326107,80769000.0,1515656,0.16697132713108245,2016-05-10,2016-03-31,0001140361-16-064175
KLIC,KULICKE AND SOFFA INDUSTRIES INCORPORATED COMMON STOCK NPV,501242101,80002000.0,7117659,0.16538573107430893,2016-05-10,2016-03-31,0001140361-16-064175
N/A,SBA COMMUNICATIONS CORPORATION COMMON STOCK USD0.01,78388J106,79483000.0,795151,0.16431281796679204,2016-05-10,2016-03-31,0001140361-16-064175
GILD,GILEAD SCIENCES INCORPORATED COMMON STOCK USD0.001,375558103,79138000.0,860481,0.16359960983173746,2016-05-10,2016-03-31,0001140361-16-064175
PFG,PRINCIPAL FINANCIAL GROUP COMMON STOCK USD0.01,74251V102,78830000.0,1982151,0.16296289068508002,2016-05-10,2016-03-31,0001140361-16-064175
BBD,BANCO BRADESCO SA SPONSORED ADR (EACH REPRESENTING 1 PREFERENCE SHARE NPV),059460303,78679000.0,10138984,0.16265073292162135,2016-05-10,2016-03-31,0001140361-16-064175
N/A,CA INCORPORATED COMMON STOCK USD0.10,12673P105,78370000.0,2537069,0.16201194650500725,2016-05-10,2016-03-31,0001140361-16-064175
GD,GENERAL DYNAMICS CORPORATION COMMON STOCK USD1,369550108,77755000.0,590260,0.16074057548164908,2016-05-10,2016-03-31,0001140361-16-064175
DFSEUR,DISCOVER FINANCIAL SERVICES COMMON STOCK USD0.01,254709108,77552000.0,1543023,0.16032091968044307,2016-05-10,2016-03-31,0001140361-16-064175
MO,ALTRIA GROUP INCORPORATED COMMON STOCK USD0.3333,02209S103,77490000.0,1238249,0.1601927489431289,2016-05-10,2016-03-31,0001140361-16-064175
HD,HOME DEPOT INCORPORATED (THE) COMMON STOCK USD0.05,437076102,75792000.0,568073,0.15668252455668638,2016-05-10,2016-03-31,0001140361-16-064175
BGCPEUR,BGC PARTNERS INCORPORATED CLASS 'A' COMMON STOCK USD0.01,05541T101,75012000.0,8270390,0.15507005399047602,2016-05-10,2016-03-31,0001140361-16-064175
CRM,SALESFORCE.COM INCORPORATED COMMON STOCK USD0.001,79466L302,74934000.0,1008532,0.15490880693385498,2016-05-10,2016-03-31,0001140361-16-064175
TXN,TEXAS INSTRUMENTS INCORPORATED COMMON STOCK USD1,882508104,74586000.0,1277817,0.15418939698893036,2016-05-10,2016-03-31,0001140361-16-064175
MSFT,MICROSOFT CORPORATION COMMON STOCK USD0.0000125,594918104,74538000.0,1353998,0.1540901680310097,2016-05-10,2016-03-31,0001140361-16-064175
N/A,NEW ORIENTAL EDUCATION & TECHNOLOGY GROUP INCORPORATED SPONSORED ADR (EACH REPRESENTS 1 ORDINARY SHARES),647581107,74479000.0,2075205,0.1539681991035656,2016-05-10,2016-03-31,0001140361-16-064175
GOOGL,ALPHABET INCORPORATED CL A NPV,02079K305,74161000.0,96521,0.15331080725734136,2016-05-10,2016-03-31,0001140361-16-064175
N/A,SINA CORPORATION COMMON STOCK USD0.133,G81477104,73487000.0,1549711,0.15191746730653907,2016-05-10,2016-03-31,0001140361-16-064175
N/A,ICL-ISRAEL CHEMICAL LIMITED ILS1,M5920A109,73336000.0,4444594,0.1516053095430804,2016-05-10,2016-03-31,0001140361-16-064175
N/A,INGERSOLL-RAND PLC COMMON STOCK USD1,G47791101,73318000.0,1181217,0.15156809868386018,2016-05-10,2016-03-31,0001140361-16-064175
XRAY,DENTSPLY INTERNATIONAL INCORPORATED COMMON STOCK USD 0.01,24906P109,72965000.0,1183924,0.15083835238915216,2016-05-10,2016-03-31,0001140361-16-064175
CLGX,CORELOGIC INCORPORATED COMMON STOCK USD1,21871D103,72817000.0,2121710,0.15053239643556354,2016-05-10,2016-03-31,0001140361-16-064175
MA,MASTERCARD INCORPORATED CLASS A COMMON STOCK USD0.0001,57636Q104,72641000.0,774346,0.15016855692318787,2016-05-10,2016-03-31,0001140361-16-064175
N/A,AMDOCS LIMITED ORDINARY 1P (US LISTING),G02602103,72082000.0,1199962,0.14901295301740378,2016-05-10,2016-03-31,0001140361-16-064175
DOV,DOVER CORPORATION COMMON STOCK USD1,260003108,72058000.0,1120127,0.14896333853844343,2016-05-10,2016-03-31,0001140361-16-064175
