ticker,nameOfIssuer,cusip,value,shares,allocation_percent,filingDate,reportDate,accessionNumber
INTC,INTEL CORPORATION COMMON STOCK USD0.001,458140100,999000.0,30531,0.0020652026867232645,2016-05-10,2016-03-31,0001140361-16-064175
CPRT,COPART INCORPORATED COMMON STOCK NPV,217204106,999000.0,24000,0.0020652026867232645,2016-05-10,2016-03-31,0001140361-16-064175
EEM,ISHARES TRUST MSCI EMERGING MARKETS ETF,464287234,989000.0,28840,0.002044529987156465,2016-05-10,2016-03-31,0001140361-16-064175
MTCHEUR,MATCH GROUP INC COMMON USD0.001000,57665R106,987000.0,90342,0.0020403954472431054,2016-05-10,2016-03-31,0001140361-16-064175
TTMCHF,TATA MOTORS LIMITED SPONSORED ADR (EACH REPRESENTS 5 ORDINARY INR2),876568502,977000.0,33667,0.002019722747676306,2016-05-10,2016-03-31,0001140361-16-064175
N/A,QUINTILES TRANSNATIONAL HOLDINGS INCORPORATED COMMON STOCK USD0.01,74876Y101,976000.0,15090,0.002017655477719626,2016-05-10,2016-03-31,0001140361-16-064175
ENTA,ENANTA PHARMACEUTICALS INCORPORATED COMMON STOCK USD0.01,29251M106,974000.0,34116,0.0020135209378062662,2016-05-10,2016-03-31,0001140361-16-064175
PEO,EXELON CORPORATION COMMON STOCK NPV,30161N101,974000.0,27500,0.0020135209378062662,2016-05-10,2016-03-31,0001140361-16-064175
AAXJ,ISHARES TRUST MSCI ALL COUNTRY ASIA EX-JAPAN ETF,464288182,972000.0,17730,0.0020093863978929063,2016-05-10,2016-03-31,0001140361-16-064175
N/A,GOLDCORP INCORPORATED COMMON NPV (CANADIAN LISTING),380956409,972000.0,45700,0.0020093863978929063,2016-05-10,2016-03-31,0001140361-16-064175
JECUSD,JACOBS ENGINEERING GROUP INCORPORATED COMMON STOCK USD1,469814107,969000.0,22145,0.0020031845880228664,2016-05-10,2016-03-31,0001140361-16-064175
ALB,ALBEMARLE CORPORATION COMMON STOCK USD0.01,012653101,968000.0,15131,0.0020011173180661864,2016-05-10,2016-03-31,0001140361-16-064175
SNA,SNAP-ON INCORPORATED COMMON STOCK USD1,833034101,967000.0,6100,0.0019990500481095064,2016-05-10,2016-03-31,0001140361-16-064175
IVZ,INVESCO LIMITED ORDINARY USD0.10,G491BT108,961000.0,30745,0.0019866464283694266,2016-05-10,2016-03-31,0001140361-16-064175
FFIV,F5 NETWORKS INCORPORATED COMMON STOCK NPV,315616102,960000.0,9100,0.0019845791584127467,2016-05-10,2016-03-31,0001140361-16-064175
XLNXEUR,XILINX INCORPORATED COMMON STOCK USD0.01,983919101,957000.0,20000,0.0019783773485427068,2016-05-10,2016-03-31,0001140361-16-064175
N/A,II-VI INCORPORATED COMMON STOCK NPV,902104108,953000.0,44300,0.001970108268715987,2016-05-10,2016-03-31,0001140361-16-064175
HRSEUR,HARRIS CORP COMMON STOCK USD1,413875105,945000.0,12000,0.0019535701090625476,2016-05-10,2016-03-31,0001140361-16-064175
N/A,ELDORADO GOLD CORPORATION LIMITED COMMON NPV,284902103,942000.0,231977,0.001947368299192508,2016-05-10,2016-03-31,0001140361-16-064175
DB,DEUTSCHE BANK AG NPV (REGISTERED),D18190898,939000.0,61976,0.001941166489322468,2016-05-10,2016-03-31,0001140361-16-064175
LNCOEUR,LINN CO LLC COMMON STOCK NPV,535782106,933000.0,2447800,0.0019287628695823884,2016-05-10,2016-03-31,0001140361-16-064175
MTD,METTLER-TOLEDO INTERNATIONAL COMMON STOCK USD0.01,592688105,921000.0,2683,0.0019039556301022288,2016-05-10,2016-03-31,0001140361-16-064175
ERFGBP,ENERPLUS CORPORATION COMMON NPV,292766102,918000.0,184270,0.0018977538202321893,2016-05-10,2016-03-31,0001140361-16-064175
VRE,MACK-CALI REALTY CORPORATION COMMON STOCK USD0.01,554489104,917000.0,39100,0.0018956865502755093,2016-05-10,2016-03-31,0001140361-16-064175
VRTX,VERTEX PHARMACEUTICALS INCORPORATED COMMON STOCK USD0.01,92532F100,908000.0,11577,0.0018770811206653899,2016-05-10,2016-03-31,0001140361-16-064175
KGC,KINROSS GOLD CORPORATION COMMON NPV (US LISTING),496902404,904000.0,262795,0.00186881204083867,2016-05-10,2016-03-31,0001140361-16-064175
DTE,DTE ENERGY COMPANY NPV,233331107,898000.0,9898,0.0018564084210985902,2016-05-10,2016-03-31,0001140361-16-064175
KNL,KNOLL INCORPORATED COMMON STOCK USD0.01,498904200,897000.0,41700,0.0018543411511419102,2016-05-10,2016-03-31,0001140361-16-064175
N/A,AGRIUM INCORPORATED COMMON NPV (CANADIAN LISTING),008916108,896000.0,7649,0.0018522738811852302,2016-05-10,2016-03-31,0001140361-16-064175
EVEUR,EATON VANCE CORPORATION COMMON STOCK USD0.00781,278265103,893000.0,26800,0.0018460720713151905,2016-05-10,2016-03-31,0001140361-16-064175
AMSF,AMERISAFE INCORPORATED COMMON STOCK USD0.01,03071H100,886000.0,16900,0.0018316011816184308,2016-05-10,2016-03-31,0001140361-16-064175
N/A,BROOKFIELD ASSET MANAGEMENT INCORPORATED VOTING CLASS 'A' NPV,112585104,884000.0,19533,0.0018274666417050708,2016-05-10,2016-03-31,0001140361-16-064175
MA,MASTERCARD INCORPORATED CLASS A COMMON STOCK USD0.0001,57636Q104,875000.0,9332,0.0018088612120949516,2016-05-10,2016-03-31,0001140361-16-064175
WHG,WESTWOOD HOLDINGS GROUP INCORPORATED COMMON STOCK USD0.01,961765104,870000.0,14800,0.001798524862311552,2016-05-10,2016-03-31,0001140361-16-064175
N/A,SIBANYE GOLD LIMITED SPONSORED ADR (EACH REPRESENT 4 ORDINARY),825724206,865000.0,55995,0.001788188512528152,2016-05-10,2016-03-31,0001140361-16-064175
BMY,BRISTOL-MYERS SQUIBB COMPANY COMMON STOCK USD0.10,110122108,862000.0,13590,0.0017819867026581122,2016-05-10,2016-03-31,0001140361-16-064175
HTH,HILLTOP HOLDINGS INCORPORATED COMMON STOCK USD0.01,432748101,858000.0,45536,0.0017737176228313923,2016-05-10,2016-03-31,0001140361-16-064175
IOSP,INNOSPEC INCORPORATED COMMON STOCK USD0.01,45768S105,857000.0,19500,0.0017716503528747124,2016-05-10,2016-03-31,0001140361-16-064175
GBCI,GLACIER BANCORP INCORPORATED COMMON STOCK USD0.01,37637Q105,855000.0,33500,0.0017675158129613526,2016-05-10,2016-03-31,0001140361-16-064175
RMAX,RE/MAX HOLDINGS INCORPORATED CLASS A COMMON STOCK USD0.0001,75524W108,853000.0,24301,0.0017633812730479927,2016-05-10,2016-03-31,0001140361-16-064175
XRAY,DENTSPLY INTERNATIONAL INCORPORATED COMMON STOCK USD 0.01,24906P109,850000.0,13800,0.0017571794631779528,2016-05-10,2016-03-31,0001140361-16-064175
PDLIEUR,PDL BIOPHARMA INCORPORATED COMMON STOCK USD0.01,69329Y104,846000.0,266935,0.0017489103833512334,2016-05-10,2016-03-31,0001140361-16-064175
AAPL,APPLE INCORPORATED COMMON STOCK NPV,037833100,843000.0,7693,0.0017427085734811935,2016-05-10,2016-03-31,0001140361-16-064175
CNI,CANADIAN NATIONAL RAILWAY COMMON STOCK NPV,136375102,837000.0,10300,0.0017303049537411136,2016-05-10,2016-03-31,0001140361-16-064175
ILMN,ILLUMINA INCORPORATED COMMON STOCK USD0.01,452327109,831000.0,5280,0.001717901334001034,2016-05-10,2016-03-31,0001140361-16-064175
MET,METLIFE INCORPORATED COMMON STOCK USD0.01,59156R108,829000.0,18539,0.0017137667940876741,2016-05-10,2016-03-31,0001140361-16-064175
TD,TORONTO-DOMINION BANK (THE) COMMON NPV,891160509,828000.0,14723,0.0017116995241309942,2016-05-10,2016-03-31,0001140361-16-064175
PKG,PACKAGING CORPORATION OF AMERICA COMMON STOCK USD0.01,695156109,809000.0,13605,0.0016724213949540754,2016-05-10,2016-03-31,0001140361-16-064175
N/A,LINKEDIN CORPORATION CLASS A COMMON STOCK USD 0.0001,53578A108,809000.0,7107,0.0016724213949540754,2016-05-10,2016-03-31,0001140361-16-064175
HPTUSD,HOSPITALITY PROPERTIES TRUST REIT USD0.01,44106M102,807000.0,30700,0.0016682868550407155,2016-05-10,2016-03-31,0001140361-16-064175
N/A,PRIMERO MINING CORPORATION COMMON NPV,74164W106,801000.0,337800,0.0016558832353006357,2016-05-10,2016-03-31,0001140361-16-064175
T,AT AND T INCORPORATED COMMON STOCK USD1,00206R102,801000.0,20357,0.0016558832353006357,2016-05-10,2016-03-31,0001140361-16-064175
MFIN,MEDALLION FINANCIAL CORPORATION COMMON STOCK USD0.01,583928106,791000.0,84505,0.0016352105357338362,2016-05-10,2016-03-31,0001140361-16-064175
TMUS,T-MOBILE US INCORPORATED COMMON STOCK USD0.0001,872590104,791000.0,20568,0.0016352105357338362,2016-05-10,2016-03-31,0001140361-16-064175
DB,DEUTSCHE BANK AG NPV (REGISTERED),D18190898,789000.0,52065,0.0016310759958204763,2016-05-10,2016-03-31,0001140361-16-064175
PNW,PINNACLE WEST CAPITAL CORPORATION COMMON STOCK USD2.50,723484101,785000.0,10504,0.0016228069159937564,2016-05-10,2016-03-31,0001140361-16-064175
AMGN,AMGEN INCORPORATED COMMON STOCK USD0.0001,031162100,785000.0,5254,0.0016228069159937564,2016-05-10,2016-03-31,0001140361-16-064175
N/A,NUTRISYSTEM INCORPORATED COMMON STOCK USD0.001,67069D108,778000.0,38459,0.001608336026296997,2016-05-10,2016-03-31,0001140361-16-064175
FLR,FLUOR CORPORATION COMMON STOCK USD0.01,343412102,772000.0,14200,0.0015959324065569172,2016-05-10,2016-03-31,0001140361-16-064175
GS,GOLDMAN SACHS GROUP INCORPORATED COMMON STOCK USD0.01,38141G104,768000.0,4905,0.0015876633267301976,2016-05-10,2016-03-31,0001140361-16-064175
SOHUN,SOHU.COM INCORPORATED COMMON STOCK USD0.001,83408W103,762000.0,15400,0.0015752597069901178,2016-05-10,2016-03-31,0001140361-16-064175
EL,ESTEE LAUDER COMPANIES INC CLASS'A'COM STK USD0.01,518439104,756000.0,8006,0.001562856087250038,2016-05-10,2016-03-31,0001140361-16-064175
TJX,TJX COS INCORPORATED COMMON STOCK USD1,872540109,751000.0,9546,0.0015525197374666384,2016-05-10,2016-03-31,0001140361-16-064175
SNH1EUR,SENIOR HOUSING PROPERTIES TRUST REIT USD0.01,81721M109,749000.0,42700,0.0015483851975532784,2016-05-10,2016-03-31,0001140361-16-064175
HEI,HEICO CORPORATION COMMON STOCK USD0.01,422806109,744000.0,12300,0.001538048847769879,2016-05-10,2016-03-31,0001140361-16-064175
NSC,NORFOLK SOUTHERN CORP COMMON STOCK USD1,655844108,742000.0,8754,0.001533914307856519,2016-05-10,2016-03-31,0001140361-16-064175
OGE,OGE ENERGY CORPORATION COMMON STOCK USD0.01,670837103,740000.0,25869,0.0015297797679431591,2016-05-10,2016-03-31,0001140361-16-064175
NWL,NEWELL RUBBERMAID INC,651229106,739000.0,16651,0.0015277124979864792,2016-05-10,2016-03-31,0001140361-16-064175
SHW,SHERWIN-WILLIAMS COMPANY (THE) COMMON STOCK USD1,824348106,737000.0,2590,0.001523577958073119,2016-05-10,2016-03-31,0001140361-16-064175
EZU,ISHARES TRUST MSCI EUROZONE ETF,464286608,734000.0,21060,0.0015173761482030793,2016-05-10,2016-03-31,0001140361-16-064175
KHC,KRAFT HEINZ COMPANY (THE) COMMON STOCK USD0.01,500754106,733000.0,9285,0.0015153088782463994,2016-05-10,2016-03-31,0001140361-16-064175
HPE,HEWLETT PACKARD ENTERPRISE COMMON STOCK USD0.01,42824C109,732000.0,40900,0.0015132416082897194,2016-05-10,2016-03-31,0001140361-16-064175
BFRUSD,BBVA BANCO FRANCES SA,07329M100,729000.0,36073,0.0015070397984196797,2016-05-10,2016-03-31,0001140361-16-064175
CTCMEUR,CTC MEDIA INCORPORATED COMMON STOCK NPV,12642X106,728000.0,371518,0.0015049725284629997,2016-05-10,2016-03-31,0001140361-16-064175
META,FACEBOOK INCORPORATED CLASS A COMMON STOCK USD0.000006,30303M102,723000.0,6306,0.0014946361786796,2016-05-10,2016-03-31,0001140361-16-064175
N/A,REGULUS THERAPEUTICS INCORPORATED COMMON STOCK USD0.001,75915K101,720000.0,109987,0.00148843436880956,2016-05-10,2016-03-31,0001140361-16-064175
ORLY,O'REILLY AUTOMOTIVE INCORPORATED COMMON STOCK USD0.01,67103H107,716000.0,2590,0.0014801652889828403,2016-05-10,2016-03-31,0001140361-16-064175
WY,WEYERHAEUSER COMPANY REIT USD1.25,962166104,714000.0,23000,0.0014760307490694804,2016-05-10,2016-03-31,0001140361-16-064175
NHI,NATIONAL HEALTH INVESTORS INCORPORATED REIT USD0.01,63633D104,707000.0,10800,0.0014615598593727209,2016-05-10,2016-03-31,0001140361-16-064175
VSH,VISHAY INTERTECHNOLOGY INCORPORATED COMMON STOCK USD0.10,928298108,702000.0,57500,0.001451223509589321,2016-05-10,2016-03-31,0001140361-16-064175
TECD1USD,TECH DATA CORPORATION COMMON STOCK USD0.0015,878237106,692000.0,9000,0.0014305508100225218,2016-05-10,2016-03-31,0001140361-16-064175
PAM,PAMPA ENERGIA SA SPONSORED ADR (EACH REPRESENTS 25 ORDINARY SHARES ARS1),697660207,687000.0,33210,0.001420214460239122,2016-05-10,2016-03-31,0001140361-16-064175
SRE,SEMPRA ENERGY CORPORATION COMMON STOCK NPV,816851109,673000.0,6500,0.0013912726808456026,2016-05-10,2016-03-31,0001140361-16-064175
SS1A,SCHNITZER STEEL INDUSTRIES INCORPORATED CLASS 'A' COMMON STOCK USD1,806882106,672000.0,35129,0.0013892054108889228,2016-05-10,2016-03-31,0001140361-16-064175
CTSH,COGNIZANT TECHNOLOGY SOLUTIONS CORPORATION CLASS A COMMON STOCK USD0.01,192446102,672000.0,10767,0.0013892054108889228,2016-05-10,2016-03-31,0001140361-16-064175
DCI,DONALDSON COMPANY INC COMMON STOCK USD5,257651109,667000.0,20800,0.001378869061105523,2016-05-10,2016-03-31,0001140361-16-064175
NTGR,NETGEAR INCORPORATED COMMON STOCK USD0.001,64111Q104,667000.0,16400,0.001378869061105523,2016-05-10,2016-03-31,0001140361-16-064175
GGB,GERDAU SA ADR (EACH REPRESENTS 1 PREFERENCE NPV),373737105,664000.0,364754,0.0013726672512354833,2016-05-10,2016-03-31,0001140361-16-064175
UTMD,UTAH MEDICAL PRODUCTS INCORPORATED COMMON STOCK USD0.01,917488108,661000.0,10600,0.0013664654413654434,2016-05-10,2016-03-31,0001140361-16-064175
FENGEUR,PHOENIX NEW MEDIA LIMITED ADR (EACH REPRESENTS 8 CLASS A ORDINARY SHARES),71910C103,650000.0,143500,0.001343725471841964,2016-05-10,2016-03-31,0001140361-16-064175
GILD,GILEAD SCIENCES INCORPORATED COMMON STOCK USD0.001,375558103,648000.0,7044,0.0013395909319286043,2016-05-10,2016-03-31,0001140361-16-064175
N/A,PIER 1 IMPORTS INCORPORATED COMMON STOCK USD0.001,720279108,647000.0,93902,0.0013375236619719243,2016-05-10,2016-03-31,0001140361-16-064175
MOV,MOVADO GROUP INCORPORATED COMMON STOCK USD0.01,624580106,646000.0,21300,0.0013354563920152443,2016-05-10,2016-03-31,0001140361-16-064175
PBR,PETROLEO BRASILEIRO - PETROBRAS ADS (EACH REPRESENTING 2 COMMON SHARES),71654V408,642000.0,109600,0.0013271873121885245,2016-05-10,2016-03-31,0001140361-16-064175
UNM,UNUM GROUP COMMON STOCK USD0.10,91529Y106,641000.0,20500,0.0013251200422318445,2016-05-10,2016-03-31,0001140361-16-064175
N/A,STERIS PUBLIC LIMITED COMPANY NPV,G84720104,635000.0,8850,0.0013127164224917647,2016-05-10,2016-03-31,0001140361-16-064175
URBN,URBAN OUTFITTERS INC,917047102,631000.0,19100,0.001304447342665045,2016-05-10,2016-03-31,0001140361-16-064175
MUR,MURPHY OIL CORPORATION COMMON STOCK USD1,626717102,628000.0,25700,0.0012982455327950053,2016-05-10,2016-03-31,0001140361-16-064175
CSCO,CISCO SYSTEMS INCORPORATED USD0.001 (US LISTING),17275R102,625000.0,21978,0.0012920437229249654,2016-05-10,2016-03-31,0001140361-16-064175
PBR/A,PETROL BRASILEIRO-PETROBRAS SA SPONSORED ADR (EACH REPRESENTS 2 PREFERENCE SHARE NPV),71654V101,621000.0,134700,0.0012837746430982456,2016-05-10,2016-03-31,0001140361-16-064175
FAST,FASTENAL COMPANY USD 0.01,311900104,621000.0,12700,0.0012837746430982456,2016-05-10,2016-03-31,0001140361-16-064175
AWM,SKYWORKS SOLUTIONS INCORPORATED COMMON STOCK USD0.25,83088M102,620000.0,7958,0.0012817073731415656,2016-05-10,2016-03-31,0001140361-16-064175
EIX,EDISON INTERNATIONAL COMMON STOCK NPV,281020107,616000.0,8609,0.0012734382933148457,2016-05-10,2016-03-31,0001140361-16-064175
N/A,FEDERATED NATIONAL HOLDING COMPANY COMMON STOCK USD0.01,31422T101,612000.0,30700,0.001265169213488126,2016-05-10,2016-03-31,0001140361-16-064175
HDB,HDFC BANK LIMITED ADR (EACH REPRESENTING 3 ORDINARY),40415F101,611000.0,10033,0.001263101943531446,2016-05-10,2016-03-31,0001140361-16-064175
MDLZ,MONDELEZ INTERNATIONAL INCORPORATED COMMON STOCK USD0.01,609207105,610000.0,15081,0.0012610346735747663,2016-05-10,2016-03-31,0001140361-16-064175
ED,CONSOLIDATED EDISON INCORPORATED COMMON STOCK USD0.10,209115104,609000.0,7967,0.0012589674036180864,2016-05-10,2016-03-31,0001140361-16-064175
N/A,ENSCO PLC CLASS A COMMON STOCK USD0.10,G3157S106,607000.0,59586,0.0012548328637047264,2016-05-10,2016-03-31,0001140361-16-064175
XLI,INDUSTRIAL SELECT SECTOR SPDR FUND,81369Y704,607000.0,10900,0.0012548328637047264,2016-05-10,2016-03-31,0001140361-16-064175
ABT,ABBOTT LABORATORIES COMMON STOCK NPV,002824100,605000.0,14533,0.0012506983237913665,2016-05-10,2016-03-31,0001140361-16-064175
PPG,PPG INDUSTRIES INC COMMON STOCK USD1.666,693506107,605000.0,5410,0.0012506983237913665,2016-05-10,2016-03-31,0001140361-16-064175
PDCOEUR,PATTERSON COMPANIES INCORPORATED COMMON STOCK USD0.01,703395103,605000.0,13064,0.0012506983237913665,2016-05-10,2016-03-31,0001140361-16-064175
FIZZ,NATIONAL BEVERAGE CORPORATION COMMON STOCK USD0.01,635017106,600000.0,14081,0.0012403619740079667,2016-05-10,2016-03-31,0001140361-16-064175
N/A,REYNOLDS AMERICAN INCORPORATED COMMON STOCK USD0.0001,761713106,596000.0,11800,0.001232092894181247,2016-05-10,2016-03-31,0001140361-16-064175
DDS,DILLARDS INCORPORATED CLASS A COMMON STOCK NPV,254067101,592000.0,7000,0.0012238238143545271,2016-05-10,2016-03-31,0001140361-16-064175
MAS,MASCO CORPORATION COMMON STOCK USD1,574599106,592000.0,18742,0.0012238238143545271,2016-05-10,2016-03-31,0001140361-16-064175
UGP,ULTRAPAR PARTICIPACOES SA SPONSORED ADR (EACH REPRESENTS 1 ORDINARY SHARE),90400P101,591000.0,30140,0.0012217565443978472,2016-05-10,2016-03-31,0001140361-16-064175
PEG,PUBLIC SERVICE ENTERPRISE GROUP INCORPORATED COMMON STOCK NPV,744573106,587000.0,12610,0.0012134874645711275,2016-05-10,2016-03-31,0001140361-16-064175
N/A,KKR AND COMPANY LP COMMON STOCK NPV,48248M102,583000.0,40214,0.0012052183847444076,2016-05-10,2016-03-31,0001140361-16-064175
SO,SOUTHERN COMPANY (THE) COMMON STOCK USD5,842587107,579000.0,11300,0.001196949304917688,2016-05-10,2016-03-31,0001140361-16-064175
BAC,VERIZON COMMUNICATIONS INCORPORATED CDI COMMON STOCK USD0.10 (LONDON LISTING),92343V104,578000.0,10693,0.001194882034961008,2016-05-10,2016-03-31,0001140361-16-064175
FOSL,FOSSIL GROUP INCORPORATED COMMON STOCK USD0.01,34988V106,568000.0,12900,0.0011742093353942086,2016-05-10,2016-03-31,0001140361-16-064175
N/A,QUALITY SYSTEMS INCORPORATED COMMON STOCK USD0.01,747582104,562000.0,36900,0.001161805715654129,2016-05-10,2016-03-31,0001140361-16-064175
N/A,FBR AND COMPANY COMMON STOCK USD0.001,30247C400,559000.0,30800,0.001155603905784089,2016-05-10,2016-03-31,0001140361-16-064175
OXY,OCCIDENTAL PETROLEUM CORP COMMON STOCK USD0.20,674599105,559000.0,8145,0.001155603905784089,2016-05-10,2016-03-31,0001140361-16-064175
N/A,TWENTY FIRST CENTURY FOX INCORPORATED CLASS A COMMON STOCK USD0.01,90130A101,558000.0,20000,0.001153536635827409,2016-05-10,2016-03-31,0001140361-16-064175
PRI,PRIMERICA INCORPORATED COMMON STOCK USD0.01,74164M108,558000.0,12300,0.001153536635827409,2016-05-10,2016-03-31,0001140361-16-064175
DFSEUR,DISCOVER FINANCIAL SERVICES COMMON STOCK USD0.01,254709108,557000.0,11077,0.0011514693658707291,2016-05-10,2016-03-31,0001140361-16-064175
N/A,DR PEPPER SNAPPLE GROUP INCORPORATED COMMON STOCK USD0.01,26138E109,553000.0,6144,0.0011432002860440093,2016-05-10,2016-03-31,0001140361-16-064175
N/A,PRIMERO MINING CORPORATION COMMON NPV,74164W106,552000.0,232882,0.0011411330160873293,2016-05-10,2016-03-31,0001140361-16-064175
ANATUSD,AMERICAN NATIONAL INSURANCE COMPANY COMMON STOCK USD1,028591105,549000.0,4721,0.0011349312062172896,2016-05-10,2016-03-31,0001140361-16-064175
FHI,FEDERATED INVESTORS INCORPORATED CLASS 'B' COMMON STOCK NPV,314211103,541000.0,18700,0.00111839304656385,2016-05-10,2016-03-31,0001140361-16-064175
DNREUR,DENBURY RESOURCES INCORPORATED COMMON STOCK USD0.001,247916208,541000.0,249100,0.00111839304656385,2016-05-10,2016-03-31,0001140361-16-064175
GOOGL,ALPHABET INCORPORATED CL A NPV,02079K305,538000.0,700,0.0011121912366938102,2016-05-10,2016-03-31,0001140361-16-064175
UVV,UNIVERSAL CORPORATION COMMON STOCK NPV,913456109,538000.0,9400,0.0011121912366938102,2016-05-10,2016-03-31,0001140361-16-064175
N/A,RPX CORPORATION COMMON STOCK USD0.0001,74972G103,535000.0,48000,0.0011059894268237703,2016-05-10,2016-03-31,0001140361-16-064175
PCG,PG & E CORPORATION COMMON STOCK USD5,69331C108,532000.0,8955,0.0010997876169537306,2016-05-10,2016-03-31,0001140361-16-064175
CUCA,AVIS BUDGET GROUP INCORPORATED COMMON STOCK USD0.01,053774105,527000.0,20000,0.001089451267170331,2016-05-10,2016-03-31,0001140361-16-064175
ACIC,UNITED INSURANCE HOLDINGS CORPORATION COMMON STOCK USD0.0001,910710102,524000.0,27471,0.001083249457300291,2016-05-10,2016-03-31,0001140361-16-064175
IPHSEUR,INNOPHOS HOLDINGS INCORPORATED COMMON STOCK USD0.001,45774N108,524000.0,17166,0.001083249457300291,2016-05-10,2016-03-31,0001140361-16-064175
XECEUR,CIMAREX ENERGY COMPANY COMMON STOCK USD0.01,171798101,523000.0,5419,0.001081182187343611,2016-05-10,2016-03-31,0001140361-16-064175
PPC,PILGRIM'S PRIDE CORPORATION COMMON STOCK USD0.01,72147K108,517000.0,20400,0.0010687785676035313,2016-05-10,2016-03-31,0001140361-16-064175
N/A,CANADIAN PACIFIC RAILWAY LTD,13645T100,516000.0,2972,0.0010667112976468513,2016-05-10,2016-03-31,0001140361-16-064175
N/A,DOW CHEMICAL COMPANY (THE) COMMON STOCK USD2.50,260543103,516000.0,10030,0.0010667112976468513,2016-05-10,2016-03-31,0001140361-16-064175
CFG,CITIZENS FINANCIAL GROUP INCORPORATED COMMON STOCK USD0.01,174610105,513000.0,24136,0.0010605094877768114,2016-05-10,2016-03-31,0001140361-16-064175
EBF,ENNIS INCORPORATED COMMON STOCK USD2.50,293389102,510000.0,25600,0.0010543076779067717,2016-05-10,2016-03-31,0001140361-16-064175
LIVN,LIVANOVA PLC ORDINARY  GBP1,G5509L101,509000.0,9400,0.001052240407950092,2016-05-10,2016-03-31,0001140361-16-064175
ORCL,ORACLE CORPORATION COMMON STOCK USD0.01,68389X105,508000.0,12388,0.001050173137993412,2016-05-10,2016-03-31,0001140361-16-064175
NI,NISOURCE INC,65473P105,508000.0,21725,0.001050173137993412,2016-05-10,2016-03-31,0001140361-16-064175
EPR,EPR PROPERTIES REIT USD0.01,26884U109,503000.0,7600,0.0010398367882100122,2016-05-10,2016-03-31,0001140361-16-064175
PEP,PEPSICO INCORPORATED CAPITAL STOCK USD0.016666,713448108,501000.0,4882,0.0010357022482966522,2016-05-10,2016-03-31,0001140361-16-064175
SXI,STANDEX INTERNATIONAL CORPORATION COMMON STOCK USD1.50,854231107,495000.0,6400,0.0010232986285565724,2016-05-10,2016-03-31,0001140361-16-064175
ESS,ESSEX PROPERTY TRUST INCORPORATED REIT NPV,297178105,494000.0,2125,0.0010212313585998925,2016-05-10,2016-03-31,0001140361-16-064175
N/A,DONNELLEY (R.R.) & SONS COMPANY COMMON STOCK USD1.25,257867101,489000.0,29800,0.001010895008816493,2016-05-10,2016-03-31,0001140361-16-064175
COST,COSTCO WHOLESALE CORPORATION COMMON STOCK USD0.01,22160K105,489000.0,3105,0.001010895008816493,2016-05-10,2016-03-31,0001140361-16-064175
CM,CANADIAN IMPERIAL BANK OF COMMERCE COMMON NPV,136069101,489000.0,5000,0.001010895008816493,2016-05-10,2016-03-31,0001140361-16-064175
N/A,MAIDEN HOLDINGS LIMITED COMMON STOCK USD0.01,G5753U112,487000.0,37495,0.0010067604689031331,2016-05-10,2016-03-31,0001140361-16-064175
CR1USD,CRANE COMPANY COMMON STOCK USD1,224399105,483000.0,8900,0.0009984913890764132,2016-05-10,2016-03-31,0001140361-16-064175
JNP,JUNIPER NETWORKS INCORPORATED COMMON STOCK USD0.00001,48203R104,482000.0,18900,0.0009964241191197333,2016-05-10,2016-03-31,0001140361-16-064175
N/A,POLYCOM INCORPORATED COMMON STOCK NPV,73172K104,477000.0,42700,0.0009860877693363334,2016-05-10,2016-03-31,0001140361-16-064175
SLG2EUR,SL GREEN REALTY CORPORATION REIT USD0.01,78440X101,474000.0,4944,0.0009798859594662937,2016-05-10,2016-03-31,0001140361-16-064175
SBUX,STARBUCKS CORPORATION COMMON STOCK USD0.001,855244109,472000.0,7859,0.0009757514195529339,2016-05-10,2016-03-31,0001140361-16-064175
G,GENPACT LIMITED COMMON STOCK USD0.01,G3922B107,468000.0,17300,0.000967482339726214,2016-05-10,2016-03-31,0001140361-16-064175
ZUMZ,ZUMIEZ INCORPORATED COMMON STOCK NPV,989817101,464000.0,23100,0.0009592132598994943,2016-05-10,2016-03-31,0001140361-16-064175
RUTHUSD,RUTHS HOSPITALITY GROUP INCORPORATED COMMON STOCK USD0.01,783332109,462000.0,25034,0.0009550787199861343,2016-05-10,2016-03-31,0001140361-16-064175
NDAQ,NASDAQ INCORPORATED COMMON STOCK USD0.01,631103108,462000.0,7089,0.0009550787199861343,2016-05-10,2016-03-31,0001140361-16-064175
JBLU,JETBLUE AIRWAYS CORPORATION COMMON STOCK USD0.01,477143101,458000.0,21500,0.0009468096401594147,2016-05-10,2016-03-31,0001140361-16-064175
WWW,WOLVERINE WORLD WIDE INCORPORATED COMMON STOCK USD1,978097103,458000.0,25125,0.0009468096401594147,2016-05-10,2016-03-31,0001140361-16-064175
CACC,CREDIT ACCEPTANCE CORPORATION COMMON STOCK USD0.01,225310101,455000.0,2500,0.0009406078302893748,2016-05-10,2016-03-31,0001140361-16-064175
SHV,ISHARES SHORT TREASURY BOND NPV ETF,464288679,452000.0,4098,0.000934406020419335,2016-05-10,2016-03-31,0001140361-16-064175
IDCC,INTERDIGITAL INCORPORATED COMMON STOCK USD0.01,45867G101,450000.0,8200,0.000930271480505975,2016-05-10,2016-03-31,0001140361-16-064175
N/A,NOBLE CORPORATION PLC COMMON STOCK CHF3.15,G65431101,450000.0,44900,0.000930271480505975,2016-05-10,2016-03-31,0001140361-16-064175
PII,POLARIS INDUSTRIES INCORPORATED COMMON STOCK USD0.01,731068102,447000.0,4600,0.0009240696706359353,2016-05-10,2016-03-31,0001140361-16-064175
CL,COLGATE-PALMOLIVE COMPANY COMMON STOCK USD1,194162103,441000.0,6238,0.0009116660508958557,2016-05-10,2016-03-31,0001140361-16-064175
VEDL,VEDANTA LIMITED ADR(EACH REPRESENTS 4 ORDINARY SHARES),92242Y100,440000.0,78100,0.0009095987809391757,2016-05-10,2016-03-31,0001140361-16-064175
CE,CELANESE CORPORATION CLASS A COMMON STOCK USD0.0001 (US LISTING),150870103,440000.0,6657,0.0009095987809391757,2016-05-10,2016-03-31,0001140361-16-064175
SF9,SANDERSON FARMS INCORPORATED COMMON STOCK USD1,800013104,434000.0,4800,0.000897195161199096,2016-05-10,2016-03-31,0001140361-16-064175
N/A,ALLIED WORLD ASSURANCE HOLDINGS LIMITED AG COMMON STOCK USD0.03,H01531104,433000.0,12200,0.000895127891242416,2016-05-10,2016-03-31,0001140361-16-064175
DVY,ISHARES TRUST SELECT DIVIDEND ETF,464287168,433000.0,5310,0.000895127891242416,2016-05-10,2016-03-31,0001140361-16-064175
BRSSUSD,GLOBAL BRASS AND COPPER HOLDINGS INCORPORATED COMMON STOCK USD0.01,37953G103,431000.0,17100,0.0008909933513290561,2016-05-10,2016-03-31,0001140361-16-064175
ADBE,ADOBE SYSTEMS INCORPORATED NPV,00724F101,431000.0,4600,0.0008909933513290561,2016-05-10,2016-03-31,0001140361-16-064175
DKS,DICK'S SPORTING GOODS INCORPORATED COMMON STOCK USD0.001,253393102,428000.0,9100,0.0008847915414590162,2016-05-10,2016-03-31,0001140361-16-064175
BRK/A,BERKSHIRE HATHAWAY INCORPORATED CONVERTIBLE CLASS 'A' COMMON STOCK USD5,084670108,428000.0,2,0.0008847915414590162,2016-05-10,2016-03-31,0001140361-16-064175
