ticker,nameOfIssuer,cusip,value,shares,allocation_percent,filingDate,reportDate,accessionNumber
AELUSD,AMERICAN EQUITY INVESTMENT LIFE HOLDING COMPANY COMMON STOCK USD1,025676206,21860000.0,1306628,0.045190521253023586,2016-05-10,2016-03-31,0001140361-16-064175
EFX,EQUIFAX INC COMMON STOCK USD2.50,294429105,21812000.0,191500,0.04509129229510295,2016-05-10,2016-03-31,0001140361-16-064175
CTSH,COGNIZANT TECHNOLOGY SOLUTIONS CORPORATION CLASS A COMMON STOCK USD0.01,192446102,21719000.0,347776,0.04489903618913172,2016-05-10,2016-03-31,0001140361-16-064175
HB6,HIBBETT SPORTS INCORPORATED COMMON STOCK USD0.01,428567101,21700000.0,603441,0.0448597580599548,2016-05-10,2016-03-31,0001140361-16-064175
CHT,CHUNGHWA TELECOM COMPANY LIMITED ADR (EACH REPRESENTS 10 ORDINARY TWD10),17133Q502,21671000.0,633296,0.04479980723121108,2016-05-10,2016-03-31,0001140361-16-064175
NOC,NORTHROP GRUMMAN CORPORATION COMMON STOCK USD1,666807102,21503000.0,108202,0.04445250587848885,2016-05-10,2016-03-31,0001140361-16-064175
N/A,VALIDUS HOLDINGS LIMITED USD0.175,G9319H102,21485000.0,453182,0.04441529501926861,2016-05-10,2016-03-31,0001140361-16-064175
LOW,LOWE'S COMPANIES INCORPORATED COMMON STOCK USD0.50,548661107,21468000.0,282397,0.04438015143000505,2016-05-10,2016-03-31,0001140361-16-064175
BMY,BRISTOL-MYERS SQUIBB COMPANY COMMON STOCK USD0.10,110122108,21446000.0,338048,0.04433467149095809,2016-05-10,2016-03-31,0001140361-16-064175
GILD,GILEAD SCIENCES INCORPORATED COMMON STOCK USD0.001,375558103,21438000.0,233097,0.04431813333130465,2016-05-10,2016-03-31,0001140361-16-064175
DIS,WALT DISNEY COMPANY (THE) COMMON STOCK USD0.01,254687106,21369000.0,216048,0.04417549170429373,2016-05-10,2016-03-31,0001140361-16-064175
KSS,KOHLS CORPORATION COMMON STOCK USD0.01,500255104,21344000.0,463503,0.044123809955376736,2016-05-10,2016-03-31,0001140361-16-064175
CBSH,COMMERCE BANCSHARES INCORPORATED COMMON STOCK USD5,200525103,21324000.0,468553,0.04408246455624314,2016-05-10,2016-03-31,0001140361-16-064175
MTSI,MA-COM TECHNOLOGY SOLUTIONS COMMON STOCK USD0.01,55405Y100,21282000.0,487000,0.04399563921806258,2016-05-10,2016-03-31,0001140361-16-064175
GGAL,GRUPO FINANCIERO GALICIA-ADR,399909100,21249000.0,750318,0.04392741930949214,2016-05-10,2016-03-31,0001140361-16-064175
TJX,TJX COS INCORPORATED COMMON STOCK USD1,872540109,21240000.0,269953,0.04390881387988202,2016-05-10,2016-03-31,0001140361-16-064175
MMM,3M COMPANY COMMON STOCK USD0.01,88579Y101,21182000.0,127031,0.04378891222239459,2016-05-10,2016-03-31,0001140361-16-064175
CHKP,CHECK POINT SOFTWARE TECHNOLOGIES LIMITED ILS1,M22465104,21173000.0,245232,0.043770306792784465,2016-05-10,2016-03-31,0001140361-16-064175
N/A,PHILIPPINE LONG DISTANCE TELEPHONE COMPANY SPONSORED ADR (EACH REPRESENTS 1 PHP5),718252604,21080000.0,495999,0.04357805068681323,2016-05-10,2016-03-31,0001140361-16-064175
ESE,ESCO TECHNOLOGIES INCORPORATED COMMON STOCK USD0.01,296315104,21077000.0,539600,0.043571848876943195,2016-05-10,2016-03-31,0001140361-16-064175
PSA,PUBLIC STORAGE COMMON STOCK USD0.10,74460D109,21045000.0,77027,0.043505696238329436,2016-05-10,2016-03-31,0001140361-16-064175
EAT,BRINKER INTERNATIONAL INC,109641100,20861000.0,449002,0.04312531856630032,2016-05-10,2016-03-31,0001140361-16-064175
KEX,KIRBY CORPORATION COMMON STOCK USD0.10,497266106,20792000.0,341300,0.04298267693928941,2016-05-10,2016-03-31,0001140361-16-064175
PFGC,PERFORMANCE FOOD GROUP CO COMMON STOCK USD0.010000,71377A103,20725000.0,863896,0.04284416985219185,2016-05-10,2016-03-31,0001140361-16-064175
SYK,STRYKER CORP COM STK USD0.10,863667101,20709000.0,193448,0.042811093532884974,2016-05-10,2016-03-31,0001140361-16-064175
N/A,WESTERN REFINING INCORPORATED COMMON STOCK USD0.01,959319104,20702000.0,725100,0.04279662264318822,2016-05-10,2016-03-31,0001140361-16-064175
HPE,HEWLETT PACKARD ENTERPRISE COMMON STOCK USD0.01,42824C109,20688000.0,1156424,0.0427676808637947,2016-05-10,2016-03-31,0001140361-16-064175
IT,GARTNER INCORPORATED COMMON STOCK USD0.0005,366651107,20632000.0,233653,0.04265191374622061,2016-05-10,2016-03-31,0001140361-16-064175
XLNXEUR,XILINX INCORPORATED COMMON STOCK USD0.01,983919101,20613000.0,430612,0.0426126356170437,2016-05-10,2016-03-31,0001140361-16-064175
IPG,INTERPUBLIC GROUP OF COMPANIES INCORPORATED (THE) COMMON STOCK USD0.10,460690100,20460000.0,894210,0.042296343313671665,2016-05-10,2016-03-31,0001140361-16-064175
CCMPEUR,CABOT MICROELECTRONICS CORPORATION COMMON STOCK USD0.001,12709P103,20440000.0,494798,0.04225499791453807,2016-05-10,2016-03-31,0001140361-16-064175
REXR,REXFORD INDUSTRIAL REALTY IN COMMON STOCK USD0.01,76169C100,20394000.0,1124861,0.042159903496530794,2016-05-10,2016-03-31,0001140361-16-064175
MTX,MINERALS TECHNOLOGIES INCORPORATED COMMON STOCK USD0.10,603158106,20382000.0,358333,0.04213509625705063,2016-05-10,2016-03-31,0001140361-16-064175
IBOC,INTERNATIONAL BANCSHARES CORPORATION COMMON STOCK USD1,459044103,20380000.0,826779,0.04213096171713727,2016-05-10,2016-03-31,0001140361-16-064175
IBM,INTL BUSINESS MACHINES CORPORATION COMMON STOCK USD0.20,459200101,20350000.0,137118,0.04206894361843687,2016-05-10,2016-03-31,0001140361-16-064175
TECK,TECK RESOURCES LIMITED CLASS 'B' SUBORDINATED VOTING COMMON NPV,878742204,20331000.0,2005045,0.04202966548925995,2016-05-10,2016-03-31,0001140361-16-064175
BIIB,BIOGEN INCORPORATED COMMON STOCK USD0.0005,09062X103,20318000.0,79934,0.04200279097982311,2016-05-10,2016-03-31,0001140361-16-064175
N/A,EATON CORPORATION PLC COMMON STOCK USD0.50,G29183103,20301000.0,323528,0.041967647390559554,2016-05-10,2016-03-31,0001140361-16-064175
AKRXEUR,AKORN INC NPV USD COMMON STOCK,009728106,20282000.0,893100,0.04192836926138264,2016-05-10,2016-03-31,0001140361-16-064175
AMSF,AMERISAFE INCORPORATED COMMON STOCK USD0.01,03071H100,20273000.0,386600,0.041909763831772515,2016-05-10,2016-03-31,0001140361-16-064175
EC,ECOPETROL SA SPONSORED ADR (EACH REPRESENTS 20 ORDINARY COP250),279158109,20191000.0,2350534,0.041740247695324764,2016-05-10,2016-03-31,0001140361-16-064175
KO,COCA-COLA COMPANY (THE) COMMON STOCK USD0.25,191216100,20111000.0,431762,0.04157486609879037,2016-05-10,2016-03-31,0001140361-16-064175
GGG,GRACO INCORPORATED COMMON STOCK USD1,384109104,20060000.0,238900,0.041469435330999685,2016-05-10,2016-03-31,0001140361-16-064175
N/A,HOMEINNS HOTEL GROUP ADR (EACH REPRESENTS 2 ORDINARY SHARES),43742E102,19959000.0,560010,0.04126064106537501,2016-05-10,2016-03-31,0001140361-16-064175
LEG,LEGGETT & PLATT INCORPORATED COMMON STOCK USD0.01,524660107,19938000.0,415800,0.041217228396284736,2016-05-10,2016-03-31,0001140361-16-064175
N/A,ALLERGAN PLC COMMON STOCK USD0.0001,G0177J108,19895000.0,72360,0.041128335788147494,2016-05-10,2016-03-31,0001140361-16-064175
FFIV,F5 NETWORKS INCORPORATED COMMON STOCK NPV,315616102,19830000.0,188011,0.0409939632409633,2016-05-10,2016-03-31,0001140361-16-064175
GNCIQ,GNC HOLDINGS INCORPORATED CLASS A COMMON STOCK USD0.001,36191G107,19828000.0,627873,0.04098982870104994,2016-05-10,2016-03-31,0001140361-16-064175
PLD,PROLOGIS INCORPORATED REIT USD0.01,74340W103,19792000.0,453211,0.04091540698260946,2016-05-10,2016-03-31,0001140361-16-064175
N/A,INGERSOLL-RAND PLC COMMON STOCK USD1,G47791101,19738000.0,317988,0.04080377440494875,2016-05-10,2016-03-31,0001140361-16-064175
FCNCA,FIRST CITIZENS BANCSHARES INCORPORATED CLASS A COMMON STOCK USD1,31946M103,19737000.0,77959,0.040801707134992066,2016-05-10,2016-03-31,0001140361-16-064175
ARE,ALEXANDRIA REAL ESTATE EQUITIES INCORPORATED REIT USD0.01,015271109,19557000.0,216456,0.04042959854278968,2016-05-10,2016-03-31,0001140361-16-064175
SBUX,STARBUCKS CORPORATION COMMON STOCK USD0.001,855244109,19465000.0,324366,0.04023940970677512,2016-05-10,2016-03-31,0001140361-16-064175
CHD,CHURCH & DWIGHT COMPANY INCORPORATED COMMON STOCK USD1,171340102,19435000.0,210976,0.04017739160807472,2016-05-10,2016-03-31,0001140361-16-064175
ESRT,EMPIRE STATE REALTY TRUST INCORPORATED CLASS A REIT USD0.01,292104106,19396000.0,1107718,0.04009676807976421,2016-05-10,2016-03-31,0001140361-16-064175
N/A,CGI GROUP INCORPORATED CLASS 'A' SUB VOTING NPV,39945C109,19365000.0,313400,0.040032682711107125,2016-05-10,2016-03-31,0001140361-16-064175
UVE,UNIVERSAL INSURANCE HOLDINGS INCORPORATED COMMON STOCK USD0.01,91359V107,19320000.0,1076300,0.03993965556305653,2016-05-10,2016-03-31,0001140361-16-064175
STLD,STEEL DYNAMICS INCORPORATED COMMON STOCK USD0.01,858119100,19287000.0,844800,0.03987143565448609,2016-05-10,2016-03-31,0001140361-16-064175
WELL,WELLTOWER INCORPORATED COMMON STOCK USD1,95040Q104,19270000.0,279755,0.03983629206522253,2016-05-10,2016-03-31,0001140361-16-064175
NEE,NEXTERA ENERGY INCORPORATED COMMON STOCK USD0.01,65339F101,19118000.0,161334,0.03952206703180718,2016-05-10,2016-03-31,0001140361-16-064175
SIVBEUR,SVB FINANCIAL GROUP COMMON STOCK USD0.001,78486Q101,19083000.0,184749,0.03944971258332338,2016-05-10,2016-03-31,0001140361-16-064175
CVS,CVS HEALTH CORPORATION COMMON STOCK USD0.01,126650100,19017000.0,182764,0.03931327276618251,2016-05-10,2016-03-31,0001140361-16-064175
APC,ANADARKO PETROLEUM CORPORATION COMMON STOCK USD0.10,032511107,18908000.0,407591,0.03908794034090439,2016-05-10,2016-03-31,0001140361-16-064175
UTXZ,UNITED TECHNOLOGIES CORPORATION COMMON STOCK USD1,913017109,18895000.0,188479,0.039061065831467554,2016-05-10,2016-03-31,0001140361-16-064175
LII,LENNOX INTERNATIONAL INCORPORATED COMMON STOCK USD0.01,526107107,18868000.0,139400,0.0390052495426372,2016-05-10,2016-03-31,0001140361-16-064175
ARE,ALEXANDRIA REAL ESTATE EQUITIES INCORPORATED REIT USD0.01,015271109,18778000.0,207835,0.038819195246536,2016-05-10,2016-03-31,0001140361-16-064175
GWRUSD,GENESEE & WYOMING INCORPORATED CLASS 'A' COMMON STOCK USD0.01,371559105,18773000.0,296566,0.0388088588967526,2016-05-10,2016-03-31,0001140361-16-064175
WAB,WABTEC CORPORATION COMMON STOCK USD0.01,929740108,18749000.0,236700,0.038759244417792285,2016-05-10,2016-03-31,0001140361-16-064175
KMB,KIMBERLY-CLARK CORPORATION COMMON STOCK USD1.25,494368103,18722000.0,137955,0.03870342812896192,2016-05-10,2016-03-31,0001140361-16-064175
SPY,SPDR S&P 500 ETF TRUST,78462F103,18703000.0,90745,0.03866414999978501,2016-05-10,2016-03-31,0001140361-16-064175
WF2,WINTRUST FINANCIAL CORPORATION COMMON STOCK NPV,97650W108,18498000.0,418217,0.03824035965866562,2016-05-10,2016-03-31,0001140361-16-064175
BAC,BANK OF AMERICA CORPORATION COMMON STOCK USD0.01,060505104,18452000.0,1368849,0.03814526524065834,2016-05-10,2016-03-31,0001140361-16-064175
MAC,MACERICH COMPANY (THE) REIT USD0.01,554382101,18411000.0,232934,0.03806050717243446,2016-05-10,2016-03-31,0001140361-16-064175
BXP,BOSTON PROPERTIES INCORPORATED COMMON STOCK USD0.01,101121101,18354000.0,144839,0.0379426727849037,2016-05-10,2016-03-31,0001140361-16-064175
N/A,FCB FINANCIAL HOLDINGS-CL A COMMON STOCK USD0.001,30255G103,18327000.0,554200,0.037886856496073346,2016-05-10,2016-03-31,0001140361-16-064175
ORCL,ORACLE CORPORATION COMMON STOCK USD0.01,68389X105,18311000.0,446934,0.037853780176766466,2016-05-10,2016-03-31,0001140361-16-064175
N/A,STERIS PUBLIC LIMITED COMPANY NPV,G84720104,18263000.0,254569,0.03775455121884583,2016-05-10,2016-03-31,0001140361-16-064175
MATW,MATTHEWS INTERNATIONAL CORPORATION CLASS 'A' COMMON STOCK USD1,577128101,18259000.0,356000,0.03774628213901911,2016-05-10,2016-03-31,0001140361-16-064175
RBAGBP,RITCHIE BROS. AUCTIONEERS INCORPORATED COMMON NPV,767744105,18244000.0,513206,0.03771527308966891,2016-05-10,2016-03-31,0001140361-16-064175
EQR,EQUITY RESIDENTIAL SBI USD0.01,29476L107,18240000.0,243687,0.03770700400984219,2016-05-10,2016-03-31,0001140361-16-064175
LLY,ELI LILLY AND COMPANY COMMON STOCK NPV,532457108,18221000.0,253839,0.03766772588066527,2016-05-10,2016-03-31,0001140361-16-064175
HCI,HCI GROUP INCORPORATED COMMON STOCK NPV,40416E103,18190000.0,546900,0.03760364051200819,2016-05-10,2016-03-31,0001140361-16-064175
KR,KROGER COMPANY (THE) COMMON STOCK USD1,501044101,18059000.0,474126,0.03733282814768312,2016-05-10,2016-03-31,0001140361-16-064175
N/A,CORE LABORATORIES NV EUR0.02,N22717107,18044000.0,157826,0.037301819098332925,2016-05-10,2016-03-31,0001140361-16-064175
WPXUSD,WPX ENERGY INCORPORATED COMMON STOCK USD1,98212B103,17997000.0,2694157,0.03720465741036896,2016-05-10,2016-03-31,0001140361-16-064175
N/A,DR PEPPER SNAPPLE GROUP INCORPORATED COMMON STOCK USD0.01,26138E109,17990000.0,200023,0.0371901865206722,2016-05-10,2016-03-31,0001140361-16-064175
AME,AMETEK INC COMMON STOCK USD0.01,031100100,17984000.0,357400,0.03717778290093213,2016-05-10,2016-03-31,0001140361-16-064175
CVI,CVR ENERGY INCORPORATED COMMON STOCK USD0.01,12662P108,17826000.0,684044,0.03685115424777669,2016-05-10,2016-03-31,0001140361-16-064175
FDX,FEDEX CORPORATION COMMON STOCK USD0.10,31428X106,17778000.0,110034,0.036751925289856054,2016-05-10,2016-03-31,0001140361-16-064175
JNJ,JOHNSON AND JOHNSON COMMON STOCK USD1,478160104,17723000.0,162622,0.03663822544223866,2016-05-10,2016-03-31,0001140361-16-064175
DPZ,DOMINO'S PIZZA INCORPORATED COMMON STOCK USD0.01,25754A201,17674000.0,134948,0.03653692921436134,2016-05-10,2016-03-31,0001140361-16-064175
ROP,ROPER TECHNOLOGIES INCORPORATED COMMON STOCK USD0.01,776696106,17600000.0,96700,0.036383951237567026,2016-05-10,2016-03-31,0001140361-16-064175
N/A,NEW ORIENTAL EDUCATION & TECHNOLOGY GROUP INCORPORATED SPONSORED ADR (EACH REPRESENTS 1 ORDINARY SHARES),647581107,17377000.0,484167,0.0359229500372274,2016-05-10,2016-03-31,0001140361-16-064175
TNHUSD,TERRA NITROGEN COMPANY LP NPV,881005201,17356000.0,158501,0.03587953736813712,2016-05-10,2016-03-31,0001140361-16-064175
WB,WEIBO CORPORATION SPONSERED ADR(EACH REPRESENTS 1 ORDINARY SHARE),948596101,17350000.0,945993,0.035867133748397034,2016-05-10,2016-03-31,0001140361-16-064175
ARCC,ARES CAPITAL CORPORATION COMMON STOCK USD0.001,04010L103,17345000.0,1188809,0.03585679739861364,2016-05-10,2016-03-31,0001140361-16-064175
DEI,DOUGLAS EMMETT INCORPORATED REIT USD0.01,25960P109,17338000.0,576389,0.03584232650891688,2016-05-10,2016-03-31,0001140361-16-064175
RL,RALPH LAUREN CORPORATION CLASS A COMMON STOCK USD0.01,751212101,17297000.0,178463,0.035757568440693,2016-05-10,2016-03-31,0001140361-16-064175
N/A,SIGNET JEWELERS LIMITED ORDINARY USD0.18 (US LISTING),G81276100,17234000.0,144001,0.035627330433422165,2016-05-10,2016-03-31,0001140361-16-064175
N/A,BAKER HUGHES INCORPORATED COMMON STOCK USD1,057224107,17198000.0,396545,0.035552908714981686,2016-05-10,2016-03-31,0001140361-16-064175
MET,METLIFE INCORPORATED COMMON STOCK USD0.01,59156R108,17162000.0,383691,0.03547848699654121,2016-05-10,2016-03-31,0001140361-16-064175
DVN,DEVON ENERGY CORPORATION COMMON STOCK USD0.10,25179M103,17077000.0,651786,0.03530276905022341,2016-05-10,2016-03-31,0001140361-16-064175
CABO,CABLE ONE INCORPORATED COMMON STOCK NPV,12685J105,17065000.0,38828,0.035277961810743254,2016-05-10,2016-03-31,0001140361-16-064175
N/A,EQUITY ONE INCORPORATED REIT USD0.01,294752100,17048000.0,593192,0.0352428182214797,2016-05-10,2016-03-31,0001140361-16-064175
SYNHEUR,INC RESEARCH HOLDINGS INCORPORATED A COMMON STOCK USD0.01,45329R109,16947000.0,416600,0.035034023955855025,2016-05-10,2016-03-31,0001140361-16-064175
ADI,ANALOG DEVICES INCORPORATED COMMON STOCK USD0.166,032654105,16923000.0,286300,0.0349844094768947,2016-05-10,2016-03-31,0001140361-16-064175
PG,PROCTER AND GAMBLE COMPANY (THE) COMMON STOCK NPV,742718109,16901000.0,204411,0.034938929537847746,2016-05-10,2016-03-31,0001140361-16-064175
AMG,AFFILIATED MANAGERS GROUP INCORPORATED COMMON STOCK NPV,008252108,16900000.0,103650,0.03493686226789106,2016-05-10,2016-03-31,0001140361-16-064175
HD,HOME DEPOT INCORPORATED (THE) COMMON STOCK USD0.05,437076102,16883000.0,126540,0.03490171867862751,2016-05-10,2016-03-31,0001140361-16-064175
MHK,MOHAWK INDUSTRIES INCORPORATED COMMON STOCK USD0.01,608190104,16755000.0,87666,0.03463710812417247,2016-05-10,2016-03-31,0001140361-16-064175
N/A,VALES SA SPONSORED ADR (REPRESENTING 1 PREFERENCE 'A' SHARE),91912E204,16693000.0,5233063,0.03450893738685831,2016-05-10,2016-03-31,0001140361-16-064175
ESS,ESSEX PROPERTY TRUST INCORPORATED REIT NPV,297178105,16684000.0,71806,0.034490331957248196,2016-05-10,2016-03-31,0001140361-16-064175
ENR,ENERGIZER HOLDINGS INCORPORATED COMMON STOCK NPV,29272W109,16592000.0,407073,0.03430014312123364,2016-05-10,2016-03-31,0001140361-16-064175
AIT,APPLIED INDUSTRIAL TECHNOLOGIES INCORPORATED COMMON STOCK NPV,03820C105,16514000.0,376078,0.0341388960646126,2016-05-10,2016-03-31,0001140361-16-064175
TRQEUR,TURQUOISE HILL RESOURCES LIMITED COMMON NPV,900435108,16347000.0,4923900,0.03379366198184705,2016-05-10,2016-03-31,0001140361-16-064175
NDAQ,NASDAQ INCORPORATED COMMON STOCK USD0.01,631103108,16338000.0,250699,0.033775056552236934,2016-05-10,2016-03-31,0001140361-16-064175
FFG,FBL FINANCIAL GROUP INC COMMON STOCK NPV,30239F106,16149000.0,265614,0.033384342530424424,2016-05-10,2016-03-31,0001140361-16-064175
ITW,ILLINOIS TOOL WORKS INC COMMON STOCK NPV,452308109,16086000.0,156734,0.03325410452315359,2016-05-10,2016-03-31,0001140361-16-064175
KEYS,KEYSIGHT TECHNOLOGIES INCORPORATED COMMON STOCK USD0.01,49338L103,16071000.0,586100,0.033223095473803387,2016-05-10,2016-03-31,0001140361-16-064175
PKG,PACKAGING CORPORATION OF AMERICA COMMON STOCK USD0.01,695156109,15973000.0,268717,0.03302050301804875,2016-05-10,2016-03-31,0001140361-16-064175
N/A,GENERAL GROWTH PROPERTIES INCORPORATED REIT USD0.01,370023103,15926000.0,539677,0.0329233413300848,2016-05-10,2016-03-31,0001140361-16-064175
PLD,PROLOGIS INCORPORATED REIT USD0.01,74340W103,15883000.0,363701,0.03283444872194756,2016-05-10,2016-03-31,0001140361-16-064175
N/A,DCT INDUSTRIAL TRUST INCORPORATED REIT USD0.01,233153204,15871000.0,398280,0.0328096414824674,2016-05-10,2016-03-31,0001140361-16-064175
BIDUN,BAIDU INCORPORATED SPONSORED ADR (EACH REPRESENTS 0.10 CLASS A SHARES),056752108,15864000.0,83545,0.032795170592770644,2016-05-10,2016-03-31,0001140361-16-064175
RRC,RANGE RESOURCES CORPORATION COMMON STOCK USD0.01,75281A109,15857000.0,490019,0.03278069970307388,2016-05-10,2016-03-31,0001140361-16-064175
N/A,SOUFUN HOLDINGS LIMITED ADR (EACH REPRESENTS 0.20 ORDINARY SHARES),836034108,15848000.0,2709050,0.032762094273463764,2016-05-10,2016-03-31,0001140361-16-064175
JXC1,J2 GLOBAL INCORPORATED COMMON STOCK USD0.01,48123V102,15839000.0,259693,0.03274348884385364,2016-05-10,2016-03-31,0001140361-16-064175
DAR,DARLING INGREDIENTS INCORPORATED COMMON STOCK USD0.01,237266101,15833000.0,1228300,0.03273108522411356,2016-05-10,2016-03-31,0001140361-16-064175
JPM,JPMORGAN CHASE AND COMPANY COMMON STOCK USD1,46625H100,15804000.0,264671,0.032671134395369845,2016-05-10,2016-03-31,0001140361-16-064175
EVEUR,EATON VANCE CORPORATION COMMON STOCK USD0.00781,278265103,15720000.0,471937,0.03249748371900873,2016-05-10,2016-03-31,0001140361-16-064175
N/A,SURGICAL CARE AFFILIATES INCORPORATED COMMON STOCK USD0.01,86881L106,15687000.0,345300,0.03242926381043829,2016-05-10,2016-03-31,0001140361-16-064175
MTDR,MATADOR RESOURCES COMPANY COMMON STOCK USD0.01,576485205,15562000.0,839400,0.03217085506585329,2016-05-10,2016-03-31,0001140361-16-064175
SWN1EUR,SOUTHWESTERN ENERGY COMPANY COMMON STOCK USD0.10,845467109,15487000.0,2011238,0.032015809819102306,2016-05-10,2016-03-31,0001140361-16-064175
COP,CONOCOPHILLIPS INCORPORATED COMMON STOCK USD0.01,20825C104,15436000.0,385142,0.031910379051311624,2016-05-10,2016-03-31,0001140361-16-064175
LEA,LEAR CORP COMMON STOCK USD0.01,521865204,15330000.0,137300,0.03169124843590355,2016-05-10,2016-03-31,0001140361-16-064175
VIPS,VIPSHOP HOLDINGS LIMITED SPONSORED ADR (EACH REPRESENTS 0.2 ORDINARY SHARES USD0.0001),92763W103,15320000.0,1216830,0.031670575736336755,2016-05-10,2016-03-31,0001140361-16-064175
CAH,CARDINAL HEALTH CORPORATION INCORPORATED COMMON STOCK NPV,14149Y108,15250000.0,186474,0.03152586683936915,2016-05-10,2016-03-31,0001140361-16-064175
OSIS,OSI SYSTEMS INC COMMON STOCK USD0.0010,671044105,15245000.0,232000,0.031515530489585754,2016-05-10,2016-03-31,0001140361-16-064175
OC,OWENS CORNING INCORPORATED COMMON STOCK USD0.01,690742101,15221000.0,321256,0.03146591601062544,2016-05-10,2016-03-31,0001140361-16-064175
BVN,COMPANIA DE MINAS BUENAVENTURA SA SPONSORED ADR (EACH REPRESENTING 1 COMMON PEN4 LEVEL 1),204448104,15135000.0,2050857,0.03128813079435096,2016-05-10,2016-03-31,0001140361-16-064175
BALL,BALL CORPORATION COMMON STOCK NPV,058498106,15076000.0,212639,0.031166161866906846,2016-05-10,2016-03-31,0001140361-16-064175
GIS,GENERAL MILLS INC COMMON STOCK USD0.10,370334104,15043000.0,237612,0.031097941958336407,2016-05-10,2016-03-31,0001140361-16-064175
VWO,VANGUARD INTERNATIONAL EQUITY INDEX FUNDS FTSE EMERGING MARKETS ETF,922042858,15023000.0,433928,0.031056596559202804,2016-05-10,2016-03-31,0001140361-16-064175
IWD,ISHARES TRUST RUSSELL 1000 VALUE ETF,464287598,14981000.0,151290,0.03096977122102225,2016-05-10,2016-03-31,0001140361-16-064175
AVB,AVALONBAY COMMUNITIES INCORPORATED COMMON STOCK USD0.01,053484101,14886000.0,78833,0.030773380575137656,2016-05-10,2016-03-31,0001140361-16-064175
CVCO,CAVCO INDUSTRIES INC COMMON STOCK USD0.01,149568107,14883000.0,161962,0.030767178765267612,2016-05-10,2016-03-31,0001140361-16-064175
CHT,CHUNGHWA TELECOM COMPANY LIMITED ADR (EACH REPRESENTS 10 ORDINARY TWD10),17133Q502,14857000.0,434168,0.030713429746393937,2016-05-10,2016-03-31,0001140361-16-064175
SJR/BEUR,SHAW COMMUNICATIONS INCORPORATED CLASS 'B' NPV,82028K200,14804000.0,586279,0.0306038644386899,2016-05-10,2016-03-31,0001140361-16-064175
QCOM,QUALCOMM INCORPORATED COMMON STOCK USD0.0001,747525103,14759000.0,289441,0.0305108372906393,2016-05-10,2016-03-31,0001140361-16-064175
BA,BOEING COMPANY (THE) COMMON STOCK USD5,097023105,14714000.0,114436,0.030417810142588705,2016-05-10,2016-03-31,0001140361-16-064175
BLKCHF,BLACKROCK INCORPORATED COMMON STOCK USD0.01,09247X101,14664000.0,42957,0.030314446644754706,2016-05-10,2016-03-31,0001140361-16-064175
NTES,NETEASE INCORPORATED ADR (EACH REPRESENTS 25 SHARES USD0.0001),64110W102,14625000.0,102539,0.03023382311644419,2016-05-10,2016-03-31,0001140361-16-064175
TKR,TIMKEN CO COMMON STOCK NPV,887389104,14621000.0,438923,0.030225554036617468,2016-05-10,2016-03-31,0001140361-16-064175
CPA,COPA HOLDINGS SA CLASS 'A' NPV,P31076105,14613000.0,218463,0.03020901587696403,2016-05-10,2016-03-31,0001140361-16-064175
N/A,FABRINET COMMON STOCK USD0.01,G3323L100,14575000.0,447216,0.030130459618610193,2016-05-10,2016-03-31,0001140361-16-064175
NEM,NEWMONT MINING CORPORATION COMMON STOCK USD1.60,651639106,14529000.0,543158,0.030035365200602914,2016-05-10,2016-03-31,0001140361-16-064175
N/A,ROCKWELL COLLINS INCORPORATED COMMON STOCK USD0.01,774341101,14477000.0,156490,0.02992786716285556,2016-05-10,2016-03-31,0001140361-16-064175
CCL,CARNIVAL CORPORATION COMMON STOCK USD0.01 (PAIRED STOCK),143658300,14461000.0,276137,0.02989479084354868,2016-05-10,2016-03-31,0001140361-16-064175
N/A,ICL-ISRAEL CHEMICAL LIMITED ILS1,M5920A109,14446000.0,875521,0.02986378179419848,2016-05-10,2016-03-31,0001140361-16-064175
BCPC,BALCHEM CORPORATION COMMON STOCK USD0.0667,057665200,14414000.0,234300,0.02979762915558472,2016-05-10,2016-03-31,0001140361-16-064175
HNI,HNI CORPORATION COMMON STOCK USD1,404251100,14414000.0,373900,0.02979762915558472,2016-05-10,2016-03-31,0001140361-16-064175
N/A,INTERVAL LEISURE GROUP INCORPORATED COMMON STOCK USD0.01,46113M108,14403000.0,1023700,0.02977488918606124,2016-05-10,2016-03-31,0001140361-16-064175
TECH,BIO-TECHNE CORPORATION COMMON STOCK USD0.01,09073M104,14385000.0,150533,0.029737678326841002,2016-05-10,2016-03-31,0001140361-16-064175
RHI,ROBERT HALF INTERNATIONAL INCORPORATE COMMON STOCK USD1,770323103,14320000.0,312319,0.029603305779656804,2016-05-10,2016-03-31,0001140361-16-064175
CUBE,CUBESMART REIT USD0.01,229663109,14275000.0,431781,0.029510278631606213,2016-05-10,2016-03-31,0001140361-16-064175
N/A,HFF INCORPORATED CLASS A COMMON STOCK USD0.01,40418F108,14267000.0,520900,0.02949374047195277,2016-05-10,2016-03-31,0001140361-16-064175
PYPL,PAYPAL HOLDINGS INCORPORATED COMMON STOCK USD0.0001,70450Y103,14259000.0,365237,0.029477202312299333,2016-05-10,2016-03-31,0001140361-16-064175
SPG,SIMON PROPERTY GROUP INCORPORATED COMMON STOCK USD0.0001,828806109,14124000.0,68653,0.029198120868147538,2016-05-10,2016-03-31,0001140361-16-064175
TRIP,TRIPADVISOR INCORPORATED COMMON STOCK USD0.001,896945201,14087000.0,211575,0.029121631879750382,2016-05-10,2016-03-31,0001140361-16-064175
CHS1USD,CHICO'S FAS INCORPORATED COMMON STOCK USD0.01,168615102,14063000.0,1086800,0.02907201740079006,2016-05-10,2016-03-31,0001140361-16-064175
N/A,QUINTILES TRANSNATIONAL HOLDINGS INCORPORATED COMMON STOCK USD0.01,74876Y101,14056000.0,217250,0.0290575465110933,2016-05-10,2016-03-31,0001140361-16-064175
DLB,DOLBY LABORATORIES INCORPORATED CLASS 'A' COMMON STOCK USD0.001,25659T107,13973000.0,321075,0.028885963104688866,2016-05-10,2016-03-31,0001140361-16-064175
AZO,AUTOZONE INCORPORATED COMMON STOCK USD0.01,053332102,13862000.0,17273,0.028656496139497393,2016-05-10,2016-03-31,0001140361-16-064175
ELS,EQUITY LIFESTYLE PROPERTIES INCORPORATED REIT USD0.01,29472R108,13858000.0,193954,0.028648227059670673,2016-05-10,2016-03-31,0001140361-16-064175
N/A,CSRA INC COMMON STOCK USD 0.001,12650T104,13840000.0,509000,0.028611016200450434,2016-05-10,2016-03-31,0001140361-16-064175
DCI,DONALDSON COMPANY INC COMMON STOCK USD5,257651109,13824000.0,430800,0.028577939881143554,2016-05-10,2016-03-31,0001140361-16-064175
N/A,FMC TECHNOLOGIES INCORPORATED COMMON STOCK USD0.01,30249U101,13664000.0,504397,0.028247176688074763,2016-05-10,2016-03-31,0001140361-16-064175
PEP,PEPSICO INCORPORATED CAPITAL STOCK USD0.016666,713448108,13629000.0,132724,0.028174822239590964,2016-05-10,2016-03-31,0001140361-16-064175
N/A,EMPRESA NAC ELEC-CHIL-SP ADR,29244T101,13620000.0,328029,0.028156216809980844,2016-05-10,2016-03-31,0001140361-16-064175
