ticker,nameOfIssuer,cusip,value,shares,allocation_percent,filingDate,reportDate,accessionNumber
DAL,DELTA AIR LINES INCORPORATED COMMON STOCK USD0.0001,247361702,4332000.0,87816,0.00895541345233752,2016-05-10,2016-03-31,0001140361-16-064175
JOBSUSD,51JOBS INCORPORATED ADR (EACH REPRESENTS 2 ORDINARY USD0.0001),316827104,4328000.0,139065,0.0089471443725108,2016-05-10,2016-03-31,0001140361-16-064175
SOHUN,SOHU.COM INCORPORATED COMMON STOCK USD0.001,83408W103,4297000.0,86800,0.008883059003853722,2016-05-10,2016-03-31,0001140361-16-064175
CIG,COMPANHIA ENERGETICA DE MINAS GERAIS SPONS ADR (EACH REP 1 NON-VTG PREF SHS) (LEVEL 2),204409601,4292000.0,1857965,0.008872722654070322,2016-05-10,2016-03-31,0001140361-16-064175
N/A,OUTERWALL INCORPORATED COMMON STOCK USD0.001,690070107,4288000.0,121139,0.008864453574243602,2016-05-10,2016-03-31,0001140361-16-064175
COF,CAPITAL ONE FINANCIAL CORPORATION COMMON STOCK USD0.01,14040H105,4280000.0,61900,0.008847915414590162,2016-05-10,2016-03-31,0001140361-16-064175
AXP,AMERICAN EXPRESS COMPANY COMMON STOCK USD0.20,025816109,4264000.0,70727,0.008814839095283283,2016-05-10,2016-03-31,0001140361-16-064175
MOS,MOSAIC COMPANY (THE) COMMON STOCK USD0.01,61945C103,4259000.0,151442,0.008804502745499885,2016-05-10,2016-03-31,0001140361-16-064175
VNO,VORNADO REALTY TRUST COMMON STOCK USD0.04,929042109,4258000.0,45313,0.008802435475543205,2016-05-10,2016-03-31,0001140361-16-064175
GAP,GAP INCORPORATED (THE) COMMON STOCK USD0.05,364760108,4204000.0,141745,0.008690802897882488,2016-05-10,2016-03-31,0001140361-16-064175
PM,PHILIP MORRIS INTERNATIONAL INCORPORATED COMMON STOCK NPV,718172109,4195000.0,42508,0.008672197468272368,2016-05-10,2016-03-31,0001140361-16-064175
PFE,PFIZER INCORPORATED COMMON STOCK USD0.05,717081103,4187000.0,139233,0.008655659308618929,2016-05-10,2016-03-31,0001140361-16-064175
DLX,DELUXE CORPORATION COMMON STOCK USD1,248019101,4179000.0,67235,0.008639121148965489,2016-05-10,2016-03-31,0001140361-16-064175
GE,GENERAL ELECTRIC COMPANY COMMON STOCK USD0.06,369604103,4165000.0,130842,0.00861017936957197,2016-05-10,2016-03-31,0001140361-16-064175
RSG,REPUBLIC SERVICES INCORORATED COMMON STOCK USD0.01,760759100,4161000.0,86063,0.00860191028974525,2016-05-10,2016-03-31,0001140361-16-064175
NFLX,NETFLIX INCORPORATED COMMON STOCK USD0.001,64110L106,4159000.0,40697,0.00859777574983189,2016-05-10,2016-03-31,0001140361-16-064175
CMA,COMERICA INC COMMON STOCK USD5,200340107,4156000.0,108700,0.00859157393996185,2016-05-10,2016-03-31,0001140361-16-064175
CNC,CENTENE CORPORATION COMMON STOCK USD0.001,15135B101,4154000.0,66500,0.00858743940004849,2016-05-10,2016-03-31,0001140361-16-064175
N/A,BEMIS COMPANY INCORPORATED COMMON STOCK USD0.10,081437105,4149000.0,78900,0.00857710305026509,2016-05-10,2016-03-31,0001140361-16-064175
HRSEUR,HARRIS CORP COMMON STOCK USD1,413875105,4148000.0,52700,0.00857503578030841,2016-05-10,2016-03-31,0001140361-16-064175
REXR,REXFORD INDUSTRIAL REALTY IN COMMON STOCK USD0.01,76169C100,4131000.0,227853,0.00853989219104485,2016-05-10,2016-03-31,0001140361-16-064175
AEM,AGNICO EAGLE MINES LIMITED COMMON NPV (US LISTING),008474108,4120000.0,112101,0.00851715222152137,2016-05-10,2016-03-31,0001140361-16-064175
CPT,CAMDEN PROPERTY TRUST REIT USD0.01,133131102,4102000.0,49108,0.008479941362301133,2016-05-10,2016-03-31,0001140361-16-064175
BEN,FRANKLIN RESOURCES INCORPORATED COMMON STOCK USD0.10,354613101,4102000.0,104800,0.008479941362301133,2016-05-10,2016-03-31,0001140361-16-064175
ABBV,ABBVIE INCORPORATED COMMON STOCK USD0.01,00287Y109,4101000.0,71939,0.008477874092344453,2016-05-10,2016-03-31,0001140361-16-064175
PLD,PROLOGIS INCORPORATED REIT USD0.01,74340W103,4100000.0,93886,0.008475806822387773,2016-05-10,2016-03-31,0001140361-16-064175
SHW,SHERWIN-WILLIAMS COMPANY (THE) COMMON STOCK USD1,824348106,4098000.0,14408,0.008471672282474413,2016-05-10,2016-03-31,0001140361-16-064175
TSN,TYSON FOODS INCORPORATED CLASS A COMMON STOCK USD0.10,902494103,4096000.0,60625,0.008467537742561053,2016-05-10,2016-03-31,0001140361-16-064175
7HP,HP INCORPORATED COMMON STOCK USD0.01,40434L105,4090000.0,332533,0.008455134122820973,2016-05-10,2016-03-31,0001140361-16-064175
N/A,HCP INCORPORATED REIT USD1,40414L109,4077000.0,125690,0.008428259613384134,2016-05-10,2016-03-31,0001140361-16-064175
MXIM,MAXIM INTEGRATED PRODUCTS INCORPORATED COMMON STOCK USD0.001,57772K101,4073000.0,111472,0.008419990533557414,2016-05-10,2016-03-31,0001140361-16-064175
SLB,SCHLUMBERGER LIMITED COMMON STOCK USD0.01,806857108,4057000.0,54521,0.008386914214250535,2016-05-10,2016-03-31,0001140361-16-064175
HRB,BLOCK(H & R) INC COM STK NPV,093671105,4033000.0,152700,0.008337299735290217,2016-05-10,2016-03-31,0001140361-16-064175
CBRL,CRACKER BARREL OLD COUNTRY STORE INCORPORATED COMMON STOCK USD0.01,22410J106,4018000.0,26200,0.008306290685940017,2016-05-10,2016-03-31,0001140361-16-064175
BSX,BOSTON SCIENTIFIC CORPORATION COMMON STOCK USD0.01,101137107,3986000.0,211776,0.00824013804732626,2016-05-10,2016-03-31,0001140361-16-064175
UPS,UNITED PARCELS SERVICE CLASS B COMMON STOCK USD0.01,911312106,3982000.0,37664,0.00823186896749954,2016-05-10,2016-03-31,0001140361-16-064175
CHKP,CHECK POINT SOFTWARE TECHNOLOGIES LIMITED ILS1,M22465104,3978000.0,46077,0.00822359988767282,2016-05-10,2016-03-31,0001140361-16-064175
UNH,UNITEDHEALTH GROUP INCORPORATED COMMON STOCK USD0.01,91324P102,3968000.0,30597,0.008202927188106019,2016-05-10,2016-03-31,0001140361-16-064175
GNTX,GENTEX CORPORATION COMMON STOCK USD0.06,371901109,3953000.0,250200,0.008171918138755821,2016-05-10,2016-03-31,0001140361-16-064175
PBI,PITNEY BOWES INCORPORATED COMMON STOCK USD2,724479100,3944000.0,185877,0.008153312709145702,2016-05-10,2016-03-31,0001140361-16-064175
BCRUSD,BARD(C.R.) INC COMMON STOCK USD0.25,067383109,3936000.0,19400,0.008136774549492262,2016-05-10,2016-03-31,0001140361-16-064175
EMB,ISHARES TRUST JP MORGAN USD EMERGING MARKETS BOND ETF,464288281,3931000.0,35695,0.008126438199708862,2016-05-10,2016-03-31,0001140361-16-064175
N/A,LASALLE HOTEL PROPERTIES REIT USD0.01,517942108,3910000.0,154041,0.008083025530618583,2016-05-10,2016-03-31,0001140361-16-064175
GTS,TRIPLE-S MANAGEMENT CORPORATION CLASS B COMMON STOCK USD1,896749108,3897000.0,152226,0.008056151021181745,2016-05-10,2016-03-31,0001140361-16-064175
CPRT,COPART INCORPORATED COMMON STOCK NPV,217204106,3888000.0,93450,0.008037545591571625,2016-05-10,2016-03-31,0001140361-16-064175
PSX,PHILLIPS 66 COMMON STOCK USD0.01,718546104,3887000.0,44359,0.008035478321614945,2016-05-10,2016-03-31,0001140361-16-064175
ANF,ABERCROMBIE AND FITCH COMPANY CLASS A COMMON STOCK USD0.01,002896207,3871000.0,122041,0.008002402002308066,2016-05-10,2016-03-31,0001140361-16-064175
SLB,SCHLUMBERGER LIMITED COMMON STOCK USD0.01,806857108,3864000.0,51930,0.007987931112611306,2016-05-10,2016-03-31,0001140361-16-064175
LOW,LOWE'S COMPANIES INCORPORATED COMMON STOCK USD0.50,548661107,3862000.0,50800,0.007983796572697946,2016-05-10,2016-03-31,0001140361-16-064175
IJH,ISHARES TRUST CORE S&P MID-CAP ETF,464287507,3861000.0,26810,0.007981729302741266,2016-05-10,2016-03-31,0001140361-16-064175
RNR,RENAISSANCE HOLDINGS COMMON STOCK NPV,G7496G103,3853000.0,32108,0.007965191143087826,2016-05-10,2016-03-31,0001140361-16-064175
ETR,ENTERGY CORPORATION COMMON STOCK USD0.01,29364G103,3842000.0,48495,0.007942451173564347,2016-05-10,2016-03-31,0001140361-16-064175
MHK,MOHAWK INDUSTRIES INCORPORATED COMMON STOCK USD0.01,608190104,3837000.0,20078,0.007932114823780947,2016-05-10,2016-03-31,0001140361-16-064175
SYY,SYSCO CORPORATION COMMON STOCK USD1,871829107,3833000.0,82200,0.007923845743954227,2016-05-10,2016-03-31,0001140361-16-064175
HFCUSD,HOLLYFRONTIER CORPORATION COMMON STOCK USD0.01,436106108,3807000.0,110700,0.00787009672508055,2016-05-10,2016-03-31,0001140361-16-064175
LBEUR,L BRANDS INCORPORATED COMMON STOCK USD0.50,501797104,3800000.0,43000,0.00785562583538379,2016-05-10,2016-03-31,0001140361-16-064175
K,KELLOGG COMPANY COMMON STOCK USD0.25,487836108,3795000.0,49390,0.00784528948560039,2016-05-10,2016-03-31,0001140361-16-064175
TSLA,TESLA MOTORS INCORPORATED COMMON STOCK USD0.001,88160R101,3789000.0,16698,0.00783288586586031,2016-05-10,2016-03-31,0001140361-16-064175
ABX,BARRICK GOLD CORPORATION COMMON NPV (US LISTING),067901108,3767000.0,274138,0.007787405926813352,2016-05-10,2016-03-31,0001140361-16-064175
N/A,EQUITY ONE INCORPORATED REIT USD0.01,294752100,3752000.0,130554,0.007756396877463152,2016-05-10,2016-03-31,0001140361-16-064175
TJX,TJX COS INCORPORATED COMMON STOCK USD1,872540109,3750000.0,47663,0.007752262337549791,2016-05-10,2016-03-31,0001140361-16-064175
N/A,INGERSOLL-RAND PLC COMMON STOCK USD1,G47791101,3747000.0,60370,0.007746060527679752,2016-05-10,2016-03-31,0001140361-16-064175
DIS,WALT DISNEY COMPANY (THE) COMMON STOCK USD0.01,254687106,3741000.0,37821,0.007733656907939673,2016-05-10,2016-03-31,0001140361-16-064175
CNP,CENTERPOINT ENERGY INCORPORATED COMMON STOCK NPV,15189T107,3740000.0,179384,0.0077315896379829925,2016-05-10,2016-03-31,0001140361-16-064175
N/A,NATIONAL INSTRUMENTS CORPORATION COMMON STOCK USD0.01,636518102,3729000.0,124832,0.007708849668459514,2016-05-10,2016-03-31,0001140361-16-064175
CR1USD,CRANE COMPANY COMMON STOCK USD1,224399105,3719000.0,68519,0.007688176968892713,2016-05-10,2016-03-31,0001140361-16-064175
NUS,NU SKIN ENTERPRISES INCORPORATED CLASS 'A' COMMON STOCK USD0.001,67018T105,3708000.0,96300,0.007665436999369234,2016-05-10,2016-03-31,0001140361-16-064175
LMT,LOCKHEED MARTIN CORP COMMON STOCK USD0.01,539830109,3697000.0,16581,0.007642697029845755,2016-05-10,2016-03-31,0001140361-16-064175
ESRT,EMPIRE STATE REALTY TRUST INCORPORATED CLASS A REIT USD0.01,292104106,3668000.0,209488,0.007582746201102037,2016-05-10,2016-03-31,0001140361-16-064175
MZTI,LANCASTER COLONY CORPORATION COMMON STOCK NPV,513847103,3662000.0,32814,0.007570342581361957,2016-05-10,2016-03-31,0001140361-16-064175
BMY,BRISTOL-MYERS SQUIBB COMPANY COMMON STOCK USD0.10,110122108,3659000.0,57671,0.007564140771491918,2016-05-10,2016-03-31,0001140361-16-064175
TROW,PRICE T.ROWE GROUP INCORPORATED COMMON STOCK USD0.20,74144T108,3651000.0,49400,0.007547602611838478,2016-05-10,2016-03-31,0001140361-16-064175
NEE,NEXTERA ENERGY INCORPORATED COMMON STOCK USD0.01,65339F101,3621000.0,30557,0.00748558451313808,2016-05-10,2016-03-31,0001140361-16-064175
TECK,TECK RESOURCES LIMITED CLASS 'B' SUBORDINATED VOTING COMMON NPV,878742204,3619000.0,356870,0.007481449973224719,2016-05-10,2016-03-31,0001140361-16-064175
AEM,AGNICO EAGLE MINES LIMITED COMMON NPV,008474108,3617000.0,75900,0.00747731543331136,2016-05-10,2016-03-31,0001140361-16-064175
ARE,ALEXANDRIA REAL ESTATE EQUITIES INCORPORATED REIT USD0.01,015271109,3615000.0,40015,0.007473180893397999,2016-05-10,2016-03-31,0001140361-16-064175
MBI,MBIA INC COM STK US$1,55262C100,3590000.0,408428,0.007421499144481002,2016-05-10,2016-03-31,0001140361-16-064175
XECEUR,CIMAREX ENERGY COMPANY COMMON STOCK USD0.01,171798101,3590000.0,37184,0.007421499144481002,2016-05-10,2016-03-31,0001140361-16-064175
N/A,TE CONNECTIVITY LIMITED CHF0.77 (US LISTING),H84989104,3590000.0,58680,0.007421499144481002,2016-05-10,2016-03-31,0001140361-16-064175
AMZN,AMAZON COMMUNICATIONS INCORPORATED USD0.01,023135106,3574000.0,5970,0.007388422825174122,2016-05-10,2016-03-31,0001140361-16-064175
LPTUSD,LIBERTY PROPERTY TRUST REIT USD0.001,531172104,3573000.0,107151,0.007386355555217442,2016-05-10,2016-03-31,0001140361-16-064175
MSFT,MICROSOFT CORPORATION COMMON STOCK USD0.0000125,594918104,3563000.0,64727,0.007365682855650643,2016-05-10,2016-03-31,0001140361-16-064175
GILD,GILEAD SCIENCES INCORPORATED COMMON STOCK USD0.001,375558103,3545000.0,38542,0.007328471996430403,2016-05-10,2016-03-31,0001140361-16-064175
N/A,SENSATA TECHNOLOGIES HOLDING NV USD0.01,N7902X106,3538000.0,90915,0.007314001106733644,2016-05-10,2016-03-31,0001140361-16-064175
EXPD,EXPEDITORS INTERNATIONAL OF WASHINGTON I NCORPORATED COMMON STOCK USD0.01,302130109,3531000.0,72500,0.007299530217036884,2016-05-10,2016-03-31,0001140361-16-064175
TDC,TERADATA CORPORATION COMMON STOCK USD0.01,88076W103,3525000.0,135000,0.007287126597296805,2016-05-10,2016-03-31,0001140361-16-064175
MDT,MEDTRONIC PLC USD0.10,G5960L103,3516000.0,46619,0.007268521167686686,2016-05-10,2016-03-31,0001140361-16-064175
MRO*,MARATHON OIL CORPORATION COMMON STOCK USD1,565849106,3494000.0,331775,0.007223041228639726,2016-05-10,2016-03-31,0001140361-16-064175
N/A,INTELIQUENT INCORPORATED COMMON STOCK USD0.001,45825N107,3484000.0,217502,0.007202368529072927,2016-05-10,2016-03-31,0001140361-16-064175
GLW,CORNING INCORPORATED COMMON STOCK USD0.50,219350105,3477000.0,166844,0.007187897639376168,2016-05-10,2016-03-31,0001140361-16-064175
SNA,SNAP-ON INCORPORATED COMMON STOCK USD1,833034101,3472000.0,21900,0.007177561289592768,2016-05-10,2016-03-31,0001140361-16-064175
PEP,PEPSICO INCORPORATED CAPITAL STOCK USD0.016666,713448108,3470000.0,33792,0.007173426749679407,2016-05-10,2016-03-31,0001140361-16-064175
AMGN,AMGEN INCORPORATED COMMON STOCK USD0.0001,031162100,3455000.0,23116,0.0071424177003292086,2016-05-10,2016-03-31,0001140361-16-064175
DEI,DOUGLAS EMMETT INCORPORATED REIT USD0.01,25960P109,3447000.0,114586,0.007125879540675769,2016-05-10,2016-03-31,0001140361-16-064175
N/A,MICHAEL KORS HOLDINGS LIMITED COMMON STOCK NPV,G60754101,3446000.0,60600,0.00712381227071909,2016-05-10,2016-03-31,0001140361-16-064175
N/A,REYNOLDS AMERICAN INCORPORATED COMMON STOCK USD0.0001,761713106,3438000.0,68108,0.00710727411106565,2016-05-10,2016-03-31,0001140361-16-064175
LVS,LAS VEGAS SANDS CORPORATION COMMON STOCK USD0.001,517834107,3404000.0,65175,0.007036986932538531,2016-05-10,2016-03-31,0001140361-16-064175
TMO,THERMO FISHER SCIENTIFIC INCORPORATED COMMON STOCK USD1,883556102,3403000.0,24170,0.007034919662581852,2016-05-10,2016-03-31,0001140361-16-064175
PEB,PEBBLEBROOK HOTEL TRUST REIT USD0.01,70509V100,3401000.0,117572,0.007030785122668491,2016-05-10,2016-03-31,0001140361-16-064175
HP,HELMERICH & PAYNE INCORPORATED COMMON STOCK USD0.10,423452101,3384000.0,58034,0.006995641533404933,2016-05-10,2016-03-31,0001140361-16-064175
PBR,PETROLEO BRASILEIRO - PETROBRAS ADS (EACH REPRESENTING 2 COMMON SHARES),71654V408,3381000.0,576900,0.006989439723534892,2016-05-10,2016-03-31,0001140361-16-064175
RMD,RESMED INCORPORATED COMMON STOCK USD0.004,761152107,3375000.0,59323,0.006977036103794813,2016-05-10,2016-03-31,0001140361-16-064175
PS1,COMPUTER PROGRAM SYSTEMS,205306103,3366000.0,63646,0.006958430674184693,2016-05-10,2016-03-31,0001140361-16-064175
ORCL,ORACLE CORPORATION COMMON STOCK USD0.01,68389X105,3362000.0,82067,0.006950161594357973,2016-05-10,2016-03-31,0001140361-16-064175
N/A,SILVER SPRING NETWORKS INC COMMON STOCK USD0.001,82817Q103,3357000.0,228202,0.006939825244574574,2016-05-10,2016-03-31,0001140361-16-064175
VAREUR,VARIAN MEDICAL SYSTEMS INCORPORATED COMMON STOCK USD1,92220P105,3352000.0,42000,0.0069294888947911745,2016-05-10,2016-03-31,0001140361-16-064175
BKE,BUCKLE INCORPORATED (THE) COMMON STOCK USD0.01,118440106,3342000.0,98200,0.006908816195224375,2016-05-10,2016-03-31,0001140361-16-064175
EMB,ISHARES TRUST JP MORGAN USD EMERGING MARKETS BOND ETF,464288281,3335000.0,30282,0.006894345305527615,2016-05-10,2016-03-31,0001140361-16-064175
SBUX,STARBUCKS CORPORATION COMMON STOCK USD0.001,855244109,3323000.0,55381,0.006869538066047455,2016-05-10,2016-03-31,0001140361-16-064175
PBR/A,PETROL BRASILEIRO-PETROBRAS SA SPONSORED ADR (EACH REPRESENTS 2 PREFERENCE SHARE NPV),71654V101,3303000.0,716500,0.006828192666913856,2016-05-10,2016-03-31,0001140361-16-064175
ABG,AMERISOURCE BERGEN CORPORATION CLASS 'A' COMMON STOCK USD0.01,03073E105,3303000.0,37930,0.006828192666913856,2016-05-10,2016-03-31,0001140361-16-064175
BMY,BRISTOL-MYERS SQUIBB COMPANY COMMON STOCK USD0.10,110122108,3301000.0,52039,0.006824058127000497,2016-05-10,2016-03-31,0001140361-16-064175
IT,GARTNER INCORPORATED COMMON STOCK USD0.0005,366651107,3291000.0,37276,0.006803385427433698,2016-05-10,2016-03-31,0001140361-16-064175
TUP,TUPPERWARE BRANDS CORPORATION COMMON STOCK USD0.01,899896104,3287000.0,57100,0.006795116347606978,2016-05-10,2016-03-31,0001140361-16-064175
ELV,ANTHEM INCORPORATED COMMON STOCK USD0.01,036752103,3263000.0,23309,0.00674550186864666,2016-05-10,2016-03-31,0001140361-16-064175
MCX,MCCORMICK & COMPANY INCORPORATED COMMON STOCK NON VOTING NPV,579780206,3240000.0,32478,0.006697954659643021,2016-05-10,2016-03-31,0001140361-16-064175
KSUEUR,KANSAS CITY SOUTHERN COMMON STOCK USD0.01,485170302,3230000.0,37644,0.006677281960076221,2016-05-10,2016-03-31,0001140361-16-064175
N/A,STARWOOD HOTELS AND RESORTS WORLDWIDE INCORPORATED COMMON STOCK USD0.01,85590A401,3229000.0,38600,0.00667521469011954,2016-05-10,2016-03-31,0001140361-16-064175
N/A,LABORATORY CORPORATION OF AMERICA HOLDINGS COMMON STOCK USD0.01,50540R409,3227000.0,27381,0.006671080150206181,2016-05-10,2016-03-31,0001140361-16-064175
QCOM,QUALCOMM INCORPORATED COMMON STOCK USD0.0001,747525103,3222000.0,63193,0.006660743800422781,2016-05-10,2016-03-31,0001140361-16-064175
N/A,VANTIV INCORPORATED CLASS A COMMON STOCK USD0.00001,92210H105,3217000.0,59712,0.006650407450639382,2016-05-10,2016-03-31,0001140361-16-064175
INTU,INTUIT INC COMMON STOCK USD0.01,461202103,3199000.0,31000,0.006613196591419143,2016-05-10,2016-03-31,0001140361-16-064175
VTWO,VANGUARD RUSSELL 2000,92206C664,3191000.0,36080,0.006596658431765703,2016-05-10,2016-03-31,0001140361-16-064175
TSS,TOTAL SYSTEM SERVICES INCORPORATED COMMON STOCK USD0.10,891906109,3179000.0,68000,0.0065718511922855435,2016-05-10,2016-03-31,0001140361-16-064175
ALXN,ALEXION PHARMACEUTICALS INCORPORATED COMMON STOCK USD0.0001,015351109,3178000.0,23570,0.006569783922328864,2016-05-10,2016-03-31,0001140361-16-064175
UAL,UNITED CONTINENTAL HOLDINGS INCORPORATED COMMON STOCK USD0.01,910047109,3174000.0,53059,0.0065615148425021445,2016-05-10,2016-03-31,0001140361-16-064175
PPL,PPL CORPORATION COMMON STOCK USD0.01,69351T106,3161000.0,83858,0.006534640333065305,2016-05-10,2016-03-31,0001140361-16-064175
BRSSUSD,GLOBAL BRASS AND COPPER HOLDINGS INCORPORATED COMMON STOCK USD0.01,37953G103,3156000.0,125200,0.006524303983281905,2016-05-10,2016-03-31,0001140361-16-064175
N/A,COACH INCORPORATED COMMON STOCK USD0.01,189754104,3120000.0,77377,0.006449882264841426,2016-05-10,2016-03-31,0001140361-16-064175
AXS,AXIS CAPITAL HOLDINGS LIMITED COMMON STOCK USD0.0125,G0692U109,3112000.0,56599,0.006433344105187988,2016-05-10,2016-03-31,0001140361-16-064175
N/A,DCT INDUSTRIAL TRUST INCORPORATED REIT USD0.01,233153204,3098000.0,77731,0.006404402325794468,2016-05-10,2016-03-31,0001140361-16-064175
N/A,CIGNA CORPORATION COMMON STOCK USD0.25,125509109,3096000.0,22525,0.006400267785881109,2016-05-10,2016-03-31,0001140361-16-064175
BBBYEUR,BED BATH AND BEYOND COMMON STOCK USD0.01,075896100,3087000.0,62242,0.006381662356270989,2016-05-10,2016-03-31,0001140361-16-064175
EC,ECOPETROL SA SPONSORED ADR (EACH REPRESENTS 20 ORDINARY COP250),279158109,3079000.0,358397,0.006365124196617549,2016-05-10,2016-03-31,0001140361-16-064175
TCO,TAUBMAN CENTERS INCORPORATED REIT USD0.01,876664103,3077000.0,43699,0.00636098965670419,2016-05-10,2016-03-31,0001140361-16-064175
9990302D,APACHE CORPORATION COMMON STOCK USD0.625,037411105,3076000.0,63238,0.00635892238674751,2016-05-10,2016-03-31,0001140361-16-064175
MCHP,MICROCHIP TECHNOLOGY INCORPORATED COMMON STOCK USD0.001,595017104,3072000.0,62900,0.00635065330692079,2016-05-10,2016-03-31,0001140361-16-064175
ELS,EQUITY LIFESTYLE PROPERTIES INCORPORATED REIT USD0.01,29472R108,3051000.0,42697,0.006307240637830511,2016-05-10,2016-03-31,0001140361-16-064175
N/A,PRICELINE GROUP INCORPORATED (THE) COMMON STOCK USD0.008,741503403,3048000.0,2314,0.006301038827960471,2016-05-10,2016-03-31,0001140361-16-064175
CVS,CVS HEALTH CORPORATION COMMON STOCK USD0.01,126650100,3037000.0,29186,0.006278298858436992,2016-05-10,2016-03-31,0001140361-16-064175
SHO,SUNSTONE HOTEL INVESTORS INCORPORATED REIT USD0.01,867892101,3035000.0,222654,0.0062741643185236316,2016-05-10,2016-03-31,0001140361-16-064175
CCL,CARNIVAL CORPORATION COMMON STOCK USD0.01 (PAIRED STOCK),143658300,3019000.0,57645,0.006241087999216752,2016-05-10,2016-03-31,0001140361-16-064175
VRSN,VERISIGN INCORPORATED COMMON STOCK USD0.001,92343E102,3018000.0,33692,0.006239020729260073,2016-05-10,2016-03-31,0001140361-16-064175
MO,ALTRIA GROUP INCORPORATED COMMON STOCK USD0.3333,02209S103,3010000.0,48096,0.006222482569606633,2016-05-10,2016-03-31,0001140361-16-064175
LECO,LINCOLN ELECTRIC HOLDINGS INCORPORATED COMMON STOCK NPV,533900106,3009000.0,51700,0.006220415299649953,2016-05-10,2016-03-31,0001140361-16-064175
YPF,YPF SA SPONSORED ADR (EACH CONVERT INTO 1 CLASS 'D'),984245100,3003000.0,169750,0.006208011679909874,2016-05-10,2016-03-31,0001140361-16-064175
N/A,WHOLE FOODS MARKET INCORPORATED COMMON STOCK NPV,966837106,2995000.0,93991,0.006191473520256435,2016-05-10,2016-03-31,0001140361-16-064175
SFM,SPROUTS FARMERS MARKETS INCORPORATED COMMON STOCK USD0.001,85208M102,2992000.0,102353,0.006185271710386394,2016-05-10,2016-03-31,0001140361-16-064175
FLXN,Flexion Therapeutics Inc COMMON STOCKUSD0.001000,33938J106,2984000.0,331530,0.006168733550732954,2016-05-10,2016-03-31,0001140361-16-064175
WAT,WATERS CORPORATION COMMON STOCK USD0.01,941848103,2975000.0,22508,0.006150128121122835,2016-05-10,2016-03-31,0001140361-16-064175
CTCMEUR,CTC MEDIA INCORPORATED COMMON STOCK NPV,12642X106,2956000.0,1508405,0.006110849991945917,2016-05-10,2016-03-31,0001140361-16-064175
TSCO,TRACTOR SUPPLY COMPANY COMMON STOCK USD0.008,892356106,2932000.0,32328,0.0060612355129855975,2016-05-10,2016-03-31,0001140361-16-064175
TWXCHF,TIME WARNER INCORPORATED COMMON STOCK USD0.01,887317303,2928000.0,40572,0.006052966433158878,2016-05-10,2016-03-31,0001140361-16-064175
TMK,TORCHMARK CORPORATION COMMON STOCK USD1,891027104,2926000.0,53400,0.006048831893245518,2016-05-10,2016-03-31,0001140361-16-064175
WLK,WESTLAKE CHEMICAL CORPORATION COMMON STOCK USD0.01,960413102,2923000.0,62300,0.006042630083375478,2016-05-10,2016-03-31,0001140361-16-064175
BIDUN,BAIDU INCORPORATED SPONSORED ADR (EACH REPRESENTS 0.10 CLASS A SHARES),056752108,2915000.0,15353,0.006026091923722038,2016-05-10,2016-03-31,0001140361-16-064175
BALL,BALL CORPORATION COMMON STOCK NPV,058498106,2912000.0,41070,0.006019890113851999,2016-05-10,2016-03-31,0001140361-16-064175
N/A,HOMEINNS HOTEL GROUP ADR (EACH REPRESENTS 2 ORDINARY SHARES),43742E102,2902000.0,81421,0.005999217414285199,2016-05-10,2016-03-31,0001140361-16-064175
SWK,STANLEY BLACK AND DECKER INCORPORATED COMMON STOCK USD2.50,854502101,2874000.0,27325,0.005941333855498161,2016-05-10,2016-03-31,0001140361-16-064175
TGT,TARGET CORPORATION COMMON STOCK USD0.167,87612E106,2872000.0,34354,0.005937199315584801,2016-05-10,2016-03-31,0001140361-16-064175
CUBE,CUBESMART REIT USD0.01,229663109,2872000.0,86863,0.005937199315584801,2016-05-10,2016-03-31,0001140361-16-064175
RHT1EUR,RED HAT INCORPORATED COMMON STOCK USD0.0001,756577102,2869000.0,38752,0.005930997505714761,2016-05-10,2016-03-31,0001140361-16-064175
VEU,VANGUARD FTSE ALL-WORLD EX-U,922042775,2862000.0,65800,0.0059165266160180014,2016-05-10,2016-03-31,0001140361-16-064175
DGT,SPDR SERIES TRUST SPDR DJ GLOBAL TITANS ETF,78464A706,2856000.0,44190,0.005904122996277922,2016-05-10,2016-03-31,0001140361-16-064175
ACIC,UNITED INSURANCE HOLDINGS CORPORATION COMMON STOCK USD0.0001,910710102,2845000.0,149036,0.005881383026754442,2016-05-10,2016-03-31,0001140361-16-064175
KHC,KRAFT HEINZ COMPANY (THE) COMMON STOCK USD0.01,500754106,2845000.0,36062,0.005881383026754442,2016-05-10,2016-03-31,0001140361-16-064175
AAPL,APPLE INCORPORATED COMMON STOCK NPV,037833100,2844000.0,25955,0.005879315756797763,2016-05-10,2016-03-31,0001140361-16-064175
MDPUSD,MEREDITH CORP COM STK US$1,589433101,2841000.0,59839,0.005873113946927723,2016-05-10,2016-03-31,0001140361-16-064175
EMR,EMERSON ELECTRIC COMPANY COMMON STOCK USD1,291011104,2834000.0,51941,0.005858643057230963,2016-05-10,2016-03-31,0001140361-16-064175
BVN,COMPANIA DE MINAS BUENAVENTURA SA SPONSORED ADR (EACH REPRESENTING 1 COMMON PEN4 LEVEL 1),204448104,2832000.0,383755,0.005854508517317603,2016-05-10,2016-03-31,0001140361-16-064175
EBF,ENNIS INCORPORATED COMMON STOCK USD2.50,293389102,2828000.0,141963,0.005846239437490883,2016-05-10,2016-03-31,0001140361-16-064175
PYPL,PAYPAL HOLDINGS INCORPORATED COMMON STOCK USD0.0001,70450Y103,2826000.0,72400,0.0058421048975775235,2016-05-10,2016-03-31,0001140361-16-064175
PLOW,DOUGLAS DYNAMICS INCORPORATED COMMON STOCK USD0.01,25960R105,2818000.0,121639,0.005825566737924084,2016-05-10,2016-03-31,0001140361-16-064175
N/A,BAXALTA INCORPORATED COMMON STOCK USD1,07177M103,2816000.0,70140,0.005821432198010724,2016-05-10,2016-03-31,0001140361-16-064175
HP,HELMERICH & PAYNE INCORPORATED COMMON STOCK USD0.10,423452101,2806000.0,48122,0.005800759498443925,2016-05-10,2016-03-31,0001140361-16-064175
BMA,BANCO MACRO SA ADR (REPRESENTS 10 CLASS 'B' SHARES ARS1),05961W105,2803000.0,44581,0.005794557688573885,2016-05-10,2016-03-31,0001140361-16-064175
HD,HOME DEPOT INCORPORATED (THE) COMMON STOCK USD0.05,437076102,2802000.0,21003,0.005792490418617205,2016-05-10,2016-03-31,0001140361-16-064175
AVPUSD,AVON PRODUCTS INCORPORATED COMMON STOCK USD0.25,054303102,2801000.0,596021,0.005790423148660525,2016-05-10,2016-03-31,0001140361-16-064175
N/A,TRANSATLANTIC PETROLEUM LIMITED COMMON NPV,G89982113,2786000.0,2704847,0.005759414099310326,2016-05-10,2016-03-31,0001140361-16-064175
BRK/A,BERKSHIRE HATHAWAY INCORPORATED CONVERTIBLE CLASS 'A' COMMON STOCK USD5,084670108,2782000.0,13,0.005751145019483606,2016-05-10,2016-03-31,0001140361-16-064175
N/A,TRIANGLE PETROLEUM CORPORATION COMMON STOCK USD0.00001,89600B201,2780000.0,5162321,0.005747010479570246,2016-05-10,2016-03-31,0001140361-16-064175
N/A,CORE LABORATORIES NV EUR0.02,N22717107,2774000.0,24263,0.005734606859830166,2016-05-10,2016-03-31,0001140361-16-064175
