ticker,nameOfIssuer,cusip,value,shares,allocation_percent,filingDate,reportDate,accessionNumber
CM,CANADIAN IMPERIAL BANK OF COMMERCE COMMON NPV,136069101,508000.0,5000,0.0009190468109618403,2019-02-14,2018-12-31,0001567619-19-003978
FLIR,FLIR SYSTEMS INCORPORATED COMMON STOCK USD0.01,302445101,501000.0,11500,0.00090638278010213,2019-02-14,2018-12-31,0001567619-19-003978
SIGA,SIGA TECHNOLOGIES INCORPORATED COMMON STOCK USD0.0001,826917106,499000.0,63182,0.0009027644855707842,2019-02-14,2018-12-31,0001567619-19-003978
CWEN/A,CLEARWAY ENERGY INCORPORATED COMMON STOCK USD0.01,18539C105,497000.0,29385,0.0008991461910394384,2019-02-14,2018-12-31,0001567619-19-003978
N/A,EURONAV SA NPV,B38564108,497000.0,79977,0.0008991461910394384,2019-02-14,2018-12-31,0001567619-19-003978
GTS,TRIPLE-S MANAGEMENT CORPORATION CLASS B COMMON STOCK USD1,896749108,496000.0,28538,0.0008973370437737654,2019-02-14,2018-12-31,0001567619-19-003978
ORIT,ORITANI FINANCIAL CORPORATION COMMON STOCK USD0.01,68633D103,492000.0,33325,0.0008901004547110738,2019-02-14,2018-12-31,0001567619-19-003978
HIW,HIGHWOODS PROPERTIES INCORPORATED REIT USD0.01,431284108,479000.0,12380,0.0008665815402573259,2019-02-14,2018-12-31,0001567619-19-003978
BRK/B,BERKSHIRE HATHAWAY INCORPORATED CLASS B COMMON STOCK USD0.0033,084670702,479000.0,2344,0.0008665815402573259,2019-02-14,2018-12-31,0001567619-19-003978
MCHP,MICROCHIP TECHNOLOGY INCORPORATED COMMON STOCK USD0.001,595017104,478000.0,6645,0.0008647723929916529,2019-02-14,2018-12-31,0001567619-19-003978
STLD,STEEL DYNAMICS INCORPORATED COMMON STOCK USD0.01,858119100,478000.0,15900,0.0008647723929916529,2019-02-14,2018-12-31,0001567619-19-003978
GPOR1EUR,GULFPORT ENERGY CORPORATION COMMON STOCK USD0.01,402635304,477000.0,72900,0.00086296324572598,2019-02-14,2018-12-31,0001567619-19-003978
AA,ALCOA CORPORATION COMMON STOCK NPV,013872106,475000.0,17866,0.0008593449511946343,2019-02-14,2018-12-31,0001567619-19-003978
VRSK,VERISK ANALYTICS INC COMMON STOCK USD0.001,92345Y106,473000.0,4340,0.0008557266566632884,2019-02-14,2018-12-31,0001567619-19-003978
AVGO,BROADCOM INCORPORATED COMMON STOCK NPV,11135F101,471000.0,1851,0.0008521083621319425,2019-02-14,2018-12-31,0001567619-19-003978
BMO,BANK OF MONTREAL COMMON NPV,063671101,468000.0,5252,0.0008466809203349239,2019-02-14,2018-12-31,0001567619-19-003978
EPP,ISHARES INCORPORATED MSCI PACIFIC EX JAPAN ETF,464286665,465000.0,11425,0.0008412534785379051,2019-02-14,2018-12-31,0001567619-19-003978
MUR,MURPHY OIL CORPORATION COMMON STOCK USD1,626717102,458000.0,19600,0.0008285894476781948,2019-02-14,2018-12-31,0001567619-19-003978
KBIA,KB FINANCIAL GROUP INCORPORATED ADR (EACH REPRESENTS 1 ORDINARY KRW5000),48241A105,458000.0,10900,0.0008285894476781948,2019-02-14,2018-12-31,0001567619-19-003978
PSBUSD,PS BUSINESS PARKS INCORPORATED CLASS A REIT USD0.01,69360J107,457000.0,3490,0.0008267803004125217,2019-02-14,2018-12-31,0001567619-19-003978
N/A,ELDORADO GOLD CORPORATION LIMITED COMMON NPV,284902103,457000.0,594127,0.0008267803004125217,2019-02-14,2018-12-31,0001567619-19-003978
CYD,CHINA YUCHAI INTERNATIONAL COMMON STOCK USD0.10,G21082105,457000.0,36716,0.0008267803004125217,2019-02-14,2018-12-31,0001567619-19-003978
N/A,DELPHI TECHNOLOGIES PLC COMMON STOCK USD0.01,G2709G107,456000.0,31832,0.0008249711531468488,2019-02-14,2018-12-31,0001567619-19-003978
N/A,BROOKFIELD PROPERTY PARTNERS LP UNIT (US LISTING),G16249107,455000.0,28244,0.000823162005881176,2019-02-14,2018-12-31,0001567619-19-003978
ARCH1EUR,ARCH COAL INCORPORATED COMMON STOCK USD0.01,039380407,454000.0,5466,0.0008213528586155029,2019-02-14,2018-12-31,0001567619-19-003978
FDC,FIRST DATA CORP- CLASS A COMMON STOCK USD0.01,32008D106,450000.0,26587,0.0008141162695528113,2019-02-14,2018-12-31,0001567619-19-003978
EVEUR,EATON VANCE CORPORATION COMMON STOCK USD0.00781,278265103,450000.0,12805,0.0008141162695528113,2019-02-14,2018-12-31,0001567619-19-003978
WM,WASTE MANAGEMENT INCORPORATED COMMON STOCK USD0.01,94106L109,446000.0,5009,0.0008068796804901197,2019-02-14,2018-12-31,0001567619-19-003978
DFSEUR,DISCOVER FINANCIAL SERVICES COMMON STOCK USD0.01,254709108,442000.0,7490,0.0007996430914274281,2019-02-14,2018-12-31,0001567619-19-003978
HP5A,EQUITY COMMONWEALTH REIT USD0.01,294628102,441000.0,14707,0.0007978339441617553,2019-02-14,2018-12-31,0001567619-19-003978
LKSDQ,LSC COMMUNICATIONS INC,50218P107,438000.0,62534,0.0007924065023647365,2019-02-14,2018-12-31,0001567619-19-003978
RDNT,RADNET INC COMMON STOCK USD0.0001,750491102,436000.0,42833,0.0007887882078333906,2019-02-14,2018-12-31,0001567619-19-003978
SWN1EUR,SOUTHWESTERN ENERGY COMPANY COMMON STOCK USD0.10,845467109,435000.0,127443,0.0007869790605677177,2019-02-14,2018-12-31,0001567619-19-003978
PPL,PPL CORPORATION COMMON STOCK USD0.01,69351T106,433000.0,15300,0.0007833607660363718,2019-02-14,2018-12-31,0001567619-19-003978
TRI4EUR,THOMSON REUTERS CORPORATION COMMON NPV (US LISTING),884903709,433000.0,3787,0.0007833607660363718,2019-02-14,2018-12-31,0001567619-19-003978
MMS,MAXIMUS INCORPORATED COMMON STOCK NPV,577933104,430000.0,6600,0.000777933324239353,2019-02-14,2018-12-31,0001567619-19-003978
PEP,PEPSICO INCORPORATED CAPITAL STOCK USD0.016666,713448108,429000.0,3882,0.0007761241769736802,2019-02-14,2018-12-31,0001567619-19-003978
VYM,VANGUARD HIGH DVD YIELD ETF,921946406,429000.0,5495,0.0007761241769736802,2019-02-14,2018-12-31,0001567619-19-003978
ORLY,O'REILLY AUTOMOTIVE INCORPORATED COMMON STOCK USD0.01,67103H107,427000.0,1240,0.0007725058824423344,2019-02-14,2018-12-31,0001567619-19-003978
XOM,EXXON MOBIL CORPORATION COMMON STOCK NPV,30231G102,426000.0,6245,0.0007706967351766614,2019-02-14,2018-12-31,0001567619-19-003978
EZU,ISHARES TRUST MSCI EUROZONE ETF,464286608,426000.0,12140,0.0007706967351766614,2019-02-14,2018-12-31,0001567619-19-003978
CRI,CARTER HOLDINGS INCORPORATED COMMON STOCK USD0.01,146229109,424000.0,5200,0.0007670784406453156,2019-02-14,2018-12-31,0001567619-19-003978
N/A,LINDE PUBLIC LIMITED COMPANY EUR0.001,G5494J103,419000.0,2684,0.000758032704316951,2019-02-14,2018-12-31,0001567619-19-003978
PH,PARKER-HANNIFIN CORPORATION COMMON STOCK USD0.5,701094104,418000.0,2800,0.0007562235570512781,2019-02-14,2018-12-31,0001567619-19-003978
8CW,CROWN CASTLE INTERNATIONAL CORPORATION REIT USD0.01,22822V101,417000.0,3843,0.0007544144097856052,2019-02-14,2018-12-31,0001567619-19-003978
EGP,EASTGROUP PROPERTIES INCORPORATED REIT USD0.0001,277276101,416000.0,4540,0.0007526052625199323,2019-02-14,2018-12-31,0001567619-19-003978
RDY,DR REDDY'S LABORATORIES LIMITED ADR (EACH REPRESENTING 1 ORDINARY SHARE),256135203,415000.0,10996,0.0007507961152542593,2019-02-14,2018-12-31,0001567619-19-003978
AELUSD,AMERICAN EQUITY INVESTMENT LIFE HOLDING COMPANY COMMON STOCK USD1,025676206,415000.0,14857,0.0007507961152542593,2019-02-14,2018-12-31,0001567619-19-003978
PGR,PROGRESSIVE CORPORATION (OHIO) COMMON STOCK USD1,743315103,414000.0,6866,0.0007489869679885864,2019-02-14,2018-12-31,0001567619-19-003978
TEN1,TENNECO INCORPORATED COMMON STOCK USD0.01,880349105,411000.0,15000,0.0007435595261915677,2019-02-14,2018-12-31,0001567619-19-003978
7HP,HP INCORPORATED COMMON STOCK USD0.01,40434L105,410000.0,20021,0.0007417503789258948,2019-02-14,2018-12-31,0001567619-19-003978
WLK,WESTLAKE CHEMICAL CORPORATION COMMON STOCK USD0.01,960413102,410000.0,6200,0.0007417503789258948,2019-02-14,2018-12-31,0001567619-19-003978
EL,ESTEE LAUDER COMPANIES INC CLASS'A'COM STK USD0.01,518439104,409000.0,3142,0.0007399412316602219,2019-02-14,2018-12-31,0001567619-19-003978
VMBS,VANGUARD MORTGAGE-BACKED SECURITIES ETF,92206C771,408000.0,7923,0.0007381320843945489,2019-02-14,2018-12-31,0001567619-19-003978
ATVIEUR,ACTIVISION BLIZZARD INCORPORATED COMMON STOCK USD0.000001,00507V109,408000.0,8766,0.0007381320843945489,2019-02-14,2018-12-31,0001567619-19-003978
JBGS,JBG SMITH PROPERTIES REIT USD0.01,46590V100,405000.0,11648,0.0007327046425975302,2019-02-14,2018-12-31,0001567619-19-003978
MET,METLIFE INCORPORATED COMMON STOCK USD0.01,59156R108,404000.0,9830,0.0007308954953318573,2019-02-14,2018-12-31,0001567619-19-003978
RSG,REPUBLIC SERVICES INCORORATED COMMON STOCK USD0.01,760759100,403000.0,5586,0.0007290863480661844,2019-02-14,2018-12-31,0001567619-19-003978
N/A,COUSINS PROPERTIES INC REIT USD1,222795106,401000.0,50762,0.0007254680535348386,2019-02-14,2018-12-31,0001567619-19-003978
IBN,ICICI BANK LIMITED SPONSORED ADR (EACH REPRESENTS 2 ORDINARY INR10),45104G104,398000.0,38648,0.0007200406117378198,2019-02-14,2018-12-31,0001567619-19-003978
SYF,SYNCHRONY FINANCIAL COMMON STOCK  USD0.001,87165B103,397000.0,16912,0.0007182314644721469,2019-02-14,2018-12-31,0001567619-19-003978
ADI,ANALOG DEVICES INCORPORATED COMMON STOCK USD0.166,032654105,397000.0,4631,0.0007182314644721469,2019-02-14,2018-12-31,0001567619-19-003978
HPE,HEWLETT PACKARD ENTERPRISE COMMON STOCK USD0.01,42824C109,396000.0,29955,0.0007164223172064741,2019-02-14,2018-12-31,0001567619-19-003978
VOO,VANGUARD INDEX FUNDS S&P 500 ETF,922908363,395000.0,1720,0.000714613169940801,2019-02-14,2018-12-31,0001567619-19-003978
BBSI,BARRETT BUSINESS SERVICES INCORPORATED COMMON STOCK USD0.01,068463108,395000.0,6895,0.000714613169940801,2019-02-14,2018-12-31,0001567619-19-003978
EXEL,EXELIXIS INCORPORATED COMMON STOCK USD0.001,30161Q104,394000.0,20045,0.0007128040226751282,2019-02-14,2018-12-31,0001567619-19-003978
N/A,LOXO ONCOLOGY INC COMMON STOCK USD0.0001,548862101,394000.0,2815,0.0007128040226751282,2019-02-14,2018-12-31,0001567619-19-003978
AMT,AMERICAN TOWER CORPORATION REIT USD0.01,03027X100,393000.0,2484,0.0007109948754094553,2019-02-14,2018-12-31,0001567619-19-003978
DQ,DAQO NEW ENERGY CORPORPORATION ADR(EACH REPRESENTS 25 ORDINARY SHARE),23703Q203,392000.0,16772,0.0007091857281437823,2019-02-14,2018-12-31,0001567619-19-003978
NWLIEUR,NATIONAL WESTERN LIFE GROUP INCORPORATED CLASS A COMMON STOCK USD0.01,638517102,391000.0,1299,0.0007073765808781094,2019-02-14,2018-12-31,0001567619-19-003978
RMR,RMR GROUP INCORPORATED (THE) A NPV,74967R106,389000.0,7320,0.0007037582863467636,2019-02-14,2018-12-31,0001567619-19-003978
EXPD,EXPEDITORS INTERNATIONAL OF WASHINGTON I NCORPORATED COMMON STOCK USD0.01,302130109,388000.0,5700,0.0007019491390810907,2019-02-14,2018-12-31,0001567619-19-003978
VVV,VALVOLINE INCORPORATED COMMON STOCK USD0.01,92047W101,387000.0,20003,0.0007001399918154178,2019-02-14,2018-12-31,0001567619-19-003978
ATR,APTARGROUP INCORPORATED COMMON STOCK USD0.01,038336103,386000.0,4100,0.0006983308445497449,2019-02-14,2018-12-31,0001567619-19-003978
NHI,NATIONAL HEALTH INVESTORS INCORPORATED REIT USD0.01,63633D104,385000.0,5095,0.0006965216972840719,2019-02-14,2018-12-31,0001567619-19-003978
DTE,DTE ENERGY COMPANY NPV,233331107,383000.0,3471,0.0006929034027527261,2019-02-14,2018-12-31,0001567619-19-003978
CRVL,CORVEL CORPORATION COMMON STOCK USD0.0001,221006109,382000.0,6187,0.0006910942554870532,2019-02-14,2018-12-31,0001567619-19-003978
VRSN,VERISIGN INCORPORATED COMMON STOCK USD0.001,92343E102,382000.0,2573,0.0006910942554870532,2019-02-14,2018-12-31,0001567619-19-003978
N/A,PENTAIR PLC COMMON STOCK USD0.167,G7S00T104,381000.0,10088,0.0006892851082213803,2019-02-14,2018-12-31,0001567619-19-003978
BBBYEUR,BED BATH AND BEYOND COMMON STOCK USD0.01,075896100,380000.0,33542,0.0006874759609557074,2019-02-14,2018-12-31,0001567619-19-003978
WWEUSD,WORLD WRESTLING ENTERTAINMENT INCORPORATED COMMON STOCK USD0.01,98156Q108,379000.0,5069,0.0006856668136900344,2019-02-14,2018-12-31,0001567619-19-003978
BURL,BURLINGTON STORES INC COMMON STOCK USD0.0001,122017106,377000.0,2317,0.0006820485191586887,2019-02-14,2018-12-31,0001567619-19-003978
CF,CF INDUSTRIES HOLDINGS INCORPORATED COMMON STOCK USD0.01,125269100,377000.0,8669,0.0006820485191586887,2019-02-14,2018-12-31,0001567619-19-003978
EXAS,EXACT SCIENCES CORP COMMON USD0.010000,30063P105,374000.0,5926,0.0006766210773616699,2019-02-14,2018-12-31,0001567619-19-003978
NDAQ,NASDAQ INCORPORATED COMMON STOCK USD0.01,631103108,374000.0,4582,0.0006766210773616699,2019-02-14,2018-12-31,0001567619-19-003978
CTXSEUR,CITRIX SYSTEMS INCORPORATED COMMON STOCK USD0.001,177376100,372000.0,3626,0.0006730027828303241,2019-02-14,2018-12-31,0001567619-19-003978
MRK,MERCK AND COMPANY INCORPORATED NEW COMMON STOCK USD0.01,58933Y105,370000.0,4841,0.0006693844882989783,2019-02-14,2018-12-31,0001567619-19-003978
FFIV,F5 NETWORKS INCORPORATED COMMON STOCK NPV,315616102,369000.0,2280,0.0006675753410333053,2019-02-14,2018-12-31,0001567619-19-003978
WRI,WEINGARTEN REALTY INVESTORS REIT USD0.03,948741103,369000.0,14888,0.0006675753410333053,2019-02-14,2018-12-31,0001567619-19-003978
RHI,ROBERT HALF INTERNATIONAL INCORPORATE COMMON STOCK USD1,770323103,366000.0,6401,0.0006621478992362865,2019-02-14,2018-12-31,0001567619-19-003978
SHO,SUNSTONE HOTEL INVESTORS INCORPORATED REIT USD0.01,867892101,365000.0,28025,0.0006603387519706137,2019-02-14,2018-12-31,0001567619-19-003978
DXC,DXC TECHNOLOGY COMPANY COMMON STOCK USD0.01,23355L106,365000.0,6869,0.0006603387519706137,2019-02-14,2018-12-31,0001567619-19-003978
BCPC,BALCHEM CORPORATION COMMON STOCK USD0.0667,057665200,360000.0,4600,0.0006512930156422492,2019-02-14,2018-12-31,0001567619-19-003978
WU,WESTERN UNION COMPANY (THE) COMMON STOCK USD0.01,959802109,358000.0,20963,0.0006476747211109032,2019-02-14,2018-12-31,0001567619-19-003978
LEMB,ISHARES JP MORGAN EM LOCAL CURRENCY ETF,464286517,358000.0,8313,0.0006476747211109032,2019-02-14,2018-12-31,0001567619-19-003978
DAL,DELTA AIR LINES INCORPORATED COMMON STOCK USD0.0001,247361702,357000.0,7147,0.0006458655738452304,2019-02-14,2018-12-31,0001567619-19-003978
GWW,GRAINGER(W.W.) INC COMMON STOCK USD0.50,384802104,357000.0,1263,0.0006458655738452304,2019-02-14,2018-12-31,0001567619-19-003978
GFI,GOLD FIELDS LIMITED SPONSORED ADR (EACH REPRESENTS 1 ORDINARY),38059T106,357000.0,101300,0.0006458655738452304,2019-02-14,2018-12-31,0001567619-19-003978
IVZ,INVESCO LIMITED ORDINARY USD0.10,G491BT108,356000.0,21250,0.0006440564265795574,2019-02-14,2018-12-31,0001567619-19-003978
BFH,ALLIANCE DATA SYSTEMS CORPORATION COMMON STOCK USD0.01,018581108,356000.0,2375,0.0006440564265795574,2019-02-14,2018-12-31,0001567619-19-003978
SIRIEUR,SIRIUS XM HOLDINGS INCORPORATED COMMON STOCK USD0.001,82968B103,354000.0,61961,0.0006404381320482116,2019-02-14,2018-12-31,0001567619-19-003978
CMCSA,COMCAST CORPORATION CLASS A COMMON STOCK USD1,20030N101,351000.0,10321,0.0006350106902511929,2019-02-14,2018-12-31,0001567619-19-003978
FTNT,FORTINET INCORPORATED COMMON STOCK USD0.001,34959E109,351000.0,4977,0.0006350106902511929,2019-02-14,2018-12-31,0001567619-19-003978
IBM,INTL BUSINESS MACHINES CORPORATION COMMON STOCK USD0.20,459200101,350000.0,3080,0.00063320154298552,2019-02-14,2018-12-31,0001567619-19-003978
MAR,MARRIOTT INTERNATIONAL INCORPORATED CLASS A COMMON STOCK USD1,571903202,348000.0,3203,0.0006295832484541742,2019-02-14,2018-12-31,0001567619-19-003978
TCO,TAUBMAN CENTERS INCORPORATED REIT USD0.01,876664103,347000.0,7633,0.0006277741011885012,2019-02-14,2018-12-31,0001567619-19-003978
VEDL,VEDANTA LIMITED ADR(EACH REPRESENTS 4 ORDINARY SHARES),92242Y100,346000.0,30000,0.0006259649539228282,2019-02-14,2018-12-31,0001567619-19-003978
ES,EVERSOURCE ENERGY COMMON STOCK USD5,30040W108,346000.0,5325,0.0006259649539228282,2019-02-14,2018-12-31,0001567619-19-003978
CLRUSD,CONTINENTAL RESOURCES INCORPORATED COMMON STOCK USD0.01,212015101,344000.0,8564,0.0006223466593914825,2019-02-14,2018-12-31,0001567619-19-003978
BTG,B2GOLD CORPORATION COMMON NPV,11777Q209,343000.0,85938,0.0006205375121258095,2019-02-14,2018-12-31,0001567619-19-003978
NTES,NETEASE INCORPORATED ADR (EACH REPRESENTS 25 SHARES USD0.0001),64110W102,342000.0,1454,0.0006187283648601366,2019-02-14,2018-12-31,0001567619-19-003978
USNA,USANA HEALTH SCIENCES INCORPORATED COMMON STOCK USD0.001,90328M107,341000.0,2900,0.0006169192175944637,2019-02-14,2018-12-31,0001567619-19-003978
BAX,BAXTER INTERNATIONAL INCORPORATED COMMON STOCK USD1,071813109,340000.0,5162,0.0006151100703287908,2019-02-14,2018-12-31,0001567619-19-003978
ISRG,INTUITIVE SURGICAL COMMON STOCK USD0.001,46120E602,335000.0,700,0.0006060643340004263,2019-02-14,2018-12-31,0001567619-19-003978
CHKEUR,CHESAPEAKE ENERGY CORPORATE COMMON STOCK USD0.01,165167107,334000.0,159167,0.0006042551867347533,2019-02-14,2018-12-31,0001567619-19-003978
INFY,INFOSYS LIMITED SPONSORED ADR (EACH REPRESENTS 1 ORDINARY INR5),456788108,332000.0,34823,0.0006006368922034075,2019-02-14,2018-12-31,0001567619-19-003978
CAH,CARDINAL HEALTH CORPORATION INCORPORATED COMMON STOCK NPV,14149Y108,332000.0,7453,0.0006006368922034075,2019-02-14,2018-12-31,0001567619-19-003978
NTR,NUTRIEN LIMITED NPV,67077M108,331000.0,5169,0.0005988277449377346,2019-02-14,2018-12-31,0001567619-19-003978
BBY,BEST BUY COMPANY INCORPORATED COMMON STOCK USD0.10,086516101,331000.0,6259,0.0005988277449377346,2019-02-14,2018-12-31,0001567619-19-003978
SBRA,SABRA HEALTHCARE INCORPORATED REIT USD0.01,78573L106,331000.0,20062,0.0005988277449377346,2019-02-14,2018-12-31,0001567619-19-003978
WIT,WIPRO LIMITED ADR (EACH REPRESENTING 1 ORDINARY INR2),97651M109,330000.0,64416,0.0005970185976720616,2019-02-14,2018-12-31,0001567619-19-003978
N/A,FIAT CHRYSLER AUTOMOBILES NV EUR0.01 (ITALIAN LISTING),N31738102,329000.0,25915,0.0005952094504063887,2019-02-14,2018-12-31,0001567619-19-003978
N/A,CANADIAN PACIFIC RAILWAY LTD,13645T100,327000.0,1350,0.0005915911558750429,2019-02-14,2018-12-31,0001567619-19-003978
HCA,HCA HEALTHCARE INCORPORATED COMMON STOCK USD0.01,40412C101,326000.0,2619,0.00058978200860937,2019-02-14,2018-12-31,0001567619-19-003978
LNTH,LANTHEUS HOLDINGS INCORPORATED COMMON STOCK USD0.01,516544103,326000.0,20819,0.00058978200860937,2019-02-14,2018-12-31,0001567619-19-003978
URI,UNITED RENTALS INCORPORATED COMMON STOCK USD0.01,911363109,325000.0,3168,0.0005879728613436971,2019-02-14,2018-12-31,0001567619-19-003978
FEZ,SPDR EURO STOXX 50 ETF,78463X202,324000.0,9750,0.0005861637140780241,2019-02-14,2018-12-31,0001567619-19-003978
XYL,XYLEM INCORPORATED COMMON STOCK NPV,98419M100,323000.0,4837,0.0005843545668123513,2019-02-14,2018-12-31,0001567619-19-003978
N/A,ROWAN COMPANIES PLC COMMON STOCK USD0.125,G7665A101,321000.0,38300,0.0005807362722810055,2019-02-14,2018-12-31,0001567619-19-003978
N/A,CIA PARANAENSE ENER-SP ADR P,20441B407,317000.0,40500,0.0005734996832183137,2019-02-14,2018-12-31,0001567619-19-003978
YRI,YAMANA GOLD INCORPORATED COMMON NPV,98462Y100,314000.0,97800,0.000568072241421295,2019-02-14,2018-12-31,0001567619-19-003978
CLNSEUR,COLONY CAPITAL INCORPORATED REIT USD0.01,19626G108,312000.0,66601,0.0005644539468899492,2019-02-14,2018-12-31,0001567619-19-003978
RPAIUSD,RETAIL PROPERTIES OF AMERICA INCORPORATED REIT USD0.001,76131V202,311000.0,28671,0.0005626447996242764,2019-02-14,2018-12-31,0001567619-19-003978
IPHSEUR,INNOPHOS HOLDINGS INCORPORATED COMMON STOCK USD0.001,45774N108,310000.0,12623,0.0005608356523586033,2019-02-14,2018-12-31,0001567619-19-003978
HAL,HALLIBURTON COMPANY COMMON STOCK USD2.50,406216101,310000.0,11677,0.0005608356523586033,2019-02-14,2018-12-31,0001567619-19-003978
GEO,GEO GROUP INCORPORATED/THE REIT USD0.01,36162J106,309000.0,15684,0.0005590265050929305,2019-02-14,2018-12-31,0001567619-19-003978
REGN,REGENERON PHARMACEUTICALS INCORPORATED COMMON STOCK USD0.001,75886F107,309000.0,828,0.0005590265050929305,2019-02-14,2018-12-31,0001567619-19-003978
SPOT,SPOTIFY TECHNOLOGY SA COMMON STOCK EUR0.000625,L8681T102,308000.0,2716,0.0005572173578272576,2019-02-14,2018-12-31,0001567619-19-003978
PDM,PIEDMONT OFFICE REALTY TRUST INCORPORATED CLASS A REIT USD0.01,720190206,304000.0,17812,0.0005499807687645659,2019-02-14,2018-12-31,0001567619-19-003978
ON,ON SEMICONDUCTOR CORPORATION COMMON STOCK USD0.01,682189105,304000.0,18400,0.0005499807687645659,2019-02-14,2018-12-31,0001567619-19-003978
TUSK,MAMMOTH ENERGY SERVICES INC,56155L108,304000.0,16900,0.0005499807687645659,2019-02-14,2018-12-31,0001567619-19-003978
HEI,HEICO CORPORATION COMMON STOCK USD0.01,422806109,302000.0,3900,0.0005463624742332201,2019-02-14,2018-12-31,0001567619-19-003978
N/A,TWENTY FIRST CENTURY FOX INCORPORATED CLASS A COMMON STOCK USD0.01,90130A101,302000.0,6286,0.0005463624742332201,2019-02-14,2018-12-31,0001567619-19-003978
CCL,CARNIVAL CORPORATION COMMON STOCK USD0.01 (PAIRED STOCK),143658300,301000.0,6115,0.0005445533269675471,2019-02-14,2018-12-31,0001567619-19-003978
CGNX,COGNEX CORPORATION COMMON STOCK USD0.002,192422103,299000.0,7739,0.0005409350324362014,2019-02-14,2018-12-31,0001567619-19-003978
MSGN,MSG NETWORKS INCORPORATED CLASS A COMMON STOCK USD0.01,553573106,297000.0,12600,0.0005373167379048555,2019-02-14,2018-12-31,0001567619-19-003978
VIV1USD,TELEF BRASIL SA SPONSORED ADR (EACH REPRESENTS 1 PREFERENCE SHARE),87936R106,297000.0,24929,0.0005373167379048555,2019-02-14,2018-12-31,0001567619-19-003978
VPL,VANGUARD FTSE PACIFIC ETF,922042866,296000.0,4890,0.0005355075906391826,2019-02-14,2018-12-31,0001567619-19-003978
CNA,CNA FINANCIAL CORPORATION COMMON STOCK USD2.50,126117100,287000.0,6500,0.0005192252652481264,2019-02-14,2018-12-31,0001567619-19-003978
CXPUSD,COLUMBIA PROPERTY TRUST INCORPORATED REIT USD0.01,198287203,287000.0,14817,0.0005192252652481264,2019-02-14,2018-12-31,0001567619-19-003978
TOL,TOLL BROTHERS INCORPORATED COMMON STOCK USD0.01,889478103,286000.0,8700,0.0005174161179824534,2019-02-14,2018-12-31,0001567619-19-003978
BDN,BRANDYWINE REALTY TRUST REIT USD0.01,105368203,281000.0,21815,0.0005083703816540888,2019-02-14,2018-12-31,0001567619-19-003978
DKS,DICK'S SPORTING GOODS INCORPORATED COMMON STOCK USD0.001,253393102,280000.0,8980,0.000506561234388416,2019-02-14,2018-12-31,0001567619-19-003978
XIFR,NEXTERA ENERGY PARTNERS LP NPV,65341B106,279000.0,6480,0.0005047520871227431,2019-02-14,2018-12-31,0001567619-19-003978
HAE,HAEMONETICS CORPORATION COMMON STOCK USD0.01,405024100,276000.0,2760,0.0004993246453257243,2019-02-14,2018-12-31,0001567619-19-003978
CW,CURTISS-WRIGHT CORPORATION COMMON STOCK USD1,231561101,276000.0,2700,0.0004993246453257243,2019-02-14,2018-12-31,0001567619-19-003978
BRSSUSD,GLOBAL BRASS AND COPPER HOLDINGS INCORPORATED COMMON STOCK USD0.01,37953G103,274000.0,10900,0.0004957063507943785,2019-02-14,2018-12-31,0001567619-19-003978
EAT,BRINKER INTERNATIONAL INC,109641100,273000.0,6209,0.0004938972035287055,2019-02-14,2018-12-31,0001567619-19-003978
LOMA,LOMA NEGRA CIA INDUSTRIAL ARGE-ADR (EACH REPRESENTS 5 ORDINARY),54150E104,271000.0,24386,0.0004902789089973597,2019-02-14,2018-12-31,0001567619-19-003978
N/A,ALTISOURCE PORTFOLIO SOLUTIONS SA USD1 (US LISTING),L0175J104,271000.0,12052,0.0004902789089973597,2019-02-14,2018-12-31,0001567619-19-003978
BAC,VERIZON COMMUNICATIONS INCORPORATED COMMON STOCK USD0.10,92343V104,271000.0,4822,0.0004902789089973597,2019-02-14,2018-12-31,0001567619-19-003978
BLKCHF,BLACKROCK INCORPORATED COMMON STOCK USD0.01,09247X101,270000.0,688,0.0004884697617316868,2019-02-14,2018-12-31,0001567619-19-003978
IXN,ISHARES GLOBAL TECH ETF,464287291,269000.0,1865,0.0004866606144660139,2019-02-14,2018-12-31,0001567619-19-003978
ARAUSD,AMERICAN RENAL ASSOCIATES HO,029227105,269000.0,23326,0.0004866606144660139,2019-02-14,2018-12-31,0001567619-19-003978
NGD,NEW GOLD INCORPORATED COMMON NPV,644535106,268000.0,255374,0.00048485146720034103,2019-02-14,2018-12-31,0001567619-19-003978
CXW,CORECIVIC INCORPORATED REIT USD0.01,21871N101,267000.0,14954,0.0004830423199346681,2019-02-14,2018-12-31,0001567619-19-003978
USX1,UNITED STATES STEEL CORPORATION COMMON STOCK USD1,912909108,267000.0,14665,0.0004830423199346681,2019-02-14,2018-12-31,0001567619-19-003978
MDLZ,MONDELEZ INTERNATIONAL INCORPORATED COMMON STOCK USD0.01,609207105,267000.0,6672,0.0004830423199346681,2019-02-14,2018-12-31,0001567619-19-003978
FDX,FEDEX CORPORATION COMMON STOCK USD0.10,31428X106,267000.0,1654,0.0004830423199346681,2019-02-14,2018-12-31,0001567619-19-003978
PPL,PPL CORPORATION COMMON STOCK USD0.01,69351T106,266000.0,9400,0.0004812331726689951,2019-02-14,2018-12-31,0001567619-19-003978
EZU,ISHARES TRUST MSCI EUROZONE ETF,464286608,265000.0,7565,0.00047942402540332224,2019-02-14,2018-12-31,0001567619-19-003978
GCI1EUR,GANNETT COMPANY INCORPORATED COMMON STOCK NPV,36473H104,265000.0,31087,0.00047942402540332224,2019-02-14,2018-12-31,0001567619-19-003978
N/A,AERCAP HOLDINGS NV EUR0.01,N00985106,264000.0,6658,0.0004776148781376493,2019-02-14,2018-12-31,0001567619-19-003978
N/A,ASPEN INSURANCE HOLDINGS LIMITED COMMON STOCK USD0.15144558,G05384105,264000.0,6279,0.0004776148781376493,2019-02-14,2018-12-31,0001567619-19-003978
DVN,DEVON ENERGY CORPORATION COMMON STOCK USD0.10,25179M103,263000.0,11665,0.0004758057308719764,2019-02-14,2018-12-31,0001567619-19-003978
N/A,ROWAN COMPANIES PLC COMMON STOCK USD0.125,G7665A101,259000.0,30900,0.00046856914180928475,2019-02-14,2018-12-31,0001567619-19-003978
CDP,CORPORATE OFFICE PROPERTIES REIT USD0.01,22002T108,258000.0,12270,0.0004667599945436119,2019-02-14,2018-12-31,0001567619-19-003978
BA,BOEING COMPANY (THE) COMMON STOCK USD5,097023105,258000.0,800,0.0004667599945436119,2019-02-14,2018-12-31,0001567619-19-003978
HUN,HUNTSMAN CORPORATION COMMON STOCK USD0.01,447011107,257000.0,13300,0.00046495084727793894,2019-02-14,2018-12-31,0001567619-19-003978
VIG,VANGUARD SPECIALISED PORTFOLIOS VANGUARD DIVIDEND APPRECIATION INDEX FUND ETF,921908844,257000.0,2625,0.00046495084727793894,2019-02-14,2018-12-31,0001567619-19-003978
SAGE,SAGE THERAPEUTICS INC COMMON STOCK USD0.0001,78667J108,254000.0,2650,0.00045952340548092015,2019-02-14,2018-12-31,0001567619-19-003978
PKN,PERKINELMER INC,714046109,253000.0,3227,0.0004577142582152473,2019-02-14,2018-12-31,0001567619-19-003978
FRCB,FIRST REPUBLIC BANK/SAN FRANCISCO CA COMMON STOCK USD0.01,33616C100,253000.0,2917,0.0004577142582152473,2019-02-14,2018-12-31,0001567619-19-003978
PE1EUR,PARSLEY ENERGY INC-CLASS A COMMON STOCK USD0.01,701877102,252000.0,15800,0.00045590511094957434,2019-02-14,2018-12-31,0001567619-19-003978
