ticker,nameOfIssuer,cusip,value,shares,allocation_percent,filingDate,reportDate,accessionNumber
CNSLEUR,CONSOLIDATED COMMUNICATIONS HLDGS INC COMMON STOCK USD0.01,209034107,3224000.0,326312,0.005832690784529475,2019-02-14,2018-12-31,0001567619-19-003978
JWN*,NORDSTROM INCORPORATED COMMON STOCK NPV,655664100,3217000.0,69024,0.0058200267536697645,2019-02-14,2018-12-31,0001567619-19-003978
CYOUUSD,CHANGYOU.COM LIMITED ADR (EACH REPRESENTS 2 CLASS A SHARES),15911M107,3211000.0,175646,0.005809171870075727,2019-02-14,2018-12-31,0001567619-19-003978
WDC,WESTERN DIGITAL CORPORATION COMMON STOCK USD0.01,958102105,3209000.0,86795,0.005805553575544381,2019-02-14,2018-12-31,0001567619-19-003978
EOG,EOG RESOURCES INCORPORATED COMMON STOCK USD0.01,26875P101,3167000.0,36317,0.005729569390386119,2019-02-14,2018-12-31,0001567619-19-003978
NFLX,NETFLIX INCORPORATED COMMON STOCK USD0.001,64110L106,3133000.0,11706,0.00566805838335324,2019-02-14,2018-12-31,0001567619-19-003978
CME,CME GROUP INCORPORATED COMMON STOCK USD0.01,12572Q105,3129000.0,16631,0.005660821794290548,2019-02-14,2018-12-31,0001567619-19-003978
N/A,LAM RESEARCH CORP COMMON STOCK NPV,512807108,3118000.0,22900,0.005640921174368146,2019-02-14,2018-12-31,0001567619-19-003978
GLPI,GAMING AND LEISURE PROPERTIES INC REIT NPV,36467J108,3104000.0,96082,0.005615593112648726,2019-02-14,2018-12-31,0001567619-19-003978
DFODQ,DEAN FOODS COMPANY COMMON STOCK USD0.01,242370203,3098000.0,813043,0.005604738229054688,2019-02-14,2018-12-31,0001567619-19-003978
DE,DEERE & COMPANY COMMON STOCK USD1,244199105,3092000.0,20728,0.0055938833454606506,2019-02-14,2018-12-31,0001567619-19-003978
OMC,OMNICOM GROUP INC COMMON STOCK USD0.15,681919106,3091000.0,42200,0.005592074198194978,2019-02-14,2018-12-31,0001567619-19-003978
MEOH,METHANEX CORPORATION COMMON NPV,59151K108,3079000.0,46900,0.0055703644310069024,2019-02-14,2018-12-31,0001567619-19-003978
ARCPEUR,VEREIT INCORPORATED REIT USD0.01,92339V100,3073000.0,429783,0.005559509547412865,2019-02-14,2018-12-31,0001567619-19-003978
SYF,SYNCHRONY FINANCIAL COMMON STOCK  USD0.001,87165B103,3050000.0,130000,0.005517899160302388,2019-02-14,2018-12-31,0001567619-19-003978
HFCUSD,HOLLYFRONTIER CORPORATION COMMON STOCK USD0.01,436106108,3047000.0,59600,0.0055124717185053695,2019-02-14,2018-12-31,0001567619-19-003978
VRSK,VERISK ANALYTICS INC COMMON STOCK USD0.001,92345Y106,3042000.0,27900,0.005503425982177005,2019-02-14,2018-12-31,0001567619-19-003978
TMUS,T-MOBILE US INCORPORATED COMMON STOCK USD0.0001,872590104,3016000.0,47410,0.0054563881532695094,2019-02-14,2018-12-31,0001567619-19-003978
VEU,VANGUARD FTSE ALL-WORLD EX-U,922042775,2999000.0,65800,0.00542563264975307,2019-02-14,2018-12-31,0001567619-19-003978
N/A,FGL HOLDINGS COMMON STOCK USD0.0001,G3402M102,2996000.0,449800,0.005420205207956051,2019-02-14,2018-12-31,0001567619-19-003978
FETUSD,FORUM ENERGY TECHNOLOGIES INCORPORATED COMMON STOCK USD0.01,34984V100,2950000.0,714308,0.005336984433735097,2019-02-14,2018-12-31,0001567619-19-003978
PDEUR,PRECISION DRILLING CORPORATION COMMON NPV,74022D308,2938000.0,1239750,0.005315274666547022,2019-02-14,2018-12-31,0001567619-19-003978
INFY,INFOSYS LIMITED SPONSORED ADR (EACH REPRESENTS 1 ORDINARY INR5),456788108,2937000.0,308477,0.005313465519281349,2019-02-14,2018-12-31,0001567619-19-003978
SLB,SCHLUMBERGER LIMITED COMMON STOCK USD0.01,806857108,2935000.0,81340,0.005309847224750003,2019-02-14,2018-12-31,0001567619-19-003978
RE,EVEREST RE GROUP LIMITED COMMON STOCK USD0.01,G3223R108,2930000.0,13454,0.005300801488421638,2019-02-14,2018-12-31,0001567619-19-003978
LII,LENNOX INTERNATIONAL INCORPORATED COMMON STOCK USD0.01,526107107,2923000.0,13355,0.005288137457561928,2019-02-14,2018-12-31,0001567619-19-003978
SYY,SYSCO CORPORATION COMMON STOCK USD1,871829107,2922000.0,46635,0.0052863283102962556,2019-02-14,2018-12-31,0001567619-19-003978
HST,HOST HOTELS & RESORTS INCORPORATED REIT USD0.01,44107P104,2921000.0,175221,0.005284519163030582,2019-02-14,2018-12-31,0001567619-19-003978
HUN,HUNTSMAN CORPORATION COMMON STOCK USD0.01,447011107,2912000.0,150937,0.005268236837639526,2019-02-14,2018-12-31,0001567619-19-003978
EQR,EQUITY RESIDENTIAL SBI REIT USD0.01,29476L107,2912000.0,44115,0.005268236837639526,2019-02-14,2018-12-31,0001567619-19-003978
EWQ,ISHARES INCORPORATED MSCI FRANCE ETF,464286707,2906000.0,109573,0.005257381954045489,2019-02-14,2018-12-31,0001567619-19-003978
IVV,ISHARES TRUST CORE S&P 500 ETF,464287200,2896000.0,11510,0.005239290481388759,2019-02-14,2018-12-31,0001567619-19-003978
EWM,ISHARES INCORPORATED MSCI MALAYSIA ETF,46434G814,2881000.0,96784,0.005212153272403665,2019-02-14,2018-12-31,0001567619-19-003978
AMAT,APPLIED MATERIALS INCORPORATED COMMON STOCK USD0.01,038222105,2878000.0,87900,0.0052067258306066466,2019-02-14,2018-12-31,0001567619-19-003978
ATHM,AUTOHOME INCORPORATED ADR (EACH REPRESENTS 1 CLASS A SHARE),05278C107,2876000.0,36760,0.005203107536075301,2019-02-14,2018-12-31,0001567619-19-003978
EQIX,EQUINIX INCORPORATED REIT USD0.001,29444U700,2872000.0,8147,0.005195870947012609,2019-02-14,2018-12-31,0001567619-19-003978
PYPL,PAYPAL HOLDINGS INCORPORATED COMMON STOCK USD0.0001,70450Y103,2867000.0,34100,0.005186825210684244,2019-02-14,2018-12-31,0001567619-19-003978
AZO,AUTOZONE INCORPORATED COMMON STOCK USD0.01,053332102,2843000.0,3391,0.005143405676308095,2019-02-14,2018-12-31,0001567619-19-003978
MRK,MERCK AND COMPANY INCORPORATED NEW COMMON STOCK USD0.01,58933Y105,2841000.0,37175,0.005139787381776749,2019-02-14,2018-12-31,0001567619-19-003978
EMR,EMERSON ELECTRIC COMPANY COMMON STOCK USD1,291011104,2839000.0,47516,0.005136169087245403,2019-02-14,2018-12-31,0001567619-19-003978
HAS,HASBRO INC COMMON STOCK USD0.50,418056107,2833000.0,34866,0.005125314203651366,2019-02-14,2018-12-31,0001567619-19-003978
CVX,CHEVRON CORPORATION COMMON STOCK USD0.75,166764100,2825000.0,25968,0.005110841025525982,2019-02-14,2018-12-31,0001567619-19-003978
FTV,FORTIVE CORPORATION COMMON STOCK USD0.01,34959J108,2818000.0,41648,0.005098176994666272,2019-02-14,2018-12-31,0001567619-19-003978
WST,WEST PHARMACEUTICAL SERVICES INCORPORATED COMMON STOCK USD0.25,955306105,2816000.0,28729,0.0050945587001349265,2019-02-14,2018-12-31,0001567619-19-003978
HLI,HOULIHAN LOKEY INC COMMON STOCK USD0.001,441593100,2804000.0,76200,0.005072848932946851,2019-02-14,2018-12-31,0001567619-19-003978
BAX,BAXTER INTERNATIONAL INCORPORATED COMMON STOCK USD1,071813109,2803000.0,42585,0.005071039785681178,2019-02-14,2018-12-31,0001567619-19-003978
BHC,BAUSCH HEALTH COS INCORPORATED NPV,071734107,2795000.0,110705,0.005056566607555795,2019-02-14,2018-12-31,0001567619-19-003978
TTC,TORO COMPANY COMMON STOCK USD1,891092108,2792000.0,49972,0.005051139165758776,2019-02-14,2018-12-31,0001567619-19-003978
USB,US BANCORP COMMON STOCK USD0.01,902973304,2776000.0,60751,0.005022192809508009,2019-02-14,2018-12-31,0001567619-19-003978
STT,STATE STREET CORPORATION COMMON STOCK USD1,857477103,2744000.0,43500,0.004964300097006476,2019-02-14,2018-12-31,0001567619-19-003978
N/A,CGI GROUP INCORPORATED CLASS 'A' SUB VOTING NPV,39945C109,2744000.0,32861,0.004964300097006476,2019-02-14,2018-12-31,0001567619-19-003978
FHI,FEDERATED INVESTORS INCORPORATED CLASS 'B' COMMON STOCK NPV,314211103,2738000.0,103114,0.004953445213412439,2019-02-14,2018-12-31,0001567619-19-003978
UPS,UNITED PARCELS SERVICE CLASS B COMMON STOCK USD0.01,911312106,2721000.0,27902,0.004922689709895999,2019-02-14,2018-12-31,0001567619-19-003978
HPE,HEWLETT PACKARD ENTERPRISE COMMON STOCK USD0.01,42824C109,2717000.0,205644,0.004915453120833308,2019-02-14,2018-12-31,0001567619-19-003978
2362120D,SINCLAIR BROADCAST GROUP INCORPORATED CLASS 'A' COMMON STOCK USD0.01,829226109,2714000.0,103050,0.004910025679036288,2019-02-14,2018-12-31,0001567619-19-003978
MSI,MOTOROLA SOLUTIONS INCORPORATED COMMON STOCK USD0.01,620076307,2698000.0,23453,0.004881079322785522,2019-02-14,2018-12-31,0001567619-19-003978
FE,FIRSTENERGY CORPORATION COMMON STOCK USD0.10,337932107,2695000.0,71778,0.004875651880988504,2019-02-14,2018-12-31,0001567619-19-003978
HB6,HIBBETT SPORTS INCORPORATED COMMON STOCK USD0.01,428567101,2692000.0,188229,0.004870224439191485,2019-02-14,2018-12-31,0001567619-19-003978
JPM,JPMORGAN CHASE AND COMPANY COMMON STOCK USD1,46625H100,2687000.0,27520,0.00486117870286312,2019-02-14,2018-12-31,0001567619-19-003978
YPF,YPF SA SPONSORED ADR (EACH CONVERT INTO 1 CLASS 'D'),984245100,2679000.0,200065,0.0048467055247377365,2019-02-14,2018-12-31,0001567619-19-003978
N/A,SEAGATE TECHNOLOGY PLC COMMON STOCK USD0.00001,G7945M107,2674000.0,69281,0.004837659788409372,2019-02-14,2018-12-31,0001567619-19-003978
ROP,ROPER TECHNOLOGIES INCORPORATED COMMON STOCK USD0.01,776696106,2671000.0,10020,0.004832232346612354,2019-02-14,2018-12-31,0001567619-19-003978
EIDO,ISHARES TRUST MSCI INDONESIA ETF,46429B309,2658000.0,107082,0.004808713432158606,2019-02-14,2018-12-31,0001567619-19-003978
DLR,DIGITAL REALTY TRUST INCORPORATED REIT USD0.01,253868103,2657000.0,24939,0.004806904284892933,2019-02-14,2018-12-31,0001567619-19-003978
IJH,ISHARES TRUST CORE S&P MID-CAP ETF,464287507,2657000.0,16000,0.004806904284892933,2019-02-14,2018-12-31,0001567619-19-003978
FDS,FACTSET RESEARCH SYSTEMS INCORPORATED COMMON STOCK USD0.01,303075105,2652000.0,13253,0.004797858548564568,2019-02-14,2018-12-31,0001567619-19-003978
LMX,LUMINEX CORPORATION COMMON STOCK USD0.001,55027E102,2647000.0,114537,0.004788812812236204,2019-02-14,2018-12-31,0001567619-19-003978
GTN,GRAY TELEVISION INCORPORATED COMMON STOCK NPV,389375106,2647000.0,179600,0.004788812812236204,2019-02-14,2018-12-31,0001567619-19-003978
N/A,DOWDUPONT INCORPORATED COMMON STOCK USD0.01,26078J100,2647000.0,49494,0.004788812812236204,2019-02-14,2018-12-31,0001567619-19-003978
AXP,AMERICAN EXPRESS COMPANY COMMON STOCK USD0.20,025816109,2643000.0,27727,0.004781576223173512,2019-02-14,2018-12-31,0001567619-19-003978
WAT,WATERS CORPORATION COMMON STOCK USD0.01,941848103,2641000.0,14000,0.004777957928642167,2019-02-14,2018-12-31,0001567619-19-003978
O,REALTY INCOME CORPORATION REIT USD1,756109104,2639000.0,41856,0.00477433963411082,2019-02-14,2018-12-31,0001567619-19-003978
ALB,ALBEMARLE CORPORATION COMMON STOCK USD0.01,012653101,2634000.0,34180,0.004765293897782456,2019-02-14,2018-12-31,0001567619-19-003978
N/A,LYONDELLBASELL INDUSTRIES NV CLASS A COMMON STOCK USD0.01,N53745100,2632000.0,31655,0.00476167560325111,2019-02-14,2018-12-31,0001567619-19-003978
N/A,AIRCASTLE LIMITED COMMON STOCK USD0.01,G0129K104,2625000.0,152253,0.004749011572391399,2019-02-14,2018-12-31,0001567619-19-003978
N/A,NABORS INDUSTRIES LIMITED COMMON STOCK USD0.001,G6359F103,2587000.0,1293400,0.004680263976295829,2019-02-14,2018-12-31,0001567619-19-003978
JAZZ,JAZZ PHARMACEUTICALS PLC USD0.0001 (US LISTING),G50871105,2585000.0,20853,0.004676645681764483,2019-02-14,2018-12-31,0001567619-19-003978
PEP,PEPSICO INCORPORATED CAPITAL STOCK USD0.016666,713448108,2574000.0,23300,0.004656745061842081,2019-02-14,2018-12-31,0001567619-19-003978
SLB,SCHLUMBERGER LIMITED COMMON STOCK USD0.01,806857108,2543000.0,70471,0.00460066149660622,2019-02-14,2018-12-31,0001567619-19-003978
AME,AMETEK INC COMMON STOCK USD0.01,031100100,2539000.0,37500,0.004593424907543529,2019-02-14,2018-12-31,0001567619-19-003978
LPL,LG DISPLAY COMPANY LIMITED ADR (EACH REPRESENTS 1/2 KRW5000),50186V102,2534000.0,309451,0.004584379171215164,2019-02-14,2018-12-31,0001567619-19-003978
N/A,AON PUBLIC LIMITED COMPANY COMMON STOCK USD1,G0408V102,2522000.0,17350,0.00456266940402709,2019-02-14,2018-12-31,0001567619-19-003978
WMT,WALMART INCORPORATED COMMON STOCK USD0.10,931142103,2511000.0,26952,0.004542768784104687,2019-02-14,2018-12-31,0001567619-19-003978
VIPS,VIPSHOP HOLDINGS LIMITED SPONSORED ADR (EACH REPRESENTS 0.2 ORDINARY SHARES USD0.0001),92763W103,2501000.0,458102,0.004524677311447958,2019-02-14,2018-12-31,0001567619-19-003978
VLO,VALERO ENERGY CORPORATION COMMON STOCK USD0.01,91913Y100,2497000.0,33300,0.004517440722385266,2019-02-14,2018-12-31,0001567619-19-003978
NTAP,NETAPP INCORPORATED COMMON STOCK USD0.001,64110D104,2489000.0,41715,0.004502967544259883,2019-02-14,2018-12-31,0001567619-19-003978
ELME,WASHINGTON REIT USD0.01,939653101,2475000.0,107599,0.004477639482540462,2019-02-14,2018-12-31,0001567619-19-003978
DLX,DELUXE CORPORATION COMMON STOCK USD1,248019101,2454000.0,63835,0.004439647389961331,2019-02-14,2018-12-31,0001567619-19-003978
USPH,US PHYSICAL THERAPY INCORPORATED COMMON STOCK USD0.01,90337L108,2451000.0,23943,0.004434219948164313,2019-02-14,2018-12-31,0001567619-19-003978
HPE,HEWLETT PACKARD ENTERPRISE COMMON STOCK USD0.01,42824C109,2445000.0,185100,0.004423365064570275,2019-02-14,2018-12-31,0001567619-19-003978
KMI,KINDER MORGAN INCORPORATED COMMON STOCK USD0.01,49456B101,2444000.0,158923,0.004421555917304603,2019-02-14,2018-12-31,0001567619-19-003978
V,VISA INCORPORATED CLASS A COMMON STOCK USD0.0001,92826C839,2437000.0,18470,0.004408891886444892,2019-02-14,2018-12-31,0001567619-19-003978
GGG,GRACO INCORPORATED COMMON STOCK USD1,384109104,2436000.0,58210,0.004407082739179219,2019-02-14,2018-12-31,0001567619-19-003978
APD,AIR PRODUCTS & CHEMICALS INC COM STK US$1,009158106,2433000.0,15200,0.0044016552973822,2019-02-14,2018-12-31,0001567619-19-003978
JXC1,J2 GLOBAL INCORPORATED COMMON STOCK USD0.01,48123V102,2426000.0,34972,0.00438899126652249,2019-02-14,2018-12-31,0001567619-19-003978
AMZN,AMAZON.COM INCORPORATED USD0.01,023135106,2424000.0,1614,0.004385372971991144,2019-02-14,2018-12-31,0001567619-19-003978
BXP,BOSTON PROPERTIES INCORPORATED REIT USD0.01,101121101,2418000.0,21481,0.0043745180883971065,2019-02-14,2018-12-31,0001567619-19-003978
LMT,LOCKHEED MARTIN CORP COMMON STOCK USD0.01,539830109,2409000.0,9200,0.00435823576300605,2019-02-14,2018-12-31,0001567619-19-003978
PRSP,PERSPECTA INCORPORATED COMMON STOCK USD0.01,715347100,2404000.0,139600,0.004349190026677685,2019-02-14,2018-12-31,0001567619-19-003978
YYEUR,YY INCORPORATED ADR (EACH REPRESENTS 20 ORDINARY CLASS A SHARES),98426T106,2387000.0,39882,0.004318434523161246,2019-02-14,2018-12-31,0001567619-19-003978
IEMG,ISHARES CORE MSCI EMERGING ETF,46434G103,2363000.0,50110,0.004275014988785096,2019-02-14,2018-12-31,0001567619-19-003978
BAC,BANK OF AMERICA CORPORATION COMMON STOCK USD0.01,060505104,2344000.0,95125,0.00424064119073731,2019-02-14,2018-12-31,0001567619-19-003978
FLT1EUR,FLEETCOR TECHNOLOGIES INCORPORATED COMMON STOCK USD0.001,339041105,2339000.0,12595,0.004231595454408946,2019-02-14,2018-12-31,0001567619-19-003978
CTRA,CABOT OIL & GAS CORPORATION COMMON STOCK USD0.10,127097103,2338000.0,104617,0.004229786307143274,2019-02-14,2018-12-31,0001567619-19-003978
WP,WORLDPAY INCORPORATED CLASS A COMMON STOCK USD0.00001,981558109,2316000.0,30305,0.004189985067298469,2019-02-14,2018-12-31,0001567619-19-003978
FICO,FAIR ISAAC CORPORATION COMMON STOCK USD0.01,303250104,2304000.0,12323,0.004168275300110394,2019-02-14,2018-12-31,0001567619-19-003978
LEG,LEGGETT & PLATT INCORPORATED COMMON STOCK USD0.01,524660107,2290000.0,63900,0.004142947238390973,2019-02-14,2018-12-31,0001567619-19-003978
BK,BANK OF NEW YORK MELLON CORPORATION (THE) COMMON STOCK USD0.01,064058100,2278000.0,48397,0.004121237471202898,2019-02-14,2018-12-31,0001567619-19-003978
EA,ELECTRONIC ARTS INCORPORATED COMMON STOCK USD0.01,285512109,2274000.0,28821,0.004114000882140207,2019-02-14,2018-12-31,0001567619-19-003978
N/A,MYLAN NV EUR0.01,N59465109,2269000.0,82800,0.004104955145811842,2019-02-14,2018-12-31,0001567619-19-003978
HRI,HERC HOLDINGS INCORPORATED COMMON STOCK USD0.01,42704L104,2261000.0,86989,0.004090481967686459,2019-02-14,2018-12-31,0001567619-19-003978
WMB,WILLIAMS COMPANIES INCORPORATED COMMON STOCK USD1,969457100,2259000.0,102467,0.004086863673155113,2019-02-14,2018-12-31,0001567619-19-003978
EMN,EASTMAN CHEMICAL COMPANY COMMON STOCK USD0.01,277432100,2257000.0,30876,0.004083245378623767,2019-02-14,2018-12-31,0001567619-19-003978
VOO,VANGUARD INDEX FUNDS S&P 500 ETF,922908363,2254000.0,9809,0.004077817936826749,2019-02-14,2018-12-31,0001567619-19-003978
MPW,MEDICAL PROPERTIES TRUST INCORPORATED REIT USD0.001,58463J304,2253000.0,140097,0.004076008789561075,2019-02-14,2018-12-31,0001567619-19-003978
CE,CELANESE CORPORATION CLASS A COMMON STOCK USD0.0001 (US LISTING),150870103,2249000.0,25000,0.004068772200498384,2019-02-14,2018-12-31,0001567619-19-003978
EPR,EPR PROPERTIES REIT USD0.01,26884U109,2228000.0,34794,0.004030780107919253,2019-02-14,2018-12-31,0001567619-19-003978
FNV,FRANCO-NEVADA CORPORATION COMMON NPV,351858105,2218000.0,23166,0.0040126886352625235,2019-02-14,2018-12-31,0001567619-19-003978
MUR,MURPHY OIL CORPORATION COMMON STOCK USD1,626717102,2207000.0,94342,0.003992788015340122,2019-02-14,2018-12-31,0001567619-19-003978
LSTR,LANDSTAR COMMON STOCK NPV,515098101,2200000.0,23000,0.003980123984480412,2019-02-14,2018-12-31,0001567619-19-003978
TROW,PRICE T.ROWE GROUP INCORPORATED COMMON STOCK USD0.20,74144T108,2197000.0,23800,0.003974696542683393,2019-02-14,2018-12-31,0001567619-19-003978
VIAB,VIACOM INCORPORATED NEW CLASS 'B' NON VOTING COMMON STOCK USD0.001,92553P201,2195000.0,85400,0.003971078248152047,2019-02-14,2018-12-31,0001567619-19-003978
IRM,IRON MOUNTAIN INCORPORATED REIT USD0.01,46284V101,2188000.0,67501,0.003958414217292336,2019-02-14,2018-12-31,0001567619-19-003978
DIS,WALT DISNEY COMPANY (THE) COMMON STOCK USD0.01,254687106,2186000.0,19938,0.0039547959227609905,2019-02-14,2018-12-31,0001567619-19-003978
CTLTEUR,CATALENT INCORPORATED COMMON STOCK USD0.01,148806102,2178000.0,69837,0.003940322744635607,2019-02-14,2018-12-31,0001567619-19-003978
MTD,METTLER-TOLEDO INTERNATIONAL COMMON STOCK USD0.01,592688105,2161000.0,3820,0.003909567241119167,2019-02-14,2018-12-31,0001567619-19-003978
SRCIEUR,SRC Energy Incorporated COMMON STOCK USD0.001,78470V108,2147000.0,456900,0.0038842391793997466,2019-02-14,2018-12-31,0001567619-19-003978
XLNXEUR,XILINX INCORPORATED COMMON STOCK USD0.01,983919101,2138000.0,25100,0.0038679568540086902,2019-02-14,2018-12-31,0001567619-19-003978
JBL,JABIL INCORPORATED COMMON STOCK USD0.001,466313103,2135000.0,86134,0.0038625294122116714,2019-02-14,2018-12-31,0001567619-19-003978
MCK,MCKESSON HBOC INCORPORATED COMMON STOCK USD0.01,58155Q103,2132000.0,19297,0.003857101970414653,2019-02-14,2018-12-31,0001567619-19-003978
UTHR,UNITED THERAPEUTICS CORPORATION COMMON STOCK USD0.01,91307C102,2116000.0,19428,0.003828155614163886,2019-02-14,2018-12-31,0001567619-19-003978
PM,PHILIP MORRIS INTERNATIONAL INCORPORATED COMMON STOCK NPV,718172109,2116000.0,31701,0.003828155614163886,2019-02-14,2018-12-31,0001567619-19-003978
MO,ALTRIA GROUP INCORPORATED COMMON STOCK USD0.3333,02209S103,2098000.0,42476,0.003795590963381774,2019-02-14,2018-12-31,0001567619-19-003978
EW,EDWARDS LIFESCIENCES CORPORATION COMMON STOCK USD1,28176E108,2098000.0,13700,0.003795590963381774,2019-02-14,2018-12-31,0001567619-19-003978
AMCX,AMC NETWORKS INCORPORATED CLASS A COMMON STOCK USD0.01,00164V103,2096000.0,38200,0.003791972668850428,2019-02-14,2018-12-31,0001567619-19-003978
BAC,BANK OF AMERICA CORPORATION COMMON STOCK USD0.01,060505104,2089000.0,84787,0.0037793086379907174,2019-02-14,2018-12-31,0001567619-19-003978
YUM,YUM BRANDS INCORPORATED COMMON STOCK NPV,988498101,2084000.0,22668,0.0037702629016623528,2019-02-14,2018-12-31,0001567619-19-003978
EWJ,ISHARES INCORPORATED MSCI JAPAN ETF,46434G822,2078000.0,40996,0.0037594080180683156,2019-02-14,2018-12-31,0001567619-19-003978
PVH,PVH CORPORATION COMMON STOCK USD1,693656100,2075000.0,22328,0.003753980576271297,2019-02-14,2018-12-31,0001567619-19-003978
CX,CEMEX SAB DE CV SPONSORED ADR (EACH REPRESENTS 10 CPO),151290889,2066000.0,428718,0.003737698250880241,2019-02-14,2018-12-31,0001567619-19-003978
N/A,CBL & ASSOCIATES PROPERTIES INCORPORATED REIT USD0.01,124830100,2061000.0,1073400,0.003728652514551876,2019-02-14,2018-12-31,0001567619-19-003978
IJH,ISHARES TRUST CORE S&P MID-CAP ETF,464287507,2048000.0,12335,0.0037051336000981277,2019-02-14,2018-12-31,0001567619-19-003978
N/A,GOLDCORP INCORPORATED COMMON NPV (CANADIAN LISTING),380956409,2028000.0,151707,0.00366895065478467,2019-02-14,2018-12-31,0001567619-19-003978
SABR,SABRE CORPORATION COMMON STOCK USD0.01,78573M104,2026000.0,93606,0.003665332360253324,2019-02-14,2018-12-31,0001567619-19-003978
VOO,VANGUARD INDEX FUNDS S&P 500 ETF,922908363,2026000.0,8818,0.003665332360253324,2019-02-14,2018-12-31,0001567619-19-003978
SJM,J.M. SMUCKER COMPANY (THE) COMMON STOCK USD0.001,832696405,2024000.0,21647,0.0036617140657219786,2019-02-14,2018-12-31,0001567619-19-003978
N/A,SINA CORPORATION COMMON STOCK USD0.133,G81477104,2009000.0,37453,0.0036345768567368846,2019-02-14,2018-12-31,0001567619-19-003978
ESNT,ESSENT GROUP LIMITED USD0.015,G3198U102,2005000.0,58652,0.003627340267674193,2019-02-14,2018-12-31,0001567619-19-003978
CMCSA,COMCAST CORPORATION CLASS A COMMON STOCK USD1,20030N101,1992000.0,58499,0.0036038213532204448,2019-02-14,2018-12-31,0001567619-19-003978
NVDA,NVIDIA CORPORATION COMMON STOCK USD0.001,67066G104,1989000.0,14900,0.0035983939114234264,2019-02-14,2018-12-31,0001567619-19-003978
LITE,LUMENTUM HOLDINGS INCORPORATED COMMON STOCK USD0.001,55024U109,1987000.0,47300,0.0035947756168920805,2019-02-14,2018-12-31,0001567619-19-003978
JPM,JPMORGAN CHASE AND COMPANY COMMON STOCK USD1,46625H100,1986000.0,20341,0.0035929664696264076,2019-02-14,2018-12-31,0001567619-19-003978
VEDL,VEDANTA LIMITED ADR(EACH REPRESENTS 4 ORDINARY SHARES),92242Y100,1976000.0,171265,0.0035748749969696783,2019-02-14,2018-12-31,0001567619-19-003978
CL,COLGATE-PALMOLIVE COMPANY COMMON STOCK USD1,194162103,1968000.0,33063,0.0035604018188442953,2019-02-14,2018-12-31,0001567619-19-003978
YYEUR,YY INCORPORATED ADR (EACH REPRESENTS 20 ORDINARY CLASS A SHARES),98426T106,1963000.0,32800,0.0035513560825159306,2019-02-14,2018-12-31,0001567619-19-003978
FL,FOOT LOCKER INCORPORATED COMMON STOCK USD0.01,344849104,1942000.0,36500,0.0035133639899367995,2019-02-14,2018-12-31,0001567619-19-003978
BXMT,BLACKSTONE MORTGAGE TRUST INCORPORATED REIT CLASS A USD0.01,09257W100,1941000.0,60908,0.003511554842671126,2019-02-14,2018-12-31,0001567619-19-003978
TMHC,TAYLOR MORRISON HOME CORPORATION COMMON STOCK USD0.00001,87724P106,1930000.0,121407,0.0034916542227487243,2019-02-14,2018-12-31,0001567619-19-003978
ESS,ESSEX PROPERTY TRUST INCORPORATED REIT NPV,297178105,1919000.0,7825,0.0034717536028263224,2019-02-14,2018-12-31,0001567619-19-003978
EWT,ISHARES MSCI TAIWAN ETF,46434G772,1917000.0,60622,0.003468135308294976,2019-02-14,2018-12-31,0001567619-19-003978
GSC1EUR,GOLDEN STAR RESOURCES LIMITED NPV,38119T807,1911000.0,606631,0.003457280424700939,2019-02-14,2018-12-31,0001567619-19-003978
HIG,HARTFORD FINANCIAL SERVICES GROUP INCORPORATE COMMON STOCK USD1,416515104,1910000.0,42962,0.0034554712774352656,2019-02-14,2018-12-31,0001567619-19-003978
K,KELLOGG COMPANY COMMON STOCK USD0.25,487836108,1910000.0,33500,0.0034554712774352656,2019-02-14,2018-12-31,0001567619-19-003978
IDXX,IDEXX LABORATORIES CORP,45168D104,1904000.0,10235,0.0034446163938412285,2019-02-14,2018-12-31,0001567619-19-003978
AR,ANTERO RESOURCES CORPORATION COMMON STOCK USD0.01,03674X106,1872000.0,199400,0.0033867236813396955,2019-02-14,2018-12-31,0001567619-19-003978
ITUB,ITAU UNIBANCO HOLDING SA ADR (EACH REPRESENTS 1 PREFERENCE SHARE),465562106,1865000.0,204000,0.003374059650479985,2019-02-14,2018-12-31,0001567619-19-003978
CVX,CHEVRON CORPORATION COMMON STOCK USD0.75,166764100,1860000.0,17100,0.0033650139141516203,2019-02-14,2018-12-31,0001567619-19-003978
JOBSUSD,51JOBS INCORPORATED ADR (EACH REPRESENTS 2 ORDINARY USD0.0001),316827104,1853000.0,29680,0.0033523498832919102,2019-02-14,2018-12-31,0001567619-19-003978
CSX,CSX CORPORATION COMMON STOCK USD1,126408103,1851000.0,29800,0.0033487315887605644,2019-02-14,2018-12-31,0001567619-19-003978
CPA,COPA HOLDINGS SA CLASS 'A' NPV,P31076105,1842000.0,23400,0.0033324492633695075,2019-02-14,2018-12-31,0001567619-19-003978
N/A,ELDORADO GOLD CORPORATION LIMITED COMMON NPV,284902103,1838000.0,2386400,0.0033252126743068162,2019-02-14,2018-12-31,0001567619-19-003978
KREF,KKR REAL ESTATE FINANCE TRUST INCORPORATED REIT USD0.01,48251K100,1834000.0,95763,0.0033179760852441245,2019-02-14,2018-12-31,0001567619-19-003978
NEE,NEXTERA ENERGY INCORPORATED COMMON STOCK USD0.01,65339F101,1825000.0,10500,0.0033016937598530686,2019-02-14,2018-12-31,0001567619-19-003978
PEO,EXELON CORPORATION COMMON STOCK NPV,30161N101,1818000.0,40300,0.003289029728993358,2019-02-14,2018-12-31,0001567619-19-003978
CDNS,CADENCE DESIGN SYSTEMS INCORPORATED COMMON STOCK USD0.01,127387108,1813000.0,41706,0.0032799839926649934,2019-02-14,2018-12-31,0001567619-19-003978
WBA,WALGREENS BOOTS ALLIANCE INCORPORATED COMMON STOCK USD0.01,931427108,1807000.0,26441,0.003269129109070956,2019-02-14,2018-12-31,0001567619-19-003978
EVR,EVERCORE INCORPORATED CLASS 'A' COMMON STOCK USD0.01,29977A105,1791000.0,25031,0.0032401827528201893,2019-02-14,2018-12-31,0001567619-19-003978
THO,THOR INDUSTRIES INCORPORATED COMMON STOCK USD0.10,885160101,1789000.0,34400,0.0032365644582888434,2019-02-14,2018-12-31,0001567619-19-003978
VICI,VICI PROPERTIES INCORPRATED REIT USD0.01,925652109,1786000.0,95110,0.0032311370164918246,2019-02-14,2018-12-31,0001567619-19-003978
AEE,AMEREN CORPORATION COMMON STOCK USD0.01,023608102,1762000.0,27007,0.0031877174821156743,2019-02-14,2018-12-31,0001567619-19-003978
GGAL,GRUPO FINANCIERO GALICIA-ADR,399909100,1754000.0,63632,0.0031732443039902917,2019-02-14,2018-12-31,0001567619-19-003978
SECOGBP,SECOO HOLDING LIMITED NPV (EACH REPRESENTS .50 ORDINARY SHARES),81367P101,1751000.0,193100,0.0031678168621932725,2019-02-14,2018-12-31,0001567619-19-003978
XEL,XCEL ENERGY INCORPORATED COMMON STOCK USD2.50,98389B100,1741000.0,35339,0.003149725389536543,2019-02-14,2018-12-31,0001567619-19-003978
ABT,ABBOTT LABORATORIES COMMON STOCK NPV,002824100,1732000.0,23951,0.003133443064145487,2019-02-14,2018-12-31,0001567619-19-003978
