ticker,nameOfIssuer,cusip,value,shares,allocation_percent,filingDate,reportDate,accessionNumber
FNF,FNF GROUP COMMON STOCK USD0.0001,31620R303,17508000.0,556874,0.03167455032740138,2019-02-14,2018-12-31,0001567619-19-003978
EFX,EQUIFAX INC COMMON STOCK USD2.50,294429105,17497000.0,187873,0.03165464970747898,2019-02-14,2018-12-31,0001567619-19-003978
APLE,APPLE HOSPITALITY REIT INCORPORATED NPV,03784Y200,17469000.0,1225045,0.03160399358404014,2019-02-14,2018-12-31,0001567619-19-003978
CTRPUSD,CTRIP.COM INTERNATIONAL LIMITED ADR (EACH REPRESENTS 0.125 ORDINARY USD0.01),22943F100,17314000.0,639822,0.031323575757860836,2019-02-14,2018-12-31,0001567619-19-003978
GILD,GILEAD SCIENCES INCORPORATED COMMON STOCK USD0.001,375558103,17159000.0,274330,0.031043157931681532,2019-02-14,2018-12-31,0001567619-19-003978
N/A,CORE LABORATORIES NV EUR0.02,N22717107,17121000.0,286970,0.03097441033558596,2019-02-14,2018-12-31,0001567619-19-003978
XYL,XYLEM INCORPORATED COMMON STOCK NPV,98419M100,16926000.0,253692,0.030621626618779745,2019-02-14,2018-12-31,0001567619-19-003978
LMT,LOCKHEED MARTIN CORP COMMON STOCK USD0.01,539830109,16598000.0,63390,0.03002822631563903,2019-02-14,2018-12-31,0001567619-19-003978
CB,CHUBB LIMITED COMMON STOCK CHF24.77,H1467J104,16439000.0,127259,0.029740571900397035,2019-02-14,2018-12-31,0001567619-19-003978
UE,URBAN EDGE PROPERTIES REIT USD0.01,91704F104,16418000.0,987853,0.029702579807817903,2019-02-14,2018-12-31,0001567619-19-003978
PKN,PERKINELMER INC,714046109,16399000.0,208773,0.029668206009770118,2019-02-14,2018-12-31,0001567619-19-003978
CDK,CDK GLOBAL INCORPORATED COMMON STOCK USD0.001,12508E101,16380000.0,342100,0.029633832211722336,2019-02-14,2018-12-31,0001567619-19-003978
RRC,RANGE RESOURCES CORPORATION COMMON STOCK USD0.01,75281A109,16335000.0,1706889,0.029552420584767054,2019-02-14,2018-12-31,0001567619-19-003978
NSC,NORFOLK SOUTHERN CORP COMMON STOCK USD1,655844108,16296000.0,108971,0.029481863841405807,2019-02-14,2018-12-31,0001567619-19-003978
EPAM,EPAM SYSTEMS INCORPORATED COMMON STOCK USD0.001,29414B104,16280000.0,140336,0.029452917485155043,2019-02-14,2018-12-31,0001567619-19-003978
IQ,IQIYI INCORPORATED ADR (EACH REPRESENTS 7 ORDINARY SHARES),46267X108,16217000.0,1090607,0.02933894120741765,2019-02-14,2018-12-31,0001567619-19-003978
LPX,LOUISIANA-PACIFIC CORP COMMON STOCK USD1,546347105,16170000.0,727704,0.02925391128593102,2019-02-14,2018-12-31,0001567619-19-003978
INTC,INTEL CORPORATION COMMON STOCK USD0.001,458140100,16144000.0,344005,0.029206873457023524,2019-02-14,2018-12-31,0001567619-19-003978
EHC,ENCOMPASS HEALTH CORPORATION COMMON STOCK USD0.01,29261A100,16137000.0,261538,0.029194209426163815,2019-02-14,2018-12-31,0001567619-19-003978
JKHY,JACK HENRY AND ASSOCIATE INCORPORATED COMMON STOCK USD0.01,426281101,16037000.0,126753,0.02901329469959652,2019-02-14,2018-12-31,0001567619-19-003978
CDEVEUR,CENTENNIAL RESOURCE DEVELOPMENT INCORPORATED COMMON STOCK NPV,15136A102,16021000.0,1453768,0.028984348343345758,2019-02-14,2018-12-31,0001567619-19-003978
CHE,CHEMED CORPORATION COMMON STOCK USD1,16359R103,15989000.0,56441,0.028926455630844224,2019-02-14,2018-12-31,0001567619-19-003978
TXN,TEXAS INSTRUMENTS INCORPORATED COMMON STOCK USD1,882508104,15722000.0,166372,0.028443413310909556,2019-02-14,2018-12-31,0001567619-19-003978
BAC,VERIZON COMMUNICATIONS INCORPORATED COMMON STOCK USD0.10,92343V104,15718000.0,279584,0.028436176721846868,2019-02-14,2018-12-31,0001567619-19-003978
MGA,MAGNA INTERNATIONAL INCORPORATED SUB-VOTING COMMON NPV,559222401,15659000.0,252688,0.028329437033172162,2019-02-14,2018-12-31,0001567619-19-003978
CXPUSD,COLUMBIA PROPERTY TRUST INCORPORATED REIT USD0.01,198287203,15635000.0,808036,0.02828601749879601,2019-02-14,2018-12-31,0001567619-19-003978
CPS,COOPER-STANDARD HOLDING COMMON STOCK USD0.001,21676P103,15612000.0,251321,0.02824440711168554,2019-02-14,2018-12-31,0001567619-19-003978
ANATUSD,AMERICAN NATIONAL INSURANCE COMPANY COMMON STOCK USD1,028591105,15526000.0,122021,0.028088820446837665,2019-02-14,2018-12-31,0001567619-19-003978
N/A,TWENTY FIRST CENTURY FOX INCORPORATED CLASS A COMMON STOCK USD0.01,90130A101,15499000.0,322094,0.028039973470664493,2019-02-14,2018-12-31,0001567619-19-003978
ABX,BARRICK GOLD CORPORATION COMMON NPV (US LISTING),067901108,15490000.0,1143999,0.028023691145273442,2019-02-14,2018-12-31,0001567619-19-003978
N/A,NATIONAL GENERAL HOLDINGS COMMON STOCK USD0.01,636220303,15449000.0,638145,0.02794951610738085,2019-02-14,2018-12-31,0001567619-19-003978
D,DOMINION ENERGY INCORPORATED (VIRGINIA) COMMON STOCK NPV,25746U109,15448000.0,216171,0.027947706960115174,2019-02-14,2018-12-31,0001567619-19-003978
ESRT,EMPIRE STATE REALTY TRUST INCORPORATED CLASS A REIT USD0.01,292104106,15446000.0,1085435,0.02794408866558383,2019-02-14,2018-12-31,0001567619-19-003978
EEM,ISHARES TRUST MSCI EMERGING MARKETS ETF,464287234,15440000.0,395281,0.027933233781989794,2019-02-14,2018-12-31,0001567619-19-003978
HFWA,HERITAGE FINANCIAL CORP COMMON STOCK NPV,42722X106,15429000.0,519130,0.027913333162067393,2019-02-14,2018-12-31,0001567619-19-003978
SU,SUNCOR ENERGY INCORPORATED NEW COMMON NPV (CANADA LISTING),867224107,15401000.0,403900,0.02786267703862855,2019-02-14,2018-12-31,0001567619-19-003978
SPG,SIMON PROPERTY GROUP INCORPORATED REIT USD0.0001,828806109,15331000.0,91262,0.027736036730031444,2019-02-14,2018-12-31,0001567619-19-003978
MEOH,METHANEX CORPORATION COMMON NPV,59151K108,15305000.0,233100,0.02768899890112395,2019-02-14,2018-12-31,0001567619-19-003978
META,FACEBOOK INCORPORATED CLASS A COMMON STOCK USD0.000006,30303M102,15212000.0,116044,0.02752074820541637,2019-02-14,2018-12-31,0001567619-19-003978
CSGS,CSG SYSTEMS INTERNATIONAL INCORPORATED COMMON STOCK USD0.01,126349109,15192000.0,478191,0.02748456526010291,2019-02-14,2018-12-31,0001567619-19-003978
OC,OWENS CORNING INCORPORATED COMMON STOCK USD0.01,690742101,15185000.0,345271,0.027471901229243204,2019-02-14,2018-12-31,0001567619-19-003978
KW,KENNEDY-WILSON HOLDINGS INCORPORATED COMMON STOCK USD0.0001,489398107,15144000.0,833486,0.027397726191350613,2019-02-14,2018-12-31,0001567619-19-003978
ATVIEUR,ACTIVISION BLIZZARD INCORPORATED COMMON STOCK USD0.000001,00507V109,15140000.0,325098,0.02739048960228792,2019-02-14,2018-12-31,0001567619-19-003978
RS,RELIANCE STEEL & ALUMINUM COMPANY COMMON STOCK NPV,759509102,15139000.0,212712,0.027388680455022248,2019-02-14,2018-12-31,0001567619-19-003978
N/A,HCP INCORPORATED REIT USD1,40414L109,15130000.0,541705,0.02737239812963119,2019-02-14,2018-12-31,0001567619-19-003978
CWB,SPDR BLOOMBERG BARCLAYS CONVERTIBLE SECURITIES ETF,78464A359,15108000.0,322883,0.02733259688978639,2019-02-14,2018-12-31,0001567619-19-003978
SBH,SALLY BEAUTY HOLDINGS INCORPORATED COMMON STOCK USD0.01,79546E104,15079000.0,884408,0.02728013161908187,2019-02-14,2018-12-31,0001567619-19-003978
MD,MEDNAX INCORPORATED COMMON STOCK USD0.01,58502B106,15034000.0,455585,0.027198719992126592,2019-02-14,2018-12-31,0001567619-19-003978
SAIC,SCIENCE APPLICATIONS INTERNATIONAL CORPORATION COMMON STOCK USD0.0001,808625107,15019000.0,235772,0.027171582783141496,2019-02-14,2018-12-31,0001567619-19-003978
AR,ANTERO RESOURCES CORPORATION COMMON STOCK USD0.01,03674X106,14891000.0,1585797,0.026940011933135364,2019-02-14,2018-12-31,0001567619-19-003978
MSFT,MICROSOFT CORPORATION COMMON STOCK USD0.0000125,594918104,14828000.0,145988,0.02682603565539797,2019-02-14,2018-12-31,0001567619-19-003978
CSCO,CISCO SYSTEMS INCORPORATED USD0.001 (US LISTING),17275R102,14784000.0,341202,0.026746433175708365,2019-02-14,2018-12-31,0001567619-19-003978
CRL,CHARLES RIVER LABORATORIES INTERNATIONAL INCORPORATED COMMON STOCK USD0.01,159864107,14733000.0,130177,0.026654166665159046,2019-02-14,2018-12-31,0001567619-19-003978
NBL2EUR,NOBLE ENERGY INCORPORATED COMMON STOCK USD0.01,655044105,14721000.0,784694,0.026632456897970967,2019-02-14,2018-12-31,0001567619-19-003978
PEP,PEPSICO INCORPORATED CAPITAL STOCK USD0.016666,713448108,14708000.0,133124,0.02660893798351722,2019-02-14,2018-12-31,0001567619-19-003978
RNR,RENAISSANCE HOLDINGS COMMON STOCK NPV,G7496G103,14673000.0,109743,0.02654561782921867,2019-02-14,2018-12-31,0001567619-19-003978
WFC,WELLS FARGO AND COMPANY COMMON STOCK USD1.6667,949746101,14604000.0,316930,0.026420786667887237,2019-02-14,2018-12-31,0001567619-19-003978
EVEUR,EATON VANCE CORPORATION COMMON STOCK USD0.00781,278265103,14570000.0,414156,0.02635927566085436,2019-02-14,2018-12-31,0001567619-19-003978
DHR,DANAHER CORPORATION COMMON STOCK USD0.01,235851102,14550000.0,141100,0.026323092715540904,2019-02-14,2018-12-31,0001567619-19-003978
TECK,TECK RESOURCES LIMITED CLASS 'B' SUBORDINATED VOTING COMMON NPV,878742204,14498000.0,493298,0.02622901705772591,2019-02-14,2018-12-31,0001567619-19-003978
ORCL,ORACLE CORPORATION COMMON STOCK USD0.01,68389X105,14474000.0,320581,0.02618559752334976,2019-02-14,2018-12-31,0001567619-19-003978
GNRC,GENERAC HOLDINGS INCORPORATION COMMON STOCK USD0.01,368736104,14445000.0,290642,0.026133132252645245,2019-02-14,2018-12-31,0001567619-19-003978
BRK/B,BERKSHIRE HATHAWAY INCORPORATED CLASS B COMMON STOCK USD0.0033,084670702,14431000.0,70680,0.026107804190925822,2019-02-14,2018-12-31,0001567619-19-003978
TMO,THERMO FISHER SCIENTIFIC INCORPORATED COMMON STOCK USD1,883556102,14295000.0,63879,0.02586176016279431,2019-02-14,2018-12-31,0001567619-19-003978
TECH,BIO-TECHNE CORPORATION COMMON STOCK USD0.01,09073M104,14207000.0,98171,0.02570255520341509,2019-02-14,2018-12-31,0001567619-19-003978
IBM,INTL BUSINESS MACHINES CORPORATION COMMON STOCK USD0.20,459200101,14134000.0,124346,0.025570487453020967,2019-02-14,2018-12-31,0001567619-19-003978
ELS,EQUITY LIFESTYLE PROPERTIES INCORPORATED REIT USD0.01,29472R108,14067000.0,144826,0.025449274586220885,2019-02-14,2018-12-31,0001567619-19-003978
N/A,RANDGOLD RESOURCES LIMITED ADR (EACH REPR 1 ORD USD0.05),752344309,14036000.0,169335,0.025393191020985025,2019-02-14,2018-12-31,0001567619-19-003978
HAL,HALLIBURTON COMPANY COMMON STOCK USD2.50,406216101,13942000.0,524528,0.025223131178011768,2019-02-14,2018-12-31,0001567619-19-003978
FRME,FIRST MERCHANTS CORPORATION COMMON STOCK NPV,320817109,13936000.0,406666,0.025212276294417732,2019-02-14,2018-12-31,0001567619-19-003978
BNS,BANK OF NOVA SCOTIA CAPITAL STOCK,064149107,13918000.0,204523,0.025179711643635617,2019-02-14,2018-12-31,0001567619-19-003978
DREUSD,DUKE REALTY CORPORATION REIT USD0.01,264411505,13913000.0,537166,0.025170665907307252,2019-02-14,2018-12-31,0001567619-19-003978
JNJ,JOHNSON AND JOHNSON COMMON STOCK USD1,478160104,13912000.0,107802,0.02516885676004158,2019-02-14,2018-12-31,0001567619-19-003978
PAGP,PLAINS GP HOLDINGS LP COMMON STOCK NPV,72651A207,13900000.0,691525,0.025147146992853506,2019-02-14,2018-12-31,0001567619-19-003978
MBTGBP,MOBILE TELESYSTEMS OJSC ADR (EACH REPRESENTS 2 COMMON SHARES),607409109,13866000.0,1980906,0.025085635985820625,2019-02-14,2018-12-31,0001567619-19-003978
AU3EUR,ANGLOGOLD ASHANTI LIMITED SPONSORED ADR (EACH REPRESENTING 1 ORDINARY LEVEL 1) (BNY),035128206,13799000.0,1099504,0.024964423119020543,2019-02-14,2018-12-31,0001567619-19-003978
CPRT,COPART INCORPORATED COMMON STOCK NPV,217204106,13734000.0,287452,0.0248468285467518,2019-02-14,2018-12-31,0001567619-19-003978
TRNO,TERRENO REALTY CORPORATION REIT USD0.01,88146M101,13718000.0,390052,0.024817882190501035,2019-02-14,2018-12-31,0001567619-19-003978
DRH,DIAMONDROCK HOSPITALITY COMPANY REIT USD0.01,252784301,13707000.0,1509615,0.024797981570578633,2019-02-14,2018-12-31,0001567619-19-003978
REXR,REXFORD INDUSTRIAL REALTY IN REIT USD0.01,76169C100,13683000.0,464312,0.024754562036202483,2019-02-14,2018-12-31,0001567619-19-003978
ASGN,ASGN INCORPORATED COMMON STOCK USD0.01,00191U102,13568000.0,248963,0.0245465101006501,2019-02-14,2018-12-31,0001567619-19-003978
TECH,BIO-TECHNE CORPORATION COMMON STOCK USD0.01,09073M104,13550000.0,93630,0.024513945449867985,2019-02-14,2018-12-31,0001567619-19-003978
CODI,COMPASS DIVERSIFIED HOLDINGS LP NPV,20451Q104,13409000.0,1077019,0.024258855685408108,2019-02-14,2018-12-31,0001567619-19-003978
SMP,STANDARD MOTOR PRODUCTS INCORPORATED COMMON STOCK USD2,853666105,13324000.0,275116,0.024105078167825908,2019-02-14,2018-12-31,0001567619-19-003978
TSM,TAIWAN SEMICONDUCTOR MANUFACTURING COMPANY LIMITED ADS REPRESENTING 5 COMMON SHARES,874039100,13261000.0,359271,0.023991101890088514,2019-02-14,2018-12-31,0001567619-19-003978
PFE,PFIZER INCORPORATED COMMON STOCK USD0.05,717081103,13227000.0,303034,0.023929590883055636,2019-02-14,2018-12-31,0001567619-19-003978
BTG,B2GOLD CORPORATION COMMON NPV,11777Q209,13215000.0,3312099,0.023907881115867557,2019-02-14,2018-12-31,0001567619-19-003978
ITCIEUR,INTRA-CELLULAR THERAPIES INCORPORATED COMMON STOCK USD0.0001,46116X101,13182000.0,1157356,0.023848179256100353,2019-02-14,2018-12-31,0001567619-19-003978
FLIR,FLIR SYSTEMS INCORPORATED COMMON STOCK USD0.01,302445101,13117000.0,301261,0.023730584683831615,2019-02-14,2018-12-31,0001567619-19-003978
MMM,3M COMPANY COMMON STOCK USD0.01,88579Y101,13107000.0,68788,0.023712493211174884,2019-02-14,2018-12-31,0001567619-19-003978
GIS,GENERAL MILLS INC COMMON STOCK USD0.10,370334104,12960000.0,332829,0.023446548563120968,2019-02-14,2018-12-31,0001567619-19-003978
CHD,CHURCH & DWIGHT COMPANY INCORPORATED COMMON STOCK USD1,171340102,12921000.0,196484,0.023375991819759724,2019-02-14,2018-12-31,0001567619-19-003978
BMY,BRISTOL-MYERS SQUIBB COMPANY COMMON STOCK USD0.10,110122108,12905000.0,248271,0.023347045463508957,2019-02-14,2018-12-31,0001567619-19-003978
UTXZ,UNITED TECHNOLOGIES CORPORATION COMMON STOCK USD1,913017109,12833000.0,120521,0.023216786860380506,2019-02-14,2018-12-31,0001567619-19-003978
CB,CHUBB LIMITED COMMON STOCK CHF24.77,H1467J104,12817000.0,99222,0.02318784050412974,2019-02-14,2018-12-31,0001567619-19-003978
N/A,INTERXION HOLDING  NV COMMON STOCK EUR0.10,N47279109,12769000.0,235770,0.023101001435377442,2019-02-14,2018-12-31,0001567619-19-003978
FTV,FORTIVE CORPORATION COMMON STOCK USD0.01,34959J108,12759000.0,188578,0.02308290996272071,2019-02-14,2018-12-31,0001567619-19-003978
CHT,CHUNGHWA TELECOM COMPANY LIMITED ADR (EACH REPRESENTS 10 ORDINARY TWD10),17133Q502,12713000.0,355202,0.022999689188499758,2019-02-14,2018-12-31,0001567619-19-003978
MCD,MCDONALD'S CORPORATION COMMON STOCK USD0.01,580135101,12654000.0,71262,0.022892949499825056,2019-02-14,2018-12-31,0001567619-19-003978
N/A,HOLLYSYS AUTOMATION TECHNOLOGIES LIMITED USD0.0001,G45667105,12558000.0,717168,0.022719271362320458,2019-02-14,2018-12-31,0001567619-19-003978
HPP,HUDSON PACIFIC PROPERTIES INCORPORATED REIT USD0.01,444097109,12543000.0,431638,0.02269213415333536,2019-02-14,2018-12-31,0001567619-19-003978
AEM,AGNICO EAGLE MINES LIMITED COMMON NPV (US LISTING),008474108,12484000.0,309004,0.02258539446466066,2019-02-14,2018-12-31,0001567619-19-003978
CHT,CHUNGHWA TELECOM COMPANY LIMITED ADR (EACH REPRESENTS 10 ORDINARY TWD10),17133Q502,12363000.0,345434,0.022366487645514237,2019-02-14,2018-12-31,0001567619-19-003978
IVV,ISHARES TRUST CORE S&P 500 ETF,464287200,12313000.0,48936,0.022276030282230592,2019-02-14,2018-12-31,0001567619-19-003978
CCL,CARNIVAL CORPORATION COMMON STOCK USD0.01 (PAIRED STOCK),143658300,12197000.0,247397,0.022066169199412535,2019-02-14,2018-12-31,0001567619-19-003978
ORCL,ORACLE CORPORATION COMMON STOCK USD0.01,68389X105,12154000.0,269202,0.0219883758669886,2019-02-14,2018-12-31,0001567619-19-003978
CHTR,CHARTER COMMUNICATIONS INCORPORATED COMMON STOCK USD0.001,16119P108,12151000.0,42638,0.02198294842519158,2019-02-14,2018-12-31,0001567619-19-003978
SUI,SUN COMMUNITIES INC REIT USD0.01,866674104,12082000.0,118787,0.02185811726386015,2019-02-14,2018-12-31,0001567619-19-003978
PAC,GRUPO AEROPORTUARIO DEL PACIFICO SAB DE CV ADR (EACH REPRESENTS 10 SERIES 'B' SHARES),400506101,12047000.0,147731,0.021794797109561597,2019-02-14,2018-12-31,0001567619-19-003978
REGIEUR,RENEWABLE ENERGY GROUP INCORPORATED COMMON STOCK USD0.0001,75972A301,12046000.0,468714,0.021792987962295923,2019-02-14,2018-12-31,0001567619-19-003978
RTN1USD,RAYTHEON COMPANY COMMON STOCK USD0.01,755111507,12033000.0,78469,0.021769469047842174,2019-02-14,2018-12-31,0001567619-19-003978
KMB,KIMBERLY-CLARK CORPORATION COMMON STOCK USD1.25,494368103,12032000.0,105599,0.021767659900576504,2019-02-14,2018-12-31,0001567619-19-003978
CVX,CHEVRON CORPORATION COMMON STOCK USD0.75,166764100,12007000.0,110366,0.02172243121893468,2019-02-14,2018-12-31,0001567619-19-003978
MCO,MOODY'S CORPORATION COMMON STOCK USD0.01,615369105,11884000.0,84860,0.021499906105256913,2019-02-14,2018-12-31,0001567619-19-003978
UAL,UNITED CONTINENTAL HOLDINGS INCORPORATED COMMON STOCK USD0.01,910047109,11854000.0,141573,0.021445631687286724,2019-02-14,2018-12-31,0001567619-19-003978
ETR,ENTERGY CORPORATION COMMON STOCK USD0.01,29364G103,11710000.0,136053,0.021185114481029825,2019-02-14,2018-12-31,0001567619-19-003978
NDAQ,NASDAQ INCORPORATED COMMON STOCK USD0.01,631103108,11660000.0,142949,0.02109465711774618,2019-02-14,2018-12-31,0001567619-19-003978
TSM,TAIWAN SEMICONDUCTOR MANUFACTURING COMPANY LIMITED ADS REPRESENTING 5 COMMON SHARES,874039100,11520000.0,312120,0.020841376500551973,2019-02-14,2018-12-31,0001567619-19-003978
GIS,GENERAL MILLS INC COMMON STOCK USD0.10,370334104,11451000.0,294079,0.02071654533922054,2019-02-14,2018-12-31,0001567619-19-003978
N/A,NEW ORIENTAL EDUCATION & TECHNOLOGY GROUP INCORPORATED SPONSORED ADR USD0.01 (EACH REPRESENTS 1 ORDINARY SHARES),647581107,11416000.0,208280,0.020653225184921988,2019-02-14,2018-12-31,0001567619-19-003978
WB,WEIBO CORPORATION SPONSERED ADR(EACH REPRESENTS 1 ORDINARY SHARE),948596101,11413000.0,195333,0.02064779774312497,2019-02-14,2018-12-31,0001567619-19-003978
ROK,ROCKWELL AUTOMATION INCORPORATED COMMON STOCK USD1,773903109,11367000.0,75537,0.020564576968904014,2019-02-14,2018-12-31,0001567619-19-003978
CNA,CNA FINANCIAL CORPORATION COMMON STOCK USD2.50,126117100,11367000.0,257452,0.020564576968904014,2019-02-14,2018-12-31,0001567619-19-003978
EC,ECOPETROL SA SPONSORED ADR (EACH REPRESENTS 20 ORDINARY COP250),279158109,11366000.0,715753,0.020562767821638343,2019-02-14,2018-12-31,0001567619-19-003978
BDX,BECTON DICKINSON & COMPANY COMMON STOCK USD1,075887109,11348000.0,50362,0.02053020317085623,2019-02-14,2018-12-31,0001567619-19-003978
HRUSD,HEALTHCARE REALTY TRUST INCORPORATED REIT USD0.01,421946104,11325000.0,398193,0.020488592783745752,2019-02-14,2018-12-31,0001567619-19-003978
BSMXUSD,BANCO SANTANDER MEXICO SA ADR (EACH REPRESENTS 5 ORDINARY SERIES B),05969B103,11299000.0,1834200,0.020441554954838258,2019-02-14,2018-12-31,0001567619-19-003978
QCOM,QUALCOMM INCORPORATED COMMON STOCK USD0.0001,747525103,11284000.0,198277,0.020414417745853165,2019-02-14,2018-12-31,0001567619-19-003978
N/A,NEW ORIENTAL EDUCATION & TECHNOLOGY GROUP INCORPORATED SPONSORED ADR USD0.01 (EACH REPRESENTS 1 ORDINARY SHARES),647581107,11281000.0,205828,0.020408990304056147,2019-02-14,2018-12-31,0001567619-19-003978
UDR,UDR INCORPORATED REIT USD0.01,902653104,11182000.0,282223,0.020229884724754527,2019-02-14,2018-12-31,0001567619-19-003978
CC,CHEMOURS COMPANY (THE) COMMON STOCK USD0.30,163851108,11181000.0,396200,0.020228075577488853,2019-02-14,2018-12-31,0001567619-19-003978
NEM,NEWMONT MINING CORPORATION COMMON STOCK USD1.60,651639106,11141000.0,321521,0.020155709686861936,2019-02-14,2018-12-31,0001567619-19-003978
BBD,BANCO BRADESCO SA SPONSORED ADR (EACH REPRESENTING 1 PREFERENCE SHARE NPV),059460303,11118000.0,1124196,0.02011409929975146,2019-02-14,2018-12-31,0001567619-19-003978
N/A,ARDAGH FINANCE HOLDINGS SA EUR0.01,L0223L101,11090000.0,1000918,0.020063443176312618,2019-02-14,2018-12-31,0001567619-19-003978
EBA,EBAY INCORPORATED COMMON STOCK USD0.001,278642103,11090000.0,395100,0.020063443176312618,2019-02-14,2018-12-31,0001567619-19-003978
G,GENPACT LIMITED COMMON STOCK USD0.01,G3922B107,11088000.0,410808,0.020059824881781273,2019-02-14,2018-12-31,0001567619-19-003978
FTNT,FORTINET INCORPORATED COMMON STOCK USD0.001,34959E109,11054000.0,156952,0.019998313874748392,2019-02-14,2018-12-31,0001567619-19-003978
SLB,SCHLUMBERGER LIMITED COMMON STOCK USD0.01,806857108,11016000.0,305321,0.019929566278652822,2019-02-14,2018-12-31,0001567619-19-003978
MMM,3M COMPANY COMMON STOCK USD0.01,88579Y101,10944000.0,57435,0.01979930767552437,2019-02-14,2018-12-31,0001567619-19-003978
N/A,TIER REIT INCORPORATED REIT USD 0.0001,88650V208,10914000.0,529035,0.019745033257554185,2019-02-14,2018-12-31,0001567619-19-003978
BKU,BANKUNITED INCORPORATED COMMON STOCK USD0.01,06652K103,10871000.0,363090,0.01966723992513025,2019-02-14,2018-12-31,0001567619-19-003978
KO,COCA-COLA COMPANY (THE) COMMON STOCK USD0.25,191216100,10763000.0,227316,0.019471852020437577,2019-02-14,2018-12-31,0001567619-19-003978
PINC,PREMIER INCORPORATED COMMON STOCK USD0.01,74051N102,10730000.0,287274,0.01941215016067037,2019-02-14,2018-12-31,0001567619-19-003978
OXY,OCCIDENTAL PETROLEUM CORP COMMON STOCK USD0.20,674599105,10726000.0,174751,0.019404913571607677,2019-02-14,2018-12-31,0001567619-19-003978
LMT,LOCKHEED MARTIN CORP COMMON STOCK USD0.01,539830109,10710000.0,40901,0.01937596721535691,2019-02-14,2018-12-31,0001567619-19-003978
EFA,ISHARES TRUST MSCI EAFE ETF,464287465,10683000.0,181741,0.019327120239183742,2019-02-14,2018-12-31,0001567619-19-003978
AMZN,AMAZON.COM INCORPORATED USD0.01,023135106,10673000.0,7106,0.01930902876652701,2019-02-14,2018-12-31,0001567619-19-003978
GS,GOLDMAN SACHS GROUP INCORPORATED COMMON STOCK USD0.01,38141G104,10597000.0,63438,0.01917153357433587,2019-02-14,2018-12-31,0001567619-19-003978
CRI,CARTER HOLDINGS INCORPORATED COMMON STOCK USD0.01,146229109,10553000.0,129300,0.019091931094646263,2019-02-14,2018-12-31,0001567619-19-003978
N/A,DOWDUPONT INCORPORATED COMMON STOCK USD0.01,26078J100,10527000.0,196841,0.019044893265738768,2019-02-14,2018-12-31,0001567619-19-003978
EMR,EMERSON ELECTRIC COMPANY COMMON STOCK USD1,291011104,10490000.0,175571,0.01897795481690887,2019-02-14,2018-12-31,0001567619-19-003978
MTB,M & T BK CORPORATION COMMON STOCK USD0.50,55261F104,10477000.0,73200,0.01895443590245512,2019-02-14,2018-12-31,0001567619-19-003978
MO,ALTRIA GROUP INCORPORATED COMMON STOCK USD0.3333,02209S103,10431000.0,211200,0.018871215128234167,2019-02-14,2018-12-31,0001567619-19-003978
SCHW,SCHWAB(CHARLES) CORPORATION COMMON STOCK USD0.01,808513105,10427000.0,251063,0.018863978539171475,2019-02-14,2018-12-31,0001567619-19-003978
DVN,DEVON ENERGY CORPORATION COMMON STOCK USD0.10,25179M103,10395000.0,461164,0.01880608582666994,2019-02-14,2018-12-31,0001567619-19-003978
AMED,AMEDISYS INCORPORATED COMMON STOCK USD0.001,023436108,10394000.0,88755,0.01880427667940427,2019-02-14,2018-12-31,0001567619-19-003978
RGEN,REPLIGEN CORPORATION COMMON STOCK USD0.01,759916109,10372000.0,196670,0.018764475439559464,2019-02-14,2018-12-31,0001567619-19-003978
SBS,COMPANHIA DE SANEAMENTO BASICO DO ESTADO DE SAO PAULO SPONSORED ADR (EACH REPRESENTS 1 COMMON SHARE),20441A102,10361000.0,1283905,0.018744574819637063,2019-02-14,2018-12-31,0001567619-19-003978
CNQ,CANADIAN NATURAL RESOURCES LIMITED COMMON NPV,136385101,10284000.0,312200,0.018605270480180246,2019-02-14,2018-12-31,0001567619-19-003978
ECL,ECOLAB INC COMMON STOCK USD1,278865100,10260000.0,69630,0.0185618509458041,2019-02-14,2018-12-31,0001567619-19-003978
LKFN,LAKELAND FINANCIAL CORPORATION COMMON STOCK NPV,511656100,10234000.0,254831,0.018514813116896605,2019-02-14,2018-12-31,0001567619-19-003978
XLV,HEALTH CARE SELECT SECTOR SPDR FD NPV,81369Y209,10218000.0,118111,0.018485866760645835,2019-02-14,2018-12-31,0001567619-19-003978
GOOGL,ALPHABET INCORPORATED CL A NPV,02079K305,10217000.0,9777,0.018484057613380164,2019-02-14,2018-12-31,0001567619-19-003978
CUBE,CUBESMART REIT USD0.01,229663109,10175000.0,354656,0.018408073428221903,2019-02-14,2018-12-31,0001567619-19-003978
AFG,AMERICAN FINANCIAL GROUP INCORPORATED COMMON STOCK NPV,025932104,10122000.0,111807,0.018312188623141237,2019-02-14,2018-12-31,0001567619-19-003978
AFL,AFLAC INCORPORATED COMMON STOCK USD0.10,001055102,10107000.0,221850,0.018285051414156143,2019-02-14,2018-12-31,0001567619-19-003978
PSA,PUBLIC STORAGE REIT USD0.10,74460D109,10099000.0,49893,0.01827057823603076,2019-02-14,2018-12-31,0001567619-19-003978
CI,CIGNA CORP COMMON STOCK USD0.010000,125523100,10059000.0,52962,0.018198212345403843,2019-02-14,2018-12-31,0001567619-19-003978
HXL,HEXCEL CORPORATION COMMON STOCK NPV,428291108,10003000.0,174458,0.018096900098526162,2019-02-14,2018-12-31,0001567619-19-003978
PK,PARK HOTELS AND RESORTS INCORPORATED REIT USD0.01,700517105,9977000.0,384012,0.018049862269618664,2019-02-14,2018-12-31,0001567619-19-003978
TRL,DAVITA INCORPORATED,23918K108,9949000.0,193339,0.017999206146179822,2019-02-14,2018-12-31,0001567619-19-003978
PHM,PULTE GROUP INCORPORATED COMMON STOCK USD0.01,745867101,9925000.0,381889,0.01795578661180367,2019-02-14,2018-12-31,0001567619-19-003978
INDA,ISHARES MSCI INDIA ETF,46429B598,9855000.0,295592,0.017829146303206568,2019-02-14,2018-12-31,0001567619-19-003978
FRTEUR,FEDERAL REALTY INVESTMENT TRUST REIT USD0.01,313747206,9823000.0,83217,0.017771253590705034,2019-02-14,2018-12-31,0001567619-19-003978
ELV,ANTHEM INCORPORATED COMMON STOCK USD0.01,036752103,9817000.0,37379,0.017760398707111,2019-02-14,2018-12-31,0001567619-19-003978
SSD,SIMPSON MANUFACTURING COMPANY INCORPORATED COMMON STOCK USD0.01,829073105,9783000.0,180732,0.017698887700078117,2019-02-14,2018-12-31,0001567619-19-003978
CPLGGUSD,COREPOINT LODGING INC USD0.010000,21872L104,9780000.0,798350,0.0176934602582811,2019-02-14,2018-12-31,0001567619-19-003978
MA,MASTERCARD INCORPORATED CLASS A COMMON STOCK USD0.0001,57636Q104,9767000.0,51772,0.017669941343827354,2019-02-14,2018-12-31,0001567619-19-003978
HTAB,HARTFORD FUNDS EXCHANGE TRADED TR SCHRODERS TAX AWARE BOND ETF USD,41653L404,9750000.0,487500,0.017639185840310913,2019-02-14,2018-12-31,0001567619-19-003978
