ticker,nameOfIssuer,cusip,value,shares,allocation_percent,filingDate,reportDate,accessionNumber
HTHT 0.375 11/01/22,HUAZHU GROUP LTD 0.3750 CONV 01/11/2022,16949NAC3,4209262000.0,43020000,7.615174837800902,2019-02-14,2018-12-31,0001567619-19-003978
WDAY 0.25 10/01/22,WORKDAY INC  0.2500 CONV 01/10/2022,98138HAF8,1944736000.0,15833000,3.5183138168556805,2019-02-14,2018-12-31,0001567619-19-003978
BABA,ALIBABA GROUP HOLDING LIMITED SPONSORED ADR (EACH REPRESENTS 1 ORDINARY SHARES USD0.000025),01609W102,901172000.0,6574536,1.6303528597009915,2019-02-14,2018-12-31,0001567619-19-003978
BABA,ALIBABA GROUP HOLDING LIMITED SPONSORED ADR (EACH REPRESENTS 1 ORDINARY SHARES USD0.000025),01609W102,895355000.0,6532098,1.6198290500565722,2019-02-14,2018-12-31,0001567619-19-003978
HTHT 0.375 11/01/22,HUAZHU GROUP LTD 0.3750 CONV 01/11/2022,16949NAC3,792539000.0,8100000,1.4338197647891455,2019-02-14,2018-12-31,0001567619-19-003978
INTC,INTEL CORPORATION COMMON STOCK USD0.001,458140100,679441000.0,14477749,1.2292088273360706,2019-02-14,2018-12-31,0001567619-19-003978
BABA,ALIBABA GROUP HOLDING LIMITED SPONSORED ADR (EACH REPRESENTS 1 ORDINARY SHARES USD0.000025),01609W102,612739000.0,4470265,1.1085350864211558,2019-02-14,2018-12-31,0001567619-19-003978
GOOGL,ALPHABET INCORPORATED CL A NPV,02079K305,588737000.0,563406,1.0651119337504744,2019-02-14,2018-12-31,0001567619-19-003978
BABA,ALIBABA GROUP HOLDING LIMITED SPONSORED ADR (EACH REPRESENTS 1 ORDINARY SHARES USD0.000025),01609W102,579023000.0,4224288,1.0475378772117276,2019-02-14,2018-12-31,0001567619-19-003978
MSFT,MICROSOFT CORPORATION COMMON STOCK USD0.0000125,594918104,578237000.0,5692988,1.0461158874609089,2019-02-14,2018-12-31,0001567619-19-003978
JPM,JPMORGAN CHASE AND COMPANY COMMON STOCK USD1,46625H100,545408000.0,5587053,0.9867233918761327,2019-02-14,2018-12-31,0001567619-19-003978
CSCO,CISCO SYSTEMS INCORPORATED USD0.001 (US LISTING),17275R102,538708000.0,12432685,0.9746021051961241,2019-02-14,2018-12-31,0001567619-19-003978
AAPL,APPLE INCORPORATED COMMON STOCK NPV,037833100,497664000.0,3154965,0.9003474648238452,2019-02-14,2018-12-31,0001567619-19-003978
JNJ,JOHNSON AND JOHNSON COMMON STOCK USD1,478160104,473128000.0,3666237,0.8559582275132945,2019-02-14,2018-12-31,0001567619-19-003978
ITUB,ITAU UNIBANCO HOLDING SA ADR (EACH REPRESENTS 1 PREFERENCE SHARE),465562106,426574000.0,46671148,0.7717351857071577,2019-02-14,2018-12-31,0001567619-19-003978
BAC,BANK OF AMERICA CORPORATION COMMON STOCK USD0.01,060505104,401670000.0,16301539,0.7266801822028394,2019-02-14,2018-12-31,0001567619-19-003978
V,VISA INCORPORATED CLASS A COMMON STOCK USD0.0001,92826C839,391920000.0,2970442,0.7090409963625285,2019-02-14,2018-12-31,0001567619-19-003978
AMZN,AMAZON.COM INCORPORATED USD0.01,023135106,368438000.0,245303,0.6665586002699971,2019-02-14,2018-12-31,0001567619-19-003978
PFE,PFIZER INCORPORATED COMMON STOCK USD0.05,717081103,358633000.0,8216097,0.6488199113300742,2019-02-14,2018-12-31,0001567619-19-003978
UNH,UNITEDHEALTH GROUP INCORPORATED COMMON STOCK USD0.01,91324P102,338717000.0,1359653,0.6127889343869325,2019-02-14,2018-12-31,0001567619-19-003978
LLY,ELI LILLY AND COMPANY COMMON STOCK NPV,532457108,328293000.0,2836962,0.5939303832895579,2019-02-14,2018-12-31,0001567619-19-003978
HD,HOME DEPOT INCORPORATED (THE) COMMON STOCK USD0.05,437076102,300936000.0,1751462,0.5444375415425441,2019-02-14,2018-12-31,0001567619-19-003978
PG,PROCTER AND GAMBLE COMPANY (THE) COMMON STOCK NPV,742718109,293544000.0,3193473,0.5310643249546899,2019-02-14,2018-12-31,0001567619-19-003978
NTR,NUTRIEN LIMITED NPV,67077M108,278966000.0,4350687,0.5046905761157102,2019-02-14,2018-12-31,0001567619-19-003978
VALE,VALE DO RIO DOCE (CIA) SPONSORED ADR (REPRESENTING 1 ORDINARY NPV),91912E105,278031000.0,21078943,0.502999023422306,2019-02-14,2018-12-31,0001567619-19-003978
N/A,UBS GROUP AG CHF0.10 (REGISTERED),H42097107,277716000.0,22698522,0.5024291420336191,2019-02-14,2018-12-31,0001567619-19-003978
ITUB,ITAU UNIBANCO HOLDING SA ADR (EACH REPRESENTS 1 PREFERENCE SHARE),465562106,273473000.0,29920514,0.49475293018536887,2019-02-14,2018-12-31,0001567619-19-003978
AMGN,AMGEN INCORPORATED COMMON STOCK USD0.0001,031162100,267584000.0,1374550,0.48409886193782103,2019-02-14,2018-12-31,0001567619-19-003978
TSM,TAIWAN SEMICONDUCTOR MANUFACTURING COMPANY LIMITED ADS REPRESENTING 5 COMMON SHARES,874039100,265740000.0,7199679,0.4807627943799202,2019-02-14,2018-12-31,0001567619-19-003978
MRK,MERCK AND COMPANY INCORPORATED NEW COMMON STOCK USD0.01,58933Y105,254365000.0,3328944,0.4601837442328908,2019-02-14,2018-12-31,0001567619-19-003978
ORCL,ORACLE CORPORATION COMMON STOCK USD0.01,68389X105,250826000.0,5555391,0.4537811720596744,2019-02-14,2018-12-31,0001567619-19-003978
IVV,ISHARES TRUST CORE S&P 500 ETF,464287200,250721000.0,996466,0.45359121159677873,2019-02-14,2018-12-31,0001567619-19-003978
HDB,HDFC BANK LIMITED ADR (EACH REPRESENTING 3 ORDINARY),40415F101,248468000.0,2398569,0.44951520280721763,2019-02-14,2018-12-31,0001567619-19-003978
PM,PHILIP MORRIS INTERNATIONAL INCORPORATED COMMON STOCK NPV,718172109,245115000.0,3671578,0.4434491320254163,2019-02-14,2018-12-31,0001567619-19-003978
IBM,INTL BUSINESS MACHINES CORPORATION COMMON STOCK USD0.20,459200101,243476000.0,2141952,0.44048393965697846,2019-02-14,2018-12-31,0001567619-19-003978
TD,TORONTO-DOMINION BANK (THE) COMMON NPV,891160509,241981000.0,3565891,0.4377792644947974,2019-02-14,2018-12-31,0001567619-19-003978
VOO,VANGUARD INDEX FUNDS S&P 500 ETF,922908363,237275000.0,1032482,0.4292654174625407,2019-02-14,2018-12-31,0001567619-19-003978
ADBE,ADOBE INCORPORATED NPV,00724F101,231921000.0,1025112,0.4195792430021279,2019-02-14,2018-12-31,0001567619-19-003978
HTHT,HUAZHU GROUP LIMITED ADR NPV (EACH REPRESENTS 1 ORDINARY SHARE),44332N106,231230000.0,8076496,0.41832912224154795,2019-02-14,2018-12-31,0001567619-19-003978
MDT,MEDTRONIC PLC USD0.10,G5960L103,231216000.0,2541948,0.4183037941798285,2019-02-14,2018-12-31,0001567619-19-003978
ABBV,ABBVIE INCORPORATED COMMON STOCK USD0.01,00287Y109,227260000.0,2465129,0.4111468075968265,2019-02-14,2018-12-31,0001567619-19-003978
TXN,TEXAS INSTRUMENTS INCORPORATED COMMON STOCK USD1,882508104,224097000.0,2371397,0.4054244747955031,2019-02-14,2018-12-31,0001567619-19-003978
TSM,TAIWAN SEMICONDUCTOR MANUFACTURING COMPANY LIMITED ADS REPRESENTING 5 COMMON SHARES,874039100,222972000.0,6040952,0.403389184121621,2019-02-14,2018-12-31,0001567619-19-003978
INFY,INFOSYS LIMITED SPONSORED ADR (EACH REPRESENTS 1 ORDINARY INR5),456788108,210756000.0,22138214,0.38128864112416067,2019-02-14,2018-12-31,0001567619-19-003978
KMB,KIMBERLY-CLARK CORPORATION COMMON STOCK USD1.25,494368103,204352000.0,1793504,0.36970286203479136,2019-02-14,2018-12-31,0001567619-19-003978
AMXN,AMERICA MOVIL SAB DE CV ADR (EACH REPRESENTS 20 SERIES 'L' SHARES),02364W105,204080000.0,14321415,0.3692107739785283,2019-02-14,2018-12-31,0001567619-19-003978
WFC,WELLS FARGO AND COMPANY COMMON STOCK USD1.6667,949746101,203501000.0,4416246,0.3681632777117037,2019-02-14,2018-12-31,0001567619-19-003978
AIG,AMERICAN INTERNATIONAL GROUP INCORPORATED COMMON STOCK USD2.50,026874784,202224000.0,5131275,0.3658529966534394,2019-02-14,2018-12-31,0001567619-19-003978
TMO,THERMO FISHER SCIENTIFIC INCORPORATED COMMON STOCK USD1,883556102,201332000.0,899646,0.3642392372924591,2019-02-14,2018-12-31,0001567619-19-003978
DHR,DANAHER CORPORATION COMMON STOCK USD0.01,235851102,200230000.0,1941717,0.3622455570056876,2019-02-14,2018-12-31,0001567619-19-003978
BMY,BRISTOL-MYERS SQUIBB COMPANY COMMON STOCK USD0.10,110122108,195677000.0,3764474,0.3540085095050788,2019-02-14,2018-12-31,0001567619-19-003978
BBD,BANCO BRADESCO SA SPONSORED ADR (EACH REPRESENTING 1 PREFERENCE SHARE NPV),059460303,187458000.0,18954301,0.33913912812851316,2019-02-14,2018-12-31,0001567619-19-003978
BKNG,BOOKING HOLDINGS INCORPORATED COMMON STOCK USD0.008,09857L108,184606000.0,107178,0.33397944012681396,2019-02-14,2018-12-31,0001567619-19-003978
BIDUN,BAIDU INCORPORATED SPONSORED ADR (EACH REPRESENTS 0.10 CLASS A SHARES),056752108,182187000.0,1148718,0.32960311289115124,2019-02-14,2018-12-31,0001567619-19-003978
BKNG,BOOKING HOLDINGS INCORPORATED COMMON STOCK USD0.008,09857L108,180158000.0,104596,0.3259323530891009,2019-02-14,2018-12-31,0001567619-19-003978
CAT,CATERPILLAR INCORPORATED COMMON STOCK USD1,149123101,178111000.0,1401675,0.3222290286362684,2019-02-14,2018-12-31,0001567619-19-003978
OMC,OMNICOM GROUP INC COMMON STOCK USD0.15,681919106,174910000.0,2388178,0.3164379482388494,2019-02-14,2018-12-31,0001567619-19-003978
VALE,VALE DO RIO DOCE (CIA) SPONSORED ADR (REPRESENTING 1 ORDINARY NPV),91912E105,173419000.0,13147797,0.3137405096657311,2019-02-14,2018-12-31,0001567619-19-003978
BAC,VERIZON COMMUNICATIONS INCORPORATED COMMON STOCK USD0.10,92343V104,173255000.0,3081741,0.31344380951416073,2019-02-14,2018-12-31,0001567619-19-003978
ROK,ROCKWELL AUTOMATION INCORPORATED COMMON STOCK USD1,773903109,168381000.0,1118959,0.30462602574127096,2019-02-14,2018-12-31,0001567619-19-003978
N/A,UBS GROUP AG CHF0.10 (REGISTERED),H42097107,167780000.0,13713122,0.3035387282346015,2019-02-14,2018-12-31,0001567619-19-003978
XOM,EXXON MOBIL CORPORATION COMMON STOCK NPV,30231G102,161765000.0,2372265,0.29265670743157896,2019-02-14,2018-12-31,0001567619-19-003978
PNC,PNC FINANCIAL SERVICES GROUP COMMON STOCK USD5,693475105,160880000.0,1376099,0.2910556121014584,2019-02-14,2018-12-31,0001567619-19-003978
GILD,GILEAD SCIENCES INCORPORATED COMMON STOCK USD0.001,375558103,158896000.0,2540302,0.2874662639263634,2019-02-14,2018-12-31,0001567619-19-003978
EBA,EBAY INCORPORATED COMMON STOCK USD0.001,278642103,153721000.0,5476336,0.27810392682650603,2019-02-14,2018-12-31,0001567619-19-003978
PM,PHILIP MORRIS INTERNATIONAL INCORPORATED COMMON STOCK NPV,718172109,153321000.0,2296594,0.27738026792023684,2019-02-14,2018-12-31,0001567619-19-003978
N/A,CREDICORP LIMITED COMMON STOCK USD5 (US LISTING),G2519Y108,152735000.0,689018,0.27632010762255255,2019-02-14,2018-12-31,0001567619-19-003978
GOOG,ALPHABET INCORPORATED-CL C NPV,02079K107,151565000.0,146353,0.2742034053217152,2019-02-14,2018-12-31,0001567619-19-003978
CTSH,COGNIZANT TECHNOLOGY SOLUTIONS CORPORATION CLASS A COMMON STOCK USD0.01,192446102,148140000.0,2333648,0.2680070759367855,2019-02-14,2018-12-31,0001567619-19-003978
N/A,NEW ORIENTAL EDUCATION & TECHNOLOGY GROUP INCORPORATED SPONSORED ADR USD0.01 (EACH REPRESENTS 1 ORDINARY SHARES),647581107,147175000.0,2685181,0.26626124882541113,2019-02-14,2018-12-31,0001567619-19-003978
CMCSA,COMCAST CORPORATION CLASS A COMMON STOCK USD1,20030N101,143416000.0,4211931,0.25946066425374664,2019-02-14,2018-12-31,0001567619-19-003978
PAYX,PAYCHEX INCORPORATED COMMON STOCK USD0.01,704326107,142227000.0,2183065,0.25730958815486155,2019-02-14,2018-12-31,0001567619-19-003978
PBR,PETROLEO BRASILEIRO - PETROBRAS ADS (EACH REPRESENTING 2 COMMON SHARES),71654V408,142213000.0,10931040,0.25728426009314215,2019-02-14,2018-12-31,0001567619-19-003978
OXY,OCCIDENTAL PETROLEUM CORP COMMON STOCK USD0.20,674599105,141471000.0,2304839,0.2559418728220128,2019-02-14,2018-12-31,0001567619-19-003978
AZO,AUTOZONE INCORPORATED COMMON STOCK USD0.01,053332102,138315000.0,164987,0.2502322040515491,2019-02-14,2018-12-31,0001567619-19-003978
PEP,PEPSICO INCORPORATED CAPITAL STOCK USD0.016666,713448108,137870000.0,1247919,0.24942713351832468,2019-02-14,2018-12-31,0001567619-19-003978
EMR,EMERSON ELECTRIC COMPANY COMMON STOCK USD1,291011104,136209000.0,2279646,0.24642213991004197,2019-02-14,2018-12-31,0001567619-19-003978
MA,MASTERCARD INCORPORATED CLASS A COMMON STOCK USD0.0001,57636Q104,136192000.0,721932,0.2463913844065255,2019-02-14,2018-12-31,0001567619-19-003978
HDB,HDFC BANK LIMITED ADR (EACH REPRESENTING 3 ORDINARY),40415F101,134530000.0,1298673,0.24338458165097712,2019-02-14,2018-12-31,0001567619-19-003978
CVX,CHEVRON CORPORATION COMMON STOCK USD0.75,166764100,132627000.0,1219110,0.23994177440440156,2019-02-14,2018-12-31,0001567619-19-003978
DIS,WALT DISNEY COMPANY (THE) COMMON STOCK USD0.01,254687106,129490000.0,1180937,0.23426647943198564,2019-02-14,2018-12-31,0001567619-19-003978
AFL,AFLAC INCORPORATED COMMON STOCK USD0.10,001055102,128326000.0,2816631,0.23216063201474238,2019-02-14,2018-12-31,0001567619-19-003978
IP,INTERNATIONAL PAPER COMPANY COMMON STOCK USD1,460146103,127586000.0,3161209,0.23082186303814445,2019-02-14,2018-12-31,0001567619-19-003978
AMXN,AMERICA MOVIL SAB DE CV ADR (EACH REPRESENTS 20 SERIES 'L' SHARES),02364W105,126746000.0,8894448,0.22930217933497918,2019-02-14,2018-12-31,0001567619-19-003978
N/A,GARMIN LIMITED COMMON STOCK USD0.005,H2906T109,125312000.0,1979034,0.22670786215600422,2019-02-14,2018-12-31,0001567619-19-003978
BBD,BANCO BRADESCO SA SPONSORED ADR (EACH REPRESENTING 1 PREFERENCE SHARE NPV),059460303,125046000.0,12643668,0.22622662898333523,2019-02-14,2018-12-31,0001567619-19-003978
IVV,ISHARES TRUST CORE S&P 500 ETF,464287200,124979000.0,496719,0.22610541611653512,2019-02-14,2018-12-31,0001567619-19-003978
AVGO,BROADCOM INCORPORATED COMMON STOCK NPV,11135F101,123839000.0,487020,0.22404298823366803,2019-02-14,2018-12-31,0001567619-19-003978
META,FACEBOOK INCORPORATED CLASS A COMMON STOCK USD0.000006,30303M102,123317000.0,940708,0.22309861336098674,2019-02-14,2018-12-31,0001567619-19-003978
SLB,SCHLUMBERGER LIMITED COMMON STOCK USD0.01,806857108,122620000.0,3398547,0.22183763771681272,2019-02-14,2018-12-31,0001567619-19-003978
VIPS,VIPSHOP HOLDINGS LIMITED SPONSORED ADR (EACH REPRESENTS 0.2 ORDINARY SHARES USD0.0001),92763W103,119613000.0,21907182,0.21639753188893426,2019-02-14,2018-12-31,0001567619-19-003978
MO,ALTRIA GROUP INCORPORATED COMMON STOCK USD0.3333,02209S103,119021000.0,2409814,0.21532651670765593,2019-02-14,2018-12-31,0001567619-19-003978
GS,GOLDMAN SACHS GROUP INCORPORATED COMMON STOCK USD0.01,38141G104,118980000.0,712244,0.21525234166976334,2019-02-14,2018-12-31,0001567619-19-003978
CHKP,CHECK POINT SOFTWARE TECHNOLOGIES LIMITED ILS1,M22465104,117345000.0,1143160,0.21229438589038813,2019-02-14,2018-12-31,0001567619-19-003978
DE,DEERE & COMPANY COMMON STOCK USD1,244199105,115942000.0,777246,0.209756152276649,2019-02-14,2018-12-31,0001567619-19-003978
BIIB,BIOGEN INCORPORATED COMMON STOCK USD0.0005,09062X103,115890000.0,385118,0.20966207661883401,2019-02-14,2018-12-31,0001567619-19-003978
PFG,PRINCIPAL FINANCIAL GROUP COMMON STOCK USD0.01,74251V102,115516000.0,2615261,0.20898545554147238,2019-02-14,2018-12-31,0001567619-19-003978
CL,COLGATE-PALMOLIVE COMPANY COMMON STOCK USD1,194162103,115399000.0,1938826,0.2087737853113886,2019-02-14,2018-12-31,0001567619-19-003978
CI,CIGNA CORP COMMON STOCK USD0.010000,125523100,110887000.0,583859,0.2006109128486724,2019-02-14,2018-12-31,0001567619-19-003978
QCOM,QUALCOMM INCORPORATED COMMON STOCK USD0.0001,747525103,109354000.0,1921525,0.19783749009039583,2019-02-14,2018-12-31,0001567619-19-003978
HSY,HERSHEY COMPANY (THE) COMMON STOCK USD1,427866108,109276000.0,1019555,0.19769637660367337,2019-02-14,2018-12-31,0001567619-19-003978
N/A,TE CONNECTIVITY LIMITED CHF0.77 (US LISTING),H84989104,109119000.0,1442800,0.19741234048296272,2019-02-14,2018-12-31,0001567619-19-003978
RGA,REINSURANCE GROUP OF AMERICA INCORPORATED COMMON STOCK USD0.01,759351604,108392000.0,772959,0.19609709042081852,2019-02-14,2018-12-31,0001567619-19-003978
N/A,DOWDUPONT INCORPORATED COMMON STOCK USD0.01,26078J100,108269000.0,2024485,0.19587456530714073,2019-02-14,2018-12-31,0001567619-19-003978
HTHT,HUAZHU GROUP LIMITED ADR NPV (EACH REPRESENTS 1 ORDINARY SHARE),44332N106,108235000.0,3780463,0.19581305430010787,2019-02-14,2018-12-31,0001567619-19-003978
7HP,HP INCORPORATED COMMON STOCK USD0.01,40434L105,107769000.0,5267324,0.1949699916743043,2019-02-14,2018-12-31,0001567619-19-003978
FTV,FORTIVE CORPORATION COMMON STOCK USD0.01,34959J108,107354000.0,1586672,0.19421919555905,2019-02-14,2018-12-31,0001567619-19-003978
TMUS,T-MOBILE US INCORPORATED COMMON STOCK USD0.0001,872590104,106564000.0,1675265,0.1927899692191684,2019-02-14,2018-12-31,0001567619-19-003978
N/A,CREDICORP LIMITED COMMON STOCK USD5 (US LISTING),G2519Y108,106388000.0,479938,0.19247155930041,2019-02-14,2018-12-31,0001567619-19-003978
ITW,ILLINOIS TOOL WORKS INC COMMON STOCK NPV,452308109,106229000.0,838493,0.19218390488516798,2019-02-14,2018-12-31,0001567619-19-003978
BAX,BAXTER INTERNATIONAL INCORPORATED COMMON STOCK USD1,071813109,103671000.0,1575069,0.1875561061795767,2019-02-14,2018-12-31,0001567619-19-003978
ARMK,ARAMARK COMMON STOCK USD0.01,03852U106,102559000.0,3540172,0.1855443344201484,2019-02-14,2018-12-31,0001567619-19-003978
NTR,NUTRIEN LIMITED NPV,67077M108,101110000.0,1576894,0.18292288003218835,2019-02-14,2018-12-31,0001567619-19-003978
XRAY,DENTSPLY INTERNATIONAL INCORPORATED COMMON STOCK USD 0.01,24906P109,100561000.0,2702529,0.1819296581833339,2019-02-14,2018-12-31,0001567619-19-003978
FMX,FOMENTO ECONOMICO MEXICANO SP ADR (EACH REPRESENTS 10 ORDINARY SHARE),344419106,99909000.0,1161054,0.18075009416611518,2019-02-14,2018-12-31,0001567619-19-003978
PFGC,PERFORMANCE FOOD GROUP CO COMMON STOCK USD0.010000,71377A103,98821000.0,3062333,0.17878174194106305,2019-02-14,2018-12-31,0001567619-19-003978
HXL,HEXCEL CORPORATION COMMON STOCK NPV,428291108,98616000.0,1719851,0.1784108667516001,2019-02-14,2018-12-31,0001567619-19-003978
BSAC,BANCO SANTANDER-CHILE SA ADR (EACH 1 REPRESENTS 400 COMMON SHARES),05965X109,97884000.0,3273722,0.17708657095312752,2019-02-14,2018-12-31,0001567619-19-003978
FMX,FOMENTO ECONOMICO MEXICANO SP ADR (EACH REPRESENTS 10 ORDINARY SHARE),344419106,97524000.0,1133346,0.17643527793748526,2019-02-14,2018-12-31,0001567619-19-003978
T,AT AND T INCORPORATED COMMON STOCK USD1,00206R102,96730000.0,3389292,0.17499881500854098,2019-02-14,2018-12-31,0001567619-19-003978
CIEN,CIENA CORPORATION COMMON STOCK USD0.01,171779309,95764000.0,2824059,0.17325117874990095,2019-02-14,2018-12-31,0001567619-19-003978
BC,BRUNSWICK CORPORATION COMMON STOCK USD0.75,117043109,95265000.0,2050910,0.17234841426433017,2019-02-14,2018-12-31,0001567619-19-003978
ELS,EQUITY LIFESTYLE PROPERTIES INCORPORATED REIT USD0.01,29472R108,94489000.0,972812,0.170944515986168,2019-02-14,2018-12-31,0001567619-19-003978
BLKCHF,BLACKROCK INCORPORATED COMMON STOCK USD0.01,09247X101,94090000.0,239524,0.17022266622716448,2019-02-14,2018-12-31,0001567619-19-003978
IQ,IQIYI INCORPORATED ADR (EACH REPRESENTS 7 ORDINARY SHARES),46267X108,93292000.0,6273852,0.16877896670915749,2019-02-14,2018-12-31,0001567619-19-003978
CLX,CLOROX COMPANY COMMON STOCK USD1,189054109,93019000.0,603474,0.1682850695056288,2019-02-14,2018-12-31,0001567619-19-003978
BEN,FRANKLIN RESOURCES INCORPORATED COMMON STOCK USD0.10,354613101,92622000.0,3122784,0.16756683804115666,2019-02-14,2018-12-31,0001567619-19-003978
PBR,PETROLEO BRASILEIRO - PETROBRAS ADS (EACH REPRESENTING 2 COMMON SHARES),71654V408,92479000.0,7108278,0.16730812998216543,2019-02-14,2018-12-31,0001567619-19-003978
AWN,ADVANCE AUTO PARTS INCORPORATED COMMON STOCK USD0.0001,00751Y106,91683000.0,582260,0.16586804875868977,2019-02-14,2018-12-31,0001567619-19-003978
PBR/A,PETROL BRASILEIRO-PETROBRAS SA SPONSORED ADR (EACH REPRESENTS 2 PREFERENCE SHARE NPV),71654V101,91399000.0,7886027,0.16535425093523867,2019-02-14,2018-12-31,0001567619-19-003978
C,CITIGROUP INCORPORATED COMMON STOCK USD0.01,172967424,90579000.0,1739897,0.1638707501773869,2019-02-14,2018-12-31,0001567619-19-003978
INFY,INFOSYS LIMITED SPONSORED ADR (EACH REPRESENTS 1 ORDINARY INR5),456788108,90453000.0,9501316,0.16364279762191208,2019-02-14,2018-12-31,0001567619-19-003978
MMM,3M COMPANY COMMON STOCK USD0.01,88579Y101,89318000.0,468763,0.16158941547537334,2019-02-14,2018-12-31,0001567619-19-003978
LNC,LINCOLN NATIONAL CORPORATION COMMON STOCK NPV,534187109,88742000.0,1729518,0.16054734665034576,2019-02-14,2018-12-31,0001567619-19-003978
DGX,QUEST DIAGNOSTICS INCORPORATED COMMON STOCK USD0.01,74834L100,88560000.0,1063534,0.16021808184799327,2019-02-14,2018-12-31,0001567619-19-003978
INTU,INTUIT INC COMMON STOCK USD0.01,461202103,87904000.0,446555,0.15903128124171184,2019-02-14,2018-12-31,0001567619-19-003978
CTLTEUR,CATALENT INCORPORATED COMMON STOCK USD0.01,148806102,84925000.0,2723701,0.15364183153727223,2019-02-14,2018-12-31,0001567619-19-003978
FITB,FIFTH THIRD BANCORP COM STK NPV,316773100,84746000.0,3601604,0.1533179941767168,2019-02-14,2018-12-31,0001567619-19-003978
BURL,BURLINGTON STORES INC COMMON STOCK USD0.0001,122017106,84500000.0,519454,0.15287294394936124,2019-02-14,2018-12-31,0001567619-19-003978
LDOS,LEIDOS HOLDINGS INCORPORATED COMMON STOCK USD0.0001,525327102,83762000.0,1588803,0.15153779326729463,2019-02-14,2018-12-31,0001567619-19-003978
XLV,HEALTH CARE SELECT SECTOR SPDR FD NPV,81369Y209,83603000.0,966393,0.15125013885205263,2019-02-14,2018-12-31,0001567619-19-003978
VOO,VANGUARD INDEX FUNDS S&P 500 ETF,922908363,82886000.0,360671,0.14995298026256515,2019-02-14,2018-12-31,0001567619-19-003978
PKG,PACKAGING CORPORATION OF AMERICA COMMON STOCK USD0.01,695156109,82388000.0,987156,0.14905202492426003,2019-02-14,2018-12-31,0001567619-19-003978
FBIN,FORTUNE BRANDS HOME AND SECURITY INCORPORATED COMMON STOCK USD0.01,34964C106,81586000.0,2147572,0.14760108881719036,2019-02-14,2018-12-31,0001567619-19-003978
HRB,BLOCK(H & R) INC COM STK NPV,093671105,81227000.0,3201680,0.1469516049488138,2019-02-14,2018-12-31,0001567619-19-003978
AJG,GALLAGHER (ARTHUR J.) & COMPANY COMMON STOCK USD1,363576109,80795000.0,1096264,0.1461700533300431,2019-02-14,2018-12-31,0001567619-19-003978
SERVUSD,SERVICEMASTER GLOBAL HOLDINGS INCORPORATED COMMON STOCK USD0.01,81761R109,79176000.0,2155027,0.14324104390691864,2019-02-14,2018-12-31,0001567619-19-003978
BRO,BROWN & BROWN INCORPORATED COMMON STOCK USD0.10,115236101,78642000.0,2853486,0.1422749592670493,2019-02-14,2018-12-31,0001567619-19-003978
PTC,PTC INCORPORATED COMMON STOCK USD0.01,69370C100,78554000.0,947573,0.1421157543076701,2019-02-14,2018-12-31,0001567619-19-003978
IDA,IDACORP INCORPORATED COMMON STOCK NPV,451107106,77326000.0,830926,0.13989412146542377,2019-02-14,2018-12-31,0001567619-19-003978
N/A,INTEGRATED DEVICE TECHNOLOGY INCORPORATE D COMMON STOCK USD0.001,458118106,77009000.0,1590114,0.13932062178220544,2019-02-14,2018-12-31,0001567619-19-003978
VVV,VALVOLINE INCORPORATED COMMON STOCK USD0.01,92047W101,75883000.0,3921584,0.13728352196105775,2019-02-14,2018-12-31,0001567619-19-003978
NTR,NUTRIEN LIMITED COMMON NPV,67077M108,75400000.0,1604261,0.13640970383173773,2019-02-14,2018-12-31,0001567619-19-003978
DLB,DOLBY LABORATORIES INCORPORATED CLASS 'A' COMMON STOCK USD0.001,25659T107,75080000.0,1214105,0.1358307767067224,2019-02-14,2018-12-31,0001567619-19-003978
WEA,WESTERN ALLIANCE BANCORP COMMON STOCK USD0.0001,957638109,75038000.0,1900178,0.13575479252156414,2019-02-14,2018-12-31,0001567619-19-003978
CTRA,CABOT OIL & GAS CORPORATION COMMON STOCK USD0.10,127097103,74087000.0,3314839,0.13403429347190918,2019-02-14,2018-12-31,0001567619-19-003978
STAYUSD,EXTENDED STAY AMERICA INC COMMON STOCK NPV,30224P200,73720000.0,4756139,0.13337033642540724,2019-02-14,2018-12-31,0001567619-19-003978
CNI,CANADIAN NATIONAL RAILWAY COMMON STOCK NPV,136375102,73099000.0,722968,0.13224685597342437,2019-02-14,2018-12-31,0001567619-19-003978
ALSN,ALLISON TRANSMISSION HOLDINGS INCORPORATED COMMON STOCK USD0.01,01973R101,72699000.0,1655645,0.13152319706715518,2019-02-14,2018-12-31,0001567619-19-003978
LAMR,LAMAR ADVERTISING COMPANY CLASS A REIT USD0.001,512816109,71544000.0,1034166,0.12943363197530297,2019-02-14,2018-12-31,0001567619-19-003978
KAR,KAR AUCTION SERVICES INCORPORATED COMMON STOCK USD0.01,48238T109,71500000.0,1498330,0.12935402949561337,2019-02-14,2018-12-31,0001567619-19-003978
ARW,ARROW ELECTRONICS INCORPORATED COMMON STOCK USD1,042735100,71461000.0,1036424,0.12928347275225213,2019-02-14,2018-12-31,0001567619-19-003978
HUBB,HUBBELL INCORPORATED COMMON STOCK USD0.01,443510607,71208000.0,716809,0.12882575849403685,2019-02-14,2018-12-31,0001567619-19-003978
GPK,GRAPHIC PACKAGING HOLDING COMPANY COMMON STOCK USD0.01,388689101,71117000.0,6683951,0.12866112609286065,2019-02-14,2018-12-31,0001567619-19-003978
NTES,NETEASE INCORPORATED ADR (EACH REPRESENTS 25 SHARES USD0.0001),64110W102,70834000.0,300947,0.12814913741667522,2019-02-14,2018-12-31,0001567619-19-003978
CTSH,COGNIZANT TECHNOLOGY SOLUTIONS CORPORATION CLASS A COMMON STOCK USD0.01,192446102,70696000.0,1113675,0.12789947509401234,2019-02-14,2018-12-31,0001567619-19-003978
DEO,DIAGEO PLC SPONSORED ADR (EACH REPRESENTING 4 ORDINARY GBP0.28),25243Q205,70404000.0,496499,0.12737120409243585,2019-02-14,2018-12-31,0001567619-19-003978
ASH,ASHLAND GLOBAL HOLDINGS INCORPORATED COMMON STOCK NPV,044186104,70387000.0,991926,0.1273404485889194,2019-02-14,2018-12-31,0001567619-19-003978
YPF,YPF SA SPONSORED ADR (EACH CONVERT INTO 1 CLASS 'D'),984245100,69921000.0,5221915,0.12649738596311583,2019-02-14,2018-12-31,0001567619-19-003978
BSAC,BANCO SANTANDER-CHILE SA ADR (EACH 1 REPRESENTS 400 COMMON SHARES),05965X109,69044000.0,2309173,0.12491076381112068,2019-02-14,2018-12-31,0001567619-19-003978
ON,ON SEMICONDUCTOR CORPORATION COMMON STOCK USD0.01,682189105,68581000.0,4153891,0.12407312862711413,2019-02-14,2018-12-31,0001567619-19-003978
MSM,MSC INDUSTRIAL DIRECT COMPANY INCORPORATED CLASS 'A' COMMON STOCK USD0.001,553530106,68223000.0,886936,0.12342545390600322,2019-02-14,2018-12-31,0001567619-19-003978
VMI,VALMONT INDUSTRIES INCORPORATED COMMON STOCK USD1,920253101,67815000.0,611220,0.12268732182160867,2019-02-14,2018-12-31,0001567619-19-003978
CM,CANADIAN IMPERIAL BANK OF COMMERCE COMMON NPV,136069101,67456000.0,663418,0.1220378379532321,2019-02-14,2018-12-31,0001567619-19-003978
N/A,COOPER COMPANIES INCORPORATED (THE) COMMON STOCK USD0.10,216648402,66820000.0,262554,0.12088722029226413,2019-02-14,2018-12-31,0001567619-19-003978
