ticker,nameOfIssuer,cusip,value,shares,allocation_percent,filingDate,reportDate,accessionNumber
TXN,TEXAS INSTRUMENTS INCORPORATED COMMON STOCK USD1,882508104,4136000.0,36038,0.004437314034593454,2019-08-08,2019-06-30,0001567619-19-016050
COF,CAPITAL ONE FINANCIAL CORPORATION COMMON STOCK USD0.01,14040H105,4111000.0,45300,0.004410492745699636,2019-08-08,2019-06-30,0001567619-19-016050
DECK,DECKERS OUTDOOR CORPORATION COMMON STOCK USD0.01,243537107,4108000.0,23343,0.0044072741910323775,2019-08-08,2019-06-30,0001567619-19-016050
UNM,UNUM GROUP COMMON STOCK USD0.10,91529Y106,4107000.0,122400,0.004406201339476625,2019-08-08,2019-06-30,0001567619-19-016050
USB,US BANCORP COMMON STOCK USD0.01,902973304,4106000.0,78351,0.004405128487920872,2019-08-08,2019-06-30,0001567619-19-016050
N/A,COCA-COLA EUROPEAN PARTNERS PLC COMMON STOCK EUR 0.01,G25839104,4093000.0,72451,0.004391181417696085,2019-08-08,2019-06-30,0001567619-19-016050
PLD,PROLOGIS INCORPORATED REIT USD0.01,74340W103,4087000.0,51020,0.004384744308361569,2019-08-08,2019-06-30,0001567619-19-016050
UTXZ,UNITED TECHNOLOGIES CORPORATION COMMON STOCK USD1,913017109,4084000.0,31364,0.004381525753694311,2019-08-08,2019-06-30,0001567619-19-016050
MRK,MERCK AND COMPANY INCORPORATED NEW COMMON STOCK USD0.01,58933Y105,4071000.0,48549,0.004367578683469525,2019-08-08,2019-06-30,0001567619-19-016050
EBF,ENNIS INCORPORATED COMMON STOCK USD2.50,293389102,4071000.0,198393,0.004367578683469525,2019-08-08,2019-06-30,0001567619-19-016050
PEG,PUBLIC SERVICE ENTERPRISE GROUP INCORPORATED COMMON STOCK NPV,744573106,4057000.0,68966,0.004352558761688986,2019-08-08,2019-06-30,0001567619-19-016050
MPC,MARATHON PETROLEUM CORPORATION COMMON STOCK NPV,56585A102,4057000.0,72600,0.004352558761688986,2019-08-08,2019-06-30,0001567619-19-016050
N/A,CRESCENT POINT ENERGY CORPORATION COMMON NPV,22576C101,4055000.0,936529,0.00435041305857748,2019-08-08,2019-06-30,0001567619-19-016050
SCHW,SCHWAB(CHARLES) CORPORATION COMMON STOCK USD0.01,808513105,4013000.0,99857,0.004305353293235864,2019-08-08,2019-06-30,0001567619-19-016050
EGO,ELDORADO GOLD CORP NPV,284902509,4000000.0,687340,0.004291406223011079,2019-08-08,2019-06-30,0001567619-19-016050
RTN1USD,RAYTHEON COMPANY COMMON STOCK USD0.01,755111507,3987000.0,22930,0.004277459152786292,2019-08-08,2019-06-30,0001567619-19-016050
CERNCHF,CERNER CORPORATION COMMON STOCK USD0.01,156782104,3973000.0,54200,0.004262439231005753,2019-08-08,2019-06-30,0001567619-19-016050
INFY,INFOSYS LIMITED SPONSORED ADR (EACH REPRESENTS 1 ORDINARY INR5),456788108,3973000.0,371278,0.004262439231005753,2019-08-08,2019-06-30,0001567619-19-016050
AFL,AFLAC INCORPORATED COMMON STOCK USD0.10,001055102,3968000.0,72400,0.004257074973226989,2019-08-08,2019-06-30,0001567619-19-016050
MMS,MAXIMUS INCORPORATED COMMON STOCK NPV,577933104,3967000.0,54682,0.0042560021216712365,2019-08-08,2019-06-30,0001567619-19-016050
CVS,CVS HEALTH CORPORATION COMMON STOCK USD0.01,126650100,3961000.0,72699,0.0042495650123367205,2019-08-08,2019-06-30,0001567619-19-016050
AZO,AUTOZONE INCORPORATED COMMON STOCK USD0.01,053332102,3947000.0,3590,0.004234545090556182,2019-08-08,2019-06-30,0001567619-19-016050
EQIX,EQUINIX INCORPORATED REIT USD0.001,29444U700,3946000.0,7825,0.004233472239000428,2019-08-08,2019-06-30,0001567619-19-016050
CMA,COMERICA INC COMMON STOCK USD5,200340107,3937000.0,54200,0.004223816574998654,2019-08-08,2019-06-30,0001567619-19-016050
N/A,NEW ORIENTAL EDUCATION & TECHNOLOGY GROUP INCORPORATED SPONSORED ADR USD0.01 (EACH REPRESENTS 1 ORDINARY SHARES),647581107,3932000.0,40710,0.004218452317219889,2019-08-08,2019-06-30,0001567619-19-016050
CMCSA,COMCAST CORPORATION CLASS A COMMON STOCK USD1,20030N101,3925000.0,92839,0.004210942356329621,2019-08-08,2019-06-30,0001567619-19-016050
ORCL,ORACLE CORPORATION COMMON STOCK USD0.01,68389X105,3920000.0,68809,0.0042055780985508565,2019-08-08,2019-06-30,0001567619-19-016050
N/A,CANADIAN PACIFIC RAILWAY LTD,13645T100,3915000.0,12694,0.004200213840772093,2019-08-08,2019-06-30,0001567619-19-016050
DIS,WALT DISNEY COMPANY (THE) COMMON STOCK USD0.01,254687106,3911000.0,28005,0.004195922434549082,2019-08-08,2019-06-30,0001567619-19-016050
MCX,MCCORMICK & COMPANY INCORPORATED COMMON STOCK NON VOTING NPV,579780206,3904000.0,25187,0.0041884124736588126,2019-08-08,2019-06-30,0001567619-19-016050
GIS,GENERAL MILLS INC COMMON STOCK USD0.10,370334104,3904000.0,74326,0.0041884124736588126,2019-08-08,2019-06-30,0001567619-19-016050
WDFC,WD-40 COMPANY COMMON STOCK USD0.001,929236107,3881000.0,24400,0.004163736887876498,2019-08-08,2019-06-30,0001567619-19-016050
PFE,PFIZER INCORPORATED COMMON STOCK USD0.05,717081103,3878000.0,89520,0.00416051833320924,2019-08-08,2019-06-30,0001567619-19-016050
IAG,IAMGOLD CORPORATION COMMON NPV,450913108,3868000.0,1144397,0.004149789817651712,2019-08-08,2019-06-30,0001567619-19-016050
SYY,SYSCO CORPORATION COMMON STOCK USD1,871829107,3865000.0,54648,0.0041465712629844545,2019-08-08,2019-06-30,0001567619-19-016050
SPY,SPDR SnP 500 ETF TRUST,78462F103,3859000.0,13169,0.004140134153649938,2019-08-08,2019-06-30,0001567619-19-016050
FSLR,FIRST SOLAR INCORPORATED COMMON STOCK USD0.001,336433107,3852000.0,58653,0.004132624192759668,2019-08-08,2019-06-30,0001567619-19-016050
A4S,AMERIPRISE FINANCIAL INCORPORATED COMMON STOCK USD0.01,03076C106,3847000.0,26500,0.004127259934980904,2019-08-08,2019-06-30,0001567619-19-016050
WFC,WELLS FARGO AND COMPANY COMMON STOCK USD1.6667,949746101,3844000.0,81242,0.004124041380313646,2019-08-08,2019-06-30,0001567619-19-016050
CAT,CATERPILLAR INCORPORATED COMMON STOCK USD1,149123101,3837000.0,28153,0.004116531419423377,2019-08-08,2019-06-30,0001567619-19-016050
VNET,21VIANET GROUP INCORPORATED SPONSORED ADR (EACH REPRESENTS 6 ORDINARY SHARES),90138A103,3833000.0,492048,0.004112240013200366,2019-08-08,2019-06-30,0001567619-19-016050
AVGO,BROADCOM INCORPORATED COMMON STOCK NPV,11135F101,3829000.0,13302,0.004107948606977355,2019-08-08,2019-06-30,0001567619-19-016050
BRK/A,BERKSHIRE HATHAWAY INCORPORATED CONVERTIBLE CLASS 'A' COMMON STOCK USD5,084670108,3820000.0,12,0.0040982929429755795,2019-08-08,2019-06-30,0001567619-19-016050
UNH,UNITEDHEALTH GROUP INCORPORATED COMMON STOCK USD0.01,91324P102,3816000.0,15639,0.0040940015367525685,2019-08-08,2019-06-30,0001567619-19-016050
VOO,VANGUARD INDEX FUNDS S&P 500 ETF,922908363,3807000.0,14145,0.004084345872750793,2019-08-08,2019-06-30,0001567619-19-016050
EL,ESTEE LAUDER COMPANIES INC CLASS'A'COM STK USD0.01,518439104,3791000.0,20705,0.004067180247858749,2019-08-08,2019-06-30,0001567619-19-016050
CHKP,CHECK POINT SOFTWARE TECHNOLOGIES LIMITED ILS1,M22465104,3787000.0,32755,0.004062888841635738,2019-08-08,2019-06-30,0001567619-19-016050
N/A,NOBLE CORPORATION PLC COMMON STOCK CHF3.15,G65431101,3787000.0,2025400,0.004062888841635738,2019-08-08,2019-06-30,0001567619-19-016050
CTLTEUR,CATALENT INCORPORATED COMMON STOCK USD0.01,148806102,3786000.0,69837,0.004061815990079985,2019-08-08,2019-06-30,0001567619-19-016050
IEX,IDEX CORPORATION COMMON STOCK USD0.01,45167R104,3780000.0,21956,0.004055378880745469,2019-08-08,2019-06-30,0001567619-19-016050
IEI,INSIGHT ENTERPRISES INCORPORATED COMMON STOCK USD0.01,45765U103,3777000.0,64900,0.00405216032607821,2019-08-08,2019-06-30,0001567619-19-016050
IP,INTERNATIONAL PAPER COMPANY COMMON STOCK USD1,460146103,3774000.0,87117,0.004048941771410952,2019-08-08,2019-06-30,0001567619-19-016050
CIT,CINTAS CORPORATION COMMON STOCK NPV,172908105,3749000.0,15800,0.004022120482517133,2019-08-08,2019-06-30,0001567619-19-016050
MMM,3M COMPANY COMMON STOCK USD0.01,88579Y101,3735000.0,21550,0.004007100560736594,2019-08-08,2019-06-30,0001567619-19-016050
VFC,VF CORPORATION COMMON STOCK USD1,918204108,3730000.0,42700,0.00400173630295783,2019-08-08,2019-06-30,0001567619-19-016050
WP,WORLDPAY INCORPORATED CLASS A COMMON STOCK USD0.00001,981558109,3714000.0,30305,0.003984570678065786,2019-08-08,2019-06-30,0001567619-19-016050
CSCO,CISCO SYSTEMS INCORPORATED USD0.001 (US LISTING),17275R102,3708000.0,67755,0.0039781335687312696,2019-08-08,2019-06-30,0001567619-19-016050
N/A,PENTAIR PLC COMMON STOCK USD0.167,G7S00T104,3665000.0,98520,0.0039320009518339005,2019-08-08,2019-06-30,0001567619-19-016050
CHRW,C.H. ROBINSON WORLDWIDE INCORPORATED COMMON STOCK USD0.10,12541W209,3661000.0,43400,0.003927709545610889,2019-08-08,2019-06-30,0001567619-19-016050
TROW,PRICE T.ROWE GROUP INCORPORATED COMMON STOCK USD0.20,74144T108,3642000.0,33200,0.003907325366051587,2019-08-08,2019-06-30,0001567619-19-016050
AZO,AUTOZONE INCORPORATED COMMON STOCK USD0.01,053332102,3625000.0,3297,0.0038890868896037894,2019-08-08,2019-06-30,0001567619-19-016050
EGO,ELDORADO GOLD CORPORATION,284902509,3604000.0,473599,0.003866557006932981,2019-08-08,2019-06-30,0001567619-19-016050
YUSD,ALLEGHANY CORPORATION COMMON STOCK USD1,017175100,3594000.0,5276,0.0038558284913754533,2019-08-08,2019-06-30,0001567619-19-016050
UE,URBAN EDGE PROPERTIES REIT USD0.01,91704F104,3588000.0,207042,0.003849391382040937,2019-08-08,2019-06-30,0001567619-19-016050
EQT,EQT CORPORATION COMMON STOCK NPV,26884L109,3585000.0,226749,0.0038461728273736784,2019-08-08,2019-06-30,0001567619-19-016050
GDS,GDS HOLDINGS LIMITED ADR (EACH REPRESENTS 8 ORDINARY SHARES),36165L108,3584000.0,95395,0.003845099975817926,2019-08-08,2019-06-30,0001567619-19-016050
EVTC,EVERTEC INCORPORATION COMMON STOCK USD 0.01,30040P103,3579000.0,109463,0.003839735718039162,2019-08-08,2019-06-30,0001567619-19-016050
ACWV,ISHARES EDGE MSCI MIN VOL GLOBAL ETF,464286525,3574000.0,38793,0.003834371460260398,2019-08-08,2019-06-30,0001567619-19-016050
CB,CHUBB LIMITED COMMON STOCK CHF24.77,H1467J104,3573000.0,24261,0.0038332986087046455,2019-08-08,2019-06-30,0001567619-19-016050
SRCIEUR,SRC Energy Incorporated COMMON STOCK USD0.001,78470V108,3564000.0,718600,0.0038236429447028705,2019-08-08,2019-06-30,0001567619-19-016050
CATO,CATO CORPORATION CLASS 'A' COMMON STOCK USD0.03333,149205106,3560000.0,289000,0.003819351538479859,2019-08-08,2019-06-30,0001567619-19-016050
VRSK,VERISK ANALYTICS INC COMMON STOCK USD0.001,92345Y106,3559000.0,24300,0.0038182786869241066,2019-08-08,2019-06-30,0001567619-19-016050
FITB,FIFTH THIRD BANCORP COM STK NPV,316773100,3541000.0,126909,0.0037989673589205572,2019-08-08,2019-06-30,0001567619-19-016050
GE,GENERAL ELECTRIC COMPANY COMMON STOCK USD0.06,369604103,3524000.0,335657,0.0037807288824727595,2019-08-08,2019-06-30,0001567619-19-016050
AAPL,APPLE INCORPORATED COMMON STOCK NPV,037833100,3519000.0,17779,0.0037753646246939956,2019-08-08,2019-06-30,0001567619-19-016050
NSC,NORFOLK SOUTHERN CORP COMMON STOCK USD1,655844108,3482000.0,17470,0.0037356691171311434,2019-08-08,2019-06-30,0001567619-19-016050
SPOT,SPOTIFY TECHNOLOGY SA COMMON STOCK EUR0.000625,L8681T102,3466000.0,23703,0.003718503492239099,2019-08-08,2019-06-30,0001567619-19-016050
BAX,BAXTER INTERNATIONAL INCORPORATED COMMON STOCK USD1,071813109,3456000.0,42201,0.0037077749766815716,2019-08-08,2019-06-30,0001567619-19-016050
NMRK,NEWMARK GROUP INCORPORATED CLASS A COMMON STOCK USD0.01,65158N102,3454000.0,384646,0.003705629273570066,2019-08-08,2019-06-30,0001567619-19-016050
DELL,DELL TECHNOLOGIES -C  W/I,24703L202,3440000.0,67712,0.0036906093517895273,2019-08-08,2019-06-30,0001567619-19-016050
FDS,FACTSET RESEARCH SYSTEMS INCORPORATED COMMON STOCK USD0.01,303075105,3412000.0,11906,0.0036605695082284496,2019-08-08,2019-06-30,0001567619-19-016050
ROK,ROCKWELL AUTOMATION INCORPORATED COMMON STOCK USD1,773903109,3404000.0,20780,0.0036519866957824276,2019-08-08,2019-06-30,0001567619-19-016050
IVV,ISHARES TRUST CORE SnP 500 ETF,464287200,3391000.0,11505,0.0036380396255576413,2019-08-08,2019-06-30,0001567619-19-016050
CHH,CHOICE HOTELS INTERNATIONAL INCORPORATED COMMON STOCK USD0.01,169905106,3385000.0,38900,0.003631602516223125,2019-08-08,2019-06-30,0001567619-19-016050
GMED,GLOBUS MEDICAL INC - A COMMON STOCK USD0.001,379577208,3380000.0,79900,0.003626238258444361,2019-08-08,2019-06-30,0001567619-19-016050
N/A,FOUR SEASONS EDUCATION CAYMAN INCORPORATED ADR NPV (EACH REPRESENTS 0.5 ORDINARY SHARES),35101A101,3365000.0,1808930,0.0036101454851080695,2019-08-08,2019-06-30,0001567619-19-016050
EMR,EMERSON ELECTRIC COMPANY COMMON STOCK USD1,291011104,3360000.0,50357,0.0036047812273293056,2019-08-08,2019-06-30,0001567619-19-016050
MD,MEDNAX INCORPORATED COMMON STOCK USD0.01,58502B106,3358000.0,133107,0.0036026355242178005,2019-08-08,2019-06-30,0001567619-19-016050
VEU,VANGUARD FTSE ALL-WORLD EX-U,922042775,3355000.0,65800,0.0035994169695505417,2019-08-08,2019-06-30,0001567619-19-016050
YRI,YAMANA GOLD INCORPORATED COMMON NPV,98462Y100,3354000.0,1010389,0.003598344117994789,2019-08-08,2019-06-30,0001567619-19-016050
XLNXEUR,XILINX INCORPORATED COMMON STOCK USD0.01,983919101,3349000.0,28400,0.003592979860216025,2019-08-08,2019-06-30,0001567619-19-016050
CMI,CUMMINS INCORPORATED COMMON STOCK USD2.50,231021106,3341000.0,19500,0.003584397047770003,2019-08-08,2019-06-30,0001567619-19-016050
AGO,ASSURED GUARANTY LIMITED COMMON STOCK USD0.01,G0585R106,3338000.0,79330,0.003581178493102745,2019-08-08,2019-06-30,0001567619-19-016050
RMAX,RE/MAX HOLDINGS INCORPORATED CLASS A COMMON STOCK USD0.0001,75524W108,3328000.0,108200,0.0035704499775452174,2019-08-08,2019-06-30,0001567619-19-016050
RDY,DR REDDY'S LABORATORIES LIMITED ADR (EACH REPRESENTING 1 ORDINARY SHARE),256135203,3320000.0,88608,0.003561867165099195,2019-08-08,2019-06-30,0001567619-19-016050
ADBE,ADOBE INCORPORATED NPV,00724F101,3307000.0,11225,0.0035479200948744087,2019-08-08,2019-06-30,0001567619-19-016050
N/A,NATIONAL GENERAL HOLDINGS COMMON STOCK USD0.01,636220303,3302000.0,143931,0.0035425558370956447,2019-08-08,2019-06-30,0001567619-19-016050
NTR,NUTRIEN LIMITED COMMON NPV,67077M108,3300000.0,61728,0.0035404101339841392,2019-08-08,2019-06-30,0001567619-19-016050
CINF,CINCINNATI FINANCIAL CORPORATION COMMON STOCK USD2,172062101,3294000.0,31778,0.0035339730246496228,2019-08-08,2019-06-30,0001567619-19-016050
EWQ,ISHARES INCORPORATED MSCI FRANCE ETF,464286707,3282000.0,107073,0.0035210988059805894,2019-08-08,2019-06-30,0001567619-19-016050
MDT,MEDTRONIC PLC USD0.10,G5960L103,3264000.0,33517,0.0035017874779770396,2019-08-08,2019-06-30,0001567619-19-016050
LMT,LOCKHEED MARTIN CORP COMMON STOCK USD0.01,539830109,3259000.0,8965,0.003496423220198276,2019-08-08,2019-06-30,0001567619-19-016050
O,REALTY INCOME CORPORATION REIT USD1,756109104,3236000.0,46915,0.003471747634415962,2019-08-08,2019-06-30,0001567619-19-016050
LOW,LOWE'S COMPANIES INCORPORATED COMMON STOCK USD0.50,548661107,3229000.0,32003,0.003464237673525693,2019-08-08,2019-06-30,0001567619-19-016050
ON,ON SEMICONDUCTOR CORPORATION COMMON STOCK USD0.01,682189105,3226000.0,159600,0.003461019118858434,2019-08-08,2019-06-30,0001567619-19-016050
FTV,FORTIVE CORPORATION COMMON STOCK USD0.01,34959J108,3220000.0,39501,0.0034545820095239176,2019-08-08,2019-06-30,0001567619-19-016050
MTD,METTLER-TOLEDO INTERNATIONAL COMMON STOCK USD0.01,592688105,3209000.0,3820,0.003442780642410637,2019-08-08,2019-06-30,0001567619-19-016050
EA,ELECTRONIC ARTS INCORPORATED COMMON STOCK USD0.01,285512109,3206000.0,31666,0.0034395620877433787,2019-08-08,2019-06-30,0001567619-19-016050
PAAS,PAN AMERICAN SILVER CORPORATION COMMON NPV,697900108,3197000.0,188844,0.0034299064237416042,2019-08-08,2019-06-30,0001567619-19-016050
ORLY,O'REILLY AUTOMOTIVE INCORPORATED COMMON STOCK USD0.01,67103H107,3184000.0,8622,0.003415959353516818,2019-08-08,2019-06-30,0001567619-19-016050
LVS,LAS VEGAS SANDS CORPORATION COMMON STOCK USD0.001,517834107,3174000.0,53709,0.0034052308379592905,2019-08-08,2019-06-30,0001567619-19-016050
DLX,DELUXE CORPORATION COMMON STOCK USD1,248019101,3173000.0,78035,0.0034041579864035375,2019-08-08,2019-06-30,0001567619-19-016050
VOO,VANGUARD INDEX FUNDS S&P 500 ETF,922908363,3170000.0,11778,0.003400939431736279,2019-08-08,2019-06-30,0001567619-19-016050
KLAC,KLA-TENCOR CORPORATION COMMON STOCK USD0.001,482480100,3170000.0,26817,0.003400939431736279,2019-08-08,2019-06-30,0001567619-19-016050
EL,ESTEE LAUDER COMPANIES INC CLASS'A'COM STK USD0.01,518439104,3168000.0,17300,0.003398793728624774,2019-08-08,2019-06-30,0001567619-19-016050
SIRIEUR,SIRIUS XM HOLDINGS INCORPORATED COMMON STOCK USD0.001,82968B103,3142000.0,563042,0.003370899588175202,2019-08-08,2019-06-30,0001567619-19-016050
PSA,PUBLIC STORAGE REIT USD0.10,74460D109,3141000.0,13189,0.0033698267366194493,2019-08-08,2019-06-30,0001567619-19-016050
IJH,ISHARES TRUST CORE S&P MID-CAP ETF,464287507,3137000.0,16150,0.0033655353303964383,2019-08-08,2019-06-30,0001567619-19-016050
MIKUSD,MICHAELS COS INC/THE COMMON STOCK USD0.06775,59408Q106,3089000.0,355067,0.003314038455720305,2019-08-08,2019-06-30,0001567619-19-016050
BAX,BAXTER INTERNATIONAL INCORPORATED COMMON STOCK USD1,071813109,3087000.0,37695,0.0033118927526087994,2019-08-08,2019-06-30,0001567619-19-016050
PBI,PITNEY BOWES INCORPORATED COMMON STOCK USD2,724479100,3086000.0,721033,0.003310819901053047,2019-08-08,2019-06-30,0001567619-19-016050
NUS,NU SKIN ENTERPRISES INCORPORATED CLASS 'A' COMMON STOCK USD0.001,67018T105,3074000.0,62335,0.003297945682384013,2019-08-08,2019-06-30,0001567619-19-016050
LLY,ELI LILLY AND COMPANY COMMON STOCK NPV,532457108,3043000.0,27470,0.0032646872841556773,2019-08-08,2019-06-30,0001567619-19-016050
YYEUR,YY INCORPORATED ADR (EACH REPRESENTS 20 ORDINARY CLASS A SHARES),98426T106,3039000.0,43604,0.0032603958779326664,2019-08-08,2019-06-30,0001567619-19-016050
WAT,WATERS CORPORATION COMMON STOCK USD0.01,941848103,3013000.0,14000,0.003232501737483094,2019-08-08,2019-06-30,0001567619-19-016050
ARCB,ARCBEST CORPORATION COMMON STOCK USD0.01,03937C105,3008000.0,107000,0.0032271374797043307,2019-08-08,2019-06-30,0001567619-19-016050
WRKUSD,WESTROCK COMPANY COMMON STOCK USD0.01,96145D105,3001000.0,82281,0.0032196275188140612,2019-08-08,2019-06-30,0001567619-19-016050
GOOG,ALPHABET INCORPORATED-CL C NPV,02079K107,2993000.0,2769,0.003211044706368039,2019-08-08,2019-06-30,0001567619-19-016050
PDEUR,PRECISION DRILLING CORPORATION COMMON NPV,74022D308,2990000.0,1215550,0.003207826151700781,2019-08-08,2019-06-30,0001567619-19-016050
PB,PROSPERITY BANCSHARES INCORPORATED COMMON STOCK USD1,743606105,2986000.0,45207,0.00320353474547777,2019-08-08,2019-06-30,0001567619-19-016050
PEP,PEPSICO INCORPORATED CAPITAL STOCK USD0.016666,713448108,2977000.0,22700,0.003193879081475995,2019-08-08,2019-06-30,0001567619-19-016050
CVX,CHEVRON CORPORATION COMMON STOCK USD0.75,166764100,2974000.0,23897,0.003190660526808737,2019-08-08,2019-06-30,0001567619-19-016050
ROP,ROPER TECHNOLOGIES INCORPORATED COMMON STOCK USD0.01,776696106,2967000.0,8100,0.003183150565918467,2019-08-08,2019-06-30,0001567619-19-016050
TLRDQ,TAILORED BRANDS INCORPORATED COMMON STOCK USD0.01,87403A107,2964000.0,513680,0.003179932011251209,2019-08-08,2019-06-30,0001567619-19-016050
DCI,DONALDSON COMPANY INC COMMON STOCK USD5,257651109,2945000.0,57900,0.0031595478316919063,2019-08-08,2019-06-30,0001567619-19-016050
N/A,LAM RESEARCH CORP COMMON STOCK NPV,512807108,2943000.0,15667,0.0031574021285804004,2019-08-08,2019-06-30,0001567619-19-016050
C,CITIGROUP INCORPORATED COMMON STOCK USD0.01,172967424,2937000.0,41937,0.003150965019245884,2019-08-08,2019-06-30,0001567619-19-016050
WB,WEIBO CORPORATION SPONSERED ADR(EACH REPRESENTS 1 ORDINARY SHARE),948596101,2929000.0,67260,0.003142382206799862,2019-08-08,2019-06-30,0001567619-19-016050
VMWEUR,VMWARE INCORPORATED CLASS 'A' COMMON STOCK USD0.01,928563402,2924000.0,17487,0.0031370179490210984,2019-08-08,2019-06-30,0001567619-19-016050
ESS,ESSEX PROPERTY TRUST INCORPORATED REIT NPV,297178105,2923000.0,10014,0.003135945097465345,2019-08-08,2019-06-30,0001567619-19-016050
LEA,LEAR CORP COMMON STOCK USD0.01,521865204,2911000.0,20900,0.003123070878796312,2019-08-08,2019-06-30,0001567619-19-016050
EA,ELECTRONIC ARTS INCORPORATED COMMON STOCK USD0.01,285512109,2906000.0,28700,0.003117706621017548,2019-08-08,2019-06-30,0001567619-19-016050
HON,HONEYWELL INTERNATIONAL INCORPORATED COMMON STOCK USD1,438516106,2904000.0,16632,0.0031155609179060427,2019-08-08,2019-06-30,0001567619-19-016050
CI,CIGNA CORP COMMON STOCK USD0.010000,125523100,2897000.0,18387,0.0031080509570157733,2019-08-08,2019-06-30,0001567619-19-016050
MBTGBP,MOBILE TELESYSTEMS OJSC ADR (EACH REPRESENTS 2 COMMON SHARES),607409109,2881000.0,309416,0.003090885332123729,2019-08-08,2019-06-30,0001567619-19-016050
EWM,ISHARES INCORPORATED MSCI MALAYSIA ETF,46434G814,2877000.0,96784,0.0030865939259007175,2019-08-08,2019-06-30,0001567619-19-016050
SIGA,SIGA TECHNOLOGIES INCORPORATED COMMON STOCK USD0.0001,826917106,2877000.0,506529,0.0030865939259007175,2019-08-08,2019-06-30,0001567619-19-016050
MTB,M & T BK CORPORATION COMMON STOCK USD0.50,55261F104,2866000.0,16852,0.003074792558787437,2019-08-08,2019-06-30,0001567619-19-016050
VIAB,VIACOM INCORPORATED NEW CLASS 'B' NON VOTING COMMON STOCK USD0.001,92553P201,2856000.0,95600,0.0030640640432299097,2019-08-08,2019-06-30,0001567619-19-016050
MFAUSD,MFA FINANCIAL INCORPORATED REIT USD0.01,55272X102,2851000.0,397055,0.0030586997854511458,2019-08-08,2019-06-30,0001567619-19-016050
KEY,KEYCORP COMMON STOCK USD1,493267108,2833000.0,159585,0.003039388457447596,2019-08-08,2019-06-30,0001567619-19-016050
ROST,ROSS STORES INCORPORATE COMMON STOCK USD0.01,778296103,2824000.0,28495,0.003029732793445821,2019-08-08,2019-06-30,0001567619-19-016050
JNJ,JOHNSON AND JOHNSON COMMON STOCK USD1,478160104,2822000.0,20260,0.0030275870903343155,2019-08-08,2019-06-30,0001567619-19-016050
N/A,CUSHMAN & WAKEFIELD PLC USD0.010000,G2717B108,2807000.0,157002,0.003011494316998024,2019-08-08,2019-06-30,0001567619-19-016050
RMD,RESMED INCORPORATED COMMON STOCK USD0.004,761152107,2807000.0,23000,0.003011494316998024,2019-08-08,2019-06-30,0001567619-19-016050
N/A,CHIMERA INVESTMENT CORPORATION REIT USD0.01,16934Q208,2804000.0,148601,0.0030082757623307657,2019-08-08,2019-06-30,0001567619-19-016050
CRM,SALESFORCE.COM INCORPORATED COMMON STOCK USD0.001,79466L302,2796000.0,18428,0.0029996929498847438,2019-08-08,2019-06-30,0001567619-19-016050
OSBCAD,NORBORD INCORPORATED COMMON NPV,65548P403,2795000.0,86100,0.002998620098328991,2019-08-08,2019-06-30,0001567619-19-016050
ABT,ABBOTT LABORATORIES COMMON STOCK NPV,002824100,2792000.0,33200,0.0029954015436617324,2019-08-08,2019-06-30,0001567619-19-016050
SU,SUNCOR ENERGY INCORPORATED NEW COMMON NPV (CANADA LISTING),867224107,2790000.0,68300,0.002993255840550227,2019-08-08,2019-06-30,0001567619-19-016050
SYF,SYNCHRONY FINANCIAL COMMON STOCK  USD0.001,87165B103,2774000.0,80000,0.0029760902156581825,2019-08-08,2019-06-30,0001567619-19-016050
HCA,HCA HEALTHCARE INCORPORATED COMMON STOCK USD0.01,40412C101,2774000.0,20525,0.0029760902156581825,2019-08-08,2019-06-30,0001567619-19-016050
BLKCHF,BLACKROCK INCORPORATED COMMON STOCK USD0.01,09247X101,2767000.0,5897,0.002968580254767913,2019-08-08,2019-06-30,0001567619-19-016050
N/A,ALLERGAN PLC COMMON STOCK USD0.0001,G0177J108,2763000.0,16500,0.002964288848544902,2019-08-08,2019-06-30,0001567619-19-016050
EOG,EOG RESOURCES INCORPORATED COMMON STOCK USD0.01,26875P101,2763000.0,29655,0.002964288848544902,2019-08-08,2019-06-30,0001567619-19-016050
ARI,APOLLO COMMERCIAL REAL ESTATE FINANCE INCORPORATED REIT USD0.01,03762U105,2756000.0,149890,0.0029567788876546327,2019-08-08,2019-06-30,0001567619-19-016050
NTR,NUTRIEN LIMITED NPV,67077M108,2753000.0,39303,0.0029535603329873747,2019-08-08,2019-06-30,0001567619-19-016050
HFCUSD,HOLLYFRONTIER CORPORATION COMMON STOCK USD0.01,436106108,2749000.0,59400,0.0029492689267643633,2019-08-08,2019-06-30,0001567619-19-016050
OXY,OCCIDENTAL PETROLEUM CORP COMMON STOCK USD0.20,674599105,2740000.0,54500,0.0029396132627625884,2019-08-08,2019-06-30,0001567619-19-016050
TRTX,TPG RE FINANCE TRUST INCORPORATED REIT USD0.001,87266M107,2722000.0,141090,0.0029203019347590385,2019-08-08,2019-06-30,0001567619-19-016050
PEB,PEBBLEBROOK HOTEL TRUST REIT USD0.01,70509V100,2721000.0,96564,0.002919229083203286,2019-08-08,2019-06-30,0001567619-19-016050
EEM,ISHARES TRUST MSCI EMERGING MARKETS ETF,464287234,2693000.0,62751,0.0028891892396422083,2019-08-08,2019-06-30,0001567619-19-016050
RNR,RENAISSANCE HOLDINGS COMMON STOCK NPV,G7496G103,2675000.0,15025,0.0028698779116386585,2019-08-08,2019-06-30,0001567619-19-016050
AKX,ANSYS INCORPORATED COMMON STOCK USD0.01,03662Q105,2669000.0,13030,0.0028634408023041416,2019-08-08,2019-06-30,0001567619-19-016050
ROP,ROPER TECHNOLOGIES INCORPORATED COMMON STOCK USD0.01,776696106,2667000.0,7282,0.0028612950991926366,2019-08-08,2019-06-30,0001567619-19-016050
IP,INTERNATIONAL PAPER COMPANY COMMON STOCK USD1,460146103,2665000.0,61519,0.0028591493960811306,2019-08-08,2019-06-30,0001567619-19-016050
AAPL,APPLE INCORPORATED COMMON STOCK NPV,037833100,2661000.0,13443,0.0028548579898581197,2019-08-08,2019-06-30,0001567619-19-016050
PM,PHILIP MORRIS INTERNATIONAL INCORPORATED COMMON STOCK NPV,718172109,2631000.0,33509,0.0028226724431855365,2019-08-08,2019-06-30,0001567619-19-016050
MRK,MERCK AND COMPANY INCORPORATED NEW COMMON STOCK USD0.01,58933Y105,2625000.0,31300,0.00281623533385102,2019-08-08,2019-06-30,0001567619-19-016050
TMUS,T-MOBILE US INCORPORATED COMMON STOCK USD0.0001,872590104,2615000.0,35273,0.002805506818293492,2019-08-08,2019-06-30,0001567619-19-016050
FHI,FEDERATED INVESTORS INCORPORATED CLASS 'B' COMMON STOCK NPV,314211103,2612000.0,80375,0.002802288263626234,2019-08-08,2019-06-30,0001567619-19-016050
PANW,PALO ALTO NETWORKS INCORPORATED COMMON STOCK USD0.0001,697435105,2611000.0,12813,0.002801215412070481,2019-08-08,2019-06-30,0001567619-19-016050
ATHM,AUTOHOME INCORPORATED ADR (EACH REPRESENTS 1 CLASS A SHARE),05278C107,2602000.0,30391,0.0027915597480687063,2019-08-08,2019-06-30,0001567619-19-016050
ZBH,ZIMMER BIOMET HOLDINGS INCORPORATED COMMON STOCK USD0.01,98956P102,2602000.0,22096,0.0027915597480687063,2019-08-08,2019-06-30,0001567619-19-016050
