ticker,nameOfIssuer,cusip,value,shares,allocation_percent,filingDate,reportDate,accessionNumber
CRI,CARTER HOLDINGS INCORPORATED COMMON STOCK USD0.01,146229109,20064000.0,205700,0.02152569361462357,2019-08-08,2019-06-30,0001567619-19-016050
PFE,PFIZER INCORPORATED COMMON STOCK USD0.05,717081103,19914000.0,459695,0.021364765881260652,2019-08-08,2019-06-30,0001567619-19-016050
N/A,AERCAP HOLDINGS NV EUR0.01,N00985106,19899000.0,382609,0.02134867310792436,2019-08-08,2019-06-30,0001567619-19-016050
CHNGUSD,CHANGE HEALTHCARE INC USD0.001000,15912K100,19710000.0,1350000,0.021145904163887088,2019-08-08,2019-06-30,0001567619-19-016050
N/A,SPRINT CORPORATION COMMON STOCK USD0.01,85207U105,19705000.0,2999274,0.021140539906108324,2019-08-08,2019-06-30,0001567619-19-016050
EAF,GRAFTECH INTERNATIONAL LIMITED COMMON STOCK USD0.01,384313508,19588000.0,1703333,0.02101501627408525,2019-08-08,2019-06-30,0001567619-19-016050
CW,CURTISS-WRIGHT CORPORATION COMMON STOCK USD1,231561101,19572000.0,153950,0.020997850649193205,2019-08-08,2019-06-30,0001567619-19-016050
LUV,SOUTHWEST AIRLINES COMPANY COMMON STOCK USD1,844741108,19537000.0,384734,0.02096030084474186,2019-08-08,2019-06-30,0001567619-19-016050
MSFT,MICROSOFT CORPORATION COMMON STOCK USD0.0000125,594918104,19384000.0,144697,0.020796154556711684,2019-08-08,2019-06-30,0001567619-19-016050
SUI,SUN COMMUNITIES INC REIT USD0.01,866674104,19253000.0,150193,0.02065561100290807,2019-08-08,2019-06-30,0001567619-19-016050
TSCO,TRACTOR SUPPLY COMPANY COMMON STOCK USD0.008,892356106,19185000.0,176335,0.02058265709711688,2019-08-08,2019-06-30,0001567619-19-016050
KW,KENNEDY-WILSON HOLDINGS INCORPORATED COMMON STOCK USD0.0001,489398107,19155000.0,931224,0.020550471550444302,2019-08-08,2019-06-30,0001567619-19-016050
N/A,INTERXION HOLDING  NV COMMON STOCK EUR0.10,N47279109,19102000.0,251051,0.020493610417989402,2019-08-08,2019-06-30,0001567619-19-016050
MBTGBP,MOBILE TELESYSTEMS OJSC ADR (EACH REPRESENTS 2 COMMON SHARES),607409109,19080000.0,2049404,0.020470007683762843,2019-08-08,2019-06-30,0001567619-19-016050
ASX,ASE INDUSTRIAL HOLDING COMPANY LIMITED ADR W/I (EACH REPRESENTING 1 TWD 2 SHARES),00215W100,19077000.0,4829746,0.020466789129095584,2019-08-08,2019-06-30,0001567619-19-016050
NBL2EUR,NOBLE ENERGY INCORPORATED COMMON STOCK USD0.01,655044105,19067000.0,851191,0.020456060613538055,2019-08-08,2019-06-30,0001567619-19-016050
HD,HOME DEPOT INCORPORATED (THE) COMMON STOCK USD0.05,437076102,18993000.0,91327,0.02037666959841235,2019-08-08,2019-06-30,0001567619-19-016050
CB,CHUBB LIMITED COMMON STOCK CHF24.77,H1467J104,18936000.0,128566,0.020315517059734445,2019-08-08,2019-06-30,0001567619-19-016050
FIBK,FIRST INTERSTATE BANCSYSTEM INCORPORATED CLASS A COMMON STOCK NPV,32055Y201,18898000.0,477095,0.02027474870061584,2019-08-08,2019-06-30,0001567619-19-016050
PSX,PHILLIPS 66 COMMON STOCK USD0.01,718546104,18848000.0,201493,0.020221106122828198,2019-08-08,2019-06-30,0001567619-19-016050
NFE,NEW FORTRESS ENERGY LLC,644393100,18789000.0,1604568,0.020157807881038787,2019-08-08,2019-06-30,0001567619-19-016050
GAP,GAP INCORPORATED (THE) COMMON STOCK USD0.05,364760108,18733000.0,1042473,0.02009772819391663,2019-08-08,2019-06-30,0001567619-19-016050
CGNX,COGNEX CORPORATION COMMON STOCK USD0.002,192422103,18706000.0,389874,0.020068761201911305,2019-08-08,2019-06-30,0001567619-19-016050
XECEUR,CIMAREX ENERGY COMPANY COMMON STOCK USD0.01,171798101,18703000.0,315231,0.02006554264724405,2019-08-08,2019-06-30,0001567619-19-016050
ELME,WASHINGTON REIT USD0.01,939653101,18584000.0,695234,0.01993787331210947,2019-08-08,2019-06-30,0001567619-19-016050
ITCIEUR,INTRA-CELLULAR THERAPIES INCORPORATED COMMON STOCK USD0.0001,46116X101,18567000.0,1430469,0.019919634835661674,2019-08-08,2019-06-30,0001567619-19-016050
TD,TORONTO-DOMINION BANK (THE) COMMON NPV,891160509,18505000.0,241833,0.019853118039205,2019-08-08,2019-06-30,0001567619-19-016050
MSCI,MSCI INCORPORATED COMMON STOCK USD0.01,55354G100,18456000.0,77289,0.019800548312973114,2019-08-08,2019-06-30,0001567619-19-016050
CSCO,CISCO SYSTEMS INCORPORATED USD0.001 (US LISTING),17275R102,18435000.0,336827,0.019778018430302306,2019-08-08,2019-06-30,0001567619-19-016050
DD,DUPONT DE NEMOURS INC COMMON USD0.010000,26614N102,18428000.0,245480,0.019770508469412036,2019-08-08,2019-06-30,0001567619-19-016050
TMO,THERMO FISHER SCIENTIFIC INCORPORATED COMMON STOCK USD1,883556102,18381000.0,62590,0.019720084446291655,2019-08-08,2019-06-30,0001567619-19-016050
GBDC,GOLUB CAPITAL BDC INCORPORATED COMMON STOCK USD0.001,38173M102,18367000.0,1031863,0.01970506452451112,2019-08-08,2019-06-30,0001567619-19-016050
FRTEUR,FEDERAL REALTY INVESTMENT TRUST REIT USD0.01,313747206,18310000.0,142205,0.01964391198583321,2019-08-08,2019-06-30,0001567619-19-016050
N/A,NIELSEN HOLDINGS PUBLIC LIMITED COMPANY ORDINARY EUR0.07,G6518L108,18297000.0,809612,0.019629964915608422,2019-08-08,2019-06-30,0001567619-19-016050
MZTI,LANCASTER COLONY CORPORATION COMMON STOCK NPV,513847103,18257000.0,122859,0.019587050853378314,2019-08-08,2019-06-30,0001567619-19-016050
AMGN,AMGEN INCORPORATED COMMON STOCK USD0.0001,031162100,18169000.0,98596,0.01949263991647207,2019-08-08,2019-06-30,0001567619-19-016050
JAZZ,JAZZ PHARMACEUTICALS PLC USD0.0001 (US LISTING),G50871105,18148000.0,127300,0.019470110033801263,2019-08-08,2019-06-30,0001567619-19-016050
LLY,ELI LILLY AND COMPANY COMMON STOCK NPV,532457108,18091000.0,163293,0.019408957495123353,2019-08-08,2019-06-30,0001567619-19-016050
N/A,CUSHMAN & WAKEFIELD PLC USD0.010000,G2717B108,18050000.0,1009500,0.01936497058133749,2019-08-08,2019-06-30,0001567619-19-016050
AMCX,AMC NETWORKS INCORPORATED CLASS A COMMON STOCK USD0.01,00164V103,17888000.0,328275,0.01919116862930554,2019-08-08,2019-06-30,0001567619-19-016050
CUBE,CUBESMART REIT USD0.01,229663109,17857000.0,533989,0.019157910231077203,2019-08-08,2019-06-30,0001567619-19-016050
GPOR1EUR,GULFPORT ENERGY CORPORATION COMMON STOCK USD0.01,402635304,17806000.0,3626426,0.019103194801733815,2019-08-08,2019-06-30,0001567619-19-016050
MCD,MCDONALD'S CORPORATION COMMON STOCK USD0.01,580135101,17688000.0,85180,0.018976598318154986,2019-08-08,2019-06-30,0001567619-19-016050
ABEV,AMBEV SA SPONSORED ADR (EACH REPRESENTS 1 COMMON NPV),02319V103,17545000.0,3756976,0.01882318054568234,2019-08-08,2019-06-30,0001567619-19-016050
GIS,GENERAL MILLS INC COMMON STOCK USD0.10,370334104,17494000.0,333083,0.018768465116338947,2019-08-08,2019-06-30,0001567619-19-016050
IP,INTERNATIONAL PAPER COMPANY COMMON STOCK USD1,460146103,17461000.0,403073,0.01873306101499911,2019-08-08,2019-06-30,0001567619-19-016050
ASX,ASE INDUSTRIAL HOLDING COMPANY LIMITED ADR W/I (EACH REPRESENTING 1 TWD 2 SHARES),00215W100,17432000.0,4413098,0.018701948319882276,2019-08-08,2019-06-30,0001567619-19-016050
FTV,FORTIVE CORPORATION COMMON STOCK USD0.01,34959J108,17425000.0,213749,0.018694438358992007,2019-08-08,2019-06-30,0001567619-19-016050
PANW,PALO ALTO NETWORKS INCORPORATED COMMON STOCK USD0.0001,697435105,17351000.0,85152,0.018615047343866303,2019-08-08,2019-06-30,0001567619-19-016050
AXS,AXIS CAPITAL HOLDINGS LIMITED COMMON STOCK USD0.0125,G0692U109,17191000.0,288193,0.01844339109494586,2019-08-08,2019-06-30,0001567619-19-016050
NCLH,NORWEGIAN CRUISE LINE HOLDINGS LIMITED COMMON STOCK USD0.001,G66721104,17123000.0,319277,0.01837043718915467,2019-08-08,2019-06-30,0001567619-19-016050
IBM,INTL BUSINESS MACHINES CORPORATION COMMON STOCK USD0.20,459200101,17095000.0,123964,0.018340397345593597,2019-08-08,2019-06-30,0001567619-19-016050
TXN,TEXAS INSTRUMENTS INCORPORATED COMMON STOCK USD1,882508104,17052000.0,148588,0.018294264728696226,2019-08-08,2019-06-30,0001567619-19-016050
N/A,ARDAGH FINANCE HOLDINGS SA EUR0.01,L0223L101,17037000.0,973544,0.018278171955359933,2019-08-08,2019-06-30,0001567619-19-016050
REXR,REXFORD INDUSTRIAL REALTY IN REIT USD0.01,76169C100,16950000.0,419875,0.018184833870009444,2019-08-08,2019-06-30,0001567619-19-016050
DRH,DIAMONDROCK HOSPITALITY COMPANY REIT USD0.01,252784301,16913000.0,1635680,0.01814513836244659,2019-08-08,2019-06-30,0001567619-19-016050
TRNO,TERRENO REALTY CORPORATION REIT USD0.01,88146M101,16860000.0,343794,0.018088277229991692,2019-08-08,2019-06-30,0001567619-19-016050
VLO,VALERO ENERGY CORPORATION COMMON STOCK USD0.01,91913Y100,16744000.0,195588,0.01796382644952437,2019-08-08,2019-06-30,0001567619-19-016050
AU3EUR,ANGLOGOLD ASHANTI LIMITED SPONSORED ADR (EACH REPRESENTING 1 ORDINARY LEVEL 1) (BNY),035128206,16717000.0,938614,0.017934859457519048,2019-08-08,2019-06-30,0001567619-19-016050
N/A,LINDE PUBLIC LIMITED COMPANY EUR0.001,G5494J103,16664000.0,82990,0.01787799832506415,2019-08-08,2019-06-30,0001567619-19-016050
XOM,EXXON MOBIL CORPORATION COMMON STOCK NPV,30231G102,16529000.0,215694,0.017733163365037528,2019-08-08,2019-06-30,0001567619-19-016050
ABBV,ABBVIE INCORPORATED COMMON STOCK USD0.01,00287Y109,16454000.0,226271,0.01765269949835607,2019-08-08,2019-06-30,0001567619-19-016050
CODI,COMPASS DIVERSIFIED HOLDINGS LP NPV,20451Q104,16429000.0,859727,0.01762587820946225,2019-08-08,2019-06-30,0001567619-19-016050
WELL,WELLTOWER INCORPORATED REIT USD1,95040Q104,16381000.0,200925,0.017574381334786116,2019-08-08,2019-06-30,0001567619-19-016050
EWZ,ISHARES MSCI BRAZIL ETF,464286400,16381000.0,374673,0.017574381334786116,2019-08-08,2019-06-30,0001567619-19-016050
DG,DOLLAR GENERAL CORPORATION COMMON STOCK USD0.875,256677105,16258000.0,120285,0.017442420593428525,2019-08-08,2019-06-30,0001567619-19-016050
ORCL,ORACLE CORPORATION COMMON STOCK USD0.01,68389X105,16096000.0,282540,0.017268618641396578,2019-08-08,2019-06-30,0001567619-19-016050
INTC,INTEL CORPORATION COMMON STOCK USD0.001,458140100,16068000.0,335653,0.0172385787978355,2019-08-08,2019-06-30,0001567619-19-016050
BNS,BANK OF NOVA SCOTIA CAPITAL STOCK,064149107,16063000.0,228363,0.01723321454005674,2019-08-08,2019-06-30,0001567619-19-016050
CAL,CALERES INC USD0.01,129500104,15974000.0,801905,0.017137730751594738,2019-08-08,2019-06-30,0001567619-19-016050
LII,LENNOX INTERNATIONAL INCORPORATED COMMON STOCK USD0.01,526107107,15936000.0,57948,0.017096962392476135,2019-08-08,2019-06-30,0001567619-19-016050
USNA,USANA HEALTH SCIENCES INCORPORATED COMMON STOCK USD0.001,90328M107,15869000.0,199792,0.0170250813382407,2019-08-08,2019-06-30,0001567619-19-016050
ARE,ALEXANDRIA REAL ESTATE EQUITIES INCORPORATED REIT USD0.01,015271109,15866000.0,112453,0.01702186278357344,2019-08-08,2019-06-30,0001567619-19-016050
OXM,OXFORD INDUSTRIES INCORPORATED COMMON STOCK USD1,691497309,15849000.0,209093,0.017003624307125643,2019-08-08,2019-06-30,0001567619-19-016050
ATVIEUR,ACTIVISION BLIZZARD INCORPORATED COMMON STOCK USD0.000001,00507V109,15845000.0,335689,0.016999332900902633,2019-08-08,2019-06-30,0001567619-19-016050
CE,CELANESE CORPORATION CLASS A COMMON STOCK USD0.0001 (US LISTING),150870103,15826000.0,146808,0.01697894872134333,2019-08-08,2019-06-30,0001567619-19-016050
DISCAUSD,DISCOVERY INCORPORATED CLASS A COMMON STOCK USD0.01,25470F104,15782000.0,514076,0.016931743252890208,2019-08-08,2019-06-30,0001567619-19-016050
FLT1EUR,FLEETCOR TECHNOLOGIES INCORPORATED COMMON STOCK USD0.001,339041105,15756000.0,56100,0.016903849112440635,2019-08-08,2019-06-30,0001567619-19-016050
FTNT,FORTINET INCORPORATED COMMON STOCK USD0.001,34959E109,15718000.0,204580,0.016863080753322032,2019-08-08,2019-06-30,0001567619-19-016050
HPP,HUDSON PACIFIC PROPERTIES INCORPORATED REIT USD0.01,444097109,15560000.0,467683,0.016693570207513095,2019-08-08,2019-06-30,0001567619-19-016050
PHM,PULTE GROUP INCORPORATED COMMON STOCK USD0.01,745867101,15521000.0,490876,0.016651728996838738,2019-08-08,2019-06-30,0001567619-19-016050
CABO,CABLE ONE INCORPORATED COMMON STOCK NPV,12685J105,15505000.0,13241,0.01663456337194669,2019-08-08,2019-06-30,0001567619-19-016050
APOG,APOGEE ENTERPRISESINC COM STK USD0.33 1/3,037598109,15503000.0,356874,0.016632417668835185,2019-08-08,2019-06-30,0001567619-19-016050
GOOGL,ALPHABET INCORPORATED CL A NPV,02079K305,15389000.0,14212,0.01651011259147937,2019-08-08,2019-06-30,0001567619-19-016050
HCA,HCA HEALTHCARE INCORPORATED COMMON STOCK USD0.01,40412C101,15388000.0,113843,0.016509039739923615,2019-08-08,2019-06-30,0001567619-19-016050
JNJ,JOHNSON AND JOHNSON COMMON STOCK USD1,478160104,15265000.0,109600,0.016377078998566025,2019-08-08,2019-06-30,0001567619-19-016050
CUZ,COUSINS PROPERTIES INCORPORATED REIT USD1,222795502,15238000.0,421284,0.0163481120065607,2019-08-08,2019-06-30,0001567619-19-016050
BMY,BRISTOL-MYERS SQUIBB COMPANY COMMON STOCK USD0.10,110122108,15200000.0,335179,0.016307343647442095,2019-08-08,2019-06-30,0001567619-19-016050
PUMP,PROPETRO HOLDING CORPORATION COMMON STOCK NPV,74347M108,15198000.0,734208,0.01630519794433059,2019-08-08,2019-06-30,0001567619-19-016050
ICE,INTERCONTINENTAL EXCHANGE INCORPORATED COMMON STOCK USD0.01,45866F104,15155000.0,176348,0.016259065327433223,2019-08-08,2019-06-30,0001567619-19-016050
CPS,COOPER-STANDARD HOLDING COMMON STOCK USD0.001,21676P103,15067000.0,328838,0.016164654390526976,2019-08-08,2019-06-30,0001567619-19-016050
XLP,CONSUMER STAPLES SELECT SECTOR SPDR FUND,81369Y308,15033000.0,258875,0.016128177437631386,2019-08-08,2019-06-30,0001567619-19-016050
EHC,ENCOMPASS HEALTH CORPORATION COMMON STOCK USD0.01,29261A100,14995000.0,236660,0.01608740907851278,2019-08-08,2019-06-30,0001567619-19-016050
BRK/B,BERKSHIRE HATHAWAY INCORPORATED CLASS B COMMON STOCK USD0.0033,084670702,14975000.0,70250,0.016065952047397723,2019-08-08,2019-06-30,0001567619-19-016050
MEOH,METHANEX CORPORATION COMMON NPV,59151K108,14968000.0,251778,0.016058442086507457,2019-08-08,2019-06-30,0001567619-19-016050
WABC,WESTAMERICA BANCORP COM STK NPV,957090103,14959000.0,242794,0.01604878642250568,2019-08-08,2019-06-30,0001567619-19-016050
DVN,DEVON ENERGY CORPORATION COMMON STOCK USD0.10,25179M103,14908000.0,522729,0.015994070993162288,2019-08-08,2019-06-30,0001567619-19-016050
DREUSD,DUKE REALTY CORPORATION REIT USD0.01,264411505,14896000.0,471254,0.015981196774493254,2019-08-08,2019-06-30,0001567619-19-016050
SRCIEUR,SRC Energy Incorporated COMMON STOCK USD0.001,78470V108,14849000.0,2993697,0.015930772751372876,2019-08-08,2019-06-30,0001567619-19-016050
ECL,ECOLAB INC COMMON STOCK USD1,278865100,14816000.0,75040,0.015895368650033034,2019-08-08,2019-06-30,0001567619-19-016050
DOV,DOVER CORPORATION COMMON STOCK USD1,260003108,14706000.0,146763,0.01577735497890023,2019-08-08,2019-06-30,0001567619-19-016050
CVX,CHEVRON CORPORATION COMMON STOCK USD0.75,166764100,14695000.0,118090,0.01576555361178695,2019-08-08,2019-06-30,0001567619-19-016050
ANATUSD,AMERICAN NATIONAL INSURANCE COMPANY COMMON STOCK USD1,028591105,14535000.0,124793,0.015593897362866505,2019-08-08,2019-06-30,0001567619-19-016050
XYL,XYLEM INCORPORATED COMMON STOCK NPV,98419M100,14527000.0,173683,0.015585314550420483,2019-08-08,2019-06-30,0001567619-19-016050
LBRT,LIBERTY OILFIELD SERVICES INCORPORATED-A COMMON STOCK NPV,53115L104,14496000.0,895944,0.015552056152192146,2019-08-08,2019-06-30,0001567619-19-016050
CTSH,COGNIZANT TECHNOLOGY SOLUTIONS CORPORATION CLASS A COMMON STOCK USD0.01,192446102,14452000.0,227989,0.015504850683739024,2019-08-08,2019-06-30,0001567619-19-016050
ICE,INTERCONTINENTAL EXCHANGE INCORPORATED COMMON STOCK USD0.01,45866F104,14422000.0,167813,0.01547266513706644,2019-08-08,2019-06-30,0001567619-19-016050
BBD,BANCO BRADESCO SA SPONSORED ADR (EACH REPRESENTING 1 PREFERENCE SHARE NPV),059460303,14387000.0,1465035,0.015435115332615096,2019-08-08,2019-06-30,0001567619-19-016050
UTXZ,UNITED TECHNOLOGIES CORPORATION COMMON STOCK USD1,913017109,14309000.0,109900,0.01535143291126638,2019-08-08,2019-06-30,0001567619-19-016050
GWW,GRAINGER(W.W.) INC COMMON STOCK USD0.50,384802104,14241000.0,53092,0.015278479005475193,2019-08-08,2019-06-30,0001567619-19-016050
TSM,TAIWAN SEMICONDUCTOR MANUFACTURING COMPANY LIMITED ADS REPRESENTING 5 COMMON SHARES,874039100,14175000.0,361883,0.015207670802795507,2019-08-08,2019-06-30,0001567619-19-016050
EFA,ISHARES TRUST MSCI EAFE ETF,464287465,14162000.0,215461,0.015193723732570722,2019-08-08,2019-06-30,0001567619-19-016050
KO,COCA-COLA COMPANY (THE) COMMON STOCK USD0.25,191216100,14131000.0,277516,0.015160465334342385,2019-08-08,2019-06-30,0001567619-19-016050
LMT,LOCKHEED MARTIN CORP COMMON STOCK USD0.01,539830109,14076000.0,38718,0.015101458498775982,2019-08-08,2019-06-30,0001567619-19-016050
N/A,CORE LABORATORIES NV EUR0.02,N22717107,14041000.0,268568,0.015063908694324637,2019-08-08,2019-06-30,0001567619-19-016050
BID,SOTHEBYS INCORPORATED COMMON STOCK USD0.10,835898107,14018000.0,241154,0.015039233108542324,2019-08-08,2019-06-30,0001567619-19-016050
BF/B,BROWN-FORMAN CORP COM STK CLASS 'B' USD0.15,115637209,13796000.0,248899,0.014801060063165209,2019-08-08,2019-06-30,0001567619-19-016050
PEP,PEPSICO INCORPORATED CAPITAL STOCK USD0.016666,713448108,13772000.0,105024,0.014775311625827141,2019-08-08,2019-06-30,0001567619-19-016050
UDR,UDR INCORPORATED REIT USD0.01,902653104,13739000.0,306050,0.0147399075244873,2019-08-08,2019-06-30,0001567619-19-016050
SLF,SUN LIFE FINANCIAL INCORPORATED COMMON NPV,866796105,13704000.0,252700,0.014702357720035954,2019-08-08,2019-06-30,0001567619-19-016050
TDOC,TELADOC HEALTH INCORPORATED COMMON STOCK USD0.001,87918A105,13677000.0,205951,0.01467339072803063,2019-08-08,2019-06-30,0001567619-19-016050
FNF,FNF GROUP COMMON STOCK USD0.0001,31620R303,13632000.0,338265,0.014625112408021753,2019-08-08,2019-06-30,0001567619-19-016050
N/A,HOLLYSYS AUTOMATION TECHNOLOGIES LIMITED USD0.0001,G45667105,13626000.0,717168,0.014618675298687238,2019-08-08,2019-06-30,0001567619-19-016050
EBA,EBAY INCORPORATED COMMON STOCK USD0.001,278642103,13501000.0,341800,0.014484568854218142,2019-08-08,2019-06-30,0001567619-19-016050
N/A,ENCANA CORPORATION COMMON NPV (US LISTING),292505104,13478000.0,2627316,0.014459893268435829,2019-08-08,2019-06-30,0001567619-19-016050
N/A,HCP INCORPORATED REIT USD1,40414L109,13471000.0,421235,0.014452383307545558,2019-08-08,2019-06-30,0001567619-19-016050
WIT,WIPRO LIMITED ADR (EACH REPRESENTING 1 ORDINARY INR2),97651M109,13454000.0,3107109,0.014434144831097763,2019-08-08,2019-06-30,0001567619-19-016050
NRG,NRG ENERGY INCORPORATED COMMON STOCK USD0.01,629377508,13409000.0,381811,0.014385866511088885,2019-08-08,2019-06-30,0001567619-19-016050
DOEUR,DIAMOND OFFSHORE DRILLING COMMON STOCK USD0.01,25271C102,13390000.0,1509592,0.014365482331529582,2019-08-08,2019-06-30,0001567619-19-016050
EFA,ISHARES TRUST MSCI EAFE ETF,464287465,13390000.0,203708,0.014365482331529582,2019-08-08,2019-06-30,0001567619-19-016050
ED,CONSOLIDATED EDISON INCORPORATED COMMON STOCK USD0.10,209115104,13366000.0,152441,0.014339733894191516,2019-08-08,2019-06-30,0001567619-19-016050
EPAM,EPAM SYSTEMS INCORPORATED COMMON STOCK USD0.001,29414B104,13321000.0,76957,0.014291455574182642,2019-08-08,2019-06-30,0001567619-19-016050
IBN,ICICI BANK LIMITED SPONSORED ADR (EACH REPRESENTS 2 ORDINARY INR10),45104G104,13281000.0,1054909,0.014248541511952532,2019-08-08,2019-06-30,0001567619-19-016050
SEI,SOLARIS OILFIELD INFRASTRUCTURE INCORPORATED COMMON STOCK USD0.01 CL A,83418M103,13258000.0,885054,0.014223865926170219,2019-08-08,2019-06-30,0001567619-19-016050
BTG,B2GOLD CORPORATION COMMON NPV,11777Q209,13205000.0,3317833,0.014167004793715321,2019-08-08,2019-06-30,0001567619-19-016050
VIV1USD,TELEF BRASIL SA SPONSORED ADR (EACH REPRESENTS 1 PREFERENCE SHARE),87936R106,13167000.0,1011289,0.014126236434596715,2019-08-08,2019-06-30,0001567619-19-016050
LYV,LIVE NATION ENTERTAINMENT INCORPORATED COMMON STOCK USD0.01,538034109,13159000.0,198621,0.014117653622150695,2019-08-08,2019-06-30,0001567619-19-016050
MRO*,MARATHON OIL CORPORATION COMMON STOCK USD1,565849106,13129000.0,923910,0.014085468075478112,2019-08-08,2019-06-30,0001567619-19-016050
OTX,OPEN TEXT CORPORATION COMMON NPV,683715106,13128000.0,242931,0.014084395223922358,2019-08-08,2019-06-30,0001567619-19-016050
SPG,SIMON PROPERTY GROUP INCORPORATED REIT USD0.0001,828806109,13127000.0,82166,0.014083322372366605,2019-08-08,2019-06-30,0001567619-19-016050
CMCSA,COMCAST CORPORATION CLASS A COMMON STOCK USD1,20030N101,13099000.0,309813,0.014053282528805527,2019-08-08,2019-06-30,0001567619-19-016050
ETR,ENTERGY CORPORATION COMMON STOCK USD0.01,29364G103,13054000.0,126827,0.014005004208796653,2019-08-08,2019-06-30,0001567619-19-016050
CXPUSD,COLUMBIA PROPERTY TRUST INCORPORATED REIT USD0.01,198287203,13034000.0,628437,0.013983547177681598,2019-08-08,2019-06-30,0001567619-19-016050
PUMP,PROPETRO HOLDING CORPORATION COMMON STOCK NPV,74347M108,12989000.0,627506,0.013935268857672725,2019-08-08,2019-06-30,0001567619-19-016050
CSGS,CSG SYSTEMS INTERNATIONAL INCORPORATED COMMON STOCK USD0.01,126349109,12914000.0,264475,0.013854804990991267,2019-08-08,2019-06-30,0001567619-19-016050
HHC*,HOWARD HUGHES CORPORATION (THE) COMMON STOCK USD0.01,44267D107,12905000.0,104211,0.013845149326989489,2019-08-08,2019-06-30,0001567619-19-016050
BAX,BAXTER INTERNATIONAL INCORPORATED COMMON STOCK USD1,071813109,12811000.0,156423,0.01374430128074873,2019-08-08,2019-06-30,0001567619-19-016050
N/A,NEW ORIENTAL EDUCATION & TECHNOLOGY GROUP INCORPORATED SPONSORED ADR USD0.01 (EACH REPRESENTS 1 ORDINARY SHARES),647581107,12809000.0,132623,0.013742155577637225,2019-08-08,2019-06-30,0001567619-19-016050
RRC,RANGE RESOURCES CORPORATION COMMON STOCK USD0.01,75281A109,12800000.0,1833829,0.013732499913635449,2019-08-08,2019-06-30,0001567619-19-016050
MSI,MOTOROLA SOLUTIONS INCORPORATED COMMON STOCK USD0.01,620076307,12754000.0,76495,0.013683148742070822,2019-08-08,2019-06-30,0001567619-19-016050
VICI,VICI PROPERTIES INCORPRATED REIT USD0.01,925652109,12753000.0,578619,0.01368207589051507,2019-08-08,2019-06-30,0001567619-19-016050
INDA,ISHARES MSCI INDIA ETF,46429B598,12622000.0,357561,0.013541532336711456,2019-08-08,2019-06-30,0001567619-19-016050
MMM,3M COMPANY COMMON STOCK USD0.01,88579Y101,12602000.0,72699,0.0135200753055964,2019-08-08,2019-06-30,0001567619-19-016050
CTRA,CABOT OIL & GAS CORPORATION COMMON STOCK USD0.10,127097103,12568000.0,547367,0.013483598352700807,2019-08-08,2019-06-30,0001567619-19-016050
EPR,EPR PROPERTIES REIT USD0.01,26884U109,12526000.0,167930,0.013438538587359192,2019-08-08,2019-06-30,0001567619-19-016050
N/A,LIBERTY GLOBAL PLC CLASS A COMMON STOCK USD0.01,G5480U104,12424000.0,460330,0.013329107728672409,2019-08-08,2019-06-30,0001567619-19-016050
EMR,EMERSON ELECTRIC COMPANY COMMON STOCK USD1,291011104,12361000.0,185271,0.013261518080659986,2019-08-08,2019-06-30,0001567619-19-016050
PFE,PFIZER INCORPORATED COMMON STOCK USD0.05,717081103,12304000.0,284024,0.013200365541982078,2019-08-08,2019-06-30,0001567619-19-016050
WELL,WELLTOWER INCORPORATED REIT USD1,95040Q104,12297000.0,150825,0.013192855581091806,2019-08-08,2019-06-30,0001567619-19-016050
HFWA,HERITAGE FINANCIAL CORP COMMON STOCK NPV,42722X106,12287000.0,415948,0.01318212706553428,2019-08-08,2019-06-30,0001567619-19-016050
ORCL,ORACLE CORPORATION COMMON STOCK USD0.01,68389X105,12211000.0,214333,0.013100590347297068,2019-08-08,2019-06-30,0001567619-19-016050
NSC,NORFOLK SOUTHERN CORP COMMON STOCK USD1,655844108,12208000.0,61243,0.01309737179262981,2019-08-08,2019-06-30,0001567619-19-016050
PG,PROCTER AND GAMBLE COMPANY (THE) COMMON STOCK NPV,742718109,12165000.0,110944,0.013051239175732442,2019-08-08,2019-06-30,0001567619-19-016050
FRME,FIRST MERCHANTS CORPORATION COMMON STOCK NPV,320817109,12105000.0,319396,0.012986868082387276,2019-08-08,2019-06-30,0001567619-19-016050
PRFTUSD,PERFICIENT INCORPORATED COMMON STOCK USD0.001,71375U101,12089000.0,352238,0.01296970245749523,2019-08-08,2019-06-30,0001567619-19-016050
MMC,MARSH & MCLENNAN COS INC COMMON STOCK USD1,571748102,11991000.0,120213,0.012864563005031459,2019-08-08,2019-06-30,0001567619-19-016050
TSM,TAIWAN SEMICONDUCTOR MANUFACTURING COMPANY LIMITED ADS REPRESENTING 5 COMMON SHARES,874039100,11936000.0,304727,0.012805556169465057,2019-08-08,2019-06-30,0001567619-19-016050
SQM,SOCIEDAD QUIMICA Y MINERA DE CHILE SA SPONSORED ADR (EACH REPRESENTS 1 PREFERENCE SERIES B),833635105,11893000.0,382300,0.012759423552567687,2019-08-08,2019-06-30,0001567619-19-016050
TRI4EUR,THOMSON REUTERS CORP,884903709,11827000.0,139999,0.012688615349888004,2019-08-08,2019-06-30,0001567619-19-016050
CPE3EUR,CALLON PETROLEUM COMPANY COMMON STOCK USD0.01,13123X102,11707000.0,1776492,0.012559873163197672,2019-08-08,2019-06-30,0001567619-19-016050
YUMC,YUM CHINA HOLDINGS INCORPORATED COMMON STOCK USD0.01,98850P109,11672000.0,252647,0.012522323358746324,2019-08-08,2019-06-30,0001567619-19-016050
C,CITIGROUP INCORPORATED COMMON STOCK USD0.01,172967424,11647000.0,166309,0.012495502069852506,2019-08-08,2019-06-30,0001567619-19-016050
ZTS,ZOETIS INCORPORATED COMMON STOCK USD0.01,98978V103,11639000.0,102559,0.012486919257406484,2019-08-08,2019-06-30,0001567619-19-016050
TGS,TRANSPORTADORA DE GAS DEL SUR SPONSERED ADR(REPRESENTING 5 CLASS 'B' ARS1),893870204,11578000.0,800666,0.012421475312505566,2019-08-08,2019-06-30,0001567619-19-016050
SSS1EUR,SOVRAN SELF STORAGE INCORPORATED REIT USD0.01,53223X107,11571000.0,121700,0.012413965351615295,2019-08-08,2019-06-30,0001567619-19-016050
DGX,QUEST DIAGNOSTICS INCORPORATED COMMON STOCK USD0.01,74834L100,11453000.0,112496,0.01228736886803647,2019-08-08,2019-06-30,0001567619-19-016050
N/A,INTERXION HOLDING  NV COMMON STOCK EUR0.10,N47279109,11403000.0,149860,0.01223372629024883,2019-08-08,2019-06-30,0001567619-19-016050
ELS,EQUITY LIFESTYLE PROPERTIES INCORPORATED REIT USD0.01,29472R108,11363000.0,93643,0.012190812228018719,2019-08-08,2019-06-30,0001567619-19-016050
WEC,WEC ENERGY GROUP INCORPORATED COMMON STOCK USD0.01,92939U106,11302000.0,135568,0.012125368283117801,2019-08-08,2019-06-30,0001567619-19-016050
BZUN,BAOZUN INC-SPN  ADR,06684L103,11297000.0,226565,0.012120004025339037,2019-08-08,2019-06-30,0001567619-19-016050
IT,GARTNER INCORPORATED COMMON STOCK USD0.0005,366651107,11207000.0,69634,0.012023447385321288,2019-08-08,2019-06-30,0001567619-19-016050
