ticker,nameOfIssuer,cusip,value,shares,allocation_percent,filingDate,reportDate,accessionNumber
APD,AIR PRODUCTS & CHEMICALS INC COM STK US$1,009158106,711000.0,3142,0.0007627974561402192,2019-08-08,2019-06-30,0001567619-19-016050
INVA,INNOVIVA INCORPORATED COMMON STOCK USD0.01,45781M101,707000.0,48551,0.000758506049917208,2019-08-08,2019-06-30,0001567619-19-016050
BMY,BRISTOL-MYERS SQUIBB COMPANY COMMON STOCK USD0.10,110122108,706000.0,15560,0.0007574331983614553,2019-08-08,2019-06-30,0001567619-19-016050
ES,EVERSOURCE ENERGY COMMON STOCK USD5,30040W108,703000.0,9276,0.000754214643694197,2019-08-08,2019-06-30,0001567619-19-016050
SLF,SUN LIFE FINANCIAL INCORPORATED COMMON NPV,866796105,700000.0,12900,0.0007509960890269387,2019-08-08,2019-06-30,0001567619-19-016050
IQ,IQIYI INCORPORATED ADR (EACH REPRESENTS 7 ORDINARY SHARES),46267X108,698000.0,33820,0.0007488503859154331,2019-08-08,2019-06-30,0001567619-19-016050
SHW,SHERWIN-WILLIAMS COMPANY (THE) COMMON STOCK USD1,824348106,687000.0,1500,0.0007370490188021527,2019-08-08,2019-06-30,0001567619-19-016050
EWU,ISHARES MSCI UNITED KINGDOM ETF,46435G334,683000.0,21124,0.0007327576125791416,2019-08-08,2019-06-30,0001567619-19-016050
KIM,KIMCO REALTY CORPORATION REIT USD0.01,49446R109,673000.0,36420,0.0007220290970216138,2019-08-08,2019-06-30,0001567619-19-016050
N/A,CRESCENT POINT ENERGY CORPORATION COMMON NPV,22576C101,663000.0,153200,0.0007113005814640862,2019-08-08,2019-06-30,0001567619-19-016050
NTAP,NETAPP INCORPORATED COMMON STOCK USD0.001,64110D104,660000.0,10700,0.0007080820267968278,2019-08-08,2019-06-30,0001567619-19-016050
BRT,BRT APARTMENTS CORPORATION TRUST REIT USD3,055645303,652000.0,46145,0.0006994992143508057,2019-08-08,2019-06-30,0001567619-19-016050
N/A,L3 TECHNOLOGIES INCORPORATED COMMON STOCK NPV,502413107,648000.0,2644,0.0006952078081277947,2019-08-08,2019-06-30,0001567619-19-016050
SLG2EUR,SL GREEN REALTY CORPORATION REIT USD0.01,78440X101,647000.0,8052,0.0006941349565720419,2019-08-08,2019-06-30,0001567619-19-016050
BMY,BRISTOL-MYERS SQUIBB COMPANY COMMON STOCK USD0.10,110122108,644000.0,14200,0.0006909164019047836,2019-08-08,2019-06-30,0001567619-19-016050
VWO,VANGUARD FTSE EMERGING MARKETS ETF,922042858,642000.0,15105,0.000688770698793278,2019-08-08,2019-06-30,0001567619-19-016050
WLLEUR,WHITING PETROLEUM CORPORATION COMMON STOCK USD0.001,966387409,640000.0,34249,0.0006866249956817724,2019-08-08,2019-06-30,0001567619-19-016050
ESNT,ESSENT GROUP LIMITED USD0.015,G3198U102,632000.0,13444,0.0006780421832357504,2019-08-08,2019-06-30,0001567619-19-016050
ISRG,INTUITIVE SURGICAL COMMON STOCK USD0.001,46120E602,631000.0,1202,0.0006769693316799975,2019-08-08,2019-06-30,0001567619-19-016050
HPTUSD,HOSPITALITY PROPERTIES TRUST REIT USD0.01,44106M102,630000.0,25217,0.0006758964801242448,2019-08-08,2019-06-30,0001567619-19-016050
WFC,WELLS FARGO AND COMPANY COMMON STOCK USD1.6667,949746101,610000.0,12891,0.0006544394490091895,2019-08-08,2019-06-30,0001567619-19-016050
CPE3EUR,CALLON PETROLEUM COMPANY COMMON STOCK USD0.01,13123X102,610000.0,92500,0.0006544394490091895,2019-08-08,2019-06-30,0001567619-19-016050
VPL,VANGUARD FTSE PACIFIC ETF,922042866,609000.0,9212,0.0006533665974534366,2019-08-08,2019-06-30,0001567619-19-016050
HDSUSD,HD SUPPLY HOLDINGS INCORPORATED COMMON STOCK USD0.01,40416M105,600000.0,14900,0.0006437109334516617,2019-08-08,2019-06-30,0001567619-19-016050
HDB,HDFC BANK LIMITED ADR (EACH REPRESENTING 3 ORDINARY),40415F101,600000.0,4615,0.0006437109334516617,2019-08-08,2019-06-30,0001567619-19-016050
MD,MEDNAX INCORPORATED COMMON STOCK USD0.01,58502B106,598000.0,23700,0.0006415652303401562,2019-08-08,2019-06-30,0001567619-19-016050
AAPL,APPLE INCORPORATED COMMON STOCK NPV,037833100,586000.0,2961,0.000628691011671123,2019-08-08,2019-06-30,0001567619-19-016050
VEEV,VEEVA SYSTEMS INC NPV,922475108,585000.0,3610,0.0006276181601153701,2019-08-08,2019-06-30,0001567619-19-016050
OXY,OCCIDENTAL PETROLEUM CORP COMMON STOCK USD0.20,674599105,581000.0,11546,0.0006233267538923591,2019-08-08,2019-06-30,0001567619-19-016050
AELUSD,AMERICAN EQUITY INVESTMENT LIFE HOLDING COMPANY COMMON STOCK USD1,025676206,580000.0,21357,0.0006222539023366063,2019-08-08,2019-06-30,0001567619-19-016050
FITB,FIFTH THIRD BANCORP COM STK NPV,316773100,580000.0,20800,0.0006222539023366063,2019-08-08,2019-06-30,0001567619-19-016050
ODFL,OLD DOMINION FREIGHT LINE,679580100,578000.0,3875,0.0006201081992251008,2019-08-08,2019-06-30,0001567619-19-016050
EPAM,EPAM SYSTEMS INCORPORATED COMMON STOCK USD0.001,29414B104,571000.0,3300,0.0006125982383348314,2019-08-08,2019-06-30,0001567619-19-016050
WPG2EUR,WASHINGTON PRIME GROUP INCORPORATED REIT USD0.0001,93964W108,568000.0,148810,0.000609379683667573,2019-08-08,2019-06-30,0001567619-19-016050
ENB,ENBRIDGE INCORPORATED COMMON NPV,29250N105,568000.0,12000,0.000609379683667573,2019-08-08,2019-06-30,0001567619-19-016050
CSIQ,CANADIAN SOLAR INCORPORATED COMMON NPV (US LISTING),136635109,567000.0,25952,0.0006083068321118204,2019-08-08,2019-06-30,0001567619-19-016050
VSH,VISHAY INTERTECHNOLOGY INCORPORATED COMMON STOCK USD0.10,928298108,562000.0,34042,0.0006029425743330565,2019-08-08,2019-06-30,0001567619-19-016050
IMO,IMPERIAL OIL COMMON STOCK NPV,453038408,562000.0,15500,0.0006029425743330565,2019-08-08,2019-06-30,0001567619-19-016050
FLT1EUR,FLEETCOR TECHNOLOGIES INCORPORATED COMMON STOCK USD0.001,339041105,562000.0,2000,0.0006029425743330565,2019-08-08,2019-06-30,0001567619-19-016050
AZO,AUTOZONE INCORPORATED COMMON STOCK USD0.01,053332102,553000.0,503,0.0005932869103312815,2019-08-08,2019-06-30,0001567619-19-016050
FTSVEUR,FORTY SEVEN INC USD0.000100,34983P104,552000.0,52052,0.0005922140587755288,2019-08-08,2019-06-30,0001567619-19-016050
WMCUSD,WESTERN ASSET MORTGAGE CAPIT REIT USD0.01,95790D105,550000.0,55096,0.0005900683556640232,2019-08-08,2019-06-30,0001567619-19-016050
PFPT,PROOFPOINT INCORPORATED COMMON STOCK USD0.0001,743424103,544000.0,4527,0.0005836312463295066,2019-08-08,2019-06-30,0001567619-19-016050
EPP,ISHARES INCORPORATED MSCI PACIFIC EX JAPAN ETF,464286665,540000.0,11425,0.0005793398401064956,2019-08-08,2019-06-30,0001567619-19-016050
NHTC,NATURAL HEALTH TRENDS CORP COMMON STOCK USD0.001,63888P406,539000.0,66949,0.0005782669885507427,2019-08-08,2019-06-30,0001567619-19-016050
EW,EDWARDS LIFESCIENCES CORPORATION COMMON STOCK USD1,28176E108,539000.0,2920,0.0005782669885507427,2019-08-08,2019-06-30,0001567619-19-016050
EVRG,EVERGY INCORPORATED COMMON STOCK NPV,30034W106,535000.0,8900,0.0005739755823277317,2019-08-08,2019-06-30,0001567619-19-016050
EDIT,EDITAS MEDICINE INCORPORATED COMMON STOCK USD0.0001,28106W103,535000.0,21613,0.0005739755823277317,2019-08-08,2019-06-30,0001567619-19-016050
AES,AES CORPORATION COMMON STOCK USD0.01,00130H105,531000.0,31700,0.0005696841761047206,2019-08-08,2019-06-30,0001567619-19-016050
BTG,B2GOLD CORPORATION NPV COMMON STOCK,11777Q209,530000.0,174872,0.0005686113245489678,2019-08-08,2019-06-30,0001567619-19-016050
MITTEUR,AG MORTGAGE INVESTMENT TRUST INCORPORATED REIT USD0.01,001228105,529000.0,33291,0.000567538472993215,2019-08-08,2019-06-30,0001567619-19-016050
MU,MICRON TECHNOLOGY INCORPORATED COMMON STOCK USD0.10,595112103,529000.0,13700,0.000567538472993215,2019-08-08,2019-06-30,0001567619-19-016050
N/A,TARENA INTERNATIONAL INCORPORATION-ADR USD0.001,876108101,526000.0,210202,0.0005643199183259568,2019-08-08,2019-06-30,0001567619-19-016050
LTC,LTC PROPERTIES INCORPORATED REIT USD0.01,502175102,523000.0,11457,0.0005611013636586985,2019-08-08,2019-06-30,0001567619-19-016050
CNP,CENTERPOINT ENERGY INCORPORATED COMMON STOCK NPV,15189T107,523000.0,18271,0.0005611013636586985,2019-08-08,2019-06-30,0001567619-19-016050
TECD1USD,TECH DATA CORPORATION COMMON STOCK USD0.0015,878237106,517000.0,4942,0.0005546642543241818,2019-08-08,2019-06-30,0001567619-19-016050
CABO,CABLE ONE INCORPORATED COMMON STOCK NPV,12685J105,515000.0,440,0.0005525185512126763,2019-08-08,2019-06-30,0001567619-19-016050
CM,CANADIAN IMPERIAL BANK OF COMMERCE COMMON NPV,136069101,515000.0,5000,0.0005525185512126763,2019-08-08,2019-06-30,0001567619-19-016050
PEP,PEPSICO INCORPORATED CAPITAL STOCK USD0.016666,713448108,509000.0,3882,0.0005460814418781597,2019-08-08,2019-06-30,0001567619-19-016050
AMT,AMERICAN TOWER CORPORATION REIT USD0.01,03027X100,508000.0,2484,0.0005450085903224069,2019-08-08,2019-06-30,0001567619-19-016050
MMC,MARSH & MCLENNAN COS INC COMMON STOCK USD1,571748102,507000.0,5081,0.0005439357387666541,2019-08-08,2019-06-30,0001567619-19-016050
WB,WEIBO CORPORATION SPONSERED ADR(EACH REPRESENTS 1 ORDINARY SHARE),948596101,502000.0,11530,0.0005385714809878903,2019-08-08,2019-06-30,0001567619-19-016050
EPRT,ESSENTIAL PROPERTIES REALTY USD0.010000,29670E107,501000.0,25000,0.0005374986294321376,2019-08-08,2019-06-30,0001567619-19-016050
BRK/B,BERKSHIRE HATHAWAY INCORPORATED CLASS B COMMON STOCK USD0.0033,084670702,500000.0,2344,0.0005364257778763848,2019-08-08,2019-06-30,0001567619-19-016050
MASI,MASIMO CORPORATION COMMON STOCK USD0.001,574795100,495000.0,3325,0.000531061520097621,2019-08-08,2019-06-30,0001567619-19-016050
LULU,LULULEMON ATHLETICA INCORPORATED COMMON STOCK USD0.01,550021109,490000.0,2720,0.0005256972623188571,2019-08-08,2019-06-30,0001567619-19-016050
KEP,KOREA ELECTRIC POWER CORP-SP ADR,500631106,489000.0,44052,0.0005246244107631043,2019-08-08,2019-06-30,0001567619-19-016050
AMZN,AMAZON.COM INCORPORATED USD0.01,023135106,487000.0,257,0.0005224787076515987,2019-08-08,2019-06-30,0001567619-19-016050
XOM,EXXON MOBIL CORPORATION COMMON STOCK NPV,30231G102,485000.0,6327,0.0005203330045400932,2019-08-08,2019-06-30,0001567619-19-016050
VYM,VANGUARD HIGH DVD YIELD ETF,921946406,480000.0,5495,0.0005149687467613294,2019-08-08,2019-06-30,0001567619-19-016050
IBN,ICICI BANK LIMITED SPONSORED ADR (EACH REPRESENTS 2 ORDINARY INR10),45104G104,476000.0,37803,0.0005106773405383183,2019-08-08,2019-06-30,0001567619-19-016050
PPL,PPL CORPORATION COMMON STOCK USD0.01,69351T106,474000.0,15300,0.0005085316374268127,2019-08-08,2019-06-30,0001567619-19-016050
DFSEUR,DISCOVER FINANCIAL SERVICES COMMON STOCK USD0.01,254709108,469000.0,6043,0.0005031673796480489,2019-08-08,2019-06-30,0001567619-19-016050
EZU,ISHARES TRUST MSCI EUROZONE ETF,464286608,467000.0,11805,0.0005010216765365433,2019-08-08,2019-06-30,0001567619-19-016050
AEP,AMERICAN ELECTRIC POWER COINC COMMON STOCK USD6.50,025537101,466000.0,5300,0.0004999488249807907,2019-08-08,2019-06-30,0001567619-19-016050
GDX,VANECK VECTORS GOLD MINERS ETF,92189F106,460000.0,18000,0.000493511715646274,2019-08-08,2019-06-30,0001567619-19-016050
AL,AIR LEASE CORP COMMON STOCK USD0.01,00912X302,459000.0,11094,0.0004924388640905212,2019-08-08,2019-06-30,0001567619-19-016050
WLK,WESTLAKE CHEMICAL CORPORATION COMMON STOCK USD0.01,960413102,458000.0,6595,0.0004913660125347684,2019-08-08,2019-06-30,0001567619-19-016050
AZPNUSD,ASPEN TECHNOLOGY INCORPORATED COMMON STOCK USD0.10,045327103,458000.0,3686,0.0004913660125347684,2019-08-08,2019-06-30,0001567619-19-016050
LOGI,LOGITECH INTERNATIONAL SA CHF0.25 (REGISTERED),H50430232,458000.0,11750,0.0004913660125347684,2019-08-08,2019-06-30,0001567619-19-016050
CBSH,COMMERCE BANCSHARES INCORPORATED COMMON STOCK USD5,200525103,457000.0,7662,0.0004902931609790156,2019-08-08,2019-06-30,0001567619-19-016050
ED,CONSOLIDATED EDISON INCORPORATED COMMON STOCK USD0.10,209115104,456000.0,5200,0.0004892203094232629,2019-08-08,2019-06-30,0001567619-19-016050
R,RYDER SYSTEM INCORPORATE COMMON SOCTK USD0.50,783549108,455000.0,7808,0.0004881474578675101,2019-08-08,2019-06-30,0001567619-19-016050
SBS,COMPANHIA DE SANEAMENTO BASICO DO ESTADO DE SAO PAULO SPONSORED ADR (EACH REPRESENTS 1 COMMON SHARE),20441A102,453000.0,37200,0.00048600175475600456,2019-08-08,2019-06-30,0001567619-19-016050
TER,TERADYNE INCORPORATE COMMON STOCK USD0.125,880770102,452000.0,9441,0.00048492890320025187,2019-08-08,2019-06-30,0001567619-19-016050
CF,CF INDUSTRIES HOLDINGS INCORPORATED COMMON STOCK USD0.01,125269100,451000.0,9653,0.00048385605164449907,2019-08-08,2019-06-30,0001567619-19-016050
SITCUSD,SITE CENTERS CORPORATION REIT USD0.10,82981J109,447000.0,33799,0.000479564645421488,2019-08-08,2019-06-30,0001567619-19-016050
NSP,INSPERITY INCORPORATED COMMON STOCK USD0.01,45778Q107,447000.0,3658,0.000479564645421488,2019-08-08,2019-06-30,0001567619-19-016050
LPLA,LPL FINANCIAL HOLDINGS INC COMMON STOCK NPV,50212V100,447000.0,5483,0.000479564645421488,2019-08-08,2019-06-30,0001567619-19-016050
LBRT,LIBERTY OILFIELD SERVICES INCORPORATED-A COMMON STOCK NPV,53115L104,447000.0,27600,0.000479564645421488,2019-08-08,2019-06-30,0001567619-19-016050
BPOP,POPULAR INCORPORATED COMMON STOCK USD0.01,733174700,445000.0,8197,0.0004774189423099824,2019-08-08,2019-06-30,0001567619-19-016050
FTS,FORTIS INCORPORATED COMMON NPV,349553107,445000.0,8600,0.0004774189423099824,2019-08-08,2019-06-30,0001567619-19-016050
VOO,VANGUARD INDEX FUNDS S&P 500 ETF,922908363,442000.0,1641,0.00047420038764272416,2019-08-08,2019-06-30,0001567619-19-016050
NDAQ,NASDAQ INCORPORATED COMMON STOCK USD0.01,631103108,442000.0,4591,0.00047420038764272416,2019-08-08,2019-06-30,0001567619-19-016050
BOH,BANK OF HAWAII CORPORATION COMMON STOCK USD0.01,062540109,439000.0,5296,0.0004709818329754658,2019-08-08,2019-06-30,0001567619-19-016050
PSBUSD,PS BUSINESS PARKS INCORPORATED CLASS A REIT USD0.01,69360J107,438000.0,2600,0.000469908981419713,2019-08-08,2019-06-30,0001567619-19-016050
MAR,MARRIOTT INTERNATIONAL INCORPORATED CLASS A COMMON STOCK USD1,571903202,437000.0,3113,0.0004688361298639603,2019-08-08,2019-06-30,0001567619-19-016050
ACCUSD,AMERICAN CAMPUS COMMUNITIES INCORPORATED REIT USD0.01,024835100,437000.0,9466,0.0004688361298639603,2019-08-08,2019-06-30,0001567619-19-016050
ANH,ANWORTH MORTGAGE ASSET CORPORATION REIT USD0.01,037347101,435000.0,114767,0.0004666904267524548,2019-08-08,2019-06-30,0001567619-19-016050
IVZ,INVESCO LIMITED ORDINARY USD0.10,G491BT108,435000.0,21250,0.0004666904267524548,2019-08-08,2019-06-30,0001567619-19-016050
GGAL,GRUPO FINANCIERO GALICIA-ADR,399909100,434000.0,12231,0.00046561757519670194,2019-08-08,2019-06-30,0001567619-19-016050
MDSOEUR,MEDIDATA SOLUTIONS INCORPORATED COMMON STOCK USD0.01,58471A105,433000.0,4780,0.00046454472364094914,2019-08-08,2019-06-30,0001567619-19-016050
DTE,DTE ENERGY COMPANY NPV,233331107,431000.0,3374,0.00046239902052944365,2019-08-08,2019-06-30,0001567619-19-016050
N/A,HELEN OF TROY LIMITED COMMON STOCK USD0.10,G4388N106,431000.0,3300,0.00046239902052944365,2019-08-08,2019-06-30,0001567619-19-016050
GIS,GENERAL MILLS INC COMMON STOCK USD0.10,370334104,431000.0,8200,0.00046239902052944365,2019-08-08,2019-06-30,0001567619-19-016050
GOOGL,ALPHABET INCORPORATED CL A NPV,02079K305,429000.0,396,0.0004602533174179381,2019-08-08,2019-06-30,0001567619-19-016050
N/A,FORTUNA SILVER MINES INCORPORATED COMMON NPV,349915108,427000.0,114500,0.00045810761430643257,2019-08-08,2019-06-30,0001567619-19-016050
N/A,UBS GROUP AG CHF0.10 (REGISTERED),H42097107,426000.0,36729,0.00045703476275067977,2019-08-08,2019-06-30,0001567619-19-016050
WSM,WILLIAMS-SONOMA INCORPORATED COMMON STOCK USD0.01,969904101,426000.0,6559,0.00045703476275067977,2019-08-08,2019-06-30,0001567619-19-016050
UNTEUR,UNIT CORPORATION COMMON STOCK USD0.20,909218109,423000.0,47578,0.00045381620808342154,2019-08-08,2019-06-30,0001567619-19-016050
STLD,STEEL DYNAMICS INCORPORATED COMMON STOCK USD0.01,858119100,420000.0,13900,0.0004505976534161632,2019-08-08,2019-06-30,0001567619-19-016050
VMBS,VANGUARD MORTGAGE-BACKED SECURITIES ETF,92206C771,419000.0,7923,0.0004495248018604104,2019-08-08,2019-06-30,0001567619-19-016050
TMHC,TAYLOR MORRISON HOME CORPORATION COMMON STOCK USD0.00001,87724P106,418000.0,19934,0.00044845195030465766,2019-08-08,2019-06-30,0001567619-19-016050
VYX,NCR CORPORATION COMMON STOCK USD0.01,62886E108,418000.0,13442,0.00044845195030465766,2019-08-08,2019-06-30,0001567619-19-016050
AWC,AMERICAN WATER WORKS COMPANY INCORPORATED COMMON STOCK USD0.01,030420103,418000.0,3600,0.00044845195030465766,2019-08-08,2019-06-30,0001567619-19-016050
7HP,HP INCORPORATED COMMON STOCK USD0.01,40434L105,416000.0,20021,0.00044630624719315217,2019-08-08,2019-06-30,0001567619-19-016050
PRGS,PROGRESS SOFTWARE CORPORATION COMMON STOCK USD0.01,743312100,416000.0,9529,0.00044630624719315217,2019-08-08,2019-06-30,0001567619-19-016050
TDC,TERADATA CORPORATION COMMON STOCK USD0.01,88076W103,416000.0,11594,0.00044630624719315217,2019-08-08,2019-06-30,0001567619-19-016050
N/A,GLOBANT SA USD1.2,L44385109,416000.0,4115,0.00044630624719315217,2019-08-08,2019-06-30,0001567619-19-016050
N/A,CANADIAN PACIFIC RAILWAY LTD,13645T100,416000.0,1350,0.00044630624719315217,2019-08-08,2019-06-30,0001567619-19-016050
FBIN,FORTUNE BRANDS HOME AND SECURITY INCORPORATED COMMON STOCK USD0.01,34964C106,415000.0,7267,0.00044523339563739937,2019-08-08,2019-06-30,0001567619-19-016050
FIBK,FIRST INTERSTATE BANCSYSTEM INCORPORATED CLASS A COMMON STOCK NPV,32055Y201,412000.0,10400,0.00044201484097014103,2019-08-08,2019-06-30,0001567619-19-016050
FDX,FEDEX CORPORATION COMMON STOCK USD0.10,31428X106,412000.0,2508,0.00044201484097014103,2019-08-08,2019-06-30,0001567619-19-016050
IBM,INTL BUSINESS MACHINES CORPORATION COMMON STOCK USD0.20,459200101,411000.0,2980,0.0004409419894143883,2019-08-08,2019-06-30,0001567619-19-016050
ESNT,ESSENT GROUP LIMITED USD0.015,G3198U102,411000.0,8744,0.0004409419894143883,2019-08-08,2019-06-30,0001567619-19-016050
CIGI,COLLIERS INTERNATIONAL GROUP INCORPORATED SUB VOTING COMMON NPV,194693107,409000.0,4363,0.0004387962863028827,2019-08-08,2019-06-30,0001567619-19-016050
N/A,LYONDELLBASELL INDUSTRIES NV CLASS A COMMON STOCK USD0.01,N53745100,409000.0,4748,0.0004387962863028827,2019-08-08,2019-06-30,0001567619-19-016050
HIW,HIGHWOODS PROPERTIES INCORPORATED REIT USD0.01,431284108,409000.0,9892,0.0004387962863028827,2019-08-08,2019-06-30,0001567619-19-016050
IDCC,INTERDIGITAL INCORPORATED COMMON STOCK USD0.01,45867G101,407000.0,6313,0.00043665058319137715,2019-08-08,2019-06-30,0001567619-19-016050
BWXT,BWX TECHNOLOGIES INCORPORATED COMMON STOCK USD0.01,05605H100,407000.0,7816,0.00043665058319137715,2019-08-08,2019-06-30,0001567619-19-016050
WFC,WELLS FARGO AND COMPANY COMMON STOCK USD1.6667,949746101,407000.0,8610,0.00043665058319137715,2019-08-08,2019-06-30,0001567619-19-016050
MHK,MOHAWK INDUSTRIES INCORPORATED COMMON STOCK USD0.01,608190104,404000.0,2737,0.0004334320285241189,2019-08-08,2019-06-30,0001567619-19-016050
JRVR,JAMES RIVER GROUP HOLDINGS LTD USD0.0002,G5005R107,403000.0,8598,0.0004323591769683661,2019-08-08,2019-06-30,0001567619-19-016050
EBF,ENNIS INCORPORATED COMMON STOCK USD2.50,293389102,402000.0,19600,0.0004312863254126133,2019-08-08,2019-06-30,0001567619-19-016050
SWK,STANLEY BLACK AND DECKER INCORPORATED COMMON STOCK USD2.50,854502101,401000.0,2771,0.0004302134738568606,2019-08-08,2019-06-30,0001567619-19-016050
CLRUSD,CONTINENTAL RESOURCES INCORPORATED COMMON STOCK USD0.01,212015101,401000.0,9527,0.0004302134738568606,2019-08-08,2019-06-30,0001567619-19-016050
NUE,NUCOR CORPORATION COMMON STOCK USD0.40,670346105,399000.0,7240,0.0004280677707453551,2019-08-08,2019-06-30,0001567619-19-016050
SON,SONOCO PRODUCTS COMPANY COMMON STOCK NPV,835495102,399000.0,6109,0.0004280677707453551,2019-08-08,2019-06-30,0001567619-19-016050
WD,WALKER AND DUNLOP INC COMMON STOCK NPV,93148P102,397000.0,7453,0.00042592206763384944,2019-08-08,2019-06-30,0001567619-19-016050
HNI,HNI CORPORATION COMMON STOCK USD1,404251100,397000.0,11232,0.00042592206763384944,2019-08-08,2019-06-30,0001567619-19-016050
ABT,ABBOTT LABORATORIES COMMON STOCK NPV,002824100,395000.0,4700,0.00042377636452234395,2019-08-08,2019-06-30,0001567619-19-016050
NOC,NORTHROP GRUMMAN CORPORATION COMMON STOCK USD1,666807102,395000.0,1222,0.00042377636452234395,2019-08-08,2019-06-30,0001567619-19-016050
RDY,DR REDDY'S LABORATORIES LIMITED ADR (EACH REPRESENTING 1 ORDINARY SHARE),256135203,394000.0,10510,0.0004227035129665912,2019-08-08,2019-06-30,0001567619-19-016050
COLD,AMERICOLD REALTY TRUST REIT USD0.01,03064D108,393000.0,12126,0.0004216306614108384,2019-08-08,2019-06-30,0001567619-19-016050
QLYS,QUALYS INCORPORATED COMMON STOCK USD0.001,74758T303,390000.0,4480,0.00041841210674358007,2019-08-08,2019-06-30,0001567619-19-016050
SHOO,STEVEN MADDEN LIMITED COMMON STOCK USD0.0001,556269108,388000.0,11426,0.00041626640363207453,2019-08-08,2019-06-30,0001567619-19-016050
N/A,NOBLE CORPORATION PLC COMMON STOCK CHF3.15,G65431101,388000.0,207300,0.00041626640363207453,2019-08-08,2019-06-30,0001567619-19-016050
HRI,HERC HOLDINGS INCORPORATED COMMON STOCK USD0.01,42704L104,387000.0,8434,0.00041519355207632184,2019-08-08,2019-06-30,0001567619-19-016050
EGOVEUR,NIC INCORPORATED COMMON STOCK NPV,62914B100,387000.0,24122,0.00041519355207632184,2019-08-08,2019-06-30,0001567619-19-016050
CHE,CHEMED CORPORATION COMMON STOCK USD1,16359R103,385000.0,1066,0.00041304784896481624,2019-08-08,2019-06-30,0001567619-19-016050
APD,AIR PRODUCTS & CHEMICALS INC COM STK US$1,009158106,385000.0,1700,0.00041304784896481624,2019-08-08,2019-06-30,0001567619-19-016050
LEMB,ISHARES JP MORGAN EM LOCAL CURRENCY ETF,464286517,384000.0,8313,0.0004119749974090635,2019-08-08,2019-06-30,0001567619-19-016050
NEU,NEWMARKET CORPORATION COMMON STOCK NPV,651587107,384000.0,957,0.0004119749974090635,2019-08-08,2019-06-30,0001567619-19-016050
CRVL,CORVEL CORPORATION COMMON STOCK USD0.0001,221006109,382000.0,4390,0.00040982929429755796,2019-08-08,2019-06-30,0001567619-19-016050
MDT,MEDTRONIC PLC USD0.10,G5960L103,381000.0,3910,0.00040875644274180516,2019-08-08,2019-06-30,0001567619-19-016050
SF9,SANDERSON FARMS INCORPORATED COMMON STOCK USD1,800013104,381000.0,2787,0.00040875644274180516,2019-08-08,2019-06-30,0001567619-19-016050
ATRIUSD,ATRION CORPORATION COMMON STOCK USD0.10,049904105,380000.0,446,0.00040768359118605247,2019-08-08,2019-06-30,0001567619-19-016050
ES,EVERSOURCE ENERGY COMMON STOCK USD5,30040W108,379000.0,5000,0.00040661073963029967,2019-08-08,2019-06-30,0001567619-19-016050
JKS,JINKOSOLAR HOLDING COMPANY LIMITED ADR (EACH REP 2 ORDINARY),47759T100,376000.0,17343,0.00040339218496304133,2019-08-08,2019-06-30,0001567619-19-016050
FEZ,SPDR EURO STOXX 50 ETF,78463X202,373000.0,9750,0.00040017363029578305,2019-08-08,2019-06-30,0001567619-19-016050
EVRG,EVERGY INCORPORATED COMMON STOCK NPV,30034W106,373000.0,6200,0.00040017363029578305,2019-08-08,2019-06-30,0001567619-19-016050
TDS,TELEPHONE AND DATA SYSTEMS INCORPORATED COMMON STOCK USD0.01,879433829,373000.0,12271,0.00040017363029578305,2019-08-08,2019-06-30,0001567619-19-016050
INFY,INFOSYS LIMITED SPONSORED ADR (EACH REPRESENTS 1 ORDINARY INR5),456788108,373000.0,34823,0.00040017363029578305,2019-08-08,2019-06-30,0001567619-19-016050
ROP,ROPER TECHNOLOGIES INCORPORATED COMMON STOCK USD0.01,776696106,371000.0,1012,0.00039802792718427745,2019-08-08,2019-06-30,0001567619-19-016050
TTMI,TTM TECHNOLOGIES,87305R109,370000.0,36227,0.00039695507562852476,2019-08-08,2019-06-30,0001567619-19-016050
N/A,LINDE PUBLIC LIMITED COMPANY EUR0.001,G5494J103,368000.0,1835,0.0003948093725170192,2019-08-08,2019-06-30,0001567619-19-016050
ESRT,EMPIRE STATE REALTY TRUST INCORPORATED CLASS A REIT USD0.01,292104106,363000.0,24522,0.00038944511473825534,2019-08-08,2019-06-30,0001567619-19-016050
MDLZ,MONDELEZ INTERNATIONAL INCORPORATED COMMON STOCK USD0.01,609207105,360000.0,6672,0.00038622656007099705,2019-08-08,2019-06-30,0001567619-19-016050
GD,GENERAL DYNAMICS CORPORATION COMMON STOCK USD1,369550108,360000.0,1978,0.00038622656007099705,2019-08-08,2019-06-30,0001567619-19-016050
VVV,VALVOLINE INCORPORATED COMMON STOCK USD0.01,92047W101,359000.0,18358,0.00038515370851524425,2019-08-08,2019-06-30,0001567619-19-016050
MIKUSD,MICHAELS COS INC/THE COMMON STOCK USD0.06775,59408Q106,358000.0,41200,0.0003840808569594915,2019-08-08,2019-06-30,0001567619-19-016050
GPOR1EUR,GULFPORT ENERGY CORPORATION COMMON STOCK USD0.01,402635304,358000.0,72900,0.0003840808569594915,2019-08-08,2019-06-30,0001567619-19-016050
OBE,OBSIDIAN ENERGY LIMITED NPV,674482203,356000.0,228140,0.00038193515384798597,2019-08-08,2019-06-30,0001567619-19-016050
AA,ALCOA CORPORATION COMMON STOCK NPV,013872106,354000.0,15116,0.0003797894507364804,2019-08-08,2019-06-30,0001567619-19-016050
SWX,SOUTHWEST GAS HOLDINGS INCORPORATED COMMON STOCK NPV,844895102,354000.0,3955,0.0003797894507364804,2019-08-08,2019-06-30,0001567619-19-016050
HSII,HEIDRICK & STRUGGLES INTERNATIONAL INC COMMON STOCK USD0.01,422819102,352000.0,11752,0.0003776437476249749,2019-08-08,2019-06-30,0001567619-19-016050
WST,WEST PHARMACEUTICAL SERVICES INCORPORATED COMMON STOCK USD0.25,955306105,350000.0,2800,0.00037549804451346934,2019-08-08,2019-06-30,0001567619-19-016050
AMKR,AMKOR TECHNOLOGY INCORPORATED COMMON STOCK USD0.001,031652100,350000.0,46868,0.00037549804451346934,2019-08-08,2019-06-30,0001567619-19-016050
N/A,UBS GROUP AG CHF0.10 (REGISTERED),H42097107,349000.0,30100,0.00037442519295771654,2019-08-08,2019-06-30,0001567619-19-016050
RMAX,RE/MAX HOLDINGS INCORPORATED CLASS A COMMON STOCK USD0.0001,75524W108,348000.0,11300,0.0003733523414019638,2019-08-08,2019-06-30,0001567619-19-016050
RUSHA,RUSH ENTERPRISES INCORPORATED CLASS 'A' COMMON STOCK USD0.01,781846209,348000.0,9529,0.0003733523414019638,2019-08-08,2019-06-30,0001567619-19-016050
GPK,GRAPHIC PACKAGING HOLDING COMPANY COMMON STOCK USD0.01,388689101,347000.0,24808,0.00037227948984621106,2019-08-08,2019-06-30,0001567619-19-016050
AR,ANTERO RESOURCES CORPORATION COMMON STOCK USD0.01,03674X106,346000.0,62600,0.00037120663829045826,2019-08-08,2019-06-30,0001567619-19-016050
CBT,CABOT CORPORATION COMMON STOCK USD1,127055101,345000.0,7235,0.00037013378673470546,2019-08-08,2019-06-30,0001567619-19-016050
RIO,RIO TINTO PLC SPONSORED ADR (EACH REPRESENTS 1 ORDINARY SHARE) (BNY),767204100,337000.0,5400,0.00036155097428868335,2019-08-08,2019-06-30,0001567619-19-016050
