ticker,nameOfIssuer,cusip,value,shares,allocation_percent,filingDate,reportDate,accessionNumber
GDSHDG 2 06/01/25,GDS HOLDINGS LIMITED  2 CONV 01/06/2025,36165LAB4,17617743000.0,179200000,18.901222986402466,2019-08-08,2019-06-30,0001567619-19-016050
WB 1.25 11/15/22,WEIBO CORP,948596AC5,3402488000.0,35794000,3.6503645442301296,2019-08-08,2019-06-30,0001567619-19-016050
TWTR 0.25 06/15/24,TWITTER INC 0.2500 CONV 15/06/2024,90184LAF9,3257068000.0,33318000,3.4943504709925612,2019-08-08,2019-06-30,0001567619-19-016050
AKAM 0.125 05/01/25,AKAMAI TECHNOLOGIES INC 0.1250 CONV 01/05/2025,00971TAJ0,3246130000.0,30300000,3.482615620675738,2019-08-08,2019-06-30,0001567619-19-016050
XYZ 0.5 05/15/23,SQUARE INC,852234AD5,2758343000.0,23163000,2.9592925788497615,2019-08-08,2019-06-30,0001567619-19-016050
PSTG 0.125 04/15/23,PURE STORAGE INC 0.1250 CONV 15/04/2023,74624MAB8,1827192000.0,19000000,1.9603057798590147,2019-08-08,2019-06-30,0001567619-19-016050
MNDT 0.875 06/01/24,FIREEYE INCORPORATED  0.875 CONV 01/06/2024,31816QAF8,1719057000.0,17650000,1.8442929768776886,2019-08-08,2019-06-30,0001567619-19-016050
NEWR 0.5 05/01/23,NEW RELIC INCORPORATED 0.5000 CONV 01/05/2023,64829BAB6,1604386000.0,15047000,1.721268016127963,2019-08-08,2019-06-30,0001567619-19-016050
BABA,ALIBABA GROUP HOLDING LIMITED SPONSORED ADR (EACH REPRESENTS 1 ORDINARY SHARES USD0.000025),01609W102,1279005000.0,7547980,1.372182504065571,2019-08-08,2019-06-30,0001567619-19-016050
BABA,ALIBABA GROUP HOLDING LIMITED SPONSORED ADR (EACH REPRESENTS 1 ORDINARY SHARES USD0.000025),01609W102,1181588000.0,6973077,1.2676685240588035,2019-08-08,2019-06-30,0001567619-19-016050
LGND 0.75 05/15/23,LIGAND PHARMACEUTICALS I 0.7500 CONV 15/05/2023,53220KAF5,959252000.0,11200000,1.0291350005589557,2019-08-08,2019-06-30,0001567619-19-016050
BABA,ALIBABA GROUP HOLDING LIMITED SPONSORED ADR (EACH REPRESENTS 1 ORDINARY SHARES USD0.000025),01609W102,895336000.0,5283776,0.9605626205214617,2019-08-08,2019-06-30,0001567619-19-016050
SEALTD 2.25 07/01/23,SEA LTD 2.2500 CONV 01/07/2023,81141RAB6,789096000.0,4336000,0.8465828712382875,2019-08-08,2019-06-30,0001567619-19-016050
BABA,ALIBABA GROUP HOLDING LIMITED SPONSORED ADR (EACH REPRESENTS 1 ORDINARY SHARES USD0.000025),01609W102,754069000.0,4450096,0.8090040997949351,2019-08-08,2019-06-30,0001567619-19-016050
MSFT,MICROSOFT CORPORATION COMMON STOCK USD0.0000125,594918104,712215000.0,5316628,0.7641009707804587,2019-08-08,2019-06-30,0001567619-19-016050
JPM,JPMORGAN CHASE AND COMPANY COMMON STOCK USD1,46625H100,635839000.0,5687286,0.6821608603582852,2019-08-08,2019-06-30,0001567619-19-016050
GOOGL,ALPHABET INCORPORATED CL A NPV,02079K305,622723000.0,575104,0.6680893393530318,2019-08-08,2019-06-30,0001567619-19-016050
TSLA 2 05/15/24,Tesla Inc 2.000000 15/May/2024 2.0000 CONV 15/05/2024,88160RAG6,589294000.0,6000000,0.6322249846957726,2019-08-08,2019-06-30,0001567619-19-016050
V,VISA INCORPORATED CLASS A COMMON STOCK USD0.0001,92826C839,560839000.0,3231568,0.6016969936768275,2019-08-08,2019-06-30,0001567619-19-016050
CSCO,CISCO SYSTEMS INCORPORATED USD0.001 (US LISTING),17275R102,553743000.0,10117717,0.5940840390372059,2019-08-08,2019-06-30,0001567619-19-016050
INTC,INTEL CORPORATION COMMON STOCK USD0.001,458140100,526272000.0,10993782,0.5646117339491216,2019-08-08,2019-06-30,0001567619-19-016050
JNJ,JOHNSON AND JOHNSON COMMON STOCK USD1,478160104,497344000.0,3570821,0.5335762841443054,2019-08-08,2019-06-30,0001567619-19-016050
AMZN,AMAZON.COM INCORPORATED USD0.01,023135106,484998000.0,256121,0.5203308588369817,2019-08-08,2019-06-30,0001567619-19-016050
MRK,MERCK AND COMPANY INCORPORATED NEW COMMON STOCK USD0.01,58933Y105,479857000.0,5722804,0.5148153289888567,2019-08-08,2019-06-30,0001567619-19-016050
AAPL,APPLE INCORPORATED COMMON STOCK NPV,037833100,475290000.0,2401423,0.5099156159337338,2019-08-08,2019-06-30,0001567619-19-016050
ITUB,ITAU UNIBANCO HOLDING SA ADR (EACH REPRESENTS 1 PREFERENCE SHARE),465562106,455141000.0,48316406,0.4882987299368713,2019-08-08,2019-06-30,0001567619-19-016050
BAC,BANK OF AMERICA CORPORATION COMMON STOCK USD0.01,060505104,422844000.0,14580840,0.45364884324072413,2019-08-08,2019-06-30,0001567619-19-016050
HD,HOME DEPOT INCORPORATED (THE) COMMON STOCK USD0.05,437076102,420335000.0,2021134,0.45095705868734043,2019-08-08,2019-06-30,0001567619-19-016050
IBM,INTL BUSINESS MACHINES CORPORATION COMMON STOCK USD0.20,459200101,371583000.0,2694583,0.3986533996412814,2019-08-08,2019-06-30,0001567619-19-016050
PG,PROCTER AND GAMBLE COMPANY (THE) COMMON STOCK NPV,742718109,354613000.0,3234041,0.38044710874015686,2019-08-08,2019-06-30,0001567619-19-016050
PFE,PFIZER INCORPORATED COMMON STOCK USD0.05,717081103,336601000.0,7770110,0.361122906517938,2019-08-08,2019-06-30,0001567619-19-016050
DHR,DANAHER CORPORATION COMMON STOCK USD0.01,235851102,326008000.0,2281055,0.3497581899878489,2019-08-08,2019-06-30,0001567619-19-016050
PM,PHILIP MORRIS INTERNATIONAL INCORPORATED COMMON STOCK NPV,718172109,318584000.0,4056844,0.3417933400379403,2019-08-08,2019-06-30,0001567619-19-016050
NTR,NUTRIEN LIMITED NPV,67077M108,308628000.0,4405820,0.3311120299488658,2019-08-08,2019-06-30,0001567619-19-016050
ORCL,ORACLE CORPORATION COMMON STOCK USD0.01,68389X105,308625000.0,5417324,0.3311088113941985,2019-08-08,2019-06-30,0001567619-19-016050
UNH,UNITEDHEALTH GROUP INCORPORATED COMMON STOCK USD0.01,91324P102,306774000.0,1257217,0.3291229631645001,2019-08-08,2019-06-30,0001567619-19-016050
ADBE,ADOBE INCORPORATED NPV,00724F101,305602000.0,1037171,0.3278655811411579,2019-08-08,2019-06-30,0001567619-19-016050
HDB,HDFC BANK LIMITED ADR (EACH REPRESENTING 3 ORDINARY),40415F101,300775000.0,2312946,0.32268692668153925,2019-08-08,2019-06-30,0001567619-19-016050
CMCSA,COMCAST CORPORATION CLASS A COMMON STOCK USD1,20030N101,285769000.0,6758965,0.3065877162359132,2019-08-08,2019-06-30,0001567619-19-016050
ITUB,ITAU UNIBANCO HOLDING SA ADR (EACH REPRESENTS 1 PREFERENCE SHARE),465562106,281935000.0,29929446,0.30247440337115705,2019-08-08,2019-06-30,0001567619-19-016050
VOO,VANGUARD INDEX FUNDS S&P 500 ETF,922908363,269078000.0,999734,0.2886807509188437,2019-08-08,2019-06-30,0001567619-19-016050
TXN,TEXAS INSTRUMENTS INCORPORATED COMMON STOCK USD1,882508104,265913000.0,2317124,0.2852851757448862,2019-08-08,2019-06-30,0001567619-19-016050
AMGN,AMGEN INCORPORATED COMMON STOCK USD0.0001,031162100,264752000.0,1436684,0.2840395950886572,2019-08-08,2019-06-30,0001567619-19-016050
TD,TORONTO-DOMINION BANK (THE) COMMON NPV,891160509,263968000.0,3449659,0.28319847946894705,2019-08-08,2019-06-30,0001567619-19-016050
TMO,THERMO FISHER SCIENTIFIC INCORPORATED COMMON STOCK USD1,883556102,257554000.0,876987,0.2763172095903488,2019-08-08,2019-06-30,0001567619-19-016050
N/A,NEW ORIENTAL EDUCATION & TECHNOLOGY GROUP INCORPORATED SPONSORED ADR USD0.01 (EACH REPRESENTS 1 ORDINARY SHARES),647581107,254306000.0,2633110,0.27283258773726377,2019-08-08,2019-06-30,0001567619-19-016050
TSM,TAIWAN SEMICONDUCTOR MANUFACTURING COMPANY LIMITED ADS REPRESENTING 5 COMMON SHARES,874039100,252304000.0,6441267,0.2706847389226468,2019-08-08,2019-06-30,0001567619-19-016050
UNP,UNION PACIFIC CORPORATION COMMON STOCK USD2.50,907818108,250499000.0,1481278,0.268748241864513,2019-08-08,2019-06-30,0001567619-19-016050
BKNG,BOOKING HOLDINGS INCORPORATED COMMON STOCK USD0.008,09857L108,245381000.0,130890,0.2632573876021704,2019-08-08,2019-06-30,0001567619-19-016050
TSM,TAIWAN SEMICONDUCTOR MANUFACTURING COMPANY LIMITED ADS REPRESENTING 5 COMMON SHARES,874039100,243523000.0,6217071,0.2612640294115817,2019-08-08,2019-06-30,0001567619-19-016050
IVV,ISHARES TRUST CORE SnP 500 ETF,464287200,236189000.0,801321,0.2533957361016909,2019-08-08,2019-06-30,0001567619-19-016050
BBD,BANCO BRADESCO SA SPONSORED ADR (EACH REPRESENTING 1 PREFERENCE SHARE NPV),059460303,236130000.0,24045800,0.25333243785990145,2019-08-08,2019-06-30,0001567619-19-016050
ROK,ROCKWELL AUTOMATION INCORPORATED COMMON STOCK USD1,773903109,225497000.0,1376409,0.24192480726758225,2019-08-08,2019-06-30,0001567619-19-016050
ABBV,ABBVIE INCORPORATED COMMON STOCK USD0.01,00287Y109,224782000.0,3091057,0.24115771840521905,2019-08-08,2019-06-30,0001567619-19-016050
BKNG,BOOKING HOLDINGS INCORPORATED COMMON STOCK USD0.008,09857L108,224564000.0,119786,0.24092383676606494,2019-08-08,2019-06-30,0001567619-19-016050
HTHT,HUAZHU GROUP LIMITED ADR NPV (EACH REPRESENTS 1 ORDINARY SHARE),44332N106,220007000.0,6069162,0.23603485222649956,2019-08-08,2019-06-30,0001567619-19-016050
FTI,TECHNIPFMC LTD USD1,G87110105,219440000.0,9709730,0.23542654539438776,2019-08-08,2019-06-30,0001567619-19-016050
AMXN,AMERICA MOVIL SAB DE CV ADR (EACH REPRESENTS 20 SERIES 'L' SHARES),02364W105,217376000.0,14929668,0.23321217978331402,2019-08-08,2019-06-30,0001567619-19-016050
FMX,FOMENTO ECONOMICO MEXICANO SP ADR (EACH REPRESENTS 10 ORDINARY SHARE),344419106,212514000.0,2196523,0.22799597551924405,2019-08-08,2019-06-30,0001567619-19-016050
WFC,WELLS FARGO AND COMPANY COMMON STOCK USD1.6667,949746101,212217000.0,4484712,0.22767733860718548,2019-08-08,2019-06-30,0001567619-19-016050
TWLO 0.25 06/01/23,TWILIO INC 0.2500 CONV 01/06/2023,90138FAB8,205962000.0,1030000,0.2209666521259519,2019-08-08,2019-06-30,0001567619-19-016050
AZO,AUTOZONE INCORPORATED COMMON STOCK USD0.01,053332102,202758000.0,184414,0.21752923574132002,2019-08-08,2019-06-30,0001567619-19-016050
CVX,CHEVRON CORPORATION COMMON STOCK USD0.75,166764100,201933000.0,1622732,0.21664413320782402,2019-08-08,2019-06-30,0001567619-19-016050
INFY,INFOSYS LIMITED SPONSORED ADR (EACH REPRESENTS 1 ORDINARY INR5),456788108,199243000.0,18620850,0.21375816252284904,2019-08-08,2019-06-30,0001567619-19-016050
MDT,MEDTRONIC PLC USD0.10,G5960L103,197735000.0,2030346,0.21214030237677386,2019-08-08,2019-06-30,0001567619-19-016050
FMX,FOMENTO ECONOMICO MEXICANO SP ADR (EACH REPRESENTS 10 ORDINARY SHARE),344419106,196493000.0,2030932,0.21080782074452895,2019-08-08,2019-06-30,0001567619-19-016050
BMY,BRISTOL-MYERS SQUIBB COMPANY COMMON STOCK USD0.10,110122108,195940000.0,4320608,0.21021453383419766,2019-08-08,2019-06-30,0001567619-19-016050
VALE,VALE DO RIO DOCE (CIA) SPONSORED ADR (REPRESENTING 1 ORDINARY NPV),91912E105,190089000.0,14143517,0.2039372793814882,2019-08-08,2019-06-30,0001567619-19-016050
NTES,NETEASE INCORPORATED ADR (EACH REPRESENTS 25 SHARES USD0.0001),64110W102,189421000.0,740591,0.20322061454224535,2019-08-08,2019-06-30,0001567619-19-016050
PBR,PETROLEO BRASILEIRO - PETROBRAS ADS (EACH REPRESENTING 2 COMMON SHARES),71654V408,186951000.0,12007122,0.200570671199536,2019-08-08,2019-06-30,0001567619-19-016050
ENV 1.75 06/01/23,ENVESTNET INC 1.7500 CONV 01/06/2023,29404KAB2,184675000.0,1555000,0.19812886105864272,2019-08-08,2019-06-30,0001567619-19-016050
PM,PHILIP MORRIS INTERNATIONAL INCORPORATED COMMON STOCK NPV,718172109,178917000.0,2278333,0.19195138180061827,2019-08-08,2019-06-30,0001567619-19-016050
AVGO,BROADCOM INCORPORATED COMMON STOCK NPV,11135F101,177891000.0,617979,0.1908506361044159,2019-08-08,2019-06-30,0001567619-19-016050
EBA,EBAY INCORPORATED COMMON STOCK USD0.001,278642103,173898000.0,4402472,0.18656673984229513,2019-08-08,2019-06-30,0001567619-19-016050
IP,INTERNATIONAL PAPER COMPANY COMMON STOCK USD1,460146103,173661000.0,4008785,0.18631247402358173,2019-08-08,2019-06-30,0001567619-19-016050
BAX,BAXTER INTERNATIONAL INCORPORATED COMMON STOCK USD1,071813109,170555000.0,2082476,0.1829801970914136,2019-08-08,2019-06-30,0001567619-19-016050
AIG,AMERICAN INTERNATIONAL GROUP INCORPORATED COMMON STOCK USD2.50,026874784,163937000.0,3076900,0.17588006549544177,2019-08-08,2019-06-30,0001567619-19-016050
META,FACEBOOK INCORPORATED CLASS A COMMON STOCK USD0.000006,30303M102,163680000.0,848083,0.1756043426456133,2019-08-08,2019-06-30,0001567619-19-016050
GOOG,ALPHABET INCORPORATED-CL C NPV,02079K107,163611000.0,151364,0.17553031588826637,2019-08-08,2019-06-30,0001567619-19-016050
DGX,QUEST DIAGNOSTICS INCORPORATED COMMON STOCK USD0.01,74834L100,161854000.0,1589765,0.17364531570480876,2019-08-08,2019-06-30,0001567619-19-016050
BBD,BANCO BRADESCO SA SPONSORED ADR (EACH REPRESENTING 1 PREFERENCE SHARE NPV),059460303,159681000.0,16260804,0.171314009274158,2019-08-08,2019-06-30,0001567619-19-016050
OMC,OMNICOM GROUP INC COMMON STOCK USD0.15,681919106,159619000.0,1947755,0.1712474924777013,2019-08-08,2019-06-30,0001567619-19-016050
HCA,HCA HEALTHCARE INCORPORATED COMMON STOCK USD0.01,40412C101,159423000.0,1179429,0.17103721357277377,2019-08-08,2019-06-30,0001567619-19-016050
FTV,FORTIVE CORPORATION COMMON STOCK USD0.01,34959J108,158976000.0,1950142,0.17055764892735228,2019-08-08,2019-06-30,0001567619-19-016050
IVV,ISHARES TRUST CORE SnP 500 ETF,464287200,157962000.0,535919,0.16946977744981898,2019-08-08,2019-06-30,0001567619-19-016050
EMR,EMERSON ELECTRIC COMPANY COMMON STOCK USD1,291011104,156041000.0,2338742,0.16740882961121792,2019-08-08,2019-06-30,0001567619-19-016050
N/A,CREDICORP LIMITED COMMON STOCK USD5 (US LISTING),G2519Y108,153802000.0,671890,0.16500671497788744,2019-08-08,2019-06-30,0001567619-19-016050
GILD,GILEAD SCIENCES INCORPORATED COMMON STOCK USD0.001,375558103,153366000.0,2270077,0.16453895169957924,2019-08-08,2019-06-30,0001567619-19-016050
CTSH,COGNIZANT TECHNOLOGY SOLUTIONS CORPORATION CLASS A COMMON STOCK USD0.01,192446102,148321000.0,2339822,0.1591264156008065,2019-08-08,2019-06-30,0001567619-19-016050
DIS,WALT DISNEY COMPANY (THE) COMMON STOCK USD0.01,254687106,147206000.0,1054184,0.15793018611614218,2019-08-08,2019-06-30,0001567619-19-016050
MFC,MANULIFE FINANCIAL CORPORATION COMMON NPV (CANADIAN LISTING),56501R106,143553000.0,6031659,0.15401105938297732,2019-08-08,2019-06-30,0001567619-19-016050
PEP,PEPSICO INCORPORATED CAPITAL STOCK USD0.016666,713448108,143301000.0,1092818,0.15374070079092764,2019-08-08,2019-06-30,0001567619-19-016050
KMB,KIMBERLY-CLARK CORPORATION COMMON STOCK USD1.25,494368103,142115000.0,1066290,0.15246829884580484,2019-08-08,2019-06-30,0001567619-19-016050
TMUS,T-MOBILE US INCORPORATED COMMON STOCK USD0.0001,872590104,141386000.0,1907017,0.1516861900616611,2019-08-08,2019-06-30,0001567619-19-016050
CHKP,CHECK POINT SOFTWARE TECHNOLOGIES LIMITED ILS1,M22465104,140209000.0,1212775,0.15042344378054007,2019-08-08,2019-06-30,0001567619-19-016050
HDB,HDFC BANK LIMITED ADR (EACH REPRESENTING 3 ORDINARY),40415F101,139139000.0,1069968,0.1492754926158846,2019-08-08,2019-06-30,0001567619-19-016050
VIPS,VIPSHOP HOLDINGS LIMITED SPONSORED ADR (EACH REPRESENTS 0.2 ORDINARY SHARES USD0.0001),92763W103,137754000.0,15962276,0.147789593211167,2019-08-08,2019-06-30,0001567619-19-016050
LNC,LINCOLN NATIONAL CORPORATION COMMON STOCK NPV,534187109,136641000.0,2120114,0.1465955094296142,2019-08-08,2019-06-30,0001567619-19-016050
NTR,NUTRIEN LIMITED NPV,67077M108,134788000.0,1924175,0.14460751549680428,2019-08-08,2019-06-30,0001567619-19-016050
CTRA,CABOT OIL & GAS CORPORATION COMMON STOCK USD0.10,127097103,134633000.0,5863822,0.14444122350566263,2019-08-08,2019-06-30,0001567619-19-016050
DFSEUR,DISCOVER FINANCIAL SERVICES COMMON STOCK USD0.01,254709108,128877000.0,1660995,0.13826588995074968,2019-08-08,2019-06-30,0001567619-19-016050
IQ,IQIYI INCORPORATED ADR (EACH REPRESENTS 7 ORDINARY SHARES),46267X108,128694000.0,6232153,0.13806955811604693,2019-08-08,2019-06-30,0001567619-19-016050
7HP,HP INCORPORATED COMMON STOCK USD0.01,40434L105,128130000.0,6163060,0.13746446983860236,2019-08-08,2019-06-30,0001567619-19-016050
ROP,ROPER TECHNOLOGIES INCORPORATED COMMON STOCK USD0.01,776696106,127310000.0,347595,0.1365847315628851,2019-08-08,2019-06-30,0001567619-19-016050
PFG,PRINCIPAL FINANCIAL GROUP COMMON STOCK USD0.01,74251V102,127036000.0,2193300,0.13629077023660882,2019-08-08,2019-06-30,0001567619-19-016050
KO,COCA-COLA COMPANY (THE) COMMON STOCK USD0.25,191216100,126369000.0,2481720,0.13557517824892173,2019-08-08,2019-06-30,0001567619-19-016050
NDAQ,NASDAQ INCORPORATED COMMON STOCK USD0.01,631103108,124810000.0,1297803,0.13390260267350315,2019-08-08,2019-06-30,0001567619-19-016050
LLY,ELI LILLY AND COMPANY COMMON STOCK NPV,532457108,124286000.0,1121814,0.1333404284582887,2019-08-08,2019-06-30,0001567619-19-016050
PBR/A,PETROL BRASILEIRO-PETROBRAS SA SPONSORED ADR (EACH REPRESENTS 2 PREFERENCE SHARE NPV),71654V101,123818000.0,8719547,0.13283833393019642,2019-08-08,2019-06-30,0001567619-19-016050
PBR,PETROLEO BRASILEIRO - PETROBRAS ADS (EACH REPRESENTING 2 COMMON SHARES),71654V408,123207000.0,7913120,0.13218282162963146,2019-08-08,2019-06-30,0001567619-19-016050
HRB,BLOCK(H & R) INC COM STK NPV,093671105,122806000.0,4191336,0.1317526081557746,2019-08-08,2019-06-30,0001567619-19-016050
VALE,VALE DO RIO DOCE (CIA) SPONSORED ADR (REPRESENTING 1 ORDINARY NPV),91912E105,121399000.0,9032678,0.13024310601683048,2019-08-08,2019-06-30,0001567619-19-016050
AMXN,AMERICA MOVIL SAB DE CV ADR (EACH REPRESENTS 20 SERIES 'L' SHARES),02364W105,121239000.0,8326845,0.13007144976791002,2019-08-08,2019-06-30,0001567619-19-016050
INTU,INTUIT INC COMMON STOCK USD0.01,461202103,117704000.0,450402,0.12627891951832398,2019-08-08,2019-06-30,0001567619-19-016050
MA,MASTERCARD INCORPORATED CLASS A COMMON STOCK USD0.0001,57636Q104,117149000.0,442858,0.12568348690488118,2019-08-08,2019-06-30,0001567619-19-016050
BSAC,BANCO SANTANDER-CHILE SA ADR (EACH 1 REPRESENTS 400 COMMON SHARES),05965X109,116676000.0,3899600,0.12517602811901013,2019-08-08,2019-06-30,0001567619-19-016050
T,AT AND T INCORPORATED COMMON STOCK USD1,00206R102,113889000.0,3398648,0.12218599083312716,2019-08-08,2019-06-30,0001567619-19-016050
BAC,VERIZON COMMUNICATIONS INCORPORATED COMMON STOCK USD0.10,92343V104,113688000.0,1989984,0.12197034767042086,2019-08-08,2019-06-30,0001567619-19-016050
NTES,NETEASE INCORPORATED ADR (EACH REPRESENTS 25 SHARES USD0.0001),64110W102,112889000.0,441371,0.1211131392773744,2019-08-08,2019-06-30,0001567619-19-016050
CAT,CATERPILLAR INCORPORATED COMMON STOCK USD1,149123101,112661000.0,826629,0.12086852912266276,2019-08-08,2019-06-30,0001567619-19-016050
DE,DEERE & COMPANY COMMON STOCK USD1,244199105,110393000.0,666180,0.11843530179421549,2019-08-08,2019-06-30,0001567619-19-016050
PAGS,PAGSEGURO DIGITAL LIMITED COMMON STOCK NPV,G68707101,108984000.0,2796620,0.11692365395215984,2019-08-08,2019-06-30,0001567619-19-016050
ALSN,ALLISON TRANSMISSION HOLDINGS INCORPORATED COMMON STOCK USD0.01,01973R101,107896000.0,2327843,0.11575639145950081,2019-08-08,2019-06-30,0001567619-19-016050
RGA,REINSURANCE GROUP OF AMERICA INCORPORATED COMMON STOCK USD0.01,759351604,106793000.0,684441,0.11457303619350552,2019-08-08,2019-06-30,0001567619-19-016050
YPF,YPF SA SPONSORED ADR (EACH CONVERT INTO 1 CLASS 'D'),984245100,106138000.0,5828554,0.11387031842448746,2019-08-08,2019-06-30,0001567619-19-016050
DEO,DIAGEO PLC SPONSORED ADR (EACH REPRESENTING 4 ORDINARY GBP0.28),25243Q205,105661000.0,613168,0.11335856823239338,2019-08-08,2019-06-30,0001567619-19-016050
HTHT,HUAZHU GROUP LIMITED ADR NPV (EACH REPRESENTS 1 ORDINARY SHARE),44332N106,105598000.0,2913040,0.11329097858438096,2019-08-08,2019-06-30,0001567619-19-016050
N/A,CREDICORP LIMITED COMMON STOCK USD5 (US LISTING),G2519Y108,105427000.0,460562,0.11310752096834722,2019-08-08,2019-06-30,0001567619-19-016050
HON,HONEYWELL INTERNATIONAL INCORPORATED COMMON STOCK USD1,438516106,104185000.0,596743,0.11177503933610228,2019-08-08,2019-06-30,0001567619-19-016050
PYPL,PAYPAL HOLDINGS INCORPORATED COMMON STOCK USD0.0001,70450Y103,103131000.0,901019,0.11064425379633887,2019-08-08,2019-06-30,0001567619-19-016050
CNI,CANADIAN NATIONAL RAILWAY COMMON STOCK NPV,136375102,102760000.0,847853,0.11024622586915458,2019-08-08,2019-06-30,0001567619-19-016050
HSY,HERSHEY COMPANY (THE) COMMON STOCK USD1,427866108,100466000.0,749581,0.10778510440025775,2019-08-08,2019-06-30,0001567619-19-016050
FBIN,FORTUNE BRANDS HOME AND SECURITY INCORPORATED COMMON STOCK USD0.01,34964C106,100349000.0,1756511,0.10765958076823466,2019-08-08,2019-06-30,0001567619-19-016050
XOM,EXXON MOBIL CORPORATION COMMON STOCK NPV,30231G102,99510000.0,1298572,0.10675945831295809,2019-08-08,2019-06-30,0001567619-19-016050
IQ,IQIYI INCORPORATED ADR (EACH REPRESENTS 7 ORDINARY SHARES),46267X108,98919000.0,4790258,0.10612540304350822,2019-08-08,2019-06-30,0001567619-19-016050
N/A,NEW ORIENTAL EDUCATION & TECHNOLOGY GROUP INCORPORATED SPONSORED ADR USD0.01 (EACH REPRESENTS 1 ORDINARY SHARES),647581107,98483000.0,1019699,0.10565763976519998,2019-08-08,2019-06-30,0001567619-19-016050
BEN,FRANKLIN RESOURCES INCORPORATED COMMON STOCK USD0.10,354613101,97487000.0,2801348,0.10458907961567025,2019-08-08,2019-06-30,0001567619-19-016050
JKS,JINKOSOLAR HOLDING COMPANY LIMITED ADR (EACH REP 2 ORDINARY),47759T100,96463000.0,4447339,0.1034904796225794,2019-08-08,2019-06-30,0001567619-19-016050
AWN,ADVANCE AUTO PARTS INCORPORATED COMMON STOCK USD0.0001,00751Y106,96370000.0,625208,0.10339070442789439,2019-08-08,2019-06-30,0001567619-19-016050
BIIB,BIOGEN INCORPORATED COMMON STOCK USD0.0005,09062X103,96196000.0,411324,0.10320402825719341,2019-08-08,2019-06-30,0001567619-19-016050
BC,BRUNSWICK CORPORATION COMMON STOCK USD0.75,117043109,96125000.0,2094683,0.10312785579673497,2019-08-08,2019-06-30,0001567619-19-016050
PKG,PACKAGING CORPORATION OF AMERICA COMMON STOCK USD0.01,695156109,96101000.0,1008197,0.1031021073593969,2019-08-08,2019-06-30,0001567619-19-016050
SPG,SIMON PROPERTY GROUP INCORPORATED REIT USD0.0001,828806109,95683000.0,598917,0.10265365540909224,2019-08-08,2019-06-30,0001567619-19-016050
MCD,MCDONALD'S CORPORATION COMMON STOCK USD0.01,580135101,94864000.0,456824,0.10177498998493073,2019-08-08,2019-06-30,0001567619-19-016050
CTLTEUR,CATALENT INCORPORATED COMMON STOCK USD0.01,148806102,94841000.0,1749514,0.10175031439914842,2019-08-08,2019-06-30,0001567619-19-016050
NTR,NUTRIEN LIMITED COMMON NPV,67077M108,93998000.0,1758288,0.10084590053764883,2019-08-08,2019-06-30,0001567619-19-016050
PNC,PNC FINANCIAL SERVICES GROUP COMMON STOCK USD5,693475105,93775000.0,683091,0.10060665464071597,2019-08-08,2019-06-30,0001567619-19-016050
CHKP,CHECK POINT SOFTWARE TECHNOLOGIES LIMITED ILS1,M22465104,93070000.0,805037,0.09985029429391025,2019-08-08,2019-06-30,0001567619-19-016050
CL,COLGATE-PALMOLIVE COMPANY COMMON STOCK USD1,194162103,92589000.0,1291882,0.09933425269559318,2019-08-08,2019-06-30,0001567619-19-016050
ENTG,ENTEGRIS INCORPORATED COMMON STOCK USD0.01,29362U104,92098000.0,2467783,0.09880748258171856,2019-08-08,2019-06-30,0001567619-19-016050
GPK,GRAPHIC PACKAGING HOLDING COMPANY COMMON STOCK USD0.01,388689101,92085000.0,6586926,0.09879353551149378,2019-08-08,2019-06-30,0001567619-19-016050
C,CITIGROUP INCORPORATED COMMON STOCK USD0.01,172967424,91135000.0,1301368,0.09777432653352863,2019-08-08,2019-06-30,0001567619-19-016050
BRO,BROWN & BROWN INCORPORATED COMMON STOCK USD0.10,115236101,90895000.0,2713298,0.09751684216014798,2019-08-08,2019-06-30,0001567619-19-016050
HUBB,HUBBELL INCORPORATED COMMON STOCK USD0.01,443510607,90618000.0,694925,0.09721966227920446,2019-08-08,2019-06-30,0001567619-19-016050
PH,PARKER-HANNIFIN CORPORATION COMMON STOCK USD0.5,701094104,89461000.0,526208,0.09597837302919851,2019-08-08,2019-06-30,0001567619-19-016050
CSIQ,CANADIAN SOLAR INCORPORATED COMMON NPV (US LISTING),136635109,88868000.0,4070905,0.09534217205663711,2019-08-08,2019-06-30,0001567619-19-016050
WU,WESTERN UNION COMPANY (THE) COMMON STOCK USD0.01,959802109,87892000.0,4418905,0.09429506893822241,2019-08-08,2019-06-30,0001567619-19-016050
LSTR,LANDSTAR COMMON STOCK NPV,515098101,87839000.0,813400,0.09423820780576753,2019-08-08,2019-06-30,0001567619-19-016050
AIZ,ASSURANT INCORPORATED COMMON STOCK USD0.01,04621X108,86875000.0,816652,0.09320397890602185,2019-08-08,2019-06-30,0001567619-19-016050
HXL,HEXCEL CORPORATION COMMON STOCK NPV,428291108,86816000.0,1073394,0.09314068066423244,2019-08-08,2019-06-30,0001567619-19-016050
PAYX,PAYCHEX INCORPORATED COMMON STOCK USD0.01,704326107,86698000.0,1053563,0.09301408418065361,2019-08-08,2019-06-30,0001567619-19-016050
N/A,UBS GROUP AG CHF0.10 (REGISTERED),H42097107,85817000.0,7398005,0.09206890196003542,2019-08-08,2019-06-30,0001567619-19-016050
CFG,CITIZENS FINANCIAL GROUP INCORPORATED COMMON STOCK USD0.01,174610105,85801000.0,2426511,0.09205173633514337,2019-08-08,2019-06-30,0001567619-19-016050
GNTX,GENTEX CORPORATION COMMON STOCK USD0.06,371901109,85097000.0,3457814,0.09129644883989343,2019-08-08,2019-06-30,0001567619-19-016050
SBUX,STARBUCKS CORPORATION COMMON STOCK USD0.001,855244109,85070000.0,1014791,0.0912674818478881,2019-08-08,2019-06-30,0001567619-19-016050
MMM,3M COMPANY COMMON STOCK USD0.01,88579Y101,84756000.0,488957,0.09093060645938172,2019-08-08,2019-06-30,0001567619-19-016050
ADP,AUTOMATIC DATA PROCESSING INCORPORATED COMMON STOCK USD0.10,053015103,83583000.0,505551,0.08967215158448374,2019-08-08,2019-06-30,0001567619-19-016050
PFGC,PERFORMANCE FOOD GROUP CO COMMON STOCK USD0.010000,71377A103,83414000.0,2083784,0.08949083967156152,2019-08-08,2019-06-30,0001567619-19-016050
XRAY,DENTSPLY INTERNATIONAL INCORPORATED COMMON STOCK USD 0.01,24906P109,83378000.0,1428677,0.08945221701555442,2019-08-08,2019-06-30,0001567619-19-016050
ON,ON SEMICONDUCTOR CORPORATION COMMON STOCK USD0.01,682189105,83230000.0,4118254,0.08929343498530301,2019-08-08,2019-06-30,0001567619-19-016050
BIDUN,BAIDU INCORPORATED SPONSORED ADR (EACH REPRESENTS 0.10 CLASS A SHARES),056752108,82593000.0,703756,0.0886100285442885,2019-08-08,2019-06-30,0001567619-19-016050
MSFT,MICROSOFT CORPORATION COMMON STOCK USD0.0000125,594918104,81911000.0,611458,0.0878783437832651,2019-08-08,2019-06-30,0001567619-19-016050
CTSH,COGNIZANT TECHNOLOGY SOLUTIONS CORPORATION CLASS A COMMON STOCK USD0.01,192446102,81713000.0,1289048,0.08766591917522605,2019-08-08,2019-06-30,0001567619-19-016050
BSAC,BANCO SANTANDER-CHILE SA ADR (EACH 1 REPRESENTS 400 COMMON SHARES),05965X109,81706000.0,2730799,0.08765840921433579,2019-08-08,2019-06-30,0001567619-19-016050
