ticker,nameOfIssuer,cusip,value,shares,allocation_percent,filingDate,reportDate,accessionNumber
SMP,STANDARD MOTOR PRODUCTS INCORPORATED COMMON STOCK USD2,853666105,13064000.0,322889,0.018237955253824552,2021-02-16,2020-12-31,0001567619-21-003755
HYG,ISHARES TRUST IBOXX HIGH YIELD CORPORATE BOND ETF,464288513,13022000.0,149160,0.018179321288679065,2021-02-16,2020-12-31,0001567619-21-003755
APH,AMPHENOL CORPORATION CLASS A COMMON STOCK USD0.001,032095101,12986000.0,99301,0.018129063604268646,2021-02-16,2020-12-31,0001567619-21-003755
AMGN,AMGEN INCORPORATED COMMON STOCK USD0.0001,031162100,12922000.0,56201,0.01803971660976124,2021-02-16,2020-12-31,0001567619-21-003755
BKNG,BOOKING HOLDINGS INCORPORATED COMMON STOCK USD0.008,09857L108,12889000.0,5787,0.01799364706571836,2021-02-16,2020-12-31,0001567619-21-003755
CSCO,CISCO SYSTEMS INCORPORATED USD0.001 (US LISTING),17275R102,12783000.0,285652,0.017845666106065465,2021-02-16,2020-12-31,0001567619-21-003755
N/A,TREAN INSURANCE GROUP INC USD0.010000,89457R101,12778000.0,975430,0.017838685872119574,2021-02-16,2020-12-31,0001567619-21-003755
DUK,DUKE ENERGY CORPORATION COMMON STOCK USD0.001,26441C204,12746000.0,139205,0.01779401237486587,2021-02-16,2020-12-31,0001567619-21-003755
WPXUSD,WPX ENERGY INCORPORATED COMMON STOCK USD1,98212B103,12743000.0,1563562,0.017789824234498333,2021-02-16,2020-12-31,0001567619-21-003755
CPK,CHESAPEAKE UTILITIES CORPORATION COMMON STOCK USD0.4867,165303108,12703000.0,117395,0.017733982362931205,2021-02-16,2020-12-31,0001567619-21-003755
VTI,VANGUARD TOTAL STOCK MARKET ETF,922908769,12686000.0,65178,0.017710249567515175,2021-02-16,2020-12-31,0001567619-21-003755
CWH,CAMPING WORLD HOLDINGS INC-A,13462K109,12663000.0,486108,0.017678140491364073,2021-02-16,2020-12-31,0001567619-21-003755
LQD,ISHARES TRUST IBOXX INVESTMENT GRADE CORPORATE BOND ETF,464287242,12662000.0,91667,0.0176767444445749,2021-02-16,2020-12-31,0001567619-21-003755
COF,CAPITAL ONE FINANCIAL CORPORATION COMMON STOCK USD0.01,14040H105,12618000.0,127653,0.017615318385851054,2021-02-16,2020-12-31,0001567619-21-003755
KEYS,KEYSIGHT TECHNOLOGIES INCORPORATED COMMON STOCK USD0.01,49338L103,12529000.0,94855,0.01749107022161419,2021-02-16,2020-12-31,0001567619-21-003755
MMM,3M COMPANY COMMON STOCK USD0.01,88579Y101,12505000.0,71543,0.017457565098673914,2021-02-16,2020-12-31,0001567619-21-003755
ALXN,ALEXION PHARMACEUTICALS INCORPORATED COMMON STOCK USD0.0001,015351109,12501000.0,80014,0.0174519809115172,2021-02-16,2020-12-31,0001567619-21-003755
CIXXF,CI FINANCIAL CORPORATION COMMON NPV,125491100,12467000.0,790046,0.01740451532068514,2021-02-16,2020-12-31,0001567619-21-003755
CB,CHUBB LIMITED COMMON STOCK CHF24.77,H1467J104,12408000.0,80614,0.017322148560123624,2021-02-16,2020-12-31,0001567619-21-003755
CHT,CHUNGHWA TELECOM COMPANY LIMITED ADR (EACH REPRESENTS 10 ORDINARY TWD10),17133Q502,12406000.0,321235,0.017319356466545265,2021-02-16,2020-12-31,0001567619-21-003755
LMT,LOCKHEED MARTIN CORP COMMON STOCK USD0.01,539830109,12382000.0,34882,0.01728585134360499,2021-02-16,2020-12-31,0001567619-21-003755
SSRM,SSR MINING INCORPORATED NPV,784730103,12375000.0,484165,0.01727607901608074,2021-02-16,2020-12-31,0001567619-21-003755
BBD,BANCO BRADESCO SA SPONSORED ADR (EACH REPRESENTING 1 PREFERENCE SHARE NPV),059460303,12351000.0,2348126,0.017242573893140465,2021-02-16,2020-12-31,0001567619-21-003755
CQQQ,INVESCO CHINA TECHNOLOGY ETF,46138E800,12350000.0,150000,0.017241177846351288,2021-02-16,2020-12-31,0001567619-21-003755
ORCL,ORACLE CORPORATION COMMON STOCK USD0.01,68389X105,12325000.0,190527,0.017206276676621828,2021-02-16,2020-12-31,0001567619-21-003755
VCRAUSD,VOCERA COMMUNICATIONS INCORPORATED COMMON STOCK USD0.003,92857F107,12265000.0,295339,0.017122513869271133,2021-02-16,2020-12-31,0001567619-21-003755
VOO,VANGUARD INDEX FUNDS S&P 500 ETF,922908363,12177000.0,35429,0.01699966175182345,2021-02-16,2020-12-31,0001567619-21-003755
N/A,HOLLYSYS AUTOMATION TECHNOLOGIES LIMITED USD0.0001,G45667105,12153000.0,827327,0.016966156628883174,2021-02-16,2020-12-31,0001567619-21-003755
REGN,REGENERON PHARMACEUTICALS INCORPORATED COMMON STOCK USD0.001,75886F107,12150000.0,25149,0.01696196848851564,2021-02-16,2020-12-31,0001567619-21-003755
CFG,CITIZENS FINANCIAL GROUP INCORPORATED COMMON STOCK USD0.01,174610105,12122000.0,338982,0.016922879178418646,2021-02-16,2020-12-31,0001567619-21-003755
SSD,SIMPSON MANUFACTURING COMPANY INCORPORATED COMMON STOCK USD0.01,829073105,12083000.0,129299,0.016868433353640695,2021-02-16,2020-12-31,0001567619-21-003755
IMO,IMPERIAL OIL COMMON STOCK NPV,453038408,12039000.0,498322,0.016807007294916854,2021-02-16,2020-12-31,0001567619-21-003755
SPY,SPDR SnP 500 ETF TRUST,78462F103,11976000.0,32031,0.016719056347198624,2021-02-16,2020-12-31,0001567619-21-003755
DXC,DXC TECHNOLOGY COMPANY COMMON STOCK USD0.01,23355L106,11926000.0,463139,0.01664925400773971,2021-02-16,2020-12-31,0001567619-21-003755
NKE,NIKE INCORPORATED CLASS B COMMON STOCK NPV,654106103,11865000.0,83866,0.01656409515359984,2021-02-16,2020-12-31,0001567619-21-003755
FRTEUR,FEDERAL REALTY INVESTMENT TRUST REIT USD0.01,313747206,11832000.0,139007,0.016518025609556956,2021-02-16,2020-12-31,0001567619-21-003755
N/A,MAXEON SOLAR TECHNOLOGIE NPV,Y58473102,11812000.0,416353,0.016490104673773393,2021-02-16,2020-12-31,0001567619-21-003755
EWY,ISHARES MSCI SOUTH KOREA ETF,464286772,11732000.0,136338,0.016378420930639133,2021-02-16,2020-12-31,0001567619-21-003755
ALLE,ALLEGION PLC COMMON STOCK USD0.01,G0176J109,11493000.0,98757,0.016044765748025533,2021-02-16,2020-12-31,0001567619-21-003755
MTH,MERITAGE HOMES CORPORATION COMMON STOCK USD0.01,59001A102,11461000.0,138389,0.016000092250771827,2021-02-16,2020-12-31,0001567619-21-003755
AJG,GALLAGHER (ARTHUR J.) & COMPANY COMMON STOCK USD1,363576109,11442000.0,92487,0.015973567361777442,2021-02-16,2020-12-31,0001567619-21-003755
VTR,VENTAS INCORPORATED REIT USD0.25,92276F100,11399000.0,232434,0.015913537349842778,2021-02-16,2020-12-31,0001567619-21-003755
RRR,RED ROCK RESORTS INCORPORATED CLASS A COMMON STOCK USD0.01,75700L108,11397000.0,455147,0.015910745256264423,2021-02-16,2020-12-31,0001567619-21-003755
ADBE,ADOBE INCORPORATED NPV,00724F101,11364000.0,22722,0.01586467571222154,2021-02-16,2020-12-31,0001567619-21-003755
CAT,CATERPILLAR INCORPORATED COMMON STOCK USD1,149123101,11327000.0,62229,0.015813021981021944,2021-02-16,2020-12-31,0001567619-21-003755
DG,DOLLAR GENERAL CORPORATION COMMON STOCK USD0.875,256677105,11322000.0,53837,0.015806041747076054,2021-02-16,2020-12-31,0001567619-21-003755
VEDL,VEDANTA LIMITED ADR(EACH REPRESENTS 4 ORDINARY SHARES),92242Y100,11270000.0,1283593,0.015733447314038786,2021-02-16,2020-12-31,0001567619-21-003755
TCOM,TRIP.COM GROUP LIMITED CNY0.01,89677Q107,11261000.0,333846,0.01572088289293618,2021-02-16,2020-12-31,0001567619-21-003755
BMY,BRISTOL-MYERS SQUIBB COMPANY COMMON STOCK USD0.10,110122108,11241000.0,181222,0.015692961957152616,2021-02-16,2020-12-31,0001567619-21-003755
CHRW,C.H. ROBINSON WORLDWIDE INCORPORATED COMMON STOCK USD0.10,12541W209,11145000.0,118727,0.015558941465391505,2021-02-16,2020-12-31,0001567619-21-003755
PPG,PPG INDUSTRIES INC COMMON STOCK USD1.666,693506107,11101000.0,76971,0.015497515406667661,2021-02-16,2020-12-31,0001567619-21-003755
EGO,ELDORADO GOLD CORP NPV,284902509,11044000.0,832250,0.015417940739684503,2021-02-16,2020-12-31,0001567619-21-003755
OII,OCEANEERING INTERNATIONAL INCORPORATED COMMON STOCK USD0.25,675232102,10964000.0,1379068,0.015306256996550242,2021-02-16,2020-12-31,0001567619-21-003755
IBN,ICICI BANK LIMITED SPONSORED ADR (EACH REPRESENTS 2 ORDINARY INR10),45104G104,10963000.0,737720,0.015304860949761065,2021-02-16,2020-12-31,0001567619-21-003755
TDOC,TELADOC HEALTH INCORPORATED COMMON STOCK USD0.001,87918A105,10956000.0,54793,0.015295088622236818,2021-02-16,2020-12-31,0001567619-21-003755
VRSK,VERISK ANALYTICS INC COMMON STOCK USD0.001,92345Y106,10935000.0,52676,0.015265771639664074,2021-02-16,2020-12-31,0001567619-21-003755
DQ,DAQO NEW ENERGY CORPORPORATION ADR(EACH REPRESENTS 5 ORDINARY SHARE),23703Q203,10932000.0,190585,0.015261583499296539,2021-02-16,2020-12-31,0001567619-21-003755
HRB,BLOCK(H & R) INC COM STK NPV,093671105,10886000.0,686391,0.01519736534699434,2021-02-16,2020-12-31,0001567619-21-003755
HSY,HERSHEY COMPANY (THE) COMMON STOCK USD1,427866108,10860000.0,71292,0.015161068130475705,2021-02-16,2020-12-31,0001567619-21-003755
FTDR,FRONTDOOR INC-W/I USD0.010000,35905A109,10860000.0,216292,0.015161068130475705,2021-02-16,2020-12-31,0001567619-21-003755
HFWA,HERITAGE FINANCIAL CORP COMMON STOCK NPV,42722X106,10854000.0,464058,0.015152691849740637,2021-02-16,2020-12-31,0001567619-21-003755
RSG,REPUBLIC SERVICES INCORORATED COMMON STOCK USD0.01,760759100,10839000.0,112550,0.015131751147902963,2021-02-16,2020-12-31,0001567619-21-003755
HTO,SJW Group COMMON STOCK USD1.042,784305104,10829000.0,156126,0.015117790680011182,2021-02-16,2020-12-31,0001567619-21-003755
HUYA,HUYA INC-ADR 1 ORD,44852D108,10823000.0,543034,0.01510941439927611,2021-02-16,2020-12-31,0001567619-21-003755
RDN,RADIAN GROUP INC,750236101,10819000.0,534271,0.015103830212119399,2021-02-16,2020-12-31,0001567619-21-003755
PG,PROCTER AND GAMBLE COMPANY (THE) COMMON STOCK NPV,742718109,10784000.0,77502,0.01505496857449816,2021-02-16,2020-12-31,0001567619-21-003755
INFY,INFOSYS LIMITED SPONSORED ADR (EACH REPRESENTS 1 ORDINARY INR5),456788108,10774000.0,635661,0.015041008106606376,2021-02-16,2020-12-31,0001567619-21-003755
N/A,TE CONNECTIVITY LIMITED CHF0.77 (US LISTING),H84989104,10771000.0,88962,0.01503681996623884,2021-02-16,2020-12-31,0001567619-21-003755
CHT,CHUNGHWA TELECOM COMPANY LIMITED ADR (EACH REPRESENTS 10 ORDINARY TWD10),17133Q502,10759000.0,278594,0.015020067404768704,2021-02-16,2020-12-31,0001567619-21-003755
JNK,SPDR BBG BARC HIGH YIELD BND ETF,78468R622,10732000.0,98511,0.01498237414146089,2021-02-16,2020-12-31,0001567619-21-003755
LLY,ELI LILLY AND COMPANY COMMON STOCK NPV,532457108,10701000.0,63381,0.014939096690996363,2021-02-16,2020-12-31,0001567619-21-003755
TFX,TELEFLEX INCORPORATED COMMON STOCK USD1,879369106,10633000.0,25836,0.014844165509332244,2021-02-16,2020-12-31,0001567619-21-003755
DE,DEERE & COMPANY COMMON STOCK USD1,244199105,10620000.0,39474,0.014826016901072929,2021-02-16,2020-12-31,0001567619-21-003755
HTAB,HARTFORD FUNDS EXCHANGE TRADED TR SCHRODERS TAX AWARE BOND ETF USD,41653L404,10603000.0,487500,0.014802284105656897,2021-02-16,2020-12-31,0001567619-21-003755
BTG,B2GOLD CORPORATION COMMON NPV,11777Q209,10587000.0,1484801,0.014779947357030046,2021-02-16,2020-12-31,0001567619-21-003755
CHNGUSD,CHANGE HEALTHCARE INC USD0.001000,15912K100,10526000.0,564388,0.014694788502890173,2021-02-16,2020-12-31,0001567619-21-003755
VRSN,VERISIGN INCORPORATED COMMON STOCK USD0.001,92343E102,10487000.0,48459,0.014640342678112222,2021-02-16,2020-12-31,0001567619-21-003755
JD,JD.COM INCORPORATED ADR (EACH REPRESENTING 2 SHARES),47215P106,10437000.0,118739,0.01457054033865331,2021-02-16,2020-12-31,0001567619-21-003755
S76,STORE CAPITAL CORP REIT USD0.01,862121100,10436000.0,307119,0.014569144291864131,2021-02-16,2020-12-31,0001567619-21-003755
TPD,TEMPUR SEALY INTERNATIONAL INCORPORATED COMMON STOCK USD0.01,88023U101,10425000.0,386123,0.01455378777718317,2021-02-16,2020-12-31,0001567619-21-003755
PANW,PALO ALTO NETWORKS INCORPORATED COMMON STOCK USD0.0001,697435105,10414000.0,29302,0.014538431262502208,2021-02-16,2020-12-31,0001567619-21-003755
EWT,ISHARES MSCI TAIWAN ETF,46434G772,10391000.0,195761,0.014506322186351112,2021-02-16,2020-12-31,0001567619-21-003755
GFI,GOLD FIELDS LIMITED SPONSORED ADR (EACH REPRESENTS 1 ORDINARY),38059T106,10266000.0,1107454,0.01433181633770383,2021-02-16,2020-12-31,0001567619-21-003755
AFG,AMERICAN FINANCIAL GROUP INCORPORATED COMMON STOCK NPV,025932104,10232000.0,116772,0.01428435074687177,2021-02-16,2020-12-31,0001567619-21-003755
YRI,YAMANA GOLD INCORPORATED COMMON NPV (US LISTING),98462Y100,10230000.0,1791580,0.014281558653293414,2021-02-16,2020-12-31,0001567619-21-003755
ALLY,ALLY FINANCIAL INCORPORATED COMMON STOCK USD0.10,02005N100,10197000.0,285958,0.014235489109250531,2021-02-16,2020-12-31,0001567619-21-003755
TSLA,TESLA INCORPORATED COMMON STOCK USD0.001,88160R101,10191000.0,14441,0.014227112828515463,2021-02-16,2020-12-31,0001567619-21-003755
SSD,SIMPSON MANUFACTURING COMPANY INCORPORATED COMMON STOCK USD0.01,829073105,10180000.0,108936,0.014211756313834503,2021-02-16,2020-12-31,0001567619-21-003755
TMHC,TAYLOR MORRISON HOME CORPORATION COMMON STOCK USD0.00001,87724P106,10074000.0,392745,0.014063775354181607,2021-02-16,2020-12-31,0001567619-21-003755
KMB,KIMBERLY-CLARK CORPORATION COMMON STOCK USD1.25,494368103,10036000.0,74438,0.014010725576192835,2021-02-16,2020-12-31,0001567619-21-003755
RACE,FERRARI NV EUR0.01,N3167Y103,9980000.0,52901,0.013932546955998854,2021-02-16,2020-12-31,0001567619-21-003755
DEI,DOUGLAS EMMETT INCORPORATED REIT USD0.01,25960P109,9970000.0,341657,0.01391858648810707,2021-02-16,2020-12-31,0001567619-21-003755
PFE,PFIZER INCORPORATED COMMON STOCK USD0.05,717081103,9917000.0,269406,0.013844596008280623,2021-02-16,2020-12-31,0001567619-21-003755
JKHY,JACK HENRY AND ASSOCIATE INCORPORATED COMMON STOCK USD0.01,426281101,9907000.0,61156,0.01383063554038884,2021-02-16,2020-12-31,0001567619-21-003755
BRO,BROWN & BROWN INCORPORATED COMMON STOCK USD0.10,115236101,9882000.0,208440,0.013795734370659386,2021-02-16,2020-12-31,0001567619-21-003755
MA,MASTERCARD INCORPORATED CLASS A COMMON STOCK USD0.0001,57636Q104,9882000.0,27684,0.013795734370659386,2021-02-16,2020-12-31,0001567619-21-003755
THC,TENET HEALTHCARE CORPORATION COMMON STOCK USD0.05,88033G407,9836000.0,246330,0.013731516218357186,2021-02-16,2020-12-31,0001567619-21-003755
BAC,VERIZON COMMUNICATIONS INCORPORATED COMMON STOCK USD0.10,92343V104,9834000.0,167389,0.013728724124778827,2021-02-16,2020-12-31,0001567619-21-003755
OVV,OVINTIV INCORPORATED COMMON STOCK NPV,69047Q102,9809000.0,683062,0.013693822955049374,2021-02-16,2020-12-31,0001567619-21-003755
EAF,GRAFTECH INTERNATIONAL LIMITED COMMON STOCK USD0.01,384313508,9729000.0,912700,0.013582139211915114,2021-02-16,2020-12-31,0001567619-21-003755
EXPD,EXPEDITORS INTERNATIONAL OF WASHINGTON I NCORPORATED COMMON STOCK USD0.01,302130109,9706000.0,102055,0.013550030135764014,2021-02-16,2020-12-31,0001567619-21-003755
NVDA,NVIDIA CORPORATION COMMON STOCK USD0.001,67066G104,9673000.0,18524,0.013503960591721133,2021-02-16,2020-12-31,0001567619-21-003755
LAD,LITHIA MOTORS INCORPORATED CLASS 'A' COMMON STOCK NPV,536797103,9668000.0,33034,0.01349698035777524,2021-02-16,2020-12-31,0001567619-21-003755
POWI,POWER INTERGRATION INCORPORATED COMMON STOCK USD0.10,739276103,9663000.0,118048,0.013490000123829352,2021-02-16,2020-12-31,0001567619-21-003755
DOV,DOVER CORPORATION COMMON STOCK USD1,260003108,9641000.0,76364,0.013459287094467429,2021-02-16,2020-12-31,0001567619-21-003755
MDCA,MDC PARTNERS INCORPORATED - A COMMON STOCK NPV,552697104,9631000.0,3836959,0.013445326626575646,2021-02-16,2020-12-31,0001567619-21-003755
CNQ,CANADIAN NATURAL RESOURCES LIMITED COMMON NPV,136385101,9595000.0,313673,0.013395068942165229,2021-02-16,2020-12-31,0001567619-21-003755
NVCR,NOVOCURE LTD USD0.000000,G6674U108,9587000.0,55405,0.013383900567851803,2021-02-16,2020-12-31,0001567619-21-003755
MRNA,MODERNA INC,60770K107,9512000.0,91053,0.013279197058663436,2021-02-16,2020-12-31,0001567619-21-003755
R,RYDER SYSTEM INCORPORATE COMMON SOCTK USD0.50,783549108,9498000.0,153791,0.01325965240361494,2021-02-16,2020-12-31,0001567619-21-003755
INTC,INTEL CORPORATION COMMON STOCK USD0.001,458140100,9464000.0,189958,0.013212186812782882,2021-02-16,2020-12-31,0001567619-21-003755
TYL,TYLER TECHNOLOGIES INCORPORATED COMMON STOCK USD0.01,902252105,9462000.0,21676,0.013209394719204523,2021-02-16,2020-12-31,0001567619-21-003755
STE,STERIS PLC USD75.000000,G8473T100,9436000.0,49783,0.013173097502685888,2021-02-16,2020-12-31,0001567619-21-003755
CCK,CROWN HOLDINGS INCORPORATED COMMON STOCK USD5,228368106,9399000.0,93803,0.013121443771486293,2021-02-16,2020-12-31,0001567619-21-003755
RNR,RENAISSANCE HOLDINGS COMMON STOCK NPV,G7496G103,9362000.0,56456,0.013069790040286699,2021-02-16,2020-12-31,0001567619-21-003755
TPH,TRI POINTE GROUP INC COMMON STOCK USD0.01,87265H109,9338000.0,541343,0.013036284917346421,2021-02-16,2020-12-31,0001567619-21-003755
EBND,SPDR BBG BARC EM LOCAL BOND,78464A391,9279000.0,330811,0.012953918156784905,2021-02-16,2020-12-31,0001567619-21-003755
SEI,SOLARIS OILFIELD INFRASTRUCTURE INCORPORATED COMMON STOCK USD0.01 CL A,83418M103,9249000.0,1136278,0.012912036753109557,2021-02-16,2020-12-31,0001567619-21-003755
SIENUSD,SIENTRA INCORPORATED COMMON STOCK USD0.01,82621J105,9210000.0,2367505,0.012857590928331606,2021-02-16,2020-12-31,0001567619-21-003755
BWXT,BWX TECHNOLOGIES INCORPORATED COMMON STOCK USD0.01,05605H100,9201000.0,152643,0.012845026507229003,2021-02-16,2020-12-31,0001567619-21-003755
FL,FOOT LOCKER INCORPORATED COMMON STOCK USD0.01,344849104,9180000.0,227004,0.01281570952465626,2021-02-16,2020-12-31,0001567619-21-003755
PEP,PEPSICO INCORPORATED CAPITAL STOCK USD0.016666,713448108,9173000.0,61857,0.012805937197132012,2021-02-16,2020-12-31,0001567619-21-003755
0VVB,VIACOMCBS INCORPORATED USD0.001,92556H206,9173000.0,246192,0.012805937197132012,2021-02-16,2020-12-31,0001567619-21-003755
COOP,MR COOPER GROUP INCORPORATED COMMON STOCK USD0.01,62482R107,9165000.0,295358,0.012794768822818587,2021-02-16,2020-12-31,0001567619-21-003755
WHD,CACTUS INCORPORATED A COMMON STOCK USD0.01,127203107,9165000.0,351538,0.012794768822818587,2021-02-16,2020-12-31,0001567619-21-003755
UNP,UNION PACIFIC CORPORATION COMMON STOCK USD2.50,907818108,9148000.0,43932,0.012771036027402555,2021-02-16,2020-12-31,0001567619-21-003755
EHTH,EHEALTH INCORPORATED COMMON STOCK USD0.001,28238P109,9125000.0,129229,0.012738926951251457,2021-02-16,2020-12-31,0001567619-21-003755
DWD,MORGAN STANLEY COMMON STOCK USD0.01,617446448,9091000.0,132652,0.012691461360419395,2021-02-16,2020-12-31,0001567619-21-003755
WDR,WADDELL & REED FINANCIAL-A,930059100,9070000.0,356100,0.012662144377846652,2021-02-16,2020-12-31,0001567619-21-003755
PYPL,PAYPAL HOLDINGS INCORPORATED COMMON STOCK USD0.0001,70450Y103,9043000.0,38613,0.01262445111453884,2021-02-16,2020-12-31,0001567619-21-003755
MDC1USD,M.D.C. HOLDINGS INCORPORATED COMMON STOCK USD0.01,552676108,9042000.0,186048,0.012623055067749661,2021-02-16,2020-12-31,0001567619-21-003755
N/A,CRESCENT POINT ENERGY CORPORATION COMMON NPV,22576C101,8987000.0,3025972,0.01254627249434486,2021-02-16,2020-12-31,0001567619-21-003755
FCX,FREEPORT-MCMORAN NCORPORATED COMMON STOCK USD0.10,35671D857,8983000.0,345233,0.012540688307188146,2021-02-16,2020-12-31,0001567619-21-003755
MSI,MOTOROLA SOLUTIONS INCORPORATED COMMON STOCK USD0.01,620076307,8983000.0,52823,0.012540688307188146,2021-02-16,2020-12-31,0001567619-21-003755
HD,HOME DEPOT INCORPORATED (THE) COMMON STOCK USD0.05,437076102,8927000.0,33610,0.012462509686994165,2021-02-16,2020-12-31,0001567619-21-003755
ESNT,ESSENT GROUP LIMITED USD0.015,G3198U102,8917000.0,206416,0.012448549219102384,2021-02-16,2020-12-31,0001567619-21-003755
QQQ,INVESCO QQQ TRUST SERIES 1 NPV,46090E103,8898000.0,28362,0.012422024330107993,2021-02-16,2020-12-31,0001567619-21-003755
ST,SENSATA TECHNOLOGIES HOLDING PLC COMMON STOCK EUR0.01,G8060N102,8822000.0,167270,0.012315924774130448,2021-02-16,2020-12-31,0001567619-21-003755
CMCSA,COMCAST CORPORATION CLASS A COMMON STOCK USD1,20030N101,8740000.0,166788,0.012201448937417833,2021-02-16,2020-12-31,0001567619-21-003755
BIDUN,BAIDU INCORPORATED SPONSORED ADR (EACH REPRESENTS 0.10 CLASS A SHARES),056752108,8663000.0,40063,0.012093953334651108,2021-02-16,2020-12-31,0001567619-21-003755
TWTRUSD,TWITTER INCORPORATED COMMON STOCK USD0.000005,90184L102,8647000.0,159677,0.012071616586024255,2021-02-16,2020-12-31,0001567619-21-003755
PAAS,PAN AMERICAN SILVER CORPORATION COMMON NPV (US LISTING),697900108,8642000.0,250418,0.012064636352078365,2021-02-16,2020-12-31,0001567619-21-003755
8CW,CROWN CASTLE INTERNATIONAL CORPORATION REIT USD0.01,22822V101,8559000.0,53765,0.01194876446857657,2021-02-16,2020-12-31,0001567619-21-003755
HUYA,HUYA INC-ADR 1 ORD,44852D108,8554000.0,429184,0.01194178423463068,2021-02-16,2020-12-31,0001567619-21-003755
RRC,RANGE RESOURCES CORPORATION COMMON STOCK USD0.01,75281A109,8551000.0,1276338,0.011937596094263146,2021-02-16,2020-12-31,0001567619-21-003755
ABEV,AMBEV SA SPONSORED ADR (EACH REPRESENTS 1 COMMON NPV),02319V103,8535000.0,2789197,0.011915259345636293,2021-02-16,2020-12-31,0001567619-21-003755
INFY,INFOSYS LIMITED SPONSORED ADR (EACH REPRESENTS 1 ORDINARY INR5),456788108,8503000.0,501660,0.01187058584838259,2021-02-16,2020-12-31,0001567619-21-003755
MTD,METTLER-TOLEDO INTERNATIONAL COMMON STOCK USD0.01,592688105,8489000.0,7449,0.011851041193334095,2021-02-16,2020-12-31,0001567619-21-003755
DB,DEUTSCHE BANK AG NPV (REGISTERED),D18190898,8486000.0,948277,0.01184685305296656,2021-02-16,2020-12-31,0001567619-21-003755
AMED,AMEDISYS INCORPORATED COMMON STOCK USD0.001,023436108,8458000.0,28834,0.011807763742869569,2021-02-16,2020-12-31,0001567619-21-003755
VOYA,VOYA FINANCIAL INCORPORATED COMMON STOCK USD0.01,929089100,8456000.0,143790,0.011804971649291212,2021-02-16,2020-12-31,0001567619-21-003755
PM,PHILIP MORRIS INTERNATIONAL INCORPORATED COMMON STOCK NPV,718172109,8453000.0,102097,0.011800783508923678,2021-02-16,2020-12-31,0001567619-21-003755
INTU,INTUIT INC COMMON STOCK USD0.01,461202103,8428000.0,22189,0.011765882339194221,2021-02-16,2020-12-31,0001567619-21-003755
ABT,ABBOTT LABORATORIES COMMON STOCK NPV,002824100,8418000.0,76886,0.011751921871302438,2021-02-16,2020-12-31,0001567619-21-003755
DLX,DELUXE CORPORATION COMMON STOCK USD1,248019101,8395000.0,287492,0.01171981279515134,2021-02-16,2020-12-31,0001567619-21-003755
SO,SOUTHERN COMPANY (THE) COMMON STOCK USD5,842587107,8380000.0,136412,0.011698872093313667,2021-02-16,2020-12-31,0001567619-21-003755
CB,CHUBB LIMITED COMMON STOCK CHF24.77,H1467J104,8369000.0,54371,0.011683515578632704,2021-02-16,2020-12-31,0001567619-21-003755
AVA,AVISTA CORPORATION COMMON STOCK NPV,05379B107,8368000.0,208481,0.011682119531843527,2021-02-16,2020-12-31,0001567619-21-003755
FRCB,FIRST REPUBLIC BANK/SAN FRANCISCO CA COMMON STOCK USD0.01,33616C100,8367000.0,56947,0.01168072348505435,2021-02-16,2020-12-31,0001567619-21-003755
SSRM,SSR MINING INCORPORATED NPV,784730103,8325000.0,325719,0.011622089519908863,2021-02-16,2020-12-31,0001567619-21-003755
TFII,TFI INTERNATIONAL INCORPORATED COMMON NPV,87241L109,8323000.0,127015,0.011619297426330506,2021-02-16,2020-12-31,0001567619-21-003755
WCN,WASTE CONNECTIONS INCORPORATED NPV,94106B101,8314000.0,81052,0.011606733005227902,2021-02-16,2020-12-31,0001567619-21-003755
SRCL,STERICYCLE INCORPORATED COMMON STOCK USD0.01,858912108,8254000.0,119059,0.011522970197877206,2021-02-16,2020-12-31,0001567619-21-003755
KO,COCA-COLA COMPANY (THE) COMMON STOCK USD0.25,191216100,8251000.0,150461,0.011518782057509672,2021-02-16,2020-12-31,0001567619-21-003755
TECH,BIO-TECHNE CORPORATION COMMON STOCK USD0.01,09073M104,8236000.0,25935,0.011497841355671999,2021-02-16,2020-12-31,0001567619-21-003755
AGO,ASSURED GUARANTY LIMITED COMMON STOCK USD0.01,G0585R106,8209000.0,260671,0.011460148092364186,2021-02-16,2020-12-31,0001567619-21-003755
CE,CELANESE CORPORATION CLASS A COMMON STOCK USD0.0001 (US LISTING),150870103,8209000.0,63173,0.011460148092364186,2021-02-16,2020-12-31,0001567619-21-003755
ABT,ABBOTT LABORATORIES COMMON STOCK NPV,002824100,8147000.0,74413,0.011373593191435136,2021-02-16,2020-12-31,0001567619-21-003755
LVS,LAS VEGAS SANDS CORPORATION COMMON STOCK USD0.001,517834107,8072000.0,135438,0.011268889682246768,2021-02-16,2020-12-31,0001567619-21-003755
CSW,CSW INDUSTRIALS INCORPORATED COMMON STOCK USD0.01,126402106,8063000.0,72051,0.011256325261144165,2021-02-16,2020-12-31,0001567619-21-003755
NSC,NORFOLK SOUTHERN CORP COMMON STOCK USD1,655844108,8061000.0,33926,0.011253533167565806,2021-02-16,2020-12-31,0001567619-21-003755
BURL,BURLINGTON STORES INC COMMON STOCK USD0.0001,122017106,8051000.0,30781,0.011239572699674025,2021-02-16,2020-12-31,0001567619-21-003755
N/A,CAPRI HOLDINGS LTD NPV,G1890L107,8021000.0,190981,0.011197691295998678,2021-02-16,2020-12-31,0001567619-21-003755
N/A,CAMBRIDGE BANCORP COMMON STOCK USD1,132152109,7995000.0,114630,0.011161394079480042,2021-02-16,2020-12-31,0001567619-21-003755
RBAGBP,RITCHIE BROS. AUCTIONEERS INCORPORATED COMMON NPV,767744105,7988000.0,90279,0.011151621751955795,2021-02-16,2020-12-31,0001567619-21-003755
MSFT,MICROSOFT CORPORATION COMMON STOCK USD0.0000125,594918104,7966000.0,35813,0.011120908722593874,2021-02-16,2020-12-31,0001567619-21-003755
IAG,IAM GOLD CORP COMMON STOCK NPV,450913108,7934000.0,1698983,0.01107623522534017,2021-02-16,2020-12-31,0001567619-21-003755
MHK,MOHAWK INDUSTRIES INCORPORATED COMMON STOCK USD0.01,608190104,7925000.0,56224,0.011063670804237565,2021-02-16,2020-12-31,0001567619-21-003755
AFW,ALIGN TECHNOLOGY INCORPORATED COMMON STOCK USD0.0001,016255101,7898000.0,14779,0.011025977540929753,2021-02-16,2020-12-31,0001567619-21-003755
TPICQ,TPI COMPOSITES INC,87266J104,7888000.0,149451,0.01101201707303797,2021-02-16,2020-12-31,0001567619-21-003755
MTB,M & T BK CORPORATION COMMON STOCK USD0.50,55261F104,7836000.0,61556,0.010939422640000702,2021-02-16,2020-12-31,0001567619-21-003755
KBH,KB HOME COMMON STOCK USD1,48666K109,7827000.0,233513,0.010926858218898099,2021-02-16,2020-12-31,0001567619-21-003755
ADNT,ADIENT PLC USD0.001,G0084W101,7802000.0,224398,0.010891957049168642,2021-02-16,2020-12-31,0001567619-21-003755
GOTU,GSX TECHEDU INCORPORATED ADR USD0.0001,36257Y109,7800000.0,150836,0.010889164955590286,2021-02-16,2020-12-31,0001567619-21-003755
ATKR,ATKORE INTERNATIONAL GROUP I,047649108,7790000.0,189489,0.010875204487698503,2021-02-16,2020-12-31,0001567619-21-003755
