ticker,nameOfIssuer,cusip,value,shares,allocation_percent,filingDate,reportDate,accessionNumber
PHM,PULTE GROUP INCORPORATED COMMON STOCK USD0.01,745867101,2246000.0,52098,0.0031355210884943313,2021-02-16,2020-12-31,0001567619-21-003755
OTX,OPEN TEXT CORPORATION COMMON NPV,683715106,2246000.0,38828,0.0031355210884943313,2021-02-16,2020-12-31,0001567619-21-003755
OHI,OMEGA HEALTHCARE INVESTORS INCORPORATED REIT USD0.10,681936100,2246000.0,61846,0.0031355210884943313,2021-02-16,2020-12-31,0001567619-21-003755
CL,COLGATE-PALMOLIVE COMPANY COMMON STOCK USD1,194162103,2237000.0,26162,0.0031229566673917266,2021-02-16,2020-12-31,0001567619-21-003755
SPGI,S AND P GLOBAL INCORPORATED COMMON STOCK USD1,78409V104,2231000.0,6786,0.0031145803866566577,2021-02-16,2020-12-31,0001567619-21-003755
HLT,HILTON WORLDWIDE HOLDINGS INCORPORATED COMMON STOCK USD0.01,43300A203,2230000.0,20047,0.003113184339867479,2021-02-16,2020-12-31,0001567619-21-003755
HTHT,HUAZHU GROUP LIMITED ADR NPV (EACH REPRESENTS 1 ORDINARY SHARE),44332N106,2225000.0,49402,0.003106204105921588,2021-02-16,2020-12-31,0001567619-21-003755
HLI,HOULIHAN LOKEY INC COMMON STOCK USD0.001,441593100,2224000.0,33084,0.00310480805913241,2021-02-16,2020-12-31,0001567619-21-003755
N/A,SERES THERAPEUTICS INC COMMON STOCK USD0.001,81750R102,2219000.0,90572,0.0030978278251865186,2021-02-16,2020-12-31,0001567619-21-003755
LEN,LENNAR CORPORATION COMMON STOCK USD0.10,526057104,2217000.0,29083,0.0030950357316081615,2021-02-16,2020-12-31,0001567619-21-003755
GDDY,GODADDY INC COMMON STOCK USD0.001,380237107,2213000.0,26675,0.0030894515444514488,2021-02-16,2020-12-31,0001567619-21-003755
BHC,BAUSCH HEALTH COS INCORPORATED NPV,071734107,2206000.0,83534,0.0030796792169272016,2021-02-16,2020-12-31,0001567619-21-003755
VFC,VF CORPORATION COMMON STOCK USD1,918204108,2198000.0,25737,0.003068510842613775,2021-02-16,2020-12-31,0001567619-21-003755
BIIB,BIOGEN INCORPORATED COMMON STOCK USD0.0005,09062X103,2196000.0,8970,0.003065718749035419,2021-02-16,2020-12-31,0001567619-21-003755
AMD,ADVANCED MICRO DEVICES INCORPORATED COMMON STOCK USD0.01,007903107,2193000.0,23908,0.003061530608667884,2021-02-16,2020-12-31,0001567619-21-003755
IEI,INSIGHT ENTERPRISES INCORPORATED COMMON STOCK USD0.01,45765U103,2191000.0,28798,0.0030587385150895275,2021-02-16,2020-12-31,0001567619-21-003755
DOOREUR,MASONITE INTERNATIONAL CORP COMMON NPV,575385109,2180000.0,22167,0.003043382000408567,2021-02-16,2020-12-31,0001567619-21-003755
NVR,NVR INCORPORATED COMMON STOCK USD0.01,62944T105,2175000.0,533,0.003036401766462676,2021-02-16,2020-12-31,0001567619-21-003755
BMI,BADGER METER INCORPORATED COMMON STOCK USD1,056525108,2171000.0,23083,0.003030817579305963,2021-02-16,2020-12-31,0001567619-21-003755
USB,US BANCORP COMMON STOCK USD0.01,902973304,2170000.0,46570,0.0030294215325167846,2021-02-16,2020-12-31,0001567619-21-003755
VOO,VANGUARD INDEX FUNDS S&P 500 ETF,922908363,2164000.0,6295,0.0030210452517817152,2021-02-16,2020-12-31,0001567619-21-003755
DISCAUSD,DISCOVERY INCORPORATED CLASS A COMMON STOCK USD0.01,25470F104,2164000.0,71932,0.0030210452517817152,2021-02-16,2020-12-31,0001567619-21-003755
AGREUR,AVANGRID INCORPORATION COMMON STOCK USD0.01,05351W103,2161000.0,47554,0.0030168571114141804,2021-02-16,2020-12-31,0001567619-21-003755
COP,CONOCOPHILLIPS INCORPORATED COMMON STOCK USD0.01,20825C104,2153000.0,53830,0.0030056887371007544,2021-02-16,2020-12-31,0001567619-21-003755
MRK,MERCK AND COMPANY INCORPORATED NEW COMMON STOCK USD0.01,58933Y105,2153000.0,26315,0.0030056887371007544,2021-02-16,2020-12-31,0001567619-21-003755
MOG/A,MOOG INCORPORATED CLASS 'A' (LIMITED VOTING) COMMON STOCK USD1,615394202,2141000.0,26993,0.0029889361756306157,2021-02-16,2020-12-31,0001567619-21-003755
MET,METLIFE INCORPORATED COMMON STOCK USD0.01,59156R108,2134000.0,45449,0.002979163848106368,2021-02-16,2020-12-31,0001567619-21-003755
N/A,BROOKFIELD ASSET MANAGEMENT INCORPORATED VOTING CLASS 'A' NPV,112585104,2129000.0,40455,0.002972183614160477,2021-02-16,2020-12-31,0001567619-21-003755
N/A,AON PLC,G0403H108,2123000.0,10047,0.0029638073334254072,2021-02-16,2020-12-31,0001567619-21-003755
GME,GAMESTOP CORPORATION CLASS'A' COMMON STOCK USD0.001,36467W109,2121000.0,112600,0.0029610152398470506,2021-02-16,2020-12-31,0001567619-21-003755
APG,API GROUP CORPORATION NPV 144A,00187Y100,2115000.0,116530,0.0029526389591119813,2021-02-16,2020-12-31,0001567619-21-003755
MPW,MEDICAL PROPERTIES TRUST INCORPORATED REIT USD0.001,58463J304,2114000.0,97037,0.002951242912322803,2021-02-16,2020-12-31,0001567619-21-003755
ZTS,ZOETIS INCORPORATED COMMON STOCK USD0.01,98978V103,2102000.0,12699,0.002934490350852664,2021-02-16,2020-12-31,0001567619-21-003755
GWW,GRAINGER(W.W.) INC COMMON STOCK USD0.50,384802104,2099000.0,5141,0.0029303022104851294,2021-02-16,2020-12-31,0001567619-21-003755
LULU,LULULEMON ATHLETICA INCORPORATED COMMON STOCK USD0.01,550021109,2093000.0,6015,0.00292192592975006,2021-02-16,2020-12-31,0001567619-21-003755
MDT,MEDTRONIC PLC USD0.10,G5960L103,2091000.0,17850,0.0029191338361717035,2021-02-16,2020-12-31,0001567619-21-003755
WMT,WALMART INCORPORATED COMMON STOCK USD0.10,931142103,2068000.0,14344,0.002887024760020604,2021-02-16,2020-12-31,0001567619-21-003755
PCRX,PACIRA BIOSCIENCES INCORPORATED COMMON STOCK NPV,695127100,2066000.0,34521,0.0028842326664422473,2021-02-16,2020-12-31,0001567619-21-003755
AZTA,BROOKS AUTOMATION INCORPORATED COMMON STOCK USD0.01,114340102,2055000.0,30292,0.002868876151761287,2021-02-16,2020-12-31,0001567619-21-003755
EMR,EMERSON ELECTRIC COMPANY COMMON STOCK USD1,291011104,2055000.0,25573,0.002868876151761287,2021-02-16,2020-12-31,0001567619-21-003755
ITW,ILLINOIS TOOL WORKS INC COMMON STOCK NPV,452308109,2052000.0,10065,0.002864688011393752,2021-02-16,2020-12-31,0001567619-21-003755
MAC,MACERICH COMPANY (THE) REIT USD0.01,554382101,2051000.0,192261,0.0028632919646045737,2021-02-16,2020-12-31,0001567619-21-003755
ZBRA,ZEBRA TECHNOLOGIES CLASS 'A' COMMON STOCK USD0.01,989207105,2050000.0,5334,0.0028618959178153955,2021-02-16,2020-12-31,0001567619-21-003755
N/A,NVENT ELECTRIC PUBLIC LIMITED COMPANY COMMON STOCK USD0.01,G6700G107,2026000.0,86982,0.0028283907948751176,2021-02-16,2020-12-31,0001567619-21-003755
9990302D,APACHE CORPORATION COMMON STOCK USD0.625,037411105,2022000.0,142472,0.002822806607718405,2021-02-16,2020-12-31,0001567619-21-003755
VICI,VICI PROPERTIES INCORPRATED REIT USD0.01,925652109,2012000.0,78915,0.0028088461398266228,2021-02-16,2020-12-31,0001567619-21-003755
NTES,NETEASE INCORPORATED ADR (EACH REPRESENTS 25 SHARES USD0.0001),64110W102,2010000.0,20993,0.0028060540462482657,2021-02-16,2020-12-31,0001567619-21-003755
AGI,ALAMOS GOLD INCORPORATED CLASS A COMMON NPV,011532108,2009000.0,180641,0.002804657999459088,2021-02-16,2020-12-31,0001567619-21-003755
HON,HONEYWELL INTERNATIONAL INCORPORATED COMMON STOCK USD1,438516106,2009000.0,9445,0.002804657999459088,2021-02-16,2020-12-31,0001567619-21-003755
MA,MASTERCARD INCORPORATED CLASS A COMMON STOCK USD0.0001,57636Q104,2006000.0,5620,0.002800469859091553,2021-02-16,2020-12-31,0001567619-21-003755
MUR,MURPHY OIL CORPORATION COMMON STOCK USD1,626717102,2005000.0,165701,0.0027990738123023747,2021-02-16,2020-12-31,0001567619-21-003755
TRMB,TRIMBLE INCORPORATED COMMON STOCK NPV,896239100,2003000.0,30005,0.002796281718724018,2021-02-16,2020-12-31,0001567619-21-003755
N/A,ARGO GROUP INTERNATIONAL HOLDINGS LIMITED COMMON STOCK USD1,G0464B107,2000000.0,45766,0.0027920935783564836,2021-02-16,2020-12-31,0001567619-21-003755
ENIC,ENEL CHILE SA SPONSORED ADR (EACH REPRESENTS 50 ORDINARY SHARES),29278D105,1996000.0,512987,0.002786509391199771,2021-02-16,2020-12-31,0001567619-21-003755
CSTM,CONSTELLIUM SE COMMON EUR0.020000,F21107101,1993000.0,142427,0.002782321250832236,2021-02-16,2020-12-31,0001567619-21-003755
COP,CONOCOPHILLIPS INCORPORATED COMMON STOCK USD0.01,20825C104,1993000.0,49836,0.002782321250832236,2021-02-16,2020-12-31,0001567619-21-003755
CNC,CENTENE CORPORATION COMMON STOCK USD0.001,15135B101,1990000.0,33151,0.002778133110464701,2021-02-16,2020-12-31,0001567619-21-003755
N/A,NEW ORIENTAL EDUCATION & TECHNOLOGY GROUP INCORPORATED SPONSORED ADR USD0.01 (EACH REPRESENTS 1 ORDINARY SHARES),647581107,1987000.0,10692,0.0027739449700971666,2021-02-16,2020-12-31,0001567619-21-003755
KREF,KKR REAL ESTATE FINANCE TRUST INCORPORATED REIT USD0.01,48251K100,1981000.0,110533,0.0027655686893620973,2021-02-16,2020-12-31,0001567619-21-003755
QDELUSD,QUIDEL CORP COMMON STOCK USD0.001,74838J101,1980000.0,11021,0.0027641726425729186,2021-02-16,2020-12-31,0001567619-21-003755
WSO,WATSCO INCORPORATED COMMON STOCK USD0.50,942622200,1978000.0,8732,0.0027613805489945624,2021-02-16,2020-12-31,0001567619-21-003755
NDAQ,NASDAQ INCORPORATED COMMON STOCK USD0.01,631103108,1975000.0,14876,0.0027571924086270275,2021-02-16,2020-12-31,0001567619-21-003755
SE,SEA LIMITED ADR (EACH REPRESENTS 1 ORDINARY SHARES),81141R100,1969000.0,9892,0.002748816127891958,2021-02-16,2020-12-31,0001567619-21-003755
O,REALTY INCOME CORPORATION REIT USD1,756109104,1968000.0,31662,0.00274742008110278,2021-02-16,2020-12-31,0001567619-21-003755
DD,DUPONT DE NEMOURS INCORPORATED COMMON USD0.010000,26614N102,1968000.0,27673,0.00274742008110278,2021-02-16,2020-12-31,0001567619-21-003755
WH,WYNDHAM HOTELS AND RESORTS INCORPORATED COMMON STOCK USD0.01,98311A105,1963000.0,33033,0.0027404398471568884,2021-02-16,2020-12-31,0001567619-21-003755
OZK,BANK OZK COMMON STOCK NPV,06417N103,1962000.0,62746,0.0027390438003677105,2021-02-16,2020-12-31,0001567619-21-003755
N/A,FOUR SEASONS EDUCATION CAYMAN INCORPORATED ADR NPV (EACH REPRESENTS 0.5 ORDINARY SHARES),35101A101,1954000.0,1808930,0.002727875426054284,2021-02-16,2020-12-31,0001567619-21-003755
UFPI,UNIVERSAL FOREST PRODUCTS NPV,90278Q108,1948000.0,35074,0.0027194991453192148,2021-02-16,2020-12-31,0001567619-21-003755
RE,EVEREST RE GROUP LIMITED COMMON STOCK USD0.01,G3223R108,1945000.0,8310,0.0027153110049516803,2021-02-16,2020-12-31,0001567619-21-003755
NOW,SERVICENOW INCORPORATED COMMON STOCK USD0.001,81762P102,1944000.0,3531,0.002713914958162502,2021-02-16,2020-12-31,0001567619-21-003755
MLKN,MILLER (HERMAN) INCORPORATED COMMON STOCK USD0.20,600544100,1940000.0,57403,0.0027083307710057893,2021-02-16,2020-12-31,0001567619-21-003755
AMGN,AMGEN INCORPORATED COMMON STOCK USD0.0001,031162100,1937000.0,8423,0.0027041426306382544,2021-02-16,2020-12-31,0001567619-21-003755
AG8,AGILENT TECHNOLOGIES INC,00846U101,1932000.0,16309,0.0026971623966923633,2021-02-16,2020-12-31,0001567619-21-003755
FAF,FIRST AMERICAN FINANCIAL CORPORATION COMMON STOCK USD0.00001,31847R102,1932000.0,37413,0.0026971623966923633,2021-02-16,2020-12-31,0001567619-21-003755
STWD,STARWOOD PROPERTY TRUST INCORPORATED REIT USD0.01,85571B105,1925000.0,99750,0.0026873900691681157,2021-02-16,2020-12-31,0001567619-21-003755
ATVIEUR,ACTIVISION BLIZZARD INCORPORATED COMMON STOCK USD0.000001,00507V109,1920000.0,20679,0.002680409835222224,2021-02-16,2020-12-31,0001567619-21-003755
AI,C3.AI INC,12468P104,1910000.0,13763,0.002666449367330442,2021-02-16,2020-12-31,0001567619-21-003755
SHOP,SHOPIFY INCORPORATED - CLASS A NPV,82509L107,1907000.0,1327,0.002662261226962907,2021-02-16,2020-12-31,0001567619-21-003755
MTG,MGIC INVESTMENT CORPORATION COMMON STOCK USD1,552848103,1906000.0,151908,0.002660865180173729,2021-02-16,2020-12-31,0001567619-21-003755
PVG1EUR,PRETIUM RESOURCES INCORPORATED COMMON NPV,74139C102,1902000.0,130365,0.0026552809930170157,2021-02-16,2020-12-31,0001567619-21-003755
GIB/A,CGI INC COM NPV SUBORD VOTING SHARES CLASS A,12532H104,1900000.0,18818,0.0026524888994386596,2021-02-16,2020-12-31,0001567619-21-003755
PTEN,PATTERSON-UTI ENERGY INCORPORATED COMMON STOCK USD0.01,703481101,1883000.0,358059,0.002628756104022629,2021-02-16,2020-12-31,0001567619-21-003755
ZTS,ZOETIS INCORPORATED COMMON STOCK USD0.01,98978V103,1882000.0,11373,0.002627360057233451,2021-02-16,2020-12-31,0001567619-21-003755
MMC,MARSH & MCLENNAN COS INC COMMON STOCK USD1,571748102,1882000.0,16083,0.002627360057233451,2021-02-16,2020-12-31,0001567619-21-003755
ACLS,AXCELIS TECHNOLOGIES INCORPORATED COMMON STOCK USD0.001,054540208,1881000.0,64585,0.0026259640104442728,2021-02-16,2020-12-31,0001567619-21-003755
JPM,JPMORGAN CHASE AND COMPANY COMMON STOCK USD1,46625H100,1874000.0,14751,0.002616191682920025,2021-02-16,2020-12-31,0001567619-21-003755
WSM,WILLIAMS-SONOMA INCORPORATED COMMON STOCK USD0.01,969904101,1872000.0,18377,0.0026133995893416685,2021-02-16,2020-12-31,0001567619-21-003755
AME,AMETEK INC COMMON STOCK USD0.01,031100100,1869000.0,15455,0.002609211448974134,2021-02-16,2020-12-31,0001567619-21-003755
ORCL,ORACLE CORPORATION COMMON STOCK USD0.01,68389X105,1868000.0,28882,0.0026078154021849554,2021-02-16,2020-12-31,0001567619-21-003755
SEDG,SOLAREDGE TECHNOLOGIES INCORPORATED COMMON STOCK USD0.0001,83417M104,1867000.0,5851,0.0026064193553957775,2021-02-16,2020-12-31,0001567619-21-003755
BDN,BRANDYWINE REALTY TRUST REIT USD0.01,105368203,1866000.0,156705,0.002605023308606599,2021-02-16,2020-12-31,0001567619-21-003755
SBAC,SBA COMMUNICATIONS CORPORATION REIT USD0.01,78410G104,1861000.0,6596,0.002598043074660708,2021-02-16,2020-12-31,0001567619-21-003755
K,KELLOGG COMPANY COMMON STOCK USD0.25,487836108,1860000.0,29891,0.00259664702787153,2021-02-16,2020-12-31,0001567619-21-003755
BSMXUSD,BANCO SANTANDER MEXICO SA ADR (EACH REPRESENTS 5 ORDINARY SERIES B),05969B103,1859000.0,360909,0.0025952509810823515,2021-02-16,2020-12-31,0001567619-21-003755
EQIX,EQUINIX INCORPORATED REIT USD0.001,29444U700,1855000.0,2597,0.0025896667939256384,2021-02-16,2020-12-31,0001567619-21-003755
MHO,M/I HOMES INCORPORATED COMMON STOCK USD0.01,55305B101,1844000.0,41627,0.002574310279244678,2021-02-16,2020-12-31,0001567619-21-003755
AIG,AMERICAN INTERNATIONAL GROUP INCORPORATED COMMON STOCK USD2.50,026874784,1838000.0,48560,0.002565933998509608,2021-02-16,2020-12-31,0001567619-21-003755
PFPT,PROOFPOINT INCORPORATED COMMON STOCK USD0.0001,743424103,1838000.0,13472,0.002565933998509608,2021-02-16,2020-12-31,0001567619-21-003755
RPM,RPM INTERNATIONAL INCORPORATED COMMON STOCK NPV,749685103,1834000.0,20202,0.0025603498113528954,2021-02-16,2020-12-31,0001567619-21-003755
GBTUSD,GLOBAL BLOOD THERAPEUTICS INC COMMON STOCK USD0.001,37890U108,1828000.0,42196,0.0025519735306178256,2021-02-16,2020-12-31,0001567619-21-003755
TER,TERADYNE INCORPORATE COMMON STOCK USD0.125,880770102,1825000.0,15220,0.002547785390250291,2021-02-16,2020-12-31,0001567619-21-003755
PRA,PROASSURANCE CORPORATION COMMON STOCK USD0.01,74267C106,1821000.0,102384,0.0025422012030935784,2021-02-16,2020-12-31,0001567619-21-003755
FTV,FORTIVE CORPORATION COMMON STOCK USD0.01,34959J108,1813000.0,25596,0.0025310328287801525,2021-02-16,2020-12-31,0001567619-21-003755
DXCM,DEXCOM INCORPORATED COMMON STOCK USD0.001,252131107,1813000.0,4905,0.0025310328287801525,2021-02-16,2020-12-31,0001567619-21-003755
SLP,SIMULATIONS PLUS INCORPORATED COMMON STOCK USD0.001,829214105,1807000.0,25121,0.0025226565480450827,2021-02-16,2020-12-31,0001567619-21-003755
VOYA,VOYA FINANCIAL INCORPORATED COMMON STOCK USD0.01,929089100,1802000.0,30634,0.0025156763140991916,2021-02-16,2020-12-31,0001567619-21-003755
PII,POLARIS INCORPORATED COMMON STOCK USD0.01,731068102,1800000.0,18896,0.002512884220520835,2021-02-16,2020-12-31,0001567619-21-003755
MTH,MERITAGE HOMES CORPORATION COMMON STOCK USD0.01,59001A102,1797000.0,21697,0.0025086960801533,2021-02-16,2020-12-31,0001567619-21-003755
FLIR,FLIR SYSTEMS INCORPORATED COMMON STOCK USD0.01,302445101,1795000.0,40949,0.002505903986574944,2021-02-16,2020-12-31,0001567619-21-003755
XECEUR,CIMAREX ENERGY COMPANY COMMON STOCK USD0.01,171798101,1793000.0,47795,0.002503111892996588,2021-02-16,2020-12-31,0001567619-21-003755
ABBV,ABBVIE INCORPORATED COMMON STOCK USD0.01,00287Y109,1792000.0,16726,0.002501715846207409,2021-02-16,2020-12-31,0001567619-21-003755
ZTO,ZTO EXPRESS CAYMAN INCORPORATED ADR (EACH REPRESENTING 1 SHARE),98980A105,1792000.0,61443,0.002501715846207409,2021-02-16,2020-12-31,0001567619-21-003755
LOW,LOWE'S COMPANIES INCORPORATED COMMON STOCK USD0.50,548661107,1790000.0,11154,0.002498923752629053,2021-02-16,2020-12-31,0001567619-21-003755
CAT,CATERPILLAR INCORPORATED COMMON STOCK USD1,149123101,1786000.0,9810,0.0024933395654723398,2021-02-16,2020-12-31,0001567619-21-003755
UBER,UBER TECHNOLOGIES INC (PROPOSED),90353T100,1779000.0,34874,0.002483567237948092,2021-02-16,2020-12-31,0001567619-21-003755
COP,CONOCOPHILLIPS INCORPORATED COMMON STOCK USD0.01,20825C104,1773000.0,44345,0.0024751909572130228,2021-02-16,2020-12-31,0001567619-21-003755
NMRK,NEWMARK GROUP INCORPORATED CLASS A COMMON STOCK USD0.01,65158N102,1770000.0,242738,0.002471002816845488,2021-02-16,2020-12-31,0001567619-21-003755
COF,CAPITAL ONE FINANCIAL CORPORATION COMMON STOCK USD0.01,14040H105,1767000.0,17873,0.002466814676477953,2021-02-16,2020-12-31,0001567619-21-003755
MDU,MDU RESOURCES GROUP INCORPORATED COMMON STOCK USD1,552690109,1763000.0,66919,0.0024612304893212402,2021-02-16,2020-12-31,0001567619-21-003755
N/A,LINDE PUBLIC LIMITED COMPANY EUR0.001,G5494J103,1753000.0,6651,0.0024472700214294577,2021-02-16,2020-12-31,0001567619-21-003755
SEE,SEALED AIR CORPORATION COMMON STOCK USD0.01,81211K100,1752000.0,38260,0.00244587397464028,2021-02-16,2020-12-31,0001567619-21-003755
IVV,ISHARES TRUST CORE SnP 500 ETF,464287200,1751000.0,4665,0.002444477927851101,2021-02-16,2020-12-31,0001567619-21-003755
WERN,WERNER ENTERPRISES INCORPORATED COMMON STOCK USD0.01,950755108,1750000.0,44625,0.0024430818810619232,2021-02-16,2020-12-31,0001567619-21-003755
QFIN,360 FINANCE INC -ADR 2 ORD,88557W101,1745000.0,148002,0.0024361016471160317,2021-02-16,2020-12-31,0001567619-21-003755
BMY,BRISTOL-MYERS SQUIBB COMPANY COMMON STOCK USD0.10,110122108,1742000.0,28090,0.0024319135067484973,2021-02-16,2020-12-31,0001567619-21-003755
XOM,EXXON MOBIL CORPORATION COMMON STOCK NPV,30231G102,1739000.0,42188,0.0024277253663809624,2021-02-16,2020-12-31,0001567619-21-003755
AAWWUSD,ATLAS AIR WORLDWIDE HOLDINGS INCORPORATED COMMON STOCK USD0.01,049164205,1737000.0,31843,0.0024249332728026062,2021-02-16,2020-12-31,0001567619-21-003755
TLT,ISHARES TRUST US TREASURY 20 YEAR BOND ETF,464287432,1735000.0,11000,0.002422141179224249,2021-02-16,2020-12-31,0001567619-21-003755
N/A,CANADIAN PACIFIC RAILWAY LTD,13645T100,1727000.0,3911,0.0024109728049108237,2021-02-16,2020-12-31,0001567619-21-003755
DKS,DICK'S SPORTING GOODS INCORPORATED COMMON STOCK USD0.001,253393102,1726000.0,30713,0.002409576758121645,2021-02-16,2020-12-31,0001567619-21-003755
TMHC,TAYLOR MORRISON HOME CORPORATION COMMON STOCK USD0.00001,87724P106,1721000.0,67113,0.002402596524175754,2021-02-16,2020-12-31,0001567619-21-003755
SJM,J.M. SMUCKER COMPANY (THE) COMMON STOCK USD0.001,832696405,1721000.0,14885,0.002402596524175754,2021-02-16,2020-12-31,0001567619-21-003755
VT,VANGUARD TOTAL WORLD STOCK ETF,922042742,1721000.0,18591,0.002402596524175754,2021-02-16,2020-12-31,0001567619-21-003755
TBBK,BANCORP INC/THE COMMON STOCK USD1,05969A105,1720000.0,125995,0.0024012004773865756,2021-02-16,2020-12-31,0001567619-21-003755
EPHE,ISHARES MSCI PHILIPPINES ETF,46429B408,1719000.0,52572,0.0023998044305973978,2021-02-16,2020-12-31,0001567619-21-003755
ROP,ROPER TECHNOLOGIES INCORPORATED COMMON STOCK USD0.01,776696106,1710000.0,3966,0.0023872400094947935,2021-02-16,2020-12-31,0001567619-21-003755
AYI,ACUITY BRANDS INCORPORATED COMMON STOCK USD0.01,00508Y102,1709000.0,14111,0.0023858439627056152,2021-02-16,2020-12-31,0001567619-21-003755
AWG,ASBURY AUTOMOTIVE GROUP INCORPORATED COMMON STOCK USD0.01,043436104,1708000.0,11722,0.002384447915916437,2021-02-16,2020-12-31,0001567619-21-003755
FL,FOOT LOCKER INCORPORATED COMMON STOCK USD0.01,344849104,1700000.0,42031,0.002373279541603011,2021-02-16,2020-12-31,0001567619-21-003755
JAZZ,JAZZ PHARMACEUTICALS PLC USD0.0001 (US LISTING),G50871105,1695000.0,10272,0.0023662993076571195,2021-02-16,2020-12-31,0001567619-21-003755
VMC,VULCAN MATERIALS CO COM STK US$1,929160109,1695000.0,11431,0.0023662993076571195,2021-02-16,2020-12-31,0001567619-21-003755
NGD,NEW GOLD INCORPORATED COMMON NPV,644535106,1693000.0,604523,0.0023635072140787633,2021-02-16,2020-12-31,0001567619-21-003755
LEA,LEAR CORP COMMON STOCK USD0.01,521865204,1692000.0,10642,0.002362111167289585,2021-02-16,2020-12-31,0001567619-21-003755
HCA,HCA HEALTHCARE INCORPORATED COMMON STOCK USD0.01,40412C101,1688000.0,10263,0.0023565269801328723,2021-02-16,2020-12-31,0001567619-21-003755
IP,INTERNATIONAL PAPER COMPANY COMMON STOCK USD1,460146103,1673000.0,33652,0.0023355862782951983,2021-02-16,2020-12-31,0001567619-21-003755
NOC,NORTHROP GRUMMAN CORPORATION COMMON STOCK USD1,666807102,1672000.0,5488,0.0023341902315060204,2021-02-16,2020-12-31,0001567619-21-003755
GPN,GLOBAL PAYMENTS INCORPORATED COMMON STOCK USD0.001,37940X102,1664000.0,7724,0.002323021857192594,2021-02-16,2020-12-31,0001567619-21-003755
TT,TRANE TECHNOLOGIES PLC USD1,G8994E103,1663000.0,11456,0.002321625810403416,2021-02-16,2020-12-31,0001567619-21-003755
VIPS,VIPSHOP HOLDINGS LIMITED SPONSORED ADR (EACH REPRESENTS 0.2 ORDINARY SHARES USD0.0001),92763W103,1656000.0,58926,0.0023118534828791685,2021-02-16,2020-12-31,0001567619-21-003755
QRVO,QORVO INCORPORATED COMMON STOCK  USD0.0001,74736K101,1655000.0,9955,0.0023104574360899898,2021-02-16,2020-12-31,0001567619-21-003755
MAS,MASCO CORPORATION COMMON STOCK USD1,574599106,1647000.0,29981,0.0022992890617765643,2021-02-16,2020-12-31,0001567619-21-003755
ITUB,ITAU UNIBANCO HOLDING SA ADR (EACH REPRESENTS 1 PREFERENCE SHARE),465562106,1646000.0,270238,0.002297893014987386,2021-02-16,2020-12-31,0001567619-21-003755
XLNXEUR,XILINX INCORPORATED COMMON STOCK USD0.01,983919101,1643000.0,11587,0.002293704874619851,2021-02-16,2020-12-31,0001567619-21-003755
TFC,TRUIST FINANCIAL CORPORATION USD5,89832Q109,1639000.0,34189,0.0022881206874631383,2021-02-16,2020-12-31,0001567619-21-003755
MRK,MERCK AND COMPANY INCORPORATED NEW COMMON STOCK USD0.01,58933Y105,1639000.0,20040,0.0022881206874631383,2021-02-16,2020-12-31,0001567619-21-003755
NAT,NORDIC AMERICAN TANKERS LIMITED COMMON STOCK USD0.01,G65773106,1637000.0,554923,0.0022853285938847817,2021-02-16,2020-12-31,0001567619-21-003755
CHE,CHEMED CORPORATION COMMON STOCK USD1,16359R103,1633000.0,3066,0.002279744406728069,2021-02-16,2020-12-31,0001567619-21-003755
SYY,SYSCO CORPORATION COMMON STOCK USD1,871829107,1632000.0,21983,0.0022783483599388907,2021-02-16,2020-12-31,0001567619-21-003755
CVX,CHEVRON CORPORATION COMMON STOCK USD0.75,166764100,1631000.0,19310,0.0022769523131497124,2021-02-16,2020-12-31,0001567619-21-003755
CI,CIGNA CORP COMMON STOCK USD0.010000,125523100,1626000.0,7812,0.0022699720792038213,2021-02-16,2020-12-31,0001567619-21-003755
ARCB,ARCBEST CORPORATION COMMON STOCK USD0.01,03937C105,1611000.0,37751,0.0022490313773661477,2021-02-16,2020-12-31,0001567619-21-003755
CARR,CARRIER GLOBAL CORP-WI USD0.010000,14448C104,1609000.0,42659,0.0022462392837877907,2021-02-16,2020-12-31,0001567619-21-003755
VMBS,VANGUARD MORTGAGE-BACKED SECURITIES ETF,92206C771,1601000.0,29609,0.002235070909474365,2021-02-16,2020-12-31,0001567619-21-003755
UTHR,UNITED THERAPEUTICS CORPORATION COMMON STOCK USD0.01,91307C102,1599000.0,10535,0.0022322788158960086,2021-02-16,2020-12-31,0001567619-21-003755
KRC,KILROY REALTY CORPORATION REIT USD0.01,49427F108,1595000.0,27792,0.002226694628739296,2021-02-16,2020-12-31,0001567619-21-003755
EOG,EOG RESOURCES INCORPORATED COMMON STOCK USD0.01,26875P101,1592000.0,31930,0.002222506488371761,2021-02-16,2020-12-31,0001567619-21-003755
ESNT,ESSENT GROUP LIMITED USD0.015,G3198U102,1591000.0,36830,0.0022211104415825827,2021-02-16,2020-12-31,0001567619-21-003755
N/A,DOUYU INTERNATIONAL HOLD-ADR .1 ORD,25985W105,1591000.0,143890,0.0022211104415825827,2021-02-16,2020-12-31,0001567619-21-003755
FIVN,FIVE9 INCORPORATED COMMON STOCK USD0.001,338307101,1584000.0,9082,0.002211338114058335,2021-02-16,2020-12-31,0001567619-21-003755
BXMT,BLACKSTONE MORTGAGE TRUST INCORPORATED REIT CLASS A USD0.01,09257W100,1578000.0,57314,0.0022029618333232652,2021-02-16,2020-12-31,0001567619-21-003755
NAT,NORDIC AMERICAN TANKERS LIMITED COMMON STOCK USD0.01,G65773106,1575000.0,533770,0.0021987736929557308,2021-02-16,2020-12-31,0001567619-21-003755
GIS,GENERAL MILLS INC COMMON STOCK USD0.10,370334104,1573000.0,26754,0.002195981599377374,2021-02-16,2020-12-31,0001567619-21-003755
VWO,VANGUARD FTSE EMERGING MARKETS ETF,922042858,1569000.0,31302,0.0021903974122206614,2021-02-16,2020-12-31,0001567619-21-003755
BR,BROADRIDGE FINANCIAL SOLUTIONS INCORPORATED COMMON STOCK USD0.01,11133T103,1567000.0,10230,0.002187605318642305,2021-02-16,2020-12-31,0001567619-21-003755
AAPL,APPLE INCORPORATED COMMON STOCK NPV,037833100,1567000.0,11807,0.002187605318642305,2021-02-16,2020-12-31,0001567619-21-003755
AVB,AVALONBAY COMMUNITIES INCORPORATED REIT USD0.01,053484101,1565000.0,9753,0.0021848132250639482,2021-02-16,2020-12-31,0001567619-21-003755
HLF,HERBALIFE NUTRITION LIMITED USD0.002,G4412G101,1560000.0,32458,0.002177832991118057,2021-02-16,2020-12-31,0001567619-21-003755
N/A,TRONOX HOLDINGS PLC-CLASS A,G9087Q102,1559000.0,106613,0.002176436944328879,2021-02-16,2020-12-31,0001567619-21-003755
APAM,ARTISAN PARTNERS ASSET MA -A COMMON STOCK USD0.01,04316A108,1554000.0,30862,0.002169456710382988,2021-02-16,2020-12-31,0001567619-21-003755
ZBH,ZIMMER BIOMET HOLDINGS INCORPORATED COMMON STOCK USD0.01,98956P102,1550000.0,10058,0.0021638725232262747,2021-02-16,2020-12-31,0001567619-21-003755
CTRA,CABOT OIL & GAS CORPORATION COMMON STOCK USD0.10,127097103,1546000.0,94939,0.002158288336069562,2021-02-16,2020-12-31,0001567619-21-003755
SAH,SONIC AUTOMOTIVE INCORPORATED CLASS 'A' COMMON STOCK USD0.01,83545G102,1537000.0,39859,0.0021457239149669577,2021-02-16,2020-12-31,0001567619-21-003755
GIS,GENERAL MILLS INC COMMON STOCK USD0.10,370334104,1535000.0,26100,0.002142931821388601,2021-02-16,2020-12-31,0001567619-21-003755
