ticker,nameOfIssuer,cusip,value,shares,allocation_percent,filingDate,reportDate,accessionNumber
SYY,SYSCO CORPORATION COMMON STOCK USD1,871829107,431000.0,5804,0.0006016961661358222,2021-02-16,2020-12-31,0001567619-21-003755
AEO,AMERICAN EAGLE OUTFITTERS INCORPORATED COMMON STOCK USD0.01,02553E106,430000.0,21422,0.0006003001193466439,2021-02-16,2020-12-31,0001567619-21-003755
NOC,NORTHROP GRUMMAN CORPORATION COMMON STOCK USD1,666807102,429000.0,1408,0.0005989040725574657,2021-02-16,2020-12-31,0001567619-21-003755
SAH,SONIC AUTOMOTIVE INCORPORATED CLASS 'A' COMMON STOCK USD0.01,83545G102,429000.0,11130,0.0005989040725574657,2021-02-16,2020-12-31,0001567619-21-003755
VPL,VANGUARD FTSE PACIFIC ETF,922042866,429000.0,5390,0.0005989040725574657,2021-02-16,2020-12-31,0001567619-21-003755
TWLO,TWILIO INCORPORATED A COMMON STOCK USD0.001,90138F102,429000.0,1266,0.0005989040725574657,2021-02-16,2020-12-31,0001567619-21-003755
AAL,AMERICAN AIRLINES GROUP INCORPORATED COMMON STOCK USD1,02376R102,428000.0,27136,0.0005975080257682875,2021-02-16,2020-12-31,0001567619-21-003755
TDG,TRANSDIGM GROUP INCORPORATED COMMON STOCK USD0.01,893641100,426000.0,688,0.0005947159321899309,2021-02-16,2020-12-31,0001567619-21-003755
HEI,HEICO CORPORATION COMMON STOCK USD0.01,422806109,426000.0,3214,0.0005947159321899309,2021-02-16,2020-12-31,0001567619-21-003755
GMS,GMS INCORPORATED COMMON STOCK USD0.01,36251C103,426000.0,13960,0.0005947159321899309,2021-02-16,2020-12-31,0001567619-21-003755
FWONKUSD,LIBERTY MEDIA GROUP-C NPV,531229854,424000.0,9944,0.0005919238386115746,2021-02-16,2020-12-31,0001567619-21-003755
SPOT,SPOTIFY TECHNOLOGY SA COMMON STOCK EUR0.000625,L8681T102,423000.0,1343,0.0005905277918223963,2021-02-16,2020-12-31,0001567619-21-003755
V,VISA INCORPORATED CLASS A COMMON STOCK USD0.0001,92826C839,423000.0,1935,0.0005905277918223963,2021-02-16,2020-12-31,0001567619-21-003755
NMIH,NMI HOLDINGS INC-CLASS A COMMON STOCK USD0.01,629209305,423000.0,18654,0.0005905277918223963,2021-02-16,2020-12-31,0001567619-21-003755
N/A,LINDE PUBLIC LIMITED COMPANY EUR0.001,G5494J103,422000.0,1600,0.0005891317450332181,2021-02-16,2020-12-31,0001567619-21-003755
FSLR,FIRST SOLAR INCORPORATED COMMON STOCK USD0.001,336433107,422000.0,4264,0.0005891317450332181,2021-02-16,2020-12-31,0001567619-21-003755
TSM,TAIWAN SEMICONDUCTOR MANUFACTURING COMPANY LIMITED ADS REPRESENTING 5 COMMON SHARES,874039100,422000.0,3869,0.0005891317450332181,2021-02-16,2020-12-31,0001567619-21-003755
IRWD,IRONWOOD PHARMACEUTICALS INCORPORATED CLASS A COMMON STOCK USD0.001,46333X108,422000.0,37083,0.0005891317450332181,2021-02-16,2020-12-31,0001567619-21-003755
QSR,RESTAURANT BRANDS INTERNATIONAL INCORPORATED COMMON NPV,76131D103,421000.0,5415,0.0005877356982440398,2021-02-16,2020-12-31,0001567619-21-003755
NSY,NICE SYSTEMS LTD-SPONS ADR,653656108,415000.0,1462,0.0005793594175089703,2021-02-16,2020-12-31,0001567619-21-003755
JNP,JUNIPER NETWORKS INCORPORATED COMMON STOCK USD0.00001,48203R104,413000.0,18336,0.0005765673239306138,2021-02-16,2020-12-31,0001567619-21-003755
BBY,BEST BUY COMPANY INCORPORATED COMMON STOCK USD0.10,086516101,413000.0,4141,0.0005765673239306138,2021-02-16,2020-12-31,0001567619-21-003755
VRSK,VERISK ANALYTICS INC COMMON STOCK USD0.001,92345Y106,412000.0,1987,0.0005751712771414356,2021-02-16,2020-12-31,0001567619-21-003755
LSTR,LANDSTAR COMMON STOCK NPV,515098101,408000.0,3029,0.0005695870899847227,2021-02-16,2020-12-31,0001567619-21-003755
EFX,EQUIFAX INC COMMON STOCK USD2.50,294429105,408000.0,2114,0.0005695870899847227,2021-02-16,2020-12-31,0001567619-21-003755
LNN,LINDSAY CORPORATION COMMON STOCK USD1,535555106,406000.0,3160,0.0005667949964063661,2021-02-16,2020-12-31,0001567619-21-003755
GGB,GERDAU SA ADR (EACH REPRESENTS 1 PREFERENCE NPV),373737105,406000.0,86915,0.0005667949964063661,2021-02-16,2020-12-31,0001567619-21-003755
EWC,ISHARES INCORPORATED MSCI CANADA ETF,464286509,405000.0,13131,0.000565398949617188,2021-02-16,2020-12-31,0001567619-21-003755
PYPL,PAYPAL HOLDINGS INCORPORATED COMMON STOCK USD0.0001,70450Y103,404000.0,1725,0.0005640029028280097,2021-02-16,2020-12-31,0001567619-21-003755
SSNC,SS&C TECHNOLOGIES HOLDINGS INCORPORATED COMMON STOCK USD0.01,78467J100,403000.0,5535,0.0005626068560388314,2021-02-16,2020-12-31,0001567619-21-003755
ODP,ODP CORP/THE,88337F105,403000.0,13764,0.0005626068560388314,2021-02-16,2020-12-31,0001567619-21-003755
WCN,WASTE CONNECTIONS INCORPORATED NPV,94106B101,403000.0,3925,0.0005626068560388314,2021-02-16,2020-12-31,0001567619-21-003755
AJG,GALLAGHER (ARTHUR J.) & COMPANY COMMON STOCK USD1,363576109,402000.0,3253,0.0005612108092496532,2021-02-16,2020-12-31,0001567619-21-003755
COOP,MR COOPER GROUP INCORPORATED COMMON STOCK USD0.01,62482R107,401000.0,12933,0.0005598147624604749,2021-02-16,2020-12-31,0001567619-21-003755
ZG,ZILLOW GROUP INC - A,98954M101,401000.0,2948,0.0005598147624604749,2021-02-16,2020-12-31,0001567619-21-003755
MXL,MAXLINEAR INC-CLASS A COMMON STOCK NPV,57776J100,399000.0,10444,0.0005570226688821184,2021-02-16,2020-12-31,0001567619-21-003755
CERNCHF,CERNER CORPORATION COMMON STOCK USD0.01,156782104,398000.0,5072,0.0005556266220929402,2021-02-16,2020-12-31,0001567619-21-003755
VFC,VF CORPORATION COMMON STOCK USD1,918204108,396000.0,4632,0.0005528345285145838,2021-02-16,2020-12-31,0001567619-21-003755
CDE,COEUR MINING INCORPORATED COMMON STOCK USD1,192108504,396000.0,38235,0.0005528345285145838,2021-02-16,2020-12-31,0001567619-21-003755
CRMT,AMERICA'S CAR-MART INC,03062T105,396000.0,3608,0.0005528345285145838,2021-02-16,2020-12-31,0001567619-21-003755
NFLX,NETFLIX INCORPORATED COMMON STOCK USD0.001,64110L106,395000.0,730,0.0005514384817254056,2021-02-16,2020-12-31,0001567619-21-003755
BDSIUSD,BIODELIVERY SCIENCES INTL COMMON STOCK USD0.001,09060J106,392000.0,93435,0.0005472503413578708,2021-02-16,2020-12-31,0001567619-21-003755
CTXSEUR,CITRIX SYSTEMS INCORPORATED COMMON STOCK USD0.001,177376100,391000.0,3004,0.0005458542945686926,2021-02-16,2020-12-31,0001567619-21-003755
W,WAYFAIR INC- CLASS A,94419L101,390000.0,1725,0.0005444582477795143,2021-02-16,2020-12-31,0001567619-21-003755
CBRE,CBRE GROUP INCORPORATED CLASS A COMMON STOCK USD0.01,12504L109,390000.0,6215,0.0005444582477795143,2021-02-16,2020-12-31,0001567619-21-003755
APPS,DIGITAL TURBINE INC COMMON STOCK USD0.0001,25400W102,389000.0,6872,0.000543062200990336,2021-02-16,2020-12-31,0001567619-21-003755
GBX,GREENBRIER COMPANIES INCORPORATED COMMON STOCK NPV,393657101,388000.0,10654,0.0005416661542011578,2021-02-16,2020-12-31,0001567619-21-003755
HOME,AT HOME GROUP INC,04650Y100,386000.0,24981,0.0005388740606228013,2021-02-16,2020-12-31,0001567619-21-003755
SM,SM ENERGY COMPANY COMMON STOCK USD0.01,78454L100,386000.0,63033,0.0005388740606228013,2021-02-16,2020-12-31,0001567619-21-003755
KMI,KINDER MORGAN INCORPORATED COMMON STOCK USD0.01,49456B101,385000.0,28188,0.0005374780138336231,2021-02-16,2020-12-31,0001567619-21-003755
SBAC,SBA COMMUNICATIONS CORPORATION REIT USD0.01,78410G104,385000.0,1365,0.0005374780138336231,2021-02-16,2020-12-31,0001567619-21-003755
BLKCHF,BLACKROCK INCORPORATED COMMON STOCK USD0.01,09247X101,385000.0,533,0.0005374780138336231,2021-02-16,2020-12-31,0001567619-21-003755
IQV,IQVIA HOLDINGS INCORPORATED COMMON STOCK USD0.01,46266C105,384000.0,2144,0.0005360819670444448,2021-02-16,2020-12-31,0001567619-21-003755
RNG,RINGCENTRAL INC-CLASS A COMMON STOCK USD0.0001,76680R206,384000.0,1012,0.0005360819670444448,2021-02-16,2020-12-31,0001567619-21-003755
GEF,GREIF INCORPORATED CLASS 'A' COMMON STOCK NPV,397624107,380000.0,8112,0.0005304977798877319,2021-02-16,2020-12-31,0001567619-21-003755
CNC,CENTENE CORPORATION COMMON STOCK USD0.001,15135B101,380000.0,6327,0.0005304977798877319,2021-02-16,2020-12-31,0001567619-21-003755
DNOW,NOW INCORPORATED COMMON STOCK USD0.01,67011P100,380000.0,52978,0.0005304977798877319,2021-02-16,2020-12-31,0001567619-21-003755
EZU,ISHARES TRUST MSCI EUROZONE ETF,464286608,379000.0,8595,0.0005291017330985536,2021-02-16,2020-12-31,0001567619-21-003755
HASI,HANNON ARMSTRONG SUSTAINABLE REIT USD0.01,41068X100,378000.0,5966,0.0005277056863093754,2021-02-16,2020-12-31,0001567619-21-003755
TSLA,TESLA INCORPORATED COMMON STOCK USD0.001,88160R101,378000.0,536,0.0005277056863093754,2021-02-16,2020-12-31,0001567619-21-003755
N/A,LABORATORY CORPORATION OF AMERICA HOLDINGS COMMON STOCK USD0.01,50540R409,377000.0,1853,0.0005263096395201972,2021-02-16,2020-12-31,0001567619-21-003755
DLR,DIGITAL REALTY TRUST INCORPORATED REIT USD0.01,253868103,375000.0,2688,0.0005235175459418407,2021-02-16,2020-12-31,0001567619-21-003755
TTWO,TAKE-TWO INTERACTIVE SOFTWARE INCORPORATED COMMON STOCK USD0.01,874054109,375000.0,1804,0.0005235175459418407,2021-02-16,2020-12-31,0001567619-21-003755
IBM,INTL BUSINESS MACHINES CORPORATION COMMON STOCK USD0.20,459200101,375000.0,2980,0.0005235175459418407,2021-02-16,2020-12-31,0001567619-21-003755
NIU,NIU TECHNOLOGIES-SPONS ADR 2 ORD,65481N100,374000.0,13335,0.0005221214991526624,2021-02-16,2020-12-31,0001567619-21-003755
AES,AES CORPORATION COMMON STOCK USD0.01,00130H105,373000.0,15874,0.0005207254523634841,2021-02-16,2020-12-31,0001567619-21-003755
INSGEUR,INSEEGO CORPORATION COMMON STOCK NPV,45782B104,373000.0,24085,0.0005207254523634841,2021-02-16,2020-12-31,0001567619-21-003755
N/A,TRONOX HOLDINGS PLC-CLASS A,G9087Q102,371000.0,25377,0.0005179333587851277,2021-02-16,2020-12-31,0001567619-21-003755
COHU,COHU INC COMMON STOCK USD1,192576106,370000.0,9697,0.0005165373119959494,2021-02-16,2020-12-31,0001567619-21-003755
PS1,COMPUTER PROGRAM SYSTEMS,205306103,369000.0,13732,0.0005151412652067711,2021-02-16,2020-12-31,0001567619-21-003755
PM,PHILIP MORRIS INTERNATIONAL INCORPORATED COMMON STOCK NPV,718172109,368000.0,4442,0.000513745218417593,2021-02-16,2020-12-31,0001567619-21-003755
CXOEUR,CONCHO RESOURCES INCORPORATED COMMON STOCK USD0.001,20605P101,367000.0,6293,0.0005123491716284148,2021-02-16,2020-12-31,0001567619-21-003755
TPC,TUTOR PERINI CORPORATION COMMON STOCK USD1,901109108,367000.0,28320,0.0005123491716284148,2021-02-16,2020-12-31,0001567619-21-003755
IVZ,INVESCO LIMITED ORDINARY USD0.10,G491BT108,366000.0,21014,0.0005109531248392365,2021-02-16,2020-12-31,0001567619-21-003755
TRMB,TRIMBLE INCORPORATED COMMON STOCK NPV,896239100,364000.0,5445,0.00050816103126088,2021-02-16,2020-12-31,0001567619-21-003755
MGRC,MCGRATH RENTCORP COMMON STOCK NPV,580589109,364000.0,5426,0.00050816103126088,2021-02-16,2020-12-31,0001567619-21-003755
TRI4EUR,THOMSON REUTERS CORP,884903709,363000.0,3489,0.0005067649844717018,2021-02-16,2020-12-31,0001567619-21-003755
CTVA,CORTEVA INC-W/I USD0.010000,22052L104,361000.0,9323,0.0005039728908933453,2021-02-16,2020-12-31,0001567619-21-003755
TIFEUR,TIFFANY & COMPANY COMMON STOCK USD0.01,886547108,360000.0,2735,0.000502576844104167,2021-02-16,2020-12-31,0001567619-21-003755
BMY,BRISTOL-MYERS SQUIBB COMPANY COMMON STOCK USD0.10,110122108,358000.0,5775,0.0004997847505258106,2021-02-16,2020-12-31,0001567619-21-003755
ADT,ADT INCORPORATED COMMON STOCK USD0.01,00090Q103,357000.0,45460,0.0004983887037366323,2021-02-16,2020-12-31,0001567619-21-003755
NOAH,NOAH HOLDINGS LIMITED ADR (2 REPRESENTS 1 ORDINARY SHARE),65487X102,357000.0,7461,0.0004983887037366323,2021-02-16,2020-12-31,0001567619-21-003755
RIO,RIO TINTO PLC SPONSORED ADR (EACH REPRESENTS 1 ORDINARY SHARE) (BNY),767204100,357000.0,4750,0.0004983887037366323,2021-02-16,2020-12-31,0001567619-21-003755
ARCB,ARCBEST CORPORATION COMMON STOCK USD0.01,03937C105,355000.0,8317,0.0004955966101582758,2021-02-16,2020-12-31,0001567619-21-003755
LVS,LAS VEGAS SANDS CORPORATION COMMON STOCK USD0.001,517834107,355000.0,5951,0.0004955966101582758,2021-02-16,2020-12-31,0001567619-21-003755
FNV,FRANCO-NEVADA CORPORATION COMMON NPV,351858105,353000.0,2209,0.0004928045165799194,2021-02-16,2020-12-31,0001567619-21-003755
MA,MASTERCARD INCORPORATED CLASS A COMMON STOCK USD0.0001,57636Q104,353000.0,988,0.0004928045165799194,2021-02-16,2020-12-31,0001567619-21-003755
XYL,XYLEM INCORPORATED COMMON STOCK NPV,98419M100,351000.0,3445,0.0004900124230015629,2021-02-16,2020-12-31,0001567619-21-003755
SHW,SHERWIN-WILLIAMS COMPANY (THE) COMMON STOCK USD1,824348106,351000.0,477,0.0004900124230015629,2021-02-16,2020-12-31,0001567619-21-003755
NVDA,NVIDIA CORPORATION COMMON STOCK USD0.001,67066G104,349000.0,669,0.0004872203294232064,2021-02-16,2020-12-31,0001567619-21-003755
TRU,TRANSUNION COMMON STOCK USD0.01,89400J107,349000.0,3514,0.0004872203294232064,2021-02-16,2020-12-31,0001567619-21-003755
TSN,TYSON FOODS INCORPORATED CLASS A COMMON STOCK USD0.10,902494103,348000.0,5408,0.00048582428263402815,2021-02-16,2020-12-31,0001567619-21-003755
STNG,SCORPIO TANKERS INC COMMON STOCK USD0.010000,Y7542C130,348000.0,31135,0.00048582428263402815,2021-02-16,2020-12-31,0001567619-21-003755
BRK/A,BERKSHIRE HATHAWAY INCORPORATED CONVERTIBLE CLASS 'A' COMMON STOCK USD5,084670108,348000.0,1,0.00048582428263402815,2021-02-16,2020-12-31,0001567619-21-003755
TBBK,BANCORP INC/THE COMMON STOCK USD1,05969A105,348000.0,25527,0.00048582428263402815,2021-02-16,2020-12-31,0001567619-21-003755
LPX,LOUISIANA-PACIFIC CORP COMMON STOCK USD1,546347105,347000.0,9329,0.0004844282358448499,2021-02-16,2020-12-31,0001567619-21-003755
ISBCUSD,INVESTORS BANCORP INC COMMON STOCK USD0.01,46146L101,346000.0,32750,0.0004830321890556716,2021-02-16,2020-12-31,0001567619-21-003755
EBS,EMERGENT BIOSOLUTIONS INCORPORATED COMMON STOCK USD0.001,29089Q105,346000.0,3865,0.0004830321890556716,2021-02-16,2020-12-31,0001567619-21-003755
BALL,BALL CORPORATION COMMON STOCK NPV,058498106,346000.0,3713,0.0004830321890556716,2021-02-16,2020-12-31,0001567619-21-003755
CTRA,CABOT OIL & GAS CORPORATION COMMON STOCK USD0.10,127097103,345000.0,21163,0.00048163614226649337,2021-02-16,2020-12-31,0001567619-21-003755
MOG/A,MOOG INCORPORATED CLASS 'A' (LIMITED VOTING) COMMON STOCK USD1,615394202,345000.0,4349,0.00048163614226649337,2021-02-16,2020-12-31,0001567619-21-003755
ORLY,O'REILLY AUTOMOTIVE INCORPORATED COMMON STOCK USD0.01,67103H107,345000.0,762,0.00048163614226649337,2021-02-16,2020-12-31,0001567619-21-003755
PEB,PEBBLEBROOK HOTEL TRUST REIT USD0.01,70509V100,344000.0,18290,0.0004802400954773152,2021-02-16,2020-12-31,0001567619-21-003755
IVZ,INVESCO LIMITED ORDINARY USD0.10,G491BT108,344000.0,19750,0.0004802400954773152,2021-02-16,2020-12-31,0001567619-21-003755
PAYC,PAYCOM SOFTWARE INC COMMON STOCK USD0.01,70432V102,344000.0,760,0.0004802400954773152,2021-02-16,2020-12-31,0001567619-21-003755
ONTO,ONTO INNOVATION INCORPORATED NPV,683344105,341000.0,7175,0.00047605195510978045,2021-02-16,2020-12-31,0001567619-21-003755
IXN,ISHARES GLOBAL TECH ETF,464287291,341000.0,1135,0.00047605195510978045,2021-02-16,2020-12-31,0001567619-21-003755
SPLKCHF,SPLUNK INC COMMON STOCK USD0.01,848637104,340000.0,2003,0.00047465590832060215,2021-02-16,2020-12-31,0001567619-21-003755
N/A,LIBERTY GLOBAL PLC CLASS A COMMON STOCK USD0.01,G5480U104,340000.0,14031,0.00047465590832060215,2021-02-16,2020-12-31,0001567619-21-003755
SLB,SCHLUMBERGER LIMITED COMMON STOCK USD0.01,806857108,339000.0,15525,0.00047325986153142396,2021-02-16,2020-12-31,0001567619-21-003755
RCI,ROGERS COMMUNICATIONS INCORPORATED COMMON STOCK CLASS 'B' NPV,775109200,338000.0,5703,0.0004718638147422457,2021-02-16,2020-12-31,0001567619-21-003755
LBEUR,L BRANDS INCORPORATED COMMON STOCK USD0.50,501797104,338000.0,9101,0.0004718638147422457,2021-02-16,2020-12-31,0001567619-21-003755
RF,REGIONS FINANCIAL CORPORATION COMMON STOCK USD0.01,7591EP100,335000.0,20781,0.00046767567437471105,2021-02-16,2020-12-31,0001567619-21-003755
IXN,ISHARES GLOBAL TECH ETF,464287291,335000.0,1115,0.00046767567437471105,2021-02-16,2020-12-31,0001567619-21-003755
UNFI,UNITED NATURAL FOODS INCORPORATED COMMON STOCK USD0.01,911163103,332000.0,20788,0.00046348753400717626,2021-02-16,2020-12-31,0001567619-21-003755
IJR,ISHARES TRUST CORE S&P SMALL-CAP ETF,464287804,331000.0,3600,0.000462091487217998,2021-02-16,2020-12-31,0001567619-21-003755
AEIS,ADVANCED ENERGY INDUSTRIES INCORPORATED COMMON STOCK USD0.001,007973100,331000.0,3412,0.000462091487217998,2021-02-16,2020-12-31,0001567619-21-003755
ACWI,ISHARES MSCI ACWI ETF,464288257,330000.0,3641,0.00046069544042881983,2021-02-16,2020-12-31,0001567619-21-003755
TXN,TEXAS INSTRUMENTS INCORPORATED COMMON STOCK USD1,882508104,329000.0,2006,0.00045929939363964153,2021-02-16,2020-12-31,0001567619-21-003755
KHC,KRAFT HEINZ COMPANY (THE) COMMON STOCK USD0.01,500754106,327000.0,9427,0.00045650730006128505,2021-02-16,2020-12-31,0001567619-21-003755
BX,BLACKSTONE GROUP INC/THE NPV,09260D107,324000.0,5000,0.0004523191596937503,2021-02-16,2020-12-31,0001567619-21-003755
FANG,DIAMONDBACK ENERGY INCORPORATED COMMON STOCK USD0.01,25278X109,324000.0,6695,0.0004523191596937503,2021-02-16,2020-12-31,0001567619-21-003755
ANAT1USD,AMERICAN NATIONAL GROUP INC USD0.010000,02772A109,323000.0,3364,0.0004509231129045721,2021-02-16,2020-12-31,0001567619-21-003755
VTR,VENTAS INCORPORATED REIT USD0.25,92276F100,322000.0,6559,0.00044952706611539383,2021-02-16,2020-12-31,0001567619-21-003755
CGNX,COGNEX CORPORATION COMMON STOCK USD0.002,192422103,321000.0,4000,0.00044813101932621565,2021-02-16,2020-12-31,0001567619-21-003755
AMAT,APPLIED MATERIALS INCORPORATED COMMON STOCK USD0.01,038222105,319000.0,3700,0.0004453389257478591,2021-02-16,2020-12-31,0001567619-21-003755
GLUU,GLU MOBILE INC COMMON STOCK USD0.0001,379890106,318000.0,35325,0.00044394287895868086,2021-02-16,2020-12-31,0001567619-21-003755
N/A,WATFORD HOLDINGS LTD USD0.010000,G94787101,318000.0,9185,0.00044394287895868086,2021-02-16,2020-12-31,0001567619-21-003755
CUBI,CUSTOMERS BANCORP INCORPORATED COMMON STOCK USD1,23204G100,318000.0,17485,0.00044394287895868086,2021-02-16,2020-12-31,0001567619-21-003755
WRKUSD,WESTROCK COMPANY COMMON STOCK USD0.01,96145D105,315000.0,7239,0.0004397547385911462,2021-02-16,2020-12-31,0001567619-21-003755
JKHY,JACK HENRY AND ASSOCIATE INCORPORATED COMMON STOCK USD0.01,426281101,315000.0,1942,0.0004397547385911462,2021-02-16,2020-12-31,0001567619-21-003755
PBA,PEMBINA PIPELINE CORPORATION COMMON NPV,706327103,315000.0,10476,0.0004397547385911462,2021-02-16,2020-12-31,0001567619-21-003755
NTRS,NORTHERN TRUST CORP COM STK USD1.666,665859104,315000.0,3380,0.0004397547385911462,2021-02-16,2020-12-31,0001567619-21-003755
DLTR,DOLLAR TREE INCORPORATED COMMON STOCK USD0.01,256746108,315000.0,2913,0.0004397547385911462,2021-02-16,2020-12-31,0001567619-21-003755
SHOP,SHOPIFY INC - CLASS A,82509L107,314000.0,277,0.0004383586918019679,2021-02-16,2020-12-31,0001567619-21-003755
L,LOEWS CORPORATION COMMON STOCK USD0.01,540424108,314000.0,6970,0.0004383586918019679,2021-02-16,2020-12-31,0001567619-21-003755
DAN,DANA INC COMMON STOCK USD0.01,235825205,313000.0,16016,0.00043696264501278965,2021-02-16,2020-12-31,0001567619-21-003755
TMO,THERMO FISHER SCIENTIFIC INCORPORATED COMMON STOCK USD1,883556102,312000.0,669,0.0004355665982236114,2021-02-16,2020-12-31,0001567619-21-003755
DEO,DIAGEO PLC SPONSORED ADR (EACH REPRESENTING 4 ORDINARY GBP0.28),25243Q205,311000.0,1958,0.0004341705514344332,2021-02-16,2020-12-31,0001567619-21-003755
ARCT,ARCTURUS THERAPEUTICS HOLDIN USD0.001000,03969T109,310000.0,7152,0.000432774504645255,2021-02-16,2020-12-31,0001567619-21-003755
AMGN,AMGEN INCORPORATED COMMON STOCK USD0.0001,031162100,310000.0,1348,0.000432774504645255,2021-02-16,2020-12-31,0001567619-21-003755
MTD,METTLER-TOLEDO INTERNATIONAL COMMON STOCK USD0.01,592688105,308000.0,270,0.00042998241106689843,2021-02-16,2020-12-31,0001567619-21-003755
EZU,ISHARES TRUST MSCI EUROZONE ETF,464286608,308000.0,6990,0.00042998241106689843,2021-02-16,2020-12-31,0001567619-21-003755
TREX,TREX COMPANY INC COMMON STOCK USD0.01,89531P105,308000.0,3678,0.00042998241106689843,2021-02-16,2020-12-31,0001567619-21-003755
SRPT,SAREPTA THERAPEUTICS INC COMMON STOCK USD0.0001,803607100,308000.0,1807,0.00042998241106689843,2021-02-16,2020-12-31,0001567619-21-003755
ANAT1USD,AMERICAN NATIONAL GROUP INC USD0.010000,02772A109,307000.0,3192,0.0004285863642777202,2021-02-16,2020-12-31,0001567619-21-003755
JEF,JEFFERIES FINANCIAL GROUP INCORPORATED COMMON STOCK USD1,47233W109,307000.0,12496,0.0004285863642777202,2021-02-16,2020-12-31,0001567619-21-003755
AG8,AGILENT TECHNOLOGIES INC,00846U101,306000.0,2580,0.000427190317488542,2021-02-16,2020-12-31,0001567619-21-003755
COP,CONOCOPHILLIPS INCORPORATED COMMON STOCK USD0.01,20825C104,305000.0,7624,0.00042579427069936376,2021-02-16,2020-12-31,0001567619-21-003755
XLE,ENERGY SELECT SECTOR SPDR ETF,81369Y506,305000.0,8041,0.00042579427069936376,2021-02-16,2020-12-31,0001567619-21-003755
PE1EUR,PARSLEY ENERGY INC-CLASS A COMMON STOCK USD0.01,701877102,304000.0,21394,0.00042439822391018546,2021-02-16,2020-12-31,0001567619-21-003755
EXAS,EXACT SCIENCES CORP COMMON USD0.010000,30063P105,304000.0,2296,0.00042439822391018546,2021-02-16,2020-12-31,0001567619-21-003755
PYPL,PAYPAL HOLDINGS INCORPORATED COMMON STOCK USD0.0001,70450Y103,303000.0,1293,0.0004230021771210072,2021-02-16,2020-12-31,0001567619-21-003755
EXPI,EXP WORLD HOLDINGS INC USD0.000010,30212W100,303000.0,4796,0.0004230021771210072,2021-02-16,2020-12-31,0001567619-21-003755
TDY,TELEDYNE TECHNOLOGIES INCORPORATED COMMON STOCK USD0.01,879360105,303000.0,772,0.0004230021771210072,2021-02-16,2020-12-31,0001567619-21-003755
AZO,AUTOZONE INCORPORATED COMMON STOCK USD0.01,053332102,302000.0,255,0.00042160613033182903,2021-02-16,2020-12-31,0001567619-21-003755
DAL,DELTA AIR LINES INCORPORATED COMMON STOCK USD0.0001,247361702,302000.0,7500,0.00042160613033182903,2021-02-16,2020-12-31,0001567619-21-003755
CHKP,CHECK POINT SOFTWARE TECHNOLOGIES LIMITED ILS1,M22465104,302000.0,2273,0.00042160613033182903,2021-02-16,2020-12-31,0001567619-21-003755
BSMXUSD,BANCO SANTANDER MEXICO SA ADR (EACH REPRESENTS 5 ORDINARY SERIES B),05969B103,301000.0,58397,0.0004202100835426508,2021-02-16,2020-12-31,0001567619-21-003755
HP,HELMERICH & PAYNE INCORPORATED COMMON STOCK USD0.10,423452101,300000.0,12972,0.00041881403675347254,2021-02-16,2020-12-31,0001567619-21-003755
ATRSEUR,ANTARES PHARMA INCORPORATED COMMON STOCK USD0.01,036642106,298000.0,74645,0.000416021943175116,2021-02-16,2020-12-31,0001567619-21-003755
MPC,MARATHON PETROLEUM CORPORATION COMMON STOCK NPV,56585A102,297000.0,7173,0.0004146258963859378,2021-02-16,2020-12-31,0001567619-21-003755
NFLX,NETFLIX INCORPORATED COMMON STOCK USD0.001,64110L106,296000.0,548,0.0004132298495967596,2021-02-16,2020-12-31,0001567619-21-003755
CRM,SALESFORCE.COM INCORPORATED COMMON STOCK USD0.001,79466L302,295000.0,1326,0.00041183380280758133,2021-02-16,2020-12-31,0001567619-21-003755
BERYEUR,BERRY GLOBAL GROUP INC COMMON STOCK USD0.01,08579W103,294000.0,5240,0.00041043775601840303,2021-02-16,2020-12-31,0001567619-21-003755
MLM,MARTIN MARIETTA MATERIALS INCORPORATED COMMON STOCK USD0.01,573284106,292000.0,1028,0.0004076456624400466,2021-02-16,2020-12-31,0001567619-21-003755
BMRN,BIOMARIN PHARMACEUTICAL INCORPORATED COMMON STOCK USD0.001,09061G101,290000.0,3310,0.0004048535688616901,2021-02-16,2020-12-31,0001567619-21-003755
TDOC,TELADOC HEALTH INCORPORATED COMMON STOCK USD0.001,87918A105,290000.0,1450,0.0004048535688616901,2021-02-16,2020-12-31,0001567619-21-003755
CROX,CROCS INCORPORATED COMMON STOCK USD0.001,227046109,290000.0,4635,0.0004048535688616901,2021-02-16,2020-12-31,0001567619-21-003755
TALO,TALOS ENERGY INCORPORATED COMMON STOCK NPV,87484T108,289000.0,35045,0.0004034575220725118,2021-02-16,2020-12-31,0001567619-21-003755
JNJ,JOHNSON AND JOHNSON COMMON STOCK USD1,478160104,289000.0,1835,0.0004034575220725118,2021-02-16,2020-12-31,0001567619-21-003755
AMKR,AMKOR TECHNOLOGY INCORPORATED COMMON STOCK USD0.001,031652100,288000.0,19105,0.0004020614752833337,2021-02-16,2020-12-31,0001567619-21-003755
FDX,FEDEX CORPORATION COMMON STOCK USD0.10,31428X106,288000.0,1110,0.0004020614752833337,2021-02-16,2020-12-31,0001567619-21-003755
EL,ESTEE LAUDER COMPANIES INC CLASS'A'COM STK USD0.01,518439104,287000.0,1079,0.0004006654284941554,2021-02-16,2020-12-31,0001567619-21-003755
TFX,TELEFLEX INCORPORATED COMMON STOCK USD1,879369106,287000.0,697,0.0004006654284941554,2021-02-16,2020-12-31,0001567619-21-003755
BLKCHF,BLACKROCK INCORPORATED COMMON STOCK USD0.01,09247X101,285000.0,395,0.0003978733349157989,2021-02-16,2020-12-31,0001567619-21-003755
ALL,ALLSTATE CORP,020002101,284000.0,2586,0.0003964772881266206,2021-02-16,2020-12-31,0001567619-21-003755
EXPE,EXPEDIA GROUP INCORPORATED COMMON STOCK USD0.001,30212P303,284000.0,2145,0.0003964772881266206,2021-02-16,2020-12-31,0001567619-21-003755
HLX,HELIX ENERGY SOLUTIONS GROUP INCORPORATED COMMON STOCK NPV,42330P107,283000.0,67315,0.00039508124133744247,2021-02-16,2020-12-31,0001567619-21-003755
COLL,COLLEGIUM PHARMACEUTICAL INC COMMON STOCK USD0.001,19459J104,283000.0,14128,0.00039508124133744247,2021-02-16,2020-12-31,0001567619-21-003755
JPM,JPMORGAN CHASE AND COMPANY COMMON STOCK USD1,46625H100,283000.0,2224,0.00039508124133744247,2021-02-16,2020-12-31,0001567619-21-003755
COST,COSTCO WHOLESALE CORPORATION COMMON STOCK USD0.01,22160K105,282000.0,749,0.00039368519454826417,2021-02-16,2020-12-31,0001567619-21-003755
ADBE,ADOBE INCORPORATED NPV,00724F101,282000.0,564,0.00039368519454826417,2021-02-16,2020-12-31,0001567619-21-003755
EWA,ISHARES INCORPORATED MSCI AUSTRALIA ETF,464286103,281000.0,11730,0.00039228914775908593,2021-02-16,2020-12-31,0001567619-21-003755
GIII,G-III APPAREL GROUP LIMITED COMMON STOCK USD0.01,36237H101,281000.0,11851,0.00039228914775908593,2021-02-16,2020-12-31,0001567619-21-003755
DRI,DARDEN RESTAURANTS INC COM STK USD0.01,237194105,281000.0,2359,0.00039228914775908593,2021-02-16,2020-12-31,0001567619-21-003755
USX1,UNITED STATES STEEL CORPORATION COMMON STOCK USD1,912909108,281000.0,16747,0.00039228914775908593,2021-02-16,2020-12-31,0001567619-21-003755
PEP,PEPSICO INCORPORATED CAPITAL STOCK USD0.016666,713448108,280000.0,1890,0.0003908931009699077,2021-02-16,2020-12-31,0001567619-21-003755
