ticker,nameOfIssuer,cusip,value,shares,allocation_percent,filingDate,reportDate,accessionNumber
BABA,ALIBABA GROUP HOLDING LIMITED SPONSORED ADR (EACH REPRESENTS 1 ORDINARY SHARES USD0.000025),01609W102,2011739000.0,8644091,2.808481771614647,2021-02-16,2020-12-31,0001567619-21-003755
BABA,ALIBABA GROUP HOLDING LIMITED SPONSORED ADR (EACH REPRESENTS 1 ORDINARY SHARES USD0.000025),01609W102,1942345000.0,8345915,2.7116045007264122,2021-02-16,2020-12-31,0001567619-21-003755
MSFT,MICROSOFT CORPORATION COMMON STOCK USD0.0000125,594918104,1627188000.0,7315833,2.271630582789365,2021-02-16,2020-12-31,0001567619-21-003755
AMZN,AMAZON.COM INCORPORATED USD0.01,023135106,1315901000.0,404031,1.8370593659264376,2021-02-16,2020-12-31,0001567619-21-003755
GOOGL,ALPHABET INCORPORATED CL A NPV,02079K305,1315178000.0,750398,1.8360500240978617,2021-02-16,2020-12-31,0001567619-21-003755
AAPL,APPLE INCORPORATED COMMON STOCK NPV,037833100,1129616000.0,8513199,1.5769967898043686,2021-02-16,2020-12-31,0001567619-21-003755
BABA,ALIBABA GROUP HOLDING LIMITED SPONSORED ADR (EACH REPRESENTS 1 ORDINARY SHARES USD0.000025),01609W102,815038000.0,3502074,1.1378311829582557,2021-02-16,2020-12-31,0001567619-21-003755
MNSO,MINISO GROUP HOLDING LTD-ADR 4 ORD,66981J102,799544000.0,30297232,1.1162008340067282,2021-02-16,2020-12-31,0001567619-21-003755
META,FACEBOOK INCORPORATED CLASS A COMMON STOCK USD0.000006,30303M102,795886000.0,2913625,1.1110940948519141,2021-02-16,2020-12-31,0001567619-21-003755
JD,JD.COM INCORPORATED ADR (EACH REPRESENTING 2 SHARES),47215P106,659864000.0,7506989,0.9212010184943112,2021-02-16,2020-12-31,0001567619-21-003755
UNH,UNITEDHEALTH GROUP INCORPORATED COMMON STOCK USD0.01,91324P102,630924000.0,1799145,0.880799424415493,2021-02-16,2020-12-31,0001567619-21-003755
TXN,TEXAS INSTRUMENTS INCORPORATED COMMON STOCK USD1,882508104,624723000.0,3806271,0.8721425382757988,2021-02-16,2020-12-31,0001567619-21-003755
PG,PROCTER AND GAMBLE COMPANY (THE) COMMON STOCK NPV,742718109,618772000.0,4447117,0.863834663833399,2021-02-16,2020-12-31,0001567619-21-003755
V,VISA INCORPORATED CLASS A COMMON STOCK USD0.0001,92826C839,606372000.0,2772242,0.8465236836475888,2021-02-16,2020-12-31,0001567619-21-003755
N/A,NEW ORIENTAL EDUCATION & TECHNOLOGY GROUP INCORPORATED SPONSORED ADR USD0.01 (EACH REPRESENTS 1 ORDINARY SHARES),647581107,566511000.0,3048874,0.7908758625841549,2021-02-16,2020-12-31,0001567619-21-003755
JPM,JPMORGAN CHASE AND COMPANY COMMON STOCK USD1,46625H100,565079000.0,4446992,0.7888767235820517,2021-02-16,2020-12-31,0001567619-21-003755
TSM,TAIWAN SEMICONDUCTOR MANUFACTURING COMPANY LIMITED ADS REPRESENTING 5 COMMON SHARES,874039100,563266000.0,5165686,0.7863456907532715,2021-02-16,2020-12-31,0001567619-21-003755
ITUB,ITAU UNIBANCO HOLDING SA ADR (EACH REPRESENTS 1 PREFERENCE SHARE),465562106,555787000.0,91262158,0.7759046568170075,2021-02-16,2020-12-31,0001567619-21-003755
MELI,MERCADOLIBRE INCORPORATED COMMON STOCK USD0.001,58733R102,525677000.0,313796,0.7338696879948506,2021-02-16,2020-12-31,0001567619-21-003755
JNJ,JOHNSON AND JOHNSON COMMON STOCK USD1,478160104,523733000.0,3327825,0.7311557730366881,2021-02-16,2020-12-31,0001567619-21-003755
TSM,TAIWAN SEMICONDUCTOR MANUFACTURING COMPANY LIMITED ADS REPRESENTING 5 COMMON SHARES,874039100,486488000.0,4461552,0.6791600103737445,2021-02-16,2020-12-31,0001567619-21-003755
CNI,CANADIAN NATIONAL RAILWAY COMMON STOCK NPV,136375102,470281000.0,3360592,0.6565342800615328,2021-02-16,2020-12-31,0001567619-21-003755
TD,TORONTO-DOMINION BANK (THE) COMMON NPV,891160509,451882000.0,6283125,0.6308484151874423,2021-02-16,2020-12-31,0001567619-21-003755
ADBE,ADOBE INCORPORATED NPV,00724F101,448864000.0,897513,0.6266351459777023,2021-02-16,2020-12-31,0001567619-21-003755
JD,JD.COM INCORPORATED ADR (EACH REPRESENTING 2 SHARES),47215P106,428030000.0,4869508,0.5975499071719628,2021-02-16,2020-12-31,0001567619-21-003755
BKNG,BOOKING HOLDINGS INCORPORATED COMMON STOCK USD0.008,09857L108,413292000.0,185560,0.5769749695930539,2021-02-16,2020-12-31,0001567619-21-003755
UNP,UNION PACIFIC CORPORATION COMMON STOCK USD2.50,907818108,410088000.0,1969492,0.5725020356805268,2021-02-16,2020-12-31,0001567619-21-003755
VOO,VANGUARD INDEX FUNDS S&P 500 ETF,922908363,409964000.0,1192832,0.5723289258786687,2021-02-16,2020-12-31,0001567619-21-003755
YUMC,YUM CHINA HOLDINGS INCORPORATED HKD0.01,98850P109,392448000.0,882700,0.5478757703194226,2021-02-16,2020-12-31,0001567619-21-003755
BKNG,BOOKING HOLDINGS INCORPORATED COMMON STOCK USD0.008,09857L108,376988000.0,169260,0.526292886958727,2021-02-16,2020-12-31,0001567619-21-003755
IVV,ISHARES TRUST CORE SnP 500 ETF,464287200,375309000.0,999783,0.5239489243996968,2021-02-16,2020-12-31,0001567619-21-003755
INTC,INTEL CORPORATION COMMON STOCK USD0.001,458140100,366609000.0,7358665,0.511803317333846,2021-02-16,2020-12-31,0001567619-21-003755
ITUB,ITAU UNIBANCO HOLDING SA ADR (EACH REPRESENTS 1 PREFERENCE SHARE),465562106,365116000.0,59953331,0.5097190194776029,2021-02-16,2020-12-31,0001567619-21-003755
CMCSA,COMCAST CORPORATION CLASS A COMMON STOCK USD1,20030N101,363404000.0,6935194,0.5073289873745297,2021-02-16,2020-12-31,0001567619-21-003755
MRK,MERCK AND COMPANY INCORPORATED NEW COMMON STOCK USD0.01,58933Y105,362122000.0,4426925,0.5055392553908032,2021-02-16,2020-12-31,0001567619-21-003755
TMO,THERMO FISHER SCIENTIFIC INCORPORATED COMMON STOCK USD1,883556102,350092000.0,751626,0.488744812516989,2021-02-16,2020-12-31,0001567619-21-003755
MA,MASTERCARD INCORPORATED CLASS A COMMON STOCK USD0.0001,57636Q104,339053000.0,949887,0.47333385201125044,2021-02-16,2020-12-31,0001567619-21-003755
SE,SEA LIMITED ADR (EACH REPRESENTS 1 ORDINARY SHARES),81141R100,331666000.0,1666245,0.46302125437959074,2021-02-16,2020-12-31,0001567619-21-003755
N/A,ALCON INC CHF0.040000,H01301128,331599000.0,5635613,0.4629277192447158,2021-02-16,2020-12-31,0001567619-21-003755
BABA,ALIBABA GROUP HOLDING LIMITED SPONSORED ADR (EACH REPRESENTS 1 ORDINARY SHARES USD0.000025),01609W102,328140000.0,1409960,0.4580987934009483,2021-02-16,2020-12-31,0001567619-21-003755
HDB,HDFC BANK LIMITED ADR (EACH REPRESENTING 3 ORDINARY),40415F101,301407000.0,4171149,0.42077827458584627,2021-02-16,2020-12-31,0001567619-21-003755
HD,HOME DEPOT INCORPORATED (THE) COMMON STOCK USD0.05,437076102,299982000.0,1129367,0.4187889079112673,2021-02-16,2020-12-31,0001567619-21-003755
INTU,INTUIT INC COMMON STOCK USD0.01,461202103,287596000.0,757131,0.4014974723805056,2021-02-16,2020-12-31,0001567619-21-003755
CSCO,CISCO SYSTEMS INCORPORATED USD0.001 (US LISTING),17275R102,285024000.0,6369244,0.3979068400387392,2021-02-16,2020-12-31,0001567619-21-003755
VALE,VALE DO RIO DOCE (CIA) SPONSORED ADR (REPRESENTING 1 ORDINARY NPV),91912E105,275164000.0,16417902,0.38414181869744174,2021-02-16,2020-12-31,0001567619-21-003755
N/A,ALCON INC CHF0.040000,H01301128,274567000.0,4666334,0.3833083787643023,2021-02-16,2020-12-31,0001567619-21-003755
DE,DEERE & COMPANY COMMON STOCK USD1,244199105,266402000.0,990158,0.37190965673066195,2021-02-16,2020-12-31,0001567619-21-003755
TME,TENCENT MUSIC ENTERTAINM-ADR 2 ORD,88034P109,264221000.0,13732903,0.36886487868346424,2021-02-16,2020-12-31,0001567619-21-003755
BMY,BRISTOL-MYERS SQUIBB COMPANY COMMON STOCK USD0.10,110122108,261989000.0,4223579,0.3657489022500184,2021-02-16,2020-12-31,0001567619-21-003755
TT,TRANE TECHNOLOGIES PLC USD1,G8994E103,257208000.0,1771896,0.35907440255095724,2021-02-16,2020-12-31,0001567619-21-003755
HYG,ISHARES IBOXX HIGH YLD CORP,464288513,249176000.0,143452,0.3478613547402776,2021-02-16,2020-12-31,0001567619-21-003755
LLY,ELI LILLY AND COMPANY COMMON STOCK NPV,532457108,246175000.0,1458040,0.34367181832595367,2021-02-16,2020-12-31,0001567619-21-003755
AMGN,AMGEN INCORPORATED COMMON STOCK USD0.0001,031162100,242288000.0,1053791,0.33824538445641783,2021-02-16,2020-12-31,0001567619-21-003755
PFE,PFIZER INCORPORATED COMMON STOCK USD0.05,717081103,240229000.0,6526187,0.3353709241174998,2021-02-16,2020-12-31,0001567619-21-003755
PM,PHILIP MORRIS INTERNATIONAL INCORPORATED COMMON STOCK NPV,718172109,240197000.0,2901285,0.3353262506202462,2021-02-16,2020-12-31,0001567619-21-003755
ACN,ACCENTURE PLC CLASS A NEW COMMON STOCK USD0.0000225,G1151C101,238889000.0,914547,0.33350022142000096,2021-02-16,2020-12-31,0001567619-21-003755
SE,SEA LIMITED ADR (EACH REPRESENTS 1 ORDINARY SHARES),81141R100,235757000.0,1184411,0.32912780287629473,2021-02-16,2020-12-31,0001567619-21-003755
MELI,MERCADOLIBRE INCORPORATED COMMON STOCK USD0.001,58733R102,234924000.0,140235,0.32796489590090927,2021-02-16,2020-12-31,0001567619-21-003755
ATVIEUR,ACTIVISION BLIZZARD INCORPORATED COMMON STOCK USD0.000001,00507V109,233951000.0,2519668,0.32660654237503883,2021-02-16,2020-12-31,0001567619-21-003755
HCA,HCA HEALTHCARE INCORPORATED COMMON STOCK USD0.01,40412C101,232177000.0,1411753,0.3241299553710366,2021-02-16,2020-12-31,0001567619-21-003755
INFY,INFOSYS LIMITED SPONSORED ADR (EACH REPRESENTS 1 ORDINARY INR5),456788108,222083000.0,13102251,0.31003825908107147,2021-02-16,2020-12-31,0001567619-21-003755
DHR,DANAHER CORPORATION COMMON STOCK USD0.01,235851102,218653000.0,984303,0.3052498185941901,2021-02-16,2020-12-31,0001567619-21-003755
YUMC,YUM CHINA HOLDINGS INCORPORATED COMMON STOCK USD0.01,98850P109,218125000.0,3820713,0.30451270588950397,2021-02-16,2020-12-31,0001567619-21-003755
ABT,ABBOTT LABORATORIES COMMON STOCK NPV,002824100,212884000.0,1944321,0.2971960246674208,2021-02-16,2020-12-31,0001567619-21-003755
COST,COSTCO WHOLESALE CORPORATION COMMON STOCK USD0.01,22160K105,211208000.0,560560,0.29485625024875806,2021-02-16,2020-12-31,0001567619-21-003755
WB,WEIBO CORPORATION SPONSERED ADR(EACH REPRESENTS 1 ORDINARY SHARE),948596101,209587000.0,5113116,0.29259325840350014,2021-02-16,2020-12-31,0001567619-21-003755
MMM,3M COMPANY COMMON STOCK USD0.01,88579Y101,207034000.0,1184475,0.2890291509507281,2021-02-16,2020-12-31,0001567619-21-003755
NVDA,NVIDIA CORPORATION COMMON STOCK USD0.001,67066G104,207005000.0,396410,0.28898866559384195,2021-02-16,2020-12-31,0001567619-21-003755
LOW,LOWE'S COMPANIES INCORPORATED COMMON STOCK USD0.50,548661107,206848000.0,1288691,0.28876948624794097,2021-02-16,2020-12-31,0001567619-21-003755
NEE,NEXTERA ENERGY INCORPORATED COMMON STOCK USD0.01,65339F101,203124000.0,2632846,0.2835706080050412,2021-02-16,2020-12-31,0001567619-21-003755
FRCB,FIRST REPUBLIC BANK/SAN FRANCISCO CA COMMON STOCK USD0.01,33616C100,195991000.0,1333905,0.2736126062578328,2021-02-16,2020-12-31,0001567619-21-003755
KMB,KIMBERLY-CLARK CORPORATION COMMON STOCK USD1.25,494368103,194882000.0,1445391,0.2720643903686341,2021-02-16,2020-12-31,0001567619-21-003755
AXP,AMERICAN EXPRESS COMPANY COMMON STOCK USD0.20,025816109,193514000.0,1600477,0.2701545983610383,2021-02-16,2020-12-31,0001567619-21-003755
DWD,MORGAN STANLEY COMMON STOCK USD0.01,617446448,192574000.0,2810062,0.26884231437921075,2021-02-16,2020-12-31,0001567619-21-003755
N/A,NEW ORIENTAL EDUCATION & TECHNOLOGY GROUP INCORPORATED SPONSORED ADR USD0.01 (EACH REPRESENTS 1 ORDINARY SHARES),647581107,192286000.0,1034851,0.2684402529039274,2021-02-16,2020-12-31,0001567619-21-003755
7HP,HP INCORPORATED COMMON STOCK USD0.01,40434L105,189429000.0,7703480,0.2644517472272451,2021-02-16,2020-12-31,0001567619-21-003755
VALE,VALE DO RIO DOCE (CIA) SPONSORED ADR (REPRESENTING 1 ORDINARY NPV),91912E105,186542000.0,11130218,0.26042136014688755,2021-02-16,2020-12-31,0001567619-21-003755
ELV,ANTHEM INCORPORATED COMMON STOCK USD0.01,036752103,185045000.0,576303,0.2583314781034878,2021-02-16,2020-12-31,0001567619-21-003755
IVV,ISHARES TRUST CORE SnP 500 ETF,464287200,182911000.0,487257,0.25535231425538135,2021-02-16,2020-12-31,0001567619-21-003755
PAGS,PAGSEGURO DIGITAL LIMITED COMMON STOCK NPV,G68707101,179086000.0,3148488,0.25001243528677464,2021-02-16,2020-12-31,0001567619-21-003755
BAC,VERIZON COMMUNICATIONS INCORPORATED COMMON STOCK USD0.10,92343V104,176237000.0,2999773,0.2460350979844058,2021-02-16,2020-12-31,0001567619-21-003755
KO,COCA-COLA COMPANY (THE) COMMON STOCK USD0.25,191216100,176197000.0,3212924,0.24597925611283866,2021-02-16,2020-12-31,0001567619-21-003755
EW,EDWARDS LIFESCIENCES CORPORATION COMMON STOCK USD1,28176E108,168424000.0,1846145,0.2351277844205562,2021-02-16,2020-12-31,0001567619-21-003755
ABBV,ABBVIE INCORPORATED COMMON STOCK USD0.01,00287Y109,167403000.0,1562324,0.2337024206488052,2021-02-16,2020-12-31,0001567619-21-003755
ORCL,ORACLE CORPORATION COMMON STOCK USD0.01,68389X105,166192000.0,2569046,0.23201180798711035,2021-02-16,2020-12-31,0001567619-21-003755
DG,DOLLAR GENERAL CORPORATION COMMON STOCK USD0.875,256677105,164716000.0,783241,0.22995124292628327,2021-02-16,2020-12-31,0001567619-21-003755
PEP,PEPSICO INCORPORATED CAPITAL STOCK USD0.016666,713448108,164645000.0,1110219,0.2298521236042516,2021-02-16,2020-12-31,0001567619-21-003755
IWB,ISHARES TRUST RUSSELL 1000 ETF,464287622,163108000.0,769960,0.22770639968928466,2021-02-16,2020-12-31,0001567619-21-003755
BLKCHF,BLACKROCK INCORPORATED COMMON STOCK USD0.01,09247X101,161597000.0,223961,0.22559697299083634,2021-02-16,2020-12-31,0001567619-21-003755
IBN,ICICI BANK LIMITED SPONSORED ADR (EACH REPRESENTS 2 ORDINARY INR10),45104G104,159754000.0,10750626,0.22302405875838086,2021-02-16,2020-12-31,0001567619-21-003755
TME,TENCENT MUSIC ENTERTAINM-ADR 2 ORD,88034P109,157443000.0,8183129,0.21979779462858992,2021-02-16,2020-12-31,0001567619-21-003755
NVR,NVR INCORPORATED COMMON STOCK USD0.01,62944T105,156018000.0,38241,0.21780842795401092,2021-02-16,2020-12-31,0001567619-21-003755
UPS,UNITED PARCELS SERVICE CLASS B COMMON STOCK USD0.01,911312106,154891000.0,919778,0.21623508322260707,2021-02-16,2020-12-31,0001567619-21-003755
CL,COLGATE-PALMOLIVE COMPANY COMMON STOCK USD1,194162103,154435000.0,1806050,0.2155984858867418,2021-02-16,2020-12-31,0001567619-21-003755
FSLR,FIRST SOLAR INCORPORATED COMMON STOCK USD0.001,336433107,154319000.0,1560039,0.2154365444591971,2021-02-16,2020-12-31,0001567619-21-003755
QCOM,QUALCOMM INCORPORATED COMMON STOCK USD0.0001,747525103,150637000.0,988820,0.21029630018144282,2021-02-16,2020-12-31,0001567619-21-003755
NKE,NIKE INCORPORATED CLASS B COMMON STOCK NPV,654106103,148826000.0,1051998,0.207768059446241,2021-02-16,2020-12-31,0001567619-21-003755
CHTR,CHARTER COMMUNICATIONS INCORPORATED COMMON STOCK USD0.001,16119P108,145580000.0,220059,0.20323649156856843,2021-02-16,2020-12-31,0001567619-21-003755
N/A,NEW ORIENTAL EDUCATION & TECHNOLOGY GROUP INCORPORATED SPONSORED ADR USD0.01 (EACH REPRESENTS 1 ORDINARY SHARES),647581107,144569000.0,778046,0.2018250882647092,2021-02-16,2020-12-31,0001567619-21-003755
SE,SEA LIMITED ADR (EACH REPRESENTS 1 ORDINARY SHARES),81141R100,143759000.0,722226,0.20069429036547484,2021-02-16,2020-12-31,0001567619-21-003755
PYPL,PAYPAL HOLDINGS INCORPORATED COMMON STOCK USD0.0001,70450Y103,142104000.0,606762,0.19838383292938486,2021-02-16,2020-12-31,0001567619-21-003755
MSFT,MICROSOFT CORPORATION COMMON STOCK USD0.0000125,594918104,140712000.0,632642,0.19644053579884876,2021-02-16,2020-12-31,0001567619-21-003755
COP,CONOCOPHILLIPS INCORPORATED COMMON STOCK USD0.01,20825C104,138608000.0,3466055,0.19350325335441773,2021-02-16,2020-12-31,0001567619-21-003755
IBM,INTL BUSINESS MACHINES CORPORATION COMMON STOCK USD0.20,459200101,137049000.0,1088731,0.19132681641008886,2021-02-16,2020-12-31,0001567619-21-003755
GOOG,ALPHABET INCORPORATED-CL C NPV,02079K107,136913000.0,78152,0.19113695404676062,2021-02-16,2020-12-31,0001567619-21-003755
HTHT,HUAZHU GROUP LIMITED ADR NPV (EACH REPRESENTS 1 ORDINARY SHARE),44332N106,135818000.0,3016169,0.18960828281261044,2021-02-16,2020-12-31,0001567619-21-003755
DIS,WALT DISNEY COMPANY (THE) COMMON STOCK USD0.01,254687106,135571000.0,748266,0.18926345925568341,2021-02-16,2020-12-31,0001567619-21-003755
BSAC,BANCO SANTANDER-CHILE SA ADR (EACH 1 REPRESENTS 400 COMMON SHARES),05965X109,131541000.0,6926859,0.1836373906952951,2021-02-16,2020-12-31,0001567619-21-003755
GILD,GILEAD SCIENCES INCORPORATED COMMON STOCK USD0.001,375558103,131041000.0,2249247,0.18293936730070598,2021-02-16,2020-12-31,0001567619-21-003755
N/A,NEW ORIENTAL EDUCATION & TECHNOLOGY GROUP INCORPORATED SPONSORED ADR USD0.01 (EACH REPRESENTS 1 ORDINARY SHARES),647581107,130637000.0,703066,0.18237536439787796,2021-02-16,2020-12-31,0001567619-21-003755
VOO,VANGUARD INDEX FUNDS S&P 500 ETF,922908363,129467000.0,376697,0.18074198965453944,2021-02-16,2020-12-31,0001567619-21-003755
MSFT,MICROSOFT CORPORATION COMMON STOCK USD0.0000125,594918104,129426000.0,581901,0.18068475173618312,2021-02-16,2020-12-31,0001567619-21-003755
TX,TERNIUM SA ADR (EACH REPRESENTS 10 ORDINARY NPV),880890108,128408000.0,4415665,0.17926357610479968,2021-02-16,2020-12-31,0001567619-21-003755
TSM,TAIWAN SEMICONDUCTOR MANUFACTURING COMPANY LIMITED ADS REPRESENTING 5 COMMON SHARES,874039100,122823000.0,1126407,0.1714666547872392,2021-02-16,2020-12-31,0001567619-21-003755
TMUS,T-MOBILE US INCORPORATED COMMON STOCK USD0.0001,872590104,120997000.0,897270,0.16891747335019971,2021-02-16,2020-12-31,0001567619-21-003755
HDB,HDFC BANK LIMITED ADR (EACH REPRESENTING 3 ORDINARY),40415F101,119712000.0,1656685,0.16712355322610567,2021-02-16,2020-12-31,0001567619-21-003755
FTV,FORTIVE CORPORATION COMMON STOCK USD0.01,34959J108,118824000.0,1677831,0.1658838636773154,2021-02-16,2020-12-31,0001567619-21-003755
NFLX,NETFLIX INCORPORATED COMMON STOCK USD0.001,64110L106,118480000.0,219111,0.16540362358183808,2021-02-16,2020-12-31,0001567619-21-003755
ITW,ILLINOIS TOOL WORKS INC COMMON STOCK NPV,452308109,115934000.0,568639,0.16184928845659027,2021-02-16,2020-12-31,0001567619-21-003755
N/A,LINDE PUBLIC LIMITED COMPANY EUR0.001,G5494J103,115921000.0,544230,0.16183113984833097,2021-02-16,2020-12-31,0001567619-21-003755
MO,ALTRIA GROUP INCORPORATED COMMON STOCK USD0.3333,02209S103,115719000.0,2822404,0.16154913839691695,2021-02-16,2020-12-31,0001567619-21-003755
AME,AMETEK INC COMMON STOCK USD0.01,031100100,115110000.0,951795,0.1606989459023074,2021-02-16,2020-12-31,0001567619-21-003755
N/A,YANDEX NV CLASS A USD0.01 (US LISTING),N97284108,113788000.0,1635349,0.15885337204701377,2021-02-16,2020-12-31,0001567619-21-003755
TSM,TAIWAN SEMICONDUCTOR MANUFACTURING COMPANY LIMITED ADS REPRESENTING 5 COMMON SHARES,874039100,110332000.0,1011847,0.15402863434361377,2021-02-16,2020-12-31,0001567619-21-003755
NDAQ,NASDAQ INCORPORATED COMMON STOCK USD0.01,631103108,109091000.0,821843,0.15229614027824356,2021-02-16,2020-12-31,0001567619-21-003755
ON,ON SEMICONDUCTOR CORPORATION COMMON STOCK USD0.01,682189105,108840000.0,3325378,0.15194573253415983,2021-02-16,2020-12-31,0001567619-21-003755
CDNS,CADENCE DESIGN SYSTEMS INCORPORATED COMMON STOCK USD0.01,127387108,108070000.0,792125,0.15087077650649258,2021-02-16,2020-12-31,0001567619-21-003755
AMZN,AMAZON.COM INCORPORATED USD0.01,023135106,106945000.0,32836,0.14930022386866706,2021-02-16,2020-12-31,0001567619-21-003755
TSLA,TESLA INCORPORATED COMMON STOCK USD0.001,88160R101,106837000.0,151398,0.14914945081543582,2021-02-16,2020-12-31,0001567619-21-003755
MU,MICRON TECHNOLOGY INCORPORATED COMMON STOCK USD0.10,595112103,105916000.0,1408830,0.14786369172260266,2021-02-16,2020-12-31,0001567619-21-003755
NTES,NETEASE INCORPORATED ADR (EACH REPRESENTS 25 SHARES USD0.0001),64110W102,105791000.0,1104631,0.14768918587395538,2021-02-16,2020-12-31,0001567619-21-003755
BAC,BANK OF AMERICA CORPORATION COMMON STOCK USD0.01,060505104,105433000.0,3478481,0.14718940112342957,2021-02-16,2020-12-31,0001567619-21-003755
UNH,UNITEDHEALTH GROUP INCORPORATED COMMON STOCK USD0.01,91324P102,104990000.0,299390,0.1465709523958236,2021-02-16,2020-12-31,0001567619-21-003755
TROW,PRICE T.ROWE GROUP INCORPORATED COMMON STOCK USD0.20,74144T108,103190000.0,681618,0.14405806817530276,2021-02-16,2020-12-31,0001567619-21-003755
LOGI,LOGITECH INTERNATIONAL SA CHF0.25 (REGISTERED),H50430232,102530000.0,1193321,0.14313667729444512,2021-02-16,2020-12-31,0001567619-21-003755
AIZ,ASSURANT INCORPORATED COMMON STOCK USD0.01,04621X108,102359000.0,751421,0.14289795329349564,2021-02-16,2020-12-31,0001567619-21-003755
MSCI,MSCI INCORPORATED COMMON STOCK USD0.01,55354G100,101147000.0,226518,0.14120594458501162,2021-02-16,2020-12-31,0001567619-21-003755
AMZN,AMAZON.COM INCORPORATED USD0.01,023135106,101131000.0,31051,0.14118360783638476,2021-02-16,2020-12-31,0001567619-21-003755
OTIS,OTIS WORLDWIDE CORP-WI USD0.010000,68902V107,101034000.0,1495689,0.14104819129783447,2021-02-16,2020-12-31,0001567619-21-003755
YUMC,YUM CHINA HOLDINGS INCORPORATED HKD0.01,98850P109,100524000.0,226100,0.14033620743535358,2021-02-16,2020-12-31,0001567619-21-003755
GOOGL,ALPHABET INCORPORATED CL A NPV,02079K305,100109000.0,57119,0.1397568480178446,2021-02-16,2020-12-31,0001567619-21-003755
V,VISA INCORPORATED CLASS A COMMON STOCK USD0.0001,92826C839,99386000.0,454378,0.13874750618926873,2021-02-16,2020-12-31,0001567619-21-003755
CNI,CANADIAN NATIONAL RAILWAY COMMON STOCK NPV,136375102,98802000.0,706034,0.13793221486438864,2021-02-16,2020-12-31,0001567619-21-003755
TGT,TARGET CORPORATION COMMON STOCK USD0.167,87612E106,98379000.0,557294,0.13734168707256625,2021-02-16,2020-12-31,0001567619-21-003755
PAGS,PAGSEGURO DIGITAL LIMITED COMMON STOCK NPV,G68707101,97610000.0,1716074,0.13626812709168817,2021-02-16,2020-12-31,0001567619-21-003755
N/A,SEAGATE TECHNOLOGY PLC COMMON STOCK USD0.00001,G7945M107,97119000.0,1562401,0.13558266811820166,2021-02-16,2020-12-31,0001567619-21-003755
CTLTEUR,CATALENT INCORPORATED COMMON STOCK USD0.01,148806102,95832000.0,920845,0.13378595590052927,2021-02-16,2020-12-31,0001567619-21-003755
VMI,VALMONT INDUSTRIES INCORPORATED COMMON STOCK USD1,920253101,95762000.0,547431,0.13368823262528678,2021-02-16,2020-12-31,0001567619-21-003755
T,AT AND T INCORPORATED COMMON STOCK USD1,00206R102,95716000.0,3328105,0.1336240144729846,2021-02-16,2020-12-31,0001567619-21-003755
BSAC,BANCO SANTANDER-CHILE SA ADR (EACH 1 REPRESENTS 400 COMMON SHARES),05965X109,94921000.0,4998476,0.13251415727558788,2021-02-16,2020-12-31,0001567619-21-003755
META,FACEBOOK INCORPORATED CLASS A COMMON STOCK USD0.000006,30303M102,94309000.0,345252,0.1316597766406108,2021-02-16,2020-12-31,0001567619-21-003755
PLD,PROLOGIS INCORPORATED REIT USD0.01,74340W103,94304000.0,946260,0.1316527964066649,2021-02-16,2020-12-31,0001567619-21-003755
YUMC,YUM CHINA HOLDINGS INCORPORATED COMMON STOCK USD0.01,98850P109,93845000.0,1643813,0.1310120109304321,2021-02-16,2020-12-31,0001567619-21-003755
VRT,VERTIV HOLDINGS CO USD0.000100,92537N108,93649000.0,5016018,0.13073838575975316,2021-02-16,2020-12-31,0001567619-21-003755
PTC,PTC INCORPORATED COMMON STOCK USD0.01,69370C100,93271000.0,779795,0.13021068007344377,2021-02-16,2020-12-31,0001567619-21-003755
CRM,SALESFORCE.COM INCORPORATED COMMON STOCK USD0.001,79466L302,92833000.0,417171,0.1295992115797837,2021-02-16,2020-12-31,0001567619-21-003755
SHW,SHERWIN-WILLIAMS COMPANY (THE) COMMON STOCK USD1,824348106,92653000.0,126074,0.12934792315773164,2021-02-16,2020-12-31,0001567619-21-003755
VIPS,VIPSHOP HOLDINGS LIMITED SPONSORED ADR (EACH REPRESENTS 0.2 ORDINARY SHARES USD0.0001),92763W103,92574000.0,3293265,0.12923763546138653,2021-02-16,2020-12-31,0001567619-21-003755
JOBSUSD,51JOBS INCORPORATED ADR (EACH REPRESENTS 2 ORDINARY USD0.0001),316827104,91970000.0,1313860,0.1283944232007229,2021-02-16,2020-12-31,0001567619-21-003755
YUMC,YUM CHINA HOLDINGS INCORPORATED COMMON STOCK USD0.01,98850P109,90670000.0,1588189,0.12657956237479118,2021-02-16,2020-12-31,0001567619-21-003755
OMC,OMNICOM GROUP INC COMMON STOCK USD0.15,681919106,89623000.0,1436949,0.12511790138652157,2021-02-16,2020-12-31,0001567619-21-003755
ROK,ROCKWELL AUTOMATION INCORPORATED COMMON STOCK USD1,773903109,89407000.0,356474,0.12481635528005905,2021-02-16,2020-12-31,0001567619-21-003755
EHC,ENCOMPASS HEALTH CORPORATION COMMON STOCK USD0.01,29261A100,85182000.0,1030140,0.11891805759578099,2021-02-16,2020-12-31,0001567619-21-003755
TMO,THERMO FISHER SCIENTIFIC INCORPORATED COMMON STOCK USD1,883556102,85132000.0,182773,0.11884825525632207,2021-02-16,2020-12-31,0001567619-21-003755
TX,TERNIUM SA ADR (EACH REPRESENTS 10 ORDINARY NPV),880890108,85093000.0,2926176,0.11879380943154412,2021-02-16,2020-12-31,0001567619-21-003755
SERVUSD,TERMINIX GLOBAL HOLDINGS INCORPORATED USD0.01,88087E100,85048000.0,1667273,0.1187309873260311,2021-02-16,2020-12-31,0001567619-21-003755
LQD,ISHARES TRUST IBOXX INVESTMENT GRADE CORPORATE BOND ETF,464287242,84507000.0,611790,0.11797572601308567,2021-02-16,2020-12-31,0001567619-21-003755
MDT,MEDTRONIC PLC USD0.10,G5960L103,83889000.0,716143,0.11711296909737352,2021-02-16,2020-12-31,0001567619-21-003755
SE,SEA LIMITED ADR (EACH REPRESENTS 1 ORDINARY SHARES),81141R100,83629000.0,420139,0.1167499969321872,2021-02-16,2020-12-31,0001567619-21-003755
ADSK,AUTODESK INC COM STK USD0.01,052769106,83287000.0,272768,0.11627254893028821,2021-02-16,2020-12-31,0001567619-21-003755
EL,ESTEE LAUDER COMPANIES INC CLASS'A'COM STK USD0.01,518439104,82905000.0,311449,0.11573925905682214,2021-02-16,2020-12-31,0001567619-21-003755
BABA,ALIBABA GROUP HOLDING LIMITED SPONSORED ADR (EACH REPRESENTS 1 ORDINARY SHARES USD0.000025),01609W102,82844000.0,355966,0.11565410020268226,2021-02-16,2020-12-31,0001567619-21-003755
FTNT,FORTINET INCORPORATED COMMON STOCK USD0.001,34959E109,81915000.0,551502,0.11435717273553568,2021-02-16,2020-12-31,0001567619-21-003755
JPM,JPMORGAN CHASE AND COMPANY COMMON STOCK USD1,46625H100,81820000.0,643900,0.11422454829056375,2021-02-16,2020-12-31,0001567619-21-003755
META,FACEBOOK INCORPORATED CLASS A COMMON STOCK USD0.000006,30303M102,81567000.0,298605,0.11387134845290164,2021-02-16,2020-12-31,0001567619-21-003755
N/A,IAC HOLDINGS INC,44891N109,81420000.0,429997,0.11366612957489244,2021-02-16,2020-12-31,0001567619-21-003755
N/A,NEW ORIENTAL EDUCATION & TECHNOLOGY GROUP INCORPORATED SPONSORED ADR USD0.01 (EACH REPRESENTS 1 ORDINARY SHARES),647581107,81160000.0,436789,0.11330315740970609,2021-02-16,2020-12-31,0001567619-21-003755
