ticker,nameOfIssuer,cusip,value,shares,allocation_percent,filingDate,reportDate,accessionNumber
N/A,TRITON INTERNATIONAL LTD USD0.01,G9078F107,9027000.0,172463,0.011307521661444836,2021-08-13,2021-06-30,0001567619-21-015385
OII,OCEANEERING INTERNATIONAL INCORPORATED COMMON STOCK USD0.25,675232102,9023000.0,579523,0.011302511127862716,2021-08-13,2021-06-30,0001567619-21-015385
WLK,WESTLAKE CHEMICAL CORPORATION COMMON STOCK USD0.01,960413102,9023000.0,100156,0.011302511127862716,2021-08-13,2021-06-30,0001567619-21-015385
HCAT,HEALTH CATALYST INC USD0.001,42225T107,8979000.0,161763,0.011247395258459419,2021-08-13,2021-06-30,0001567619-21-015385
DGX,QUEST DIAGNOSTICS INCORPORATED COMMON STOCK USD0.01,74834L100,8942000.0,67757,0.011201047822824826,2021-08-13,2021-06-30,0001567619-21-015385
GE,GENERAL ELECTRIC COMPANY COMMON STOCK USD0.06,369604103,8920000.0,662672,0.011173489888123177,2021-08-13,2021-06-30,0001567619-21-015385
KOS,KOSMOS ENERGY LIMITED GHS0.01,500688106,8905000.0,2573612,0.011154700387190235,2021-08-13,2021-06-30,0001567619-21-015385
TRV,TRAVELERS COMPANIES INCORPORATED (THE) COMMON STOCK NPV,89417E109,8893000.0,59401,0.01113966878644388,2021-08-13,2021-06-30,0001567619-21-015385
TYL,TYLER TECHNOLOGIES INCORPORATED COMMON STOCK USD0.01,902252105,8890000.0,19651,0.011135910886257292,2021-08-13,2021-06-30,0001567619-21-015385
PRVA,PRIVIA HEALTH GROUP INC USD0.01,74276R102,8867000.0,199839,0.011107100318160113,2021-08-13,2021-06-30,0001567619-21-015385
AVA,AVISTA CORPORATION COMMON STOCK NPV,05379B107,8825000.0,206820,0.011054489715547875,2021-08-13,2021-06-30,0001567619-21-015385
BWXT,BWX TECHNOLOGIES INCORPORATED COMMON STOCK USD0.01,05605H100,8821000.0,151772,0.011049479181965758,2021-08-13,2021-06-30,0001567619-21-015385
DLX,DELUXE CORPORATION COMMON STOCK USD1,248019101,8814000.0,184519,0.01104071074819705,2021-08-13,2021-06-30,0001567619-21-015385
MBUU,MALIBU BOATS INCORPORATED COMMON STOCK A USD0.01,56117J100,8737000.0,119149,0.010944257976741279,2021-08-13,2021-06-30,0001567619-21-015385
ESNT,ESSENT GROUP LIMITED USD0.015,G3198U102,8718000.0,193951,0.010920457942226219,2021-08-13,2021-06-30,0001567619-21-015385
VOO,VANGUARD INDEX FUNDS S&P 500 ETF,922908363,8677000.0,22049,0.010869099973009508,2021-08-13,2021-06-30,0001567619-21-015385
IMO,IMPERIAL OIL COMMON STOCK NPV,453038408,8662000.0,229267,0.010850310472076566,2021-08-13,2021-06-30,0001567619-21-015385
AMED,AMEDISYS INCORPORATED COMMON STOCK USD0.001,023436108,8583000.0,35043,0.010751352433829735,2021-08-13,2021-06-30,0001567619-21-015385
SWK,STANLEY BLACK AND DECKER INCORPORATED COMMON STOCK USD2.50,854502101,8570000.0,41805,0.01073506819968785,2021-08-13,2021-06-30,0001567619-21-015385
AMCX,AMC NETWORKS INCORPORATED CLASS A COMMON STOCK USD0.01,00164V103,8535000.0,127774,0.010691226030844318,2021-08-13,2021-06-30,0001567619-21-015385
VDE,VANGUARD ENERGY ETF,92204A306,8512000.0,112159,0.01066241546274714,2021-08-13,2021-06-30,0001567619-21-015385
N/A,QIAGEN NV USD0.01,N72482123,8511000.0,208800,0.01066116282935161,2021-08-13,2021-06-30,0001567619-21-015385
AFW,ALIGN TECHNOLOGY INCORPORATED COMMON STOCK USD0.0001,016255101,8509000.0,13926,0.010658657562560552,2021-08-13,2021-06-30,0001567619-21-015385
CE,CELANESE CORPORATION CLASS A COMMON STOCK USD0.0001 (US LISTING),150870103,8467000.0,55850,0.010606046959948311,2021-08-13,2021-06-30,0001567619-21-015385
RTX,RAYTHEON TECHNOLOGIES CORPORATION USD1,75513E101,8450000.0,99056,0.010584752192224312,2021-08-13,2021-06-30,0001567619-21-015385
DKNG1USD,DRAFTKINGS INC CLASS A USD0.0001,26142R104,8445000.0,161884,0.010578489025246664,2021-08-13,2021-06-30,0001567619-21-015385
MDLZ,MONDELEZ INTERNATIONAL INCORPORATED COMMON STOCK USD0.01,609207105,8439000.0,135149,0.010570973224873485,2021-08-13,2021-06-30,0001567619-21-015385
SO,SOUTHERN COMPANY (THE) COMMON STOCK USD5,842587107,8387000.0,138610,0.010505836288305951,2021-08-13,2021-06-30,0001567619-21-015385
FE,FIRSTENERGY CORPORATION COMMON STOCK USD0.10,337932107,8355000.0,224549,0.010465752019649008,2021-08-13,2021-06-30,0001567619-21-015385
TSM,TAIWAN SEMICONDUCTOR MANUFACTURING COMPANY LIMITED ADS REPRESENTING 5 COMMON SHARES,874039100,8345000.0,69447,0.010453225685693712,2021-08-13,2021-06-30,0001567619-21-015385
MOH,MOLINA HEALTHCARE INCORPORATED COMMON STOCK USD0.001,60855R100,8310000.0,32839,0.01040938351685018,2021-08-13,2021-06-30,0001567619-21-015385
BSMXUSD,BANCO SANTANDER MEXICO SA ADR (EACH REPRESENTS 5 ORDINARY SERIES B),05969B103,8299000.0,1321485,0.010395604549499357,2021-08-13,2021-06-30,0001567619-21-015385
FDX,FEDEX CORPORATION COMMON STOCK USD0.10,31428X106,8273000.0,27732,0.010363036081215589,2021-08-13,2021-06-30,0001567619-21-015385
DE,DEERE & COMPANY COMMON STOCK USD1,244199105,8265000.0,23434,0.010353015014051352,2021-08-13,2021-06-30,0001567619-21-015385
EWA,ISHARES INCORPORATED MSCI AUSTRALIA ETF,464286103,8262000.0,318026,0.010349257113864764,2021-08-13,2021-06-30,0001567619-21-015385
EWA,ISHARES INCORPORATED MSCI AUSTRALIA ETF,464286103,8262000.0,318026,0.010349257113864764,2021-08-13,2021-06-30,0001567619-21-015385
UI,UBIQUITI INCORPORATED USD0.001,90353W103,8245000.0,26411,0.010327962346140761,2021-08-13,2021-06-30,0001567619-21-015385
CGAU,CENTERRA GOLD INCORPORATED COMMON NPV,152006102,8224000.0,873943,0.010301657044834643,2021-08-13,2021-06-30,0001567619-21-015385
HCA,HCA HEALTHCARE INCORPORATED COMMON STOCK USD0.01,40412C101,8210000.0,39714,0.01028412017729723,2021-08-13,2021-06-30,0001567619-21-015385
UCTT,ULTRA CLEAN HOLDINGS INCORPORATED COMMON STOCK USD0.001,90385V107,8209000.0,152805,0.010282867543901699,2021-08-13,2021-06-30,0001567619-21-015385
VIPS,VIPSHOP HOLDINGS LIMITED SPONSORED ADR (EACH REPRESENTS 0.2 ORDINARY SHARES USD0.0001),92763W103,8203000.0,408527,0.010275351743528524,2021-08-13,2021-06-30,0001567619-21-015385
VRTX,VERTEX PHARMACEUTICALS INCORPORATED COMMON STOCK USD0.01,92532F100,8200000.0,40669,0.010271593843341935,2021-08-13,2021-06-30,0001567619-21-015385
N/A,COCA-COLA EUROPACIFIC PARTNERS COMMON STOCK EUR 0.01,G25839104,8144000.0,137290,0.010201446373192282,2021-08-13,2021-06-30,0001567619-21-015385
UNP,UNION PACIFIC CORPORATION COMMON STOCK USD2.50,907818108,8133000.0,36981,0.010187667405841459,2021-08-13,2021-06-30,0001567619-21-015385
CTOS,CUSTOM TRUCK ONE SOURCE INCORPORATED USD0.0001,23204X103,8105000.0,851381,0.010152593670766633,2021-08-13,2021-06-30,0001567619-21-015385
WCC,WESCO INTERNATIONAL INCORPORATED COMMON STOCK USD0.01,95082P105,8093000.0,78711,0.010137562070020279,2021-08-13,2021-06-30,0001567619-21-015385
TLV,GRUPO TELEVISA SAB SPONS ADR (REPRESENTING 5 ORDINARY PTG CERTS),40049J206,8079000.0,565734,0.010120025202482865,2021-08-13,2021-06-30,0001567619-21-015385
VTWO,VANGUARD RUSSELL 2000 ETF,92206C664,8037000.0,86821,0.010067414599870626,2021-08-13,2021-06-30,0001567619-21-015385
RVLV,REVOLVE GROUP CLASS A INC USD0.001,76156B107,8021000.0,116418,0.010047372465542154,2021-08-13,2021-06-30,0001567619-21-015385
QRVO,QORVO INCORPORATED COMMON STOCK  USD0.0001,74736K101,8016000.0,40973,0.010041109298564506,2021-08-13,2021-06-30,0001567619-21-015385
PANW,PALO ALTO NETWORKS INCORPORATED COMMON STOCK USD0.0001,697435105,8006000.0,21576,0.010028582964609211,2021-08-13,2021-06-30,0001567619-21-015385
LVS,LAS VEGAS SANDS CORPORATION COMMON STOCK USD0.001,517834107,7999000.0,151807,0.010019814530840504,2021-08-13,2021-06-30,0001567619-21-015385
BCC,BOISE CASCADE COMPANY COMMON STOCK USD0.01,09739D100,7999000.0,137086,0.010019814530840504,2021-08-13,2021-06-30,0001567619-21-015385
SNA,SNAP-ON INCORPORATED COMMON STOCK USD1,833034101,7958000.0,35619,0.009968456561623795,2021-08-13,2021-06-30,0001567619-21-015385
CTLTEUR,CATALENT INCORPORATED COMMON STOCK USD0.01,148806102,7953000.0,73560,0.009962193394646147,2021-08-13,2021-06-30,0001567619-21-015385
BTG,B2GOLD CORPORATION COMMON NPV,11777Q209,7952000.0,1529302,0.009960940761250618,2021-08-13,2021-06-30,0001567619-21-015385
MA,MASTERCARD INCORPORATED CLASS A COMMON STOCK USD0.0001,57636Q104,7952000.0,21782,0.009960940761250618,2021-08-13,2021-06-30,0001567619-21-015385
QCOM,QUALCOMM INCORPORATED COMMON STOCK USD0.0001,747525103,7951000.0,55627,0.009959688127855089,2021-08-13,2021-06-30,0001567619-21-015385
SIVBEUR,SVB FINANCIAL GROUP COMMON STOCK USD0.001,78486Q101,7949000.0,14285,0.00995718286106403,2021-08-13,2021-06-30,0001567619-21-015385
PINS,PINTEREST INC COMMON STOCK A,72352L106,7925000.0,100379,0.009927119659571321,2021-08-13,2021-06-30,0001567619-21-015385
PYPL,PAYPAL HOLDINGS INCORPORATED COMMON STOCK USD0.0001,70450Y103,7894000.0,27083,0.009888288024309907,2021-08-13,2021-06-30,0001567619-21-015385
USRT,ISHARES CORE US REIT ETF,464288521,7875000.0,134989,0.009864487989794847,2021-08-13,2021-06-30,0001567619-21-015385
MSFT,MICROSOFT CORPORATION COMMON STOCK USD0.0000125,594918104,7863000.0,29025,0.009849456389048493,2021-08-13,2021-06-30,0001567619-21-015385
MU,MICRON TECHNOLOGY INCORPORATED COMMON STOCK USD0.10,595112103,7860000.0,92489,0.009845698488861902,2021-08-13,2021-06-30,0001567619-21-015385
NSC,NORFOLK SOUTHERN CORP COMMON STOCK USD1,655844108,7857000.0,29604,0.009841940588675314,2021-08-13,2021-06-30,0001567619-21-015385
IXC,ISHARES TRUST GLOBAL ENERGY ETF,464287341,7850000.0,295209,0.009833172154906608,2021-08-13,2021-06-30,0001567619-21-015385
IXC,ISHARES TRUST GLOBAL ENERGY ETF,464287341,7850000.0,295209,0.009833172154906608,2021-08-13,2021-06-30,0001567619-21-015385
THC,TENET HEALTHCARE CORPORATION COMMON STOCK USD0.05,88033G407,7828000.0,116849,0.009805614220204959,2021-08-13,2021-06-30,0001567619-21-015385
IVE,ISHARES S&P  VALUE ETF,464287408,7818000.0,52950,0.009793087886249665,2021-08-13,2021-06-30,0001567619-21-015385
IVE,ISHARES S&P  VALUE ETF,464287408,7818000.0,52950,0.009793087886249665,2021-08-13,2021-06-30,0001567619-21-015385
HON,HONEYWELL INTERNATIONAL INCORPORATED COMMON STOCK USD1,438516106,7794000.0,35533,0.009763024684756956,2021-08-13,2021-06-30,0001567619-21-015385
DE,DEERE & COMPANY COMMON STOCK USD1,244199105,7692000.0,21807,0.009635256078412946,2021-08-13,2021-06-30,0001567619-21-015385
GFI,GOLD FIELDS LIMITED SPONSORED ADR (EACH REPRESENTS 1 ORDINARY),38059T106,7668000.0,861571,0.009605192876920238,2021-08-13,2021-06-30,0001567619-21-015385
VER,VEREIT INC USD0.01(POST REV SPLIT),92339V308,7632000.0,166175,0.009560098074681176,2021-08-13,2021-06-30,0001567619-21-015385
CWH,CAMPING WORLD HOLDINGS INC-A,13462K109,7628000.0,186102,0.009555087541099058,2021-08-13,2021-06-30,0001567619-21-015385
NDAQ,NASDAQ INCORPORATED COMMON STOCK USD0.01,631103108,7615000.0,43315,0.009538803306957173,2021-08-13,2021-06-30,0001567619-21-015385
GM,GENERAL MOTORS COMPANY COMMON STOCK USD0.01,37045V100,7571000.0,127960,0.009483687437553876,2021-08-13,2021-06-30,0001567619-21-015385
AGREUR,AVANGRID INCORPORATION COMMON STOCK USD0.01,05351W103,7561000.0,147022,0.009471161103598582,2021-08-13,2021-06-30,0001567619-21-015385
XLE,ENERGY SELECT SECTOR SPDR ETF,81369Y506,7526000.0,139700,0.00942731893475505,2021-08-13,2021-06-30,0001567619-21-015385
XLE,ENERGY SELECT SECTOR SPDR ETF,81369Y506,7526000.0,139700,0.00942731893475505,2021-08-13,2021-06-30,0001567619-21-015385
COST,COSTCO WHOLESALE CORPORATION COMMON STOCK USD0.01,22160K105,7522000.0,19010,0.00942230840117293,2021-08-13,2021-06-30,0001567619-21-015385
DXCM,DEXCOM INCORPORATED COMMON STOCK USD0.001,252131107,7499000.0,17561,0.009393497833075753,2021-08-13,2021-06-30,0001567619-21-015385
SRNE,SORRENTO THERAPEUTICS INC COMMON STOCK USD0.0001,83587F202,7490000.0,772916,0.009382224132515988,2021-08-13,2021-06-30,0001567619-21-015385
AAPL,APPLE INCORPORATED COMMON STOCK NPV,037833100,7454000.0,54424,0.009337129330276925,2021-08-13,2021-06-30,0001567619-21-015385
SHW,SHERWIN-WILLIAMS COMPANY (THE) COMMON STOCK USD1,824348106,7421000.0,27238,0.00929579242822445,2021-08-13,2021-06-30,0001567619-21-015385
AMZN,AMAZON.COM INCORPORATED USD0.01,023135106,7417000.0,2156,0.009290781894642332,2021-08-13,2021-06-30,0001567619-21-015385
XYL,XYLEM INCORPORATED COMMON STOCK NPV,98419M100,7407000.0,61748,0.009278255560687038,2021-08-13,2021-06-30,0001567619-21-015385
RF,REGIONS FINANCIAL CORPORATION COMMON STOCK USD0.01,7591EP100,7399000.0,366671,0.009268234493522803,2021-08-13,2021-06-30,0001567619-21-015385
NLYEUR,ANNALY CAPITAL MANAGEMENT INCORPORATED REIT USD0.01,035710409,7380000.0,831103,0.009244434459007743,2021-08-13,2021-06-30,0001567619-21-015385
AN,AUTONATION INCORPORATED COMMON STOCK USD0.01,05329W102,7337000.0,77390,0.009190571222999972,2021-08-13,2021-06-30,0001567619-21-015385
AU3EUR,ANGLOGOLD ASHANTI LIMITED SPONSORED ADR (EACH REPRESENTING 1 ORDINARY LEVEL 1) (BNY),035128206,7282000.0,391910,0.00912167638624585,2021-08-13,2021-06-30,0001567619-21-015385
SCCO,SOUTHERN COPPER CORPORATION COMMON STOCK USD0.01,84265V105,7282000.0,113209,0.00912167638624585,2021-08-13,2021-06-30,0001567619-21-015385
MAA,MID-AMERICA APARTMENT COMMUNITIES INCORPORATED REIT USD0.01,59522J103,7278000.0,43213,0.00911666585266373,2021-08-13,2021-06-30,0001567619-21-015385
VOO,VANGUARD INDEX FUNDS S&P 500 ETF,922908363,7278000.0,18494,0.00911666585266373,2021-08-13,2021-06-30,0001567619-21-015385
KBH,KB HOME COMMON STOCK USD1,48666K109,7235000.0,177666,0.009062802616655962,2021-08-13,2021-06-30,0001567619-21-015385
N/A,BIOHAVEN PHARMACEUTICAL HOLDING CO,G11196105,7205000.0,74215,0.009025223614790079,2021-08-13,2021-06-30,0001567619-21-015385
SWN1EUR,SOUTHWESTERN ENERGY COMPANY COMMON STOCK USD0.10,845467109,7159000.0,1262542,0.00896760247859572,2021-08-13,2021-06-30,0001567619-21-015385
HDB,HDFC BANK LIMITED ADR (EACH REPRESENTING 3 ORDINARY),40415F101,7158000.0,97896,0.008966349845200191,2021-08-13,2021-06-30,0001567619-21-015385
JNK,SPDR BBG BARC HIGH YIELD BND ETF,78468R622,7147000.0,65000,0.008952570877849366,2021-08-13,2021-06-30,0001567619-21-015385
JNK,SPDR BBG BARC HIGH YIELD BND ETF,78468R622,7147000.0,65000,0.008952570877849366,2021-08-13,2021-06-30,0001567619-21-015385
MC,MOELIS AND COMPANY CLASS A COMMON STOCK USD0.01,60786M105,7147000.0,125629,0.008952570877849366,2021-08-13,2021-06-30,0001567619-21-015385
FANG,DIAMONDBACK ENERGY INCORPORATED COMMON STOCK USD0.01,25278X109,7138000.0,76030,0.008941297177289602,2021-08-13,2021-06-30,0001567619-21-015385
CRM,SALESFORCE.COM INCORPORATED COMMON STOCK USD0.001,79466L302,7134000.0,29204,0.008936286643707483,2021-08-13,2021-06-30,0001567619-21-015385
FSLR,FIRST SOLAR INCORPORATED COMMON STOCK USD0.001,336433107,7125000.0,78724,0.008925012943147717,2021-08-13,2021-06-30,0001567619-21-015385
XLE,ENERGY SELECT SECTOR SPDR ETF,81369Y506,7104000.0,131864,0.008898707641841598,2021-08-13,2021-06-30,0001567619-21-015385
VNET,21VIANET GROUP INCORPORATED SPONSORED ADR (EACH REPRESENTS 6 ORDINARY SHARES),90138A103,7099000.0,309307,0.008892444474863951,2021-08-13,2021-06-30,0001567619-21-015385
BKE,BUCKLE INCORPORATED (THE) COMMON STOCK USD0.01,118440106,6981000.0,140324,0.008744633734191468,2021-08-13,2021-06-30,0001567619-21-015385
TDY,TELEDYNE TECHNOLOGIES INCORPORATED COMMON STOCK USD0.01,879360105,6975000.0,16654,0.008737117933818293,2021-08-13,2021-06-30,0001567619-21-015385
CSCO,CISCO SYSTEMS INCORPORATED USD0.001 (US LISTING),17275R102,6967000.0,131457,0.008727096866654056,2021-08-13,2021-06-30,0001567619-21-015385
CCS,CENTURY COMMUNITIES INC COMMON STOCK USD0.01,156504300,6957000.0,104559,0.00871457053269876,2021-08-13,2021-06-30,0001567619-21-015385
IDXX,IDEXX LABORATORIES CORP,45168D104,6947000.0,11000,0.008702044198743467,2021-08-13,2021-06-30,0001567619-21-015385
CNI,CANADIAN NATIONAL RAILWAY COMMON STOCK NPV,136375102,6940000.0,65766,0.00869327576497476,2021-08-13,2021-06-30,0001567619-21-015385
N/A,FIBROGEN INC COMMON STOCK USD0.01,31572Q808,6925000.0,260053,0.008674486264041817,2021-08-13,2021-06-30,0001567619-21-015385
VMC,VULCAN MATERIALS CO COM STK US$1,929160109,6923000.0,39771,0.008671980997250759,2021-08-13,2021-06-30,0001567619-21-015385
SHW,SHERWIN-WILLIAMS COMPANY (THE) COMMON STOCK USD1,824348106,6914000.0,25376,0.008660707296690991,2021-08-13,2021-06-30,0001567619-21-015385
FIS,FIDELITY NATIONAL INFORMATION INCORPORATED COMMON STOCK USD0.01,31620M106,6914000.0,48802,0.008660707296690991,2021-08-13,2021-06-30,0001567619-21-015385
EHC,ENCOMPASS HEALTH CORPORATION COMMON STOCK USD0.01,29261A100,6913000.0,88589,0.008659454663295462,2021-08-13,2021-06-30,0001567619-21-015385
GOOG,ALPHABET INCORPORATED-CL C NPV,02079K107,6892000.0,2750,0.008633149361989344,2021-08-13,2021-06-30,0001567619-21-015385
CSIQ,CANADIAN SOLAR INCORPORATED COMMON NPV (US LISTING),136635109,6867000.0,153137,0.008601833527101106,2021-08-13,2021-06-30,0001567619-21-015385
TEVA,TEVA PHARMACEUTICAL INDUSTRIES LIMITED SPONSORED ADR (EACH CONVERT INTO 1 ORDINARY ILS0.10),881624209,6852000.0,692127,0.008583044026168163,2021-08-13,2021-06-30,0001567619-21-015385
IAG,IAM GOLD CORP COMMON STOCK NPV,450913108,6847000.0,1875796,0.008576780859190515,2021-08-13,2021-06-30,0001567619-21-015385
MSFT,MICROSOFT CORPORATION COMMON STOCK USD0.0000125,594918104,6839000.0,25246,0.00856675979202628,2021-08-13,2021-06-30,0001567619-21-015385
MSFT,MICROSOFT CORPORATION COMMON STOCK USD0.0000125,594918104,6839000.0,25246,0.00856675979202628,2021-08-13,2021-06-30,0001567619-21-015385
MAR,MARRIOTT INTERNATIONAL INCORPORATED CLASS A COMMON STOCK USD1,571903202,6826000.0,50000,0.008550475557884395,2021-08-13,2021-06-30,0001567619-21-015385
BAC,VERIZON COMMUNICATIONS INCORPORATED COMMON STOCK USD0.10,92343V104,6793000.0,121233,0.008509138655831923,2021-08-13,2021-06-30,0001567619-21-015385
ESS,ESSEX PROPERTY TRUST INCORPORATED REIT NPV,297178105,6784000.0,22612,0.008497864955272157,2021-08-13,2021-06-30,0001567619-21-015385
N/A,ALCON INC CHF0.040000,H01301128,6783000.0,104710,0.008496612321876627,2021-08-13,2021-06-30,0001567619-21-015385
AAPL,APPLE INCORPORATED COMMON STOCK NPV,037833100,6774000.0,49462,0.008485338621316861,2021-08-13,2021-06-30,0001567619-21-015385
N/A,TRONOX HOLDINGS PLC-CLASS A,G9087Q102,6773000.0,302359,0.008484085987921332,2021-08-13,2021-06-30,0001567619-21-015385
HP,HELMERICH & PAYNE INCORPORATED COMMON STOCK USD0.10,423452101,6767000.0,207387,0.008476570187548155,2021-08-13,2021-06-30,0001567619-21-015385
AGNC,AGNC INVESTMENT CORPORATION REIT USD0.01,00123Q104,6766000.0,400564,0.008475317554152626,2021-08-13,2021-06-30,0001567619-21-015385
BABA,ALIBABA GROUP HOLDING LIMITED SPONSORED ADR (EACH REPRESENTS 1 ORDINARY SHARES USD0.000025),01609W102,6762000.0,29818,0.008470307020570509,2021-08-13,2021-06-30,0001567619-21-015385
AEP,AMERICAN ELECTRIC POWER COINC COMMON STOCK USD6.50,025537101,6723000.0,79482,0.008421454318144856,2021-08-13,2021-06-30,0001567619-21-015385
NVO,NOVO-NORDISK A/S-SPONS ADR 1.0000 ORD 1 ORD,670100205,6702000.0,80000,0.008395149016838738,2021-08-13,2021-06-30,0001567619-21-015385
CNQ,CANADIAN NATURAL RESOURCES LIMITED COMMON NPV,136385101,6695000.0,148781,0.00838638058307003,2021-08-13,2021-06-30,0001567619-21-015385
HWAYEUR,TIVITY HEALTH INCORPORATED COMMON STOCK USD0.001,88870R102,6691000.0,254331,0.008381370049487913,2021-08-13,2021-06-30,0001567619-21-015385
ARNC1EUR,ARCONIC CORPORATION USD0.01,03966V107,6650000.0,186680,0.008330012080271204,2021-08-13,2021-06-30,0001567619-21-015385
INTC,INTEL CORPORATION COMMON STOCK USD0.001,458140100,6639000.0,118251,0.008316233112920379,2021-08-13,2021-06-30,0001567619-21-015385
ARW,ARROW ELECTRONICS INCORPORATED COMMON STOCK USD1,042735100,6616000.0,58124,0.0082874225448232,2021-08-13,2021-06-30,0001567619-21-015385
DRNAUSD,DICERNA PHARMACEUTICALS INC COMMON STOCK USD0.0001,253031108,6579000.0,176277,0.008241075109188608,2021-08-13,2021-06-30,0001567619-21-015385
GTLS,CHART INDUSTRIES INCORPORATED COMMON STOCK USD0.01,16115Q308,6570000.0,44902,0.008229801408628843,2021-08-13,2021-06-30,0001567619-21-015385
BLKCHF,BLACKROCK INCORPORATED COMMON STOCK USD0.01,09247X101,6565000.0,7503,0.008223538241651195,2021-08-13,2021-06-30,0001567619-21-015385
MANH,MANHATTAN ASSOCS INC,562750109,6559000.0,45287,0.00821602244127802,2021-08-13,2021-06-30,0001567619-21-015385
HD,HOME DEPOT INCORPORATED (THE) COMMON STOCK USD0.05,437076102,6556000.0,20559,0.00821226454109143,2021-08-13,2021-06-30,0001567619-21-015385
IBN,ICICI BANK LIMITED SPONSORED ADR (EACH REPRESENTS 2 ORDINARY INR10),45104G104,6553000.0,383229,0.00820850664090484,2021-08-13,2021-06-30,0001567619-21-015385
IBN,ICICI BANK LIMITED SPONSORED ADR (EACH REPRESENTS 2 ORDINARY INR10),45104G104,6553000.0,383229,0.00820850664090484,2021-08-13,2021-06-30,0001567619-21-015385
MIC2EUR,MACQUARIE INFRASTRUCTURE CORPORATION COMMON STOCK USD1,55608B105,6549000.0,171134,0.008203496107322723,2021-08-13,2021-06-30,0001567619-21-015385
DLR,DIGITAL REALTY TRUST INCORPORATED REIT USD0.01,253868103,6549000.0,43528,0.008203496107322723,2021-08-13,2021-06-30,0001567619-21-015385
EL,ESTEE LAUDER COMPANIES INC CLASS'A'COM STK USD0.01,518439104,6524000.0,20510,0.008172180272434486,2021-08-13,2021-06-30,0001567619-21-015385
EQH,EQUITABLE HOLDINGS INCORPORATED COMMON STOCK USD0.01,29452E101,6418000.0,210771,0.008039401132508358,2021-08-13,2021-06-30,0001567619-21-015385
AMZN,AMAZON.COM INCORPORATED USD0.01,023135106,6402000.0,1861,0.008019358998179885,2021-08-13,2021-06-30,0001567619-21-015385
VT,VANGUARD TOTAL WORLD STOCK ETF,922042742,6344000.0,61229,0.007946706261239174,2021-08-13,2021-06-30,0001567619-21-015385
GWW,GRAINGER(W.W.) INC COMMON STOCK USD0.50,384802104,6328000.0,14448,0.007926664126910702,2021-08-13,2021-06-30,0001567619-21-015385
ORLY,O'REILLY AUTOMOTIVE INCORPORATED COMMON STOCK USD0.01,67103H107,6287000.0,11103,0.007875306157693992,2021-08-13,2021-06-30,0001567619-21-015385
N/A,AMDOCS LIMITED ORDINARY 1P (US LISTING),G02602103,6230000.0,80535,0.0078039060541488115,2021-08-13,2021-06-30,0001567619-21-015385
FL,FOOT LOCKER INCORPORATED COMMON STOCK USD0.01,344849104,6213000.0,100807,0.007782611286424809,2021-08-13,2021-06-30,0001567619-21-015385
USB,US BANCORP COMMON STOCK USD0.01,902973304,6206000.0,108937,0.007773842852656103,2021-08-13,2021-06-30,0001567619-21-015385
MMM,3M COMPANY COMMON STOCK USD0.01,88579Y101,6176000.0,31095,0.007736263850790219,2021-08-13,2021-06-30,0001567619-21-015385
PEO,EXELON CORPORATION COMMON STOCK NPV,30161N101,6170000.0,139242,0.007728748050417041,2021-08-13,2021-06-30,0001567619-21-015385
SHOP,SHOPIFY INCORPORATED - CLASS A NPV,82509L107,6137000.0,3385,0.007687411148364568,2021-08-13,2021-06-30,0001567619-21-015385
ADBE,ADOBE INCORPORATED NPV,00724F101,6127000.0,10462,0.0076748848144092725,2021-08-13,2021-06-30,0001567619-21-015385
MTCH,MATCH GROUP INC,57667L107,6109000.0,37887,0.007652337413289742,2021-08-13,2021-06-30,0001567619-21-015385
META,FACEBOOK INCORPORATED CLASS A COMMON STOCK USD0.000006,30303M102,6100000.0,17542,0.007641063712729975,2021-08-13,2021-06-30,0001567619-21-015385
AEO,AMERICAN EAGLE OUTFITTERS INCORPORATED COMMON STOCK USD0.01,02553E106,6096000.0,162440,0.007636053179147857,2021-08-13,2021-06-30,0001567619-21-015385
POWI,POWER INTERGRATION INCORPORATED COMMON STOCK USD0.10,739276103,6060000.0,73848,0.007590958376908796,2021-08-13,2021-06-30,0001567619-21-015385
AXP,AMERICAN EXPRESS COMPANY COMMON STOCK USD0.20,025816109,6057000.0,36661,0.0075872004767222065,2021-08-13,2021-06-30,0001567619-21-015385
TREX,TREX COMPANY INC COMMON STOCK USD0.01,89531P105,6047000.0,59163,0.007574674142766913,2021-08-13,2021-06-30,0001567619-21-015385
CHTR,CHARTER COMMUNICATIONS INCORPORATED COMMON STOCK USD0.001,16119P108,6035000.0,8365,0.007559642542020559,2021-08-13,2021-06-30,0001567619-21-015385
VGK,VANGUARD FTSE EUROPE ETF,922042874,6019000.0,89492,0.007539600407692085,2021-08-13,2021-06-30,0001567619-21-015385
RS,RELIANCE STEEL & ALUMINUM COMPANY COMMON STOCK NPV,759509102,5996000.0,39738,0.007510789839594908,2021-08-13,2021-06-30,0001567619-21-015385
CMS,CMS ENERGY CORPORATION COMMON STOCK USD0.01,125896100,5981000.0,101230,0.007492000338661964,2021-08-13,2021-06-30,0001567619-21-015385
CSCO,CISCO SYSTEMS INCORPORATED USD0.001 (US LISTING),17275R102,5944000.0,112152,0.007445652903027374,2021-08-13,2021-06-30,0001567619-21-015385
N/A,ROYALTY PHARMA PLC CLASS A,G7709Q104,5941000.0,144928,0.0074418950028407845,2021-08-13,2021-06-30,0001567619-21-015385
IAG,IAM GOLD CORP COMMON STOCK NPV,450913108,5941000.0,1627652,0.0074418950028407845,2021-08-13,2021-06-30,0001567619-21-015385
N/A,TRINSEO SA COMMON STOCK USD0.01,L9340P101,5941000.0,99283,0.0074418950028407845,2021-08-13,2021-06-30,0001567619-21-015385
LOGI,LOGITECH INTERNATIONAL SA CHF0.25 (REGISTERED),H50430232,5940000.0,52988,0.007440642369445255,2021-08-13,2021-06-30,0001567619-21-015385
WLL,WHITING PETROLEUM CORPORATION COMMON STOCK NPV,966387508,5940000.0,108884,0.007440642369445255,2021-08-13,2021-06-30,0001567619-21-015385
NFLX,NETFLIX INCORPORATED COMMON STOCK USD0.001,64110L106,5934000.0,11234,0.0074331265690720785,2021-08-13,2021-06-30,0001567619-21-015385
WB,WEIBO CORPORATION SPONSERED ADR(EACH REPRESENTS 1 ORDINARY SHARE),948596101,5926000.0,112623,0.007423105501907842,2021-08-13,2021-06-30,0001567619-21-015385
DT,DYNATRACE INCORPORATED USD0.001,268150109,5915000.0,101250,0.0074093265345570175,2021-08-13,2021-06-30,0001567619-21-015385
ERFGBP,ENERPLUS CORPORATION COMMON NPV,292766102,5895000.0,661584,0.007384273866646428,2021-08-13,2021-06-30,0001567619-21-015385
GPI,GROUP 1 AUTOMOTIVE INCORPORATED COMMON STOCK USD0.01,398905109,5885000.0,38109,0.007371747532691132,2021-08-13,2021-06-30,0001567619-21-015385
PCH,POTLATCHDELTIC CORPORATION REIT USD1,737630103,5843000.0,109940,0.007319136930078894,2021-08-13,2021-06-30,0001567619-21-015385
VRTS,VIRTUS INVESTMENT PARTNERS INCORPORATED COMMON STOCK USD0.01,92828Q109,5834000.0,21003,0.007307863229519128,2021-08-13,2021-06-30,0001567619-21-015385
LOW,LOWE'S COMPANIES INCORPORATED COMMON STOCK USD0.50,548661107,5794000.0,29871,0.007257757893697947,2021-08-13,2021-06-30,0001567619-21-015385
