ticker,nameOfIssuer,cusip,value,shares,allocation_percent,filingDate,reportDate,accessionNumber
MSFT,MICROSOFT CORPORATION COMMON STOCK USD0.0000125,594918104,2178673000.0,8042350,2.7290785577384518,2021-08-13,2021-06-30,0001567619-21-015385
BABA,ALIBABA GROUP HOLDING LIMITED SPONSORED ADR (EACH REPRESENTS 1 ORDINARY SHARES USD0.000025),01609W102,2091598000.0,9223027,2.62000550482272,2021-08-13,2021-06-30,0001567619-21-015385
GOOGL,ALPHABET INCORPORATED CL A NPV,02079K305,1893005000.0,775253,2.3712412809043295,2021-08-13,2021-06-30,0001567619-21-015385
BABA,ALIBABA GROUP HOLDING LIMITED SPONSORED ADR (EACH REPRESENTS 1 ORDINARY SHARES USD0.000025),01609W102,1710825000.0,7543984,2.143036528906764,2021-08-13,2021-06-30,0001567619-21-015385
AMZN,AMAZON.COM INCORPORATED USD0.01,023135106,1324131000.0,384904,1.6586507106558779,2021-08-13,2021-06-30,0001567619-21-015385
AAPL,APPLE INCORPORATED COMMON STOCK NPV,037833100,1105164000.0,8069243,1.384365333936969,2021-08-13,2021-06-30,0001567619-21-015385
YUMC,YUM CHINA HOLDINGS INCORPORATED HKD0.01,98850P109,986459000.0,1947600,1.235671486720639,2021-08-13,2021-06-30,0001567619-21-015385
META,FACEBOOK INCORPORATED CLASS A COMMON STOCK USD0.000006,30303M102,965210000.0,2775906,1.2090542796990327,2021-08-13,2021-06-30,0001567619-21-015385
TXN,TEXAS INSTRUMENTS INCORPORATED COMMON STOCK USD1,882508104,780374000.0,4058107,0.9775225334029414,2021-08-13,2021-06-30,0001567619-21-015385
UNH,UNITEDHEALTH GROUP INCORPORATED COMMON STOCK USD0.01,91324P102,776236000.0,1938457,0.9723391364122402,2021-08-13,2021-06-30,0001567619-21-015385
JPM,JPMORGAN CHASE AND COMPANY COMMON STOCK USD1,46625H100,734719000.0,4723663,0.9203335557300417,2021-08-13,2021-06-30,0001567619-21-015385
V,VISA INCORPORATED CLASS A COMMON STOCK USD0.0001,92826C839,711903000.0,3044662,0.8917534721776408,2021-08-13,2021-06-30,0001567619-21-015385
BABA,ALIBABA GROUP HOLDING LIMITED SPONSORED ADR (EACH REPRESENTS 1 ORDINARY SHARES USD0.000025),01609W102,708072000.0,3122284,0.8869546336393671,2021-08-13,2021-06-30,0001567619-21-015385
MELI,MERCADOLIBRE INCORPORATED COMMON STOCK USD0.001,58733R102,588578000.0,377829,0.7372724586739645,2021-08-13,2021-06-30,0001567619-21-015385
ITUB,ITAU UNIBANCO HOLDING SA ADR (EACH REPRESENTS 1 PREFERENCE SHARE),465562106,551619000.0,91783570,0.6909763810085896,2021-08-13,2021-06-30,0001567619-21-015385
CNI,CANADIAN NATIONAL RAILWAY COMMON STOCK NPV,136375102,547049000.0,5184312,0.6852518463910198,2021-08-13,2021-06-30,0001567619-21-015385
JNJ,JOHNSON AND JOHNSON COMMON STOCK USD1,478160104,542851000.0,3295197,0.6799932913965869,2021-08-13,2021-06-30,0001567619-21-015385
TD,TORONTO-DOMINION BANK (THE) COMMON NPV,891160509,523617000.0,6027590,0.6559001406669724,2021-08-13,2021-06-30,0001567619-21-015385
INTC,INTEL CORPORATION COMMON STOCK USD0.001,458140100,516371000.0,9197919,0.6468235590829656,2021-08-13,2021-06-30,0001567619-21-015385
ADBE,ADOBE INCORPORATED NPV,00724F101,506567000.0,864981,0.6345427412731944,2021-08-13,2021-06-30,0001567619-21-015385
PG,PROCTER AND GAMBLE COMPANY (THE) COMMON STOCK NPV,742718109,500783000.0,3711431,0.6272975097134518,2021-08-13,2021-06-30,0001567619-21-015385
UNP,UNION PACIFIC CORPORATION COMMON STOCK USD2.50,907818108,487899000.0,2218428,0.6111585810454496,2021-08-13,2021-06-30,0001567619-21-015385
BKNG,BOOKING HOLDINGS INCORPORATED COMMON STOCK USD0.008,09857L108,451720000.0,206445,0.5658395574285877,2021-08-13,2021-06-30,0001567619-21-015385
N/A,ALCON INC CHF0.040000,H01301128,443653000.0,6848604,0.5557345638268512,2021-08-13,2021-06-30,0001567619-21-015385
VOO,VANGUARD INDEX FUNDS S&P 500 ETF,922908363,442430000.0,1124288,0.5542025931841186,2021-08-13,2021-06-30,0001567619-21-015385
LOW,LOWE'S COMPANIES INCORPORATED COMMON STOCK USD0.50,548661107,439572000.0,2266184,0.5506225669396952,2021-08-13,2021-06-30,0001567619-21-015385
BMY,BRISTOL-MYERS SQUIBB COMPANY COMMON STOCK USD0.10,110122108,431066000.0,6451151,0.5399676672773213,2021-08-13,2021-06-30,0001567619-21-015385
ITUB,ITAU UNIBANCO HOLDING SA ADR (EACH REPRESENTS 1 PREFERENCE SHARE),465562106,427440000.0,71121464,0.5354256185851313,2021-08-13,2021-06-30,0001567619-21-015385
SE,SEA LIMITED ADR (EACH REPRESENTS 1 ORDINARY SHARES),81141R100,425144000.0,1548231,0.5325495723089956,2021-08-13,2021-06-30,0001567619-21-015385
BKNG,BOOKING HOLDINGS INCORPORATED COMMON STOCK USD0.008,09857L108,390981000.0,178686,0.48975585761752105,2021-08-13,2021-06-30,0001567619-21-015385
MRK,MERCK AND COMPANY INCORPORATED NEW COMMON STOCK USD0.01,58933Y105,378040000.0,4860994,0.47354552884597373,2021-08-13,2021-06-30,0001567619-21-015385
TT,TRANE TECHNOLOGIES PLC USD1,G8994E103,376599000.0,2045176,0.4717404841230157,2021-08-13,2021-06-30,0001567619-21-015385
JD,JD.COM INCORPORATED ADR (EACH REPRESENTING 2 SHARES),47215P106,349476000.0,4378844,0.43776530853606904,2021-08-13,2021-06-30,0001567619-21-015385
AXP,AMERICAN EXPRESS COMPANY COMMON STOCK USD0.20,025816109,345446000.0,2090696,0.43271719595208513,2021-08-13,2021-06-30,0001567619-21-015385
PFE,PFIZER INCORPORATED COMMON STOCK USD0.05,717081103,339808000.0,8677430,0.42565484886808974,2021-08-13,2021-06-30,0001567619-21-015385
MA,MASTERCARD INCORPORATED CLASS A COMMON STOCK USD0.0001,57636Q104,337064000.0,923235,0.4222176228307568,2021-08-13,2021-06-30,0001567619-21-015385
COP,CONOCOPHILLIPS INCORPORATED COMMON STOCK USD0.01,20825C104,335665000.0,5511736,0.420465188710411,2021-08-13,2021-06-30,0001567619-21-015385
YUMC,YUM CHINA HOLDINGS INCORPORATED COMMON STOCK USD0.01,98850P109,335308000.0,5061260,0.420017998588207,2021-08-13,2021-06-30,0001567619-21-015385
KO,COCA-COLA COMPANY (THE) COMMON STOCK USD0.25,191216100,328888000.0,6078134,0.41197609218890757,2021-08-13,2021-06-30,0001567619-21-015385
FRCB,FIRST REPUBLIC BANK/SAN FRANCISCO CA COMMON STOCK USD0.01,33616C100,324067000.0,1731404,0.4059371465890599,2021-08-13,2021-06-30,0001567619-21-015385
PM,PHILIP MORRIS INTERNATIONAL INCORPORATED COMMON STOCK NPV,718172109,323272000.0,3261749,0.40494130303961384,2021-08-13,2021-06-30,0001567619-21-015385
JD,JD.COM INCORPORATED ADR (EACH REPRESENTING 2 SHARES),47215P106,323209000.0,4049734,0.40486238713569556,2021-08-13,2021-06-30,0001567619-21-015385
YUMC,YUM CHINA HOLDINGS INCORPORATED HKD0.01,98850P109,317044000.0,625950,0.39713990225225615,2021-08-13,2021-06-30,0001567619-21-015385
YUMC,YUM CHINA HOLDINGS INCORPORATED HKD0.01,98850P109,317044000.0,625950,0.39713990225225615,2021-08-13,2021-06-30,0001567619-21-015385
N/A,ALCON INC CHF0.040000,H01301128,309786000.0,4782122,0.388048289067503,2021-08-13,2021-06-30,0001567619-21-015385
ELV,ANTHEM INCORPORATED COMMON STOCK USD0.01,036752103,295843000.0,774863,0.3705828216336351,2021-08-13,2021-06-30,0001567619-21-015385
DHR,DANAHER CORPORATION COMMON STOCK USD0.01,235851102,286992000.0,1069429,0.35949576344980344,2021-08-13,2021-06-30,0001567619-21-015385
ACN,ACCENTURE PLC CLASS A NEW COMMON STOCK USD0.0000225,G1151C101,285577000.0,968746,0.35772328719512925,2021-08-13,2021-06-30,0001567619-21-015385
LLY,ELI LILLY AND COMPANY COMMON STOCK NPV,532457108,284381000.0,1239025,0.35622513765407593,2021-08-13,2021-06-30,0001567619-21-015385
TMO,THERMO FISHER SCIENTIFIC INCORPORATED COMMON STOCK USD1,883556102,281035000.0,557090,0.35203382631263425,2021-08-13,2021-06-30,0001567619-21-015385
YUMC,YUM CHINA HOLDINGS INCORPORATED COMMON STOCK USD0.01,98850P109,279688000.0,4221707,0.350346529128856,2021-08-13,2021-06-30,0001567619-21-015385
VALE,VALE DO RIO DOCE (CIA) SPONSORED ADR (REPRESENTING 1 ORDINARY NPV),91912E105,276095000.0,12104120,0.34584581733871844,2021-08-13,2021-06-30,0001567619-21-015385
DWD,MORGAN STANLEY COMMON STOCK USD0.01,617446448,275053000.0,2999811,0.34454057334057675,2021-08-13,2021-06-30,0001567619-21-015385
CSCO,CISCO SYSTEMS INCORPORATED USD0.001 (US LISTING),17275R102,265317000.0,5005988,0.33234493460170145,2021-08-13,2021-06-30,0001567619-21-015385
INFY,INFOSYS LIMITED SPONSORED ADR (EACH REPRESENTS 1 ORDINARY INR5),456788108,264808000.0,12496825,0.33170734420337694,2021-08-13,2021-06-30,0001567619-21-015385
SE,SEA LIMITED ADR (EACH REPRESENTS 1 ORDINARY SHARES),81141R100,258051000.0,939733,0.3232433003497841,2021-08-13,2021-06-30,0001567619-21-015385
BABA,ALIBABA GROUP HOLDING LIMITED SPONSORED ADR (EACH REPRESENTS 1 ORDINARY SHARES USD0.000025),01609W102,251731000.0,1110025,0.31532665729003767,2021-08-13,2021-06-30,0001567619-21-015385
BABA,ALIBABA GROUP HOLDING LIMITED SPONSORED ADR (EACH REPRESENTS 1 ORDINARY SHARES USD0.000025),01609W102,251731000.0,1110025,0.31532665729003767,2021-08-13,2021-06-30,0001567619-21-015385
NVDA,NVIDIA CORPORATION COMMON STOCK USD0.001,67066G104,244315000.0,305355,0.30603712802879085,2021-08-13,2021-06-30,0001567619-21-015385
UPS,UNITED PARCELS SERVICE CLASS B COMMON STOCK USD0.01,911312106,242026000.0,1163753,0.3031698501864238,2021-08-13,2021-06-30,0001567619-21-015385
MMM,3M COMPANY COMMON STOCK USD0.01,88579Y101,240784000.0,1212224,0.3016140795091762,2021-08-13,2021-06-30,0001567619-21-015385
IBM,INTL BUSINESS MACHINES CORPORATION COMMON STOCK USD0.20,459200101,239466000.0,1633575,0.2999631086938683,2021-08-13,2021-06-30,0001567619-21-015385
AMGN,AMGEN INCORPORATED COMMON STOCK USD0.0001,031162100,238510000.0,978504,0.2987655911677421,2021-08-13,2021-06-30,0001567619-21-015385
INTU,INTUIT INC COMMON STOCK USD0.01,461202103,235148000.0,479727,0.29455423769197187,2021-08-13,2021-06-30,0001567619-21-015385
MELI,MERCADOLIBRE INCORPORATED COMMON STOCK USD0.001,58733R102,234069000.0,150257,0.29320264625819553,2021-08-13,2021-06-30,0001567619-21-015385
COST,COSTCO WHOLESALE CORPORATION COMMON STOCK USD0.01,22160K105,232639000.0,587961,0.29141138050258836,2021-08-13,2021-06-30,0001567619-21-015385
HD,HOME DEPOT INCORPORATED (THE) COMMON STOCK USD0.05,437076102,232568000.0,729305,0.2913224435315057,2021-08-13,2021-06-30,0001567619-21-015385
BLKCHF,BLACKROCK INCORPORATED COMMON STOCK USD0.01,09247X101,229022000.0,261748,0.2868806055109581,2021-08-13,2021-06-30,0001567619-21-015385
NEE,NEXTERA ENERGY INCORPORATED COMMON STOCK USD0.01,65339F101,229001000.0,3125019,0.28685430020965197,2021-08-13,2021-06-30,0001567619-21-015385
N/A,CNH INDUSTRIAL NV EUR0.01 (ITALIAN LISTING),N20944109,224558000.0,16126262,0.28128885003331444,2021-08-13,2021-06-30,0001567619-21-015385
FSLR,FIRST SOLAR INCORPORATED COMMON STOCK USD0.001,336433107,215345000.0,2379235,0.2697483385603011,2021-08-13,2021-06-30,0001567619-21-015385
IVV,ISHARES TRUST CORE SnP 500 ETF,464287200,209482000.0,487257,0.2624041489623116,2021-08-13,2021-06-30,0001567619-21-015385
SHW,SHERWIN-WILLIAMS COMPANY (THE) COMMON STOCK USD1,824348106,209086000.0,767428,0.2619081061376819,2021-08-13,2021-06-30,0001567619-21-015385
YUMC,YUM CHINA HOLDINGS INCORPORATED COMMON STOCK USD0.01,98850P109,208066000.0,3140618,0.2606304200742418,2021-08-13,2021-06-30,0001567619-21-015385
VALE,VALE DO RIO DOCE (CIA) SPONSORED ADR (REPRESENTING 1 ORDINARY NPV),91912E105,205480000.0,9008323,0.2573911101134025,2021-08-13,2021-06-30,0001567619-21-015385
N/A,NEW ORIENTAL EDUCATION & TECHNOLOGY GROUP INCORPORATED SPONSORED ADR USD0.01 (EACH REPRESENTS 1 ORDINARY SHARES),647581107,204180000.0,24930446,0.25576268669921415,2021-08-13,2021-06-30,0001567619-21-015385
STLA,STELLANTIS NV EUR0.01,N82405106,204032000.0,12325257,0.2555772969566758,2021-08-13,2021-06-30,0001567619-21-015385
HCA,HCA HEALTHCARE INCORPORATED COMMON STOCK USD0.01,40412C101,202867000.0,981266,0.25411797905088396,2021-08-13,2021-06-30,0001567619-21-015385
VRT,VERTIV HOLDINGS CLASS A USD0.0001,92537N108,202710000.0,7425273,0.2539213156077858,2021-08-13,2021-06-30,0001567619-21-015385
AVGO,BROADCOM INCORPORATED COMMON STOCK NPV,11135F101,201313000.0,422181,0.2521713867542311,2021-08-13,2021-06-30,0001567619-21-015385
SE,SEA LIMITED ADR (EACH REPRESENTS 1 ORDINARY SHARES),81141R100,200769000.0,731131,0.25148995418706305,2021-08-13,2021-06-30,0001567619-21-015385
DIDIY,DIDI GLOBAL  ADR REPRESENTING INC 0.25 ORD,23292E108,199830000.0,14132236,0.2503137314286608,2021-08-13,2021-06-30,0001567619-21-015385
KMB,KIMBERLY-CLARK CORPORATION COMMON STOCK USD1.25,494368103,196754000.0,1470730,0.24646063110401206,2021-08-13,2021-06-30,0001567619-21-015385
EW,EDWARDS LIFESCIENCES CORPORATION COMMON STOCK USD1,28176E108,194217000.0,1875227,0.2432827001795537,2021-08-13,2021-06-30,0001567619-21-015385
MSFT,MICROSOFT CORPORATION COMMON STOCK USD0.0000125,594918104,193899000.0,715758,0.24288436275977532,2021-08-13,2021-06-30,0001567619-21-015385
DE,DEERE & COMPANY COMMON STOCK USD1,244199105,191170000.0,542002,0.23946592622337534,2021-08-13,2021-06-30,0001567619-21-015385
PEP,PEPSICO INCORPORATED CAPITAL STOCK USD0.016666,713448108,190108000.0,1283038,0.23813562955732298,2021-08-13,2021-06-30,0001567619-21-015385
ABBV,ABBVIE INCORPORATED COMMON STOCK USD0.01,00287Y109,185319000.0,1645231,0.23213676822613222,2021-08-13,2021-06-30,0001567619-21-015385
PAGS,PAGSEGURO DIGITAL LIMITED COMMON STOCK NPV,G68707101,184861000.0,3305820,0.23156306213097969,2021-08-13,2021-06-30,0001567619-21-015385
ATVIEUR,ACTIVISION BLIZZARD INCORPORATED COMMON STOCK USD0.000001,00507V109,181567000.0,1902423,0.22743688772610549,2021-08-13,2021-06-30,0001567619-21-015385
NKE,NIKE INCORPORATED CLASS B COMMON STOCK NPV,654106103,179464000.0,1161653,0.22480259969530694,2021-08-13,2021-06-30,0001567619-21-015385
GOOG,ALPHABET INCORPORATED-CL C NPV,02079K107,177232000.0,70714,0.2220067219564851,2021-08-13,2021-06-30,0001567619-21-015385
PYPL,PAYPAL HOLDINGS INCORPORATED COMMON STOCK USD0.0001,70450Y103,176703000.0,606226,0.22134407889024998,2021-08-13,2021-06-30,0001567619-21-015385
OMC,OMNICOM GROUP INC COMMON STOCK USD0.15,681919106,172752000.0,2159664,0.2163949243445129,2021-08-13,2021-06-30,0001567619-21-015385
ORCL,ORACLE CORPORATION COMMON STOCK USD0.01,68389X105,166623000.0,2140577,0.2087175342633126,2021-08-13,2021-06-30,0001567619-21-015385
BAC,VERIZON COMMUNICATIONS INCORPORATED COMMON STOCK USD0.10,92343V104,166049000.0,2963572,0.20799852269427865,2021-08-13,2021-06-30,0001567619-21-015385
N/A,LINDE PUBLIC LIMITED COMPANY EUR0.001,G5494J103,163449000.0,565371,0.20474167586590195,2021-08-13,2021-06-30,0001567619-21-015385
TROW,PRICE T.ROWE GROUP INCORPORATED COMMON STOCK USD0.20,74144T108,161749000.0,817039,0.20261219909350178,2021-08-13,2021-06-30,0001567619-21-015385
MSFT,MICROSOFT CORPORATION COMMON STOCK USD0.0000125,594918104,160252000.0,591555,0.20073700690039412,2021-08-13,2021-06-30,0001567619-21-015385
GOOGL,ALPHABET INCORPORATED CL A NPV,02079K305,156590000.0,64129,0.19614986340596505,2021-08-13,2021-06-30,0001567619-21-015385
QCOM,QUALCOMM INCORPORATED COMMON STOCK USD0.0001,747525103,153931000.0,1076971,0.19281911120725212,2021-08-13,2021-06-30,0001567619-21-015385
AIZ,ASSURANT INCORPORATED COMMON STOCK USD0.01,04621X108,152682000.0,977605,0.19125457209623575,2021-08-13,2021-06-30,0001567619-21-015385
PLD,PROLOGIS INCORPORATED REIT USD0.01,74340W103,152561000.0,1276341,0.1911030034553767,2021-08-13,2021-06-30,0001567619-21-015385
CL,COLGATE-PALMOLIVE COMPANY COMMON STOCK USD1,194162103,151651000.0,1864176,0.18996310706544484,2021-08-13,2021-06-30,0001567619-21-015385
SLB,SCHLUMBERGER LIMITED COMMON STOCK USD0.01,806857108,151486000.0,4732474,0.1897564225551825,2021-08-13,2021-06-30,0001567619-21-015385
ABT,ABBOTT LABORATORIES COMMON STOCK NPV,002824100,149527000.0,1289802,0.18730251373334017,2021-08-13,2021-06-30,0001567619-21-015385
HSY,HERSHEY COMPANY (THE) COMMON STOCK USD1,427866108,148335000.0,851617,0.185809374725869,2021-08-13,2021-06-30,0001567619-21-015385
USB,US BANCORP COMMON STOCK USD0.01,902973304,146776000.0,2576367,0.1838565192622385,2021-08-13,2021-06-30,0001567619-21-015385
NDAQ,NASDAQ INCORPORATED COMMON STOCK USD0.01,631103108,145315000.0,826590,0.18202642187136991,2021-08-13,2021-06-30,0001567619-21-015385
MDT,MEDTRONIC PLC USD0.10,G5960L103,141816000.0,1142478,0.17764345762041217,2021-08-13,2021-06-30,0001567619-21-015385
NVR,NVR INCORPORATED COMMON STOCK USD0.01,62944T105,140998000.0,28351,0.17661880350286904,2021-08-13,2021-06-30,0001567619-21-015385
KR,KROGER COMPANY (THE) COMMON STOCK USD1,501044101,139997000.0,3654333,0.175364917473944,2021-08-13,2021-06-30,0001567619-21-015385
OTIS,OTIS WORLDWIDE CORP USD0.01,68902V107,139507000.0,1706090,0.17475112711013455,2021-08-13,2021-06-30,0001567619-21-015385
MCO,MOODY'S CORPORATION COMMON STOCK USD0.01,615369105,139457000.0,384848,0.17468849544035805,2021-08-13,2021-06-30,0001567619-21-015385
7HP,HP INCORPORATED COMMON STOCK USD0.01,40434L105,135108000.0,4475255,0.16924079280320026,2021-08-13,2021-06-30,0001567619-21-015385
META,FACEBOOK INCORPORATED CLASS A COMMON STOCK USD0.000006,30303M102,134946000.0,388100,0.16903786619312447,2021-08-13,2021-06-30,0001567619-21-015385
N/A,YANDEX NV CLASS A USD0.01 (US LISTING),N97284108,134432000.0,1900096,0.16839401262782233,2021-08-13,2021-06-30,0001567619-21-015385
CHTR,CHARTER COMMUNICATIONS INCORPORATED COMMON STOCK USD0.001,16119P108,133752000.0,185393,0.16754222191886226,2021-08-13,2021-06-30,0001567619-21-015385
DIS,WALT DISNEY COMPANY (THE) COMMON STOCK USD0.01,254687106,133627000.0,760238,0.16738564274442108,2021-08-13,2021-06-30,0001567619-21-015385
UNH,UNITEDHEALTH GROUP INCORPORATED COMMON STOCK USD0.01,91324P102,132451000.0,330764,0.16591254587127838,2021-08-13,2021-06-30,0001567619-21-015385
AME,AMETEK INC COMMON STOCK USD0.01,031100100,131828000.0,987473,0.1651321552658635,2021-08-13,2021-06-30,0001567619-21-015385
MSCI,MSCI INCORPORATED COMMON STOCK USD0.01,55354G100,131768000.0,247183,0.16505699726213172,2021-08-13,2021-06-30,0001567619-21-015385
EQIX,EQUINIX INCORPORATED REIT USD0.001,29444U700,131256000.0,163538,0.1644156489636206,2021-08-13,2021-06-30,0001567619-21-015385
AZO,AUTOZONE INCORPORATED COMMON STOCK USD0.01,053332102,130962000.0,87763,0.16404737474533493,2021-08-13,2021-06-30,0001567619-21-015385
ORLY,O'REILLY AUTOMOTIVE INCORPORATED COMMON STOCK USD0.01,67103H107,128841000.0,227550,0.16139053931341685,2021-08-13,2021-06-30,0001567619-21-015385
TGT,TARGET CORPORATION COMMON STOCK USD0.167,87612E106,128692000.0,532357,0.16120389693748297,2021-08-13,2021-06-30,0001567619-21-015385
AWN,ADVANCE AUTO PARTS INCORPORATED COMMON STOCK USD0.0001,00751Y106,127227000.0,620196,0.15936878901303225,2021-08-13,2021-06-30,0001567619-21-015385
ITW,ILLINOIS TOOL WORKS INC COMMON STOCK NPV,452308109,124558000.0,557157,0.156025510480364,2021-08-13,2021-06-30,0001567619-21-015385
MO,ALTRIA GROUP INCORPORATED COMMON STOCK USD0.3333,02209S103,123531000.0,2590839,0.15473905598315518,2021-08-13,2021-06-30,0001567619-21-015385
TX,TERNIUM SA ADR (EACH REPRESENTS 10 ORDINARY NPV),880890108,122809000.0,3193161,0.1538346546715829,2021-08-13,2021-06-30,0001567619-21-015385
SEDG,SOLAREDGE TECHNOLOGIES INCORPORATED COMMON STOCK USD0.0001,83417M104,121253000.0,438733,0.15188555710813897,2021-08-13,2021-06-30,0001567619-21-015385
V,VISA INCORPORATED CLASS A COMMON STOCK USD0.0001,92826C839,120937000.0,517224,0.15148972495515164,2021-08-13,2021-06-30,0001567619-21-015385
PH,PARKER-HANNIFIN CORPORATION COMMON STOCK USD0.5,701094104,120598000.0,392688,0.15106508223406714,2021-08-13,2021-06-30,0001567619-21-015385
AMZN,AMAZON.COM INCORPORATED USD0.01,023135106,120247000.0,34954,0.1506254079122363,2021-08-13,2021-06-30,0001567619-21-015385
N/A,NEW ORIENTAL EDUCATION & TECHNOLOGY GROUP INCORPORATED SPONSORED ADR USD0.01 (EACH REPRESENTS 1 ORDINARY SHARES),647581107,120124000.0,14667214,0.15047133400458618,2021-08-13,2021-06-30,0001567619-21-015385
ON,ON SEMICONDUCTOR CORPORATION COMMON STOCK USD0.01,682189105,118322000.0,3090959,0.148214088625842,2021-08-13,2021-06-30,0001567619-21-015385
HDB,HDFC BANK LIMITED ADR (EACH REPRESENTING 3 ORDINARY),40415F101,116338000.0,1591049,0.14572886396911147,2021-08-13,2021-06-30,0001567619-21-015385
TD,TORONTO-DOMINION BANK (THE) COMMON NPV,891160509,116048000.0,1335883,0.14536560028440793,2021-08-13,2021-06-30,0001567619-21-015385
DFSEUR,DISCOVER FINANCIAL SERVICES COMMON STOCK USD0.01,254709108,115453000.0,976018,0.14462028341406785,2021-08-13,2021-06-30,0001567619-21-015385
FAST,FASTENAL COMPANY USD 0.01,311900104,113569000.0,2184025,0.14226032209689027,2021-08-13,2021-06-30,0001567619-21-015385
GOOG,ALPHABET INCORPORATED-CL C NPV,02079K107,113243000.0,45183,0.14185196360994765,2021-08-13,2021-06-30,0001567619-21-015385
LOGI,LOGITECH INTERNATIONAL SA CHF0.25 (REGISTERED),H50430232,113173000.0,1009575,0.1417642792722606,2021-08-13,2021-06-30,0001567619-21-015385
SERVUSD,TERMINIX GLOBAL HOLDINGS INCORPORATED USD0.01,88087E100,112232000.0,2352381,0.14058555124706731,2021-08-13,2021-06-30,0001567619-21-015385
DXCM,DEXCOM INCORPORATED COMMON STOCK USD0.001,252131107,112218000.0,262806,0.1405680143795299,2021-08-13,2021-06-30,0001567619-21-015385
HON,HONEYWELL INTERNATIONAL INCORPORATED COMMON STOCK USD1,438516106,109857000.0,500829,0.13761054693268474,2021-08-13,2021-06-30,0001567619-21-015385
TMO,THERMO FISHER SCIENTIFIC INCORPORATED COMMON STOCK USD1,883556102,109229000.0,216523,0.1368238931602922,2021-08-13,2021-06-30,0001567619-21-015385
JPM,JPMORGAN CHASE AND COMPANY COMMON STOCK USD1,46625H100,108854000.0,699846,0.13635415563696865,2021-08-13,2021-06-30,0001567619-21-015385
AIG,AMERICAN INTERNATIONAL GROUP INCORPORATED COMMON STOCK USD2.50,026874784,108127000.0,2271572,0.13544349115841872,2021-08-13,2021-06-30,0001567619-21-015385
YUMC,YUM CHINA HOLDINGS INCORPORATED HKD0.01,98850P109,107226000.0,211700,0.1343148684690466,2021-08-13,2021-06-30,0001567619-21-015385
TSM,TAIWAN SEMICONDUCTOR MANUFACTURING COMPANY LIMITED ADS REPRESENTING 5 COMMON SHARES,874039100,107185000.0,892017,0.1342635104998299,2021-08-13,2021-06-30,0001567619-21-015385
WNSN,WNS HOLDINGS LIMITED ADR (EACH REPRESENTS 1 ORDINARY),92932M101,106522000.0,1333694,0.13343301455859385,2021-08-13,2021-06-30,0001567619-21-015385
NFLX,NETFLIX INCORPORATED COMMON STOCK USD0.001,64110L106,105089000.0,198953,0.13163799090280007,2021-08-13,2021-06-30,0001567619-21-015385
EOG,EOG RESOURCES INCORPORATED COMMON STOCK USD0.01,26875P101,104018000.0,1246615,0.13029642053618795,2021-08-13,2021-06-30,0001567619-21-015385
IDXX,IDEXX LABORATORIES CORP,45168D104,103099000.0,163248,0.12914525044569636,2021-08-13,2021-06-30,0001567619-21-015385
OC,OWENS CORNING INCORPORATED COMMON STOCK USD0.01,690742101,102972000.0,1051807,0.1289861660044641,2021-08-13,2021-06-30,0001567619-21-015385
EL,ESTEE LAUDER COMPANIES INC CLASS'A'COM STK USD0.01,518439104,102482000.0,322188,0.12837237564065465,2021-08-13,2021-06-30,0001567619-21-015385
TDC,TERADATA CORPORATION COMMON STOCK USD0.01,88076W103,101747000.0,2036165,0.12745169009494048,2021-08-13,2021-06-30,0001567619-21-015385
META,FACEBOOK INCORPORATED CLASS A COMMON STOCK USD0.000006,30303M102,101741000.0,292603,0.12744417429456728,2021-08-13,2021-06-30,0001567619-21-015385
MMM,3M COMPANY COMMON STOCK USD0.01,88579Y101,101712000.0,512067,0.12740784792609694,2021-08-13,2021-06-30,0001567619-21-015385
PAGS,PAGSEGURO DIGITAL LIMITED COMMON STOCK NPV,G68707101,101678000.0,1818281,0.12736525839064894,2021-08-13,2021-06-30,0001567619-21-015385
LLY,ELI LILLY AND COMPANY COMMON STOCK NPV,532457108,100359000.0,437257,0.12571303494194552,2021-08-13,2021-06-30,0001567619-21-015385
T,AT AND T INCORPORATED COMMON STOCK USD1,00206R102,100256000.0,3483534,0.12558401370220598,2021-08-13,2021-06-30,0001567619-21-015385
FBIN,FORTUNE BRANDS HOME AND SECURITY INCORPORATED COMMON STOCK USD0.01,34964C106,99715000.0,1001056,0.12490633903522452,2021-08-13,2021-06-30,0001567619-21-015385
MU,MICRON TECHNOLOGY INCORPORATED COMMON STOCK USD0.10,595112103,98296000.0,1156691,0.12312885224696815,2021-08-13,2021-06-30,0001567619-21-015385
TCOM,TRIP.COM GROUP LIMITED CNY0.01,89677Q107,98214000.0,2769701,0.12302613630853472,2021-08-13,2021-06-30,0001567619-21-015385
TCOM,TRIP.COM GROUP LIMITED CNY0.01,89677Q107,98214000.0,2769701,0.12302613630853472,2021-08-13,2021-06-30,0001567619-21-015385
VVV,VALVOLINE INCORPORATED COMMON STOCK USD0.01,92047W101,98150000.0,3023715,0.12294596777122084,2021-08-13,2021-06-30,0001567619-21-015385
FTV,FORTIVE CORPORATION COMMON STOCK USD0.01,34959J108,97980000.0,1404939,0.12273302009398082,2021-08-13,2021-06-30,0001567619-21-015385
VMC,VULCAN MATERIALS CO COM STK US$1,929160109,97791000.0,561793,0.12249627238222575,2021-08-13,2021-06-30,0001567619-21-015385
UDR,UDR INCORPORATED REIT USD0.01,902653104,97437000.0,1989315,0.1220528401602083,2021-08-13,2021-06-30,0001567619-21-015385
CRM,SALESFORCE.COM INCORPORATED COMMON STOCK USD0.001,79466L302,97216000.0,397985,0.12177600817979628,2021-08-13,2021-06-30,0001567619-21-015385
UNVREUR,UNIVAR SOLUTIONS INC COMMON STOCK USD0.01,91336L107,96985000.0,3978059,0.12148664986542897,2021-08-13,2021-06-30,0001567619-21-015385
BAC,BANK OF AMERICA CORPORATION COMMON STOCK USD0.01,060505104,96440000.0,2339074,0.12080396466486538,2021-08-13,2021-06-30,0001567619-21-015385
EHC,ENCOMPASS HEALTH CORPORATION COMMON STOCK USD0.01,29261A100,95352000.0,1221996,0.1194410995305293,2021-08-13,2021-06-30,0001567619-21-015385
VIAV,VIAVI SOLUTIONS INCORPORATED COMMON STOCK USD0.001,925550105,95142000.0,5387420,0.11917804651746808,2021-08-13,2021-06-30,0001567619-21-015385
TAP,MOLSON COORS BEVERAGE COMPANY USD0.01,60871R209,95085000.0,1771000,0.11910664641392292,2021-08-13,2021-06-30,0001567619-21-015385
AMZN,AMAZON.COM INCORPORATED USD0.01,023135106,94278000.0,27405,0.1180957712637306,2021-08-13,2021-06-30,0001567619-21-015385
N/A,LAM RESEARCH CORP COMMON STOCK NPV,512807108,93746000.0,144070,0.1174293702973089,2021-08-13,2021-06-30,0001567619-21-015385
CB,CHUBB LIMITED COMMON STOCK CHF24.77,H1467J104,93394000.0,587603,0.11698844334208253,2021-08-13,2021-06-30,0001567619-21-015385
CNI,CANADIAN NATIONAL RAILWAY COMMON STOCK NPV,136375102,93071000.0,882024,0.11658384275532649,2021-08-13,2021-06-30,0001567619-21-015385
SMTC,SEMTECH CORPORATION COMMON STOCK USD0.01,816850101,92957000.0,1351121,0.11644104254823612,2021-08-13,2021-06-30,0001567619-21-015385
