ticker,nameOfIssuer,cusip,value,shares,allocation_percent,filingDate,reportDate,accessionNumber
AJG,GALLAGHER (ARTHUR J.) & COMPANY COMMON STOCK USD1,363576109,1303000.0,9304,0.001632181314374944,2021-08-13,2021-06-30,0001567619-21-015385
COLL,COLLEGIUM PHARMACEUTICAL INC COMMON STOCK USD0.001,19459J104,1300000.0,55002,0.0016284234141883554,2021-08-13,2021-06-30,0001567619-21-015385
NTR,NUTRIEN LIMITED NPV,67077M108,1300000.0,17306,0.0016284234141883554,2021-08-13,2021-06-30,0001567619-21-015385
VOO,VANGUARD INDEX FUNDS S&P 500 ETF,922908363,1299000.0,3300,0.001627170780792826,2021-08-13,2021-06-30,0001567619-21-015385
VOO,VANGUARD INDEX FUNDS S&P 500 ETF,922908363,1299000.0,3300,0.001627170780792826,2021-08-13,2021-06-30,0001567619-21-015385
CSGP,COSTAR GROUP INCORPORATED COMMON STOCK USD0.01,22160N109,1298000.0,15670,0.0016259181473972965,2021-08-13,2021-06-30,0001567619-21-015385
8CW,CROWN CASTLE INTERNATIONAL CORPORATION REIT USD0.01,22822V101,1295000.0,6638,0.0016221602472107082,2021-08-13,2021-06-30,0001567619-21-015385
TT,TRANE TECHNOLOGIES PLC USD1,G8994E103,1294000.0,7027,0.0016209076138151784,2021-08-13,2021-06-30,0001567619-21-015385
TT,TRANE TECHNOLOGIES PLC USD1,G8994E103,1294000.0,7027,0.0016209076138151784,2021-08-13,2021-06-30,0001567619-21-015385
EEM,ISHARES TRUST MSCI EMERGING MARKETS ETF,464287234,1293000.0,23446,0.001619654980419649,2021-08-13,2021-06-30,0001567619-21-015385
D,DOMINION ENERGY INCORPORATED (VIRGINIA) COMMON STOCK NPV,25746U109,1292000.0,17558,0.0016184023470241196,2021-08-13,2021-06-30,0001567619-21-015385
DXJ,WISDOMTREE TRUST JAPAN HEDGED EQUITY FUND ETF,97717W851,1291000.0,21162,0.0016171497136285898,2021-08-13,2021-06-30,0001567619-21-015385
PFE,PFIZER INCORPORATED COMMON STOCK USD0.05,717081103,1288000.0,32899,0.0016133918134420013,2021-08-13,2021-06-30,0001567619-21-015385
BBD,BANCO BRADESCO SA SPONSORED ADR (EACH REPRESENTING 1 PREFERENCE SHARE NPV),059460303,1286000.0,250626,0.0016108865466509426,2021-08-13,2021-06-30,0001567619-21-015385
ENPH,ENPHASE ENERGY INC COMMON STOCK USD0.00001,29355A107,1281000.0,6978,0.0016046233796732949,2021-08-13,2021-06-30,0001567619-21-015385
BCC,BOISE CASCADE COMPANY COMMON STOCK USD0.01,09739D100,1278000.0,21905,0.0016008654794867063,2021-08-13,2021-06-30,0001567619-21-015385
MRK,MERCK AND COMPANY INCORPORATED NEW COMMON STOCK USD0.01,58933Y105,1277000.0,16420,0.001599612846091177,2021-08-13,2021-06-30,0001567619-21-015385
ESNT,ESSENT GROUP LIMITED USD0.015,G3198U102,1276000.0,28377,0.0015983602126956476,2021-08-13,2021-06-30,0001567619-21-015385
SWN1EUR,SOUTHWESTERN ENERGY COMPANY COMMON STOCK USD0.10,845467109,1276000.0,225128,0.0015983602126956476,2021-08-13,2021-06-30,0001567619-21-015385
KHC,KRAFT HEINZ COMPANY (THE) COMMON STOCK USD0.01,500754106,1260000.0,30907,0.0015783180783671752,2021-08-13,2021-06-30,0001567619-21-015385
JMIA,JUMIA TECHNOLOGIES AG 2 ORD,48138M105,1260000.0,41539,0.0015783180783671752,2021-08-13,2021-06-30,0001567619-21-015385
EVR,EVERCORE INCORPORATED CLASS 'A' COMMON STOCK USD0.01,29977A105,1246000.0,8852,0.0015607812108297623,2021-08-13,2021-06-30,0001567619-21-015385
KDP,KEURIG DR PEPPER INC USD0.01 COMMON STOCK USD0.01,49271V100,1243000.0,35276,0.0015570233106431738,2021-08-13,2021-06-30,0001567619-21-015385
SSD,SIMPSON MANUFACTURING COMPANY INCORPORATED COMMON STOCK USD0.01,829073105,1237000.0,11197,0.001549507510269997,2021-08-13,2021-06-30,0001567619-21-015385
MGM,MGM RESORTS INTERNATIONAL COMMON STOCK USD0.01,552953101,1236000.0,28969,0.0015482548768744671,2021-08-13,2021-06-30,0001567619-21-015385
ACWI,ISHARES MSCI ACWI ETF,464288257,1235000.0,12205,0.0015470022434789378,2021-08-13,2021-06-30,0001567619-21-015385
VEEV,VEEVA SYSTEMS INC NPV,922475108,1235000.0,3972,0.0015470022434789378,2021-08-13,2021-06-30,0001567619-21-015385
N/A,LINDE PUBLIC LIMITED COMPANY EUR0.001,G5494J103,1230000.0,4255,0.00154073907650129,2021-08-13,2021-06-30,0001567619-21-015385
HTAEUR,HEALTHCARE TRUST OF AMERICA INCORPORATED REIT CLASS A USD0.01,42225P501,1229000.0,46038,0.0015394864431057607,2021-08-13,2021-06-30,0001567619-21-015385
DELL,DELL TECHNOLOGIES -C  W/I,24703L202,1226000.0,12304,0.0015357285429191722,2021-08-13,2021-06-30,0001567619-21-015385
SAH,SONIC AUTOMOTIVE INCORPORATED CLASS 'A' COMMON STOCK USD0.01,83545G102,1222000.0,27317,0.0015307180093370543,2021-08-13,2021-06-30,0001567619-21-015385
LUXE,MYT NETHERLANDS PARENT BV USD,55406W103,1219000.0,40049,0.0015269601091504657,2021-08-13,2021-06-30,0001567619-21-015385
SPLKCHF,SPLUNK INC COMMON STOCK USD0.01,848637104,1212000.0,8381,0.001518191675381759,2021-08-13,2021-06-30,0001567619-21-015385
CSCO,CISCO SYSTEMS INCORPORATED USD0.001 (US LISTING),17275R102,1211000.0,22846,0.0015169390419862295,2021-08-13,2021-06-30,0001567619-21-015385
VRTS,VIRTUS INVESTMENT PARTNERS INCORPORATED COMMON STOCK USD0.01,92828Q109,1207000.0,4347,0.0015119285084041116,2021-08-13,2021-06-30,0001567619-21-015385
MLM,MARTIN MARIETTA MATERIALS INCORPORATED COMMON STOCK USD0.01,573284106,1203000.0,3420,0.0015069179748219935,2021-08-13,2021-06-30,0001567619-21-015385
AWC,AMERICAN WATER WORKS COMPANY INCORPORATED COMMON STOCK USD0.01,030420103,1202000.0,7801,0.001505665341426464,2021-08-13,2021-06-30,0001567619-21-015385
NOG,NORTHERN OIL AND GAS INCORPORATED USD0.001,665531307,1198000.0,57689,0.001500654807844346,2021-08-13,2021-06-30,0001567619-21-015385
BPOP,POPULAR INCORPORATED COMMON STOCK USD0.01,733174700,1193000.0,15900,0.0014943916408666985,2021-08-13,2021-06-30,0001567619-21-015385
LAD,LITHIA MOTORS INCORPORATED CLASS 'A' COMMON STOCK NPV,536797103,1190000.0,3462,0.00149063374068011,2021-08-13,2021-06-30,0001567619-21-015385
REGN,REGENERON PHARMACEUTICALS INCORPORATED COMMON STOCK USD0.001,75886F107,1187000.0,2126,0.0014868758404935217,2021-08-13,2021-06-30,0001567619-21-015385
TDG,TRANSDIGM GROUP INCORPORATED COMMON STOCK USD0.01,893641100,1186000.0,1833,0.0014856232070979921,2021-08-13,2021-06-30,0001567619-21-015385
BRT,BRT APARTMENTS CORPORATION TRUST REIT USD3,055645303,1185000.0,68342,0.0014843705737024625,2021-08-13,2021-06-30,0001567619-21-015385
INTU,INTUIT INC COMMON STOCK USD0.01,461202103,1182000.0,2411,0.001480612673515874,2021-08-13,2021-06-30,0001567619-21-015385
INTU,INTUIT INC COMMON STOCK USD0.01,461202103,1182000.0,2411,0.001480612673515874,2021-08-13,2021-06-30,0001567619-21-015385
INTC,INTEL CORPORATION COMMON STOCK USD0.001,458140100,1179000.0,21003,0.0014768547733292855,2021-08-13,2021-06-30,0001567619-21-015385
SPGI,S AND P GLOBAL INCORPORATED COMMON STOCK USD1,78409V104,1176000.0,2866,0.001473096873142697,2021-08-13,2021-06-30,0001567619-21-015385
VOYA,VOYA FINANCIAL INCORPORATED COMMON STOCK USD0.01,929089100,1174000.0,19092,0.001470591606351638,2021-08-13,2021-06-30,0001567619-21-015385
RSG,REPUBLIC SERVICES INCORORATED COMMON STOCK USD0.01,760759100,1172000.0,10651,0.001468086339560579,2021-08-13,2021-06-30,0001567619-21-015385
HOUS,REALOGY HOLDINGS CORP COMMON STOCK USD0.01,75605Y106,1171000.0,64286,0.0014668337061650495,2021-08-13,2021-06-30,0001567619-21-015385
AME,AMETEK INC COMMON STOCK USD0.01,031100100,1169000.0,8755,0.0014643284393739905,2021-08-13,2021-06-30,0001567619-21-015385
AME,AMETEK INC COMMON STOCK USD0.01,031100100,1169000.0,8755,0.0014643284393739905,2021-08-13,2021-06-30,0001567619-21-015385
N/A,EATON CORPORATION PLC COMMON STOCK USD0.50,G29183103,1163000.0,7849,0.0014568126390008135,2021-08-13,2021-06-30,0001567619-21-015385
N/A,BROOKFIELD PROPERTY REIT I-A,11282X103,1163000.0,61550,0.0014568126390008135,2021-08-13,2021-06-30,0001567619-21-015385
NFLX,NETFLIX INCORPORATED COMMON STOCK USD0.001,64110L106,1159000.0,2195,0.0014518021054186953,2021-08-13,2021-06-30,0001567619-21-015385
RNR,RENAISSANCE HOLDINGS COMMON STOCK NPV,G7496G103,1159000.0,7791,0.0014518021054186953,2021-08-13,2021-06-30,0001567619-21-015385
BMO,BANK OF MONTREAL COMMON NPV,063671101,1153000.0,9075,0.0014442863050455183,2021-08-13,2021-06-30,0001567619-21-015385
JD,JD.COM INCORPORATED ADR (EACH REPRESENTING 2 SHARES),47215P106,1152000.0,14440,0.001443033671649989,2021-08-13,2021-06-30,0001567619-21-015385
JD,JD.COM INCORPORATED ADR (EACH REPRESENTING 2 SHARES),47215P106,1152000.0,14440,0.001443033671649989,2021-08-13,2021-06-30,0001567619-21-015385
CRM,SALESFORCE.COM INCORPORATED COMMON STOCK USD0.001,79466L302,1149000.0,4703,0.0014392757714634004,2021-08-13,2021-06-30,0001567619-21-015385
OZK,BANK OZK COMMON STOCK NPV,06417N103,1149000.0,27253,0.0014392757714634004,2021-08-13,2021-06-30,0001567619-21-015385
PFE,PFIZER INCORPORATED COMMON STOCK USD0.05,717081103,1148000.0,29303,0.0014380231380678708,2021-08-13,2021-06-30,0001567619-21-015385
KBWB,INVESCO KBW BANK ETF,46138E628,1146000.0,17800,0.0014355178712768119,2021-08-13,2021-06-30,0001567619-21-015385
KBWB,INVESCO KBW BANK ETF,46138E628,1146000.0,17800,0.0014355178712768119,2021-08-13,2021-06-30,0001567619-21-015385
RDY,DR REDDY'S LABORATORIES LIMITED ADR (EACH REPRESENTING 1 ORDINARY SHARE),256135203,1146000.0,15589,0.0014355178712768119,2021-08-13,2021-06-30,0001567619-21-015385
RDY,DR REDDY'S LABORATORIES LIMITED ADR (EACH REPRESENTING 1 ORDINARY SHARE),256135203,1146000.0,15589,0.0014355178712768119,2021-08-13,2021-06-30,0001567619-21-015385
CVX,CHEVRON CORPORATION COMMON STOCK USD0.75,166764100,1143000.0,10916,0.0014317599710902233,2021-08-13,2021-06-30,0001567619-21-015385
WMT,WALMART INCORPORATED COMMON STOCK USD0.10,931142103,1141000.0,8094,0.0014292547042991644,2021-08-13,2021-06-30,0001567619-21-015385
EWJ,ISHARES INCORPORATED MSCI JAPAN ETF,46434G822,1137000.0,16831,0.0014242441707170463,2021-08-13,2021-06-30,0001567619-21-015385
AMT,AMERICAN TOWER CORPORATION REIT USD0.01,03027X100,1135000.0,4200,0.0014217389039259873,2021-08-13,2021-06-30,0001567619-21-015385
CHT,CHUNGHWA TELECOM COMPANY LIMITED ADR (EACH REPRESENTS 10 ORDINARY TWD10),17133Q502,1133000.0,27859,0.0014192336371349284,2021-08-13,2021-06-30,0001567619-21-015385
EFX,EQUIFAX INC COMMON STOCK USD2.50,294429105,1133000.0,4732,0.0014192336371349284,2021-08-13,2021-06-30,0001567619-21-015385
AFYA,AFYA LIMITED-CLASS A USD0.00005,G01125106,1128000.0,43751,0.0014129704701572809,2021-08-13,2021-06-30,0001567619-21-015385
MRK,MERCK AND COMPANY INCORPORATED NEW COMMON STOCK USD0.01,58933Y105,1123000.0,14439,0.0014067073031796332,2021-08-13,2021-06-30,0001567619-21-015385
N/A,LARGO RESOURCES LIMITED NPV,517103602,1122000.0,58121,0.0014054546697841038,2021-08-13,2021-06-30,0001567619-21-015385
BAC,VERIZON COMMUNICATIONS INCORPORATED COMMON STOCK USD0.10,92343V104,1122000.0,20017,0.0014054546697841038,2021-08-13,2021-06-30,0001567619-21-015385
MSCI,MSCI INCORPORATED COMMON STOCK USD0.01,55354G100,1116000.0,2094,0.0013979388694109268,2021-08-13,2021-06-30,0001567619-21-015385
AIG,AMERICAN INTERNATIONAL GROUP INCORPORATED COMMON STOCK USD2.50,026874784,1116000.0,23454,0.0013979388694109268,2021-08-13,2021-06-30,0001567619-21-015385
CYD,CHINA YUCHAI INTERNATIONAL COMMON STOCK USD0.10,G21082105,1113000.0,69400,0.0013941809692243382,2021-08-13,2021-06-30,0001567619-21-015385
WMT,WALMART INCORPORATED COMMON STOCK USD0.10,931142103,1111000.0,7880,0.0013916757024332793,2021-08-13,2021-06-30,0001567619-21-015385
KO,COCA-COLA COMPANY (THE) COMMON STOCK USD0.25,191216100,1111000.0,20527,0.0013916757024332793,2021-08-13,2021-06-30,0001567619-21-015385
DOCUSD,PHYSICIANS REALTY TRUST REIT USD0.01,71943U104,1107000.0,59950,0.0013866651688511612,2021-08-13,2021-06-30,0001567619-21-015385
NVTA1EUR,INVITAE CORP NPV COMMON STOCK USD,46185L103,1106000.0,32785,0.0013854125354556316,2021-08-13,2021-06-30,0001567619-21-015385
VIPS,VIPSHOP HOLDINGS LIMITED SPONSORED ADR (EACH REPRESENTS 0.2 ORDINARY SHARES USD0.0001),92763W103,1100000.0,54805,0.0013778967350824545,2021-08-13,2021-06-30,0001567619-21-015385
KBH,KB HOME COMMON STOCK USD1,48666K109,1100000.0,27021,0.0013778967350824545,2021-08-13,2021-06-30,0001567619-21-015385
ISRG,INTUITIVE SURGICAL COMMON STOCK USD0.001,46120E602,1099000.0,1195,0.0013766441016869252,2021-08-13,2021-06-30,0001567619-21-015385
ABX,BARRICK GOLD CORPORATION COMMON NPV,067901108,1096000.0,52996,0.0013728862015003366,2021-08-13,2021-06-30,0001567619-21-015385
FTV,FORTIVE CORPORATION COMMON STOCK USD0.01,34959J108,1093000.0,15671,0.001369128301313748,2021-08-13,2021-06-30,0001567619-21-015385
FTV,FORTIVE CORPORATION COMMON STOCK USD0.01,34959J108,1093000.0,15671,0.001369128301313748,2021-08-13,2021-06-30,0001567619-21-015385
APA,APA CORPORATION NPV,03743Q108,1092000.0,50479,0.0013678756679182185,2021-08-13,2021-06-30,0001567619-21-015385
HPE,HEWLETT PACKARD ENTERPRISE COMMON STOCK USD0.01,42824C109,1077000.0,73899,0.001349086166985276,2021-08-13,2021-06-30,0001567619-21-015385
HCM,HUTCHISON CHINA MEDITECH LIMITED ADR (EACH REPRESENTS 5 ORDINARY),44842L103,1065000.0,27131,0.001334054566238922,2021-08-13,2021-06-30,0001567619-21-015385
N/A,EASTERLY GOVERNMENT PROPERTIES INCORPORATED REIT USD0.01,27616P103,1062000.0,50372,0.0013302966660523334,2021-08-13,2021-06-30,0001567619-21-015385
RTX,RAYTHEON TECHNOLOGIES CORPORATION USD1,75513E101,1060000.0,12420,0.0013277913992612745,2021-08-13,2021-06-30,0001567619-21-015385
PEP,PEPSICO INCORPORATED CAPITAL STOCK USD0.016666,713448108,1059000.0,7147,0.0013265387658657449,2021-08-13,2021-06-30,0001567619-21-015385
AWG,ASBURY AUTOMOTIVE GROUP INCORPORATED COMMON STOCK USD0.01,043436104,1057000.0,6169,0.001324033499074686,2021-08-13,2021-06-30,0001567619-21-015385
YUSD,ALLEGHANY CORPORATION COMMON STOCK USD1,017175100,1056000.0,1583,0.0013227808656791564,2021-08-13,2021-06-30,0001567619-21-015385
N/A,FOUR SEASONS EDUCATION CAYMAN INCORPORATED ADR NPV (EACH REPRESENTS 0.5 ORDINARY SHARES),35101A101,1055000.0,909465,0.001321528232283627,2021-08-13,2021-06-30,0001567619-21-015385
N/A,FOUR SEASONS EDUCATION CAYMAN INCORPORATED ADR NPV (EACH REPRESENTS 0.5 ORDINARY SHARES),35101A101,1055000.0,909465,0.001321528232283627,2021-08-13,2021-06-30,0001567619-21-015385
ABBV,ABBVIE INCORPORATED COMMON STOCK USD0.01,00287Y109,1054000.0,9361,0.0013202755988880974,2021-08-13,2021-06-30,0001567619-21-015385
LLY,ELI LILLY AND COMPANY COMMON STOCK NPV,532457108,1054000.0,4592,0.0013202755988880974,2021-08-13,2021-06-30,0001567619-21-015385
ACMR,ACM RESEARCH INCORPORATED CLASS A COMMON STOCK USD0.0001,00108J109,1053000.0,10304,0.0013190229654925678,2021-08-13,2021-06-30,0001567619-21-015385
RDN,RADIAN GROUP INC USD0.001,750236101,1051000.0,47221,0.0013165176987015089,2021-08-13,2021-06-30,0001567619-21-015385
RTX,RAYTHEON TECHNOLOGIES CORPORATION USD1,75513E101,1050000.0,12304,0.0013152650653059793,2021-08-13,2021-06-30,0001567619-21-015385
PHM,PULTE GROUP INCORPORATED COMMON STOCK USD0.01,745867101,1042000.0,19102,0.0013052439981417433,2021-08-13,2021-06-30,0001567619-21-015385
EW,EDWARDS LIFESCIENCES CORPORATION COMMON STOCK USD1,28176E108,1040000.0,10045,0.0013027387313506843,2021-08-13,2021-06-30,0001567619-21-015385
ALB,ALBEMARLE CORPORATION COMMON STOCK USD0.01,012653101,1040000.0,6171,0.0013027387313506843,2021-08-13,2021-06-30,0001567619-21-015385
EW,EDWARDS LIFESCIENCES CORPORATION COMMON STOCK USD1,28176E108,1040000.0,10045,0.0013027387313506843,2021-08-13,2021-06-30,0001567619-21-015385
N/A,LINDE PUBLIC LIMITED COMPANY EUR0.001,G5494J103,1038000.0,4266,0.0013002334645596254,2021-08-13,2021-06-30,0001567619-21-015385
PG,PROCTER AND GAMBLE COMPANY (THE) COMMON STOCK NPV,742718109,1037000.0,7688,0.0012989808311640958,2021-08-13,2021-06-30,0001567619-21-015385
ADI,ANALOG DEVICES INCORPORATED COMMON STOCK USD0.166,032654105,1037000.0,6022,0.0012989808311640958,2021-08-13,2021-06-30,0001567619-21-015385
BILI,BILIBILI INCORPORATED ADR (EACH REPRESENTS 1 ORDINARY SHARE),090040106,1035000.0,8498,0.0012964755643730369,2021-08-13,2021-06-30,0001567619-21-015385
DOCU,DOCUSIGN INCORPORATED COMMON STOCK USD0.0001,256163106,1033000.0,3696,0.001293970297581978,2021-08-13,2021-06-30,0001567619-21-015385
T,AT AND T INCORPORATED COMMON STOCK USD1,00206R102,1033000.0,35880,0.001293970297581978,2021-08-13,2021-06-30,0001567619-21-015385
N/A,TRITON INTERNATIONAL LTD USD0.01,G9078F107,1032000.0,19718,0.0012927176641864483,2021-08-13,2021-06-30,0001567619-21-015385
N/A,NEW ORIENTAL EDUCATION & TECHNOLOGY GROUP INCORPORATED SPONSORED ADR USD0.01 (EACH REPRESENTS 1 ORDINARY SHARES),647581107,1032000.0,126011,0.0012927176641864483,2021-08-13,2021-06-30,0001567619-21-015385
TMO,THERMO FISHER SCIENTIFIC INCORPORATED COMMON STOCK USD1,883556102,1032000.0,2045,0.0012927176641864483,2021-08-13,2021-06-30,0001567619-21-015385
CDW,CDW CORPORATION COMMON STOCK USD0.01,12514G108,1032000.0,5908,0.0012927176641864483,2021-08-13,2021-06-30,0001567619-21-015385
STAA,STAAR SURGICAL COMPANY COMMON STOCK USD0.01,852312305,1029000.0,6747,0.00128895976399986,2021-08-13,2021-06-30,0001567619-21-015385
ARNC1EUR,ARCONIC CORPORATION USD0.01,03966V107,1029000.0,28893,0.00128895976399986,2021-08-13,2021-06-30,0001567619-21-015385
LOGI,LOGITECH INTERNATIONAL SA CHF0.25 (REGISTERED),H50430232,1026000.0,9150,0.0012852018638132715,2021-08-13,2021-06-30,0001567619-21-015385
BYND,BEYOND MEAT INCORPORATED USD0.0001,08862E109,1019000.0,6471,0.0012764334300445648,2021-08-13,2021-06-30,0001567619-21-015385
HDB,HDFC BANK LIMITED ADR (EACH REPRESENTING 3 ORDINARY),40415F101,1016000.0,13889,0.0012726755298579763,2021-08-13,2021-06-30,0001567619-21-015385
GMED,GLOBUS MEDICAL INC - A COMMON STOCK USD0.001,379577208,1014000.0,13076,0.0012701702630669174,2021-08-13,2021-06-30,0001567619-21-015385
IEX,IDEX CORPORATION COMMON STOCK USD0.01,45167R104,1013000.0,4602,0.0012689176296713878,2021-08-13,2021-06-30,0001567619-21-015385
VWO,VANGUARD FTSE EMERGING MARKETS ETF,922042858,1007000.0,18535,0.0012614018292982107,2021-08-13,2021-06-30,0001567619-21-015385
WCC,WESCO INTERNATIONAL INCORPORATED COMMON STOCK USD0.01,95082P105,1006000.0,9787,0.0012601491959026814,2021-08-13,2021-06-30,0001567619-21-015385
STLA,STELLANTIS NV EUR0.01,N82405106,1004000.0,60625,0.0012576439291116222,2021-08-13,2021-06-30,0001567619-21-015385
STLA,STELLANTIS NV EUR0.01,N82405106,1004000.0,60625,0.0012576439291116222,2021-08-13,2021-06-30,0001567619-21-015385
GL,Globe Life Inc COMMON USD1.000000,37959E102,1002000.0,10522,0.0012551386623205632,2021-08-13,2021-06-30,0001567619-21-015385
SAM,BOSTON BEER COMPANY INC CLASS 'A' COMMON STOCK USD0.01,100557107,1000000.0,980,0.0012526333955295043,2021-08-13,2021-06-30,0001567619-21-015385
AVGO,BROADCOM INCORPORATED COMMON STOCK NPV,11135F101,996000.0,2088,0.0012476228619473862,2021-08-13,2021-06-30,0001567619-21-015385
KMB,KIMBERLY-CLARK CORPORATION COMMON STOCK USD1.25,494368103,990000.0,7400,0.0012401070615742091,2021-08-13,2021-06-30,0001567619-21-015385
CC,CHEMOURS COMPANY (THE) COMMON STOCK USD0.30,163851108,988000.0,28404,0.0012376017947831502,2021-08-13,2021-06-30,0001567619-21-015385
NKE,NIKE INCORPORATED CLASS B COMMON STOCK NPV,654106103,988000.0,6394,0.0012376017947831502,2021-08-13,2021-06-30,0001567619-21-015385
FLO,FLOWERS FOODS INCORPORATED COMMON STOCK USD0.01,343498101,985000.0,40697,0.0012338438945965616,2021-08-13,2021-06-30,0001567619-21-015385
PDCOEUR,PATTERSON COMPANIES INCORPORATED COMMON STOCK USD0.01,703395103,984000.0,32385,0.001232591261201032,2021-08-13,2021-06-30,0001567619-21-015385
MED,MEDIFAST INCORPORATED COMMON STOCK USD0.001,58470H101,979000.0,3460,0.0012263280942233848,2021-08-13,2021-06-30,0001567619-21-015385
ZION,ZIONS BANCORPORATION COMMON STOCK NPV,989701107,978000.0,18503,0.0012250754608278552,2021-08-13,2021-06-30,0001567619-21-015385
CAKE,CHEESECAKE FACTORY INCORPORATED (THE) COMMON STOCK USD0.01,163072101,977000.0,18028,0.0012238228274323256,2021-08-13,2021-06-30,0001567619-21-015385
AMXN,AMERICA MOVIL SAB DE CV ADR (EACH REPRESENTS 20 SERIES 'L' SHARES),02364W105,976000.0,65063,0.0012225701940367963,2021-08-13,2021-06-30,0001567619-21-015385
LMT,LOCKHEED MARTIN CORP COMMON STOCK USD0.01,539830109,976000.0,2580,0.0012225701940367963,2021-08-13,2021-06-30,0001567619-21-015385
CROX,CROCS INCORPORATED COMMON STOCK USD0.001,227046109,975000.0,8366,0.0012213175606412667,2021-08-13,2021-06-30,0001567619-21-015385
KEYS,KEYSIGHT TECHNOLOGIES INCORPORATED COMMON STOCK USD0.01,49338L103,974000.0,6307,0.001220064927245737,2021-08-13,2021-06-30,0001567619-21-015385
ABT,ABBOTT LABORATORIES COMMON STOCK NPV,002824100,974000.0,8399,0.001220064927245737,2021-08-13,2021-06-30,0001567619-21-015385
GS,GOLDMAN SACHS GROUP INCORPORATED COMMON STOCK USD0.01,38141G104,973000.0,2563,0.0012188122938502077,2021-08-13,2021-06-30,0001567619-21-015385
VRT,VERTIV HOLDINGS CLASS A USD0.0001,92537N108,973000.0,35652,0.0012188122938502077,2021-08-13,2021-06-30,0001567619-21-015385
VRT,VERTIV HOLDINGS CLASS A USD0.0001,92537N108,973000.0,35652,0.0012188122938502077,2021-08-13,2021-06-30,0001567619-21-015385
ALLE,ALLEGION PLC COMMON STOCK USD0.01,G0176J109,972000.0,6981,0.0012175596604546781,2021-08-13,2021-06-30,0001567619-21-015385
NOW,SERVICENOW INCORPORATED COMMON STOCK USD0.001,81762P102,972000.0,1769,0.0012175596604546781,2021-08-13,2021-06-30,0001567619-21-015385
NOAH,NOAH HOLDINGS LIMITED ADR (2 REPRESENTS 1 ORDINARY SHARE),65487X102,970000.0,20558,0.0012150543936636192,2021-08-13,2021-06-30,0001567619-21-015385
APD,AIR PRODUCTS & CHEMICALS INC COM STK US$1,009158106,969000.0,3367,0.0012138017602680896,2021-08-13,2021-06-30,0001567619-21-015385
EWU,ISHARES MSCI UNITED KINGDOM ETF,46435G334,969000.0,29620,0.0012138017602680896,2021-08-13,2021-06-30,0001567619-21-015385
N/A,CELESTICA INCORPORATED SUBORDINATED ORDINARY VOTING SHARES NPV,15101Q108,968000.0,99559,0.0012125491268725602,2021-08-13,2021-06-30,0001567619-21-015385
CCS,CENTURY COMMUNITIES INC COMMON STOCK USD0.01,156504300,968000.0,14554,0.0012125491268725602,2021-08-13,2021-06-30,0001567619-21-015385
BNS,BANK OF NOVA SCOTIA CAPITAL STOCK,064149107,967000.0,11990,0.0012112964934770307,2021-08-13,2021-06-30,0001567619-21-015385
TRP,TC ENERGY CORP NPV,87807B107,963000.0,15696,0.0012062859598949126,2021-08-13,2021-06-30,0001567619-21-015385
GDOT,GREEN DOT CORPORATION CLASS A COMMON STOCK USD0.001,39304D102,962000.0,20540,0.0012050333264993832,2021-08-13,2021-06-30,0001567619-21-015385
BA,BOEING COMPANY (THE) COMMON STOCK USD5,097023105,960000.0,4008,0.001202528059708324,2021-08-13,2021-06-30,0001567619-21-015385
EXPE,EXPEDIA GROUP INCORPORATED COMMON STOCK USD0.001,30212P303,959000.0,5860,0.0012012754263127947,2021-08-13,2021-06-30,0001567619-21-015385
SNA,SNAP-ON INCORPORATED COMMON STOCK USD1,833034101,959000.0,4291,0.0012012754263127947,2021-08-13,2021-06-30,0001567619-21-015385
N/A,SMART GLOBAL HOLDINGS INC USD0.01,G8232Y101,958000.0,20095,0.001200022792917265,2021-08-13,2021-06-30,0001567619-21-015385
AMCR,AMCOR PLC USD0.010000,G0250X107,949000.0,82819,0.0011887490923574995,2021-08-13,2021-06-30,0001567619-21-015385
IVV,ISHARES TRUST CORE SnP 500 ETF,464287200,944000.0,2195,0.001182485925379852,2021-08-13,2021-06-30,0001567619-21-015385
SS1A,SCHNITZER STEEL INDUSTRIES INCORPORATED CLASS 'A' COMMON STOCK USD1,806882106,942000.0,19205,0.0011799806585887928,2021-08-13,2021-06-30,0001567619-21-015385
CI,CIGNA CORP COMMON STOCK USD0.010000,125523100,936000.0,3949,0.0011724648582156158,2021-08-13,2021-06-30,0001567619-21-015385
VMWEUR,VMWARE INCORPORATED CLASS 'A' COMMON STOCK USD0.01,928563402,935000.0,5844,0.0011712122248200864,2021-08-13,2021-06-30,0001567619-21-015385
N/A,ATLASSIAN CORP PLC-CLASS A USD0.100000,G06242104,934000.0,3635,0.0011699595914245568,2021-08-13,2021-06-30,0001567619-21-015385
WERN,WERNER ENTERPRISES INCORPORATED COMMON STOCK USD0.01,950755108,933000.0,20946,0.0011687069580290275,2021-08-13,2021-06-30,0001567619-21-015385
FIS,FIDELITY NATIONAL INFORMATION INCORPORATED COMMON STOCK USD0.01,31620M106,932000.0,6579,0.0011674543246334979,2021-08-13,2021-06-30,0001567619-21-015385
WFC,WELLS FARGO AND COMPANY COMMON STOCK USD1.6667,949746101,932000.0,20572,0.0011674543246334979,2021-08-13,2021-06-30,0001567619-21-015385
BEKE,KE HOLDINGS INCORPORATED USD0.00002,482497104,932000.0,19551,0.0011674543246334979,2021-08-13,2021-06-30,0001567619-21-015385
EWH,ISHARES INCORPORATED MSCI HONG KONG ETF,464286871,931000.0,34826,0.0011662016912379683,2021-08-13,2021-06-30,0001567619-21-015385
BXMT,BLACKSTONE MORTGAGE TRUST INCORPORATED REIT CLASS A USD0.01,09257W100,930000.0,29156,0.001164949057842439,2021-08-13,2021-06-30,0001567619-21-015385
TSM,TAIWAN SEMICONDUCTOR MANUFACTURING COMPANY LIMITED ADS REPRESENTING 5 COMMON SHARES,874039100,926000.0,7708,0.001159938524260321,2021-08-13,2021-06-30,0001567619-21-015385
CAT,CATERPILLAR INCORPORATED COMMON STOCK USD1,149123101,921000.0,4233,0.0011536753572826736,2021-08-13,2021-06-30,0001567619-21-015385
FFIV,F5 NETWORKS INCORPORATED COMMON STOCK NPV,315616102,918000.0,4920,0.001149917457096085,2021-08-13,2021-06-30,0001567619-21-015385
AZO,AUTOZONE INCORPORATED COMMON STOCK USD0.01,053332102,915000.0,613,0.0011461595569094965,2021-08-13,2021-06-30,0001567619-21-015385
AZO,AUTOZONE INCORPORATED COMMON STOCK USD0.01,053332102,915000.0,613,0.0011461595569094965,2021-08-13,2021-06-30,0001567619-21-015385
FDX,FEDEX CORPORATION COMMON STOCK USD0.10,31428X106,913000.0,3060,0.0011436542901184373,2021-08-13,2021-06-30,0001567619-21-015385
APH,AMPHENOL CORPORATION CLASS A COMMON STOCK USD0.001,032095101,911000.0,13315,0.0011411490233273784,2021-08-13,2021-06-30,0001567619-21-015385
MDLZ,MONDELEZ INTERNATIONAL INCORPORATED COMMON STOCK USD0.01,609207105,910000.0,14572,0.0011398963899318488,2021-08-13,2021-06-30,0001567619-21-015385
PGR,PROGRESSIVE CORPORATION (OHIO) COMMON STOCK USD1,743315103,909000.0,9252,0.0011386437565363194,2021-08-13,2021-06-30,0001567619-21-015385
OPEN,OPENDOOR TECHNOLOGIES INC USD0.0001,683712103,907000.0,51169,0.0011361384897452603,2021-08-13,2021-06-30,0001567619-21-015385
CINF,CINCINNATI FINANCIAL CORPORATION COMMON STOCK USD2,172062101,906000.0,7769,0.001134885856349731,2021-08-13,2021-06-30,0001567619-21-015385
