ticker,nameOfIssuer,cusip,value,shares,allocation_percent,filingDate,reportDate,accessionNumber
JMIA,JUMIA TECHNOLOGIES AG 2 ORD,48138M105,318000.0,10477,0.0003983374197783823,2021-08-13,2021-06-30,0001567619-21-015385
BDX,BECTON DICKINSON & COMPANY COMMON STOCK USD1,075887109,317000.0,1304,0.00039708478638285285,2021-08-13,2021-06-30,0001567619-21-015385
8CW,CROWN CASTLE INTERNATIONAL CORPORATION REIT USD0.01,22822V101,317000.0,1626,0.00039708478638285285,2021-08-13,2021-06-30,0001567619-21-015385
BRK/B,BERKSHIRE HATHAWAY INCORPORATED CLASS B COMMON STOCK USD0.0033,084670702,316000.0,1,0.00039583215298732337,2021-08-13,2021-06-30,0001567619-21-015385
DEO,DIAGEO PLC SPONSORED ADR (EACH REPRESENTING 4 ORDINARY GBP0.28),25243Q205,315000.0,1644,0.0003945795195917938,2021-08-13,2021-06-30,0001567619-21-015385
VLY,VALLEY NATIONAL BANCORP COMMON STOCK NPV,919794107,315000.0,23438,0.0003945795195917938,2021-08-13,2021-06-30,0001567619-21-015385
DEO,DIAGEO PLC SPONSORED ADR (EACH REPRESENTING 4 ORDINARY GBP0.28),25243Q205,315000.0,1644,0.0003945795195917938,2021-08-13,2021-06-30,0001567619-21-015385
DE,DEERE & COMPANY COMMON STOCK USD1,244199105,315000.0,894,0.0003945795195917938,2021-08-13,2021-06-30,0001567619-21-015385
USB,US BANCORP COMMON STOCK USD0.01,902973304,314000.0,5520,0.0003933268861962643,2021-08-13,2021-06-30,0001567619-21-015385
ROKU,ROKU INCORPORATED COMMON STOCK USD0.0001,77543R102,311000.0,678,0.00038956898600967584,2021-08-13,2021-06-30,0001567619-21-015385
NSY,NICE SYSTEMS LTD-SPONS ADR,653656108,311000.0,1257,0.00038956898600967584,2021-08-13,2021-06-30,0001567619-21-015385
LFUS,LITTELFUSE INCORPORATED COMMON STOCK USD0.01,537008104,311000.0,1220,0.00038956898600967584,2021-08-13,2021-06-30,0001567619-21-015385
UGI,UGI CORPORATION COMMON STOCK NPV,902681105,311000.0,6724,0.00038956898600967584,2021-08-13,2021-06-30,0001567619-21-015385
WHR,WHIRLPOOL CORPORATION COMMON STOCK USD1,963320106,311000.0,1427,0.00038956898600967584,2021-08-13,2021-06-30,0001567619-21-015385
QTWO,Q2 HOLDINGS INCORPORATED COMMON USD0.0001,74736L109,310000.0,3021,0.0003883163526141463,2021-08-13,2021-06-30,0001567619-21-015385
VTR,VENTAS INCORPORATED REIT USD0.25,92276F100,310000.0,5426,0.0003883163526141463,2021-08-13,2021-06-30,0001567619-21-015385
GPN,GLOBAL PAYMENTS INCORPORATED COMMON STOCK USD0.001,37940X102,310000.0,1651,0.0003883163526141463,2021-08-13,2021-06-30,0001567619-21-015385
USFD,US FOODS HOLDING CORPORATION COMMON STOCK USD0.01,912008109,310000.0,8087,0.0003883163526141463,2021-08-13,2021-06-30,0001567619-21-015385
CIT,CINTAS CORPORATION COMMON STOCK NPV,172908105,310000.0,812,0.0003883163526141463,2021-08-13,2021-06-30,0001567619-21-015385
PYPL,PAYPAL HOLDINGS INCORPORATED COMMON STOCK USD0.0001,70450Y103,310000.0,1063,0.0003883163526141463,2021-08-13,2021-06-30,0001567619-21-015385
PYPL,PAYPAL HOLDINGS INCORPORATED COMMON STOCK USD0.0001,70450Y103,310000.0,1063,0.0003883163526141463,2021-08-13,2021-06-30,0001567619-21-015385
TWTRUSD,TWITTER INCORPORATED COMMON STOCK USD0.000005,90184L102,310000.0,4503,0.0003883163526141463,2021-08-13,2021-06-30,0001567619-21-015385
DOW,DOW INC USD0.01,260557103,309000.0,4876,0.0003870637192186168,2021-08-13,2021-06-30,0001567619-21-015385
MDT,MEDTRONIC PLC USD0.10,G5960L103,309000.0,2488,0.0003870637192186168,2021-08-13,2021-06-30,0001567619-21-015385
MDT,MEDTRONIC PLC USD0.10,G5960L103,309000.0,2488,0.0003870637192186168,2021-08-13,2021-06-30,0001567619-21-015385
N/A,NXP SEMICONDUCTORS NV COMMON STOCK USD0.01,N6596X109,309000.0,1501,0.0003870637192186168,2021-08-13,2021-06-30,0001567619-21-015385
SLAB,SILICON LABORATORIES INCORPORATED COMMON STOCK USD0.01,826919102,308000.0,2010,0.0003858110858230873,2021-08-13,2021-06-30,0001567619-21-015385
TEVA,TEVA PHARMACEUTICAL INDUSTRIES LIMITED SPONSORED ADR (EACH CONVERT INTO 1 ORDINARY ILS0.10),881624209,308000.0,31143,0.0003858110858230873,2021-08-13,2021-06-30,0001567619-21-015385
DDOG,DATADOG INC CLASS A USD0,23804L103,308000.0,2961,0.0003858110858230873,2021-08-13,2021-06-30,0001567619-21-015385
MSI,MOTOROLA SOLUTIONS INCORPORATED COMMON STOCK USD0.01,620076307,308000.0,1419,0.0003858110858230873,2021-08-13,2021-06-30,0001567619-21-015385
TXT,TEXTRON INCCORPORATED COMMON STOCK USD0.125,883203101,308000.0,4473,0.0003858110858230873,2021-08-13,2021-06-30,0001567619-21-015385
NNN,NATIONAL RETAIL PROPERTIES REIT USD0.01,637417106,308000.0,6574,0.0003858110858230873,2021-08-13,2021-06-30,0001567619-21-015385
PTON,PELOTON INTERACTIVE INC COMMON USD0.000025,70614W100,306000.0,2464,0.00038330581903202825,2021-08-13,2021-06-30,0001567619-21-015385
WH,WYNDHAM HOTELS AND RESORTS INCORPORATED COMMON STOCK USD0.01,98311A105,306000.0,4231,0.00038330581903202825,2021-08-13,2021-06-30,0001567619-21-015385
WH,WYNDHAM HOTELS AND RESORTS INCORPORATED COMMON STOCK USD0.01,98311A105,306000.0,4231,0.00038330581903202825,2021-08-13,2021-06-30,0001567619-21-015385
GRBK,GREEN BRICK PARTNERS INC COMMON STOCK USD0.01,392709101,305000.0,13393,0.0003820531856364988,2021-08-13,2021-06-30,0001567619-21-015385
NSY,NICE SYSTEMS LTD-SPONS ADR,653656108,305000.0,1233,0.0003820531856364988,2021-08-13,2021-06-30,0001567619-21-015385
ACCUSD,AMERICAN CAMPUS COMMUNITIES INCORPORATED REIT USD0.01,024835100,305000.0,6530,0.0003820531856364988,2021-08-13,2021-06-30,0001567619-21-015385
WHD,CACTUS INCORPORATED A COMMON STOCK USD0.01,127203107,305000.0,8295,0.0003820531856364988,2021-08-13,2021-06-30,0001567619-21-015385
DAL,DELTA AIR LINES INCORPORATED COMMON STOCK USD0.0001,247361702,302000.0,6980,0.00037829528544991025,2021-08-13,2021-06-30,0001567619-21-015385
PKN,PERKINELMER INC USD1,714046109,302000.0,1953,0.00037829528544991025,2021-08-13,2021-06-30,0001567619-21-015385
VEEV,VEEVA SYSTEMS INC NPV,922475108,302000.0,971,0.00037829528544991025,2021-08-13,2021-06-30,0001567619-21-015385
EOG,EOG RESOURCES INCORPORATED COMMON STOCK USD0.01,26875P101,301000.0,3602,0.00037704265205438077,2021-08-13,2021-06-30,0001567619-21-015385
ROST,ROSS STORES INCORPORATE COMMON STOCK USD0.01,778296103,300000.0,2423,0.00037579001865885124,2021-08-13,2021-06-30,0001567619-21-015385
LECO,LINCOLN ELECTRIC HOLDINGS INCORPORATED COMMON STOCK NPV,533900106,300000.0,2280,0.00037579001865885124,2021-08-13,2021-06-30,0001567619-21-015385
EGP,EASTGROUP PROPERTIES INCORPORATED REIT USD0.0001,277276101,300000.0,1826,0.00037579001865885124,2021-08-13,2021-06-30,0001567619-21-015385
TRI4EUR,THOMSON REUTERS CORP,884903709,300000.0,3018,0.00037579001865885124,2021-08-13,2021-06-30,0001567619-21-015385
ULTA,ULTA BEAUTY INCORPORATED COMMON STOCK NPV,90384S303,299000.0,865,0.00037453738526332177,2021-08-13,2021-06-30,0001567619-21-015385
ICE,INTERCONTINENTAL EXCHANGE INCORPORATED COMMON STOCK USD0.01,45866F104,299000.0,2515,0.00037453738526332177,2021-08-13,2021-06-30,0001567619-21-015385
ICE,INTERCONTINENTAL EXCHANGE INCORPORATED COMMON STOCK USD0.01,45866F104,299000.0,2515,0.00037453738526332177,2021-08-13,2021-06-30,0001567619-21-015385
EEM,ISHARES TRUST MSCI EMERGING MARKETS ETF,464287234,298000.0,5410,0.0003732847518677923,2021-08-13,2021-06-30,0001567619-21-015385
L,LOEWS CORPORATION COMMON STOCK USD0.01,540424108,298000.0,5451,0.0003732847518677923,2021-08-13,2021-06-30,0001567619-21-015385
YUSD,ALLEGHANY CORPORATION COMMON STOCK USD1,017175100,296000.0,443,0.0003707794850767333,2021-08-13,2021-06-30,0001567619-21-015385
FTNT,FORTINET INCORPORATED COMMON STOCK USD0.001,34959E109,296000.0,1244,0.0003707794850767333,2021-08-13,2021-06-30,0001567619-21-015385
WDAY,WORKDAY INCORPORATED COMMON STOCK USD0.001,98138H101,294000.0,1230,0.00036827421828567424,2021-08-13,2021-06-30,0001567619-21-015385
HUBS,HubSpot Inc COMMON STOCK USD0.001000,443573100,293000.0,502,0.00036702158489014476,2021-08-13,2021-06-30,0001567619-21-015385
HES,HESS CORPORATION COMMON STOCK USD1,42809H107,292000.0,3346,0.00036576895149461523,2021-08-13,2021-06-30,0001567619-21-015385
VTWO,VANGUARD RUSSELL 2000 ETF,92206C664,292000.0,3150,0.00036576895149461523,2021-08-13,2021-06-30,0001567619-21-015385
ROK,ROCKWELL AUTOMATION INCORPORATED COMMON STOCK USD1,773903109,292000.0,1021,0.00036576895149461523,2021-08-13,2021-06-30,0001567619-21-015385
WFC,WELLS FARGO AND COMPANY COMMON STOCK USD1.6667,949746101,292000.0,6455,0.00036576895149461523,2021-08-13,2021-06-30,0001567619-21-015385
SPHR,MSG ENTERTAINMENT SPIN-A-W/I USD0.010000,55826T102,291000.0,3461,0.0003645163180990857,2021-08-13,2021-06-30,0001567619-21-015385
LMT,LOCKHEED MARTIN CORP COMMON STOCK USD0.01,539830109,290000.0,767,0.00036326368470355623,2021-08-13,2021-06-30,0001567619-21-015385
VTLE,LAREDO PETROLEUM INCORPORATED USD0.01,516806205,290000.0,3122,0.00036326368470355623,2021-08-13,2021-06-30,0001567619-21-015385
CMBM,CAMBIUM NETWORKS CORP USD0.0001,G17766109,290000.0,5988,0.00036326368470355623,2021-08-13,2021-06-30,0001567619-21-015385
D,DOMINION ENERGY INCORPORATED (VIRGINIA) COMMON STOCK NPV,25746U109,289000.0,3923,0.0003620110513080267,2021-08-13,2021-06-30,0001567619-21-015385
ICE,INTERCONTINENTAL EXCHANGE INCORPORATED COMMON STOCK USD0.01,45866F104,288000.0,2429,0.00036075841791249723,2021-08-13,2021-06-30,0001567619-21-015385
BMRN,BIOMARIN PHARMACEUTICAL INCORPORATED COMMON STOCK USD0.001,09061G101,288000.0,3446,0.00036075841791249723,2021-08-13,2021-06-30,0001567619-21-015385
NVR,NVR INCORPORATED COMMON STOCK USD0.01,62944T105,288000.0,58,0.00036075841791249723,2021-08-13,2021-06-30,0001567619-21-015385
HOLX,HOLOGIC INCORPORATED COMMON STOCK USD0.01,436440101,288000.0,4320,0.00036075841791249723,2021-08-13,2021-06-30,0001567619-21-015385
CE,CELANESE CORPORATION CLASS A COMMON STOCK USD0.0001 (US LISTING),150870103,286000.0,1886,0.00035825315112143817,2021-08-13,2021-06-30,0001567619-21-015385
BIIB,BIOGEN INCORPORATED COMMON STOCK USD0.0005,09062X103,285000.0,822,0.0003570005177259087,2021-08-13,2021-06-30,0001567619-21-015385
EMR,EMERSON ELECTRIC COMPANY COMMON STOCK USD1,291011104,284000.0,2947,0.0003557478843303792,2021-08-13,2021-06-30,0001567619-21-015385
VMC,VULCAN MATERIALS CO COM STK US$1,929160109,284000.0,1629,0.0003557478843303792,2021-08-13,2021-06-30,0001567619-21-015385
VMC,VULCAN MATERIALS CO COM STK US$1,929160109,284000.0,1629,0.0003557478843303792,2021-08-13,2021-06-30,0001567619-21-015385
AFW,ALIGN TECHNOLOGY INCORPORATED COMMON STOCK USD0.0001,016255101,284000.0,464,0.0003557478843303792,2021-08-13,2021-06-30,0001567619-21-015385
PS1,COMPUTER PROGRAM SYSTEMS,205306103,283000.0,8514,0.0003544952509348497,2021-08-13,2021-06-30,0001567619-21-015385
VRTX,VERTEX PHARMACEUTICALS INCORPORATED COMMON STOCK USD0.01,92532F100,283000.0,1403,0.0003544952509348497,2021-08-13,2021-06-30,0001567619-21-015385
CIT,CINTAS CORPORATION COMMON STOCK NPV,172908105,283000.0,740,0.0003544952509348497,2021-08-13,2021-06-30,0001567619-21-015385
GIS,GENERAL MILLS INC COMMON STOCK USD0.10,370334104,282000.0,4631,0.0003532426175393202,2021-08-13,2021-06-30,0001567619-21-015385
N/A,LIBERTY GLOBAL PLC CLASS C COMMON STOCK USD0.01,G5480U120,281000.0,10355,0.0003519899841437907,2021-08-13,2021-06-30,0001567619-21-015385
N/A,EATON CORPORATION PLC COMMON STOCK USD0.50,G29183103,281000.0,1896,0.0003519899841437907,2021-08-13,2021-06-30,0001567619-21-015385
NSC,NORFOLK SOUTHERN CORP COMMON STOCK USD1,655844108,281000.0,1057,0.0003519899841437907,2021-08-13,2021-06-30,0001567619-21-015385
PEP,PEPSICO INCORPORATED CAPITAL STOCK USD0.016666,713448108,280000.0,1890,0.00035073735074826116,2021-08-13,2021-06-30,0001567619-21-015385
SSNC,SS&C TECHNOLOGIES HOLDINGS INCORPORATED COMMON STOCK USD0.01,78467J100,280000.0,3889,0.00035073735074826116,2021-08-13,2021-06-30,0001567619-21-015385
JNJ,JOHNSON AND JOHNSON COMMON STOCK USD1,478160104,280000.0,1698,0.00035073735074826116,2021-08-13,2021-06-30,0001567619-21-015385
TFX,TELEFLEX INCORPORATED COMMON STOCK USD1,879369106,280000.0,697,0.00035073735074826116,2021-08-13,2021-06-30,0001567619-21-015385
N/A,CNH INDUSTRIAL NV EUR0.01 (ITALIAN LISTING),N20944109,279000.0,20053,0.0003494847173527317,2021-08-13,2021-06-30,0001567619-21-015385
SF,STIFEL FINANCIAL CORPORATION COMMON STOCK USD0.15,860630102,279000.0,4298,0.0003494847173527317,2021-08-13,2021-06-30,0001567619-21-015385
ALL,ALLSTATE CORP USD0.01,020002101,278000.0,2132,0.00034823208395720216,2021-08-13,2021-06-30,0001567619-21-015385
MTUS,TIMKENSTEEL CORP COMMON STOCK NPV,887399103,278000.0,19646,0.00034823208395720216,2021-08-13,2021-06-30,0001567619-21-015385
CSX,CSX CORPORATION COMMON STOCK USD1,126408103,277000.0,8628,0.0003469794505616727,2021-08-13,2021-06-30,0001567619-21-015385
LULU,LULULEMON ATHLETICA INCORPORATED COMMON STOCK USD0.01,550021109,275000.0,754,0.00034447418377061363,2021-08-13,2021-06-30,0001567619-21-015385
CMCSA,COMCAST CORPORATION CLASS A COMMON STOCK USD1,20030N101,275000.0,4825,0.00034447418377061363,2021-08-13,2021-06-30,0001567619-21-015385
CMCSA,COMCAST CORPORATION CLASS A COMMON STOCK USD1,20030N101,275000.0,4825,0.00034447418377061363,2021-08-13,2021-06-30,0001567619-21-015385
ROP,ROPER TECHNOLOGIES INCORPORATED COMMON STOCK USD0.01,776696106,274000.0,583,0.00034322155037508416,2021-08-13,2021-06-30,0001567619-21-015385
PINS,PINTEREST INC COMMON STOCK A,72352L106,273000.0,3462,0.00034196891697955463,2021-08-13,2021-06-30,0001567619-21-015385
ALXN,ALEXION PHARMACEUTICALS INCORPORATED COMMON STOCK USD0.0001,015351109,272000.0,1482,0.00034071628358402515,2021-08-13,2021-06-30,0001567619-21-015385
ALNY,ALNYLAM PHARMACEUTICALS INCORPORATED COMMON STOCK USD0.01,02043Q107,272000.0,1606,0.00034071628358402515,2021-08-13,2021-06-30,0001567619-21-015385
NOG,NORTHERN OIL AND GAS INCORPORATED USD0.001,665531307,272000.0,13092,0.00034071628358402515,2021-08-13,2021-06-30,0001567619-21-015385
NEM,NEWMONT CORP COMMON STOCK USD1.60,651639106,271000.0,4275,0.0003394636501884957,2021-08-13,2021-06-30,0001567619-21-015385
SLG2EUR,SL GREEN REALTY CORPORATION USD0.01,78440X804,271000.0,3382,0.0003394636501884957,2021-08-13,2021-06-30,0001567619-21-015385
N/A,ARISTA NETWORKS INCORPORATED COMMON STOCK USD0.0001,040413106,271000.0,748,0.0003394636501884957,2021-08-13,2021-06-30,0001567619-21-015385
TDG,TRANSDIGM GROUP INCORPORATED COMMON STOCK USD0.01,893641100,270000.0,417,0.00033821101679296615,2021-08-13,2021-06-30,0001567619-21-015385
CRWD,CROWDSTRIKE HOLDINGS INC CLASS A,22788C105,270000.0,1075,0.00033821101679296615,2021-08-13,2021-06-30,0001567619-21-015385
ECL,ECOLAB INC COMMON STOCK USD1,278865100,270000.0,1311,0.00033821101679296615,2021-08-13,2021-06-30,0001567619-21-015385
DASH,DOORDASH INC CLASS A USD0,25809K105,270000.0,1516,0.00033821101679296615,2021-08-13,2021-06-30,0001567619-21-015385
IBN,ICICI BANK LIMITED SPONSORED ADR (EACH REPRESENTS 2 ORDINARY INR10),45104G104,269000.0,15724,0.0003369583833974367,2021-08-13,2021-06-30,0001567619-21-015385
SHW,SHERWIN-WILLIAMS COMPANY (THE) COMMON STOCK USD1,824348106,269000.0,987,0.0003369583833974367,2021-08-13,2021-06-30,0001567619-21-015385
MPC,MARATHON PETROLEUM CORPORATION COMMON STOCK NPV,56585A102,269000.0,4453,0.0003369583833974367,2021-08-13,2021-06-30,0001567619-21-015385
FRTEUR,FEDERAL REALTY INVESTMENT TRUST REIT USD0.01,313747206,269000.0,2298,0.0003369583833974367,2021-08-13,2021-06-30,0001567619-21-015385
SRCUSD,SPIRIT REALTY CAPITAL INC REIT,84860W300,269000.0,5633,0.0003369583833974367,2021-08-13,2021-06-30,0001567619-21-015385
CGNX,COGNEX CORPORATION COMMON STOCK USD0.002,192422103,269000.0,3195,0.0003369583833974367,2021-08-13,2021-06-30,0001567619-21-015385
CTRA,CABOT OIL & GAS CORPORATION COMMON STOCK USD0.10,127097103,268000.0,15331,0.00033570575000190715,2021-08-13,2021-06-30,0001567619-21-015385
CTRA,CABOT OIL & GAS CORPORATION COMMON STOCK USD0.10,127097103,268000.0,15331,0.00033570575000190715,2021-08-13,2021-06-30,0001567619-21-015385
EEM,ISHARES TRUST MSCI EMERGING MARKETS ETF,464287234,268000.0,4860,0.00033570575000190715,2021-08-13,2021-06-30,0001567619-21-015385
UI,UBIQUITI INCORPORATED USD0.001,90353W103,267000.0,854,0.0003344531166063776,2021-08-13,2021-06-30,0001567619-21-015385
CARR,CARRIER GLOBAL CORP USD0.01,14448C104,267000.0,5490,0.0003344531166063776,2021-08-13,2021-06-30,0001567619-21-015385
INSW,INTERNATIONAL SEAWAYS INCORPORATED COMMON STOCK NPV,Y41053102,266000.0,13867,0.00033320048321084815,2021-08-13,2021-06-30,0001567619-21-015385
KLAC,KLA CORPORATION COMMON STOCK USD0.001,482480100,266000.0,819,0.00033320048321084815,2021-08-13,2021-06-30,0001567619-21-015385
APH,AMPHENOL CORPORATION CLASS A COMMON STOCK USD0.001,032095101,266000.0,3888,0.00033320048321084815,2021-08-13,2021-06-30,0001567619-21-015385
WELL,WELLTOWER INCORPORATED REIT USD1,95040Q104,266000.0,3198,0.00033320048321084815,2021-08-13,2021-06-30,0001567619-21-015385
N/A,AON PLC,G0403H108,266000.0,1112,0.00033320048321084815,2021-08-13,2021-06-30,0001567619-21-015385
TROW,PRICE T.ROWE GROUP INCORPORATED COMMON STOCK USD0.20,74144T108,266000.0,1345,0.00033320048321084815,2021-08-13,2021-06-30,0001567619-21-015385
MELI,MERCADOLIBRE INCORPORATED COMMON STOCK USD0.001,58733R102,265000.0,170,0.0003319478498153186,2021-08-13,2021-06-30,0001567619-21-015385
MELI,MERCADOLIBRE INCORPORATED COMMON STOCK USD0.001,58733R102,265000.0,170,0.0003319478498153186,2021-08-13,2021-06-30,0001567619-21-015385
AAXJ,ISHARES TRUST MSCI ALL COUNTRY ASIA EX-JAPAN ETF,464288182,265000.0,2805,0.0003319478498153186,2021-08-13,2021-06-30,0001567619-21-015385
SLB,SCHLUMBERGER LIMITED COMMON STOCK USD0.01,806857108,265000.0,8285,0.0003319478498153186,2021-08-13,2021-06-30,0001567619-21-015385
DTM,DT MIDSTREAM INC WHEN ISSUED,23345M107,264000.0,6823,0.0003306952164197891,2021-08-13,2021-06-30,0001567619-21-015385
GDDY,GODADDY INC COMMON STOCK USD0.001,380237107,264000.0,3033,0.0003306952164197891,2021-08-13,2021-06-30,0001567619-21-015385
AVYAUSD,AVAYA HOLDINGS CORPORATION COMMON STOCK USD0.001,05351X101,264000.0,9818,0.0003306952164197891,2021-08-13,2021-06-30,0001567619-21-015385
JBHT,JB HUNT TRANSPORT SERVICES INCORPORATED COMMON STOCK USD0.01,445658107,264000.0,1621,0.0003306952164197891,2021-08-13,2021-06-30,0001567619-21-015385
BSAC,BANCO SANTANDER-CHILE SA ADR (EACH 1 REPRESENTS 400 COMMON SHARES),05965X109,263000.0,13220,0.0003294425830242596,2021-08-13,2021-06-30,0001567619-21-015385
PLTR,PALANTIR TECHNOLOGIES INC CLASS A USD0.001,69608A108,263000.0,9972,0.0003294425830242596,2021-08-13,2021-06-30,0001567619-21-015385
AKAM,AKAMAI TECHNOLOGIES INCORPORATED COMMON STOCK USD0.01,00971T101,263000.0,2254,0.0003294425830242596,2021-08-13,2021-06-30,0001567619-21-015385
SYY,SYSCO CORPORATION COMMON STOCK USD1,871829107,262000.0,3364,0.0003281899496287301,2021-08-13,2021-06-30,0001567619-21-015385
INDY,ISHARES TRUST INDIA 50 ETF,464289529,262000.0,5600,0.0003281899496287301,2021-08-13,2021-06-30,0001567619-21-015385
CVNA,CARVANA COMPANY COMMON STOCK USD0.001,146869102,261000.0,865,0.0003269373162332006,2021-08-13,2021-06-30,0001567619-21-015385
LVS,LAS VEGAS SANDS CORPORATION COMMON STOCK USD0.001,517834107,261000.0,4957,0.0003269373162332006,2021-08-13,2021-06-30,0001567619-21-015385
DUK,DUKE ENERGY CORPORATION COMMON STOCK USD0.001,26441C204,261000.0,2646,0.0003269373162332006,2021-08-13,2021-06-30,0001567619-21-015385
ADI,ANALOG DEVICES INCORPORATED COMMON STOCK USD0.166,032654105,260000.0,1513,0.0003256846828376711,2021-08-13,2021-06-30,0001567619-21-015385
HLT,HILTON WORLDWIDE HOLDINGS INCORPORATED COMMON STOCK USD0.01,43300A203,260000.0,2155,0.0003256846828376711,2021-08-13,2021-06-30,0001567619-21-015385
CSL,CARLISLE COMPANIES INCORPORATED COMMON STOCK USD1,142339100,260000.0,1357,0.0003256846828376711,2021-08-13,2021-06-30,0001567619-21-015385
K,KELLOGG COMPANY COMMON STOCK USD0.25,487836108,260000.0,4042,0.0003256846828376711,2021-08-13,2021-06-30,0001567619-21-015385
PSX,PHILLIPS 66 COMMON STOCK USD0.01,718546104,259000.0,3023,0.0003244320494421416,2021-08-13,2021-06-30,0001567619-21-015385
CNC,CENTENE CORPORATION COMMON STOCK USD0.001,15135B101,259000.0,3555,0.0003244320494421416,2021-08-13,2021-06-30,0001567619-21-015385
ADC,AGREE REALTY CORPORATION REIT USD0.0001,008492100,258000.0,3664,0.0003231794160466121,2021-08-13,2021-06-30,0001567619-21-015385
BBY,BEST BUY COMPANY INCORPORATED COMMON STOCK USD0.10,086516101,258000.0,2244,0.0003231794160466121,2021-08-13,2021-06-30,0001567619-21-015385
EEM,ISHARES TRUST MSCI EMERGING MARKETS ETF,464287234,257000.0,4653,0.0003219267826510826,2021-08-13,2021-06-30,0001567619-21-015385
HRL,HORMEL FOODS CORPORATION COMMON STOCK USD0.0293,440452100,257000.0,5390,0.0003219267826510826,2021-08-13,2021-06-30,0001567619-21-015385
DFSEUR,DISCOVER FINANCIAL SERVICES COMMON STOCK USD0.01,254709108,256000.0,2162,0.0003206741492555531,2021-08-13,2021-06-30,0001567619-21-015385
AAXJ,ISHARES TRUST MSCI ALL COUNTRY ASIA EX-JAPAN ETF,464288182,256000.0,2710,0.0003206741492555531,2021-08-13,2021-06-30,0001567619-21-015385
MTDR,MATADOR RESOURCES COMPANY COMMON STOCK USD0.01,576485205,256000.0,7100,0.0003206741492555531,2021-08-13,2021-06-30,0001567619-21-015385
ACLS,AXCELIS TECHNOLOGIES INCORPORATED COMMON STOCK USD0.001,054540208,255000.0,6319,0.0003194215158600236,2021-08-13,2021-06-30,0001567619-21-015385
FLS,FLOWSERVE CORPORATION COMMON STOCK USD1.25,34354P105,255000.0,6320,0.0003194215158600236,2021-08-13,2021-06-30,0001567619-21-015385
KHC,KRAFT HEINZ COMPANY (THE) COMMON STOCK USD0.01,500754106,255000.0,6249,0.0003194215158600236,2021-08-13,2021-06-30,0001567619-21-015385
CDK,CDK GLOBAL INCORPORATED COMMON STOCK USD0.001,12508E101,255000.0,5135,0.0003194215158600236,2021-08-13,2021-06-30,0001567619-21-015385
NFLX,NETFLIX INCORPORATED COMMON STOCK USD0.001,64110L106,254000.0,480,0.0003181688824644941,2021-08-13,2021-06-30,0001567619-21-015385
BAH,BOOZ ALLEN HAMILTON HOLDING CORPORATION CLASS A COMMON STOCK USD0.01,099502106,254000.0,2984,0.0003181688824644941,2021-08-13,2021-06-30,0001567619-21-015385
NFLX,NETFLIX INCORPORATED COMMON STOCK USD0.001,64110L106,254000.0,480,0.0003181688824644941,2021-08-13,2021-06-30,0001567619-21-015385
DGX,QUEST DIAGNOSTICS INCORPORATED COMMON STOCK USD0.01,74834L100,254000.0,1926,0.0003181688824644941,2021-08-13,2021-06-30,0001567619-21-015385
FAF,FIRST AMERICAN FINANCIAL CORPORATION COMMON STOCK USD0.00001,31847R102,253000.0,4050,0.00031691624906896455,2021-08-13,2021-06-30,0001567619-21-015385
RHI,ROBERT HALF INTERNATIONAL INCORPORATE COMMON STOCK USD1,770323103,253000.0,2844,0.00031691624906896455,2021-08-13,2021-06-30,0001567619-21-015385
RNG,RINGCENTRAL INC-CLASS A COMMON STOCK USD0.0001,76680R206,253000.0,870,0.00031691624906896455,2021-08-13,2021-06-30,0001567619-21-015385
FRPT,FRESHPET INC COMMON STOCK USD0.001,358039105,253000.0,1552,0.00031691624906896455,2021-08-13,2021-06-30,0001567619-21-015385
HWM,Howmet Aerospace Inc NPV,443201108,252000.0,7317,0.0003156636156734351,2021-08-13,2021-06-30,0001567619-21-015385
N/A,WILLIS TOWERS WATSON PUBLIC LIMITED COMPANY ORDINARY USD0.0003,G96629103,252000.0,1096,0.0003156636156734351,2021-08-13,2021-06-30,0001567619-21-015385
CFG,CITIZENS FINANCIAL GROUP INCORPORATED COMMON STOCK USD0.01,174610105,252000.0,5494,0.0003156636156734351,2021-08-13,2021-06-30,0001567619-21-015385
DEI,DOUGLAS EMMETT INCORPORATED REIT USD0.01,25960P109,252000.0,7495,0.0003156636156734351,2021-08-13,2021-06-30,0001567619-21-015385
FL,FOOT LOCKER INCORPORATED COMMON STOCK USD0.01,344849104,251000.0,4071,0.00031441098227790555,2021-08-13,2021-06-30,0001567619-21-015385
FICO,FAIR ISAAC CORPORATION COMMON STOCK USD0.01,303250104,251000.0,499,0.00031441098227790555,2021-08-13,2021-06-30,0001567619-21-015385
EMN,EASTMAN CHEMICAL COMPANY COMMON STOCK USD0.01,277432100,250000.0,2144,0.00031315834888237607,2021-08-13,2021-06-30,0001567619-21-015385
PPL,PPL CORPORATION COMMON STOCK USD0.01,69351T106,249000.0,8909,0.00031190571548684654,2021-08-13,2021-06-30,0001567619-21-015385
DLTR,DOLLAR TREE INCORPORATED COMMON STOCK USD0.01,256746108,249000.0,2506,0.00031190571548684654,2021-08-13,2021-06-30,0001567619-21-015385
ACN,ACCENTURE PLC CLASS A NEW COMMON STOCK USD0.0000225,G1151C101,248000.0,840,0.000310653082091317,2021-08-13,2021-06-30,0001567619-21-015385
PRU,PRUDENTIAL FINANCIAL INCORPORATED COMMON STOCK USD0.01,744320102,248000.0,2425,0.000310653082091317,2021-08-13,2021-06-30,0001567619-21-015385
QTS,QTS REALTY TRUST INC-CL A REIT USD0.01,74736A103,248000.0,3213,0.000310653082091317,2021-08-13,2021-06-30,0001567619-21-015385
SJM,J.M. SMUCKER COMPANY (THE) COMMON STOCK USD0.001,832696405,248000.0,1917,0.000310653082091317,2021-08-13,2021-06-30,0001567619-21-015385
COLL,COLLEGIUM PHARMACEUTICAL INC COMMON STOCK USD0.001,19459J104,248000.0,10502,0.000310653082091317,2021-08-13,2021-06-30,0001567619-21-015385
N/A,ATLASSIAN CORP PLC-CLASS A USD0.100000,G06242104,248000.0,964,0.000310653082091317,2021-08-13,2021-06-30,0001567619-21-015385
SPLKCHF,SPLUNK INC COMMON STOCK USD0.01,848637104,248000.0,1713,0.000310653082091317,2021-08-13,2021-06-30,0001567619-21-015385
DLB,DOLBY LABORATORIES INCORPORATED CLASS 'A' COMMON STOCK USD0.001,25659T107,247000.0,2515,0.00030940044869578754,2021-08-13,2021-06-30,0001567619-21-015385
HCA,HCA HEALTHCARE INCORPORATED COMMON STOCK USD0.01,40412C101,246000.0,1188,0.000308147815300258,2021-08-13,2021-06-30,0001567619-21-015385
HCA,HCA HEALTHCARE INCORPORATED COMMON STOCK USD0.01,40412C101,246000.0,1188,0.000308147815300258,2021-08-13,2021-06-30,0001567619-21-015385
SYF,SYNCHRONY FINANCIAL COMMON STOCK  USD0.001,87165B103,245000.0,5057,0.00030689518190472854,2021-08-13,2021-06-30,0001567619-21-015385
CMG,CHIPOTLE MEXICAN GRILL INCORPORATED COMMON STOCK USD0.01,169656105,245000.0,158,0.00030689518190472854,2021-08-13,2021-06-30,0001567619-21-015385
CSX,CSX CORPORATION COMMON STOCK USD1,126408103,245000.0,7623,0.00030689518190472854,2021-08-13,2021-06-30,0001567619-21-015385
NWLIEUR,NATIONAL WESTERN LIFE GROUP INCORPORATED CLASS A COMMON STOCK USD0.01,638517102,245000.0,1092,0.00030689518190472854,2021-08-13,2021-06-30,0001567619-21-015385
