ticker,nameOfIssuer,cusip,value,shares,allocation_percent,filingDate,reportDate,accessionNumber
BAC,VERIZON COMMS INC NPV Common Stock,92343V104,150381000.0,3092354,9.949742160610716,2015-04-10,2015-03-31,0001140361-15-014996
LMT,LOCKHEED MARTIN CO USD1 Common Stock,539830109,66945000.0,329845,4.429319454865205,2015-04-10,2015-03-31,0001140361-15-014996
AAPL,APPLE INC NPV Common Stock,037833100,53933000.0,433442,3.568399225621706,2015-04-10,2015-03-31,0001140361-15-014996
BKU,BANKUNITED INC USD0.01 Common Stock,06652K103,37985000.0,1160200,2.5132227872590156,2015-04-10,2015-03-31,0001140361-15-014996
V,VISA INC USD0.0001 Common Stock,92826C839,31605000.0,483185,2.0910992810667683,2015-04-10,2015-03-31,0001140361-15-014996
JNJ,JOHNSON & JOHNSON USD1 Common Stock,478160104,28361000.0,281922,1.8764646957865723,2015-04-10,2015-03-31,0001140361-15-014996
DIS,WALT DISNEY (HLDGS) CO USD0.1 Common Stock,254687106,25423000.0,242377,1.6820761595494524,2015-04-10,2015-03-31,0001140361-15-014996
AMZN,AMAZON COM INC USD0.01Common Stock,023135106,25305000.0,68007,1.674268859591665,2015-04-10,2015-03-31,0001140361-15-014996
JPM,JP MORGAN CHASE & CO USD1 Common Stock,46625H100,24721000.0,408067,1.6356293411565126,2015-04-10,2015-03-31,0001140361-15-014996
INTC,INTEL CORP USD0.001 Common Stock,458140100,24523000.0,784243,1.6225289564815806,2015-04-10,2015-03-31,0001140361-15-014996
BRK/B,BERKSHIRE HATHAWAY INC USD0.0033 Cls B Common Stock,084670702,23545000.0,163147,1.5578209958144933,2015-04-10,2015-03-31,0001140361-15-014996
PM,PHILIP MORRIS INTL INC NPV Common Stock,718172109,22473000.0,298327,1.4868936606047614,2015-04-10,2015-03-31,0001140361-15-014996
N/A,SPRINGLEAF HLDGS INC USD0.01 Common Stock,85172J101,22442000.0,433500,1.484842590276868,2015-04-10,2015-03-31,0001140361-15-014996
GE,GENERAL ELECTRIC CORP USD0.06 Common Stock,369604103,22302000.0,898918,1.4755796920218658,2015-04-10,2015-03-31,0001140361-15-014996
STZ,CONSTELLATION BRANDS INC USD Cls A Common Stock,21036P108,22223000.0,191230,1.4703527708636859,2015-04-10,2015-03-31,0001140361-15-014996
VIPS,VIPSHOP HOLDINGS LTD Spon ADR Each Rep 2 Ord Shares,92763W103,21491000.0,730000,1.4219210457018168,2015-04-10,2015-03-31,0001140361-15-014996
XOM,EXXON MOBIL CORP NPV Common Stock,30231G102,20905000.0,245939,1.3831492001487355,2015-04-10,2015-03-31,0001140361-15-014996
CTSH,COGNIZANT TECHNOLOGY USD0.01 Class A Common Stock,192446102,20437000.0,327565,1.3521846545534424,2015-04-10,2015-03-31,0001140361-15-014996
MSFT,MICROSOFT CORP USD 0.00000625 Common Stock,594918104,20176000.0,496265,1.3349159656637595,2015-04-10,2015-03-31,0001140361-15-014996
META,FACEBOOK INC USD0.000006 Cls A Common Stock,30303M102,19502000.0,237202,1.2903217269218197,2015-04-10,2015-03-31,0001140361-15-014996
KMX,CARMAX INC USD0.50 Common Stock,143130102,19392000.0,281000,1.2830437354357465,2015-04-10,2015-03-31,0001140361-15-014996
MA,MASTERCARD INC USD0.0001 Class A Common Stock,57636Q104,18901000.0,218790,1.2505574279842744,2015-04-10,2015-03-31,0001140361-15-014996
AOS,SMITH(AO)CORP USD1 Common Stock,831865209,18844000.0,287000,1.2467861051233091,2015-04-10,2015-03-31,0001140361-15-014996
AMGN,AMGEN INC USD0.0001 Common Stock,031162100,18843000.0,117879,1.2467199415643446,2015-04-10,2015-03-31,0001140361-15-014996
N/A,RESTORATION HARDWARE HLDGS INC USD0.0001 Common Stock,761283100,18648000.0,188000,1.2338180475663059,2015-04-10,2015-03-31,0001140361-15-014996
N/A,KRAFT FOODS GROUP NPV Common Stock,50076Q106,17639000.0,202481,1.167059016571325,2015-04-10,2015-03-31,0001140361-15-014996
BFH,ALLIANCE DATA SYSTEMS USD0.01 Common Stock,018581108,17331000.0,58500,1.14668064041032,2015-04-10,2015-03-31,0001140361-15-014996
N/A,MATTRESS FIRM HLDGS CORP USD0.001 Common Stock,57722W106,17131000.0,246000,1.1334479286174597,2015-04-10,2015-03-31,0001140361-15-014996
CCK,CROWN HOLDINGS INC USD5 Common Stock,228368106,16892000.0,312690,1.1176348380249912,2015-04-10,2015-03-31,0001140361-15-014996
CL,COLGATE-PALMOLIVE CO NPV Common Stock,194162103,16677000.0,240514,1.1034096728476663,2015-04-10,2015-03-31,0001140361-15-014996
BABA,ALIBABA GROUP HOLDINGS LTD Spon ADS Each Rep 1 Ord,01609W102,16638000.0,199883,1.1008292940480584,2015-04-10,2015-03-31,0001140361-15-014996
RY,ROYAL BANK OF CANADA NPV Common Stock,780087102,16180000.0,268779,1.0705263840424082,2015-04-10,2015-03-31,0001140361-15-014996
PPG,PPG INDUSTRIES INC USD1.666 Common Stock,693506107,15855000.0,70300,1.04902322737901,2015-04-10,2015-03-31,0001140361-15-014996
CVX,CHEVRON CORP USD0.75 Common Stock,166764100,15197000.0,144765,1.005487605580499,2015-04-10,2015-03-31,0001140361-15-014996
MCX,MCCORMICK & CO INC NPV Non Vtg Common Stock,579780206,15056000.0,195251,0.9961585437665326,2015-04-10,2015-03-31,0001140361-15-014996
GILD,GILEAD SCIENCES INC USD0.001 Common Stock,375558103,14887000.0,151711,0.9849769023015655,2015-04-10,2015-03-31,0001140361-15-014996
LBEUR,LIMITED BRANDS INC USD0.50 Common Stock,501797104,13781000.0,146160,0.9118000060870475,2015-04-10,2015-03-31,0001140361-15-014996
JBHT,HUNT (JB) TRANSPORT SVCS INC USD0.01 Common Stock,445658107,13663000.0,160000,0.9039927061292597,2015-04-10,2015-03-31,0001140361-15-014996
EXP,EAGLE MATERIALS INC USD0.01 Common Stock,26969P108,13566000.0,162355,0.8975748409097225,2015-04-10,2015-03-31,0001140361-15-014996
ROL,ROLLINS INC USD1 Common Stock,775711104,13540000.0,547500,0.8958545883766507,2015-04-10,2015-03-31,0001140361-15-014996
ATVIEUR,ACTIVISION BLIZZAR INC USD0.000001 Common Stock,00507V109,13067000.0,575000,0.8645592249865356,2015-04-10,2015-03-31,0001140361-15-014996
BNS,BANK OF NOVA SCOTIA NPV Common Stock,064149107,12679000.0,252718,0.8388877641083864,2015-04-10,2015-03-31,0001140361-15-014996
EOG,EOG RESOURCES INC USD0.01 Common Stock,26875P101,12562000.0,137000,0.8311466277095632,2015-04-10,2015-03-31,0001140361-15-014996
PFE,PFIZER INC USD0.05 Common Stock,717081103,11892000.0,341816,0.7868170432034808,2015-04-10,2015-03-31,0001140361-15-014996
KO,COCA-COLA CO USD0.25 Common Stock,191216100,11656000.0,287445,0.7712024432879054,2015-04-10,2015-03-31,0001140361-15-014996
PG,PROCTER & GAMBLE CO NPV Common Stock,742718109,11403000.0,139164,0.7544630628699369,2015-04-10,2015-03-31,0001140361-15-014996
N/A,DR PEPPER SNAPPLE GROUP INC USD0.01 Common Stock,26138E109,11197000.0,142669,0.7408333697232907,2015-04-10,2015-03-31,0001140361-15-014996
MDLZ,MONDELEZ INTL INC USD0.01 Common Stock,609207105,10920000.0,302580,0.7225060638901791,2015-04-10,2015-03-31,0001140361-15-014996
SLB,SCHLUMBERGER LTD USD0.01 Common Stock,806857108,10590000.0,126918,0.7006720894319595,2015-04-10,2015-03-31,0001140361-15-014996
WFC,WELLS FARGO & CO USD1.6666 Common Stock,949746101,10581000.0,194511,0.7000766174012807,2015-04-10,2015-03-31,0001140361-15-014996
C,CITIGROUP INC USD0.01 Common Stock,172967424,10012000.0,194328,0.6624295523505928,2015-04-10,2015-03-31,0001140361-15-014996
ABT,ABBOTT LABORATORIES NPV Common Stock,002824100,9729000.0,209997,0.6437052651636952,2015-04-10,2015-03-31,0001140361-15-014996
MMC,MARSH & MCLENNAN CO INC USD1 Common Stock,571748102,9625000.0,171602,0.6368242550314078,2015-04-10,2015-03-31,0001140361-15-014996
AFW,ALIGN TECHNOLOGY INC USD0.0001 Common Stock,016255101,9305000.0,173000,0.6156519161628311,2015-04-10,2015-03-31,0001140361-15-014996
N/A,GOOGLE INC USD0.001 Class A Common Stock,38259P508,9054000.0,16323,0.5990448628627913,2015-04-10,2015-03-31,0001140361-15-014996
ABBV,ABBVIE INC USD0.01 Common Stock,00287Y109,8935000.0,152638,0.5911713993460394,2015-04-10,2015-03-31,0001140361-15-014996
WT,WISDOMTREE INVESTMENTS INC USD0.01 Common Stock,97717P104,8584000.0,400000,0.5679479901495693,2015-04-10,2015-03-31,0001140361-15-014996
SPY,SPDR SERIES TRUST S&P 500 ETF Trust,78462F103,8310000.0,40254,0.5498191749933505,2015-04-10,2015-03-31,0001140361-15-014996
HON,HONEYWELL INTERNATIONAL INC USD1 Common Stock,438516106,7964000.0,76348,0.526926583591702,2015-04-10,2015-03-31,0001140361-15-014996
RTN1USD,RAYTHEON CO USD0.01 Common Stock,755111507,7114000.0,65115,0.4706875584720453,2015-04-10,2015-03-31,0001140361-15-014996
PEP,PEPSICO INC USD0.016666 Cap,713448108,6916000.0,72324,0.45758717379711344,2015-04-10,2015-03-31,0001140361-15-014996
IBM,IBM CORP USD0.20 Common Stock,459200101,6658000.0,41481,0.44051697558432346,2015-04-10,2015-03-31,0001140361-15-014996
MO,ALTRIA GROUP INC USD0.333333 Common Stock,02209S103,6418000.0,128310,0.42463772143289097,2015-04-10,2015-03-31,0001140361-15-014996
MCD,MCDONALD'S CORP USD0.01 Common Stock,580135101,5876000.0,60303,0.3887770724742392,2015-04-10,2015-03-31,0001140361-15-014996
CM,CANADIAN IMPERIAL BANK NPV Common Stock,136069101,5866000.0,80914,0.3881154368845962,2015-04-10,2015-03-31,0001140361-15-014996
AJG,GALLAGHER AJ & CO USD1 Common Stock,363576109,5678000.0,121455,0.3756766877993074,2015-04-10,2015-03-31,0001140361-15-014996
LLY,LILLY (ELI) & CO NPV Common Stock,532457108,5387000.0,74145,0.3564230921406955,2015-04-10,2015-03-31,0001140361-15-014996
N/A,EMC CORP MASSACHUSETTS USD0.01 Common Stock,268648102,5364000.0,209860,0.35490133028451654,2015-04-10,2015-03-31,0001140361-15-014996
EBA,EBAY INC USD0.001 Common Stock,278642103,4927000.0,85425,0.3259878550171165,2015-04-10,2015-03-31,0001140361-15-014996
UNP,UNION PACIFIC CORP USD2.50 Common Stock,907818108,4566000.0,42153,0.30210281023100344,2015-04-10,2015-03-31,0001140361-15-014996
CVS,CVS CORP USD0.01 Common Stock,126650100,4537000.0,43963,0.30018406702103867,2015-04-10,2015-03-31,0001140361-15-014996
EPP,ISHARES INC MSCI Pacific Ex Japan ETF,464286665,4508000.0,99379,0.2982653238110739,2015-04-10,2015-03-31,0001140361-15-014996
N/A,GOOGLE INC USD0.001 Cls C Common Stock,38259P706,4123000.0,7524,0.2727923536098176,2015-04-10,2015-03-31,0001140361-15-014996
DVY,ISHARES TRUST Select Dividend ETF,464287168,3969000.0,50925,0.2626031655293151,2015-04-10,2015-03-31,0001140361-15-014996
BMY,BRISTOL-MYERS SQUIBB CO NPV Common Stock,110122108,3959000.0,61381,0.26194152993967207,2015-04-10,2015-03-31,0001140361-15-014996
WMT,WAL-MART STORES INC USD0.1 Common Stock,931142103,3677000.0,44703,0.24328340631173886,2015-04-10,2015-03-31,0001140361-15-014996
T,AT&T INC USD1 Common Stock,00206R102,3619000.0,110848,0.23944591989180936,2015-04-10,2015-03-31,0001140361-15-014996
BAC,BANK OF AMERICA CORP NPV Common Stock,060505104,3580000.0,232641,0.23686554109220154,2015-04-10,2015-03-31,0001140361-15-014996
EWP,ISHARES INC MSCI Spain Capped Index Fund,464286764,3562000.0,102404,0.23567459703084412,2015-04-10,2015-03-31,0001140361-15-014996
CELG,CELGENE CORP USD0.01 Common Stock,151020104,3548000.0,30773,0.23474830720534387,2015-04-10,2015-03-31,0001140361-15-014996
DFSEUR,DISCOVER FINANCIAL SERVICES USD0.01 Common Stock,254709108,3543000.0,62869,0.2344174894105224,2015-04-10,2015-03-31,0001140361-15-014996
BMO,BANK OF MONTREAL NPV Common Stock,063671101,3491000.0,58256,0.2309769843443787,2015-04-10,2015-03-31,0001140361-15-014996
EMR,EMERSON ELECTRIC CO USD0.50 Common Stock,291011104,3422000.0,60430,0.22641169877584186,2015-04-10,2015-03-31,0001140361-15-014996
ADBE,ADOBE SYSTEMS INC NPV Common Stock,00724F101,3402000.0,46012,0.2250884275965558,2015-04-10,2015-03-31,0001140361-15-014996
GLW,CORNING INC USD0.50 Common Stock,219350105,3367000.0,148460,0.22277270303280522,2015-04-10,2015-03-31,0001140361-15-014996
NEM,NEWMONT MINING CORP USD1.60 Common Stock,651639106,3177000.0,146344,0.21020162682958782,2015-04-10,2015-03-31,0001140361-15-014996
MMM,3M COMPANY USD0.01 Common Stock,88579Y101,3155000.0,19129,0.20874602853237317,2015-04-10,2015-03-31,0001140361-15-014996
COP,CONOCOPHILLIPS USD0.01 Common Stock,20825C104,3086000.0,49567,0.20418074296383631,2015-04-10,2015-03-31,0001140361-15-014996
MRK,MERCK & CO INC USD0.50 Common Stock,58933Y105,3033000.0,52772,0.2006740743387283,2015-04-10,2015-03-31,0001140361-15-014996
BCE,BCE INC NPV Common Stock,05534B760,2581000.0,60961,0.17076814568686374,2015-04-10,2015-03-31,0001140361-15-014996
RJAUSD,SWEDISH EXPORT CREDIT Elements ETN Lkd RICI,870297603,2580000.0,381027,0.17070198212789947,2015-04-10,2015-03-31,0001140361-15-014996
HFCUSD,HOLLYFRONTIER CORP USD0.01 Common Stock,436106108,2525000.0,62701,0.16706298638486283,2015-04-10,2015-03-31,0001140361-15-014996
N/A,ISHARES INC MSCI Japan ETF,464286848,2449000.0,195432,0.16203455590357588,2015-04-10,2015-03-31,0001140361-15-014996
KMB,KIMBERLEY CLARK CORP NPV Common Stock,494368103,2382000.0,22241,0.15760159745296765,2015-04-10,2015-03-31,0001140361-15-014996
POT1EUR,POTASH CORP OF SASKATCHEWAN NPV Common Stock,73755L107,2379000.0,73765,0.15740310677607475,2015-04-10,2015-03-31,0001140361-15-014996
DXJ,WISDOMTREE TRUST Japan Hedged Equity Fund,97717W851,2336000.0,42378,0.15455807374060973,2015-04-10,2015-03-31,0001140361-15-014996
UTXZ,UTD TECHNOLOGIES CORP USD1 Common Stock,913017109,2323000.0,19819,0.1536979474740738,2015-04-10,2015-03-31,0001140361-15-014996
TD,TORONTO-DOMINION BANK NPV Common Stock,891160509,2308000.0,53924,0.15270549408960926,2015-04-10,2015-03-31,0001140361-15-014996
TIP,ISHARES TRUST Tips Bond ETF,464287176,2176000.0,19153,0.1439719043063214,2015-04-10,2015-03-31,0001140361-15-014996
BND,VANGUARD BOND INDEX FUND Total Bond Market ETF,921937835,2130000.0,25549,0.1409283805939635,2015-04-10,2015-03-31,0001140361-15-014996
EEM,ISHARES TRUST MSCI Emerging Markets ETF,464287234,2114000.0,52685,0.13986976365053466,2015-04-10,2015-03-31,0001140361-15-014996
CAT,CATERPILLAR INC USD1 Common Stock,149123101,1970000.0,24614,0.13034221115967518,2015-04-10,2015-03-31,0001140361-15-014996
N/A,POWERSHARES ETF Intl Corp Bond,73936Q835,1967000.0,74378,0.13014372048278225,2015-04-10,2015-03-31,0001140361-15-014996
EMF,TEMPLETON EMERGING MKTS FUND USD0.01 Common Stock,880191101,1918000.0,125685,0.12690170609353146,2015-04-10,2015-03-31,0001140361-15-014996
DWD,MORGAN STANLEY USD0.01 Common Stock,617446448,1918000.0,53743,0.12690170609353146,2015-04-10,2015-03-31,0001140361-15-014996
N/A,THOMSON REUTERS CORP NPV Common Stock,884903105,1880000.0,46384,0.12438749085288799,2015-04-10,2015-03-31,0001140361-15-014996
N/A,ISHARES INC MSCI UK ETF,46434V548,1878000.0,104288,0.12425516373495936,2015-04-10,2015-03-31,0001140361-15-014996
WBA,WALGREENS BOOTS ALLIANCE USD0.01 Common Stock,931427108,1784000.0,21071,0.11803578919231496,2015-04-10,2015-03-31,0001140361-15-014996
AEM,AGNICO EAGLE MINES LTD NPV Common Stock,008474108,1699000.0,61150,0.11241188668034928,2015-04-10,2015-03-31,0001140361-15-014996
TIFEUR,TIFFANY & CO USD0.01 Common Stock,886547108,1699000.0,19306,0.11241188668034928,2015-04-10,2015-03-31,0001140361-15-014996
SYY,SYSCO CORP NPV Common Stock,871829107,1692000.0,44832,0.11194874176759918,2015-04-10,2015-03-31,0001140361-15-014996
NX,QUANEX BUILDING PRODUCTS CORP USD0.01 Common Stock,747619104,1679000.0,85045,0.11108861550106325,2015-04-10,2015-03-31,0001140361-15-014996
BA,BOEING CO USD5 Common Stock,097023105,1676000.0,11169,0.11089012482417035,2015-04-10,2015-03-31,0001140361-15-014996
GLD,SPDR GOLD TRUST NPV Shares,78463V107,1610000.0,14163,0.1065233299325264,2015-04-10,2015-03-31,0001140361-15-014996
CSCO,CISCO SYSTEMS INC USD0.001 Common Stock,17275R102,1598000.0,58040,0.10572936722495478,2015-04-10,2015-03-31,0001140361-15-014996
N/A,RACKSPACE HOSTING INC USD0.001 Common Stock,750086100,1588000.0,30785,0.10506773163531176,2015-04-10,2015-03-31,0001140361-15-014996
EWG,ISHARES INC MSCI Germany ETF,464286806,1573000.0,52700,0.10407527825084724,2015-04-10,2015-03-31,0001140361-15-014996
WPS,ISHARES TRUST Intl Developed Prop ETF,464288422,1565000.0,41023,0.1035459697791328,2015-04-10,2015-03-31,0001140361-15-014996
GIS,GENERAL MILLS INC USD0.10 Common Stock,370334104,1530000.0,27025,0.10123024521538222,2015-04-10,2015-03-31,0001140361-15-014996
BRK/A,BERKSHIRE HATHAWAY INC USD5 Class A Common Stock,084670108,1523000.0,7,0.10076710030263213,2015-04-10,2015-03-31,0001140361-15-014996
BF/B,BROWN-FORMAN CORP USD0.15 B Common Stock,115637209,1512000.0,16730,0.10003930115402479,2015-04-10,2015-03-31,0001140361-15-014996
N/A,MARKET VECTORS ETF Gold Mines,57060U100,1409000.0,77231,0.09322445458070168,2015-04-10,2015-03-31,0001140361-15-014996
PSX,PHILLIPS 66 USD0.01 Common Stock,718546104,1368000.0,17403,0.09051174866316529,2015-04-10,2015-03-31,0001140361-15-014996
N/A,REYNOLDS AMERICAN INC USD0.0001 Common Stock,761713106,1353000.0,19640,0.08951929527870076,2015-04-10,2015-03-31,0001140361-15-014996
GS,GOLDMAN SACHS GROUP USD0.01 Common Stock,38141G104,1327000.0,7062,0.0877990427456289,2015-04-10,2015-03-31,0001140361-15-014996
XYL,XYLEM INC USD0.01 Common Stock,98419M100,1297000.0,37050,0.08581413597669985,2015-04-10,2015-03-31,0001140361-15-014996
PAYX,PAYCHEX INC USD0.01 Common Stock,704326107,1265000.0,25501,0.08369690208984217,2015-04-10,2015-03-31,0001140361-15-014996
BSV,VANGUARD BOND INDEX FUND Short Term Bond ETF,921937827,1259000.0,15639,0.08329992073605635,2015-04-10,2015-03-31,0001140361-15-014996
DOV,DOVER CORP USD1 Common Stock,260003108,1255000.0,18155,0.08303526650019916,2015-04-10,2015-03-31,0001140361-15-014996
IOO,ISHARES TRUST Global 100 ETF,464287572,1183000.0,15385,0.0782714902547694,2015-04-10,2015-03-31,0001140361-15-014996
MFC,MANULIFE FINANCIAL CORP NPV Common Stock,56501R106,1172000.0,69000,0.07754369110616208,2015-04-10,2015-03-31,0001140361-15-014996
N/A,PALL CORP USD0.10 Common Stock,696429307,1169000.0,11645,0.07734520042926918,2015-04-10,2015-03-31,0001140361-15-014996
IWM,ISHARES TRUST Russell 2000 ETF,464287655,1164000.0,9361,0.07701438263444767,2015-04-10,2015-03-31,0001140361-15-014996
N/A,TOWERS WATSON & CO USD0.01 Class A Common Stock,891894107,1134000.0,8580,0.0750294758655186,2015-04-10,2015-03-31,0001140361-15-014996
IXN,ISHARES TRUST Global Technology ETF,464287291,1120000.0,11566,0.07410318604001837,2015-04-10,2015-03-31,0001140361-15-014996
K,KELLOGG CO USD0.25 Common Stock,487836108,1114000.0,16890,0.07370620468623255,2015-04-10,2015-03-31,0001140361-15-014996
EZU,ISHARES INC MSCI EMU ETF,464286608,1098000.0,28455,0.07264758774280372,2015-04-10,2015-03-31,0001140361-15-014996
TEVA,TEVA PHARMACEUTICAL INDUSTRIES ADR Conv 1 Ord ILS0.10,881624209,1093000.0,17551,0.07231676994798221,2015-04-10,2015-03-31,0001140361-15-014996
N/A,GOLDCORP INC NPV Common Stock,380956409,1089000.0,60105,0.072052115712125,2015-04-10,2015-03-31,0001140361-15-014996
GII,SPDR INDEX SHARES S&P Gbl Infrastructure ETF,78463X855,1088000.0,22396,0.0719859521531607,2015-04-10,2015-03-31,0001140361-15-014996
PUK,PRUDENTIAL PLC ADR Rep 2 5p Ordinary Shares,74435K204,1066000.0,21370,0.07053035385594605,2015-04-10,2015-03-31,0001140361-15-014996
N/A,WHOLE FOODS MARKET INC NPV Common Stock,966837106,1063000.0,20403,0.07033186317905314,2015-04-10,2015-03-31,0001140361-15-014996
N/A,YAHOO INC USD 0.001 Common Stock,984332106,1032000.0,23220,0.06828079285115977,2015-04-10,2015-03-31,0001140361-15-014996
DE,DEERE & CO USD1 Common Stock,244199105,1029000.0,11734,0.06808230217426688,2015-04-10,2015-03-31,0001140361-15-014996
N/A,CANADIAN PACIFIC RAILWAY LTD NPV Common Stock,13645T100,1003000.0,5477,0.06636204964119502,2015-04-10,2015-03-31,0001140361-15-014996
NKE,NIKE INC NPV Cls B Common Stock,654106103,987000.0,9834,0.06530343269776619,2015-04-10,2015-03-31,0001140361-15-014996
IMO,IMPERIAL OIL NPV Common Stock,453038408,976000.0,24460,0.06457563354915886,2015-04-10,2015-03-31,0001140361-15-014996
R6C2,ROYAL DUTCH SHELL EUR0.07 ADR Ea Rep 2 Cls B Shs,780259107,961000.0,15330,0.06358318016469433,2015-04-10,2015-03-31,0001140361-15-014996
AXP,AMERICAN EXPRESS CORP USD0.20 Common Stock,025816109,941000.0,12047,0.062259908985408285,2015-04-10,2015-03-31,0001140361-15-014996
EWH,ISHARES INC MSCI Hong Kong Index Fund,464286871,936000.0,42670,0.061929091190586774,2015-04-10,2015-03-31,0001140361-15-014996
BDX,BECTON DICKINSON & CO NPV Common Stock,075887109,898000.0,6255,0.05941487594994329,2015-04-10,2015-03-31,0001140361-15-014996
VGK,VANGUARD INTL EQUITY European ETF,922042874,898000.0,16570,0.05941487594994329,2015-04-10,2015-03-31,0001140361-15-014996
SBUX,STARBUCKS CORP USD0.001 Common Stock,855244109,880000.0,9291,0.05822393188858586,2015-04-10,2015-03-31,0001140361-15-014996
BTUSD,BRITISH TELECOM GROUP PLC ADR Each Rep 10 Ord Shares,05577E101,873000.0,13397,0.05776078697583574,2015-04-10,2015-03-31,0001140361-15-014996
WM,WASTE MANAGEMENT INC NPV Common Stock,94106L109,864000.0,15930,0.057165314945157024,2015-04-10,2015-03-31,0001140361-15-014996
RSG,REPUBLIC SERVICES INC USD0.01 Common Stock,760759100,863000.0,21275,0.057099151386192724,2015-04-10,2015-03-31,0001140361-15-014996
MCO,MOODYS CORP  USD0.01 Common Stock,615369105,857000.0,8252,0.056702170032406914,2015-04-10,2015-03-31,0001140361-15-014996
QCOM,QUALCOMM INC USD0.001 Common Stock,747525103,843000.0,12163,0.055775880206906686,2015-04-10,2015-03-31,0001140361-15-014996
RPM,RPM INTL INC USD0.01 Common Stock,749685103,842000.0,17545,0.05570971664794238,2015-04-10,2015-03-31,0001140361-15-014996
PH,PARKER-HANNIFIN CORP USD0.50 Common Stock,701094104,831000.0,7000,0.05498191749933505,2015-04-10,2015-03-31,0001140361-15-014996
PKWUSD,POWERSHARES ETF Buyback Achievers,73935X286,827000.0,16765,0.05471726326347785,2015-04-10,2015-03-31,0001140361-15-014996
RDS/A,ROYAL DUTCH SHELL PLC ADR Ech Rep 2 Cl A EUR0.07 Shs,780259206,821000.0,13769,0.05432028190969204,2015-04-10,2015-03-31,0001140361-15-014996
IVV,ISHARES INC Core S&P 500 ETF,464287200,818000.0,3935,0.05412179123279912,2015-04-10,2015-03-31,0001140361-15-014996
L,LOEWS CORP USD1 Common Stock,540424108,817000.0,20000,0.05405562767383482,2015-04-10,2015-03-31,0001140361-15-014996
KR,KROGER CO USD1 Common Stock,501044101,809000.0,10550,0.053526319202120407,2015-04-10,2015-03-31,0001140361-15-014996
N/A,MARKET VECTORS ETF Vietnam ETF,57060U761,797000.0,47220,0.052732356494548785,2015-04-10,2015-03-31,0001140361-15-014996
EWD,ISHARES INC MSCI Sweden ETF,464286756,789000.0,23565,0.05220304802283437,2015-04-10,2015-03-31,0001140361-15-014996
GTE2EUR,GRAN TIERRA ENERGY INC USD0.01 Common Stock,38500T101,786000.0,287686,0.05200455734594146,2015-04-10,2015-03-31,0001140361-15-014996
UTF,COHEN & STEERS INFRASTRUCTURE USD0.001 Common Stock,19248A109,785000.0,34550,0.05193839378697716,2015-04-10,2015-03-31,0001140361-15-014996
VPL,VANGUARD INTL EQUITY MSCI Pacific ETF,922042866,772000.0,12599,0.051078267520441235,2015-04-10,2015-03-31,0001140361-15-014996
LEN,LENNAR CORP USD0.10 Cls A Common Stock,526057104,758000.0,14625,0.05015197769494101,2015-04-10,2015-03-31,0001140361-15-014996
ORCL,ORACLE CORP USD0.01 Common Stock,68389X105,740000.0,17139,0.04896103363358356,2015-04-10,2015-03-31,0001140361-15-014996
ENB,ENBRIDGE INC NPV Common Stock,29250N105,731000.0,15172,0.048365561602904845,2015-04-10,2015-03-31,0001140361-15-014996
VOD,VODAFONE GROUP PLC Spon ADR Rep 10 Ord Shs,92857W308,723000.0,22126,0.04783625313119043,2015-04-10,2015-03-31,0001140361-15-014996
DVN,DEVON ENERGY CORP USD0.10 Common Stock,25179M103,721000.0,11950,0.04770392601326182,2015-04-10,2015-03-31,0001140361-15-014996
AME,AMETEK INC NPV Common Stock,031100100,709000.0,13500,0.0469099633056902,2015-04-10,2015-03-31,0001140361-15-014996
ADP,AUTO DATA PROCESS USD0.10 Common Stock,053015103,701000.0,8185,0.04638065483397578,2015-04-10,2015-03-31,0001140361-15-014996
IJH,ISHARES TRUST Core S&P Mid-Cap ETF,464287507,684000.0,4499,0.045255874331582645,2015-04-10,2015-03-31,0001140361-15-014996
BXUSD,BLACKSTONE GROUP LP Common Units,09253U108,681000.0,17518,0.04505738365468974,2015-04-10,2015-03-31,0001140361-15-014996
EUO,PROSHARES TRUST II Ultrashort Euro,74347W882,675000.0,25060,0.04466040230090392,2015-04-10,2015-03-31,0001140361-15-014996
VTI,VANGUARD INDEX FUNDS Total Stock Market ETF,922908769,648000.0,6040,0.04287398620886777,2015-04-10,2015-03-31,0001140361-15-014996
LVS,LAS VEGAS SANDS CORP USD0.001 Common Stock,517834107,640000.0,11621,0.04234467773715335,2015-04-10,2015-03-31,0001140361-15-014996
VXF,VANGUARD INDEX FUNDS Extended Market ETF,922908652,639000.0,6910,0.04227851417818905,2015-04-10,2015-03-31,0001140361-15-014996
DBDEUR,DIEBOLD INC USD1.25 Common Stock,253651103,621000.0,17500,0.04108757011683161,2015-04-10,2015-03-31,0001140361-15-014996
HOG,HARLEY DAVIDSON USD0.01 Common Stock,412822108,620000.0,10215,0.04102140655786731,2015-04-10,2015-03-31,0001140361-15-014996
BTI,BRITISH AMERICAN TOBACCO PLC ADR Each Rep 2 25p Ord Shares,110448107,599000.0,5775,0.039631971819616967,2015-04-10,2015-03-31,0001140361-15-014996
APC,ANADARKO PETROLEUM CORP USD0.10 Common Stock,032511107,593000.0,7156,0.039234990465831156,2015-04-10,2015-03-31,0001140361-15-014996
N/A,MONSANTO CO USD0.01 Common Stock,61166W101,591000.0,5255,0.03910266334790255,2015-04-10,2015-03-31,0001140361-15-014996
USB,US BANCORP DEL USD0.01 Common Stock,902973304,589000.0,13486,0.038970336229973944,2015-04-10,2015-03-31,0001140361-15-014996
CMCSA,COMCAST CORP USD1 A Common Stock,20030N101,584000.0,10341,0.03863951843515243,2015-04-10,2015-03-31,0001140361-15-014996
DEO,DIAGEO PLC ADR 4 28 101/108p Ordinary Shs,25243Q205,582000.0,5265,0.038507191317223834,2015-04-10,2015-03-31,0001140361-15-014996
IWP,ISHARES TRUST Russell Midcap Growth ETF,464287481,581000.0,5935,0.03844102775825953,2015-04-10,2015-03-31,0001140361-15-014996
VT,VANGUARD INTL EQUITY Total World Stock Market ETF,922042742,580000.0,9410,0.03837486419929522,2015-04-10,2015-03-31,0001140361-15-014996
TWXCHF,TIME WARNER INC USD0.01 Common Stock,887317303,563000.0,6663,0.03725008369690209,2015-04-10,2015-03-31,0001140361-15-014996
SWK,STANLEY BLACK & DECKER INC USD2.50 Common Stock,854502101,563000.0,5900,0.03725008369690209,2015-04-10,2015-03-31,0001140361-15-014996
EXPE,EXPEDIA INC USD0.001 Com Stk (Post-Split),30212P303,559000.0,5940,0.03698542946104488,2015-04-10,2015-03-31,0001140361-15-014996
ITW,ILLINOIS TOOL WORKS INC NPV Common Stock,452308109,545000.0,5607,0.03605913963554465,2015-04-10,2015-03-31,0001140361-15-014996
