ticker,nameOfIssuer,cusip,value,shares,allocation_percent,filingDate,reportDate,accessionNumber
FCX,FREEPORT MCMORAN COPPER & GOLD USD0.10 Common Stock,35671D857,545000.0,28786,0.03605913963554465,2015-04-10,2015-03-31,0001140361-15-014996
ENOR,ISHARES TRUST MSCI Norway Capped ETF,46429B499,534000.0,23565,0.03533134048693733,2015-04-10,2015-03-31,0001140361-15-014996
SRCL,STERICYCLE INC USD0.01 Common Stock,858912108,520000.0,3705,0.0344050506614371,2015-04-10,2015-03-31,0001140361-15-014996
ATI,ALLEGHENY TECHNOLOGY INC USD0.10 Common Stock,01741R102,518000.0,17250,0.03427272354350849,2015-04-10,2015-03-31,0001140361-15-014996
TSN,TYSON FOODS INC USD0.10 Common Stock,902494103,518000.0,13535,0.03427272354350849,2015-04-10,2015-03-31,0001140361-15-014996
BIIB,BIOGEN IDEC INC USD0.0005 Common Stock,09062X103,517000.0,1225,0.034206559984544194,2015-04-10,2015-03-31,0001140361-15-014996
BP,BP PLC ADR Cnv Into 6 Ord USD0.25,055622104,515000.0,13152,0.03407423286661559,2015-04-10,2015-03-31,0001140361-15-014996
TSM,TAIWAN SEMICONDUCTORS MAN LTD ADS Rep 5 TWD10 Ord Share,874039100,513000.0,21863,0.03394190574868698,2015-04-10,2015-03-31,0001140361-15-014996
N/A,BROOKFIELD ASSET MGMT LTD NPV Cls A Voting Shares,112585104,511000.0,9551,0.033809578630758376,2015-04-10,2015-03-31,0001140361-15-014996
N/A,INNOCOLL AG Spon ADR EA Rep Ord Shs,45780Q103,510000.0,64130,0.033743415071794076,2015-04-10,2015-03-31,0001140361-15-014996
ARLP,ALLIANCE RESOURCE PARTNERS SBI Stock,01877R108,506000.0,15135,0.03347876083593687,2015-04-10,2015-03-31,0001140361-15-014996
CMI,CUMMINS INC USD2.50 Common Stock,231021106,506000.0,3652,0.03347876083593687,2015-04-10,2015-03-31,0001140361-15-014996
PXGBX,PRAXAIR INC USD0.01 Common Stock,74005P104,505000.0,4180,0.033412597276972565,2015-04-10,2015-03-31,0001140361-15-014996
IDV,ISHARES TRUST Intl Select Dividend ETF,464288448,504000.0,14970,0.033346433718008266,2015-04-10,2015-03-31,0001140361-15-014996
N/A,MCGRAW HILL FINANCAL INC USD1 Common Stock,580645109,496000.0,4800,0.03281712524629385,2015-04-10,2015-03-31,0001140361-15-014996
TRL,DAVITA INC COM USD0.001 Common Stock,23918K108,494000.0,6075,0.03268479812836524,2015-04-10,2015-03-31,0001140361-15-014996
N/A,EXPRESS SCRIPTS HOLDINGS INC USD0.01 Common Stock,30219G108,485000.0,5584,0.03208932609768653,2015-04-10,2015-03-31,0001140361-15-014996
N/A,DU PONT DE NEMOURS USD0.30 Common Stock,263534109,465000.0,6502,0.03076605491840048,2015-04-10,2015-03-31,0001140361-15-014996
UNFI,UNITED NATURAL FOODS INC USD0.01 Common Stock,911163103,458000.0,5950,0.030302910005650368,2015-04-10,2015-03-31,0001140361-15-014996
N/A,PROGRESSIVE WASTE SOLUTIONS NPV Common Stock,74339G101,433000.0,14750,0.028648821031542815,2015-04-10,2015-03-31,0001140361-15-014996
VAREUR,VARIAN MEDICAL SYSTEMS INC USD1 Common Stock,92220P105,430000.0,4575,0.02845033035464991,2015-04-10,2015-03-31,0001140361-15-014996
YUM,YUM BRANDS INC  NPV Common Stock,988498101,429000.0,5450,0.028384166795685607,2015-04-10,2015-03-31,0001140361-15-014996
LKQ1,LKQ CORP USD0.01 Common Stock,501889208,428000.0,16750,0.028318003236721304,2015-04-10,2015-03-31,0001140361-15-014996
N/A,GLAXOSMITHKLINE PLC Spon ADR (Cnv 2 Ord 25p),37733W105,423000.0,9167,0.027987185441899796,2015-04-10,2015-03-31,0001140361-15-014996
ABMDEUR,ABIOMED INC USD0.01 Common Stock,003654100,422000.0,5900,0.027921021882935493,2015-04-10,2015-03-31,0001140361-15-014996
HAL,HALLIBURTON CORP NPV Common Stock,406216101,417000.0,9503,0.02759020408811398,2015-04-10,2015-03-31,0001140361-15-014996
BAX,BAXTER INTERNATIONAL INC USD1 Common Stock,071813109,415000.0,6053,0.02745787697018538,2015-04-10,2015-03-31,0001140361-15-014996
TXN,TEXAS INSTRUMENTS INC Common Stock,882508104,413000.0,7230,0.02732554985225677,2015-04-10,2015-03-31,0001140361-15-014996
GAM,GENERAL AMERICAN INVESTORS CO USD1 Common Stock,368802104,412000.0,11774,0.027259386293292474,2015-04-10,2015-03-31,0001140361-15-014996
SYK,STRYKER CORP USD0.10 Common Stock,863667101,403000.0,4370,0.02666391426261375,2015-04-10,2015-03-31,0001140361-15-014996
EWC,ISHARES INC MSCI Canada ETF,464286509,397000.0,14610,0.02626693290882794,2015-04-10,2015-03-31,0001140361-15-014996
N/A,PHARMACYCLICS INC USD0.01 Common Stock,716933106,389000.0,1520,0.025737624437113523,2015-04-10,2015-03-31,0001140361-15-014996
N/A,ITT CORP USD1.00 Com Stk (Post Rev Sp),450911201,389000.0,9750,0.025737624437113523,2015-04-10,2015-03-31,0001140361-15-014996
N/A,POWERSHARES ETF II S&P 500 Low Volatility (USD),73937B779,379000.0,10000,0.025075988847470504,2015-04-10,2015-03-31,0001140361-15-014996
RRX,REGAL BELOIT CORP USD0.01 Common Stock,758750103,376000.0,4705,0.0248774981705776,2015-04-10,2015-03-31,0001140361-15-014996
AU3EUR,ANGLOGOLD ASHANTI LTD LVL1 ADR Rep 1 ZAR0.25 Com Stk,035128206,369000.0,39515,0.024414353257827478,2015-04-10,2015-03-31,0001140361-15-014996
TJX,TJX COMPANIES INC NPV Common Stock,872540109,348000.0,4968,0.023024918519577137,2015-04-10,2015-03-31,0001140361-15-014996
N/A,PLUM CREEK TIMBER CO INC USD0.01 Common Stock,729251108,348000.0,8000,0.023024918519577137,2015-04-10,2015-03-31,0001140361-15-014996
TRIP,TRIPADVISOR INC USD0.001 Common Stock,896945201,345000.0,4150,0.022826427842684228,2015-04-10,2015-03-31,0001140361-15-014996
SU,SUNCOR ENERGY INC New NPV Common Stock (CAD),867224107,345000.0,11820,0.022826427842684228,2015-04-10,2015-03-31,0001140361-15-014996
WPP,WPP PLC ADR Each Repr 5 Ord,92937A102,344000.0,3020,0.02276026428371993,2015-04-10,2015-03-31,0001140361-15-014996
N/A,TWENTY-FIRST CENTURY FOX CORP USD0.01 Cls A Common Stock,90130A101,343000.0,10145,0.022694100724755625,2015-04-10,2015-03-31,0001140361-15-014996
EXPD,EXPEDITOR INTL OF WASHINGTON USD0.01 Common Stock,302130109,342000.0,7100,0.022627937165791322,2015-04-10,2015-03-31,0001140361-15-014996
HD,HOME DEPOT INC USD0.05 Common Stock,437076102,334000.0,2938,0.022098628694076906,2015-04-10,2015-03-31,0001140361-15-014996
IBB,ISHARES TRUST NASDAQ Biotech ETF,464287556,332000.0,966,0.0219663015761483,2015-04-10,2015-03-31,0001140361-15-014996
NVS,NOVARTIS AG ADR Rep 1 CHF0.5 (Regd) Shares,66987V109,326000.0,3310,0.02156932022236249,2015-04-10,2015-03-31,0001140361-15-014996
FSLR,FIRST SOLAR INC USD0.001 Common Stock,336433107,322000.0,5380,0.02130466598650528,2015-04-10,2015-03-31,0001140361-15-014996
N/A,ENCANA CORP NPV Common Stock,292505104,321000.0,28736,0.021238502427540978,2015-04-10,2015-03-31,0001140361-15-014996
ANIK,ANIKA THERAPEUTICS INC USD0.01 Common Stock,035255108,321000.0,7800,0.021238502427540978,2015-04-10,2015-03-31,0001140361-15-014996
RDUSEUR,RADIUS HEALTH INC USD0.001 Common Stock (New),750469207,320000.0,7770,0.021172338868576675,2015-04-10,2015-03-31,0001140361-15-014996
MKC/V,MCCORMICK & CO INC NPV Vtg Common Stock,579780107,311000.0,4000,0.02057686683789796,2015-04-10,2015-03-31,0001140361-15-014996
SQM,SOCIEDAD QUIMICA Y MINERA ADR (Rep 1 Ser B Pref Share),833635105,307000.0,16810,0.02031221260204075,2015-04-10,2015-03-31,0001140361-15-014996
OXY,OCCIDENTAL PETROLEUM CORP      USD0.20 Common Stock,674599105,296000.0,4060,0.019584413453433425,2015-04-10,2015-03-31,0001140361-15-014996
FEZ,SPDR INDEX SHARES Eurostoxx 50 ETF,78463X202,295000.0,7609,0.019518249894469125,2015-04-10,2015-03-31,0001140361-15-014996
IXC,ISHARES TRUST Global Energy ETF,464287341,293000.0,8220,0.01938592277654052,2015-04-10,2015-03-31,0001140361-15-014996
ABX,BARRICK GOLD CORP NPV Common Stock (CADD),067901108,291000.0,26509,0.019253595658611917,2015-04-10,2015-03-31,0001140361-15-014996
JBLU,JETBLUE AIRWAYS CORP USD0.01 Common Stock,477143101,289000.0,15030,0.01912126854068331,2015-04-10,2015-03-31,0001140361-15-014996
ALXN,ALEXION PHARMACEUTICALS INC USD0.0001 Common Stock,015351109,284000.0,1640,0.0187904507458618,2015-04-10,2015-03-31,0001140361-15-014996
N/A,ENDOLOGIX INC USD0.001 Common Stock,29266S106,280000.0,16400,0.01852579651000459,2015-04-10,2015-03-31,0001140361-15-014996
ELV,ANTHEM INC USD0.01 Common Stock,036752103,279000.0,1810,0.01845963295104029,2015-04-10,2015-03-31,0001140361-15-014996
LOW,LOWES COS INC USD0.50 Common Stock,548661107,279000.0,3745,0.01845963295104029,2015-04-10,2015-03-31,0001140361-15-014996
NUVAGBP,NUVASIVE INC USD0.001 Common Stock,670704105,278000.0,6050,0.01839346939207599,2015-04-10,2015-03-31,0001140361-15-014996
N/A,SPECTRANETICS CORP USD0.001 Common Stock,84760C107,278000.0,8000,0.01839346939207599,2015-04-10,2015-03-31,0001140361-15-014996
IWB,ISHARES TRUST Russell 1000 ETF,464287622,277000.0,2390,0.018327305833111686,2015-04-10,2015-03-31,0001140361-15-014996
ACHC,ACADIA HEALTHCARE CO INC USD0.01 Common Stock,00404A109,276000.0,3860,0.018261142274147383,2015-04-10,2015-03-31,0001140361-15-014996
NFLX,NETFLIX COM INC USD0.001 Common Stock,64110L106,271000.0,650,0.01793032447932587,2015-04-10,2015-03-31,0001140361-15-014996
ED,CONSOLIDATED EDISON INC USD0.10 Common Stock,209115104,268000.0,4400,0.017731833802432966,2015-04-10,2015-03-31,0001140361-15-014996
N/A,SEVCON INC USD0.10 Common Stock,81783K108,267000.0,34083,0.017665670243468663,2015-04-10,2015-03-31,0001140361-15-014996
CCJ,CAMECO CORP NPV Common Stock,13321L108,267000.0,19125,0.017665670243468663,2015-04-10,2015-03-31,0001140361-15-014996
N/A,REED ELSEVIER Spon ADR Conv Into 4 Ord Shs,758205207,265000.0,3850,0.01753334312554006,2015-04-10,2015-03-31,0001140361-15-014996
GD,GENERAL DYNAMICS CORP USD1 Common Stock,369550108,265000.0,1956,0.01753334312554006,2015-04-10,2015-03-31,0001140361-15-014996
N/A,ST JUDE MEDICAL INC USD0.10 Common Stock,790849103,259000.0,3965,0.017136361771754247,2015-04-10,2015-03-31,0001140361-15-014996
IXJ,ISHARES TRUST S&P Gbl Heathcare Sector,464287325,257000.0,2385,0.017004034653825644,2015-04-10,2015-03-31,0001140361-15-014996
MSON,MISONIX INC USD0.01 Common Stock,604871103,256000.0,19600,0.01693787109486134,2015-04-10,2015-03-31,0001140361-15-014996
N/A,CEPHEID NPV Common Stock,15670R107,248000.0,4350,0.016408562623146924,2015-04-10,2015-03-31,0001140361-15-014996
HNM,ORMAT TECHNOLOGIES INC USD0.001 Common Stock,686688102,247000.0,6500,0.01634239906418262,2015-04-10,2015-03-31,0001140361-15-014996
BUD,ANHEUSER-BUSCH INBEV ADR Each Rep 1 NPV Ord Shs,03524A108,241000.0,1975,0.015945417710396807,2015-04-10,2015-03-31,0001140361-15-014996
VALE,VALE SA Spons ADR Rep 1 Common Stock,91912E105,238000.0,42200,0.015746927033503902,2015-04-10,2015-03-31,0001140361-15-014996
WLY,WILEY (JOHN) & SONS INC USD1 Cls A Common Stock,968223206,237000.0,3876,0.015680763474539602,2015-04-10,2015-03-31,0001140361-15-014996
ADM,ARCHER-DANIELS-MIDLAND CO NPV Common Stock,039483102,237000.0,5000,0.015680763474539602,2015-04-10,2015-03-31,0001140361-15-014996
BNDX,VANGUARD CHARLOTTE Total Intl Bond Index Fund ETF,92203J407,237000.0,4375,0.015680763474539602,2015-04-10,2015-03-31,0001140361-15-014996
DXCM,DEXCOM INC USD0.001 Common Stock,252131107,237000.0,3800,0.015680763474539602,2015-04-10,2015-03-31,0001140361-15-014996
BIDUN,BAIDU INC ADS Each Rep 1 Ord Cls A Share,056752108,223000.0,1070,0.01475447364903937,2015-04-10,2015-03-31,0001140361-15-014996
N/A,BAKER HUGHES INC USD1 Common Stock,057224107,223000.0,3500,0.01475447364903937,2015-04-10,2015-03-31,0001140361-15-014996
N/A,DOW CHEMICAL CORP USD2.50 Common Stock,260543103,222000.0,4620,0.01468831009007507,2015-04-10,2015-03-31,0001140361-15-014996
D,DOMINION RES (VIR) NPV Common Stock,25746U109,221000.0,3120,0.014622146531110766,2015-04-10,2015-03-31,0001140361-15-014996
N/A,INDEXIQ ETF TRUST IQ Hedge Macro Tracker ETF,45409B206,221000.0,8650,0.014622146531110766,2015-04-10,2015-03-31,0001140361-15-014996
N/A,ARCELORMITTAL NY Registry Shares,03938L104,221000.0,23500,0.014622146531110766,2015-04-10,2015-03-31,0001140361-15-014996
TGT,TARGET CORP USD0.0833 Common Stock,87612E106,221000.0,2695,0.014622146531110766,2015-04-10,2015-03-31,0001140361-15-014996
N/A,JOHNSON CONTROLS INC USD0.01388 Common Stock,478366107,219000.0,4350,0.014489819413182165,2015-04-10,2015-03-31,0001140361-15-014996
AMBC,AMBAC FINANCIAL GROUP INC USD0.01 Common Stock,023139884,218000.0,9009,0.01442365585421786,2015-04-10,2015-03-31,0001140361-15-014996
BK,BANK OF NEW YORK MELLON CORP USD0.01 Common Stock,064058100,215000.0,5332,0.014225165177324955,2015-04-10,2015-03-31,0001140361-15-014996
DBAUSD,POWERSHARES DB Agriculture Fund,73936B408,214000.0,9665,0.014159001618360652,2015-04-10,2015-03-31,0001140361-15-014996
EL,ESTEE LAUDER COS USD0.01 Class A Common Stock,518439104,213000.0,2563,0.01409283805939635,2015-04-10,2015-03-31,0001140361-15-014996
N/A,ISHARES TRUST Intl Inflation Linked Bond ETF,46429B770,209000.0,4981,0.013828183823539142,2015-04-10,2015-03-31,0001140361-15-014996
WU,WESTERN UNION COMP USD0.01 Common Stock,959802109,208000.0,10000,0.013762020264574841,2015-04-10,2015-03-31,0001140361-15-014996
N/A,GLOBAL X FUNDS Copper Miners ETF,37950E861,207000.0,30461,0.013695856705610538,2015-04-10,2015-03-31,0001140361-15-014996
N/A,DIRECTV USD0.01 Common Stock,25490A309,206000.0,2420,0.013629693146646237,2015-04-10,2015-03-31,0001140361-15-014996
SYMCEUR,SYMANTEC CORP USD0.01 Common Stock,871503108,205000.0,8780,0.013563529587681932,2015-04-10,2015-03-31,0001140361-15-014996
ISRG,INTUITIVE SURGICAL INC USD0.001 Common Stock,46120E602,205000.0,405,0.013563529587681932,2015-04-10,2015-03-31,0001140361-15-014996
WAT,WATERS CORP USD0.01 Common Stock,941848103,203000.0,1635,0.013431202469753328,2015-04-10,2015-03-31,0001140361-15-014996
CVE,CENOVUS ENERGY INC NPV Common Stock,15135U109,203000.0,12030,0.013431202469753328,2015-04-10,2015-03-31,0001140361-15-014996
MPC,MARATHON PETROLEUM CORP USD0.01 Common Stock,56585A102,201000.0,1960,0.013298875351824724,2015-04-10,2015-03-31,0001140361-15-014996
DHI,DR HORTON INC USD0.01 Common Stock,23331A109,201000.0,7050,0.013298875351824724,2015-04-10,2015-03-31,0001140361-15-014996
SCHW,SCHWAB (CHARLES) CORP USD0.01 Common Stock,808513105,201000.0,6610,0.013298875351824724,2015-04-10,2015-03-31,0001140361-15-014996
FCO,ABERDEEN GLOBAL INCOME FUND USD0.001 Common Stock,003013109,194000.0,20880,0.01283573043907461,2015-04-10,2015-03-31,0001140361-15-014996
N/A,SILVER WHEATON CORP NPV Common Stock,828336107,193000.0,10130,0.012769566880110309,2015-04-10,2015-03-31,0001140361-15-014996
N/A,NOVADAQ TECHNOLOGIES INC NPV Common Stock,66987G102,190000.0,11700,0.0125710762032174,2015-04-10,2015-03-31,0001140361-15-014996
DL,CHINA DISTANCE EDUCATION HLDGS Spons ADR Each Rep 4 Ord Shs,16944W104,172000.0,10250,0.011380132141859964,2015-04-10,2015-03-31,0001140361-15-014996
N/A,NEKTAR THERAPEUTICS USD0.01 Common Stock,640268108,166000.0,15100,0.01098315078807415,2015-04-10,2015-03-31,0001140361-15-014996
CDZI,CADIZ INC USD0.01 Common Stock,127537207,147000.0,14312,0.009726043167752411,2015-04-10,2015-03-31,0001140361-15-014996
N/A,STILLWATER MINING CO USD0.01 Common Stock,86074Q102,139000.0,10750,0.009196734696037994,2015-04-10,2015-03-31,0001140361-15-014996
YRI,YAMANA GOLD INC NPV Common Stock (CAD),98462Y100,127000.0,35615,0.008402771988466368,2015-04-10,2015-03-31,0001140361-15-014996
SAN,BANCO SANTANDER SA ADR Rep 1 EUR0.50 Ord Shares,05964H105,124000.0,16624,0.008204281311573462,2015-04-10,2015-03-31,0001140361-15-014996
PBR,PETROLEO BRASILEIRO SA ADS Each 1 Rep 2 NPV Com Stock,71654V408,119000.0,19802,0.007873463516751951,2015-04-10,2015-03-31,0001140361-15-014996
N/A,INDONESIA FUND INC USD0.001 Common Stock,00305P106,92000.0,11942,0.006087047424715795,2015-04-10,2015-03-31,0001140361-15-014996
NGD,NEW GOLD INC NPV Common Stock,644535106,68000.0,20000,0.004499122009572544,2015-04-10,2015-03-31,0001140361-15-014996
N/A,ONE HORIZON GROUP INC USD0.0001 Com Stk (Pst Rev Sp),68235H205,65000.0,40866,0.004300631332679637,2015-04-10,2015-03-31,0001140361-15-014996
NNVCUSD,NANOVIRICIDES INC USD0.001 Common Stock (PRS),630087203,64000.0,28250,0.004234467773715335,2015-04-10,2015-03-31,0001140361-15-014996
N/A,WAVE SYSTEMS CORP USD0.01 Com Stk (Post Rev),943526400,64000.0,92291,0.004234467773715335,2015-04-10,2015-03-31,0001140361-15-014996
TRQEUR,TURQUOISE HILL RESOURCES LTD NPV Common Stock,900435108,61000.0,19400,0.004035977096822429,2015-04-10,2015-03-31,0001140361-15-014996
N/A,SEQUENOM INC USD0.001 Common Stock,817337405,56000.0,14090,0.0037051593020009186,2015-04-10,2015-03-31,0001140361-15-014996
PHPN,GALECTIN THERAPEUTICS INC USD0.001 Common Stock,363225202,55000.0,16400,0.003638995743036616,2015-04-10,2015-03-31,0001140361-15-014996
N/A,ALMADEN MINERALS LTD NPV Common Stock,020283107,54000.0,60000,0.003572832184072314,2015-04-10,2015-03-31,0001140361-15-014996
EXEL,EXELIXIS INC USD0.001 Common Stock,30161Q104,49000.0,19000,0.0032420143892508036,2015-04-10,2015-03-31,0001140361-15-014996
N/A,FORTUNA SILVER MINING NPV Common Stock,349915108,43000.0,11500,0.002845033035464991,2015-04-10,2015-03-31,0001140361-15-014996
MPVD,MOUNTAIN PROVINCE DIAMONDS NPV Common Stock,62426E402,43000.0,11444,0.002845033035464991,2015-04-10,2015-03-31,0001140361-15-014996
N/A,LEXICON GENETICS INC USD0.001 Common Stock,528872104,42000.0,43980,0.0027788694765006885,2015-04-10,2015-03-31,0001140361-15-014996
N/A,BURCON NUTRASCIENCE CORP NPV Common Stock,120831102,25000.0,10586,0.0016540889741075528,2015-04-10,2015-03-31,0001140361-15-014996
N/A,RUBICON MINERALS CORP NPV Common Stock,780911103,14000.0,15000,0.0009262898255002297,2015-04-10,2015-03-31,0001140361-15-014996
