ticker,nameOfIssuer,cusip,value,shares,allocation_percent,filingDate,reportDate,accessionNumber
BAC,VERIZON COMMS INC NPV Common Stock,92343V104,156124000.0,3003547,8.064114576500206,2016-10-24,2016-09-30,0001140361-16-083322
AMZN,AMAZON COM INC USD0.01Common Stock,023135106,65662000.0,78420,3.391572668661811,2016-10-24,2016-09-30,0001140361-16-083322
V,VISA INC USD0.0001 Common Stock,92826C839,64603000.0,781178,3.3368732160695522,2016-10-24,2016-09-30,0001140361-16-083322
KO,COCA-COLA CO USD0.25 Common Stock,191216100,60155000.0,1421438,3.107125184784978,2016-10-24,2016-09-30,0001140361-16-083322
AAPL,APPLE INC NPV Common Stock,037833100,57085000.0,504953,2.948553589451425,2016-10-24,2016-09-30,0001140361-16-083322
LMT,LOCKHEED MARTIN CO USD1 Common Stock,539830109,54580000.0,227683,2.8191653658974998,2016-10-24,2016-09-30,0001140361-16-083322
BKU,BANKUNITED INC USD0.01 Common Stock,06652K103,41179000.0,1363533,2.126977108873088,2016-10-24,2016-09-30,0001140361-16-083322
GE,GENERAL ELECTRIC CORP USD0.06 Common Stock,369604103,38778000.0,1309180,2.0029606918060323,2016-10-24,2016-09-30,0001140361-16-083322
JNJ,JOHNSON & JOHNSON USD1 Common Stock,478160104,36531000.0,309243,1.8868986804983796,2016-10-24,2016-09-30,0001140361-16-083322
META,FACEBOOK INC USD0.000006 Cls A Common Stock,30303M102,34478000.0,268794,1.7808571543681566,2016-10-24,2016-09-30,0001140361-16-083322
PFE,PFIZER INC USD0.05 Common Stock,717081103,31273000.0,923311,1.6153125409987634,2016-10-24,2016-09-30,0001140361-16-083322
ATVIEUR,ACTIVISION BLIZZARD INC USD0.000001 Common Stock,00507V109,29085000.0,656551,1.5022979968327002,2016-10-24,2016-09-30,0001140361-16-083322
INTC,INTEL CORP USD0.001 Common Stock,458140100,28854000.0,764350,1.4903663881935958,2016-10-24,2016-09-30,0001140361-16-083322
PM,PHILIP MORRIS INTL INC NPV Common Stock,718172109,28269000.0,290775,1.4601499767049546,2016-10-24,2016-09-30,0001140361-16-083322
EA,ELECTRONIC ARTS INC USD0.01 Common Stock,285512109,28003000.0,327900,1.4464105485750767,2016-10-24,2016-09-30,0001140361-16-083322
MSFT,MICROSOFT CORP USD 0.00000625 Common Stock,594918104,26777000.0,464883,1.383085214412557,2016-10-24,2016-09-30,0001140361-16-083322
XOM,EXXON MOBIL CORP NPV Common Stock,30231G102,25992000.0,297800,1.342538405833782,2016-10-24,2016-09-30,0001140361-16-083322
NKE,NIKE INC NPV Cls B Common Stock,654106103,25853000.0,491031,1.3353587798561388,2016-10-24,2016-09-30,0001140361-16-083322
MA,MASTERCARD INC USD0.0001 Class A Common Stock,57636Q104,25718000.0,252710,1.3283857618202988,2016-10-24,2016-09-30,0001140361-16-083322
STZ,CONSTELLATION BRANDS INC USD Cls A Common Stock,21036P108,25709000.0,154415,1.3279208939512426,2016-10-24,2016-09-30,0001140361-16-083322
ADBE,ADOBE SYSTEMS INC NPV Common Stock,00724F101,25625000.0,236085,1.3235821271733865,2016-10-24,2016-09-30,0001140361-16-083322
PYPL,PAYPAL HOLDINGS INC USD0.0001 Common Stock,70450Y103,25569000.0,624080,1.320689615988149,2016-10-24,2016-09-30,0001140361-16-083322
AMGN,AMGEN INC USD0.0001 Common Stock,031162100,25212000.0,151145,1.3022498571822603,2016-10-24,2016-09-30,0001140361-16-083322
AOS,SMITH(AO)CORP USD1 Common Stock,831865209,24698000.0,250000,1.2757007366606166,2016-10-24,2016-09-30,0001140361-16-083322
AFW,ALIGN TECHNOLOGY INC USD0.0001 Common Stock,016255101,24356000.0,259800,1.2580357576364878,2016-10-24,2016-09-30,0001140361-16-083322
ULTA,ULTA SALON USD0.01 Common Stock,90384S303,24310000.0,102150,1.255659766305757,2016-10-24,2016-09-30,0001140361-16-083322
BRK/B,BERKSHIRE HATHAWAY INC USD0.0033 Cls B Common Stock,084670702,23208000.0,160645,1.19873927833912,2016-10-24,2016-09-30,0001140361-16-083322
JPM,JP MORGAN CHASE & CO USD1 Common Stock,46625H100,23103000.0,346943,1.1933158198668,2016-10-24,2016-09-30,0001140361-16-083322
DIS,WALT DISNEY (HLDGS) CO USD0.1 Common Stock,254687106,22903000.0,246637,1.182985422776666,2016-10-24,2016-09-30,0001140361-16-083322
GOOGL,ALPHABET INC USD0.001 Cls A Common Stock,02079K305,21387000.0,26599,1.1046810128334523,2016-10-24,2016-09-30,0001140361-16-083322
ROL,ROLLINS INC USD1 Common Stock,775711104,20203000.0,690000,1.0435250620598606,2016-10-24,2016-09-30,0001140361-16-083322
MCX,MCCORMICK & CO INC NPV Non Vtg Common Stock,579780206,19330000.0,193450,0.9984328787614268,2016-10-24,2016-09-30,0001140361-16-083322
TJX,TJX COMPANIES INC NPV Common Stock,872540109,19087000.0,255247,0.9858814462969143,2016-10-24,2016-09-30,0001140361-16-083322
SPGI,S&P GLOBAL INC USD1 Common Stock,78409V104,19022000.0,150300,0.9825240672426208,2016-10-24,2016-09-30,0001140361-16-083322
APH,AMPHENOL CORP USD0.001 Cls A Common Stock,032095101,18372000.0,283000,0.948950276699686,2016-10-24,2016-09-30,0001140361-16-083322
EFX,EQUIFAX INC USD1.25 Common Stock,294429105,18236000.0,135500,0.9419256066783951,2016-10-24,2016-09-30,0001140361-16-083322
COST,COSTCO CORP NPV Common Stock,22160K105,17545000.0,115040,0.9062340847319831,2016-10-24,2016-09-30,0001140361-16-083322
FRCB,FIRST REP BANK SAN FRANCISCO USD0.01 Common Stock,33616C100,17350000.0,225000,0.8961619475691025,2016-10-24,2016-09-30,0001140361-16-083322
JBHT,HUNT (JB) TRANSPORT SVCS INC USD0.01 Common Stock,445658107,17323000.0,213500,0.8947673439619346,2016-10-24,2016-09-30,0001140361-16-083322
CL,COLGATE-PALMOLIVE CO NPV Common Stock,194162103,17298000.0,233315,0.8934760443256677,2016-10-24,2016-09-30,0001140361-16-083322
BR,BROADRIDGE FINANCIAL SOLUTIONS USD0.01 Common Stock,11133T103,17275000.0,254825,0.8922880486603024,2016-10-24,2016-09-30,0001140361-16-083322
CRM,SALESFORCE.COM INC USD0.001 Common Stock,79466L302,16915000.0,237140,0.8736933338980617,2016-10-24,2016-09-30,0001140361-16-083322
HAS,HASBRO INC USD0.50 Common Stock,418056107,16501000.0,208000,0.8523094119214848,2016-10-24,2016-09-30,0001140361-16-083322
HD,HOME DEPOT INC USD0.05 Common Stock,437076102,16212000.0,125984,0.8373819881262416,2016-10-24,2016-09-30,0001140361-16-083322
RY,ROYAL BANK OF CANADA NPV Common Stock,780087102,15861000.0,256521,0.8192521412330569,2016-10-24,2016-09-30,0001140361-16-083322
KHC,KRAFT HEINZ CO NPV Common Stock,500754106,15142000.0,169166,0.782114363694026,2016-10-24,2016-09-30,0001140361-16-083322
BNS,BANK OF NOVA SCOTIA NPV Common Stock,064149107,13900000.0,262763,0.7179625977642955,2016-10-24,2016-09-30,0001140361-16-083322
PG,PROCTER & GAMBLE CO NPV Common Stock,742718109,13842000.0,154224,0.7149667826081567,2016-10-24,2016-09-30,0001140361-16-083322
MDLZ,MONDELEZ INTL INC USD0.01 Common Stock,609207105,12669000.0,288585,0.6543790036745222,2016-10-24,2016-09-30,0001140361-16-083322
CVX,CHEVRON CORP USD0.75 Common Stock,166764100,12608000.0,122502,0.6512282325620314,2016-10-24,2016-09-30,0001140361-16-083322
N/A,ENVISION HEALTHCARE HLDGS INC USD0.01 Common Stock,29413U103,12583000.0,565000,0.6499369329257648,2016-10-24,2016-09-30,0001140361-16-083322
N/A,DR PEPPER SNAPPLE GROUP INC USD0.01 Common Stock,26138E109,12328000.0,135016,0.6367656766358443,2016-10-24,2016-09-30,0001140361-16-083322
SPY,SPDR SERIES TRUST S&P 500 ETF Trust,78462F103,12272000.0,56736,0.6338731654506068,2016-10-24,2016-09-30,0001140361-16-083322
C,CITIGROUP INC USD0.01 Common Stock,172967424,11875000.0,251428,0.6133673272266913,2016-10-24,2016-09-30,0001140361-16-083322
EPAM,EPAM SYSTEMS INC USD0.001 Common Stock,29414B104,11575000.0,167000,0.5978717315914907,2016-10-24,2016-09-30,0001140361-16-083322
WFC,WELLS FARGO & CO USD1.6666 Common Stock,949746101,11390000.0,257230,0.5883161142831169,2016-10-24,2016-09-30,0001140361-16-083322
BDX,BECTON DICKINSON & CO NPV Common Stock,075887109,11189000.0,62255,0.5779340652075325,2016-10-24,2016-09-30,0001140361-16-083322
MMC,MARSH & MCLENNAN CO INC USD1 Common Stock,571748102,11172000.0,166123,0.5770559814548711,2016-10-24,2016-09-30,0001140361-16-083322
HON,HONEYWELL INTERNATIONAL INC USD1 Common Stock,438516106,9261000.0,79429,0.4783490372586432,2016-10-24,2016-09-30,0001140361-16-083322
CVS,CVS CORP USD0.01 Common Stock,126650100,9259000.0,104046,0.4782457332877419,2016-10-24,2016-09-30,0001140361-16-083322
ABT,ABBOTT LABORATORIES NPV Common Stock,002824100,9140000.0,216136,0.47209914701911226,2016-10-24,2016-09-30,0001140361-16-083322
GLD,SPDR GOLD TRUST NPV Shares,78463V107,8858000.0,70501,0.45753328712202374,2016-10-24,2016-09-30,0001140361-16-083322
MO,ALTRIA GROUP INC USD0.333333 Common Stock,02209S103,8777000.0,138810,0.4533494763005195,2016-10-24,2016-09-30,0001140361-16-083322
RTN1USD,RAYTHEON CO USD0.01 Common Stock,755111507,8653000.0,63567,0.4469446301046366,2016-10-24,2016-09-30,0001140361-16-083322
ABBV,ABBVIE INC USD0.01 Common Stock,00287Y109,8577000.0,135994,0.4430190792103858,2016-10-24,2016-09-30,0001140361-16-083322
SLB,SCHLUMBERGER LTD USD0.01 Common Stock,806857108,8439000.0,107312,0.4358911052181935,2016-10-24,2016-09-30,0001140361-16-083322
GOOG,ALPHABET INC USD0.001 Cls C Common Stock,02079K107,8219000.0,10574,0.4245276684190464,2016-10-24,2016-09-30,0001140361-16-083322
PEP,PEPSICO INC USD0.016666 Cap,713448108,8206000.0,75443,0.4238561926081877,2016-10-24,2016-09-30,0001140361-16-083322
IBM,IBM CORP USD0.20 Common Stock,459200101,7881000.0,49611,0.40706929733672037,2016-10-24,2016-09-30,0001140361-16-083322
LLY,LILLY (ELI) & CO NPV Common Stock,532457108,7723000.0,96230,0.3989082836355146,2016-10-24,2016-09-30,0001140361-16-083322
TWXCHF,TIME WARNER INC USD0.01 Common Stock,887317303,6979000.0,87662,0.36047920646021714,2016-10-24,2016-09-30,0001140361-16-083322
DFSEUR,DISCOVER FINANCIAL SERVICES USD0.01 Common Stock,254709108,6899000.0,122004,0.35634704762416364,2016-10-24,2016-09-30,0001140361-16-083322
MMM,3M COMPANY USD0.01 Common Stock,88579Y101,6899000.0,39147,0.35634704762416364,2016-10-24,2016-09-30,0001140361-16-083322
WAB,WABTEC CORP USD0.01 Common Stock,929740108,6485000.0,79430,0.33496312564758673,2016-10-24,2016-09-30,0001140361-16-083322
CM,CANADIAN IMPERIAL BANK NPV Common Stock,136069101,6380000.0,82424,0.32953966717526656,2016-10-24,2016-09-30,0001140361-16-083322
AJG,GALLAGHER AJ & CO USD1 Common Stock,363576109,6160000.0,121095,0.3181762303761194,2016-10-24,2016-09-30,0001140361-16-083322
NEM,NEWMONT MINING CORP USD1.60 Common Stock,651639106,5320000.0,135403,0.2747885625975577,2016-10-24,2016-09-30,0001140361-16-083322
T,AT&T INC USD1 Common Stock,00206R102,4890000.0,120411,0.25257820885377014,2016-10-24,2016-09-30,0001140361-16-083322
DVY,ISHARES TRUST Select Dividend ETF,464287168,4885000.0,57009,0.25231994892651677,2016-10-24,2016-09-30,0001140361-16-083322
EPP,ISHARES INC MSCI Pacific Ex Japan ETF,464286665,4679000.0,110671,0.24167963992367905,2016-10-24,2016-09-30,0001140361-16-083322
TIP,ISHARES TRUST Tips Bond ETF,464287176,4610000.0,39570,0.23811565292758285,2016-10-24,2016-09-30,0001140361-16-083322
BSV,VANGUARD BOND INDEX FUND Short Term Bond ETF,921937827,4258000.0,52684,0.21993415404894748,2016-10-24,2016-09-30,0001140361-16-083322
MRK,MERCK & CO INC USD0.50 Common Stock,58933Y105,3935000.0,63049,0.2032505627483815,2016-10-24,2016-09-30,0001140361-16-083322
BALL,BALL CORP NPV Common Stock,058498106,3834000.0,46790,0.19803371221786395,2016-10-24,2016-09-30,0001140361-16-083322
BMO,BANK OF MONTREAL NPV Common Stock,063671101,3801000.0,58118,0.19632919669799187,2016-10-24,2016-09-30,0001140361-16-083322
UNP,UNION PACIFIC CORP USD2.50 Common Stock,907818108,3787000.0,38833,0.19560606890168253,2016-10-24,2016-09-30,0001140361-16-083322
BMY,BRISTOL-MYERS SQUIBB CO NPV Common Stock,110122108,3746000.0,69468,0.1934883374982051,2016-10-24,2016-09-30,0001140361-16-083322
BND,VANGUARD BOND INDEX FUND Total Bond Market ETF,921937835,3610000.0,42899,0.18646366747691415,2016-10-24,2016-09-30,0001140361-16-083322
RJAUSD,SWEDISH EXPORT CREDIT Elements ETN Lkd RICI,870297603,3478000.0,560982,0.17964560539742588,2016-10-24,2016-09-30,0001140361-16-083322
N/A,ISHARES INC MSCI Japan ETF,464286848,3351000.0,267246,0.17308580324519096,2016-10-24,2016-09-30,0001140361-16-083322
AEM,AGNICO EAGLE MINES LTD NPV Common Stock,008474108,3346000.0,61970,0.17282754331793762,2016-10-24,2016-09-30,0001140361-16-083322
GIS,GENERAL MILLS INC USD0.10 Common Stock,370334104,3321000.0,51991,0.1715362436816709,2016-10-24,2016-09-30,0001140361-16-083322
PPG,PPG INDUSTRIES INC USD1.666 Common Stock,693506107,3248000.0,31425,0.16776564874377206,2016-10-24,2016-09-30,0001140361-16-083322
EEM,ISHARES TRUST MSCI Emerging Markets ETF,464287234,3184000.0,85012,0.16445992167492926,2016-10-24,2016-09-30,0001140361-16-083322
KMB,KIMBERLEY CLARK CORP NPV Common Stock,494368103,3178000.0,25196,0.16415000976222524,2016-10-24,2016-09-30,0001140361-16-083322
CELG,CELGENE CORP USD0.01 Common Stock,151020104,3139000.0,30027,0.16213558232964917,2016-10-24,2016-09-30,0001140361-16-083322
MCD,MCDONALD'S CORP USD0.01 Common Stock,580135101,2976000.0,25794,0.15371630870119016,2016-10-24,2016-09-30,0001140361-16-083322
WMT,WAL-MART STORES INC USD0.1 Common Stock,931142103,2935000.0,40693,0.15159857729771276,2016-10-24,2016-09-30,0001140361-16-083322
BCE,BCE INC NPV Common Stock,05534B760,2834000.0,61481,0.14638172676719519,2016-10-24,2016-09-30,0001140361-16-083322
GLW,CORNING INC USD0.50 Common Stock,219350105,2770000.0,117125,0.1430759996983524,2016-10-24,2016-09-30,0001140361-16-083322
BABA,ALIBABA GROUP HOLDINGS LTD Spon ADS Each Rep 1 Ord,01609W102,2747000.0,25970,0.14188800403298701,2016-10-24,2016-09-30,0001140361-16-083322
BAC,BANK OF AMERICA CORP NPV Common Stock,060505104,2654000.0,169573,0.13708436938607482,2016-10-24,2016-09-30,0001140361-16-083322
VT,VANGUARD INTL EQUITY Total World Stock Market ETF,922042742,2602000.0,42760,0.13439846614264006,2016-10-24,2016-09-30,0001140361-16-083322
N/A,POWERSHARES ETF Intl Corp Bond,73936Q835,2528000.0,94988,0.13057621921929058,2016-10-24,2016-09-30,0001140361-16-083322
XYL,XYLEM INC USD0.01 Common Stock,98419M100,2476000.0,47200,0.1278903159758558,2016-10-24,2016-09-30,0001140361-16-083322
DXJ,WISDOMTREE TRUST Japan Hedged Equity Fund,97717W851,2394000.0,55798,0.12365485316890096,2016-10-24,2016-09-30,0001140361-16-083322
TSLA,TESLA MOTORS INC USD0.001 Common Stock,88160R101,2336000.0,11447,0.12065903801276216,2016-10-24,2016-09-30,0001140361-16-083322
ADAP,ADAPTIMMUNE THERAPEUTICS PLC Spon ADS Each Rep 6 Ord Shs,00653A107,2327000.0,330125,0.12019417014370616,2016-10-24,2016-09-30,0001140361-16-083322
TD,TORONTO-DOMINION BANK NPV Common Stock,891160509,2289000.0,51659,0.11823139469658074,2016-10-24,2016-09-30,0001140361-16-083322
CTSH,COGNIZANT TECHNOLOGY USD0.01 Class A Common Stock,192446102,2148000.0,45030,0.11094846474803645,2016-10-24,2016-09-30,0001140361-16-083322
EL,ESTEE LAUDER COS USD0.01 Class A Common Stock,518439104,2136000.0,24115,0.11032864092262844,2016-10-24,2016-09-30,0001140361-16-083322
SYY,SYSCO CORP NPV Common Stock,871829107,2098000.0,42810,0.108365865475503,2016-10-24,2016-09-30,0001140361-16-083322
N/A,ISHARES INC MSCI UK ETF,46434V548,2061000.0,130138,0.10645474201382828,2016-10-24,2016-09-30,0001140361-16-083322
COP,CONOCOPHILLIPS INC USD0.01 Common Stock,20825C104,1999000.0,45976,0.1032523189158868,2016-10-24,2016-09-30,0001140361-16-083322
EMR,EMERSON ELECTRIC CO USD0.50 Common Stock,291011104,1974000.0,36206,0.10196101927962009,2016-10-24,2016-09-30,0001140361-16-083322
GII,SPDR INDEX SHARES S&P Gbl Infrastructure ETF,78463X855,1971000.0,41088,0.10180606332326808,2016-10-24,2016-09-30,0001140361-16-083322
BRK/A,BERKSHIRE HATHAWAY INC USD5 Class A Common Stock,084670108,1946000.0,9,0.10051476368700137,2016-10-24,2016-09-30,0001140361-16-083322
DWD,MORGAN STANLEY USD0.01 Common Stock,617446448,1896000.0,59133,0.09793216441446792,2016-10-24,2016-09-30,0001140361-16-083322
IXN,ISHARES TRUST Global Technology ETF,464287291,1876000.0,16948,0.09689912470545456,2016-10-24,2016-09-30,0001140361-16-083322
CAT,CATERPILLAR INC USD1 Common Stock,149123101,1837000.0,20699,0.09488469727287847,2016-10-24,2016-09-30,0001140361-16-083322
N/A,THOMSON REUTERS CORP NPV Common Stock,884903105,1804000.0,43701,0.09318018175300641,2016-10-24,2016-09-30,0001140361-16-083322
WPS,ISHARES TRUST Intl Developed Prop ETF,464288422,1649000.0,43492,0.08517412400815275,2016-10-24,2016-09-30,0001140361-16-083322
BA,BOEING CO USD5 Common Stock,097023105,1555000.0,11801,0.08031883737578989,2016-10-24,2016-09-30,0001140361-16-083322
TAP,MOLSON COORS BREWING CO USD0.01 Cls B Shares,60871R209,1555000.0,14165,0.08031883737578989,2016-10-24,2016-09-30,0001140361-16-083322
BXUSD,BLACKSTONE GROUP LP Common Units,09253U108,1533000.0,60033,0.07918249369587518,2016-10-24,2016-09-30,0001140361-16-083322
N/A,REYNOLDS AMERICAN INC USD0.0001 Common Stock,761713106,1501000.0,31843,0.07752963016145378,2016-10-24,2016-09-30,0001140361-16-083322
GILD,GILEAD SCIENCES INC USD0.001 Common Stock,375558103,1484000.0,18760,0.0766515464087924,2016-10-24,2016-09-30,0001140361-16-083322
UTXZ,UTD TECHNOLOGIES CORP USD1 Common Stock,913017109,1479000.0,14556,0.07639328648153906,2016-10-24,2016-09-30,0001140361-16-083322
VPL,VANGUARD INTL EQUITY MSCI Pacific ETF,922042866,1460000.0,24097,0.07541189875797635,2016-10-24,2016-09-30,0001140361-16-083322
EBA,EBAY INC USD0.001 Common Stock,278642103,1452000.0,44145,0.074998682874371,2016-10-24,2016-09-30,0001140361-16-083322
PSX,PHILLIPS 66 USD0.01 Common Stock,718546104,1424000.0,17681,0.07355242728175228,2016-10-24,2016-09-30,0001140361-16-083322
K,KELLOGG CO USD0.25 Common Stock,487836108,1416000.0,18275,0.07313921139814693,2016-10-24,2016-09-30,0001140361-16-083322
DOV,DOVER CORP USD1 Common Stock,260003108,1324000.0,17980,0.06838722873668542,2016-10-24,2016-09-30,0001140361-16-083322
ISRG,INTUITIVE SURGICAL INC USD0.001 Common Stock,46120E602,1297000.0,1790,0.06699262512951736,2016-10-24,2016-09-30,0001140361-16-083322
APC,ANADARKO PETROLEUM CORP USD0.10 Common Stock,032511107,1277000.0,20160,0.06595958542050398,2016-10-24,2016-09-30,0001140361-16-083322
IOO,ISHARES TRUST Global 100 ETF,464287572,1229000.0,16390,0.06348029011887188,2016-10-24,2016-09-30,0001140361-16-083322
PAYX,PAYCHEX INC USD0.01 Common Stock,704326107,1196000.0,20660,0.061775774598999814,2016-10-24,2016-09-30,0001140361-16-083322
EWG,ISHARES INC MSCI Germany ETF,464286806,1184000.0,45069,0.06115595077359179,2016-10-24,2016-09-30,0001140361-16-083322
IWM,ISHARES TRUST Russell 2000 ETF,464287655,1176000.0,9467,0.06074273488998644,2016-10-24,2016-09-30,0001140361-16-083322
R6C2,ROYAL DUTCH SHELL EUR0.07 ADR Ea Rep 2 Cls B Shs,780259107,1133000.0,21450,0.058521699515607685,2016-10-24,2016-09-30,0001140361-16-083322
WM,WASTE MANAGEMENT INC NPV Common Stock,94106L109,1095000.0,17180,0.056558924068482265,2016-10-24,2016-09-30,0001140361-16-083322
IWP,ISHARES TRUST Russell Midcap Growth ETF,464287481,1079000.0,11081,0.05573249230127157,2016-10-24,2016-09-30,0001140361-16-083322
VNQ,VANGUARD INDEX FUNDS REIT ETF (USD),922908553,1060000.0,12225,0.05475110457770886,2016-10-24,2016-09-30,0001140361-16-083322
RSG,REPUBLIC SERVICES INC USD0.01 Common Stock,760759100,1057000.0,20950,0.05459614862135685,2016-10-24,2016-09-30,0001140361-16-083322
PH,PARKER-HANNIFIN CORP USD0.50 Common Stock,701094104,1048000.0,8350,0.05413128075230084,2016-10-24,2016-09-30,0001140361-16-083322
TIFEUR,TIFFANY & CO USD0.01 Common Stock,886547108,1040000.0,14320,0.05371806486869549,2016-10-24,2016-09-30,0001140361-16-083322
CSCO,CISCO SYSTEMS INC USD0.001 Common Stock,17275R102,1038000.0,32739,0.05361476089779415,2016-10-24,2016-09-30,0001140361-16-083322
DE,DEERE & CO USD1 Common Stock,244199105,1038000.0,12165,0.05361476089779415,2016-10-24,2016-09-30,0001140361-16-083322
EZU,ISHARES INC MSCI EMU ETF,464286608,1032000.0,29930,0.05330484898509014,2016-10-24,2016-09-30,0001140361-16-083322
CSL,CARLISLE COS INC USD1 Common Stock,142339100,1026000.0,10000,0.052994937072386124,2016-10-24,2016-09-30,0001140361-16-083322
GS,GOLDMAN SACHS GROUP USD0.01 Common Stock,38141G104,1025000.0,6356,0.05294328508693546,2016-10-24,2016-09-30,0001140361-16-083322
MFC,MANULIFE FINANCIAL CORP NPV Common Stock,56501R106,1014000.0,72000,0.052375113246978106,2016-10-24,2016-09-30,0001140361-16-083322
UTF,COHEN & STEERS INFRASTRUCTURE USD0.001 Common Stock,19248A109,973000.0,45160,0.05025738184350068,2016-10-24,2016-09-30,0001140361-16-083322
HFCUSD,HOLLYFRONTIER CORP USD0.01 Common Stock,436106108,970000.0,39586,0.05010242588714867,2016-10-24,2016-09-30,0001140361-16-083322
MHK,MOWHAWK INDUSTRIES INC USD0.01 Common Stock,608190104,952000.0,4752,0.049172690149036635,2016-10-24,2016-09-30,0001140361-16-083322
N/A,SEVCON INC USD0.10 Common Stock,81783K108,931000.0,105668,0.048087998454572595,2016-10-24,2016-09-30,0001140361-16-083322
TTEK,TETRA TECH INC USD0.01 Common Stock,88162G103,925000.0,26070,0.04777808654186858,2016-10-24,2016-09-30,0001140361-16-083322
VGK,VANGUARD INTL EQUITY European ETF,922042874,899000.0,18441,0.046435134920151194,2016-10-24,2016-09-30,0001140361-16-083322
IVV,ISHARES INC Core S&P 500 ETF,464287200,889000.0,4085,0.045918615065644514,2016-10-24,2016-09-30,0001140361-16-083322
N/A,GOLDCORP INC NPV Common Stock,380956409,868000.0,52630,0.044833923371180466,2016-10-24,2016-09-30,0001140361-16-083322
WBA,WALGREENS BOOTS ALLIANCE USD0.01 Common Stock,931427108,853000.0,10577,0.04405914358942044,2016-10-24,2016-09-30,0001140361-16-083322
TRUP,TRUPANION INC USD0.00001 Common Stock,898202106,845000.0,50000,0.04364592770581508,2016-10-24,2016-09-30,0001140361-16-083322
TSM,TAIWAN SEMICONDUCTORS MAN LTD ADS Rep 5 TWD10 Ord Share,874039100,833000.0,27217,0.04302610388040706,2016-10-24,2016-09-30,0001140361-16-083322
N/A,CANADIAN PACIFIC RAILWAY LTD NPV Common Stock,13645T100,832000.0,5462,0.04297445189495639,2016-10-24,2016-09-30,0001140361-16-083322
NFLX,NETFLIX COM INC USD0.001 Common Stock,64110L106,826000.0,8379,0.04266453998225238,2016-10-24,2016-09-30,0001140361-16-083322
L,LOEWS CORP USD1 Common Stock,540424108,823000.0,20000,0.04250958402590037,2016-10-24,2016-09-30,0001140361-16-083322
VTI,VANGUARD INDEX FUNDS Total Stock Market ETF,922908769,823000.0,7393,0.04250958402590037,2016-10-24,2016-09-30,0001140361-16-083322
SWK,STANLEY BLACK & DECKER INC USD2.50 Common Stock,854502101,821000.0,6679,0.04240628005499904,2016-10-24,2016-09-30,0001140361-16-083322
LKQ1,LKQ CORP USD0.01 Common Stock,501889208,801000.0,22575,0.04137324034598566,2016-10-24,2016-09-30,0001140361-16-083322
CMCSA,COMCAST CORP USD1 A Common Stock,20030N101,799000.0,12039,0.041269936375084325,2016-10-24,2016-09-30,0001140361-16-083322
N/A,YAHOO INC USD 0.001 Common Stock,984332106,782000.0,18150,0.04039185262242295,2016-10-24,2016-09-30,0001140361-16-083322
MCO,MOODYS CORP  USD0.01 Common Stock,615369105,764000.0,7052,0.039462116884310915,2016-10-24,2016-09-30,0001140361-16-083322
ABMDEUR,ABIOMED INC USD0.01 Common Stock,003654100,759000.0,5900,0.03920385695705757,2016-10-24,2016-09-30,0001140361-16-083322
CHLUSD,CHINA MOBILE (HONG KONG) LTD Spon ADR Rep 5 Ord HKD0.10,16941M109,738000.0,12000,0.03811916526259353,2016-10-24,2016-09-30,0001140361-16-083322
WY,WEYERHAUSER CO USD1.25 Common Stock,962166104,729000.0,22835,0.03765429739353751,2016-10-24,2016-09-30,0001140361-16-083322
IJH,ISHARES TRUST Core S&P Mid-Cap ETF,464287507,726000.0,4691,0.0374993414371855,2016-10-24,2016-09-30,0001140361-16-083322
RPM,RPM INTL INC USD0.01 Common Stock,749685103,725000.0,13500,0.037447689451734836,2016-10-24,2016-09-30,0001140361-16-083322
BTUSD,BRITISH TELECOM GROUP PLC ADR Each Rep 10 Ord Shares,05577E101,702000.0,27600,0.03625969378636946,2016-10-24,2016-09-30,0001140361-16-083322
EXPE,EXPEDIA INC USD0.001 Com Stk (Post-Split),30212P303,701000.0,6010,0.036208041800918786,2016-10-24,2016-09-30,0001140361-16-083322
TKR,TIMKEN CO NPV Common Stock,887389104,696000.0,19800,0.03594978187366544,2016-10-24,2016-09-30,0001140361-16-083322
AME,AMETEK INC NPV Common Stock,031100100,692000.0,14475,0.035743173931862764,2016-10-24,2016-09-30,0001140361-16-083322
HYG,ISHARES TRUST IBOXX High Yield Corp Bond ETF,464288513,689000.0,7900,0.03558821797551076,2016-10-24,2016-09-30,0001140361-16-083322
ENB,ENBRIDGE INC NPV Common Stock,29250N105,681000.0,15522,0.03517500209190541,2016-10-24,2016-09-30,0001140361-16-083322
EWD,ISHARES INC MSCI Sweden ETF,464286756,676000.0,23265,0.03491674216465206,2016-10-24,2016-09-30,0001140361-16-083322
SJM,JM SMUCKER CO NPV Common Stock,832696405,665000.0,4906,0.03434857032469471,2016-10-24,2016-09-30,0001140361-16-083322
WCN,WASTE CONNECTIONS INC NPV Common Stock,94106B101,639000.0,8557,0.03300561870297732,2016-10-24,2016-09-30,0001140361-16-083322
FCX,FREEPORT-MCMORAN INC USD0.10 Common Stock,35671D857,638000.0,58786,0.03295396671752665,2016-10-24,2016-09-30,0001140361-16-083322
SKAA,SKECHER USA INC USD0.001 A Common Stock,830566105,638000.0,27880,0.03295396671752665,2016-10-24,2016-09-30,0001140361-16-083322
IMO,IMPERIAL OIL NPV Common Stock,453038408,634000.0,20310,0.03274735877572398,2016-10-24,2016-09-30,0001140361-16-083322
SBUX,STARBUCKS CORP USD0.001 Common Stock,855244109,627000.0,11577,0.0323857948775693,2016-10-24,2016-09-30,0001140361-16-083322
9990302D,APACHE CORP USD1.25 Common Stock,037411105,610000.0,9550,0.03150771112490793,2016-10-24,2016-09-30,0001140361-16-083322
EUO,PROSHARES TRUST II Ultrashort Euro,74347W882,595000.0,25060,0.030732931343147897,2016-10-24,2016-09-30,0001140361-16-083322
N/A,WHOLE FOODS MARKET INC NPV Common Stock,966837106,589000.0,20787,0.030423019430443888,2016-10-24,2016-09-30,0001140361-16-083322
VOD,VODAFONE GROUP PLC Spon ADR Rep 10 Ord Shs,92857W308,586000.0,20109,0.030268063474091878,2016-10-24,2016-09-30,0001140361-16-083322
ITT,ITT INC USD1.00 Common Stock,45073V108,564000.0,15750,0.02913171979417717,2016-10-24,2016-09-30,0001140361-16-083322
OXY,OCCIDENTAL PETROLEUM CORP      USD0.20 Common Stock,674599105,543000.0,7442,0.02804702809971313,2016-10-24,2016-09-30,0001140361-16-083322
ABX,BARRICK GOLD CORP NPV Common Stock (CADD),067901108,522000.0,29529,0.02696233640524908,2016-10-24,2016-09-30,0001140361-16-083322
