ticker,nameOfIssuer,cusip,value,shares,allocation_percent,filingDate,reportDate,accessionNumber
GDX,VANECK VECTORS ETF Gold Miners ETF,92189F106,520000.0,19664,0.026859032434347747,2016-10-24,2016-09-30,0001140361-16-083322
CCK,CROWN HOLDINGS INC USD5 Common Stock,228368106,518000.0,9070,0.02675572846344641,2016-10-24,2016-09-30,0001140361-16-083322
BF/B,BROWN-FORMAN CORP USD0.15 B Common Stock,115637209,506000.0,10664,0.02613590463803838,2016-10-24,2016-09-30,0001140361-16-083322
N/A,BROOKFIELD ASSET MGMT NPV Cls A Voting Shares,112585104,503000.0,14326,0.025980948681686374,2016-10-24,2016-09-30,0001140361-16-083322
ENOR,ISHARES TRUST MSCI Norway Capped ETF,46429B499,501000.0,23265,0.025877644710785037,2016-10-24,2016-09-30,0001140361-16-083322
SCHW,SCHWAB (CHARLES) CORP USD0.01 Common Stock,808513105,497000.0,15755,0.02567103676898236,2016-10-24,2016-09-30,0001140361-16-083322
RDS/A,ROYAL DUTCH SHELL PLC ADR Ech Rep 2 Cl A EUR0.07 Shs,780259206,492000.0,9835,0.025412776841729018,2016-10-24,2016-09-30,0001140361-16-083322
SYK,STRYKER CORP USD0.10 Common Stock,863667101,489000.0,4200,0.025257820885377015,2016-10-24,2016-09-30,0001140361-16-083322
YRI,YAMANA GOLD INC NPV Common Stock (CAD),98462Y100,485000.0,112649,0.025051212943574337,2016-10-24,2016-09-30,0001140361-16-083322
IXJ,ISHARES TRUST S&P Gbl Heathcare Sector,464287325,483000.0,4790,0.024947908972673,2016-10-24,2016-09-30,0001140361-16-083322
VXF,VANGUARD INDEX FUNDS Extended Market ETF,922908652,479000.0,5250,0.024741301030870327,2016-10-24,2016-09-30,0001140361-16-083322
QCOM,QUALCOMM INC USD0.001 Common Stock,747525103,477000.0,6959,0.02463799705996899,2016-10-24,2016-09-30,0001140361-16-083322
N/A,BAKER HUGHES INC USD1 Common Stock,057224107,475000.0,9418,0.024534693089067652,2016-10-24,2016-09-30,0001140361-16-083322
BTI,BRITISH AMERICAN TOBACCO PLC ADR Each Rep 2 25p Ord Shares,110448107,470000.0,3685,0.02427643316181431,2016-10-24,2016-09-30,0001140361-16-083322
LQD,ISHARES INC ISHARES Iboxx Investop Inv,464287242,457000.0,3707,0.023604957350955615,2016-10-24,2016-09-30,0001140361-16-083322
AXP,AMERICAN EXPRESS CORP USD0.20 Common Stock,025816109,451000.0,7037,0.023295045438251602,2016-10-24,2016-09-30,0001140361-16-083322
DEO,DIAGEO PLC ADR 4 28 101/108p Ordinary Shs,25243Q205,440000.0,3790,0.022726873598294246,2016-10-24,2016-09-30,0001140361-16-083322
BIIB,BIOGEN IDEC INC USD0.0005 Common Stock,09062X103,431000.0,1377,0.022262005729238227,2016-10-24,2016-09-30,0001140361-16-083322
EMF,TEMPLETON EMERGING MKTS FUND USD0.01 Common Stock,880191101,429000.0,34000,0.02215870175833689,2016-10-24,2016-09-30,0001140361-16-083322
N/A,DU PONT DE NEMOURS USD0.30 Common Stock,263534109,419000.0,6252,0.0216421819038302,2016-10-24,2016-09-30,0001140361-16-083322
IDV,ISHARES TRUST Intl Select Dividend ETF,464288448,419000.0,13960,0.0216421819038302,2016-10-24,2016-09-30,0001140361-16-083322
ALB,ALBEMARLE CORP USD0.01 Common Stock,012653101,411000.0,4810,0.02122896602022485,2016-10-24,2016-09-30,0001140361-16-083322
BNDX,VANGUARD CHARLOTTE Total Intl Bond Index Fund ETF,92203J407,410000.0,7315,0.021177314034774183,2016-10-24,2016-09-30,0001140361-16-083322
FXI,ISHARES TRUST China Large-Cap ETF,464287184,401000.0,10545,0.020712446165718164,2016-10-24,2016-09-30,0001140361-16-083322
ARLP,ALLIANCE RESOURCE PARTNERS SBI Stock,01877R108,394000.0,17745,0.020350882267563482,2016-10-24,2016-09-30,0001140361-16-083322
FSLR,FIRST SOLAR INC USD0.001 Common Stock,336433107,389000.0,9850,0.02009262234031014,2016-10-24,2016-09-30,0001140361-16-083322
N/A,GLAXOSMITHKLINE PLC Spon ADR (Cnv 2 Ord 25p),37733W105,381000.0,8826,0.01967940645670479,2016-10-24,2016-09-30,0001140361-16-083322
LVS,LAS VEGAS SANDS CORP USD0.001 Common Stock,517834107,380000.0,6606,0.01962775447125412,2016-10-24,2016-09-30,0001140361-16-083322
CEO,CNOOC LTD ADS Each Rep 100 HKD0.02 Ord,126132109,379000.0,3000,0.01957610248580345,2016-10-24,2016-09-30,0001140361-16-083322
YUM,YUM BRANDS INC  NPV Common Stock,988498101,376000.0,4143,0.019421146529451448,2016-10-24,2016-09-30,0001140361-16-083322
N/A,POWERSHARES ETF II S&P 500 Low Volatility (USD),73937B779,370000.0,8912,0.019111234616747432,2016-10-24,2016-09-30,0001140361-16-083322
ORCL,ORACLE CORP USD0.01 Common Stock,68389X105,365000.0,9297,0.01885297468949409,2016-10-24,2016-09-30,0001140361-16-083322
SU,SUNCOR ENERGY INC New NPV Common Stock (CAD),867224107,353000.0,12734,0.018233150864086063,2016-10-24,2016-09-30,0001140361-16-083322
N/A,RACKSPACE HOSTING INC USD0.001 Common Stock,750086100,349000.0,11010,0.01802654292228339,2016-10-24,2016-09-30,0001140361-16-083322
N/A,KLONDEX MINES LTD NPV Common Stock,498696103,344000.0,60000,0.017768282995030044,2016-10-24,2016-09-30,0001140361-16-083322
NUVAGBP,NUVASIVE INC USD0.001 Common Stock,670704105,337000.0,5050,0.017406719096875363,2016-10-24,2016-09-30,0001140361-16-083322
DXCM,DEXCOM INC USD0.001 Common Stock,252131107,333000.0,3800,0.01720011115507269,2016-10-24,2016-09-30,0001140361-16-083322
FITEUR,FITBIT INC USD0.0001 Cls A Common Stock,33812L102,332000.0,22397,0.017148459169622023,2016-10-24,2016-09-30,0001140361-16-083322
SQM,SOCIEDAD QUIMICA Y MINERA ADR (Rep 1 Ser B Pref Share),833635105,328000.0,12210,0.016941851227819344,2016-10-24,2016-09-30,0001140361-16-083322
GAM,GENERAL AMERICAN INVESTORS CO USD1 Common Stock,368802104,319000.0,9774,0.016476983358763325,2016-10-24,2016-09-30,0001140361-16-083322
AU3EUR,ANGLOGOLD ASHANTI LTD LVL1 ADR Rep 1 ZAR0.25 Com Stk,035128206,315000.0,19758,0.016270375416960654,2016-10-24,2016-09-30,0001140361-16-083322
GDXJ,VANECK VECTORS ETF JR Gold Miners ETF,92189F791,315000.0,7113,0.016270375416960654,2016-10-24,2016-09-30,0001140361-16-083322
DBAUSD,POWERSHARES DB Agriculture Fund,73936B408,308000.0,15426,0.015908811518805972,2016-10-24,2016-09-30,0001140361-16-083322
EWC,ISHARES INC MSCI Canada ETF,464286509,307000.0,11960,0.015857159533355304,2016-10-24,2016-09-30,0001140361-16-083322
GD,GENERAL DYNAMICS CORP USD1 Common Stock,369550108,303000.0,1956,0.01565055159155263,2016-10-24,2016-09-30,0001140361-16-083322
WPP,WPP PLC ADR Each Repr 5 Ord,92937A102,301000.0,2560,0.01554724762065129,2016-10-24,2016-09-30,0001140361-16-083322
OMC,OMNICOM GROUP INC USD0.15 Common Stock,681919106,300000.0,3524,0.01549559563520062,2016-10-24,2016-09-30,0001140361-16-083322
IXC,ISHARES TRUST Global Energy ETF,464287341,296000.0,8990,0.015288987693397947,2016-10-24,2016-09-30,0001140361-16-083322
RELX,RELX GROUP PLC Spon ADR Each Rep 0.25 Ord Shs,759530108,295000.0,15400,0.015237335707947278,2016-10-24,2016-09-30,0001140361-16-083322
N/A,TWENTY-FIRST CENTURY FOX CORP USD0.01 Cls A Common Stock,90130A101,285000.0,11754,0.014720815853440592,2016-10-24,2016-09-30,0001140361-16-083322
N/A,CENTRAL FUND OF CANADA NPV Class A Shares,153501101,283000.0,20480,0.014617511882539251,2016-10-24,2016-09-30,0001140361-16-083322
MDY,SPDR SERIES TRUST S&P MidCap 400 ETF,78467Y107,282000.0,1000,0.014565859897088584,2016-10-24,2016-09-30,0001140361-16-083322
N/A,ENCANA CORP NPV Common Stock,292505104,281000.0,26936,0.014514207911637916,2016-10-24,2016-09-30,0001140361-16-083322
N/A,SILVER WHEATON CORP NPV Common Stock,828336107,274000.0,10130,0.014152644013483234,2016-10-24,2016-09-30,0001140361-16-083322
EOG,EOG RESOURCES INC USD0.01 Common Stock,26875P101,272000.0,2810,0.014049340042581897,2016-10-24,2016-09-30,0001140361-16-083322
N/A,NEKTAR THERAPEUTICS USD0.01 Common Stock,640268108,271000.0,15800,0.013997688057131228,2016-10-24,2016-09-30,0001140361-16-083322
N/A,ELDORADO GOLD CORP NPV Common Stock,284902103,270000.0,68651,0.01394603607168056,2016-10-24,2016-09-30,0001140361-16-083322
APPF,APPFOLIO INC USD0.0001 Cls A Common Stock,03783C100,267000.0,13750,0.013791080115328555,2016-10-24,2016-09-30,0001140361-16-083322
BLKCHF,BLACKROCK INC NPV Class A Common Stock,09247X101,266000.0,734,0.013739428129877882,2016-10-24,2016-09-30,0001140361-16-083322
EXEL,EXELIXIS INC USD0.001 Common Stock,30161Q104,265000.0,20700,0.013687776144427215,2016-10-24,2016-09-30,0001140361-16-083322
NVS,NOVARTIS AG ADR Rep 1 CHF0.5 (Regd) Shares,66987V109,265000.0,3362,0.013687776144427215,2016-10-24,2016-09-30,0001140361-16-083322
ATI,ALLEGHENY TECHNOLOGY INC USD0.10 Common Stock,01741R102,257000.0,14250,0.013274560260821865,2016-10-24,2016-09-30,0001140361-16-083322
N/A,NXSTAGE MEDICAL INC USD0.001 Common Stock,67072V103,255000.0,10200,0.013171256289920528,2016-10-24,2016-09-30,0001140361-16-083322
CNQ,CDN NATURAL RESOURCES NPV Common Stock,136385101,255000.0,8000,0.013171256289920528,2016-10-24,2016-09-30,0001140361-16-083322
MKC/V,MCCORMICK & CO INC NPV Vtg Common Stock,579780107,250000.0,2500,0.012912996362667186,2016-10-24,2016-09-30,0001140361-16-083322
TRIP,TRIPADVISOR INC USD0.001 Common Stock,896945201,248000.0,3925,0.012809692391765846,2016-10-24,2016-09-30,0001140361-16-083322
N/A,INDEXIQ ETF TRUST IQ Hedge Macro Tracker ETF,45409B206,243000.0,9650,0.012551432464512504,2016-10-24,2016-09-30,0001140361-16-083322
ITW,ILLINOIS TOOL WORKS INC NPV Common Stock,452308109,242000.0,2018,0.012499780479061836,2016-10-24,2016-09-30,0001140361-16-083322
IWB,ISHARES TRUST Russell 1000 ETF,464287622,239000.0,1980,0.012344824522709828,2016-10-24,2016-09-30,0001140361-16-083322
BUD,ANHEUSER-BUSCH INBEV ADR Each Rep 1 NPV Ord Shs,03524A108,237000.0,1802,0.01224152055180849,2016-10-24,2016-09-30,0001140361-16-083322
TRV,THE TRAVELERS CO INC NPV Common Stock,89417E109,236000.0,2058,0.012189868566357821,2016-10-24,2016-09-30,0001140361-16-083322
AWC,AMERICAN WATER WORKS USD0.01 Common Stock,030420103,236000.0,3150,0.012189868566357821,2016-10-24,2016-09-30,0001140361-16-083322
D,DOMINION RES (VIR) NPV Common Stock,25746U109,236000.0,3180,0.012189868566357821,2016-10-24,2016-09-30,0001140361-16-083322
HAL,HALLIBURTON CORP NPV Common Stock,406216101,233000.0,5186,0.012034912610005817,2016-10-24,2016-09-30,0001140361-16-083322
ALXN,ALEXION PHARMACEUTICALS INC USD0.0001 Common Stock,015351109,232000.0,1890,0.011983260624555146,2016-10-24,2016-09-30,0001140361-16-083322
IBND,SPDR SERIES TRUST Barclays Cap Intl Corp Bd ETF,78464A151,232000.0,6935,0.011983260624555146,2016-10-24,2016-09-30,0001140361-16-083322
EXPD,EXPEDITOR INTL OF WASHINGTON USD0.01 Common Stock,302130109,232000.0,4500,0.011983260624555146,2016-10-24,2016-09-30,0001140361-16-083322
PEN,PENUMBRA INC USD0.001 Common Stock,70975L107,228000.0,3000,0.011776652682752471,2016-10-24,2016-09-30,0001140361-16-083322
ELV,ANTHEM INC USD0.01 Common Stock,036752103,227000.0,1810,0.011725000697301802,2016-10-24,2016-09-30,0001140361-16-083322
N/A,ENDOLOGIX INC USD0.001 Common Stock,29266S106,223000.0,17400,0.011518392755499127,2016-10-24,2016-09-30,0001140361-16-083322
VBR,VANGUARD INDEX FUNDS Small Cap Value ETF,922908611,221000.0,2000,0.011415088784597792,2016-10-24,2016-09-30,0001140361-16-083322
WAT,WATERS CORP USD0.01 Common Stock,941848103,220000.0,1390,0.011363436799147123,2016-10-24,2016-09-30,0001140361-16-083322
ADM,ARCHER-DANIELS-MIDLAND CO NPV Common Stock,039483102,211000.0,5000,0.010898568930091104,2016-10-24,2016-09-30,0001140361-16-083322
ESBA,EMPIRE STATE REALTY Partnership Units ES,292102100,209000.0,10037,0.010795264959189766,2016-10-24,2016-09-30,0001140361-16-083322
WU,WESTERN UNION COMP USD0.01 Common Stock,959802109,208000.0,10000,0.010743612973739098,2016-10-24,2016-09-30,0001140361-16-083322
N/A,CRESCENT POINT ENERGY CORP NPV Common Stock,22576C101,197000.0,15000,0.010175441133781741,2016-10-24,2016-09-30,0001140361-16-083322
DL,CHINA DISTANCE EDUCATION HLDGS Spons ADR Each Rep 4 Ord Shs,16944W104,194000.0,15000,0.010020485177429735,2016-10-24,2016-09-30,0001140361-16-083322
N/A,NOVADAQ TECHNOLOGIES INC NPV Common Stock,66987G102,170000.0,14700,0.008780837526613686,2016-10-24,2016-09-30,0001140361-16-083322
PETXEUR,ARATANA THERAPEUTICS INC US$0.001 Common Stock,03874P101,168000.0,17900,0.008677533555712347,2016-10-24,2016-09-30,0001140361-16-083322
N/A,POWERSHARES ETF Preferred Portfolio,73936T565,166000.0,11000,0.008574229584811011,2016-10-24,2016-09-30,0001140361-16-083322
CVE,CENOVUS ENERGY INC NPV Common Stock,15135U109,153000.0,10704,0.007902753773952317,2016-10-24,2016-09-30,0001140361-16-083322
NGD,NEW GOLD INC NPV Common Stock,644535106,148000.0,34110,0.0076444938466989736,2016-10-24,2016-09-30,0001140361-16-083322
N/A,STILLWATER MINING CO USD0.01 Common Stock,86074Q102,144000.0,10750,0.0074378859048962985,2016-10-24,2016-09-30,0001140361-16-083322
N/A,ARCELORMITTAL NY Registry Shares,03938L104,142000.0,23500,0.00733458193399496,2016-10-24,2016-09-30,0001140361-16-083322
F,FORD MOTOR CO USD0.01 Common Stock,345370860,121000.0,10000,0.006249890239530918,2016-10-24,2016-09-30,0001140361-16-083322
LCEUR,LENDING CLUB CORP USD0.01 Common Stock,52603A109,114000.0,18500,0.005888326341376236,2016-10-24,2016-09-30,0001140361-16-083322
CCJ,CAMECO CORP NPV Common Stock,13321L108,108000.0,12695,0.005578414428672224,2016-10-24,2016-09-30,0001140361-16-083322
DVAX,DYNAVAX TECHNOLOGY CORP USD0.001 Common Stock,268158201,105000.0,10000,0.005423458472320218,2016-10-24,2016-09-30,0001140361-16-083322
MSON,MISONIX INC USD0.01 Common Stock,604871103,105000.0,19600,0.005423458472320218,2016-10-24,2016-09-30,0001140361-16-083322
N/A,INOTEK PHARMACEUTICALS CORP USD0.01 Common Stock,45780V102,95000.0,10000,0.00490693861781353,2016-10-24,2016-09-30,0001140361-16-083322
N/A,BANRO CORP NPV Common Stock,066800103,88000.0,275000,0.004545374719658849,2016-10-24,2016-09-30,0001140361-16-083322
N/A,GOLDEN STAR RESOURCES NPV Common Stock,38119T104,84000.0,100000,0.0043387667778561735,2016-10-24,2016-09-30,0001140361-16-083322
A4E1,ALMADEN MINERALS LTD NPV Cls B Common Stock,020283305,84000.0,60000,0.0043387667778561735,2016-10-24,2016-09-30,0001140361-16-083322
IAG,IAMGOLD CORP NPV Common Stock,450913108,81000.0,20000,0.004183810821504168,2016-10-24,2016-09-30,0001140361-16-083322
N/A,FORTUNA SILVER MINING NPV Common Stock,349915108,80000.0,11000,0.0041321588360534985,2016-10-24,2016-09-30,0001140361-16-083322
GTE2EUR,GRAN TIERRA ENERGY USD0.001 Common Stock,38500T101,72000.0,23849,0.0037189429524481493,2016-10-24,2016-09-30,0001140361-16-083322
NAK,NORTHERN DYNASTY MINERALS LTD NPV Common Stock,66510M204,71000.0,100000,0.00366729096699748,2016-10-24,2016-09-30,0001140361-16-083322
SAN,BANCO SANTANDER SA ADR Rep 1 EUR0.50 Ord Shares,05964H105,63000.0,14384,0.0032540750833921304,2016-10-24,2016-09-30,0001140361-16-083322
MHSG,MECHEL PJSC Spon ADR Each Rep 2 Ord Shs,583840608,57000.0,20000,0.002944163170688118,2016-10-24,2016-09-30,0001140361-16-083322
NNVCUSD,NANOVIRICIDES INC USD0.001 Common Stock (PRS),630087203,48000.0,28250,0.0024792953016320994,2016-10-24,2016-09-30,0001140361-16-083322
N/A,FORWARD INDUSTRIES INC USD0.01 Common Stock,349862300,22000.0,15000,0.0011363436799147122,2016-10-24,2016-09-30,0001140361-16-083322
PHPN,GALECTIN THERAPEUTICS INC USD0.001 Common Stock,363225202,19000.0,16400,0.000981387723562706,2016-10-24,2016-09-30,0001140361-16-083322
