ticker,nameOfIssuer,cusip,value,shares,allocation_percent,filingDate,reportDate,accessionNumber
V,VISA INC USD0.0001 Common Stock,92826C839,90321000.0,963115,4.024417141011217,2017-08-10,2017-06-30,0001140361-17-030958
AMZN,AMAZON COM INC USD0.01 Common Stock,023135106,80887000.0,83561,3.604068038274314,2017-08-10,2017-06-30,0001140361-17-030958
KO,COCA-COLA CO USD0.25 Common Stock,191216100,68237000.0,1521458,3.04042418098983,2017-08-10,2017-06-30,0001140361-17-030958
LMT,LOCKHEED MARTIN CO USD1 Common Stock,539830109,64152000.0,231087,2.858409544072271,2017-08-10,2017-06-30,0001140361-17-030958
BAC,VERIZON COMMS INC NPV Common Stock,92343V104,63008000.0,1410833,2.807436534370022,2017-08-10,2017-06-30,0001140361-17-030958
AAPL,APPLE INC NPV Common Stock,037833100,57722000.0,400795,2.571909148630435,2017-08-10,2017-06-30,0001140361-17-030958
ATVIEUR,ACTIVISION BLIZZARD INC USD0.000001 Common Stock,00507V109,47040000.0,817088,2.0959531262183506,2017-08-10,2017-06-30,0001140361-17-030958
META,FACEBOOK INC USD0.000006 Cls A Common Stock,30303M102,40758000.0,269956,1.8160471411226093,2017-08-10,2017-06-30,0001140361-17-030958
JNJ,JOHNSON & JOHNSON USD1 Common Stock,478160104,40104000.0,303155,1.7869069764851346,2017-08-10,2017-06-30,0001140361-17-030958
MO,ALTRIA GROUP INC USD0.333333 Common Stock,02209S103,39554000.0,531135,1.762400721820592,2017-08-10,2017-06-30,0001140361-17-030958
AFW,ALIGN TECHNOLOGY INC USD0.0001 Common Stock,016255101,38716000.0,257900,1.7250621010771614,2017-08-10,2017-06-30,0001140361-17-030958
EA,ELECTRONIC ARTS INC USD0.01 Common Stock,285512109,35757000.0,338220,1.593218450981921,2017-08-10,2017-06-30,0001140361-17-030958
MSFT,MICROSOFT CORP USD 0.00000625 Common Stock,594918104,34821000.0,505162,1.5515132612255356,2017-08-10,2017-06-30,0001140361-17-030958
WEC,WEC ENERGY GROUP INC USD0.01 Common Stock,92939U106,34554000.0,562955,1.5396165885065667,2017-08-10,2017-06-30,0001140361-17-030958
GOOGL,ALPHABET INC USD0.001 Cls A Common Stock,02079K305,34297000.0,36891,1.5281654840542256,2017-08-10,2017-06-30,0001140361-17-030958
GE,GENERAL ELECTRIC CORP USD0.06 Common Stock,369604103,33693000.0,1247431,1.5012531607498913,2017-08-10,2017-06-30,0001140361-17-030958
MA,MASTERCARD INC USD0.0001 Class A Common Stock,57636Q104,33392000.0,274946,1.4878415559243872,2017-08-10,2017-06-30,0001140361-17-030958
PYPL,PAYPAL HOLDINGS INC USD0.0001 Common Stock,70450Y103,33179000.0,618200,1.4783509518452096,2017-08-10,2017-06-30,0001140361-17-030958
ADBE,ADOBE SYSTEMS INC NPV Common Stock,00724F101,32746000.0,231520,1.459057845900215,2017-08-10,2017-06-30,0001140361-17-030958
PM,PHILIP MORRIS INTL INC NPV Common Stock,718172109,32710000.0,278498,1.457453800140354,2017-08-10,2017-06-30,0001140361-17-030958
GOOG,ALPHABET INC USD0.001 Cls C Common Stock,02079K107,31809000.0,35004,1.4173080993171665,2017-08-10,2017-06-30,0001140361-17-030958
ULTA,ULTA BEAUTY INC USD0.01 Common Stock,90384S303,31489000.0,109587,1.403049914785069,2017-08-10,2017-06-30,0001140361-17-030958
PFE,PFIZER INC USD0.05 Common Stock,717081103,31308000.0,932059,1.3949851291591013,2017-08-10,2017-06-30,0001140361-17-030958
JPM,JP MORGAN CHASE & CO USD1 Common Stock,46625H100,28981000.0,317079,1.291301393514754,2017-08-10,2017-06-30,0001140361-17-030958
AOS,SMITH(AO)CORP USD1 Common Stock,831865209,27968000.0,496500,1.2461653281053322,2017-08-10,2017-06-30,0001140361-17-030958
ROL,ROLLINS INC USD1 Common Stock,775711104,27785000.0,682500,1.238011428826039,2017-08-10,2017-06-30,0001140361-17-030958
CL,COLGATE-PALMOLIVE CO NPV Common Stock,194162103,27329000.0,368664,1.2176935158678,2017-08-10,2017-06-30,0001140361-17-030958
HAS,HASBRO INC USD0.50 Common Stock,418056107,26864000.0,240914,1.1969745914695955,2017-08-10,2017-06-30,0001140361-17-030958
DIS,WALT DISNEY (HLDGS) CO USD0.1 Common Stock,254687106,26832000.0,252536,1.1955487730163856,2017-08-10,2017-06-30,0001140361-17-030958
BRK/B,BERKSHIRE HATHAWAY INC USD0.0033 Cls B Common Stock,084670702,26261000.0,155054,1.170106824991924,2017-08-10,2017-06-30,0001140361-17-030958
XOM,EXXON MOBIL CORP NPV Common Stock,30231G102,24754000.0,306624,1.1029596872110767,2017-08-10,2017-06-30,0001140361-17-030958
SHW,SHERWIN-WILLIAMS USD1 Common Stock,824348106,24637000.0,70200,1.0977465384915286,2017-08-10,2017-06-30,0001140361-17-030958
CRM,SALESFORCE.COM INC USD0.001 Common Stock,79466L302,23927000.0,276295,1.0661111915609371,2017-08-10,2017-06-30,0001140361-17-030958
BR,BROADRIDGE FINANCIAL SOLUTIONS USD0.01 Common Stock,11133T103,23070000.0,305325,1.027925991110913,2017-08-10,2017-06-30,0001140361-17-030958
INTC,INTEL CORP USD0.001 Common Stock,458140100,22561000.0,668665,1.0052465663395453,2017-08-10,2017-06-30,0001140361-17-030958
FRCB,FIRST REP BANK SAN FRANCISCO USD0.01 Common Stock,33616C100,22272000.0,222500,0.9923696434339947,2017-08-10,2017-06-30,0001140361-17-030958
INTU,INTUIT INC USD0.01 Common Stock,461202103,21980000.0,165500,0.9793590500484556,2017-08-10,2017-06-30,0001140361-17-030958
SPGI,S&P GLOBAL INC USD1 Common Stock,78409V104,21763000.0,149070,0.9696902186626268,2017-08-10,2017-06-30,0001140361-17-030958
GPN,GLOBAL PAYMENTS INC NPV Common Stock,37940X102,20774000.0,230000,0.9256235170931126,2017-08-10,2017-06-30,0001140361-17-030958
COST,COSTCO CORP NPV Common Stock,22160K105,20669000.0,129240,0.920945050293518,2017-08-10,2017-06-30,0001140361-17-030958
EFX,EQUIFAX INC USD1.25 Common Stock,294429105,20654000.0,150298,0.920276697893576,2017-08-10,2017-06-30,0001140361-17-030958
APH,AMPHENOL CORP USD0.001 Cls A Common Stock,032095101,20633000.0,279500,0.9193410045336571,2017-08-10,2017-06-30,0001140361-17-030958
CHTR,CHARTER COMMUNICATIONS INC USD0.001 Class A Common Stock,16119P108,19976000.0,59302,0.8900671694161942,2017-08-10,2017-06-30,0001140361-17-030958
HD,HOME DEPOT INC USD0.05 Common Stock,437076102,19883000.0,129617,0.8859233845365534,2017-08-10,2017-06-30,0001140361-17-030958
ATR,APTARGROUP INC USD0.01 Common Stock,038336103,19804000.0,228000,0.8824033952301916,2017-08-10,2017-06-30,0001140361-17-030958
MNST,MONSTER BEVERAGE CORP USD0.005 New Common Stock,61174X109,19524000.0,393000,0.8699274837646064,2017-08-10,2017-06-30,0001140361-17-030958
ABMDEUR,ABIOMED INC USD0.01 Common Stock,003654100,19403000.0,135400,0.8645361077384068,2017-08-10,2017-06-30,0001140361-17-030958
MCX,MCCORMICK & CO INC NPV Non Vtg Common Stock,579780206,18737000.0,192150,0.8348612611809787,2017-08-10,2017-06-30,0001140361-17-030958
TJX,TJX COMPANIES INC NPV Common Stock,872540109,18378000.0,254650,0.8188653604090317,2017-08-10,2017-06-30,0001140361-17-030958
RY,ROYAL BANK OF CANADA NPV Common Stock,780087102,17744000.0,244746,0.7906163323048132,2017-08-10,2017-06-30,0001140361-17-030958
BNS,BANK OF NOVA SCOTIA NPV Common Stock,064149107,15681000.0,261047,0.6986955988994464,2017-08-10,2017-06-30,0001140361-17-030958
ORLY,OREILLY AUTOMOTIVE INC USD0.01 New Common Stock,67103H107,14721000.0,67300,0.6559210453031535,2017-08-10,2017-06-30,0001140361-17-030958
KHC,KRAFT HEINZ CO NPV Common Stock,500754106,14394000.0,168077,0.6413509629844163,2017-08-10,2017-06-30,0001140361-17-030958
SPY,SPDR SERIES TRUST S&P 500 ETF Trust,78462F103,14055000.0,58127,0.6262461987457254,2017-08-10,2017-06-30,0001140361-17-030958
DFSEUR,DISCOVER FINANCIAL SERVICES USD0.01 Common Stock,254709108,13801000.0,221923,0.6149287647733729,2017-08-10,2017-06-30,0001140361-17-030958
N/A,DR PEPPER SNAPPLE GROUP INC USD0.01 Common Stock,26138E109,13402000.0,147095,0.5971505909349136,2017-08-10,2017-06-30,0001140361-17-030958
NKE,NIKE INC NPV Cls B Common Stock,654106103,13373000.0,226661,0.5958584429616923,2017-08-10,2017-06-30,0001140361-17-030958
PG,PROCTER & GAMBLE CO NPV Common Stock,742718109,13367000.0,153374,0.5955911020017154,2017-08-10,2017-06-30,0001140361-17-030958
C,CITIGROUP INC USD0.01 Common Stock,172967424,12661000.0,189304,0.564133982377775,2017-08-10,2017-06-30,0001140361-17-030958
BDX,BECTON DICKINSON & CO NPV Common Stock,075887109,12563000.0,64388,0.5597674133648202,2017-08-10,2017-06-30,0001140361-17-030958
MDLZ,MONDELEZ INTL INC USD0.01 Common Stock,609207105,12435000.0,287923,0.5540641395519811,2017-08-10,2017-06-30,0001140361-17-030958
CVX,CHEVRON CORP USD0.75 Common Stock,166764100,11827000.0,113364,0.5269735889409957,2017-08-10,2017-06-30,0001140361-17-030958
GLD,SPDR GOLD TRUST NPV Shares,78463V107,11425000.0,96807,0.5090617446225479,2017-08-10,2017-06-30,0001140361-17-030958
ABT,ABBOTT LABORATORIES NPV Common Stock,002824100,10589000.0,217845,0.47181223753244295,2017-08-10,2017-06-30,0001140361-17-030958
HON,HONEYWELL INTERNATIONAL INC USD1 Common Stock,438516106,10400000.0,78026,0.4633909972931728,2017-08-10,2017-06-30,0001140361-17-030958
MMC,MARSH & MCLENNAN CO INC USD1 Common Stock,571748102,10375000.0,133084,0.4622770766266026,2017-08-10,2017-06-30,0001140361-17-030958
PEP,PEPSICO INC USD0.016666 Cap,713448108,9262000.0,80197,0.4126853285509006,2017-08-10,2017-06-30,0001140361-17-030958
RTN1USD,RAYTHEON CO USD0.01 Common Stock,755111507,8782000.0,54387,0.3912980517527542,2017-08-10,2017-06-30,0001140361-17-030958
SLB,SCHLUMBERGER LTD USD0.01 Common Stock,806857108,8706000.0,132226,0.387911732926381,2017-08-10,2017-06-30,0001140361-17-030958
AMGN,AMGEN INC USD0.0001 Common Stock,031162100,8636000.0,50141,0.3847927550599846,2017-08-10,2017-06-30,0001140361-17-030958
WAB,WABTEC CORP USD0.01 Common Stock,929740108,8341000.0,91157,0.37164849119445714,2017-08-10,2017-06-30,0001140361-17-030958
IBM,IBM CORP USD0.20 Common Stock,459200101,7742000.0,50331,0.3449589520234369,2017-08-10,2017-06-30,0001140361-17-030958
ABBV,ABBVIE INC USD0.01 Common Stock,00287Y109,7727000.0,106567,0.34429059962349484,2017-08-10,2017-06-30,0001140361-17-030958
TWXCHF,TIME WARNER INC USD0.01 Common Stock,887317303,7606000.0,75754,0.3388992235972954,2017-08-10,2017-06-30,0001140361-17-030958
LLY,LILLY (ELI) & CO NPV Common Stock,532457108,7514000.0,91305,0.33479999554431733,2017-08-10,2017-06-30,0001140361-17-030958
BKU,BANKUNITED INC USD0.01 Common Stock,06652K103,7392000.0,219295,0.32936406269145513,2017-08-10,2017-06-30,0001140361-17-030958
MMM,3M COMPANY USD0.01 Common Stock,88579Y101,7240000.0,34775,0.32259142503870875,2017-08-10,2017-06-30,0001140361-17-030958
AJG,GALLAGHER AJ & CO USD1 Common Stock,363576109,6901000.0,120535,0.30748666080001785,2017-08-10,2017-06-30,0001140361-17-030958
CM,CANADIAN IMPERIAL BANK NPV Common Stock,136069101,6733000.0,82968,0.3000011139206666,2017-08-10,2017-06-30,0001140361-17-030958
EL,ESTEE LAUDER COS USD0.01 Class A Common Stock,518439104,6625000.0,69023,0.2951889766410836,2017-08-10,2017-06-30,0001140361-17-030958
PPG,PPG INDUSTRIES INC USD1.666 Common Stock,693506107,6360000.0,57838,0.2833814175754403,2017-08-10,2017-06-30,0001140361-17-030958
DVY,ISHARES TRUST Select Dividend ETF,464287168,5639000.0,61152,0.25125594555155784,2017-08-10,2017-06-30,0001140361-17-030958
DWD,MORGAN STANLEY USD0.01 Common Stock,617446448,5453000.0,122368,0.24296837579227606,2017-08-10,2017-06-30,0001140361-17-030958
EPP,ISHARES INC MSCI Pacific Ex Japan ETF,464286665,5438000.0,122261,0.242300023392334,2017-08-10,2017-06-30,0001140361-17-030958
TIP,ISHARES TRUST Tips Bond ETF,464287176,5437000.0,47930,0.2422554665656712,2017-08-10,2017-06-30,0001140361-17-030958
RJAUSD,SWEDISH EXPORT CREDIT Elements ETN Lkd RICI,870297603,5380000.0,841982,0.2397157274458913,2017-08-10,2017-06-30,0001140361-17-030958
NTRS,NORTHERN TRUST CORP USD1.666 Common Stock,665859104,5272000.0,54231,0.23490359016630832,2017-08-10,2017-06-30,0001140361-17-030958
CELG,CELGENE CORP USD0.01 Common Stock,151020104,5140000.0,39581,0.2290220890468181,2017-08-10,2017-06-30,0001140361-17-030958
BABA,ALIBABA GROUP HOLDINGS LTD Spon ADS Each Rep 1 Ord,01609W102,4842000.0,34366,0.21574415470130218,2017-08-10,2017-06-30,0001140361-17-030958
EEM,ISHARES TRUST MSCI Emerging Markets ETF,464287234,4697000.0,113470,0.20928341483519544,2017-08-10,2017-06-30,0001140361-17-030958
UNP,UNION PACIFIC CORP USD2.50 Common Stock,907818108,4507000.0,41385,0.2008176177692625,2017-08-10,2017-06-30,0001140361-17-030958
NEM,NEWMONT MINING CORP USD1.60 Common Stock,651639106,4440000.0,137077,0.19783231038285454,2017-08-10,2017-06-30,0001140361-17-030958
TSLA,TESLA INC USD0.001 Common Stock,88160R101,4311000.0,11921,0.1920844797433527,2017-08-10,2017-06-30,0001140361-17-030958
EWJ,ISHARES INC MSCI Japan New ETF (P/R Split),46434G822,4299000.0,80128,0.191549797823399,2017-08-10,2017-06-30,0001140361-17-030958
BMO,BANK OF MONTREAL NPV Common Stock,063671101,4247000.0,57928,0.18923284283693315,2017-08-10,2017-06-30,0001140361-17-030958
BSV,VANGUARD BOND INDEX FUND Short Term Bond ETF,921937827,4226000.0,52929,0.18829714947701423,2017-08-10,2017-06-30,0001140361-17-030958
MRK,MERCK & CO INC USD0.50 Common Stock,58933Y105,4076000.0,63597,0.1816136254775935,2017-08-10,2017-06-30,0001140361-17-030958
CVS,CVS CORP USD0.01 Common Stock,126650100,4004000.0,49769,0.17840553395787154,2017-08-10,2017-06-30,0001140361-17-030958
BAC,BANK OF AMERICA CORP NPV Common Stock,060505104,3966000.0,163468,0.1767123745446849,2017-08-10,2017-06-30,0001140361-17-030958
MCD,MCDONALD'S CORP USD0.01 Common Stock,580135101,3754000.0,24510,0.16726632729217025,2017-08-10,2017-06-30,0001140361-17-030958
T,AT&T INC USD1 Common Stock,00206R102,3722000.0,98638,0.16584050883896048,2017-08-10,2017-06-30,0001140361-17-030958
VT,VANGUARD INTL EQUITY Total World Stock Market ETF,922042742,3453000.0,51130,0.15385472246666593,2017-08-10,2017-06-30,0001140361-17-030958
BND,VANGUARD BOND INDEX FUND Total Bond Market ETF,921937835,3399000.0,41539,0.15144865382687445,2017-08-10,2017-06-30,0001140361-17-030958
EWU,ISHARES TRUST MSCI UK New ETF (Post Cons),46435G334,3383000.0,101515,0.15073574460026956,2017-08-10,2017-06-30,0001140361-17-030958
WFC,WELLS FARGO & CO USD1.6666 Common Stock,949746101,3316000.0,59851,0.14775043721386164,2017-08-10,2017-06-30,0001140361-17-030958
CTSH,COGNIZANT TECHNOLOGY USD0.01 Class A Common Stock,192446102,3231000.0,48656,0.1439631069475232,2017-08-10,2017-06-30,0001140361-17-030958
BALL,BALL CORP NPV Common Stock,058498106,3099000.0,73422,0.13808160582803294,2017-08-10,2017-06-30,0001140361-17-030958
AEM,AGNICO EAGLE MINES LTD NPV Common Stock,008474108,3001000.0,66620,0.13371503681507804,2017-08-10,2017-06-30,0001140361-17-030958
BCE,BCE INC NPV Common Stock,05534B760,2951000.0,65617,0.1314871954819378,2017-08-10,2017-06-30,0001140361-17-030958
BMY,BRISTOL-MYERS SQUIBB CO NPV Common Stock,110122108,2851000.0,51159,0.12703151281565728,2017-08-10,2017-06-30,0001140361-17-030958
GII,SPDR INDEX SHARES S&P Gbl Infrastructure ETF,78463X855,2841000.0,56327,0.12658594454902922,2017-08-10,2017-06-30,0001140361-17-030958
KMB,KIMBERLEY CLARK CORP NPV Common Stock,494368103,2823000.0,21867,0.1257839216690987,2017-08-10,2017-06-30,0001140361-17-030958
DXJ,WISDOMTREE TRUST Japan Hedged Equity Fund,97717W851,2820000.0,54237,0.1256502511891103,2017-08-10,2017-06-30,0001140361-17-030958
IXN,ISHARES TRUST Global Technology ETF,464287291,2817000.0,21514,0.1255165807091219,2017-08-10,2017-06-30,0001140361-17-030958
GLW,CORNING INC USD0.50 Common Stock,219350105,2784000.0,92660,0.12404620542924934,2017-08-10,2017-06-30,0001140361-17-030958
ISRG,INTUITIVE SURGICAL INC USD0.001 Common Stock,46120E602,2759000.0,2950,0.1229322847626792,2017-08-10,2017-06-30,0001140361-17-030958
N/A,POWERSHARES ETF Intl Corp Bond,73936Q835,2755000.0,104865,0.12275405745602798,2017-08-10,2017-06-30,0001140361-17-030958
XYL,XYLEM INC USD0.01 Common Stock,98419M100,2724000.0,49150,0.12137279582948102,2017-08-10,2017-06-30,0001140361-17-030958
MHK,MOWHAWK INDUSTRIES INC USD0.01 Common Stock,608190104,2680000.0,11088,0.11941229545631761,2017-08-10,2017-06-30,0001140361-17-030958
GWPH,GW PHARMACEUTICALS PLC ADS Each Rep 12 Ord Shares,36197T103,2668000.0,26611,0.11887761353636395,2017-08-10,2017-06-30,0001140361-17-030958
TD,TORONTO-DOMINION BANK NPV Common Stock,891160509,2640000.0,52459,0.11763002238980538,2017-08-10,2017-06-30,0001140361-17-030958
WMT,WAL-MART STORES INC USD0.1 Common Stock,931142103,2408000.0,31818,0.10729283860403463,2017-08-10,2017-06-30,0001140361-17-030958
N/A,THOMSON REUTERS CORP NPV Common Stock,884903105,2366000.0,51187,0.1054214518841968,2017-08-10,2017-06-30,0001140361-17-030958
STZ,CONSTELLATION BRANDS INC USD Cls A Common Stock,21036P108,2312000.0,11935,0.10301538324440533,2017-08-10,2017-06-30,0001140361-17-030958
BA,BOEING CO USD5 Common Stock,097023105,2214000.0,11194,0.09864881423145043,2017-08-10,2017-06-30,0001140361-17-030958
EZU,ISHARES INC MSCI EMU ETF,464286608,2200000.0,54557,0.09802501865817116,2017-08-10,2017-06-30,0001140361-17-030958
WPS,ISHARES TRUST Intl Developed Prop ETF,464288422,2093000.0,56522,0.09325743820525102,2017-08-10,2017-06-30,0001140361-17-030958
EMR,EMERSON ELECTRIC CO USD0.50 Common Stock,291011104,2078000.0,34850,0.09258908580530895,2017-08-10,2017-06-30,0001140361-17-030958
GIS,GENERAL MILLS INC USD0.10 Common Stock,370334104,2077000.0,37485,0.09254452897864614,2017-08-10,2017-06-30,0001140361-17-030958
COP,CONOCOPHILLIPS INC USD0.01 Common Stock,20825C104,2041000.0,46421,0.09094048321878516,2017-08-10,2017-06-30,0001140361-17-030958
SYY,SYSCO CORP NPV Common Stock,871829107,1928000.0,38310,0.08590556180588818,2017-08-10,2017-06-30,0001140361-17-030958
CAT,CATERPILLAR INC USD1 Common Stock,149123101,1840000.0,17120,0.08198456105956134,2017-08-10,2017-06-30,0001140361-17-030958
VPL,VANGUARD INTL EQUITY MSCI Pacific ETF,922042866,1835000.0,27887,0.08176177692624731,2017-08-10,2017-06-30,0001140361-17-030958
N/A,REYNOLDS AMERICAN INC USD0.0001 Common Stock,761713106,1799000.0,27655,0.08015773116638633,2017-08-10,2017-06-30,0001140361-17-030958
BRK/A,BERKSHIRE HATHAWAY INC USD5 Class A Common Stock,084670108,1783000.0,7,0.07944482193978145,2017-08-10,2017-06-30,0001140361-17-030958
N/A,SEVCON INC USD0.10 Common Stock,81783K108,1737000.0,129621,0.07739520791329241,2017-08-10,2017-06-30,0001140361-17-030958
IWM,ISHARES TRUST Russell 2000 ETF,464287655,1737000.0,12326,0.07739520791329241,2017-08-10,2017-06-30,0001140361-17-030958
IOO,ISHARES TRUST Global 100 ETF,464287572,1689000.0,20050,0.07525648023347777,2017-08-10,2017-06-30,0001140361-17-030958
UTXZ,UTD TECHNOLOGIES CORP USD1 Common Stock,913017109,1625000.0,13306,0.07240484332705824,2017-08-10,2017-06-30,0001140361-17-030958
NFLX,NETFLIX COM INC USD0.001 Common Stock,64110L106,1584000.0,10605,0.07057801343388324,2017-08-10,2017-06-30,0001140361-17-030958
TTEK,TETRA TECH INC USD0.01 Common Stock,88162G103,1480000.0,32345,0.0659441034609515,2017-08-10,2017-06-30,0001140361-17-030958
DOV,DOVER CORP USD1 Common Stock,260003108,1442000.0,17980,0.06425094404776491,2017-08-10,2017-06-30,0001140361-17-030958
MFC,MANULIFE FINANCIAL CORP NPV Common Stock,56501R106,1423000.0,76000,0.06340436434117162,2017-08-10,2017-06-30,0001140361-17-030958
K,KELLOGG CO USD0.25 Common Stock,487836108,1419000.0,20435,0.0632261370345204,2017-08-10,2017-06-30,0001140361-17-030958
EWG,ISHARES INC MSCI Germany ETF,464286806,1378000.0,45519,0.06139930714134539,2017-08-10,2017-06-30,0001140361-17-030958
TIFEUR,TIFFANY & CO USD0.01 Common Stock,886547108,1369000.0,14580,0.06099829570138014,2017-08-10,2017-06-30,0001140361-17-030958
RSG,REPUBLIC SERVICES INC USD0.01 Common Stock,760759100,1335000.0,20950,0.059483363594844775,2017-08-10,2017-06-30,0001140361-17-030958
EBA,EBAY INC USD0.001 Common Stock,278642103,1268000.0,36310,0.05649805620843684,2017-08-10,2017-06-30,0001140361-17-030958
WM,WASTE MANAGEMENT INC NPV Common Stock,94106L109,1260000.0,17180,0.0561416015951344,2017-08-10,2017-06-30,0001140361-17-030958
UTF,COHEN & STEERS INFRASTRUCTURE USD0.001 Common Stock,19248A109,1252000.0,52990,0.05578514698183195,2017-08-10,2017-06-30,0001140361-17-030958
PSX,PHILLIPS 66 USD0.01 Common Stock,718546104,1245000.0,15056,0.055473249195192316,2017-08-10,2017-06-30,0001140361-17-030958
BXUSD,BLACKSTONE GROUP LP Common Units,09253U108,1222000.0,36633,0.054448442181947804,2017-08-10,2017-06-30,0001140361-17-030958
IWP,ISHARES TRUST Russell Midcap Growth ETF,464287481,1218000.0,11275,0.05427021487529658,2017-08-10,2017-06-30,0001140361-17-030958
GS,GOLDMAN SACHS GROUP USD0.01 Common Stock,38141G104,1186000.0,5346,0.05284439642208682,2017-08-10,2017-06-30,0001140361-17-030958
PAYX,PAYCHEX INC USD0.01 Common Stock,704326107,1176000.0,20660,0.052398828155458765,2017-08-10,2017-06-30,0001140361-17-030958
R6C2,ROYAL DUTCH SHELL EUR0.07 ADR Ea Rep 2 Cls B Shs,780259107,1168000.0,21450,0.05204237354215633,2017-08-10,2017-06-30,0001140361-17-030958
CMCSA,COMCAST CORP USD1 A Common Stock,20030N101,1167000.0,29980,0.05199781671549352,2017-08-10,2017-06-30,0001140361-17-030958
WBA,WALGREENS BOOTS ALLIANCE USD0.01 Common Stock,931427108,1165000.0,14872,0.05190870306216791,2017-08-10,2017-06-30,0001140361-17-030958
TRUP,TRUPANION INC USD0.00001 Common Stock,898202106,1119000.0,50000,0.04985908903567888,2017-08-10,2017-06-30,0001140361-17-030958
DE,DEERE & CO USD1 Common Stock,244199105,1089000.0,8815,0.048522384235794726,2017-08-10,2017-06-30,0001140361-17-030958
PH,PARKER-HANNIFIN CORP USD0.50 Common Stock,701094104,1071000.0,6700,0.04772036135586424,2017-08-10,2017-06-30,0001140361-17-030958
WY,WEYERHAUSER CO USD1.25 Common Stock,962166104,1025000.0,30600,0.0456707473293752,2017-08-10,2017-06-30,0001140361-17-030958
VNQ,VANGUARD INDEX FUNDS REIT ETF (USD),922908553,1014000.0,12185,0.04518062223608434,2017-08-10,2017-06-30,0001140361-17-030958
GILD,GILEAD SCIENCES INC USD0.001 Common Stock,375558103,1000000.0,14131,0.044556826662805075,2017-08-10,2017-06-30,0001140361-17-030958
CSCO,CISCO SYSTEMS INC USD0.001 Common Stock,17275R102,989000.0,31601,0.04406670156951422,2017-08-10,2017-06-30,0001140361-17-030958
AABAUSD,ALTABA INC NPV Common Stock,021346101,989000.0,18150,0.04406670156951422,2017-08-10,2017-06-30,0001140361-17-030958
IXJ,ISHARES TRUST S&P Gbl Heathcare Sector,464287325,976000.0,8928,0.043487462822897754,2017-08-10,2017-06-30,0001140361-17-030958
CSL,CARLISLE COS INC USD1 Common Stock,142339100,954000.0,10000,0.042507212636316044,2017-08-10,2017-06-30,0001140361-17-030958
L,LOEWS CORP USD1 Common Stock,540424108,936000.0,20000,0.04170518975638555,2017-08-10,2017-06-30,0001140361-17-030958
TKR,TIMKEN CO NPV Common Stock,887389104,916000.0,19800,0.04081405322312945,2017-08-10,2017-06-30,0001140361-17-030958
SWK,STANLEY BLACK & DECKER INC USD2.50 Common Stock,854502101,901000.0,6400,0.04014570082318737,2017-08-10,2017-06-30,0001140361-17-030958
IJH,ISHARES TRUST Core S&P Mid-Cap ETF,464287507,901000.0,5177,0.04014570082318737,2017-08-10,2017-06-30,0001140361-17-030958
ADAP,ADAPTIMMUNE THERAPEUTICS PLC Spon ADS Each Rep 6 Ord Shs,00653A107,900000.0,200525,0.04010114399652456,2017-08-10,2017-06-30,0001140361-17-030958
N/A,GOLDCORP INC NPV Common Stock,380956409,897000.0,69570,0.03996747351653615,2017-08-10,2017-06-30,0001140361-17-030958
N/A,CANADIAN PACIFIC RAILWAY LTD NPV Common Stock,13645T100,889000.0,5532,0.039611018903233715,2017-08-10,2017-06-30,0001140361-17-030958
FXI,ISHARES TRUST China Large-Cap ETF,464287184,889000.0,22395,0.039611018903233715,2017-08-10,2017-06-30,0001140361-17-030958
VTI,VANGUARD INDEX FUNDS Total Stock Market ETF,922908769,873000.0,7012,0.03889810967662883,2017-08-10,2017-06-30,0001140361-17-030958
MCO,MOODYS CORP  USD0.01 Common Stock,615369105,841000.0,6913,0.037472291223419066,2017-08-10,2017-06-30,0001140361-17-030958
WCN,WASTE CONNECTIONS INC NPV Common Stock,94106B101,827000.0,12832,0.0368484956501398,2017-08-10,2017-06-30,0001140361-17-030958
IVV,ISHARES INC Core S&P 500 ETF,464287200,824000.0,3385,0.036714825170151386,2017-08-10,2017-06-30,0001140361-17-030958
9990302D,APACHE CORP USD1.25 Common Stock,037411105,824000.0,17200,0.036714825170151386,2017-08-10,2017-06-30,0001140361-17-030958
AME,AMETEK INC NPV Common Stock,031100100,818000.0,13500,0.036447484210174554,2017-08-10,2017-06-30,0001140361-17-030958
EWD,ISHARES INC MSCI Sweden ETF,464286756,789000.0,23250,0.0351553362369532,2017-08-10,2017-06-30,0001140361-17-030958
SKAA,SKECHER USA INC USD0.001 A Common Stock,830566105,779000.0,26415,0.03470976797032515,2017-08-10,2017-06-30,0001140361-17-030958
SJM,JM SMUCKER CO NPV Common Stock,832696405,766000.0,6470,0.03413052922370869,2017-08-10,2017-06-30,0001140361-17-030958
EXPE,EXPEDIA INC USD0.001 Com Stk (Post-Split),30212P303,763000.0,5120,0.03399685874372027,2017-08-10,2017-06-30,0001140361-17-030958
FCX,FREEPORT-MCMORAN INC USD0.10 Common Stock,35671D857,755000.0,62826,0.033640404130417835,2017-08-10,2017-06-30,0001140361-17-030958
IDV,ISHARES TRUST Intl Select Dividend ETF,464288448,749000.0,22900,0.033373063170440996,2017-08-10,2017-06-30,0001140361-17-030958
VOD,VODAFONE GROUP PLC Spon ADR Rep 10 Ord Shs,92857W308,739000.0,25709,0.03292749490381295,2017-08-10,2017-06-30,0001140361-17-030958
RPM,RPM INTL INC USD0.01 Common Stock,749685103,736000.0,13500,0.03279382442382454,2017-08-10,2017-06-30,0001140361-17-030958
BUD,ANHEUSER-BUSCH INBEV ADR Each Rep 1 NPV Ord Shs,03524A108,718000.0,6502,0.03199180154389404,2017-08-10,2017-06-30,0001140361-17-030958
ALB,ALBEMARLE CORP USD0.01 Common Stock,012653101,717000.0,6794,0.03194724471723124,2017-08-10,2017-06-30,0001140361-17-030958
SBUX,STARBUCKS CORP USD0.001 Common Stock,855244109,703000.0,12052,0.03132344914395197,2017-08-10,2017-06-30,0001140361-17-030958
AXP,AMERICAN EXPRESS CORP USD0.20 Common Stock,025816109,689000.0,8184,0.030699653570672693,2017-08-10,2017-06-30,0001140361-17-030958
LKQ1,LKQ CORP USD0.01 Common Stock,501889208,685000.0,20775,0.030521426264021476,2017-08-10,2017-06-30,0001140361-17-030958
EMF,TEMPLETON EMERGING MKTS FUND USD0.01 Common Stock,880191101,664000.0,44510,0.02958573290410257,2017-08-10,2017-06-30,0001140361-17-030958
TSM,TAIWAN SEMICONDUCTORS MAN LTD ADS Rep 5 TWD10 Ord Share,874039100,662000.0,18932,0.029496619250776963,2017-08-10,2017-06-30,0001140361-17-030958
