ticker,nameOfIssuer,cusip,value,shares,allocation_percent,filingDate,reportDate,accessionNumber
VGK,VANGUARD INTL EQUITY European ETF,922042874,641000.0,11621,0.028560925890858055,2017-08-10,2017-06-30,0001140361-17-030958
CHLUSD,CHINA MOBILE (HONG KONG) LTD Spon ADR Rep 5 Ord HKD0.10,16941M109,637000.0,12000,0.028382698584206834,2017-08-10,2017-06-30,0001140361-17-030958
TG7,TRIUMPH GROUP INC USD0.001 Common Stock,896818101,632000.0,20000,0.02815991445089281,2017-08-10,2017-06-30,0001140361-17-030958
ITT,ITT INC USD1.00 Common Stock,45073V108,613000.0,15250,0.027313334744299513,2017-08-10,2017-06-30,0001140361-17-030958
PFF,ISHARES TRUST S&P US Pref Stock Index Fund,464288687,594000.0,15155,0.02646675503770621,2017-08-10,2017-06-30,0001140361-17-030958
SYK,STRYKER CORP USD0.10 Common Stock,863667101,583000.0,4200,0.02597662994441536,2017-08-10,2017-06-30,0001140361-17-030958
NVDA,NVIDIA CORP USD0.001 Common Stock,67066G104,580000.0,4015,0.025842959464426943,2017-08-10,2017-06-30,0001140361-17-030958
EUO,PROSHARES TRUST II Ultrashort Euro,74347W882,579000.0,25060,0.025798402637764138,2017-08-10,2017-06-30,0001140361-17-030958
VHT,VANGUARD WORLD FUNDS Healthcare ETF,92204A504,568000.0,3854,0.02530827754447328,2017-08-10,2017-06-30,0001140361-17-030958
N/A,DU PONT DE NEMOURS USD0.30 Common Stock,263534109,567000.0,7028,0.025263720717810474,2017-08-10,2017-06-30,0001140361-17-030958
N/A,BROOKFIELD ASSET MGMT NPV Cls A Voting Shares,112585104,561000.0,14326,0.024996379757833646,2017-08-10,2017-06-30,0001140361-17-030958
BTI,BRITISH AMERICAN TOBACCO PLC ADR Each Rep 1 Ordinary Share,110448107,554000.0,8080,0.024684481971194012,2017-08-10,2017-06-30,0001140361-17-030958
SCHW,SCHWAB (CHARLES) CORP USD0.01 Common Stock,808513105,548000.0,12755,0.024417141011217183,2017-08-10,2017-06-30,0001140361-17-030958
BTUSD,BRITISH TELECOM GROUP PLC ADR Each Rep 10 Ord Shares,05577E101,536000.0,27600,0.02388245909126352,2017-08-10,2017-06-30,0001140361-17-030958
ENOR,ISHARES TRUST MSCI Norway Capped ETF,46429B499,514000.0,23250,0.02290220890468181,2017-08-10,2017-06-30,0001140361-17-030958
RDS/A,ROYAL DUTCH SHELL PLC ADR Ech Rep 2 Cl A EUR0.07 Shs,780259206,513000.0,9640,0.022857652078019004,2017-08-10,2017-06-30,0001140361-17-030958
EXEL,EXELIXIS INC USD0.001 Common Stock,30161Q104,493000.0,20000,0.0219665155447629,2017-08-10,2017-06-30,0001140361-17-030958
ENB,ENBRIDGE INC NPV Common Stock,29250N105,479000.0,12050,0.02134271997148363,2017-08-10,2017-06-30,0001140361-17-030958
GD,GENERAL DYNAMICS CORP USD1 Common Stock,369550108,475000.0,2398,0.02116449266483241,2017-08-10,2017-06-30,0001140361-17-030958
BF/B,BROWN-FORMAN CORP USD0.15 B Common Stock,115637209,472000.0,9715,0.021030822184843995,2017-08-10,2017-06-30,0001140361-17-030958
EXAS,EXACT SCIENCES CORP USD0.01 Common Stock,30063P105,463000.0,13100,0.02062981074487875,2017-08-10,2017-06-30,0001140361-17-030958
BNDX,VANGUARD CHARLOTTE Total Intl Bond Index Fund ETF,92203J407,460000.0,8465,0.020496140264890335,2017-08-10,2017-06-30,0001140361-17-030958
IXC,ISHARES TRUST Global Energy ETF,464287341,459000.0,14802,0.02045158343822753,2017-08-10,2017-06-30,0001140361-17-030958
N/A,BAKER HUGHES INC USD1 Common Stock,057224107,448000.0,8218,0.019961458344936674,2017-08-10,2017-06-30,0001140361-17-030958
APPF,APPFOLIO INC USD0.0001 Cls A Common Stock,03783C100,448000.0,13750,0.019961458344936674,2017-08-10,2017-06-30,0001140361-17-030958
GAM,GENERAL AMERICAN INVESTORS CO USD1 Common Stock,368802104,445000.0,12967,0.01982778786494826,2017-08-10,2017-06-30,0001140361-17-030958
CCK,CROWN HOLDINGS INC USD5 Common Stock,228368106,438000.0,7345,0.019515890078308624,2017-08-10,2017-06-30,0001140361-17-030958
GDX,VANECK VECTORS ETF Gold Miners ETF,92189F106,438000.0,19831,0.019515890078308624,2017-08-10,2017-06-30,0001140361-17-030958
DBAUSD,POWERSHARES DB Agriculture Fund,73936B408,428000.0,21556,0.01907032181168057,2017-08-10,2017-06-30,0001140361-17-030958
N/A,GLAXOSMITHKLINE PLC Spon ADR (Cnv 2 Ord 25p),37733W105,404000.0,9376,0.01800095797177325,2017-08-10,2017-06-30,0001140361-17-030958
N/A,POWERSHARES ETF II S&P 500 Low Volatility (USD),73937B779,399000.0,8912,0.017778173838459223,2017-08-10,2017-06-30,0001140361-17-030958
NUVAGBP,NUVASIVE INC USD0.001 Common Stock,670704105,388000.0,5050,0.01728804874516837,2017-08-10,2017-06-30,0001140361-17-030958
VXF,VANGUARD INDEX FUNDS Extended Market ETF,922908652,387000.0,3785,0.017243491918505563,2017-08-10,2017-06-30,0001140361-17-030958
DEO,DIAGEO PLC ADR 4 28 101/108p Ordinary Shs,25243Q205,369000.0,3080,0.016441469038575074,2017-08-10,2017-06-30,0001140361-17-030958
ORCL,ORACLE CORP USD0.01 Common Stock,68389X105,362000.0,7212,0.01612957125193544,2017-08-10,2017-06-30,0001140361-17-030958
SQM,SOCIEDAD QUIMICA Y MINERA ADR (Rep 1 Ser B Pref Share),833635105,361000.0,10930,0.016085014425272635,2017-08-10,2017-06-30,0001140361-17-030958
N/A,POWERSHARES ETF Global Short Term High Yield,73936Q710,353000.0,14555,0.015728559811970192,2017-08-10,2017-06-30,0001140361-17-030958
LVS,LAS VEGAS SANDS CORP USD0.001 Common Stock,517834107,352000.0,5513,0.015684002985307387,2017-08-10,2017-06-30,0001140361-17-030958
N/A,NEKTAR THERAPEUTICS USD0.01 Common Stock,640268108,348000.0,17800,0.015505775678656167,2017-08-10,2017-06-30,0001140361-17-030958
TXN,TEXAS INSTRUMENTS INC Common Stock,882508104,346000.0,4498,0.015416662025330556,2017-08-10,2017-06-30,0001140361-17-030958
SU,SUNCOR ENERGY INC New NPV Common Stock (CAD),867224107,345000.0,11820,0.01537210519866775,2017-08-10,2017-06-30,0001140361-17-030958
CEO,CNOOC LTD ADS Each Rep 100 HKD0.02 Ord,126132109,328000.0,3000,0.014614639145400064,2017-08-10,2017-06-30,0001140361-17-030958
LBEUR,LIMITED BRANDS INC USD0.50 Common Stock,501797104,327000.0,6065,0.014570082318737259,2017-08-10,2017-06-30,0001140361-17-030958
IGSB,ISHARES TRUST Barclays 1-3 Yr Credit Bond Fd,464288646,327000.0,3105,0.014570082318737259,2017-08-10,2017-06-30,0001140361-17-030958
N/A,PRICELINE.COM INC USD0.008 Common Stock,741503403,327000.0,175,0.014570082318737259,2017-08-10,2017-06-30,0001140361-17-030958
N/A,POWERSHARES ETF India P/Folio,73935L100,325000.0,14235,0.01448096866541165,2017-08-10,2017-06-30,0001140361-17-030958
MDY,SPDR SERIES TRUST S&P MidCap 400 ETF,78467Y107,318000.0,1000,0.014169070878772014,2017-08-10,2017-06-30,0001140361-17-030958
ILMN,ILLUMINA INC USD0.01 Common Stock,452327109,312000.0,1796,0.013901729918795182,2017-08-10,2017-06-30,0001140361-17-030958
STWD,STARWOOD PROPERTY TRUST INC USD0.01 Common Stock,85571B105,305000.0,13620,0.013589832132155548,2017-08-10,2017-06-30,0001140361-17-030958
ARLP,ALLIANCE RESOURCE PARTNERS SBI Stock,01877R108,302000.0,15955,0.013456161652167134,2017-08-10,2017-06-30,0001140361-17-030958
ABX,BARRICK GOLD CORP NPV Common Stock (CAD),067901108,298000.0,18769,0.013277934345515911,2017-08-10,2017-06-30,0001140361-17-030958
AYXEUR,ALTERYX INC USD0.0001 Class A Common Stock,02156B103,293000.0,15000,0.013055150212201886,2017-08-10,2017-06-30,0001140361-17-030958
DXCM,DEXCOM INC USD0.001 Common Stock,252131107,293000.0,4000,0.013055150212201886,2017-08-10,2017-06-30,0001140361-17-030958
UNUSD,UNILEVER NV EUR0.16 Shares (NY Listed),904784709,282000.0,5094,0.01256502511891103,2017-08-10,2017-06-30,0001140361-17-030958
OXY,OCCIDENTAL PETROLEUM CORP      USD0.20 Common Stock,674599105,278000.0,4642,0.012386797812259811,2017-08-10,2017-06-30,0001140361-17-030958
APC,ANADARKO PETROLEUM CORP USD0.10 Common Stock,032511107,277000.0,6120,0.012342240985597006,2017-08-10,2017-06-30,0001140361-17-030958
BIIB,BIOGEN IDEC INC USD0.0005 Common Stock,09062X103,266000.0,982,0.01185211589230615,2017-08-10,2017-06-30,0001140361-17-030958
UYG,PROSHARES TRUST Ultra Financials Proshares,74347X633,263000.0,2530,0.011718445412317735,2017-08-10,2017-06-30,0001140361-17-030958
PEN,PENUMBRA INC USD0.001 Common Stock,70975L107,263000.0,3000,0.011718445412317735,2017-08-10,2017-06-30,0001140361-17-030958
N/A,NXSTAGE MEDICAL INC USD0.001 Common Stock,67072V103,256000.0,10200,0.011406547625678099,2017-08-10,2017-06-30,0001140361-17-030958
EXPD,EXPEDITOR INTL OF WASHINGTON USD0.01 Common Stock,302130109,254000.0,4500,0.011317433972352488,2017-08-10,2017-06-30,0001140361-17-030958
EOG,EOG RESOURCES INC USD0.01 Common Stock,26875P101,254000.0,2810,0.011317433972352488,2017-08-10,2017-06-30,0001140361-17-030958
N/A,WHOLE FOODS MARKET INC NPV Common Stock,966837106,253000.0,6000,0.011272877145689685,2017-08-10,2017-06-30,0001140361-17-030958
EWC,ISHARES INC MSCI Canada ETF,464286509,252000.0,9420,0.01122832031902688,2017-08-10,2017-06-30,0001140361-17-030958
MKL,MARKEL CORP NPV Common Stock,570535104,251000.0,257,0.011183763492364074,2017-08-10,2017-06-30,0001140361-17-030958
IWB,ISHARES TRUST Russell 1000 ETF,464287622,250000.0,1845,0.011139206665701269,2017-08-10,2017-06-30,0001140361-17-030958
AU3EUR,ANGLOGOLD ASHANTI LTD LVL1 ADR Rep 1 ZAR0.25 Com Stk,035128206,248000.0,25508,0.011050093012375658,2017-08-10,2017-06-30,0001140361-17-030958
ALXN,ALEXION PHARMACEUTICALS INC USD0.0001 Common Stock,015351109,248000.0,2040,0.011050093012375658,2017-08-10,2017-06-30,0001140361-17-030958
BLKCHF,BLACKROCK INC NPV Class A Common Stock,09247X101,246000.0,582,0.01096097935905005,2017-08-10,2017-06-30,0001140361-17-030958
VBR,VANGUARD INDEX FUNDS Small Cap Value ETF,922908611,246000.0,2000,0.01096097935905005,2017-08-10,2017-06-30,0001140361-17-030958
AWC,AMERICAN WATER WORKS USD0.01 Common Stock,030420103,246000.0,3150,0.01096097935905005,2017-08-10,2017-06-30,0001140361-17-030958
MKC/V,MCCORMICK & CO INC NPV Vtg Common Stock,579780107,244000.0,2500,0.010871865705724439,2017-08-10,2017-06-30,0001140361-17-030958
N/A,TWENTY-FIRST CENTURY FOX CORP USD0.01 Cls A Common Stock,90130A101,243000.0,8572,0.010827308879061633,2017-08-10,2017-06-30,0001140361-17-030958
BIDUN,BAIDU INC ADS Each Rep 1 Ord Cls A Share,056752108,242000.0,1355,0.010782752052398828,2017-08-10,2017-06-30,0001140361-17-030958
IBND,SPDR SERIES TRUST Barclays Cap Intl Corp Bd ETF,78464A151,240000.0,7205,0.010693638399073217,2017-08-10,2017-06-30,0001140361-17-030958
YUM,YUM BRANDS INC  NPV Common Stock,988498101,233000.0,3163,0.010381740612433582,2017-08-10,2017-06-30,0001140361-17-030958
CNQ,CDN NATURAL RESOURCES NPV Common Stock,136385101,230000.0,8000,0.010248070132445167,2017-08-10,2017-06-30,0001140361-17-030958
CTRPUSD,CTRIP.COM INTERNATIONAL LTD ADS Each Rep 2 Ord USD0.01,22943F100,229000.0,4255,0.010203513305782362,2017-08-10,2017-06-30,0001140361-17-030958
N/A,CENTRAL FUND OF CANADA NPV Class A Shares,153501101,228000.0,18480,0.010158956479119557,2017-08-10,2017-06-30,0001140361-17-030958
N/A,INDEXIQ ETF TRUST IQ Hedge Macro Tracker ETF,45409B206,223000.0,8650,0.009936172345805532,2017-08-10,2017-06-30,0001140361-17-030958
FI,FISERV INC USD0.01 Common Stock,337738108,214000.0,1750,0.009535160905840286,2017-08-10,2017-06-30,0001140361-17-030958
ABG,AMERISOURCEBERGEN CORP USD0.01 Common Stock,03073E105,212000.0,2245,0.009446047252514677,2017-08-10,2017-06-30,0001140361-17-030958
ADM,ARCHER-DANIELS-MIDLAND CO NPV Common Stock,039483102,207000.0,5000,0.00922326311920065,2017-08-10,2017-06-30,0001140361-17-030958
TRV,THE TRAVELERS CO INC NPV Common Stock,89417E109,205000.0,1620,0.009134149465875041,2017-08-10,2017-06-30,0001140361-17-030958
ATI,ALLEGHENY TECHNOLOGY INC USD0.10 Common Stock,01741R102,204000.0,12000,0.009089592639212236,2017-08-10,2017-06-30,0001140361-17-030958
TMO,THERMO FISHER SCIENTIFIC INC USD1 Common Stock,883556102,202000.0,1155,0.009000478985886625,2017-08-10,2017-06-30,0001140361-17-030958
ADP,AUTO DATA PROCESS USD0.10 Common Stock,053015103,202000.0,1970,0.009000478985886625,2017-08-10,2017-06-30,0001140361-17-030958
N/A,ENCANA CORP NPV Common Stock,292505104,201000.0,22900,0.00895592215922382,2017-08-10,2017-06-30,0001140361-17-030958
WPM,WHEATON PRECIOUS METALS CORP NPV Common Stock,962879102,201000.0,10130,0.00895592215922382,2017-08-10,2017-06-30,0001140361-17-030958
MSON,MISONIX INC USD0.01 Common Stock,604871103,187000.0,19600,0.008332126585944549,2017-08-10,2017-06-30,0001140361-17-030958
N/A,CARA THERAPEUTICS INC USD0.001 Common Stock,140755109,185000.0,12000,0.008243012932618938,2017-08-10,2017-06-30,0001140361-17-030958
N/A,OCH-ZIFF CAPITAL MGMT GROUP LP NPV Cls A Common Stock,67551U105,177000.0,69176,0.007886558319316499,2017-08-10,2017-06-30,0001140361-17-030958
N/A,NOVADAQ TECHNOLOGIES INC NPV Common Stock,66987G102,172000.0,14700,0.007663774186002472,2017-08-10,2017-06-30,0001140361-17-030958
N/A,POWERSHARES ETF Preferred Portfolio,73936T565,166000.0,11000,0.007396433226025643,2017-08-10,2017-06-30,0001140361-17-030958
YRI,YAMANA GOLD INC NPV Common Stock (CAD),98462Y100,161000.0,66653,0.007173649092711617,2017-08-10,2017-06-30,0001140361-17-030958
PETXEUR,ARATANA THERAPEUTICS INC US$0.001 Common Stock,03874P101,137000.0,18900,0.006104285252804296,2017-08-10,2017-06-30,0001140361-17-030958
DL,CHINA DISTANCE EDUCATION HLDGS Spons ADR Each Rep 4 Ord Shs,16944W104,134000.0,15000,0.00597061477281588,2017-08-10,2017-06-30,0001140361-17-030958
N/A,BANK OF AMERICA CORP C/Wts 16/01/19 (To Pur Com),060505146,126000.0,10500,0.00561416015951344,2017-08-10,2017-06-30,0001140361-17-030958
F,FORD MOTOR CO USD0.01 Common Stock,345370860,124000.0,11100,0.005525046506187829,2017-08-10,2017-06-30,0001140361-17-030958
NGD,NEW GOLD INC NPV Common Stock,644535106,108000.0,34110,0.004812137279582948,2017-08-10,2017-06-30,0001140361-17-030958
SAN,BANCO SANTANDER SA ADR Rep 1 EUR0.50 Ord Shares,05964H105,90000.0,13525,0.0040101143996524565,2017-08-10,2017-06-30,0001140361-17-030958
N/A,ENDOLOGIX INC USD0.001 Common Stock,29266S106,85000.0,17400,0.003787330266338431,2017-08-10,2017-06-30,0001140361-17-030958
N/A,KLONDEX MINES LTD NPV Common Stock,498696103,84000.0,25000,0.0037427734396756262,2017-08-10,2017-06-30,0001140361-17-030958
A4E1,ALMADEN MINERALS LTD NPV Cls B Common Stock,020283305,76000.0,60000,0.0033863188263731857,2017-08-10,2017-06-30,0001140361-17-030958
CHKEUR,CHESAPEAKE ENERGY USD0.01 Common Stock,165167107,71000.0,14300,0.00316353469305916,2017-08-10,2017-06-30,0001140361-17-030958
FITEUR,FITBIT INC USD0.0001 Cls A Common Stock,33812L102,55000.0,10365,0.0024506254664542794,2017-08-10,2017-06-30,0001140361-17-030958
N/A,FORTUNA SILVER MINING NPV Common Stock,349915108,54000.0,11000,0.002406068639791474,2017-08-10,2017-06-30,0001140361-17-030958
HMY,HARMONY GOLD MINING CO Spon ADR Rep 1 Ord ZAR0.50,413216300,44000.0,26500,0.0019605003731634233,2017-08-10,2017-06-30,0001140361-17-030958
GTE2EUR,GRAN TIERRA ENERGY USD0.001 Common Stock,38500T101,42000.0,18849,0.0018713867198378131,2017-08-10,2017-06-30,0001140361-17-030958
SVM,SILVERCORP METALS INC          NPV Common Stock,82835P103,40000.0,12500,0.001782273066512203,2017-08-10,2017-06-30,0001140361-17-030958
PHPN,GALECTIN THERAPEUTICS INC USD0.001 Common Stock,363225202,40000.0,16400,0.001782273066512203,2017-08-10,2017-06-30,0001140361-17-030958
NNVCUSD,NANOVIRICIDES INC USD0.001 Common Stock (PRS),630087203,38000.0,28250,0.0016931594131865929,2017-08-10,2017-06-30,0001140361-17-030958
N/A,BANRO CORP NPV Com Stock (Post Rev Split),066800806,34000.0,47500,0.0015149321065353724,2017-08-10,2017-06-30,0001140361-17-030958
N/A,ELDORADO GOLD CORP NPV Common Stock,284902103,34000.0,12651,0.0015149321065353724,2017-08-10,2017-06-30,0001140361-17-030958
URE,UR ENERGY INC NPV Common Stock,91688R108,24000.0,38000,0.001069363839907322,2017-08-10,2017-06-30,0001140361-17-030958
NXE,NEXGEN ENERGY LTD NPV Common Stock,65340P106,23000.0,10500,0.0010248070132445168,2017-08-10,2017-06-30,0001140361-17-030958
N/A,GOLDEN STAR RESOURCES NPV Common Stock,38119T104,20000.0,30000,0.0008911365332561015,2017-08-10,2017-06-30,0001140361-17-030958
UUUU,ENERGY FUELS INC NPV Common Stock,292671708,20000.0,12500,0.0008911365332561015,2017-08-10,2017-06-30,0001140361-17-030958
N/A,INOTEK PHARMACEUTICALS CORP USD0.01 Common Stock,45780V102,19000.0,10000,0.0008465797065932964,2017-08-10,2017-06-30,0001140361-17-030958
DNN,DENISON MINES INC NPV Common Stock,248356107,18000.0,40000,0.0008020228799304914,2017-08-10,2017-06-30,0001140361-17-030958
N/A,FORWARD INDUSTRIES INC USD0.01 Common Stock,349862300,16000.0,15000,0.0007129092266048812,2017-08-10,2017-06-30,0001140361-17-030958
