ticker,nameOfIssuer,cusip,value,shares,allocation_percent,filingDate,reportDate,accessionNumber
V,VISA INC USD0.0001 Common Stock,92826C839,444777000.0,2100679,5.6954551298369696,2021-05-14,2021-03-31,0001567619-21-009929
MSFT,MICROSOFT CORP USD 0.00000625 Common Stock,594918104,419319000.0,1778507,5.36946053772589,2021-05-14,2021-03-31,0001567619-21-009929
AMZN,AMAZON COM INC USD0.01 Common Stock,023135106,368415000.0,119071,4.717625015814413,2021-05-14,2021-03-31,0001567619-21-009929
GOOGL,ALPHABET INC USD0.001 Cls A Common Stock,02079K305,243049000.0,117841,3.1122892457383036,2021-05-14,2021-03-31,0001567619-21-009929
PYPL,PAYPAL HOLDINGS INC USD0.0001 Common Stock,70450Y103,192729000.0,793647,2.4679319562799993,2021-05-14,2021-03-31,0001567619-21-009929
EL,ESTEE LAUDER COS USD0.01 Class A Common Stock,518439104,190971000.0,656596,2.4454204277651406,2021-05-14,2021-03-31,0001567619-21-009929
AAPL,APPLE INC NPV Common Stock,037833100,190180000.0,1556941,2.4352915204527097,2021-05-14,2021-03-31,0001567619-21-009929
ABT,ABBOTT LABORATORIES NPV Common Stock,002824100,171127000.0,1427962,2.1913141866679506,2021-05-14,2021-03-31,0001567619-21-009929
ADBE,ADOBE INC NPV Common Stock,00724F101,157886000.0,332133,2.021760632023328,2021-05-14,2021-03-31,0001567619-21-009929
KO,COCA-COLA CO USD0.25 Common Stock,191216100,138826000.0,2633779,1.7776936618906714,2021-05-14,2021-03-31,0001567619-21-009929
MA,MASTERCARD INC USD0.0001 Class A Common Stock,57636Q104,135499000.0,380562,1.735090786254189,2021-05-14,2021-03-31,0001567619-21-009929
GOOG,ALPHABET INC USD0.001 Cls C Common Stock,02079K107,128296000.0,62020,1.6428549842675406,2021-05-14,2021-03-31,0001567619-21-009929
NKE,NIKE INC NPV Cls B Common Stock,654106103,127686000.0,960839,1.6350438168078911,2021-05-14,2021-03-31,0001567619-21-009929
BRK/B,BERKSHIRE HATHAWAY INC USD0.0033 Cls B Common Stock,084670702,109458000.0,428459,1.4016307668824939,2021-05-14,2021-03-31,0001567619-21-009929
APH,AMPHENOL CORP USD0.001 Cls A Common Stock,032095101,104058000.0,1577350,1.3324827270757602,2021-05-14,2021-03-31,0001567619-21-009929
NVDA,NVIDIA CORP USD0.001 Common Stock,67066G104,102892000.0,192706,1.3175518725545283,2021-05-14,2021-03-31,0001567619-21-009929
FRCB,FIRST REP BANK SAN FRANCISCO USD0.01 Common Stock,33616C100,101036000.0,605912,1.2937854351691027,2021-05-14,2021-03-31,0001567619-21-009929
MTCH,MATCH GROUP INC NEW USD0.001 Common Stock,57667L107,99846000.0,726788,1.2785472560265079,2021-05-14,2021-03-31,0001567619-21-009929
INTU,INTUIT INC USD0.01 Common Stock,461202103,96729000.0,252516,1.2386334708269542,2021-05-14,2021-03-31,0001567619-21-009929
FRPT,FRESHPET INC USD0.001 Common Stock,358039105,94524000.0,595200,1.2103980212392045,2021-05-14,2021-03-31,0001567619-21-009929
COST,COSTCO CORP NPV Common Stock,22160K105,94475000.0,267981,1.2097705668039214,2021-05-14,2021-03-31,0001567619-21-009929
SPGI,S&P GLOBAL INC USD1 Common Stock,78409V104,92639000.0,262529,1.186260233269632,2021-05-14,2021-03-31,0001567619-21-009929
JPM,JP MORGAN CHASE & CO USD1 Common Stock,46625H100,85369000.0,560789,1.0931664833816772,2021-05-14,2021-03-31,0001567619-21-009929
AFW,ALIGN TECHNOLOGY INC USD0.0001 Common Stock,016255101,84862000.0,156707,1.0866742507553782,2021-05-14,2021-03-31,0001567619-21-009929
GPN,GLOBAL PAYMENTS INC NPV Common Stock,37940X102,84426000.0,418822,1.0810911868006126,2021-05-14,2021-03-31,0001567619-21-009929
ADSK,AUTODESK INC NPV Common Stock,052769106,83011000.0,299517,1.0629718393327368,2021-05-14,2021-03-31,0001567619-21-009929
NFLX,NETFLIX COM INC USD0.001 Common Stock,64110L106,82469000.0,158089,1.0560314249669498,2021-05-14,2021-03-31,0001567619-21-009929
JNJ,JOHNSON & JOHNSON USD1 Common Stock,478160104,79697000.0,484920,1.0205354311994932,2021-05-14,2021-03-31,0001567619-21-009929
SHOP,SHOPIFY INC NPV Sub-Vtg Cls A Common Stock,82509L107,79647000.0,71981,1.019895171571653,2021-05-14,2021-03-31,0001567619-21-009929
SIVBEUR,SVB FINANCIAL GROUP USD0.001 Common Stock,78486Q101,79551000.0,161145,1.0186658730862,2021-05-14,2021-03-31,0001567619-21-009929
JKHY,JACK HENRY & ASSOCIATES INC USD0.01 Common Stock,426281101,79104000.0,521380,1.0129419520133092,2021-05-14,2021-03-31,0001567619-21-009929
JBHT,HUNT (JB) TRANSPORT SVCS INC USD0.01 Common Stock,445658107,78438000.0,466700,1.0044136937704788,2021-05-14,2021-03-31,0001567619-21-009929
TJX,TJX COMPANIES INC NPV Common Stock,872540109,76176000.0,1151570,0.9754483482069913,2021-05-14,2021-03-31,0001567619-21-009929
IDXX,IDEXX LABORATORIES INC USD0.10 Common Stock,45168D104,76164000.0,155655,0.9752946858963097,2021-05-14,2021-03-31,0001567619-21-009929
MLM,MARTIN MARIETTA MATERIALS USD0.01 Common Stock,573284106,74821000.0,222800,0.9580973122925239,2021-05-14,2021-03-31,0001567619-21-009929
UBER,UBER TECHNOLOGIES USD0.00001 Common Stock,90353T100,71300000.0,1308011,0.9130102293000221,2021-05-14,2021-03-31,0001567619-21-009929
RNG,RINGCENTRAL INC USD0.0001 Cls A Common Stock,76680R206,70985000.0,238300,0.9089765936446293,2021-05-14,2021-03-31,0001567619-21-009929
HON,HONEYWELL INTERNATIONAL INC USD1 Common Stock,438516106,69897000.0,322003,0.8950445441428281,2021-05-14,2021-03-31,0001567619-21-009929
CSGP,COSTAR GROUP INC USD0.01 Common Stock,22160N109,68135000.0,82900,0.8724817948577421,2021-05-14,2021-03-31,0001567619-21-009929
ROL,ROLLINS INC USD1 Common Stock,775711104,67990000.0,1975300,0.8706250419370056,2021-05-14,2021-03-31,0001567619-21-009929
BAC,VERIZON COMMS INC NPV Common Stock,92343V104,66191000.0,1138278,0.8475885005273178,2021-05-14,2021-03-31,0001567619-21-009929
SHW,SHERWIN-WILLIAMS USD1 Common Stock,824348106,65048000.0,88140,0.8329521654348925,2021-05-14,2021-03-31,0001567619-21-009929
WCN,WASTE CONNECTIONS INC NPV Common Stock,94106B101,63228000.0,585549,0.8096467149815119,2021-05-14,2021-03-31,0001567619-21-009929
C,CITIGROUP INC USD0.01 Common Stock,172967424,61302000.0,842633,0.7849839141171102,2021-05-14,2021-03-31,0001567619-21-009929
CME,CME GROUP INC USD0.01 Cls A Common Stock,12572Q105,60854000.0,297969,0.7792471878516626,2021-05-14,2021-03-31,0001567619-21-009929
CIT,CINTAS CORP NPV Common Stock,172908105,60842000.0,178260,0.7790935255409809,2021-05-14,2021-03-31,0001567619-21-009929
LW,LAMB WESTON HOLDINGS USD1 Common Stock,513272104,58621000.0,756600,0.7506531928723226,2021-05-14,2021-03-31,0001567619-21-009929
DIS,WALT DISNEY (HLDGS) CO USD0.1 Common Stock,254687106,55865000.0,302760,0.7153620821857746,2021-05-14,2021-03-31,0001567619-21-009929
BR,BROADRIDGE FINANCIAL SOLUTIONS USD0.01 Common Stock,11133T103,55575000.0,363000,0.7116485763443019,2021-05-14,2021-03-31,0001567619-21-009929
CHGG,CHEGG INC USD0.001 Common Stock,163092109,53323000.0,622500,0.6828112827063826,2021-05-14,2021-03-31,0001567619-21-009929
TMO,THERMO FISHER SCIENTIFIC INC USD1 Common Stock,883556102,49216000.0,107841,0.6302203568755944,2021-05-14,2021-03-31,0001567619-21-009929
META,FACEBOOK INC USD0.000006 Cls A Common Stock,30303M102,44444000.0,150897,0.5691139779945327,2021-05-14,2021-03-31,0001567619-21-009929
PG,PROCTER & GAMBLE CO NPV Common Stock,742718109,41181000.0,304073,0.527330634681686,2021-05-14,2021-03-31,0001567619-21-009929
SPY,SPDR SERIES TRUST S&P 500 ETF Trust,78462F103,39929000.0,100746,0.5112985336005692,2021-05-14,2021-03-31,0001567619-21-009929
FIS,FIDELITY NATIONAL INFORMATION USD0.01 Common Stock,31620M106,38834000.0,276179,0.49727684775087033,2021-05-14,2021-03-31,0001567619-21-009929
BDX,BECTON DICKINSON & CO NPV Common Stock,075887109,38159000.0,156934,0.4886333427750286,2021-05-14,2021-03-31,0001567619-21-009929
VRSK,VERISK ANALYTICS INC USD0.001 Common Stock,92345Y106,33829000.0,191461,0.4331868590040736,2021-05-14,2021-03-31,0001567619-21-009929
ATVIEUR,ACTIVISION BLIZZARD INC USD0.000001 Common Stock,00507V109,33624000.0,361545,0.43056179452992904,2021-05-14,2021-03-31,0001567619-21-009929
LMT,LOCKHEED MARTIN CO USD1 Common Stock,539830109,32571000.0,88150,0.41707792676761596,2021-05-14,2021-03-31,0001567619-21-009929
BABA,ALIBABA GROUP HOLDINGS LTD Spon ADS Each Rep 1 Ord,01609W102,32324000.0,142565,0.41391504420608577,2021-05-14,2021-03-31,0001567619-21-009929
GDDY,GODADDY INC USD0.001 Cls A Common Stock,380237107,31856000.0,410406,0.4079222140895022,2021-05-14,2021-03-31,0001567619-21-009929
XYL,XYLEM INC USD0.01 Common Stock,98419M100,31571000.0,300165,0.4042727342108134,2021-05-14,2021-03-31,0001567619-21-009929
CLX,CLOROX CO USD1 Common Stock,189054109,31025000.0,160849,0.39728109907479925,2021-05-14,2021-03-31,0001567619-21-009929
CDNS,CADENCE DESIGN SYSTEMS INC USD0.01 Common Stock,127387108,30698000.0,224091,0.39309380110872477,2021-05-14,2021-03-31,0001567619-21-009929
GLD,SPDR GOLD TRUST NPV Shares ETF,78463V107,29604000.0,185074,0.3790849204515828,2021-05-14,2021-03-31,0001567619-21-009929
BKNG,BOOKING HOLDINGS INC USD0.008 Common Stock,09857L108,29498000.0,12661,0.37772757004056173,2021-05-14,2021-03-31,0001567619-21-009929
DFSEUR,DISCOVER FINANCIAL SERVICES USD0.01 Common Stock,254709108,29244000.0,307859,0.3744750511311339,2021-05-14,2021-03-31,0001567619-21-009929
AKX,ANSYS INC USD0.01 Common Stock,03662Q105,29002000.0,85410,0.3713761945323877,2021-05-14,2021-03-31,0001567619-21-009929
YUMC,YUM CHINA HOLDINGS INC USD0.01 Common Stock,98850P109,28910000.0,488257,0.3701981168171618,2021-05-14,2021-03-31,0001567619-21-009929
USB,US BANCORP DEL USD0.01 Common Stock,902973304,28668000.0,518311,0.3670992602184156,2021-05-14,2021-03-31,0001567619-21-009929
BAC,BANK OF AMERICA CORP NPV Common Stock,060505104,28476000.0,735998,0.36464066324750954,2021-05-14,2021-03-31,0001567619-21-009929
DXCM,DEXCOM INC USD0.001 Common Stock,252131107,28309000.0,78769,0.36250219609052353,2021-05-14,2021-03-31,0001567619-21-009929
MO,ALTRIA GROUP INC USD0.333333 Common Stock,02209S103,28201000.0,551240,0.36111923529438883,2021-05-14,2021-03-31,0001567619-21-009929
WEC,WEC ENERGY GROUP INC USD0.01 Common Stock,92939U106,27414000.0,292913,0.3510415487521852,2021-05-14,2021-03-31,0001567619-21-009929
EW,EDWARDS LIFESCIENCES CORP USD1 Common Stock,28176E108,26481000.0,316605,0.33909430409668845,2021-05-14,2021-03-31,0001567619-21-009929
PHM,PULTE GROUP INC USD0.01 Common Stock,745867101,26328000.0,502061,0.33713510963549764,2021-05-14,2021-03-31,0001567619-21-009929
QCOM,QUALCOMM INC USD0.001 Common Stock,747525103,26183000.0,197477,0.33527835671476125,2021-05-14,2021-03-31,0001567619-21-009929
ECL,ECOLAB INC USD1 Common Stock,278865100,25451000.0,118891,0.3259049557631818,2021-05-14,2021-03-31,0001567619-21-009929
AMGN,AMGEN INC USD0.0001 Common Stock,031162100,24877000.0,99983,0.3185547752355771,2021-05-14,2021-03-31,0001567619-21-009929
PEP,PEPSICO INC USD0.016666 Cap,713448108,24549000.0,173551,0.3143546720769459,2021-05-14,2021-03-31,0001567619-21-009929
ULTA,ULTA BEAUTY INC USD0.01 Common Stock,90384S303,23961000.0,77501,0.30682521885354597,2021-05-14,2021-03-31,0001567619-21-009929
MDLZ,MONDELEZ INTL INC USD0.01 Common Stock,609207105,23389000.0,399600,0.2995006487110549,2021-05-14,2021-03-31,0001567619-21-009929
PFE,PFIZER INC USD0.05 Common Stock,717081103,22459000.0,619908,0.28759181963322855,2021-05-14,2021-03-31,0001567619-21-009929
NTRS,NORTHERN TRUST CORP USD1.666 Common Stock,665859104,22009000.0,209394,0.2818294829826674,2021-05-14,2021-03-31,0001567619-21-009929
SLB,SCHLUMBERGER LTD USD0.01 Common Stock,806857108,21187000.0,779219,0.2713036147009757,2021-05-14,2021-03-31,0001567619-21-009929
HD,HOME DEPOT INC USD0.05 Common Stock,437076102,21027000.0,68886,0.26925478389188734,2021-05-14,2021-03-31,0001567619-21-009929
TREX,TREX COMPANY INC USD0.01 Common Stock,89531P105,20984000.0,229229,0.2687041606119448,2021-05-14,2021-03-31,0001567619-21-009929
CL,COLGATE-PALMOLIVE CO NPV Common Stock,194162103,20873000.0,264791,0.26728278423813967,2021-05-14,2021-03-31,0001567619-21-009929
EQIX,EQUINIX INC USD0.001 New Common Stock,29444U700,20778000.0,30575,0.2660662909452435,2021-05-14,2021-03-31,0001567619-21-009929
GNRC,GENERAC HOLDINGS INC USD0.01 Common Stock,368736104,18885000.0,57672,0.24182606143521623,2021-05-14,2021-03-31,0001567619-21-009929
ZTS,ZOETIS INC USD0.01 Cls A Common Stock,98978V103,17645000.0,112049,0.22594762266478105,2021-05-14,2021-03-31,0001567619-21-009929
PTC,PTC INC USD0.01 Common Stock,69370C100,16303000.0,118437,0.20876305425355204,2021-05-14,2021-03-31,0001567619-21-009929
BCC,BOISE CASCADE COMPANY USD0.01 Common Stock,09739D100,16257000.0,271714,0.2081740153959391,2021-05-14,2021-03-31,0001567619-21-009929
T,AT&T INC USD1 Common Stock,00206R102,15451000.0,510428,0.19785303019515627,2021-05-14,2021-03-31,0001567619-21-009929
INTC,INTEL CORP USD0.001 Common Stock,458140100,15236000.0,238056,0.1950999137954437,2021-05-14,2021-03-31,0001567619-21-009929
VWO,VANGUARD INTL EQUITY FTSE Emerging Markets Idx ETF,922042858,15166000.0,291372,0.19420355031646752,2021-05-14,2021-03-31,0001567619-21-009929
LLY,LILLY (ELI) & CO NPV Common Stock,532457108,15079000.0,80716,0.19308949856402569,2021-05-14,2021-03-31,0001567619-21-009929
N/A,COOPER COS INC USD0.10 Common Stock,216648402,14938000.0,38891,0.19128396641351655,2021-05-14,2021-03-31,0001567619-21-009929
VOO,VANGUARD INDEX FUNDS S&P 500 ETF (USD),922908363,14763000.0,40524,0.1890430577160761,2021-05-14,2021-03-31,0001567619-21-009929
AJG,GALLAGHER AJ & CO USD1 Common Stock,363576109,14757000.0,118270,0.18896622656073528,2021-05-14,2021-03-31,0001567619-21-009929
GE,GENERAL ELECTRIC CORP USD0.06 Common Stock,369604103,14516000.0,1105534,0.18588017515454586,2021-05-14,2021-03-31,0001567619-21-009929
RY,ROYAL BANK OF CANADA NPV Common Stock,780087102,14505000.0,157342,0.18573931803642105,2021-05-14,2021-03-31,0001567619-21-009929
ISRG,INTUITIVE SURGICAL INC USD0.001 Common Stock,46120E602,13848000.0,18740,0.17732630652660175,2021-05-14,2021-03-31,0001567619-21-009929
OTIS,OTIS WORLDWIDE CORP USD0.01 Common Stock (WI),68902V107,13488000.0,197055,0.17271643720615285,2021-05-14,2021-03-31,0001567619-21-009929
MMC,MARSH & MCLENNAN CO INC USD1 Common Stock,571748102,13254000.0,108816,0.16972002214786105,2021-05-14,2021-03-31,0001567619-21-009929
TSLA,TESLA INC USD0.001 Common Stock,88160R101,12468000.0,18666,0.15965514079821422,2021-05-14,2021-03-31,0001567619-21-009929
AXON,AXON ENTERPRISE INC USD0.00001 Common Stock,05464C101,12346000.0,86688,0.15809290730628434,2021-05-14,2021-03-31,0001567619-21-009929
TSM,TAIWAN SEMICONDUCTORS MAN LTD ADS Rep 5 TWD10 Ord Share,874039100,11671000.0,98672,0.1494494023304426,2021-05-14,2021-03-31,0001567619-21-009929
ABBV,ABBVIE INC USD0.01 Common Stock,00287Y109,11342000.0,104804,0.14523649397925456,2021-05-14,2021-03-31,0001567619-21-009929
SYY,SYSCO CORP NPV Common Stock,871829107,10978000.0,139427,0.14057540388857842,2021-05-14,2021-03-31,0001567619-21-009929
CVX,CHEVRON CORP USD0.75 Common Stock,166764100,10915000.0,104161,0.13976867675749988,2021-05-14,2021-03-31,0001567619-21-009929
HASI,HANNON ARMSTRONG SUST INFRA USD0.01 Common Stock,41068X100,10781000.0,192174,0.13805278095488832,2021-05-14,2021-03-31,0001567619-21-009929
XOM,EXXON MOBIL CORP NPV Common Stock,30231G102,10252000.0,183621,0.13127883409233979,2021-05-14,2021-03-31,0001567619-21-009929
RTX,RAYTHEON TECHNOLOGIES CORP USD1.00 Common Stock,75513E101,10000000.0,129416,0.12805192556802553,2021-05-14,2021-03-31,0001567619-21-009929
EWJ,ISHARES INC MSCI Japan New ETF (P/R Split),46434G822,9775000.0,142661,0.12517075724274496,2021-05-14,2021-03-31,0001567619-21-009929
BNS,BANK OF NOVA SCOTIA NPV Common Stock,064149107,9597000.0,153431,0.1228914329676341,2021-05-14,2021-03-31,0001567619-21-009929
GH,GUARDANT HEALTH INC USD0.00001 Common Stock,40131M109,9345000.0,61218,0.11966452444331986,2021-05-14,2021-03-31,0001567619-21-009929
BND,VANGUARD BOND INDEX FUND Total Bond Market ETF,921937835,9239000.0,109056,0.1183071740322988,2021-05-14,2021-03-31,0001567619-21-009929
VPL,VANGUARD INTL EQUITY MSCI Pacific ETF,922042866,9027000.0,110541,0.11559247321025665,2021-05-14,2021-03-31,0001567619-21-009929
N/A,BROOKFIELD ASSET MGMT NPV Cls A Voting Shares,112585104,8956000.0,201353,0.11468330453872366,2021-05-14,2021-03-31,0001567619-21-009929
BSV,VANGUARD BOND INDEX FUND Short Term Bond ETF,921937827,8339000.0,101459,0.1067825007311765,2021-05-14,2021-03-31,0001567619-21-009929
NVS,NOVARTIS AG ADR Rep 1 CHF0.5 (Regd) Shares,66987V109,8245000.0,96458,0.10557881263083704,2021-05-14,2021-03-31,0001567619-21-009929
BYND,BEYOND MEAT INC USD0.0001 Common Stock,08862E109,8166000.0,62757,0.10456720241884966,2021-05-14,2021-03-31,0001567619-21-009929
TIP,ISHARES TRUST Tips Bond ETF,464287176,8163000.0,65044,0.10452878684117925,2021-05-14,2021-03-31,0001567619-21-009929
EEM,ISHARES TRUST MSCI Emerging Markets ETF,464287234,8125000.0,152323,0.10404218952402074,2021-05-14,2021-03-31,0001567619-21-009929
EA,ELECTRONIC ARTS INC USD0.01 Common Stock,285512109,8012000.0,59184,0.10259520276510208,2021-05-14,2021-03-31,0001567619-21-009929
UNP,UNION PACIFIC CORP USD2.50 Common Stock,907818108,7885000.0,35774,0.10096894331038814,2021-05-14,2021-03-31,0001567619-21-009929
IXN,ISHARES TRUST Global Technology ETF,464287291,7867000.0,25566,0.10073844984436568,2021-05-14,2021-03-31,0001567619-21-009929
EWU,ISHARES TRUST MSCI UK New ETF (Post Cons),46435G334,7689000.0,245584,0.09845912556925485,2021-05-14,2021-03-31,0001567619-21-009929
NEE,NEXTERA ENERGY INC USD0.01 Common Stock,65339F101,7450000.0,98534,0.09539868454817903,2021-05-14,2021-03-31,0001567619-21-009929
PICB,INVESCO EXCHANGE TRADING Intl Corp Bond ETF,46138E636,7327000.0,255863,0.09382364586369231,2021-05-14,2021-03-31,0001567619-21-009929
DG,DOLLAR GENERAL CORP USD0.875 Common Stock,256677105,7162000.0,35349,0.0917107890918199,2021-05-14,2021-03-31,0001567619-21-009929
BF/B,BROWN-FORMAN CORP USD0.15 B Common Stock,115637209,7043000.0,102113,0.09018697117756039,2021-05-14,2021-03-31,0001567619-21-009929
GS,GOLDMAN SACHS GROUP USD0.01 Common Stock,38141G104,6734000.0,20592,0.0862301666775084,2021-05-14,2021-03-31,0001567619-21-009929
VT,VANGUARD INTL EQUITY Total World Stock Market ETF,922042742,6275000.0,64502,0.08035258329393602,2021-05-14,2021-03-31,0001567619-21-009929
TTWO,TAKE TWO INTERACTIVE INC USD0.01 Common Stock,874054109,6239000.0,35310,0.07989159636189114,2021-05-14,2021-03-31,0001567619-21-009929
CM,CANADIAN IMPERIAL BANK NPV Common Stock,136069101,6016000.0,61454,0.07703603842172417,2021-05-14,2021-03-31,0001567619-21-009929
DVY,ISHARES TRUST Select Dividend ETF,464287168,5949000.0,52135,0.07617809052041839,2021-05-14,2021-03-31,0001567619-21-009929
MCD,MCDONALD'S CORP USD0.01 Common Stock,580135101,5811000.0,25924,0.07441097394757965,2021-05-14,2021-03-31,0001567619-21-009929
ZBRA,ZEBRA TECHNOLOGIES USD0.01 Class A Common Stock,989207105,5674000.0,11695,0.07265666256729769,2021-05-14,2021-03-31,0001567619-21-009929
MRK,MERCK & CO INC USD0.50 Common Stock,58933Y105,5629000.0,73019,0.07208042890224158,2021-05-14,2021-03-31,0001567619-21-009929
EPP,ISHARES INC MSCI Pacific Ex Japan ETF,464286665,5602000.0,111532,0.07173468870320791,2021-05-14,2021-03-31,0001567619-21-009929
IWM,ISHARES TRUST Russell 2000 ETF,464287655,5299000.0,23986,0.06785471535849673,2021-05-14,2021-03-31,0001567619-21-009929
RJAUSD,SWEDISH EXPORT CREDIT Lkd Rog Intl Com Idx - Agri,870297603,5095000.0,732524,0.06524245607690901,2021-05-14,2021-03-31,0001567619-21-009929
ABX,BARRICK GOLD CORP NPV Common Stock (USD/ CAD),067901108,5086000.0,256583,0.06512720934389779,2021-05-14,2021-03-31,0001567619-21-009929
EMR,EMERSON ELECTRIC CO USD0.50 Common Stock,291011104,5062000.0,56107,0.06481988472253453,2021-05-14,2021-03-31,0001567619-21-009929
ZBH,ZIMMER BIOMET HOLDINGS INC USD0.01 Common Stock,98956P102,4831000.0,30177,0.06186188524191314,2021-05-14,2021-03-31,0001567619-21-009929
DWD,MORGAN STANLEY USD0.01 Common Stock,617446448,4745000.0,61098,0.06076063868202812,2021-05-14,2021-03-31,0001567619-21-009929
NEM,NEWMONT CORP USD1.60 Common Stock,651639106,4662000.0,77355,0.059697807699813504,2021-05-14,2021-03-31,0001567619-21-009929
SBUX,STARBUCKS CORP USD0.001 Common Stock,855244109,4593000.0,42032,0.05881424941339413,2021-05-14,2021-03-31,0001567619-21-009929
SKYY,FIRST TRUST Cloud Computing ETF,33734X192,4517000.0,47174,0.05784105477907713,2021-05-14,2021-03-31,0001567619-21-009929
GII,SPDR INDEX SHARES S&P Gbl Infrastructure ETF,78463X855,4407000.0,85664,0.05643248359782885,2021-05-14,2021-03-31,0001567619-21-009929
FMC,FMC CORP USD0.10 Common Stock,302491303,4120000.0,37248,0.05275739333402653,2021-05-14,2021-03-31,0001567619-21-009929
GWPH,GW PHARMACEUTICALS PLC ADS Each Rep 12 Ord Shares,36197T103,3954000.0,18231,0.0506317313695973,2021-05-14,2021-03-31,0001567619-21-009929
GIS,GENERAL MILLS INC USD0.10 Common Stock,370334104,3908000.0,63731,0.05004269251198438,2021-05-14,2021-03-31,0001567619-21-009929
TRUP,TRUPANION INC USD0.00001 Common Stock,898202106,3811000.0,50008,0.048800588833974534,2021-05-14,2021-03-31,0001567619-21-009929
PM,PHILIP MORRIS INTL INC NPV Common Stock,718172109,3784000.0,42642,0.04845484863494086,2021-05-14,2021-03-31,0001567619-21-009929
IBM,IBM CORP USD0.20 Common Stock,459200101,3778000.0,28349,0.04837801747960005,2021-05-14,2021-03-31,0001567619-21-009929
ILMN,ILLUMINA INC USD0.01 Common Stock,452327109,3765000.0,9803,0.048211549976361616,2021-05-14,2021-03-31,0001567619-21-009929
BCE,BCE INC NPV Common Stock,05534B760,3729000.0,82605,0.04775056304431672,2021-05-14,2021-03-31,0001567619-21-009929
CCK,CROWN HOLDINGS INC USD5 Common Stock,228368106,3691000.0,38035,0.04726396572715823,2021-05-14,2021-03-31,0001567619-21-009929
TD,TORONTO-DOMINION BANK NPV Common Stock,891160509,3555000.0,54519,0.04552245953943308,2021-05-14,2021-03-31,0001567619-21-009929
BMO,BANK OF MONTREAL NPV Common Stock,063671101,3468000.0,38915,0.04440840778699126,2021-05-14,2021-03-31,0001567619-21-009929
TRI4EUR,THOMSON REUTERS CORP NPV Com Stk (Post Rev Split),884903709,3365000.0,38420,0.043089472953640594,2021-05-14,2021-03-31,0001567619-21-009929
TRMB,TRIMBLE INC NPV Common Stock,896239100,3361000.0,43200,0.04303825218341338,2021-05-14,2021-03-31,0001567619-21-009929
IBND,SPDR SERIES TRUST Barclays Cap Intl Corp Bd ETF,78464A151,3339000.0,93183,0.04275653794716373,2021-05-14,2021-03-31,0001567619-21-009929
DE,DEERE & CO USD1 Common Stock,244199105,3335000.0,8913,0.042705317176936514,2021-05-14,2021-03-31,0001567619-21-009929
UTF,COHEN & STEERS INFRASTRUCTURE USD0.001 Common Stock,19248A109,3313000.0,118626,0.04242360294068686,2021-05-14,2021-03-31,0001567619-21-009929
KMB,KIMBERLEY CLARK CORP NPV Common Stock,494368103,3246000.0,23346,0.04156565503938109,2021-05-14,2021-03-31,0001567619-21-009929
LFUS,LITTELFUSE INC USD0.01 Common Stock,537008104,3214000.0,12155,0.041155888877563405,2021-05-14,2021-03-31,0001567619-21-009929
BRK/A,BERKSHIRE HATHAWAY INC USD5 Class A Common Stock,084670108,3086000.0,8,0.03951682423029268,2021-05-14,2021-03-31,0001567619-21-009929
SKAA,SKECHER USA INC USD0.001 A Common Stock,830566105,3047000.0,73043,0.03901742172057738,2021-05-14,2021-03-31,0001567619-21-009929
MCHP,MICROCHIP TECHNOLOGY INC USD0.001 Common Stock,595017104,3038000.0,19574,0.03890217498756616,2021-05-14,2021-03-31,0001567619-21-009929
GLW,CORNING INC USD0.50 Common Stock,219350105,2939000.0,67558,0.037634460924442704,2021-05-14,2021-03-31,0001567619-21-009929
FEUZ,FIRST TRUST Eurozone AlphaDEX ETF,33737J505,2855000.0,64217,0.036558824749671294,2021-05-14,2021-03-31,0001567619-21-009929
BMI,BADGER METER INC USD1 Common Stock,056525108,2775000.0,29820,0.03553440934512709,2021-05-14,2021-03-31,0001567619-21-009929
BALL,BALL CORP NPV Common Stock,058498106,2712000.0,32008,0.034727682214048525,2021-05-14,2021-03-31,0001567619-21-009929
IOO,ISHARES TRUST Global 100 ETF,464287572,2611000.0,39556,0.03343435776581147,2021-05-14,2021-03-31,0001567619-21-009929
K,KELLOGG CO USD0.25 Common Stock,487836108,2604000.0,41145,0.03334472141791385,2021-05-14,2021-03-31,0001567619-21-009929
AEM,AGNICO EAGLE MINES LTD NPV Common Stock,008474108,2591000.0,44828,0.03317825391467542,2021-05-14,2021-03-31,0001567619-21-009929
MFC,MANULIFE FINANCIAL CORP NPV Common Stock,56501R106,2570000.0,119500,0.032909344870982564,2021-05-14,2021-03-31,0001567619-21-009929
DOV,DOVER CORP USD1 Common Stock,260003108,2457000.0,17914,0.031462358112063875,2021-05-14,2021-03-31,0001567619-21-009929
MCO,MOODYS CORP  USD0.01 Common Stock,615369105,2438000.0,8163,0.03121905945348463,2021-05-14,2021-03-31,0001567619-21-009929
YUM,YUM BRANDS INC  NPV Common Stock,988498101,2369000.0,21903,0.03033550116706525,2021-05-14,2021-03-31,0001567619-21-009929
MMM,3M COMPANY USD0.01 Common Stock,88579Y101,2327000.0,12077,0.029797683079679543,2021-05-14,2021-03-31,0001567619-21-009929
ADAP,ADAPTIMMUNE THERAPEUTICS PLC Spon ADS Each Rep 6 Ord Shs,00653A107,2299000.0,432921,0.029439137688089072,2021-05-14,2021-03-31,0001567619-21-009929
WPS,ISHARES TRUST Intl Developed Prop ETF,464288422,2270000.0,62670,0.029067787103941797,2021-05-14,2021-03-31,0001567619-21-009929
KHC,KRAFT HEINZ CO NPV Common Stock,500754106,2258000.0,56438,0.028914124793260165,2021-05-14,2021-03-31,0001567619-21-009929
VCIT,VANGUARD INVESTMENTS Inter-Term Corp Bd Index ETF,92206C870,2186000.0,23500,0.027992150929170383,2021-05-14,2021-03-31,0001567619-21-009929
IWP,ISHARES TRUST Russell Midcap Growth ETF,464287481,2107000.0,20640,0.02698054071718298,2021-05-14,2021-03-31,0001567619-21-009929
EZU,ISHARES INC MSCI EMU ETF,464286608,2044000.0,44013,0.026173813586104423,2021-05-14,2021-03-31,0001567619-21-009929
BLDP,BALLARD POWER SYSTEMS NPV Common Stock,058586108,1976000.0,81190,0.025303060492241847,2021-05-14,2021-03-31,0001567619-21-009929
SUSA,ISHARES TRUST MSCI USA ESG Select ETF,464288802,1976000.0,22500,0.025303060492241847,2021-05-14,2021-03-31,0001567619-21-009929
MTD,METTLER TOLEDO INTERNATIONAL USD0.01 Common Stock,592688105,1968000.0,1703,0.025200618951787424,2021-05-14,2021-03-31,0001567619-21-009929
