ticker,nameOfIssuer,cusip,value,shares,allocation_percent,filingDate,reportDate,accessionNumber
DNN,DENISON MINES INC NPV Common Stock,248356107,128000.0,117000,0.001639064647270727,2021-05-14,2021-03-31,0001567619-21-009929
KGC,KINROSS GOLD CORP NPV Common Shares,496902404,113000.0,17000,0.0014469867589186885,2021-05-14,2021-03-31,0001567619-21-009929
SVM,SILVERCORP METALS INC          NPV Common Stock,82835P103,104000.0,21000,0.0013317400259074657,2021-05-14,2021-03-31,0001567619-21-009929
VRNA,VERONA PHARMA Spon ADR Each Rep 8 Ord Shs,925050106,100000.0,11959,0.0012805192556802553,2021-05-14,2021-03-31,0001567619-21-009929
CX,CEMEX SAB DE CV Spon ADR Rep 10 CPO,151290889,91000.0,13084,0.0011652725226690324,2021-05-14,2021-03-31,0001567619-21-009929
AGI,ALAMOS GOLD INC NPV Class A Common Stock,011532108,91000.0,11611,0.0011652725226690324,2021-05-14,2021-03-31,0001567619-21-009929
SIL1EUR,SILVERCREST METALS INC NPV Common Stock,828363101,90000.0,11150,0.0011524673301122298,2021-05-14,2021-03-31,0001567619-21-009929
BB,BLACKBERRY LTD NPV Common Stock,09228F103,84000.0,10000,0.0010756361747714146,2021-05-14,2021-03-31,0001567619-21-009929
BTG,B2GOLD CORP NPV Common Stock,11777Q209,68000.0,15900,0.0008707530938625737,2021-05-14,2021-03-31,0001567619-21-009929
BHR,BRAEMAR HOTELS & RESORTS INC USD0.01 Common Stock,10482B101,67000.0,11000,0.0008579479013057712,2021-05-14,2021-03-31,0001567619-21-009929
URE,UR ENERGY INC NPV Common Stock,91688R108,59000.0,53000,0.0007555063608513507,2021-05-14,2021-03-31,0001567619-21-009929
ORLA,ORLA MINING LTD NPV Common Stock,68634K106,57000.0,15250,0.0007298959757377455,2021-05-14,2021-03-31,0001567619-21-009929
A4E1,ALMADEN MINERALS LTD NPV Cls B Common Stock,020283305,32000.0,60000,0.00040976616181768175,2021-05-14,2021-03-31,0001567619-21-009929
RIG 0.5 01/30/23,TRANSOCEAN INC 0.5 Notes 30/01/2023,893830BJ7,30000.0,40000,0.00038415577670407666,2021-05-14,2021-03-31,0001567619-21-009929
GPRCHF,GREAT PANTHER RESOURCES LTD NPV Common Stock,39115V101,16000.0,20000,0.00020488308090884088,2021-05-14,2021-03-31,0001567619-21-009929
VGZ,VISTA GOLD CORP NPV Common Stock,927926303,13000.0,12000,0.00016646750323843321,2021-05-14,2021-03-31,0001567619-21-009929
