ticker,nameOfIssuer,cusip,value,shares,allocation_percent,filingDate,reportDate,accessionNumber
IJH,ISHARES TRUST Core S&P Mid-Cap ETF,464287507,1925000.0,7394,0.024649995671844917,2021-05-14,2021-03-31,0001567619-21-009929
CAT,CATERPILLAR INC USD1 Common Stock,149123101,1891000.0,8157,0.024214619124913628,2021-05-14,2021-03-31,0001567619-21-009929
MCX,MCCORMICK & CO INC NPV Non Vtg Common Stock,579780206,1874000.0,21016,0.023996930851447988,2021-05-14,2021-03-31,0001567619-21-009929
FJP,FIRST TRUST Japan AlphaDEX ETF,33737J158,1848000.0,34586,0.02366399584497112,2021-05-14,2021-03-31,0001567619-21-009929
IGSB,ISHARES TRUST Barclays 1-3 Yr Credit Bond Fd,464288646,1819000.0,33263,0.023292645260823846,2021-05-14,2021-03-31,0001567619-21-009929
AME,AMETEK INC NPV Common Stock,031100100,1789000.0,14007,0.022908489484119766,2021-05-14,2021-03-31,0001567619-21-009929
N/A,CANADIAN PACIFIC RAILWAY LTD NPV Common Stock,13645T100,1736000.0,4545,0.022229814278609233,2021-05-14,2021-03-31,0001567619-21-009929
BMY,BRISTOL-MYERS SQUIBB CO NPV Common Stock,110122108,1731000.0,27426,0.02216578831582522,2021-05-14,2021-03-31,0001567619-21-009929
HPE,HEWLETT-PACKARD CORP USD0.01 Common Stock,42824C109,1726000.0,109632,0.022101762353041208,2021-05-14,2021-03-31,0001567619-21-009929
ABMDEUR,ABIOMED INC USD0.01 Common Stock,003654100,1721000.0,5400,0.022037736390257197,2021-05-14,2021-03-31,0001567619-21-009929
PLTR,PALANTIR TECHNOLOGIES INC USD0.001 Cls A Common Stock,69608A108,1711000.0,73470,0.021909684464689168,2021-05-14,2021-03-31,0001567619-21-009929
RMD,RESMED INC USD0.004 Common Stock,761152107,1707000.0,8800,0.02185846369446196,2021-05-14,2021-03-31,0001567619-21-009929
EXAS,EXACT SCIENCES CORP USD0.01 Common Stock,30063P105,1687000.0,12800,0.021602359843325907,2021-05-14,2021-03-31,0001567619-21-009929
CSL,CARLISLE COS INC USD1 Common Stock,142339100,1646000.0,10000,0.021077346948497003,2021-05-14,2021-03-31,0001567619-21-009929
WAT,WATERS CORP USD0.01 Common Stock,941848103,1645000.0,5788,0.021064541755940202,2021-05-14,2021-03-31,0001567619-21-009929
PH,PARKER-HANNIFIN CORP USD0.50 Common Stock,701094104,1624000.0,5150,0.02079563271224735,2021-05-14,2021-03-31,0001567619-21-009929
XYZ,SQUARE INC USD0.0000001 Cls A Com Stock,852234103,1617000.0,7123,0.02070599636434973,2021-05-14,2021-03-31,0001567619-21-009929
TPL,TEXAS PACIFIC LAND CORP USD0.01 Common Stock,88262P102,1589000.0,1000,0.020347450972759258,2021-05-14,2021-03-31,0001567619-21-009929
CNI,CANADIAN NATIONAL RAILWAYS CO NPV Common Stock,136375102,1550000.0,13356,0.019848048463043957,2021-05-14,2021-03-31,0001567619-21-009929
KDP,KEURIG DR PEPPER USD0.01 Common Stock,49271V100,1549000.0,45055,0.019835243270487156,2021-05-14,2021-03-31,0001567619-21-009929
AXP,AMERICAN EXPRESS CORP USD0.20 Common Stock,025816109,1526000.0,10789,0.019540723841680697,2021-05-14,2021-03-31,0001567619-21-009929
MASI,MASIMO CORP USD0.001 Common Stock,574795100,1516000.0,6600,0.01941267191611267,2021-05-14,2021-03-31,0001567619-21-009929
BKR,BAKER HUGHES COMPANY USD0.0001 Cls A Common Stock,05722G100,1464000.0,67747,0.01874680190315894,2021-05-14,2021-03-31,0001567619-21-009929
WY,WEYERHAUSER CO USD1.25 Common Stock,962166104,1445000.0,40600,0.01850350324457969,2021-05-14,2021-03-31,0001567619-21-009929
BA,BOEING CO USD5 Common Stock,097023105,1441000.0,5658,0.01845228247435248,2021-05-14,2021-03-31,0001567619-21-009929
BX,BLACKSTONE GROUP INC USD0.00001 Common Stock,09260D107,1439000.0,19308,0.018426672089238875,2021-05-14,2021-03-31,0001567619-21-009929
SE,SEA LTD ADS Ea Rep 1 Cls A Shares,81141R100,1430000.0,6405,0.01831142535622765,2021-05-14,2021-03-31,0001567619-21-009929
BLKCHF,BLACKROCK INC NPV Class A Common Stock,09247X101,1402000.0,1860,0.01795287996463718,2021-05-14,2021-03-31,0001567619-21-009929
SPYX,SPDR SERIES TRUST S&P Fossil Fuel Res Free ETF,78468R796,1401000.0,14270,0.01794007477208038,2021-05-14,2021-03-31,0001567619-21-009929
WM,WASTE MANAGEMENT INC NPV Common Stock,94106L109,1393000.0,10800,0.017837633231625957,2021-05-14,2021-03-31,0001567619-21-009929
COP,CONOCOPHILLIPS INC USD0.01 Common Stock,20825C104,1388000.0,26202,0.017773607268841946,2021-05-14,2021-03-31,0001567619-21-009929
DXJ,WISDOMTREE TRUST Japan Hedged Equity Fund,97717W851,1365000.0,22261,0.017479087840035486,2021-05-14,2021-03-31,0001567619-21-009929
LMNR,LIMONEIRA CORP NPV Common Stock,532746104,1319000.0,75360,0.016890048982422568,2021-05-14,2021-03-31,0001567619-21-009929
WMT,WAL-MART STORES INC USD0.1 Common Stock,931142103,1250000.0,9205,0.01600649069600319,2021-05-14,2021-03-31,0001567619-21-009929
IVV,ISHARES TRUST Core S&P 500 ETF,464287200,1221000.0,3068,0.01563514011185592,2021-05-14,2021-03-31,0001567619-21-009929
MELI,MERCADOLIBRE INC USD0.001 Common Stock,58733R102,1195000.0,812,0.01530220510537905,2021-05-14,2021-03-31,0001567619-21-009929
WBA,WALGREENS BOOTS ALLIANCE USD0.01 Common Stock,931427108,1188000.0,21632,0.015212568757481433,2021-05-14,2021-03-31,0001567619-21-009929
AQUAUSD,EVOQUA WATER TECHNOLOGIES CORP USD0.01 Common Stock,30057T105,1183000.0,44995,0.015148542794697422,2021-05-14,2021-03-31,0001567619-21-009929
SWK,STANLEY BLACK & DECKER INC USD2.50 Common Stock,854502101,1138000.0,5700,0.014572309129641305,2021-05-14,2021-03-31,0001567619-21-009929
APD,AIR PRODUCTS & CHEMICALS INC USD1 Common Stock,009158106,1121000.0,3983,0.014354620856175664,2021-05-14,2021-03-31,0001567619-21-009929
PSLV/U,SPROTT ASSET MGMT Physical Silver,85207K107,1107000.0,126090,0.014175348160380428,2021-05-14,2021-03-31,0001567619-21-009929
PNC,PNC FINANCIAL SERVICES GRP INC USD5 Common Stock,693475105,1096000.0,6250,0.014034491042255598,2021-05-14,2021-03-31,0001567619-21-009929
FCX,FREEPORT-MCMORAN INC USD0.10 Common Stock,35671D857,1092000.0,33162,0.01398327027202839,2021-05-14,2021-03-31,0001567619-21-009929
CVS,CVS CORP USD0.01 Common Stock,126650100,1083000.0,14402,0.013868023539017164,2021-05-14,2021-03-31,0001567619-21-009929
ADP,AUTO DATA PROCESS USD0.10 Common Stock,053015103,1073000.0,5693,0.01373997161344914,2021-05-14,2021-03-31,0001567619-21-009929
VGK,VANGUARD INTL EQUITY European ETF,922042874,1065000.0,16912,0.01363753007299472,2021-05-14,2021-03-31,0001567619-21-009929
IXJ,ISHARES TRUST S&P Gbl Healthcare Sector,464287325,1030000.0,13363,0.013189348333506632,2021-05-14,2021-03-31,0001567619-21-009929
L,LOEWS CORP USD1 Common Stock,540424108,1026000.0,20000,0.013138127563279419,2021-05-14,2021-03-31,0001567619-21-009929
ENPH,ENPHASE ENERGY INC USD0.00001 Common Stock,29355A107,1022000.0,6300,0.013086906793052211,2021-05-14,2021-03-31,0001567619-21-009929
EBA,EBAY INC USD0.001 Common Stock,278642103,976000.0,15930,0.012497867935439293,2021-05-14,2021-03-31,0001567619-21-009929
SHV,ISHARES TRUST Short Treasury Bond ETF,464288679,972000.0,8800,0.012446647165212082,2021-05-14,2021-03-31,0001567619-21-009929
VHT,VANGUARD WORLD FUNDS Healthcare ETF,92204A504,964000.0,4216,0.012344205624757661,2021-05-14,2021-03-31,0001567619-21-009929
CSCO,CISCO SYSTEMS INC USD0.001 Common Stock,17275R102,958000.0,18527,0.012267374469416845,2021-05-14,2021-03-31,0001567619-21-009929
CRM,SALESFORCE.COM INC USD0.001 Common Stock,79466L302,942000.0,4445,0.012062491388508005,2021-05-14,2021-03-31,0001567619-21-009929
AU3EUR,ANGLOGOLD ASHANTI LTD LVL1 ADR Rep 1 ZAR0.25 Com Stk,035128206,915000.0,41633,0.011716751189474336,2021-05-14,2021-03-31,0001567619-21-009929
PINS,PINTEREST INC USD0.00001 Cls A Common Stock,72352L106,893000.0,12059,0.01143503695322468,2021-05-14,2021-03-31,0001567619-21-009929
DQ,DAQO NEW ENERGY CORP ADR Each Rep 25 Ord Shares,23703Q203,868000.0,11500,0.011114907139304617,2021-05-14,2021-03-31,0001567619-21-009929
U,UNITY SOFTWARE INC USD0.000005 Common Stock,91332U101,854000.0,8512,0.010935634443509382,2021-05-14,2021-03-31,0001567619-21-009929
8CW,CROWN CASTLE INTL CORP USD0.01 Common Stock,22822V101,837000.0,4862,0.010717946170043737,2021-05-14,2021-03-31,0001567619-21-009929
IWB,ISHARES TRUST Russell 1000 ETF,464287622,817000.0,3650,0.010461842318907686,2021-05-14,2021-03-31,0001567619-21-009929
PEN,PENUMBRA INC USD0.001 Common Stock,70975L107,812000.0,3000,0.010397816356123675,2021-05-14,2021-03-31,0001567619-21-009929
CMCSA,COMCAST CORP USD1 A Common Stock,20030N101,808000.0,14927,0.010346595585896463,2021-05-14,2021-03-31,0001567619-21-009929
RSG,REPUBLIC SERVICES INC USD0.01 Common Stock,760759100,805000.0,8100,0.010308180008226055,2021-05-14,2021-03-31,0001567619-21-009929
PPG,PPG INDUSTRIES INC USD1.666 Common Stock,693506107,742000.0,4937,0.009501452877147496,2021-05-14,2021-03-31,0001567619-21-009929
TTEK,TETRA TECH INC USD0.01 Common Stock,88162G103,731000.0,5385,0.009360595759022667,2021-05-14,2021-03-31,0001567619-21-009929
BNDX,VANGUARD CHARLOTTE Total Intl Bond Index Fund ETF,92203J407,727000.0,12728,0.009309374988795456,2021-05-14,2021-03-31,0001567619-21-009929
WFC,WELLS FARGO & CO USD1.6666 Common Stock,949746101,726000.0,18585,0.009296569796238654,2021-05-14,2021-03-31,0001567619-21-009929
FPA,FIRST TRUST Asia Pac Ex Jpn AlphaDEX ETF,33737J109,723000.0,21305,0.009258154218568246,2021-05-14,2021-03-31,0001567619-21-009929
PFF,ISHARES TRUST S&P US Pref Stock Index Fund,464288687,719000.0,18732,0.009206933448341037,2021-05-14,2021-03-31,0001567619-21-009929
AWC,AMERICAN WATER WORKS USD0.01 Common Stock,030420103,690000.0,4600,0.008835582864193762,2021-05-14,2021-03-31,0001567619-21-009929
VTWO,VANGUARD INVESTMENTS Russell 2000 ETF,92206C664,690000.0,3868,0.008835582864193762,2021-05-14,2021-03-31,0001567619-21-009929
VTI,VANGUARD INDEX FUNDS Total Stock Market ETF,922908769,685000.0,3315,0.008771556901409749,2021-05-14,2021-03-31,0001567619-21-009929
GHLEUR,GREENHILL & CO INC USD0.01 Common Stock,395259104,665000.0,40372,0.0085154530502737,2021-05-14,2021-03-31,0001567619-21-009929
TDOC,TELADOC INC USD0.001 Common Stock,87918A105,660000.0,3634,0.008451427087489685,2021-05-14,2021-03-31,0001567619-21-009929
MXL,MAXLINEAR INC USD0.01 Common Stock,57776J100,659000.0,19345,0.008438621894932883,2021-05-14,2021-03-31,0001567619-21-009929
PAYX,PAYCHEX INC USD0.01 Common Stock,704326107,658000.0,6708,0.00842581670237608,2021-05-14,2021-03-31,0001567619-21-009929
KKR,KKR & CO INC NPV Class A Common Stock,48251W104,655000.0,13400,0.008387401124705672,2021-05-14,2021-03-31,0001567619-21-009929
SYK,STRYKER CORP USD0.10 Common Stock,863667101,646000.0,2654,0.00827215439169445,2021-05-14,2021-03-31,0001567619-21-009929
IR,INGERSOLL RAND INC USD1 Common Stock,45687V106,638000.0,12968,0.008169712851240029,2021-05-14,2021-03-31,0001567619-21-009929
FSLR,FIRST SOLAR INC USD0.001 Common Stock,336433107,638000.0,7303,0.008169712851240029,2021-05-14,2021-03-31,0001567619-21-009929
FEM,FIRST TRUST Emerging Markets AlphaDEX ETF,33737J182,608000.0,23039,0.007785557074535952,2021-05-14,2021-03-31,0001567619-21-009929
SJM,JM SMUCKER CO NPV Common Stock,832696405,607000.0,4800,0.00777275188197915,2021-05-14,2021-03-31,0001567619-21-009929
HYLS,FIRST TRUST High Yield Long/Short ETF,33738D408,594000.0,12210,0.007606284378740716,2021-05-14,2021-03-31,0001567619-21-009929
VXF,VANGUARD INDEX FUNDS Extended Market ETF,922908652,593000.0,3350,0.007593479186183914,2021-05-14,2021-03-31,0001567619-21-009929
SEDG,SOLAREDGE TECHNOLOGIES INC USD0.0001 Common Stock,83417M104,584000.0,2030,0.007478232453172691,2021-05-14,2021-03-31,0001567619-21-009929
GDX,VANECK VECTORS ETF Gold Miners ETF,92189F106,576000.0,17720,0.007375790912718271,2021-05-14,2021-03-31,0001567619-21-009929
VONG,VANGUARD SCOTTSDAL Russell 1000 Growth Index ETF,92206C680,575000.0,2300,0.0073629857201614685,2021-05-14,2021-03-31,0001567619-21-009929
R6C2,ROYAL DUTCH SHELL PLC ADR Ech Rep 2 Cl B EUR0.07 Shs,780259107,569000.0,15450,0.0072861545648206525,2021-05-14,2021-03-31,0001567619-21-009929
GILD,GILEAD SCIENCES INC USD0.001 Common Stock,375558103,567000.0,8768,0.007260544179707049,2021-05-14,2021-03-31,0001567619-21-009929
ACWV,ISHARES INC Edge MSCI Min Vol Gbl Mkts ETF,464286525,559000.0,5661,0.007158102639252627,2021-05-14,2021-03-31,0001567619-21-009929
BTI,BRITISH AMERICAN TOBACCO PLC ADR Each Rep 1 25p Ord Share,110448107,554000.0,14303,0.007094076676468615,2021-05-14,2021-03-31,0001567619-21-009929
IGM,ISHARES TRUST North American Technology ETF,464287549,552000.0,1530,0.007068466291355009,2021-05-14,2021-03-31,0001567619-21-009929
VB,VANGUARD INDEX FUNDS Small Cap ETF,922908751,535000.0,2500,0.006850778017889365,2021-05-14,2021-03-31,0001567619-21-009929
AVGO,BROADCOM CORP USD1 Common Stock,11135F101,533000.0,1150,0.0068251676327757615,2021-05-14,2021-03-31,0001567619-21-009929
STWD,STARWOOD PROPERTY TRUST INC USD0.01 Common Stock,85571B105,523000.0,21150,0.006697115707207736,2021-05-14,2021-03-31,0001567619-21-009929
DEO,DIAGEO PLC ADR Ea Rep 4 28 101/108p Ord,25243Q205,522000.0,3180,0.006684310514650934,2021-05-14,2021-03-31,0001567619-21-009929
VNQ,VANGUARD INDEX FUNDS REIT ETF (USD),922908553,512000.0,5574,0.006556258589082908,2021-05-14,2021-03-31,0001567619-21-009929
LHX,L3 HARRIS TECHNOLOGIES INC USD1.00 Common Stock,502431109,511000.0,2523,0.006543453396526106,2021-05-14,2021-03-31,0001567619-21-009929
N/A,2U INC USD0.001 Common Stock,90214J101,508000.0,13300,0.006505037818855698,2021-05-14,2021-03-31,0001567619-21-009929
APA,APA CORP USD0.625 Common Stock,03743Q108,500000.0,27955,0.006402596278401276,2021-05-14,2021-03-31,0001567619-21-009929
TTD,THE TRADE DESK INC USD0.000001 Cls A Common Stock,88339J105,491000.0,753,0.0062873495453900545,2021-05-14,2021-03-31,0001567619-21-009929
MKC/V,MCCORMICK & CO INC NPV Vtg Common Stock,579780107,490000.0,5500,0.00627454435283325,2021-05-14,2021-03-31,0001567619-21-009929
TCMD,TACTILE SYSTEMS TECHNOLOGY USD0.001 Common Stock,87357P100,485000.0,8900,0.0062105183900492385,2021-05-14,2021-03-31,0001567619-21-009929
FXI,ISHARES TRUST China Large-Cap ETF,464287184,482000.0,10325,0.0061721028123788305,2021-05-14,2021-03-31,0001567619-21-009929
LMBS,FIRST TRUST Low Dur Mortgage Opps ETF,33739Q200,480000.0,9410,0.006146492427265227,2021-05-14,2021-03-31,0001567619-21-009929
FTSM,FIRST TRUST Enhanced Short Maturity ETF,33739Q408,479000.0,7994,0.0061336872347084225,2021-05-14,2021-03-31,0001567619-21-009929
KMX,CARMAX INC USD0.50 Common Stock,143130102,478000.0,3600,0.006120882042151621,2021-05-14,2021-03-31,0001567619-21-009929
MDY,SPDR SERIES TRUST S&P MidCap 400 ETF,78467Y107,476000.0,1000,0.006095271657038015,2021-05-14,2021-03-31,0001567619-21-009929
TXN,TEXAS INSTRUMENTS INC Common Stock,882508104,472000.0,2500,0.006044050886810806,2021-05-14,2021-03-31,0001567619-21-009929
PTON,PELOTON INTERACTIVE INC USD0.000025 Cls A Common Stock,70614W100,452000.0,4023,0.005787947035674754,2021-05-14,2021-03-31,0001567619-21-009929
HMSY,HMS HOLDINGS CORP USD0.01 Common Stock,40425J101,451000.0,12200,0.005775141843117952,2021-05-14,2021-03-31,0001567619-21-009929
CARR,CARRIER GLOBAL CORP USD0.01 Common Stock (WI),14448C104,445000.0,10535,0.005698310687777136,2021-05-14,2021-03-31,0001567619-21-009929
WAB,WABTEC CORP USD0.01 Common Stock,929740108,428000.0,5410,0.005480622414311492,2021-05-14,2021-03-31,0001567619-21-009929
EXEL,EXELIXIS INC USD0.001 Common Stock,30161Q104,418000.0,18500,0.005352570488743468,2021-05-14,2021-03-31,0001567619-21-009929
N/A,CARA THERAPEUTICS INC USD0.001 Common Stock,140755109,412000.0,19000,0.005275739333402652,2021-05-14,2021-03-31,0001567619-21-009929
SRE,SEMPRA ENERGY NPV Common Stock,816851109,411000.0,3100,0.00526293414084585,2021-05-14,2021-03-31,0001567619-21-009929
SUSB,ISHARES TRUST ESG Aware 1-5 Yr USD Cp Bd ETF,46435G243,407000.0,15650,0.005211713370618639,2021-05-14,2021-03-31,0001567619-21-009929
SUSC,ISHARES TRUST ESG Aware USD Corp Bond ETF,46435G193,407000.0,15100,0.005211713370618639,2021-05-14,2021-03-31,0001567619-21-009929
DOW,DOW INC USD0.01 Common Stock WI,260557103,406000.0,6344,0.005198908178061837,2021-05-14,2021-03-31,0001567619-21-009929
VTRS,VIATRIS INC USD0.01 Common Stock,92556V106,402000.0,28799,0.005147687407834627,2021-05-14,2021-03-31,0001567619-21-009929
FAST,FASTENAL COMPANY USD0.01 Common Stock,311900104,402000.0,8000,0.005147687407834627,2021-05-14,2021-03-31,0001567619-21-009929
CTSH,COGNIZANT TECHNOLOGY USD0.01 Class A Common Stock,192446102,396000.0,5067,0.005070856252493811,2021-05-14,2021-03-31,0001567619-21-009929
TGT,TARGET CORP USD0.0833 Common Stock,87612E106,395000.0,1995,0.0050580510599370085,2021-05-14,2021-03-31,0001567619-21-009929
ZM,ZOOM VIDEO COMMUNICATIONS INC USD0.001 Class A Common Stock,98980L101,386000.0,1202,0.004942804326925785,2021-05-14,2021-03-31,0001567619-21-009929
UL,UNILEVER PLC ADS Ea Rep 1 Ord Share,904767704,379000.0,6784,0.004853167979028168,2021-05-14,2021-03-31,0001567619-21-009929
XME,SPDR SERIES TRUST S&P Metals & Mining ETF,78464A755,379000.0,9489,0.004853167979028168,2021-05-14,2021-03-31,0001567619-21-009929
N/A,SILK ROAD MEDICAL INC USD0.001 Common Stock,82710M100,377000.0,7450,0.004827557593914563,2021-05-14,2021-03-31,0001567619-21-009929
UNH,UNITED HEALTHCARE CORP USD0.01 Common Stock,91324P102,369000.0,991,0.004725116053460142,2021-05-14,2021-03-31,0001567619-21-009929
TG7,TRIUMPH GROUP INC USD0.001 Common Stock,896818101,368000.0,20000,0.00471231086090334,2021-05-14,2021-03-31,0001567619-21-009929
AMT,AMER TOWER CORP USD0.01 New Common Stock,03027X100,364000.0,1522,0.0046610900906761295,2021-05-14,2021-03-31,0001567619-21-009929
TRHCEUR,TABULA RASA HEALTHCARE INC USD0.0001 Common Stock,873379101,363000.0,7890,0.004648284898119327,2021-05-14,2021-03-31,0001567619-21-009929
SRNE,SORRENTO THERAPEUTICS INC USD0.0001 Common Stock,83587F202,351000.0,42484,0.004494622587437696,2021-05-14,2021-03-31,0001567619-21-009929
RDS/A,ROYAL DUTCH SHELL PLC ADR Ech Rep 2 Cl A EUR0.07 Shs,780259206,347000.0,8845,0.004443401817210486,2021-05-14,2021-03-31,0001567619-21-009929
CCJ,CAMECO CORP NPV Common Stock,13321L108,344000.0,20700,0.004404986239540078,2021-05-14,2021-03-31,0001567619-21-009929
N/A,COMPUTE HEALTH ACQUISITION CP Units (1 Cls A & 1/4 Wt Exp),204833206,341000.0,33800,0.004366570661869671,2021-05-14,2021-03-31,0001567619-21-009929
MKL,MARKEL CORP NPV Common Stock,570535104,340000.0,298,0.004353765469312868,2021-05-14,2021-03-31,0001567619-21-009929
IXC,ISHARES TRUST Global Energy ETF,464287341,335000.0,13580,0.004289739506528855,2021-05-14,2021-03-31,0001567619-21-009929
AMD,ADVANCED MICRO DEVICES INC USD0.01 Common Stock,007903107,332000.0,4224,0.004251323928858447,2021-05-14,2021-03-31,0001567619-21-009929
VBR,VANGUARD INDEX FUNDS Small Cap Value ETF,922908611,331000.0,2000,0.004238518736301646,2021-05-14,2021-03-31,0001567619-21-009929
BLFS,BIOLIFE SOLUTIONS USD0.001 Common Stock,09062W204,325000.0,9018,0.00416168758096083,2021-05-14,2021-03-31,0001567619-21-009929
PPTA,PERPETUA RESOURCES CORP NPV Common Stock,714266103,323000.0,53200,0.004136077195847225,2021-05-14,2021-03-31,0001567619-21-009929
NIO,NIO INC Spon ADS Each Rep 1 Ord Shares,62914V106,322000.0,8259,0.0041232720032904225,2021-05-14,2021-03-31,0001567619-21-009929
CHTR,CHARTER COMMUNICATIONS INC USD0.001 Class A Common Stock,16119P108,319000.0,517,0.0040848564256200145,2021-05-14,2021-03-31,0001567619-21-009929
SQM,SOCIEDAD QUIMICA Y MINERA ADR Each Rep 1 Ser B Pref Shs,833635105,319000.0,6015,0.0040848564256200145,2021-05-14,2021-03-31,0001567619-21-009929
7HP,HP INC USD0.01 Common Stock,40434L105,315000.0,9923,0.004033635655392805,2021-05-14,2021-03-31,0001567619-21-009929
ZS,ZSCALER INC USD0.001 Common Stock,98980G102,314000.0,1827,0.004020830462836002,2021-05-14,2021-03-31,0001567619-21-009929
QQQ,INVESCO QQQ TRUST Unit Series 1 ETF,46090E103,311000.0,975,0.003982414885165594,2021-05-14,2021-03-31,0001567619-21-009929
ADM,ARCHER-DANIELS-MIDLAND CO NPV Common Stock,039483102,308000.0,5395,0.0039439993074951865,2021-05-14,2021-03-31,0001567619-21-009929
AGG,ISHARES TRUST Barclays US Aggregate Bond Fd,464287226,308000.0,2708,0.0039439993074951865,2021-05-14,2021-03-31,0001567619-21-009929
ARES,ARES MANAGEMENT CORP USD0.01 Cls A Common Stock,03990B101,297000.0,5300,0.003803142189370358,2021-05-14,2021-03-31,0001567619-21-009929
AMAT,APPLIED MATERIALS INC NPV Common Stock,038222105,287000.0,2150,0.003675090263802333,2021-05-14,2021-03-31,0001567619-21-009929
AOS,SMITH (AO) CORP USD1 Common Stock,831865209,281000.0,4150,0.0035982591084615175,2021-05-14,2021-03-31,0001567619-21-009929
EOG,EOG RESOURCES INC USD0.01 Common Stock,26875P101,279000.0,3850,0.0035726487233479123,2021-05-14,2021-03-31,0001567619-21-009929
DKNG1USD,DRAFTKINGS INC USD0.0001 Class A Common Stock,26142R104,275000.0,4490,0.0035214279531207023,2021-05-14,2021-03-31,0001567619-21-009929
MSON,MISONIX INC USD0.01 Common Stock,604871103,272000.0,13900,0.0034830123754502947,2021-05-14,2021-03-31,0001567619-21-009929
VNQI,VANGUARD INTL EQUITY Global Ex US Real Estate ETF,922042676,272000.0,4887,0.0034830123754502947,2021-05-14,2021-03-31,0001567619-21-009929
HCM,HUTCHISON CHINA MEDITECH LTD Spon ADR Each Rep 5 Ord Shs,44842L103,267000.0,9450,0.003418986412666282,2021-05-14,2021-03-31,0001567619-21-009929
ALB,ALBEMARLE CORP USD0.01 Common Stock,012653101,264000.0,1805,0.003380570834995874,2021-05-14,2021-03-31,0001567619-21-009929
FNX,FIRST TRUST Mid Cap Core AlphaDEX ETF,33735B108,264000.0,2811,0.003380570834995874,2021-05-14,2021-03-31,0001567619-21-009929
NGG,NATIONAL GRID PLC Spon ADR Each Rep 5 Ord Shs,636274409,263000.0,4435,0.0033677656424390716,2021-05-14,2021-03-31,0001567619-21-009929
OIH,VANECK VECTORS ETF Oil Services ETF (Post Rev Sp),92189H607,262000.0,1370,0.0033549604498822687,2021-05-14,2021-03-31,0001567619-21-009929
IHI,ISHARES TRUST US Medical Devices ETF,464288810,258000.0,780,0.0033037396796550588,2021-05-14,2021-03-31,0001567619-21-009929
PPLT,ABERDEEN STANDARD Physical Platinum Shares ETF,003260106,253000.0,2270,0.003239713716871046,2021-05-14,2021-03-31,0001567619-21-009929
GIB/A,CGI INC NPV Class A Sub Voting Shares,12532H104,250000.0,3000,0.003201298139200638,2021-05-14,2021-03-31,0001567619-21-009929
SII,SPROTT INC NPV Common Stock (P/R Split),852066208,249000.0,6550,0.003188492946643836,2021-05-14,2021-03-31,0001567619-21-009929
WDAY,WORKDAY INC USD0.001 Cls A Common Stock,98138H101,248000.0,1000,0.0031756877540870332,2021-05-14,2021-03-31,0001567619-21-009929
N/A,INDEXIQ ETF TRUST IQ Hedge Macro Tracker ETF,45409B206,244000.0,8650,0.0031244669838598233,2021-05-14,2021-03-31,0001567619-21-009929
HAL,HALLIBURTON CORP NPV Common Stock,406216101,243000.0,11321,0.0031116617913030204,2021-05-14,2021-03-31,0001567619-21-009929
OII,OCEANEERING INTL INC USD0.25 Common Stock,675232102,236000.0,20650,0.003022025443405403,2021-05-14,2021-03-31,0001567619-21-009929
CG,CARLYLE GROUP INC USD0.01 Common Stock,14316J108,236000.0,6430,0.003022025443405403,2021-05-14,2021-03-31,0001567619-21-009929
SEA,SEABRIDGE GOLD INC NPV Common Stock,811916105,234000.0,14501,0.0029964150582917973,2021-05-14,2021-03-31,0001567619-21-009929
GM,GENERAL MOTORS CO USD0.01 Common Stock,37045V100,233000.0,4060,0.002983609865734995,2021-05-14,2021-03-31,0001567619-21-009929
TTE,TOTAL SE Spon ADR Each Rep 1 Ord Shares,89151E109,224000.0,4805,0.002868363132723772,2021-05-14,2021-03-31,0001567619-21-009929
TWLO,TWILIO INC USD0.001 Class A Common Stock,90138F102,223000.0,654,0.0028555579401669693,2021-05-14,2021-03-31,0001567619-21-009929
RCKT,ROCKET PHARMACEUTICALS INC USD0.01 Common Stock,77313F106,222000.0,5000,0.002842752747610167,2021-05-14,2021-03-31,0001567619-21-009929
PLUN,PLUG POWER INC USD0.01 Common Stock,72919P202,215000.0,6000,0.002753116399712549,2021-05-14,2021-03-31,0001567619-21-009929
EGP,EASTGROUP PROPERTIES INC USD0.0001 Common Stock,277276101,215000.0,1500,0.002753116399712549,2021-05-14,2021-03-31,0001567619-21-009929
SLF,SUN LIFE FINANCIAL INC NPV Common Stock,866796105,209000.0,4133,0.002676285244371734,2021-05-14,2021-03-31,0001567619-21-009929
CPRT,COPART INC USD0.001 Common Stock,217204106,209000.0,1925,0.002676285244371734,2021-05-14,2021-03-31,0001567619-21-009929
N/A,GLAXOSMITHKLINE PLC Spon ADR (Cnv 2 Ord 25p),37733W105,208000.0,5825,0.0026634800518149314,2021-05-14,2021-03-31,0001567619-21-009929
DWX,SPDR INDEX SHARES S&P Intl Dividend ETF,78463X772,205000.0,5371,0.0026250644741445234,2021-05-14,2021-03-31,0001567619-21-009929
MSTR,MICROSTATEGY INC USD0.001 Cls A Common Stock,594972408,204000.0,300,0.002612259281587721,2021-05-14,2021-03-31,0001567619-21-009929
CMI,CUMMINS INC USD2.50 Common Stock,231021106,204000.0,787,0.002612259281587721,2021-05-14,2021-03-31,0001567619-21-009929
N/A,MESOBLAST LTD Spon ADR Ea Rep 5 Shares,590717104,202000.0,24435,0.002586648896474116,2021-05-14,2021-03-31,0001567619-21-009929
HMY,HARMONY GOLD MINING CO Spon ADR Rep 1 ZAR0.50 Ord Shs,413216300,193000.0,44325,0.0024714021634628927,2021-05-14,2021-03-31,0001567619-21-009929
CEF/U,SPROTT PHYSICAL GOLD & SILVER Units (US Quoted),85208R101,190000.0,10920,0.002432986585792485,2021-05-14,2021-03-31,0001567619-21-009929
HL,HECLA MINING CO USD0.25 Common Stock,422704106,186000.0,32750,0.0023817658155652747,2021-05-14,2021-03-31,0001567619-21-009929
F,FORD MOTOR CO USD0.01 Common Stock,345370860,178000.0,14513,0.0022793242751108543,2021-05-14,2021-03-31,0001567619-21-009929
PGX,INVESCO EXCH TRDII Preferred ETF,46138E511,165000.0,11000,0.002112856771872421,2021-05-14,2021-03-31,0001567619-21-009929
MDNA,MEDICENNA THERAPEUTICS CORP NPV Common Stock,58490H107,163000.0,40000,0.0020872463867588164,2021-05-14,2021-03-31,0001567619-21-009929
YRI,YAMANA GOLD INC NPV Common Stock (USD),98462Y100,161000.0,37000,0.0020616360016452112,2021-05-14,2021-03-31,0001567619-21-009929
N/A,QURATE RETAIL GROUP USD0.01 Series A Common Stock,74915M100,153000.0,13000,0.0019591944611907905,2021-05-14,2021-03-31,0001567619-21-009929
SSRM,SSR MINING INC NPV Common Stock,784730103,147000.0,10250,0.0018823633058499755,2021-05-14,2021-03-31,0001567619-21-009929
