ticker,nameOfIssuer,cusip,value,shares,allocation_percent,filingDate,reportDate,accessionNumber
MSFT,MICROSOFT CORP USD 0.00000625 Common Stock,594918104,480999000.0,2065261,5.9345000099319805,2022-11-03,2022-09-30,0001140361-22-039712
V,VISA INC USD0.0001 Common Stock,92826C839,419785000.0,2362987,5.179250033096318,2022-11-03,2022-09-30,0001140361-22-039712
AMZN,AMAZON COM INC USD0.01 Common Stock,023135106,283108000.0,2505378,3.492947862286248,2022-11-03,2022-09-30,0001140361-22-039712
AAPL,APPLE INC NPV Common Stock,037833100,259079000.0,1874666,3.1964813400301613,2022-11-03,2022-09-30,0001140361-22-039712
GOOGL,ALPHABET INC USD0.001 Cls A Common Stock,02079K305,248479000.0,2597797,3.0656999868354995,2022-11-03,2022-09-30,0001140361-22-039712
KO,COCA-COLA CO USD0.25 Common Stock,191216100,247135000.0,4411541,3.0491178982794973,2022-11-03,2022-09-30,0001140361-22-039712
ACN,ACCENTURE PLC New A Class Shares,G1151C101,226054000.0,878561,2.7890233976477368,2022-11-03,2022-09-30,0001140361-22-039712
BRK/B,BERKSHIRE HATHAWAY INC USD0.0033 Cls B Common Stock,084670702,182819000.0,684665,2.255595868839134,2022-11-03,2022-09-30,0001140361-22-039712
ABT,ABBOTT LABORATORIES NPV Common Stock,002824100,169018000.0,1746779,2.085321014552387,2022-11-03,2022-09-30,0001140361-22-039712
CME,CME GROUP INC USD0.01 Cls A Common Stock,12572Q105,167241000.0,944172,2.0633966310970173,2022-11-03,2022-09-30,0001140361-22-039712
EL,ESTEE LAUDER COS USD0.01 Class A Common Stock,518439104,158365000.0,733512,1.9538857545917518,2022-11-03,2022-09-30,0001140361-22-039712
COST,COSTCO CORP NPV Common Stock,22160K105,141898000.0,300422,1.7507181561901959,2022-11-03,2022-09-30,0001140361-22-039712
MA,MASTERCARD INC USD0.0001 Class A Common Stock,57636Q104,128095000.0,450501,1.5804186261764306,2022-11-03,2022-09-30,0001140361-22-039712
JNJ,JOHNSON & JOHNSON USD1 Common Stock,478160104,123917000.0,758550,1.5288710324361199,2022-11-03,2022-09-30,0001140361-22-039712
APH,AMPHENOL CORP USD0.001 Cls A Common Stock,032095101,121167000.0,1809542,1.4949419077865613,2022-11-03,2022-09-30,0001140361-22-039712
GOOG,ALPHABET INC USD0.001 Cls C Common Stock,02079K107,120325000.0,1251435,1.484553426712042,2022-11-03,2022-09-30,0001140361-22-039712
JPM,JP MORGAN CHASE & CO USD1 Common Stock,46625H100,111996000.0,1071735,1.3817913615461612,2022-11-03,2022-09-30,0001140361-22-039712
DE,DEERE & CO USD1 Common Stock,244199105,109237000.0,327165,1.3477511961250224,2022-11-03,2022-09-30,0001140361-22-039712
SCHW,SCHWAB (CHARLES) CORP USD0.01 Common Stock,808513105,109019000.0,1516889,1.3450615418800758,2022-11-03,2022-09-30,0001140361-22-039712
HD,HOME DEPOT INC USD0.05 Common Stock,437076102,105565000.0,382566,1.3024465613202303,2022-11-03,2022-09-30,0001140361-22-039712
INTU,INTUIT INC USD0.01 Common Stock,461202103,103622000.0,267535,1.2784740925223788,2022-11-03,2022-09-30,0001140361-22-039712
TMO,THERMO FISHER SCIENTIFIC INC USD1 Common Stock,883556102,102652000.0,202393,1.2665063649187163,2022-11-03,2022-09-30,0001140361-22-039712
DXCM,DEXCOM INC USD0.001 Common Stock,252131107,101661000.0,1262247,1.2542795421813664,2022-11-03,2022-09-30,0001140361-22-039712
ADBE,ADOBE INC NPV Common Stock,00724F101,92908000.0,337602,1.146286222887699,2022-11-03,2022-09-30,0001140361-22-039712
WCN,WASTE CONNECTIONS INC NPV Common Stock,94106B101,91211000.0,674989,1.1253488685130444,2022-11-03,2022-09-30,0001140361-22-039712
SPGI,S&P GLOBAL INC USD1 Common Stock,78409V104,86521000.0,283351,1.067484288656161,2022-11-03,2022-09-30,0001140361-22-039712
FRCB,FIRST REP BANK SAN FRANCISCO USD0.01 Common Stock,33616C100,86194000.0,660238,1.0634498072887408,2022-11-03,2022-09-30,0001140361-22-039712
MLM,MARTIN MARIETTA MATERIALS USD0.01 Common Stock,573284106,81236000.0,252214,1.0022786800114643,2022-11-03,2022-09-30,0001140361-22-039712
NVDA,NVIDIA CORP USD0.001 Common Stock,67066G104,78676000.0,648122,0.9706937494286028,2022-11-03,2022-09-30,0001140361-22-039712
MDLZ,MONDELEZ INTL INC USD0.01 Common Stock,609207105,74886000.0,1365784,0.9239332467297569,2022-11-03,2022-09-30,0001140361-22-039712
JBHT,HUNT (JB) TRANSPORT SVCS INC USD0.01 Common Stock,445658107,72422000.0,463000,0.8935327510437524,2022-11-03,2022-09-30,0001140361-22-039712
HON,HONEYWELL INTL INC USD1 Common Stock,438516106,72333000.0,433212,0.8924346811914576,2022-11-03,2022-09-30,0001140361-22-039712
TJX,TJX COMPANIES INC NPV Common Stock,872540109,71117000.0,1144830,0.8774318391645983,2022-11-03,2022-09-30,0001140361-22-039712
CIT,CINTAS CORP NPV Common Stock,172908105,69005000.0,177760,0.8513742714337376,2022-11-03,2022-09-30,0001140361-22-039712
ROL,ROLLINS INC USD1 Common Stock,775711104,68361000.0,1971200,0.8434286873339863,2022-11-03,2022-09-30,0001140361-22-039712
BR,BROADRIDGE FINANCIAL SOLUTIONS USD0.01 Common Stock,11133T103,62794000.0,435100,0.7747438011797712,2022-11-03,2022-09-30,0001140361-22-039712
FWONKUSD,LIBERTY MEDIA CORP USD0.01 Ser C Media Com Stk,531229854,60553000.0,1035100,0.7470946490562582,2022-11-03,2022-09-30,0001140361-22-039712
MCD,MCDONALD'S CORP USD0.01 Common Stock,580135101,59779000.0,259074,0.7375451427003462,2022-11-03,2022-09-30,0001140361-22-039712
CSGP,COSTAR GROUP INC USD0.01 Common Stock,22160N109,57740000.0,829000,0.7123882390056373,2022-11-03,2022-09-30,0001140361-22-039712
BSX,BOSTON SCIENTIFIC USD0.01 Common Stock,101137107,56189000.0,1450775,0.6932522127032863,2022-11-03,2022-09-30,0001140361-22-039712
BAC,BANK OF AMERICA CORP NPV Common Stock,060505104,54411000.0,1801675,0.6713154913844082,2022-11-03,2022-09-30,0001140361-22-039712
SHW,SHERWIN-WILLIAMS USD1 Common Stock,824348106,54042000.0,263941,0.6667628197496129,2022-11-03,2022-09-30,0001140361-22-039712
SIVBEUR,SVB FINANCIAL GROUP USD0.001 Common Stock,78486Q101,53773000.0,160145,0.6634439344657106,2022-11-03,2022-09-30,0001140361-22-039712
IDXX,IDEXX LABORATORIES INC USD0.10 Common Stock,45168D104,52190000.0,160190,0.643913096531074,2022-11-03,2022-09-30,0001140361-22-039712
N/A,APTIV PLC USD0.01 Common Stock,G6095L109,51881000.0,663358,0.6401006967068145,2022-11-03,2022-09-30,0001140361-22-039712
PG,PROCTER & GAMBLE CO NPV Common Stock,742718109,50317000.0,398547,0.6208042781788474,2022-11-03,2022-09-30,0001140361-22-039712
EFX,EQUIFAX INC USD1.25 Common Stock,294429105,49599000.0,289325,0.6119456921794355,2022-11-03,2022-09-30,0001140361-22-039712
ISRG,INTUITIVE SURGICAL INC USD0.001 Common Stock,46120E602,47723000.0,254604,0.5887998602366822,2022-11-03,2022-09-30,0001140361-22-039712
N/A,LINDE PLC EUR0.001 Common Stock,G5494J103,44597000.0,165427,0.5502316989077659,2022-11-03,2022-09-30,0001140361-22-039712
SLB,SCHLUMBERGER LTD USD0.01 Common Stock,806857108,42902000.0,1195038,0.529319020260129,2022-11-03,2022-09-30,0001140361-22-039712
PEP,PEPSICO INC USD0.016666 Cap,713448108,42742000.0,261806,0.5273449620987002,2022-11-03,2022-09-30,0001140361-22-039712
VRSK,VERISK ANALYTICS INC USD0.001 Common Stock,92345Y106,42311000.0,248116,0.5220273429263512,2022-11-03,2022-09-30,0001140361-22-039712
BAC,VERIZON COMMS INC NPV Common Stock,92343V104,39613000.0,1043277,0.4887397871792572,2022-11-03,2022-09-30,0001140361-22-039712
CDNS,CADENCE DESIGN SYSTEMS INC USD0.01 Common Stock,127387108,39328000.0,240643,0.48522349607921206,2022-11-03,2022-09-30,0001140361-22-039712
ADSK,AUTODESK INC NPV Common Stock,052769106,39322000.0,210503,0.48514946889815846,2022-11-03,2022-09-30,0001140361-22-039712
C,CITIGROUP INC USD0.01 Common Stock,172967424,38614000.0,926653,0.4764142615338358,2022-11-03,2022-09-30,0001140361-22-039712
LMT,LOCKHEED MARTIN CO USD1 Common Stock,539830109,36842000.0,95375,0.45455156739601127,2022-11-03,2022-09-30,0001140361-22-039712
EW,EDWARDS LIFESCIENCES CORP USD1 Common Stock,28176E108,36340000.0,439793,0.44835795991452826,2022-11-03,2022-09-30,0001140361-22-039712
CVX,CHEVRON CORP USD0.75 Common Stock,166764100,35617000.0,247907,0.4394376845975716,2022-11-03,2022-09-30,0001140361-22-039712
AKX,ANSYS INC USD0.01 Common Stock,03662Q105,35408000.0,159713,0.4368590711242052,2022-11-03,2022-09-30,0001140361-22-039712
JKHY,JACK HENRY & ASSOCIATES INC USD0.01 Common Stock,426281101,34461000.0,189065,0.42517511438124816,2022-11-03,2022-09-30,0001140361-22-039712
NKE,NIKE INC NPV Cls B Common Stock,654106103,34295000.0,412601,0.4231270290387657,2022-11-03,2022-09-30,0001140361-22-039712
GLD,SPDR GOLD TRUST NPV Shares ETF,78463V107,33022000.0,213497,0.4074209287918974,2022-11-03,2022-09-30,0001140361-22-039712
ULTA,ULTA BEAUTY INC USD0.01 Common Stock,90384S303,32812000.0,81786,0.40482997745502197,2022-11-03,2022-09-30,0001140361-22-039712
DWD,MORGAN STANLEY USD0.01 Common Stock,617446448,31761000.0,401988,0.3918628829071362,2022-11-03,2022-09-30,0001140361-22-039712
WEC,WEC ENERGY GROUP INC USD0.01 Common Stock,92939U106,31712000.0,354603,0.3912583275951987,2022-11-03,2022-09-30,0001140361-22-039712
DFSEUR,DISCOVER FINANCIAL SERVICES USD0.01 Common Stock,254709108,31221000.0,343388,0.38520043661231385,2022-11-03,2022-09-30,0001140361-22-039712
FIS,FIDELITY NATIONAL INFORMATION USD0.01 Common Stock,31620M106,30401000.0,402294,0.375083388534991,2022-11-03,2022-09-30,0001140361-22-039712
XYL,XYLEM INC USD0.01 Common Stock,98419M100,30067000.0,344178,0.3709625421230082,2022-11-03,2022-09-30,0001140361-22-039712
MRK,MERCK & CO INC USD0.50 Common Stock,58933Y105,29996000.0,348306,0.37008655381387423,2022-11-03,2022-09-30,0001140361-22-039712
DIS,WALT DISNEY (HLDGS) CO USD0.1 Common Stock,254687106,29762000.0,315505,0.3671994937527845,2022-11-03,2022-09-30,0001140361-22-039712
USB,US BANCORP DEL USD0.01 Common Stock,902973304,29707000.0,736775,0.3665209112597933,2022-11-03,2022-09-30,0001140361-22-039712
BKNG,BOOKING HOLDINGS INC USD0.008 Common Stock,09857L108,28501000.0,17345,0.35164144786802337,2022-11-03,2022-09-30,0001140361-22-039712
XOM,EXXON MOBIL CORP NPV Common Stock,30231G102,28490000.0,326304,0.35150573136942515,2022-11-03,2022-09-30,0001140361-22-039712
GDDY,GODADDY INC USD0.001 Cls A Common Stock,380237107,28159000.0,397280,0.3474218985479692,2022-11-03,2022-09-30,0001140361-22-039712
BDX,BECTON DICKINSON & CO NPV Common Stock,075887109,27303000.0,122530,0.33686068738432484,2022-11-03,2022-09-30,0001140361-22-039712
BCC,BOISE CASCADE COMPANY USD0.01 Common Stock,09739D100,27131000.0,456297,0.3347385748607888,2022-11-03,2022-09-30,0001140361-22-039712
PANW,PALO ALTO NETWORKS INC USD0.0001 Common Stock,697435105,26751000.0,163325,0.3300501867273953,2022-11-03,2022-09-30,0001140361-22-039712
ECL,ECOLAB INC USD1 Common Stock,278865100,25969000.0,179813,0.32040197746341176,2022-11-03,2022-09-30,0001140361-22-039712
EQIX,EQUINIX INC USD0.001 New Common Stock,29444U700,25658000.0,45105,0.31656490191213443,2022-11-03,2022-09-30,0001140361-22-039712
MO,ALTRIA GROUP INC USD0.333333 Common Stock,02209S103,25464000.0,630597,0.314171356391402,2022-11-03,2022-09-30,0001140361-22-039712
N/A,COOPER COS INC USD0.10 Common Stock,216648402,25271000.0,95758,0.3117901487341784,2022-11-03,2022-09-30,0001140361-22-039712
OTIS,OTIS WORLDWIDE CORP USD0.01 Common Stock (WI),68902V107,24678000.0,386795,0.30447379567338273,2022-11-03,2022-09-30,0001140361-22-039712
DG,DOLLAR GENERAL CORP USD0.875 Common Stock,256677105,23803000.0,99235,0.29367816510306866,2022-11-03,2022-09-30,0001140361-22-039712
PYPL,PAYPAL HOLDINGS INC USD0.0001 Common Stock,70450Y103,23198000.0,269519,0.28621375768016577,2022-11-03,2022-09-30,0001140361-22-039712
TSM,TAIWAN SEMICONDUCTORS MAN LTD ADS Rep 5 TWD10 Ord Share,874039100,23103000.0,336970,0.28504166064681746,2022-11-03,2022-09-30,0001140361-22-039712
ATVIEUR,ACTIVISION BLIZZARD INC USD0.000001 Common Stock,00507V109,22858000.0,307476,0.2820188840871295,2022-11-03,2022-09-30,0001140361-22-039712
PFE,PFIZER INC USD0.05 Common Stock,717081103,21914000.0,500768,0.2703719409346993,2022-11-03,2022-09-30,0001140361-22-039712
CAT,CATERPILLAR INC USD1 Common Stock,149123101,21641000.0,131890,0.2670037041967613,2022-11-03,2022-09-30,0001140361-22-039712
AMGN,AMGEN INC USD0.0001 Common Stock,031162100,21092000.0,93577,0.26023021713035854,2022-11-03,2022-09-30,0001140361-22-039712
LLY,LILLY (ELI) & CO NPV Common Stock,532457108,20618000.0,63764,0.2543820698271255,2022-11-03,2022-09-30,0001140361-22-039712
AJG,GALLAGHER AJ & CO USD1 Common Stock,363576109,20221000.0,118100,0.2494839380140802,2022-11-03,2022-09-30,0001140361-22-039712
ZBRA,ZEBRA TECHNOLOGIES USD0.01 Class A Common Stock,989207105,19048000.0,72700,0.23501162411810492,2022-11-03,2022-09-30,0001140361-22-039712
TREX,TREX COMPANY INC USD0.01 Common Stock,89531P105,19030000.0,433101,0.23478954257494417,2022-11-03,2022-09-30,0001140361-22-039712
SPY,SPDR SERIES TRUST S&P 500 ETF Trust,78462F103,18974000.0,53123,0.23409862221844407,2022-11-03,2022-09-30,0001140361-22-039712
YUMC,YUM CHINA HOLDINGS INC USD0.01 Common Stock,98850P109,18712000.0,395352,0.23086610197910434,2022-11-03,2022-09-30,0001140361-22-039712
META,META PLATFORMS INC USD0.000006 Cls A Common Stock,30303M102,18231000.0,134369,0.22493158963130885,2022-11-03,2022-09-30,0001140361-22-039712
NEE,NEXTERA ENERGY INC USD0.01 Common Stock,65339F101,18194000.0,232034,0.22447508868147842,2022-11-03,2022-09-30,0001140361-22-039712
SHOP,SHOPIFY INC NPV Sub-Vtg Cls A Common Stock,82509L107,17971000.0,667080,0.22172374511898696,2022-11-03,2022-09-30,0001140361-22-039712
ZTS,ZOETIS INC USD0.01 Cls A Common Stock,98978V103,17551000.0,118356,0.21654184244523622,2022-11-03,2022-09-30,0001140361-22-039712
QCOM,QUALCOMM INC USD0.001 Common Stock,747525103,16760000.0,148345,0.20678259240967234,2022-11-03,2022-09-30,0001140361-22-039712
WMS,ADVANCED DRAINAGE SYSTEM INC USD0.01 Common Stock,00790R104,16067000.0,129191,0.19823245299798362,2022-11-03,2022-09-30,0001140361-22-039712
FCX,FREEPORT-MCMORAN INC USD0.10 Common Stock,35671D857,15565000.0,569533,0.1920388455165006,2022-11-03,2022-09-30,0001140361-22-039712
CL,COLGATE-PALMOLIVE CO NPV Common Stock,194162103,15338000.0,218329,0.18923815049997342,2022-11-03,2022-09-30,0001140361-22-039712
MMC,MARSH & MCLENNAN CO INC USD1 Common Stock,571748102,15146000.0,101452,0.1868692807062588,2022-11-03,2022-09-30,0001140361-22-039712
FMC,FMC CORP USD0.10 Common Stock,302491303,15029000.0,142185,0.18542575067571396,2022-11-03,2022-09-30,0001140361-22-039712
TSLA,TESLA INC USD0.001 Common Stock,88160R101,14428000.0,54395,0.17801069470684683,2022-11-03,2022-09-30,0001140361-22-039712
STE,STERIS PLC USD0.001 Ordinary Shares,G8473T100,14383000.0,86497,0.17745549084894494,2022-11-03,2022-09-30,0001140361-22-039712
RY,ROYAL BANK OF CANADA NPV Common Stock,780087102,14200000.0,156893,0.1751976618268107,2022-11-03,2022-09-30,0001140361-22-039712
VOO,VANGUARD INDEX FUNDS S&P 500 ETF (USD),922908363,14067000.0,42849,0.17355672598012298,2022-11-03,2022-09-30,0001140361-22-039712
ABBV,ABBVIE INC USD0.01 Common Stock,00287Y109,13506000.0,100634,0.16663518455161302,2022-11-03,2022-09-30,0001140361-22-039712
RTX,RAYTHEON TECHNOLOGIES CORP USD1.00 Common Stock,75513E101,13099000.0,160016,0.1616136741034784,2022-11-03,2022-09-30,0001140361-22-039712
HASI,HANNON ARMSTRONG SUST INFRA USD0.01 Common Stock,41068X100,12409000.0,414585,0.15310054828231648,2022-11-03,2022-09-30,0001140361-22-039712
SPYX,SPDR SERIES TRUST S&P Fossil Fuel Res Free ETF,78468R796,12171000.0,139657,0.15016413676719104,2022-11-03,2022-09-30,0001140361-22-039712
N/A,CAPRI HOLDINGS LTD NPV Common Stock,G1890L107,11953000.0,310946,0.14747448252224427,2022-11-03,2022-09-30,0001140361-22-039712
SYY,SYSCO CORP NPV Common Stock,871829107,11496000.0,162580,0.1418360788986631,2022-11-03,2022-09-30,0001140361-22-039712
AFW,ALIGN TECHNOLOGY INC USD0.0001 Common Stock,016255101,10913000.0,52693,0.1346431044729567,2022-11-03,2022-09-30,0001140361-22-039712
GNRC,GENERAC HOLDINGS INC USD0.01 Common Stock,368736104,10684000.0,59977,0.13181773372941163,2022-11-03,2022-09-30,0001140361-22-039712
BAH,BOOZ ALLEN HAMILTON HLDG CORP USD0.01 Class A Common Stock,099502106,10326000.0,111817,0.12740077859321458,2022-11-03,2022-09-30,0001140361-22-039712
UNP,UNION PACIFIC CORP USD2.50 Common Stock,907818108,8995000.0,46172,0.11097908226282832,2022-11-03,2022-09-30,0001140361-22-039712
IMCR,IMMUNOCORE HLDGS PLC Spon ADS Each Rep One Ord Shs,45258D105,8919000.0,190015,0.11004140463614961,2022-11-03,2022-09-30,0001140361-22-039712
MRVL,MARVELL TECHNOLOGY INC USD0.002 Common Stock,573874104,8856000.0,206393,0.10926411923508701,2022-11-03,2022-09-30,0001140361-22-039712
TT,TRANE TECHNOLOGIES PLC USD1 Common Stock,G8994E103,8605000.0,59421,0.1061673154943455,2022-11-03,2022-09-30,0001140361-22-039712
GE,GENERAL ELECTRIC CORP USD0.01 Com Stock (P/R Split),369604301,8505000.0,137382,0.10493352914345247,2022-11-03,2022-09-30,0001140361-22-039712
N/A,BROOKFIELD ASSET MGMT NPV Cls A Voting Shares,112585104,8359000.0,203253,0.10313220107114862,2022-11-03,2022-09-30,0001140361-22-039712
TIP,ISHARES TRUST Tips Bond ETF,464287176,8195000.0,78118,0.10110879145568405,2022-11-03,2022-09-30,0001140361-22-039712
RJAUSD,SWEDISH EXPORT CREDIT Lkd Rog Intl Com Idx - Agri,870297603,7898000.0,867943,0.09744444599353176,2022-11-03,2022-09-30,0001140361-22-039712
VPL,VANGUARD INTL EQUITY MSCI Pacific ETF,922042866,7659000.0,133335,0.0944956966148974,2022-11-03,2022-09-30,0001140361-22-039712
S,SENTINELONE INC USD0.0001 Cls A Common Stock,81730H109,7378000.0,288652,0.09102875696888799,2022-11-03,2022-09-30,0001140361-22-039712
EA,ELECTRONIC ARTS INC USD0.01 Common Stock,285512109,7350000.0,63523,0.09068329679063793,2022-11-03,2022-09-30,0001140361-22-039712
EWJ,ISHARES INC MSCI Japan New ETF (P/R Split),46434G822,7068000.0,144684,0.08720401928111958,2022-11-03,2022-09-30,0001140361-22-039712
BSV,VANGUARD BOND INDEX FUND Short Term Bond ETF,921937827,7024000.0,93881,0.08666115328672665,2022-11-03,2022-09-30,0001140361-22-039712
BF/B,BROWN-FORMAN CORP USD0.15 B Common Stock,115637209,7001000.0,105175,0.08637738242602125,2022-11-03,2022-09-30,0001140361-22-039712
VWO,VANGUARD INTL EQUITY FTSE Emerging Markets Idx ETF,922042858,6989000.0,191533,0.08622932806391408,2022-11-03,2022-09-30,0001140361-22-039712
NFLX,NETFLIX COM INC USD0.001 Common Stock,64110L106,6911000.0,29355,0.08526697471021752,2022-11-03,2022-09-30,0001140361-22-039712
TTWO,TAKE TWO INTERACTIVE INC USD0.01 Common Stock,874054109,6666000.0,61160,0.08224419815052958,2022-11-03,2022-09-30,0001140361-22-039712
JCI,JOHNSON CONTROLS INTL USD1 Common Stock,G51502105,6493000.0,131914,0.08010974776348463,2022-11-03,2022-09-30,0001140361-22-039712
BNS,BANK OF NOVA SCOTIA NPV Common Stock,064149107,6410000.0,134066,0.07908570509224341,2022-11-03,2022-09-30,0001140361-22-039712
NVS,NOVARTIS AG ADR Rep 1 CHF0.5 (Regd) Shares,66987V109,6207000.0,81661,0.07658111879993056,2022-11-03,2022-09-30,0001140361-22-039712
VT,VANGUARD INTL EQUITY Total World Stock Market ETF,922042742,5896000.0,74750,0.07274404324865323,2022-11-03,2022-09-30,0001140361-22-039712
EWU,ISHARES TRUST MSCI UK New ETF (Post Cons),46435G334,5717000.0,218122,0.07053556568055469,2022-11-03,2022-09-30,0001140361-22-039712
GH,GUARDANT HEALTH INC USD0.00001 Common Stock,40131M109,5710000.0,106082,0.07044920063599218,2022-11-03,2022-09-30,0001140361-22-039712
AXON,AXON ENTERPRISE INC USD0.00001 Common Stock,05464C101,5553000.0,47977,0.06851215606509013,2022-11-03,2022-09-30,0001140361-22-039712
DVY,ISHARES TRUST Select Dividend ETF,464287168,4935000.0,46031,0.06088735641657118,2022-11-03,2022-09-30,0001140361-22-039712
BND,VANGUARD BOND INDEX FUND Total Bond Market ETF,921937835,4891000.0,68571,0.06034449042217825,2022-11-03,2022-09-30,0001140361-22-039712
CM,CANADIAN IMPERIAL BANK NPV Common Stock,136069101,4870000.0,110686,0.06008539528849071,2022-11-03,2022-09-30,0001140361-22-039712
GIS,GENERAL MILLS INC USD0.10 Common Stock,370334104,4715000.0,61550,0.058173026444606514,2022-11-03,2022-09-30,0001140361-22-039712
IXN,ISHARES TRUST Global Technology ETF,464287291,4665000.0,110599,0.05755613326915999,2022-11-03,2022-09-30,0001140361-22-039712
N/A,CANADIAN PACIFIC RAILWAYS INC NPV Common Stock,13645T100,4555000.0,68016,0.05619896828317765,2022-11-03,2022-09-30,0001140361-22-039712
BLKCHF,BLACKROCK INC NPV Class A Common Stock,09247X101,4470000.0,8123,0.055150249884918574,2022-11-03,2022-09-30,0001140361-22-039712
EMR,EMERSON ELECTRIC CO USD0.50 Common Stock,291011104,4329000.0,59117,0.0534106111301594,2022-11-03,2022-09-30,0001140361-22-039712
ABX,BARRICK GOLD CORP NPV Common Stock (USD),067901108,4297000.0,276452,0.05301579949787363,2022-11-03,2022-09-30,0001140361-22-039712
N/A,EATON CORPORATION PLC USD0.50 Common Stock,G29183103,4288000.0,32150,0.05290475872629326,2022-11-03,2022-09-30,0001140361-22-039712
BABA,ALIBABA GROUP HOLDINGS LTD Spon ADS Each Rep 1 Ord,01609W102,4159000.0,51989,0.05131317433364125,2022-11-03,2022-09-30,0001140361-22-039712
SBUX,STARBUCKS CORP USD0.001 Common Stock,855244109,4092000.0,48562,0.05048653747854291,2022-11-03,2022-09-30,0001140361-22-039712
NTRS,NORTHERN TRUST CORP USD1.666 Common Stock,665859104,3699000.0,43238,0.045637757119533294,2022-11-03,2022-09-30,0001140361-22-039712
EEM,ISHARES TRUST MSCI Emerging Markets ETF,464287234,3668000.0,105157,0.04525528335075645,2022-11-03,2022-09-30,0001140361-22-039712
TRUP,TRUPANION INC USD0.00001 Common Stock,898202106,3567000.0,60025,0.04400915913635449,2022-11-03,2022-09-30,0001140361-22-039712
INTC,INTEL CORP USD0.001 Common Stock,458140100,3546000.0,137593,0.043750064002666955,2022-11-03,2022-09-30,0001140361-22-039712
ZBH,ZIMMER BIOMET HOLDINGS INC USD0.01 Common Stock,98956P102,3526000.0,33726,0.043503306732488346,2022-11-03,2022-09-30,0001140361-22-039712
TRI4EUR,THOMSON REUTERS CORP NPV Com Stk (Post Rev Split),884903709,3497000.0,33884,0.04314550869072937,2022-11-03,2022-09-30,0001140361-22-039712
AQUAUSD,EVOQUA WATER TECHNOLOGIES CORP USD0.01 Common Stock,30057T105,3467000.0,104835,0.04277537278546146,2022-11-03,2022-09-30,0001140361-22-039712
BMI,BADGER METER INC USD1 Common Stock,056525108,3439000.0,37220,0.042429912607211406,2022-11-03,2022-09-30,0001140361-22-039712
PM,PHILIP MORRIS INTL INC NPV Common Stock,718172109,3316000.0,39953,0.04091235539561298,2022-11-03,2022-09-30,0001140361-22-039712
BRK/A,BERKSHIRE HATHAWAY INC USD5 Class A Common Stock,084670108,3252000.0,8,0.040122732131041436,2022-11-03,2022-09-30,0001140361-22-039712
MCHP,MICROCHIP TECHNOLOGY INC USD0.001 Common Stock,595017104,3233000.0,52981,0.03988831272437176,2022-11-03,2022-09-30,0001140361-22-039712
8DT,SQUARESPACE INC USD0.0001 Class A Common Stock,85225A107,3187000.0,149190,0.03932077100296096,2022-11-03,2022-09-30,0001140361-22-039712
T,AT&T INC USD1 Common Stock,00206R102,3092000.0,201559,0.03814867396961258,2022-11-03,2022-09-30,0001140361-22-039712
UTF,COHEN & STEERS INFRASTRUCTURE USD0.001 Common Stock,19248A109,3046000.0,131076,0.03758113224820178,2022-11-03,2022-09-30,0001140361-22-039712
EPP,ISHARES INC MSCI Pacific Ex Japan ETF,464286665,2974000.0,79270,0.036692806075558804,2022-11-03,2022-09-30,0001140361-22-039712
PICB,INVESCO EXCHANGE TRADING Intl Corp Bond ETF,46138E636,2966000.0,154314,0.03659410316748736,2022-11-03,2022-09-30,0001140361-22-039712
K,KELLOGG CO USD0.25 Common Stock,487836108,2908000.0,41749,0.0358785070839694,2022-11-03,2022-09-30,0001140361-22-039712
BALL,BALL CORP NPV Common Stock,058498106,2891000.0,59838,0.035668763404317586,2022-11-03,2022-09-30,0001140361-22-039712
IGSB,ISHARES TRUST Barclays 1-3 Yr Credit Bond Fd,464288646,2890000.0,58640,0.03565642554080866,2022-11-03,2022-09-30,0001140361-22-039712
BMO,BANK OF MONTREAL NPV Common Stock,063671101,2807000.0,31853,0.034632382869567435,2022-11-03,2022-09-30,0001140361-22-039712
CSL,CARLISLE COS INC USD1 Common Stock,142339100,2804000.0,10000,0.034595369279040646,2022-11-03,2022-09-30,0001140361-22-039712
IBND,SPDR SERIES TRUST Barclays Cap Intl Corp Bd ETF,78464A151,2799000.0,111559,0.034533679961496,2022-11-03,2022-09-30,0001140361-22-039712
CCK,CROWN HOLDINGS INC USD5 Common Stock,228368106,2799000.0,34539,0.034533679961496,2022-11-03,2022-09-30,0001140361-22-039712
VCIT,VANGUARD INVESTMENTS Inter-Term Corp Bd Index ETF,92206C870,2735000.0,36136,0.03374405669692446,2022-11-03,2022-09-30,0001140361-22-039712
LFUS,LITTELFUSE INC USD0.01 Common Stock,537008104,2702000.0,13597,0.03333690720112976,2022-11-03,2022-09-30,0001140361-22-039712
TD,TORONTO-DOMINION BANK NPV Common Stock,891160509,2656000.0,43079,0.03276936547971896,2022-11-03,2022-09-30,0001140361-22-039712
IWM,ISHARES TRUST Russell 2000 ETF,464287655,2638000.0,15996,0.032547283936558216,2022-11-03,2022-09-30,0001140361-22-039712
IBM,IBM CORP USD0.20 Common Stock,459200101,2600000.0,21883,0.03207844512321886,2022-11-03,2022-09-30,0001140361-22-039712
SQM,SOCIEDAD QUIMICA Y MINERA ADR Each Rep 1 Ser B Pref Shs,833635105,2595000.0,28597,0.03201675580567421,2022-11-03,2022-09-30,0001140361-22-039712
TRMB,TRIMBLE INC NPV Common Stock,896239100,2580000.0,47533,0.031831687853040254,2022-11-03,2022-09-30,0001140361-22-039712
GII,SPDR INDEX SHARES S&P Gbl Infrastructure ETF,78463X855,2569000.0,53774,0.03169597135444202,2022-11-03,2022-09-30,0001140361-22-039712
OC,OWENS CORNING INC USD0.01 Common Stock,690742101,2550000.0,32440,0.031461551947772344,2022-11-03,2022-09-30,0001140361-22-039712
NEM,NEWMONT CORP USD1.60 Common Stock,651639106,2545000.0,60542,0.03139986263022769,2022-11-03,2022-09-30,0001140361-22-039712
MXCT,MAXCYTE INC USD0.01 Ordinary Shares,57777K106,2501000.0,386602,0.030856996635834757,2022-11-03,2022-09-30,0001140361-22-039712
KMB,KIMBERLY CLARK CORP NPV Common Stock,494368103,2460000.0,21860,0.030351144231968614,2022-11-03,2022-09-30,0001140361-22-039712
BCE,BCE INC NPV Common Stock,05534B760,2457000.0,58285,0.030314130641441825,2022-11-03,2022-09-30,0001140361-22-039712
DOV,DOVER CORP USD1 Common Stock,260003108,2403000.0,20613,0.029647886011959584,2022-11-03,2022-09-30,0001140361-22-039712
MDT,MEDTRONIC PLC USD0.0001 Common Stock,G5960L103,2369000.0,29342,0.029228398652655956,2022-11-03,2022-09-30,0001140361-22-039712
