ticker,nameOfIssuer,cusip,value,shares,allocation_percent,filingDate,reportDate,accessionNumber
NTR,NUTRIEN LTD NPV Common Stock,67077M108,2346000.0,28126,0.028944627791950554,2022-11-03,2022-09-30,0001140361-22-039712
YUM,YUM BRANDS INC NPV Common Stock,988498101,2157000.0,20280,0.026612771588762723,2022-11-03,2022-09-30,0001140361-22-039712
ILMN,ILLUMINA INC USD0.01 Common Stock,452327109,2117000.0,11097,0.026119257048405512,2022-11-03,2022-09-30,0001140361-22-039712
COP,CONOCOPHILLIPS INC USD0.01 Common Stock,20825C104,2105000.0,20568,0.025971202686298347,2022-11-03,2022-09-30,0001140361-22-039712
TECH,BIO-TECHNE CORP USD0.01 Common Stock,09073M104,2096000.0,7380,0.02586016191471797,2022-11-03,2022-09-30,0001140361-22-039712
GS,GOLDMAN SACHS GROUP USD0.01 Common Stock,38141G104,2084000.0,7110,0.025712107552610806,2022-11-03,2022-09-30,0001140361-22-039712
UBER,UBER TECHNOLOGIES USD0.00001 Common Stock,90353T100,2058000.0,77644,0.02539132310137862,2022-11-03,2022-09-30,0001140361-22-039712
AEM,AGNICO EAGLE MINES LTD NPV Common Stock,008474108,2030000.0,47854,0.025045862923128572,2022-11-03,2022-09-30,0001140361-22-039712
GLW,CORNING INC USD0.50 Common Stock,219350105,1959000.0,67498,0.024169874613994516,2022-11-03,2022-09-30,0001140361-22-039712
LYV,LIVE NATIONS ENTERAINMENT INC USD0.01 Common Stock,538034109,1930000.0,25376,0.023812076572235538,2022-11-03,2022-09-30,0001140361-22-039712
BMY,BRISTOL-MYERS SQUIBB CO NPV Common Stock,110122108,1888000.0,26552,0.023293886304860463,2022-11-03,2022-09-30,0001140361-22-039712
BX,BLACKSTONE GROUP INC USD0.00001 Common Stock,09260D107,1818000.0,21720,0.022430235859235342,2022-11-03,2022-09-30,0001140361-22-039712
BKR,BAKER HUGHES COMPANY USD0.0001 Cls A Common Stock,05722G100,1773000.0,84568,0.021875032001333478,2022-11-03,2022-09-30,0001140361-22-039712
MCO,MOODYS CORP USD0.01 Common Stock,615369105,1718000.0,7066,0.02119644950834231,2022-11-03,2022-09-30,0001140361-22-039712
KHC,KRAFT HEINZ CO NPV Common Stock,500754106,1641000.0,49216,0.020246434018154673,2022-11-03,2022-09-30,0001140361-22-039712
VCSH,VANGUARD SCOTTSDAL Short Term Corp Bond Index ETF,92206C409,1615000.0,21739,0.019925649566922485,2022-11-03,2022-09-30,0001140361-22-039712
IOO,ISHARES TRUST Global 100 ETF,464287572,1599000.0,26872,0.019728243750779598,2022-11-03,2022-09-30,0001140361-22-039712
AXP,AMERICAN EXPRESS CORP USD0.20 Common Stock,025816109,1548000.0,11476,0.01909901271182415,2022-11-03,2022-09-30,0001140361-22-039712
TPL,TEXAS PACIFIC LAND CORP USD0.01 Common Stock,88262P102,1546000.0,870,0.01907433698480629,2022-11-03,2022-09-30,0001140361-22-039712
BYND 0 03/15/27,BEYOND MEAT INC 0 Conv Snr Nts 15/03/2027,08862EAB5,1519000.0,5000000,0.018741214670065173,2022-11-03,2022-09-30,0001140361-22-039712
KDP,KEURIG DR PEPPER USD0.01 Common Stock,49271V100,1516000.0,42331,0.018704201079538383,2022-11-03,2022-09-30,0001140361-22-039712
AME,AMETEK INC NPV Common Stock,031100100,1500000.0,13227,0.018506795263395496,2022-11-03,2022-09-30,0001140361-22-039712
IJH,ISHARES TRUST Core S&P Mid-Cap ETF,464287507,1499000.0,6835,0.018494457399886564,2022-11-03,2022-09-30,0001140361-22-039712
CLX,CLOROX CO USD1 Common Stock,189054109,1471000.0,11460,0.018148997221636518,2022-11-03,2022-09-30,0001140361-22-039712
JXN,JACKSON FINANCIAL INC USD0.01 Cls A Common Stock WI,46817M107,1464000.0,52759,0.018062632177074003,2022-11-03,2022-09-30,0001140361-22-039712
WM,WASTE MANAGEMENT INC NPV Common Stock,94106L109,1463000.0,9130,0.018050294313565075,2022-11-03,2022-09-30,0001140361-22-039712
IWP,ISHARES TRUST Russell Midcap Growth ETF,464287481,1391000.0,17730,0.01716196814092209,2022-11-03,2022-09-30,0001140361-22-039712
MCX,MCCORMICK & CO INC NPV Non Vtg Common Stock,579780206,1384000.0,19422,0.017075603096359578,2022-11-03,2022-09-30,0001140361-22-039712
MFC,MANULIFE FINANCIAL CORP NPV Common Stock,56501R106,1384000.0,87700,0.017075603096359578,2022-11-03,2022-09-30,0001140361-22-039712
SKYY,FIRST TRUST Cloud Computing ETF,33734X192,1379000.0,22822,0.017013913778814924,2022-11-03,2022-09-30,0001140361-22-039712
PLTR,PALANTIR TECHNOLOGIES INC USD0.001 Cls A Common Stock,69608A108,1371000.0,168626,0.016915210870743484,2022-11-03,2022-09-30,0001140361-22-039712
WPS,ISHARES TRUST Intl Developed Prop ETF,464288422,1348000.0,54318,0.016631440010038086,2022-11-03,2022-09-30,0001140361-22-039712
HPE,HEWLETT-PACKARD CORP USD0.01 Common Stock,42824C109,1346000.0,112335,0.016606764283020225,2022-11-03,2022-09-30,0001140361-22-039712
ABMDEUR,ABIOMED INC USD0.01 Common Stock,003654100,1327000.0,5400,0.01637234487635055,2022-11-03,2022-09-30,0001140361-22-039712
DAVA,ENDAVA PLC Spon ADS Each Rep 1 Ord Shares,29260V105,1321000.0,16380,0.01629831769529697,2022-11-03,2022-09-30,0001140361-22-039712
PHM,PULTE GROUP INC USD0.01 Common Stock,745867101,1314000.0,35045,0.016211952650734454,2022-11-03,2022-09-30,0001140361-22-039712
VTWO,VANGUARD INVESTMENTS Russell 2000 ETF,92206C664,1310000.0,19663,0.016162601196698732,2022-11-03,2022-09-30,0001140361-22-039712
DXJ,WISDOMTREE TRUST Japan Hedged Equity Fund,97717W851,1216000.0,19721,0.015002842026859281,2022-11-03,2022-09-30,0001140361-22-039712
VNT,VONTIER CORP USD0.0001 Common Stock,928881101,1199000.0,71776,0.014793098347207467,2022-11-03,2022-09-30,0001140361-22-039712
EZU,ISHARES INC MSCI EMU ETF,464286608,1185000.0,37064,0.01462036825808244,2022-11-03,2022-09-30,0001140361-22-039712
ACWV,ISHARES INC Edge MSCI Min Vol Gbl Mkts ETF,464286525,1126000.0,12719,0.013892434311055553,2022-11-03,2022-09-30,0001140361-22-039712
AOS,SMITH (AO) CORP USD1 Common Stock,831865209,1108000.0,22800,0.013670352767894807,2022-11-03,2022-09-30,0001140361-22-039712
SUSA,ISHARES TRUST MSCI USA ESG Select ETF,464288802,1063000.0,14000,0.013115148909992942,2022-11-03,2022-09-30,0001140361-22-039712
FSLR,FIRST SOLAR INC USD0.001 Common Stock,336433107,1061000.0,8023,0.013090473182975081,2022-11-03,2022-09-30,0001140361-22-039712
CIBR,FIRST TRUST NASDAQ Cybersecurity ETF,33734X846,1047000.0,27197,0.012917743093850055,2022-11-03,2022-09-30,0001140361-22-039712
WMT,WAL-MART STORES INC USD0.1 Common Stock,931142103,1040000.0,8016,0.012831378049287545,2022-11-03,2022-09-30,0001140361-22-039712
FEUZ,FIRST TRUST Eurozone AlphaDEX ETF,33737J505,1033000.0,35595,0.012745013004725032,2022-11-03,2022-09-30,0001140361-22-039712
ICLN,ISHARES TRUST S&P Global Clean Energy Index,464288224,1032000.0,54075,0.012732675141216102,2022-11-03,2022-09-30,0001140361-22-039712
PH,PARKER-HANNIFIN CORP USD0.50 Common Stock,701094104,1006000.0,4150,0.012411890689983912,2022-11-03,2022-09-30,0001140361-22-039712
N/A,GOLAR LNG USD1 Common Stock,G9456A100,997000.0,40000,0.012300849918403538,2022-11-03,2022-09-30,0001140361-22-039712
GRID,FIRST TRUST NASDAQ Clean Edge Smart Grid,33737A108,994000.0,13211,0.012263836327876747,2022-11-03,2022-09-30,0001140361-22-039712
RSG,REPUBLIC SERVICES INC USD0.01 Common Stock,760759100,978000.0,7187,0.012066430511733863,2022-11-03,2022-09-30,0001140361-22-039712
LMNR,LIMONEIRA CORP NPV Common Stock,532746104,967000.0,73360,0.01193071401313563,2022-11-03,2022-09-30,0001140361-22-039712
PSLV/U,SPROTT ASSET MGMT Physical Silver,85207K107,926000.0,139920,0.011424861609269487,2022-11-03,2022-09-30,0001140361-22-039712
VHT,VANGUARD WORLD FUNDS Healthcare ETF,92204A504,923000.0,4124,0.011387848018742696,2022-11-03,2022-09-30,0001140361-22-039712
IXC,ISHARES TRUST Global Energy ETF,464287341,918000.0,27548,0.011326158701198043,2022-11-03,2022-09-30,0001140361-22-039712
FJP,FIRST TRUST Japan AlphaDEX ETF,33737J158,899000.0,23814,0.011091739294528367,2022-11-03,2022-09-30,0001140361-22-039712
APA,APA CORP USD0.625 Common Stock,03743Q108,886000.0,25900,0.010931347068912273,2022-11-03,2022-09-30,0001140361-22-039712
SHEL,SHELL PLC Spon ADS Ea Rep 2 Ord Shs,780259305,831000.0,16700,0.010252764575921105,2022-11-03,2022-09-30,0001140361-22-039712
VTI,VANGUARD INDEX FUNDS Total Stock Market ETF,922908769,816000.0,4549,0.01006769662328715,2022-11-03,2022-09-30,0001140361-22-039712
CCJ,CAMECO CORP NPV Common Stock,13321L108,807000.0,30420,0.009956655851706778,2022-11-03,2022-09-30,0001140361-22-039712
L,LOEWS CORP USD1 Common Stock,540424108,748000.0,15000,0.009228721904679887,2022-11-03,2022-09-30,0001140361-22-039712
MELI,MERCADOLIBRE INC USD0.001 Common Stock,58733R102,730000.0,882,0.00900664036151914,2022-11-03,2022-09-30,0001140361-22-039712
CNI,CANADIAN NATIONAL RAILWAYS CO NPV Common Stock,136375102,717000.0,6600,0.008846248135903047,2022-11-03,2022-09-30,0001140361-22-039712
FKU,FIRST TRUST UK AlphaDEX ETF,33737J224,714000.0,26651,0.008809234545376255,2022-11-03,2022-09-30,0001140361-22-039712
MXL,MAXLINEAR INC USD0.01 Common Stock,57776J100,711000.0,21805,0.008772220954849466,2022-11-03,2022-09-30,0001140361-22-039712
ICLR,ICON PLC EUR0.06 Ordinary Shares,G4705A100,698000.0,3800,0.008611828729233372,2022-11-03,2022-09-30,0001140361-22-039712
SFL,SFL CORP LTD USD0.01 Common Stock,G7738W106,683000.0,75000,0.008426760776599415,2022-11-03,2022-09-30,0001140361-22-039712
HL,HECLA MINING CO USD0.25 Common Stock,422704106,681000.0,172750,0.008402085049581554,2022-11-03,2022-09-30,0001140361-22-039712
XYZ,BLOCK INC USD0.0000001 Cls A Com Stock,852234103,667000.0,12131,0.00822935496045653,2022-11-03,2022-09-30,0001140361-22-039712
AU3EUR,ANGLOGOLD ASHANTI LTD LVL1 ADR Rep 1 ZAR0.25 Com Stk,035128206,657000.0,47562,0.008105976325367227,2022-11-03,2022-09-30,0001140361-22-039712
SUSB,ISHARES TRUST ESG Aware 1-5 Yr USD Cp Bd ETF,46435G243,646000.0,27500,0.007970259826768994,2022-11-03,2022-09-30,0001140361-22-039712
BA,BOEING CO USD5 Common Stock,097023105,641000.0,5298,0.007908570509224342,2022-11-03,2022-09-30,0001140361-22-039712
8CW,CROWN CASTLE INTL CORP USD0.01 Common Stock,22822V101,629000.0,4354,0.007760516147117177,2022-11-03,2022-09-30,0001140361-22-039712
STIP,ISHARES TRUST 0-5 Year TIPS Bond ETF,46429B747,603000.0,6278,0.00743973169588499,2022-11-03,2022-09-30,0001140361-22-039712
VB,VANGUARD INDEX FUNDS Small Cap ETF,922908751,600000.0,3513,0.007402718105358199,2022-11-03,2022-09-30,0001140361-22-039712
SDG,ISHARES TRUST MSCI Global Impact ETF,46435G532,597000.0,8419,0.007365704514831407,2022-11-03,2022-09-30,0001140361-22-039712
WY,WEYERHAUSER CO USD1.25 Common Stock,962166104,583000.0,20400,0.007192974425706382,2022-11-03,2022-09-30,0001140361-22-039712
BK,BANK OF NEW YORK MELLON CORP USD0.01 Common Stock,064058100,575000.0,14917,0.00709427151763494,2022-11-03,2022-09-30,0001140361-22-039712
FAST,FASTENAL COMPANY USD0.01 Common Stock,311900104,571000.0,12403,0.007044920063599218,2022-11-03,2022-09-30,0001140361-22-039712
PEN,PENUMBRA INC USD0.001 Common Stock,70975L107,569000.0,3000,0.0070202443365813575,2022-11-03,2022-09-30,0001140361-22-039712
VFH,VANGUARD WORLD FUNDS Financials ETF,92204A405,568000.0,7631,0.007007906473072429,2022-11-03,2022-09-30,0001140361-22-039712
MMM,3M COMPANY USD0.01 Common Stock,88579Y101,565000.0,5111,0.0069708928825456375,2022-11-03,2022-09-30,0001140361-22-039712
FTSM,FIRST TRUST Enhanced Short Maturity ETF,33739Q408,562000.0,9475,0.006933879292018846,2022-11-03,2022-09-30,0001140361-22-039712
CSCO,CISCO SYSTEMS INC USD0.001 Common Stock,17275R102,556000.0,13905,0.006859852110965264,2022-11-03,2022-09-30,0001140361-22-039712
MKL,MARKEL CORP NPV Common Stock,570535104,540000.0,498,0.006662446294822379,2022-11-03,2022-09-30,0001140361-22-039712
PPG,PPG INDUSTRIES INC USD1.666 Common Stock,693506107,533000.0,4817,0.006576081250259866,2022-11-03,2022-09-30,0001140361-22-039712
BLDP,BALLARD POWER SYSTEMS NPV Common Stock,058586108,522000.0,85222,0.006440364751661632,2022-11-03,2022-09-30,0001140361-22-039712
LHX,L3 HARRIS TECHNOLOGIES INC USD1.00 Common Stock,502431109,516000.0,2484,0.006366337570608051,2022-11-03,2022-09-30,0001140361-22-039712
ALB,ALBEMARLE CORP USD0.01 Common Stock,012653101,505000.0,1911,0.006230621072009817,2022-11-03,2022-09-30,0001140361-22-039712
APD,AIR PRODUCTS & CHEMICALS INC USD1 Common Stock,009158106,493000.0,2120,0.006082566709902653,2022-11-03,2022-09-30,0001140361-22-039712
SWK,STANLEY BLACK & DECKER INC USD2.50 Common Stock,854502101,490000.0,6516,0.006045553119375862,2022-11-03,2022-09-30,0001140361-22-039712
WBA,WALGREENS BOOTS ALLIANCE USD0.01 Common Stock,931427108,488000.0,15532,0.006020877392358001,2022-11-03,2022-09-30,0001140361-22-039712
SUSC,ISHARES TRUST ESG Aware USD Corp Bond ETF,46435G193,484000.0,22200,0.00597152593832228,2022-11-03,2022-09-30,0001140361-22-039712
WDAY,WORKDAY INC USD0.001 Cls A Common Stock,98138H101,483000.0,3175,0.00595918807481335,2022-11-03,2022-09-30,0001140361-22-039712
VNQ,VANGUARD INDEX FUNDS REIT ETF (USD),922908553,467000.0,5826,0.005761782258670464,2022-11-03,2022-09-30,0001140361-22-039712
ADAP,ADAPTIMMUNE THERAPEUTICS PLC Spon ADS Each Rep 6 Ord Shs,00653A107,465000.0,432818,0.0057371065316526035,2022-11-03,2022-09-30,0001140361-22-039712
PFF,ISHARES TRUST S&P US Pref Stock Index Fund,464288687,459000.0,14506,0.005663079350599022,2022-11-03,2022-09-30,0001140361-22-039712
FPA,FIRST TRUST Asia Pac Ex Jpn AlphaDEX ETF,33737J109,458000.0,20306,0.005650741487090091,2022-11-03,2022-09-30,0001140361-22-039712
ADM,ARCHER-DANIELS-MIDLAND CO NPV Common Stock,039483102,454000.0,5642,0.00560139003305437,2022-11-03,2022-09-30,0001140361-22-039712
PACK,RANPAK HLDGS CORP USD0.0001 Cls A Common Stock,75321W103,450000.0,131700,0.005552038579018649,2022-11-03,2022-09-30,0001140361-22-039712
N/A,WILLIS TOWERS WATSON PLC USD0.000304635 Common Stock,G96629103,448000.0,2230,0.005527362852000788,2022-11-03,2022-09-30,0001140361-22-039712
MRNA,MODERNA INC USD0.0001 Common Stock,60770K107,445000.0,3762,0.005490349261473997,2022-11-03,2022-09-30,0001140361-22-039712
VONG,VANGUARD SCOTTSDAL Russell 1000 Growth Index ETF,92206C680,445000.0,8200,0.005490349261473997,2022-11-03,2022-09-30,0001140361-22-039712
GDX,VANECK VECTORS ETF Gold Miners ETF,92189F106,444000.0,18400,0.005478011397965067,2022-11-03,2022-09-30,0001140361-22-039712
UNH,UNITED HEALTHCARE CORP USD0.01 Common Stock,91324P102,426000.0,843,0.005255929854804321,2022-11-03,2022-09-30,0001140361-22-039712
HYLS,FIRST TRUST High Yield Long/Short ETF,33738D408,425000.0,11100,0.005243591991295391,2022-11-03,2022-09-30,0001140361-22-039712
IGM,ISHARES TRUST North American Technology ETF,464287549,423000.0,1530,0.00521891626427753,2022-11-03,2022-09-30,0001140361-22-039712
EXAS,EXACT SCIENCES CORP USD0.01 Common Stock,30063P105,416000.0,12800,0.005132551219715017,2022-11-03,2022-09-30,0001140361-22-039712
IWB,ISHARES TRUST Russell 1000 ETF,464287622,413000.0,2095,0.0050955376291882265,2022-11-03,2022-09-30,0001140361-22-039712
ARES,ARES MANAGEMENT CORP USD0.01 Cls A Common Stock,03990B101,406000.0,6550,0.005009172584625714,2022-11-03,2022-09-30,0001140361-22-039712
TTEK,TETRA TECH INC USD0.01 Common Stock,88162G103,406000.0,3160,0.005009172584625714,2022-11-03,2022-09-30,0001140361-22-039712
MDY,SPDR SERIES TRUST S&P MidCap 400 ETF,78467Y107,402000.0,1000,0.004959821130589993,2022-11-03,2022-09-30,0001140361-22-039712
VIG,VANGUARD SPECIALIZED FUNDS Dividend Appreciation ETF,921908844,402000.0,2975,0.004959821130589993,2022-11-03,2022-09-30,0001140361-22-039712
MOS,MOSAIC CO USD0.01 Common Stock,61945C103,396000.0,8200,0.004885793949536411,2022-11-03,2022-09-30,0001140361-22-039712
TXN,TEXAS INSTRUMENTS INC Common Stock,882508104,395000.0,2550,0.00487345608602748,2022-11-03,2022-09-30,0001140361-22-039712
AMT,AMER TOWER CORP USD0.01 New Common Stock,03027X100,394000.0,1834,0.00486111822251855,2022-11-03,2022-09-30,0001140361-22-039712
VGK,VANGUARD INTL EQUITY European ETF,922042874,391000.0,8467,0.004824104631991759,2022-11-03,2022-09-30,0001140361-22-039712
EOG,EOG RESOURCES INC USD0.01 Common Stock,26875P101,391000.0,3500,0.004824104631991759,2022-11-03,2022-09-30,0001140361-22-039712
KKR,KKR & CO INC NPV Class A Common Stock,48251W104,387000.0,9000,0.0047747531779560376,2022-11-03,2022-09-30,0001140361-22-039712
CRM,SALESFORCE.COM INC USD0.001 Common Stock,79466L302,385000.0,2680,0.0047500774509381775,2022-11-03,2022-09-30,0001140361-22-039712
OXY,OCCIDENTAL PETROLEUM CORP USD0.20 Common Stock,674599105,384000.0,6249,0.004737739587429247,2022-11-03,2022-09-30,0001140361-22-039712
STWD,STARWOOD PROPERTY TRUST INC USD0.01 Common Stock,85571B105,384000.0,21070,0.004737739587429247,2022-11-03,2022-09-30,0001140361-22-039712
CMCSA,COMCAST CORP USD1 A Common Stock,20030N101,384000.0,13105,0.004737739587429247,2022-11-03,2022-09-30,0001140361-22-039712
XME,SPDR SERIES TRUST S&P Metals & Mining ETF,78464A755,379000.0,8921,0.004676050269884596,2022-11-03,2022-09-30,0001140361-22-039712
TTD,THE TRADE DESK INC USD0.000001 Cls A Common Stock,88339J105,372000.0,6225,0.0045896852253220835,2022-11-03,2022-09-30,0001140361-22-039712
VXF,VANGUARD INDEX FUNDS Extended Market ETF,922908652,362000.0,2845,0.00446630659023278,2022-11-03,2022-09-30,0001140361-22-039712
IR,INGERSOLL RAND INC USD1 Common Stock,45687V106,359000.0,8293,0.004429292999705989,2022-11-03,2022-09-30,0001140361-22-039712
ABNB,AIRBNB INC USD0.0001 Class A Common Stock,009066101,357000.0,3397,0.004404617272688128,2022-11-03,2022-09-30,0001140361-22-039712
WBD,WARNER BROS DISCOVERY INC USD0.01 Ser A Common Stock,934423104,355000.0,30891,0.004379941545670268,2022-11-03,2022-09-30,0001140361-22-039712
FEM,FIRST TRUST Emerging Markets AlphaDEX ETF,33737J182,351000.0,18986,0.004330590091634546,2022-11-03,2022-09-30,0001140361-22-039712
7HP,HP INC USD0.01 Common Stock,40434L105,347000.0,13935,0.004281238637598825,2022-11-03,2022-09-30,0001140361-22-039712
GXO,GXO LOGISTICS INC (WI) USD0.01 Common Stock,36262G101,342000.0,9747,0.004219549320054173,2022-11-03,2022-09-30,0001140361-22-039712
MKC/V,MCCORMICK & CO INC NPV Vtg Common Stock,579780107,337000.0,4600,0.0041578600025095214,2022-11-03,2022-09-30,0001140361-22-039712
FNX,FIRST TRUST Mid Cap Core AlphaDEX ETF,33735B108,335000.0,4177,0.0041331842754916606,2022-11-03,2022-09-30,0001140361-22-039712
LUV,SOUTHWEST AIRLINES CO USD1 Common Stock,844741108,335000.0,10865,0.0041331842754916606,2022-11-03,2022-09-30,0001140361-22-039712
N/A,SILK ROAD MEDICAL INC USD0.001 Common Stock,82710M100,335000.0,7450,0.0041331842754916606,2022-11-03,2022-09-30,0001140361-22-039712
AMD,ADVANCED MICRO DEVICES INC USD0.01 Common Stock,007903107,326000.0,5146,0.004022143503911288,2022-11-03,2022-09-30,0001140361-22-039712
TECK,TECK RESOURCES LTD NPV Cls B Sub-Vtg Common Stock,878742204,321000.0,10550,0.003960454186366636,2022-11-03,2022-09-30,0001140361-22-039712
UL,UNILEVER PLC ADS Ea Rep 1 Ord Share,904767704,318000.0,7260,0.003923440595839846,2022-11-03,2022-09-30,0001140361-22-039712
ORCL,ORACLE CORP USD0.01 Common Stock,68389X105,311000.0,5100,0.003837075551277333,2022-11-03,2022-09-30,0001140361-22-039712
SJM,JM SMUCKER CO NPV Common Stock,832696405,309000.0,2250,0.003812399824259472,2022-11-03,2022-09-30,0001140361-22-039712
SYK,STRYKER CORP USD0.10 Common Stock,863667101,306000.0,1510,0.003775386233732681,2022-11-03,2022-09-30,0001140361-22-039712
AUID,IPSIDY INC USD0.0001 Common Stock,46264C206,301000.0,104283,0.00371369691618803,2022-11-03,2022-09-30,0001140361-22-039712
CVS,CVS CORP USD0.01 Common Stock,126650100,291000.0,3052,0.003590318281098726,2022-11-03,2022-09-30,0001140361-22-039712
OIH,VANECK VECTORS ETF Oil Services ETF (Post Rev Sp),92189H607,289000.0,1370,0.0035656425540808658,2022-11-03,2022-09-30,0001140361-22-039712
VBR,VANGUARD INDEX FUNDS Small Cap Value ETF,922908611,287000.0,2000,0.003540966827063005,2022-11-03,2022-09-30,0001140361-22-039712
LMBS,FIRST TRUST Low Dur Mortgage Opps ETF,33739Q200,287000.0,6052,0.003540966827063005,2022-11-03,2022-09-30,0001140361-22-039712
AWC,AMERICAN WATER WORKS USD0.01 Common Stock,030420103,280000.0,2150,0.0034546017825004926,2022-11-03,2022-09-30,0001140361-22-039712
TGT,TARGET CORP USD0.0833 Common Stock,87612E106,280000.0,1890,0.0034546017825004926,2022-11-03,2022-09-30,0001140361-22-039712
COPX,GLOBAL X FUNDS Copper Miners ETF,37954Y830,280000.0,9925,0.0034546017825004926,2022-11-03,2022-09-30,0001140361-22-039712
HAL,HALLIBURTON CORP NPV Common Stock,406216101,279000.0,11321,0.003442263918991562,2022-11-03,2022-09-30,0001140361-22-039712
CGAU,CENTERRA GOLD INC NPV Common Stock,152006102,274000.0,62000,0.0033805746014469104,2022-11-03,2022-09-30,0001140361-22-039712
MTCH,MATCH GROUP INC NEW USD0.001 Common Stock,57667L107,272000.0,5700,0.0033558988744290504,2022-11-03,2022-09-30,0001140361-22-039712
AVGO,BROADCOM CORP USD1 Common Stock,11135F101,271000.0,610,0.00334356101092012,2022-11-03,2022-09-30,0001140361-22-039712
AMR,ALPHA METALLURGICA RESOURCES USD0.01 Common Stock,020764106,260000.0,1900,0.0032078445123218864,2022-11-03,2022-09-30,0001140361-22-039712
CB,CHUBB LTD CHF24.15 Ordinary Shares,H1467J104,253000.0,1391,0.0031214794677593737,2022-11-03,2022-09-30,0001140361-22-039712
IVV,ISHARES TRUST Core S&P 500 ETF,464287200,250000.0,698,0.0030844658772325824,2022-11-03,2022-09-30,0001140361-22-039712
NVO,NOVO-NORDISK AS ADR Rep 1 DKK1 Cls B Shares,670100205,249000.0,2500,0.003072128013723652,2022-11-03,2022-09-30,0001140361-22-039712
KWEB,KRANESHARES TRUST CSI China Internet ETF (USD),500767306,246000.0,10000,0.0030351144231968614,2022-11-03,2022-09-30,0001140361-22-039712
U,UNITY SOFTWARE INC USD0.000005 Common Stock,91332U101,241000.0,7553,0.0029734251056522097,2022-11-03,2022-09-30,0001140361-22-039712
ENPH,ENPHASE ENERGY INC USD0.00001 Common Stock,29355A107,241000.0,868,0.0029734251056522097,2022-11-03,2022-09-30,0001140361-22-039712
AMAT,APPLIED MATERIALS INC NPV Common Stock,038222105,240000.0,2928,0.0029610872421432797,2022-11-03,2022-09-30,0001140361-22-039712
IVZ,INVESCO LTD USD0.20 Common Stock,G491BT108,240000.0,17540,0.0029610872421432797,2022-11-03,2022-09-30,0001140361-22-039712
RMD,RESMED INC USD0.004 Common Stock,761152107,240000.0,1100,0.0029610872421432797,2022-11-03,2022-09-30,0001140361-22-039712
KMX,CARMAX INC USD0.50 Common Stock,143130102,238000.0,3600,0.0029364115151254188,2022-11-03,2022-09-30,0001140361-22-039712
NIO,NIO INC Spon ADS Each Rep 1 Ord Shares,62914V106,237000.0,15018,0.0029240736516164883,2022-11-03,2022-09-30,0001140361-22-039712
N/A,INDEXIQ ETF TRUST IQ Hedge Macro Tracker ETF,45409B206,234000.0,9547,0.0028870600610896974,2022-11-03,2022-09-30,0001140361-22-039712
EBA,EBAY INC USD0.001 Common Stock,278642103,233000.0,6335,0.002874722197580767,2022-11-03,2022-09-30,0001140361-22-039712
VGT,VANGUARD WORLD FUNDS Information Technology ETF,92204A702,230000.0,748,0.002837708607053976,2022-11-03,2022-09-30,0001140361-22-039712
COIN,COINBASE GLOBAL INC 0.00001 Class A Common Stock,19260Q107,224000.0,3476,0.002763681426000394,2022-11-03,2022-09-30,0001140361-22-039712
SII,SPROTT INC NPV Common Stock (P/R Split),852066208,221000.0,6550,0.002726667835473603,2022-11-03,2022-09-30,0001140361-22-039712
GPN,GLOBAL PAYMENTS INC NPV Common Stock,37940X102,217000.0,2012,0.0026773163814378816,2022-11-03,2022-09-30,0001140361-22-039712
VIR,VIR BIOTECHNOLOGY USD0.0001 Common Stock,92764N102,213000.0,11067,0.0026279649274021607,2022-11-03,2022-09-30,0001140361-22-039712
ADP,AUTO DATA PROCESS USD0.10 Common Stock,053015103,211000.0,935,0.0026032892003843,2022-11-03,2022-09-30,0001140361-22-039712
SKAA,SKECHER USA INC USD0.001 A Common Stock,830566105,209000.0,6596,0.002578613473366439,2022-11-03,2022-09-30,0001140361-22-039712
EGP,EASTGROUP PROPERTIES INC USD0.0001 Common Stock,277276101,206000.0,1430,0.002541599882839648,2022-11-03,2022-09-30,0001140361-22-039712
PINS,PINTEREST INC USD0.00001 Cls A Common Stock,72352L106,205000.0,8800,0.0025292620193307176,2022-11-03,2022-09-30,0001140361-22-039712
SLF,SUN LIFE FINANCIAL INC NPV Common Stock,866796105,204000.0,5105,0.0025169241558217876,2022-11-03,2022-09-30,0001140361-22-039712
TSCO,TRACTOR SUPPLY CO USD0.008 Common Stock,892356106,204000.0,1100,0.0025169241558217876,2022-11-03,2022-09-30,0001140361-22-039712
SPOT,SPOTIFY TECHNOLOGY EUR0.000625 Common Stock,L8681T102,203000.0,2358,0.002504586292312857,2022-11-03,2022-09-30,0001140361-22-039712
CPRT,COPART INC USD0.001 Common Stock,217204106,202000.0,1900,0.0024922484288039267,2022-11-03,2022-09-30,0001140361-22-039712
N/A,CARA THERAPEUTICS INC USD0.001 Common Stock,140755109,187000.0,20000,0.0023071804761699718,2022-11-03,2022-09-30,0001140361-22-039712
GHLEUR,GREENHILL & CO INC USD0.01 Common Stock,395259104,178000.0,30000,0.002196139704589599,2022-11-03,2022-09-30,0001140361-22-039712
F,FORD MOTOR CO USD0.01 Common Stock,345370860,175000.0,15654,0.002159126114062808,2022-11-03,2022-09-30,0001140361-22-039712
YRI,YAMANA GOLD INC NPV Common Stock (USD),98462Y100,172000.0,38000,0.002122112523536017,2022-11-03,2022-09-30,0001140361-22-039712
TG7,TRIUMPH GROUP INC USD0.001 Common Stock,896818101,172000.0,20000,0.002122112523536017,2022-11-03,2022-09-30,0001140361-22-039712
VALE,VALE SA Spons ADR Rep 1 Common Stock,91912E105,165000.0,12375,0.0020357474789735046,2022-11-03,2022-09-30,0001140361-22-039712
SSRM,SSR MINING INC NPV Common Stock,784730103,159000.0,10750,0.001961720297919923,2022-11-03,2022-09-30,0001140361-22-039712
OII,OCEANEERING INTL INC USD0.25 Common Stock,675232102,159000.0,20000,0.001961720297919923,2022-11-03,2022-09-30,0001140361-22-039712
TAL,TAL EDUCATION GROUP Spon ADS Ea Rep 0.3333 Cls A,874080104,148000.0,30000,0.001826003799321689,2022-11-03,2022-09-30,0001140361-22-039712
ERO,ERO COPPER CORP NPV Common Stock,296006109,148000.0,13333,0.001826003799321689,2022-11-03,2022-09-30,0001140361-22-039712
BARK,BARK INC USD0.0001 Common Stock,68622E104,146000.0,80000,0.0018013280723038281,2022-11-03,2022-09-30,0001140361-22-039712
VTRS,VIATRIS INC USD0.01 Common Stock,92556V106,142000.0,16711,0.0017519766182681072,2022-11-03,2022-09-30,0001140361-22-039712
KGC,KINROSS GOLD CORP NPV Common Stock,496902404,140000.0,37000,0.0017273008912502463,2022-11-03,2022-09-30,0001140361-22-039712
