ticker,nameOfIssuer,cusip,value,shares,allocation_percent,filingDate,reportDate,accessionNumber
DNN,DENISON MINES INC NPV Common Stock,248356107,137000.0,117000,0.0016902873007234552,2022-11-03,2022-09-30,0001140361-22-039712
PGX,INVESCO EXCH TRDII Preferred ETF,46138E511,131000.0,11000,0.0016162601196698732,2022-11-03,2022-09-30,0001140361-22-039712
GLDG,GOLDMINING INC NPV Common Stock,38149E101,129000.0,152200,0.0015915843926520127,2022-11-03,2022-09-30,0001140361-22-039712
PTON,PELOTON INTERACTIVE INC USD0.000025 Cls A Common Stock,70614W100,116000.0,16800,0.0014311921670359183,2022-11-03,2022-09-30,0001140361-22-039712
SBSW,SIBANYE STILLWATER Spon ADR Ea Rep 4 Ord Shs,82575P107,109000.0,11736,0.001344827122473406,2022-11-03,2022-09-30,0001140361-22-039712
AG,FIRST MAJESTIC SILVER NPV Common Stock,32076V103,99000.0,13000,0.0012214484873841027,2022-11-03,2022-09-30,0001140361-22-039712
DRD,DRDGOLD LTD Spon ADR Ea Rep 10 NPV Ord Shs,26152H301,92000.0,16875,0.0011350834428215904,2022-11-03,2022-09-30,0001140361-22-039712
AGI,ALAMOS GOLD INC NPV Class A Common Stock,011532108,89000.0,12010,0.0010980698522947995,2022-11-03,2022-09-30,0001140361-22-039712
MDNA,MEDICENNA THERAPEUTICS CORP NPV Common Stock,58490H107,87000.0,105663,0.0010733941252769389,2022-11-03,2022-09-30,0001140361-22-039712
ITUB,ITAU UNIBANCO HOLDING SA ADR Each Rep 1 NPV Pref,465562106,72000.0,14000,0.0008883261726429838,2022-11-03,2022-09-30,0001140361-22-039712
SIL1EUR,SILVERCREST METALS INC NPV Common Stock,828363101,62000.0,11150,0.0007649475375536806,2022-11-03,2022-09-30,0001140361-22-039712
N/A,MESOBLAST LTD Spon ADR Ea Rep 5 Shares,590717104,62000.0,24435,0.0007649475375536806,2022-11-03,2022-09-30,0001140361-22-039712
HMY,HARMONY GOLD MINING CO Spon ADR Rep 1 ZAR0.50 Ord Shs,413216300,61000.0,25075,0.0007526096740447501,2022-11-03,2022-09-30,0001140361-22-039712
RIG,TRANSOCEAN LTD CHF15 Common Stock,H8817H100,58000.0,23517,0.0007155960835179591,2022-11-03,2022-09-30,0001140361-22-039712
BTG,B2GOLD CORP NPV Common Stock,11777Q209,51000.0,15900,0.0006292310389554469,2022-11-03,2022-09-30,0001140361-22-039712
ORLA,ORLA MINING LTD NPV Common Stock,68634K106,50000.0,15250,0.0006168931754465166,2022-11-03,2022-09-30,0001140361-22-039712
SVM,SILVERCORP METALS INC NPV Common Stock,82835P103,49000.0,21000,0.0006045553119375861,2022-11-03,2022-09-30,0001140361-22-039712
BB,BLACKBERRY LTD NPV Common Stock,09228F103,47000.0,10000,0.0005798795849197256,2022-11-03,2022-09-30,0001140361-22-039712
BHR,BRAEMAR HOTELS & RESORTS INC USD0.01 Common Stock,10482B101,47000.0,11000,0.0005798795849197256,2022-11-03,2022-09-30,0001140361-22-039712
CX,CEMEX SAB DE CV Spon ADR Rep 10 CPO,151290889,45000.0,13084,0.0005552038579018649,2022-11-03,2022-09-30,0001140361-22-039712
RIG 0.5 01/30/23,TRANSOCEAN INC 0.5 Notes 30/01/2023,893830BJ7,40000.0,40000,0.0004935145403572133,2022-11-03,2022-09-30,0001140361-22-039712
PPTA,PERPETUA RESOURCES CORP NPV Common Stock,714266103,37000.0,18500,0.00045650094983042225,2022-11-03,2022-09-30,0001140361-22-039712
N/A,180 LIFE SCIENCES CORP USD0.0001 Common Stock,68236V104,33000.0,50000,0.0004071494957947009,2022-11-03,2022-09-30,0001140361-22-039712
IVVD,INVIVYD INC USD0.0001 Common Stock,00534A102,31000.0,10000,0.0003824737687768403,2022-11-03,2022-09-30,0001140361-22-039712
N/A,OATLY GROUP AB Spon ADS Ea Rep 1 Ord Share,67421J108,30000.0,11300,0.00037013590526790996,2022-11-03,2022-09-30,0001140361-22-039712
N/A,MAGENTA THERAPEUTICS USD0.001 Common Stock,55910K108,14000.0,10000,0.00017273008912502462,2022-11-03,2022-09-30,0001140361-22-039712
A4E1,ALMADEN MINERALS LTD NPV Cls B Common Stock,020283305,13000.0,60000,0.00016039222561609428,2022-11-03,2022-09-30,0001140361-22-039712
