ticker,nameOfIssuer,cusip,value,shares,allocation_percent,filingDate,reportDate,accessionNumber
N/A,STERIS CORP       Common equity ,859152100,75044000.0,2160834,0.011042635736652649,2013-02-12,2012-12-31,0001193125-13-050774
JAZZ,JAZZ                Common Stock PHARMACEUTICALS PLC,G50871105,74861000.0,1405800,0.011015707503352087,2013-02-12,2012-12-31,0001193125-13-050774
WCGEUR,WELLCARE          Common equity HEALTH PLANS      shares INC,94946T106,74793000.0,1536070,0.011005701383874283,2013-02-12,2012-12-31,0001193125-13-050774
N/A,PROTECTIVE        Common equity LIFE CORP,743674103,74678000.0,2612973,0.010988779270051523,2013-02-12,2012-12-31,0001193125-13-050774
OSK,OSHKOSH CORP      Common equity ,688239201,74281000.0,2505091,0.010930361190159046,2013-02-12,2012-12-31,0001193125-13-050774
N/A,LASALLE HOTEL     Real Estate PROPERTIES        Investment ,517942108,73885000.0,2910209,0.010872090259082418,2013-02-12,2012-12-31,0001193125-13-050774
CNK,CINEMARK HOLDINGS   Common equity INC,17243V102,73792000.0,2840160,0.010858405419208362,2013-02-12,2012-12-31,0001193125-13-050774
AMXN,AMERICA MOVIL     American SA DE CV          Depository ,02364W105,73616000.0,3181259,0.01083250722761875,2013-02-12,2012-12-31,0001193125-13-050774
ELS,EQUITY          Real Estate LIFESTYLE       Investment PROPERTIES,29472R108,73305000.0,1089404,0.010786743945889379,2013-02-12,2012-12-31,0001193125-13-050774
CBOE,CBOE HOLDINGS INC   Common equity ,12503M108,72585000.0,2463739,0.010680796798477329,2013-02-12,2012-12-31,0001193125-13-050774
MGM,MGM RESORTS          Common equity INTERNATIONAL,552953101,72270000.0,6209246,0.010634444921484557,2013-02-12,2012-12-31,0001193125-13-050774
N/A,TWO HARBORS          Common equity INVESTMENT CORP,90187B101,72162000.0,6513051,0.010618552849372747,2013-02-12,2012-12-31,0001193125-13-050774
EMB,ISHARES JPMORGAN     Investments USD EMERGING         that contain MARKETS BOND         a pool of FUND                 securities representing a specific index and are built ,464288281,71936000.0,585803,0.010585297216990633,2013-02-12,2012-12-31,0001193125-13-050774
HYG,ISHARES IBOXX $     USA: Common HIGH YIELD          Stock CORPORATE BOND FUND,464288513,71862000.0,769813,0.010574408204617728,2013-02-12,2012-12-31,0001193125-13-050774
BIGGQ,BIG LOTS INC     Common equity ,089302103,71709000.0,2519416,0.010551894435792665,2013-02-12,2012-12-31,0001193125-13-050774
N/A,INGRAM MICRO      Common equity INC,457153104,71453000.0,4223160,0.010514224338935048,2013-02-12,2012-12-31,0001193125-13-050774
HE,HAWAIIAN        Common equity ELECTRIC INDS,419870100,71436000.0,2841496,0.010511722809065597,2013-02-12,2012-12-31,0001193125-13-050774
N/A,LIFE TIME         Common equity FITNESS INC,53217R207,71169000.0,1446208,0.010472434075233628,2013-02-12,2012-12-31,0001193125-13-050774
N/A,ALLIED NEVADA GOLD  Common equity CORP,019344100,71048000.0,2358108,0.010454629068515771,2013-02-12,2012-12-31,0001193125-13-050774
N/A,KINDER MORGAN     Common equity MANAGEMENT        shares LLC,49455U100,70082000.0,928703,0.010312483312404603,2013-02-12,2012-12-31,0001193125-13-050774
SMTC,SEMTECH CORP      Common equity ,816850101,70043000.0,2419562,0.010306744508586449,2013-02-12,2012-12-31,0001193125-13-050774
N/A,TECHNE CORP        Common equity ,878377100,70010000.0,1024341,0.010301888597663397,2013-02-12,2012-12-31,0001193125-13-050774
N/A,HARRIS TEETER          Common equity SUPERMARKETS,414585109,69935000.0,1813632,0.010290852436474643,2013-02-12,2012-12-31,0001193125-13-050774
N/A,LAMAR                Common equity ADVERTISING          shares CO -CL A,512815101,69920000.0,1804302,0.010288645204236892,2013-02-12,2012-12-31,0001193125-13-050774
ACM,AECOM TECHNOLOGY    Common equity CORP,00766T100,69916000.0,2937715,0.01028805660897349,2013-02-12,2012-12-31,0001193125-13-050774
CLRUSD,CONTINENTAL         Common equity RESOURCES INC,212015101,69881000.0,950934,0.010282906400418738,2013-02-12,2012-12-31,0001193125-13-050774
LSTR,LANDSTAR             Common equity SYSTEM INC,515098101,69822000.0,1331003,0.010274224620283583,2013-02-12,2012-12-31,0001193125-13-050774
HL,HECLA MINING CO Common equity ,422704106,69815000.0,11974763,0.010273194578572634,2013-02-12,2012-12-31,0001193125-13-050774
CVLT,COMMVAULT         Common equity SYSTEMS INC,204166102,69797000.0,1001228,0.010270545899887332,2013-02-12,2012-12-31,0001193125-13-050774
N/A,AMDOCS LTD        Common equity ,G02602103,69793000.0,2053265,0.010269957304623933,2013-02-12,2012-12-31,0001193125-13-050774
N/A,SUSQUEHANNA        Common equity BANCSHARES INC,869099101,69432000.0,6625113,0.010216836582102058,2013-02-12,2012-12-31,0001193125-13-050774
N/A,ESTERLINE         Common equity TECHNOLOGIES      shares CORP,297425100,69303000.0,1089488,0.010197854384857399,2013-02-12,2012-12-31,0001193125-13-050774
N/A,HEALTH MANAGEMENT    Common equity ASSOC,421933102,69273000.0,7432829,0.010193439920381896,2013-02-12,2012-12-31,0001193125-13-050774
HRUSD,HEALTHCARE      Real Estate REALTY TRUST    Investment INC,421946104,69190000.0,2881775,0.010181226568666341,2013-02-12,2012-12-31,0001193125-13-050774
N/A,CABELAS INC       Common equity ,126804301,69030000.0,1653406,0.010157682758130329,2013-02-12,2012-12-31,0001193125-13-050774
CATY,CATHAY GENERAL     Common equity BANCORP,149150104,68904000.0,3533488,0.010139142007333221,2013-02-12,2012-12-31,0001193125-13-050774
N/A,MEDIVATION INC,58501N101,68755000.0,1343977,0.010117216833771559,2013-02-12,2012-12-31,0001193125-13-050774
EAT,BRINKER INTL INC     Common equity ,109641100,68737000.0,2218156,0.010114568155086259,2013-02-12,2012-12-31,0001193125-13-050774
N/A,WARNER            Common equity CHILCOTT PLC,G94368100,68281000.0,5670703,0.010047468295058625,2013-02-12,2012-12-31,0001193125-13-050774
N/A,COMPUWARE CORP  Common equity ,205638109,68087000.0,6263515,0.010018921424783713,2013-02-12,2012-12-31,0001193125-13-050774
INFY,INFOSYS LTD          Depository ,456788108,67406000.0,1593533,0.009918713081189814,2013-02-12,2012-12-31,0001193125-13-050774
MKL,MARKEL CORP     Common equity ,570535104,67394000.0,155506,0.009916947295399613,2013-02-12,2012-12-31,0001193125-13-050774
ASNAEUR,ASCENA RETAIL     Common equity GROUP INC,04351G101,67269000.0,3638315,0.009898553693418357,2013-02-12,2012-12-31,0001193125-13-050774
BIDUN,BAIDU INC            American Depository ,056752108,67117000.0,669232,0.009876187073409145,2013-02-12,2012-12-31,0001193125-13-050774
N/A,CHARTER             Common equity COMMUNICATIONS      shares INC,16117M305,66838000.0,876736,0.009835132553786975,2013-02-12,2012-12-31,0001193125-13-050774
OMI,OWENS & MINOR     Common equity INC,690732102,66803000.0,2343159,0.009829982345232222,2013-02-12,2012-12-31,0001193125-13-050774
N/A,THORATEC CORP      Common equity ,885175307,66797000.0,1780165,0.009829099452337123,2013-02-12,2012-12-31,0001193125-13-050774
N/A,COLONIAL          Real Estate PROPERTIES        Investment TRUST,195872106,66698000.0,3120959,0.009814531719567966,2013-02-12,2012-12-31,0001193125-13-050774
N/A,JEFFERIES         Common equity GROUP INC,472319102,66570000.0,3584858,0.009795696671139158,2013-02-12,2012-12-31,0001193125-13-050774
N/A,TIDEWATER INC      Common equity ,886423102,66497000.0,1488304,0.009784954807582102,2013-02-12,2012-12-31,0001193125-13-050774
AMT,TD AMERITRADE     Common Stock HOLDING CORP,87236Y108,66349000.0,3947190,0.009763176782836292,2013-02-12,2012-12-31,0001193125-13-050774
N/A,CONVERGYS CORP       Common equity ,212485106,66222000.0,4035109,0.009744488883223334,2013-02-12,2012-12-31,0001193125-13-050774
AN,AUTONATION INC   Common equity ,05329W102,66219000.0,1667807,0.009744047436775781,2013-02-12,2012-12-31,0001193125-13-050774
N/A,ISHARES MSCI      Investments TAIWAN INDEX      that contain FUND              a pool of securities representing a specific index and are built ,464286731,65980000.0,4844362,0.009708878869787614,2013-02-12,2012-12-31,0001193125-13-050774
STWD,STARWOOD PROPERTY   Real Estate TRUST INC           Investment ,85571B105,65695000.0,2861169,0.009666941457270345,2013-02-12,2012-12-31,0001193125-13-050774
SBS,CIA SANEAMENTO    American BASICO ESTADO     Depository ,20441A102,65667000.0,785767,0.009662821290426544,2013-02-12,2012-12-31,0001193125-13-050774
N/A,EXELIS INC          Common equity ,30162A108,65009000.0,5768336,0.009565997369597198,2013-02-12,2012-12-31,0001193125-13-050774
LEA,LEAR CORP           Common equity ,521865204,64640000.0,1380005,0.009511699456548521,2013-02-12,2012-12-31,0001193125-13-050774
EXP,EAGLE             Common equity MATERIALS INC,26969P108,64352000.0,1099989,0.009469320597583703,2013-02-12,2012-12-31,0001193125-13-050774
ALKS,ALKERMES PLC      Common equity ,G01767105,64300000.0,3471989,0.009461668859159498,2013-02-12,2012-12-31,0001193125-13-050774
N/A,ASPEN INSURANCE    Common equity HOLDINGS LTD,G05384105,64145000.0,1999514,0.009438860792702737,2013-02-12,2012-12-31,0001193125-13-050774
GRA1EUR,GRACE (W R) & CO     Common equity ,38388F108,64099000.0,953438,0.009432091947173635,2013-02-12,2012-12-31,0001193125-13-050774
EC,ECOPETROL SA        American Depository ,279158109,64063000.0,1073573,0.009426794589803032,2013-02-12,2012-12-31,0001193125-13-050774
N/A,ALLIANT           Common equity TECHSYSTEMS       shares INC,018804104,64010000.0,1033061,0.009418995702562978,2013-02-12,2012-12-31,0001193125-13-050774
TRMK,TRUSTMARK CORP     Common equity ,898402102,63963000.0,2847929,0.009412079708218024,2013-02-12,2012-12-31,0001193125-13-050774
N/A,BANCORPSOUTH      Common equity INC,059692103,63838000.0,4390301,0.009393686106236764,2013-02-12,2012-12-31,0001193125-13-050774
N/A,STILLWATER MINING  Common equity CO,86074Q102,63757000.0,4988823,0.00938176705215291,2013-02-12,2012-12-31,0001193125-13-050774
N/A,WASHINGTON      Common equity POST -CL B,939640108,63196000.0,173006,0.009299216566461021,2013-02-12,2012-12-31,0001193125-13-050774
N/A,CEPHEID INC,15670R107,63052000.0,1864889,0.00927802713697861,2013-02-12,2012-12-31,0001193125-13-050774
N/A,NATIONAL          Common equity INSTRUMENTS       shares CORP,636518102,62969000.0,2439626,0.009265813785263055,2013-02-12,2012-12-31,0001193125-13-050774
SGENEUR,SEATTLE           Common Stock GENETICS INC,812578102,62964000.0,2714009,0.009265078041183804,2013-02-12,2012-12-31,0001193125-13-050774
DLX,DELUXE CORP      Common equity ,248019101,62833000.0,1948758,0.009245801546307445,2013-02-12,2012-12-31,0001193125-13-050774
DLB,DOLBY             Common equity LABORATORIES      shares INC,25659T107,62656000.0,2135983,0.009219756205901984,2013-02-12,2012-12-31,0001193125-13-050774
N/A,NIELSEN HOLDINGS NV Common equity ,N63218106,62653000.0,2048152,0.009219314759454433,2013-02-12,2012-12-31,0001193125-13-050774
TXNM,PNM RESOURCES     Common equity INC,69349H107,62552000.0,3049906,0.009204452729053575,2013-02-12,2012-12-31,0001193125-13-050774
N/A,ANN INC           Common equity ,035623107,62395000.0,1843770,0.009181350364965115,2013-02-12,2012-12-31,0001193125-13-050774
N/A,"LENDER PROCESSING    Common equity                                                  1,2,5,6,8,10,12, SERVICES",52602E102,62180000.0,2525489,0.00914971336955735,2013-02-12,2012-12-31,0001193125-13-050774
N/A,MARVELL         Common equity TECHNOLOGY      shares GROUP LTD,G5876H105,61912000.0,8527382,0.009110277486909532,2013-02-12,2012-12-31,0001193125-13-050774
N/A,CYMER INC         Common equity ,232572107,61796000.0,683409,0.009093208224270923,2013-02-12,2012-12-31,0001193125-13-050774
N/A,SOVRAN SELF       Real Estate STORAGE INC       Investment ,84610H108,61591000.0,991829,0.00906304271702166,2013-02-12,2012-12-31,0001193125-13-050774
N/A,LEVEL 3              Common Stock COMMUNICATIONS INC,52729N308,61487000.0,2660695,0.00904773924017325,2013-02-12,2012-12-31,0001193125-13-050774
IDCC,INTERDIGITAL      Common equity INC,45867G101,61367000.0,1493191,0.009030081382271243,2013-02-12,2012-12-31,0001193125-13-050774
TSA,ACI WORLDWIDE INC  Common equity ,004498101,61299000.0,1403049,0.009020075262793437,2013-02-12,2012-12-31,0001193125-13-050774
N/A,LIBERTY VENTURES    Common equity ,53071M880,61187000.0,903008,0.009003594595418229,2013-02-12,2012-12-31,0001193125-13-050774
BC,BRUNSWICK CORP       Common equity ,117043109,60614000.0,2083499,0.00891927832393614,2013-02-12,2012-12-31,0001193125-13-050774
N/A,WALTER ENERGY INC  Common equity ,93317Q105,60584000.0,1688589,0.008914863859460637,2013-02-12,2012-12-31,0001193125-13-050774
N/A,ARIAD             Common Stock PHARMACEUTICALS INC,04033A100,60415000.0,3149847,0.008889995709581976,2013-02-12,2012-12-31,0001193125-13-050774
ELME,WASHINGTON REIT    Real Estate Investment ,939653101,60208000.0,2302412,0.008859535904701012,2013-02-12,2012-12-31,0001193125-13-050774
N/A,MENTOR          Common equity GRAPHICS CORP,587200106,59848000.0,3516196,0.008806562330994987,2013-02-12,2012-12-31,0001193125-13-050774
TCBI,TEXAS CAPITAL      Common equity BANCSHARES INC,88224Q107,59223000.0,1321380,0.008714594321088693,2013-02-12,2012-12-31,0001193125-13-050774
GATX,GATX CORP         Common equity ,361448103,58988000.0,1362364,0.008680014349363926,2013-02-12,2012-12-31,0001193125-13-050774
OASEUR,OASIS PETROLEUM INC Common equity ,674215108,58930000.0,1853254,0.008671479718044621,2013-02-12,2012-12-31,0001193125-13-050774
BKH,BLACK HILLS       Common equity CORP,092113109,58856000.0,1619521,0.008660590705671717,2013-02-12,2012-12-31,0001193125-13-050774
BUWA,BIO-RAD           Common equity LABORATORIES      shares INC,090572207,58718000.0,558893,0.008640284169084408,2013-02-12,2012-12-31,0001193125-13-050774
N/A,APOLLO            Common equity INVESTMENT        shares CORP,03761U106,58072000.0,6946302,0.008545226034045263,2013-02-12,2012-12-31,0001193125-13-050774
CR1USD,CRANE CO         Common equity ,224399105,57933000.0,1251697,0.008524772348642101,2013-02-12,2012-12-31,0001193125-13-050774
UNTEUR,UNIT CORP          Common equity ,909218109,57933000.0,1285794,0.008524772348642101,2013-02-12,2012-12-31,0001193125-13-050774
N/A,KODIAK OIL &      Common Stock GAS CORP,50015Q100,57644000.0,6513176,0.008482246340861432,2013-02-12,2012-12-31,0001193125-13-050774
DRH,DIAMONDROCK          Real Estate HOSPITALITY CO       Investment ,252784301,57638000.0,6403929,0.008481363447966333,2013-02-12,2012-12-31,0001193125-13-050774
SXT,SENSIENT          Common equity TECHNOLOGIES      shares CORP,81725T100,57621000.0,1620335,0.008478861918096882,2013-02-12,2012-12-31,0001193125-13-050774
N/A,CORPORATE         Common Stock EXECUTIVE BRD CO,21988R102,56841000.0,1197724,0.008364085841733827,2013-02-12,2012-12-31,0001193125-13-050774
CIEN,CIENA CORP      Common equity ,171779309,56668000.0,3609708,0.008338629096591764,2013-02-12,2012-12-31,0001193125-13-050774
WIP,SPDR DB             Investments INTERNATIONAL       that contain GOVERNMENT          a pool of INFLATION-          securities PROTECTED BOND      representing ETF                 a specific index and are built ,78464A490,56565000.0,890229,0.008323472768559206,2013-02-12,2012-12-31,0001193125-13-050774
UPLEUR,ULTRA              Common equity PETROLEUM          shares CORP,903914109,56317000.0,3106321,0.00828697986222839,2013-02-12,2012-12-31,0001193125-13-050774
CAKE,CHEESECAKE         Common equity FACTORY INC,163072101,56146000.0,1715814,0.008261817414718028,2013-02-12,2012-12-31,0001193125-13-050774
IACIEUR,IAC/                Common equity INTERACTIVECORP,44919P508,56020000.0,1184382,0.008243276663920919,2013-02-12,2012-12-31,0001193125-13-050774
CLDEUR,CLOUD PEAK ENERGY   Common equity INC,18911Q102,55905000.0,2892171,0.008226354550098161,2013-02-12,2012-12-31,0001193125-13-050774
DDD,3D SYSTEMS CORP,88554D205,55899000.0,1047864,0.008225471657203061,2013-02-12,2012-12-31,0001193125-13-050774
EWC,ISHARES MSCI      Investments CANADA INDEX      that contain FUND              a pool of securities representing a specific index and are built ,464286509,55707000.0,1961500,0.008197219084559847,2013-02-12,2012-12-31,0001193125-13-050774
DAN,DANA HOLDING CORP    Common equity ,235825205,55483000.0,3564021,0.008164257749809431,2013-02-12,2012-12-31,0001193125-13-050774
IBN,ICICI BANK LTD    American Depository ,45104G104,55450000.0,1271456,0.008159401838886379,2013-02-12,2012-12-31,0001193125-13-050774
AZPNUSD,ASPEN             Common Stock TECHNOLOGY INC,045327103,55403000.0,2004429,0.008152485844541426,2013-02-12,2012-12-31,0001193125-13-050774
N/A,ATHENAHEALTH INC,04685W103,55394000.0,754211,0.008151161505198774,2013-02-12,2012-12-31,0001193125-13-050774
N/A,DST SYSTEMS INC      Common equity ,233326107,55286000.0,912359,0.008135269433086968,2013-02-12,2012-12-31,0001193125-13-050774
N/A,ITC HOLDINGS CORP    Common equity ,465685105,55256000.0,718428,0.008130854968611465,2013-02-12,2012-12-31,0001193125-13-050774
AMD,ADVANCED MICRO       Common equity DEVICES,007903107,54902000.0,22874104,0.00807876428780054,2013-02-12,2012-12-31,0001193125-13-050774
DPZ,DOMINO'S PIZZA    Common equity INC,25754A201,54707000.0,1256139,0.008050070268709776,2013-02-12,2012-12-31,0001193125-13-050774
N/A,SIRONA DENTAL          Common equity SYSTEMS INC,82966C103,54694000.0,848440,0.008048157334103726,2013-02-12,2012-12-31,0001193125-13-050774
ETD,ETHAN ALLEN       Common equity INTERIORS INC,297602104,54675000.0,2126604,0.008045361506602575,2013-02-12,2012-12-31,0001193125-13-050774
N/A,VALIDUS HOLDINGS    Common equity LTD,G9319H102,54592000.0,1578610,0.008033148154887019,2013-02-12,2012-12-31,0001193125-13-050774
SIXEUR,SIX FLAGS           Common equity ENTERTAINMENT       shares CORP,83001A102,54500000.0,890557,0.008019610463828812,2013-02-12,2012-12-31,0001193125-13-050774
EPI,WISDOMTREE INDIA     Investments EARNINGS FUND        that contain a pool of securities representing a specific index and are built ,97717W422,54413000.0,2809150,0.008006808516849857,2013-02-12,2012-12-31,0001193125-13-050774
N/A,FLEXTRONICS          Common equity INTERNATIONAL,Y2573F102,54412000.0,8761623,0.008006661368034006,2013-02-12,2012-12-31,0001193125-13-050774
ODFL,OLD DOMINION      Common equity FREIGHT,679580100,54316000.0,1584547,0.0079925350817124,2013-02-12,2012-12-31,0001193125-13-050774
N/A,LIFEPOINT            Common equity HOSPITALS INC,53219L109,54293000.0,1438124,0.007989150658947848,2013-02-12,2012-12-31,0001193125-13-050774
LULU,"LULULEMON           Common equity                                                  1,2,5,6,8,10,12, ATHLETICA INC",550021109,54235000.0,711515,0.007980616027628543,2013-02-12,2012-12-31,0001193125-13-050774
N/A,ENERGY XXI          Common Stock (BERMUDA),G10082140,54115000.0,1681062,0.007962958169726536,2013-02-12,2012-12-31,0001193125-13-050774
THG,HANOVER           Common equity INSURANCE         shares GROUP INC,410867105,54079000.0,1396056,0.007957660812355933,2013-02-12,2012-12-31,0001193125-13-050774
ZBRA,ZEBRA             Common equity TECHNOLOGIES      shares CP -CL A,989207105,53988000.0,1374308,0.007944270270113577,2013-02-12,2012-12-31,0001193125-13-050774
NVRI,HARSCO CORP     Common equity ,415864107,53866000.0,2291885,0.007926318114579868,2013-02-12,2012-12-31,0001193125-13-050774
SLGN,SILGAN HOLDINGS   Common equity INC,827048109,53665000.0,1290290,0.007896741202594003,2013-02-12,2012-12-31,0001193125-13-050774
EME,EMCOR GROUP INC   Common equity ,29084Q100,53605000.0,1548756,0.007887912273643001,2013-02-12,2012-12-31,0001193125-13-050774
FICO,FAIR ISAAC CORP   Common equity ,303250104,53517000.0,1273408,0.007874963177848193,2013-02-12,2012-12-31,0001193125-13-050774
N/A,DCT INDUSTRIAL      Real Estate TRUST INC           Investment ,233153105,53493000.0,8242194,0.007871431606267793,2013-02-12,2012-12-31,0001193125-13-050774
RWR,SPDR DOW JONES REIT  USA: Common ETF,78464A607,53419000.0,732071,0.007860542593894886,2013-02-12,2012-12-31,0001193125-13-050774
TDY,TELEDYNE           Common equity TECHNOLOGIES INC,879360105,53251000.0,818275,0.007835821592832075,2013-02-12,2012-12-31,0001193125-13-050774
PLTEUR,PLANTRONICS INC   Common equity ,727493108,53053000.0,1438929,0.007806686127293761,2013-02-12,2012-12-31,0001193125-13-050774
N/A,FAIRCHILD         Common equity SEMICONDUCTOR     shares INTL,303726103,53010000.0,3681382,0.007800358728212208,2013-02-12,2012-12-31,0001193125-13-050774
FHI,FEDERATED        Common equity INVESTORS INC,314211103,52936000.0,2616933,0.007789469715839304,2013-02-12,2012-12-31,0001193125-13-050774
IVREUR,INVESCO MORTGAGE    Common equity CAPITAL INC,46131B100,52800000.0,2678925,0.0077694574768836944,2013-02-12,2012-12-31,0001193125-13-050774
WAFD,WASHINGTON         Common equity FEDERAL INC,938824109,52769000.0,3128073,0.007764895863592341,2013-02-12,2012-12-31,0001193125-13-050774
N/A,EQUITY ONE INC    Real Estate Investment ,294752100,52726000.0,2509593,0.007758568464510788,2013-02-12,2012-12-31,0001193125-13-050774
EPR,EPR PROPERTIES    Real Estate Investment ,26884U109,52702000.0,1142970,0.007755036892930387,2013-02-12,2012-12-31,0001193125-13-050774
CASY,CASEYS GENERAL     Common equity STORES INC,147528103,52655000.0,991648,0.007748120898585433,2013-02-12,2012-12-31,0001193125-13-050774
N/A,HEALTH NET INC  Common equity ,42222G108,52578000.0,2163878,0.007736790439764978,2013-02-12,2012-12-31,0001193125-13-050774
N/A,VCA ANTECH INC    Common equity ,918194101,52561000.0,2496948,0.007734288909895528,2013-02-12,2012-12-31,0001193125-13-050774
N/A,ULTIMATE           Common Stock SOFTWARE GROUP INC,90385D107,52514000.0,556272,0.007727372915550574,2013-02-12,2012-12-31,0001193125-13-050774
SSD,SIMPSON           Common equity MANUFACTURING     shares INC,829073105,52338000.0,1596120,0.007701474723960961,2013-02-12,2012-12-31,0001193125-13-050774
EGP,EASTGROUP         Real Estate PROPERTIES        Investment ,277276101,52119000.0,968593,0.007669249133289795,2013-02-12,2012-12-31,0001193125-13-050774
N/A,VALUECLICK INC     Common equity ,92046N102,52114000.0,2684793,0.007668513389210545,2013-02-12,2012-12-31,0001193125-13-050774
N/A,BALLY             Common equity TECHNOLOGIES      shares INC,05874B107,52053000.0,1164220,0.007659537311443691,2013-02-12,2012-12-31,0001193125-13-050774
PCH,POTLATCH CORP,737630103,51961000.0,1325904,0.007645999620385485,2013-02-12,2012-12-31,0001193125-13-050774
WLY,WILEY (JOHN) &    Common equity SONS -CL A,968223206,51881000.0,1332579,0.0076342277151174795,2013-02-12,2012-12-31,0001193125-13-050774
GHLEUR,GREENHILL & CO    Common equity INC,395259104,51786000.0,996096,0.007620248577611722,2013-02-12,2012-12-31,0001193125-13-050774
CRREUR,CARBO CERAMICS     Common equity INC,140781105,51779000.0,660871,0.007619218535900771,2013-02-12,2012-12-31,0001193125-13-050774
CSGP,COSTAR GROUP      Common equity INC,22160N109,51687000.0,578316,0.007605680844842566,2013-02-12,2012-12-31,0001193125-13-050774
N/A,ROBBINS & MYERS        Common equity INC,770196103,51642000.0,868697,0.007599059148129313,2013-02-12,2012-12-31,0001193125-13-050774
CUBE,CUBESMART         Real Estate Investment ,229663109,51624000.0,3543097,0.007596410469444011,2013-02-12,2012-12-31,0001193125-13-050774
N/A,ARENA             Common Stock PHARMACEUTICALS INC,040047102,51470000.0,5706053,0.007573749551803101,2013-02-12,2012-12-31,0001193125-13-050774
SBH,SALLY BEAUTY      Common equity HOLDINGS INC,79546E104,51244000.0,2173920,0.007540493919420984,2013-02-12,2012-12-31,0001193125-13-050774
MTX,MINERALS        Common equity TECHNOLOGIES    shares INC,603158106,51002000.0,1277581,0.007504883905985267,2013-02-12,2012-12-31,0001193125-13-050774
WABC,WESTAMERICA        Common equity BANCORPORATION,957090103,50981000.0,1197004,0.007501793780852416,2013-02-12,2012-12-31,0001193125-13-050774
SMG,SCOTTS            Common equity MIRACLE-GRO CO,810186106,50910000.0,1155779,0.007491346214927062,2013-02-12,2012-12-31,0001193125-13-050774
BCO,BRINKS CO         Common equity ,109696104,50695000.0,1776753,0.007459709219519296,2013-02-12,2012-12-31,0001193125-13-050774
GPOR1EUR,GULFPORT        Common equity ENERGY CORP,402635304,50695000.0,1326490,0.007459709219519296,2013-02-12,2012-12-31,0001193125-13-050774
CIBEUR,BANCOLOMBIA SA    American Depository ,05968L102,50554000.0,759315,0.007438961236484436,2013-02-12,2012-12-31,0001193125-13-050774
HDB,HDFC BANK LTD     American Depository ,40415F101,50549000.0,1241427,0.007438225492405186,2013-02-12,2012-12-31,0001193125-13-050774
DISCKUSD,DISCOVERY           Common equity COMMUNICATNS NEW,25470F302,50369000.0,861026,0.007411738705552173,2013-02-12,2012-12-31,0001193125-13-050774
N/A,DONNELLEY (R    Common Stock R) & SONS CO,257867101,50271000.0,5584085,0.007397318121598867,2013-02-12,2012-12-31,0001193125-13-050774
N/A,LUFKIN               Common equity INDUSTRIES           shares INC,549764108,50208000.0,863701,0.0073880477462003125,2013-02-12,2012-12-31,0001193125-13-050774
N/A,ACXIOM CORP       Common equity ,005125109,50130000.0,2871164,0.007376570138564007,2013-02-12,2012-12-31,0001193125-13-050774
N/A,UBS AG            Common equity ,H89231338,50096000.0,3182740,0.007371567078825104,2013-02-12,2012-12-31,0001193125-13-050774
FNB,F N B CORP/FL     Common equity ,302520101,49973000.0,4705800,0.007353467774475546,2013-02-12,2012-12-31,0001193125-13-050774
N/A,MICHAEL KORS        Common equity HOLDINGS LTD,G60754101,49943000.0,978723,0.007349053310000044,2013-02-12,2012-12-31,0001193125-13-050774
N/A,MADISON SQUARE    Common equity GARDEN CO,55826P100,49896000.0,1125011,0.007342137315655091,2013-02-12,2012-12-31,0001193125-13-050774
MIDD,MIDDLEBY CORP   Common equity ,596278101,49889000.0,389119,0.00734110727394414,2013-02-12,2012-12-31,0001193125-13-050774
HXL,HEXCEL CORP     Common equity ,428291108,49756000.0,1845508,0.00732153648143608,2013-02-12,2012-12-31,0001193125-13-050774
ITRI,ITRON INC         Common equity ,465741106,49754000.0,1116701,0.00732124218380438,2013-02-12,2012-12-31,0001193125-13-050774
N/A,BABCOCK & WILCOX CO Common equity ,05615F102,49609000.0,1893412,0.00729990560550612,2013-02-12,2012-12-31,0001193125-13-050774
