ticker,nameOfIssuer,cusip,value,shares,allocation_percent,filingDate,reportDate,accessionNumber
N/A,WARREN            Common Stock RESOURCES INC,93564A100,4114000.0,1464247,0.0006053702284071878,2013-02-12,2012-12-31,0001193125-13-050774
N/A,ALMOST FAMILY     Common Stock INC,020409108,4097000.0,202302,0.0006028686985377366,2013-02-12,2012-12-31,0001193125-13-050774
KEP,KEPCO-KOREA ELEC     American POWER CORP           Depository ,500631106,4094000.0,292967,0.0006024272520901864,2013-02-12,2012-12-31,0001193125-13-050774
N/A,SCORPIO TANKERS INC Common equity ,Y7542C106,4086000.0,574680,0.0006012500615633858,2013-02-12,2012-12-31,0001193125-13-050774
FMF,FORMFACTOR INC     Common equity ,346375108,4084000.0,896304,0.0006009557639316856,2013-02-12,2012-12-31,0001193125-13-050774
N/A,SEABRIGHT         Common Stock HOLDINGS INC,811656107,4079000.0,368489,0.0006002200198524353,2013-02-12,2012-12-31,0001193125-13-050774
BMTCUSD,BRYN MAWR BANK    Common equity CORP,117665109,4063000.0,182543,0.0005978656387988342,2013-02-12,2012-12-31,0001193125-13-050774
KOPN,KOPIN CORP,500600101,4059000.0,1219250,0.000597277043535434,2013-02-12,2012-12-31,0001193125-13-050774
N/A,OMNIAMERICAN      Common equity BANCORP INC,68216R107,4057000.0,175350,0.0005969827459037338,2013-02-12,2012-12-31,0001193125-13-050774
N/A,GASLOG LTD          Common equity ,G37585109,4054000.0,326034,0.0005965412994561836,2013-02-12,2012-12-31,0001193125-13-050774
N/A,CARMIKE CINEMAS   Common Stock INC,143436400,4044000.0,269198,0.0005950698112976829,2013-02-12,2012-12-31,0001193125-13-050774
AP,AMPCO-            Common equity PITTSBURGH        shares CORP,032037103,4041000.0,202236,0.0005946283648501327,2013-02-12,2012-12-31,0001193125-13-050774
N/A,SCIQUEST INC        Common equity ,80908T101,4037000.0,254497,0.0005940397695867324,2013-02-12,2012-12-31,0001193125-13-050774
CECO1EUR,CAREER          Common equity EDUCATION       shares CORP,141665109,4021000.0,1141819,0.0005916853885331313,2013-02-12,2012-12-31,0001193125-13-050774
IIIN,INSTEEL           Common equity INDUSTRIES,45774W108,4013000.0,321740,0.0005905081980063307,2013-02-12,2012-12-31,0001193125-13-050774
N/A,WILLBROS GROUP INC Common equity ,969203108,4012000.0,748249,0.0005903610491904806,2013-02-12,2012-12-31,0001193125-13-050774
NMFC,NEW MOUNTAIN        Common equity FINANCE CORP,647551100,4004000.0,268831,0.0005891838586636802,2013-02-12,2012-12-31,0001193125-13-050774
N/A,BAKER             Common equity (MICHAEL)         shares CORP,057149106,3996000.0,160419,0.0005880066681368796,2013-02-12,2012-12-31,0001193125-13-050774
SPTL,SPDR BARCLAYS LONG  Exchange TERM TREASURY ETF   Traded ,78464A664,3987000.0,56866,0.0005866823287942289,2013-02-12,2012-12-31,0001193125-13-050774
TRK,SPEEDWAY          Common equity MOTORSPORTS INC,847788106,3984000.0,223125,0.0005862408823466787,2013-02-12,2012-12-31,0001193125-13-050774
N/A,CLEAR CHANNEL OUTDOOR     Common equity HLDGS,18451C109,3980000.0,566621,0.0005856522870832784,2013-02-12,2012-12-31,0001193125-13-050774
N/A,REPROS            Common Stock THERAPEUTICS INC,76028H209,3971000.0,252179,0.0005843279477406278,2013-02-12,2012-12-31,0001193125-13-050774
N/A,CENTRAL           Common Stock EUROPEAN MEDIA,G20045202,3958000.0,645719,0.0005824150131345768,2013-02-12,2012-12-31,0001193125-13-050774
AUOUSD,AU OPTRONICS      American CORP              Depository ,002255107,3948000.0,877641,0.0005809435249760762,2013-02-12,2012-12-31,0001193125-13-050774
N/A,HUDSON VALLEY   Common equity HOLDING CORP,444172100,3945000.0,253338,0.0005805020785285259,2013-02-12,2012-12-31,0001193125-13-050774
N/A,NTELOS HOLDINGS     An issue in CORP                any currency issued on a ,67020Q305,3945000.0,300918,0.0005805020785285259,2013-02-12,2012-12-31,0001193125-13-050774
GPRE,GREEN PLAINS RENEWABLE    Common Stock ENRGY,393222104,3936000.0,497361,0.0005791777391858753,2013-02-12,2012-12-31,0001193125-13-050774
N/A,AVIAT NETWORKS    Common Stock INC,05366Y102,3929000.0,1193962,0.0005781476974749248,2013-02-12,2012-12-31,0001193125-13-050774
WWEUSD,WORLD             Common equity WRESTLING         shares ENTMT INC,98156Q108,3915000.0,495952,0.0005760876140530239,2013-02-12,2012-12-31,0001193125-13-050774
RBCAA,REPUBLIC BANCORP       Common equity INC/KY,760281204,3904000.0,184691,0.0005744689770786731,2013-02-12,2012-12-31,0001193125-13-050774
CRAI,CRA                Common equity INTERNATIONAL      shares INC,12618T105,3887000.0,196435,0.000571967447209222,2013-02-12,2012-12-31,0001193125-13-050774
USNA,USANA HEALTH       Common Stock SCIENCES INC,90328M107,3879000.0,117728,0.0005707902566824214,2013-02-12,2012-12-31,0001193125-13-050774
N/A,VIRGINIA COMM      Common equity BANCORP INC,92778Q109,3873000.0,432756,0.0005699073637873209,2013-02-12,2012-12-31,0001193125-13-050774
NWPX,NORTHWEST PIPE       Common equity CO,667746101,3873000.0,162280,0.0005699073637873209,2013-02-12,2012-12-31,0001193125-13-050774
N/A,VICAL INC,925602104,3872000.0,1330348,0.0005697602149714708,2013-02-12,2012-12-31,0001193125-13-050774
N/A,JIVE SOFTWARE INC   Common equity ,47760A108,3867000.0,266075,0.0005690244708922205,2013-02-12,2012-12-31,0001193125-13-050774
N/A,FUEL SYSTEMS      Common Stock SOLUTIONS INC,35952W103,3865000.0,263105,0.0005687301732605203,2013-02-12,2012-12-31,0001193125-13-050774
N/A,STATE AUTO        Common equity FINANCIAL CORP,855707105,3862000.0,258699,0.0005682887268129702,2013-02-12,2012-12-31,0001193125-13-050774
N/A,TRIANGLE          Common equity PETROLEUM         shares CORP,89600B201,3857000.0,643717,0.0005675529827337197,2013-02-12,2012-12-31,0001193125-13-050774
N/A,ENDEAVOUR         Common Stock INTERNATIONAL CORP,29259G200,3842000.0,741810,0.0005653457504959687,2013-02-12,2012-12-31,0001193125-13-050774
N/A,ZOLTEK COS INC    Common equity ,98975W104,3822000.0,493089,0.0005624027741789674,2013-02-12,2012-12-31,0001193125-13-050774
N/A,FISHER               Common Stock COMMUNICATIONS INC,337756209,3803000.0,140998,0.000559606946677816,2013-02-12,2012-12-31,0001193125-13-050774
N/A,ASSISTED          Common equity LIVING            shares CONCEPTS INC,04544X300,3795000.0,389147,0.0005584297561510154,2013-02-12,2012-12-31,0001193125-13-050774
WAIREUR,WESCO AIRCRAFT      Common equity HOLDINGS INC,950814103,3794000.0,287241,0.0005582826073351655,2013-02-12,2012-12-31,0001193125-13-050774
CAMPEUR,CALAMP CORP        Common equity ,128126109,3794000.0,456096,0.0005582826073351655,2013-02-12,2012-12-31,0001193125-13-050774
OCFC,OCEANFIRST        Common equity FINANCIAL         shares CORP,675234108,3793000.0,275695,0.0005581354585193154,2013-02-12,2012-12-31,0001193125-13-050774
N/A,GSI GROUP INC,36191C205,3785000.0,437525,0.0005569582679925148,2013-02-12,2012-12-31,0001193125-13-050774
ORN,ORION MARINE         Common Stock GROUP INC,68628V308,3783000.0,517615,0.0005566639703608147,2013-02-12,2012-12-31,0001193125-13-050774
N/A,FOX CHASE         Common Stock BANCORP INC,35137T108,3769000.0,226493,0.0005546038869389137,2013-02-12,2012-12-31,0001193125-13-050774
N/A,FX ENERGY INC,302695101,3763000.0,915568,0.0005537209940438133,2013-02-12,2012-12-31,0001193125-13-050774
QNST,QUINSTREET INC    Common equity ,74874Q100,3757000.0,558679,0.0005528381011487128,2013-02-12,2012-12-31,0001193125-13-050774
NKSH,NATIONAL             Common equity BANKSHARES           shares INC VA,634865109,3749000.0,115825,0.0005516609106219123,2013-02-12,2012-12-31,0001193125-13-050774
N/A,TORNIER NV          Common equity ,N87237108,3749000.0,223278,0.0005516609106219123,2013-02-12,2012-12-31,0001193125-13-050774
STAA,STAAR SURGICAL CO Common equity ,852312305,3742000.0,613766,0.0005506308689109617,2013-02-12,2012-12-31,0001193125-13-050774
SAN,BANCO             American SANTANDER SA      Depository ,05964H105,3731000.0,456708,0.000549012231936611,2013-02-12,2012-12-31,0001193125-13-050774
N/A,BANK MUTUAL       Common equity CORP,063750103,3728000.0,867099,0.0005485707854890607,2013-02-12,2012-12-31,0001193125-13-050774
CRD/B,CRAWFORD & CO     Common equity ,224633107,3725000.0,466822,0.0005481293390415105,2013-02-12,2012-12-31,0001193125-13-050774
CZNC,CITIZENS &        Common equity NORTHERN CORP,172922106,3712000.0,196316,0.0005462164044354596,2013-02-12,2012-12-31,0001193125-13-050774
N/A,BALDWIN &         Common equity LYONS -CL B,057755209,3702000.0,155135,0.0005447449162769589,2013-02-12,2012-12-31,0001193125-13-050774
N/A,TIM HORTONS INC           Common equity ,88706M103,3698000.0,75166,0.0005441563210135587,2013-02-12,2012-12-31,0001193125-13-050774
N/A,FXCM INC            Common equity ,302693106,3694000.0,366948,0.0005435677257501584,2013-02-12,2012-12-31,0001193125-13-050774
N/A,WESTFIELD         Common equity FINANCIAL INC,96008P104,3685000.0,509648,0.0005422433864075077,2013-02-12,2012-12-31,0001193125-13-050774
BACR 7.1 PERP 3,BARCLAYS BANK PLC   Public preferred ,06739H776,3674000.0,146606,0.000540624749433157,2013-02-12,2012-12-31,0001193125-13-050774
GHM,GRAHAM CORP          Common equity ,384556106,3664000.0,187864,0.0005391532612746563,2013-02-12,2012-12-31,0001193125-13-050774
N/A,YOUKU TUDOU INC     American Depository ,98742U100,3656000.0,200462,0.0005379760707478557,2013-02-12,2012-12-31,0001193125-13-050774
YORW,YORK WATER CO     Common equity ,987184108,3654000.0,207769,0.0005376817731161557,2013-02-12,2012-12-31,0001193125-13-050774
N/A,SCHAWK INC -CL A       Common equity ,806373106,3653000.0,277569,0.0005375346243003056,2013-02-12,2012-12-31,0001193125-13-050774
CTRN,CITI TRENDS INC   Common equity ,17306X102,3647000.0,264846,0.0005366517314052051,2013-02-12,2012-12-31,0001193125-13-050774
N/A,SWS GROUP INC     Common equity ,78503N107,3636000.0,687038,0.0005350330944308544,2013-02-12,2012-12-31,0001193125-13-050774
N/A,SUNOCO            Composition of LOGISTICS         more than 1 PARTNERS LP,86764L108,3635000.0,73098,0.0005348859456150043,2013-02-12,2012-12-31,0001193125-13-050774
N/A,WUXI PHARMATECH     American (CAYMAN)-ADR        Depository ,929352102,3632000.0,230677,0.0005344444991674541,2013-02-12,2012-12-31,0001193125-13-050774
N/A,FIESTA RESTAURANT   Common equity GROUP INC,31660B101,3632000.0,236797,0.0005344444991674541,2013-02-12,2012-12-31,0001193125-13-050774
TRNO,TERRENO REALTY    Real Estate CORP              Investment ,88146M101,3628000.0,234868,0.0005338559039040538,2013-02-12,2012-12-31,0001193125-13-050774
N/A,GLADSTONE         Common equity CAPITAL CORP,376535100,3614000.0,442608,0.0005317958204821528,2013-02-12,2012-12-31,0001193125-13-050774
HTB,HOMETRUST           Common equity BANCSHARES INC,437872104,3614000.0,267600,0.0005317958204821528,2013-02-12,2012-12-31,0001193125-13-050774
HFWA,HERITAGE        Common equity FINANCIAL       shares CORP,42722X106,3602000.0,245448,0.0005300300346919519,2013-02-12,2012-12-31,0001193125-13-050774
ETMUSD,ENTERCOM          Common equity COMMUNICATIONS    shares CORP,293639100,3588000.0,513987,0.000527969951270051,2013-02-12,2012-12-31,0001193125-13-050774
AIEUR,ARLINGTON ASSET      Real Estate INVESTMENT           Investment ,041356205,3577000.0,172365,0.0005263513142957002,2013-02-12,2012-12-31,0001193125-13-050774
N/A,ROADRUNNER TRANS    Common equity SVCS HLDGS,76973Q105,3575000.0,197148,0.0005260570166640001,2013-02-12,2012-12-31,0001193125-13-050774
N/A,NOVAVAX INC,670002104,3552000.0,1880633,0.0005226725938994485,2013-02-12,2012-12-31,0001193125-13-050774
N/A,SELECT INCOME REIT  Real Estate Investment ,81618T100,3544000.0,143024,0.000521495403372648,2013-02-12,2012-12-31,0001193125-13-050774
N/A,SHORETEL INC,825211105,3544000.0,835928,0.000521495403372648,2013-02-12,2012-12-31,0001193125-13-050774
N/A,FIRST CONNECTICUT   Common equity BANCORP,319850103,3533000.0,256773,0.0005198767663982972,2013-02-12,2012-12-31,0001193125-13-050774
HWCC,HOUSTON WIRE &    Common equity CABLE CO,44244K109,3523000.0,287128,0.0005184052782397964,2013-02-12,2012-12-31,0001193125-13-050774
WD,WALKER & DUNLOP INC Common equity ,93148P102,3523000.0,211416,0.0005184052782397964,2013-02-12,2012-12-31,0001193125-13-050774
FBNC,FIRST             Common equity BANCORP/NC,318910106,3518000.0,274552,0.0005176695341605461,2013-02-12,2012-12-31,0001193125-13-050774
N/A,DYNAMIC           Common equity MATERIALS         shares CORP,267888105,3514000.0,252673,0.0005170809388971459,2013-02-12,2012-12-31,0001193125-13-050774
OLP,ONE LIBERTY       Real Estate PROPERTIES        Investment INC,682406103,3503000.0,172736,0.0005154623019227951,2013-02-12,2012-12-31,0001193125-13-050774
N/A,INTRALINKS          Common equity HOLDINGS INC,46118H104,3495000.0,566281,0.0005142851113959945,2013-02-12,2012-12-31,0001193125-13-050774
EWY,ISHARES MSCI      Investments KOREA INDEX       that contain FUND              a pool of securities representing a specific index and are built ,464286772,3485000.0,55009,0.0005128136232374937,2013-02-12,2012-12-31,0001193125-13-050774
N/A,SPDR S&P             Investments INTERNATIONAL        that contain ENERGY SECTOR        a pool of ETF                  securities representing a specific index and are built ,78463X715,3482000.0,139507,0.0005123721767899436,2013-02-12,2012-12-31,0001193125-13-050774
N/A,ALLIANCE          Common equity FINANCIAL         shares CORP/NY,019205103,3482000.0,80076,0.0005123721767899436,2013-02-12,2012-12-31,0001193125-13-050774
N/A,MULTI-FINELINE    Common equity ELECTRON INC,62541B101,3481000.0,172317,0.0005122250279740935,2013-02-12,2012-12-31,0001193125-13-050774
IPHI,INPHI CORP          Common equity ,45772F107,3467000.0,361693,0.0005101649445521926,2013-02-12,2012-12-31,0001193125-13-050774
TSU,TIM PARTICIPACOES  American SA                 Depository ,88706P205,3462000.0,174654,0.0005094292004729421,2013-02-12,2012-12-31,0001193125-13-050774
PRLB,PROTO LABS INC      Common equity ,743713109,3456000.0,87634,0.0005085463075778417,2013-02-12,2012-12-31,0001193125-13-050774
RNET,RIGNET INC          Common equity ,766582100,3450000.0,168987,0.0005076634146827414,2013-02-12,2012-12-31,0001193125-13-050774
IMMU,IMMUNOMEDICS      Common equity INC,452907108,3448000.0,1181273,0.0005073691170510412,2013-02-12,2012-12-31,0001193125-13-050774
KVHI,KVH INDUSTRIES    Common Stock INC,482738101,3448000.0,246810,0.0005073691170510412,2013-02-12,2012-12-31,0001193125-13-050774
CNXN,PC CONNECTION     Common equity INC,69318J100,3438000.0,298817,0.0005058976288925405,2013-02-12,2012-12-31,0001193125-13-050774
EFSC,ENTERPRISE        Common equity FINL              shares SERVICES CP,293712105,3427000.0,262045,0.0005042789919181898,2013-02-12,2012-12-31,0001193125-13-050774
N/A,PALOMAR MED       Common equity TECHNOLOGIES      shares INC,697529303,3425000.0,371842,0.0005039846942864896,2013-02-12,2012-12-31,0001193125-13-050774
N/A,EXACTTARGET INC     Common equity ,30064K105,3420000.0,171011,0.0005032489502072393,2013-02-12,2012-12-31,0001193125-13-050774
N/A,SUPERTEX INC       Common equity ,868532102,3419000.0,194805,0.0005031018013913892,2013-02-12,2012-12-31,0001193125-13-050774
OPY,OPPENHEIMER       Common equity HOLDINGS INC,683797104,3413000.0,197715,0.0005022189084962887,2013-02-12,2012-12-31,0001193125-13-050774
RGEN,REPLIGEN CORP,759916109,3409000.0,542248,0.0005016303132328885,2013-02-12,2012-12-31,0001193125-13-050774
N/A,WASHINGTON         Common equity BANKING CO,937303105,3408000.0,250304,0.0005014831644170384,2013-02-12,2012-12-31,0001193125-13-050774
N/A,ZIPCAR INC          Common equity ,98974X103,3400000.0,412237,0.0005003059738902379,2013-02-12,2012-12-31,0001193125-13-050774
CLVSEUR,CLOVIS ONCOLOGY INC Common equity ,189464100,3380000.0,211157,0.0004973629975732365,2013-02-12,2012-12-31,0001193125-13-050774
N/A,STEC INC          Common equity ,784774101,3380000.0,686190,0.0004973629975732365,2013-02-12,2012-12-31,0001193125-13-050774
N/A,FIVE STAR         Common Stock QUALITY CARE INC,33832D106,3372000.0,672710,0.0004961858070464359,2013-02-12,2012-12-31,0001193125-13-050774
N/A,METALS USA          Common equity HOLDINGS CORP,59132A104,3363000.0,192542,0.0004948614677037852,2013-02-12,2012-12-31,0001193125-13-050774
N/A,FRANKLIN FINANCIAL  Common equity CORP/VA,35353C102,3361000.0,202614,0.0004945671700720851,2013-02-12,2012-12-31,0001193125-13-050774
MFIN,MEDALLION       Common equity FINANCIAL       shares CORP,583928106,3355000.0,285713,0.0004936842771769847,2013-02-12,2012-12-31,0001193125-13-050774
PLPC,PREFORMED LINE    Common Stock PRODUCTS CO,740444104,3352000.0,56352,0.0004932428307294344,2013-02-12,2012-12-31,0001193125-13-050774
N/A,MOLEX INC            Common equity ,608554200,3350000.0,150116,0.0004929485330977344,2013-02-12,2012-12-31,0001193125-13-050774
N/A,MCCLATCHY CO    Common equity -CL A,579489105,3349000.0,1024123,0.0004928013842818843,2013-02-12,2012-12-31,0001193125-13-050774
IMMR,IMMERSION CORP,452521107,3348000.0,487210,0.0004926542354660342,2013-02-12,2012-12-31,0001193125-13-050774
N/A,RESPONSYS INC       Common equity ,761248103,3345000.0,560877,0.0004922127890184839,2013-02-12,2012-12-31,0001193125-13-050774
UFI,UNIFI INC          Common equity ,904677200,3334000.0,255969,0.0004905941520441332,2013-02-12,2012-12-31,0001193125-13-050774
IDT,IDT CORP            Common equity ,448947507,3332000.0,349003,0.0004902998544124331,2013-02-12,2012-12-31,0001193125-13-050774
N/A,COWEN GROUP INC   Common equity ,223622101,3332000.0,1360408,0.0004902998544124331,2013-02-12,2012-12-31,0001193125-13-050774
HZO,MARINEMAX INC   Common equity ,567908108,3325000.0,371986,0.0004892698127014826,2013-02-12,2012-12-31,0001193125-13-050774
CLDT,CHATHAM LODGING     Real Estate TRUST               Investment ,16208T102,3315000.0,215354,0.0004877983245429819,2013-02-12,2012-12-31,0001193125-13-050774
MLR,MILLER          Common equity INDUSTRIES      shares INC/TN,600551204,3311000.0,217147,0.00048720972927958166,2013-02-12,2012-12-31,0001193125-13-050774
PHXUSD,PANHANDLE         Common equity OIL & GAS INC,698477106,3309000.0,117285,0.0004869154316478815,2013-02-12,2012-12-31,0001193125-13-050774
FLICUSD,FIRST LONG        Common equity ISLAND CORP,320734106,3298000.0,116428,0.0004852967946735307,2013-02-12,2012-12-31,0001193125-13-050774
N/A,HOME FEDERAL      Common equity BANCORP INC,43710G105,3283000.0,264029,0.00048308956243577967,2013-02-12,2012-12-31,0001193125-13-050774
N/A,SUPPORT.COM INC    Common equity ,86858W101,3277000.0,784020,0.00048220666954067924,2013-02-12,2012-12-31,0001193125-13-050774
PLUS,EPLUS INC,294268107,3272000.0,79171,0.0004814709254614289,2013-02-12,2012-12-31,0001193125-13-050774
ASR,GRUPO           American AEROPORTUARIO   Depository SURESTE,40051E202,3271000.0,28690,0.0004813237766455788,2013-02-12,2012-12-31,0001193125-13-050774
N/A,SYNERGY           Common equity PHARMACEUTICALS   shares INC,871639308,3270000.0,622162,0.00048117662782972873,2013-02-12,2012-12-31,0001193125-13-050774
N/A,COPEL-CIA         American PARANAENSE        Depository ENERGIA,20441B407,3259000.0,212181,0.000479557990855378,2013-02-12,2012-12-31,0001193125-13-050774
SPARUSD,SPARTAN MOTORS    Common equity INC,846819100,3249000.0,658805,0.0004780865026968773,2013-02-12,2012-12-31,0001193125-13-050774
BYON,OVERSTOCK.COM     Common equity INC,690370101,3246000.0,227101,0.00047764505624932704,2013-02-12,2012-12-31,0001193125-13-050774
N/A,FURMANITE CORP       Common equity ,361086101,3240000.0,603316,0.0004767621633542266,2013-02-12,2012-12-31,0001193125-13-050774
HMST,HOMESTREET INC      Common equity ,43785V102,3235000.0,126614,0.0004760264192749763,2013-02-12,2012-12-31,0001193125-13-050774
CCNE,CNB FINANCIAL     Common equity CORP/PA,126128107,3231000.0,197247,0.00047543782401157604,2013-02-12,2012-12-31,0001193125-13-050774
SNEUR,SANCHEZ ENERGY CORP Common equity ,79970Y105,3231000.0,179518,0.00047543782401157604,2013-02-12,2012-12-31,0001193125-13-050774
GERN,GERON CORP,374163103,3225000.0,2287978,0.0004745549311164756,2013-02-12,2012-12-31,0001193125-13-050774
BMRC,BANK OF MARIN     Common equity BANCORP,063425102,3216000.0,85877,0.000473230591773825,2013-02-12,2012-12-31,0001193125-13-050774
CWI,SPDR MSCI ACWI      USA: Common EX-US ETF,78463X848,3206000.0,99594,0.0004717591036153243,2013-02-12,2012-12-31,0001193125-13-050774
N/A,BLYTH INC         Common equity ,09643P207,3204000.0,206454,0.00047146480598362413,2013-02-12,2012-12-31,0001193125-13-050774
N/A,SIGMA DESIGNS INC,826565103,3200000.0,621039,0.0004708762107202239,2013-02-12,2012-12-31,0001193125-13-050774
N/A,BRIDGEPOINT         Common equity EDUCATION INC,10807M105,3195000.0,310435,0.00047014046664097355,2013-02-12,2012-12-31,0001193125-13-050774
N/A,NATIONAL          Common Stock INTERSTATE CORP,63654U100,3194000.0,110748,0.00046999331782512346,2013-02-12,2012-12-31,0001193125-13-050774
N/A,ACTIVE NETWORK INC  Global Depository ,00506D100,3193000.0,650420,0.0004698461690092734,2013-02-12,2012-12-31,0001193125-13-050774
IWM,ISHARES RUSSELL      Investments 2000 INDEX FUND      that contain a pool of securities representing a specific index and are built ,464287655,3190000.0,37843,0.0004694047225617231,2013-02-12,2012-12-31,0001193125-13-050774
BMO,BANK OF           Common equity MONTREAL,063671101,3169000.0,51655,0.0004663145974288717,2013-02-12,2012-12-31,0001193125-13-050774
ARQLUSD,ARQULE INC        Common equity ,04269E107,3164000.0,1133412,0.00046557885334962135,2013-02-12,2012-12-31,0001193125-13-050774
TLV,GRUPO TELEVISA    American SAB               Depository ,40049J206,3159000.0,118861,0.000464843109270371,2013-02-12,2012-12-31,0001193125-13-050774
N/A,FURIEX              Common Stock PHARMACEUTICALS INC,36106P101,3158000.0,163760,0.0004646959604545209,2013-02-12,2012-12-31,0001193125-13-050774
PKOH,PARK OHIO         Common equity HOLDINGS CORP,700666100,3155000.0,148037,0.0004642545140069707,2013-02-12,2012-12-31,0001193125-13-050774
KTOS,KRATOS            Common equity DEFENSE &         shares SECURITY,50077B207,3145000.0,624567,0.00046278302584847004,2013-02-12,2012-12-31,0001193125-13-050774
N/A,THRESHOLD         Common equity PHARMACEUTICALS,885807206,3142000.0,746600,0.0004623415794009198,2013-02-12,2012-12-31,0001193125-13-050774
N/A,PENDRELL CORP,70686R104,3132000.0,2465746,0.0004608700912424191,2013-02-12,2012-12-31,0001193125-13-050774
N/A,ANADIGICS INC,032515108,3131000.0,1241469,0.000460722942426569,2013-02-12,2012-12-31,0001193125-13-050774
ZIXI,ZIX CORP,98974P100,3130000.0,1118092,0.00046057579361071893,2013-02-12,2012-12-31,0001193125-13-050774
SLCAUSD,U S SILICA          Common equity HOLDINGS INC,90346E103,3120000.0,186568,0.00045910430545221826,2013-02-12,2012-12-31,0001193125-13-050774
N/A,LUMOS NETWORKS CORP Common equity ,550283105,3120000.0,310990,0.00045910430545221826,2013-02-12,2012-12-31,0001193125-13-050774
KIRK,KIRKLAND'S INC,497498105,3117000.0,294559,0.0004586628590046681,2013-02-12,2012-12-31,0001193125-13-050774
VPG,VISHAY PRECISION    Common equity GROUP INC,92835K103,3114000.0,235677,0.00045822141255711784,2013-02-12,2012-12-31,0001193125-13-050774
N/A,KERYX                Common equity BIOPHARMACEUTICALS   shares INC,492515101,3114000.0,1188362,0.00045822141255711784,2013-02-12,2012-12-31,0001193125-13-050774
N/A,SWISHER HYGIENE INC Common equity ,870808102,3109000.0,1776365,0.0004574856684778675,2013-02-12,2012-12-31,0001193125-13-050774
N/A,ODYSSEY MARINE    Common equity EXPLORATION,676118102,3101000.0,1044685,0.0004563084779510669,2013-02-12,2012-12-31,0001193125-13-050774
SPEU,SPDR STOXX EUROPE    Investments 50 ETF               that contain a pool of securities representing a specific index and are built ,78463X103,3099000.0,92168,0.0004560141803193668,2013-02-12,2012-12-31,0001193125-13-050774
N/A,PLX TECHNOLOGY    Common equity INC,693417107,3097000.0,853244,0.00045571988268766666,2013-02-12,2012-12-31,0001193125-13-050774
N/A,RENTRAK CORP           Common equity ,760174102,3094000.0,158780,0.00045527843624011645,2013-02-12,2012-12-31,0001193125-13-050774
N/A,TARGA RESOURCES     Misc Equity PARTNERS LP,87611X105,3092000.0,82710,0.00045498413860841627,2013-02-12,2012-12-31,0001193125-13-050774
BACR 7.75 PERP 4,BARCLAYS BANK PLC    Public preferred ,06739H511,3086000.0,122548,0.00045410124571331585,2013-02-12,2012-12-31,0001193125-13-050774
N/A,POZEN INC,73941U102,3073000.0,612525,0.0004521883111072649,2013-02-12,2012-12-31,0001193125-13-050774
CSIIEUR,CARDIOVASCULAR    Common equity SYSTEMS INC,141619106,3063000.0,244003,0.00045071682294876424,2013-02-12,2012-12-31,0001193125-13-050774
N/A,METRO BANCORP     Common equity INC,59161R101,3051000.0,230889,0.0004489510371585634,2013-02-12,2012-12-31,0001193125-13-050774
N/A,REGENCY ENERGY PARTNERS   Misc Equity LP,75885Y107,3051000.0,140711,0.0004489510371585634,2013-02-12,2012-12-31,0001193125-13-050774
GOOD,GLADSTONE          REIT COMMERCIAL CORP,376536108,3042000.0,169575,0.0004476266978159128,2013-02-12,2012-12-31,0001193125-13-050774
N/A,COURIER CORP      Common equity ,222660102,3032000.0,275591,0.0004461552096574121,2013-02-12,2012-12-31,0001193125-13-050774
N/A,FEDERAL-MOGUL CORP,313549404,3027000.0,377443,0.00044541946557816176,2013-02-12,2012-12-31,0001193125-13-050774
N/A,KCAP FINANCIAL INC  Common equity ,48668E101,3026000.0,329539,0.00044527231676231167,2013-02-12,2012-12-31,0001193125-13-050774
N/A,PMFG INC,69345P103,3024000.0,332672,0.0004449780191306115,2013-02-12,2012-12-31,0001193125-13-050774
DHIL,DIAMOND HILL      Common Stock INVESTMENT GRP,25264R207,3019000.0,44470,0.00044424227505136116,2013-02-12,2012-12-31,0001193125-13-050774
AXASEUR,ABRAXAS           Common equity PETROLEUM         shares CORP/NV,003830106,3018000.0,1378286,0.00044409512623551107,2013-02-12,2012-12-31,0001193125-13-050774
N/A,SILICONWARE       American PRECISION INDS    Depository ,827084864,3007000.0,563039,0.0004424764892611603,2013-02-12,2012-12-31,0001193125-13-050774
RNWA,REALNETWORKS INC       Common equity ,75605L708,3001000.0,397125,0.0004415935963660599,2013-02-12,2012-12-31,0001193125-13-050774
