ticker,nameOfIssuer,cusip,value,shares,allocation_percent,filingDate,reportDate,accessionNumber
AAPL,APPLE INC        Common equity ,037833100,19636171000.0,36838788,2.889439310479484,2013-02-12,2012-12-31,0001193125-13-050774
XOM,"EXXON MOBIL      Common equity                                                    1,2,5,6,8,10,12,17, CORP",30231G102,16553896000.0,191264000,2.4358861941052097,2013-02-12,2012-12-31,0001193125-13-050774
IBM,INTL BUSINESS   Common equity MACHINES CORP,459200101,11953634000.0,62404792,1.758963088205135,2013-02-12,2012-12-31,0001193125-13-050774
CVX,CHEVRON CORP    Common equity ,166764100,11519111000.0,106520361,1.6950235432955152,2013-02-12,2012-12-31,0001193125-13-050774
JNJ,"JOHNSON &        Common equity                                                    1,2,5,6,8,10,12,17, JOHNSON",478160104,10635737000.0,151722340,1.5650361052427755,2013-02-12,2012-12-31,0001193125-13-050774
UTXZ,UNITED            Common equity TECHNOLOGIES      shares CORP,913017109,9099450000.0,110955329,1.338973292386919,2013-02-12,2012-12-31,0001193125-13-050774
MSFT,MICROSOFT CORP  Common equity ,594918104,8714387000.0,326015245,1.2823117279092435,2013-02-12,2012-12-31,0001193125-13-050774
GE,"GENERAL ELECTRIC CO  Common equity                                                   1,2,5,6,8,10,12,18, ",369604103,8633737000.0,411326516,1.2704441759109353,2013-02-12,2012-12-31,0001193125-13-050774
PG,PROCTER &        Common equity GAMBLE CO,742718109,8370927000.0,123301338,1.2317719956173785,2013-02-12,2012-12-31,0001193125-13-050774
T,AT&T INC         Common equity ,00206R102,8101943000.0,240342310,1.1921913185347632,2013-02-12,2012-12-31,0001193125-13-050774
PFE,PFIZER INC       Common equity ,717081103,8038125000.0,320499418,1.1828005754048436,2013-02-12,2012-12-31,0001193125-13-050774
N/A,GOOGLE INC        Common equity ,38259P508,7525484000.0,10608679,1.1073660592986478,2013-02-12,2012-12-31,0001193125-13-050774
JPM,"JPMORGAN CHASE & CO  Common equity                                                   1,2,5,6,8,10,12,17, ",46625H100,7254734000.0,164992861,1.0675255174072413,2013-02-12,2012-12-31,0001193125-13-050774
WFC,"WELLS FARGO &     Common equity                                                   1,2,5,6,8,10,12,18, CO",949746101,7032498000.0,205749010,1.0348237531679854,2013-02-12,2012-12-31,0001193125-13-050774
BRK/B,BERKSHIRE         Common equity HATHAWAY,084670702,6762545000.0,75390686,0.9951004888828113,2013-02-12,2012-12-31,0001193125-13-050774
CAT,CATERPILLAR INC Common equity ,149123101,6386301000.0,71291539,0.9397366298121176,2013-02-12,2012-12-31,0001193125-13-050774
KO,COCA-COLA CO     Common equity ,191216100,6235952000.0,172025763,0.9176129524978754,2013-02-12,2012-12-31,0001193125-13-050774
PM,"PHILIP MORRIS        Common equity                                                  1,2,5,6,8,10,12, INTERNATIONAL",718172109,6047909000.0,72308831,0.8899426477189807,2013-02-12,2012-12-31,0001193125-13-050774
LMT,"LOCKHEED         Common equity                                                    1,2,5,6,8,10,12,17, MARTIN CORP",539830109,5636673000.0,61075638,0.8294297572840614,2013-02-12,2012-12-31,0001193125-13-050774
MRK,"MERCK & CO           Common equity                                                   1,2,5,6,8,10,12,17, ",58933Y105,5384571000.0,131523514,0.792333246510627,2013-02-12,2012-12-31,0001193125-13-050774
ORCL,ORACLE CORP      Common equity ,68389X105,5304571000.0,159200761,0.7805613412426214,2013-02-12,2012-12-31,0001193125-13-050774
WMT,"WAL-MART          Common equity                                                   1,2,5,6,8,10,12,17, STORES INC",931142103,5234311000.0,76715549,0.7702226654409955,2013-02-12,2012-12-31,0001193125-13-050774
BAC,BANK OF         Common equity AMERICA CORP,060505104,5224101000.0,450353705,0.7687202760311663,2013-02-12,2012-12-31,0001193125-13-050774
BAC,"VERIZON           Common equity COMMUNICATIONS    shares                                                        1,2,5,6,8,10,12,17, INC",92343V104,5177726000.0,119660877,0.7618962496961192,2013-02-12,2012-12-31,0001193125-13-050774
MMM,3M CO           Common equity ,88579Y101,4809280000.0,51796286,0.7076798570914244,2013-02-12,2012-12-31,0001193125-13-050774
C,CITIGROUP INC        Common equity ,172967424,4758319000.0,120281148,0.7001810062868891,2013-02-12,2012-12-31,0001193125-13-050774
HON,HONEYWELL            Common equity INTERNATIONAL INC,438516106,4668058000.0,73547438,0.6868992070194458,2013-02-12,2012-12-31,0001193125-13-050774
MCD,MCDONALD'S CORP Common equity ,580135101,4457667000.0,50534654,0.6559404205039338,2013-02-12,2012-12-31,0001193125-13-050774
CSCO,"CISCO SYSTEMS    Common equity                                                    1,2,5,6,8,10,12,18, INC",17275R102,4420766000.0,224975361,0.6505104820502504,2013-02-12,2012-12-31,0001193125-13-050774
INTC,"INTEL CORP      Common equity                                                   1,2,5,6,8,10,12,17,18, ",458140100,4389794000.0,212786564,0.6459529889257419,2013-02-12,2012-12-31,0001193125-13-050774
QCOM,QUALCOMM INC     Common equity ,747525103,4344987000.0,70057897,0.6393596919339479,2013-02-12,2012-12-31,0001193125-13-050774
PEP,PEPSICO INC      Common equity ,713448108,4318453000.0,63107587,0.6354552452541821,2013-02-12,2012-12-31,0001193125-13-050774
ABT,ABBOTT          Common equity LABORATORIES,002824100,4315785000.0,65889831,0.6350626522134942,2013-02-12,2012-12-31,0001193125-13-050774
HD,"HOME DEPOT INC       Common equity                                                   1,2,5,6,8,10,12,17, ",437076102,4315395000.0,69771843,0.6350052641753127,2013-02-12,2012-12-31,0001193125-13-050774
SLB,SCHLUMBERGER     Common equity LTD,806857108,3767826000.0,54377650,0.5544311342291057,2013-02-12,2012-12-31,0001193125-13-050774
CL,"COLGATE-         Common equity                                                    1,2,5,6,8,10,12,17, PALMOLIVE CO",194162103,3698533000.0,35379142,0.5442347513324067,2013-02-12,2012-12-31,0001193125-13-050774
CMCSA,COMCAST CORP    Common equity ,20030N101,3674710000.0,98306881,0.5407292250924105,2013-02-12,2012-12-31,0001193125-13-050774
DIS,DISNEY (WALT) CO     Common equity ,254687106,3655148000.0,73411302,0.5378506999567515,2013-02-12,2012-12-31,0001193125-13-050774
TGT,TARGET CORP      Common equity ,87612E106,3596556000.0,60783464,0.5292289565384642,2013-02-12,2012-12-31,0001193125-13-050774
AMZN,AMAZON.COM INC       Common equity ,023135106,3473279000.0,13830096,0.5110888919669151,2013-02-12,2012-12-31,0001193125-13-050774
DWD,MORGAN STANLEY       Common equity ,617446448,3421017000.0,178923589,0.5033986005529588,2013-02-12,2012-12-31,0001193125-13-050774
V,"VISA INC             Common equity                                                  1,2,5,6,8,10,12, ",92826C839,3040641000.0,20059677,0.4474267225751725,2013-02-12,2012-12-31,0001193125-13-050774
COP,"CONOCOPHILLIPS   Common equity                                                    1,2,5,6,8,10,12,17, ",20825C104,2943962000.0,50766639,0.43320052220760363,2013-02-12,2012-12-31,0001193125-13-050774
DUK,"DUKE ENERGY      Common equity                                                    1,2,5,6,8,10,12,17, CORP",26441C204,2720501000.0,42641163,0.40031850066893115,2013-02-12,2012-12-31,0001193125-13-050774
AMGN,AMGEN INC            Common equity ,031162100,2683329000.0,31085899,0.3948486848861524,2013-02-12,2012-12-31,0001193125-13-050774
MO,ALTRIA GROUP    Common equity INC,02209S103,2664414000.0,84800030,0.39206536503434825,2013-02-12,2012-12-31,0001193125-13-050774
UNH,"UNITEDHEALTH      Common equity                                                   1,2,5,6,8,10,12,18, GROUP INC",91324P102,2645269000.0,48769656,0.3892482009548987,2013-02-12,2012-12-31,0001193125-13-050774
OXY,OCCIDENTAL       Common equity PETROLEUM        shares CORP,674599105,2638374000.0,34439054,0.3882336098696125,2013-02-12,2012-12-31,0001193125-13-050774
AXP,AMERICAN EXPRESS CO  Common equity ,025816109,2634228000.0,45828679,0.38762353087909807,2013-02-12,2012-12-31,0001193125-13-050774
SPG,SIMON PROPERTY   Real Estate GROUP INC        Investment ,828806109,2598964000.0,16439792,0.3824344750369612,2013-02-12,2012-12-31,0001193125-13-050774
USB,"U S BANCORP       Common equity                                                   1,2,5,6,8,10,12,17, ",902973304,2514741000.0,78733391,0.37004116031962075,2013-02-12,2012-12-31,0001193125-13-050774
CVS,CVS CAREMARK    Common equity CORP,126650100,2502052000.0,51748795,0.36817398899529924,2013-02-12,2012-12-31,0001193125-13-050774
BA,BOEING CO       Common equity ,097023105,2442562000.0,32411858,0.35942010594037854,2013-02-12,2012-12-31,0001193125-13-050774
GS,GOLDMAN SACHS GROUP  Common equity INC,38141G104,2441998000.0,19143921,0.3593371140082391,2013-02-12,2012-12-31,0001193125-13-050774
EBA,"EBAY INC         Common equity                                                    1,2,5,6,8,10,12,17, ",278642103,2417274000.0,47379061,0.355699006685162,2013-02-12,2012-12-31,0001193125-13-050774
UNP,UNION PACIFIC     Common equity CORP,907818108,2329414000.0,18528646,0.34277051172457484,2013-02-12,2012-12-31,0001193125-13-050774
N/A,EMC CORP/MA      Common equity ,268648102,2237519000.0,88439652,0.32924827129203266,2013-02-12,2012-12-31,0001193125-13-050774
MDLZ,MONDELEZ        Common equity INTERNATIONAL   shares INC,609207105,2195898000.0,86215008,0.3231237904275369,2013-02-12,2012-12-31,0001193125-13-050774
GILD,GILEAD           Common equity SCIENCES INC,375558103,2194230000.0,29873840,0.322878346202699,2013-02-12,2012-12-31,0001193125-13-050774
BMY,"BRISTOL-MYERS    Common equity                                                    1,2,5,6,8,10,12,17, SQUIBB CO",110122108,2168582000.0,66541052,0.3191042733737764,2013-02-12,2012-12-31,0001193125-13-050774
N/A,MONSANTO CO     Common equity ,61166W101,2162845000.0,22850966,0.31826008061724453,2013-02-12,2012-12-31,0001193125-13-050774
LLY,"LILLY (ELI) & CO     Common equity                                                   1,2,5,6,8,10,12,17, ",532457108,2088082000.0,42337359,0.30725879369784576,2013-02-12,2012-12-31,0001193125-13-050774
UPS,UNITED PARCEL     Common equity SERVICE INC,911312106,2077469000.0,28176593,0.305697103315229,2013-02-12,2012-12-31,0001193125-13-050774
N/A,DU PONT (E I)   Common equity DE NEMOURS,263534109,2014478000.0,44796086,0.29642805225601726,2013-02-12,2012-12-31,0001193125-13-050774
MA,MASTERCARD INC    Common equity ,57636Q104,2014405000.0,4100340,0.29641731039246016,2013-02-12,2012-12-31,0001193125-13-050774
N/A,NEWS CORP,65248E104,2001679000.0,78374408,0.2945446945619522,2013-02-12,2012-12-31,0001193125-13-050774
AIG,AMERICAN        Common equity INTERNATIONAL   shares GROUP,026874784,1922015000.0,54448117,0.2828222312960722,2013-02-12,2012-12-31,0001193125-13-050774
F,FORD MOTOR CO   Common equity ,345370860,1844393000.0,142424614,0.27140024591215806,2013-02-12,2012-12-31,0001193125-13-050774
N/A,MEDTRONIC INC   Common equity ,585055106,1832332000.0,44669183,0.2696254840441904,2013-02-12,2012-12-31,0001193125-13-050774
SO,SOUTHERN CO      Common equity ,842587107,1811338000.0,42311125,0.266536241804234,2013-02-12,2012-12-31,0001193125-13-050774
NOC,"NORTHROP        Common equity                                                   1,2,5,6,8,10,12,17,18, GRUMMAN CORP",666807102,1786058000.0,26428624,0.2628163197395442,2013-02-12,2012-12-31,0001193125-13-050774
LOW,LOWE'S          Common equity COMPANIES INC,548661107,1756595000.0,49453808,0.25848087417815363,2013-02-12,2012-12-31,0001193125-13-050774
N/A,EXPRESS SCRIPTS      Common equity HOLDING CO,30219G108,1746592000.0,32344413,0.2570089445732054,2013-02-12,2012-12-31,0001193125-13-050774
TWXCHF,"TIME WARNER INC   Common equity                                                   1,2,5,6,8,10,12,17, ",887317303,1744556000.0,36474078,0.2567093495841346,2013-02-12,2012-12-31,0001193125-13-050774
EMR,EMERSON ELECTRIC CO  Common equity ,291011104,1743035000.0,32912279,0.2564855362352267,2013-02-12,2012-12-31,0001193125-13-050774
COST,COSTCO          Common equity WHOLESALE       shares CORP,22160K105,1728146000.0,17496692,0.254294637516035,2013-02-12,2012-12-31,0001193125-13-050774
APC,ANADARKO        Common equity PETROLEUM       shares CORP,032511107,1689881000.0,22741045,0.24866398807753204,2013-02-12,2012-12-31,0001193125-13-050774
GIS,"GENERAL MILLS INC    Common equity                                                   1,2,5,6,8,10,12,17, ",370334104,1677556000.0,41513391,0.24685037892217992,2013-02-12,2012-12-31,0001193125-13-050774
BAX,BAXTER              Common equity INTERNATIONAL INC,071813109,1675672000.0,25137387,0.24657315055311843,2013-02-12,2012-12-31,0001193125-13-050774
ACN,ACCENTURE PLC   Common equity ,G1151C101,1645524000.0,24744705,0.24213690805287053,2013-02-12,2012-12-31,0001193125-13-050774
TRV,TRAVELERS COS    Common equity INC,89417E109,1624553000.0,22619819,0.2390510502356787,2013-02-12,2012-12-31,0001193125-13-050774
N/A,DOW CHEMICAL         Common equity ,260543103,1618755000.0,50085254,0.23819788140137999,2013-02-12,2012-12-31,0001193125-13-050774
BP,BP PLC            American Depository ,055622104,1611769000.0,38707267,0.2371698997738514,2013-02-12,2012-12-31,0001193125-13-050774
MET,"METLIFE INC      Common equity                                                    1,2,5,6,8,10,12,18, ",59156R108,1594886000.0,48417921,0.23468558631585465,2013-02-12,2012-12-31,0001193125-13-050774
PEO,EXELON CORP     Common equity ,30161N101,1574104000.0,52928662,0.23162753962485852,2013-02-12,2012-12-31,0001193125-13-050774
SPY,SPDR S&P 500      USA: Common ETF,78462F103,1556028000.0,10917965,0.22896767762955267,2013-02-12,2012-12-31,0001193125-13-050774
KMB,KIMBERLY-       Common equity CLARK CORP,494368103,1548708000.0,18343112,0.22789054829753017,2013-02-12,2012-12-31,0001193125-13-050774
SBUX,STARBUCKS CORP   Common equity ,855244109,1531741000.0,28566744,0.22539387433900201,2013-02-12,2012-12-31,0001193125-13-050774
N/A,HEWLETT-        Common equity PACKARD CO,428236103,1513702000.0,106224728,0.22273945684988258,2013-02-12,2012-12-31,0001193125-13-050774
N/A,WALGREEN CO       Common equity ,931422109,1494183000.0,40372504,0.21986725911330504,2013-02-12,2012-12-31,0001193125-13-050774
BIIB,BIOGEN IDEC INC      Common equity ,09062X103,1474986000.0,10056540,0.2170424432954313,2013-02-12,2012-12-31,0001193125-13-050774
FCX,FREEPORT-       Common equity MCMORAN         shares COP&GOLD,35671D857,1472145000.0,43045114,0.21662439350960122,2013-02-12,2012-12-31,0001193125-13-050774
N/A,DIRECTV         Common equity ,25490A309,1469667000.0,29299637,0.21625975874392475,2013-02-12,2012-12-31,0001193125-13-050774
CMI,"CUMMINS INC      Common equity                                                    1,2,5,6,8,10,12,17, ",231021106,1452764000.0,13407979,0.213772502309611,2013-02-12,2012-12-31,0001193125-13-050774
NKE,"NIKE INC         Common equity                                                    1,2,5,6,8,10,12,17, ",654106103,1448619000.0,28073882,0.21316257046791248,2013-02-12,2012-12-31,0001193125-13-050774
D,DOMINION        Common equity RESOURCES INC,25746U109,1429502000.0,27596438,0.2103495265553067,2013-02-12,2012-12-31,0001193125-13-050774
EIX,EDISON          Common equity INTERNATIONAL,281020107,1424530000.0,31523081,0.20961790264290014,2013-02-12,2012-12-31,0001193125-13-050774
ADP,AUTOMATIC DATA   Common equity PROCESSING,053015103,1404229000.0,24631098,0.20663063453232786,2013-02-12,2012-12-31,0001193125-13-050774
NEE,NEXTERA ENERGY  Common equity INC,65339F101,1399331000.0,20224453,0.20590989963229422,2013-02-12,2012-12-31,0001193125-13-050774
YUM,YUM BRANDS INC    Common equity ,988498101,1396468000.0,21031128,0.2054886125725155,2013-02-12,2012-12-31,0001193125-13-050774
PNC,PNC FINANCIAL    Common equity SVCS GROUP       shares INC,693475105,1395535000.0,23933176,0.2053513227273274,2013-02-12,2012-12-31,0001193125-13-050774
PSX,"PHILLIPS 66         Common equity                                                    1,2,5,6,8,10, ",718546104,1395033000.0,26271646,0.20527745402177064,2013-02-12,2012-12-31,0001193125-13-050774
CELG,CELGENE CORP       Common equity ,151020104,1395021000.0,17721432,0.20527568823598044,2013-02-12,2012-12-31,0001193125-13-050774
EOG,"EOG RESOURCES    Common equity                                                    1,2,5,6,8,10,12,17, INC",26875P101,1381302000.0,11435490,0.20325695363133334,2013-02-12,2012-12-31,0001193125-13-050774
TXN,TEXAS            Common Stock INSTRUMENTS INC,882508104,1371262000.0,44320082,0.2017795795201986,2013-02-12,2012-12-31,0001193125-13-050774
FE,FIRSTENERGY     Common equity CORP,337932107,1365917000.0,32709014,0.20099306909948,2013-02-12,2012-12-31,0001193125-13-050774
CTLEUR,"CENTURYLINK INC  Common equity                                                    1,2,5,6,8,10,12,17, ",156700106,1365049000.0,34894026,0.20086534392732217,2013-02-12,2012-12-31,0001193125-13-050774
COF,CAPITAL ONE     Common equity FINANCIAL       shares CORP,14040H105,1362264000.0,23515760,0.2004555344751797,2013-02-12,2012-12-31,0001193125-13-050774
HAL,HALLIBURTON CO  Common equity ,406216101,1358688000.0,39166495,0.19992933030969987,2013-02-12,2012-12-31,0001193125-13-050774
PXGBX,PRAXAIR INC      Common equity ,74005P104,1347400000.0,12310620,0.19826831447638427,2013-02-12,2012-12-31,0001193125-13-050774
9990302D,APACHE CORP          Common equity ,037411105,1325659000.0,16887291,0.1950691520709879,2013-02-12,2012-12-31,0001193125-13-050774
N/A,HCP INC         Real Estate Investment ,40414L109,1320153000.0,29219694,0.1942589506909174,2013-02-12,2012-12-31,0001193125-13-050774
N/A,PRICELINE.COM     Common equity INC,741503403,1307656000.0,2105062,0.1924200319392391,2013-02-12,2012-12-31,0001193125-13-050774
BK,"BANK OF NEW     Common equity YORK MELLON     shares                                                        1,2,5,6,8,10,12,18, CORP",064058100,1302882000.0,50695567,0.19171754349237086,2013-02-12,2012-12-31,0001193125-13-050774
DE,DEERE & CO      Common equity ,244199105,1296995000.0,15008050,0.1908512784134615,2013-02-12,2012-12-31,0001193125-13-050774
DHR,DANAHER CORP    Common equity ,235851102,1278564000.0,22872329,0.18813917858852883,2013-02-12,2012-12-31,0001193125-13-050774
NOVEUR,NATIONAL             Common equity OILWELL              shares VARCO INC,637071101,1262313000.0,18468397,0.18574786318214936,2013-02-12,2012-12-31,0001193125-13-050774
AMT,AMERICAN TOWER    Common equity CORP,03027X100,1259506000.0,16299926,0.1853348164560582,2013-02-12,2012-12-31,0001193125-13-050774
IP,INTL PAPER CO   Common equity ,460146103,1253698000.0,31468252,0.184480176133601,2013-02-12,2012-12-31,0001193125-13-050774
N/A,TIME WARNER CABLE   Common Stock INC,88732J207,1229017000.0,12645555,0.18084839620960544,2013-02-12,2012-12-31,0001193125-13-050774
TJX,"TJX COMPANIES     Common equity                                                   1,2,5,6,8,10,12,17, INC",872540109,1219272000.0,28722755,0.1794144309991465,2013-02-12,2012-12-31,0001193125-13-050774
AFL,"AFLAC INC            Common equity                                                   1,2,5,6,8,10,12,17, ",001055102,1191635000.0,22432929,0.17534767917549812,2013-02-12,2012-12-31,0001193125-13-050774
ITW,ILLINOIS TOOL WORKS  Common equity ,452308109,1166970000.0,19190380,0.17171825363255613,2013-02-12,2012-12-31,0001193125-13-050774
N/A,ALLERGAN INC     Common equity ,018490102,1132987000.0,12351342,0.16671769542352322,2013-02-12,2012-12-31,0001193125-13-050774
N/A,"ACE LTD              Common equity                                                  1,2,5,6,8,10,12, ",H0023R105,1122846000.0,14070718,0.16522545928198765,2013-02-12,2012-12-31,0001193125-13-050774
PSA,PUBLIC STORAGE  Real Estate Investment ,74460D109,1122035000.0,7740374,0.16510612159233326,2013-02-12,2012-12-31,0001193125-13-050774
FDX,FEDEX CORP      Common equity ,31428X106,1086436000.0,11844985,0.15986777089688659,2013-02-12,2012-12-31,0001193125-13-050774
N/A,"COVIDIEN PLC        Common equity                                                  1,2,5,6,8,10,12, ",G2554F113,1081759000.0,18734946,0.1591795558851558,2013-02-12,2012-12-31,0001193125-13-050774
GD,GENERAL         Common equity DYNAMICS CORP,369550108,1066828000.0,15401004,0.15698247691569842,2013-02-12,2012-12-31,0001193125-13-050774
BLKCHF,BLACKROCK INC     Common equity ,09247X101,1063223000.0,5143585,0.15645200543455892,2013-02-12,2012-12-31,0001193125-13-050774
STT,STATE STREET     Common equity CORP,857477103,1054544000.0,22432290,0.15517490086179617,2013-02-12,2012-12-31,0001193125-13-050774
N/A,PRECISION         Common equity CASTPARTS         shares CORP,740189105,1049048000.0,5538184,0.15436617096988417,2013-02-12,2012-12-31,0001193125-13-050774
AEP,"AMERICAN         Common equity ELECTRIC         shares                                                         1,2,5,6,8,10,12,17, POWER CO",025537101,1038147000.0,24324024,0.15276210172830257,2013-02-12,2012-12-31,0001193125-13-050774
VIAB,"VIACOM INC                Common Stock                                                     1,2,5,6,8, ",92553P201,1035826000.0,19640142,0.15242056932671455,2013-02-12,2012-12-31,0001193125-13-050774
BDX,"BECTON DICKINSON &   Common equity                                                   1,2,5,6,8,10,12,17, CO",075887109,1029571000.0,13167525,0.15150015348357238,2013-02-12,2012-12-31,0001193125-13-050774
PPG,PPG INDUSTRIES   Common equity INC,693506107,1027120000.0,7588609,0.15113949173592386,2013-02-12,2012-12-31,0001193125-13-050774
ED,CONSOLIDATED    Common equity EDISON INC,209115104,1025220000.0,18458985,0.1508599089858087,2013-02-12,2012-12-31,0001193125-13-050774
PRU,PRUDENTIAL       Common equity FINANCIAL INC,744320102,1020600000.0,19137440,0.15018008145658138,2013-02-12,2012-12-31,0001193125-13-050774
N/A,AETNA INC       Common equity ,00817Y108,1005138000.0,21709251,0.14790486646590761,2013-02-12,2012-12-31,0001193125-13-050774
VTR,VENTAS INC         Real Estate Investment ,92276F100,1005131000.0,15530461,0.14790383642419666,2013-02-12,2012-12-31,0001193125-13-050774
NEM,NEWMONT MINING   Common equity CORP,651639106,991140000.0,21342269,0.14584507734163832,2013-02-12,2012-12-31,0001193125-13-050774
N/A,EATON CORP PLC  Common equity ,G29183103,984236000.0,18159526,0.14482916191700945,2013-02-12,2012-12-31,0001193125-13-050774
MCK,"MCKESSON CORP    Common equity                                                    1,2,5,6,8,10,12,17, ",58155Q103,972597000.0,10030914,0.14311649684933048,2013-02-12,2012-12-31,0001193125-13-050774
WMB,WILLIAMS COS      Common equity INC,969457100,967070000.0,29537781,0.14230320534412713,2013-02-12,2012-12-31,0001193125-13-050774
EQR,"EQUITY RESIDENTIAL   Real Estate Investment                                                    1,2,3,5,6,8,10,12, ",29476L107,964476000.0,17019105,0.14192150131581208,2013-02-12,2012-12-31,0001193125-13-050774
SYY,SYSCO CORP       Common equity ,871829107,955258000.0,30172518,0.14056508353130612,2013-02-12,2012-12-31,0001193125-13-050774
MRO*,MARATHON OIL    Common equity CORP,565849106,951997000.0,31050153,0.14008523124281905,2013-02-12,2012-12-31,0001193125-13-050774
N/A,CHUBB CORP      Common equity ,171232101,948293000.0,12590169,0.13954019202891038,2013-02-12,2012-12-31,0001193125-13-050774
MPC,MARATHON PETROLEUM  Common equity CORP,56585A102,930850000.0,14775329,0.13697347523403763,2013-02-12,2012-12-31,0001193125-13-050774
N/A,"YAHOO INC         Common equity                                                   1,2,5,6,8,10,12,17, ",984332106,926684000.0,46566856,0.13636045326720622,2013-02-12,2012-12-31,0001193125-13-050774
TMO,THERMO FISHER     Common equity SCIENTIFIC        shares INC,883556102,925262000.0,14507059,0.13615120765106742,2013-02-12,2012-12-31,0001193125-13-050774
APD,AIR PRODUCTS &       Common equity CHEMICALS INC,009158106,917820000.0,10923904,0.1350561261635112,2013-02-12,2012-12-31,0001193125-13-050774
N/A,CBS CORP          Common equity ,124857202,902204000.0,23710925,0.13275825025519652,2013-02-12,2012-12-31,0001193125-13-050774
ADM,ARCHER-         Common equity DANIELS-        shares MIDLAND CO,039483102,897439000.0,32765237,0.13205708614767092,2013-02-12,2012-12-31,0001193125-13-050774
PLD,PROLOGIS INC      Real Estate Investment ,74340W103,896240000.0,24561322,0.13188065471746668,2013-02-12,2012-12-31,0001193125-13-050774
VLO,"VALERO ENERGY     Common equity                                                   1,2,5,6,8,10,12,17, CORP",91913Y100,895928000.0,26258069,0.13183474428692146,2013-02-12,2012-12-31,0001193125-13-050774
CTSH,COGNIZANT TECH    Common equity SOLUTIONS,192446102,893737000.0,12069390,0.131512341231394,2013-02-12,2012-12-31,0001193125-13-050774
KMI,KINDER MORGAN INC   Common equity ,49456B101,881397000.0,24947573,0.12969652484380412,2013-02-12,2012-12-31,0001193125-13-050774
N/A,LYONDELLBASELL      Common equity INDUSTRIES NV,N53745100,880667000.0,15425937,0.12958910620823355,2013-02-12,2012-12-31,0001193125-13-050774
ECL,ECOLAB INC      Common equity ,278865100,879869000.0,12237335,0.1294716814531852,2013-02-12,2012-12-31,0001193125-13-050774
BBTUSD,BB&T CORP       Common equity ,054937107,874933000.0,30055998,0.12874535489814926,2013-02-12,2012-12-31,0001193125-13-050774
N/A,AON PLC         Common equity ,G0408V102,863463000.0,15529957,0.12705755798034896,2013-02-12,2012-12-31,0001193125-13-050774
PCG,PG&E CORP        Common equity ,69331C108,859674000.0,21395779,0.12650001111709303,2013-02-12,2012-12-31,0001193125-13-050774
N/A,CROWN CASTLE      Common equity INTL CORP,228227104,855562000.0,11856495,0.12589493518631753,2013-02-12,2012-12-31,0001193125-13-050774
NUE,NUCOR CORP       Common equity ,670346105,850050000.0,19686328,0.12508385091335197,2013-02-12,2012-12-31,0001193125-13-050774
BXP,BOSTON          Real Estate PROPERTIES      Investment INC,101121101,849261000.0,8026260,0.12496775049764626,2013-02-12,2012-12-31,0001193125-13-050774
