ticker,nameOfIssuer,cusip,value,shares,allocation_percent,filingDate,reportDate,accessionNumber
CHFCUSD,CHEMICAL           Common equity FINANCIAL          shares CORP,163731102,14092000.0,593142,0.0020736211129591857,2013-02-12,2012-12-31,0001193125-13-050774
N/A,RUE21 INC           Common equity ,781295100,14047000.0,494734,0.0020669994162459326,2013-02-12,2012-12-31,0001193125-13-050774
CHCO,CITY HOLDING CO   Common equity ,177835105,14040000.0,403004,0.0020659693745349824,2013-02-12,2012-12-31,0001193125-13-050774
N/A,SYKES ENTERPRISES  Common equity INC,871237103,14032000.0,921914,0.0020647921840081817,2013-02-12,2012-12-31,0001193125-13-050774
HPP,HUDSON PACIFIC      Common equity PPTYS INC,444097109,14026000.0,666028,0.002063909291113081,2013-02-12,2012-12-31,0001193125-13-050774
ROICUSD,RETAIL OPPORTUNITY  REIT INVTS CP,76131N101,14019000.0,1089989,0.0020628792494021306,2013-02-12,2012-12-31,0001193125-13-050774
SSNC,SS&C TECHNOLOGIES   Common equity HLDGS INC,78467J100,14016000.0,606299,0.0020624378029545807,2013-02-12,2012-12-31,0001193125-13-050774
N/A,BOULDER BRANDS INC        Common equity ,101405108,13993000.0,1084723,0.002059053380190029,2013-02-12,2012-12-31,0001193125-13-050774
N/A,IXIA              Common equity ,45071R109,13985000.0,823414,0.0020578761896632284,2013-02-12,2012-12-31,0001193125-13-050774
N/A,ISTAR FINANCIAL INC  Real Estate Investment ,45031U101,13967000.0,1714264,0.002055227510977927,2013-02-12,2012-12-31,0001193125-13-050774
VRTS,VIRTUS INVESTMENT   Common Stock PTNRS INC,92828Q109,13938000.0,115271,0.002050960195318275,2013-02-12,2012-12-31,0001193125-13-050774
HURN,HURON             Common equity CONSULTING        shares GROUP INC,447462102,13932000.0,413602,0.0020500773024231746,2013-02-12,2012-12-31,0001193125-13-050774
N/A,BIO REFERENCE     Common equity LABS,09057G602,13925000.0,485381,0.0020490472607122244,2013-02-12,2012-12-31,0001193125-13-050774
ORIT,ORITANI FINANCIAL   Common equity CORP,68633D103,13917000.0,908468,0.0020478700701854237,2013-02-12,2012-12-31,0001193125-13-050774
N/A,AMTRUST           Common equity FINANCIAL         shares SERVICES,032359309,13892000.0,484353,0.0020441913497891715,2013-02-12,2012-12-31,0001193125-13-050774
N/A,SPANSION INC        Common equity ,84649R200,13890000.0,998457,0.0020438970521574717,2013-02-12,2012-12-31,0001193125-13-050774
BMI,BADGER METER      Common equity INC,056525108,13889000.0,292974,0.0020437499033416216,2013-02-12,2012-12-31,0001193125-13-050774
TISIUSD,TEAM INC,878155100,13886000.0,365009,0.0020433084568940714,2013-02-12,2012-12-31,0001193125-13-050774
N/A,BASIC ENERGY SERVICES INC Common equity ,06985P100,13860000.0,1214522,0.0020394825876819695,2013-02-12,2012-12-31,0001193125-13-050774
N/A,SUSSER            Common Stock HOLDINGS CORP,869233106,13843000.0,401384,0.0020369810578125184,2013-02-12,2012-12-31,0001193125-13-050774
N/A,BROOKFIELD        Common equity OFFICE PPTYS      shares INC,112900105,13760000.0,808875,0.0020247677060969624,2013-02-12,2012-12-31,0001193125-13-050774
N/A,BELO CORP -SER    Common equity A COM,080555105,13757000.0,1793629,0.002024326259649412,2013-02-12,2012-12-31,0001193125-13-050774
N/A,ENDOLOGIX INC,29266S106,13741000.0,965161,0.002021971878595811,2013-02-12,2012-12-31,0001193125-13-050774
SSL,SASOL LTD              American Depository ,803866300,13737000.0,317345,0.0020213832833324108,2013-02-12,2012-12-31,0001193125-13-050774
N/A,INFINITY           Common equity PROPERTY & CAS     shares CORP,45665Q103,13736000.0,235903,0.0020212361345165607,2013-02-12,2012-12-31,0001193125-13-050774
N/A,TRIANGLE CAPITAL    Common equity CORP,895848109,13730000.0,538688,0.0020203532416214606,2013-02-12,2012-12-31,0001193125-13-050774
N/A,VIEWPOINT         Common equity FINANCIAL         shares GROUP,92672A101,13696000.0,653950,0.002015350181882558,2013-02-12,2012-12-31,0001193125-13-050774
SKAA,SKECHERS U S A    Common equity INC,830566105,13682000.0,739405,0.0020132900984606568,2013-02-12,2012-12-31,0001193125-13-050774
N/A,LINN ENERGY LLC           Composition of more than 1 ,536020100,13675000.0,388049,0.0020122600567497066,2013-02-12,2012-12-31,0001193125-13-050774
CCU,COMPANIA          American CERVECERIAS       Depository UNIDAS,204429104,13650000.0,431576,0.002008581336353455,2013-02-12,2012-12-31,0001193125-13-050774
NUVAGBP,NUVASIVE INC      Common equity ,670704105,13506000.0,873621,0.0019873919068710446,2013-02-12,2012-12-31,0001193125-13-050774
AXL,AMERICAN        Common equity AXLE & MFG      shares HOLDINGS,024061103,13475000.0,1203250,0.0019828302935796923,2013-02-12,2012-12-31,0001193125-13-050774
N/A,HORSEHEAD HOLDING   Common equity CORP,440694305,13463000.0,1318973,0.0019810645077894917,2013-02-12,2012-12-31,0001193125-13-050774
HTLD,HEARTLAND       Common equity EXPRESS INC,422347104,13454000.0,1029276,0.0019797401684468413,2013-02-12,2012-12-31,0001193125-13-050774
LPSN,LIVEPERSON INC,538146101,13441000.0,1022817,0.00197782723384079,2013-02-12,2012-12-31,0001193125-13-050774
N/A,LANDAUER INC         Common equity ,51476K103,13426000.0,219379,0.0019756200016030393,2013-02-12,2012-12-31,0001193125-13-050774
ARRYEUR,ARRAY             Common equity BIOPHARMA INC,04269X105,13350000.0,3589585,0.001964436691598434,2013-02-12,2012-12-31,0001193125-13-050774
N/A,EMERITUS CORP     Common equity ,291005106,13324000.0,539139,0.001960610822386332,2013-02-12,2012-12-31,0001193125-13-050774
N/A,PARKER            Common equity DRILLING CO,701081101,13285000.0,2888462,0.0019548720185681794,2013-02-12,2012-12-31,0001193125-13-050774
RP,REALPAGE INC        Common equity ,75606N109,13272000.0,615412,0.0019529590839621283,2013-02-12,2012-12-31,0001193125-13-050774
MGRC,MCGRATH         Common equity RENTCORP,580589109,13241000.0,456183,0.0019483974706707762,2013-02-12,2012-12-31,0001193125-13-050774
CIR2USD,CIRCOR INTL INC    Common equity ,17273K109,13203000.0,333426,0.0019428058156684737,2013-02-12,2012-12-31,0001193125-13-050774
FREDQ,FREDS INC            Common equity ,356108100,13154000.0,987896,0.0019355955236918202,2013-02-12,2012-12-31,0001193125-13-050774
BFS,SAUL CENTERS INC       Real Estate Investment ,804395101,13113000.0,306452,0.0019295624222419672,2013-02-12,2012-12-31,0001193125-13-050774
2362120D,SINCLAIR          Common equity BROADCAST         shares GP -CL A,829226109,13069000.0,1035697,0.0019230878743445642,2013-02-12,2012-12-31,0001193125-13-050774
LMX,LUMINEX CORP,55027E102,13065000.0,779359,0.0019224992790811638,2013-02-12,2012-12-31,0001193125-13-050774
SXI,STANDEX           Common equity INTERNATIONAL     shares CORP,854231107,13056000.0,254622,0.0019211749397385132,2013-02-12,2012-12-31,0001193125-13-050774
CMD,CANTEL MEDICAL     Common equity CORP,138098108,13046000.0,438811,0.0019197034515800126,2013-02-12,2012-12-31,0001193125-13-050774
WIT,WIPRO LTD         American Depository ,97651M109,13045000.0,1488953,0.0019195563027641625,2013-02-12,2012-12-31,0001193125-13-050774
N/A,TOWER GROUP INC   Common equity ,891777104,12990000.0,731078,0.001911463117892409,2013-02-12,2012-12-31,0001193125-13-050774
N/A,DIGITAL RIVER     Common equity INC,25388B104,12984000.0,902379,0.0019105802249973082,2013-02-12,2012-12-31,0001193125-13-050774
N/A,ELAN CORP PLC     American Depository ,284131208,12952000.0,1268662,0.0019058714628901062,2013-02-12,2012-12-31,0001193125-13-050774
N/A,ATMI INC          Common equity ,00207R101,12947000.0,620276,0.0019051357188108555,2013-02-12,2012-12-31,0001193125-13-050774
N/A,AMERICAN          Common equity GREETINGS         shares -CL A,026375105,12877000.0,762514,0.0018948353017013508,2013-02-12,2012-12-31,0001193125-13-050774
N/A,STEINER           Common equity LEISURE LTD,P8744Y102,12825000.0,266158,0.001887183563277147,2013-02-12,2012-12-31,0001193125-13-050774
RDY,DR REDDY'S        American LABORATORIES      Depository LTD,256135203,12816000.0,384969,0.0018858592239344965,2013-02-12,2012-12-31,0001193125-13-050774
N/A,STEWART           Common equity ENTERPRISES       shares -CL A,860370105,12814000.0,1677097,0.0018855649263027961,2013-02-12,2012-12-31,0001193125-13-050774
N/A,IPC THE              Common Stock HOSPITALIST CO INC,44984A105,12802000.0,322380,0.0018837991405125955,2013-02-12,2012-12-31,0001193125-13-050774
PNNT,PENNANTPARK         Common equity INVESTMENT CORP.,708062104,12783000.0,1162493,0.0018810033130114443,2013-02-12,2012-12-31,0001193125-13-050774
N/A,TRUE RELIGION      Common Stock APPAREL INC,89784N104,12766000.0,502257,0.0018785017831419932,2013-02-12,2012-12-31,0001193125-13-050774
SKYW,SKYWEST INC       Common equity ,830879102,12710000.0,1020587,0.001870261449454389,2013-02-12,2012-12-31,0001193125-13-050774
N/A,SONIC CORP        Common equity ,835451105,12702000.0,1220032,0.0018690842589275888,2013-02-12,2012-12-31,0001193125-13-050774
N/A,CEC               Common equity ENTERTAINMENT     shares INC,125137109,12687000.0,382157,0.0018668770266898375,2013-02-12,2012-12-31,0001193125-13-050774
DIOD,DIODES INC        Common equity ,254543101,12665000.0,730443,0.0018636397527411358,2013-02-12,2012-12-31,0001193125-13-050774
KOF,COCA-COLA         American FEMSA SAB DE      Depository CV,191241108,12658000.0,84934,0.0018626097110301853,2013-02-12,2012-12-31,0001193125-13-050774
EIG,EMPLOYERS HOLDINGS  Common equity INC,292218104,12638000.0,614164,0.001859666734713184,2013-02-12,2012-12-31,0001193125-13-050774
APEI,AMERICAN PUBLIC     Common Stock EDUCATION,02913V103,12607000.0,349220,0.0018551051214218321,2013-02-12,2012-12-31,0001193125-13-050774
TYPEUSD,MONOTYPE IMAGING    Common equity HOLDINGS,61022P100,12535000.0,784303,0.0018445104066806268,2013-02-12,2012-12-31,0001193125-13-050774
ASTE,ASTEC             Common equity INDUSTRIES        shares INC,046224101,12498000.0,374878,0.0018390659004941744,2013-02-12,2012-12-31,0001193125-13-050774
LXU,LSB INDUSTRIES       Common equity INC,502160104,12465000.0,351874,0.001834209989571122,2013-02-12,2012-12-31,0001193125-13-050774
N/A,CNH GLOBAL NV     Common equity ,N20935206,12459000.0,309356,0.0018333270966760214,2013-02-12,2012-12-31,0001193125-13-050774
N/A,SAUER-DANFOSS INC      Common equity ,804137107,12455000.0,233413,0.001832738501412621,2013-02-12,2012-12-31,0001193125-13-050774
COLM,COLUMBIA          Common equity SPORTSWEAR CO,198516106,12395000.0,232323,0.001823909572461617,2013-02-12,2012-12-31,0001193125-13-050774
ECPG,ENCORE CAPITAL       Common equity GROUP INC,292554102,12383000.0,404459,0.0018221437866714164,2013-02-12,2012-12-31,0001193125-13-050774
OXM,OXFORD            Common equity INDUSTRIES        shares INC,691497309,12361000.0,266621,0.0018189065127227147,2013-02-12,2012-12-31,0001193125-13-050774
N/A,EMULEX CORP       Common equity ,292475209,12356000.0,1692545,0.0018181707686434644,2013-02-12,2012-12-31,0001193125-13-050774
CALM,CAL-MAINE          Common Stock FOODS INC,128030202,12298000.0,305829,0.0018096361373241604,2013-02-12,2012-12-31,0001193125-13-050774
AEIS,ADVANCED          Common equity ENERGY INDS       shares INC,007973100,12291000.0,890178,0.00180860609561321,2013-02-12,2012-12-31,0001193125-13-050774
N/A,ROFIN SINAR            Common equity TECHNOLOGIES           shares INC,775043102,12256000.0,565179,0.0018034558870584573,2013-02-12,2012-12-31,0001193125-13-050774
STBA,S & T BANCORP INC      Common equity ,783859101,12188000.0,674562,0.0017934497675806526,2013-02-12,2012-12-31,0001193125-13-050774
RUSHA,RUSH              Common equity ENTERPRISES       shares INC,781846209,12111000.0,585855,0.0017821193087601973,2013-02-12,2012-12-31,0001193125-13-050774
N/A,G&K SERVICES INC     Common equity -CL A,361268105,12090000.0,354028,0.0017790291836273456,2013-02-12,2012-12-31,0001193125-13-050774
RGP,RESOURCES              Common equity CONNECTION INC,76122Q105,12077000.0,1011675,0.001777116249021295,2013-02-12,2012-12-31,0001193125-13-050774
N/A,MECHEL OAO        American Depository ,583840103,12070000.0,1741232,0.0017760862073103443,2013-02-12,2012-12-31,0001193125-13-050774
KT,KT CORP              American Depository ,48268K101,12053000.0,719988,0.0017735846774408932,2013-02-12,2012-12-31,0001193125-13-050774
ABX,BARRICK GOLD      Common equity CORP,067901108,12031000.0,343649,0.0017703474034921915,2013-02-12,2012-12-31,0001193125-13-050774
N/A,ELLIE MAE INC       Common equity ,28849P100,12030000.0,433561,0.0017702002546763416,2013-02-12,2012-12-31,0001193125-13-050774
N/A,CONCEPTUS INC,206016107,12023000.0,572357,0.001769170212965391,2013-02-12,2012-12-31,0001193125-13-050774
N/A,WEBSENSE INC       Common equity ,947684106,11991000.0,797164,0.0017644614508581886,2013-02-12,2012-12-31,0001193125-13-050774
N/A,TASER             Common equity INTERNATIONAL     shares INC,87651B104,11938000.0,1335390,0.0017566625636181352,2013-02-12,2012-12-31,0001193125-13-050774
N/A,KINDRED           Common equity HEALTHCARE        shares INC,494580103,11911000.0,1100955,0.0017526895455901833,2013-02-12,2012-12-31,0001193125-13-050774
N/A,DREW              Common equity INDUSTRIES        shares INC,26168L205,11911000.0,369477,0.0017526895455901833,2013-02-12,2012-12-31,0001193125-13-050774
LORLUSD,LORAL SPACE &        Common equity COMMUNICATIONS,543881106,11869000.0,217082,0.0017465092953244802,2013-02-12,2012-12-31,0001193125-13-050774
AIN,ALBANY INTL       Common equity CORP -CL A,012348108,11868000.0,523441,0.0017463621465086303,2013-02-12,2012-12-31,0001193125-13-050774
PESUSD,PIONEER ENERGY    Common Stock SERVICES CORP,723664108,11844000.0,1631631,0.0017428305749282286,2013-02-12,2012-12-31,0001193125-13-050774
N/A,FORESTAR GROUP INC   Common equity ,346233109,11796000.0,680724,0.0017357674317674252,2013-02-12,2012-12-31,0001193125-13-050774
N/A,CASCADE CORP       Common equity ,147195101,11795000.0,183453,0.0017356202829515751,2013-02-12,2012-12-31,0001193125-13-050774
N/A,GREENLIGHT CAPITAL  Common equity RE LTD,G4095J109,11795000.0,511128,0.0017356202829515751,2013-02-12,2012-12-31,0001193125-13-050774
N/A,OPTIMER             Common Stock PHARMACEUTICALS INC,68401H104,11751000.0,1298245,0.001729145735054172,2013-02-12,2012-12-31,0001193125-13-050774
HTGC,HERCULES TECHNOLOGY  Common Stock GROWTH CAPITAL INC.,427096508,11661000.0,1047424,0.0017159023416276659,2013-02-12,2012-12-31,0001193125-13-050774
NBIX,NEUROCRINE           Common equity BIOSCIENCES          shares INC,64125C109,11640000.0,1556543,0.0017128122164948142,2013-02-12,2012-12-31,0001193125-13-050774
IBKR,INTERACTIVE         Common equity BROKERS GROUP,45841N107,11593000.0,847256,0.0017058962221498612,2013-02-12,2012-12-31,0001193125-13-050774
FARO,FARO              Common equity TECHNOLOGIES      shares INC,311642102,11587000.0,324811,0.0017050133292547604,2013-02-12,2012-12-31,0001193125-13-050774
EBS,EMERGENT          Common equity BIOSOLUTIONS      shares INC,29089Q105,11575000.0,721644,0.0017032475434645598,2013-02-12,2012-12-31,0001193125-13-050774
N/A,BIGLARI HOLDINGS  Common equity INC,08986R101,11557000.0,29627,0.0017005988647792584,2013-02-12,2012-12-31,0001193125-13-050774
N/A,UNITED ONLINE        Common equity INC,911268100,11549000.0,2065910,0.001699421674252458,2013-02-12,2012-12-31,0001193125-13-050774
EXLS,EXLSERVICE        Common equity HOLDINGS INC,302081104,11519000.0,434670,0.001695007209776956,2013-02-12,2012-12-31,0001193125-13-050774
N/A,GLOBAL CASH ACCESS        Common equity HOLDINGS,378967103,11508000.0,1467774,0.0016933885728026051,2013-02-12,2012-12-31,0001193125-13-050774
NCI1EUR,NAVIGANT             Common equity CONSULTING           shares INC,63935N107,11506000.0,1031206,0.0016930942751709047,2013-02-12,2012-12-31,0001193125-13-050774
N/A,AFC               Common Stock ENTERPRISES INC,00104Q107,11482000.0,439380,0.001689562703590503,2013-02-12,2012-12-31,0001193125-13-050774
GWRE,GUIDEWIRE SOFTWARE  Common equity INC,40171V100,11482000.0,386282,0.001689562703590503,2013-02-12,2012-12-31,0001193125-13-050774
BRKL,BROOKLINE         Common equity BANCORP INC,11373M107,11440000.0,1345887,0.0016833824533248004,2013-02-12,2012-12-31,0001193125-13-050774
N/A,PARKWAY           Real Estate PROPERTIES        Investment INC,70159Q104,11439000.0,817660,0.0016832353045089501,2013-02-12,2012-12-31,0001193125-13-050774
N/A,STATE BANK        Common equity FINANCIAL CORP,856190103,11431000.0,719763,0.0016820581139821498,2013-02-12,2012-12-31,0001193125-13-050774
FCNCA,FIRST CITIZENS    Common equity BANCSH -CL A,31946M103,11427000.0,69875,0.0016814695187187495,2013-02-12,2012-12-31,0001193125-13-050774
N/A,AMERICAN          Common equity SCIENCE           shares ENGINEERING,029429107,11423000.0,175116,0.0016808809234553491,2013-02-12,2012-12-31,0001193125-13-050774
HLIT,HARMONIC INC    Common equity ,413160102,11422000.0,2252446,0.001680733774639499,2013-02-12,2012-12-31,0001193125-13-050774
N/A,ROUSE PROPERTIES    Real Estate INC                 Investment ,779287101,11421000.0,674904,0.0016805866258236487,2013-02-12,2012-12-31,0001193125-13-050774
DENN,DENNYS CORP       Common equity ,24869P104,11413000.0,2338040,0.0016794094352968485,2013-02-12,2012-12-31,0001193125-13-050774
N/A,ACCRETIVE HEALTH    Common equity INC,00438V103,11407000.0,987064,0.0016785265424017481,2013-02-12,2012-12-31,0001193125-13-050774
CHH,CHOICE HOTELS      Common equity INTL INC,169905106,11376000.0,338391,0.0016739649291103958,2013-02-12,2012-12-31,0001193125-13-050774
N/A,KITE REALTY       Real Estate GROUP TRUST       Investment ,49803T102,11364000.0,2033005,0.0016721991433201948,2013-02-12,2012-12-31,0001193125-13-050774
STAG,STAG INDUSTRIAL INC Real Estate Investment ,85254J102,11359000.0,632166,0.0016714633992409448,2013-02-12,2012-12-31,0001193125-13-050774
VRNT,VERINT SYSTEMS    Common Stock INC,92343X100,11349000.0,386585,0.001669991911082444,2013-02-12,2012-12-31,0001193125-13-050774
SAFT,SAFETY INSURANCE   Common equity GROUP INC,78648T100,11336000.0,245448,0.0016680789764763932,2013-02-12,2012-12-31,0001193125-13-050774
CPLUSD,CPFL ENERGIA SA   American Depository ,126153105,11312000.0,539725,0.0016645474048959915,2013-02-12,2012-12-31,0001193125-13-050774
MMSI,MERIT MEDICAL   Common equity SYSTEMS INC,589889104,11311000.0,813596,0.0016644002560801414,2013-02-12,2012-12-31,0001193125-13-050774
N/A,GREATBATCH INC    Common equity ,39153L106,11301000.0,486096,0.0016629287679216405,2013-02-12,2012-12-31,0001193125-13-050774
N/A,SCBT FINANCIAL    Common equity CORP,78401V102,11291000.0,280988,0.0016614572797631398,2013-02-12,2012-12-31,0001193125-13-050774
SNCREUR,SYNCHRONOSS       Common Stock TECHNOLOGIES,87157B103,11267000.0,534215,0.0016579257081827381,2013-02-12,2012-12-31,0001193125-13-050774
WSBC,WESBANCO INC       Common equity ,950810101,11247000.0,506016,0.0016549827318657368,2013-02-12,2012-12-31,0001193125-13-050774
N/A,GENCORP INC          Common equity ,368682100,11218000.0,1226163,0.0016507154162060847,2013-02-12,2012-12-31,0001193125-13-050774
MYE,MYERS                Common equity INDUSTRIES           shares INC,628464109,11215000.0,740247,0.0016502739697585344,2013-02-12,2012-12-31,0001193125-13-050774
N/A,INTERMEC INC       Common equity ,458786100,11210000.0,1136612,0.0016495382256792844,2013-02-12,2012-12-31,0001193125-13-050774
INFNEUR,INFINERA CORP,45667G103,11189000.0,1926233,0.0016464481005464327,2013-02-12,2012-12-31,0001193125-13-050774
PIPR,PIPER JAFFRAY     Common equity COS INC,724078100,11174000.0,347879,0.0016442408683086816,2013-02-12,2012-12-31,0001193125-13-050774
TLK,TELEKOMUNIKASI    American INDONESIA         Depository ,715684106,11174000.0,302409,0.0016442408683086816,2013-02-12,2012-12-31,0001193125-13-050774
N/A,CROSSTEX ENERGY    Common equity INC,22765Y104,11148000.0,777336,0.0016404149990965798,2013-02-12,2012-12-31,0001193125-13-050774
IVCUSD,INVACARE CORP     Common equity ,461203101,11128000.0,682781,0.0016374720227795784,2013-02-12,2012-12-31,0001193125-13-050774
AZTA,BROOKS            Common equity AUTOMATION        shares INC,114340102,11127000.0,1382443,0.0016373248739637283,2013-02-12,2012-12-31,0001193125-13-050774
N/A,RESOLUTE ENERGY     Common Stock CORP,76116A108,11089000.0,1363546,0.0016317332189614256,2013-02-12,2012-12-31,0001193125-13-050774
PS1,COMPUTER          Common equity PROGRAMS &        shares SYSTEMS,205306103,11039000.0,219315,0.0016243757781689223,2013-02-12,2012-12-31,0001193125-13-050774
MITTEUR,AG MORTGAGE         Miscellaneous INVESTMENT TRUST,001228105,11020000.0,469292,0.001621579950667771,2013-02-12,2012-12-31,0001193125-13-050774
EHTH,EHEALTH INC,28238P109,10984000.0,399892,0.0016162825932971683,2013-02-12,2012-12-31,0001193125-13-050774
WNC,WABASH NATIONAL    Common equity CORP,929566107,10939000.0,1219532,0.0016096608965839154,2013-02-12,2012-12-31,0001193125-13-050774
AIMCUSD,ALTRA HOLDINGS INC  Common equity ,02208R106,10928000.0,495592,0.0016080422596095644,2013-02-12,2012-12-31,0001193125-13-050774
N/A,FLOTEK INDUSTRIES    Common equity INC,343389102,10886000.0,892401,0.0016018620093438615,2013-02-12,2012-12-31,0001193125-13-050774
N/A,HEADWATERS INC  Common equity ,42210P102,10855000.0,1268032,0.0015973003960525092,2013-02-12,2012-12-31,0001193125-13-050774
RTECEUR,RUDOLPH                Common equity TECHNOLOGIES           shares INC,781270103,10852000.0,807089,0.001596858949604959,2013-02-12,2012-12-31,0001193125-13-050774
COR1EUR,CORESITE REALTY     Real Estate CORP                Investment ,21870Q105,10834000.0,391679,0.001594210270919658,2013-02-12,2012-12-31,0001193125-13-050774
N/A,NATIONSTAR          Common equity MORTGAGE HOLDINGS,63861C109,10799000.0,348599,0.0015890600623649056,2013-02-12,2012-12-31,0001193125-13-050774
JBTM,JOHN BEAN            Common equity TECHNOLOGIES,477839104,10796000.0,607315,0.0015886186159173553,2013-02-12,2012-12-31,0001193125-13-050774
RPAIUSD,RETAIL PPTYS OF     Real Estate AMERICA INC         Investment ,76131V202,10761000.0,899032,0.0015834684073626026,2013-02-12,2012-12-31,0001193125-13-050774
PKEUSD,PARK              Common equity ELECTROCHEMICAL   shares CORP,700416209,10732000.0,417241,0.001579201091702951,2013-02-12,2012-12-31,0001193125-13-050774
MTOR,MERITOR INC       Common equity ,59001K100,10690000.0,2259571,0.0015730208414372478,2013-02-12,2012-12-31,0001193125-13-050774
CMTL,COMTECH           Common equity TELECOMMUN,205826209,10687000.0,421070,0.0015725793949896976,2013-02-12,2012-12-31,0001193125-13-050774
MOV,MOVADO GROUP         Common equity INC,624580106,10648000.0,347171,0.001566840591171545,2013-02-12,2012-12-31,0001193125-13-050774
GFF,GRIFFON CORP    Common equity ,398433102,10641000.0,928772,0.0015658105494605946,2013-02-12,2012-12-31,0001193125-13-050774
PRSU,VIAD CORP          Common equity ,92552R406,10640000.0,391812,0.0015656634006447443,2013-02-12,2012-12-31,0001193125-13-050774
RXNEUR,REXNORD CORP        Common equity ,76169B102,10628000.0,498877,0.0015638976148545434,2013-02-12,2012-12-31,0001193125-13-050774
ZQKEUR,QUIKSILVER INC    Common equity ,74838C106,10625000.0,2500405,0.0015634561684069932,2013-02-12,2012-12-31,0001193125-13-050774
WIREEUR,ENCORE WIRE       Common equity CORP,292562105,10625000.0,350582,0.0015634561684069932,2013-02-12,2012-12-31,0001193125-13-050774
WEP,MAGELLAN           Limited MIDSTREAM          Partnership PRTNRS LP,559080106,10606000.0,245567,0.001560660340905842,2013-02-12,2012-12-31,0001193125-13-050774
N/A,APOLLO RESIDENTIAL  Real Estate MTG INC             Investment ,03763V102,10560000.0,523089,0.0015538914953767385,2013-02-12,2012-12-31,0001193125-13-050774
N/A,NAVIGATORS           Common equity GROUP INC,638904102,10532000.0,206175,0.0015497713285329369,2013-02-12,2012-12-31,0001193125-13-050774
CRAY,CRAY INC,225223304,10520000.0,659481,0.0015480055427427358,2013-02-12,2012-12-31,0001193125-13-050774
CNSLEUR,CONSOLIDATED COMM    Common Stock HLDGS INC,209034107,10520000.0,660882,0.0015480055427427358,2013-02-12,2012-12-31,0001193125-13-050774
GIII,G-III APPAREL GROUP  Common equity LTD,36237H101,10506000.0,307034,0.0015459454593208348,2013-02-12,2012-12-31,0001193125-13-050774
N/A,AEGERION            Common equity PHARMACEUTICALS     shares INC,00767E102,10445000.0,411327,0.0015369693815539805,2013-02-12,2012-12-31,0001193125-13-050774
N/A,RESOURCE CAPITAL CORP     Common equity ,76120W302,10445000.0,1865004,0.0015369693815539805,2013-02-12,2012-12-31,0001193125-13-050774
N/A,CLEARWIRE CORP      Common equity ,18538Q105,10374000.0,3590551,0.0015265218156286255,2013-02-12,2012-12-31,0001193125-13-050774
TREX,TREX CO INC        Common equity ,89531P105,10338000.0,277669,0.0015212244582580232,2013-02-12,2012-12-31,0001193125-13-050774
UBAUSD,URSTADT BIDDLE     Real Estate PROPERTIES         Investment ,917286205,10300000.0,523294,0.0015156328032557204,2013-02-12,2012-12-31,0001193125-13-050774
VTRS 3.75 09/15/15,MYLAN INC 144A,628530AJ6,10287000.0,4905000,0.0015137198686496695,2013-02-12,2012-12-31,0001193125-13-050774
NHC,NATIONAL             Common equity HEALTHCARE           shares CORP,635906100,10276000.0,218437,0.001512101231675319,2013-02-12,2012-12-31,0001193125-13-050774
OMCL,OMNICELL INC      Common equity ,68213N109,10275000.0,690994,0.0015119540828594687,2013-02-12,2012-12-31,0001193125-13-050774
N/A,NEWPORT CORP         Common equity ,651824104,10267000.0,763343,0.0015107768923326682,2013-02-12,2012-12-31,0001193125-13-050774
UGP,ULTRAPAR           American PARTICIPACOES      Depository SA,90400P101,10263000.0,460645,0.0015101882970692678,2013-02-12,2012-12-31,0001193125-13-050774
N/A,ISHARES MSCI      Investments UNITED            that contain KINGDOM           a pool of INDEX FUND        securities representing a specific index and are built ,464286699,10254000.0,571545,0.0015088639577266175,2013-02-12,2012-12-31,0001193125-13-050774
N/A,PREMIERE          Common equity GLOBAL            shares SERVICES INC,740585104,10224000.0,1045118,0.0015044494932511152,2013-02-12,2012-12-31,0001193125-13-050774
N/A,PANDORA MEDIA INC   Common equity ,698354107,10206000.0,1111581,0.001501800814565814,2013-02-12,2012-12-31,0001193125-13-050774
