ticker,nameOfIssuer,cusip,value,shares,allocation_percent,filingDate,reportDate,accessionNumber
VO, VANGUARD INDEX FDS MID CAP ETF,922908629,26387000.0,167388,11.584118426944588,2018-08-21,2018-06-30,0001586767-18-000003
VEA, VANGUARD TAX MANAGED INTL FD FTSE DEV MKT ETF,921943858,24429000.0,569454,10.724539699542552,2018-08-21,2018-06-30,0001586767-18-000003
VTV, VANGUARD INDEX FDS VALUE ETF,922908744,18445000.0,177649,8.097512577594761,2018-08-21,2018-06-30,0001586767-18-000003
TIP, ISHARES TR TIPS BD ETF,464287176,18351000.0,162585,8.056245774542772,2018-08-21,2018-06-30,0001586767-18-000003
N/A, POWERSHARES QQQ TRUST UNIT SER 1,73935A104,15538000.0,90526,6.821314742784895,2018-08-21,2018-06-30,0001586767-18-000003
VUG, VANGUARD INDEX FDS GROWTH ETF,922908736,15077000.0,100641,6.618931804412914,2018-08-21,2018-06-30,0001586767-18-000003
VWO, VANGUARD INTL EQUITY INDEX F FTSE EMR MKT ETF,922042858,10317000.0,244500,4.52925113922717,2018-08-21,2018-06-30,0001586767-18-000003
EMLP, FIRST TR EXCHANGE TRADED FD NO AMER ENERGY,33738D101,10099000.0,434967,4.433547276830007,2018-08-21,2018-06-30,0001586767-18-000003
VIG, VANGUARD SPECIALIZED PORTFOL DIV APP ETF,921908844,6185000.0,60865,2.7152678391121494,2018-08-21,2018-06-30,0001586767-18-000003
N/A, SPDR SERIES TRUST BRC HGH YLD BD,78464A417,4630000.0,130500,2.0326095545819323,2018-08-21,2018-06-30,0001586767-18-000003
AGG, ISHARES TR CORE US AGGBD ET,464287226,3518000.0,33090,1.5444320546477834,2018-08-21,2018-06-30,0001586767-18-000003
TFI, SPDR SER TR NUVN BRCLY MUNI,78468R721,3504000.0,73036,1.538285935044296,2018-08-21,2018-06-30,0001586767-18-000003
LQD, ISHARES TR IBOXX INV CP ETF,464287242,3256000.0,28426,1.4294118163539462,2018-08-21,2018-06-30,0001586767-18-000003
WFC, WELLS FARGO & CO NEW COM,949746101,3068000.0,55352,1.3468782102499715,2018-08-21,2018-06-30,0001586767-18-000003
JNJ, JOHNSON & JOHNSON COM,478160104,2998000.0,24712,1.3161476122325342,2018-08-21,2018-06-30,0001586767-18-000003
VYM, VANGUARD WHITEHALL FDS INC HIGH DIV YLD,921946406,2952000.0,35549,1.2959532192496466,2018-08-21,2018-06-30,0001586767-18-000003
N/A, POWERSHARES ETF TR II PFD PORTFOLIO,73936T565,2106000.0,144677,0.9245519917817601,2018-08-21,2018-06-30,0001586767-18-000003
AAPL, APPLE INC COM,037833100,1401000.0,7569,0.6150509688918546,2018-08-21,2018-06-30,0001586767-18-000003
IVV, ISHARES TR CORE S&P500 ETF,464287200,1394000.0,5106,0.611977909090111,2018-08-21,2018-06-30,0001586767-18-000003
HDV, ISHARES TR CORE HIGH DV ETF,46429B663,1190000.0,14002,0.5224201662964361,2018-08-21,2018-06-30,0001586767-18-000003
AMZN, AMAZON COM INC COM,023135106,1123000.0,661,0.49300659390831747,2018-08-21,2018-06-30,0001586767-18-000003
VNQ, VANGUARD INDEX FDS REIT ETF,922908553,1107000.0,13596,0.4859824572186175,2018-08-21,2018-06-30,0001586767-18-000003
IVE, ISHARES TR S&P 500 VAL ETF,464287408,988000.0,8973,0.4337404405889739,2018-08-21,2018-06-30,0001586767-18-000003
IVW, ISHARES TR S&P 500 GRWT ETF,464287309,941000.0,5792,0.4131070390629802,2018-08-21,2018-06-30,0001586767-18-000003
OXY, OCCIDENTAL PETE CORP DEL COM,674599105,935000.0,11178,0.41047298780434266,2018-08-21,2018-06-30,0001586767-18-000003
GOOGL, ALPHABET INC CAP STK CL A,02079K305,897000.0,795,0.39379066316630523,2018-08-21,2018-06-30,0001586767-18-000003
MCD, MCDONALDS CORP COM,580135101,894000.0,5709,0.39247363753698644,2018-08-21,2018-06-30,0001586767-18-000003
INTC, INTEL CORP COM,458140100,868000.0,17469,0.381059415416224,2018-08-21,2018-06-30,0001586767-18-000003
N/A, IHS MARKIT LTD SHS ADDED,G47567105,850000.0,16478,0.3731572616403115,2018-08-21,2018-06-30,0001586767-18-000003
GOOG, ALPHABET INC CAP STK CL C,02079K107,818000.0,734,0.35910898826091153,2018-08-21,2018-06-30,0001586767-18-000003
N/A, EATON CORP PLC SHS,G29183103,810000.0,10850,0.35559691991606157,2018-08-21,2018-06-30,0001586767-18-000003
T, AT&T INC COM,00206R102,739000.0,23040,0.3244273133555179,2018-08-21,2018-06-30,0001586767-18-000003
META, FACEBOOK INC CL A,30303M102,713000.0,3671,0.31301309123475546,2018-08-21,2018-06-30,0001586767-18-000003
FMUSD, ISHARES MSCI FRNTR100ETF,464286145,691000.0,24009,0.30335490328641795,2018-08-21,2018-06-30,0001586767-18-000003
PFE, PFIZER INC COM,717081103,657000.0,18136,0.2884286128208055,2018-08-21,2018-06-30,0001586767-18-000003
MA, MASTERCARD INCORPORATED CL A,57636Q104,657000.0,3346,0.2884286128208055,2018-08-21,2018-06-30,0001586767-18-000003
MSFT, MICROSOFT CORP COM,594918104,652000.0,6617,0.2862335701052742,2018-08-21,2018-06-30,0001586767-18-000003
ACN, ACCENTURE PLC IRELAND SHS CLASS A,G1151C101,637000.0,3894,0.2796484419586805,2018-08-21,2018-06-30,0001586767-18-000003
VBK, VANGUARD INDEX FDS SML CP GRW ETF,922908595,636000.0,3619,0.27920943341557425,2018-08-21,2018-06-30,0001586767-18-000003
JPM, JPMORGAN CHASE & CO COM,46625H100,631000.0,6059,0.277014390700043,2018-08-21,2018-06-30,0001586767-18-000003
VBR, VANGUARD INDEX FDS SM CP VAL ETF,922908611,627000.0,4621,0.27525835652761804,2018-08-21,2018-06-30,0001586767-18-000003
XLF, SELECT SECTOR SPDR TR SBI INT-FINL,81369Y605,621000.0,23378,0.2726243052689805,2018-08-21,2018-06-30,0001586767-18-000003
UNH, UNITEDHEALTH GROUP INC COM,91324P102,620000.0,2528,0.2721852967258743,2018-08-21,2018-06-30,0001586767-18-000003
FDX, FEDEX CORP COM,31428X106,606000.0,2672,0.2660391771223868,2018-08-21,2018-06-30,0001586767-18-000003
BK, BANK NEW YORK MELLON CORP COM,064058100,601000.0,11149,0.26384413440685556,2018-08-21,2018-06-30,0001586767-18-000003
XLK, SELECT SECTOR SPDR TR TECHNOLOGY,81369Y803,569000.0,8195,0.2497958610274556,2018-08-21,2018-06-30,0001586767-18-000003
C, CITIGROUP INC COM NEW,172967424,522000.0,7802,0.2291624595014619,2018-08-21,2018-06-30,0001586767-18-000003
XOM, EXXON MOBIL CORP COM,30231G102,509000.0,6157,0.22345534844108067,2018-08-21,2018-06-30,0001586767-18-000003
BAC, VERIZON COMMUNICATIONS INC COM,92343V104,500000.0,9944,0.21950427155312444,2018-08-21,2018-06-30,0001586767-18-000003
HD, HOME DEPOT INC COM,437076102,492000.0,2523,0.21599220320827445,2018-08-21,2018-06-30,0001586767-18-000003
IJR, ISHARES TR CORE S&P SCP ETF,464287804,472000.0,5658,0.20721203234614943,2018-08-21,2018-06-30,0001586767-18-000003
MDT, MEDTRONIC PLC SHS,G5960L103,465000.0,5432,0.20413897254440572,2018-08-21,2018-06-30,0001586767-18-000003
AMGN, AMGEN INC COM,031162100,441000.0,2391,0.19360276750985575,2018-08-21,2018-06-30,0001586767-18-000003
RDS/A, ROYAL DUTCH SHELL PLC SPONS ADR A,780259206,438000.0,6330,0.192285741880537,2018-08-21,2018-06-30,0001586767-18-000003
CSCO, CISCO SYS INC COM,17275R102,428000.0,9959,0.1878956564494745,2018-08-21,2018-06-30,0001586767-18-000003
BDX, BECTON DICKINSON & CO COM,075887109,427000.0,1782,0.18745664790636826,2018-08-21,2018-06-30,0001586767-18-000003
IBM, INTERNATIONAL BUSINESS MACHS COM,459200101,424000.0,3039,0.18613962227704953,2018-08-21,2018-06-30,0001586767-18-000003
CVX, CHEVRON CORP NEW COM,166764100,421000.0,3330,0.18482259664773076,2018-08-21,2018-06-30,0001586767-18-000003
V, VISA INC COM CL A,92826C839,415000.0,3136,0.18218854538909326,2018-08-21,2018-06-30,0001586767-18-000003
EL, LAUDER ESTEE COS INC CL A,518439104,403000.0,2824,0.1769204428718183,2018-08-21,2018-06-30,0001586767-18-000003
TXN, TEXAS INSTRS INC COM,882508104,399000.0,3621,0.17516440869939331,2018-08-21,2018-06-30,0001586767-18-000003
WBA, WALGREENS BOOTS ALLIANCE INC COM,931427108,392000.0,6547,0.17209134889764954,2018-08-21,2018-06-30,0001586767-18-000003
PPL, PPL CORP COM,69351T106,381000.0,13355,0.16726225492348082,2018-08-21,2018-06-30,0001586767-18-000003
TSM, TAIWAN SEMICONDUCTOR MFG LTD SPONSORED ADR,874039100,375000.0,10281,0.16462820366484332,2018-08-21,2018-06-30,0001586767-18-000003
NKE, NIKE INC CL B,654106103,374000.0,4695,0.16418919512173707,2018-08-21,2018-06-30,0001586767-18-000003
ORCL, ORACLE CORP COM,68389X105,343000.0,7786,0.15057993028544336,2018-08-21,2018-06-30,0001586767-18-000003
LOW, LOWES COS INC COM,548661107,337000.0,3534,0.14794587902680587,2018-08-21,2018-06-30,0001586767-18-000003
PG, PROCTER AND GAMBLE CO COM,742718109,315000.0,4036,0.1382876910784684,2018-08-21,2018-06-30,0001586767-18-000003
PEP, PEPSICO INC COM,713448108,313000.0,2879,0.1374096739922559,2018-08-21,2018-06-30,0001586767-18-000003
SHW, SHERWIN WILLIAMS CO COM,824348106,308000.0,756,0.13521463127672464,2018-08-21,2018-06-30,0001586767-18-000003
UNP, UNION PAC CORP COM,907818108,307000.0,2169,0.1347756227336184,2018-08-21,2018-06-30,0001586767-18-000003
CB, CHUBB LIMITED COM,H1467J104,299000.0,2354,0.13126355438876838,2018-08-21,2018-06-30,0001586767-18-000003
WMB, WILLIAMS COS INC DEL COM,969457100,296000.0,10952,0.12994652875944968,2018-08-21,2018-06-30,0001586767-18-000003
HON, HONEYWELL INTL INC COM,438516106,291000.0,2024,0.12775148604391842,2018-08-21,2018-06-30,0001586767-18-000003
PNC, PNC FINL SVCS GROUP INC COM,693475105,290000.0,2148,0.12731247750081218,2018-08-21,2018-06-30,0001586767-18-000003
TJX, TJX COS INC NEW COM,872540109,274000.0,2887,0.12028834081111218,2018-08-21,2018-06-30,0001586767-18-000003
ZTS, ZOETIS INC CL A,98978V103,248000.0,2911,0.10887411869034971,2018-08-21,2018-06-30,0001586767-18-000003
COF, CAPITAL ONE FINL CORP COM,14040H105,245000.0,2667,0.10755709306103096,2018-08-21,2018-06-30,0001586767-18-000003
UTXZ, UNITED TECHNOLOGIES CORP COM,913017109,244000.0,1955,0.10711808451792472,2018-08-21,2018-06-30,0001586767-18-000003
KO, COCA COLA CO COM,191216100,243000.0,5553,0.10667907597481847,2018-08-21,2018-06-30,0001586767-18-000003
MGA, MAGNA INTL INC COM,559222401,242000.0,4168,0.10624006743171222,2018-08-21,2018-06-30,0001586767-18-000003
CNI, CANADIAN NATL RY CO COM,136375102,239000.0,2929,0.10492304180239347,2018-08-21,2018-06-30,0001586767-18-000003
BA, BOEING CO COM,097023105,237000.0,707,0.10404502471618098,2018-08-21,2018-06-30,0001586767-18-000003
HRL, HORMEL FOODS CORP COM,440452100,235000.0,6342,0.10316700762996849,2018-08-21,2018-06-30,0001586767-18-000003
DUK, DUKE ENERGY CORP NEW COM NEW,26441C204,235000.0,2973,0.10316700762996849,2018-08-21,2018-06-30,0001586767-18-000003
VLO, VALERO ENERGY CORP NEW COM,91913Y100,234000.0,2118,0.10272799908686223,2018-08-21,2018-06-30,0001586767-18-000003
TTC, TORO CO COM,891092108,232000.0,3852,0.10184998200064974,2018-08-21,2018-06-30,0001586767-18-000003
FDS, FACTSET RESH SYS INC COM,303075105,231000.0,1166,0.10141097345754348,2018-08-21,2018-06-30,0001586767-18-000003
SPY, SPDR S&P 500 ETF TR TR UNIT,78462F103,228000.0,844,0.10009394782822473,2018-08-21,2018-06-30,0001586767-18-000003
WMT, WAL-MART STORES INC COM,931142103,227000.0,2650,0.0996549392851185,2018-08-21,2018-06-30,0001586767-18-000003
STT, STATE STR CORP COM,857477103,226000.0,2431,0.09921593074201224,2018-08-21,2018-06-30,0001586767-18-000003
AXP, AMERICAN EXPRESS CO COM,025816109,219000.0,2243,0.0961428709402685,2018-08-21,2018-06-30,0001586767-18-000003
NTRS, NORTHERN TR CORP COM,665859104,213000.0,2074,0.09350881968163101,2018-08-21,2018-06-30,0001586767-18-000003
IWY,ISHARES RUS TP200 GR ETF,464289438,209000.0,2672,0.09175278550920601,2018-08-21,2018-06-30,0001586767-18-000003
SNPS, SYNOPSYS INC COM,871607107,203000.0,2378,0.08911873425056852,2018-08-21,2018-06-30,0001586767-18-000003
PYPL, PAYPAL HLDGS INC COM,70450Y103,201000.0,2425,0.08824071716435601,2018-08-21,2018-06-30,0001586767-18-000003
CMI, CUMMINS INC COM,231021106,195000.0,1472,0.08560666590571853,2018-08-21,2018-06-30,0001586767-18-000003
EMR, EMERSON ELEC CO COM,291011104,195000.0,2824,0.08560666590571853,2018-08-21,2018-06-30,0001586767-18-000003
SWK, STANLEY BLACK & DECKER INC COM,854502101,193000.0,1454,0.08472864881950602,2018-08-21,2018-06-30,0001586767-18-000003
IBN, ICICI BK LTD ADR,45104G104,190000.0,23691,0.08341162319018727,2018-08-21,2018-06-30,0001586767-18-000003
USB, US BANCORP DEL COM NEW,902973304,189000.0,3789,0.08297261464708103,2018-08-21,2018-06-30,0001586767-18-000003
TTE, TOTAL S A SPONSORED ADR,89151E109,186000.0,3074,0.08165558901776229,2018-08-21,2018-06-30,0001586767-18-000003
AB, ALLIANCEBERNSTEIN HOLDING LP UNIT LTD PARTN,01881G106,184000.0,6447,0.08077757193154979,2018-08-21,2018-06-30,0001586767-18-000003
IWX,ISHARES RUS TP200 VL ETF,464289420,180000.0,3537,0.0790215377591248,2018-08-21,2018-06-30,0001586767-18-000003
GE, GENERAL ELECTRIC CO COM,369604103,178000.0,13121,0.0781435206729123,2018-08-21,2018-06-30,0001586767-18-000003
UNUSD, UNILEVER N V N Y SHS NEW,904784709,173000.0,3118,0.07594847795738105,2018-08-21,2018-06-30,0001586767-18-000003
INTU, INTUIT COM,461202103,171000.0,837,0.07507046087116855,2018-08-21,2018-06-30,0001586767-18-000003
AEP, AMERICAN ELEC PWR INC COM,025537101,171000.0,2480,0.07507046087116855,2018-08-21,2018-06-30,0001586767-18-000003
EEM, ISHARES TR MSCI EMG MKT ETF,464287234,166000.0,3837,0.0728754181556373,2018-08-21,2018-06-30,0001586767-18-000003
MCO, MOODYS CORP COM,615369105,163000.0,961,0.07155839252631856,2018-08-21,2018-06-30,0001586767-18-000003
ADP, AUTOMATIC DATA PROCESSING IN COM,053015103,161000.0,1202,0.07068037544010607,2018-08-21,2018-06-30,0001586767-18-000003
GS, GOLDMAN SACHS GROUP INC COM,38141G104,160000.0,729,0.07024136689699981,2018-08-21,2018-06-30,0001586767-18-000003
BHP, BHP BILLITON LTD SPONSORED ADR,088606108,159000.0,3192,0.06980235835389356,2018-08-21,2018-06-30,0001586767-18-000003
ROST, ROSS STORES INC COM,778296103,158000.0,1875,0.06936334981078732,2018-08-21,2018-06-30,0001586767-18-000003
SLB, SCHLUMBERGER LTD COM,806857108,156000.0,2331,0.06848533272457483,2018-08-21,2018-06-30,0001586767-18-000003
ABT, ABBOTT LABS COM,002824100,155000.0,2557,0.06804632418146858,2018-08-21,2018-06-30,0001586767-18-000003
MLM, MARTIN MARIETTA MATLS INC COM,573284106,154000.0,693,0.06760731563836232,2018-08-21,2018-06-30,0001586767-18-000003
EBA, EBAY INC COM,278642103,153000.0,4237,0.06716830709525608,2018-08-21,2018-06-30,0001586767-18-000003
N/A, AEGON N V NY REGISTRY SH,007924103,151000.0,25651,0.06629029000904357,2018-08-21,2018-06-30,0001586767-18-000003
MSM, MSC INDL DIRECT INC CL A,553530106,151000.0,1788,0.06629029000904357,2018-08-21,2018-06-30,0001586767-18-000003
SMFG, SUMITOMO MITSUI FINL GROUP I SPONSORED ADR,86562M209,147000.0,18999,0.06453425583661858,2018-08-21,2018-06-30,0001586767-18-000003
MINT, PIMCO ETF TR ENHAN SHRT MA AC,72201R833,142000.0,1398,0.06233921312108734,2018-08-21,2018-06-30,0001586767-18-000003
DIS, DISNEY WALT CO COM DISNEY,254687106,141000.0,1354,0.06190020457798108,2018-08-21,2018-06-30,0001586767-18-000003
G, GENPACT LIMITED SHS,G3922B107,139000.0,4820,0.06102218749176859,2018-08-21,2018-06-30,0001586767-18-000003
HXL, HEXCEL CORP NEW COM,428291108,136000.0,2053,0.05970516186244985,2018-08-21,2018-06-30,0001586767-18-000003
UMC, UNITED MICROELECTRONICS CORP SPON ADR NEW,910873405,136000.0,48483,0.05970516186244985,2018-08-21,2018-06-30,0001586767-18-000003
N/A, AERCAP HOLDINGS NV SHS,N00985106,136000.0,2519,0.05970516186244985,2018-08-21,2018-06-30,0001586767-18-000003
PFF, ISHARES TR U.S. PFD STK ETF,464288687,133000.0,3529,0.0583881362331311,2018-08-21,2018-06-30,0001586767-18-000003
BAC, BANK AMER CORP COM,060505104,132000.0,4702,0.05794912769002485,2018-08-21,2018-06-30,0001586767-18-000003
ODFL, OLD DOMINION FGHT LINES INC COM,679580100,131000.0,879,0.057510119146918594,2018-08-21,2018-06-30,0001586767-18-000003
MRK, MERCK & CO INC COM,58933Y105,130000.0,2153,0.05707111060381235,2018-08-21,2018-06-30,0001586767-18-000003
TMO,THERMO FISHER SCIENTIFIC INC COM,883556102,125000.0,607,0.05487606788828111,2018-08-21,2018-06-30,0001586767-18-000003
BWA, BORGWARNER INC COM,099724106,124000.0,2880,0.05443705934517486,2018-08-21,2018-06-30,0001586767-18-000003
MMM, 3M CO COM,88579Y101,124000.0,631,0.05443705934517486,2018-08-21,2018-06-30,0001586767-18-000003
HSBC, HSBC HLDGS PLC SPON ADR NEW,404280406,124000.0,2632,0.05443705934517486,2018-08-21,2018-06-30,0001586767-18-000003
HDB, HDFC BANK LTD ADR REPS 3 SHS,40415F101,123000.0,1176,0.05399805080206861,2018-08-21,2018-06-30,0001586767-18-000003
PAA, PLAINS ALL AMERN PIPELINE L UNIT LTD PARTN,726503105,121000.0,5121,0.05312003371585611,2018-08-21,2018-06-30,0001586767-18-000003
BXUSD, BLACKSTONE GROUP L P COM UNIT LTD,09253U108,120000.0,3749,0.05268102517274986,2018-08-21,2018-06-30,0001586767-18-000003
N/A, GLAXOSMITHKLINE PLC SPONSORED ADR,37733W105,120000.0,2989,0.05268102517274986,2018-08-21,2018-06-30,0001586767-18-000003
BAX, BAXTER INTL INC COM,071813109,116000.0,1583,0.05092499100032487,2018-08-21,2018-06-30,0001586767-18-000003
ELV, ANTHEM INC COM,036752103,115000.0,485,0.05048598245721862,2018-08-21,2018-06-30,0001586767-18-000003
IWB, ISHARES TR RUS 1000 ETF,464287622,114000.0,755,0.050046973914112364,2018-08-21,2018-06-30,0001586767-18-000003
GILD, GILEAD SCIENCES INC COM,375558103,114000.0,1613,0.050046973914112364,2018-08-21,2018-06-30,0001586767-18-000003
AG8, AGILENT TECHNOLOGIES INC COM,00846U101,110000.0,1791,0.04829093974168737,2018-08-21,2018-06-30,0001586767-18-000003
N/A, BLDRS INDEX FDS TR EMER MK 50 ADR,09348R300,107000.0,2629,0.04697391411236863,2018-08-21,2018-06-30,0001586767-18-000003
PXDEUR, PIONEER NAT RES CO COM,723787107,107000.0,566,0.04697391411236863,2018-08-21,2018-06-30,0001586767-18-000003
BIDUN, BAIDU INC SPON ADR REP A,056752108,106000.0,437,0.04653490556926238,2018-08-21,2018-06-30,0001586767-18-000003
N/A, CANADIAN PAC RY LTD COM,13645T100,104000.0,571,0.045656888483049884,2018-08-21,2018-06-30,0001586767-18-000003
NFLX, NETFLIX INC COM,64110L106,104000.0,267,0.045656888483049884,2018-08-21,2018-06-30,0001586767-18-000003
HBI, HANESBRANDS INC COM,410345102,103000.0,4710,0.04521787993994363,2018-08-21,2018-06-30,0001586767-18-000003
ALL, ALLSTATE CORP COM,020002101,102000.0,1122,0.04477887139683738,2018-08-21,2018-06-30,0001586767-18-000003
RSG, REPUBLIC SVCS INC COM,760759100,101000.0,1480,0.044339862853731135,2018-08-21,2018-06-30,0001586767-18-000003
N/A, LABORATORY CORP AMER HLDGS COM NEW,50540R409,101000.0,563,0.044339862853731135,2018-08-21,2018-06-30,0001586767-18-000003
IEX, IDEX CORP COM,45167R104,101000.0,745,0.044339862853731135,2018-08-21,2018-06-30,0001586767-18-000003
MMC, MARSH & MCLENNAN COS INC COM,571748102,100000.0,1223,0.04390085431062488,2018-08-21,2018-06-30,0001586767-18-000003
CL, COLGATE PALMOLIVE CO COM,194162103,99000.0,1536,0.04346184576751864,2018-08-21,2018-06-30,0001586767-18-000003
IWF, ISHARES TR RUS 1000 GRW ETF,464287614,98000.0,686,0.043022837224412386,2018-08-21,2018-06-30,0001586767-18-000003
UPS, UNITED PARCEL SERVICE INC CL B,911312106,96000.0,912,0.04214482013819989,2018-08-21,2018-06-30,0001586767-18-000003
ISCV,ISHARES TR MRNING SM CP ETF,464288703,96000.0,630,0.04214482013819989,2018-08-21,2018-06-30,0001586767-18-000003
BABA, ALIBABA GROUP HLDG LTD SPONSORED ADS,01609W102,95000.0,517,0.041705811595093636,2018-08-21,2018-06-30,0001586767-18-000003
CVS, CVS HEALTH CORP COM,126650100,95000.0,1488,0.041705811595093636,2018-08-21,2018-06-30,0001586767-18-000003
SPGI, S&P GLOBAL INC COM,78409V104,94000.0,464,0.04126680305198739,2018-08-21,2018-06-30,0001586767-18-000003
NVDA, NVIDIA CORP COM,67066G104,94000.0,399,0.04126680305198739,2018-08-21,2018-06-30,0001586767-18-000003
NVS, NOVARTIS A G SPONSORED ADR,66987V109,93000.0,1235,0.040827794508881146,2018-08-21,2018-06-30,0001586767-18-000003
SYY, SYSCO CORP COM,871829107,92000.0,1361,0.040388785965774894,2018-08-21,2018-06-30,0001586767-18-000003
SUN, SUNOCO LP COM U REP LP,86765K109,92000.0,3721,0.040388785965774894,2018-08-21,2018-06-30,0001586767-18-000003
ABG, AMERISOURCEBERGEN CORP COM,03073E105,92000.0,1082,0.040388785965774894,2018-08-21,2018-06-30,0001586767-18-000003
TRL, DAVITA INC COM,23918K108,91000.0,1311,0.03994977742266865,2018-08-21,2018-06-30,0001586767-18-000003
ROP, ROPER TECHNOLOGIES INC COM,776696106,91000.0,330,0.03994977742266865,2018-08-21,2018-06-30,0001586767-18-000003
N/A, CORE LABORATORIES N V COM,N22717107,91000.0,727,0.03994977742266865,2018-08-21,2018-06-30,0001586767-18-000003
CMCSA, COMCAST CORP NEW CL A,20030N101,90000.0,2756,0.0395107688795624,2018-08-21,2018-06-30,0001586767-18-000003
IYM, ISHARES TR U.S. BAS MTL ETF,464287838,90000.0,909,0.0395107688795624,2018-08-21,2018-06-30,0001586767-18-000003
BMY, BRISTOL MYERS SQUIBB CO COM,110122108,89000.0,1620,0.03907176033645615,2018-08-21,2018-06-30,0001586767-18-000003
NTTYY, NIPPON TELEG & TEL CORP SPONSORED ADR,654624105,89000.0,1974,0.03907176033645615,2018-08-21,2018-06-30,0001586767-18-000003
GM, GENERAL MTRS CO COM,37045V100,89000.0,2262,0.03907176033645615,2018-08-21,2018-06-30,0001586767-18-000003
IWM, ISHARES TR RUSSELL 2000 ETF,464287655,88000.0,540,0.0386327517933499,2018-08-21,2018-06-30,0001586767-18-000003
GLD, SPDR GOLD TRUST GOLD SHS,78463V107,88000.0,742,0.0386327517933499,2018-08-21,2018-06-30,0001586767-18-000003
EOG, EOG RES INC COM,26875P101,86000.0,699,0.0377547347071374,2018-08-21,2018-06-30,0001586767-18-000003
KHC, KRAFT HEINZ CO COM,500754106,85000.0,1358,0.03731572616403115,2018-08-21,2018-06-30,0001586767-18-000003
N/A, U S G CORP COM NEW,903293405,84000.0,1969,0.036876717620924905,2018-08-21,2018-06-30,0001586767-18-000003
KMX, CARMAX INC COM,143130102,84000.0,1160,0.036876717620924905,2018-08-21,2018-06-30,0001586767-18-000003
N/A, POWERSHARES ETF TR II PWRSHS SP500 LOW,73937B654,81000.0,1982,0.035559691991606156,2018-08-21,2018-06-30,0001586767-18-000003
EFA, ISHARES TR MSCI EAFE ETF,464287465,81000.0,1211,0.035559691991606156,2018-08-21,2018-06-30,0001586767-18-000003
PXGBX, PRAXAIR INC COM,74005P104,80000.0,508,0.035120683448499904,2018-08-21,2018-06-30,0001586767-18-000003
SNN, SMITH & NEPHEW PLC SPDN ADR NEW,83175M205,80000.0,2146,0.035120683448499904,2018-08-21,2018-06-30,0001586767-18-000003
VB, VANGUARD INDEX FDS SMALL CP ETF,922908751,79000.0,511,0.03468167490539366,2018-08-21,2018-06-30,0001586767-18-000003
BLKCHF, BLACKROCK INC COM,09247X101,78000.0,156,0.03424266636228741,2018-08-21,2018-06-30,0001586767-18-000003
SJNK, SPDR SER TR SHT TRM HGH YLD,78468R408,77000.0,2836,0.03380365781918116,2018-08-21,2018-06-30,0001586767-18-000003
SAP, SAP SE SPON ADR,803054204,76000.0,663,0.033364649276074916,2018-08-21,2018-06-30,0001586767-18-000003
WRKUSD, WESTROCK CO COM,96145D105,76000.0,1334,0.033364649276074916,2018-08-21,2018-06-30,0001586767-18-000003
ENR, ENERGIZER HLDGS INC NEW COM,29272W109,75000.0,1202,0.032925640732968664,2018-08-21,2018-06-30,0001586767-18-000003
ICLR, ICON PLC SHS,G4705A100,74000.0,564,0.03248663218986242,2018-08-21,2018-06-30,0001586767-18-000003
ORANY, ORANGE SPONSORED ADR,684060106,72000.0,4340,0.031608615103649915,2018-08-21,2018-06-30,0001586767-18-000003
ENB, ENBRIDGE INC COM,29250N105,70000.0,1985,0.030730598017437417,2018-08-21,2018-06-30,0001586767-18-000003
CPRT, COPART INC COM,217204106,68000.0,1216,0.029852580931224924,2018-08-21,2018-06-30,0001586767-18-000003
MSI, MOTOROLA SOLUTIONS INC COM NEW,620076307,68000.0,587,0.029852580931224924,2018-08-21,2018-06-30,0001586767-18-000003
WELL, WELLTOWER INC COM,95040Q104,66000.0,1066,0.028974563845012426,2018-08-21,2018-06-30,0001586767-18-000003
NEU, NEWMARKET CORP COM,651587107,66000.0,164,0.028974563845012426,2018-08-21,2018-06-30,0001586767-18-000003
TSLA, TESLA MTRS INC COM,88160R101,66000.0,193,0.028974563845012426,2018-08-21,2018-06-30,0001586767-18-000003
SAN, BANCO SANTANDER SA ADR,05964H105,66000.0,12384,0.028974563845012426,2018-08-21,2018-06-30,0001586767-18-000003
KR, KROGER CO COM,501044101,65000.0,2292,0.028535555301906174,2018-08-21,2018-06-30,0001586767-18-000003
YUM, YUM BRANDS INC COM,988498101,64000.0,826,0.02809654675879993,2018-08-21,2018-06-30,0001586767-18-000003
NVO, NOVO-NORDISK A S ADR,670100205,62000.0,1353,0.02721852967258743,2018-08-21,2018-06-30,0001586767-18-000003
N/A,WHITE MTNS INS GROUP LTD COM,G9618E107,60000.0,66,0.02634051258637493,2018-08-21,2018-06-30,0001586767-18-000003
BBL, BHP BILLITON PLC SPONSORED ADR,05545E209,56000.0,1257,0.024584478413949937,2018-08-21,2018-06-30,0001586767-18-000003
AWI, ARMSTRONG WORLD INDS INC NEW COM,04247X102,55000.0,880,0.024145469870843685,2018-08-21,2018-06-30,0001586767-18-000003
LLY, LILLY ELI & CO COM,532457108,55000.0,649,0.024145469870843685,2018-08-21,2018-06-30,0001586767-18-000003
RIO, RIO TINTO PLC SPONSORED ADR,767204100,55000.0,996,0.024145469870843685,2018-08-21,2018-06-30,0001586767-18-000003
N/A, BROADCOM LTD SHS,Y09827109,53000.0,222,0.02326745278463119,2018-08-21,2018-06-30,0001586767-18-000003
WNSN, WNS HOLDINGS LTD SPON ADR,92932M101,53000.0,1025,0.02326745278463119,2018-08-21,2018-06-30,0001586767-18-000003
HCA, HCA HOLDINGS INC COM,40412C101,51000.0,505,0.02238943569841869,2018-08-21,2018-06-30,0001586767-18-000003
WBK,WESTPAC BKG CORP SPONSORED ADR,961214301,50000.0,2333,0.02195042715531244,2018-08-21,2018-06-30,0001586767-18-000003
KMI, KINDER MORGAN INC DEL COM,49456B101,50000.0,2841,0.02195042715531244,2018-08-21,2018-06-30,0001586767-18-000003
HPE, HEWLETT PACKARD ENTERPRISE C COM,42824C109,50000.0,3425,0.02195042715531244,2018-08-21,2018-06-30,0001586767-18-000003
HAS, HASBRO INC COM,418056107,48000.0,523,0.021072410069099944,2018-08-21,2018-06-30,0001586767-18-000003
QCOM, QUALCOMM INC COM,747525103,48000.0,866,0.021072410069099944,2018-08-21,2018-06-30,0001586767-18-000003
OKE, ONEOK INC NEW COM,682680103,48000.0,692,0.021072410069099944,2018-08-21,2018-06-30,0001586767-18-000003
DRRXEUR, DURECT CORP COM,266605104,47000.0,30230,0.020633401525993696,2018-08-21,2018-06-30,0001586767-18-000003
SHG,SHINHAN FINANCIAL GROUP CO L SPN ADR RESTRD,824596100,47000.0,1227,0.020633401525993696,2018-08-21,2018-06-30,0001586767-18-000003
AZN,ASTRAZENECA PLC SPONSORED ADR,046353108,45000.0,1295,0.0197553844397812,2018-08-21,2018-06-30,0001586767-18-000003
CAT, CATERPILLAR INC DEL COM,149123101,45000.0,334,0.0197553844397812,2018-08-21,2018-06-30,0001586767-18-000003
CRM, SALESFORCE COM INC COM,79466L302,44000.0,328,0.01931637589667495,2018-08-21,2018-06-30,0001586767-18-000003
