ticker,nameOfIssuer,cusip,value,shares,allocation_percent,filingDate,reportDate,accessionNumber
IYR, ISHARES TR U.S. REAL ES ETF,464287739,2000.0,31,0.0008780170862124978,2018-08-21,2018-06-30,0001586767-18-000003
REG,REGENCY CTRS CORP COM,758849103,2000.0,44,0.0008780170862124978,2018-08-21,2018-06-30,0001586767-18-000003
N/A,ADVANCED SEMICONDUCTOR ENGR SPONSORED ADR,00756M404,2000.0,558,0.0008780170862124978,2018-08-21,2018-06-30,0001586767-18-000003
ROK, ROCKWELL AUTOMATION INC COM,773903109,2000.0,18,0.0008780170862124978,2018-08-21,2018-06-30,0001586767-18-000003
WEP, MAGELLAN MIDSTREAM PRTNRS LP COM UNIT RP LP,559080106,2000.0,42,0.0008780170862124978,2018-08-21,2018-06-30,0001586767-18-000003
MTB, M & T BK CORP COM,55261F104,2000.0,17,0.0008780170862124978,2018-08-21,2018-06-30,0001586767-18-000003
AME,AMETEK INC NEW COM,031100100,2000.0,39,0.0008780170862124978,2018-08-21,2018-06-30,0001586767-18-000003
BCS, BARCLAYS PLC ADR,06738E204,2000.0,286,0.0008780170862124978,2018-08-21,2018-06-30,0001586767-18-000003
UAA, UNDER ARMOUR INC CL A,904311107,2000.0,120,0.0008780170862124978,2018-08-21,2018-06-30,0001586767-18-000003
NOVEUR, NATIONAL OILWELL VARCO INC COM,637071101,2000.0,62,0.0008780170862124978,2018-08-21,2018-06-30,0001586767-18-000003
IP, INTL PAPER CO COM,460146103,2000.0,50,0.0008780170862124978,2018-08-21,2018-06-30,0001586767-18-000003
N/A, CLAYMORE EXCHANGE TRD FD TR GUGGENHEIM SOLAR,18383Q739,2000.0,112,0.0008780170862124978,2018-08-21,2018-06-30,0001586767-18-000003
EMB, ISHARES TR JP MOR EM MK ETF,464288281,2000.0,24,0.0008780170862124978,2018-08-21,2018-06-30,0001586767-18-000003
IWS, ISHARES TR RUS MDCP VAL ETF,464287473,1000.0,14,0.0004390085431062489,2018-08-21,2018-06-30,0001586767-18-000003
IWP, ISHARES TR RUS MD CP GR ETF,464287481,1000.0,11,0.0004390085431062489,2018-08-21,2018-06-30,0001586767-18-000003
N/A, ROCKWELL COLLINS INC COM,774341101,1000.0,11,0.0004390085431062489,2018-08-21,2018-06-30,0001586767-18-000003
PANW, PALO ALTO NETWORKS INC COM,697435105,1000.0,7,0.0004390085431062489,2018-08-21,2018-06-30,0001586767-18-000003
EQT,EQT CORP COM,26884L109,1000.0,26,0.0004390085431062489,2018-08-21,2018-06-30,0001586767-18-000003
FLS, FLOWSERVE CORP COM,34354P105,1000.0,33,0.0004390085431062489,2018-08-21,2018-06-30,0001586767-18-000003
SJR/BEUR, SHAW COMMUNICATIONS INC CL B CONV,82028K200,1000.0,54,0.0004390085431062489,2018-08-21,2018-06-30,0001586767-18-000003
ZBH,ZIMMER BIOMET HLDGS INC COM,98956P102,1000.0,11,0.0004390085431062489,2018-08-21,2018-06-30,0001586767-18-000003
LPL, LG DISPLAY CO LTD SPONS ADR REP,50186V102,1000.0,146,0.0004390085431062489,2018-08-21,2018-06-30,0001586767-18-000003
CPLUSD, CPFL ENERGIA S A SPONSORED ADR,126153105,1000.0,107,0.0004390085431062489,2018-08-21,2018-06-30,0001586767-18-000003
N/A, CRH PLC ADR,12626K203,1000.0,33,0.0004390085431062489,2018-08-21,2018-06-30,0001586767-18-000003
LPTUSD, LIBERTY PPTY TR SH BEN INT,531172104,1000.0,26,0.0004390085431062489,2018-08-21,2018-06-30,0001586767-18-000003
QRVO, QORVO INC COM,74736K101,1000.0,19,0.0004390085431062489,2018-08-21,2018-06-30,0001586767-18-000003
AWN, ADVANCE AUTO PARTS INC COM,00751Y106,1000.0,11,0.0004390085431062489,2018-08-21,2018-06-30,0001586767-18-000003
HSIC,SCHEIN HENRY INC COM,806407102,1000.0,24,0.0004390085431062489,2018-08-21,2018-06-30,0001586767-18-000003
CTRPUSD, CTRIP COM INTL LTD AMERICAN DEP SHS,22943F100,1000.0,32,0.0004390085431062489,2018-08-21,2018-06-30,0001586767-18-000003
PII, POLARIS INDS INC COM,731068102,1000.0,13,0.0004390085431062489,2018-08-21,2018-06-30,0001586767-18-000003
NWL, NEWELL BRANDS INC COM,651229106,1000.0,63,0.0004390085431062489,2018-08-21,2018-06-30,0001586767-18-000003
CHD,CHURCH & DWIGHT INC COM,171340102,1000.0,31,0.0004390085431062489,2018-08-21,2018-06-30,0001586767-18-000003
FMS, FRESENIUS MED CARE AG&CO KGA SPONSORED ADR,358029106,1000.0,34,0.0004390085431062489,2018-08-21,2018-06-30,0001586767-18-000003
N/A, ENSCO PLC SHS CLASS A,G3157S106,1000.0,236,0.0004390085431062489,2018-08-21,2018-06-30,0001586767-18-000003
TTMCHF, TATA MTRS LTD SPONSORED ADR,876568502,1000.0,91,0.0004390085431062489,2018-08-21,2018-06-30,0001586767-18-000003
N/A,SBA COMMUNICATIONS CORP COM,78388J106,1000.0,11,0.0004390085431062489,2018-08-21,2018-06-30,0001586767-18-000003
MCX, MCCORMICK & CO INC COM NON VTG,579780206,1000.0,16,0.0004390085431062489,2018-08-21,2018-06-30,0001586767-18-000003
BCH,BANCO DE CHILE SPONSORED ADR,059520106,1000.0,20,0.0004390085431062489,2018-08-21,2018-06-30,0001586767-18-000003
PJT, PJT PARTNERS INC COM CL A,69343T107,1000.0,35,0.0004390085431062489,2018-08-21,2018-06-30,0001586767-18-000003
CNP, CENTERPOINT ENERGY INC COM,15189T107,1000.0,70,0.0004390085431062489,2018-08-21,2018-06-30,0001586767-18-000003
DHI, D R HORTON INC COM,23331A109,1000.0,48,0.0004390085431062489,2018-08-21,2018-06-30,0001586767-18-000003
N/A, SYKES ENTERPRISES INC COM,871237103,1000.0,69,0.0004390085431062489,2018-08-21,2018-06-30,0001586767-18-000003
PAYX,PAYCHEX INC COM,704326107,1000.0,16,0.0004390085431062489,2018-08-21,2018-06-30,0001586767-18-000003
