ticker,nameOfIssuer,cusip,value,shares,allocation_percent,filingDate,reportDate,accessionNumber
N/A, SPECTRUM BRANDS HLDGS INC COM,84763R101,44000.0,544,0.01931637589667495,2018-08-21,2018-06-30,0001586767-18-000003
N/A, INTERCONTINENTAL HOTELS GROU SPON ADR NW 2016,45857P608,44000.0,715,0.01931637589667495,2018-08-21,2018-06-30,0001586767-18-000003
OTX, OPEN TEXT CORP COM,683715106,44000.0,1276,0.01931637589667495,2018-08-21,2018-06-30,0001586767-18-000003
RY, ROYAL BK CDA MONTREAL QUE COM,780087102,43000.0,578,0.0188773673535687,2018-08-21,2018-06-30,0001586767-18-000003
N/A, ENERGY TRANSFER PRTNRS L P UNIT LTD PARTN,29273R109,43000.0,2274,0.0188773673535687,2018-08-21,2018-06-30,0001586767-18-000003
DECK, DECKERS OUTDOOR CORP COM,243537107,43000.0,381,0.0188773673535687,2018-08-21,2018-06-30,0001586767-18-000003
INFY, INFOSYS LTD SPONSORED ADR,456788108,41000.0,2137,0.0179993502673562,2018-08-21,2018-06-30,0001586767-18-000003
N/A, AETNA INC NEW COM,00817Y108,41000.0,225,0.0179993502673562,2018-08-21,2018-06-30,0001586767-18-000003
MTD, METTLER TOLEDO INTERNATIONAL COM,592688105,40000.0,70,0.017560341724249952,2018-08-21,2018-06-30,0001586767-18-000003
N/A, SHIRE PLC SPONSORED ADR,82481R106,40000.0,238,0.017560341724249952,2018-08-21,2018-06-30,0001586767-18-000003
FR, FIRST INDUSTRIAL REALTY TRUS COM,32054K103,40000.0,1206,0.017560341724249952,2018-08-21,2018-06-30,0001586767-18-000003
TGT, TARGET CORP COM,87612E106,40000.0,538,0.017560341724249952,2018-08-21,2018-06-30,0001586767-18-000003
CAJPY, CANON INC SPONSORED ADR,138006309,40000.0,1240,0.017560341724249952,2018-08-21,2018-06-30,0001586767-18-000003
SCHW, SCHWAB CHARLES CORP NEW COM,808513105,40000.0,795,0.017560341724249952,2018-08-21,2018-06-30,0001586767-18-000003
AWC, AMERICAN WTR WKS CO INC NEW COM,030420103,39000.0,459,0.017121333181143707,2018-08-21,2018-06-30,0001586767-18-000003
SPG, SIMON PPTY GROUP INC NEW COM,828806109,38000.0,229,0.016682324638037458,2018-08-21,2018-06-30,0001586767-18-000003
RGR, STURM RUGER & CO INC COM,864159108,38000.0,694,0.016682324638037458,2018-08-21,2018-06-30,0001586767-18-000003
MDLZ, MONDELEZ INTL INC CL A,609207105,38000.0,933,0.016682324638037458,2018-08-21,2018-06-30,0001586767-18-000003
VTR, VENTAS INC COM,92276F100,37000.0,665,0.01624331609493121,2018-08-21,2018-06-30,0001586767-18-000003
CHTR, CHARTER COMMUNICATIONS INC N CL A,16119P108,37000.0,129,0.01624331609493121,2018-08-21,2018-06-30,0001586767-18-000003
BIIB, BIOGEN INC COM,09062X103,37000.0,128,0.01624331609493121,2018-08-21,2018-06-30,0001586767-18-000003
EPC, EDGEWELL PERS CARE CO COM,28035Q102,36000.0,718,0.015804307551824957,2018-08-21,2018-06-30,0001586767-18-000003
VNO,VORNADO RLTY TR SH BEN INT,929042109,36000.0,496,0.015804307551824957,2018-08-21,2018-06-30,0001586767-18-000003
CSX, CSX CORP COM,126408103,36000.0,569,0.015804307551824957,2018-08-21,2018-06-30,0001586767-18-000003
TD, TORONTO DOMINION BK ONT COM NEW,891160509,35000.0,608,0.015365299008718709,2018-08-21,2018-06-30,0001586767-18-000003
ABEV, AMBEV SA SPONSORED ADR,02319V103,35000.0,7720,0.015365299008718709,2018-08-21,2018-06-30,0001586767-18-000003
PKX, POSCO SPONSORED ADR,693483109,34000.0,468,0.014926290465612462,2018-08-21,2018-06-30,0001586767-18-000003
IWN, ISHARES TR RUS 2000 VAL ETF,464287630,34000.0,261,0.014926290465612462,2018-08-21,2018-06-30,0001586767-18-000003
EFV, ISHARES TR EAFE VALUE ETF,464288877,34000.0,671,0.014926290465612462,2018-08-21,2018-06-30,0001586767-18-000003
EFG, ISHARES TR EAFE GRWTH ETF,464288885,34000.0,437,0.014926290465612462,2018-08-21,2018-06-30,0001586767-18-000003
FLOT, ISHARES TR FLTG RATE BD ETF,46429B655,34000.0,675,0.014926290465612462,2018-08-21,2018-06-30,0001586767-18-000003
PUK, PRUDENTIAL PLC ADR,74435K204,34000.0,749,0.014926290465612462,2018-08-21,2018-06-30,0001586767-18-000003
CEO, CNOOC LTD SPONSORED ADR,126132109,34000.0,199,0.014926290465612462,2018-08-21,2018-06-30,0001586767-18-000003
GD, GENERAL DYNAMICS CORP COM,369550108,33000.0,182,0.014487281922506213,2018-08-21,2018-06-30,0001586767-18-000003
DLTR, DOLLAR TREE INC COM,256746108,33000.0,399,0.014487281922506213,2018-08-21,2018-06-30,0001586767-18-000003
SSL, SASOL LTD SPONSORED ADR,803866300,33000.0,915,0.014487281922506213,2018-08-21,2018-06-30,0001586767-18-000003
ECL,ECOLAB INC COM,278865100,33000.0,237,0.014487281922506213,2018-08-21,2018-06-30,0001586767-18-000003
IWO, ISHARES TR RUS 2000 GRW ETF,464287648,33000.0,162,0.014487281922506213,2018-08-21,2018-06-30,0001586767-18-000003
ISRG, INTUITIVE SURGICAL INC COM NEW,46120E602,32000.0,67,0.014048273379399965,2018-08-21,2018-06-30,0001586767-18-000003
ADBE, ADOBE SYS INC COM,00724F101,32000.0,133,0.014048273379399965,2018-08-21,2018-06-30,0001586767-18-000003
SO, SOUTHERN CO COM,842587107,31000.0,689,0.013609264836293714,2018-08-21,2018-06-30,0001586767-18-000003
HUM, HUMANA INC COM,444859102,31000.0,107,0.013609264836293714,2018-08-21,2018-06-30,0001586767-18-000003
CTXSEUR, CITRIX SYS INC COM,177376100,31000.0,303,0.013609264836293714,2018-08-21,2018-06-30,0001586767-18-000003
N/A, ALLERGAN PLC SHS,G0177J108,31000.0,189,0.013609264836293714,2018-08-21,2018-06-30,0001586767-18-000003
MBI, MBIA INC COM,55262C100,31000.0,3452,0.013609264836293714,2018-08-21,2018-06-30,0001586767-18-000003
N/A, MICHAEL KORS HLDGS LTD SHS,G60754101,30000.0,462,0.013170256293187466,2018-08-21,2018-06-30,0001586767-18-000003
LFCUSD, CHINA LIFE INS CO LTD SPON ADR REP H,16939P106,30000.0,2394,0.013170256293187466,2018-08-21,2018-06-30,0001586767-18-000003
CELG, CELGENE CORP COM,151020104,29000.0,371,0.012731247750081217,2018-08-21,2018-06-30,0001586767-18-000003
F, FORD MTR CO DEL COM PAR $0.01,345370860,29000.0,2637,0.012731247750081217,2018-08-21,2018-06-30,0001586767-18-000003
IWC, ISHARES TR MICRO-CAP ETF,464288869,28000.0,269,0.012292239206974968,2018-08-21,2018-06-30,0001586767-18-000003
N/A, TWENTY FIRST CENTY FOX INC CL A,90130A101,28000.0,570,0.012292239206974968,2018-08-21,2018-06-30,0001586767-18-000003
UDR, UDR INC COM,902653104,27000.0,725,0.01185323066386872,2018-08-21,2018-06-30,0001586767-18-000003
MPC, MARATHON PETE CORP COM,56585A102,27000.0,386,0.01185323066386872,2018-08-21,2018-06-30,0001586767-18-000003
BP, BP PLC SPONSORED ADR,055622104,26000.0,573,0.011414222120762471,2018-08-21,2018-06-30,0001586767-18-000003
XLE, SELECT SECTOR SPDR TR SBI INT-ENERGY,81369Y506,26000.0,348,0.011414222120762471,2018-08-21,2018-06-30,0001586767-18-000003
PBR, PETROLEO BRASILEIRO SA PETRO SPONSORED ADR,71654V408,25000.0,2572,0.01097521357765622,2018-08-21,2018-06-30,0001586767-18-000003
PSX, PHILLIPS 66 COM,718546104,25000.0,229,0.01097521357765622,2018-08-21,2018-06-30,0001586767-18-000003
SKMEUR, SK TELECOM LTD SPONSORED ADR,78440P108,25000.0,1084,0.01097521357765622,2018-08-21,2018-06-30,0001586767-18-000003
N/A, EXPRESS SCRIPTS HLDG CO COM,30219G108,25000.0,326,0.01097521357765622,2018-08-21,2018-06-30,0001586767-18-000003
N/A, UBS GROUP AG SHS,H42097107,24000.0,1576,0.010536205034549972,2018-08-21,2018-06-30,0001586767-18-000003
DWD, MORGAN STANLEY COM NEW,617446448,24000.0,510,0.010536205034549972,2018-08-21,2018-06-30,0001586767-18-000003
VFC, V F CORP COM,918204108,23000.0,293,0.010097196491443724,2018-08-21,2018-06-30,0001586767-18-000003
EW, EDWARDS LIFESCIENCES CORP COM,28176E108,23000.0,160,0.010097196491443724,2018-08-21,2018-06-30,0001586767-18-000003
NSC, NORFOLK SOUTHERN CORP COM,655844108,23000.0,153,0.010097196491443724,2018-08-21,2018-06-30,0001586767-18-000003
BMRN, BIOMARIN PHARMACEUTICAL INC COM,09061G101,22000.0,237,0.009658187948337475,2018-08-21,2018-06-30,0001586767-18-000003
N/A, XEROX CORP COM,984121103,22000.0,929,0.009658187948337475,2018-08-21,2018-06-30,0001586767-18-000003
PFG, PRINCIPAL FINL GROUP INC COM,74251V102,22000.0,419,0.009658187948337475,2018-08-21,2018-06-30,0001586767-18-000003
AMXN, AMERICA MOVIL SAB DE CV SPON ADR L SHS,02364W105,22000.0,1332,0.009658187948337475,2018-08-21,2018-06-30,0001586767-18-000003
N/A, ASML HOLDING N V N Y REGISTRY SHS,N07059210,21000.0,108,0.009219179405231226,2018-08-21,2018-06-30,0001586767-18-000003
DHR, DANAHER CORP DEL COM,235851102,21000.0,217,0.009219179405231226,2018-08-21,2018-06-30,0001586767-18-000003
DOEUR, DIAMOND OFFSHORE DRILLING IN COM,25271C102,20000.0,998,0.008780170862124976,2018-08-21,2018-06-30,0001586767-18-000003
PRU, PRUDENTIAL FINL INC COM,744320102,20000.0,220,0.008780170862124976,2018-08-21,2018-06-30,0001586767-18-000003
SNA, SNAP ON INC COM,833034101,20000.0,128,0.008780170862124976,2018-08-21,2018-06-30,0001586767-18-000003
UA, UNDER ARMOUR INC CL C,904311206,20000.0,975,0.008780170862124976,2018-08-21,2018-06-30,0001586767-18-000003
CDK, CDK GLOBAL INC COM,12508E101,20000.0,311,0.008780170862124976,2018-08-21,2018-06-30,0001586767-18-000003
N/A, LYONDELLBASELL INDUSTRIES N SHS - A -,N53745100,19000.0,176,0.008341162319018729,2018-08-21,2018-06-30,0001586767-18-000003
EA, ELECTRONIC ARTS INC COM,285512109,19000.0,135,0.008341162319018729,2018-08-21,2018-06-30,0001586767-18-000003
AEM,AGNICO EAGLE MINES LTD COM,008474108,18000.0,412,0.007902153775912479,2018-08-21,2018-06-30,0001586767-18-000003
ABJA, ABB LTD SPONSORED ADR,000375204,18000.0,864,0.007902153775912479,2018-08-21,2018-06-30,0001586767-18-000003
7HP, HP INC COM,40434L105,18000.0,820,0.007902153775912479,2018-08-21,2018-06-30,0001586767-18-000003
KBIA, KB FINANCIAL GROUP INC SPONSORED ADR,48241A105,18000.0,400,0.007902153775912479,2018-08-21,2018-06-30,0001586767-18-000003
N/A, DR PEPPER SNAPPLE GROUP INC COM,26138E109,18000.0,150,0.007902153775912479,2018-08-21,2018-06-30,0001586767-18-000003
EVEUR, EATON VANCE CORP COM NON VTG,278265103,18000.0,350,0.007902153775912479,2018-08-21,2018-06-30,0001586767-18-000003
KYOCY,KYOCERA CORP ADR,501556203,18000.0,322,0.007902153775912479,2018-08-21,2018-06-30,0001586767-18-000003
NGVT, INGEVITY CORP COM,45688C107,17000.0,218,0.007463145232806231,2018-08-21,2018-06-30,0001586767-18-000003
AIG, AMERICAN INTL GROUP INC COM NEW,026874784,17000.0,339,0.007463145232806231,2018-08-21,2018-06-30,0001586767-18-000003
DLR, DIGITAL RLTY TR INC COM,253868103,17000.0,161,0.007463145232806231,2018-08-21,2018-06-30,0001586767-18-000003
MUFG, MITSUBISHI UFJ FINL GROUP IN SPONSORED ADR,606822104,16000.0,2906,0.007024136689699982,2018-08-21,2018-06-30,0001586767-18-000003
EQR, EQUITY RESIDENTIAL SH BEN INT,29476L107,16000.0,255,0.007024136689699982,2018-08-21,2018-06-30,0001586767-18-000003
EWH, ISHARES MSCI HONG KG ETF,464286871,16000.0,692,0.007024136689699982,2018-08-21,2018-06-30,0001586767-18-000003
EIX, EDISON INTL COM,281020107,16000.0,260,0.007024136689699982,2018-08-21,2018-06-30,0001586767-18-000003
MET, METLIFE INC COM,59156R108,16000.0,379,0.007024136689699982,2018-08-21,2018-06-30,0001586767-18-000003
XHR, XENIA HOTELS & RESORTS INC COM,984017103,15000.0,638,0.006585128146593733,2018-08-21,2018-06-30,0001586767-18-000003
AVVIYUSD,AVIVA PLC ADR,05382A104,15000.0,1138,0.006585128146593733,2018-08-21,2018-06-30,0001586767-18-000003
NRG, NRG ENERGY INC COM NEW,629377508,15000.0,491,0.006585128146593733,2018-08-21,2018-06-30,0001586767-18-000003
TRV, TRAVELERS COMPANIES INC COM,89417E109,15000.0,124,0.006585128146593733,2018-08-21,2018-06-30,0001586767-18-000003
MFG, MIZUHO FINL GROUP INC SPONSORED ADR,60687Y109,15000.0,4438,0.006585128146593733,2018-08-21,2018-06-30,0001586767-18-000003
PSA, PUBLIC STORAGE COM,74460D109,15000.0,69,0.006585128146593733,2018-08-21,2018-06-30,0001586767-18-000003
ITW, ILLINOIS TOOL WKS INC COM,452308109,15000.0,115,0.006585128146593733,2018-08-21,2018-06-30,0001586767-18-000003
VEDL, VEDANTA LTD SPONSORED ADR,92242Y100,15000.0,1154,0.006585128146593733,2018-08-21,2018-06-30,0001586767-18-000003
ALE, ALLETE INC COM NEW,018522300,15000.0,202,0.006585128146593733,2018-08-21,2018-06-30,0001586767-18-000003
CHLUSD, CHINA MOBILE LIMITED SPONSORED ADR,16941M109,14000.0,321,0.006146119603487484,2018-08-21,2018-06-30,0001586767-18-000003
A4S, AMERIPRISE FINL INC COM,03076C106,14000.0,104,0.006146119603487484,2018-08-21,2018-06-30,0001586767-18-000003
TDS, TELEPHONE & DATA SYS INC COM NEW,879433829,13000.0,509,0.0057071110603812356,2018-08-21,2018-06-30,0001586767-18-000003
N/A, LUXOTTICA GROUP S P A SPONSORED ADR,55068R202,13000.0,217,0.0057071110603812356,2018-08-21,2018-06-30,0001586767-18-000003
DFSEUR, DISCOVER FINL SVCS COM,254709108,13000.0,186,0.0057071110603812356,2018-08-21,2018-06-30,0001586767-18-000003
WAT,WATERS CORP COM,941848103,13000.0,68,0.0057071110603812356,2018-08-21,2018-06-30,0001586767-18-000003
UHS, UNIVERSAL HLTH SVCS INC CL B,913903100,12000.0,116,0.005268102517274986,2018-08-21,2018-06-30,0001586767-18-000003
CAE, CAE INC COM,124765108,12000.0,620,0.005268102517274986,2018-08-21,2018-06-30,0001586767-18-000003
SCHE, SCHWAB STRATEGIC TR EMRG MKTEQ ETF,808524706,12000.0,489,0.005268102517274986,2018-08-21,2018-06-30,0001586767-18-000003
IFF,INTERNATIONAL FLAVORS&FRAGRA COM,459506101,12000.0,101,0.005268102517274986,2018-08-21,2018-06-30,0001586767-18-000003
TLK, P T TELEKOMUNIKASI INDONESIA SPONSORED ADR,715684106,11000.0,426,0.0048290939741687374,2018-08-21,2018-06-30,0001586767-18-000003
JCI, JOHNSON CTLS INTL PLC SHS ADDED,G51502105,11000.0,330,0.0048290939741687374,2018-08-21,2018-06-30,0001586767-18-000003
AFL,AFLAC INC COM,001055102,11000.0,257,0.0048290939741687374,2018-08-21,2018-06-30,0001586767-18-000003
TM, TOYOTA MOTOR CORP SP ADR REP2COM,892331307,11000.0,86,0.0048290939741687374,2018-08-21,2018-06-30,0001586767-18-000003
IWV, ISHARES TR RUSSELL 3000 ETF,464287689,11000.0,72,0.0048290939741687374,2018-08-21,2018-06-30,0001586767-18-000003
DLTH, DULUTH HLDGS INC COM CL B,26443V101,11000.0,500,0.0048290939741687374,2018-08-21,2018-06-30,0001586767-18-000003
SONY, SONY CORP ADR NEW,835699307,11000.0,234,0.0048290939741687374,2018-08-21,2018-06-30,0001586767-18-000003
IWD, ISHARES TR RUS 1000 VAL ETF,464287598,11000.0,97,0.0048290939741687374,2018-08-21,2018-06-30,0001586767-18-000003
KT, KT CORP SPONSORED ADR,48268K101,10000.0,822,0.004390085431062488,2018-08-21,2018-06-30,0001586767-18-000003
AVY, AVERY DENNISON CORP COM,053611109,10000.0,103,0.004390085431062488,2018-08-21,2018-06-30,0001586767-18-000003
N/A,GENERAL GROWTH PPTYS INC NEW COM,370023103,10000.0,512,0.004390085431062488,2018-08-21,2018-06-30,0001586767-18-000003
N/A,HCP INC COM,40414L109,10000.0,403,0.004390085431062488,2018-08-21,2018-06-30,0001586767-18-000003
VRTX, VERTEX PHARMACEUTICALS INC COM,92532F100,10000.0,60,0.004390085431062488,2018-08-21,2018-06-30,0001586767-18-000003
ERIC, ERICSSON ADR B SEK 10,294821608,10000.0,1326,0.004390085431062488,2018-08-21,2018-06-30,0001586767-18-000003
N/A, CBS CORP NEW CL B,124857202,9000.0,164,0.003951076887956239,2018-08-21,2018-06-30,0001586767-18-000003
TKC, TURKCELL ILETISIM HIZMETLERI SPON ADR NEW,900111204,9000.0,1377,0.003951076887956239,2018-08-21,2018-06-30,0001586767-18-000003
STZ, CONSTELLATION BRANDS INC CL A,21036P108,9000.0,41,0.003951076887956239,2018-08-21,2018-06-30,0001586767-18-000003
N/A, KKR & CO L P DEL COM UNITS,48248M102,9000.0,368,0.003951076887956239,2018-08-21,2018-06-30,0001586767-18-000003
MTN, VAIL RESORTS INC COM,91879Q109,9000.0,33,0.003951076887956239,2018-08-21,2018-06-30,0001586767-18-000003
N/A, NAM TAI PPTY INC SHS,G63907102,9000.0,849,0.003951076887956239,2018-08-21,2018-06-30,0001586767-18-000003
PLD, PROLOGIS INC COM,74340W103,9000.0,143,0.003951076887956239,2018-08-21,2018-06-30,0001586767-18-000003
PHG, KONINKLIJKE PHILIPS N V NY REG SH NEW,500472303,9000.0,226,0.003951076887956239,2018-08-21,2018-06-30,0001586767-18-000003
ETRA, E TRADE FINANCIAL CORP COM NEW,269246401,9000.0,157,0.003951076887956239,2018-08-21,2018-06-30,0001586767-18-000003
HAL, HALLIBURTON CO COM,406216101,8000.0,199,0.003512068344849991,2018-08-21,2018-06-30,0001586767-18-000003
AMAT, APPLIED MATLS INC COM,038222105,8000.0,194,0.003512068344849991,2018-08-21,2018-06-30,0001586767-18-000003
UGP, ULTRAPAR PARTICIPACOES S A SP ADR REP COM,90400P101,8000.0,736,0.003512068344849991,2018-08-21,2018-06-30,0001586767-18-000003
VOT, VANGUARD INDEX FDS MCAP GR IDXVIP,922908538,8000.0,63,0.003512068344849991,2018-08-21,2018-06-30,0001586767-18-000003
VOE, VANGUARD INDEX FDS MCAP VL IDXVIP,922908512,8000.0,77,0.003512068344849991,2018-08-21,2018-06-30,0001586767-18-000003
PWOD,PENNS WOODS BANCORP INC COM,708430103,8000.0,188,0.003512068344849991,2018-08-21,2018-06-30,0001586767-18-000003
FI, FISERV INC COM,337738108,7000.0,95,0.003073059801743742,2018-08-21,2018-06-30,0001586767-18-000003
XRAY, DENTSPLY SIRONA INC COM,24906P109,7000.0,164,0.003073059801743742,2018-08-21,2018-06-30,0001586767-18-000003
RWX, SPDR INDEX SHS FDS DJ INTL RL ETF,78463X863,7000.0,184,0.003073059801743742,2018-08-21,2018-06-30,0001586767-18-000003
HRSEUR, HARRIS CORP DEL COM,413875105,7000.0,51,0.003073059801743742,2018-08-21,2018-06-30,0001586767-18-000003
ISCG,ISHARES TR MRGSTR SM CP GR,464288604,7000.0,37,0.003073059801743742,2018-08-21,2018-06-30,0001586767-18-000003
OMC, OMNICOM GROUP INC COM,681919106,7000.0,97,0.003073059801743742,2018-08-21,2018-06-30,0001586767-18-000003
OSK,OSHKOSH CORP COM,688239201,7000.0,106,0.003073059801743742,2018-08-21,2018-06-30,0001586767-18-000003
N/A, TRITON INTL LTD CL A ADDED,G9078F107,7000.0,244,0.003073059801743742,2018-08-21,2018-06-30,0001586767-18-000003
OHI, OMEGA HEALTHCARE INVS INC COM,681936100,7000.0,243,0.003073059801743742,2018-08-21,2018-06-30,0001586767-18-000003
SKAA, SKECHERS U S A INC CL A,830566105,7000.0,255,0.003073059801743742,2018-08-21,2018-06-30,0001586767-18-000003
DGX, QUEST DIAGNOSTICS INC COM,74834L100,7000.0,70,0.003073059801743742,2018-08-21,2018-06-30,0001586767-18-000003
N/A, CREDIT SUISSE GROUP SPONSORED ADR,225401108,7000.0,506,0.003073059801743742,2018-08-21,2018-06-30,0001586767-18-000003
LN5, LANNET INC COM,516012101,6000.0,513,0.002634051258637493,2018-08-21,2018-06-30,0001586767-18-000003
VOD, VODAFONE GROUP PLC NEW SPNSR ADR,92857W308,6000.0,283,0.002634051258637493,2018-08-21,2018-06-30,0001586767-18-000003
9990302D, APACHE CORP COM,037411105,6000.0,140,0.002634051258637493,2018-08-21,2018-06-30,0001586767-18-000003
DSGX, DESCARTES SYS GROUP INC COM,249906108,6000.0,200,0.002634051258637493,2018-08-21,2018-06-30,0001586767-18-000003
CM, CDN IMPERIAL BK COMM TORONTO COM,136069101,6000.0,70,0.002634051258637493,2018-08-21,2018-06-30,0001586767-18-000003
CME, CME GROUP INC COM,12572Q105,6000.0,37,0.002634051258637493,2018-08-21,2018-06-30,0001586767-18-000003
SPH, SUBURBAN PROPANE PARTNERS L UNIT LTD PARTN,864482104,6000.0,256,0.002634051258637493,2018-08-21,2018-06-30,0001586767-18-000003
BTUSD, BT GROUP PLC ADR,05577E101,5000.0,367,0.002195042715531244,2018-08-21,2018-06-30,0001586767-18-000003
MAT, MATTEL INC COM,577081102,5000.0,313,0.002195042715531244,2018-08-21,2018-06-30,0001586767-18-000003
WDC, WESTERN DIGITAL CORP COM,958102105,5000.0,67,0.002195042715531244,2018-08-21,2018-06-30,0001586767-18-000003
IMCG,ISHARES TR MRGSTR MD CP GRW,464288307,5000.0,24,0.002195042715531244,2018-08-21,2018-06-30,0001586767-18-000003
E, ENI S P A SPONSORED ADR,26874R108,5000.0,144,0.002195042715531244,2018-08-21,2018-06-30,0001586767-18-000003
LNC, LINCOLN NATL CORP IND COM,534187109,5000.0,88,0.002195042715531244,2018-08-21,2018-06-30,0001586767-18-000003
N/A, CIGNA CORPORATION COM,125509109,5000.0,33,0.002195042715531244,2018-08-21,2018-06-30,0001586767-18-000003
STWD, STARWOOD PPTY TR INC COM,85571B105,5000.0,266,0.002195042715531244,2018-08-21,2018-06-30,0001586767-18-000003
FIS, FIDELITY NATL INFORMATION SV COM,31620M106,5000.0,55,0.002195042715531244,2018-08-21,2018-06-30,0001586767-18-000003
BBD, BANCO BRADESCO S A SP ADR PFD NEW,059460303,4000.0,632,0.0017560341724249956,2018-08-21,2018-06-30,0001586767-18-000003
BNS, BANK N S HALIFAX COM,064149107,4000.0,70,0.0017560341724249956,2018-08-21,2018-06-30,0001586767-18-000003
APC, ANADARKO PETE CORP COM,032511107,4000.0,55,0.0017560341724249956,2018-08-21,2018-06-30,0001586767-18-000003
DRI, DARDEN RESTAURANTS INC COM,237194105,4000.0,38,0.0017560341724249956,2018-08-21,2018-06-30,0001586767-18-000003
ORLY, O REILLY AUTOMOTIVE INC NEW COM,67103H107,4000.0,15,0.0017560341724249956,2018-08-21,2018-06-30,0001586767-18-000003
MAR,MARRIOTT INTL INC NEW CL A,571903202,4000.0,33,0.0017560341724249956,2018-08-21,2018-06-30,0001586767-18-000003
N/A,GOLDCORP INC NEW COM,380956409,4000.0,305,0.0017560341724249956,2018-08-21,2018-06-30,0001586767-18-000003
ILCV,ISHARES TR MRNGSTR LG-CP VL,464288109,4000.0,41,0.0017560341724249956,2018-08-21,2018-06-30,0001586767-18-000003
QSR, RESTAURANT BRANDS INTL INC COM,76131D103,4000.0,70,0.0017560341724249956,2018-08-21,2018-06-30,0001586767-18-000003
ITUB, ITAU UNIBANCO HLDG SA SPON ADR REP PFD,465562106,4000.0,407,0.0017560341724249956,2018-08-21,2018-06-30,0001586767-18-000003
SRE, SEMPRA ENERGY COM,816851109,4000.0,37,0.0017560341724249956,2018-08-21,2018-06-30,0001586767-18-000003
BSX,BOSTON SCIENTIFIC CORP COM,101137107,4000.0,132,0.0017560341724249956,2018-08-21,2018-06-30,0001586767-18-000003
TAL, TAL ED GROUP ADS REPSTG COM,874080104,4000.0,126,0.0017560341724249956,2018-08-21,2018-06-30,0001586767-18-000003
SCCO, SOUTHERN COPPER CORP COM,84265V105,4000.0,93,0.0017560341724249956,2018-08-21,2018-06-30,0001586767-18-000003
APD, AIR PRODS & CHEMS INC COM,009158106,4000.0,29,0.0017560341724249956,2018-08-21,2018-06-30,0001586767-18-000003
N/A,COCA COLA EUROPEAN PARTNERS SHS,G25839104,4000.0,122,0.0017560341724249956,2018-08-21,2018-06-30,0001586767-18-000003
NBL2EUR, NOBLE ENERGY INC COM,655044105,4000.0,139,0.0017560341724249956,2018-08-21,2018-06-30,0001586767-18-000003
VALE, VALE S A ADR,91912E105,4000.0,350,0.0017560341724249956,2018-08-21,2018-06-30,0001586767-18-000003
NTES, NETEASE INC SPONSORED ADR,64110W102,4000.0,19,0.0017560341724249956,2018-08-21,2018-06-30,0001586767-18-000003
PH, PARKER HANNIFIN CORP COM,701094104,4000.0,31,0.0017560341724249956,2018-08-21,2018-06-30,0001586767-18-000003
BMO, BANK MONTREAL QUE COM,063671101,4000.0,60,0.0017560341724249956,2018-08-21,2018-06-30,0001586767-18-000003
DVN, DEVON ENERGY CORP NEW COM,25179M103,4000.0,105,0.0017560341724249956,2018-08-21,2018-06-30,0001586767-18-000003
N/A,EMPRESA NACIONAL DE ELCTRCID SPONSORED ADR,29244T101,4000.0,229,0.0017560341724249956,2018-08-21,2018-06-30,0001586767-18-000003
RELX,RELX PLC SPONSORED ADR,759530108,4000.0,207,0.0017560341724249956,2018-08-21,2018-06-30,0001586767-18-000003
BBVA, BANCO BILBAO VIZCAYA ARGENTA SPONSORED ADR,05946K101,3000.0,481,0.0013170256293187465,2018-08-21,2018-06-30,0001586767-18-000003
EC, ECOPETROL S A SPONSORED ADS,279158109,3000.0,146,0.0013170256293187465,2018-08-21,2018-06-30,0001586767-18-000003
BRFS, BRF SA SPONSORED ADR,10552T107,3000.0,663,0.0013170256293187465,2018-08-21,2018-06-30,0001586767-18-000003
N/A,NATIONAL GRID PLC SPON ADR NEW,636274300,3000.0,56,0.0013170256293187465,2018-08-21,2018-06-30,0001586767-18-000003
GT, GOODYEAR TIRE & RUBR CO COM,382550101,3000.0,136,0.0013170256293187465,2018-08-21,2018-06-30,0001586767-18-000003
N/A, TEXTAINER GROUP HOLDINGS LTD SHS,G8766E109,3000.0,200,0.0013170256293187465,2018-08-21,2018-06-30,0001586767-18-000003
TSN, TYSON FOODS INC CL A,902494103,3000.0,47,0.0013170256293187465,2018-08-21,2018-06-30,0001586767-18-000003
OGS, ONE GAS INC COM,68235P108,3000.0,45,0.0013170256293187465,2018-08-21,2018-06-30,0001586767-18-000003
TMUS, T MOBILE US INC COM,872590104,3000.0,52,0.0013170256293187465,2018-08-21,2018-06-30,0001586767-18-000003
BBTUSD, BB&T CORP COM,054937107,3000.0,68,0.0013170256293187465,2018-08-21,2018-06-30,0001586767-18-000003
REGN, REGENERON PHARMACEUTICALS COM,75886F107,3000.0,10,0.0013170256293187465,2018-08-21,2018-06-30,0001586767-18-000003
N/A, NEW ORIENTAL ED & TECH GRP I SPON ADR,647581107,3000.0,38,0.0013170256293187465,2018-08-21,2018-06-30,0001586767-18-000003
IMCV,ISHARES TR MRGSTR MD CP VAL,464288406,3000.0,22,0.0013170256293187465,2018-08-21,2018-06-30,0001586767-18-000003
TROW, PRICE T ROWE GROUP INC COM,74144T108,3000.0,31,0.0013170256293187465,2018-08-21,2018-06-30,0001586767-18-000003
PCAR, PACCAR INC COM,693718108,3000.0,62,0.0013170256293187465,2018-08-21,2018-06-30,0001586767-18-000003
N/A, DELL TECHNOLOGIES INC COM CL V ADDED,24703L103,3000.0,47,0.0013170256293187465,2018-08-21,2018-06-30,0001586767-18-000003
RDY, DR REDDYS LABS LTD ADR,256135203,3000.0,107,0.0013170256293187465,2018-08-21,2018-06-30,0001586767-18-000003
NMR, NOMURA HLDGS INC SPONSORED ADR,65535H208,2000.0,470,0.0008780170862124978,2018-08-21,2018-06-30,0001586767-18-000003
SR,SPIRE INC COM,84857L101,2000.0,35,0.0008780170862124978,2018-08-21,2018-06-30,0001586767-18-000003
NJR, NEW JERSEY RES COM,646025106,2000.0,55,0.0008780170862124978,2018-08-21,2018-06-30,0001586767-18-000003
FSLR, FIRST SOLAR INC COM,336433107,2000.0,46,0.0008780170862124978,2018-08-21,2018-06-30,0001586767-18-000003
MCK,MCKESSON CORP COM,58155Q103,2000.0,18,0.0008780170862124978,2018-08-21,2018-06-30,0001586767-18-000003
N/A, YANDEX N V SHS CLASS A,N97284108,2000.0,60,0.0008780170862124978,2018-08-21,2018-06-30,0001586767-18-000003
SIRIEUR, SIRIUS XM HLDGS INC COM,82968B103,2000.0,332,0.0008780170862124978,2018-08-21,2018-06-30,0001586767-18-000003
PRGO,PERRIGO CO PLC SHS,G97822103,2000.0,30,0.0008780170862124978,2018-08-21,2018-06-30,0001586767-18-000003
ING, ING GROEP N V SPONSORED ADR,456837103,2000.0,151,0.0008780170862124978,2018-08-21,2018-06-30,0001586767-18-000003
XYL, XYLEM INC COM,98419M100,2000.0,37,0.0008780170862124978,2018-08-21,2018-06-30,0001586767-18-000003
WPP, WPP PLC NEW ADR,92937A102,2000.0,26,0.0008780170862124978,2018-08-21,2018-06-30,0001586767-18-000003
JD, JD COM INC SPON ADR CL A,47215P106,2000.0,64,0.0008780170862124978,2018-08-21,2018-06-30,0001586767-18-000003
N/A, COLONY CAP INC CL A,19624R106,2000.0,345,0.0008780170862124978,2018-08-21,2018-06-30,0001586767-18-000003
