ticker,nameOfIssuer,cusip,value,shares,allocation_percent,filingDate,reportDate,accessionNumber
N/A,"ECHOSTAR COMMUNICATIONS CORP, NEW-CL A",278762109,85458664200.0,3130354,38.71145219167193,2002-02-14,2001-12-31,0000922423-02-000202
N/A,"ACE LTD                            COM     G0070K103000    62063117.25    1541175         X                  19930    0     1440430 ACTIVE POWER INC                   COM     00504W100000       53572.26       7798         X                     33    0        5718 ACTUATE SOFTWARE CORP              COM     00508B102000        28858.5       5445         X                      0    0        5445 ADMINISTAFF INC ;                  COM     007094105000         110160       4000         X                   4000    0           0 ADVANCE PCS                        COM     00790K109000        1464036      48720         X                   4105    0       40525 ADVANCED SWITCHING COMMUNICATIONS INC               COM     00757V106000          84150      82500         X                      0    0       82500 AFC ENTERPRISES INC                COM     00104Q107000       26212020     919720         X                  23525    0      764270 AFFYMETRIX INC                     COM     00826T108000    61091420.15    1529197         X                  40540    0     1417509 AGILE SOFTWARE CORP DEL            COM     00846X105000      2534978.1     140442         X                  10625    0      112200 ALLOY INC.                         COM     019855105000     16913275.2     797796         X                    593    0      725649 AMISTAR CORP,                      COM     031535107000          25145      23500         X                  23500    0           0 AMN HEALTHCARE SVCS INC            COM     001744101000       35512565    1291366         X                  44612    0     1131800 ANTHEM INC ;                       COM     03674B104000     25732887.5     530575         X                  15490    0      474930 AOL TIME WARNER INC                COM     00184A105000      1169191.3      35323         X                     17    0       32894 AON CORP,                          COM     037389103000         106140       3000         X                   3000    0           0 APOLLO GROUP INC-CL A,",037604105,30846814320.0,684572,13.973129453784056,2002-02-14,2001-12-31,0000922423-02-000202
N/A,"SONIC CORP                         COM     835451105000    27899385.44     766888         X                   1361    0      685883 SONIC INNOVATIONS INC              COM     83545M109000        1303029     303030         X                  25140    0      251660 SOUTHWEST AIRLINES CO,             COM     844741108000     38692312.5    2063590         X                  24375    0     1887075 STANCORP FINL GROUP INC ; COM      COM     852891100000       12878180     270550         X                      0    0      264275 STORAGENETWORKS INC                COM     86211E103000        3605283     603900         X                      0    0      543750 SWIFT TRANSPORTATION CO INC        COM     870756103000    12858783.42     589582         X                  36875    0      513270 SYMYX TECHNOLOGIES INC             COM     87155S108000     2602806.25     122485         X                   8595    0       97955 SYNOPSYS INC                       COM     871607107000         835203      13990         X                    225    0       12615 TEMPLE INLAND INC,                 COM     879868107000         141800       2500         X                      0    0        2500 THERAGENICS CORP,                  COM     883375107000        5195000     500000         X                      0    0      462325 TMP WORLDWIDE INC                  COM     872941109000       11147324     249940         X                   2075    0      228125 TRC COMPANIES INC,                 COM     872625108000        5775055     117260         X                      0    0      100335 TRENWICK GROUP LTD BERMUDA (HOLDING COMPANY)                COM     G9032C109000       18720528    1887150         X                 103930    0     1598194 TWEETER HOME ENTMT GROUP INC",901167106,22710430000.0,775100,10.287473288136322,2002-02-14,2001-12-31,0000922423-02-000202
N/A,"BRISTOL MYERS SQUIBB CO,           COM     110122108000          41440        800         X                      0    0         800 CABLEVISION SYS CORP RAINBOW MEDIA GROUP                      COM     12686C844000      297092.51      12221         X                     26    0        8923 CACI INTERNATIONAL INC-CL A        COM     127190304000          10580        250         X                      0    0         250 CADIZ INC   COM",127537108,13981205000.0,1705025,6.333269470171106,2002-02-14,2001-12-31,0000922423-02-000202
N/A,"KANA SOFTWARE INC - NEW            COM     483600300000     5157705.54     279399         X                  10189    0      231384 KNIGHT TRANSPORTATION INC          COM     499064103000     7210710.85     250285         X                  23420    0      188550 KOHLS CORP                         COM     500255104000     4355591.45      61355         X                  11905    0       45760 KRISPY KREME DOUGHNUTS INC         COM     501014104000    17041646.25     372495         X                   8625    0      330595 KRONOS INC                         COM     501052104000     7539446.25     152775         X                   4475    0      127800 KULICKE & SOFFA INDUSTRIES INC     COM     501242101000          17850       1000         X                      0    0        1000 LAMAR ADVERTISING CO-CL A,",512815101,12424202190.0,298157,5.627971295833228,2002-02-14,2001-12-31,0000922423-02-000202
N/A,"RES-CARE INC,                      COM     760943100000        2572619     294350         X                      0    0      242910 SBC COMMUNICATIONS INC,            COM     78387G103000       61525.42       1558         X                      0    0        1558 SCIENTIFIC GAMES CORP CL A         COM     80874P109000      8019294.6     921758         X                  33325    0      860050 SCP POOL CORP,",784028102,8742679560.0,318147,3.9602985254015635,2002-02-14,2001-12-31,0000922423-02-000202
N/A,"ULTIMATE ELECTRONICS INC           COM     903849107000    15412276.77     527637         X                  23800    0      476362 UNILAB CORP NEW                    COM     904763208000     2882848.75     113275         X                   8405    0       96265 UNION PACIFIC CORP,                COM     907818108000     34006375.5     594725         X                      0    0      568975 UNITED PARCEL SVC INC ; CL B       COM     911312106000         110100       2000         X                   2000    0           0 UNITED SURGICAL PARTNERS INTL INC                              COM     913016309000      2188035.5     107785         X                   9370    0       89665 URBAN OUTFITTERS INC               COM     917047102000      2438887.5      99750         X                      0    0       79990 USA NETWORKS INC,                  COM     902984103000     21099079.5     777130         X                    390    0      755283 VALERO ENERGY CORP NEW ;           COM     91913Y100000      179899.98       4758         X                     18    0        3487 VIACOM INC-CL B,                   COM     925524308000     1820954.85      40601         X                  17983    0       22428 VYYO INC                           COM     918458100000      2445953.4    1772430         X                  34140    0     1668940 W R BERKLEY CORP                   COM     084423102000    123753019.6    2300242         X                  54056    0     2142699 WALT DISNEY CO HOLDING CO,         COM     254687106000        93395.1       4458         X                      0    0        4458 WEBSENSE INC",947684106,8362032000.0,248870,3.787871072214007,2002-02-14,2001-12-31,0000922423-02-000202
N/A,"SEACHANGE INTERNATIONAL INC,       COM     811699107000       16742574     485292         X                  32200    0      423015 SEACOR SMIT INC, FORMERLY SECOR HOLDINGS INC                     COM     811904101000         158440       3400         X                   3400    0           0 SEPRACOR INC,                      COM     817315104000      3792327.6      63930         X                   6560    0       55820 SFBC INTL INC                      COM     784121105000        1624050      81000         X                    795    0       71960 SIRIUS SATELLITE RADIO INC         COM     82966U103000        8878086     822045         X                  32385    0      680225 SIX FLAGS INC ;                    COM     83001P109000    11113197.81     706497         X                  70625    0      635872 SMARTFORCE PUB LTD CO ; SPONSORED ADR                    COM     83170A206000          38068       1535         X                      0    0         710 SOLECTRON CORP,",834182107,7080444500.0,658646,3.2073317705513174,2002-02-14,2001-12-31,0000922423-02-000202
UPBD,"NEOFORMA IN COM NEW                COM     640475505000      4915537.5     172475         X                      0    0      141860 NEOPHARM INC ;                     COM     640919106000    26577804.12    1020653         X                  30506    0      940544 NEWMONT MINING CORP,               COM     651639106000       39702285    2100650         X                 113725    0     1935940 NEXTWAVE TELECOM INC-CL B ;        COM     65332M103000         600000      80000         X                  80000    0           0 NOKIA CORP-SPONSORED ADR           COM     654902204000     2414531.25      95625         X                  16470    0       71875 NORTHERN CRANBERRIES INC CL A NEW                         COM     666499207000       245357.2     446104         X                   6419    0      423069 NORTHROP GRUMMAN CORP              COM     666807102000          99650       1000         X                   1000    0           0 NUMERICAL TECHNOLOGIES INC         COM     67053T101000    14334295.36     397292         X                  30900    0      333854 OAKLEY INC,                        COM     673662102000       14358645     865500         X                      0    0      796765 OMI CORP NEW,                      COM     Y6476W104000        1245740     313000         X                      0    0      312275 OSI PHARMACEUTICALS INC            COM     671040103000    15645220.72     339818         X                  11553    0      302806 PACKAGING CORP AMER                COM     695156109000        4867720     263120         X                  37015    0      202995 PEC SOLUTIONS INC                  COM     705107100000     34797787.5     927941         X                  13896    0      813407 PFSWEB INC                         COM     717098107000     2157329.75    2538035         X                 100000    0     2213555 PLX TECHNOLOGY INC                 COM     693417107000      6878795.6     527515         X                 109085    0      375220 QUEST SOFTWARE INC                 COM     74834T103000    6094389.118     259933         X                  28480    0      205500 QWEST COMMUNICATIONS, INTERNATIONAL INC                COM     749121109000       42732816    3000900         X                      0    0     2900145 RADIO ONE INC CL D                 COM     75040P405000     7576220.25     413775         X                  48380    0      329000 RADIOSHACK CORP                    COM     750438103000          12616        415         X                      0    0         415 RAINDANCE COMMUNICATIONS INC       COM     75086X106000     3396656.25     580625         X                  29450    0      482500 RARE HOSPITALITY INTERNATIONAL INC                              COM     753820109000     11598970.5     499525         X                      0    0      455325 RENT A CENTER INC-NEW",76009N100,4694387620.0,137827,2.1264849342310055,2002-02-14,2001-12-31,0000922423-02-000202
N/A,"APPLIED SIGNAL TECHNOLOGY INC                              COM     038237103000       208564.5      25500         X                  25500    0           0 ARCH COAL INC                      COM     039380100000     6104350.42     270823         X                  14950    0      219975 ARCHER-DANIELS-MIDLAND CO          COM     039483102000     9327038.75     650875         X                      0    0      625425 AT&T WIRELSS SERVICES INC          COM     00209A106000          87540       6000         X                   6000    0           0 BAY VIEW CAPITAL CORP-DEL          COM     07262L101000     3917469.88     541087         X                      0    0      525895 BE FREE                            COM     073308108000      4716874.7    2289745         X                      0    0     1929310 BEA SYSTEMS INC,                   COM     073325102000    25770633.92    1606648         X                  53579    0     1423348 BECTON DICKINSON & CO,             COM     075887109000     4459466.25     132525         X                      0    0      132525 BEI TECHNOLOGIES INC               COM     05538P104000     8036997.65     483865         X                  24900    0      439537 BENIHANA INC-CL A,",082047200,4114385200.0,277999,1.8637528149886826,2002-02-14,2001-12-31,0000922423-02-000202
MMSI,"MERIT MEDICAL SYSTEMS INC,",589889104,3760276650.0,208095,1.7033471225722165,2002-02-14,2001-12-31,0000922423-02-000202
N/A,"COACH INC                          COM     189754104000    20132344.14     524553         X                  20225    0      460416 COCA COLA CO,                      COM     191216100000          94340       2000         X                   2000    0           0 COINSTAR INC,",19259P300,3550663750.0,139625,1.6083957231667982,2002-02-14,2001-12-31,0000922423-02-000202
N/A,NABORS INDUSTRIES INC              COM     629568106000        8505000     243000         X                      0    0      232870 NATIONAL-OILWELL INC               COM     637071101000     11256043.5     534475         X                      0    0      523400 NAVIGATORS GROUP INC,638904102,3471471000.0,172710,1.5725226331267126,2002-02-14,2001-12-31,0000922423-02-000202
N/A,"LEXENT INC                         COM     52886Q102000     1350798.43     204977         X                   6482    0      154058 LIBERTY SATELLITE & TECHNOLOGY ; INC CL A                         COM     531182103000      560136.85     615535         X                  10950    0      586395 LITHIA MOTORS INC-CL A,            COM     536797103000          96576       4800         X                   4800    0           0 LUCENT TECHNOLOGIES INC,           COM     549463107000         123600      20000         X                  20000    0           0 MAGMA DESIGN AUTOMATION INC        COM     559181102000      6451322.4     216560         X                  30545    0      169710 MAGNA ENTERTAINMENT CORP SUB VTG CL A                             COM     559211107000        6672673     953239         X                      0    0      930625 MANOR CARE INC NEW ;               COM     564055101000      248384.33      10397         X                     23    0        7616 MAXIMUS INC                        COM     577933104000    45718461.15    1084661         X                    269    0     1045261 MAXYGEN INC                        COM     577776107000      7234301.1     395317         X                  24275    0      341861 MEDAREX INC                        COM     583916101000      331489.05      17401         X                     74    0       16450 MEDIMMUNE INC                      COM     584699102000     4842880.83     100329         X                      0    0       91700 MERCK & CO INC,                    COM     589331107000         175584       2950         X                   2000    0         950 MERCURY INTERACTIVE CORP,",589405109,3370368300.0,96434,1.52672467484902,2002-02-14,2001-12-31,0000922423-02-000202
N/A,"CAMECO CORP                        COM     13321L108000        6923298     276600         X                      0    0      272250 CARDIODYNAMICS INTERNATIONAL CORP                             COM     141597104000    2417032.555     380695         X                  21225    0      320702 CENDANT CORP,                      COM     151313103000          99050       5000         X                   5000    0           0 CENTENE CORP DEL                   COM     15135B101000       14383500     669000         X                      0    0      606960 CHAMPPS ENTERTAINMENT INC          COM     158787101000      8074831.5     903225         X                      0    0      831200 CHARLOTTE RUSSE HLDG INC           COM     161048103000      1131370.8      59640         X                   3125    0       51965 CHARTER COMMUNICATIONS INC DEL                              COM     16117M107000         323527      19031         X                     40    0       13990 CHICOS FAS INC,                    COM     168615102000    24493927.04     608696         X                  17050    0      530946 CHILES OFFSHORE INC                COM     16888M104000        1744956      90600         X                      0    0       78525 CIRCUIT CITY STORES INC ; CIRCUIT CITY GROUP               COM     172737108000    45761301.52    1762762         X                  68550    0     1636237 CIRCUIT CITY STORES INC CARMAX GROUP                     COM     172737306000      3655510.8     159490         X                  27450    0      119990 CLEAR CHANNEL COMMUNICATIONS, INC",184502102,3019003050.0,59115,1.3675616548729852,2002-02-14,2001-12-31,0000922423-02-000202
N/A,"EDUCATION MANAGEMENT CORP          COM     28139T101000     32240185.6     859280         X                  26728    0      760830 EFTC CORP                          COM     268443108000        1616309     950770         X                  97300    0      825937 EGL INC                            COM     268484102000        1988712     136400         X                      0    0      134150 ELLETT BROTHERS INC,               COM     288398100000     1037193.75     460975         X                 104500    0      353450 EMC CORP-MASS                      COM     268648102000     2923344.75     215745         X                  40755    0      158190 EMISPHERE TECHNOLOGIES INC,        COM     291345106000     2449500.75      74115         X                   4295    0       61850 ENDOCARE INC                       COM     29264P104000       357622.2      19890         X                    360    0       17610 EPRESENCE INC                      COM     294348107000         508750     125000         X                      0    0      125000 ERESEARCH TECHNOLOGY INC           COM     29481V108000         865650      72500         X                      0    0       72500 EXACT SCIENCES CORP                COM     30063P105000     4052817.75     397725         X                      0    0      354450 EXXON MOBIL CORP                   COM     30231G102000          47736       1200         X                      0    0        1200 FAIRMONT HOTELS & RESORTS          COM     305204109000       53627649    2262770         X                  76824    0     2024135 FAMOUS DAVES OF AMERICA INC        COM     307068106000      2968535.3     412870         X                  10045    0      341075 FASTENAL CO,                       COM     311900104000     23281305.6     346448         X                   6475    0      322414 FIDELITY NATIONAL FINANCIAL INC                              COM     316326107000    24925643.48    1000628         X                      0    0      973238 FLAGSTAR BANCORP INC               COM     337930101000     3359725.44     169341         X                  13745    0      141401 FLUOR CORP NEW ;                   COM     343412102000          52010       1400         X                   1400    0           0 GAIA                               COM     36268Q103000     4764566.25     225275         X                    675    0      189375 GEMSTAR TV GUIDE INTL INC          COM     36866W106000        91114.3       3130         X                      0    0        1425 GENERAL AMERICAN INVESTORS CO      COM     368802104000          43086       1290         X                      0    0        1290 GENSTAR THERAPEUTICS CORP          COM     37248D105000         595000     250000         X                      0    0      198825 GIVEN IMAGING                      COM     M52020100000     13021379.2     767770         X                  35115    0      679577 GUIDANT CORP,                      COM     401698105000        24800.4        498         X                      0    0           0 HCA INC                            COM     404119109000    19007675.71     496673         X                      0    0      467841 HCC INSURANCE HOLDINGS INC,        COM     404132102000     26524841.6     975178         X                  56655    0      822955 HEARTLAND EXPRESS INC              COM     422347104000     12419137.5     417450         X                      0    0      382375 HELATHEXTRAS INC                   COM     422211102000     6091330.96    1064918         X                  37030    0      866805 HIBBETT SPORTING GOODS INC,        COM     428565105000        2018346      69960         X                      0    0       57210 HISPANIC BROADCASTING COMPANY      COM     43357B104000      9519052.2     367815         X                  20350    0      333973 HOLLINGER INTERNATIONAL INC, CL A                             COM     435569108000          16704       1450         X                      0    0        1450 HOLLYWOOD ENTERTAINMENT CORP,      COM     436141105000     16673540.8    1104208         X                   3389    0      986375 HOTEL RESERVATIONS NETWORK INC     COM     441451101000       58234965    1235100         X                  29132    0     1111622 ICN PHARMACEUTICALS INC NEW ;      COM     448924100000          27225        825         X                      0    0           0 IMNY                               COM     44973Q103000        5100000     500000         X                      0    0      474050 IMPATH INC,                        COM     45255G101000     3887035.35      82335         X                   4380    0       69120 INDYMAC MTG HLDGS INC,             COM     456607100000    23402373.31    1000529         X                  70600    0      810985 INFOSPACE INC                      COM     45678T102000       108433.8      50670         X                      0    0       50670 INNOVEDA INC                       COM     45769F102000     2303051.63    1193291         X                  49300    0     1107641 INSIGHT COMMUNICATIONS INC         COM     45768V108000     11667653.5     484135         X                  25625    0      412950 INTEGRAL SYSTEMS INC-MD,",45810H107,1822560480.0,91494,0.8255916886652044,2002-02-14,2001-12-31,0000922423-02-000202
LDE,"LANDEC CORP,",514766104,1806131250.0,481635,0.8181495017594677,2002-02-14,2001-12-31,0000922423-02-000202
N/A,INTEREP NATL RADIO SALES INC       COM     45866V109000    2203433.985     495265         X                      0    0      477000 INTERNET CAPITAL GROUP INC         COM     46059C106000     4214791.25    3371833         X                   5375    0     2836186 INTUITIVE SURGICAL INC             COM     46120E107000      2738791.8     273060         X                      0    0      254610 INVERNESS MEDICAL INNOVATIONS      COM     46126P106000        1377000      75000         X                      0    0       73835 IPC HOLDINGS LTD                   COM     G4933P101000     11690459.7     395215         X                      0    0      379935 IVILLAGE INC,46588H105,920000000.0,500000,0.41674576065206237,2002-02-14,2001-12-31,0000922423-02-000202
N/A,"BERKSHIRE HATHAWAY INC-DEL CL B                             COM     084670207000       28398805      11465         X                    273    0       10282 BIG CITY RADIO INC-CL A,",089098107,331027500.0,287850,0.1499503340046202,2002-02-14,2001-12-31,0000922423-02-000202
MSFT,"MICRO COMPONENT TECHNOLOGY INC     COM     59479Q100000          75900      30000         X                      0    0       28465 MICROSOFT CORP,",594918104,291347900.0,4294,0.13197608934769675,2002-02-14,2001-12-31,0000922423-02-000202
