ticker,nameOfIssuer,cusip,value,shares,allocation_percent,filingDate,reportDate,accessionNumber
N/A,"AQUANTIVE INC                         COM    03839G105    21804383.1    2354685            X                  43248     0    2311437 ARCHER-DANIELS-MIDLAND CO             COM    039483102   83166142.98    6343718            X                 165900     0    6177818 AT ROAD INC                           COM    04648K105    1201690.25      89345            X                   1640     0      87705 BANKRATE INC                          COM    06646V108     1413937.2     101140            X                   7610     0      93530 BENIHANA INC-CL A,                    COM    082047200     3852205.7     355042            X                   1994     0     353048 BERKSHIRE HATHAWAY INC  CL B",084670207,948480000.0,380,36.88785195389174,2003-11-14,2003-09-30,0000922423-03-001262
FMCC,"FIRST CASH FINANCIAL SERVICES INC     COM    31942D107    2472563.29     123443            X                   2520     0     120923 FOREST LABORATORIES INC,              COM    345838106    28001045.1     544238            X                  14276     0     529962 FREDDIE MAC-VOTING COMMON (FORMERLY FEDERAL HOME LOAN",313400301,157050000.0,3000,6.107917035002001,2003-11-14,2003-09-30,0000922423-03-001262
N/A,"SCHNITZER STEEL INDUSTRIES INC CL A                                COM    806882106      27657.63        921            X                      0     0        921 SCP POOL CORP,                        COM    784028102    4469922.86     160673            X                  16676     0     143997 SEACOR SMIT INC, FORMERLY SECOR HOLDINGS INC",811904101,122978000.0,3400,4.7828043370294555,2003-11-14,2003-09-30,0000922423-03-001262
N/A,UNITED RETAIL GROUP INC               COM    911380103    3102784.53    1010679            X                   6155     0    1004524 UNITEDGLOBALCOM CL A                  COM    913247508     631804.55     103405            X                   5255     0      98150 USG CORP NEW ;                        COM    903293405    9605421.16     557159            X                     39     0     557120 VERITAS SOFTWARE CORP                 COM    923436109    31426752.8    1000852            X                  28640     0     972212 VIACOM INC-CL A,925524100,115200000.0,3000,4.48030590533098,2003-11-14,2003-09-30,0000922423-03-001262
BMY,"BLUE MARTINI SOFTWARE INC             COM    095698502    1525195.97     289411            X                    538     0     288873 BOSTON SCIENTIFIC CORP                COM    101137107      29651688     464760            X                  16109     0     448651 BRISTOL MYERS SQUIBB CO,",110122108,88527000.0,3450,3.442951743760727,2003-11-14,2003-09-30,0000922423-03-001262
N/A,"VIACOM INC-CL B,                      COM    925524308     2874261.8      75046            X                  20298     0      54748 VISTACARE INC                         COM    92839Y109   138307939.2    4418784            X                 102670     0    4316114 VITAL IMAGES INC                      COM    92846N104   8539008.792     456168            X                   9844     0     446324 VYYO INC NEW                          COM    918458209    1509113.52     354252            X                  11117     0     343135 W R BERKLEY CORP                      COM    084423102   261023137.1    7618889            X                 276018     0    7342871 W R GRACE & CO-DEL NEW                COM    38388F108     2986775.6     963476            X                    164     0     963312 WALT DISNEY CO HOLDING CO,            COM    254687106      26442.87       1311            X                      0     0       1311 WATCHGUARD TECHNOLOGIES INC           COM    941105108    3962835.95     740717            X                      0     0     740717 WEBMD CORP                            COM    94769M105   10984827.25    1227355            X                   2925     0    1224430 WESTERN DIGITAL CORP,                 COM    958102105   47383756.01    3676009            X                 106754     0    3569255 WHITE MTNS INS GROUP LTD COM          COM    G9618E107   31885876.33      80311            X                   1669     0      78642 WHOLE FOODS MARKET INC                COM    966837106     879348.48      15936            X                      0     0      15936 WILSONS LEATHER EXPERTS INC           COM    972463103    1844435.57     230843            X                      0     0     230843 WYETH COM",983024100,79384200.0,1722,3.087374132378261,2003-11-14,2003-09-30,0000922423-03-001262
N/A,SCHERING PLOUGH CORP,806605101,76200000.0,5000,2.9635356769637218,2003-11-14,2003-09-30,0000922423-03-001262
N/A,"MERIT MEDICAL SYSTEMS INC,            COM    589889104     5009760.6     226686            X                    327     0     226359 MICROCHIP TECHNOLOGY INC,             COM    595017104   14620373.46     610709            X                  18290     0     592419 MIKOHN GAMING CORP                    COM    59862K108      81857.92      15272            X                     20     0      15252 MILLIPORE CORP",601073109,72544500.0,1575,2.821367636712529,2003-11-14,2003-09-30,0000922423-03-001262
N/A,IDEC PHARMACEUTICALS CORP,449370105,63979500.0,1930,2.4882615596364883,2003-11-14,2003-09-30,0000922423-03-001262
N/A,"LAIDLAW INTERNATIONAL INC             COM    50730R102    5669413.75     575575            X                  57175     0     518400 LANDEC CORP,                          COM    514766104     1628530.8     417572            X                  15000     0     402572 LCA-VISION INC",501803308,63522400.0,4688,2.470484234729138,2003-11-14,2003-09-30,0000922423-03-001262
N/A,STARCRAFT CORP,855269106,63149900.0,1870,2.4559971344710148,2003-11-14,2003-09-30,0000922423-03-001262
N/A,"LIBERTY MEDIA CORP ; SER A NEW                               COM    530718105    5656329.95     567335            X                    500     0     566835 LIFECELL CORP                         COM    531927101    1415808.75     240375            X                   7745     0     232630 LIONBRIDGE TECHNOLOGIES INC           COM    536252109    4258335.22     567022            X                      0     0     567022 LITHIA MOTORS INC-CL A,               COM    536797103    3312523.75     165875            X                   3000     0     162875 LIVEPERSON INC                        COM    538146101   12640675.29    3031337            X                  66305     0    2965032 MAGNETEK INC                          COM    559424106    4020424.65     812207            X                    152     0     812055 MANOR CARE INC NEW ;                  COM    564055101     171660450    5722015            X                 118598     0    5603417 MARVEL ENTERPRISES INC",57383M108,57850000.0,2600,2.2498758387447677,2003-11-14,2003-09-30,0000922423-03-001262
XOM,ENCORE MEDICAL CORP                   COM    29256E109   5576507.154     819954            X                      0     0     819954 ENSTAR GROUP INC-GA                   COM    29358R107    3660337.25      93257            X                  12270     0      80987 EOG RES INC                           COM    26875P101     8313147.1     199165            X                   2885     0     196280 EXACT SCIENCES CORP                   COM    30063P105     5345230.5     395943            X                      0     0     395943 EXULT INC DEL                         COM    302284104    22015851.6    2738290            X                  35558     0    2702732 EXXON MOBIL CORP,30231G102,56730000.0,1550,2.2063173091096053,2003-11-14,2003-09-30,0000922423-03-001262
GE,FRIENDLY ICE CREAM CORP NEW           COM    358497105    3272282.75     410575            X                   8250     0     402325 FTI CONSULTING INC ;                  COM    302941109     1152872.8      66448            X                  18142     0      48306 GENENTECH INC COM NEW                 COM    368710406     128784.98       1607            X                      0     0       1607 GENERAL AMERICAN INVESTORS CO         COM    368802104      35901.94       1306            X                      0     0       1306 GENERAL ELECTRIC CO,369604103,55446600.0,1860,2.1564039011330274,2003-11-14,2003-09-30,0000922423-03-001262
N/A,BIG 5 SPORTING GOODS CORP             COM    08915P101   13218483.52     865084            X                  28835     0     836249 BINDVIEW DEVELOPMENT CORP             COM    090327107     2111523.6     779160            X                   2450     0     776710 BIO IMAGING TECHNOLOGIES INC,09056N103,53889000.0,7810,2.095826431704698,2003-11-14,2003-09-30,0000922423-03-001262
HL,"HALLIBURTON CO                        COM    406216101    3863922.25     159337            X                    550     0     158787 HCC INSURANCE HOLDINGS INC,           COM    404132102   11288361.64     388183            X                   9600     0     378583 HEARTLAND EXPRESS INC                 COM    422347104   29552958.96    1230348            X                  25183     0    1205165 HECLA MINING CO",422704106,50173000.0,9575,1.9513054530223204,2003-11-14,2003-09-30,0000922423-03-001262
HUP,***HUANENG POWER INTL INC SPONSORED ADR REPSTG 40 ORDDES3: SER N,443304100,48409500.0,885,1.882720214619098,2003-11-14,2003-09-30,0000922423-03-001262
N/A,"MAXTOR CORP (NEW)                     COM    577729205   52116223.84    4282352            X                   9437     0    4272915 MERCK & CO INC,",589331107,48089000.0,950,1.8702554746654647,2003-11-14,2003-09-30,0000922423-03-001262
N/A,"GEORGIA PACIFIC CORP, (GEORGIA PACIFIC GROUP)             COM    373298108      10835.28        447            X                      0     0        447 GETTY IMAGES INC,                     COM    374276103     7272670.2     206845            X                      0     0     206845 GUITAR CENTER INC",402040109,45345600.0,1410,1.7635604119859074,2003-11-14,2003-09-30,0000922423-03-001262
N/A,"LEVEL 3 COMMUNICATIONS INC,           COM    52729N100   111560835.6   20583180            X                 418488     0   20164692 LEXAR MEDIA INC",52886P104,36976800.0,2170,1.4380848559048838,2003-11-14,2003-09-30,0000922423-03-001262
AL21,AFC ENTERPRISES INC                   COM    00104Q107     5122569.2     318172            X                  10150     0     308022 AKAMAI TECHNOLOGIES INC               COM    00971T101   30314976.12    7066428            X                 214359     0    6852069 ALLSCRIPTS HEALTHCARE SOLUTIONS INC,01988P108,36597600.0,8970,1.4233371822998357,2003-11-14,2003-09-30,0000922423-03-001262
N/A,"RENT A CENTER INC-NEW                 COM    76009N100    11361395.8     351746            X                    875     0     350871 RESTORATION HARDWARE INC DEL,         COM    760981100    7983491.95    1374095            X                   2595     0    1371500 RIGHT MANAGEMENT CONSULTANTS INC                                 COM    766573109    6924169.92     382974            X                    776     0     382198 SAFETY INSURANCE GROUP INC            COM    78648T100   35888246.24    2312387            X                  58947     0    2253440 SBC COMMUNICATIONS INC",78387G103,34665500.0,1558,1.3481948295247492,2003-11-14,2003-09-30,0000922423-03-001262
DRI,"COVAD COMMUNICATIONS GROUP INC        COM    222814204    8571931.34    1550078            X                    643     0    1549435 CROWN HOLDINGS INC 144A               COM    228368106    2179959.75     322957            X                  10620     0     312337 CYBERONICS INC,                       COM    23251P102   17796221.36     576676            X                   2925     0     573751 DARDEN RESTAURANTS INC",237194105,21888000.0,1152,0.8512581220128863,2003-11-14,2003-09-30,0000922423-03-001262
N/A,CHESAPEAKE ENERGY CORP                COM    165167107   11132646.14    1032713            X                  67716     0     964997 CHINA FUND INC                        COM    169373107     117069.37       4453            X                      0     0       4453 CLEAN HARBORS INC                     COM    184496107     1075377.5     253030            X                  45730     0     207300 COGNIZANT TECHNOLOGY SOLUTIONS CORP-CL A                           COM    192446102    2997651.65      82195            X                   7595     0      74600 COMCAST CORPORATION NEW SPL CLASS A,20030N200,20678000.0,700,0.8041993533891841,2003-11-14,2003-09-30,0000922423-03-001262
STT,STATE STREET CORP,857477103,18000000.0,400,0.7000477977079658,2003-11-14,2003-09-30,0000922423-03-001262
N/A,"HELATHEXTRAS INC                      COM    422211102     5683719.3     660130            X                   7525     0     652605 HIBBETT SPORTING GOODS INC,           COM    428565105   10437181.04     436337            X                  19041     0     417296 HOLLINGER INTERNATIONAL INC CL A",435569108,17907500.0,1450,0.6964503298586331,2003-11-14,2003-09-30,0000922423-03-001262
N/A,MARVELL TECHNOLOGY GROUP,G5876H105,17365000.0,460,0.6753516670666013,2003-11-14,2003-09-30,0000922423-03-001262
SBUX,SPORTS AUTHORITY INC NEW              COM    84917U109    3647189.26     115931            X                  21429     0      94502 STARBUCKS CORP,855244109,16560000.0,575,0.6440439738913285,2003-11-14,2003-09-30,0000922423-03-001262
ED,"COMMERCE BANCORP INC-N.J.             COM    200519106   383674155.6    8008227            X                 190743     0    7817484 CONEXANT SYSTEMS INC                  COM    207142100    32524001.4    5746290            X                 128906     0    5617384 CONSOLIDATED EDISON INC,",209115104,16304000.0,400,0.6340877385461485,2003-11-14,2003-09-30,0000922423-03-001262
N/A,"ANCHOR GLASS CONTAINER CORP COM NEW                                 COM    03304B300      11594679     711330            X                  32185     0     679145 AOL TIME WARNER INC                   COM    00184A105    4256592.77     281707            X                    975     0     280732 AON CORP,",037389103,15012000.0,720,0.5838398632884434,2003-11-14,2003-09-30,0000922423-03-001262
N/A,UNITED ONLINE INC,911268100,13888000.0,400,0.5401257674760127,2003-11-14,2003-09-30,0000922423-03-001262
INTC,"IDINE REWARDS NETWORK INC             COM    45168A100    2825143.75     173855            X                   6435     0     167420 INCO LTD                              COM    453258402      38781735    1397540            X                  10950     0    1386590 INDYMAC MTG HLDGS INC,                COM    456607100    8614466.98     371794            X                  16570     0     355224 INFONOW CORPORATION                   COM    456664309      501974.1     356010            X                   2800     0     353210 INTEL CORP",458140100,13479900.0,490,0.5242541282402005,2003-11-14,2003-09-30,0000922423-03-001262
N/A,SEALED AIR CORP NEW                   COM    81211K100   16550383.83     350421            X                  22902     0     327519 SELECT COMFORT CORP OC-CAP STK,81616X103,13382500.0,505,0.520466091823714,2003-11-14,2003-09-30,0000922423-03-001262
DAIO,DATA I/O CORP,237690102,11600000.0,4000,0.45114191407846677,2003-11-14,2003-09-30,0000922423-03-001262
