ticker,nameOfIssuer,cusip,value,shares,allocation_percent,filingDate,reportDate,accessionNumber
VMI,VALMONT INDUSTRIES COMMON STOC,920253101,4485000.0,33240,0.013471857874632842,2014-11-12,2014-09-30,0001115418-14-000011
N/A,EXTERRAN HOLDINGS INC COMMON S,30225X103,4473000.0,100938,0.013435812769951552,2014-11-12,2014-09-30,0001115418-14-000011
WLY,WILEY (JOHN) + SONS CLASS A CO,968223206,4464000.0,79557,0.013408778941440583,2014-11-12,2014-09-30,0001115418-14-000011
N/A,ISIS PHARMACEUTICALS INC COMMO,464330109,4463000.0,114948,0.013405775182717142,2014-11-12,2014-09-30,0001115418-14-000011
DAR,DARLING INGREDIENTS,237266101,4454000.0,243120,0.013378741354206171,2014-11-12,2014-09-30,0001115418-14-000011
CAKE,CHEESECAKE FACTORY INC/THE COM,163072101,4444000.0,97675,0.013348703766971764,2014-11-12,2014-09-30,0001115418-14-000011
N/A,AMDOCS LTD COMMON STOCK GBP.00,G02602103,4432000.0,96605,0.01331265866229047,2014-11-12,2014-09-30,0001115418-14-000011
N/A,BALLY TECHNOLOGIES INC COMMON,05874B107,4424000.0,54815,0.013288628592502943,2014-11-12,2014-09-30,0001115418-14-000011
CBRL,CRACKER BARREL OLD COUNTRY COM,22410J106,4423000.0,42862,0.013285624833779501,2014-11-12,2014-09-30,0001115418-14-000011
N/A,CITY NATIONAL CORP COMMON STOC,178566105,4418000.0,58387,0.013270606040162298,2014-11-12,2014-09-30,0001115418-14-000011
N/A,VECTREN CORPORATION COMMON STO,92240G101,4403000.0,110345,0.013225549659310682,2014-11-12,2014-09-30,0001115418-14-000011
N/A,GREAT PLAINS ENERGY INC COMMON,391164100,4378000.0,181124,0.013150455691224658,2014-11-12,2014-09-30,0001115418-14-000011
N/A,COLFAX CORP COMMON STOCK USD.0,194014106,4358000.0,76494,0.013090380516755836,2014-11-12,2014-09-30,0001115418-14-000011
N/A,WGL HOLDINGS INC COMMON STOCK,92924F106,4346000.0,103184,0.013054335412074545,2014-11-12,2014-09-30,0001115418-14-000011
TKR,TIMKEN CO COMMON STOCK NPV,887389104,4345000.0,102504,0.013051331653351103,2014-11-12,2014-09-30,0001115418-14-000011
ERIE,ERIE INDEMNITY COMPANY CL A CO,29530P102,4335000.0,57183,0.013021294066116695,2014-11-12,2014-09-30,0001115418-14-000011
ISBCUSD,INVESTORS BANCORP INC COMMON S,46146L101,4332000.0,427682,0.01301228278994637,2014-11-12,2014-09-30,0001115418-14-000011
WBC1EUR,WABCO HOLDINGS INC COMMON STOC,92927K102,4325000.0,47552,0.012991256478882284,2014-11-12,2014-09-30,0001115418-14-000011
ORI,OLD REPUBLIC INTL CORP COMMON,680223104,4295000.0,300740,0.012901143717179054,2014-11-12,2014-09-30,0001115418-14-000011
N/A,COMPUWARE CORP COMMON STOCK US,205638109,4286000.0,403982,0.012874109888668085,2014-11-12,2014-09-30,0001115418-14-000011
OIS,OIL STATES INTERNATIONAL INC C,678026105,4280000.0,69151,0.012856087336327439,2014-11-12,2014-09-30,0001115418-14-000011
N/A,EXELIS INC,30162A108,4280000.0,258764,0.012856087336327439,2014-11-12,2014-09-30,0001115418-14-000011
TG7,TRIUMPH GROUP INC COMMON STOCK,896818101,4259000.0,65467,0.012793008403135178,2014-11-12,2014-09-30,0001115418-14-000011
N/A,CHICAGO BRIDGE + IRON NY SHR N,167250109,4255000.0,73547,0.012780993368241414,2014-11-12,2014-09-30,0001115418-14-000011
N/A,HOME PROPERTIES INC REIT USD.0,437306103,4250000.0,72980,0.012765974574624209,2014-11-12,2014-09-30,0001115418-14-000011
ACM,AECOM TECHNOLOGY CORP COMMON S,00766T100,4231000.0,125371,0.012708903158878833,2014-11-12,2014-09-30,0001115418-14-000011
N/A,SPRINT CORP COMMON,85207U105,4230000.0,667220,0.012705899400155391,2014-11-12,2014-09-30,0001115418-14-000011
HHC*,HOWARD HUGHES CORP/THE COMMON,44267D107,4218000.0,28122,0.0126698542954741,2014-11-12,2014-09-30,0001115418-14-000011
ALNY,ALNYLAM PHARMACEUTICALS INC CO,02043Q107,4208000.0,53880,0.012639816708239689,2014-11-12,2014-09-30,0001115418-14-000011
N/A,LIFE TIME FITNESS INC COMMON S,53217R207,4179000.0,82846,0.0125527077052599,2014-11-12,2014-09-30,0001115418-14-000011
N/A,CYTEC INDUSTRIES INC COMMON ST,232820100,4179000.0,88360,0.0125527077052599,2014-11-12,2014-09-30,0001115418-14-000011
DRH,DIAMONDROCK HOSPITALITY CO REI,252784301,4172000.0,329031,0.012531681394195813,2014-11-12,2014-09-30,0001115418-14-000011
N/A,VCA INC COMMON STOCK USD.001,918194101,4166000.0,105935,0.012513658841855168,2014-11-12,2014-09-30,0001115418-14-000011
CR1USD,CRANE CO COMMON STOCK USD1.,224399105,4148000.0,65627,0.01245959118483323,2014-11-12,2014-09-30,0001115418-14-000011
TXNM,PNM RESOURCES INC COMMON STOCK,69349H107,4144000.0,166339,0.012447576149939465,2014-11-12,2014-09-30,0001115418-14-000011
FHI,FEDERATED INVESTORS INC CL B C,314211103,4136000.0,140870,0.012423546080151938,2014-11-12,2014-09-30,0001115418-14-000011
N/A,RIVERBED TECHNOLOGY INC COMMON,768573107,4127000.0,222542,0.012396512251640969,2014-11-12,2014-09-30,0001115418-14-000011
BRSEUR,BRISTOW GROUP INC COMMON STOCK,110394103,4119000.0,61302,0.012372482181853443,2014-11-12,2014-09-30,0001115418-14-000011
CLH,CLEAN HARBORS INC COMMON STOCK,184496107,4114000.0,76302,0.012357463388236236,2014-11-12,2014-09-30,0001115418-14-000011
N/A,DST SYSTEMS INC COMMON STOCK U,233326107,4110000.0,48978,0.012345448353342472,2014-11-12,2014-09-30,0001115418-14-000011
N/A,PIEDMONT NATURAL GAS CO COMMON,720186105,4106000.0,122468,0.01233343331844871,2014-11-12,2014-09-30,0001115418-14-000011
FRCB,FIRST REPUBLIC BANK/SAN FRAN C,33616C100,4103000.0,83097,0.012324422042278384,2014-11-12,2014-09-30,0001115418-14-000011
TCBI,TEXAS CAPITAL BANCSHARES INC C,88224Q107,4095000.0,70995,0.012300391972490856,2014-11-12,2014-09-30,0001115418-14-000011
N/A,JANUS CAPITAL GROUP INC COMMON,47102X105,4073000.0,280134,0.012234309280575154,2014-11-12,2014-09-30,0001115418-14-000011
BKD,BROOKDALE SENIOR LIVING INC CO,112463104,4047000.0,125598,0.01215621155376569,2014-11-12,2014-09-30,0001115418-14-000011
UNTEUR,UNIT CORP COMMON STOCK USD.2,909218109,4034000.0,68783,0.012117162690360957,2014-11-12,2014-09-30,0001115418-14-000011
HUN,HUNTSMAN CORP COMMON STOCK USD,447011107,4034000.0,155220,0.012117162690360957,2014-11-12,2014-09-30,0001115418-14-000011
WPC,WP CAREY INC,92936U109,4031000.0,63218,0.012108151414190634,2014-11-12,2014-09-30,0001115418-14-000011
CBT,CABOT CORP COMMON STOCK USD1.,127055101,4027000.0,79316,0.01209613637929687,2014-11-12,2014-09-30,0001115418-14-000011
N/A,MENTOR GRAPHICS CORP COMMON ST,587200106,4027000.0,196474,0.01209613637929687,2014-11-12,2014-09-30,0001115418-14-000011
N/A,PARTNERRE LTD COMMON STOCK USD,G6852T105,4026000.0,36633,0.012093132620573429,2014-11-12,2014-09-30,0001115418-14-000011
SWX,SOUTHWEST GAS CORP COMMON STOC,844895102,4025000.0,82851,0.012090128861849988,2014-11-12,2014-09-30,0001115418-14-000011
CUBE,CUBESMART REIT USD.01,229663109,4021000.0,223646,0.012078113826956224,2014-11-12,2014-09-30,0001115418-14-000011
N/A,ATHENAHEALTH INC COMMON STOCK,04685W103,4020000.0,30526,0.012075110068232782,2014-11-12,2014-09-30,0001115418-14-000011
N/A,TEAM HEALTH HOLDINGS INC COMMO,87817A107,4003000.0,69023,0.012024046169934285,2014-11-12,2014-09-30,0001115418-14-000011
SEMGUSD,SEMGROUP CORP CLASS A COMMON S,81663A105,4000000.0,48036,0.012015034893763963,2014-11-12,2014-09-30,0001115418-14-000011
TYL,TYLER TECHNOLOGIES INC COMMON,902252105,3979000.0,45009,0.011951955960571702,2014-11-12,2014-09-30,0001115418-14-000011
CVLT,COMMVAULT SYSTEMS INC COMMON S,204166102,3963000.0,78624,0.011903895820996645,2014-11-12,2014-09-30,0001115418-14-000011
N/A,ASPEN INSURANCE HOLDINGS LTD C,G05384105,3955000.0,92471,0.011879865751209119,2014-11-12,2014-09-30,0001115418-14-000011
POR,PORTLAND GENERAL ELECTRIC CO C,736508847,3926000.0,122233,0.011792756748229329,2014-11-12,2014-09-30,0001115418-14-000011
JXC1,J GLOBAL INC,48123V102,3919000.0,79399,0.011771730437165243,2014-11-12,2014-09-30,0001115418-14-000011
KMT,KENNAMETAL INC COMMON STOCK US,489170100,3914000.0,94758,0.011756711643548037,2014-11-12,2014-09-30,0001115418-14-000011
SSYS,STRATASYS LTD,M85548101,3912000.0,32392,0.011750704126101156,2014-11-12,2014-09-30,0001115418-14-000011
AKRXEUR,AKORN INC COMMON STOCK NPV,009728106,3911000.0,107821,0.011747700367377715,2014-11-12,2014-09-30,0001115418-14-000011
LPX,LOUISIANA PACIFIC CORP COMMON,546347105,3909000.0,287609,0.011741692849930832,2014-11-12,2014-09-30,0001115418-14-000011
CATY,CATHAY GENERAL BANCORP COMMON,149150104,3904000.0,157240,0.011726674056313627,2014-11-12,2014-09-30,0001115418-14-000011
N/A,STANCORP FINANCIAL GROUP COMMO,852891100,3900000.0,61733,0.011714659021419863,2014-11-12,2014-09-30,0001115418-14-000011
SNV,SYNOVUS FINANCIAL CORP COMMON,87161C501,3899000.0,164949,0.011711655262696423,2014-11-12,2014-09-30,0001115418-14-000011
SHO,SUNSTONE HOTEL INVESTORS INC R,867892101,3868000.0,279905,0.011618538742269752,2014-11-12,2014-09-30,0001115418-14-000011
N/A,SOLARWINDS INC COMMON STOCK US,83416B109,3866000.0,91934,0.011612531224822871,2014-11-12,2014-09-30,0001115418-14-000011
N/A,AMTRUST FINANCIAL SERVICES COM,032359309,3863000.0,97013,0.011603519948652547,2014-11-12,2014-09-30,0001115418-14-000011
S9Q,SPIRIT AEROSYSTEMS HOLD CL A C,848574109,3847000.0,101078,0.011555459809077491,2014-11-12,2014-09-30,0001115418-14-000011
THG,HANOVER INSURANCE GROUP INC/ C,410867105,3845000.0,62596,0.011549452291630609,2014-11-12,2014-09-30,0001115418-14-000011
JCPCHF,J.C. PENNEY CO INC COMMON STOC,708160106,3837000.0,382127,0.01152542222184308,2014-11-12,2014-09-30,0001115418-14-000011
N/A,CONVERSANT INC,21249J105,3830000.0,111811,0.011504395910778994,2014-11-12,2014-09-30,0001115418-14-000011
TRGP,TARGA RESOURCES CORP COMMON ST,87612G101,3828000.0,28109,0.011498388393332112,2014-11-12,2014-09-30,0001115418-14-000011
N/A,ATWOOD OCEANICS INC COMMON STO,050095108,3822000.0,87474,0.011480365840991467,2014-11-12,2014-09-30,0001115418-14-000011
CMC,COMMERCIAL METALS CO COMMON ST,201723103,3804000.0,222824,0.011426298183969529,2014-11-12,2014-09-30,0001115418-14-000011
PANW,PALO ALTO NETWORKS INC,697435105,3791000.0,38642,0.011387249320564796,2014-11-12,2014-09-30,0001115418-14-000011
LXKEUR,LEXMARK INTERNATIONAL INC A CO,529771107,3778000.0,88898,0.011348200457160063,2014-11-12,2014-09-30,0001115418-14-000011
N/A,MARVELL TECHNOLOGY GROUP LTD C,G5876H105,3773000.0,279918,0.011333181663542857,2014-11-12,2014-09-30,0001115418-14-000011
WAFD,WASHINGTON FEDERAL INC COMMON,938824109,3770000.0,185172,0.011324170387372535,2014-11-12,2014-09-30,0001115418-14-000011
BOH,BANK OF HAWAII CORP COMMON STO,062540109,3770000.0,66363,0.011324170387372535,2014-11-12,2014-09-30,0001115418-14-000011
CSGP,COSTAR GROUP INC COMMON STOCK,22160N109,3762000.0,24186,0.011300140317585007,2014-11-12,2014-09-30,0001115418-14-000011
N/A,PEABODY ENERGY CORP COMMON STO,704549104,3760000.0,303756,0.011294132800138126,2014-11-12,2014-09-30,0001115418-14-000011
N/A,ROWAN COMPANIES PLC,G7665A101,3759000.0,148533,0.011291129041414683,2014-11-12,2014-09-30,0001115418-14-000011
ATUEUR,ACTUANT CORP A COMMON STOCK US,00508X203,3755000.0,123046,0.011279114006520919,2014-11-12,2014-09-30,0001115418-14-000011
DNKN,DUNKIN BRANDS GROUP INC COM,265504100,3742000.0,83488,0.011240065143116188,2014-11-12,2014-09-30,0001115418-14-000011
HRUSD,HEALTHCARE REALTY TRUST INC RE,421946104,3735000.0,157724,0.0112190388320521,2014-11-12,2014-09-30,0001115418-14-000011
N/A,INTERSIL CORP A COMMON STOCK U,46069S109,3734000.0,262785,0.01121603507332866,2014-11-12,2014-09-30,0001115418-14-000011
CASY,CASEY S GENERAL STORES INC COM,147528103,3727000.0,51986,0.011195008762264572,2014-11-12,2014-09-30,0001115418-14-000011
HE,HAWAIIAN ELECTRIC INDS COMMON,419870100,3713000.0,139854,0.011152956140136398,2014-11-12,2014-09-30,0001115418-14-000011
N/A,PANDORA MEDIA INC COM,698354107,3713000.0,153700,0.011152956140136398,2014-11-12,2014-09-30,0001115418-14-000011
N/A,LIFEPOINT HOSPITALS INC COMMON,53219L109,3708000.0,53593,0.011137937346519194,2014-11-12,2014-09-30,0001115418-14-000011
WKC,WORLD FUEL SERVICES CORP COMMO,981475106,3705000.0,92801,0.01112892607034887,2014-11-12,2014-09-30,0001115418-14-000011
IACIEUR,IAC/INTERACTIVECORP COMMON STO,44919P508,3693000.0,56039,0.011092880965667578,2014-11-12,2014-09-30,0001115418-14-000011
SAVEEUR,SPIRIT AIRLINES INC COMMON STO,848577102,3682000.0,53255,0.011059839619709728,2014-11-12,2014-09-30,0001115418-14-000011
TSA,ACI WORLDWIDE INC COMMON STOCK,004498101,3681000.0,196217,0.011056835860986287,2014-11-12,2014-09-30,0001115418-14-000011
JACK,JACK IN THE BOX INC COMMON STO,466367109,3667000.0,53769,0.011014783238858114,2014-11-12,2014-09-30,0001115418-14-000011
N/A,FIRST NIAGARA FINANCIAL GRP CO,33582V108,3664000.0,439877,0.01100577196268779,2014-11-12,2014-09-30,0001115418-14-000011
PLTEUR,PLANTRONICS INC COMMON STOCK U,727493108,3664000.0,76694,0.01100577196268779,2014-11-12,2014-09-30,0001115418-14-000011
N/A,BANK OF THE OZARKS COMMON STOC,063904106,3659000.0,116084,0.010990753169070585,2014-11-12,2014-09-30,0001115418-14-000011
VLY,VALLEY NATIONAL BANCORP COMMON,919794107,3655000.0,377159,0.01097873813417682,2014-11-12,2014-09-30,0001115418-14-000011
WSO,WATSCO INC COMMON STOCK USD.5,942622200,3643000.0,42269,0.01094269302949553,2014-11-12,2014-09-30,0001115418-14-000011
N/A,DYNEGY INC,26817R108,3640000.0,126129,0.010933681753325205,2014-11-12,2014-09-30,0001115418-14-000011
N/A,JDS UNIPHASE CORP COMMON STOCK,46612J507,3639000.0,284259,0.010930677994601765,2014-11-12,2014-09-30,0001115418-14-000011
N/A,HEALTHSOUTH CORP COMMON STOCK,421924309,3635000.0,98519,0.010918662959708,2014-11-12,2014-09-30,0001115418-14-000011
MIDD,MIDDLEBY CORP COMMON STOCK USD,596278101,3631000.0,41206,0.010906647924814238,2014-11-12,2014-09-30,0001115418-14-000011
CHE,CHEMED CORP COMMON STOCK USD1.,16359R103,3622000.0,35196,0.010879614096303267,2014-11-12,2014-09-30,0001115418-14-000011
N/A,COUSINS PROPERTIES INC REIT US,222795106,3617000.0,302689,0.010864595302686063,2014-11-12,2014-09-30,0001115418-14-000011
N/A,CST BRANDS INC,12646R105,3615000.0,100552,0.010858587785239182,2014-11-12,2014-09-30,0001115418-14-000011
N/A,TRIQUINT SEMICONDUCTOR INC COM,89674K103,3605000.0,189051,0.010828550198004772,2014-11-12,2014-09-30,0001115418-14-000011
N/A,INTEGRATED DEVICE TECH INC COM,458118106,3599000.0,225630,0.010810527645664125,2014-11-12,2014-09-30,0001115418-14-000011
MKTX,MARKETAXESS HOLDINGS INC COMMO,57060D108,3596000.0,58136,0.010801516369493802,2014-11-12,2014-09-30,0001115418-14-000011
N/A,FAIRCHILD SEMICONDUCTOR INTE C,303726103,3583000.0,230721,0.01076246750608907,2014-11-12,2014-09-30,0001115418-14-000011
FHN,FIRST HORIZON NATIONAL CORP CO,320517105,3573000.0,290962,0.010732429918854659,2014-11-12,2014-09-30,0001115418-14-000011
GHC,GRAHAM HOLDINGS CO,384637104,3572000.0,5106,0.010729426160131218,2014-11-12,2014-09-30,0001115418-14-000011
NVS,NOVARTIS AG ADR,66987V109,3558000.0,37795,0.010687373538003045,2014-11-12,2014-09-30,0001115418-14-000011
UMBF,UMB FINANCIAL CORP COMMON STOC,902788108,3552000.0,65118,0.0106693509856624,2014-11-12,2014-09-30,0001115418-14-000011
PEB,PEBBLEBROOK HOTEL TRUST REIT U,70509V100,3546000.0,94954,0.010651328433321752,2014-11-12,2014-09-30,0001115418-14-000011
WF2,WINTRUST FINANCIAL CORP COMMON,97650W108,3545000.0,79354,0.010648324674598312,2014-11-12,2014-09-30,0001115418-14-000011
DAN,DANA HOLDING CORP COMMON STOCK,235825205,3532000.0,184245,0.010609275811193579,2014-11-12,2014-09-30,0001115418-14-000011
N/A,ROCKWOOD HOLDINGS INC COMMON S,774415103,3525000.0,46111,0.010588249500129493,2014-11-12,2014-09-30,0001115418-14-000011
RDN,RADIAN GROUP INC COMMON STOCK,750236101,3517000.0,246662,0.010564219430341965,2014-11-12,2014-09-30,0001115418-14-000011
N/A,REALOGY HOLDINGS CORP,75605y106,3516000.0,94511,0.010561215671618523,2014-11-12,2014-09-30,0001115418-14-000011
N/A,CONVERGYS CORP COMMON STOCK NP,212485106,3512000.0,197075,0.01054920063672476,2014-11-12,2014-09-30,0001115418-14-000011
N/A,BANCORPSOUTH INC COMMON STOCK,059692103,3506000.0,174070,0.010531178084384113,2014-11-12,2014-09-30,0001115418-14-000011
SLCAUSD,US SILICA HOLDINGS INC COM,90346E103,3503000.0,56043,0.01052216680821379,2014-11-12,2014-09-30,0001115418-14-000011
AZPNUSD,ASPEN TECHNOLOGY INC COMMON ST,045327103,3489000.0,92490,0.010480114186085616,2014-11-12,2014-09-30,0001115418-14-000011
N/A,COBALT INTERNATIONAL ENERGY CO,19075F106,3488000.0,256435,0.010477110427362175,2014-11-12,2014-09-30,0001115418-14-000011
TRMK,TRUSTMARK CORP COMMON STOCK NP,898402102,3483000.0,151190,0.010462091633744971,2014-11-12,2014-09-30,0001115418-14-000011
AXE3EUR,ANIXTER INTERNATIONAL INC COMM,035290105,3481000.0,41033,0.010456084116298088,2014-11-12,2014-09-30,0001115418-14-000011
N/A,WASHINGTON PRIME GROUP,939647103,3469000.0,198471,0.010420039011616797,2014-11-12,2014-09-30,0001115418-14-000011
N/A,KODIAK OIL + GAS CORP COMMON S,50015Q100,3467000.0,255502,0.010414031494169914,2014-11-12,2014-09-30,0001115418-14-000011
OLN,OLIN CORP COMMON STOCK USD1.,680665205,3466000.0,137280,0.010411027735446473,2014-11-12,2014-09-30,0001115418-14-000011
SMG,SCOTTS MIRACLE GRO CO CL A COM,810186106,3442000.0,62587,0.01033893752608389,2014-11-12,2014-09-30,0001115418-14-000011
KBR,KBR INC COMMON STOCK USD.001,48242W106,3442000.0,182775,0.01033893752608389,2014-11-12,2014-09-30,0001115418-14-000011
N/A,DDR CORP COMMON STOCK,23317H102,3433000.0,205213,0.010311903697572922,2014-11-12,2014-09-30,0001115418-14-000011
N/A,STRATEGIC HOTELS + RESORTS I R,86272T106,3431000.0,294490,0.01030589618012604,2014-11-12,2014-09-30,0001115418-14-000011
N/A,SOVRAN SELF STORAGE INC REIT U,84610H108,3429000.0,46108,0.010299888662679156,2014-11-12,2014-09-30,0001115418-14-000011
BID,SOTHEBY S COMMON STOCK USD.01,835898107,3426000.0,95902,0.010290877386508834,2014-11-12,2014-09-30,0001115418-14-000011
NJR,NEW JERSEY RESOURCES CORP COMM,646025106,3426000.0,67829,0.010290877386508834,2014-11-12,2014-09-30,0001115418-14-000011
BUWA,BIO RAD LABORATORIES A COMMON,090572207,3425000.0,30205,0.010287873627785393,2014-11-12,2014-09-30,0001115418-14-000011
N/A,LIBERTY MEDIA CORP,531229102,3421000.0,72508,0.010275858592891629,2014-11-12,2014-09-30,0001115418-14-000011
GATX,GATX CORP COMMON STOCK USD.625,361448103,3413000.0,58478,0.010251828523104101,2014-11-12,2014-09-30,0001115418-14-000011
N/A,AXIALL CORP,05463D100,3412000.0,95286,0.01024882476438066,2014-11-12,2014-09-30,0001115418-14-000011
BIGGQ,BIG LOTS INC COMMON STOCK USD.,089302103,3412000.0,79248,0.01024882476438066,2014-11-12,2014-09-30,0001115418-14-000011
RRX,REGAL BELOIT CORP COMMON STOCK,758750103,3406000.0,53006,0.010230802212040015,2014-11-12,2014-09-30,0001115418-14-000011
N/A,SUPERVALU INC COMMON STOCK USD,868536103,3398000.0,380097,0.010206772142252487,2014-11-12,2014-09-30,0001115418-14-000011
CRREUR,CARBO CERAMICS INC COMMON STOC,140781105,3393000.0,57281,0.010191753348635282,2014-11-12,2014-09-30,0001115418-14-000011
PCRX,PACIRA PHARMACEUTICALS INC COM,695127100,3393000.0,35008,0.010191753348635282,2014-11-12,2014-09-30,0001115418-14-000011
MTN,VAIL RESORTS INC COMMON STOCK,91879Q109,3377000.0,38919,0.010143693209060224,2014-11-12,2014-09-30,0001115418-14-000011
ANF,ABERCROMBIE + FITCH CO CL A CO,002896207,3374000.0,92842,0.010134681932889902,2014-11-12,2014-09-30,0001115418-14-000011
ASB,ASSOCIATED BANC CORP COMMON ST,045487105,3371000.0,193505,0.01012567065671958,2014-11-12,2014-09-30,0001115418-14-000011
N/A,CABELA S INC COMMON STOCK USD.,126804301,3351000.0,56893,0.010065595482250759,2014-11-12,2014-09-30,0001115418-14-000011
N/A,HSN INC COMMON STOCK USD.01,404303109,3350000.0,54584,0.010062591723527319,2014-11-12,2014-09-30,0001115418-14-000011
N/A,QIAGEN N.V. COMMON STOCK EUR.0,N72482107,3350000.0,147126,0.010062591723527319,2014-11-12,2014-09-30,0001115418-14-000011
AMD,ADVANCED MICRO DEVICES COMMON,007903107,3343000.0,980275,0.01004156541246323,2014-11-12,2014-09-30,0001115418-14-000011
MPW,MEDICAL PROPERTIES TRUST INC R,58463J304,3343000.0,272669,0.01004156541246323,2014-11-12,2014-09-30,0001115418-14-000011
MLKN,HERMAN MILLER INC COMMON STOCK,600544100,3323000.0,111308,0.009981490237994411,2014-11-12,2014-09-30,0001115418-14-000011
N/A,BROCADE COMMUNICATIONS SYS COM,111621306,3307000.0,304271,0.009933430098419356,2014-11-12,2014-09-30,0001115418-14-000011
SGENEUR,SEATTLE GENETICS INC COMMON ST,812578102,3305000.0,88889,0.009927422580972475,2014-11-12,2014-09-30,0001115418-14-000011
NUS,NU SKIN ENTERPRISES INC   A CO,67018T105,3304000.0,73369,0.009924418822249034,2014-11-12,2014-09-30,0001115418-14-000011
WOR,WORTHINGTON INDUSTRIES COMMON,981811102,3304000.0,88772,0.009924418822249034,2014-11-12,2014-09-30,0001115418-14-000011
N/A,CEPHEID INC COMMON STOCK NPV,15670R107,3302000.0,74984,0.00991841130480215,2014-11-12,2014-09-30,0001115418-14-000011
N/A,CORPORATE EXECUTIVE BOARD CO C,21988R102,3301000.0,54953,0.009915407546078711,2014-11-12,2014-09-30,0001115418-14-000011
SBH,SALLY BEAUTY HOLDINGS INC COMM,79546E104,3301000.0,120592,0.009915407546078711,2014-11-12,2014-09-30,0001115418-14-000011
HXL,HEXCEL CORP COMMON STOCK USD.0,428291108,3300000.0,83114,0.00991240378735527,2014-11-12,2014-09-30,0001115418-14-000011
MANH,MANHATTAN ASSOCIATES INC COMMO,562750109,3300000.0,98757,0.00991240378735527,2014-11-12,2014-09-30,0001115418-14-000011
TTWO,TAKE TWO INTERACTIVE SOFTWRE C,874054109,3299000.0,143020,0.009909400028631828,2014-11-12,2014-09-30,0001115418-14-000011
TTC,TORO CO COMMON STOCK USD1.,891092108,3291000.0,55566,0.0098853699588443,2014-11-12,2014-09-30,0001115418-14-000011
AXS,AXIS CAPITAL HOLDINGS LTD COMM,G0692U109,3288000.0,69466,0.009876358682673978,2014-11-12,2014-09-30,0001115418-14-000011
VOYA,VOYA FINANACIAL INC,929089100,3288000.0,84087,0.009876358682673978,2014-11-12,2014-09-30,0001115418-14-000011
GPK,GRAPHIC PACKAGING HOLDING CO C,388689101,3286000.0,264396,0.009870351165227095,2014-11-12,2014-09-30,0001115418-14-000011
N/A,ANN INC COMMON STOCK USD.0068,035623107,3281000.0,79776,0.00985533237160989,2014-11-12,2014-09-30,0001115418-14-000011
N/A,RITE AID CORP COMMON STOCK USD,767754104,3280000.0,677734,0.009852328612886449,2014-11-12,2014-09-30,0001115418-14-000011
OGS,ONE GAS INC,68235P108,3273000.0,95567,0.009831302301822362,2014-11-12,2014-09-30,0001115418-14-000011
SYNA,SYNAPTICS INC COMMON STOCK USD,87157D109,3257000.0,44490,0.009783242162247307,2014-11-12,2014-09-30,0001115418-14-000011
UPBD,RENT A CENTER INC COMMON STOCK,76009N100,3255000.0,107261,0.009777234644800424,2014-11-12,2014-09-30,0001115418-14-000011
N/A,DCT INDUSTRIAL TRUST INC REIT,233153105,3252000.0,433014,0.009768223368630102,2014-11-12,2014-09-30,0001115418-14-000011
OASEUR,OASIS PETROLEUM INC COMMON STO,674215108,3247000.0,77672,0.009753204575012896,2014-11-12,2014-09-30,0001115418-14-000011
N/A,CON WAY INC COMMON STOCK USD.6,205944101,3247000.0,68354,0.009753204575012896,2014-11-12,2014-09-30,0001115418-14-000011
VRE,MACK CALI REALTY CORP REIT USD,554489104,3237000.0,169393,0.009723166987778486,2014-11-12,2014-09-30,0001115418-14-000011
UBSI,UNITED BANKSHARES INC COMMON S,909907107,3224000.0,104247,0.009684118124373753,2014-11-12,2014-09-30,0001115418-14-000011
RLI,RLI CORP COMMON STOCK USD1.,749607107,3221000.0,74416,0.00967510684820343,2014-11-12,2014-09-30,0001115418-14-000011
LXP,LEXINGTON REALTY TRUST REIT US,529043101,3214000.0,328329,0.009654080537139344,2014-11-12,2014-09-30,0001115418-14-000011
N/A,PRIVATEBANCORP INC COMMON STOC,742962103,3202000.0,107053,0.009618035432458052,2014-11-12,2014-09-30,0001115418-14-000011
WWW,WOLVERINE WORLD WIDE INC COMMO,978097103,3200000.0,127701,0.00961202791501117,2014-11-12,2014-09-30,0001115418-14-000011
N/A,DEVRY EDUCATION GROUP COMMON S,251893103,3195000.0,74634,0.009597009121393964,2014-11-12,2014-09-30,0001115418-14-000011
AIT,APPLIED INDUSTRIAL TECH INC CO,03820C105,3194000.0,69958,0.009594005362670525,2014-11-12,2014-09-30,0001115418-14-000011
BCPC,BALCHEM CORP COMMON STOCK USD.,057665200,3193000.0,56438,0.009591001603947083,2014-11-12,2014-09-30,0001115418-14-000011
FICO,FAIR ISAAC CORP COMMON STOCK U,303250104,3190000.0,57900,0.009581990327776761,2014-11-12,2014-09-30,0001115418-14-000011
AMSGEUR,AMSURG CORP COMMON STOCK NPV,03232P405,3185000.0,63627,0.009566971534159556,2014-11-12,2014-09-30,0001115418-14-000011
ALE,ALLETE INC COMMON STOCK NPV,018522300,3159000.0,71171,0.00948887380735009,2014-11-12,2014-09-30,0001115418-14-000011
MDPUSD,MEREDITH CORP COMMON STOCK USD,589433101,3153000.0,73670,0.009470851255009443,2014-11-12,2014-09-30,0001115418-14-000011
MUSA,MURPHY USA INC,626755102,3139000.0,59168,0.009428798632881269,2014-11-12,2014-09-30,0001115418-14-000011
FFIN,FIRST FINL BANKSHARES INC COMM,32020R109,3137000.0,112872,0.009422791115434388,2014-11-12,2014-09-30,0001115418-14-000011
ALEX,ALEXANDER + BALDWIN HOLDINGS I,014491104,3136000.0,87181,0.009419787356710948,2014-11-12,2014-09-30,0001115418-14-000011
CLGX,CORELOGIC INC COMMON STOCK USD,21871D103,3133000.0,115733,0.009410776080540624,2014-11-12,2014-09-30,0001115418-14-000011
HRC,HILL ROM HOLDINGS INC COMMON S,431475102,3125000.0,75437,0.009386746010753096,2014-11-12,2014-09-30,0001115418-14-000011
N/A,UIL HOLDINGS CORP COMMON STOCK,902748102,3124000.0,88239,0.009383742252029655,2014-11-12,2014-09-30,0001115418-14-000011
DBDEUR,DIEBOLD INC COMMON STOCK USD1.,253651103,3119000.0,88306,0.009368723458412451,2014-11-12,2014-09-30,0001115418-14-000011
GBCI,GLACIER BANCORP INC COMMON STO,37637Q105,3119000.0,120606,0.009368723458412451,2014-11-12,2014-09-30,0001115418-14-000011
KMPR,KEMPER CORP COMMON STOCK USD.1,488401100,3110000.0,91074,0.009341689629901482,2014-11-12,2014-09-30,0001115418-14-000011
N/A,APOLLO EDUCATION GROUP INC.,037604105,3099000.0,123202,0.00930864828394363,2014-11-12,2014-09-30,0001115418-14-000011
DXCM,DEXCOM INC COMMON STOCK USD.00,252131107,3099000.0,77495,0.00930864828394363,2014-11-12,2014-09-30,0001115418-14-000011
N/A,TCF FINANCIAL CORP COMMON STOC,872275102,3097000.0,199426,0.009302640766496749,2014-11-12,2014-09-30,0001115418-14-000011
FULT,FULTON FINANCIAL CORP COMMON S,360271100,3081000.0,278102,0.009254580626921692,2014-11-12,2014-09-30,0001115418-14-000011
