ticker,nameOfIssuer,cusip,value,shares,allocation_percent,filingDate,reportDate,accessionNumber
QEP,QEP RESOURCES INC COMMON STOCK,74733V100,4727000.0,233765,0.013732005176039251,2015-02-06,2014-12-31,0001115418-15-000002
LSTR,LANDSTAR SYSTEM INC COMMON STO,515098101,4720000.0,65072,0.013711670072118735,2015-02-06,2014-12-31,0001115418-15-000002
CAKE,CHEESECAKE FACTORY INC/THE COM,163072101,4714000.0,93703,0.013694239983044008,2015-02-06,2014-12-31,0001115418-15-000002
FHI,FEDERATED INVESTORS INC CL B C,314211103,4707000.0,142925,0.013673904879123495,2015-02-06,2014-12-31,0001115418-15-000002
TPD,TEMPUR SEALY INTERNATIONAL INC,88023U101,4705000.0,85683,0.01366809484943192,2015-02-06,2014-12-31,0001115418-15-000002
CMP,COMPASS MINERALS INTERNATION C,20451N101,4699000.0,54114,0.013650664760357192,2015-02-06,2014-12-31,0001115418-15-000002
HLX,HELIX ENERGY SOLUTIONS GROUP C,42330P107,4696000.0,216408,0.013641949715819827,2015-02-06,2014-12-31,0001115418-15-000002
GHC,GRAHAM HOLDINGS CO,384637104,4675000.0,5413,0.013580944404058281,2015-02-06,2014-12-31,0001115418-15-000002
MUSA,MURPHY USA INC,626755102,4673000.0,67863,0.013575134374366705,2015-02-06,2014-12-31,0001115418-15-000002
N/A,AMDOCS LTD COMMON STOCK GBP.00,G02602103,4667000.0,100040,0.013557704285291978,2015-02-06,2014-12-31,0001115418-15-000002
ENS,ENERSYS COMMON STOCK USD.01,29275Y102,4666000.0,75597,0.013554799270446193,2015-02-06,2014-12-31,0001115418-15-000002
N/A,LIFE TIME FITNESS INC COMMON S,53217R207,4662000.0,82341,0.013543179211063041,2015-02-06,2014-12-31,0001115418-15-000002
N/A,SOLARWINDS INC COMMON STOCK US,83416B109,4659000.0,93494,0.013534464166525676,2015-02-06,2014-12-31,0001115418-15-000002
N/A,JANUS CAPITAL GROUP INC COMMON,47102X105,4656000.0,288642,0.013525749121988314,2015-02-06,2014-12-31,0001115418-15-000002
ALLY,ALLY FINANCIAL INC,02005N100,4650000.0,196877,0.013508319032913586,2015-02-06,2014-12-31,0001115418-15-000002
WPC,WP CAREY INC,92936U109,4626000.0,65993,0.013438598676614677,2015-02-06,2014-12-31,0001115418-15-000002
N/A,SPX CORP COMMON STOCK USD10.,784635104,4617000.0,53732,0.013412453543002587,2015-02-06,2014-12-31,0001115418-15-000002
SNV,SYNOVUS FINANCIAL CORP COMMON,87161C501,4599000.0,169759,0.013360163275778403,2015-02-06,2014-12-31,0001115418-15-000002
N/A,ALLIANT TECHSYSTEMS INC COMMON,018804104,4593000.0,39508,0.013342733186703676,2015-02-06,2014-12-31,0001115418-15-000002
CASY,CASEY S GENERAL STORES INC COM,147528103,4591000.0,50831,0.0133369231570121,2015-02-06,2014-12-31,0001115418-15-000002
N/A,DST SYSTEMS INC COMMON STOCK U,233326107,4580000.0,48644,0.013304967993708436,2015-02-06,2014-12-31,0001115418-15-000002
SCCO,SOUTHERN COPPER CORP COMMON ST,84265V105,4576000.0,162274,0.013293347934325284,2015-02-06,2014-12-31,0001115418-15-000002
THG,HANOVER INSURANCE GROUP INC/ C,410867105,4566000.0,64026,0.013264297785867405,2015-02-06,2014-12-31,0001115418-15-000002
ORI,OLD REPUBLIC INTL CORP COMMON,680223104,4566000.0,312065,0.013264297785867405,2015-02-06,2014-12-31,0001115418-15-000002
N/A,EXELIS INC,30162A108,4535000.0,258724,0.013174242325647982,2015-02-06,2014-12-31,0001115418-15-000002
N/A,SUPERIOR ENERGY SERVICES INC C,868157108,4533000.0,224976,0.013168432295956406,2015-02-06,2014-12-31,0001115418-15-000002
N/A,RIVERBED TECHNOLOGY INC COMMON,768573107,4504000.0,220682,0.013084186865428558,2015-02-06,2014-12-31,0001115418-15-000002
FRCB,FIRST REPUBLIC BANK/SAN FRAN C,33616C100,4502000.0,86387,0.013078376835736982,2015-02-06,2014-12-31,0001115418-15-000002
TUP,TUPPERWARE BRANDS CORP COMMON,899896104,4501000.0,71447,0.013075471820891194,2015-02-06,2014-12-31,0001115418-15-000002
DAR,DARLING INGREDIENTS,237266101,4499000.0,247759,0.013069661791199618,2015-02-06,2014-12-31,0001115418-15-000002
DECK,DECKERS OUTDOOR CORP COMMON ST,243537107,4497000.0,49391,0.013063851761508042,2015-02-06,2014-12-31,0001115418-15-000002
DDD,3D SYSTEMS CORP COMMON STOCK U,88554D205,4490000.0,136592,0.013043516657587528,2015-02-06,2014-12-31,0001115418-15-000002
TG7,TRIUMPH GROUP INC COMMON STOCK,896818101,4489000.0,66777,0.013040611642741739,2015-02-06,2014-12-31,0001115418-15-000002
CSGP,COSTAR GROUP INC COMMON STOCK,22160N109,4484000.0,24417,0.0130260865685128,2015-02-06,2014-12-31,0001115418-15-000002
N/A,CST BRANDS INC,12646R105,4476000.0,102627,0.013002846449746495,2015-02-06,2014-12-31,0001115418-15-000002
WKC,WORLD FUEL SERVICES CORP COMMO,981475106,4457000.0,94961,0.012947651167676528,2015-02-06,2014-12-31,0001115418-15-000002
N/A,LIBERTY VENTURES SER A COM,53071M880,4457000.0,118165,0.012947651167676528,2015-02-06,2014-12-31,0001115418-15-000002
N/A,ATHENAHEALTH INC COMMON STOCK,04685W103,4440000.0,30472,0.012898265915298133,2015-02-06,2014-12-31,0001115418-15-000002
N/A,INTEGRATED DEVICE TECH INC COM,458118106,4424000.0,225716,0.012851785677765529,2015-02-06,2014-12-31,0001115418-15-000002
BND,VANGUARD TOTAL BOND MARKET ETF,921937835,4415000.0,53601,0.012825640544153437,2015-02-06,2014-12-31,0001115418-15-000002
N/A,PARTNERRE LTD COMMON STOCK USD,G6852T105,4405000.0,38595,0.012796590395695558,2015-02-06,2014-12-31,0001115418-15-000002
N/A,MENTOR GRAPHICS CORP COMMON ST,587200106,4385000.0,200035,0.012738490098779802,2015-02-06,2014-12-31,0001115418-15-000002
N/A,RR DONNELLEY + SONS CO COMMON,257867101,4341000.0,258292,0.012610669445565133,2015-02-06,2014-12-31,0001115418-15-000002
N/A,STANCORP FINANCIAL GROUP COMMO,852891100,4339000.0,62103,0.012604859415873557,2015-02-06,2014-12-31,0001115418-15-000002
N/A,BANK OF THE OZARKS COMMON STOC,063904106,4318000.0,113879,0.012543854104112013,2015-02-06,2014-12-31,0001115418-15-000002
FSLR,FIRST SOLAR INC COMMON STOCK U,336433107,4307000.0,96578,0.012511898940808348,2015-02-06,2014-12-31,0001115418-15-000002
TEX,TEREX CORP COMMON STOCK USD.01,880779103,4300000.0,154221,0.01249156383688783,2015-02-06,2014-12-31,0001115418-15-000002
HRUSD,HEALTHCARE REALTY TRUST INC RE,421946104,4297000.0,157283,0.01248284879235047,2015-02-06,2014-12-31,0001115418-15-000002
N/A,REALOGY HOLDINGS CORP,75605y106,4287000.0,96351,0.01245379864389259,2015-02-06,2014-12-31,0001115418-15-000002
N/A,DCT INDUSTRIAL TRUST INC REIT,233153204,4272000.0,119785,0.012410223421205771,2015-02-06,2014-12-31,0001115418-15-000002
N/A,APOLLO EDUCATION GROUP INC.,037604105,4265000.0,125022,0.012389888317285255,2015-02-06,2014-12-31,0001115418-15-000002
NJR,NEW JERSEY RESOURCES CORP COMM,646025106,4252000.0,69479,0.012352123124290015,2015-02-06,2014-12-31,0001115418-15-000002
NWE,NORTHWESTERN CORP COMMON STOCK,668074305,4244000.0,75017,0.012328883005523712,2015-02-06,2014-12-31,0001115418-15-000002
WAFD,WASHINGTON FEDERAL INC COMMON,938824109,4221000.0,190575,0.012262067664070592,2015-02-06,2014-12-31,0001115418-15-000002
DAN,DANA HOLDING CORP COMMON STOCK,235825205,4215000.0,193876,0.012244637574995864,2015-02-06,2014-12-31,0001115418-15-000002
RDN,RADIAN GROUP INC COMMON STOCK,750236101,4215000.0,252076,0.012244637574995864,2015-02-06,2014-12-31,0001115418-15-000002
N/A,CYTEC INDUSTRIES INC COMMON ST,232820100,4197000.0,90895,0.012192347307771682,2015-02-06,2014-12-31,0001115418-15-000002
VMI,VALMONT INDUSTRIES COMMON STOC,920253101,4193000.0,33018,0.01218072724838853,2015-02-06,2014-12-31,0001115418-15-000002
DXCM,DEXCOM INC COMMON STOCK USD.00,252131107,4191000.0,76130,0.012174917218696955,2015-02-06,2014-12-31,0001115418-15-000002
WSO,WATSCO INC COMMON STOCK USD.5,942622200,4172000.0,38987,0.012119721936626984,2015-02-06,2014-12-31,0001115418-15-000002
N/A,SUSQUEHANNA BANCSHARES INC COM,869099101,4172000.0,310661,0.012119721936626984,2015-02-06,2014-12-31,0001115418-15-000002
CATY,CATHAY GENERAL BANCORP COMMON,149150104,4165000.0,162751,0.01209938683270647,2015-02-06,2014-12-31,0001115418-15-000002
MIDD,MIDDLEBY CORP COMMON STOCK USD,596278101,4157000.0,41946,0.012076146713940167,2015-02-06,2014-12-31,0001115418-15-000002
JACK,JACK IN THE BOX INC COMMON STO,466367109,4142000.0,51799,0.01203257149125335,2015-02-06,2014-12-31,0001115418-15-000002
OGS,ONE GAS INC,68235P108,4140000.0,100442,0.012026761461561774,2015-02-06,2014-12-31,0001115418-15-000002
N/A,AXIALL CORP,05463D100,4140000.0,97486,0.012026761461561774,2015-02-06,2014-12-31,0001115418-15-000002
N/A,MARVELL TECHNOLOGY GROUP LTD C,G5876H105,4136000.0,285228,0.01201514140217862,2015-02-06,2014-12-31,0001115418-15-000002
PBYI,PUMA BIOTECHNOLOGY INC,74587V107,4093000.0,21623,0.011890225763809742,2015-02-06,2014-12-31,0001115418-15-000002
LDOS,LEIDOS HOLDINGS INC,525327102,4089000.0,93956,0.011878605704426592,2015-02-06,2014-12-31,0001115418-15-000002
N/A,CONVERGYS CORP COMMON STOCK NP,212485106,4085000.0,200526,0.01186698564504344,2015-02-06,2014-12-31,0001115418-15-000002
BRSEUR,BRISTOW GROUP INC COMMON STOCK,110394103,4081000.0,62027,0.011855365585660289,2015-02-06,2014-12-31,0001115418-15-000002
MKTX,MARKETAXESS HOLDINGS INC COMMO,57060D108,4081000.0,56906,0.011855365585660289,2015-02-06,2014-12-31,0001115418-15-000002
N/A,PAREXEL INTERNATIONAL CORP COM,699462107,4072000.0,73286,0.011829220452048199,2015-02-06,2014-12-31,0001115418-15-000002
SAVEEUR,SPIRIT AIRLINES INC COMMON STO,848577102,4056000.0,53665,0.011782740214515591,2015-02-06,2014-12-31,0001115418-15-000002
VLY,VALLEY NATIONAL BANCORP COMMON,919794107,4055000.0,417608,0.011779835199669804,2015-02-06,2014-12-31,0001115418-15-000002
RRX,REGAL BELOIT CORP COMMON STOCK,758750103,4054000.0,53906,0.011776930184824015,2015-02-06,2014-12-31,0001115418-15-000002
DNREUR,DENBURY RESOURCES INC COMMON S,247916208,4051000.0,498217,0.011768215140286652,2015-02-06,2014-12-31,0001115418-15-000002
UBSI,UNITED BANKSHARES INC COMMON S,909907107,4043000.0,107960,0.01174497502152035,2015-02-06,2014-12-31,0001115418-15-000002
FHN,FIRST HORIZON NATIONAL CORP CO,320517105,4042000.0,297652,0.011742070006674562,2015-02-06,2014-12-31,0001115418-15-000002
N/A,UIL HOLDINGS CORP COMMON STOCK,902748102,4027000.0,92489,0.011698494783987745,2015-02-06,2014-12-31,0001115418-15-000002
N/A,BANCORPSOUTH INC COMMON STOCK,059692103,4011000.0,178173,0.011652014546455137,2015-02-06,2014-12-31,0001115418-15-000002
N/A,FAIRCHILD SEMICONDUCTOR INTE C,303726103,4011000.0,237593,0.011652014546455137,2015-02-06,2014-12-31,0001115418-15-000002
N/A,HSN INC COMMON STOCK USD.01,404303109,4006000.0,52709,0.011637489472226198,2015-02-06,2014-12-31,0001115418-15-000002
MDPUSD,MEREDITH CORP COMMON STOCK USD,589433101,4000000.0,73640,0.011620059383151471,2015-02-06,2014-12-31,0001115418-15-000002
N/A,LIBERTY MEDIA CORP - C SHARES,531229300,3996000.0,114076,0.01160843932376832,2015-02-06,2014-12-31,0001115418-15-000002
N/A,ASPEN INSURANCE HOLDINGS LTD C,G05384105,3982000.0,90976,0.01156776911592729,2015-02-06,2014-12-31,0001115418-15-000002
DNOW,NOW INC COM,67011P100,3978000.0,154621,0.011556149056544139,2015-02-06,2014-12-31,0001115418-15-000002
N/A,JDS UNIPHASE CORP COMMON STOCK,46612J507,3975000.0,289759,0.011547434012006775,2015-02-06,2014-12-31,0001115418-15-000002
CVLT,COMMVAULT SYSTEMS INC COMMON S,204166102,3974000.0,76889,0.011544528997160986,2015-02-06,2014-12-31,0001115418-15-000002
CR1USD,CRANE CO COMMON STOCK USD1.,224399105,3964000.0,67532,0.011515478848703109,2015-02-06,2014-12-31,0001115418-15-000002
BOH,BANK OF HAWAII CORP COMMON STO,062540109,3961000.0,66793,0.011506763804165744,2015-02-06,2014-12-31,0001115418-15-000002
N/A,STRATEGIC HOTELS + RESORTS I R,86272T106,3956000.0,299025,0.011492238729936806,2015-02-06,2014-12-31,0001115418-15-000002
N/A,WHITING PETROLEUM CORP COMMON,966387102,3955000.0,119849,0.011489333715091017,2015-02-06,2014-12-31,0001115418-15-000002
MPW,MEDICAL PROPERTIES TRUST INC R,58463J304,3945000.0,286274,0.01146028356663314,2015-02-06,2014-12-31,0001115418-15-000002
ALE,ALLETE INC COMMON STOCK NPV,018522300,3937000.0,71401,0.011437043447866837,2015-02-06,2014-12-31,0001115418-15-000002
N/A,COLFAX CORP COMMON STOCK USD.0,194014106,3933000.0,76264,0.011425423388483683,2015-02-06,2014-12-31,0001115418-15-000002
N/A,LIFEPOINT HOSPITALS INC COMMON,53219L109,3931000.0,54663,0.011419613358792107,2015-02-06,2014-12-31,0001115418-15-000002
UPBD,RENT A CENTER INC COMMON STOCK,76009N100,3927000.0,108116,0.011407993299408958,2015-02-06,2014-12-31,0001115418-15-000002
SMG,SCOTTS MIRACLE GRO CO CL A COM,810186106,3920000.0,62897,0.011387658195488442,2015-02-06,2014-12-31,0001115418-15-000002
N/A,SOVRAN SELF STORAGE INC REIT U,84610H108,3916000.0,44903,0.01137603813610529,2015-02-06,2014-12-31,0001115418-15-000002
N/A,INTERSIL CORP A COMMON STOCK U,46069S109,3908000.0,270066,0.011352798017338989,2015-02-06,2014-12-31,0001115418-15-000002
FICO,FAIR ISAAC CORP COMMON STOCK U,303250104,3902000.0,53965,0.011335367928264261,2015-02-06,2014-12-31,0001115418-15-000002
PTEN,PATTERSON UTI ENERGY INC COMMO,703481101,3896000.0,234848,0.011317937839189534,2015-02-06,2014-12-31,0001115418-15-000002
BID,SOTHEBY S COMMON STOCK USD.01,835898107,3893000.0,90163,0.01130922279465217,2015-02-06,2014-12-31,0001115418-15-000002
TCBI,TEXAS CAPITAL BANCSHARES INC C,88224Q107,3882000.0,71445,0.011277267631348504,2015-02-06,2014-12-31,0001115418-15-000002
UMBF,UMB FINANCIAL CORP COMMON STOC,902788108,3881000.0,68218,0.011274362616502715,2015-02-06,2014-12-31,0001115418-15-000002
N/A,DDR CORP COMMON STOCK,23317H102,3871000.0,210858,0.011245312468044838,2015-02-06,2014-12-31,0001115418-15-000002
TSA,ACI WORLDWIDE INC COMMON STOCK,004498101,3870000.0,191870,0.011242407453199049,2015-02-06,2014-12-31,0001115418-15-000002
BUWA,BIO RAD LABORATORIES A COMMON,090572207,3863000.0,32039,0.011222072349278535,2015-02-06,2014-12-31,0001115418-15-000002
MANH,MANHATTAN ASSOCIATES INC COMMO,562750109,3848000.0,94502,0.011178497126591715,2015-02-06,2014-12-31,0001115418-15-000002
PLTEUR,PLANTRONICS INC COMMON STOCK U,727493108,3847000.0,72559,0.011175592111745927,2015-02-06,2014-12-31,0001115418-15-000002
N/A,FIRST NIAGARA FINANCIAL GRP CO,33582V108,3843000.0,455837,0.011163972052362777,2015-02-06,2014-12-31,0001115418-15-000002
N/A,BUFFALO WILD WINGS INC COMMON,119848109,3836000.0,21268,0.01114363694844226,2015-02-06,2014-12-31,0001115418-15-000002
AKRXEUR,AKORN INC COMMON STOCK NPV,009728106,3832000.0,105861,0.011132016889059109,2015-02-06,2014-12-31,0001115418-15-000002
N/A,CORPORATE EXECUTIVE BOARD CO C,21988R102,3822000.0,52698,0.011102966740601232,2015-02-06,2014-12-31,0001115418-15-000002
N/A,SUPERVALU INC COMMON STOCK USD,868536103,3820000.0,393811,0.011097156710909656,2015-02-06,2014-12-31,0001115418-15-000002
N/A,NOBLE CORP PLC,G65431101,3808000.0,229793,0.0110622965327602,2015-02-06,2014-12-31,0001115418-15-000002
TRMK,TRUSTMARK CORP COMMON STOCK NP,898402102,3802000.0,154912,0.011044866443685474,2015-02-06,2014-12-31,0001115418-15-000002
N/A,TEAM HEALTH HOLDINGS INC COMMO,87817A107,3797000.0,66003,0.011030341369456534,2015-02-06,2014-12-31,0001115418-15-000002
N/A,CEPHEID INC COMMON STOCK NPV,15670R107,3783000.0,69874,0.010989671161615505,2015-02-06,2014-12-31,0001115418-15-000002
UNF,UNIFIRST CORP/MA COMMON STOCK,904708104,3772000.0,31062,0.010957715998311838,2015-02-06,2014-12-31,0001115418-15-000002
LXP,LEXINGTON REALTY TRUST REIT US,529043101,3765000.0,342900,0.010937380894391321,2015-02-06,2014-12-31,0001115418-15-000002
CMC,COMMERCIAL METALS CO COMMON ST,201723103,3752000.0,230355,0.01089961570139608,2015-02-06,2014-12-31,0001115418-15-000002
N/A,ROWAN COMPANIES PLC,G7665A101,3743000.0,160521,0.01087347056778399,2015-02-06,2014-12-31,0001115418-15-000002
N/A,WESTERN REFINING INC COMMON ST,959319104,3740000.0,98996,0.010864755523246627,2015-02-06,2014-12-31,0001115418-15-000002
WF2,WINTRUST FINANCIAL CORP COMMON,97650W108,3734000.0,79862,0.0108473254341719,2015-02-06,2014-12-31,0001115418-15-000002
N/A,ROCKWOOD HOLDINGS INC COMMON S,774415103,3730000.0,47336,0.010835705374788746,2015-02-06,2014-12-31,0001115418-15-000002
NVS,NOVARTIS AG ADR,66987V109,3726000.0,40210,0.010824085315405595,2015-02-06,2014-12-31,0001115418-15-000002
HHC*,HOWARD HUGHES CORP/THE COMMON,44267D107,3721000.0,28529,0.010809560241176656,2015-02-06,2014-12-31,0001115418-15-000002
BCPC,BALCHEM CORP COMMON STOCK USD.,057665200,3719000.0,55808,0.01080375021148508,2015-02-06,2014-12-31,0001115418-15-000002
SBH,SALLY BEAUTY HOLDINGS INC COMM,79546E104,3714000.0,120832,0.010789225137256142,2015-02-06,2014-12-31,0001115418-15-000002
ELS,EQUITY LIFESTYLE PROPERTIES RE,29472R108,3714000.0,72046,0.010789225137256142,2015-02-06,2014-12-31,0001115418-15-000002
VOYA,VOYA FINANACIAL INC,929089100,3710000.0,87547,0.01077760507787299,2015-02-06,2014-12-31,0001115418-15-000002
MTG,MGIC INVESTMENT CORP COMMON ST,552848103,3707000.0,397791,0.010768890033335627,2015-02-06,2014-12-31,0001115418-15-000002
CLH,CLEAN HARBORS INC COMMON STOCK,184496107,3700000.0,77007,0.010748554929415111,2015-02-06,2014-12-31,0001115418-15-000002
CLGX,CORELOGIC INC COMMON STOCK USD,21871D103,3698000.0,117073,0.010742744899723536,2015-02-06,2014-12-31,0001115418-15-000002
N2EUR,NETSUITE INC COMMON STOCK USD.,64118Q107,3693000.0,33827,0.010728219825494597,2015-02-06,2014-12-31,0001115418-15-000002
N/A,PRIVATEBANCORP INC COMMON STOC,742962103,3672000.0,109933,0.01066721451373305,2015-02-06,2014-12-31,0001115418-15-000002
AMSGEUR,AMSURG CORP COMMON STOCK NPV,03232P405,3667000.0,67007,0.010652689439504112,2015-02-06,2014-12-31,0001115418-15-000002
ASB,ASSOCIATED BANC-CORP,045487105,3647000.0,195740,0.010594589142588354,2015-02-06,2014-12-31,0001115418-15-000002
KAR,KAR AUCTION SERVICES INC COMMO,48238T109,3643000.0,105128,0.010582969083205203,2015-02-06,2014-12-31,0001115418-15-000002
TTWO,TAKE TWO INTERACTIVE SOFTWRE C,874054109,3635000.0,129668,0.0105597289644389,2015-02-06,2014-12-31,0001115418-15-000002
N/A,DEVRY EDUCATION GROUP COMMON S,251893103,3630000.0,76459,0.01054520389020996,2015-02-06,2014-12-31,0001115418-15-000002
N/A,HEALTHSOUTH CORP COMMON STOCK,421924309,3630000.0,94375,0.01054520389020996,2015-02-06,2014-12-31,0001115418-15-000002
SM,SM ENERGY CO COMMON STOCK USD.,78454L100,3627000.0,94014,0.010536488845672596,2015-02-06,2014-12-31,0001115418-15-000002
HUN,HUNTSMAN CORP COMMON STOCK USD,447011107,3623000.0,159050,0.010524868786289446,2015-02-06,2014-12-31,0001115418-15-000002
N/A,BROCADE COMMUNICATIONS SYS COM,111621306,3613000.0,305156,0.010495818637831568,2015-02-06,2014-12-31,0001115418-15-000002
AXS,AXIS CAPITAL HOLDINGS LTD COMM,G0692U109,3606000.0,70591,0.010475483533911051,2015-02-06,2014-12-31,0001115418-15-000002
N/A,QIAGEN N.V. COMMON STOCK EUR.0,N72482107,3605000.0,153646,0.010472578519065263,2015-02-06,2014-12-31,0001115418-15-000002
SUX,SYNNEX CORP COMMON STOCK USD.0,87162W100,3603000.0,46097,0.010466768489373687,2015-02-06,2014-12-31,0001115418-15-000002
AXE3EUR,ANIXTER INTERNATIONAL INC COMM,035290105,3598000.0,40678,0.010452243415144748,2015-02-06,2014-12-31,0001115418-15-000002
N/A,NPS PHARMACEUTICALS INC COMMON,62936P103,3596000.0,100518,0.010446433385453173,2015-02-06,2014-12-31,0001115418-15-000002
LXKEUR,LEXMARK INTERNATIONAL INC A CO,529771107,3596000.0,87133,0.010446433385453173,2015-02-06,2014-12-31,0001115418-15-000002
RLI,RLI CORP COMMON STOCK USD1.,749607107,3595000.0,72771,0.010443528370607386,2015-02-06,2014-12-31,0001115418-15-000002
IPGP,IPG PHOTONICS CORP COMMON STOC,44980X109,3595000.0,47985,0.010443528370607386,2015-02-06,2014-12-31,0001115418-15-000002
WWW,WOLVERINE WORLD WIDE INC COMMO,978097103,3591000.0,121838,0.010431908311224234,2015-02-06,2014-12-31,0001115418-15-000002
FR,FIRST INDUSTRIAL REALTY TR REI,32054K103,3586000.0,174408,0.010417383236995294,2015-02-06,2014-12-31,0001115418-15-000002
NYT,NEW YORK TIMES CO A COMMON STO,650111107,3573000.0,270276,0.010379618044000052,2015-02-06,2014-12-31,0001115418-15-000002
DNKN,DUNKIN BRANDS GROUP INC COM,265504100,3569000.0,83688,0.0103679979846169,2015-02-06,2014-12-31,0001115418-15-000002
N/A,LACLEDE GROUP INC/THE COMMON S,505597104,3568000.0,67062,0.010365092969771112,2015-02-06,2014-12-31,0001115418-15-000002
CBT,CABOT CORP COMMON STOCK USD1.,127055101,3565000.0,81291,0.010356377925233749,2015-02-06,2014-12-31,0001115418-15-000002
ALEX,ALEXANDER + BALDWIN HOLDINGS I,014491104,3563000.0,90756,0.010350567895542173,2015-02-06,2014-12-31,0001115418-15-000002
N/A,COUSINS PROPERTIES INC REIT US,222795106,3555000.0,311333,0.01032732777677587,2015-02-06,2014-12-31,0001115418-15-000002
LTC,LTC PROPERTIES INC REIT USD.01,502175102,3536000.0,81913,0.010272132494705901,2015-02-06,2014-12-31,0001115418-15-000002
N/A,WP GLIMCHER INC,92939N102,3534000.0,205211,0.010266322465014325,2015-02-06,2014-12-31,0001115418-15-000002
N/A,HALYARD HEALTH INC,40650V100,3527000.0,77562,0.01024598736109381,2015-02-06,2014-12-31,0001115418-15-000002
TTC,TORO CO COMMON STOCK USD1.,891092108,3526000.0,55251,0.010243082346248022,2015-02-06,2014-12-31,0001115418-15-000002
FULT,FULTON FINANCIAL CORP COMMON S,360271100,3521000.0,284852,0.010228557272019082,2015-02-06,2014-12-31,0001115418-15-000002
DFODQ,DEAN FOODS CO COMMON STOCK USD,242370203,3520000.0,181628,0.010225652257173295,2015-02-06,2014-12-31,0001115418-15-000002
HRC,HILL ROM HOLDINGS INC COMMON S,431475102,3517000.0,77094,0.010216937212635932,2015-02-06,2014-12-31,0001115418-15-000002
KMT,KENNAMETAL INC COMMON STOCK US,489170100,3512000.0,98123,0.010202412138406992,2015-02-06,2014-12-31,0001115418-15-000002
CHE,CHEMED CORP COMMON STOCK USD1.,16359R103,3512000.0,33235,0.010202412138406992,2015-02-06,2014-12-31,0001115418-15-000002
AANUSD,AARON S INC COMMON STOCK USD.5,002535300,3507000.0,114731,0.010187887064178053,2015-02-06,2014-12-31,0001115418-15-000002
POST,POST HOLDINGS INC,737446104,3506000.0,83689,0.010184982049332264,2015-02-06,2014-12-31,0001115418-15-000002
N/A,CON WAY INC COMMON STOCK USD.6,205944101,3489000.0,70949,0.010135596796953871,2015-02-06,2014-12-31,0001115418-15-000002
N/A,MB FINANCIAL INC COMMON STOCK,55264U108,3487000.0,106121,0.010129786767262295,2015-02-06,2014-12-31,0001115418-15-000002
FNB,FNB CORP COMMON STOCK USD.01,302520101,3483000.0,261487,0.010118166707879144,2015-02-06,2014-12-31,0001115418-15-000002
GPK,GRAPHIC PACKAGING HOLDING CO C,388689101,3478000.0,255334,0.010103641633650205,2015-02-06,2014-12-31,0001115418-15-000002
N/A,EQUITY ONE INC REIT USD.01,294752100,3469000.0,136774,0.010077496500038113,2015-02-06,2014-12-31,0001115418-15-000002
HEI,HEICO CORP COMMON STOCK USD.01,422806109,3466000.0,57385,0.01006878145550075,2015-02-06,2014-12-31,0001115418-15-000002
VAC,MARRIOTT VACATIONS WORLD,57164Y107,3463000.0,46453,0.010060066410963386,2015-02-06,2014-12-31,0001115418-15-000002
GATX,GATX CORP COMMON STOCK USD.625,361448103,3426000.0,59548,0.009952580861669235,2015-02-06,2014-12-31,0001115418-15-000002
OIS,OIL STATES INTERNATIONAL INC C,678026105,3414000.0,69811,0.009917720683519782,2015-02-06,2014-12-31,0001115418-15-000002
HXL,HEXCEL CORP COMMON STOCK USD.0,428291108,3413000.0,82264,0.009914815668673993,2015-02-06,2014-12-31,0001115418-15-000002
FFIN,FIRST FINL BANKSHARES INC COMM,32020R109,3404000.0,113922,0.009888670535061901,2015-02-06,2014-12-31,0001115418-15-000002
SLGN,SILGAN HOLDINGS INC COMMON STO,827048109,3400000.0,63426,0.00987705047567875,2015-02-06,2014-12-31,0001115418-15-000002
ON,ON SEMICONDUCTOR CORPORATION C,682189105,3399000.0,335545,0.009874145460832963,2015-02-06,2014-12-31,0001115418-15-000002
GBCI,GLACIER BANCORP INC COMMON STO,37637Q105,3395000.0,122240,0.009862525401449811,2015-02-06,2014-12-31,0001115418-15-000002
IDCC,INTERDIGITAL INC COMMON STOCK,45867G101,3395000.0,64179,0.009862525401449811,2015-02-06,2014-12-31,0001115418-15-000002
WERN,WERNER ENTERPRISES INC COMMON,950755108,3391000.0,108853,0.00985090534206666,2015-02-06,2014-12-31,0001115418-15-000002
CA8A,CACI INTERNATIONAL INC  CL A C,127190304,3378000.0,39196,0.009813140149071418,2015-02-06,2014-12-31,0001115418-15-000002
WEN,WENDY S CO/THE COMMON STOCK US,95058W100,3378000.0,374085,0.009813140149071418,2015-02-06,2014-12-31,0001115418-15-000002
HNI,HNI CORP COMMON STOCK USD1.,404251100,3377000.0,66147,0.009810235134225631,2015-02-06,2014-12-31,0001115418-15-000002
AELUSD,AMERICAN EQUITY INVT LIFE HL C,025676206,3374000.0,115593,0.009801520089688267,2015-02-06,2014-12-31,0001115418-15-000002
KMPR,KEMPER CORP COMMON STOCK USD.1,488401100,3371000.0,93354,0.009792805045150904,2015-02-06,2014-12-31,0001115418-15-000002
ALSN,ALLISON TRANSMISSION HOLDING C,01973R101,3364000.0,99241,0.009772469941230388,2015-02-06,2014-12-31,0001115418-15-000002
IPXLEUR,IMPAX LABORATORIES INC COMMON,45256B101,3361000.0,106106,0.009763754896693023,2015-02-06,2014-12-31,0001115418-15-000002
GNCIQ,GNC HOLDINGS INC CL A COMMON S,36191G107,3360000.0,71555,0.009760849881847236,2015-02-06,2014-12-31,0001115418-15-000002
CHS1USD,CHICO S FAS INC COMMON STOCK U,168615102,3348000.0,206556,0.009725989703697781,2015-02-06,2014-12-31,0001115418-15-000002
AKR,ACADIA REALTY TRUST REIT USD.0,004239109,3347000.0,104491,0.009723084688851994,2015-02-06,2014-12-31,0001115418-15-000002
N/A,EXTERRAN HOLDINGS INC COMMON S,30225X103,3342000.0,102568,0.009708559614623054,2015-02-06,2014-12-31,0001115418-15-000002
N/A,MICROSEMI CORP COMMON STOCK US,595137100,3335000.0,117510,0.00968822451070254,2015-02-06,2014-12-31,0001115418-15-000002
MGEE,MGE ENERGY INC COMMON STOCK US,55277P104,3334000.0,73102,0.009685319495856753,2015-02-06,2014-12-31,0001115418-15-000002
SAM,BOSTON BEER COMPANY INC CL A C,100557107,3321000.0,11471,0.00964755430286151,2015-02-06,2014-12-31,0001115418-15-000002
IACIEUR,IAC/INTERACTIVECORP COMMON STO,44919P508,3315000.0,54539,0.009630124213786782,2015-02-06,2014-12-31,0001115418-15-000002
NHI,NATL HEALTH INVESTORS INC REIT,63633D104,3312000.0,47337,0.00962140916924942,2015-02-06,2014-12-31,0001115418-15-000002
MTN,VAIL RESORTS INC COMMON STOCK,91879Q109,3309000.0,36309,0.009612694124712055,2015-02-06,2014-12-31,0001115418-15-000002
POOL,POOL CORP COMMON STOCK USD.001,73278L105,3302000.0,52051,0.00959235902079154,2015-02-06,2014-12-31,0001115418-15-000002
CDP,CORPORATE OFFICE PROPERTIES RE,22002T108,3295000.0,116161,0.009572023916871026,2015-02-06,2014-12-31,0001115418-15-000002
