ticker,nameOfIssuer,cusip,value,shares,allocation_percent,filingDate,reportDate,accessionNumber
AAPL,APPLE INC COMMON STOCK NPV,037833100,1040697000.0,10329499,3.1260026922088686,2014-11-12,2014-09-30,0001115418-14-000011
XOM,EXXON MOBIL CORP COMMON STOCK,30231G102,658370000.0,7000212,1.9775846307518452,2014-11-12,2014-09-30,0001115418-14-000011
MSFT,MICROSOFT CORP COMMON STOCK US,594918104,646849000.0,13952741,1.9429783264990812,2014-11-12,2014-09-30,0001115418-14-000011
JNJ,JOHNSON + JOHNSON COMMON STOCK,478160104,461305000.0,4327842,1.3856489179169462,2014-11-12,2014-09-30,0001115418-14-000011
WFC,WELLS FARGO + CO COMMON STOCK,949746101,400988000.0,7730630,1.2044712029951559,2014-11-12,2014-09-30,0001115418-14-000011
BRK/B,BERKSHIRE HATHAWAY INC CL B CO,084670702,400390000.0,2898437,1.2026749552785383,2014-11-12,2014-09-30,0001115418-14-000011
GE,GENERAL ELECTRIC CO COMMON STO,369604103,380872000.0,14866216,1.144047592514417,2014-11-12,2014-09-30,0001115418-14-000011
CVX,CHEVRON CORP COMMON STOCK USD.,166764100,374272000.0,3136707,1.1242227849397066,2014-11-12,2014-09-30,0001115418-14-000011
PG,PROCTER + GAMBLE CO/THE COMMON,742718109,373297000.0,4457814,1.1212941201843514,2014-11-12,2014-09-30,0001115418-14-000011
JPM,JPMORGAN CHASE + CO COMMON STO,46625H100,361942000.0,6008334,1.0871864398796791,2014-11-12,2014-09-30,0001115418-14-000011
BAC,VERIZON COMMUNICATIONS INC COM,92343V104,357372000.0,7148866,1.0734592625135537,2014-11-12,2014-09-30,0001115418-14-000011
IBM,INTL BUSINESS MACHINES CORP CO,459200101,310807000.0,1637289,0.933589237556524,2014-11-12,2014-09-30,0001115418-14-000011
KO,COCA COLA CO/THE COMMON STOCK,191216100,303512000.0,7114667,0.9116768176690219,2014-11-12,2014-09-30,0001115418-14-000011
T,AT+T INC COMMON STOCK USD1.,00206R102,300278000.0,8520929,0.9019626619574138,2014-11-12,2014-09-30,0001115418-14-000011
INTC,INTEL CORP COMMON STOCK USD.00,458140100,287436000.0,8254906,0.8633883924309846,2014-11-12,2014-09-30,0001115418-14-000011
PFE,PFIZER INC COMMON STOCK USD.05,717081103,285976000.0,9671146,0.8590029046947608,2014-11-12,2014-09-30,0001115418-14-000011
BAC,BANK OF AMERICA CORP COMMON ST,060505104,285556000.0,16748139,0.8577413260309155,2014-11-12,2014-09-30,0001115418-14-000011
N/A,GOOGLE INC CL A COMMON STOCK U,38259P508,281869000.0,479035,0.8466664676175887,2014-11-12,2014-09-30,0001115418-14-000011
GILD,GILEAD SCIENCES INC COMMON STO,375558103,277508000.0,2606936,0.8335670758246625,2014-11-12,2014-09-30,0001115418-14-000011
N/A,GOOGLE INC CL C COMMON STOCK U,38259P706,275150000.0,476566,0.8264842127547886,2014-11-12,2014-09-30,0001115418-14-000011
META,FACEBOOK INC COM,30303M102,260829000.0,3299958,0.7834673840763902,2014-11-12,2014-09-30,0001115418-14-000011
MRK,MERCK + CO. INC. COMMON STOCK,58933Y105,256024000.0,4318899,0.7690343234102561,2014-11-12,2014-09-30,0001115418-14-000011
DIS,WALT DISNEY CO/THE COMMON STOC,254687106,253815000.0,2850893,0.762399020390175,2014-11-12,2014-09-30,0001115418-14-000011
C,CITIGROUP INC COMMON STOCK USD,172967424,250320000.0,4830573,0.7519008836517488,2014-11-12,2014-09-30,0001115418-14-000011
PEP,PEPSICO INC COMMON STOCK USD.0,713448108,248752000.0,2672171,0.7471909899733933,2014-11-12,2014-09-30,0001115418-14-000011
CMCSA,COMCAST CORP CLASS A COMMON ST,20030N101,237227000.0,4411061,0.7125726706857359,2014-11-12,2014-09-30,0001115418-14-000011
QCOM,QUALCOMM INC COMMON STOCK USD.,747525103,223996000.0,2995795,0.6728299390158881,2014-11-12,2014-09-30,0001115418-14-000011
ORCL,ORACLE CORP COMMON STOCK USD.0,68389X105,222378000.0,5809239,0.6679698574013606,2014-11-12,2014-09-30,0001115418-14-000011
HD,HOME DEPOT INC COMMON STOCK US,437076102,217841000.0,2374548,0.6543418040731088,2014-11-12,2014-09-30,0001115418-14-000011
CSCO,CISCO SYSTEMS INC COMMON STOCK,17275R102,212587000.0,8446039,0.63856005574015,2014-11-12,2014-09-30,0001115418-14-000011
AMZN,AMAZON.COM INC COMMON STOCK US,023135106,204381000.0,633858,0.6139112116555931,2014-11-12,2014-09-30,0001115418-14-000011
WMT,WAL MART STORES INC COMMON STO,931142103,203194000.0,2657174,0.6103457500508687,2014-11-12,2014-09-30,0001115418-14-000011
PM,PHILIP MORRIS INTERNATIONAL CO,718172109,196547000.0,2356675,0.5903797658161564,2014-11-12,2014-09-30,0001115418-14-000011
AMGN,AMGEN INC COMMON STOCK USD.000,031162100,185808000.0,1322857,0.5581224008851235,2014-11-12,2014-09-30,0001115418-14-000011
V,VISA INC CLASS A SHARES COMMON,92826C839,179100000.0,839385,0.5379731873682814,2014-11-12,2014-09-30,0001115418-14-000011
UNP,UNION PACIFIC CORP COMMON STOC,907818108,172436000.0,1590449,0.5179561392352707,2014-11-12,2014-09-30,0001115418-14-000011
MMM,3M CO COMMON STOCK USD.01,88579Y101,171210000.0,1208424,0.514273531040332,2014-11-12,2014-09-30,0001115418-14-000011
SLB,SCHLUMBERGER LTD COMMON STOCK,806857108,170483000.0,1676502,0.5120897984483904,2014-11-12,2014-09-30,0001115418-14-000011
MCD,MCDONALD S CORP COMMON STOCK U,580135101,162973000.0,1718940,0.4895315704353486,2014-11-12,2014-09-30,0001115418-14-000011
ABBV,ABBVIE INC.,00287Y109,159162000.0,2755569,0.47808424594031496,2014-11-12,2014-09-30,0001115418-14-000011
COP,CONOCOPHILLIPS COMMON STOCK US,20825C104,157892000.0,2063404,0.47426947236154493,2014-11-12,2014-09-30,0001115418-14-000011
CVS,CVS HEALTH CORP,126650100,156797000.0,1970058,0.470980356559377,2014-11-12,2014-09-30,0001115418-14-000011
UNH,UNITEDHEALTH GROUP INC COMMON,91324P102,145927000.0,1691909,0.4383294992355734,2014-11-12,2014-09-30,0001115418-14-000011
BA,BOEING CO/THE COMMON STOCK USD,097023105,145029000.0,1138552,0.4356321239019234,2014-11-12,2014-09-30,0001115418-14-000011
MO,ALTRIA GROUP INC COMMON STOCK,02209S103,137771000.0,2998931,0.4138308430871887,2014-11-12,2014-09-30,0001115418-14-000011
UTXZ,UNITED TECHNOLOGIES CORP COMMO,913017109,135945000.0,1287354,0.4083459796581855,2014-11-12,2014-09-30,0001115418-14-000011
BIIB,BIOGEN IDEC INC COMMON STOCK U,09062X103,134000000.0,405067,0.4025036689410928,2014-11-12,2014-09-30,0001115418-14-000011
AXP,AMERICAN EXPRESS CO COMMON STO,025816109,133738000.0,1527732,0.4017166841555512,2014-11-12,2014-09-30,0001115418-14-000011
BMY,BRISTOL MYERS SQUIBB CO COMMON,110122108,130014000.0,2540333,0.39053068666945695,2014-11-12,2014-09-30,0001115418-14-000011
CELG,CELGENE CORP COMMON STOCK USD.,151020104,127127000.0,1341282,0.3818588352348828,2014-11-12,2014-09-30,0001115418-14-000011
OXY,OCCIDENTAL PETROLEUM CORP COMM,674599105,126179000.0,1312310,0.3790112719650608,2014-11-12,2014-09-30,0001115418-14-000011
GS,GOLDMAN SACHS GROUP INC COMMON,38141G104,125580000.0,684100,0.3772120204897196,2014-11-12,2014-09-30,0001115418-14-000011
AIG,AMERICAN INTERNATIONAL GROUP C,026874784,124928000.0,2312624,0.37525356980203606,2014-11-12,2014-09-30,0001115418-14-000011
MA,MASTERCARD INC CLASS A COMMON,57636Q104,124421000.0,1683185,0.3737306641292515,2014-11-12,2014-09-30,0001115418-14-000011
USB,US BANCORP COMMON STOCK USD.01,902973304,124193000.0,2968985,0.37304580714030694,2014-11-12,2014-09-30,0001115418-14-000011
HON,HONEYWELL INTERNATIONAL INC CO,438516106,119093000.0,1278922,0.3577266376507579,2014-11-12,2014-09-30,0001115418-14-000011
UPS,UNITED PARCEL SERVICE CL B COM,911312106,117569000.0,1196139,0.35314890935623383,2014-11-12,2014-09-30,0001115418-14-000011
EBA,EBAY INC COMMON STOCK USD.001,278642103,114910000.0,2029135,0.3451619149106043,2014-11-12,2014-09-30,0001115418-14-000011
NKE,NIKE INC  CL B COMMON STOCK NP,654106103,112846000.0,1265093,0.33896215690542203,2014-11-12,2014-09-30,0001115418-14-000011
N/A,DU PONT (E.I.) DE NEMOURS COMM,263534109,110247000.0,1536332,0.3311553879831989,2014-11-12,2014-09-30,0001115418-14-000011
N/A,MEDTRONIC INC COMMON STOCK USD,585055106,110013000.0,1775829,0.3304525084419137,2014-11-12,2014-09-30,0001115418-14-000011
N/A,HEWLETT PACKARD CO COMMON STOC,428236103,108284000.0,3052820,0.3252590096090842,2014-11-12,2014-09-30,0001115418-14-000011
N/A,TWENTY-FIRST CENTURY FOX INC.,90130A101,107551000.0,3136521,0.323057254464802,2014-11-12,2014-09-30,0001115418-14-000011
TWXCHF,TIME WARNER INC COMMON STOCK U,887317303,104081000.0,1383870,0.31263421169446176,2014-11-12,2014-09-30,0001115418-14-000011
ABT,ABBOTT LABORATORIES COMMON STO,002824100,101945000.0,2451196,0.3062181830611918,2014-11-12,2014-09-30,0001115418-14-000011
CL,COLGATE PALMOLIVE CO COMMON ST,194162103,101451000.0,1555515,0.30473432625181196,2014-11-12,2014-09-30,0001115418-14-000011
LLY,ELI LILLY + CO COMMON STOCK NP,532457108,100965000.0,1556895,0.3032744995122196,2014-11-12,2014-09-30,0001115418-14-000011
N/A,PRICELINE GROUP INC COMMON STO,741503403,100684000.0,86903,0.30243044331093266,2014-11-12,2014-09-30,0001115418-14-000011
N/A,MONSANTO CO COMMON STOCK USD.0,61166W101,99207000.0,881760,0.2979938916764103,2014-11-12,2014-09-30,0001115418-14-000011
N/A,DOW CHEMICAL CO/THE COMMON STO,260543103,98998000.0,1887837,0.2973661061032112,2014-11-12,2014-09-30,0001115418-14-000011
COST,COSTCO WHOLESALE CORP COMMON S,22160K105,97831000.0,780646,0.2938607196729556,2014-11-12,2014-09-30,0001115418-14-000011
N/A,ACTAVIS PLC,G0083B108,96993000.0,401992,0.291343569862712,2014-11-12,2014-09-30,0001115418-14-000011
SBUX,STARBUCKS CORP COMMON STOCK US,855244109,96763000.0,1282313,0.2906527053563206,2014-11-12,2014-09-30,0001115418-14-000011
N/A,EMC CORP/MASS COMMON STOCK USD,268648102,96425000.0,3295457,0.2896374349077975,2014-11-12,2014-09-30,0001115418-14-000011
HAL,HALLIBURTON CO COMMON STOCK US,406216101,96165000.0,1490706,0.28885645763970286,2014-11-12,2014-09-30,0001115418-14-000011
SPG,SIMON PROPERTY GROUP INC REIT,828806109,95887000.0,583181,0.28802141271458626,2014-11-12,2014-09-30,0001115418-14-000011
LOW,LOWE S COS INC COMMON STOCK US,548661107,95187000.0,1798691,0.2859187816081776,2014-11-12,2014-09-30,0001115418-14-000011
MDLZ,MONDELEZ INTERNATIONAL INC,609207105,94380000.0,2754426,0.2834947483183607,2014-11-12,2014-09-30,0001115418-14-000011
N/A,WALGREEN CO COMMON STOCK USD.0,931422109,93925000.0,1584693,0.28212803809919507,2014-11-12,2014-09-30,0001115418-14-000011
F,FORD MOTOR CO COMMON STOCK USD,345370860,92625000.0,6262667,0.27822315175872175,2014-11-12,2014-09-30,0001115418-14-000011
N/A,ALLERGAN INC COMMON STOCK USD.,018490102,92373000.0,518397,0.2774662045604146,2014-11-12,2014-09-30,0001115418-14-000011
TXN,TEXAS INSTRUMENTS INC COMMON S,882508104,91757000.0,1924024,0.275615889186775,2014-11-12,2014-09-30,0001115418-14-000011
N/A,EXPRESS SCRIPTS HOLDING COMPAN,30219G108,90853000.0,1286330,0.2729004913007843,2014-11-12,2014-09-30,0001115418-14-000011
EOG,EOG RESOURCES INC COMMON STOCK,26875P101,90782000.0,916801,0.27268722443142,2014-11-12,2014-09-30,0001115418-14-000011
ACN,ACCENTURE PLC CL A COMMON STOC,G1151C101,90382000.0,1111439,0.2714857209420436,2014-11-12,2014-09-30,0001115418-14-000011
MET,METLIFE INC COMMON STOCK USD.0,59156R108,87500000.0,1628812,0.2628288883010867,2014-11-12,2014-09-30,0001115418-14-000011
DUK,DUKE ENERGY CORP COMMON STOCK,26441C204,84699000.0,1132794,0.2544153601167285,2014-11-12,2014-09-30,0001115418-14-000011
DWD,MORGAN STANLEY COMMON STOCK US,617446448,83716000.0,2421629,0.25146266529158595,2014-11-12,2014-09-30,0001115418-14-000011
EMR,EMERSON ELECTRIC CO COMMON STO,291011104,83716000.0,1337744,0.25146266529158595,2014-11-12,2014-09-30,0001115418-14-000011
APC,ANADARKO PETROLEUM CORP COMMON,032511107,83045000.0,818659,0.24944714318815708,2014-11-12,2014-09-30,0001115418-14-000011
DHR,DANAHER CORP COMMON STOCK USD.,235851102,82680000.0,1088176,0.24835077125410113,2014-11-12,2014-09-30,0001115418-14-000011
LMT,LOCKHEED MARTIN CORP COMMON ST,539830109,82198000.0,449708,0.24690295954940253,2014-11-12,2014-09-30,0001115418-14-000011
CAT,CATERPILLAR INC COMMON STOCK U,149123101,79915000.0,806980,0.24004537838378678,2014-11-12,2014-09-30,0001115418-14-000011
PSX,PHILLIPS 66,718546104,76131000.0,936302,0.22867915537428604,2014-11-12,2014-09-30,0001115418-14-000011
BLKCHF,BLACKROCK INC COMMON STOCK USD,09247X101,75935000.0,231283,0.22809041866449165,2014-11-12,2014-09-30,0001115418-14-000011
N/A,LYONDELLBASELL INDU CL A COMMO,N53745100,75830000.0,697866,0.2277750239985303,2014-11-12,2014-09-30,0001115418-14-000011
MCK,MCKESSON CORP COMMON STOCK USD,58155Q103,75589000.0,388294,0.227051118146181,2014-11-12,2014-09-30,0001115418-14-000011
FDX,FEDEX CORP COMMON STOCK USD.1,31428X106,74533000.0,461648,0.22387914893422736,2014-11-12,2014-09-30,0001115418-14-000011
TJX,TJX COMPANIES INC COMMON STOCK,872540109,74046000.0,1251416,0.2224163184359116,2014-11-12,2014-09-30,0001115418-14-000011
ADP,AUTOMATIC DATA PROCESSING COMM,053015103,73948000.0,890087,0.22212195008101437,2014-11-12,2014-09-30,0001115418-14-000011
COF,CAPITAL ONE FINANCIAL CORP COM,14040H105,73599000.0,901727,0.22107363828653345,2014-11-12,2014-09-30,0001115418-14-000011
GM,GENERAL MOTORS CO COMMON STOCK,37045V100,72785000.0,2278819,0.2186285786856525,2014-11-12,2014-09-30,0001115418-14-000011
TMO,THERMO FISHER SCIENTIFIC INC C,883556102,72573000.0,596330,0.217991781836283,2014-11-12,2014-09-30,0001115418-14-000011
PNC,PNC FINANCIAL SERVICES GROUP C,693475105,72323000.0,845098,0.21724084215542275,2014-11-12,2014-09-30,0001115418-14-000011
BK,BANK OF NEW YORK MELLON CORP C,064058100,70684000.0,1825046,0.21231768160770298,2014-11-12,2014-09-30,0001115418-14-000011
N/A,DIRECTV CLASS A COMMON STOCK U,25490A309,69931000.0,808260,0.21005585128895193,2014-11-12,2014-09-30,0001115418-14-000011
KMB,KIMBERLY CLARK CORP COMMON STO,494368103,69788000.0,648771,0.20962631379149985,2014-11-12,2014-09-30,0001115418-14-000011
PXGBX,PRAXAIR INC COMMON STOCK USD.0,74005P104,68915000.0,534225,0.20700403242593585,2014-11-12,2014-09-30,0001115418-14-000011
N/A,TIME WARNER CABLE COMMON STOCK,88732J207,68814000.0,479576,0.20670065279486832,2014-11-12,2014-09-30,0001115418-14-000011
TGT,TARGET CORP COMMON STOCK USD.0,87612E106,68641000.0,1095109,0.20618100253571303,2014-11-12,2014-09-30,0001115418-14-000011
NEE,NEXTERA ENERGY INC COMMON STOC,65339F101,67675000.0,720863,0.20327937160886903,2014-11-12,2014-09-30,0001115418-14-000011
WMB,WILLIAMS COS INC COMMON STOCK,969457100,67316000.0,1216192,0.20220102222715375,2014-11-12,2014-09-30,0001115418-14-000011
SO,SOUTHERN CO COMMON STOCK USD5.,842587107,66007000.0,1512188,0.19826910205816947,2014-11-12,2014-09-30,0001115418-14-000011
AMT,AMERICAN TOWER REIT INC,03027X100,65406000.0,698554,0.19646384306538142,2014-11-12,2014-09-30,0001115418-14-000011
D,DOMINION RESOURCES INC/VA COMM,25746U109,64734000.0,936956,0.19444531720322908,2014-11-12,2014-09-30,0001115418-14-000011
PRU,PRUDENTIAL FINANCIAL INC COMMO,744320102,63938000.0,727069,0.19205432525937005,2014-11-12,2014-09-30,0001115418-14-000011
BAX,BAXTER INTERNATIONAL INC COMMO,071813109,62178000.0,866353,0.1867677099061139,2014-11-12,2014-09-30,0001115418-14-000011
N/A,YAHOO  INC COMMON STOCK USD.00,984332106,61937000.0,1519934,0.18604380405376464,2014-11-12,2014-09-30,0001115418-14-000011
MU,MICRON TECHNOLOGY INC COMMON S,595112103,60758000.0,1773424,0.1825023725188277,2014-11-12,2014-09-30,0001115418-14-000011
9990302D,APACHE CORP COMMON STOCK USD.6,037411105,59590000.0,634815,0.17899398232984864,2014-11-12,2014-09-30,0001115418-14-000011
NSC,NORFOLK SOUTHERN CORP COMMON S,655844108,59336000.0,531681,0.17823102761409462,2014-11-12,2014-09-30,0001115418-14-000011
N/A,COVIDIEN PLC COMMON STOCK USD.,G2554F113,59058000.0,682670,0.17739598268897802,2014-11-12,2014-09-30,0001115418-14-000011
GD,GENERAL DYNAMICS CORP COMMON S,369550108,58744000.0,462220,0.17645280244981756,2014-11-12,2014-09-30,0001115418-14-000011
NOVEUR,NATIONAL OILWELL VARCO INC COM,637071101,57424000.0,754589,0.17248784093487546,2014-11-12,2014-09-30,0001115418-14-000011
GIS,GENERAL MILLS INC COMMON STOCK,370334104,57033000.0,1130479,0.17131337127401003,2014-11-12,2014-09-30,0001115418-14-000011
CRM,SALESFORCE.COM INC COMMON STOC,79466L302,56598000.0,983792,0.1700067362293132,2014-11-12,2014-09-30,0001115418-14-000011
N/A,KRAFT FOOD GROUP INC.,50076Q106,56587000.0,1003322,0.16997369488335534,2014-11-12,2014-09-30,0001115418-14-000011
ALXN,ALEXION PHARMACEUTICALS INC CO,015351109,56458000.0,340479,0.16958621000803145,2014-11-12,2014-09-30,0001115418-14-000011
ITW,ILLINOIS TOOL WORKS COMMON STO,452308109,56368000.0,667707,0.16931587172292176,2014-11-12,2014-09-30,0001115418-14-000011
ECL,ECOLAB INC COMMON STOCK USD1.,278865100,55982000.0,487520,0.16815642085567353,2014-11-12,2014-09-30,0001115418-14-000011
CSX,CSX CORP COMMON STOCK USD1.,126408103,55885000.0,1743130,0.16786505625949977,2014-11-12,2014-09-30,0001115418-14-000011
ADBE,ADOBE SYSTEMS INC COMMON STOCK,00724F101,55511000.0,802294,0.16674165049693285,2014-11-12,2014-09-30,0001115418-14-000011
N/A,PRECISION CASTPARTS CORP COMMO,740189105,55239000.0,233196,0.16592462812415687,2014-11-12,2014-09-30,0001115418-14-000011
FCX,FREEPORT MCMORAN INC.,35671D857,54971000.0,1683637,0.1651196207862747,2014-11-12,2014-09-30,0001115418-14-000011
N/A,AETNA INC COMMON STOCK USD.01,00817Y108,54841000.0,677046,0.16472913215222737,2014-11-12,2014-09-30,0001115418-14-000011
YUM,YUM  BRANDS INC COMMON STOCK N,988498101,54590000.0,758403,0.1639751887126437,2014-11-12,2014-09-30,0001115418-14-000011
N/A,WELLPOINT INC COMMON STOCK USD,94973V107,53603000.0,448113,0.16101047885260744,2014-11-12,2014-09-30,0001115418-14-000011
SCHW,SCHWAB (CHARLES) CORP COMMON S,808513105,53432000.0,1818017,0.16049683611089902,2014-11-12,2014-09-30,0001115418-14-000011
ADM,ARCHER DANIELS MIDLAND CO COMM,039483102,53426000.0,1045523,0.16047881355855836,2014-11-12,2014-09-30,0001115418-14-000011
N/A,ACE LTD COMMON STOCK CHF30.57,H0023R105,53057000.0,505931,0.15937042658960865,2014-11-12,2014-09-30,0001115418-14-000011
DE,DEERE + CO COMMON STOCK USD1.,244199105,53027000.0,646749,0.15928031382790542,2014-11-12,2014-09-30,0001115418-14-000011
VIAB,VIACOM INC CLASS B COMMON STOC,92553P201,52959000.0,688314,0.1590760582347114,2014-11-12,2014-09-30,0001115418-14-000011
TRV,TRAVELERS COS INC/THE COMMON S,89417E109,51281000.0,545891,0.15403575109677745,2014-11-12,2014-09-30,0001115418-14-000011
STT,STATE STREET CORP COMMON STOCK,857477103,50363000.0,684181,0.1512783005886586,2014-11-12,2014-09-30,0001115418-14-000011
SYK,STRYKER CORP COMMON STOCK USD.,863667101,50202000.0,621697,0.1507946954341846,2014-11-12,2014-09-30,0001115418-14-000011
PSA,PUBLIC STORAGE REIT USD.1,74460D109,49814000.0,300371,0.14962923704948952,2014-11-12,2014-09-30,0001115418-14-000011
CME,CME GROUP INC COMMON STOCK USD,12572Q105,49308000.0,616703,0.14810933513542837,2014-11-12,2014-09-30,0001115418-14-000011
DAL,DELTA AIR LINES INC COMMON STO,247361702,48338000.0,1337153,0.1451956891736906,2014-11-12,2014-09-30,0001115418-14-000011
N/A,EATON CORP PLC,G29183103,48146000.0,759753,0.14461896749878994,2014-11-12,2014-09-30,0001115418-14-000011
N/A,BAKER HUGHES INC COMMON STOCK,057224107,48126000.0,739714,0.14455889232432112,2014-11-12,2014-09-30,0001115418-14-000011
RTN1USD,RAYTHEON COMPANY COMMON STOCK,755111507,47746000.0,469847,0.14341746400941352,2014-11-12,2014-09-30,0001115418-14-000011
REGN,REGENERON PHARMACEUTICALS COMM,75886F107,47429000.0,131558,0.14246527249408275,2014-11-12,2014-09-30,0001115418-14-000011
DFSEUR,DISCOVER FINANCIAL SERVICES CO,254709108,47405000.0,736211,0.14239318228472017,2014-11-12,2014-09-30,0001115418-14-000011
PEO,EXELON CORP COMMON STOCK NPV,30161N101,47364000.0,1389385,0.14227002817705908,2014-11-12,2014-09-30,0001115418-14-000011
MMC,MARSH + MCLENNAN COS COMMON ST,571748102,47313000.0,903952,0.1421168364821636,2014-11-12,2014-09-30,0001115418-14-000011
N/A,JOHNSON CONTROLS INC COMMON ST,478366107,47126000.0,1071044,0.14155513360088012,2014-11-12,2014-09-30,0001115418-14-000011
PXDEUR,PIONEER NATURAL RESOURCES CO C,723787107,47088000.0,239060,0.14144099076938937,2014-11-12,2014-09-30,0001115418-14-000011
AFL,AFLAC INC COMMON STOCK USD.1,001055102,46961000.0,806206,0.14105951341151238,2014-11-12,2014-09-30,0001115418-14-000011
PPG,PPG INDUSTRIES INC COMMON STOC,693506107,46817000.0,237965,0.14062697215533687,2014-11-12,2014-09-30,0001115418-14-000011
APD,AIR PRODUCTS + CHEMICALS INC C,009158106,46087000.0,354023,0.13843422828722493,2014-11-12,2014-09-30,0001115418-14-000011
CTSH,COGNIZANT TECH SOLUTIONS A COM,192446102,45699000.0,1020761,0.13726876990252984,2014-11-12,2014-09-30,0001115418-14-000011
CMI,CUMMINS INC COMMON STOCK USD2.,231021106,45107000.0,341771,0.13549054473825278,2014-11-12,2014-09-30,0001115418-14-000011
N/A,CBS CORP CLASS B NON VOTING CO,124857202,44905000.0,839345,0.13488378547611768,2014-11-12,2014-09-30,0001115418-14-000011
N/A,SPECTRA ENERGY CORP COMMON STO,847560109,44788000.0,1140817,0.1345323457054751,2014-11-12,2014-09-30,0001115418-14-000011
ALL,ALLSTATE CORP COMMON STOCK USD,020002101,44014000.0,717198,0.13220743645353175,2014-11-12,2014-09-30,0001115418-14-000011
DVN,DEVON ENERGY CORPORATION COMMO,25179M103,43928000.0,644295,0.13194911320331584,2014-11-12,2014-09-30,0001115418-14-000011
HES,HESS CORP COMMON STOCK USD1.,42809H107,43547000.0,461689,0.13080468112968482,2014-11-12,2014-09-30,0001115418-14-000011
NOC,NORTHROP GRUMMAN CORP COMMON S,666807102,42965000.0,326083,0.12905649355264218,2014-11-12,2014-09-30,0001115418-14-000011
BEN,FRANKLIN RESOURCES INC COMMON,354613101,42713000.0,782144,0.12829954635433502,2014-11-12,2014-09-30,0001115418-14-000011
KMI,KINDER MORGAN INC COMMON STOCK,49456B101,42618000.0,1111578,0.12801418927560815,2014-11-12,2014-09-30,0001115418-14-000011
N/A,CHUBB CORP COMMON STOCK USD1.,171232101,42449000.0,466066,0.12750655405134662,2014-11-12,2014-09-30,0001115418-14-000011
GLW,CORNING INC COMMON STOCK USD.5,219350105,42189000.0,2181439,0.12672557678325194,2014-11-12,2014-09-30,0001115418-14-000011
AEP,AMERICAN ELECTRIC POWER COMMON,025537101,42059000.0,805571,0.12633508814920463,2014-11-12,2014-09-30,0001115418-14-000011
BBTUSD,BB+T CORP COMMON STOCK USD5.,054937107,41540000.0,1116362,0.12477613737173876,2014-11-12,2014-09-30,0001115418-14-000011
MRO*,MARATHON OIL CORP COMMON STOCK,565849106,41456000.0,1102856,0.1245238216389697,2014-11-12,2014-09-30,0001115418-14-000011
N/A,CROWN CASTLE INTL CORP COMMON,228227104,41067000.0,509954,0.12335535949555115,2014-11-12,2014-09-30,0001115418-14-000011
VLO,VALERO ENERGY CORP COMMON STOC,91913Y100,40297000.0,870919,0.1210424652785016,2014-11-12,2014-09-30,0001115418-14-000011
BDX,BECTON DICKINSON AND CO COMMON,075887109,39818000.0,349863,0.11960366484997337,2014-11-12,2014-09-30,0001115418-14-000011
N/A,AON PLC,G0408V102,39690000.0,452716,0.11921918373337292,2014-11-12,2014-09-30,0001115418-14-000011
KR,KROGER CO COMMON STOCK USD1.,501044101,39329000.0,756320,0.11813482683421073,2014-11-12,2014-09-30,0001115418-14-000011
SYY,SYSCO CORP COMMON STOCK USD1.,871829107,39186000.0,1032569,0.11770528933675865,2014-11-12,2014-09-30,0001115418-14-000011
MPC,MARATHON PETROLEUM CORP COMMON,56585A102,39145000.0,462327,0.11758213522909758,2014-11-12,2014-09-30,0001115418-14-000011
NFLX,NETFLIX INC COMMON STOCK USD.0,64110L106,39082000.0,86621,0.11739289842952079,2014-11-12,2014-09-30,0001115418-14-000011
VRTX,VERTEX PHARMACEUTICALS INC COM,92532F100,38919000.0,346533,0.11690328575759991,2014-11-12,2014-09-30,0001115418-14-000011
CTLEUR,CENTURYLINK INC COMMON STOCK U,156700106,38672000.0,945759,0.11616135735291,2014-11-12,2014-09-30,0001115418-14-000011
AMAT,APPLIED MATERIALS INC COMMON S,038222105,36830000.0,1704294,0.11062843378433168,2014-11-12,2014-09-30,0001115418-14-000011
EQR,EQUITY RESIDENTIAL REIT USD.01,29476L107,36697000.0,595920,0.11022893387411403,2014-11-12,2014-09-30,0001115418-14-000011
TROW,T ROWE PRICE GROUP INC COMMON,74144T108,36233000.0,462156,0.10883518982643742,2014-11-12,2014-09-30,0001115418-14-000011
VFC,VF CORP COMMON STOCK USD1.,918204108,36174000.0,547840,0.1086579680617544,2014-11-12,2014-09-30,0001115418-14-000011
WM,WASTE MANAGEMENT INC COMMON ST,94106L109,35788000.0,752957,0.10749851719450618,2014-11-12,2014-09-30,0001115418-14-000011
INTU,INTUIT INC COMMON STOCK USD.01,461202103,35607000.0,406244,0.10695483686556335,2014-11-12,2014-09-30,0001115418-14-000011
NBL2EUR,NOBLE ENERGY INC COMMON STOCK,655044105,35390000.0,517703,0.10630302122257666,2014-11-12,2014-09-30,0001115418-14-000011
SRE,SEMPRA ENERGY COMMON STOCK NPV,816851109,34187000.0,324421,0.10268949947827716,2014-11-12,2014-09-30,0001115418-14-000011
N/A,MCGRAW HILL FINANCIAL INC,580645109,33816000.0,400427,0.10157510499188055,2014-11-12,2014-09-30,0001115418-14-000011
LUV,SOUTHWEST AIRLINES CO COMMON S,844741108,33733000.0,998919,0.10132579301783493,2014-11-12,2014-09-30,0001115418-14-000011
PCG,P G + E CORP COMMON STOCK NPV,69331C108,33052000.0,733830,0.09928023332717163,2014-11-12,2014-09-30,0001115418-14-000011
CAH,CARDINAL HEALTH INC COMMON STO,14149Y108,33040000.0,440998,0.09924418822249033,2014-11-12,2014-09-30,0001115418-14-000011
N/A,CIGNA CORP COMMON STOCK USD.25,125509109,32095000.0,353893,0.09640563622883859,2014-11-12,2014-09-30,0001115418-14-000011
A4S,AMERIPRISE FINANCIAL INC COMMO,03076C106,31973000.0,259142,0.0960391776645788,2014-11-12,2014-09-30,0001115418-14-000011
N/A,LORILLARD INC COMMON STOCK USD,544147101,31433000.0,524677,0.09441714795392066,2014-11-12,2014-09-30,0001115418-14-000011
PCAR,PACCAR INC COMMON STOCK USD1.,693718108,31429000.0,552604,0.09440513291902689,2014-11-12,2014-09-30,0001115418-14-000011
N/A,REYNOLDS AMERICAN INC COMMON S,761713106,30751000.0,521198,0.0923685845045339,2014-11-12,2014-09-30,0001115418-14-000011
CMG,CHIPOTLE MEXICAN GRILL INC COM,169656105,29981000.0,44976,0.09005569028748434,2014-11-12,2014-09-30,0001115418-14-000011
ZTS,ZOETIS INC COM,98978V103,29966000.0,810988,0.09001063390663272,2014-11-12,2014-09-30,0001115418-14-000011
ICE,INTERCONTINENTAL EXCHANGE INC,45866F104,29926000.0,153427,0.08989048355769509,2014-11-12,2014-09-30,0001115418-14-000011
EL,ESTEE LAUDER COMPANIES CL A CO,518439104,29587000.0,395965,0.0888722093504486,2014-11-12,2014-09-30,0001115418-14-000011
