ticker,nameOfIssuer,cusip,value,shares,allocation_percent,filingDate,reportDate,accessionNumber
AAPL,APPLE INC COMMON STOCK NPV,037833100,1105633000.0,10016603,3.2118802789929775,2015-02-06,2014-12-31,0001115418-15-000002
MSFT,MICROSOFT CORP COMMON STOCK US,594918104,636486000.0,13702605,1.849001279136137,2015-02-06,2014-12-31,0001115418-15-000002
XOM,EXXON MOBIL CORP COMMON STOCK,30231G102,634308000.0,6861089,1.842674156802011,2015-02-06,2014-12-31,0001115418-15-000002
JNJ,JOHNSON + JOHNSON COMMON STOCK,478160104,445862000.0,4263765,1.2952357291726704,2015-02-06,2014-12-31,0001115418-15-000002
BRK/B,BERKSHIRE HATHAWAY INC CL B CO,084670702,430740000.0,2868729,1.2513060946746661,2015-02-06,2014-12-31,0001115418-15-000002
WFC,WELLS FARGO + CO COMMON STOCK,949746101,415216000.0,7574173,1.2062086442086555,2015-02-06,2014-12-31,0001115418-15-000002
PG,PROCTER + GAMBLE CO/THE COMMON,742718109,400781000.0,4399835,1.1642747549097074,2015-02-06,2014-12-31,0001115418-15-000002
JPM,JPMORGAN CHASE + CO COMMON STO,46625H100,370634000.0,5922556,1.0766972723537407,2015-02-06,2014-12-31,0001115418-15-000002
GE,GENERAL ELECTRIC CO COMMON STO,369604103,369672000.0,14628899,1.0739026480720928,2015-02-06,2014-12-31,0001115418-15-000002
CVX,CHEVRON CORP COMMON STOCK USD.,166764100,346027000.0,3084565,1.0052135720434385,2015-02-06,2014-12-31,0001115418-15-000002
BAC,VERIZON COMMUNICATIONS INC COM,92343V104,327118000.0,6992685,0.9502826463244358,2015-02-06,2014-12-31,0001115418-15-000002
BAC,BANK OF AMERICA CORP COMMON ST,060505104,296128000.0,16552731,0.8602562362534698,2015-02-06,2014-12-31,0001115418-15-000002
PFE,PFIZER INC COMMON STOCK USD.05,717081103,296000000.0,9502423,0.859884394353209,2015-02-06,2014-12-31,0001115418-15-000002
INTC,INTEL CORP COMMON STOCK USD.00,458140100,292769000.0,8067492,0.8504982913864683,2015-02-06,2014-12-31,0001115418-15-000002
KO,COCA COLA CO/THE COMMON STOCK,191216100,292056000.0,6917483,0.8484270158014215,2015-02-06,2014-12-31,0001115418-15-000002
T,AT+T INC COMMON STOCK USD1.,00206R102,283324000.0,8434759,0.8230604261680019,2015-02-06,2014-12-31,0001115418-15-000002
DIS,WALT DISNEY CO/THE COMMON STOC,254687106,262459000.0,2786487,0.762447291410638,2015-02-06,2014-12-31,0001115418-15-000002
META,FACEBOOK INC COM,30303M102,260880000.0,3343756,0.757860272969139,2015-02-06,2014-12-31,0001115418-15-000002
C,CITIGROUP INC COMMON STOCK USD,172967424,258563000.0,4778466,0.7511293535714485,2015-02-06,2014-12-31,0001115418-15-000002
IBM,INTL BUSINESS MACHINES CORP CO,459200101,256833000.0,1600803,0.7461036778882355,2015-02-06,2014-12-31,0001115418-15-000002
N/A,GOOGLE INC CL C COMMON STOCK U,38259P706,252705000.0,480062,0.7341117766048231,2015-02-06,2014-12-31,0001115418-15-000002
ORCL,ORACLE CORP COMMON STOCK USD.0,68389X105,252476000.0,5614325,0.7334465282051377,2015-02-06,2014-12-31,0001115418-15-000002
CMCSA,COMCAST CORP CLASS A COMMON ST,20030N101,249575000.0,4302270,0.7250190801375072,2015-02-06,2014-12-31,0001115418-15-000002
N/A,GOOGLE INC CL A COMMON STOCK U,38259P508,247406000.0,466224,0.7187181029369932,2015-02-06,2014-12-31,0001115418-15-000002
PEP,PEPSICO INC COMMON STOCK USD.0,713448108,244998000.0,2590928,0.7117228271883361,2015-02-06,2014-12-31,0001115418-15-000002
HD,HOME DEPOT INC COMMON STOCK US,437076102,241184000.0,2297645,0.7006431005665011,2015-02-06,2014-12-31,0001115418-15-000002
GILD,GILEAD SCIENCES INC COMMON STO,375558103,240879000.0,2555473,0.6997570710385358,2015-02-06,2014-12-31,0001115418-15-000002
MRK,MERCK + CO. INC. COMMON STOCK,58933Y105,240408000.0,4233286,0.6983888090461697,2015-02-06,2014-12-31,0001115418-15-000002
CSCO,CISCO SYSTEMS INC COMMON STOCK,17275R102,231642000.0,8327950,0.6729234489079934,2015-02-06,2014-12-31,0001115418-15-000002
WMT,WAL MART STORES INC COMMON STO,931142103,223591000.0,2603525,0.6495351743845552,2015-02-06,2014-12-31,0001115418-15-000002
QCOM,QUALCOMM INC COMMON STOCK USD.,747525103,216730000.0,2915781,0.6296038675276047,2015-02-06,2014-12-31,0001115418-15-000002
V,VISA INC CLASS A SHARES COMMON,92826C839,213668000.0,814905,0.6207087120698022,2015-02-06,2014-12-31,0001115418-15-000002
AMGN,AMGEN INC COMMON STOCK USD.000,031162100,205577000.0,1290582,0.5972042369525326,2015-02-06,2014-12-31,0001115418-15-000002
MMM,3M CO COMMON STOCK USD.01,88579Y101,192556000.0,1171833,0.5593780386455287,2015-02-06,2014-12-31,0001115418-15-000002
AMZN,AMAZON.COM INC COMMON STOCK US,023135106,192235000.0,619413,0.5584455288800307,2015-02-06,2014-12-31,0001115418-15-000002
PM,PHILIP MORRIS INTERNATIONAL CO,718172109,187351000.0,2300191,0.5442574363732028,2015-02-06,2014-12-31,0001115418-15-000002
CVS,CVS HEALTH CORP,126650100,186649000.0,1938006,0.5422181159514597,2015-02-06,2014-12-31,0001115418-15-000002
UNP,UNION PACIFIC CORP COMMON STOC,907818108,184232000.0,1546482,0.5351966950691905,2015-02-06,2014-12-31,0001115418-15-000002
ABBV,ABBVIE INC.,00287Y109,176013000.0,2689685,0.5113203780516601,2015-02-06,2014-12-31,0001115418-15-000002
UNH,UNITEDHEALTH GROUP INC COMMON,91324P102,167043000.0,1652417,0.4852623948849428,2015-02-06,2014-12-31,0001115418-15-000002
MCD,MCDONALD S CORP COMMON STOCK U,580135101,158031000.0,1686564,0.45908240109470255,2015-02-06,2014-12-31,0001115418-15-000002
UTXZ,UNITED TECHNOLOGIES CORP COMMO,913017109,147960000.0,1286606,0.4298259965827729,2015-02-06,2014-12-31,0001115418-15-000002
BMY,BRISTOL MYERS SQUIBB CO COMMON,110122108,147534000.0,2499309,0.4285884602584673,2015-02-06,2014-12-31,0001115418-15-000002
CELG,CELGENE CORP COMMON STOCK USD.,151020104,147314000.0,1316948,0.427949356992394,2015-02-06,2014-12-31,0001115418-15-000002
BA,BOEING CO/THE COMMON STOCK USD,097023105,144275000.0,1109982,0.41912101687604464,2015-02-06,2014-12-31,0001115418-15-000002
MO,ALTRIA GROUP INC COMMON STOCK,02209S103,143825000.0,2919115,0.41781376019544014,2015-02-06,2014-12-31,0001115418-15-000002
SLB,SCHLUMBERGER LTD COMMON STOCK,806857108,142766000.0,1671541,0.41473734947375074,2015-02-06,2014-12-31,0001115418-15-000002
COP,CONOCOPHILLIPS COMMON STOCK US,20825C104,141296000.0,2045990,0.4104669776504426,2015-02-06,2014-12-31,0001115418-15-000002
MA,MASTERCARD INC CLASS A COMMON,57636Q104,141240000.0,1639278,0.4103042968190785,2015-02-06,2014-12-31,0001115418-15-000002
AXP,AMERICAN EXPRESS CO COMMON STO,025816109,137715000.0,1480168,0.40006411948767623,2015-02-06,2014-12-31,0001115418-15-000002
BIIB,BIOGEN IDEC INC COMMON STOCK U,09062X103,135077000.0,397928,0.3924006903244878,2015-02-06,2014-12-31,0001115418-15-000002
USB,US BANCORP COMMON STOCK USD.01,902973304,131031000.0,2915048,0.3806470002584301,2015-02-06,2014-12-31,0001115418-15-000002
GS,GOLDMAN SACHS GROUP INC COMMON,38141G104,129783000.0,669572,0.37702154173088687,2015-02-06,2014-12-31,0001115418-15-000002
UPS,UNITED PARCEL SERVICE CL B COM,911312106,129399000.0,1163974,0.3759060160301043,2015-02-06,2014-12-31,0001115418-15-000002
AIG,AMERICAN INTERNATIONAL GROUP C,026874784,128672000.0,2297296,0.37379407023721656,2015-02-06,2014-12-31,0001115418-15-000002
HON,HONEYWELL INTERNATIONAL INC CO,438516106,125478000.0,1255783,0.36451545281977005,2015-02-06,2014-12-31,0001115418-15-000002
MDT,MEDTRONIC PLC,G5960L103,125090000.0,1732543,0.3633883070596044,2015-02-06,2014-12-31,0001115418-15-000002
N/A,HEWLETT PACKARD CO COMMON STOC,428236103,120431000.0,3001013,0.34985384289307875,2015-02-06,2014-12-31,0001115418-15-000002
LOW,LOWE S COS INC COMMON STOCK US,548661107,119994000.0,1744094,0.34858435140546945,2015-02-06,2014-12-31,0001115418-15-000002
NKE,NIKE INC  CL B COMMON STOCK NP,654106103,118910000.0,1236711,0.3454353153126354,2015-02-06,2014-12-31,0001115418-15-000002
WBA,WALGREENS BOOTS ALLIANCE INC,931427108,118184000.0,1550966,0.34332627453459336,2015-02-06,2014-12-31,0001115418-15-000002
N/A,TWENTY-FIRST CENTURY FOX INC.,90130A101,117135000.0,3049992,0.3402789139613619,2015-02-06,2014-12-31,0001115418-15-000002
TWXCHF,TIME WARNER INC COMMON STOCK U,887317303,115710000.0,1354600,0.3361392678061142,2015-02-06,2014-12-31,0001115418-15-000002
N/A,DU PONT (E.I.) DE NEMOURS COMM,263534109,111320000.0,1505539,0.32338625263310544,2015-02-06,2014-12-31,0001115418-15-000002
EBA,EBAY INC COMMON STOCK USD.001,278642103,111314000.0,1983504,0.3233688225440307,2015-02-06,2014-12-31,0001115418-15-000002
COST,COSTCO WHOLESALE CORP COMMON S,22160K105,110103000.0,776739,0.3198508495657816,2015-02-06,2014-12-31,0001115418-15-000002
ABT,ABBOTT LABORATORIES COMMON STO,002824100,109320000.0,2428265,0.3175762229415297,2015-02-06,2014-12-31,0001115418-15-000002
N/A,ALLERGAN INC COMMON STOCK USD.,018490102,107478000.0,505563,0.3122251855955885,2015-02-06,2014-12-31,0001115418-15-000002
LLY,ELI LILLY + CO COMMON STOCK NP,532457108,105934000.0,1535495,0.307739842673692,2015-02-06,2014-12-31,0001115418-15-000002
N/A,EXPRESS SCRIPTS HOLDING COMPAN,30219G108,105033000.0,1240502,0.30512242429763714,2015-02-06,2014-12-31,0001115418-15-000002
CL,COLGATE PALMOLIVE CO COMMON ST,194162103,105029000.0,1517983,0.305110804238254,2015-02-06,2014-12-31,0001115418-15-000002
OXY,OCCIDENTAL PETROLEUM CORP COMM,674599105,104038000.0,1290634,0.3022319345260782,2015-02-06,2014-12-31,0001115418-15-000002
SPG,SIMON PROPERTY GROUP INC REIT,828806109,103832000.0,570161,0.3016335014678459,2015-02-06,2014-12-31,0001115418-15-000002
SBUX,STARBUCKS CORP COMMON STOCK US,855244109,102850000.0,1253502,0.29878077688928223,2015-02-06,2014-12-31,0001115418-15-000002
N/A,ACTAVIS PLC,G0083B108,101657000.0,394921,0.2953150941782573,2015-02-06,2014-12-31,0001115418-15-000002
TXN,TEXAS INSTRUMENTS INC COMMON S,882508104,100070000.0,1871690,0.29070483561799193,2015-02-06,2014-12-31,0001115418-15-000002
MDLZ,MONDELEZ INTERNATIONAL INC,609207105,98654000.0,2715880,0.28659133459635633,2015-02-06,2014-12-31,0001115418-15-000002
N/A,MONSANTO CO COMMON STOCK USD.0,61166W101,97773000.0,818393,0.2840320165172172,2015-02-06,2014-12-31,0001115418-15-000002
N/A,PRICELINE GROUP INC COMMON STO,741503403,97217000.0,85262,0.2824168282629591,2015-02-06,2014-12-31,0001115418-15-000002
ACN,ACCENTURE PLC CL A COMMON STOC,G1151C101,96841000.0,1084327,0.2813245426809429,2015-02-06,2014-12-31,0001115418-15-000002
N/A,EMC CORP/MASS COMMON STOCK USD,268648102,96522000.0,3245539,0.2803978429451366,2015-02-06,2014-12-31,0001115418-15-000002
F,FORD MOTOR CO COMMON STOCK USD,345370860,95563000.0,6165355,0.277611933708026,2015-02-06,2014-12-31,0001115418-15-000002
DUK,DUKE ENERGY CORP COMMON STOCK,26441C204,93488000.0,1119081,0.2715840279030162,2015-02-06,2014-12-31,0001115418-15-000002
DWD,MORGAN STANLEY COMMON STOCK US,617446448,92977000.0,2396324,0.2700995653168186,2015-02-06,2014-12-31,0001115418-15-000002
DHR,DANAHER CORP COMMON STOCK USD.,235851102,92767000.0,1082335,0.26948951219920314,2015-02-06,2014-12-31,0001115418-15-000002
MET,METLIFE INC COMMON STOCK USD.0,59156R108,87000000.0,1608435,0.25273629158354455,2015-02-06,2014-12-31,0001115418-15-000002
KMI,KINDER MORGAN INC COMMON STOCK,49456B101,86494000.0,2044300,0.2512663540715759,2015-02-06,2014-12-31,0001115418-15-000002
LMT,LOCKHEED MARTIN CORP COMMON ST,539830109,84127000.0,436865,0.24439018393159598,2015-02-06,2014-12-31,0001115418-15-000002
N/A,DOW CHEMICAL CO/THE COMMON STO,260543103,83825000.0,1837867,0.24351286944816805,2015-02-06,2014-12-31,0001115418-15-000002
TJX,TJX COMPANIES INC COMMON STOCK,872540109,83747000.0,1221161,0.24328627829019658,2015-02-06,2014-12-31,0001115418-15-000002
CAT,CATERPILLAR INC COMMON STOCK U,149123101,83719000.0,914660,0.2432049378745145,2015-02-06,2014-12-31,0001115418-15-000002
EOG,EOG RESOURCES INC COMMON STOCK,26875P101,82237000.0,893196,0.2388997058730569,2015-02-06,2014-12-31,0001115418-15-000002
BLKCHF,BLACKROCK INC COMMON STOCK USD,09247X101,81659000.0,228378,0.2372206072921915,2015-02-06,2014-12-31,0001115418-15-000002
TGT,TARGET CORP COMMON STOCK USD.0,87612E106,81482000.0,1073407,0.23670641966448705,2015-02-06,2014-12-31,0001115418-15-000002
EMR,EMERSON ELECTRIC CO COMMON STO,291011104,79748000.0,1291877,0.2316691239218909,2015-02-06,2014-12-31,0001115418-15-000002
GM,GENERAL MOTORS CO COMMON STOCK,37045V100,79040000.0,2264102,0.22961237341107307,2015-02-06,2014-12-31,0001115418-15-000002
MCK,MCKESSON CORP COMMON STOCK USD,58155Q103,79013000.0,380641,0.2295339380102368,2015-02-06,2014-12-31,0001115418-15-000002
FDX,FEDEX CORP COMMON STOCK USD.1,31428X106,78148000.0,450005,0.22702110016863028,2015-02-06,2014-12-31,0001115418-15-000002
PNC,PNC FINANCIAL SERVICES GROUP C,693475105,75779000.0,830640,0.22013911999895883,2015-02-06,2014-12-31,0001115418-15-000002
NEE,NEXTERA ENERGY INC COMMON STOC,65339F101,75476000.0,710093,0.21925890050068514,2015-02-06,2014-12-31,0001115418-15-000002
KMB,KIMBERLY CLARK CORP COMMON STO,494368103,73688000.0,637772,0.2140647339564164,2015-02-06,2014-12-31,0001115418-15-000002
N/A,YAHOO  INC COMMON STOCK USD.00,984332106,73524000.0,1455632,0.21358831152170718,2015-02-06,2014-12-31,0001115418-15-000002
TMO,THERMO FISHER SCIENTIFIC INC C,883556102,73391000.0,585772,0.21320194454721741,2015-02-06,2014-12-31,0001115418-15-000002
COF,CAPITAL ONE FINANCIAL CORP COM,14040H105,73160000.0,886251,0.2125308861178404,2015-02-06,2014-12-31,0001115418-15-000002
BK,BANK OF NEW YORK MELLON CORP C,064058100,73012000.0,1799653,0.2121009439206638,2015-02-06,2014-12-31,0001115418-15-000002
SO,SOUTHERN CO COMMON STOCK USD5.,842587107,72940000.0,1485247,0.21189178285176707,2015-02-06,2014-12-31,0001115418-15-000002
ADP,AUTOMATIC DATA PROCESSING COMM,053015103,72749000.0,872602,0.2113369250162216,2015-02-06,2014-12-31,0001115418-15-000002
D,DOMINION RESOURCES INC/VA COMM,25746U109,71519000.0,930027,0.20776375675590253,2015-02-06,2014-12-31,0001115418-15-000002
N/A,TIME WARNER CABLE COMMON STOCK,88732J207,71438000.0,469800,0.2075284505533937,2015-02-06,2014-12-31,0001115418-15-000002
N/A,DIRECTV CLASS A COMMON STOCK U,25490A309,68845000.0,794062,0.19999574705826575,2015-02-06,2014-12-31,0001115418-15-000002
PXGBX,PRAXAIR INC COMMON STOCK USD.0,74005P104,68656000.0,529914,0.19944669925241187,2015-02-06,2014-12-31,0001115418-15-000002
N/A,COVIDIEN PLC COMMON STOCK USD.,G2554F113,68520000.0,669926,0.19905161723338471,2015-02-06,2014-12-31,0001115418-15-000002
AMT,AMERICAN TOWER REIT INC,03027X100,67992000.0,687831,0.19751776939480872,2015-02-06,2014-12-31,0001115418-15-000002
APC,ANADARKO PETROLEUM CORP COMMON,032511107,66790000.0,809576,0.1940259415501717,2015-02-06,2014-12-31,0001115418-15-000002
PSX,PHILLIPS 66,718546104,65824000.0,918050,0.19121969720914062,2015-02-06,2014-12-31,0001115418-15-000002
PRU,PRUDENTIAL FINANCIAL INC COMMO,744320102,65136000.0,720052,0.18922104699523856,2015-02-06,2014-12-31,0001115418-15-000002
DAL,DELTA AIR LINES INC COMMON STO,247361702,64690000.0,1315095,0.18792541037401717,2015-02-06,2014-12-31,0001115418-15-000002
N/A,KRAFT FOOD GROUP INC.,50076Q106,62193000.0,992546,0.18067158830408486,2015-02-06,2014-12-31,0001115418-15-000002
GD,GENERAL DYNAMICS CORP COMMON S,369550108,62156000.0,451650,0.18056410275479073,2015-02-06,2014-12-31,0001115418-15-000002
ALXN,ALEXION PHARMACEUTICALS INC CO,015351109,61965000.0,334894,0.18000924491924525,2015-02-06,2014-12-31,0001115418-15-000002
BAX,BAXTER INTERNATIONAL INC COMMO,071813109,61290000.0,836261,0.17804835989833842,2015-02-06,2014-12-31,0001115418-15-000002
CSX,CSX CORP COMMON STOCK USD1.,126408103,61290000.0,1691687,0.17804835989833842,2015-02-06,2014-12-31,0001115418-15-000002
MU,MICRON TECHNOLOGY INC COMMON S,595112103,60863000.0,1738440,0.176807918559187,2015-02-06,2014-12-31,0001115418-15-000002
GIS,GENERAL MILLS INC COMMON STOCK,370334104,58833000.0,1103182,0.17091073842223764,2015-02-06,2014-12-31,0001115418-15-000002
ITW,ILLINOIS TOOL WORKS COMMON STO,452308109,58526000.0,618010,0.17001889886458077,2015-02-06,2014-12-31,0001115418-15-000002
N/A,AETNA INC COMMON STOCK USD.01,00817Y108,58407000.0,657512,0.16967320209793202,2015-02-06,2014-12-31,0001115418-15-000002
ADBE,ADOBE SYSTEMS INC COMMON STOCK,00724F101,58391000.0,803174,0.1696267218603994,2015-02-06,2014-12-31,0001115418-15-000002
CRM,SALESFORCE.COM INC COMMON STOC,79466L302,58148000.0,980402,0.16892080325287295,2015-02-06,2014-12-31,0001115418-15-000002
NSC,NORFOLK SOUTHERN CORP COMMON S,655844108,58006000.0,529201,0.16850829114477106,2015-02-06,2014-12-31,0001115418-15-000002
HAL,HALLIBURTON CO COMMON STOCK US,406216101,57656000.0,1465964,0.16749153594874533,2015-02-06,2014-12-31,0001115418-15-000002
SYK,STRYKER CORP COMMON STOCK USD.,863667101,57613000.0,610758,0.16736662031037644,2015-02-06,2014-12-31,0001115418-15-000002
N/A,ACE LTD COMMON STOCK CHF30.57,H0023R105,57325000.0,498996,0.16652997603478953,2015-02-06,2014-12-31,0001115418-15-000002
DE,DEERE + CO COMMON STOCK USD1.,244199105,56669000.0,640550,0.1646242862959527,2015-02-06,2014-12-31,0001115418-15-000002
TRV,TRAVELERS COS INC/THE COMMON S,89417E109,56428000.0,533092,0.16392417771811782,2015-02-06,2014-12-31,0001115418-15-000002
ELV,ANTHEM INC,036752103,55943000.0,445157,0.1625152455179107,2015-02-06,2014-12-31,0001115418-15-000002
N/A,PRECISION CASTPARTS CORP COMMO,740189105,55491000.0,230368,0.16120217880761456,2015-02-06,2014-12-31,0001115418-15-000002
PSA,PUBLIC STORAGE REIT USD.1,74460D109,54912000.0,297062,0.1595201752119034,2015-02-06,2014-12-31,0001115418-15-000002
CME,CME GROUP INC COMMON STOCK USD,12572Q105,54024000.0,609403,0.15694052202884376,2015-02-06,2014-12-31,0001115418-15-000002
YUM,YUM  BRANDS INC COMMON STOCK N,988498101,53985000.0,741038,0.15682722644985805,2015-02-06,2014-12-31,0001115418-15-000002
SCHW,SCHWAB (CHARLES) CORP COMMON S,808513105,53959000.0,1787315,0.15675169606386757,2015-02-06,2014-12-31,0001115418-15-000002
ADM,ARCHER DANIELS MIDLAND CO COMM,039483102,53641000.0,1031560,0.15582790134290703,2015-02-06,2014-12-31,0001115418-15-000002
PPG,PPG INDUSTRIES INC COMMON STOC,693506107,53561000.0,231715,0.15559550015524398,2015-02-06,2014-12-31,0001115418-15-000002
WMB,WILLIAMS COS INC COMMON STOCK,969457100,53062000.0,1180727,0.15414589774719586,2015-02-06,2014-12-31,0001115418-15-000002
STT,STATE STREET CORP COMMON STOCK,857477103,52837000.0,673084,0.1534922694068936,2015-02-06,2014-12-31,0001115418-15-000002
N/A,LYONDELLBASELL INDU CL A COMMO,N53745100,52808000.0,665169,0.15340802397636571,2015-02-06,2014-12-31,0001115418-15-000002
REGN,REGENERON PHARMACEUTICALS COMM,75886F107,52585000.0,128177,0.15276020566575502,2015-02-06,2014-12-31,0001115418-15-000002
CTSH,COGNIZANT TECH SOLUTIONS A COM,192446102,52286000.0,992892,0.15189160622686446,2015-02-06,2014-12-31,0001115418-15-000002
N/A,EATON CORP PLC,G29183103,50995000.0,750364,0.1481412320609523,2015-02-06,2014-12-31,0001115418-15-000002
N/A,JOHNSON CONTROLS INC COMMON ST,478366107,50892000.0,1052787,0.14784201553183618,2015-02-06,2014-12-31,0001115418-15-000002
PEO,EXELON CORP COMMON STOCK NPV,30161N101,50632000.0,1365474,0.14708671167193133,2015-02-06,2014-12-31,0001115418-15-000002
MMC,MARSH + MCLENNAN COS COMMON ST,571748102,50588000.0,883792,0.14695889101871668,2015-02-06,2014-12-31,0001115418-15-000002
ECL,ECOLAB INC COMMON STOCK USD1.,278865100,50090000.0,479241,0.14551219362551432,2015-02-06,2014-12-31,0001115418-15-000002
VIAB,VIACOM INC CLASS B COMMON STOC,92553P201,50069000.0,665363,0.14545118831375276,2015-02-06,2014-12-31,0001115418-15-000002
APD,AIR PRODUCTS + CHEMICALS INC C,009158106,50000000.0,346668,0.1452507422893934,2015-02-06,2014-12-31,0001115418-15-000002
RTN1USD,RAYTHEON COMPANY COMMON STOCK,755111507,49790000.0,460293,0.14464068917177794,2015-02-06,2014-12-31,0001115418-15-000002
ALL,ALLSTATE CORP COMMON STOCK USD,020002101,49311000.0,701942,0.14324918706064554,2015-02-06,2014-12-31,0001115418-15-000002
NOVEUR,NATIONAL OILWELL VARCO INC COM,637071101,49013000.0,747954,0.14238349263660077,2015-02-06,2014-12-31,0001115418-15-000002
GLW,CORNING INC COMMON STOCK USD.5,219350105,48971000.0,2135692,0.1422614820130777,2015-02-06,2014-12-31,0001115418-15-000002
AFL,AFLAC INC COMMON STOCK USD.1,001055102,48847000.0,799589,0.14190126017219998,2015-02-06,2014-12-31,0001115418-15-000002
AEP,AMERICAN ELECTRIC POWER COMMON,025537101,48460000.0,798091,0.14077701942688006,2015-02-06,2014-12-31,0001115418-15-000002
BDX,BECTON DICKINSON AND CO COMMON,075887109,48027000.0,345124,0.13951914799865392,2015-02-06,2014-12-31,0001115418-15-000002
N/A,CHUBB CORP COMMON STOCK USD1.,171232101,47521000.0,459270,0.13804921048668528,2015-02-06,2014-12-31,0001115418-15-000002
KR,KROGER CO COMMON STOCK USD1.,501044101,47212000.0,735269,0.1371515608993368,2015-02-06,2014-12-31,0001115418-15-000002
DFSEUR,DISCOVER FINANCIAL SERVICES CO,254709108,47202000.0,720758,0.13712251075087895,2015-02-06,2014-12-31,0001115418-15-000002
CMI,CUMMINS INC COMMON STOCK USD2.,231021106,46155000.0,320146,0.13408096020733903,2015-02-06,2014-12-31,0001115418-15-000002
NOC,NORTHROP GRUMMAN CORP COMMON S,666807102,45795000.0,310704,0.13303515486285541,2015-02-06,2014-12-31,0001115418-15-000002
N/A,CBS CORP CLASS B NON VOTING CO,124857202,45049000.0,814048,0.13086801378789767,2015-02-06,2014-12-31,0001115418-15-000002
BBTUSD,BB+T CORP COMMON STOCK USD5.,054937107,43006000.0,1105826,0.12493306845795306,2015-02-06,2014-12-31,0001115418-15-000002
EQR,EQUITY RESIDENTIAL REIT USD.01,29476L107,42701000.0,594396,0.12404703892998775,2015-02-06,2014-12-31,0001115418-15-000002
VLO,VALERO ENERGY CORP COMMON STOC,91913Y100,42479000.0,858159,0.12340212563422283,2015-02-06,2014-12-31,0001115418-15-000002
BEN,FRANKLIN RESOURCES INC COMMON,354613101,42306000.0,764054,0.12289955806590153,2015-02-06,2014-12-31,0001115418-15-000002
N/A,AON PLC,G0408V102,42238000.0,445403,0.12270201705638797,2015-02-06,2014-12-31,0001115418-15-000002
AMAT,APPLIED MATERIALS INC COMMON S,038222105,41816000.0,1678020,0.12147610079146548,2015-02-06,2014-12-31,0001115418-15-000002
LUV,SOUTHWEST AIRLINES CO COMMON S,844741108,41325000.0,976478,0.12004973850218364,2015-02-06,2014-12-31,0001115418-15-000002
N/A,SPECTRA ENERGY CORP COMMON STO,847560109,41015000.0,1129895,0.11914918389998941,2015-02-06,2014-12-31,0001115418-15-000002
SYY,SYSCO CORP COMMON STOCK USD1.,871829107,40880000.0,1029992,0.11875700689580804,2015-02-06,2014-12-31,0001115418-15-000002
N/A,BAKER HUGHES INC COMMON STOCK,057224107,40721000.0,726249,0.11829510953532776,2015-02-06,2014-12-31,0001115418-15-000002
VFC,VF CORP COMMON STOCK USD1.,918204108,40464000.0,540240,0.11754852071996029,2015-02-06,2014-12-31,0001115418-15-000002
VRTX,VERTEX PHARMACEUTICALS INC COM,92532F100,40415000.0,340196,0.11740617499251668,2015-02-06,2014-12-31,0001115418-15-000002
MPC,MARATHON PETROLEUM CORP COMMON,56585A102,40298000.0,446461,0.11706628825555951,2015-02-06,2014-12-31,0001115418-15-000002
AAL,AMERICAN AIRLINES GROUP  INC,02376R102,40103000.0,747775,0.11649981036063087,2015-02-06,2014-12-31,0001115418-15-000002
TROW,T ROWE PRICE GROUP INC COMMON,74144T108,39292000.0,457633,0.11414384332069691,2015-02-06,2014-12-31,0001115418-15-000002
9990302D,APACHE CORP COMMON STOCK USD.6,037411105,39192000.0,625376,0.11385334183611812,2015-02-06,2014-12-31,0001115418-15-000002
DVN,DEVON ENERGY CORPORATION COMMO,25179M103,39082000.0,638486,0.11353379020308145,2015-02-06,2014-12-31,0001115418-15-000002
8CW,CROWN CASTLE INTL CORP COMMON,22822V101,39011000.0,495689,0.11332753414903052,2015-02-06,2014-12-31,0001115418-15-000002
FCX,FREEPORT MCMORAN INC.,35671D857,38955000.0,1667581,0.11316485331766639,2015-02-06,2014-12-31,0001115418-15-000002
PCG,P G + E CORP COMMON STOCK NPV,69331C108,38953000.0,731643,0.11315904328797481,2015-02-06,2014-12-31,0001115418-15-000002
WM,WASTE MANAGEMENT INC COMMON ST,94106L109,38700000.0,754097,0.11242407453199048,2015-02-06,2014-12-31,0001115418-15-000002
INTU,INTUIT INC COMMON STOCK USD.01,461202103,37036000.0,401732,0.10759012982859949,2015-02-06,2014-12-31,0001115418-15-000002
CTLEUR,CENTURYLINK INC COMMON STOCK U,156700106,36744000.0,928359,0.1067418654936294,2015-02-06,2014-12-31,0001115418-15-000002
SRE,SEMPRA ENERGY COMMON STOCK NPV,816851109,36188000.0,324968,0.10512667723937136,2015-02-06,2014-12-31,0001115418-15-000002
CAH,CARDINAL HEALTH INC COMMON STO,14149Y108,35684000.0,442022,0.10366254975709428,2015-02-06,2014-12-31,0001115418-15-000002
N/A,CIGNA CORP COMMON STOCK USD.25,125509109,35674000.0,346651,0.10363349960863641,2015-02-06,2014-12-31,0001115418-15-000002
N/A,MCGRAW HILL FINANCIAL INC,580645109,35152000.0,395052,0.10211708185913512,2015-02-06,2014-12-31,0001115418-15-000002
PXDEUR,PIONEER NATURAL RESOURCES CO C,723787107,35125000.0,235976,0.10203864645829887,2015-02-06,2014-12-31,0001115418-15-000002
PCAR,PACCAR INC COMMON STOCK USD1.,693718108,34803000.0,511736,0.10110323167795517,2015-02-06,2014-12-31,0001115418-15-000002
N/A,HEALTH CARE REIT INC REIT USD1,42217K106,34249000.0,452610,0.0994938534533887,2015-02-06,2014-12-31,0001115418-15-000002
HES,HESS CORP COMMON STOCK USD1.,42809H107,33657000.0,455933,0.09777408466468226,2015-02-06,2014-12-31,0001115418-15-000002
A4S,AMERIPRISE FINANCIAL INC COMMO,03076C106,33636000.0,254340,0.09771307935292073,2015-02-06,2014-12-31,0001115418-15-000002
ICE,INTERCONTINENTAL EXCHANGE INC,45866F104,33397000.0,152297,0.09701878080477742,2015-02-06,2014-12-31,0001115418-15-000002
N/A,AVAGO TECHNOLOGIES LTD COMMON,Y0486S104,32887000.0,326946,0.09553722323342562,2015-02-06,2014-12-31,0001115418-15-000002
ZTS,ZOETIS INC COM,98978V103,32855000.0,763538,0.0954442627583604,2015-02-06,2014-12-31,0001115418-15-000002
N/A,REYNOLDS AMERICAN INC COMMON S,761713106,32679000.0,508468,0.09493298014550174,2015-02-06,2014-12-31,0001115418-15-000002
N/A,LORILLARD INC COMMON STOCK USD,544147101,32531000.0,516857,0.09450303794832512,2015-02-06,2014-12-31,0001115418-15-000002
M,MACY S INC COMMON STOCK USD.01,55616P104,32161000.0,489148,0.09342818245538362,2015-02-06,2014-12-31,0001115418-15-000002
SHW,SHERWIN WILLIAMS CO/THE COMMON,824348106,31958000.0,121493,0.09283846444168868,2015-02-06,2014-12-31,0001115418-15-000002
