ticker,nameOfIssuer,cusip,value,shares,allocation_percent,filingDate,reportDate,accessionNumber
VOO,VANGUARD INDEX FDS S&P 500 ETF SHS,922908363,312798000.0,1574638,4.770383415918329,2016-11-04,2016-09-30,0001140361-16-084876
SPY,SPDR S&P 500 ETF TR TR UNIT,78462F103,235137000.0,1087089,3.586000055207476,2016-11-04,2016-09-30,0001140361-16-084876
FLOT,ISHARES TR FLTG RATE BD ETF,46429B655,207638000.0,4091374,3.166621499224579,2016-11-04,2016-09-30,0001140361-16-084876
IGIB,ISHARES TR INTERM CR BD ETF,464288638,174623000.0,1568239,2.6631201709662666,2016-11-04,2016-09-30,0001140361-16-084876
N/A,SPDR SERIES TRUST BRC HGH YLD BD,78464A417,171486000.0,4670088,2.6152787756384965,2016-11-04,2016-09-30,0001140361-16-084876
HYG,ISHARES TR IBOXX HI YD ETF,464288513,164886000.0,1889596,2.5146242620384704,2016-11-04,2016-09-30,0001140361-16-084876
VTV,VANGUARD INDEX FDS VALUE ETF,922908744,161651000.0,1858051,2.4652882996905787,2016-11-04,2016-09-30,0001140361-16-084876
SHY,ISHARES TR 1-3 YR TR BD ETF,464287457,103448000.0,1216466,1.5776527458932579,2016-11-04,2016-09-30,0001140361-16-084876
IWS,ISHARES TR RUS MDCP VAL ETF,464287473,100672000.0,1311351,1.5353168474457315,2016-11-04,2016-09-30,0001140361-16-084876
IEFA,ISHARES TR CORE MSCI EAFE,46432F842,100097000.0,1815325,1.5265477042154263,2016-11-04,2016-09-30,0001140361-16-084876
VUG,VANGUARD INDEX FDS GROWTH ETF,922908736,98354000.0,875899,1.499965762214692,2016-11-04,2016-09-30,0001140361-16-084876
TLT,ISHARES TR 20 YR TR BD ETF,464287432,97846000.0,711556,1.4922184148042659,2016-11-04,2016-09-30,0001140361-16-084876
IYC,ISHARES TR U.S. CNSM SV ETF,464287580,97764000.0,664566,1.490967858726205,2016-11-04,2016-09-30,0001140361-16-084876
IYH,ISHARES TR US HLTHCARE ETF,464287762,97128000.0,646617,1.4812684237792932,2016-11-04,2016-09-30,0001140361-16-084876
IYJ,ISHARES TR U.S. INDS ETF,464287754,95646000.0,836429,1.4586669102709238,2016-11-04,2016-09-30,0001140361-16-084876
IXJ,ISHARES TR GLOB HLTHCRE ETF,464287325,95253000.0,945536,1.4526733915065586,2016-11-04,2016-09-30,0001140361-16-084876
IYF,ISHARES TR U.S. FINLS ETF,464287788,94866000.0,1054071,1.4467713768454662,2016-11-04,2016-09-30,0001140361-16-084876
IEMG,ISHARES INC CORE MSCI EMKT,46434G103,91364000.0,2003168,1.3933634819019372,2016-11-04,2016-09-30,0001140361-16-084876
RWR,SPDR SERIES TRUST DJ REIT ETF,78464A607,91026000.0,934851,1.3882087507509056,2016-11-04,2016-09-30,0001140361-16-084876
SPAB,SPDR SERIES TRUST BRCLYS AGG ETF,78464A649,87047000.0,1469141,1.327526279597193,2016-11-04,2016-09-30,0001140361-16-084876
MGK,VANGUARD WORLD FD MEGA GRWTH IND,921910816,86192000.0,985274,1.3144869448808258,2016-11-04,2016-09-30,0001140361-16-084876
MGV,VANGUARD WORLD FD MEGA CAP VAL ETF,921910840,85701000.0,1367493,1.306998859096339,2016-11-04,2016-09-30,0001140361-16-084876
VEA,VANGUARD TAX MANAGED INTL FD FTSE DEV MKT ETF,921943858,84391000.0,2256315,1.2870204632151216,2016-11-04,2016-09-30,0001140361-16-084876
PFF,ISHARES TR U.S. PFD STK ETF,464288687,83865000.0,2123167,1.2789986034948773,2016-11-04,2016-09-30,0001140361-16-084876
SPDW,SPDR INDEX SHS FDS S&P WRLD EX US,78463X889,75745000.0,2861545,1.1551630503990875,2016-11-04,2016-09-30,0001140361-16-084876
IPAC,ISHARES TR CORE MSCI PAC,46434V696,74302000.0,1461198,1.1331563135619909,2016-11-04,2016-09-30,0001140361-16-084876
BNDX,VANGUARD CHARLOTTE FDS INTL BD IDX ETF,92203J407,67149000.0,1198226,1.0240681717769928,2016-11-04,2016-09-30,0001140361-16-084876
BWX,SPDR SERIES TRUST BRCLYS INTL ETF,78464A516,66893000.0,2319436,1.0201639967040221,2016-11-04,2016-09-30,0001140361-16-084876
VBK,VANGUARD INDEX FDS SML CP GRW ETF,922908595,66497000.0,504610,1.0141247258880206,2016-11-04,2016-09-30,0001140361-16-084876
IEUR,ISHARES TR CORE MSCI EURO,46434V738,66048000.0,1596520,1.007277168826443,2016-11-04,2016-09-30,0001140361-16-084876
MBB,ISHARES TR MBS ETF,464288588,65190000.0,592156,0.9941920820584397,2016-11-04,2016-09-30,0001140361-16-084876
RWX,SPDR INDEX SHS FDS DJ INTL RL ETF,78463X863,59972000.0,1437823,0.9146140135789038,2016-11-04,2016-09-30,0001140361-16-084876
SOXX,ISHARES TR PHLX SEMICND ETF,464287523,59799000.0,529244,0.9119756452678729,2016-11-04,2016-09-30,0001140361-16-084876
IWF,ISHARES TR RUS 1000 GRW ETF,464287614,57515000.0,552123,0.8771430832887124,2016-11-04,2016-09-30,0001140361-16-084876
IWR,ISHARES TR RUS MID-CAP ETF,464287499,57452000.0,329578,0.8761822902043483,2016-11-04,2016-09-30,0001140361-16-084876
IEF,ISHARES TR 7-10 Y TR BD ETF,464287440,57155000.0,510857,0.8716528370923473,2016-11-04,2016-09-30,0001140361-16-084876
IGLB,ISHARES 10+ YR CR BD ETF,464289511,56754000.0,897150,0.8655373128569517,2016-11-04,2016-09-30,0001140361-16-084876
VBR,VANGUARD INDEX FDS SM CP VAL ETF,922908611,56579000.0,511282,0.8628684431781632,2016-11-04,2016-09-30,0001140361-16-084876
ICF,ISHARES TR COHEN&STEER REIT,464287564,56379000.0,537455,0.8598183064024049,2016-11-04,2016-09-30,0001140361-16-084876
VXF,VANGUARD INDEX FDS EXTEND MKT ETF,922908652,51200000.0,560976,0.780835014594142,2016-11-04,2016-09-30,0001140361-16-084876
VSS,VANGUARD INTL EQUITY INDEX F FTSE SMCAP ETF,922042718,49841000.0,500778,0.7601093352028638,2016-11-04,2016-09-30,0001140361-16-084876
BND,VANGUARD BD INDEX FD INC TOTAL BND MRKT,921937835,49012000.0,582515,0.7474665182673453,2016-11-04,2016-09-30,0001140361-16-084876
N/A,POWERSHARES ETF TRUST II SENIOR LN PORT,73936Q769,48760000.0,2100812,0.7436233459298899,2016-11-04,2016-09-30,0001140361-16-084876
GXC,SPDR INDEX SHS FDS S&P CHINA ETF,78463X400,48469000.0,606545,0.7391853969211614,2016-11-04,2016-09-30,0001140361-16-084876
GLD,SPDR GOLD TRUST GOLD SHS,78463V107,47593000.0,378808,0.7258257978433398,2016-11-04,2016-09-30,0001140361-16-084876
EMB,ISHARES TR JP MOR EM MK ETF,464288281,46988000.0,400887,0.7165991340966708,2016-11-04,2016-09-30,0001140361-16-084876
EWL,ISHARES MSCI SZ CAP ETF,464286749,46772000.0,1530988,0.7133049863788518,2016-11-04,2016-09-30,0001140361-16-084876
AGG,ISHARES TR CORE US AGGBD ET,464287226,45708000.0,406575,0.6970782587318172,2016-11-04,2016-09-30,0001140361-16-084876
LQD,ISHARES TR IBOXX INV CP ETF,464287242,45468000.0,369122,0.6934180946009071,2016-11-04,2016-09-30,0001140361-16-084876
SLQD,ISHARES TR 0-5YR INVT GR CP,46434V100,43459000.0,854311,0.6627794706884144,2016-11-04,2016-09-30,0001140361-16-084876
SPEM,SPDR INDEX SHS FDS EMERG MKTS ETF,78463X509,40959000.0,676117,0.6246527609914347,2016-11-04,2016-09-30,0001140361-16-084876
VMBS,VANGUARD SCOTTSDALE FDS MORTG-BACK SEC,92206C771,40949000.0,758869,0.6245002541526468,2016-11-04,2016-09-30,0001140361-16-084876
GBF,ISHARES TR GOV/CRED BD ETF,464288596,40309000.0,343783,0.61473981647022,2016-11-04,2016-09-30,0001140361-16-084876
SLV,ISHARES SILVER TRUST ISHARES,46428Q109,39172000.0,2152332,0.5973997889000338,2016-11-04,2016-09-30,0001140361-16-084876
VOE,VANGUARD INDEX FDS MCAP VL IDXVIP,922908512,33734000.0,360524,0.5144665699671637,2016-11-04,2016-09-30,0001140361-16-084876
FLRN,SPDR SER TR INV GRD FLT RT,78468R200,33429000.0,1090325,0.5098151113841323,2016-11-04,2016-09-30,0001140361-16-084876
XLK,SELECT SECTOR SPDR TR TECHNOLOGY,81369Y803,33268000.0,696269,0.5073597512796467,2016-11-04,2016-09-30,0001140361-16-084876
JNJ,JOHNSON & JOHNSON COM,478160104,32676000.0,276610,0.498331346423402,2016-11-04,2016-09-30,0001140361-16-084876
MUB,ISHARES TR NATIONAL MUN ETF,464288414,30732000.0,272570,0.46868401696303064,2016-11-04,2016-09-30,0001140361-16-084876
SPIB,SPDR SERIES TRUST INTR TRM CORP BD,78464A375,29753000.0,852264,0.4537535974456935,2016-11-04,2016-09-30,0001140361-16-084876
DHS,WISDOMTREE TR HIGH DIV FD,97717W208,29747000.0,447453,0.4536620933424207,2016-11-04,2016-09-30,0001140361-16-084876
GOVT,ISHARES TR CORE US TR BD,46429B267,26724000.0,1024703,0.407559275976833,2016-11-04,2016-09-30,0001140361-16-084876
ADP,AUTOMATIC DATA PROCESSING IN COM,053015103,26025000.0,295073,0.39689904794555747,2016-11-04,2016-09-30,0001140361-16-084876
VNQ,VANGUARD INDEX FDS REIT ETF,922908553,25819000.0,297654,0.39375740706652634,2016-11-04,2016-09-30,0001140361-16-084876
DVY,ISHARES TR SELECT DIVID ETF,464287168,25741000.0,300397,0.39256785372398056,2016-11-04,2016-09-30,0001140361-16-084876
USMV,ISHARES TR MIN VOL USA ETF,46429B697,25690000.0,565485,0.3917900688461622,2016-11-04,2016-09-30,0001140361-16-084876
TFI,SPDR SER TR NUVN BRCLY MUNI,78468R721,25183000.0,502865,0.3840579721196148,2016-11-04,2016-09-30,0001140361-16-084876
GWX,SPDR INDEX SHS FDS S&P INTL SMLCP,78463X871,24718000.0,787962,0.37696640411597654,2016-11-04,2016-09-30,0001140361-16-084876
BMY,BRISTOL MYERS SQUIBB CO COM,110122108,24539000.0,455109,0.37423653170167287,2016-11-04,2016-09-30,0001140361-16-084876
IDV,ISHARES TR INTL SEL DIV ETF,464288448,24059000.0,802494,0.36691620343985276,2016-11-04,2016-09-30,0001140361-16-084876
MDY,SPDR S&P MIDCAP 400 ETF TR UTSER1 S&PDCRP,78467Y107,23955000.0,84867,0.3653301323164584,2016-11-04,2016-09-30,0001140361-16-084876
VTIP,VANGUARD MALVERN FDS STRM INFPROIDX,922020805,23489000.0,473088,0.3582233136289414,2016-11-04,2016-09-30,0001140361-16-084876
SJNK,SPDR SER TR SHT TRM HGH YLD,78468R408,23099000.0,834208,0.3522755469162126,2016-11-04,2016-09-30,0001140361-16-084876
VOT,VANGUARD INDEX FDS MCAP GR IDXVIP,922908538,22904000.0,215281,0.34930166355984815,2016-11-04,2016-09-30,0001140361-16-084876
EWC,ISHARES MSCI CDA ETF,464286509,22793000.0,887220,0.3476088376493023,2016-11-04,2016-09-30,0001140361-16-084876
JPM,JPMORGAN CHASE & CO COM,46625H100,21833000.0,327874,0.3329681811256621,2016-11-04,2016-09-30,0001140361-16-084876
MCHP,MICROCHIP TECHNOLOGY INC COM,595017104,21626000.0,348020,0.3298112895627522,2016-11-04,2016-09-30,0001140361-16-084876
N/A,VANECK VECTORS ETF TR JP MORGAN MKTS,92189F494,19650000.0,1029891,0.29967593821825955,2016-11-04,2016-09-30,0001140361-16-084876
VCSH,VANGUARD SCOTTSDALE FDS SHRT TRM CORP BD,92206C409,19472000.0,241735,0.2969613164878346,2016-11-04,2016-09-30,0001140361-16-084876
TIP,ISHARES TR TIPS BD ETF,464287176,19326000.0,165907,0.294734716641531,2016-11-04,2016-09-30,0001140361-16-084876
IGSB,ISHARES TR 1-3 YR CR BD ETF,464288646,18960000.0,179275,0.2891529663418932,2016-11-04,2016-09-30,0001140361-16-084876
SDY,SPDR SERIES TRUST S&P DIVID ETF,78464A763,18167000.0,215355,0.27705917402601127,2016-11-04,2016-09-30,0001140361-16-084876
NTTYY,NIPPON TELEG & TEL CORP SPONSORED ADR,654624105,18165000.0,396523,0.27702867265825365,2016-11-04,2016-09-30,0001140361-16-084876
SNPUSD,CHINA PETE & CHEM CORP SPON ADR H SHS,16941R108,18093000.0,245002,0.27593062341898067,2016-11-04,2016-09-30,0001140361-16-084876
XLI,SELECT SECTOR SPDR TR SBI INT-INDS,81369Y704,17957000.0,307592,0.27385653041146496,2016-11-04,2016-09-30,0001140361-16-084876
XLP,SELECT SECTOR SPDR TR SBI CONS STPLS,81369Y308,17755000.0,333686,0.270775892267949,2016-11-04,2016-09-30,0001140361-16-084876
VWO,VANGUARD INTL EQUITY INDEX F FTSE EMR MKT ETF,922042858,17537000.0,466525,0.2674512431823724,2016-11-04,2016-09-30,0001140361-16-084876
HYS,PIMCO ETF TR 0-5 HIGH YIELD,72201R783,17512000.0,175996,0.2670699760854026,2016-11-04,2016-09-30,0001140361-16-084876
MCD,MCDONALDS CORP COM,580135101,17471000.0,151455,0.26644469804637216,2016-11-04,2016-09-30,0001140361-16-084876
MSFT,MICROSOFT CORP COM,594918104,17194000.0,298511,0.2622202586119468,2016-11-04,2016-09-30,0001140361-16-084876
BRK/B,BERKSHIRE HATHAWAY INC DEL CL B NEW,084670702,17129000.0,118567,0.2612289641598253,2016-11-04,2016-09-30,0001140361-16-084876
SHM,SPDR SER TR NUVN BR SHT MUNI,78468R739,16990000.0,347794,0.2591091191006733,2016-11-04,2016-09-30,0001140361-16-084876
FIBK,FIRST INTST BANCSYSTEM INC COM CL A,32055Y201,16843000.0,534525,0.25686726857049086,2016-11-04,2016-09-30,0001140361-16-084876
EIX,EDISON INTL COM,281020107,16378000.0,226680,0.24977570056685267,2016-11-04,2016-09-30,0001140361-16-084876
DWX,SPDR INDEX SHS FDS S&P INTL ETF,78463X772,15897000.0,432088,0.2424401216211538,2016-11-04,2016-09-30,0001140361-16-084876
CVX,CHEVRON CORP NEW COM,166764100,15689000.0,152441,0.23926797937436511,2016-11-04,2016-09-30,0001140361-16-084876
SYY,SYSCO CORP COM,871829107,15635000.0,319018,0.23844444244491034,2016-11-04,2016-09-30,0001140361-16-084876
XOM,EXXON MOBIL CORP COM,30231G102,15401000.0,176459,0.23487578241727305,2016-11-04,2016-09-30,0001140361-16-084876
USIG,ISHARES TR CORE US CR BD,464288620,15011000.0,131899,0.22892801570454424,2016-11-04,2016-09-30,0001140361-16-084876
BAC,VERIZON COMMUNICATIONS INC COM,92343V104,14990000.0,288381,0.22860775134308958,2016-11-04,2016-09-30,0001140361-16-084876
SPSM,SPDR SER TR SPDR RUSSEL 2000,78468R853,14954000.0,202405,0.22805872672345312,2016-11-04,2016-09-30,0001140361-16-084876
SPYG,SPDR SERIES TRUST S&P 500 GROWTH,78464A409,14579000.0,138543,0.22233972026890614,2016-11-04,2016-09-30,0001140361-16-084876
ITW,ILLINOIS TOOL WKS INC COM,452308109,14154000.0,118106,0.21585817962041964,2016-11-04,2016-09-30,0001140361-16-084876
OMC,OMNICOM GROUP INC COM,681919106,14061000.0,165422,0.21443986601969198,2016-11-04,2016-09-30,0001140361-16-084876
PGR,PROGRESSIVE CORP OHIO COM,743315103,13876000.0,440497,0.2116184895021155,2016-11-04,2016-09-30,0001140361-16-084876
VTI,VANGUARD INDEX FDS TOTAL STK MKT,922908769,13779000.0,123764,0.2101391731658727,2016-11-04,2016-09-30,0001140361-16-084876
VNQI,VANGUARD INTL EQUITY INDEX F GLB EX US ETF,922042676,13393000.0,238431,0.20425240918865903,2016-11-04,2016-09-30,0001140361-16-084876
SLYG,SPDR SERIES TRUST S&P 600 SMCP GRW,78464A201,13339000.0,69789,0.2034288722592043,2016-11-04,2016-09-30,0001140361-16-084876
UNH,UNITEDHEALTH GROUP INC COM,91324P102,13107000.0,93619,0.19989071359932456,2016-11-04,2016-09-30,0001140361-16-084876
SPIP,SPDR SERIES TRUST BARCLYS TIPS ETF,78464A656,13036000.0,224178,0.19880791504393036,2016-11-04,2016-09-30,0001140361-16-084876
CTLEUR,CENTURYLINK INC COM,156700106,12748000.0,464759,0.19441571808683833,2016-11-04,2016-09-30,0001140361-16-084876
MMC,MARSH & MCLENNAN COS INC COM,571748102,12571000.0,186929,0.19171634704029217,2016-11-04,2016-09-30,0001140361-16-084876
N/A,NATIONAL GRID PLC SPON ADR NEW,636274300,12504000.0,175838,0.1906945512204131,2016-11-04,2016-09-30,0001140361-16-084876
OXY,OCCIDENTAL PETE CORP DEL COM,674599105,12473000.0,171044,0.19022178002017057,2016-11-04,2016-09-30,0001140361-16-084876
AAPL,APPLE INC COM,037833100,12363000.0,109361,0.18854420479350345,2016-11-04,2016-09-30,0001140361-16-084876
JWN*,NORDSTROM INC COM,655664100,12224000.0,235621,0.1864243597343514,2016-11-04,2016-09-30,0001140361-16-084876
IEI,ISHARES TR 3-7 YR TR BD ETF,464288661,11600000.0,91667,0.17690793299398527,2016-11-04,2016-09-30,0001140361-16-084876
N/A,POWERSHARES ETF TR II INSUR NATL MUN,73936T474,11453000.0,439829,0.17466608246380289,2016-11-04,2016-09-30,0001140361-16-084876
DES,WISDOMTREE TR SMALLCAP DIVID,97717W604,11216000.0,149125,0.17105167038452923,2016-11-04,2016-09-30,0001140361-16-084876
SPTL,SPDR SERIES TRUST BRCLYS LG TRS ET,78464A664,10888000.0,137714,0.1660494460722855,2016-11-04,2016-09-30,0001140361-16-084876
PXF,POWERSHARES ETF TR II DEV MKTS EX-US,73936T789,10428000.0,283757,0.15903413148804124,2016-11-04,2016-09-30,0001140361-16-084876
TM,TOYOTA MOTOR CORP SP ADR REP2COM,892331307,10375000.0,89394,0.1582258452424653,2016-11-04,2016-09-30,0001140361-16-084876
AMGN,AMGEN INC COM,031162100,10160000.0,60902,0.15494694820852503,2016-11-04,2016-09-30,0001140361-16-084876
PM,PHILIP MORRIS INTL INC COM,718172109,10127000.0,104165,0.1544436756405249,2016-11-04,2016-09-30,0001140361-16-084876
VCLT,VANGUARD SCOTTSDALE FDS LG-TERM COR BD,92206C813,10000000.0,104497,0.15250683878791835,2016-11-04,2016-09-30,0001140361-16-084876
DEM,WISDOMTREE TR EMER MKT HIGH FD,97717W315,9699000.0,258157,0.147916382940402,2016-11-04,2016-09-30,0001140361-16-084876
SPG,SIMON PPTY GROUP INC NEW COM,828806109,9314000.0,44993,0.14204486964706714,2016-11-04,2016-09-30,0001140361-16-084876
SPMB,SPDR SERIES TRUST BRC MTG BCKD BD,78464A383,8703000.0,320260,0.13272670179712534,2016-11-04,2016-09-30,0001140361-16-084876
GM,GENERAL MTRS CO COM,37045V100,8094000.0,254757,0.12343903531494112,2016-11-04,2016-09-30,0001140361-16-084876
SPSB,SPDR SERIES TRUST BARC SHT TR CP,78464A474,7986000.0,259544,0.12179196145603159,2016-11-04,2016-09-30,0001140361-16-084876
PG,PROCTER AND GAMBLE CO COM,742718109,7934000.0,88398,0.12099892589433443,2016-11-04,2016-09-30,0001140361-16-084876
ACWI,ISHARES TR MSCI ACWI ETF,464288257,7801000.0,131990,0.11897058493845511,2016-11-04,2016-09-30,0001140361-16-084876
N/A,DOW CHEM CO COM,260543103,7709000.0,148749,0.11756752202160625,2016-11-04,2016-09-30,0001140361-16-084876
VCIT,VANGUARD SCOTTSDALE FDS INT-TERM CORP,92206C870,7622000.0,85086,0.11624071252415136,2016-11-04,2016-09-30,0001140361-16-084876
ESS,ESSEX PPTY TR INC COM,297178105,7531000.0,33817,0.11485290029118131,2016-11-04,2016-09-30,0001140361-16-084876
UAL,UNITED CONTL HLDGS INC COM,910047109,7165000.0,136546,0.10927114999154348,2016-11-04,2016-09-30,0001140361-16-084876
BHP,BHP BILLITON LTD SPONSORED ADR,088606108,7148000.0,206282,0.10901188836560405,2016-11-04,2016-09-30,0001140361-16-084876
N/A,GLAXOSMITHKLINE PLC SPONSORED ADR,37733W105,6984000.0,161925,0.10651077620948217,2016-11-04,2016-09-30,0001140361-16-084876
N/A,LEVEL 3 COMMUNICATIONS INC COM NEW,52729N308,6977000.0,150426,0.10640402142233063,2016-11-04,2016-09-30,0001140361-16-084876
TLK,P T TELEKOMUNIKASI INDONESIA SPONSORED ADR,715684106,6911000.0,104592,0.10539747628633037,2016-11-04,2016-09-30,0001140361-16-084876
DOCUSD,PHYSICIANS RLTY TR COM,71943U104,6895000.0,320093,0.10515346534426971,2016-11-04,2016-09-30,0001140361-16-084876
META,FACEBOOK INC CL A,30303M102,6823000.0,53193,0.10405541610499669,2016-11-04,2016-09-30,0001140361-16-084876
IVE,ISHARES TR S&P 500 VAL ETF,464287408,6701000.0,70565,0.10219483267178409,2016-11-04,2016-09-30,0001140361-16-084876
ROICUSD,RETAIL OPPORTUNITY INVTS COR COM,76131N101,6681000.0,304237,0.10188981899420825,2016-11-04,2016-09-30,0001140361-16-084876
SHO,SUNSTONE HOTEL INVS INC NEW COM,867892101,6620000.0,517569,0.10095952727760195,2016-11-04,2016-09-30,0001140361-16-084876
N/A,EDUCATION RLTY TR INC COM NEW,28140H203,6605000.0,153106,0.10073076701942008,2016-11-04,2016-09-30,0001140361-16-084876
ELS,EQUITY LIFESTYLE PPTYS INC COM,29472R108,6582000.0,85283,0.10038000129020785,2016-11-04,2016-09-30,0001140361-16-084876
ESRT,EMPIRE ST RLTY TR INC CL A,292104106,6563000.0,313265,0.10009023829651081,2016-11-04,2016-09-30,0001140361-16-084876
AMT,AMERICAN TOWER CORP NEW COM,03027X100,6554000.0,57830,0.09995298214160168,2016-11-04,2016-09-30,0001140361-16-084876
SNY,SANOFI SPONSORED ADR,80105N105,6284000.0,164543,0.09583529749432788,2016-11-04,2016-09-30,0001140361-16-084876
SHYG,ISHARES TR 0-5YR HI YL CP,46434V407,6247000.0,132120,0.0952710221908126,2016-11-04,2016-09-30,0001140361-16-084876
NVS,NOVARTIS A G SPONSORED ADR,66987V109,6213000.0,78691,0.09475249893893367,2016-11-04,2016-09-30,0001140361-16-084876
EWA,ISHARES MSCI AUST ETF,464286103,6027000.0,288382,0.0919158717374784,2016-11-04,2016-09-30,0001140361-16-084876
REXR,REXFORD INDL RLTY INC COM,76169C100,6008000.0,262493,0.09162610874378134,2016-11-04,2016-09-30,0001140361-16-084876
N/A,UBS AG JERSEY BRH ALERIAN INFRST,902641646,5968000.0,210226,0.09101608138862967,2016-11-04,2016-09-30,0001140361-16-084876
PSA,PUBLIC STORAGE COM,74460D109,5774000.0,25875,0.08805744871614404,2016-11-04,2016-09-30,0001140361-16-084876
BXP,BOSTON PROPERTIES INC COM,101121101,5728000.0,42029,0.08735591725771963,2016-11-04,2016-09-30,0001140361-16-084876
N/A,ANALOGIC CORP COM PAR $0.05,032657207,5666000.0,63946,0.08641037485723453,2016-11-04,2016-09-30,0001140361-16-084876
FNDX,SCHWAB STRATEGIC TR SCHWAB FDT US LG,808524771,5557000.0,178622,0.08474805031444622,2016-11-04,2016-09-30,0001140361-16-084876
IGF,ISHARES TR GLB INFRASTR ETF,464288372,5542000.0,133350,0.08451929005626435,2016-11-04,2016-09-30,0001140361-16-084876
COHREUR,COHERENT INC COM,192479103,5412000.0,48964,0.08253670115202141,2016-11-04,2016-09-30,0001140361-16-084876
TLH,ISHARES TR 10-20 YR TRS ETF,464288653,5412000.0,37371,0.08253670115202141,2016-11-04,2016-09-30,0001140361-16-084876
VGIT,VANGUARD SCOTTSDALE FDS INT-TERM GOV,92206C706,5309000.0,79495,0.08096588071250585,2016-11-04,2016-09-30,0001140361-16-084876
IWD,ISHARES TR RUS 1000 VAL ETF,464287598,5290000.0,50087,0.0806761177188088,2016-11-04,2016-09-30,0001140361-16-084876
AMH,AMERICAN HOMES 4 RENT CL A,02665T306,5285000.0,244218,0.08059986429941485,2016-11-04,2016-09-30,0001140361-16-084876
LQDH,ISHARES U S ETF TR INT RT HDG C B,46431W705,5175000.0,56105,0.07892228907274774,2016-11-04,2016-09-30,0001140361-16-084876
AVB,AVALONBAY CMNTYS INC COM,053484101,5108000.0,28724,0.07790049325286869,2016-11-04,2016-09-30,0001140361-16-084876
XLU,SELECT SECTOR SPDR TR SBI INT-UTILS,81369Y886,4988000.0,101824,0.07607041118741367,2016-11-04,2016-09-30,0001140361-16-084876
ELD,WISDOMTREE TR EM LCL DEBT FD,97717X867,4949000.0,129971,0.0754756345161408,2016-11-04,2016-09-30,0001140361-16-084876
PC6A,PETROCHINA CO LTD SPONSORED ADR,71646E100,4670000.0,69907,0.07122069371395787,2016-11-04,2016-09-30,0001140361-16-084876
MO,ALTRIA GROUP INC COM,02209S103,4555000.0,72045,0.0694668650678968,2016-11-04,2016-09-30,0001140361-16-084876
XLE,SELECT SECTOR SPDR TR SBI INT-ENERGY,81369Y506,4434000.0,62793,0.067621532318563,2016-11-04,2016-09-30,0001140361-16-084876
ETJ,EATON VANCE RISK MNGD DIV EQ COM,27829G106,4373000.0,463716,0.06669124060195669,2016-11-04,2016-09-30,0001140361-16-084876
N/A,NUVEEN ENERGY MLP TOTL RTRNF COM,67074U103,4357000.0,332043,0.06644722965989602,2016-11-04,2016-09-30,0001140361-16-084876
NVO,NOVO-NORDISK A S ADR,670100205,4271000.0,102694,0.06513567084631994,2016-11-04,2016-09-30,0001140361-16-084876
KYN,KAYNE ANDERSON MLP INVT CO COM,486606106,4226000.0,204882,0.06444939007177429,2016-11-04,2016-09-30,0001140361-16-084876
SPTI,SPDR SERIES TRUST BRCLYS INTER ETF,78464A672,4225000.0,68884,0.06443413938789551,2016-11-04,2016-09-30,0001140361-16-084876
IWN,ISHARES TR RUS 2000 VAL ETF,464287630,4020000.0,38376,0.06130774919274318,2016-11-04,2016-09-30,0001140361-16-084876
IWO,ISHARES TR RUS 2000 GRW ETF,464287648,3775000.0,25351,0.057571331642439175,2016-11-04,2016-09-30,0001140361-16-084876
IOSP,INNOSPEC INC COM,45768S105,3726000.0,61278,0.05682404813237838,2016-11-04,2016-09-30,0001140361-16-084876
DVYE,ISHARES EM MKTS DIV ETF,464286319,3669000.0,102184,0.05595475915128724,2016-11-04,2016-09-30,0001140361-16-084876
VOD,VODAFONE GROUP PLC NEW SPNSR ADR,92857W308,3601000.0,123548,0.0549177126475294,2016-11-04,2016-09-30,0001140361-16-084876
XLV,SELECT SECTOR SPDR TR SBI HEALTHCARE,81369Y209,3421000.0,47436,0.052172589549346865,2016-11-04,2016-09-30,0001140361-16-084876
XLB,SELECT SECTOR SPDR TR SBI MATERIALS,81369Y100,3392000.0,71035,0.0517303197168619,2016-11-04,2016-09-30,0001140361-16-084876
VRSK,VERISK ANALYTICS INC COM,92345Y106,3333000.0,41007,0.05083052936801319,2016-11-04,2016-09-30,0001140361-16-084876
VB,VANGUARD INDEX FDS SMALL CP ETF,922908751,3268000.0,26966,0.04983923491589171,2016-11-04,2016-09-30,0001140361-16-084876
AZN,ASTRAZENECA PLC SPONSORED ADR,046353108,3231000.0,98315,0.04927495961237642,2016-11-04,2016-09-30,0001140361-16-084876
N/A,RANDGOLD RES LTD ADR,752344309,3217000.0,32150,0.04906145003807333,2016-11-04,2016-09-30,0001140361-16-084876
STT,STATE STR CORP COM,857477103,3112000.0,44693,0.04746012823080019,2016-11-04,2016-09-30,0001140361-16-084876
N/A,COLONY STARWOOD HOMES COM,19625X102,3087000.0,107573,0.0470788611338304,2016-11-04,2016-09-30,0001140361-16-084876
VO,VANGUARD INDEX FDS MID CAP ETF,922908629,3063000.0,23855,0.046712844720739395,2016-11-04,2016-09-30,0001140361-16-084876
UPS,UNITED PARCEL SERVICE INC CL B,911312106,3018000.0,27594,0.046026563946193755,2016-11-04,2016-09-30,0001140361-16-084876
CMD,CANTEL MEDICAL CORP COM,138098108,3000000.0,38466,0.0457520516363755,2016-11-04,2016-09-30,0001140361-16-084876
TLTE,FLEXSHARES TR MSTAR EMKT FAC,33939L308,2986000.0,62011,0.04553854206207242,2016-11-04,2016-09-30,0001140361-16-084876
XLF,SELECT SECTOR SPDR TR SBI INT-FINL,81369Y605,2976000.0,154220,0.0453860352232845,2016-11-04,2016-09-30,0001140361-16-084876
AGZ,ISHARES TR AGENCY BOND ETF,464288166,2948000.0,25501,0.04495901607467833,2016-11-04,2016-09-30,0001140361-16-084876
XLY,SELECT SECTOR SPDR TR SBI CONS DISCR,81369Y407,2947000.0,36817,0.044943765390799535,2016-11-04,2016-09-30,0001140361-16-084876
MTUM,ISHARES TR USA MOMENTUM FCT,46432F396,2930000.0,37872,0.04468450376486007,2016-11-04,2016-09-30,0001140361-16-084876
R6C2,ROYAL DUTCH SHELL PLC SPON ADR B,780259107,2928000.0,55427,0.044654002397102495,2016-11-04,2016-09-30,0001140361-16-084876
N/A,SPDR SERIES TRUST BRCLYS 1-3MT ETF,78464A680,2928000.0,64033,0.044654002397102495,2016-11-04,2016-09-30,0001140361-16-084876
ITGR,INTEGER HLDGS CORP COM ADDED,45826H109,2820000.0,130001,0.04300692853819297,2016-11-04,2016-09-30,0001140361-16-084876
TTE,TOTAL S A SPONSORED ADR,89151E109,2717000.0,56969,0.04143610809867742,2016-11-04,2016-09-30,0001140361-16-084876
WMB,WILLIAMS COS INC DEL COM,969457100,2701000.0,87890,0.041192097156616744,2016-11-04,2016-09-30,0001140361-16-084876
N/A,RYDEX ETF TRUST GUG S&P500 EQ WT,78355W106,2659000.0,31807,0.04055156843370749,2016-11-04,2016-09-30,0001140361-16-084876
AES,AES CORP COM,00130H105,2544000.0,197990,0.038797739787646425,2016-11-04,2016-09-30,0001140361-16-084876
BP,BP PLC SPONSORED ADR,055622104,2368000.0,67353,0.036113619424979065,2016-11-04,2016-09-30,0001140361-16-084876
SPLB,SPDR SERIES TRUST LNG TRM CORP BD,78464A367,2332000.0,54369,0.035564594805342555,2016-11-04,2016-09-30,0001140361-16-084876
WMT,WAL-MART STORES INC COM,931142103,2250000.0,31201,0.03431403872728163,2016-11-04,2016-09-30,0001140361-16-084876
T,AT&T INC COM,00206R102,2170000.0,53446,0.03309398401697828,2016-11-04,2016-09-30,0001140361-16-084876
